,date,title,url
708,2015-04-29,襄阳轴承：2015年第一季度报告正文,finalpage/2015-04-29/1200931742.PDF
709,2015-04-29,襄阳轴承：2015年第一季度报告全文,finalpage/2015-04-29/1200931744.PDF
710,2015-05-08,襄阳轴承：长江证券承销保荐有限公司关于公司重大资产重组之2014年度持续督导报告,finalpage/2015-05-08/1200979078.PDF
711,2015-05-12,襄阳轴承：关于公司非公开发行股票之保荐总结报告书,finalpage/2015-05-12/1200998766.PDF
712,2015-05-12,襄阳轴承：申万宏源证券承销保荐有限责任公司关于公司持续督导期间2014年度保荐工作报告,finalpage/2015-05-12/1200998767.PDF
713,2015-05-13,襄阳轴承：关于召开2014年年度股东大会的提示性公告,finalpage/2015-05-13/1201006740.PDF
714,2015-05-16,襄阳轴承：2014年年度股东大会决议公告,finalpage/2015-05-16/1201020555.PDF
715,2015-05-16,襄阳轴承：2014年年度股东大会法律意见,finalpage/2015-05-16/1201020556.PDF
716,2015-05-30,襄阳轴承：关于控股股东名称变更的公告,finalpage/2015-05-30/1201082102.PDF
717,2015-05-30,襄阳轴承：五届董事会第二十八次会议决议公告,finalpage/2015-05-30/1201082889.PDF
718,2015-05-30,襄阳轴承：关联交易补充披露公告,finalpage/2015-05-30/1201082890.PDF
719,2015-05-30,襄阳轴承：独立董事意见,finalpage/2015-05-30/1201082891.PDF
720,2015-06-06,襄阳轴承：补充更正公告,finalpage/2015-06-06/1201110892.PDF
721,2015-06-24,襄阳轴承：关于收到《中国证监会行政许可申请受理通知书》的公告,finalpage/2015-06-24/1201186084.PDF
722,2015-07-03,襄阳轴承：关于涉及诉讼事项的公告,finalpage/2015-07-03/1201231086.PDF
723,2015-07-09,襄阳轴承：关于控股股东计划增持公司股份的公告,finalpage/2015-07-09/1201261540.PDF
724,2015-07-13,襄阳轴承：五届监事会第十九次会议决议公告,finalpage/2015-07-13/1201282243.PDF
725,2015-07-13,襄阳轴承：五届董事会第二十九次会议决议公告,finalpage/2015-07-13/1201282244.PDF
726,2015-07-13,襄阳轴承：关于召开2015年第二次临时股东大会的通知,finalpage/2015-07-13/1201282245.PDF
727,2015-07-13,襄阳轴承：独立董事候选人声明,finalpage/2015-07-13/1201282246.PDF
728,2015-07-13,襄阳轴承：独立董事关于公司董事会换届选举的独立意见,finalpage/2015-07-13/1201282247.PDF
729,2015-07-13,襄阳轴承：独立董事提名人声明,finalpage/2015-07-13/1201282248.PDF
730,2015-07-15,襄阳轴承：2015年半年度业绩预告公告,finalpage/2015-07-15/1201293801.PDF
731,2015-07-15,襄阳轴承：股票交易异常波动公告,finalpage/2015-07-15/1201293802.PDF
732,2015-07-31,襄阳轴承：关于召开2015年第二次临时股东大会的提示性公告,finalpage/2015-07-31/1201368519.PDF
733,2015-08-06,襄阳轴承：2015年第二次临时股东大会决议公告,finalpage/2015-08-06/1201399094.PDF
734,2015-08-06,襄阳轴承：第六届监事会第一次会议决议公告,finalpage/2015-08-06/1201399095.PDF
735,2015-08-06,襄阳轴承：第六届董事会第一次会议决议公告,finalpage/2015-08-06/1201399096.PDF
736,2015-08-06,襄阳轴承：2015年第二次临时股东大会法律意见,finalpage/2015-08-06/1201399097.PDF
737,2015-08-06,襄阳轴承：独立董事关于公司聘任高级管理人员的独立意见,finalpage/2015-08-06/1201399098.PDF
738,2015-08-06,襄阳轴承：关于第六届监事会职工代表监事选举结果的公告,finalpage/2015-08-06/1201399099.PDF
739,2015-08-11,襄阳轴承：关于获得政府补贴的公告,finalpage/2015-08-11/1201416940.PDF
740,2015-08-25,襄阳轴承：2015年半年度报告摘要,finalpage/2015-08-25/1201482759.PDF
741,2015-08-25,襄阳轴承：2015年半年度财务报告,finalpage/2015-08-25/1201482761.PDF
742,2015-08-25,襄阳轴承：第六届董事会第二次会议决议公告,finalpage/2015-08-25/1201482762.PDF
743,2015-08-25,襄阳轴承：第六届监事会第二次会议决议公告,finalpage/2015-08-25/1201482763.PDF
744,2015-08-25,襄阳轴承：2015年半年度报告,finalpage/2015-08-25/1201482764.PDF
745,2015-08-25,襄阳轴承：关于召开2015年第三次临时股东大会的提示性公告,finalpage/2015-08-25/1201482765.PDF
746,2015-08-25,襄阳轴承：前次募集资金使用情况报告,finalpage/2015-08-25/1201482766.PDF
747,2015-08-25,襄阳轴承：前次募集资金使用情况鉴证报告,finalpage/2015-08-25/1201482767.PDF
748,2015-08-25,襄阳轴承：独立董事对公司关联方资金占用和对外担保情况的专项说明和独立意见,finalpage/2015-08-25/1201482768.PDF
749,2015-09-01,襄阳轴承：关于收到《中国证监会行政许可项目审查反馈意见通知书》的公告,finalpage/2015-09-01/1201530855.PDF
750,2015-09-07,襄阳轴承：关于召开2015年第三次临时股东大会的提示性公告,finalpage/2015-09-07/1201542450.PDF
751,2015-09-10,襄阳轴承：2015年第三次临时股东大会决议公告,finalpage/2015-09-10/1201572593.PDF
752,2015-09-10,襄阳轴承：2015年第三次临时股东大会法律意见,finalpage/2015-09-10/1201572594.PDF
753,2015-09-23,襄阳轴承：关于非公开发行股票申请文件反馈意见回复的公告,finalpage/2015-09-23/1201625438.PDF
754,2015-09-23,襄阳轴承：承诺函（二）,finalpage/2015-09-23/1201625439.PDF
755,2015-09-23,襄阳轴承：承诺函（三）,finalpage/2015-09-23/1201625440.PDF
756,2015-09-23,襄阳轴承：承诺函（四）,finalpage/2015-09-23/1201625441.PDF
757,2015-09-23,襄阳轴承：承诺函（五）,finalpage/2015-09-23/1201625442.PDF
758,2015-09-23,襄阳轴承：承诺函（六）,finalpage/2015-09-23/1201625443.PDF
759,2015-09-23,襄阳轴承：公司和广州证券股份有限公司关于公司非公开发行股票申请文件反馈意见之回复,finalpage/2015-09-23/1201625444.PDF
760,2015-09-23,襄阳轴承：关于非公开发行A股股票摊薄即期回报对公司主要财务指标的影响及公司拟采取措施的公告,finalpage/2015-09-23/1201625445.PDF
761,2015-09-23,襄阳轴承：关于关联交易未回避表决公告,finalpage/2015-09-23/1201625446.PDF
762,2015-09-23,襄阳轴承：关于最近五年被证券监管部门和交易所采取监管措施或处罚以及整改情况的公告,finalpage/2015-09-23/1201625447.PDF
763,2015-09-23,襄阳轴承：上银基金财富28号资产管理计划资产管理合同之补充协议,finalpage/2015-09-23/1201625448.PDF
764,2015-09-23,襄阳轴承：上银基金财富29号资产管理计划资产管理合同之补充协议,finalpage/2015-09-23/1201625449.PDF
765,2015-09-23,襄阳轴承：上银基金财富30号资产管理计划资产管理合同之补充协议,finalpage/2015-09-23/1201625450.PDF
766,2015-09-23,襄阳轴承：承诺函（一）,finalpage/2015-09-23/1201625451.PDF
767,2015-10-15,襄阳轴承：2015年前三季度业绩预告公告,finalpage/2015-10-15/1201694132.PDF
768,2015-10-31,襄阳轴承：2015年第三季度报告正文,finalpage/2015-10-31/1201743140.PDF
769,2015-10-31,襄阳轴承：2015年第三季度报告全文,finalpage/2015-10-31/1201743142.PDF
770,2015-11-06,襄阳轴承：关于非公开发行股票申请文件补充反馈意见回复的公告,finalpage/2015-11-06/1201755699.PDF
771,2015-11-06,襄阳轴承：公司和广州证券股份有限公司关于公司非公开发行股票申请文件补充反馈意见,finalpage/2015-11-06/1201755700.PDF
772,2015-11-27,襄阳轴承：第六届董事会第四次会议决议公告,finalpage/2015-11-27/1201789880.PDF
773,2015-11-27,襄阳轴承：独立董事关于调整员工持股计划人数的独立意见,finalpage/2015-11-27/1201789881.PDF
774,2015-11-27,襄阳轴承：非关联监事关于员工持股计划持有人名单（调整后）的核查意见,finalpage/2015-11-27/1201789882.PDF
775,2015-11-27,襄阳轴承：关于非公开发行股票认购对象穿透后涉及认购主体数量等相关情况说明公告,finalpage/2015-11-27/1201789883.PDF
776,2015-12-17,襄阳轴承：关于非公开发行股票申请获得发审委审核通过的公告,finalpage/2015-12-17/1201841286.PDF
777,2015-12-22,襄阳轴承：关于获得政府补贴的公告,finalpage/2015-12-22/1201849436.PDF
778,2015-12-30,襄阳轴承：关于获得政府补贴的公告,finalpage/2015-12-30/1201873208.PDF
779,2016-01-04,襄阳轴承：股票交易异常波动公告,finalpage/2016-01-04/1201883702.PDF
780,2016-01-14,襄阳轴承：股票交易异常波动公告,finalpage/2016-01-14/1201910414.PDF
781,2016-01-23,襄阳轴承：关于非公开发行股票申请获得中国证券监督管理委员会核准的公告,finalpage/2016-01-23/1201934896.PDF
782,2016-01-30,襄阳轴承：2015年度业绩预告,finalpage/2016-01-30/1201954249.PDF
783,2016-02-05,襄阳轴承：关于限售股份解除限售的提示性公告,finalpage/2016-02-05/1201972113.PDF
784,2016-02-05,襄阳轴承：申万宏源证券承销保荐有限责任公司关于公司非公开发行股票限售股份上市流通的核查意见,finalpage/2016-02-05/1201972114.PDF
785,2016-04-07,襄阳轴承：关于非公开发行股票会后事项告知函回复的公告,finalpage/2016-04-07/1202144210.PDF
786,2016-04-07,襄阳轴承：公司与广州证券股份有限公司关于非公开发行股票会后事项的告知函的回复,finalpage/2016-04-07/1202144211.PDF
787,2016-04-13,襄阳轴承：第六届监事会第四次会议决议,finalpage/2016-04-13/1202169012.PDF
788,2016-04-13,襄阳轴承：关于延长公司非公开发行股票有效期的公告,finalpage/2016-04-13/1202169013.PDF
789,2016-04-13,襄阳轴承：独立董事关于延长非公开发行股票股东大会决议有效期的独立意见,finalpage/2016-04-13/1202169014.PDF
790,2016-04-13,襄阳轴承：第六届董事会第五次会议决议公告,finalpage/2016-04-13/1202169015.PDF
791,2016-04-13,襄阳轴承：关于召开2016年第一次临时股东大会的通知,finalpage/2016-04-13/1202169016.PDF
792,2016-04-15,襄阳轴承：2015年度业绩快报,finalpage/2016-04-15/1202179043.PDF
793,2016-04-15,襄阳轴承：2016年第一季度业绩预告,finalpage/2016-04-15/1202179044.PDF
794,2016-04-26,襄阳轴承：关于召开2016年第一次临时股东大会的提示性公告,finalpage/2016-04-26/1202237908.PDF
795,2016-04-27,襄阳轴承：2015年年度报告摘要,finalpage/2016-04-27/1202248685.PDF
796,2016-04-27,襄阳轴承：2015年年度审计报告,finalpage/2016-04-27/1202248687.PDF
797,2016-04-27,襄阳轴承：第六届董事会第六次会议决议公告,finalpage/2016-04-27/1202248688.PDF
798,2016-04-27,襄阳轴承：关于召开2015年年度股东大会的通知,finalpage/2016-04-27/1202248689.PDF
799,2016-04-27,襄阳轴承：第六届监事会第五次会议决议公告,finalpage/2016-04-27/1202248690.PDF
800,2016-04-27,襄阳轴承：2015年年度报告,finalpage/2016-04-27/1202248691.PDF
801,2016-04-27,襄阳轴承：2015年度控股股东及其他关联方资金占用情况的专项说明,finalpage/2016-04-27/1202248692.PDF
802,2016-04-27,襄阳轴承：2015年度内部控制评价报告,finalpage/2016-04-27/1202248693.PDF
803,2016-04-27,襄阳轴承：独立董事的专项说明及独立意见,finalpage/2016-04-27/1202248694.PDF
804,2016-04-27,襄阳轴承：2015年度独立董事述职报告,finalpage/2016-04-27/1202248695.PDF
805,2016-04-27,襄阳轴承：关于2016年日常关联交易预计情况的公告,finalpage/2016-04-27/1202248696.PDF
806,2016-04-27,襄阳轴承：关于应收账款核销的公告,finalpage/2016-04-27/1202248697.PDF
807,2016-04-27,襄阳轴承：关于核销公司长期股权投资的公告,finalpage/2016-04-27/1202248698.PDF
808,2016-04-27,襄阳轴承：关于重大资产购买项目2015年度盈利预测完成情况的说明,finalpage/2016-04-27/1202248699.PDF
809,2016-04-27,襄阳轴承：内部控制审计报告,finalpage/2016-04-27/1202248700.PDF
810,2016-04-27,襄阳轴承：重大资产购买项目2015年度盈利预测完成情况专项审核报告,finalpage/2016-04-27/1202248701.PDF
811,2016-04-27,襄阳轴承：长江证券承销保荐有限公司关于公司重大资产重组2015年度盈利预测完成情况的核查意见,finalpage/2016-04-27/1202248702.PDF
812,2016-04-29,襄阳轴承：2016年第一季度报告正文,finalpage/2016-04-29/1202263897.PDF
813,2016-04-29,襄阳轴承：2016年第一季度报告全文,finalpage/2016-04-29/1202263899.PDF
814,2016-04-29,襄阳轴承：2016年第一次临时股东大会法律意见,finalpage/2016-04-29/1202264001.PDF
815,2016-04-29,襄阳轴承：2016年第一次临时股东大会决议公告,finalpage/2016-04-29/1202264002.PDF
816,2016-05-12,襄阳轴承：关于召开2015年年度股东大会的提示性公告,finalpage/2016-05-12/1202316519.PDF
817,2016-05-18,襄阳轴承：2015年年度股东大会决议公告,finalpage/2016-05-18/1202326074.PDF
818,2016-05-18,襄阳轴承：2015年年度股东大会法律意见,finalpage/2016-05-18/1202326075.PDF
819,2016-07-15,襄阳轴承：2016年半年度业绩预告公告,finalpage/2016-07-15/1202473757.PDF
820,2016-07-22,襄阳轴承：非公开发行股票发行情况报告暨上市公告书摘要,finalpage/2016-07-22/1202496541.PDF
821,2016-07-22,襄阳轴承：广州证券股份有限公司关于公司非公开发行A股股票之上市保荐书,finalpage/2016-07-22/1202496542.PDF
822,2016-07-22,襄阳轴承：国浩律师（上海）事务所关于公司非公开发行股票之发行过程和认购对象合规性之法律意见书,finalpage/2016-07-22/1202496543.PDF
823,2016-07-22,襄阳轴承：关于非公开发行股票相关承诺的公告,finalpage/2016-07-22/1202496544.PDF
824,2016-07-22,襄阳轴承：关于公司非公开发行股票发行过程和发行对象合规性的报告,finalpage/2016-07-22/1202496545.PDF
825,2016-07-22,襄阳轴承：关于非公开发行股票发行情况报告书的提示性公告,finalpage/2016-07-22/1202496546.PDF
826,2016-07-22,襄阳轴承：非公开发行股票发行情况报告暨上市公告书,finalpage/2016-07-22/1202496547.PDF
827,2016-07-27,襄阳轴承：关于新增股份可解除限售日期的补充公告,finalpage/2016-07-27/1202506047.PDF
828,2016-07-28,襄阳轴承：关于新增股份可解除限售日期的补充说明公告,finalpage/2016-07-28/1202511072.PDF
829,2016-07-28,襄阳轴承：非公开发行股票发行情况报告暨上市公告书,finalpage/2016-07-28/1202511073.PDF
830,2016-08-20,襄阳轴承：关于签订募集资金三方监管协议的公告,finalpage/2016-08-20/1202596738.PDF
831,2016-08-20,襄阳轴承：关于保荐代表人变更的公告,finalpage/2016-08-20/1202596739.PDF
832,2016-08-26,襄阳轴承：关于控股股东及一致行动人增持完成的公告,finalpage/2016-08-26/1202619160.PDF
833,2016-08-26,襄阳轴承：湖北今天律师事务所关于公司控股股东及一致行动人增持公司股份的专项法律意见书,finalpage/2016-08-26/1202619161.PDF
834,2016-08-27,襄阳轴承：2016年半年度报告摘要,finalpage/2016-08-27/1202632302.PDF
835,2016-08-27,襄阳轴承：2016年半年度财务报告,finalpage/2016-08-27/1202632309.PDF
836,2016-08-27,襄阳轴承：2016年半年度报告,finalpage/2016-08-27/1202632311.PDF
837,2016-08-27,襄阳轴承：独立董事对公司关联方资金占用和对外担保情况的专项说明和独立意见,finalpage/2016-08-27/1202632312.PDF
838,2016-09-03,襄阳轴承：关于控股股东及一致行动人增持完成的补充更正公告,finalpage/2016-09-03/1202672650.PDF
839,2016-09-03,襄阳轴承：湖北今天律师事务所关于公司控股股东及一致行动人增持公司股份的专项法律意见书,finalpage/2016-09-03/1202672651.PDF
840,2016-09-13,襄阳轴承：关于控股股东实行混合所有制改革的提示性公告,finalpage/2016-09-13/1202697905.PDF
841,2016-09-19,襄阳轴承：独立董事关于第六届董事会第九次会议相关事项的独立意见,finalpage/2016-09-19/1202704348.PDF
842,2016-09-19,襄阳轴承：关于以募集资金置换先期投入的公告,finalpage/2016-09-19/1202704349.PDF
843,2016-09-19,襄阳轴承：广州证券股份有限公司关于公司使用募集资金置换预先已投入募投项目的自筹资金的核查意见,finalpage/2016-09-19/1202704350.PDF
844,2016-09-19,襄阳轴承：关于公司以自筹资金预先投入募投项目的专项说明的专项审核报告,finalpage/2016-09-19/1202704351.PDF
845,2016-09-19,襄阳轴承：第六届董事会第九次会议决议公告,finalpage/2016-09-19/1202704352.PDF
846,2016-09-19,襄阳轴承：第六届监事会第八次会议决议公告,finalpage/2016-09-19/1202704353.PDF
847,2016-09-20,襄阳轴承：股票交易异常波动公告,finalpage/2016-09-20/1202708064.PDF
848,2016-10-15,襄阳轴承：2016年前三季度业绩预告公告,finalpage/2016-10-15/1202759163.PDF
849,2016-10-28,襄阳轴承：2016年第三季度报告正文,finalpage/2016-10-28/1202795270.PDF
850,2016-10-28,襄阳轴承：2016年第三季度报告全文,finalpage/2016-10-28/1202795272.PDF
851,2016-10-28,襄阳轴承：第六届董事会第十次会议决议公告,finalpage/2016-10-28/1202795273.PDF
852,2016-10-28,襄阳轴承：独立董事事前认可及独立意见,finalpage/2016-10-28/1202795274.PDF
853,2016-11-19,襄阳轴承：第六届董事会第十一次会议决议公告,finalpage/2016-11-19/1202835155.PDF
854,2016-11-19,襄阳轴承：第六届监事会第十次会议决议公告,finalpage/2016-11-19/1202835156.PDF
855,2016-11-19,襄阳轴承：独立董事意见,finalpage/2016-11-19/1202835157.PDF
856,2016-11-19,襄阳轴承：关于使用银行承兑汇票支付募集资金投资项目所需资金并同时以募集资金等额进行置换的公告,finalpage/2016-11-19/1202835158.PDF
857,2016-11-19,襄阳轴承：广州证券股份有限公司关于公司使用银行承兑汇票支付募投项目款项并以募集资金等额置换的核查意见,finalpage/2016-11-19/1202835159.PDF
858,2016-12-07,襄阳轴承：关于签署国有土地补偿协议书的公告,finalpage/2016-12-07/1202861388.PDF
859,2016-12-30,襄阳轴承：关于收到土地拆迁及收储补偿款的公告,finalpage/2016-12-30/1202973152.PDF
860,2017-01-10,襄阳轴承：广州证券股份有限公司对公司现场检查报告,finalpage/2017-01-10/1203001083.PDF
861,2017-01-10,襄阳轴承：广州证券股份有限公司关于公司持续督导期2016年培训情况报告,finalpage/2017-01-10/1203001084.PDF
862,2017-01-21,襄阳轴承：2016年度业绩预告,finalpage/2017-01-21/1203035912.PDF
863,2017-03-16,襄阳轴承：关于控股股东混合所有制改革进展的公告,finalpage/2017-03-16/1203162291.PDF
864,2017-04-15,襄阳轴承：2016年度业绩快报,finalpage/2017-04-15/1203298690.PDF
865,2017-04-15,襄阳轴承：2017年度第一季度业绩预告,finalpage/2017-04-15/1203298691.PDF
866,2017-04-26,襄阳轴承：2016年年度报告摘要,finalpage/2017-04-26/1203385259.PDF
867,2017-04-26,襄阳轴承：2016年年度审计报告,finalpage/2017-04-26/1203385261.PDF
868,2017-04-26,襄阳轴承：第六届董事会第十二次会议决议公告（已取消）,finalpage/2017-04-26/1203385262.PDF
869,2017-04-26,襄阳轴承：关于召开2016年年度股东大会的通知（已取消）,finalpage/2017-04-26/1203385263.PDF
870,2017-04-26,襄阳轴承：第六届监事会第十一次会议决议公告（已取消）,finalpage/2017-04-26/1203385264.PDF
871,2017-04-26,襄阳轴承：2016年年度报告（已取消）,finalpage/2017-04-26/1203385265.PDF
872,2017-04-26,襄阳轴承：2016年度控股股东及其他关联方资金占用情况的专项说明,finalpage/2017-04-26/1203385266.PDF
873,2017-04-26,襄阳轴承：2016年度内部控制评价报告,finalpage/2017-04-26/1203385267.PDF
874,2017-04-26,襄阳轴承：2016年度募集资金存放与实际使用情况的专项报告,finalpage/2017-04-26/1203385268.PDF
875,2017-04-26,襄阳轴承：2016年度独立董事述职报告,finalpage/2017-04-26/1203385269.PDF
876,2017-04-26,襄阳轴承：独立董事的专项说明及独立意见,finalpage/2017-04-26/1203385270.PDF
877,2017-04-26,襄阳轴承：独立董事候选人声明（周宇）,finalpage/2017-04-26/1203385271.PDF
878,2017-04-26,襄阳轴承：独立董事提名人声明,finalpage/2017-04-26/1203385272.PDF
879,2017-04-26,襄阳轴承：关于独立董事辞职并增补独立董事的公告,finalpage/2017-04-26/1203385273.PDF
880,2017-04-26,襄阳轴承：关于监事辞职并增补监事的公告,finalpage/2017-04-26/1203385274.PDF
881,2017-04-26,襄阳轴承：关于确认2016年度并预计2017年度日常关联交易的公告（已取消）,finalpage/2017-04-26/1203385275.PDF
882,2017-04-26,襄阳轴承：广州证券股份有限公司关于公司2016年度内部控制评价报告的核查意见,finalpage/2017-04-26/1203385276.PDF
883,2017-04-26,襄阳轴承：广州证券股份有限公司关于公司之2016年度保荐工作报告,finalpage/2017-04-26/1203385277.PDF
884,2017-04-26,襄阳轴承：广州证券股份有限公司关于公司2016年度募集资金存放与使用情况专项核查报告,finalpage/2017-04-26/1203385278.PDF
885,2017-04-26,襄阳轴承：广州证券股份有限公司关于公司关联交易情况的专项现场检查报告,finalpage/2017-04-26/1203385279.PDF
886,2017-04-27,襄阳轴承：2016年监事会报告,finalpage/2017-04-27/1203403853.PDF
887,2017-04-27,襄阳轴承：第六届董事会第十二次会议决议公告（更新后）,finalpage/2017-04-27/1203403854.PDF
888,2017-04-27,襄阳轴承：第六届监事会第十一次会议决议公告（更新后）,finalpage/2017-04-27/1203403855.PDF
889,2017-04-27,襄阳轴承：关于确认2016年度并预计2017年度日常关联交易的公告（更新后）,finalpage/2017-04-27/1203403856.PDF
890,2017-04-27,襄阳轴承：关于召开2016年年度股东大会的通知（更新后）,finalpage/2017-04-27/1203403857.PDF
891,2017-04-27,襄阳轴承：内部控制审计报告,finalpage/2017-04-27/1203403858.PDF
892,2017-04-27,襄阳轴承：关于2016年年度报告相关事项的补充更正公告,finalpage/2017-04-27/1203403859.PDF
893,2017-04-29,襄阳轴承：2017年第一季度报告正文,finalpage/2017-04-29/1203422979.PDF
894,2017-04-29,襄阳轴承：2017年第一季度报告全文,finalpage/2017-04-29/1203422981.PDF
895,2017-05-10,襄阳轴承：关于召开2016年年度股东大会的提示性公告,finalpage/2017-05-10/1203487111.PDF
896,2017-05-17,襄阳轴承：关于保荐代表人变更的公告,finalpage/2017-05-17/1203525789.PDF
897,2017-05-17,襄阳轴承：2016年年度股东大会决议公告,finalpage/2017-05-17/1203525790.PDF
898,2017-05-17,襄阳轴承：公司章程（2017年5月）,finalpage/2017-05-17/1203525791.PDF
899,2017-05-17,襄阳轴承：2016年年度股东大会法律意见,finalpage/2017-05-17/1203525792.PDF
900,2017-05-20,襄阳轴承：关于2016年年度报告的补充更正公告,finalpage/2017-05-20/1203543661.PDF
901,2017-05-20,襄阳轴承：2016年年度报告（更新后）,finalpage/2017-05-20/1203543662.PDF
902,2017-07-05,襄阳轴承：关于收到湖北证监局行政监管措施决定书的公告,finalpage/2017-07-05/1203681613.PDF
903,2017-07-11,襄阳轴承：第六届董事会第十四次会议决议公告,finalpage/2017-07-11/1203692042.PDF
904,2017-07-11,襄阳轴承：独立董事事前认可及独立意见,finalpage/2017-07-11/1203692043.PDF
905,2017-07-11,襄阳轴承：关于向控股子公司增资暨关联交易的公告,finalpage/2017-07-11/1203692044.PDF
906,2017-07-11,襄阳轴承：广州证券股份有限公司关于公司向控股子公司增资暨关联交易之核查意见,finalpage/2017-07-11/1203692045.PDF
907,2017-07-15,襄阳轴承：2017年半年度业绩预告公告,finalpage/2017-07-15/1203706985.PDF
908,2017-08-26,襄阳轴承：关于保荐代表人变更的公告,finalpage/2017-08-26/1203871558.PDF
909,2017-08-26,襄阳轴承：第六届董事会第十五次会议决议公告,finalpage/2017-08-26/1203871559.PDF
910,2017-08-26,襄阳轴承：独立董事事前认可及独立意见,finalpage/2017-08-26/1203871560.PDF
911,2017-08-26,襄阳轴承：关于调整对控股子公司增资方案暨关联交易的公告,finalpage/2017-08-26/1203871561.PDF
912,2017-08-26,襄阳轴承：关于召开2017年第一次临时股东大会的通知,finalpage/2017-08-26/1203871562.PDF
913,2017-08-26,襄阳轴承：广州证券股份有限公司关于公司调整向控股子公司增资方案暨关联交易之核查意见,finalpage/2017-08-26/1203871563.PDF
914,2017-08-28,襄阳轴承：Fabryka Lozysk Tocznych-Krasnik S.A.审计报告,finalpage/2017-08-28/1203874806.PDF
915,2017-08-28,襄阳轴承：Fabryka Lozysk Tocznych-Krasnik S.A.审阅报告,finalpage/2017-08-28/1203874807.PDF
916,2017-08-30,襄阳轴承：2017年半年度报告摘要,finalpage/2017-08-30/1203894348.PDF
917,2017-08-30,襄阳轴承：2017年半年度财务报告,finalpage/2017-08-30/1203894350.PDF
918,2017-08-30,襄阳轴承：第六届董事会第十六次会议决议公告,finalpage/2017-08-30/1203894351.PDF
919,2017-08-30,襄阳轴承：2017年半年度报告（已取消）,finalpage/2017-08-30/1203894352.PDF
920,2017-08-30,襄阳轴承：第六届监事会第十三次会议决议,finalpage/2017-08-30/1203894353.PDF
921,2017-08-30,襄阳轴承：独立董事关于会计政策变更的独立意见,finalpage/2017-08-30/1203894354.PDF
922,2017-08-30,襄阳轴承：独立董事对公司关联方资金占用和对外担保情况的专项说明和独立意见,finalpage/2017-08-30/1203894355.PDF
