date,title,url
2011-02-24,建投能源：拟发行股份收购秦皇岛秦热发电有限责任公司40%股权项目资产评估报告书,finalpage/2011-02-24/59038171.PDF
2011-02-24,建投能源：河北建投电力燃料管理有限公司2008年至2010年6月两年一期审计报告,finalpage/2011-02-24/59038172.PDF
2011-02-24,建投能源：河北建投电力燃料管理有限公司审计报告,finalpage/2011-02-24/59038173.PDF
2011-02-24,建投能源：拟发行股份收购河北建投电力燃料管理有限公司58%股权项目资产评估报告书,finalpage/2011-02-24/59038192.PDF
2011-02-24,建投能源：三河发电有限责任公司2008年至2010年6月两年一期审计报告,finalpage/2011-02-24/59038195.PDF
2011-02-24,建投能源：三河发电有限责任公司审计报告（2010年11月30日）,finalpage/2011-02-24/59038196.PDF
2011-02-24,建投能源：拟发行股份收购三河发电有限责任公司15%股权项目资产评估报告书,finalpage/2011-02-24/59038197.PDF
2011-02-24,建投能源：河北建投宣化热电有限责任公司审计报告（2008年-2010年1-6月）,finalpage/2011-02-24/59038198.PDF
2011-02-24,建投能源：河北建投宣化热电有限责任公司审计报告（2010年11月30日）,finalpage/2011-02-24/59038199.PDF
2011-02-24,建投能源：拟发行股份收购河北建投宣化热电有限责任公司全部股权项目资产评估报告书,finalpage/2011-02-24/59038200.PDF
2011-03-08,建投能源：关于召开2011年第一次临时股东大会的提示性公告,finalpage/2011-03-08/59090650.PDF
2011-03-08,建投能源：关于发行股份购买资产之重大资产重组方案获河北省国资委正式批准的公告,finalpage/2011-03-08/59090651.PDF
2011-03-14,建投能源：2011年第一次临时股东大会决议公告,finalpage/2011-03-14/59112127.PDF
2011-03-14,建投能源：2011年第一次临时股东大会的法律意见书,finalpage/2011-03-14/59112128.PDF
2011-03-29,建投能源：第六届董事会第十一次临时会议决议公告,finalpage/2011-03-29/59189312.PDF
2011-04-09,建投能源：2010年年度报告,finalpage/2011-04-09/59241616.PDF
2011-04-09,建投能源：2011年日常关联交易公告,finalpage/2011-04-09/59241611.PDF
2011-04-09,建投能源：2010年年度报告摘要,finalpage/2011-04-09/59241613.PDF
2011-04-09,建投能源：2010年年度审计报告,finalpage/2011-04-09/59241621.PDF
2011-04-09,建投能源：第六届董事会第七次会议决议公告,finalpage/2011-04-09/59241622.PDF
2011-04-09,建投能源：关于召开2010年年度股东大会的通知,finalpage/2011-04-09/59241623.PDF
2011-04-09,建投能源：第六届监事会第七次会议决议公告,finalpage/2011-04-09/59241624.PDF
2011-04-09,建投能源：关于公司2010年度控股股东及其他关联方资金占用情况的专项说明,finalpage/2011-04-09/59241625.PDF
2011-04-09,建投能源：2010年度独立董事述职报告,finalpage/2011-04-09/59241690.PDF
2011-04-09,建投能源：2010年度内部控制自我评价报告,finalpage/2011-04-09/59241693.PDF
2011-04-09,建投能源：第六届董事会独立董事关于关联方资金占用和对外担保情况的独立意见,finalpage/2011-04-09/59241700.PDF
2011-04-15,建投能源：2011年第一季度业绩预告公告,finalpage/2011-04-15/59269945.PDF
2011-04-30,建投能源：2010年年度股东大会决议公告,finalpage/2011-04-30/59370832.PDF
2011-04-30,建投能源：关于召开2011年第二次临时股东大会的通知,finalpage/2011-04-30/59370833.PDF
2011-04-30,建投能源：2011年第一季度报告正文,finalpage/2011-04-30/59370834.PDF
2011-04-30,建投能源：2011年第一季度报告全文,finalpage/2011-04-30/59370835.PDF
2011-04-30,建投能源：第六届董事会第八次会议决议公告,finalpage/2011-04-30/59370836.PDF
2011-04-30,建投能源：第六届监事会第八次会议决议公告,finalpage/2011-04-30/59370837.PDF
2011-04-30,建投能源：关于向控股子公司提供委托贷款的公告,finalpage/2011-04-30/59370838.PDF
2011-04-30,建投能源：2010年年度股东大会的法律意见书,finalpage/2011-04-30/59370839.PDF
2011-05-19,建投能源：2011年第二次临时股东大会的法律意见书,finalpage/2011-05-19/59446779.PDF
2011-05-19,建投能源：2011年第二次临时股东大会决议公告,finalpage/2011-05-19/59446780.PDF
2011-05-20,建投能源：关于举行2010年度业绩说明会的公告,finalpage/2011-05-20/59451636.PDF
2011-06-03,建投能源：关于控股子公司电价调整的公告,finalpage/2011-06-03/59509920.PDF
2011-06-14,建投能源：关于召开2011年第三次临时股东大会的通知,finalpage/2011-06-14/59547398.PDF
2011-06-14,建投能源：第六届董事会第十二次临时会议决议公告,finalpage/2011-06-14/59547399.PDF
2011-06-18,建投能源：2010年度分红派息实施公告,finalpage/2011-06-18/59567993.PDF
2011-06-25,建投能源：关于召开2011年第三次临时股东大会的提示性公告,finalpage/2011-06-25/59595621.PDF
2011-06-28,建投能源：关于控股股东为公司债券提供有偿担保的关联交易公告,finalpage/2011-06-28/59603466.PDF
2011-06-28,建投能源：第六届董事会第十三次临时会议决议公告,finalpage/2011-06-28/59603467.PDF
2011-06-29,建投能源：关于使用暂时闲置资金购买银行理财产品的公告,finalpage/2011-06-29/59607849.PDF
2011-06-30,建投能源：2011年第三次临时股东大会决议公告,finalpage/2011-06-30/59614367.PDF
2011-06-30,建投能源：2011年第三次临时股东大会的法律意见书,finalpage/2011-06-30/59614368.PDF
2011-07-15,建投能源：2011年半年度业绩预告公告,finalpage/2011-07-15/59678174.PDF
2011-07-22,建投能源：关于延期上报发行股份购买资产反馈意见回复材料的公告,finalpage/2011-07-22/59710961.PDF
2011-07-30,建投能源：关于公司债券发行申请获得中国证券监督管理委员会发行审核委员会审核通过的公告,finalpage/2011-07-30/59747287.PDF
2011-08-03,建投能源：关于召开2011年第四次临时股东大会的通知,finalpage/2011-08-03/59762471.PDF
2011-08-03,建投能源：2011年半年度报告摘要,finalpage/2011-08-03/59762472.PDF
2011-08-03,建投能源：2011年半年度报告,finalpage/2011-08-03/59762474.PDF
2011-08-03,建投能源：2011年半年度审计报告,finalpage/2011-08-03/59762476.PDF
2011-08-03,建投能源：第六届董事会第九次会议决议公告,finalpage/2011-08-03/59762477.PDF
2011-08-03,建投能源：关于参股设立河北建设投资集团财务有限责任公司的对外投资暨关联交易公告,finalpage/2011-08-03/59762479.PDF
2011-08-03,建投能源：第六届董事会独立董事关于关联方资金占用和对外担保情况的独立意见,finalpage/2011-08-03/59762480.PDF
2011-08-19,建投能源：2011年第四次临时股东大会决议公告,finalpage/2011-08-19/59838487.PDF
2011-08-19,建投能源：2011年第四次临时股东大会的法律意见书,finalpage/2011-08-19/59838488.PDF
2011-08-20,建投能源：关于公开发行公司债券获得中国证券监督管理委员会核准的公告,finalpage/2011-08-20/59844565.PDF
2011-08-25,建投能源：2011公司债券信用评级报告,finalpage/2011-08-25/59868287.PDF
2011-08-25,建投能源：公开发行2011年公司债券募集说明书,finalpage/2011-08-25/59868289.PDF
2011-08-25,建投能源：公开发行2011年公司债券募集说明书摘要,finalpage/2011-08-25/59868290.PDF
2011-08-25,建投能源：2011年公司债券发行公告,finalpage/2011-08-25/59868898.PDF
2011-08-29,建投能源：2011年公司债券票面利率公告,finalpage/2011-08-29/59883441.PDF
2011-08-31,建投能源：2011年公司债券发行结果公告,finalpage/2011-08-31/59900830.PDF
2011-09-03,建投能源：关于向控股子公司河北建投国融能源服务股份有限公司增加投资的公告,finalpage/2011-09-03/59916585.PDF
2011-09-03,建投能源：关于向参股公司河北银行股份有限公司增加投资的公告,finalpage/2011-09-03/59916586.PDF
2011-09-03,建投能源：第六届董事会第十四次临时会议决议公告,finalpage/2011-09-03/59916587.PDF
2011-10-10,建投能源：关于申请环保核查有关事项的公告,finalpage/2011-10-10/60027335.PDF
2011-10-15,建投能源：2011年前三季度业绩预告公告,finalpage/2011-10-15/60059695.PDF
2011-10-19,建投能源：2011年公司债券上市公告书,finalpage/2011-10-19/60074937.PDF
2011-10-24,建投能源：2011年第三季度报告正文,finalpage/2011-10-24/60091484.PDF
2011-10-24,建投能源：2011年第三季度报告全文,finalpage/2011-10-24/60091488.PDF
2011-12-06,建投能源：关于控股子公司电价调整的公告,finalpage/2011-12-06/60287001.PDF
2011-12-20,建投能源：关于召开2012年第一次临时股东大会的通知,finalpage/2011-12-20/60343421.PDF
2011-12-20,建投能源：第六届董事会独立董事对公司转让参股公司河北银行股份有限公司部分股份事项的独立意见,finalpage/2011-12-20/60343422.PDF
2011-12-20,建投能源：第六届董事会第十五次临时会议决议公告,finalpage/2011-12-20/60343423.PDF
2011-12-20,建投能源：关于控股子公司河北西柏坡发电有限责任公司与河北西柏坡第二发电有限责任公司互为提供贷款担保的公告,finalpage/2011-12-20/60343424.PDF
2011-12-20,建投能源：关于转让参股公司河北银行股份有限公司部分股份的关联交易公告,finalpage/2011-12-20/60343425.PDF
2011-12-30,建投能源：关于转让河北银行股份有限公司部分股份的进展公告,finalpage/2011-12-30/60387581.PDF
2012-01-07,建投能源：2012年第一次临时股东大会的法律意见书,finalpage/2012-01-07/60416900.PDF
2012-01-07,建投能源：2012年第一次临时股东大会决议公告,finalpage/2012-01-07/60416901.PDF
2012-01-19,建投能源：关于更换职工监事的公告,finalpage/2012-01-19/60462960.PDF
2012-02-23,建投能源：关于召开2012年第二次临时股东大会的通知,finalpage/2012-02-23/60574509.PDF
2012-02-23,建投能源：第六届董事会第十六次临时会议决议公告,finalpage/2012-02-23/60574510.PDF
2012-03-06,建投能源：关于召开2012年第二次临时股东大会的提示性公告,finalpage/2012-03-06/60628278.PDF
2012-03-10,建投能源：2012年第二次临时股东大会的法律意见书,finalpage/2012-03-10/60650863.PDF
2012-03-10,建投能源：2012年第二次临时股东大会决议公告,finalpage/2012-03-10/60650864.PDF
2012-04-17,建投能源：2011年度业绩快报公告,finalpage/2012-04-17/60841260.PDF
2012-04-17,建投能源：2012年一季度业绩预告公告,finalpage/2012-04-17/60841407.PDF
2012-04-18,建投能源：2011年度独立董事述职报告（戚辉敏）,finalpage/2012-04-18/60848299.PDF
2012-04-18,建投能源：2011年度独立董事述职报告（郭立田）,finalpage/2012-04-18/60848300.PDF
2012-04-18,建投能源：2011年度独立董事述职报告（陈春逢）,finalpage/2012-04-18/60848301.PDF
2012-04-18,建投能源：2012年日常关联交易预计公告,finalpage/2012-04-18/60848302.PDF
2012-04-18,建投能源：2011年年度报告摘要,finalpage/2012-04-18/60848303.PDF
2012-04-18,建投能源：2011年年度报告,finalpage/2012-04-18/60848305.PDF
2012-04-18,建投能源：2011年年度审计报告,finalpage/2012-04-18/60848306.PDF
2012-04-18,建投能源：第六届董事会第十一次会议决议公告,finalpage/2012-04-18/60848307.PDF
2012-04-18,建投能源：关于召开2011年年度股东大会的通知,finalpage/2012-04-18/60848308.PDF
2012-04-18,建投能源：第六届监事会第十一次会议决议公告,finalpage/2012-04-18/60848309.PDF
2012-04-18,建投能源：关于公司2011年度控股股东及其他关联方资金占用情况的专项说明,finalpage/2012-04-18/60848310.PDF
2012-04-18,建投能源：2011年度内部控制评价报告,finalpage/2012-04-18/60848311.PDF
2012-04-18,建投能源：第六届董事会独立董事关于关联方资金占用和对外担保情况的独立意见等,finalpage/2012-04-18/60848312.PDF
2012-04-18,建投能源：内部控制审计报告,finalpage/2012-04-18/60848313.PDF
2012-04-18,建投能源：关于公司固定资产折旧年限会计估计变更影响明细表之专项审计报告,finalpage/2012-04-18/60848314.PDF
2012-04-18,建投能源：内幕信息知情人登记制度（2012年4月）,finalpage/2012-04-18/60848315.PDF
2012-04-18,建投能源：关于控股子公司会计估计变更的公告,finalpage/2012-04-18/60848316.PDF
2012-04-21,建投能源：2012年第一季度报告正文,finalpage/2012-04-21/60871592.PDF
2012-04-21,建投能源：2012年第一季度报告全文,finalpage/2012-04-21/60871593.PDF
2012-05-05,建投能源：关于召开2011年年度股东大会的提示性公告,finalpage/2012-05-05/60956703.PDF
2012-05-10,建投能源：2011年年度股东大会决议公告,finalpage/2012-05-10/60976271.PDF
2012-05-10,建投能源：2011年年度股东大会的法律意见书,finalpage/2012-05-10/60976272.PDF
2012-05-18,建投能源：关于举行2011年度业绩说明会的公告,finalpage/2012-05-18/61012957.PDF
2012-05-18,建投能源：2011年公司债券受托管理事务报告（2011年度）,finalpage/2012-05-18/61012958.PDF
2012-05-18,建投能源：公司债券2012年跟踪评级报告,finalpage/2012-05-18/61012959.PDF
2012-06-15,建投能源：关于召开2012年第三次临时股东大会的通知,finalpage/2012-06-15/61139933.PDF
2012-06-15,建投能源：第六届董事会独立董事对公司终止发行股份购买资产暨重大资产重组申请工作事项的独立意见,finalpage/2012-06-15/61139934.PDF
2012-06-15,建投能源：第六届董事会第十七次临时会议决议公告,finalpage/2012-06-15/61139935.PDF
2012-06-15,建投能源：关于终止发行股份购买资产暨重大资产重组申请工作的公告,finalpage/2012-06-15/61139936.PDF
2012-06-28,建投能源：2011年度分红派息实施公告,finalpage/2012-06-28/61189756.PDF
2012-06-29,建投能源：关于召开2012年第三次临时股东大会的提示性公告,finalpage/2012-06-29/61195471.PDF
2012-07-05,建投能源：2012年第三次临时股东大会的法律意见书,finalpage/2012-07-05/61224785.PDF
2012-07-05,建投能源：2012年第三次临时股东大会决议公告,finalpage/2012-07-05/61224786.PDF
2012-07-13,建投能源：2012年半年度业绩预告公告,finalpage/2012-07-13/61261870.PDF
2012-07-18,建投能源：股票交易异常波动公告,finalpage/2012-07-18/61283691.PDF
2012-07-25,建投能源：关于中国证监会终止审查公司发行股份购买资产行政许可申请的公告,finalpage/2012-07-25/61317634.PDF
2012-07-28,建投能源：关于召开2012年第四次临时股东大会的通知,finalpage/2012-07-28/61334458.PDF
2012-07-28,建投能源：公司章程修正案（草案）,finalpage/2012-07-28/61334459.PDF
2012-07-28,建投能源：第六届董事会第十八次临时会议决议公告,finalpage/2012-07-28/61334460.PDF
2012-08-14,建投能源：2012年第四次临时股东大会的法律意见书,finalpage/2012-08-14/61414563.PDF
2012-08-14,建投能源：公司章程修正案,finalpage/2012-08-14/61414564.PDF
2012-08-14,建投能源：公司章程（2012年8月）,finalpage/2012-08-14/61414565.PDF
2012-08-14,建投能源：2012年第四次临时股东大会决议公告,finalpage/2012-08-14/61414566.PDF
2012-08-15,建投能源：2012年半年度报告摘要,finalpage/2012-08-15/61421437.PDF
2012-08-15,建投能源：2012年半年度报告,finalpage/2012-08-15/61421442.PDF
2012-08-15,建投能源：2012年半年度财务报告,finalpage/2012-08-15/61421447.PDF
2012-08-15,建投能源：第六届董事会第十三次会议决议公告,finalpage/2012-08-15/61421448.PDF
2012-08-15,建投能源：第六届董事会独立董事关于关联方资金占用和对外担保情况的独立意见,finalpage/2012-08-15/61421449.PDF
2012-08-25,建投能源：2011年公司债券2012年付息公告,finalpage/2012-08-25/61477115.PDF
2012-10-12,建投能源：银行间债券市场债务融资工具信息披露管理制度（2012年10月）,finalpage/2012-10-12/61646220.PDF
2012-10-12,建投能源：第六届董事会第十九次临时会议决议公告,finalpage/2012-10-12/61646221.PDF
2012-10-13,建投能源：2012年前三季度业绩预告公告,finalpage/2012-10-13/61650574.PDF
2012-10-20,建投能源：2012年第三季度报告正文,finalpage/2012-10-20/61679346.PDF
2012-10-20,建投能源：2012年第三季度报告全文,finalpage/2012-10-20/61679347.PDF
2012-10-31,建投能源：关于控股股东承诺履行情况的公告,finalpage/2012-10-31/61738519.PDF
2012-11-24,建投能源：关于为控股孙公司石家庄国融安能分布能源技术有限公司提供担保的公告,finalpage/2012-11-24/61831942.PDF
2012-11-24,建投能源：第六届董事会第二十次临时会议决议公告,finalpage/2012-11-24/61831943.PDF
2013-01-30,建投能源：2012年度业绩预告公告,finalpage/2013-01-30/62082665.PDF
2013-03-15,建投能源：河北建投集团财务有限公司风险评估报告,finalpage/2013-03-15/62214525.PDF
2013-03-15,建投能源：关于在河北建投集团财务有限公司存款风险的处置预案,finalpage/2013-03-15/62214526.PDF
2013-03-15,建投能源：2012年度独立董事述职报告（戚辉敏）,finalpage/2013-03-15/62214527.PDF
2013-03-15,建投能源：2012年度独立董事述职报告（郭立田）,finalpage/2013-03-15/62214528.PDF
2013-03-15,建投能源：2012年度独立董事述职报告（陈春逢）,finalpage/2013-03-15/62214529.PDF
2013-03-15,建投能源：2013年日常关联交易预计公告,finalpage/2013-03-15/62214530.PDF
2013-03-15,建投能源：2012年年度报告摘要,finalpage/2013-03-15/62214531.PDF
2013-03-15,建投能源：2012年年度报告,finalpage/2013-03-15/62214536.PDF
2013-03-15,建投能源：2012年年度审计报告,finalpage/2013-03-15/62214580.PDF
2013-03-15,建投能源：第六届董事会第十五次会议决议公告,finalpage/2013-03-15/62214581.PDF
2013-03-15,建投能源：关于召开2012年年度股东大会的通知,finalpage/2013-03-15/62214582.PDF
2013-03-15,建投能源：第六届监事会第十五次会议决议公告,finalpage/2013-03-15/62214583.PDF
2013-03-15,建投能源：2012年度内部控制评价报告,finalpage/2013-03-15/62214584.PDF
2013-03-15,建投能源：关于与河北建投集团财务有限公司持续关联交易公告,finalpage/2013-03-15/62214585.PDF
2013-04-02,建投能源：关于召开2012年年度股东大会的提示性公告,finalpage/2013-04-02/62311681.PDF
2013-04-02,建投能源：关于沙河发电项目1号机组投产的公告,finalpage/2013-04-02/62311682.PDF
2013-04-11,建投能源：控股股东及其他关联方资金占用情况的专项说明,finalpage/2013-04-11/62344805.PDF
2013-04-11,建投能源：2012年年度股东大会决议公告,finalpage/2013-04-11/62344806.PDF
2013-04-11,建投能源：2012年年度股东大会的法律意见书,finalpage/2013-04-11/62344809.PDF
2013-04-13,建投能源：2013年一季度业绩预告公告,finalpage/2013-04-13/62355943.PDF
2013-04-23,建投能源：2013年第一季度报告正文（已取消）,finalpage/2013-04-23/62402774.PDF
2013-04-23,建投能源：2013年第一季度报告全文（已取消）,finalpage/2013-04-23/62402775.PDF
2013-04-25,建投能源：2013年第一季度报告全文（更新后）,finalpage/2013-04-25/62421975.PDF
2013-04-25,建投能源：2013年第一季度报告正文（更新后）,finalpage/2013-04-25/62421976.PDF
2013-04-25,建投能源：关于2013年第一季度报告的更正公告,finalpage/2013-04-25/62421977.PDF
2013-05-07,建投能源：关于沙河发电项目2号机组投产的公告,finalpage/2013-05-07/62465340.PDF
2013-05-16,建投能源：2011年公司债券跟踪评级报告（2013）,finalpage/2013-05-16/62495484.PDF
2013-05-16,建投能源：2011年公司债券受托管理事务报告（2012年度）,finalpage/2013-05-16/62495487.PDF
2013-05-21,建投能源：内部控制审计报告,finalpage/2013-05-21/62510002.PDF
2013-05-21,建投能源：董事会关于重大资产重组停牌公告,finalpage/2013-05-21/62510003.PDF
2013-05-27,建投能源：关于举行2012年度业绩说明会的公告,finalpage/2013-05-27/62522172.PDF
2013-05-27,建投能源：重大资产重组事项进展公告,finalpage/2013-05-27/62522173.PDF
2013-06-03,建投能源：2012年年度权益分派实施公告,finalpage/2013-06-03/62542962.PDF
2013-06-03,建投能源：重大资产重组事项进展公告,finalpage/2013-06-03/62542963.PDF
2013-06-13,建投能源：关于任丘热电项目2号机组投产的公告,finalpage/2013-06-13/62570713.PDF
2013-06-13,建投能源：重大资产重组事项进展公告,finalpage/2013-06-13/62570714.PDF
2013-06-17,建投能源：重大资产重组事项进展公告,finalpage/2013-06-17/62584193.PDF
2013-06-19,建投能源：关于筹划重大资产重组停牌期满申请继续停牌的公告,finalpage/2013-06-19/62593597.PDF
2013-06-24,建投能源：重大资产重组事项进展公告,finalpage/2013-06-24/62603552.PDF
2013-07-01,建投能源：关于筹划重大资产重组停牌期满申请继续停牌的公告,finalpage/2013-07-01/62626191.PDF
2013-07-08,建投能源：重大资产重组事项进展公告,finalpage/2013-07-08/62790461.PDF
2013-07-15,建投能源：2013年半年度业绩预告公告,finalpage/2013-07-15/62831507.PDF
2013-07-15,建投能源：关于召开2013年第一次临时股东大会的通知,finalpage/2013-07-15/62831605.PDF
2013-07-15,建投能源：河北建设投资集团有限责任公司与公司关于发行股份购买资产框架协议,finalpage/2013-07-15/62831606.PDF
2013-07-15,建投能源：河北建设投资集团有限责任公司与公司盈利补偿框架协议,finalpage/2013-07-15/62831607.PDF
2013-07-15,建投能源：独立董事候选人声明（齐守印）,finalpage/2013-07-15/62831608.PDF
2013-07-15,建投能源：独立董事提名人声明（三）,finalpage/2013-07-15/62831609.PDF
2013-07-15,建投能源：独立董事候选人声明（戚辉敏）,finalpage/2013-07-15/62831610.PDF
2013-07-15,建投能源：独立董事提名人声明（二）,finalpage/2013-07-15/62831611.PDF
2013-07-15,建投能源：独立董事候选人声明（于万魁）,finalpage/2013-07-15/62831612.PDF
2013-07-15,建投能源：独立董事提名人声明（一）,finalpage/2013-07-15/62831613.PDF
2013-07-15,建投能源：关于本次重组相关主体不存在不得参与任何上市公司重大资产重组情形的说明,finalpage/2013-07-15/62831614.PDF
2013-07-15,建投能源：第六届监事会第三次临时会议决议公告,finalpage/2013-07-15/62831615.PDF
2013-07-15,建投能源：发行股份购买资产并配套融资暨关联交易预案,finalpage/2013-07-15/62831616.PDF
2013-07-15,建投能源：第六届董事会独立董事对公司董事会换届选举的独立意见,finalpage/2013-07-15/62831617.PDF
2013-07-15,建投能源：第六届董事会独立董事对发行股份购买资产并配套融资暨关联交易事项的独立意见,finalpage/2013-07-15/62831618.PDF
2013-07-15,建投能源：招商证券股份有限公司关于公司发行股份购买资产并配套融资暨关联交易预案之独立财务顾问核查意见,finalpage/2013-07-15/62831619.PDF
2013-07-15,建投能源：第六届董事会第二十一次临时会议决议公告,finalpage/2013-07-15/62831620.PDF
2013-07-15,建投能源：董事会关于重组履行法定程序的完备性、合规性及提交法律文件的有效性的说明,finalpage/2013-07-15/62831621.PDF
2013-07-15,建投能源：第七届董事会、监事会候选人简历,finalpage/2013-07-15/62831622.PDF
2013-07-15,建投能源：重组预案独立财务顾问核查意见表,finalpage/2013-07-15/62831623.PDF
2013-07-15,建投能源：董事会关于重大资产重组存在交易异常的风险提示公告,finalpage/2013-07-15/62831624.PDF
2013-07-20,建投能源：关于对河北建投集团财务有限公司的风险持续评估报告,finalpage/2013-07-20/62854319.PDF
2013-07-20,建投能源：2013年半年度报告摘要,finalpage/2013-07-20/62854320.PDF
2013-07-20,建投能源：2013年半年度审计报告,finalpage/2013-07-20/62854335.PDF
2013-07-20,建投能源：第六届董事会第十七次会议决议公告,finalpage/2013-07-20/62854336.PDF
2013-07-20,建投能源：2013年半年度报告,finalpage/2013-07-20/62854337.PDF
2013-07-20,建投能源：第六届董事会独立董事关于关联方资金占用和对外担保情况的独立意见,finalpage/2013-07-20/62854338.PDF
2013-07-31,建投能源：第七届董事会第一次临时会议决议公告,finalpage/2013-07-31/62886885.PDF
2013-07-31,建投能源：2013年第一次临时股东大会的法律意见书,finalpage/2013-07-31/62886886.PDF
2013-07-31,建投能源：独立董事关于董事会聘任公司高级管理人员的独立意见,finalpage/2013-07-31/62886887.PDF
2013-07-31,建投能源：第七届监事会第一次临时会议决议公告,finalpage/2013-07-31/62886888.PDF
2013-07-31,建投能源：2013年第一次临时股东大会决议公告,finalpage/2013-07-31/62886889.PDF
2013-08-13,建投能源：2013年半年度报告补充公告,finalpage/2013-08-13/62930886.PDF
2013-08-14,建投能源：重大资产重组事项进展公告,finalpage/2013-08-14/62935265.PDF
2013-08-22,建投能源：“11建能债”2013年付息公告,finalpage/2013-08-22/62973633.PDF
2013-09-14,建投能源：重大资产重组事项进展公告,finalpage/2013-09-14/63081151.PDF
