date,title,url
2014-12-13,建投能源：招商证券股份有限公司关于公司关联交易的持续督导核查意见,finalpage/2014-12-13/1200463154.PDF
2014-12-13,建投能源：国电承德热电有限公司审计报告（2014年1-6月）,finalpage/2014-12-13/1200463155.PDF
2014-12-13,建投能源：河北建设投资集团有限责任公司拟转让股权涉及的国电承德热电有限公司股权价值项目资产评估报告书,finalpage/2014-12-13/1200463156.PDF
2014-12-13,建投能源：第七届董事会独立董事关于向控股股东购买、出售资产事项的独立意见,finalpage/2014-12-13/1200463157.PDF
2014-12-13,建投能源：河北建设投资集团有限责任公司拟转让股权涉及河北大唐国际王滩发电有限责任公司股权项目资产评估报告书,finalpage/2014-12-13/1200463158.PDF
2014-12-13,建投能源：河北大唐国际王滩发电有限责任公司审计报告（2014年1-6月）,finalpage/2014-12-13/1200463159.PDF
2014-12-13,建投能源：第七届董事会第七次临时会议决议公告,finalpage/2014-12-13/1200463160.PDF
2014-12-13,建投能源：河北建设投资集团有限责任公司拟转让股权涉及的国电河北龙山发电有限责任公司股权价值项目资产评估报告书,finalpage/2014-12-13/1200463161.PDF
2014-12-13,建投能源：国电河北龙山发电有限责任公司审计报告（2014年6月）,finalpage/2014-12-13/1200463162.PDF
2014-12-13,建投能源：承德龙新热力有限责任公司审计报告（2014年1-6月）,finalpage/2014-12-13/1200463163.PDF
2014-12-13,建投能源：河北建设投资集团有限责任公司拟转让股权涉及的承德龙新热力有限责任公司股权价值项目资产评估报告书,finalpage/2014-12-13/1200463164.PDF
2014-12-18,建投能源：简式权益变动报告书,finalpage/2014-12-18/1200473156.PDF
2014-12-20,建投能源：关于拟购买标的公司河北大唐国际王滩发电有限责任公司其他股东方放弃优先购买权的公告,finalpage/2014-12-20/1200479843.PDF
2014-12-24,建投能源：关于召开2014年第三次临时股东大会提示性公告,finalpage/2014-12-24/1200488838.PDF
2014-12-24,建投能源：第七届董事会第八次临时会议决议公告,finalpage/2014-12-24/1200488839.PDF
2014-12-24,建投能源：关于第七届董事会第八次临时会议决议的补充公告,finalpage/2014-12-24/1200489570.PDF
2014-12-27,建投能源：关于与河北建设投资集团有限责任公司签订股权转让协议的公告,finalpage/2014-12-27/1200500218.PDF
2014-12-30,建投能源：2014年第三次临时股东大会决议公告,finalpage/2014-12-30/1200504362.PDF
2014-12-30,建投能源：2014年第三次临时股东大会的法律意见书,finalpage/2014-12-30/1200504363.PDF
2015-01-09,建投能源：关于签订河北建投集团财务有限公司增资扩股协议的公告,finalpage/2015-01-09/1200530475.PDF
2015-01-23,建投能源：2014年度业绩预告公告,finalpage/2015-01-23/1200570931.PDF
2015-01-23,建投能源：关于控股股东承诺履行进展情况的公告,finalpage/2015-01-23/1200570932.PDF
2015-04-13,建投能源：关于筹划重大事项的停牌公告,finalpage/2015-04-13/1200815335.PDF
2015-04-15,建投能源：内部控制审计报告,finalpage/2015-04-15/1200835751.PDF
2015-04-15,建投能源：关于向控股股东购买、出售资产过户完成的公告,finalpage/2015-04-15/1200834274.PDF
2015-04-15,建投能源：2014年度募集资金存放与使用情况专项报告,finalpage/2015-04-15/1200834313.PDF
2015-04-15,建投能源：涉及财务公司关联交易的存款、贷款等金融业务的专项说明（2014年度）,finalpage/2015-04-15/1200834314.PDF
2015-04-15,建投能源：2014年度独立董事述职报告（赵强）,finalpage/2015-04-15/1200834315.PDF
2015-04-15,建投能源：2014年度独立董事述职报告（龚六堂）,finalpage/2015-04-15/1200834316.PDF
2015-04-15,建投能源：2015年日常关联交易预计公告（已取消）,finalpage/2015-04-15/1200834317.PDF
2015-04-15,建投能源：2014年年度报告摘要,finalpage/2015-04-15/1200834318.PDF
2015-04-15,建投能源：2014年年度报告,finalpage/2015-04-15/1200834319.PDF
2015-04-15,建投能源：2014年年度审计报告,finalpage/2015-04-15/1200834320.PDF
2015-04-15,建投能源：第七届董事会第五次会议决议公告,finalpage/2015-04-15/1200834321.PDF
2015-04-15,建投能源：关于召开2014年度股东大会的通知,finalpage/2015-04-15/1200834322.PDF
2015-04-15,建投能源：第七届监事会第五次会议决议公告,finalpage/2015-04-15/1200834323.PDF
2015-04-15,建投能源：关于公司控股股东及其他关联方资金占用情况专项说明（2014年度）,finalpage/2015-04-15/1200834324.PDF
2015-04-15,建投能源：2014年度内部控制评价报告,finalpage/2015-04-15/1200834325.PDF
2015-04-15,建投能源：关于向参股公司中核华电河北核电有限公司提供委托贷款的公告,finalpage/2015-04-15/1200834326.PDF
2015-04-15,建投能源：关于投资设立燃料物资子公司的公告,finalpage/2015-04-15/1200834327.PDF
2015-04-15,建投能源：关于公司募集资金年度存放与使用情况专项审核报告,finalpage/2015-04-15/1200834328.PDF
2015-04-15,建投能源：关于公司重大资产重组2014年度盈利预测实现情况鉴证报告,finalpage/2015-04-15/1200834329.PDF
2015-04-15,建投能源：招商证券股份有限公司关于公司2014年度内部控制评价报告的核查意见,finalpage/2015-04-15/1200834330.PDF
2015-04-15,建投能源：招商证券股份有限公司关于公司2014年度募集资金存放与使用情况的核查意见,finalpage/2015-04-15/1200834331.PDF
2015-04-15,建投能源：招商证券股份有限公司关于公司向参股公司提供委托贷款的持续督导核查意见,finalpage/2015-04-15/1200834332.PDF
2015-04-15,建投能源：招商证券股份有限公司关于公司发行股份购买资产并配套融资暨关联交易2014年度持续督导工作报告,finalpage/2015-04-15/1200834333.PDF
2015-04-15,建投能源：招商证券股份有限公司关于公司重大资产重组标的公司河北国华沧东发电有限责任公司2014年度业绩承诺情况专项说明,finalpage/2015-04-15/1200834334.PDF
2015-04-15,建投能源：招商证券股份有限公司关于公司关联交易的持续督导核查意见,finalpage/2015-04-15/1200834335.PDF
2015-04-15,建投能源：关于公司重大资产重组标的公司河北国华沧东发电有限责任公司2014年度业绩承诺情况的鉴证报告,finalpage/2015-04-15/1200834336.PDF
2015-04-15,建投能源：河北国华沧东发电有限责任公司审计报告及财务报表（2014年度）,finalpage/2015-04-15/1200834337.PDF
2015-04-15,建投能源：独立董事关于2014年报对以前报告期披露的财务报表数据由于同一控制下企业合并进行追溯调整的专项说明,finalpage/2015-04-15/1200834338.PDF
2015-04-15,建投能源：第七届董事会独立董事关于关联方资金占用和对外担保情况的独立意见,finalpage/2015-04-15/1200834339.PDF
2015-04-15,建投能源：第七届董事会独立董事对公司内部控制自我评价的独立意见,finalpage/2015-04-15/1200834340.PDF
2015-04-15,建投能源：第七届董事会独立董事对公司与河北建投集团财务有限公司持续关联交易的独立意见,finalpage/2015-04-15/1200834341.PDF
2015-04-15,建投能源：第七届董事会独立董事关于向参股公司中核华电河北核电有限公司提供委托贷款的独立意见,finalpage/2015-04-15/1200834342.PDF
2015-04-15,建投能源：第七届董事会独立董事对2015年预计日常关联交易事项的独立意见,finalpage/2015-04-15/1200834343.PDF
2015-04-15,建投能源：第七届董事会独立董事对公司续聘会计师事务所的独立意见,finalpage/2015-04-15/1200834344.PDF
2015-04-15,建投能源：监事会关于2014年报对以前报告期披露的财务报表数据由于同一控制下企业合并进行追溯调整的专项说明,finalpage/2015-04-15/1200834345.PDF
2015-04-15,建投能源：董事会关于2014年报对以前报告期披露的财务报表数据由于同一控制下企业合并进行追溯调整的专项说明,finalpage/2015-04-15/1200834346.PDF
2015-04-15,建投能源：关于对河北建投集团财务有限公司的风险持续评估报告（2014年度）,finalpage/2015-04-15/1200834347.PDF
2015-04-15,建投能源：关于公司重大资产重组标的公司2014年度盈利预测实现情况的鉴证报告,finalpage/2015-04-15/1200834348.PDF
2015-04-16,建投能源：2015年日常关联交易预计公告（更新后）,finalpage/2015-04-16/1200839180.PDF
2015-04-16,建投能源：关于2015年日常关联交易预计的补充公告,finalpage/2015-04-16/1200839181.PDF
2015-04-20,建投能源：关于筹划重大事项的进展公告,finalpage/2015-04-20/1200862792.PDF
2015-04-25,建投能源：关于筹划重大事项的进展公告,finalpage/2015-04-25/1200907012.PDF
2015-04-25,建投能源：关于控股发电公司电价调整的公告,finalpage/2015-04-25/1200908051.PDF
2015-04-30,建投能源：2015年第一季度报告正文（已取消）,finalpage/2015-04-30/1200944279.PDF
2015-04-30,建投能源：2015年第一季度报告全文（已取消）,finalpage/2015-04-30/1200944280.PDF
2015-04-30,建投能源：2015年第一季度报告全文（更新后）,finalpage/2015-04-30/1200945919.PDF
2015-04-30,建投能源：2015年第一季度报告正文（更新后）,finalpage/2015-04-30/1200945920.PDF
2015-04-30,建投能源：关于2015年第一季度报告的更正公告,finalpage/2015-04-30/1200945921.PDF
2015-05-04,建投能源：关于筹划重大事项的进展公告,finalpage/2015-05-04/1200957734.PDF
2015-05-09,建投能源：关于召开2014年度股东大会提示性公告,finalpage/2015-05-09/1200985821.PDF
2015-05-11,建投能源：关于召开2015年第一次临时股东大会的通知,finalpage/2015-05-11/1200986530.PDF
2015-05-11,建投能源：公司章程修正案（草案）,finalpage/2015-05-11/1200986531.PDF
2015-05-11,建投能源：关于股票复牌的公告,finalpage/2015-05-11/1200986532.PDF
2015-05-11,建投能源：前次募集资金使用情况报告,finalpage/2015-05-11/1200986533.PDF
2015-05-11,建投能源：关于公司前次募集资金使用情况鉴证报告,finalpage/2015-05-11/1200986534.PDF
2015-05-11,建投能源：募集资金管理办法（2015年5月）,finalpage/2015-05-11/1200986535.PDF
2015-05-11,建投能源：未来三年（2015年-2017年）股东回报规划,finalpage/2015-05-11/1200986536.PDF
2015-05-11,建投能源：2015年非公开发行A股股票预案,finalpage/2015-05-11/1200986537.PDF
2015-05-11,建投能源：2015年非公开发行股票募集资金运用可行性报告,finalpage/2015-05-11/1200986538.PDF
2015-05-11,建投能源：第七届董事会独立董事关于修订《公司章程》利润分配相关条款的独立意见,finalpage/2015-05-11/1200986539.PDF
2015-05-11,建投能源：第七届董事会独立董事关于公司未来三年（2015年-2017年）股东回报规划的独立意见,finalpage/2015-05-11/1200986540.PDF
2015-05-11,建投能源：第七届董事会独立董事关于公司非公开发行股票事项的独立意见,finalpage/2015-05-11/1200986541.PDF
2015-05-11,建投能源：第七届董事会第九次临时会议决议公告,finalpage/2015-05-11/1200986542.PDF
2015-05-16,建投能源：2011年公司债券受托管理事务报告（2014年度）,finalpage/2015-05-16/1201021307.PDF
2015-05-16,建投能源：2011年公司债券跟踪评级报告（2015）,finalpage/2015-05-16/1201021308.PDF
2015-05-16,建投能源：2014年度股东大会决议公告,finalpage/2015-05-16/1201021395.PDF
2015-05-16,建投能源：2014年度股东大会的法律意见书,finalpage/2015-05-16/1201021396.PDF
2015-05-22,建投能源：关于召开2015年第一次临时股东大会提示性公告,finalpage/2015-05-22/1201045978.PDF
2015-05-23,建投能源：关于投资者网上集体接待日活动的公告,finalpage/2015-05-23/1201049545.PDF
2015-05-27,建投能源：2015年第一次临时股东大会决议公告,finalpage/2015-05-27/1201067018.PDF
2015-05-27,建投能源：公司章程修正案,finalpage/2015-05-27/1201067019.PDF
2015-05-27,建投能源：公司章程（2015年5月）,finalpage/2015-05-27/1201067020.PDF
2015-05-27,建投能源：2015年第一次临时股东大会的法律意见书,finalpage/2015-05-27/1201067021.PDF
2015-05-27,建投能源：关于非公开发行股票方案获河北省国资委批准的公告,finalpage/2015-05-27/1201067039.PDF
2015-06-05,建投能源：关于董事辞职的公告,finalpage/2015-06-05/1201105807.PDF
2015-06-10,建投能源：关于召开2015年第二次临时股东大会的通知,finalpage/2015-06-10/1201127552.PDF
2015-06-10,建投能源：第七届董事会独立董事对董事会提名董事候选人的独立意见,finalpage/2015-06-10/1201127553.PDF
2015-06-10,建投能源：第七届董事会第十次临时会议决议公告,finalpage/2015-06-10/1201127554.PDF
2015-06-12,建投能源：2014年度权益分派实施公告,finalpage/2015-06-12/1201139694.PDF
2015-06-19,建投能源：关于召开2015年第二次临时股东大会提示性公告,finalpage/2015-06-19/1201168668.PDF
2015-06-26,建投能源：2015年第二次临时股东大会决议公告,finalpage/2015-06-26/1201196300.PDF
2015-07-11,建投能源：关于积极维护股价稳定的公告,finalpage/2015-07-11/1201275219.PDF
2015-07-13,建投能源：股票交易异常波动公告,finalpage/2015-07-13/1201275334.PDF
2015-07-14,建投能源：2015年半年度业绩预告公告,finalpage/2015-07-14/1201287174.PDF
2015-07-21,建投能源：关于非公开发行股票申请材料获得中国证监会行政许可申请受理的公告,finalpage/2015-07-21/1201323238.PDF
2015-08-07,建投能源：招商证券股份有限公司关于公司非公开发行限售股份上市流通的核查意见,finalpage/2015-08-07/1201402217.PDF
2015-08-07,建投能源：重大资产重组配套融资非公开发行股份解除限售提示性公告,finalpage/2015-08-07/1201402218.PDF
2015-08-25,建投能源：“11建能债”2015年付息公告,finalpage/2015-08-25/1201483192.PDF
2015-08-27,建投能源：关于拟参股投资山西盂县2×100万千瓦发电项目的公告,finalpage/2015-08-27/1201500961.PDF
2015-08-29,建投能源：2015年半年度报告摘要,finalpage/2015-08-29/1201518988.PDF
2015-08-29,建投能源：2015年半年度报告,finalpage/2015-08-29/1201518989.PDF
2015-08-29,建投能源：2015年半年度财务报告,finalpage/2015-08-29/1201518990.PDF
2015-08-29,建投能源：第七届董事会第七次会议决议公告,finalpage/2015-08-29/1201518991.PDF
2015-08-29,建投能源：关于控股子公司替代发电关联交易的公告,finalpage/2015-08-29/1201518992.PDF
2015-08-29,建投能源：招商证券股份有限公司关于公司控股子公司替代发电关联交易的核查意见,finalpage/2015-08-29/1201518993.PDF
2015-08-29,建投能源：第七届董事会独立董事关于关联方资金占用和对外担保情况的独立意见,finalpage/2015-08-29/1201518994.PDF
2015-08-29,建投能源：第七届董事会独立董事对董事会聘任副总经理的独立意见,finalpage/2015-08-29/1201518995.PDF
2015-08-29,建投能源：第七届董事会独立董事对关联交易事项的独立意见,finalpage/2015-08-29/1201518996.PDF
2015-08-29,建投能源：关于对河北建投集团财务有限公司的风险持续评估报告（2015年1-6月）,finalpage/2015-08-29/1201518997.PDF
2015-09-16,建投能源：第七届董事会第十一次临时会议决议公告,finalpage/2015-09-16/1201597666.PDF
2015-10-20,建投能源：关于收到《中国证监会行政许可项目审查反馈意见通知书》的公告,finalpage/2015-10-20/1201708520.PDF
2015-10-23,建投能源：关于董事辞职的公告,finalpage/2015-10-23/1201715045.PDF
2015-10-26,建投能源：第七届董事会第十二次临时会议决议公告,finalpage/2015-10-26/1201718406.PDF
2015-10-26,建投能源：关于调整2015年非公开发行股票募集资金总额及用途的公告,finalpage/2015-10-26/1201718407.PDF
2015-10-26,建投能源：2015年非公开发行A股股票预案（修订稿）,finalpage/2015-10-26/1201718408.PDF
2015-10-26,建投能源：2015年非公开发行股票募集资金运用可行性报告（修订稿）,finalpage/2015-10-26/1201718409.PDF
2015-10-26,建投能源：关于非公开发行股票摊薄即期回报的风险提示及公司采取措施的公告,finalpage/2015-10-26/1201718410.PDF
2015-10-26,建投能源：关于最近五年被证券监管部门和交易所处罚或采取监管措施的情况及整改措施的公告,finalpage/2015-10-26/1201718411.PDF
2015-10-26,建投能源：第七届董事会独立董事关于调整公司非公开发行股票方案的独立意见,finalpage/2015-10-26/1201718412.PDF
2015-10-26,建投能源：关于对非公开发行股票申请文件反馈意见进行回复的公告,finalpage/2015-10-26/1201718413.PDF
2015-10-27,建投能源：2015年第三季度报告正文,finalpage/2015-10-27/1201726881.PDF
2015-10-27,建投能源：2015年第三季度报告全文,finalpage/2015-10-27/1201726882.PDF
2015-10-27,建投能源：第七届董事会独立董事对董事会提名董事候选人的独立意见,finalpage/2015-10-27/1201726883.PDF
2015-10-27,建投能源：关于召开2015年第三次临时股东大会的通知,finalpage/2015-10-27/1201726884.PDF
2015-10-27,建投能源：第七届董事会第八次会议决议公告,finalpage/2015-10-27/1201726885.PDF
2015-10-29,建投能源：关于非公开发行股票申请文件反馈意见补充回复的公告,finalpage/2015-10-29/1201735079.PDF
2015-10-29,建投能源：关于非公开发行股票申请文件反馈意见之回复（修订稿）,finalpage/2015-10-29/1201735080.PDF
2015-11-06,建投能源：关于召开2015年第三次临时股东大会提示性公告,finalpage/2015-11-06/1201755146.PDF
2015-11-13,建投能源：2015年第三次临时股东大会决议公告,finalpage/2015-11-13/1201766834.PDF
2015-11-13,建投能源：2015年第三次临时股东大会的法律意见书,finalpage/2015-11-13/1201766835.PDF
2015-11-19,建投能源：关于非公开发行股票申请获得中国证监会发审委审核通过的公告,finalpage/2015-11-19/1201777111.PDF
2015-12-05,建投能源：关于控股子公司开展大用户直供电业务的公告,finalpage/2015-12-05/1201808263.PDF
2015-12-09,建投能源：关于独立董事辞职的公告,finalpage/2015-12-09/1201820863.PDF
2015-12-22,建投能源：第七届董事会第十三次临时会议决议公告,finalpage/2015-12-22/1201850054.PDF
2015-12-22,建投能源：对外担保管理办法（2015年12月）,finalpage/2015-12-22/1201850055.PDF
2015-12-24,建投能源：关于非公开发行股票申请获得中国证监会核准的公告,finalpage/2015-12-24/1201854475.PDF
2016-01-15,建投能源：内幕信息知情人登记制度（2016年1月）,finalpage/2016-01-15/1201916694.PDF
2016-01-15,建投能源：第七届董事会第十四次临时会议决议公告,finalpage/2016-01-15/1201916695.PDF
2016-02-23,建投能源：关于筹划员工持股计划的提示性公告,finalpage/2016-02-23/1201990057.PDF
2016-02-27,建投能源：第七届董事会第十五次临时会议决议公告,finalpage/2016-02-27/1202004043.PDF
2016-02-27,建投能源：关于召开2016年第一次临时股东大会的通知,finalpage/2016-02-27/1202004044.PDF
2016-02-27,建投能源：独立董事候选人声明（曾鸣）,finalpage/2016-02-27/1202004045.PDF
2016-02-27,建投能源：第七届董事会独立董事对董事会提名独立董事候选人的独立意见,finalpage/2016-02-27/1202004046.PDF
2016-02-27,建投能源：独立董事提名人声明（一）,finalpage/2016-02-27/1202004047.PDF
2016-03-10,建投能源：关于召开2016年第一次临时股东大会的提示性公告,finalpage/2016-03-10/1202033020.PDF
2016-03-16,建投能源：2016年第一次临时股东大会决议公告,finalpage/2016-03-16/1202046555.PDF
2016-03-16,建投能源：2016年第一次临时股东大会的法律意见书,finalpage/2016-03-16/1202046556.PDF
2016-03-25,建投能源：第七届董事会第十六次临时会议决议公告,finalpage/2016-03-25/1202076612.PDF
2016-03-25,建投能源：关于参股投资乐亭菩提岛海上风电项目的关联交易公告,finalpage/2016-03-25/1202076613.PDF
2016-03-25,建投能源：关于参股中国海外基础设施开发投资有限公司的公告,finalpage/2016-03-25/1202076614.PDF
2016-03-25,建投能源：关于召开2016年第二次临时股东大会的通知,finalpage/2016-03-25/1202076615.PDF
2016-03-25,建投能源：第七届监事会第二次临时会议决议公告,finalpage/2016-03-25/1202076616.PDF
2016-03-25,建投能源：第七届董事会独立董事对关联交易事项的独立意见,finalpage/2016-03-25/1202076618.PDF
2016-03-25,建投能源：第七届董事会独立董事对第一期员工持股计划的独立意见,finalpage/2016-03-25/1202076619.PDF
2016-03-25,建投能源：第一期员工持股计划（草案）,finalpage/2016-03-25/1202076620.PDF
2016-03-25,建投能源：第一期员工持股计划（草案）摘要,finalpage/2016-03-25/1202076622.PDF
2016-04-01,建投能源：第一期员工持股计划（草案）法律意见书,finalpage/2016-04-01/1202122789.PDF
2016-04-06,建投能源：关于召开2016年第二次临时股东大会提示性公告,finalpage/2016-04-06/1202139683.PDF
2016-04-09,建投能源：2016年第一季度报告全文,finalpage/2016-04-09/1202156311.PDF
2016-04-09,建投能源：2015年度内部控制评价报告,finalpage/2016-04-09/1202156312.PDF
2016-04-09,建投能源：河北国华沧东发电有限责任公司审计报告及财务报表（2015年度）,finalpage/2016-04-09/1202156313.PDF
2016-04-09,建投能源：2015年年度报告摘要,finalpage/2016-04-09/1202156314.PDF
2016-04-09,建投能源：2016年第一季度报告正文,finalpage/2016-04-09/1202156315.PDF
2016-04-09,建投能源：2015年度独立董事述职报告（赵强）,finalpage/2016-04-09/1202156316.PDF
2016-04-09,建投能源：第七届董事会独立董事对2016年预计日常关联交易事项的独立意见,finalpage/2016-04-09/1202156317.PDF
2016-04-09,建投能源：第七届董事会独立董事对公司与河北建投集团财务有限公司持续关联交易的独立意见,finalpage/2016-04-09/1202156318.PDF
2016-04-09,建投能源：第七届董事会独立董事关于关联方资金占用和对外担保情况的独立意见,finalpage/2016-04-09/1202156319.PDF
2016-04-09,建投能源：第七届董事会独立董事对公司内部控制自我评价的独立意见,finalpage/2016-04-09/1202156320.PDF
2016-04-09,建投能源：招商证券股份有限公司关于公司发行股份购买资产并配套融资暨关联交易之2015年度持续督导工作报告暨持续督导总结报告,finalpage/2016-04-09/1202156321.PDF
2016-04-09,建投能源：招商证券股份有限公司关于公司2015年度内部控制评价报告的核查意见,finalpage/2016-04-09/1202156322.PDF
2016-04-09,建投能源：招商证券股份有限公司关于公司重大资产重组标的公司河北国华沧东发电有限责任公司2015年度业绩承诺情况专项说明,finalpage/2016-04-09/1202156323.PDF
2016-04-09,建投能源：关于公司在河北建投集团财务有限公司存贷款业务情况的专项审核报告,finalpage/2016-04-09/1202156324.PDF
2016-04-09,建投能源：关于公司重大资产重组标的公司河北国华沧东发电有限责任公司2015年度业绩承诺情况的鉴证报告,finalpage/2016-04-09/1202156325.PDF
2016-04-09,建投能源：内部控制审计报告（2015年度）,finalpage/2016-04-09/1202156326.PDF
2016-04-09,建投能源：2015年年度审计报告,finalpage/2016-04-09/1202156327.PDF
2016-04-09,建投能源：关于召开2015年度股东大会的通知,finalpage/2016-04-09/1202156328.PDF
2016-04-09,建投能源：第七届监事会第九次会议决议公告,finalpage/2016-04-09/1202156329.PDF
2016-04-09,建投能源：2016年日常关联交易预计公告,finalpage/2016-04-09/1202156330.PDF
2016-04-09,建投能源：关于公司2015年度控股股东及其他关联方资金占用情况专项说明,finalpage/2016-04-09/1202156331.PDF
2016-04-09,建投能源：2015年年度报告,finalpage/2016-04-09/1202156332.PDF
2016-04-09,建投能源：第七届董事会第九次会议决议公告,finalpage/2016-04-09/1202156333.PDF
2016-04-12,建投能源：2015年度监事会工作报告,finalpage/2016-04-12/1202163070.PDF
2016-04-12,建投能源：2015年度董事会工作报告,finalpage/2016-04-12/1202163071.PDF
2016-04-13,建投能源：2016年第二次临时股东大会决议公告,finalpage/2016-04-13/1202169743.PDF
2016-04-13,建投能源：2016年第二次临时股东大会的法律意见书,finalpage/2016-04-13/1202169744.PDF
2016-04-13,建投能源：第一期员工持股计划方案,finalpage/2016-04-13/1202169745.PDF
2016-04-23,建投能源：关于召开2015年度股东大会提示性公告,finalpage/2016-04-23/1202227672.PDF
2016-04-23,建投能源：关于公司第一期员工持股计划完成股票购买的公告,finalpage/2016-04-23/1202228078.PDF
2016-04-30,建投能源：2015年度股东大会决议公告,finalpage/2016-04-30/1202281516.PDF
2016-05-06,建投能源：2015年度权益分派实施公告,finalpage/2016-05-06/1202298719.PDF
2016-05-06,建投能源：2011年公司债券跟踪评级报告（2016）,finalpage/2016-05-06/1202299141.PDF
