,date,title,url
495,2013-03-28,海螺型材：2012年年度报告摘要,finalpage/2013-03-28/62285590.PDF
496,2013-03-28,海螺型材：2012年年度审计报告,finalpage/2013-03-28/62285601.PDF
497,2013-03-28,海螺型材：第六届董事会第六次会议决议公告,finalpage/2013-03-28/62285604.PDF
498,2013-03-28,海螺型材：关于召开2012年度股东大会的通知,finalpage/2013-03-28/62285605.PDF
499,2013-03-28,海螺型材：第六届监事会第四次会议决议公告,finalpage/2013-03-28/62285608.PDF
500,2013-03-28,海螺型材：控股股东及其他关联方资金占用情况的专项说明,finalpage/2013-03-28/62285611.PDF
501,2013-03-28,海螺型材：2012年度内部控制自我评价报告,finalpage/2013-03-28/62285613.PDF
502,2013-03-28,海螺型材：2012年年度报告,finalpage/2013-03-28/62285614.PDF
503,2013-03-28,海螺型材：关于子公司吸收合并的公告,finalpage/2013-03-28/62285615.PDF
504,2013-03-28,海螺型材：2013年度日常关联交易公告,finalpage/2013-03-28/62285617.PDF
505,2013-03-28,海螺型材：为子公司提供授信担保的公告,finalpage/2013-03-28/62285618.PDF
506,2013-03-28,海螺型材：对外投资公告,finalpage/2013-03-28/62285619.PDF
507,2013-03-28,海螺型材：独立董事候选人声明（李晓玲）,finalpage/2013-03-28/62285620.PDF
508,2013-03-28,海螺型材：独立董事关于相关事项的独立意见,finalpage/2013-03-28/62285621.PDF
509,2013-03-28,海螺型材：独立董事提名人声明,finalpage/2013-03-28/62285622.PDF
510,2013-03-28,海螺型材：内部控制审计报告,finalpage/2013-03-28/62285623.PDF
511,2013-03-28,海螺型材：独立董事2012年度述职报告（丁美彩）,finalpage/2013-03-28/62285624.PDF
512,2013-03-28,海螺型材：独立董事2012年度述职报告（项仕安）,finalpage/2013-03-28/62285625.PDF
513,2013-04-20,海螺型材：2013年第一季度报告正文,finalpage/2013-04-20/62390936.PDF
514,2013-04-20,海螺型材：2013年第一季度报告全文,finalpage/2013-04-20/62390938.PDF
515,2013-04-20,海螺型材：关于召开2012年度股东大会的通知,finalpage/2013-04-20/62390939.PDF
516,2013-04-20,海螺型材：关于延期召开2012年度股东大会的通知,finalpage/2013-04-20/62390940.PDF
517,2013-04-27,海螺型材：2012年公司债券受托管理人报告（2012年度）,finalpage/2013-04-27/62435835.PDF
518,2013-05-04,海螺型材：2012年度股东大会决议公告,finalpage/2013-05-04/62454885.PDF
519,2013-05-04,海螺型材：2012年度股东大会的法律意见书,finalpage/2013-05-04/62454886.PDF
520,2013-05-14,海螺型材：公司债券2013年跟踪评级报告,finalpage/2013-05-14/62486655.PDF
521,2013-06-22,海螺型材：2012年度权益分派实施公告,finalpage/2013-06-22/62602460.PDF
522,2013-08-12,海螺型材：2012年公司债券2013年付息公告,finalpage/2013-08-12/62924673.PDF
523,2013-08-22,海螺型材：2013年半年度报告摘要,finalpage/2013-08-22/62974021.PDF
524,2013-08-22,海螺型材：2013年半年度财务报告,finalpage/2013-08-22/62974027.PDF
525,2013-08-22,海螺型材：第六届董事会第八次会议决议公告,finalpage/2013-08-22/62974028.PDF
526,2013-08-22,海螺型材：2013年半年度报告,finalpage/2013-08-22/62974029.PDF
527,2013-08-22,海螺型材：独立董事关于六届八次董事会相关事项的独立意见,finalpage/2013-08-22/62974031.PDF
528,2013-09-18,海螺型材：关于子公司芜湖海螺泰森挤出装备有限公司第二股东变更的提示性公告,finalpage/2013-09-18/63093701.PDF
529,2013-09-18,海螺型材：关于收到政府补助的提示性公告,finalpage/2013-09-18/63093702.PDF
530,2013-10-22,海螺型材：2013年第三季度报告正文,finalpage/2013-10-22/63177570.PDF
531,2013-10-22,海螺型材：第六届董事会第九次会议决议公告,finalpage/2013-10-22/63177572.PDF
532,2013-10-22,海螺型材：2013年第三季度报告全文,finalpage/2013-10-22/63177573.PDF
533,2013-10-22,海螺型材：关于召开2013年第一次临时股东大会的通知,finalpage/2013-10-22/63177574.PDF
534,2013-10-22,海螺型材：独立董事关于提名周小川先生为公司董事候选人的独立意见,finalpage/2013-10-22/63177575.PDF
535,2013-11-09,海螺型材：关于调整子公司吸收合并基准日的公告,finalpage/2013-11-09/63252218.PDF
536,2013-11-09,海螺型材：2013年第一次临时股东大会决议公告,finalpage/2013-11-09/63252221.PDF
537,2013-11-09,海螺型材：2013年第一次临时股东大会的法律意见书,finalpage/2013-11-09/63252222.PDF
538,2013-12-03,海螺型材：提示性公告,finalpage/2013-12-03/63329786.PDF
539,2013-12-10,海螺型材：关于子公司股权转让完成并更名的提示性公告,finalpage/2013-12-10/63359758.PDF
540,2014-02-11,海螺型材：关于公司及相关方承诺事项履行情况的公告,finalpage/2014-02-11/63558091.PDF
541,2014-03-05,海螺型材：独立董事关于提前归还安徽海螺集团有限责任公司借款的独立意见,finalpage/2014-03-05/63636736.PDF
542,2014-03-05,海螺型材：第六届董事会第十次会议决议公告,finalpage/2014-03-05/63636737.PDF
543,2014-03-22,海螺型材：2013年年度报告摘要,finalpage/2014-03-22/63708774.PDF
544,2014-03-22,海螺型材：2013年年度审计报告（已取消）,finalpage/2014-03-22/63708797.PDF
545,2014-03-22,海螺型材：第六届董事会第十一次会议决议公告,finalpage/2014-03-22/63708802.PDF
546,2014-03-22,海螺型材：关于召开2013年度股东大会的通知,finalpage/2014-03-22/63708803.PDF
547,2014-03-22,海螺型材：第六届监事会第八次会议决议公告,finalpage/2014-03-22/63708804.PDF
548,2014-03-22,海螺型材：控股股东及其他关联方资金占用情况的专项说明,finalpage/2014-03-22/63708805.PDF
549,2014-03-22,海螺型材：2013年度内部控制自我评价报告,finalpage/2014-03-22/63708806.PDF
550,2014-03-22,海螺型材：2013年年度报告,finalpage/2014-03-22/63708807.PDF
551,2014-03-22,海螺型材：2014年度日常关联交易公告,finalpage/2014-03-22/63708808.PDF
552,2014-03-22,海螺型材：为子公司提供授信担保的公告,finalpage/2014-03-22/63708809.PDF
553,2014-03-22,海螺型材：独立董事2013年度述职报告（丁美彩）,finalpage/2014-03-22/63708810.PDF
554,2014-03-22,海螺型材：独立董事2013年度述职报告（李晓玲）,finalpage/2014-03-22/63708811.PDF
555,2014-03-22,海螺型材：独立董事2013年度述职报告（项仕安）,finalpage/2014-03-22/63708812.PDF
556,2014-03-22,海螺型材：独立董事候选人声明（陶成群）,finalpage/2014-03-22/63708813.PDF
557,2014-03-22,海螺型材：独立董事关于六届十一次董事会相关事项的独立意见,finalpage/2014-03-22/63708814.PDF
558,2014-03-22,海螺型材：独立董事提名人声明,finalpage/2014-03-22/63708815.PDF
559,2014-03-22,海螺型材：内部控制审计报告,finalpage/2014-03-22/63708817.PDF
560,2014-03-22,海螺型材：2013年年度审计报告（更新后）,finalpage/2014-03-22/63709553.PDF
561,2014-04-01,海螺型材：关于子公司收到政府补助的提示性公告,finalpage/2014-04-01/63762871.PDF
562,2014-04-19,海螺型材：2014年第一季度报告正文,finalpage/2014-04-19/63872503.PDF
563,2014-04-19,海螺型材：第六届董事会第十二次会议决议公告,finalpage/2014-04-19/63872505.PDF
564,2014-04-19,海螺型材：第六届监事会第九次会议决议公告,finalpage/2014-04-19/63872506.PDF
565,2014-04-19,海螺型材：2014年第一季度报告全文,finalpage/2014-04-19/63872507.PDF
566,2014-04-19,海螺型材：2013年度股东大会决议公告,finalpage/2014-04-19/63872508.PDF
567,2014-04-19,海螺型材：2013年度股东大会的法律意见书,finalpage/2014-04-19/63872509.PDF
568,2014-04-19,海螺型材：为子公司提供授信担保的公告,finalpage/2014-04-19/63872511.PDF
569,2014-04-19,海螺型材：关于使用部分自有闲置资金进行低风险理财产品投资的公告,finalpage/2014-04-19/63872512.PDF
570,2014-04-19,海螺型材：独立董事关于六届十二次董事会相关事项的独立意见,finalpage/2014-04-19/63872513.PDF
571,2014-04-24,海螺型材：2012年公司债券受托管理人报告（2013年度）,finalpage/2014-04-24/63905758.PDF
572,2014-04-24,海螺型材：2012年公司债券跟踪评级报告（2014）,finalpage/2014-04-24/63905759.PDF
573,2014-04-26,海螺型材：关于收到土地使用税奖励的提示性公告,finalpage/2014-04-26/63929093.PDF
574,2014-06-10,海螺型材：2013年度权益分派实施公告,finalpage/2014-06-10/64118650.PDF
575,2014-06-28,海螺型材：关于子公司吸收合并完成的提示性公告,finalpage/2014-06-28/1200014775.PDF
576,2014-08-09,海螺型材：2012年公司债券2014年付息公告,finalpage/2014-08-09/1200112140.PDF
577,2014-08-19,海螺型材：2014年半年度报告摘要,finalpage/2014-08-19/1200136531.PDF
578,2014-08-19,海螺型材：2014年半年度财务报告,finalpage/2014-08-19/1200136533.PDF
579,2014-08-19,海螺型材：第六届董事会第十三次会议决议公告,finalpage/2014-08-19/1200136534.PDF
580,2014-08-19,海螺型材：2014年半年度报告,finalpage/2014-08-19/1200136535.PDF
581,2014-08-19,海螺型材：独立董事关于六届十三次董事会相关事项的独立意见,finalpage/2014-08-19/1200136536.PDF
582,2014-08-19,海螺型材：理财产品管理暂行规定（2014年8月）,finalpage/2014-08-19/1200136537.PDF
583,2014-08-19,海螺型材：关于公司高级管理人员辞职的公告,finalpage/2014-08-19/1200136538.PDF
584,2014-08-19,海螺型材：关于公司董事辞职的公告,finalpage/2014-08-19/1200136539.PDF
585,2014-08-19,海螺型材：公司章程修改对照表,finalpage/2014-08-19/1200136540.PDF
586,2014-08-19,海螺型材：《股东大会议事规则》修改对照表,finalpage/2014-08-19/1200136541.PDF
587,2014-08-19,海螺型材：关于召开2014年第一次临时股东大会的通知,finalpage/2014-08-19/1200136542.PDF
588,2014-09-10,海螺型材：关于召开2014年第一次临时股东大会的提示性公告,finalpage/2014-09-10/1200219959.PDF
589,2014-09-13,海螺型材：2014年第一次临时股东大会的法律意见书,finalpage/2014-09-13/1200230763.PDF
590,2014-09-13,海螺型材：2014年第一次临时股东大会决议公告,finalpage/2014-09-13/1200230764.PDF
591,2014-09-13,海螺型材：公司章程（2014年9月）,finalpage/2014-09-13/1200230765.PDF
592,2014-09-13,海螺型材：股东大会议事规则（2014年9月）,finalpage/2014-09-13/1200230766.PDF
593,2014-10-18,海螺型材：2014年第三季度报告正文,finalpage/2014-10-18/1200309083.PDF
594,2014-10-18,海螺型材：2014年第三季度报告全文,finalpage/2014-10-18/1200309085.PDF
595,2014-10-29,海螺型材：关于独立董事辞职的公告,finalpage/2014-10-29/1200346617.PDF
596,2014-11-28,海螺型材：关于独立董事辞职的公告,finalpage/2014-11-28/1200421853.PDF
597,2014-12-18,海螺型材：重大事项停牌公告,finalpage/2014-12-18/1200474215.PDF
598,2014-12-25,海螺型材：重大事项继续停牌公告,finalpage/2014-12-25/1200493349.PDF
599,2014-12-30,海螺型材：重大事项进展暨复牌公告,finalpage/2014-12-30/1200504400.PDF
600,2015-01-06,海螺型材：对外投资公告,finalpage/2015-01-06/1200521286.PDF
601,2015-01-06,海螺型材：第六届董事会第十五次会议决议公告,finalpage/2015-01-06/1200521287.PDF
602,2015-03-24,海螺型材：关于召开2014年度股东大会通知的提示性公告,finalpage/2015-03-24/1200735539.PDF
603,2015-03-24,海螺型材：2014年年度报告摘要,finalpage/2015-03-24/1200733075.PDF
604,2015-03-24,海螺型材：2014年年度审计报告,finalpage/2015-03-24/1200733077.PDF
605,2015-03-24,海螺型材：第六届董事会第十六次会议决议公告,finalpage/2015-03-24/1200733078.PDF
606,2015-03-24,海螺型材：关于召开2014年度股东大会的通知,finalpage/2015-03-24/1200733079.PDF
607,2015-03-24,海螺型材：第六届监事会第十三次会议决议公告,finalpage/2015-03-24/1200733080.PDF
608,2015-03-24,海螺型材：控股股东及其他关联方资金占用情况的专项说明,finalpage/2015-03-24/1200733081.PDF
609,2015-03-24,海螺型材：2014年度内部控制自我评价报告,finalpage/2015-03-24/1200733082.PDF
610,2015-03-24,海螺型材：2014年年度报告,finalpage/2015-03-24/1200733083.PDF
611,2015-03-24,海螺型材：关于会计政策变更的公告,finalpage/2015-03-24/1200733084.PDF
612,2015-03-24,海螺型材：2015年度日常关联交易公告,finalpage/2015-03-24/1200733085.PDF
613,2015-03-24,海螺型材：为子公司提供授信担保的公告,finalpage/2015-03-24/1200733086.PDF
614,2015-03-24,海螺型材：对外投资公告,finalpage/2015-03-24/1200733087.PDF
615,2015-03-24,海螺型材：独立董事2014年度述职报告（丁美彩）,finalpage/2015-03-24/1200733088.PDF
616,2015-03-24,海螺型材：独立董事2014年度述职报告（李晓玲）,finalpage/2015-03-24/1200733089.PDF
617,2015-03-24,海螺型材：独立董事2014年度述职报告（陶成群）,finalpage/2015-03-24/1200733090.PDF
618,2015-03-24,海螺型材：独立董事2014年度述职报告（项仕安）,finalpage/2015-03-24/1200733091.PDF
619,2015-03-24,海螺型材：独立董事候选人声明（周泽将）,finalpage/2015-03-24/1200733092.PDF
620,2015-03-24,海螺型材：独立董事候选人声明（张光杰）,finalpage/2015-03-24/1200733093.PDF
621,2015-03-24,海螺型材：独立董事关于六届十六次董事会相关事项的独立意见,finalpage/2015-03-24/1200733094.PDF
622,2015-03-24,海螺型材：独立董事提名人声明（一）,finalpage/2015-03-24/1200733095.PDF
623,2015-03-24,海螺型材：独立董事提名人声明（二）,finalpage/2015-03-24/1200733096.PDF
624,2015-03-24,海螺型材：内部控制审计报告,finalpage/2015-03-24/1200733097.PDF
625,2015-04-14,海螺型材：关于召开2014年度股东大会暨实行累积投票制相关事项的提示性公告,finalpage/2015-04-14/1200828404.PDF
626,2015-04-18,海螺型材：2015年第一季度报告正文,finalpage/2015-04-18/1200866522.PDF
627,2015-04-18,海螺型材：第七届董事会第一次会议决议公告,finalpage/2015-04-18/1200866524.PDF
628,2015-04-18,海螺型材：第七届监事会第一次会议决议公告,finalpage/2015-04-18/1200866525.PDF
629,2015-04-18,海螺型材：2015年第一季度报告全文,finalpage/2015-04-18/1200866526.PDF
630,2015-04-18,海螺型材：2014年年度股东大会决议公告,finalpage/2015-04-18/1200866527.PDF
631,2015-04-18,海螺型材：2014年度股东大会的法律意见书,finalpage/2015-04-18/1200866528.PDF
632,2015-04-18,海螺型材：2015年第一次临时职工代表大会决议公告,finalpage/2015-04-18/1200866529.PDF
633,2015-04-25,海螺型材：关于政府回购子公司土地并签订《国有建设用地使用权收购协议》的公告,finalpage/2015-04-25/1200907213.PDF
634,2015-04-25,海螺型材：第七届监事会第二次会议决议公告,finalpage/2015-04-25/1200907214.PDF
635,2015-04-25,海螺型材：第七届董事会第二次会议决议公告,finalpage/2015-04-25/1200907215.PDF
636,2015-05-12,海螺型材：2012年公司债券跟踪评级报告（2015年）,finalpage/2015-05-12/1201003779.PDF
637,2015-05-13,海螺型材：关于子公司收到首期土地回购及补偿款的提示性公告,finalpage/2015-05-13/1201005832.PDF
638,2015-05-14,海螺型材：2012年公司债券受托管理人报告（2014年度）,finalpage/2015-05-14/1201011119.PDF
639,2015-06-06,海螺型材：关于收到土地使用税奖励的提示性公告,finalpage/2015-06-06/1201111416.PDF
640,2015-06-09,海螺型材：2014年度权益分派实施公告,finalpage/2015-06-09/1201121723.PDF
641,2015-06-17,海螺型材：关于控股股东减持股份的公告,finalpage/2015-06-17/1201159789.PDF
642,2015-06-17,海螺型材：股票交易异常波动公告,finalpage/2015-06-17/1201160211.PDF
643,2015-06-25,海螺型材：第七届董事会第三次会议决议公告,finalpage/2015-06-25/1201191679.PDF
644,2015-06-25,海螺型材：关于召开2015年第一次临时股东大会的通知,finalpage/2015-06-25/1201191680.PDF
645,2015-06-25,海螺型材：对外投资公告,finalpage/2015-06-25/1201191681.PDF
646,2015-06-25,海螺型材：独立董事候选人声明（雷华）,finalpage/2015-06-25/1201191682.PDF
647,2015-06-25,海螺型材：独立董事提名人声明,finalpage/2015-06-25/1201191683.PDF
648,2015-06-25,海螺型材：独立董事关于七届三次董事会相关事项的独立意见,finalpage/2015-06-25/1201191684.PDF
649,2015-07-06,海螺型材：关于“12海型债”票面利率调整和投资者回售实施办法的第一次提示性公告,finalpage/2015-07-06/1201237390.PDF
650,2015-07-07,海螺型材：关于“12海型债”票面利率调整和投资者回售实施办法的第二次提示性公告,finalpage/2015-07-07/1201248435.PDF
651,2015-07-08,海螺型材：关于“12海型债”票面利率调整和投资者回售实施办法的第三次提示性公告,finalpage/2015-07-08/1201253720.PDF
652,2015-07-10,海螺型材：“12海型债”回售申报结果的公告,finalpage/2015-07-10/1201267973.PDF
653,2015-07-11,海螺型材：关于维护公司股价稳定的公告,finalpage/2015-07-11/1201275118.PDF
654,2015-07-15,海螺型材：股票交易异常波动公告,finalpage/2015-07-15/1201294341.PDF
655,2015-07-17,海螺型材：关于公司控股股东一致行动人增持公司股份的提示性公告,finalpage/2015-07-17/1201305702.PDF
656,2015-07-18,海螺型材：关于召开2015年第一次临时股东大会的提示性公告,finalpage/2015-07-18/1201310630.PDF
657,2015-07-23,海螺型材：2015年第一次临时股东大会决议公告,finalpage/2015-07-23/1201334580.PDF
658,2015-07-23,海螺型材：2015年第一次临时股东大会的法律意见书,finalpage/2015-07-23/1201334581.PDF
659,2015-07-24,海螺型材：关于公司控股股东一致行动人增持公司股份的进展公告,finalpage/2015-07-24/1201338942.PDF
660,2015-07-31,海螺型材：关于控股股东一致行动人增持计划完成的公告,finalpage/2015-07-31/1201370817.PDF
661,2015-07-31,海螺型材：竞天公诚律师事务所关于公司控股股东的一致行动人增持股份的法律意见书,finalpage/2015-07-31/1201370818.PDF
662,2015-07-31,海螺型材：股票交易异常波动公告,finalpage/2015-07-31/1201370819.PDF
663,2015-08-07,海螺型材：2012年公司债券2015年付息公告,finalpage/2015-08-07/1201402264.PDF
664,2015-08-14,海螺型材：“12海型债”回售实施结果的公告,finalpage/2015-08-14/1201434842.PDF
665,2015-08-20,海螺型材：2015年半年度报告摘要,finalpage/2015-08-20/1201462434.PDF
666,2015-08-20,海螺型材：2015年半年度财务报告,finalpage/2015-08-20/1201462436.PDF
667,2015-08-20,海螺型材：第七届董事会第四次会议决议公告,finalpage/2015-08-20/1201462437.PDF
668,2015-08-20,海螺型材：2015年半年度报告,finalpage/2015-08-20/1201462438.PDF
669,2015-08-20,海螺型材：关于董事长、总经理调整的公告,finalpage/2015-08-20/1201462439.PDF
670,2015-08-20,海螺型材：关于子公司吸收合并的公告,finalpage/2015-08-20/1201462440.PDF
671,2015-08-20,海螺型材：关于召开2015年第二次临时股东大会的通知,finalpage/2015-08-20/1201462441.PDF
672,2015-08-20,海螺型材：独立董事关于七届四次董事会相关事项的独立意见,finalpage/2015-08-20/1201462442.PDF
673,2015-08-29,海螺型材：关于子公司收到土地回购及补偿余款的提示性公告,finalpage/2015-08-29/1201518436.PDF
674,2015-09-08,海螺型材：关于召开2015年第二次临时股东大会的提示性公告,finalpage/2015-09-08/1201560616.PDF
675,2015-09-11,海螺型材：2015年第二次临时股东大会决议公告,finalpage/2015-09-11/1201578296.PDF
676,2015-09-11,海螺型材：2015年第二次临时股东大会的法律意见书,finalpage/2015-09-11/1201578297.PDF
677,2015-10-20,海螺型材：2015年第三季度报告正文,finalpage/2015-10-20/1201708555.PDF
678,2015-10-20,海螺型材：2015年第三季度报告全文,finalpage/2015-10-20/1201708557.PDF
679,2015-10-20,海螺型材：第七届董事会第五次会议决议公告,finalpage/2015-10-20/1201708558.PDF
680,2015-10-20,海螺型材：第七届监事会第四次会议决议公告,finalpage/2015-10-20/1201708559.PDF
681,2015-12-29,海螺型材：关于调整子公司吸收合并基准日的公告,finalpage/2015-12-29/1201870532.PDF
682,2016-03-22,海螺型材：2015年年度报告摘要,finalpage/2016-03-22/1202064958.PDF
683,2016-03-22,海螺型材：第七届董事会第六次会议决议公告,finalpage/2016-03-22/1202064959.PDF
684,2016-03-22,海螺型材：关于召开2015年度股东大会通知,finalpage/2016-03-22/1202064961.PDF
685,2016-03-22,海螺型材：2015年度内部控制自我评价报告,finalpage/2016-03-22/1202064962.PDF
686,2016-03-22,海螺型材：控股股东及其他关联方资金占用情况的专项说明,finalpage/2016-03-22/1202064964.PDF
687,2016-03-22,海螺型材：2016年度日常关联交易公告,finalpage/2016-03-22/1202064967.PDF
688,2016-03-22,海螺型材：独立董事关于七届六次董事会相关事项的独立意见,finalpage/2016-03-22/1202064968.PDF
689,2016-03-22,海螺型材：内部控制审计报告,finalpage/2016-03-22/1202064969.PDF
690,2016-03-22,海螺型材：独立董事2015年度述职报告（张光杰）,finalpage/2016-03-22/1202064971.PDF
691,2016-03-22,海螺型材：独立董事2015年度述职报告（周泽将）,finalpage/2016-03-22/1202064972.PDF
692,2016-03-22,海螺型材：独立董事2015年度述职报告（雷华）,finalpage/2016-03-22/1202064973.PDF
693,2016-03-22,海螺型材：2015年年度审计报告,finalpage/2016-03-22/1202064974.PDF
694,2016-03-22,海螺型材：第七届监事会第五次会议决议公告,finalpage/2016-03-22/1202064976.PDF
695,2016-03-22,海螺型材：关于增加使用自有闲置资金进行委托理财额度的公告,finalpage/2016-03-22/1202064977.PDF
696,2016-03-22,海螺型材：2015年年度报告,finalpage/2016-03-22/1202064980.PDF
697,2016-03-22,海螺型材：为子公司提供授信担保的公告,finalpage/2016-03-22/1202064982.PDF
698,2016-04-15,海螺型材：关于召开2015年度股东大会的提示性公告,finalpage/2016-04-15/1202179468.PDF
699,2016-04-20,海螺型材：2016年第一季度报告正文,finalpage/2016-04-20/1202204765.PDF
700,2016-04-20,海螺型材：第七届董事会第七次会议决议公告,finalpage/2016-04-20/1202204766.PDF
701,2016-04-20,海螺型材：对外投资公告,finalpage/2016-04-20/1202204767.PDF
702,2016-04-20,海螺型材：2015年年度股东大会决议公告,finalpage/2016-04-20/1202204768.PDF
703,2016-04-20,海螺型材：2015年度股东大会的法律意见书,finalpage/2016-04-20/1202204769.PDF
704,2016-04-20,海螺型材：2016年第一季度报告全文,finalpage/2016-04-20/1202204771.PDF
705,2016-04-26,海螺型材：2012年公司债券跟踪评级报告（2016）,finalpage/2016-04-26/1202240600.PDF
706,2016-04-29,海螺型材：关于收到土地使用税奖励款的提示性公告,finalpage/2016-04-29/1202267383.PDF
707,2016-05-16,海螺型材：重大事项停牌公告,finalpage/2016-05-16/1202321973.PDF
708,2016-05-23,海螺型材：关于筹划重大资产重组停牌公告,finalpage/2016-05-23/1202333127.PDF
709,2016-05-25,海螺型材：2012年公司债券受托管理人报告（2015年度）,finalpage/2016-05-25/1202337378.PDF
710,2016-05-30,海螺型材：董事会关于重大资产重组停牌进展公告,finalpage/2016-05-30/1202342677.PDF
711,2016-06-06,海螺型材：关于重大资产重组停牌进展公告,finalpage/2016-06-06/1202355769.PDF
712,2016-06-07,海螺型材：关于子公司收到土地使用税奖励款的提示性公告,finalpage/2016-06-07/1202358703.PDF
713,2016-06-08,海螺型材：2015年度权益分派实施公告,finalpage/2016-06-08/1202360917.PDF
714,2016-06-14,海螺型材：关于子公司吸收合并完成的提示性公告,finalpage/2016-06-14/1202366775.PDF
715,2016-06-15,海螺型材：关于重大资产重组停牌进展公告,finalpage/2016-06-15/1202368692.PDF
716,2016-06-22,海螺型材：关于筹划重大资产重组停牌期满申请继续停牌公告,finalpage/2016-06-22/1202381004.PDF
717,2016-06-25,海螺型材：关于子公司收到政府补助款的提示性公告,finalpage/2016-06-25/1202408038.PDF
718,2016-06-29,海螺型材：关于重大资产重组停牌进展公告,finalpage/2016-06-29/1202433133.PDF
719,2016-06-29,海螺型材：关于子公司收到政府补助款的提示性公告,finalpage/2016-06-29/1202433134.PDF
720,2016-07-06,海螺型材：关于重大资产重组停牌进展公告,finalpage/2016-07-06/1202453022.PDF
721,2016-07-08,海螺型材：第七届董事会第八次会议决议公告,finalpage/2016-07-08/1202459356.PDF
722,2016-07-08,海螺型材：对外投资公告,finalpage/2016-07-08/1202459357.PDF
723,2016-07-13,海螺型材：独立董事关于终止筹划重大资产重组事项的独立意见,finalpage/2016-07-13/1202468168.PDF
724,2016-07-13,海螺型材：第七届董事会第九次会议决议公告,finalpage/2016-07-13/1202468169.PDF
725,2016-07-13,海螺型材：关于终止筹划重大资产重组事项暨公司股票复牌公告,finalpage/2016-07-13/1202468170.PDF
726,2016-07-21,海螺型材：关于公司办公地址变更的提示性公告,finalpage/2016-07-21/1202494542.PDF
