,date,title,url
0,2001-06-30,襄阳汽车轴承股份有限公司2001年中期报告,finalpage/2001-06-30/515000.html
1,2001-08-06,襄阳轴承2001年中期报告,finalpage/2001-08-06/604636.PDF
2,2002-01-17,襄阳轴承：2001年度预亏提示性公告,finalpage/2002-01-17/536345.html
3,2002-01-23,襄阳轴承：股票交易异常波动公告,finalpage/2002-01-23/537877.html
4,2002-03-25,襄阳轴承：股票交易实行特别处理公告,finalpage/2002-03-25/557118.html
5,2002-03-25,襄阳轴承2001年年度报告,finalpage/2002-03-25/557326.PDF
6,2002-03-25,襄阳轴承2001年年度报告摘要,finalpage/2002-03-25/558093.html
7,2002-03-26,襄阳轴承：股票交易实行特别处理,finalpage/2002-03-26/558250.html
8,2002-04-24,ST 襄 轴：通过2002年第一季度报告,finalpage/2002-04-24/578501.html
9,2002-04-24,ST 襄 轴2002年第一季度报告,finalpage/2002-04-24/578505.PDF
10,2002-04-26,ST 襄 轴：2001年度利润分配方案等,finalpage/2002-04-26/580149.html
11,2002-05-17,ST 襄 轴：募集资金承诺项目的进展情况等,finalpage/2002-05-17/599454.html
12,2002-06-15,ST 襄 轴：董事会决议公告,finalpage/2002-06-15/608072.html
13,2002-06-20,ST 襄 轴：2002年中期预亏公告,finalpage/2002-06-20/609155.html
14,2002-06-26,ST 襄 轴：股票交易异常波动公告,finalpage/2002-06-26/610652.html
15,2002-07-24,ST 襄 轴：召开公司2002年第一次临时股东大会的议案等,finalpage/2002-07-24/619121.html
16,2002-08-10,ST 襄 轴：公布2002年中期财务指标等,finalpage/2002-08-10/629484.html
17,2002-08-10,ST 襄 轴2002年中期报告,finalpage/2002-08-10/628998.PDF
18,2002-08-10,ST 襄 轴：2002年中期报告摘要,finalpage/2002-08-10/631789.html
19,2002-08-24,ST 襄 轴：选举周霁为董事长等,finalpage/2002-08-24/643214.html
20,2002-08-28,ST 襄 轴：更正公告,finalpage/2002-08-28/645707.html
21,2002-10-23,ST 襄 轴：董事会通过公司2002年第三季度报告,finalpage/2002-10-23/10028277.html
22,2002-10-23,ST 襄 轴2002年第三季度报告,finalpage/2002-10-23/10168088.PDF
23,2002-12-07,ST 襄 轴：预计2002年亏损,finalpage/2002-12-07/10084348.PDF
24,2002-12-27,ST 襄 轴：预计2002年亏损,finalpage/2002-12-27/10093801.PDF
25,2003-01-25,ST 襄 轴：董事风险提示公告,finalpage/2003-01-25/10119333.PDF
26,2003-02-25,ST 襄 轴：关于国有法人股被司法冻结的公告,finalpage/2003-02-25/10162254.html
27,2003-03-08,ST 襄 轴：风险提示,finalpage/2003-03-08/10207845.PDF
28,2003-04-01,ST 襄 轴：风险提示公告,finalpage/2003-04-01/10416975.html
29,2003-04-15,ST 襄 轴：二届十六次监事会决议公告,finalpage/2003-04-15/10514096.html
30,2003-04-15,ST 襄 轴：三届三次董事会会议决议公告,finalpage/2003-04-15/10514090.html
31,2003-04-15,ST 襄 轴：2002年度财务报告之审计报告,finalpage/2003-04-15/10514101.PDF
32,2003-04-15,ST 襄 轴：风险提示公告,finalpage/2003-04-15/10518109.html
33,2003-04-15,ST 襄 轴2002年年度报告,finalpage/2003-04-15/10513564.PDF
34,2003-04-15,ST 襄 轴2002年年度报告摘要,finalpage/2003-04-15/10514097.PDF
35,2003-04-16,ST 襄 轴：更正公告,finalpage/2003-04-16/10528660.html
36,2003-04-22,ST 襄 轴：股票暂停上市公告,finalpage/2003-04-22/10597282.html
37,2003-04-24,ST 襄 轴：三届四次董事会会议决议公告,finalpage/2003-04-24/10623077.html
38,2003-04-24,ST 襄 轴2003年第一季度报告,finalpage/2003-04-24/10623085.PDF
39,2003-05-13,ST 襄 轴：关于召开2002年年度股东大会的通知,finalpage/2003-05-13/10700374.html
40,2003-06-07,ST 襄 轴：资产处置进展公告,finalpage/2003-06-07/10726613.html
41,2003-06-10,ST 襄 轴：关于土地处置情况的补充说明,finalpage/2003-06-10/10727839.html
42,2003-06-13,ST 襄 轴：关于暂停上市期间工作进展的公告,finalpage/2003-06-13/10733787.html
43,2003-06-14,ST 襄 轴：2002年度股东大会决议公告,finalpage/2003-06-14/10734823.PDF
44,2003-07-02,ST 襄 轴：独立董事候选人声明,finalpage/2003-07-02/10750463.html
45,2003-07-02,ST 襄 轴：独立董事提名人声明,finalpage/2003-07-02/10750315.html
46,2003-07-02,ST 襄 轴：董事会临时会议决议公告,finalpage/2003-07-02/10750314.html
47,2003-07-10,ST 襄 轴：风险提示公告,finalpage/2003-07-10/10756378.html
48,2003-08-07,ST 襄 轴：二届十七次监事会决议公告,finalpage/2003-08-07/11094920.html
49,2003-08-07,ST 襄 轴：2003年半年度财务报告之审计报告,finalpage/2003-08-07/11104050.PDF
50,2003-08-07,ST 襄 轴：三届五次董事会会议决议暨召开股东大会通知,finalpage/2003-08-07/11094915.html
51,2003-08-07,ST 襄 轴：风险提示公告,finalpage/2003-08-07/11127756.html
52,2003-08-07,ST 襄 轴2003年半年度报告摘要,finalpage/2003-08-07/11094923.PDF
53,2003-08-07,ST 襄 轴2003年半年度报告,finalpage/2003-08-07/11092387.PDF
54,2003-08-14,ST 襄 轴：董事会关于向深圳证券交易所申请恢复上市的公告,finalpage/2003-08-14/11405907.html
55,2003-08-21,ST 襄 轴：关于深圳证券交易所决定受理本公司恢复上市申请的公告,finalpage/2003-08-21/12159550.html
56,2003-09-09,ST 襄 轴：2003年第一次临时股东大会决议公告,finalpage/2003-09-09/12519586.html
57,2003-10-11,ST 襄 轴2003年半年度报告补充公告,finalpage/2003-10-11/12872961.PDF
58,2003-10-25,ST 襄 轴：股票恢复上市并实施警示存在终止上市风险的特别处理公告,finalpage/2003-10-25/12991240.PDF
59,2003-10-28,ST 襄 轴：关于修改股票证券简称的公告,finalpage/2003-10-28/13008521.html
60,2003-10-28,ST 襄 轴：更正公告,finalpage/2003-10-28/13008518.html
61,2003-10-31,ST 襄 轴2003年第三季度报告,finalpage/2003-10-31/13035485.PDF
62,2003-11-08,*ST 襄轴：股票交易异常波动公告,finalpage/2003-11-08/13050203.html
63,2003-11-27,*ST 襄轴：董事会决议公告暨召开2003年第二次临时股东大会的通知,finalpage/2003-11-27/13095072.html
64,2003-11-27,*ST 襄轴：澄清公告,finalpage/2003-11-27/13095075.html
65,2003-11-27,*ST 襄轴：二届十八次监事会决议公告,finalpage/2003-11-27/13095073.html
66,2003-11-27,*ST 襄轴：关于出售武汉博大电气有限责任公司股权的公告,finalpage/2003-11-27/13095085.PDF
67,2003-11-27,*ST 襄轴：关于向控股股东转让部分资产及负债的关联交易公告,finalpage/2003-11-27/13095083.PDF
68,2003-12-25,*ST 襄轴：董事会重要事项公告,finalpage/2003-12-25/13293727.html
69,2003-12-30,*ST 襄轴：董事会2003年度业绩预盈公告,finalpage/2003-12-30/13336922.html
70,2003-12-30,*ST 襄轴：2003年第二次临时股东大会决议公告,finalpage/2003-12-30/13336923.html
71,2004-01-02,*ST 襄轴：董事会出售资产公告,finalpage/2004-01-02/13355830.html
72,2004-02-20,*ST 襄轴：三届八次董事会会议决议公告,finalpage/2004-02-20/13724531.html
73,2004-02-20,*ST 襄轴：监事会决议公告,finalpage/2004-02-20/13724528.html
74,2004-02-20,*ST 襄轴：2003年度财务报告之审计报告,finalpage/2004-02-20/13724500.PDF
75,2004-02-20,*ST 襄轴2003年年度报告摘要,finalpage/2004-02-20/13724492.PDF
76,2004-02-20,*ST 襄轴2003年年度报告,finalpage/2004-02-20/13724480.PDF
77,2004-02-26,*ST 襄轴：关于撤销退市风险警示的公告,finalpage/2004-02-26/13735241.html
78,2004-03-09,ST 襄 轴：关于变更公司对外联络电话的公告,finalpage/2004-03-09/13759718.html
79,2004-04-09,ST 襄 轴：关于本公司股东股权转让的提示性公告,finalpage/2004-04-09/13885475.html
80,2004-04-09,ST 襄 轴：襄阳汽车轴承集团公司持股变动报告书,finalpage/2004-04-09/13885484.PDF
81,2004-04-09,ST 襄 轴：收购报告书摘要,finalpage/2004-04-09/13885481.PDF
82,2004-04-15,ST 襄 轴2004年第一季度报告,finalpage/2004-04-15/13906933.PDF
83,2004-04-16,ST 襄 轴：董事会关于收购事宜致全体股东报告书,finalpage/2004-04-16/13913243.PDF
84,2004-04-23,ST 襄 轴：关于国有法人股股权转让获湖北省政府批准的提示性公告,finalpage/2004-04-23/13962800.html
85,2004-05-11,ST 襄 轴：三届十次董事会会议决议公告,finalpage/2004-05-11/14018853.html
86,2004-05-25,ST 襄 轴：董事会关于召开2003年年度股东大会的通知,finalpage/2004-05-25/14060267.html
87,2004-06-09,ST 襄 轴：关于股份转让补充合同的公告,finalpage/2004-06-09/14129132.html
88,2004-06-26,ST 襄 轴：二ＯＯ三年年度股东大会决议公告,finalpage/2004-06-26/14189677.html
89,2004-07-06,ST 襄 轴：2004年半年度业绩预警提示性公告,finalpage/2004-07-06/14219398.html
90,2004-07-26,ST 襄 轴：三届十一次董事会会议决议公告,finalpage/2004-07-26/14358396.html
91,2004-07-26,ST 襄 轴：二届二十次监事会决议公告,finalpage/2004-07-26/14358392.html
92,2004-07-26,ST 襄 轴：2004年半年度财务报告,finalpage/2004-07-26/14358606.PDF
93,2004-07-26,ST 襄 轴2004年半年度报告摘要,finalpage/2004-07-26/14358604.PDF
94,2004-07-26,ST 襄 轴2004年半年度报告,finalpage/2004-07-26/14358602.PDF
95,2004-08-05,ST 襄 轴：关于股份转让获国资委批复的公告,finalpage/2004-08-05/14397595.html
96,2004-09-30,ST 襄 轴：三届十二次董事会会议决议暨召开2004年第一次临时股东大会通知,finalpage/2004-09-30/14612309.html
97,2004-10-16,ST 襄 轴2004年第三季度报告,finalpage/2004-10-16/14661218.PDF
98,2004-10-27,ST 襄 轴：股票交易异常交易波动公告,finalpage/2004-10-27/14738108.html
99,2004-11-02,ST 襄 轴：二ＯＯ四年第一次临时股东大会决议公告,finalpage/2004-11-02/14769037.html
100,2004-12-31,ST 襄 轴：董事会决议公告暨召开2005年第一次临时股东大会的通知,finalpage/2004-12-31/14912792.html
101,2004-12-31,ST 襄 轴：关于修改《公司章程》的议案,finalpage/2004-12-31/14912787.html
102,2005-01-29,ST 襄 轴：2004年度业绩快报,finalpage/2005-01-29/14982793.PDF
103,2005-02-01,ST 襄 轴：2005年第一次临时股东大会决议公告,finalpage/2005-02-01/14988102.html
104,2005-04-15,ST 襄 轴：204年度财务报告之审计报告,finalpage/2005-04-15/15227765.PDF
105,2005-04-15,ST 襄 轴：监事会决议公告,finalpage/2005-04-15/15227373.html
106,2005-04-15,ST 襄 轴：三届十五次董事会会议决议公告,finalpage/2005-04-15/15227370.html
107,2005-04-15,ST 襄 轴204年年度报告摘要,finalpage/2005-04-15/15227759.PDF
108,2005-04-15,ST 襄 轴2004年年度报告,finalpage/2005-04-15/15227747.PDF
109,2005-04-22,ST 襄 轴2005年第一季度报告,finalpage/2005-04-22/15266221.PDF
110,2005-04-25,ST 襄 轴：关于撤销公司股票交易特别处理的公告,finalpage/2005-04-25/15271877.html
111,2005-05-20,襄阳轴承：三届十七次董事会会议决议公告暨召开2004年度股东大会通知,finalpage/2005-05-20/15403849.html
112,2005-05-20,襄阳轴承：监事会决议公告,finalpage/2005-05-20/15403848.html
113,2005-06-21,襄阳轴承：2004年度股东大会决议公告,finalpage/2005-06-21/15537137.html
114,2005-06-21,襄阳轴承：三届一次监事会会议决议公告,finalpage/2005-06-21/15537140.html
115,2005-07-12,襄阳轴承：业绩预告修正公告,finalpage/2005-07-12/15612087.html
116,2005-07-28,襄阳轴承：2005年半年度财务报告,finalpage/2005-07-28/15682290.PDF
117,2005-07-28,襄阳轴承：三届二次监事会决议公告,finalpage/2005-07-28/15682255.html
118,2005-07-28,襄阳轴承：三届十八次董事会会议决议公告,finalpage/2005-07-28/15682254.html
119,2005-07-28,襄阳轴承2005年半年度报告摘要,finalpage/2005-07-28/15682289.PDF
120,2005-07-28,襄阳轴承2005年半年度报告,finalpage/2005-07-28/15682288.PDF
121,2005-08-02,襄阳轴承：重要事项公告,finalpage/2005-08-02/15704898.html
122,2005-09-02,襄阳轴承：重要事项公告,finalpage/2005-09-02/15881101.html
123,2005-10-21,襄阳轴承2005年第三季度报告,finalpage/2005-10-21/16056905.PDF
124,2005-12-20,襄阳轴承：提示性公告,finalpage/2005-12-20/16302097.html
125,2006-01-07,襄阳轴承：收购报告书摘要,finalpage/2006-01-07/16357280.PDF
126,2006-01-07,襄阳轴承：关于本公司股东股份转让的提示性公告,finalpage/2006-01-07/16357279.html
127,2006-01-07,襄阳轴承：襄阳汽车轴承集团公司持股变动报告书,finalpage/2006-01-07/16357281.PDF
128,2006-01-12,襄阳轴承：三届董事会第二十次会议决议公告,finalpage/2006-01-12/16368705.html
129,2006-03-22,襄阳轴承：三届监事会第三次会议决议公告,finalpage/2006-03-22/16594285.html
130,2006-03-22,襄阳轴承：2005年度财务报告之审计报告,finalpage/2006-03-22/16594906.PDF
131,2006-03-22,襄阳轴承：三届董事会第二十一次会议决议公告,finalpage/2006-03-22/16594283.html
132,2006-03-22,襄阳轴承2005年年度报告摘要,finalpage/2006-03-22/16594903.PDF
133,2006-03-22,襄阳轴承2005年年度报告,finalpage/2006-03-22/16594885.PDF
134,2006-03-27,襄阳轴承：关于股权分置改革的提示性公告,finalpage/2006-03-27/16611045.html
135,2006-04-11,襄阳轴承：关于股权分置改革进展情况公告,finalpage/2006-04-11/16873732.html
136,2006-04-26,襄阳轴承2006年第一季度报告,finalpage/2006-04-26/16978835.PDF
137,2006-05-12,襄阳轴承：股权分置改革说明书,finalpage/2006-05-12/17064679.PDF
138,2006-05-12,襄阳轴承：关于股权分置改革相关问题的法律意见书,finalpage/2006-05-12/17064808.PDF
139,2006-05-12,襄阳轴承：股权分置改革之保荐意见书,finalpage/2006-05-12/17064807.PDF
140,2006-05-12,襄阳轴承：股权分置改革说明书（摘要）,finalpage/2006-05-12/17064806.PDF
141,2006-05-12,襄阳轴承：三届董事会临时会议决议公告暨召开2005年度股东大会通知,finalpage/2006-05-12/17064684.PDF
142,2006-05-12,襄阳轴承：董事会关于股权分置改革的投票委托征集函,finalpage/2006-05-12/17064683.PDF
143,2006-05-12,襄阳轴承：关于召开2006年第一次临时股东大会暨股权分置改革相关股东会议的通知,finalpage/2006-05-12/17064682.PDF
144,2006-05-13,襄阳轴承：关于进行股权分置改革网上投资者沟通会的公告,finalpage/2006-05-13/17073642.html
145,2006-05-20,襄阳轴承：关于股权分置改革方案沟通协商情况暨调整股权分置改革方案的公告,finalpage/2006-05-20/17131336.html
146,2006-05-20,襄阳轴承：关于取消2005年年度股东大会议案并接受股东提出新议案的公告,finalpage/2006-05-20/17131335.html
147,2006-05-20,襄阳轴承：股权分置改革相关问题的补充法律意见书,finalpage/2006-05-20/17131348.PDF
148,2006-05-20,襄阳轴承：股权分置改革之补充保荐意见,finalpage/2006-05-20/17131347.PDF
149,2006-05-20,襄阳轴承：股权分置改革修改方案之独立董事意见函,finalpage/2006-05-20/17131346.html
150,2006-05-20,襄阳轴承：股权分置改革说明书（修订稿）,finalpage/2006-05-20/17131355.PDF
151,2006-05-20,襄阳轴承：股权分置改革说明书摘要（修订稿）,finalpage/2006-05-20/17131354.PDF
152,2006-05-25,襄阳轴承：股票交易异常波动公告,finalpage/2006-05-25/17165358.html
153,2006-06-06,襄阳轴承：召开股权分置改革相关股东会议的第一次提示性公告,finalpage/2006-06-06/17246923.PDF
154,2006-06-09,襄阳轴承：关于股权分置改革方案获湖北省人民政府国资委批复的公告,finalpage/2006-06-09/17285094.html
155,2006-06-09,襄阳轴承：关于召开股权分置改革相关股东会议的第二次提示性公告,finalpage/2006-06-09/17285096.PDF
156,2006-06-14,襄阳轴承：2006年第一次临时股东大会决议暨相关股东会议表决结果公告,finalpage/2006-06-14/17489425.PDF
157,2006-06-15,襄阳轴承：2005年度股东大会决议公告,finalpage/2006-06-15/17504507.html
158,2006-06-17,襄阳轴承：关于国有法人股股权转让获湖北省政府批准的提示性公告,finalpage/2006-06-17/17519313.html
159,2006-07-10,襄阳轴承：股权分置改革方案实施公告,finalpage/2006-07-10/17676678.PDF
160,2006-07-10,襄阳轴承：转增股本实施公告,finalpage/2006-07-10/17676679.PDF
161,2006-07-13,襄阳轴承：股份结构变动公告,finalpage/2006-07-13/17694797.PDF
162,2006-07-13,襄阳轴承：股票简称变更及恢复交易的公告,finalpage/2006-07-13/17694808.PDF
163,2006-08-01,G 襄  轴：三届董事会临时会议决议,finalpage/2006-08-01/17884745.PDF
164,2006-08-10,G 襄  轴：2006年度中期报告之财务报告,finalpage/2006-08-10/17951817.PDF
165,2006-08-10,G 襄  轴2006年度中期报告,finalpage/2006-08-10/17951693.PDF
166,2006-08-10,G 襄  轴2006年度中期报告摘要,finalpage/2006-08-10/17951696.PDF
167,2006-10-20,襄阳轴承：2006年年度业绩预增公告,finalpage/2006-10-20/18473076.PDF
168,2006-10-20,襄阳轴承2006年第三季度报告,finalpage/2006-10-20/18473077.PDF
169,2007-03-10,襄阳轴承：2006年年度报告,finalpage/2007-03-10/21391885.PDF
170,2007-03-10,襄阳轴承：2006年年度报告摘要,finalpage/2007-03-10/21391906.PDF
171,2007-03-10,襄阳轴承：2006年年度财务报告之审计报告,finalpage/2007-03-10/21391908.PDF
172,2007-03-10,襄阳轴承：三届董事会第二十四次会议决议公告,finalpage/2007-03-10/21391910.PDF
173,2007-03-10,襄阳轴承：三届监事会第五次会议决议公告,finalpage/2007-03-10/21391912.PDF
174,2007-03-29,襄阳轴承：提示性公告,finalpage/2007-03-29/21854546.PDF
175,2007-03-31,襄阳轴承：股票异常波动补充公告,finalpage/2007-03-31/21904741.PDF
176,2007-04-11,襄阳轴承：提示性公告,finalpage/2007-04-11/22628221.PDF
177,2007-04-12,襄阳轴承：澄清公告,finalpage/2007-04-12/22640006.PDF
178,2007-04-20,襄阳轴承：2007年第一季度报告,finalpage/2007-04-20/22881587.PDF
179,2007-05-30,襄阳轴承：关于加强公司专项活动联系方式公告,finalpage/2007-05-30/23860595.PDF
180,2007-05-30,襄阳轴承：关于召开2006年年度股东大会的通知,finalpage/2007-05-30/23860619.PDF
181,2007-05-30,襄阳轴承：三届董事会第二十六次会议决议公告,finalpage/2007-05-30/23860596.PDF
182,2007-05-30,襄阳轴承：公司章程（修订稿）,finalpage/2007-05-30/23860605.PDF
183,2007-05-30,襄阳轴承：股东大会议事规则（2007年5月修订）,finalpage/2007-05-30/23860607.PDF
184,2007-05-30,襄阳轴承：董事会议事规则（2007年5月修订）,finalpage/2007-05-30/23860609.PDF
185,2007-05-30,襄阳轴承：信息披露制度（2007年5月修订）,finalpage/2007-05-30/23860610.PDF
186,2007-05-30,襄阳轴承：三届监事会第七次会议决议公告,finalpage/2007-05-30/23860611.PDF
187,2007-05-30,襄阳轴承：监事会议事规则（2007年5月修订）,finalpage/2007-05-30/23860613.PDF
188,2007-06-13,襄阳轴承：自愿性信息披露公告,finalpage/2007-06-13/29023196.PDF
189,2007-06-21,襄阳轴承：2007年中期业绩预增公告,finalpage/2007-06-21/29193538.PDF
190,2007-06-30,襄阳轴承：2006年度股东大会决议公告,finalpage/2007-06-30/29491138.PDF
191,2007-07-20,襄阳轴承：2007年1-3季度业绩预增公告,finalpage/2007-07-20/30086235.PDF
192,2007-07-20,襄阳轴承：2007年半年度报告摘要,finalpage/2007-07-20/30086238.PDF
193,2007-07-20,襄阳轴承：2007年半年度财务报告,finalpage/2007-07-20/30086245.PDF
194,2007-07-20,襄阳轴承：2007年半年度报告,finalpage/2007-07-20/30086249.PDF
195,2007-08-04,襄阳轴承：限售股份上市流通提示性公告,finalpage/2007-08-04/30464569.PDF
196,2007-08-09,襄阳轴承：三届董事会临时会议决议公告,finalpage/2007-08-09/30578402.PDF
197,2007-08-09,襄阳轴承：关于“加强上市公司治理专项活动”的自查报告,finalpage/2007-08-09/30578403.PDF
198,2007-08-09,襄阳轴承：关于“加强上市公司治理专项活动”的自查报告及整改计划,finalpage/2007-08-09/30578404.PDF
199,2007-10-18,襄阳轴承：2007年第三季度报告,finalpage/2007-10-18/33761645.PDF
200,2007-10-31,襄阳轴承：关于“加强上市公司治理专项活动”的整改报告,finalpage/2007-10-31/34939759.PDF
201,2007-10-31,襄阳轴承：三届董事会第二十九次会议决议公告,finalpage/2007-10-31/34939760.PDF
202,2007-10-31,襄阳轴承：信息披露管理制度,finalpage/2007-10-31/34939761.PDF
203,2007-10-31,襄阳轴承：募集资金管理制度,finalpage/2007-10-31/34939762.PDF
204,2007-10-31,襄阳轴承：投资者关系管理制度,finalpage/2007-10-31/34939763.PDF
205,2007-10-31,襄阳轴承：经理议事规则,finalpage/2007-10-31/34939764.PDF
206,2007-10-31,襄阳轴承：董事会专门委员会工作制度,finalpage/2007-10-31/34939765.PDF
207,2008-04-11,襄阳轴承：2007年年度报告摘要,finalpage/2008-04-11/38675911.PDF
208,2008-04-11,襄阳轴承：2007年年度财务报告之审计报告,finalpage/2008-04-11/38675913.PDF
209,2008-04-11,襄阳轴承：三届董事会第三十次会议决议公告,finalpage/2008-04-11/38675914.PDF
210,2008-04-11,襄阳轴承：三届监事会第十次会议决议公告,finalpage/2008-04-11/38675915.PDF
211,2008-04-11,襄阳轴承：2007年年度报告,finalpage/2008-04-11/38675916.PDF
212,2008-04-11,襄阳轴承：关于公司大股东及关联方资金占用情况的专项审计报告,finalpage/2008-04-11/38675917.PDF
213,2008-04-16,襄阳轴承：2008年第一季度业绩预增公告,finalpage/2008-04-16/38789653.PDF
214,2008-04-19,襄阳轴承：2008年第一季度报告,finalpage/2008-04-19/38903446.PDF
215,2008-04-24,襄阳轴承：三届董事会第三十二次会议决议公告,finalpage/2008-04-24/39077366.PDF
216,2008-06-07,襄阳轴承：关于召开2007年年度股东大会的通知,finalpage/2008-06-07/40330873.PDF
217,2008-06-28,襄阳轴承：2007年度股东大会决议公告,finalpage/2008-06-28/40850027.PDF
218,2008-06-28,襄阳轴承：2007年年度股东大会法律意见书,finalpage/2008-06-28/40850031.PDF
219,2008-07-16,襄阳轴承：重要事项公告,finalpage/2008-07-16/41276376.PDF
220,2008-07-18,襄阳轴承：自愿性信息披露公告,finalpage/2008-07-18/41367021.PDF
221,2008-07-23,襄阳轴承：2008年半年度财务报告,finalpage/2008-07-23/41462703.PDF
222,2008-07-23,襄阳轴承：2008年半年度报告摘要,finalpage/2008-07-23/41462650.PDF
223,2008-07-23,襄阳轴承：2008年半年度报告,finalpage/2008-07-23/41462651.PDF
224,2008-07-31,襄阳轴承：关于公司治理专项活动整改情况的说明,finalpage/2008-07-31/41688488.PDF
225,2008-07-31,襄阳轴承：三届董事会第三十五次会议决议公告,finalpage/2008-07-31/41688489.PDF
226,2008-10-14,襄阳轴承：2008年第三季度报告,finalpage/2008-10-14/44130859.PDF
227,2008-10-24,襄阳轴承：三届董事会第三十六次会议决议公告,finalpage/2008-10-24/44568998.PDF
228,2008-10-24,襄阳轴承：关于召开2008年第一次临时股东大会的通知,finalpage/2008-10-24/44568999.PDF
229,2008-10-24,襄阳轴承：监事会决议公告,finalpage/2008-10-24/44569000.PDF
230,2008-10-24,襄阳轴承：董事会换届独立董事意见,finalpage/2008-10-24/44569001.PDF
231,2008-11-11,襄阳轴承：四届监事会第一次会议决议公告,finalpage/2008-11-11/46204122.PDF
232,2008-11-11,襄阳轴承：四届董事会第一次会议决议公告,finalpage/2008-11-11/46204123.PDF
233,2008-11-11,襄阳轴承：2008年第一次临时股东大会决议公告,finalpage/2008-11-11/46204124.PDF
234,2008-11-11,襄阳轴承：2008年度第一次临时股东大会法律意见书,finalpage/2008-11-11/46204125.PDF
235,2008-11-11,襄阳轴承：四届董事会选举董事长之独立董事意见,finalpage/2008-11-11/46204126.PDF
236,2008-12-24,襄阳轴承：关于入选拟认定高新技术企业名单的提示性公告,finalpage/2008-12-24/47540999.PDF
237,2009-02-19,襄阳轴承：关于公司被认定为高新技术企业的公告,finalpage/2009-02-19/49314888.PDF
238,2009-04-01,襄阳轴承：2008年度业绩预告公告,finalpage/2009-04-01/50804227.PDF
239,2009-04-15,襄阳轴承：内部控制自我评价报告,finalpage/2009-04-15/51235205.PDF
240,2009-04-15,襄阳轴承：2008年年度报告摘要,finalpage/2009-04-15/51235206.PDF
241,2009-04-15,襄阳轴承：2008年度审计报告,finalpage/2009-04-15/51235208.PDF
242,2009-04-15,襄阳轴承：四届董事会第二次会议决议公告,finalpage/2009-04-15/51235209.PDF
243,2009-04-15,襄阳轴承：关于召开2008年度股东大会通知,finalpage/2009-04-15/51235210.PDF
244,2009-04-15,襄阳轴承：四届监事会第二次会议决议公告,finalpage/2009-04-15/51235211.PDF
245,2009-04-15,襄阳轴承：2008年年度报告,finalpage/2009-04-15/51235212.PDF
246,2009-04-15,襄阳轴承：关于公司2008年度控股股东及其他关联方资金占用情况的专项说明,finalpage/2009-04-15/51235213.PDF
247,2009-04-16,襄阳轴承：2009年度第一季度业绩预告,finalpage/2009-04-16/51322836.PDF
248,2009-04-23,襄阳轴承：2009年第一季度报告,finalpage/2009-04-23/51611780.PDF
249,2009-04-29,襄阳轴承：重大事项提示性公告,finalpage/2009-04-29/51904152.PDF
250,2009-05-09,襄阳轴承：2008年年度股东大会决议公告,finalpage/2009-05-09/52294421.PDF
251,2009-05-09,襄阳轴承：2008年年度股东大会法律意见书,finalpage/2009-05-09/52294422.PDF
252,2009-05-27,襄阳轴承：关于国有法人股股权无偿划转获湖北省人民政府批准的提示性公告,finalpage/2009-05-27/52913975.PDF
253,2009-06-02,襄阳轴承：三环集团公司详式权益变动报告书,finalpage/2009-06-02/53034186.PDF
