date,title,url
2001-06-30,石家庄国际大厦（集团）股份有限公司2001年中期报告,finalpage/2001-06-30/514338.html
2001-08-15,国际大厦2001年中期报告,finalpage/2001-08-15/604654.PDF
2001-09-19,石家庄国际大厦（集团）股份有限公司董事会关于王慧斌女士辞去公司股东监事职务的公告,finalpage/2001-09-19/504517.html
2001-10-09,国际大厦：2001年第八次临时股东大会决议公告,finalpage/2001-10-09/505366.html
2001-10-10,国际大厦：采取措施限期收回世贸广场欠款等提案未获通过,finalpage/2001-10-10/505531.html
2001-10-16,国际大厦：公司高级管理人员变更,finalpage/2001-10-16/509913.html
2001-10-19,国际大厦：采取措施限期收回世贸广场欠款的提案等,finalpage/2001-10-19/510179.html
2001-10-29,石家庄国际大厦股份有限公司三届董事会第三十四次会议决议公告,finalpage/2001-10-29/512225.html
2001-11-08,国际大厦：关于罢免单群英国际大厦董事长的提案等,finalpage/2001-11-08/516577.html
2001-11-12,国际大厦：关于全面妥善解决“世贸广场”欠款问题的提案等,finalpage/2001-11-12/517376.html
2001-11-20,国际大厦：关于召开2001年临时股东大会的通知等,finalpage/2001-11-20/519899.html
2001-11-27,国际大厦：更换会计师事务所的提案未获通过等,finalpage/2001-11-27/522111.html
2001-12-12,国际大厦：借款担保协议,finalpage/2001-12-12/527378.html
2001-12-17,国际大厦：全面妥善解决世贸广场欠款问题的提案,finalpage/2001-12-17/528818.html
2001-12-27,国际大厦：签署委托贷款协议,finalpage/2001-12-27/531971.html
2001-12-28,国际大厦：补选董事的议案,finalpage/2001-12-28/532374.html
2001-12-31,国际大厦：采取适当措施解决“世贸广场”欠款问题,finalpage/2001-12-31/532967.html
2002-01-15,国际大厦：修改公司章程的议案等,finalpage/2002-01-15/535621.html
2002-02-28,国际大厦：修改公司章程的议案等,finalpage/2002-02-28/545622.html
2002-03-14,国际大厦：2001年年度分配利润预案等,finalpage/2002-03-14/552465.PDF
2002-03-14,石家庄国际大厦（集团）股份有限公司2001年年度报告摘要,finalpage/2002-03-14/552598.html
2002-03-14,国际大厦2001年年度报告,finalpage/2002-03-14/552444.PDF
2002-03-26,国际大厦：征集独立董事提名的提案等,finalpage/2002-03-26/558236.html
2002-04-12,国际大厦：高管人员变更公告,finalpage/2002-04-12/568665.PDF
2002-04-19,国际大厦：2002年第一季度报告,finalpage/2002-04-19/574612.html
2002-04-19,国际大厦2002年第一季度报告,finalpage/2002-04-19/575049.PDF
2002-04-23,国际大厦：2001年度利润分配方案等,finalpage/2002-04-23/577535.html
2002-05-28,国际大厦：召开2002年第二次临时股东大会的议案等,finalpage/2002-05-28/603085.html
2002-05-28,国际大厦董事会议事规则,finalpage/2002-05-28/603088.PDF
2002-05-28,国际大厦监事会议事规则,finalpage/2002-05-28/603087.PDF
2002-05-28,国际大厦股东大会议事规则,finalpage/2002-05-28/603086.PDF
2002-06-11,国际大厦：分红派息公告,finalpage/2002-06-11/606863.html
2002-06-25,国际大厦：关于转让石家庄世贸广场有限公司股权的提案等,finalpage/2002-06-25/610229.PDF
2002-06-27,国际大厦：独立财务顾问报告,finalpage/2002-06-27/611158.PDF
2002-06-29,国际大厦：选举第三届董事会独立董事的议案等,finalpage/2002-06-29/612239.html
2002-07-27,国际大厦：关于转让石家庄物华大厦有限公司股权的提案等,finalpage/2002-07-27/620465.html
2002-08-15,国际大厦：公布2002年中期主要财务指标等,finalpage/2002-08-15/633558.html
2002-08-15,国际大厦：2002年中期报告摘要,finalpage/2002-08-15/634325.html
2002-08-15,国际大厦2002年中期报告,finalpage/2002-08-15/633641.PDF
2002-10-10,国际大厦：对外担保,finalpage/2002-10-10/10007561.html
2002-10-30,国际大厦：董事会通过2002年第三季度报告,finalpage/2002-10-30/10054059.html
2002-10-30,国际大厦2002年第三季度报告,finalpage/2002-10-30/10053130.PDF
2002-11-12,国际大厦：部分股权被质押,finalpage/2002-11-12/10068960.html
2002-11-13,国际大厦：股权变更,finalpage/2002-11-13/10069843.html
2002-11-16,国际大厦：更正公告,finalpage/2002-11-16/10072570.html
2003-01-02,国际大厦：第二大股东变更,finalpage/2003-01-02/10096547.PDF
2003-02-11,国际大厦：董事会第四十五次临时会议决议公告,finalpage/2003-02-11/10130296.html
2003-02-11,国际大厦：召开2003年第一次临时股东大会的通知,finalpage/2003-02-11/10130299.html
2003-02-11,国际大厦：关于转让世贸广场股权的关联交易公告,finalpage/2003-02-11/10130304.PDF
2003-02-11,国际大厦：关于转让物华大厦股权的关联交易公告,finalpage/2003-02-11/10130305.PDF
2003-02-11,国际大厦：独立董事关联交易事项的独立意见,finalpage/2003-02-11/10130301.html
2003-02-11,国际大厦：关联交易的独立财务顾问报告,finalpage/2003-02-11/10130306.PDF
2003-03-05,国际大厦：召开2003年第二次临时股东大会的通知,finalpage/2003-03-05/10192711.html
2003-03-05,国际大厦：第三届董事会第四十六次临时会议决议公告,finalpage/2003-03-05/10192705.html
2003-03-05,国际大厦：公司章程修正案（预案）,finalpage/2003-03-05/10192712.PDF
2003-03-14,国际大厦：2003年第一次临时股东大会决议公告,finalpage/2003-03-14/10235176.html
2003-04-05,国际大厦：转让股权过户手续完成公告,finalpage/2003-04-05/10445719.html
2003-04-08,国际大厦：2003年第二次临时股东大会决议公告,finalpage/2003-04-08/10451262.html
2003-04-16,国际大厦：第三届监事会第七次会议决议公告,finalpage/2003-04-16/10531319.html
2003-04-16,国际大厦：召开2002年度股东大会的通知,finalpage/2003-04-16/10531214.html
2003-04-16,国际大厦：第三届董事会第八次会议决议公告,finalpage/2003-04-16/10531196.html
2003-04-16,国际大厦：2002年度财务报告之审计报告,finalpage/2003-04-16/10531487.PDF
2003-04-16,国际大厦2002年年度报告,finalpage/2003-04-16/10530202.PDF
2003-04-16,国际大厦2002年年度报告摘要,finalpage/2003-04-16/10531368.PDF
2003-04-30,国际大厦：第三届董事会第九次会议决议公告,finalpage/2003-04-30/10687134.html
2003-04-30,国际大厦2003年第一季度报告,finalpage/2003-04-30/10687108.PDF
2003-05-13,国际大厦：关于取消原订2002年度股东大会的紧急公告,finalpage/2003-05-13/10700395.html
2003-05-30,国际大厦：重大资产购买之独立财务顾问报告,finalpage/2003-05-30/10718850.PDF
2003-05-30,国际大厦：重大资产购买的法律意见书,finalpage/2003-05-30/10718847.PDF
2003-05-30,国际大厦：资产评估报告书摘要,finalpage/2003-05-30/10718846.PDF
2003-05-30,国际大厦：重大资产购买报告书,finalpage/2003-05-30/10718845.PDF
2003-05-30,国际大厦：第三届监事会第一次临时会议决议公告,finalpage/2003-05-30/10718782.html
2003-05-30,国际大厦：第三届董事会第四十七次临时会议决议公告,finalpage/2003-05-30/10718784.PDF
2003-06-10,国际大厦：股份质押公告,finalpage/2003-06-10/10727853.html
2003-06-26,国际大厦：关于召开2002年度股东大会的通知,finalpage/2003-06-26/10745802.PDF
2003-06-26,国际大厦：独立董事提名人声明,finalpage/2003-06-26/10745799.PDF
2003-06-26,国际大厦：第三届董事会第四十八次临时会议决议公告,finalpage/2003-06-26/10745795.PDF
2003-07-18,国际大厦：停牌公告,finalpage/2003-07-18/10770190.html
2003-07-30,国际大厦：第四届监事会第一次临时会议决议公告,finalpage/2003-07-30/10857166.html
2003-07-30,国际大厦：独立董事关于董事会聘任公司高级管理人员的独立意见,finalpage/2003-07-30/10857165.html
2003-07-30,国际大厦：第四届董事会第一次临时会议决议公告,finalpage/2003-07-30/10857164.html
2003-07-30,国际大厦：2002年度股东大会决议公告,finalpage/2003-07-30/10857168.html
2003-08-13,国际大厦：第四届董事会第一次临时会议决议公告,finalpage/2003-08-13/11383005.html
2003-08-13,国际大厦：2003年半年度财务报告,finalpage/2003-08-13/11382992.PDF
2003-08-13,国际大厦2003年半年度报告,finalpage/2003-08-13/11382977.PDF
2003-08-13,国际大厦2003年半年度报告摘要,finalpage/2003-08-13/11382984.PDF
2003-09-16,国际大厦：第四届董事会第二次临时会议决议公告,finalpage/2003-09-16/12711187.html
2003-10-21,国际大厦：重大资产购买之独立财务顾问报告,finalpage/2003-10-21/12976198.PDF
2003-10-21,国际大厦：重大资产购买的补充法律意见书,finalpage/2003-10-21/12976193.PDF
2003-10-21,国际大厦：重大资产购买报告书（草案）,finalpage/2003-10-21/12976187.PDF
2003-10-21,国际大厦：第四届董事会第三次临时会议决议暨召开股东大会通知,finalpage/2003-10-21/12976184.PDF
2003-10-21,国际大厦：关于股票复牌的特别提示,finalpage/2003-10-21/12976180.html
2003-10-27,国际大厦2003年第三季度报告,finalpage/2003-10-27/12990952.PDF
2003-11-22,国际大厦：2003年第三次临时股东大会决议公告,finalpage/2003-11-22/13070474.html
2003-11-29,国际大厦：董事会关于重大资产购买事项进展情况的公告,finalpage/2003-11-29/13097499.html
2004-02-05,国际大厦：关于重大资产购买实施结果的法律意见书,finalpage/2004-02-05/13569492.html
2004-02-05,国际大厦：董事会关于重大资产购买事项实施结果的公告,finalpage/2004-02-05/13569456.html
2004-03-02,国际大厦：石家庄鸿基投资有限责任公司持股变动报告书,finalpage/2004-03-02/13747291.PDF
2004-03-25,国际大厦董事会专门委员会工作细则,finalpage/2004-03-25/13935922.PDF
2004-03-26,国际大厦：第四届监事会第一次会议决议公告,finalpage/2004-03-26/13829854.html
2004-03-26,国际大厦：2003年度财务报告之审计报告,finalpage/2004-03-26/13827617.PDF
2004-03-26,国际大厦：第四届董事会第二次会议决议公告暨召开2003年度股东大会的通知,finalpage/2004-03-26/13829853.PDF
2004-03-26,国际大厦2003年年度报告,finalpage/2004-03-26/13827612.PDF
2004-03-26,国际大厦2003年年度报告摘要,finalpage/2004-03-26/13827616.PDF
2004-04-19,国际大厦2004年第一季度报告,finalpage/2004-04-19/13923953.PDF
2004-04-20,国际大厦董事会专门委员会工作细则,finalpage/2004-04-20/13936453.PDF
2004-04-28,国际大厦：2003年年度股东大会决议公告,finalpage/2004-04-28/13995351.html
2004-05-11,国际大厦：关于签署综合授信合同的公告,finalpage/2004-05-11/14018837.html
2004-06-01,国际大厦：变更证券简称公告,finalpage/2004-06-01/14109942.html
2004-06-25,建投能源：关于公司控股子公司电价调整的公告,finalpage/2004-06-25/14187760.html
2004-06-26,建投能源：关于签署《职工安置协议书》的公告,finalpage/2004-06-26/14189822.html
2004-08-11,建投能源：第四届监事会第二次会议决议公告,finalpage/2004-08-11/14421032.html
2004-08-11,建投能源：第四届董事会第四次会议决议公告,finalpage/2004-08-11/14421028.html
2004-08-11,建投能源：2004年半年度财务报告,finalpage/2004-08-11/14420667.PDF
2004-08-11,建投能源2004年半年度报告摘要,finalpage/2004-08-11/14420664.PDF
2004-08-11,建投能源2004年半年度报告,finalpage/2004-08-11/14420634.PDF
2004-10-21,建投能源2004年第三季度报告,finalpage/2004-10-21/14698612.PDF
2005-01-04,建投能源：董事会公告,finalpage/2005-01-04/14915963.html
2005-02-28,建投能源：第四届监事会第六次会议决议公告,finalpage/2005-02-28/15042979.html
2005-02-28,建投能源：第四届董事会第六次会议决议公告暨召开2004年度股东大会的通知,finalpage/2005-02-28/15042991.html
2005-02-28,建投能源：2004年年度财务报告之审计报告,finalpage/2005-02-28/15043063.PDF
2005-02-28,建投能源2004年年度报告摘要,finalpage/2005-02-28/15043059.PDF
2005-02-28,建投能源2004年年度报告,finalpage/2005-02-28/15043057.PDF
2005-03-31,建投能源：二○○四年年度股东大会的法律意见书,finalpage/2005-03-31/15162824.html
2005-03-31,建投能源：二○○四年年度股东大会决议公告,finalpage/2005-03-31/15162761.html
2005-04-08,建投能源：2005年第一季度业绩预亏公告,finalpage/2005-04-08/15195402.html
2005-04-13,建投能源：第四届董事会第七次会议决议公告暨召开2005年第一次临时股东大会的通知,finalpage/2005-04-13/15215757.PDF
2005-04-13,建投能源2005年第一季度报告,finalpage/2005-04-13/15215751.PDF
2005-04-27,建投能源：关于公司控股子公司电价调整的公告,finalpage/2005-04-27/15299227.html
2005-05-18,建投能源：2005年第一次临时股东大会决议公告,finalpage/2005-05-18/15394198.html
2005-05-18,建投能源：2005年第一次临时股东大会的法律意见书,finalpage/2005-05-18/15394199.html
2005-05-19,建投能源：2004年度分红派息、资本公积金转增股本实施公告,finalpage/2005-05-19/15398613.PDF
2005-07-01,建投能源公司章程（2005年5月）,finalpage/2005-07-01/15576718.PDF
2005-07-27,建投能源：2005年半年度财务报告,finalpage/2005-07-27/15676310.PDF
2005-07-27,建投能源：第四届董事会第八次会议决议公告,finalpage/2005-07-27/15676515.html
2005-07-27,建投能源2005年半年度报告摘要,finalpage/2005-07-27/15676308.PDF
2005-07-27,建投能源2005年半年度报告,finalpage/2005-07-27/15676305.PDF
2005-09-01,建投能源：关于公司股东转让法人股的提示性公告,finalpage/2005-09-01/15875580.html
2005-09-01,建投能源：石家庄鸿基投资有限责任公司关于转让所持建投能源股份的公告,finalpage/2005-09-01/15875581.html
2005-09-01,建投能源：河北省建设投资公司持股变动报告书,finalpage/2005-09-01/15875582.PDF
2005-09-12,建投能源：董事会关于进行股权分置改革的提示性公告,finalpage/2005-09-12/15911806.html
2005-09-13,建投能源：股权分置改革说明书,finalpage/2005-09-13/15919389.PDF
2005-09-13,建投能源：股权分置改革之保荐意见,finalpage/2005-09-13/15919419.PDF
2005-09-13,建投能源：股权分置改革说明书（摘要）,finalpage/2005-09-13/15919407.PDF
2005-09-13,建投能源：董事会公开征集投票权报告书,finalpage/2005-09-13/15919397.PDF
2005-09-13,建投能源：关于召开相关股东会议的通知,finalpage/2005-09-13/15919402.PDF
2005-09-13,建投能源：独立董事关于公司实施股权分置改革的独立意见,finalpage/2005-09-13/15919383.html
2005-09-13,建投能源：股权分置改革的法律意见书,finalpage/2005-09-13/15919411.PDF
2005-09-15,建投能源：关于举行股权分置改革投资者恳谈会的通知,finalpage/2005-09-15/15929389.html
2005-09-22,建投能源：股权分置改革说明书（修改稿）,finalpage/2005-09-22/15957960.PDF
2005-09-22,建投能源：股权分置改革说明书摘要（修改稿）,finalpage/2005-09-22/15957963.PDF
2005-09-22,建投能源：独立董事关于公司实施股权分置改革的独立意见,finalpage/2005-09-22/15957953.html
2005-09-22,建投能源：股权分置改革之补充保荐意见,finalpage/2005-09-22/15957958.PDF
2005-09-22,建投能源：股权分置改革的补充法律意见书,finalpage/2005-09-22/15957957.PDF
2005-09-22,建投能源：关于股权分置改革方案沟通情况暨调整股权分置改革方案的公告,finalpage/2005-09-22/15957956.html
2005-10-13,建投能源：董事会关于召开相关股东会议的第一次提示公告,finalpage/2005-10-13/16017075.PDF
2005-10-15,建投能源：关于召开股权分置改革网上交流会的公告,finalpage/2005-10-15/16028029.html
2005-10-25,建投能源：董事会关于股权分置改革方案获得国资委批准的公告,finalpage/2005-10-25/16080180.html
2005-10-25,建投能源：董事会关于召开相关股东会议的第二次提示公告,finalpage/2005-10-25/16080182.PDF
2005-10-28,建投能源：股权分置改革相关股东会议表决结果公告,finalpage/2005-10-28/16116291.PDF
2005-10-28,建投能源：股权分置改革相关股东会议的法律意见书,finalpage/2005-10-28/16116290.PDF
2005-10-29,建投能源2005年第三季度报告,finalpage/2005-10-29/16131532.PDF
2005-11-15,建投能源：董事会关于公司股东股份转让完成过户登记的公告,finalpage/2005-11-15/16193788.html
2005-11-24,建投能源：股权分置改革实施公告,finalpage/2005-11-24/16221681.PDF
2005-11-28,建投能源：关于股票简称变更的公告,finalpage/2005-11-28/16229468.html
2005-11-29,G  建 投：股份结构变动公告,finalpage/2005-11-29/16234019.PDF
2005-12-01,G  建 投：关于控股股东增持公司股份的公告,finalpage/2005-12-01/16251474.html
2005-12-09,G  建 投：关于控股股东增持公司股份的公告,finalpage/2005-12-09/16274641.html
2006-02-07,G 建  投：关于控股股东增持承诺履行情况的公告,finalpage/2006-02-07/16418877.PDF
2006-03-18,G 建  投：第四届董事会独立董事对公司董事会换届选举的意见,finalpage/2006-03-18/16581155.html
2006-03-18,G 建  投：2005年度财务报告之审计报告,finalpage/2006-03-18/16582184.PDF
2006-03-18,G 建  投：关于召开2005年年度股东大会的通知,finalpage/2006-03-18/16581166.PDF
2006-03-18,G 建  投：关于公司控股股东及其他关联方占用资金情况的专项说明,finalpage/2006-03-18/16581165.PDF
2006-03-18,G 建  投：第四届董事会第十次会议决议公告,finalpage/2006-03-18/16581160.html
2006-03-18,G 建  投：独立董事候选人声明,finalpage/2006-03-18/16581126.html
2006-03-18,G 建  投：独立董事提名人声明,finalpage/2006-03-18/16581125.html
2006-03-18,G 建  投：第四届监事会第四次会议决议公告,finalpage/2006-03-18/16581119.html
2006-03-18,G 建  投2005年年度报告摘要,finalpage/2006-03-18/16582182.PDF
2006-03-18,G 建  投2005年年度报告,finalpage/2006-03-18/16582166.PDF
2006-03-30,G 建  投：董事会公告,finalpage/2006-03-30/16634604.html
2006-04-05,G 建  投：第四届董事会第三次临时会议决议公告暨召开2006年第一次临时股东大会的通知,finalpage/2006-04-05/16849379.PDF
2006-04-05,G 建  投：第四届监事会第一次临时会议决议公告,finalpage/2006-04-05/16849376.html
2006-04-05,G 建  投：独立董事独立意见书,finalpage/2006-04-05/16849373.html
2006-04-05,G 建  投：关于对前次募集资金使用情况无法发表意见的说明,finalpage/2006-04-05/16849370.html
2006-04-05,G 建  投：董事会关于前次募集资金使用情况的说明,finalpage/2006-04-05/16849369.html
2006-04-05,G 建  投：关于资产收购暨关联交易的公告,finalpage/2006-04-05/16849380.PDF
2006-04-05,G 建  投：关于2006年增发新股募集资金运用可行性研究报告,finalpage/2006-04-05/16849383.PDF
2006-04-08,G 建  投：第四届董事会第四次临时会议决议公告暨2005年年度股东大会的补充通知,finalpage/2006-04-08/16864873.html
2006-04-08,G 建  投公司章程（草案）,finalpage/2006-04-08/16864874.PDF
2006-04-08,G 建  投股东大会议事规则（草案）,finalpage/2006-04-08/16864875.PDF
2006-04-19,G 建  投：2005年年度股东大会决议公告,finalpage/2006-04-19/16925216.PDF
2006-04-19,G 建  投：关于2005年年度股东大会的法律意见书,finalpage/2006-04-19/16925243.PDF
2006-04-20,G 建  投：第五届董事会第一次临时会议决议公告,finalpage/2006-04-20/16933044.html
2006-04-20,G 建  投：第五届监事会第一次临时会议决议公告,finalpage/2006-04-20/16933046.html
2006-04-20,G 建  投2006年第一季度报告,finalpage/2006-04-20/16933037.PDF
2006-04-28,G 建  投：关于召开2006年第一次临时股东大会的提示公告,finalpage/2006-04-28/16996271.PDF
2006-04-29,G 建  投：关于2006年第一次临时股东大会的补充通知,finalpage/2006-04-29/17009224.PDF
2006-05-10,G 建  投：2006年第一次临时股东大会决议公告,finalpage/2006-05-10/17045497.PDF
2006-05-10,G 建  投：关于2006年第一次临时股东大会的法律意见书,finalpage/2006-05-10/17045496.PDF
2006-05-19,G 建  投：澄清公告,finalpage/2006-05-19/17122392.html
2006-06-01,G 建  投：2005年度分红派息公告,finalpage/2006-06-01/17218404.html
2006-06-01,G 建  投：第五届董事会第二次临时会议决议公告,finalpage/2006-06-01/17218052.html
2006-06-01,G 建  投募集资金管理办法,finalpage/2006-06-01/17218401.PDF
2006-07-03,G 建  投：关于公司控股子公司电价调整的公告,finalpage/2006-07-03/17623560.PDF
2006-08-01,G 建  投：第五届董事会第一次会议决议公告,finalpage/2006-08-01/17884942.PDF
2006-08-01,G 建  投：2006年度中期报告之财务报告,finalpage/2006-08-01/17886105.PDF
2006-08-01,G 建  投：第五届监事会第一次会议决议公告,finalpage/2006-08-01/17886249.PDF
2006-08-01,G 建  投2006年度中期报告,finalpage/2006-08-01/17885976.PDF
2006-08-01,G 建  投2006年度中期报告摘要,finalpage/2006-08-01/17886032.PDF
2006-08-05,G 建  投：董事会公告,finalpage/2006-08-05/17920285.PDF
2006-10-21,建投能源：关于控股子公司西柏坡发电公司与西柏坡第二发电公司共用生产设施事项的关联交易公告,finalpage/2006-10-21/18489371.PDF
2006-10-21,建投能源：第五届董事会第二次会议决议公告,finalpage/2006-10-21/18489596.PDF
2006-10-21,建投能源：第五届监事会第二次会议决议公告,finalpage/2006-10-21/18489701.PDF
2006-10-21,建投能源2006年第三季度报告,finalpage/2006-10-21/18489800.PDF
2006-11-07,建投能源：第五届董事会第三次临时会议决议公告,finalpage/2006-11-07/18646578.PDF
2006-11-22,建投能源：关于股东偿还垫付对价的公告,finalpage/2006-11-22/19019849.PDF
2006-11-24,建投能源：限售股份上市流通提示性公告,finalpage/2006-11-24/19074779.PDF
2007-01-12,建投能源：股票交易异常波动公告,finalpage/2007-01-12/20106078.PDF
2007-01-31,建投能源：关于非公开发行股票申请获得核准的公告,finalpage/2007-01-31/20593446.PDF
2007-02-28,建投能源：关于非公开发行股票申请获得中国证监会核准的公告,finalpage/2007-02-28/21063249.PDF
2007-03-12,建投能源：关于公司非公开发行过程和认购对象合规性的法律意见书,finalpage/2007-03-12/21392387.PDF
2007-03-12,建投能源：非公开发行股票发行情况报告暨上市公告书,finalpage/2007-03-12/21392407.PDF
2007-03-12,建投能源：非公开发行股票发行情况报告书,finalpage/2007-03-12/21392408.PDF
2007-03-12,建投能源：2006年增资发行新股股份之补充法律意见书,finalpage/2007-03-12/21392415.PDF
2007-03-12,建投能源：证券发行保荐书,finalpage/2007-03-12/21392436.PDF
2007-03-12,建投能源：中银国际证券有限责任公司关于公司非公开发行股票上市推荐书,finalpage/2007-03-12/21392476.PDF
2007-03-12,建投能源：2006年增资发行新股股份法律意见书,finalpage/2007-03-12/21392507.PDF
2007-03-13,建投能源：股东持股变动报告书,finalpage/2007-03-13/21424465.PDF
2007-03-13,建投能源：详式权益变动报告书,finalpage/2007-03-13/21424466.PDF
2007-03-27,建投能源：2006年年度报告,finalpage/2007-03-27/21771610.PDF
2007-03-27,建投能源：2006年年度报告摘要,finalpage/2007-03-27/21764544.PDF
2007-03-27,建投能源：2006年度财务报告之审计报告,finalpage/2007-03-27/21764829.PDF
2007-03-27,建投能源：第五届董事会第三次会议决议公告,finalpage/2007-03-27/21767230.PDF
2007-03-27,建投能源：关于召开2006年年度股东大会的通知,finalpage/2007-03-27/21769803.PDF
2007-03-27,建投能源：第五届监事会第三次会议决议公告,finalpage/2007-03-27/21770861.PDF
2007-04-19,建投能源：2006年年度股东大会的法律意见书,finalpage/2007-04-19/22837259.PDF
2007-04-19,建投能源：2006年年度股东大会决议公告,finalpage/2007-04-19/22837260.PDF
2007-04-21,建投能源：关于控股股东增持股份解除锁定的提示性公告,finalpage/2007-04-21/22928317.PDF
2007-04-28,建投能源：2007年第一季度报告,finalpage/2007-04-28/23185736.PDF
2007-04-28,建投能源：第五届董事会第四次会议决议公告,finalpage/2007-04-28/23185737.PDF
2007-04-28,建投能源：关联交易公告,finalpage/2007-04-28/23185739.PDF
2007-04-28,建投能源：第五届监事会第四次会议决议公告,finalpage/2007-04-28/23185742.PDF
2007-04-28,建投能源：业绩预告公告,finalpage/2007-04-28/23185743.PDF
2007-05-19,建投能源：关于股东减持股份的公告,finalpage/2007-05-19/23577098.PDF
2007-06-06,建投能源：关于更换保荐代表人的公告,finalpage/2007-06-06/24062018.PDF
2007-06-08,建投能源：二00六年度分红派息公告,finalpage/2007-06-08/24108282.PDF
2007-06-21,建投能源：关于办公地址变更的公告,finalpage/2007-06-21/29193689.PDF
2007-07-06,建投能源：加强上市公司治理专项活动自查报告和整改计划,finalpage/2007-07-06/29630392.PDF
2007-07-06,建投能源：加强上市公司治理专项活动自查情况,finalpage/2007-07-06/29630400.PDF
2007-07-12,建投能源：2007年上半年业绩预告修正公告,finalpage/2007-07-12/29788692.PDF
2007-07-12,建投能源：第五届董事会第四次临时会议决议公告,finalpage/2007-07-12/29788689.PDF
