date,title,url
2014-07-17,吉林敖东：独立董事关于对董事会聘任公司高级管理人员的独立意见,finalpage/2014-07-17/1200059398.PDF
2014-08-07,吉林敖东：关于广发证券2014年7月主要财务信息的公告,finalpage/2014-08-07/1200103421.PDF
2014-08-19,吉林敖东：2014年半年度报告摘要,finalpage/2014-08-19/1200135870.PDF
2014-08-19,吉林敖东：2014年半年度报告,finalpage/2014-08-19/1200135871.PDF
2014-08-19,吉林敖东：独立董事对2014年半年度相关事项的专项说明及独立意见,finalpage/2014-08-19/1200135872.PDF
2014-08-19,吉林敖东：2014年半年度报告之财务报告,finalpage/2014-08-19/1200136919.PDF
2014-08-20,吉林敖东：关于公司股东股权解除质押登记的公告,finalpage/2014-08-20/1200140671.PDF
2014-09-04,吉林敖东：第八届董事会第三次会议决议公告,finalpage/2014-09-04/1200203023.PDF
2014-09-04,吉林敖东：对外投资公告（二）,finalpage/2014-09-04/1200203024.PDF
2014-09-04,吉林敖东：对外投资公告（一）,finalpage/2014-09-04/1200203025.PDF
2014-09-05,吉林敖东：关于广发证券2014年8月主要财务信息的公告,finalpage/2014-09-05/1200205700.PDF
2014-10-15,吉林敖东：关于广发证券2014年9月主要财务信息的公告,finalpage/2014-10-15/1200299867.PDF
2014-10-15,吉林敖东：关于广发证券2014年前三季度业绩快报的公告,finalpage/2014-10-15/1200299868.PDF
2014-10-28,吉林敖东：限售股份解除限售提示性公告,finalpage/2014-10-28/1200340081.PDF
2014-10-28,吉林敖东：关于召开2014年第三次临时股东大会的通知,finalpage/2014-10-28/1200340773.PDF
2014-10-28,吉林敖东：第八届监事会第三次会议决议公告,finalpage/2014-10-28/1200340774.PDF
2014-10-28,吉林敖东：第八届董事会第四次会议决议公告,finalpage/2014-10-28/1200340775.PDF
2014-10-28,吉林敖东：独立董事关于《关于调整吉林亚泰（集团）股份有限公司非公开发行股份认购价格的议案》的独立意见,finalpage/2014-10-28/1200341712.PDF
2014-10-29,吉林敖东：2014年第三季度报告正文,finalpage/2014-10-29/1200347157.PDF
2014-10-29,吉林敖东：2014年第三季度报告全文,finalpage/2014-10-29/1200347158.PDF
2014-10-29,吉林敖东：第八届董事会第五次会议决议公告,finalpage/2014-10-29/1200347159.PDF
2014-10-29,吉林敖东：第八届监事会第四次会议决议公告,finalpage/2014-10-29/1200347160.PDF
2014-10-29,吉林敖东：关于会计政策变更的公告,finalpage/2014-10-29/1200347161.PDF
2014-10-29,吉林敖东：对外投资公告,finalpage/2014-10-29/1200347162.PDF
2014-10-29,吉林敖东：独立董事关于会计政策变更的独立意见,finalpage/2014-10-29/1200347163.PDF
2014-10-29,吉林敖东：关于对公司会计政策变更的专项说明,finalpage/2014-10-29/1200347164.PDF
2014-11-07,吉林敖东：关于召开2014年第三次临时股东大会的提示性公告,finalpage/2014-11-07/1200375242.PDF
2014-11-07,吉林敖东：关于广发证券2014年10月主要财务信息的公告,finalpage/2014-11-07/1200375298.PDF
2014-11-14,吉林敖东：2014年第三次临时股东大会决议公告,finalpage/2014-11-14/1200391034.PDF
2014-11-14,吉林敖东：2014年第三次临时股东大会法律意见书,finalpage/2014-11-14/1200391035.PDF
2014-12-05,吉林敖东：关于广发证券2014年11月主要财务信息的公告,finalpage/2014-12-05/1200441104.PDF
2015-01-12,吉林敖东：关于广发证券2014年12月主要财务信息的公告,finalpage/2015-01-12/1200533095.PDF
2015-01-12,吉林敖东：关于广发证券2014年度业绩快报的公告,finalpage/2015-01-12/1200533096.PDF
2015-02-06,吉林敖东：关于广发证券2015年1月主要财务信息的公告,finalpage/2015-02-06/1200612743.PDF
2015-02-14,吉林敖东：2014年度业绩快报,finalpage/2015-02-14/1200636577.PDF
2015-02-26,吉林敖东：关于终止认购信邦制药非公开发行股份的提示性公告,finalpage/2015-02-26/1200651135.PDF
2015-03-06,吉林敖东：关于广发证券2015年2月主要财务信息的公告,finalpage/2015-03-06/1200673613.PDF
2015-04-09,吉林敖东：关于广发证券2015年3月主要财务信息的公告,finalpage/2015-04-09/1200800704.PDF
2015-04-09,吉林敖东：2015年第一季度业绩预告,finalpage/2015-04-09/1200800705.PDF
2015-04-11,吉林敖东：关于广发证券境外上市外资股（H股）挂牌并上市交易对公司影响的提示公告,finalpage/2015-04-11/1200812584.PDF
2015-04-21,吉林敖东：独立董事关于公司对外担保情况的专项说明及相关独立意见,finalpage/2015-04-21/1200873308.PDF
2015-04-21,吉林敖东：2014年年度报告摘要,finalpage/2015-04-21/1200873309.PDF
2015-04-21,吉林敖东：2014年年度报告,finalpage/2015-04-21/1200873310.PDF
2015-04-21,吉林敖东：2014年度报告之财务报告,finalpage/2015-04-21/1200873311.PDF
2015-04-21,吉林敖东：第八届董事会第六次会议决议公告,finalpage/2015-04-21/1200873312.PDF
2015-04-21,吉林敖东：关于召开2014年度股东大会的通知,finalpage/2015-04-21/1200873313.PDF
2015-04-21,吉林敖东：第八届监事会第五次会议决议公告,finalpage/2015-04-21/1200873314.PDF
2015-04-21,吉林敖东：关于对公司控股股东及其他关联方占用资金情况的专项审计说明,finalpage/2015-04-21/1200873315.PDF
2015-04-21,吉林敖东：2014年度社会责任报告,finalpage/2015-04-21/1200873316.PDF
2015-04-21,吉林敖东：2014年度内部控制评价报告,finalpage/2015-04-21/1200873317.PDF
2015-04-21,吉林敖东：关于举办2014年年度报告网上业绩说明会的公告,finalpage/2015-04-21/1200873318.PDF
2015-04-21,吉林敖东：关于日常关联交易的公告,finalpage/2015-04-21/1200873319.PDF
2015-04-21,吉林敖东：关于核销资产的公告,finalpage/2015-04-21/1200873320.PDF
2015-04-21,吉林敖东：内部控制审计报告,finalpage/2015-04-21/1200873321.PDF
2015-04-21,吉林敖东：2014年度独立董事述职报告（吕桂霞）,finalpage/2015-04-21/1200873322.PDF
2015-04-21,吉林敖东：2014年度独立董事述职报告（孙茂成）,finalpage/2015-04-21/1200873323.PDF
2015-04-21,吉林敖东：2014年度独立董事述职报告（韩波）,finalpage/2015-04-21/1200873324.PDF
2015-04-21,吉林敖东：监事会对公司内部控制自我评价的意见,finalpage/2015-04-21/1200873325.PDF
2015-04-21,吉林敖东：董事会关于证券投资情况的专项说明,finalpage/2015-04-21/1200873326.PDF
2015-04-28,吉林敖东：2015年第一季度报告正文,finalpage/2015-04-28/1200918960.PDF
2015-04-28,吉林敖东：2015年第一季度报告全文,finalpage/2015-04-28/1200918961.PDF
2015-05-04,吉林敖东：关于认购亚泰集团非公开发行股票完成证券登记的公告,finalpage/2015-05-04/1200957007.PDF
2015-05-05,吉林敖东：关于公司股东股权解冻及质押的公告,finalpage/2015-05-05/1200961756.PDF
2015-05-08,吉林敖东：关于广发证券2015年4月主要财务信息的公告,finalpage/2015-05-08/1200979002.PDF
2015-05-12,吉林敖东：关于召开2014年度股东大会的提示性公告,finalpage/2015-05-12/1200998575.PDF
2015-05-15,吉林敖东：关于公司股东股权质押的公告,finalpage/2015-05-15/1201014949.PDF
2015-05-16,吉林敖东：2014年度股东大会决议公告,finalpage/2015-05-16/1201021042.PDF
2015-05-16,吉林敖东：2014年度股东大会法律意见书,finalpage/2015-05-16/1201021043.PDF
2015-05-21,吉林敖东：关于公司股东股权解除质押的公告,finalpage/2015-05-21/1201040236.PDF
2015-06-05,吉林敖东：关于广发证券2015年5月主要财务信息的公告,finalpage/2015-06-05/1201106183.PDF
2015-06-09,吉林敖东：2014年年度权益分派实施公告,finalpage/2015-06-09/1201122433.PDF
2015-06-18,吉林敖东：关联交易及对外投资公告,finalpage/2015-06-18/1201165242.PDF
2015-06-18,吉林敖东：第八届董事会第八次会议决议公告,finalpage/2015-06-18/1201165243.PDF
2015-06-18,吉林敖东：独立董事关于对关联交易的事前审核意见,finalpage/2015-06-18/1201165244.PDF
2015-06-18,吉林敖东：独立董事关于对《关于发起设立广发信德.吉林敖东基金管理有限公司（暂定名）及广发信德.吉林敖东中药现代化产业基金（暂定名）和吉林敖东创新产业发展基金（暂定名）暨与广发证券共同投资的关联交易议案》的独立意见,finalpage/2015-06-18/1201165245.PDF
2015-07-03,吉林敖东：关于召开2015年第一次临时股东大会的通知,finalpage/2015-07-03/1201231315.PDF
2015-07-03,吉林敖东：关于在香港投资设立全资子公司的对外投资公告,finalpage/2015-07-03/1201231316.PDF
2015-07-03,吉林敖东：第八届监事会第七次会议决议公告,finalpage/2015-07-03/1201231317.PDF
2015-07-03,吉林敖东：第八届董事会第九次会议决议公告,finalpage/2015-07-03/1201231318.PDF
2015-07-03,吉林敖东：独立董事对《关于在香港投资设立全资子公司的议案》、《关于对部分广发证券股权实施市值管理的议案》的独立意见,finalpage/2015-07-03/1201231319.PDF
2015-07-08,吉林敖东：关于广发证券2015年6月主要财务信息的公告,finalpage/2015-07-08/1201254882.PDF
2015-07-08,吉林敖东：关于第一大股东敦化市金诚实业有限责任公司增持公司股份计划的公告,finalpage/2015-07-08/1201254883.PDF
2015-07-08,吉林敖东：2015年半年度业绩预告,finalpage/2015-07-08/1201254884.PDF
2015-07-10,吉林敖东：关于第一大股东敦化市金诚实业有限责任公司增持公司股份计划实施完成的公告,finalpage/2015-07-10/1201266838.PDF
2015-07-10,吉林敖东：关于第一大股东敦化市金诚实业有限责任公司拟继续增持公司股份计划的公告,finalpage/2015-07-10/1201266839.PDF
2015-07-17,吉林敖东：关于召开2015年第一次临时股东大会的提示性公告,finalpage/2015-07-17/1201304102.PDF
2015-07-22,吉林敖东：2015年第一次临时股东大会决议公告,finalpage/2015-07-22/1201329939.PDF
2015-07-22,吉林敖东：召开2015年第一次临时股东大会法律意见书,finalpage/2015-07-22/1201329940.PDF
2015-07-29,吉林敖东：关于第一大股东敦化市金诚实业有限责任公司增持公司股份计划实施完成的公告,finalpage/2015-07-29/1201358389.PDF
2015-08-05,吉林敖东：关于公司股东股权解冻及质押的公告,finalpage/2015-08-05/1201392775.PDF
2015-08-07,吉林敖东：关于广发证券2015年7月主要财务信息的公告,finalpage/2015-08-07/1201402907.PDF
2015-08-11,吉林敖东：关于公司股东股权质押的公告,finalpage/2015-08-11/1201417085.PDF
2015-08-22,吉林敖东：2015年半年度报告摘要,finalpage/2015-08-22/1201472393.PDF
2015-08-22,吉林敖东：2015年半年度报告,finalpage/2015-08-22/1201472394.PDF
2015-08-22,吉林敖东：关于公司股东股权解冻及质押的公告,finalpage/2015-08-22/1201472396.PDF
2015-08-22,吉林敖东：独立董事对2015年半年度相关事项的专项说明及独立意见,finalpage/2015-08-22/1201472397.PDF
2015-09-08,吉林敖东：关于广发证券2015年8月主要财务信息的公告,finalpage/2015-09-08/1201565569.PDF
2015-10-15,吉林敖东：关于广发证券2015年9月主要财务信息的公告,finalpage/2015-10-15/1201695065.PDF
2015-10-15,吉林敖东：2015年前三季度业绩预告,finalpage/2015-10-15/1201695066.PDF
2015-10-31,吉林敖东：2015年第三季度报告正文,finalpage/2015-10-31/1201743540.PDF
2015-10-31,吉林敖东：2015年第三季度报告全文,finalpage/2015-10-31/1201743541.PDF
2015-11-06,吉林敖东：关于广发证券2015年10月主要财务信息的公告,finalpage/2015-11-06/1201755302.PDF
2015-11-23,吉林敖东：限售股份解除限售提示性公告,finalpage/2015-11-23/1201782691.PDF
2015-12-05,吉林敖东：关于广发证券2015年11月主要财务信息的公告,finalpage/2015-12-05/1201808890.PDF
2015-12-17,吉林敖东：关于控股子公司撤回药品注册申请的公告,finalpage/2015-12-17/1201841336.PDF
2015-12-22,吉林敖东：关于控股股东敦化市金诚实业有限责任公司股东续签一致行动人协议的公告,finalpage/2015-12-22/1201850287.PDF
2016-01-12,吉林敖东：2015年度业绩预告,finalpage/2016-01-12/1201906746.PDF
2016-01-12,吉林敖东：关于广发证券2015年12月主要财务信息的公告,finalpage/2016-01-12/1201906747.PDF
2016-01-12,吉林敖东：关于广发证券2015年度业绩预告的公告,finalpage/2016-01-12/1201906748.PDF
2016-01-15,吉林敖东：关于成为广发证券股份有限公司第一大股东的提示性公告,finalpage/2016-01-15/1201917342.PDF
2016-02-05,吉林敖东：关于广发证券2016年1月主要财务信息的公告,finalpage/2016-02-05/1201972547.PDF
2016-03-05,吉林敖东：关于广发证券2016年2月主要财务信息的公告,finalpage/2016-03-05/1202023618.PDF
2016-03-29,吉林敖东：2015年年度审计报告,finalpage/2016-03-29/1202089437.PDF
2016-03-29,吉林敖东：2015年度社会责任报告,finalpage/2016-03-29/1202089438.PDF
2016-03-29,吉林敖东：2015年度内部控制评价报告,finalpage/2016-03-29/1202089439.PDF
2016-03-29,吉林敖东：2015年度独立董事述职报告（韩波）,finalpage/2016-03-29/1202089440.PDF
2016-03-29,吉林敖东：2015年度独立董事述职报告（吕桂霞）,finalpage/2016-03-29/1202089441.PDF
2016-03-29,吉林敖东：2015年度独立董事述职报告（孙茂成）,finalpage/2016-03-29/1202089442.PDF
2016-03-29,吉林敖东：独立董事关于公司对外担保情况的专项说明及相关独立意见,finalpage/2016-03-29/1202089443.PDF
2016-03-29,吉林敖东：董事会关于证券投资情况的专项说明,finalpage/2016-03-29/1202089444.PDF
2016-03-29,吉林敖东：2015年年度报告,finalpage/2016-03-29/1202089445.PDF
2016-03-29,吉林敖东：内部控制审计报告（2015年度）,finalpage/2016-03-29/1202089446.PDF
2016-03-29,吉林敖东：关于对公司控股股东及其他关联方占用资金情况的专项审计说明,finalpage/2016-03-29/1202089447.PDF
2016-03-29,吉林敖东：2015年年度报告摘要,finalpage/2016-03-29/1202089448.PDF
2016-03-29,吉林敖东：第八届董事会第十二次会议决议公告,finalpage/2016-03-29/1202089449.PDF
2016-03-29,吉林敖东：关于召开2015年度股东大会的通知,finalpage/2016-03-29/1202089450.PDF
2016-03-29,吉林敖东：第八届监事会第十次会议决议公告,finalpage/2016-03-29/1202089451.PDF
2016-03-29,吉林敖东：独立董事就《关于公司回购股份的议案》的独立意见,finalpage/2016-03-29/1202089452.PDF
2016-03-29,吉林敖东：关于日常关联交易的公告,finalpage/2016-03-29/1202089453.PDF
2016-03-29,吉林敖东：关于回购公司股份的公告,finalpage/2016-03-29/1202089454.PDF
2016-03-29,吉林敖东：关于举办2015年度报告网上业绩说明会的公告,finalpage/2016-03-29/1202089455.PDF
2016-03-29,吉林敖东：关于股票复牌的提示性公告,finalpage/2016-03-29/1202091861.PDF
2016-03-29,吉林敖东：2015年度监事会工作报告,finalpage/2016-03-29/1202091863.PDF
2016-04-12,吉林敖东：关于广发证券2016年3月主要财务信息的公告,finalpage/2016-04-12/1202163361.PDF
2016-04-14,吉林敖东：关于召开2015年度股东大会的提示性公告,finalpage/2016-04-14/1202174742.PDF
2016-04-14,吉林敖东：关于前十名股东持股信息的公告,finalpage/2016-04-14/1202174743.PDF
2016-04-14,吉林敖东：民生证券股份有限公司关于公司回购股份之独立财务顾问报告,finalpage/2016-04-14/1202174744.PDF
2016-04-20,吉林敖东：2015年度股东大会决议公告,finalpage/2016-04-20/1202205121.PDF
2016-04-20,吉林敖东：2015年度股东大会法律意见书,finalpage/2016-04-20/1202205122.PDF
2016-04-20,吉林敖东：关于回购股份的债权人通知书,finalpage/2016-04-20/1202205123.PDF
2016-04-27,吉林敖东：关于回购公司股份的报告书,finalpage/2016-04-27/1202250654.PDF
2016-04-27,吉林敖东：关于公司回购社会公众股份之法律意见书,finalpage/2016-04-27/1202250655.PDF
2016-04-29,吉林敖东：2016年第一季度报告正文,finalpage/2016-04-29/1202263481.PDF
2016-04-29,吉林敖东：2016年第一季度报告全文,finalpage/2016-04-29/1202263482.PDF
2016-05-04,吉林敖东：关于回购公司股份的进展公告,finalpage/2016-05-04/1202287120.PDF
2016-05-04,吉林敖东：关于首次实施回购公司股份的公告,finalpage/2016-05-04/1202287121.PDF
2016-05-07,吉林敖东：关于回购股份总数超过总股本1%的公告,finalpage/2016-05-07/1202303235.PDF
2016-05-07,吉林敖东：关于广发证券2016年4月主要财务信息的公告,finalpage/2016-05-07/1202304058.PDF
2016-05-11,吉林敖东：关于回购股份总数超过总股本2%的公告,finalpage/2016-05-11/1202314819.PDF
2016-05-21,吉林敖东：关于公司股份回购方案已实施完毕的公告,finalpage/2016-05-21/1202332615.PDF
2016-06-07,吉林敖东：关于广发证券2016年5月主要财务信息的公告,finalpage/2016-06-07/1202358961.PDF
2016-06-08,吉林敖东：2015年年度权益分派实施公告,finalpage/2016-06-08/1202360717.PDF
2016-06-14,吉林敖东：关于公司股东部分股权解除质押的公告,finalpage/2016-06-14/1202366843.PDF
2016-06-30,吉林敖东：第八届董事会第十四次会议决议公告,finalpage/2016-06-30/1202438013.PDF
2016-06-30,吉林敖东：第八届监事会第十二次会议决议公告,finalpage/2016-06-30/1202438014.PDF
2016-06-30,吉林敖东：关于公司员工持股计划的独立意见,finalpage/2016-06-30/1202438015.PDF
2016-06-30,吉林敖东：监事会关于员工持股计划相关事项的审核意见,finalpage/2016-06-30/1202438016.PDF
2016-06-30,吉林敖东：关于召开2016年第一次临时股东大会的通知,finalpage/2016-06-30/1202438017.PDF
2016-06-30,吉林敖东：员工持股计划（草案）,finalpage/2016-06-30/1202438018.PDF
2016-06-30,吉林敖东：员工持股计划（草案）摘要,finalpage/2016-06-30/1202438019.PDF
2016-06-30,吉林敖东：民生证券吉林敖东1号集合资产管理计划资产管理合同（草案）,finalpage/2016-06-30/1202438020.PDF
2016-07-01,吉林敖东：对《关于召开2016年第一次临时股东大会的通知》的更正公告,finalpage/2016-07-01/1202442285.PDF
2016-07-05,吉林敖东：关于控股子公司获得药品GMP证书及药用辅料注册批件的公告,finalpage/2016-07-05/1202449936.PDF
2016-07-09,吉林敖东：关于广发证券2016年6月主要财务信息的公告,finalpage/2016-07-09/1202462661.PDF
2016-07-09,吉林敖东：关于广发证券2016年半年度业绩预告的公告,finalpage/2016-07-09/1202462662.PDF
2016-07-09,吉林敖东：2016年半年度业绩预告,finalpage/2016-07-09/1202462663.PDF
2016-07-12,吉林敖东：关于公司员工持股计划之法律意见书,finalpage/2016-07-12/1202466671.PDF
2016-07-12,吉林敖东：关于召开2016年第一次临时股东大会的提示性公告,finalpage/2016-07-12/1202466672.PDF
2016-07-16,吉林敖东：2016年第一次临时股东大会决议公告,finalpage/2016-07-16/1202477891.PDF
2016-07-16,吉林敖东：2016年第一次临时股东大会法律意见,finalpage/2016-07-16/1202477892.PDF
2016-08-05,吉林敖东：关于广发证券2016年7月主要财务信息的公告,finalpage/2016-08-05/1202538952.PDF
2016-08-30,吉林敖东：2016年半年度报告摘要,finalpage/2016-08-30/1202642884.PDF
2016-08-30,吉林敖东：2016年半年度报告,finalpage/2016-08-30/1202642885.PDF
2016-08-30,吉林敖东：2016年半年度财务报告,finalpage/2016-08-30/1202642886.PDF
2016-08-30,吉林敖东：独立董事对2016年半年度相关事项的专项说明及独立意见,finalpage/2016-08-30/1202642887.PDF
2016-09-07,吉林敖东：关于广发证券2016年8月主要财务信息的公告,finalpage/2016-09-07/1202679635.PDF
2016-09-20,吉林敖东：关于控股子公司获得药品GMP证书的自愿性信息披露公告,finalpage/2016-09-20/1202707789.PDF
2016-10-14,吉林敖东：关于广发证券2016年9月主要财务信息的公告,finalpage/2016-10-14/1202757393.PDF
2016-10-25,吉林敖东：2016年第三季度报告正文,finalpage/2016-10-25/1202781047.PDF
2016-10-25,吉林敖东：2016年第三季度报告全文,finalpage/2016-10-25/1202781049.PDF
2016-10-27,吉林敖东：关于公司股东部分股权解除质押及质押的公告,finalpage/2016-10-27/1202792462.PDF
2016-11-05,吉林敖东：关于广发证券2016年10月主要财务信息的公告,finalpage/2016-11-05/1202815807.PDF
2016-11-22,吉林敖东：简式权益变动报告书,finalpage/2016-11-22/1202838649.PDF
2016-11-23,吉林敖东：第八届董事会第十七次会议决议公告,finalpage/2016-11-23/1202839627.PDF
2016-11-23,吉林敖东：第八届监事会第十五次会议决议公告,finalpage/2016-11-23/1202839628.PDF
2016-11-23,吉林敖东：关于对控股子公司增资的公告,finalpage/2016-11-23/1202839629.PDF
2016-11-23,吉林敖东：关于控股子公司吸收合并的公告,finalpage/2016-11-23/1202839630.PDF
2016-11-24,吉林敖东：限售股份解除限售提示性公告,finalpage/2016-11-24/1202841581.PDF
2016-11-24,吉林敖东：关于公司股东部分股权解除质押及质押的公告,finalpage/2016-11-24/1202841628.PDF
2016-11-24,吉林敖东：民生证券股份有限公司关于公司控股股东履行股权分置改革承诺有关事宜的专项核查意见,finalpage/2016-11-24/1202841671.PDF
2016-11-25,吉林敖东：股票交易异常波动公告,finalpage/2016-11-25/1202842975.PDF
2016-12-07,吉林敖东：关于广发证券2016年11月主要财务信息的公告,finalpage/2016-12-07/1202862535.PDF
2016-12-09,吉林敖东：关于公司股东部分股权解除质押及质押的公告,finalpage/2016-12-09/1202865424.PDF
2016-12-24,吉林敖东：关于公司股东股权质押的公告,finalpage/2016-12-24/1202953714.PDF
2017-01-04,吉林敖东：关于公司员工持股计划完成股票过户的公告,finalpage/2017-01-04/1202985911.PDF
2017-01-11,吉林敖东：关于广发证券2016年12月主要财务信息的公告,finalpage/2017-01-11/1203005214.PDF
2017-02-08,吉林敖东：关于广发证券2017年1月主要财务信息的公告,finalpage/2017-02-08/1203068292.PDF
2017-03-07,吉林敖东：关于广发证券2017年2月主要财务信息的公告,finalpage/2017-03-07/1203134085.PDF
2017-03-31,吉林敖东：2016年年度报告摘要,finalpage/2017-03-31/1203239356.PDF
2017-03-31,吉林敖东：2016年年度审计报告,finalpage/2017-03-31/1203239357.PDF
2017-03-31,吉林敖东：第八届监事会第十六次会议决议公告,finalpage/2017-03-31/1203239358.PDF
2017-03-31,吉林敖东：关于对公司控股股东及其他关联方占用资金情况的专项审计说明,finalpage/2017-03-31/1203239359.PDF
2017-03-31,吉林敖东：2016年度社会责任报告,finalpage/2017-03-31/1203239360.PDF
2017-03-31,吉林敖东：2016年度内部控制评价报告,finalpage/2017-03-31/1203239361.PDF
2017-03-31,吉林敖东：独立董事关于公司对外担保情况的专项说明及相关独立意见,finalpage/2017-03-31/1203239362.PDF
2017-03-31,吉林敖东：董事会关于证券投资情况的专项说明,finalpage/2017-03-31/1203239363.PDF
2017-03-31,吉林敖东：关于会计政策变更的公告,finalpage/2017-03-31/1203239364.PDF
2017-03-31,吉林敖东：关于举办2016年度报告网上业绩说明会的公告,finalpage/2017-03-31/1203239365.PDF
2017-03-31,吉林敖东：2016年度独立董事述职报告（韩波）,finalpage/2017-03-31/1203239366.PDF
2017-03-31,吉林敖东：2016年度独立董事述职报告（吕桂霞）,finalpage/2017-03-31/1203239367.PDF
2017-03-31,吉林敖东：2016年度独立董事述职报告（孙茂成）,finalpage/2017-03-31/1203239368.PDF
2017-03-31,吉林敖东：2016年度监事会工作报告,finalpage/2017-03-31/1203239369.PDF
2017-03-31,吉林敖东：2016年度董事会工作报告,finalpage/2017-03-31/1203239370.PDF
2017-03-31,吉林敖东：第八届董事会第十八次会议决议公告,finalpage/2017-03-31/1203239371.PDF
2017-03-31,吉林敖东：关于召开2016年度股东大会的通知,finalpage/2017-03-31/1203239372.PDF
2017-03-31,吉林敖东：关于日常关联交易的公告,finalpage/2017-03-31/1203239373.PDF
2017-03-31,吉林敖东：内部控制审计报告,finalpage/2017-03-31/1203239374.PDF
2017-03-31,吉林敖东：2016年年度报告,finalpage/2017-03-31/1203239375.PDF
2017-04-12,吉林敖东：关于广发证券2017年3月主要财务信息的公告,finalpage/2017-04-12/1203283125.PDF
2017-04-18,吉林敖东：关于召开2016年度股东大会的提示性公告,finalpage/2017-04-18/1203313925.PDF
2017-04-22,吉林敖东：2016年度股东大会决议公告,finalpage/2017-04-22/1203357785.PDF
2017-04-22,吉林敖东：2016年度股东大会法律意见书,finalpage/2017-04-22/1203357786.PDF
2017-04-27,吉林敖东：关于公司股东部分股权质押的公告,finalpage/2017-04-27/1203403696.PDF
2017-04-28,吉林敖东：2017年第一季度报告正文,finalpage/2017-04-28/1203410901.PDF
2017-04-28,吉林敖东：2017年第一季度报告全文,finalpage/2017-04-28/1203410902.PDF
2017-05-06,吉林敖东：关于广发证券2017年4月主要财务信息的公告,finalpage/2017-05-06/1203482037.PDF
2017-05-18,吉林敖东：关于公司股东部分股权解除质押的公告,finalpage/2017-05-18/1203531318.PDF
2017-05-27,吉林敖东：关于公司股东部分股权解除质押的公告,finalpage/2017-05-27/1203572766.PDF
