,date,title,url
485,2013-02-05,襄阳轴承：湖北今天律师事务所关于公司非公开发行股票之发行过程及认购对象合规性的法律意见,finalpage/2013-02-05/62109023.PDF
486,2013-02-05,襄阳轴承：非公开发行股票相关承诺,finalpage/2013-02-05/62109024.PDF
487,2013-02-07,襄阳轴承：五届监事会第七次会议决议公告,finalpage/2013-02-07/62120492.PDF
488,2013-02-07,襄阳轴承：五届董事会第十次会议决议公告,finalpage/2013-02-07/62120493.PDF
489,2013-02-07,襄阳轴承：关于以募集资金置换先期投入的公告,finalpage/2013-02-07/62120494.PDF
490,2013-02-07,襄阳轴承：关于召开2013年第一次临时股东大会的通知,finalpage/2013-02-07/62120495.PDF
491,2013-02-07,襄阳轴承：关于签订募集资金三方监管协议的公告,finalpage/2013-02-07/62120496.PDF
492,2013-02-07,襄阳轴承：独立董事关于第五届董事会第十次会议相关事项的独立意见,finalpage/2013-02-07/62120497.PDF
493,2013-02-07,襄阳轴承：申银万国证券股份有限公司关于公司用募集资金置换预先已投入募集资金项目的自筹资金的核查意见,finalpage/2013-02-07/62120498.PDF
494,2013-02-07,襄阳轴承：鉴证报告,finalpage/2013-02-07/62120499.PDF
495,2013-02-22,襄阳轴承：董事会关于重大资产重组停牌公告,finalpage/2013-02-22/62142082.PDF
496,2013-02-27,襄阳轴承：2013年第一次临时股东大会决议公告,finalpage/2013-02-27/62157312.PDF
497,2013-02-27,襄阳轴承：公司章程（2013年2月）,finalpage/2013-02-27/62157313.PDF
498,2013-02-27,襄阳轴承：更正公告,finalpage/2013-02-27/62157314.PDF
499,2013-02-27,襄阳轴承：2013年度第一次临时股东大会法律意见书,finalpage/2013-02-27/62157315.PDF
500,2013-03-01,襄阳轴承：重大资产重组进展公告,finalpage/2013-03-01/62167640.PDF
501,2013-03-08,襄阳轴承：重大资产重组进展公告,finalpage/2013-03-08/62192794.PDF
502,2013-03-15,襄阳轴承：重大资产重组进展公告,finalpage/2013-03-15/62214161.PDF
503,2013-03-22,襄阳轴承：重大资产重组进展暨延期复牌公告,finalpage/2013-03-22/62239427.PDF
504,2013-03-29,襄阳轴承：重大资产重组进展公告,finalpage/2013-03-29/62294991.PDF
505,2013-04-08,襄阳轴承：重大资产重组进展公告,finalpage/2013-04-08/62326700.PDF
506,2013-04-15,襄阳轴承：2012年度业绩快报,finalpage/2013-04-15/62356414.PDF
507,2013-04-15,襄阳轴承：2013年第一季度业绩预告,finalpage/2013-04-15/62356415.PDF
508,2013-04-15,襄阳轴承：重大资产重组进展公告,finalpage/2013-04-15/62356416.PDF
509,2013-04-20,襄阳轴承：重大资产重组进展暨延期复牌公告,finalpage/2013-04-20/62389617.PDF
510,2013-04-25,襄阳轴承：2013年日常关联交易预计公告,finalpage/2013-04-25/62421683.PDF
511,2013-04-25,襄阳轴承：2012年年度报告摘要,finalpage/2013-04-25/62421684.PDF
512,2013-04-25,襄阳轴承：2012年年度审计报告,finalpage/2013-04-25/62421692.PDF
513,2013-04-25,襄阳轴承：五届董事会第十一次会议决议,finalpage/2013-04-25/62421693.PDF
514,2013-04-25,襄阳轴承：关于召开2012年度股东大会的通知,finalpage/2013-04-25/62421694.PDF
515,2013-04-25,襄阳轴承：五届监事会第八次会议决议,finalpage/2013-04-25/62421695.PDF
516,2013-04-25,襄阳轴承：2012年度控股股东及其他关联方资金占用情况的专项说明,finalpage/2013-04-25/62421696.PDF
517,2013-04-25,襄阳轴承：2012年度内部控制自我评价报告,finalpage/2013-04-25/62421697.PDF
518,2013-04-25,襄阳轴承：2012年年度报告,finalpage/2013-04-25/62421698.PDF
519,2013-04-25,襄阳轴承：关于应收账款核销的公告,finalpage/2013-04-25/62421699.PDF
520,2013-04-25,襄阳轴承：关于聘任证券事务代表的公告,finalpage/2013-04-25/62421700.PDF
521,2013-04-25,襄阳轴承：内部控制审计报告,finalpage/2013-04-25/62421701.PDF
522,2013-04-25,襄阳轴承：2012年度独立董事述职报告,finalpage/2013-04-25/62421702.PDF
523,2013-04-25,襄阳轴承：独立董事的专项说明及独立意见,finalpage/2013-04-25/62421703.PDF
524,2013-04-25,襄阳轴承：申银万国证券股份有限公司关于公司2012年度内部控制自我评价报告的核查意见,finalpage/2013-04-25/62421704.PDF
525,2013-04-25,襄阳轴承：申银万国证券股份有限公司关于公司预计2013年度日常关联交易事项的核查意见,finalpage/2013-04-25/62421706.PDF
526,2013-04-26,襄阳轴承：2013年第一季度报告正文,finalpage/2013-04-26/62427191.PDF
527,2013-04-26,襄阳轴承：2013年第一季度报告全文,finalpage/2013-04-26/62427195.PDF
528,2013-05-02,襄阳轴承：重大资产重组进展公告,finalpage/2013-05-02/62437961.PDF
529,2013-05-06,襄阳轴承：重大资产重组进展公告,finalpage/2013-05-06/62455758.PDF
530,2013-05-13,襄阳轴承：重大资产重组进展公告,finalpage/2013-05-13/62479988.PDF
531,2013-05-17,襄阳轴承：2012年度股东大会决议公告,finalpage/2013-05-17/62498348.PDF
532,2013-05-17,襄阳轴承：2012年年度股东大会法律意见书,finalpage/2013-05-17/62498349.PDF
533,2013-05-20,襄阳轴承：重大资产重组进展公告,finalpage/2013-05-20/62503098.PDF
534,2013-05-22,襄阳轴承：重大资产购买报告书（草案）摘要,finalpage/2013-05-22/62513295.PDF
535,2013-05-22,襄阳轴承：国浩律师（上海）事务所关于公司重大资产购买之法律意见书,finalpage/2013-05-22/62513296.PDF
536,2013-05-22,襄阳轴承：FLT合并财务报表及审计报告,finalpage/2013-05-22/62513297.PDF
537,2013-05-22,襄阳轴承：股权项目评估说明,finalpage/2013-05-22/62513298.PDF
538,2013-05-22,襄阳轴承：FLT合并盈利预测报告及审核报告（2013年12月31日止年度）,finalpage/2013-05-22/62513299.PDF
539,2013-05-22,襄阳轴承：董事会关于重大资产重组的一般风险提示公告,finalpage/2013-05-22/62513300.PDF
540,2013-05-22,襄阳轴承：重大资产购买报告书（草案）,finalpage/2013-05-22/62513301.PDF
541,2013-05-22,襄阳轴承：五届董事会第十三次会议决议,finalpage/2013-05-22/62513302.PDF
542,2013-05-22,襄阳轴承：独立董事意见,finalpage/2013-05-22/62513303.PDF
543,2013-05-22,襄阳轴承：长江证券承销保荐有限公司关于公司重大资产购买之独立财务顾问报告,finalpage/2013-05-22/62513304.PDF
544,2013-05-22,襄阳轴承：股权项目评估报告,finalpage/2013-05-22/62513305.PDF
545,2013-05-28,襄阳轴承：关于召开2013年第二次临时股东大会的通知,finalpage/2013-05-28/62529120.PDF
546,2013-06-07,襄阳轴承：关于召开2013年第二次临时股东大会的提示性公告,finalpage/2013-06-07/62566244.PDF
547,2013-06-14,襄阳轴承：2013年第二次临时股东大会决议公告,finalpage/2013-06-14/62579434.PDF
548,2013-06-14,襄阳轴承：公司章程（2013年6月）,finalpage/2013-06-14/62579435.PDF
549,2013-06-14,襄阳轴承：2013年第二次临时股东大会法律意见,finalpage/2013-06-14/62579436.PDF
550,2013-06-29,襄阳轴承：关于中国证监会受理本公司《重大资产购买》行政许可申请的公告,finalpage/2013-06-29/62626177.PDF
551,2013-07-12,襄阳轴承：五届董事会第十四次会议决议公告,finalpage/2013-07-12/62826365.PDF
552,2013-07-13,襄阳轴承：2013年半年度业绩预告公告,finalpage/2013-07-13/62831185.PDF
553,2013-07-16,襄阳轴承：重大资产购买报告书（修订）,finalpage/2013-07-16/62838247.PDF
554,2013-07-16,襄阳轴承：关于重大资产购买报告书修订说明的公告,finalpage/2013-07-16/62838248.PDF
555,2013-07-16,襄阳轴承：关于重大资产购买事项获得中国证监会核准的公告,finalpage/2013-07-16/62838249.PDF
556,2013-07-16,襄阳轴承：国浩律师（上海）事务所关于公司重大资产购买之补充法律意见书（一）,finalpage/2013-07-16/62838250.PDF
557,2013-07-16,襄阳轴承：重大资产购买报告书（修订）摘要,finalpage/2013-07-16/62838251.PDF
558,2013-07-16,襄阳轴承：长江证券承销保荐有限公司关于公司重大资产购买之独立财务顾问报告,finalpage/2013-07-16/62838252.PDF
559,2013-07-26,襄阳轴承：重大资产重组进展公告,finalpage/2013-07-26/62870807.PDF
560,2013-08-09,襄阳轴承：关于重大资产购买相关方出具承诺事项的公告,finalpage/2013-08-09/62921175.PDF
561,2013-08-09,襄阳轴承：重大资产购买实施情况报告书,finalpage/2013-08-09/62921176.PDF
562,2013-08-09,襄阳轴承：国浩律师（上海）事务所关于公司重大资产购买实施情况之法律意见书,finalpage/2013-08-09/62921177.PDF
563,2013-08-09,襄阳轴承：长江证券承销保荐有限公司关于公司重大资产购买实施情况之独立财务顾问核查意见,finalpage/2013-08-09/62921178.PDF
564,2013-08-10,襄阳轴承：五届董事会第十五次会议决议公告,finalpage/2013-08-10/62924409.PDF
565,2013-08-10,襄阳轴承：关于副总经理辞职的公告,finalpage/2013-08-10/62924412.PDF
566,2013-08-10,襄阳轴承：独立董事关于公司聘任财务总监的独立意见,finalpage/2013-08-10/62924417.PDF
567,2013-08-14,襄阳轴承：2013年半年度募集资金存放与实际使用情况的专项报告,finalpage/2013-08-14/62936644.PDF
568,2013-08-14,襄阳轴承：2013年半年度报告摘要,finalpage/2013-08-14/62936645.PDF
569,2013-08-14,襄阳轴承：2013半年度财务报告,finalpage/2013-08-14/62936647.PDF
570,2013-08-14,襄阳轴承：五届董事会第十六次会议决议公告,finalpage/2013-08-14/62936648.PDF
571,2013-08-14,襄阳轴承：五届监事会第十次会议决议公告,finalpage/2013-08-14/62936649.PDF
572,2013-08-14,襄阳轴承：2013年半年度报告（已取消）,finalpage/2013-08-14/62936650.PDF
573,2013-08-14,襄阳轴承：独立董事对公司关联方资金占用和对外担保情况的专项说明和独立意见,finalpage/2013-08-14/62936651.PDF
574,2013-08-27,襄阳轴承：关于签订募集资金三方监管协议的公告,finalpage/2013-08-27/62996468.PDF
575,2013-08-27,襄阳轴承：关于获得政府补贴的公告,finalpage/2013-08-27/62996469.PDF
576,2013-09-28,襄阳轴承：2013年半年度报告（更新后）,finalpage/2013-09-28/63119215.PDF
577,2013-09-28,襄阳轴承：2013年半年度报告更正公告,finalpage/2013-09-28/63119216.PDF
578,2013-10-15,襄阳轴承：2013年前三季度业绩预告公告,finalpage/2013-10-15/63154203.PDF
579,2013-10-30,襄阳轴承：2013年第三季度报告正文,finalpage/2013-10-30/63212603.PDF
580,2013-10-30,襄阳轴承：2013年第三季度报告全文,finalpage/2013-10-30/63212606.PDF
581,2013-12-14,襄阳轴承：关于获得政府补贴的公告,finalpage/2013-12-14/63375409.PDF
582,2014-01-28,襄阳轴承：2013年度业绩预告,finalpage/2014-01-28/63530069.PDF
583,2014-02-15,襄阳轴承：关于相关承诺履行情况的公告,finalpage/2014-02-15/63572979.PDF
584,2014-03-08,襄阳轴承：五届董事会第十八次会议决议公告,finalpage/2014-03-08/63649588.PDF
585,2014-03-08,襄阳轴承：关于会计师事务所更名的公告,finalpage/2014-03-08/63649589.PDF
586,2014-03-08,襄阳轴承：关于与关联方共同投资成立公司的公告,finalpage/2014-03-08/63649590.PDF
587,2014-03-08,襄阳轴承：独立董事事前认可及独立意见,finalpage/2014-03-08/63649591.PDF
588,2014-03-20,襄阳轴承：重大事项继续停牌公告,finalpage/2014-03-20/63698078.PDF
589,2014-03-27,襄阳轴承：重大事项继续停牌公告,finalpage/2014-03-27/63730409.PDF
590,2014-04-03,襄阳轴承：重大事项继续停牌公告,finalpage/2014-04-03/63779197.PDF
591,2014-04-10,襄阳轴承：重大事项继续停牌公告,finalpage/2014-04-10/63813766.PDF
592,2014-04-15,襄阳轴承：2013年度业绩快报,finalpage/2014-04-15/63838685.PDF
593,2014-04-15,襄阳轴承：2014年第一季度业绩预告,finalpage/2014-04-15/63838687.PDF
594,2014-04-17,襄阳轴承：重大事项继续停牌公告,finalpage/2014-04-17/63853632.PDF
595,2014-04-22,襄阳轴承：2013年度募集资金存放与使用情况专项审核报告,finalpage/2014-04-22/63885872.PDF
596,2014-04-22,襄阳轴承：2013年度募集资金存放与实际使用情况的专项报告,finalpage/2014-04-22/63885874.PDF
597,2014-04-22,襄阳轴承：2014年日常关联交易预计公告,finalpage/2014-04-22/63885875.PDF
598,2014-04-22,襄阳轴承：2013年年度报告摘要,finalpage/2014-04-22/63885876.PDF
599,2014-04-22,襄阳轴承：2013年年度审计报告,finalpage/2014-04-22/63885999.PDF
600,2014-04-22,襄阳轴承：五届董事会第十九次会议决议公告,finalpage/2014-04-22/63886001.PDF
601,2014-04-22,襄阳轴承：关于召开2013年度股东大会的通知,finalpage/2014-04-22/63886002.PDF
602,2014-04-22,襄阳轴承：五届监事会第十二次会议决议,finalpage/2014-04-22/63886004.PDF
603,2014-04-22,襄阳轴承：2013年度控股股东及其他关联方资金占用情况的专项说明,finalpage/2014-04-22/63886005.PDF
604,2014-04-22,襄阳轴承：2013年度内部控制评价报告,finalpage/2014-04-22/63886054.PDF
605,2014-04-22,襄阳轴承：2013年年度报告,finalpage/2014-04-22/63886090.PDF
606,2014-04-22,襄阳轴承：关于重大资产购买项目盈利预测完成情况的报告,finalpage/2014-04-22/63886116.PDF
607,2014-04-22,襄阳轴承：内部控制审计报告,finalpage/2014-04-22/63886172.PDF
608,2014-04-22,襄阳轴承：2013年度独立董事述职报告,finalpage/2014-04-22/63886178.PDF
609,2014-04-22,襄阳轴承：独立董事的专项说明及独立意见,finalpage/2014-04-22/63886179.PDF
610,2014-04-22,襄阳轴承：申银万国证券股份有限公司关于公司2013年度内部控制自我评价报告的核查意见,finalpage/2014-04-22/63886180.PDF
611,2014-04-22,襄阳轴承：申银万国证券股份有限公司关于公司持续督导期间2013年度保荐工作报告,finalpage/2014-04-22/63886181.PDF
612,2014-04-22,襄阳轴承：申银万国证券股份有限公司关于公司预计2014年度日常关联交易事项的核查意见,finalpage/2014-04-22/63886182.PDF
613,2014-04-22,襄阳轴承：申银万国证券股份有限公司关于公司2013年度募集资金存放与实际使用情况专项核查报告,finalpage/2014-04-22/63886183.PDF
614,2014-04-22,襄阳轴承：盈利预测完成情况专项审核报告,finalpage/2014-04-22/63886184.PDF
615,2014-04-22,襄阳轴承：长江证券承销保荐有限公司关于公司重大资产重组2013年度盈利预测完成情况的核查意见,finalpage/2014-04-22/63886185.PDF
616,2014-04-23,襄阳轴承：关于终止筹划重大事项暨公司股票复牌公告,finalpage/2014-04-23/63894810.PDF
617,2014-04-24,襄阳轴承：2014年第一季度报告正文,finalpage/2014-04-24/63901575.PDF
618,2014-04-24,襄阳轴承：2014年第一季度报告全文,finalpage/2014-04-24/63901577.PDF
619,2014-05-08,襄阳轴承：长江证券承销保荐有限公司关于公司重大资产重组之2013年度持续督导报告,finalpage/2014-05-08/63997003.PDF
620,2014-05-23,襄阳轴承：2013年度股东大会决议公告,finalpage/2014-05-23/64055368.PDF
621,2014-05-23,襄阳轴承：2013年年度股东大会法律意见书,finalpage/2014-05-23/64055369.PDF
622,2014-07-10,襄阳轴承：关于获得政府补贴的公告,finalpage/2014-07-10/1200043008.PDF
623,2014-07-15,襄阳轴承：2014年半年度业绩预告公告,finalpage/2014-07-15/1200053124.PDF
624,2014-08-14,襄阳轴承：2014年半年度募集资金存放与实际使用情况的专项报告,finalpage/2014-08-14/1200125109.PDF
625,2014-08-14,襄阳轴承：2014年半年度报告摘要,finalpage/2014-08-14/1200125110.PDF
626,2014-08-14,襄阳轴承：2014年半年度财务报告,finalpage/2014-08-14/1200125112.PDF
627,2014-08-14,襄阳轴承：五届董事会第二十一次会议决议公告,finalpage/2014-08-14/1200125113.PDF
628,2014-08-14,襄阳轴承：五届监事会第十四次会议决议公告,finalpage/2014-08-14/1200125114.PDF
629,2014-08-14,襄阳轴承：2014年半年度报告,finalpage/2014-08-14/1200125115.PDF
630,2014-08-14,襄阳轴承：独立董事对公司关联方资金占用和对外担保情况的专项说明和独立意见,finalpage/2014-08-14/1200125116.PDF
631,2014-10-15,襄阳轴承：2014年前三季度业绩预告公告,finalpage/2014-10-15/1200298895.PDF
632,2014-10-17,襄阳轴承：五届董事会第二十二次会议决议公告,finalpage/2014-10-17/1200305951.PDF
633,2014-10-17,襄阳轴承：独立董事事前认可及独立意见,finalpage/2014-10-17/1200305952.PDF
634,2014-10-17,襄阳轴承：关于银行授信抵押物的说明,finalpage/2014-10-17/1200306424.PDF
635,2014-10-22,襄阳轴承：2014年第三季度报告正文,finalpage/2014-10-22/1200317252.PDF
636,2014-10-22,襄阳轴承：2014年第三季度报告全文,finalpage/2014-10-22/1200317254.PDF
637,2014-10-30,襄阳轴承：关于公司独立董事辞职的公告,finalpage/2014-10-30/1200351170.PDF
638,2014-11-07,襄阳轴承：关于获得政府补贴的公告,finalpage/2014-11-07/1200375091.PDF
639,2014-12-06,襄阳轴承：重大事项继续停牌公告,finalpage/2014-12-06/1200443728.PDF
640,2014-12-13,襄阳轴承：重大事项继续停牌公告,finalpage/2014-12-13/1200461895.PDF
641,2014-12-20,襄阳轴承：重大事项继续停牌公告,finalpage/2014-12-20/1200478842.PDF
642,2014-12-27,襄阳轴承：重大事项继续停牌公告,finalpage/2014-12-27/1200499303.PDF
643,2014-12-31,襄阳轴承：第五届董事会第二十四次会议决议公告,finalpage/2014-12-31/1200508331.PDF
644,2014-12-31,襄阳轴承：第五届监事会第十六次会议决议公告,finalpage/2014-12-31/1200508332.PDF
645,2014-12-31,襄阳轴承：独立董事关于本次非公开发行股票涉及关联交易事项的事前认可意见,finalpage/2014-12-31/1200508333.PDF
646,2014-12-31,襄阳轴承：独立董事关于非公开发行股票及关联交易有关事项的独立意见,finalpage/2014-12-31/1200508334.PDF
647,2014-12-31,襄阳轴承：独立董事关于员工持股计划（草案）的独立意见,finalpage/2014-12-31/1200508335.PDF
648,2014-12-31,襄阳轴承：非公开发行股票募集资金使用可行性分析报告,finalpage/2014-12-31/1200508336.PDF
649,2014-12-31,襄阳轴承：前次募集资金使用情况报告,finalpage/2014-12-31/1200508337.PDF
650,2014-12-31,襄阳轴承：前次募集资金使用情况鉴证报告,finalpage/2014-12-31/1200508338.PDF
651,2014-12-31,襄阳轴承：关于股票复牌的公告,finalpage/2014-12-31/1200508339.PDF
652,2014-12-31,襄阳轴承：第一期员工持股计划（草案）（非公开发行方式认购）,finalpage/2014-12-31/1200508340.PDF
653,2014-12-31,襄阳轴承：第一期员工持股计划（草案）摘要（非公开发行方式认购）,finalpage/2014-12-31/1200508341.PDF
654,2014-12-31,襄阳轴承：监事会关于襄阳轴承第一期员工持股计划相关事项的审核意见,finalpage/2014-12-31/1200508342.PDF
655,2014-12-31,襄阳轴承：关于公司非公开发行股票涉及关联交易事项暨签订附条件生效的股份认购合同的公告,finalpage/2014-12-31/1200508343.PDF
656,2014-12-31,襄阳轴承：公司与上银基金管理有限公司关于公司非公开发行股票之附生效条件的股份认购协议,finalpage/2014-12-31/1200508344.PDF
657,2014-12-31,襄阳轴承：公司与湖北新海天投资有限公司关于公司非公开发行股票之附生效条件的股份认购协议,finalpage/2014-12-31/1200508345.PDF
658,2014-12-31,襄阳轴承：未来三年（2015-2017年）股东回报规划,finalpage/2014-12-31/1200508346.PDF
659,2014-12-31,襄阳轴承：独立董事关于《未来三年（2015年-2017年）股东回报规划》的独立意见,finalpage/2014-12-31/1200508347.PDF
660,2014-12-31,襄阳轴承：公司章程修正案,finalpage/2014-12-31/1200508348.PDF
661,2014-12-31,襄阳轴承：简式权益变动报告书,finalpage/2014-12-31/1200508349.PDF
662,2014-12-31,襄阳轴承：非公开发行A股股票预案,finalpage/2014-12-31/1200508350.PDF
663,2014-12-31,襄阳轴承：上银基金财富28号资产管理计划资产管理合同,finalpage/2014-12-31/1200508351.PDF
664,2014-12-31,襄阳轴承：上银基金财富29号资产管理计划资产管理合同,finalpage/2014-12-31/1200508352.PDF
665,2014-12-31,襄阳轴承：上银基金财富30号资产管理计划资产管理合同,finalpage/2014-12-31/1200508353.PDF
666,2014-12-31,襄阳轴承：非公开发行股票认购对象关于资金来源及不存在结构化承诺书（一）,finalpage/2014-12-31/1200508354.PDF
667,2014-12-31,襄阳轴承：非公开发行股票认购对象关于资金来源及不存在结构化承诺书（二）,finalpage/2014-12-31/1200508355.PDF
668,2014-12-31,襄阳轴承：关于公司第一期员工持股计划（草案）之法律意见书,finalpage/2014-12-31/1200508356.PDF
669,2015-01-06,襄阳轴承：关于获得政府补贴的公告,finalpage/2015-01-06/1200521193.PDF
670,2015-01-30,襄阳轴承：2014年度业绩预告,finalpage/2015-01-30/1200590454.PDF
671,2015-02-14,襄阳轴承：关于保荐机构合并重组及业务承继公告,finalpage/2015-02-14/1200636722.PDF
672,2015-03-10,襄阳轴承：关于获得政府补贴的公告,finalpage/2015-03-10/1200682250.PDF
673,2015-03-21,襄阳轴承：五届董事会第二十五次会议决议公告,finalpage/2015-03-21/1200722477.PDF
674,2015-03-21,襄阳轴承：关于修改向湖北银行襄阳分行檀溪支行申请授信额度的公告,finalpage/2015-03-21/1200722478.PDF
675,2015-03-21,襄阳轴承：独立董事事前认可及独立意见,finalpage/2015-03-21/1200722479.PDF
676,2015-04-10,襄阳轴承：关于召开2015年第一次临时股东大会的通知,finalpage/2015-04-10/1200803620.PDF
677,2015-04-10,襄阳轴承：关于非公开发行股票事项获得湖北省国资委批复的公告,finalpage/2015-04-10/1200803621.PDF
678,2015-04-15,襄阳轴承：2014年度业绩快报,finalpage/2015-04-15/1200831930.PDF
679,2015-04-15,襄阳轴承：2015年第一季度业绩预告,finalpage/2015-04-15/1200831931.PDF
680,2015-04-22,襄阳轴承：关于召开2015年第一次临时股东大会的提示性公告,finalpage/2015-04-22/1200881433.PDF
681,2015-04-25,襄阳轴承：2014年度募集资金存放与实际使用情况的专项报告,finalpage/2015-04-25/1200904848.PDF
682,2015-04-25,襄阳轴承：关于重大资产购买项目2014年度盈利预测完成情况的说明,finalpage/2015-04-25/1200904849.PDF
683,2015-04-25,襄阳轴承：关于会计政策变更的公告,finalpage/2015-04-25/1200904850.PDF
684,2015-04-25,襄阳轴承：关于应收账款核销的公告,finalpage/2015-04-25/1200904851.PDF
685,2015-04-25,襄阳轴承：关于前期会计差错更正及追溯调事项的公告,finalpage/2015-04-25/1200904852.PDF
686,2015-04-25,襄阳轴承：独立董事的专项说明及独立意见,finalpage/2015-04-25/1200904853.PDF
687,2015-04-25,襄阳轴承：内部控制审计报告,finalpage/2015-04-25/1200904854.PDF
688,2015-04-25,襄阳轴承：重大资产购买项目2014年度盈利预测完成情况专项审核报告,finalpage/2015-04-25/1200904855.PDF
689,2015-04-25,襄阳轴承：前期会计差错更正及追溯调整事项专项审核报告,finalpage/2015-04-25/1200904856.PDF
690,2015-04-25,襄阳轴承：2014年度募集资金存放与使用情况专项审核报告,finalpage/2015-04-25/1200904857.PDF
691,2015-04-25,襄阳轴承：申万宏源证券承销保荐有限责任公司关于公司预计2015年度日常关联交易事项的核查意见,finalpage/2015-04-25/1200904858.PDF
692,2015-04-25,襄阳轴承：申万宏源证券承销保荐有限责任公司关于公司2014年度内部控制评价报告的核查意见,finalpage/2015-04-25/1200904859.PDF
693,2015-04-25,襄阳轴承：申万宏源证券承销保荐有限责任公司关于公司2014年度募集资金存放与实际使用情况专项核查报告,finalpage/2015-04-25/1200904860.PDF
694,2015-04-25,襄阳轴承：长江证券承销保荐有限公司关于公司重大资产重组2014年度盈利预测完成情况的核查意见,finalpage/2015-04-25/1200904861.PDF
695,2015-04-25,襄阳轴承：2014年度独立董事述职报告,finalpage/2015-04-25/1200904862.PDF
696,2015-04-25,襄阳轴承：2015年日常关联交易预计公告,finalpage/2015-04-25/1200904863.PDF
697,2015-04-25,襄阳轴承：2014年年度报告摘要,finalpage/2015-04-25/1200904864.PDF
698,2015-04-25,襄阳轴承：2014年年度审计报告,finalpage/2015-04-25/1200904866.PDF
699,2015-04-25,襄阳轴承：五届董事会第二十六次会议决议公告,finalpage/2015-04-25/1200904867.PDF
700,2015-04-25,襄阳轴承：关于召开2014年度股东大会的通知,finalpage/2015-04-25/1200904868.PDF
701,2015-04-25,襄阳轴承：五届监事会第十七次会议决议,finalpage/2015-04-25/1200904869.PDF
702,2015-04-25,襄阳轴承：2014年度控股股东及其他关联方资金占用情况的专项说明,finalpage/2015-04-25/1200904870.PDF
703,2015-04-25,襄阳轴承：2014年度内部控制评价报告,finalpage/2015-04-25/1200904871.PDF
704,2015-04-25,襄阳轴承：2014年年度报告,finalpage/2015-04-25/1200904872.PDF
705,2015-04-28,襄阳轴承：2015年第一次临时股东大会决议公告,finalpage/2015-04-28/1200921469.PDF
706,2015-04-28,襄阳轴承：公司章程（2015年4月）,finalpage/2015-04-28/1200921470.PDF
707,2015-04-28,襄阳轴承：2015年第一次临时股东大会法律意见,finalpage/2015-04-28/1200921471.PDF
