date,title,url
2007-07-12,建投能源：接待和推广工作制度,finalpage/2007-07-12/29788690.PDF
2007-07-12,建投能源：信息披露管理制度,finalpage/2007-07-12/29788691.PDF
2007-07-17,建投能源：股票交易异常波动公告,finalpage/2007-07-17/29913888.PDF
2007-08-25,建投能源：关于更换职工监事的公告,finalpage/2007-08-25/31051953.PDF
2007-08-29,建投能源：业绩预告公告,finalpage/2007-08-29/31142419.PDF
2007-08-29,建投能源：关于召开2007年第一次临时股东大会的通知,finalpage/2007-08-29/31142413.PDF
2007-08-29,建投能源：第五届监事会第五次会议决议公告,finalpage/2007-08-29/31142414.PDF
2007-08-29,建投能源：2007年半年度报告摘要,finalpage/2007-08-29/31142415.PDF
2007-08-29,建投能源：2007年半年度财务报告,finalpage/2007-08-29/31142416.PDF
2007-08-29,建投能源：第五届董事会第五次会议决议公告,finalpage/2007-08-29/31142417.PDF
2007-08-29,建投能源：2007年半年度报告,finalpage/2007-08-29/31142418.PDF
2007-08-29,建投能源：2007年第一次临时股东大会会议文件,finalpage/2007-08-29/31142420.PDF
2007-09-20,建投能源：董事会议事规则（2007年修订）,finalpage/2007-09-20/33200515.PDF
2007-09-20,建投能源：监事会议事规则（2007年修订）,finalpage/2007-09-20/33200551.PDF
2007-09-20,建投能源：2007年第一次临时股东大会决议公告,finalpage/2007-09-20/33200649.PDF
2007-09-20,建投能源：2007年第一次临时股东大会的法律意见书,finalpage/2007-09-20/33200650.PDF
2007-10-19,建投能源：第五届董事会第六次会议决议公告,finalpage/2007-10-19/33887976.PDF
2007-10-19,建投能源：关于召开2007年第二次临时股东大会的通知,finalpage/2007-10-19/33887977.PDF
2007-10-19,建投能源：第五届监事会第六次会议决议公告,finalpage/2007-10-19/33887978.PDF
2007-10-19,建投能源：2007年第三季度报告,finalpage/2007-10-19/33887980.PDF
2007-10-19,建投能源：业绩预告公告,finalpage/2007-10-19/33887981.PDF
2007-10-19,建投能源：关联交易公告,finalpage/2007-10-19/33887982.PDF
2007-10-19,建投能源：对外担保管理办法,finalpage/2007-10-19/33887983.PDF
2007-10-19,建投能源：2007年第二次临时股东大会会议文件,finalpage/2007-10-19/33887984.PDF
2007-11-01,建投能源：“加强上市公司治理专项活动”整改工作报告,finalpage/2007-11-01/34975565.PDF
2007-11-01,建投能源：第五届董事会第五次临时会议决议公告,finalpage/2007-11-01/34975566.PDF
2007-11-09,建投能源：2007年第二次临时股东大会决议公告,finalpage/2007-11-09/35176994.PDF
2007-11-22,建投能源：关于增资石家庄商业银行的公告,finalpage/2007-11-22/35498210.PDF
2007-11-22,建投能源：第五届董事会第六次临时会议决议公告,finalpage/2007-11-22/35498211.PDF
2007-11-23,建投能源：关于股东偿还垫付对价的公告,finalpage/2007-11-23/35527655.PDF
2007-11-23,建投能源：限售股份上市流通提示性公告,finalpage/2007-11-23/35527656.PDF
2007-11-24,建投能源：关于拟参股设立国电榆次热电有限公司的对外投资公告,finalpage/2007-11-24/35533304.PDF
2007-12-29,建投能源：第五届董事会第七次临时会议决议公告,finalpage/2007-12-29/36335617.PDF
2008-02-02,建投能源：2007年年度报告摘要,finalpage/2008-02-02/37173585.PDF
2008-02-02,建投能源：2007年年度财务报告之审计报告,finalpage/2008-02-02/37173586.PDF
2008-02-02,建投能源：第五届董事会第七次会议决议公告,finalpage/2008-02-02/37173587.PDF
2008-02-02,建投能源：关于召开2007年年度股东大会的通知,finalpage/2008-02-02/37173588.PDF
2008-02-02,建投能源：第五届监事会第七次会议决议公告,finalpage/2008-02-02/37173589.PDF
2008-02-02,建投能源：2007年年度报告,finalpage/2008-02-02/37173590.PDF
2008-02-02,建投能源：关联交易公告,finalpage/2008-02-02/37173591.PDF
2008-03-01,建投能源：2007年年度股东大会决议公告,finalpage/2008-03-01/37648566.PDF
2008-03-13,建投能源：非公开发行股份解除限售的提示性公告,finalpage/2008-03-13/37928415.PDF
2008-04-12,建投能源：2007年度分红派息公告,finalpage/2008-04-12/38710116.PDF
2008-04-29,建投能源：第五届董事会第八次会议决议公告,finalpage/2008-04-29/39222481.PDF
2008-04-29,建投能源：第五届监事会第八次会议决议公告,finalpage/2008-04-29/39222482.PDF
2008-04-29,建投能源：2008年第一季度报告,finalpage/2008-04-29/39222485.PDF
2008-04-29,建投能源：第五届董事会独立董事独立意见,finalpage/2008-04-29/39222486.PDF
2008-05-15,建投能源：关于拟参股设立国电长治热电有限公司的对外投资公告,finalpage/2008-05-15/39735144.PDF
2008-07-08,建投能源：关于公司控股子公司电价调整的公告,finalpage/2008-07-08/41093686.PDF
2008-07-10,建投能源：关于增资石家庄市商业银行的重大事项进展公告,finalpage/2008-07-10/41139474.PDF
2008-07-26,建投能源：2008年中期业绩预告公告,finalpage/2008-07-26/41594888.PDF
2008-07-26,建投能源：关于“加强上市公司治理专项活动”所涉事项的整改情况说明,finalpage/2008-07-26/41594889.PDF
2008-07-26,建投能源：第五届董事会第八次临时会议决议公告,finalpage/2008-07-26/41594890.PDF
2008-08-13,建投能源：第五届董事会第九次临时会议决议公告,finalpage/2008-08-13/42051812.PDF
2008-08-13,建投能源：关联交易公告,finalpage/2008-08-13/42051811.PDF
2008-08-23,建投能源：关于公司控股子公司电价再次调整的公告,finalpage/2008-08-23/42457281.PDF
2008-08-30,建投能源：2008年半年度财务报告之审计报告,finalpage/2008-08-30/42814484.PDF
2008-08-30,建投能源：业绩预告公告,finalpage/2008-08-30/42814355.PDF
2008-08-30,建投能源：关于召开2008年第一次临时股东大会的通知,finalpage/2008-08-30/42814356.PDF
2008-08-30,建投能源：2008年半年度报告摘要,finalpage/2008-08-30/42814357.PDF
2008-08-30,建投能源：第五届董事会第九次会议决议公告,finalpage/2008-08-30/42814358.PDF
2008-08-30,建投能源：2008年半年度报告,finalpage/2008-08-30/42814359.PDF
2008-08-30,建投能源：关于控股子公司会计估计变更的公告,finalpage/2008-08-30/42814360.PDF
2008-08-30,建投能源：第五届监事会第九次会议决议公告,finalpage/2008-08-30/42814361.PDF
2008-09-18,建投能源：公司章程（2008年修订）,finalpage/2008-09-18/43476080.PDF
2008-09-18,建投能源：2008年第一次临时股东大会决议公告,finalpage/2008-09-18/43476081.PDF
2008-10-07,建投能源：关于增资石家庄市商业银行的重大事项进展公告,finalpage/2008-10-07/43807961.PDF
2008-10-16,建投能源：2008年中期分红派息公告,finalpage/2008-10-16/44210566.PDF
2008-10-22,建投能源：2008年全年业绩预告公告,finalpage/2008-10-22/44417679.PDF
2008-10-22,建投能源：2008年第三季度报告,finalpage/2008-10-22/44417682.PDF
2008-11-01,建投能源：关于控股股东增持本公司股份情况的公告,finalpage/2008-11-01/45894348.PDF
2008-11-27,建投能源：关于召开2008年第二次临时股东大会的通知,finalpage/2008-11-27/46697388.PDF
2008-11-27,建投能源：2008年第二次临时股东大会会议文件,finalpage/2008-11-27/46697436.PDF
2008-11-27,建投能源：第五届董事会第十一次临时会议决议公告,finalpage/2008-11-27/46697387.PDF
2008-11-27,建投能源：募集资金管理办法（2008年修订）,finalpage/2008-11-27/46697389.PDF
2008-11-27,建投能源：债券持有人会议规则,finalpage/2008-11-27/46697390.PDF
2008-11-27,建投能源：第五届监事会第二次临时会议决议公告,finalpage/2008-11-27/46697391.PDF
2008-12-03,建投能源：限售股份上市流通的提示性公告,finalpage/2008-12-03/46899216.PDF
2008-12-09,建投能源：关于召开2008年第二次临时股东大会的提示性公告,finalpage/2008-12-09/47106543.PDF
2008-12-13,建投能源：公司章程,finalpage/2008-12-13/47289698.PDF
2008-12-13,建投能源：2008年第二次临时股东大会决议公告,finalpage/2008-12-13/47289699.PDF
2008-12-13,建投能源：董事会议事规则（2008年修订）,finalpage/2008-12-13/47289700.PDF
2008-12-20,建投能源：关于更换保荐代表人的公告,finalpage/2008-12-20/47529482.PDF
2009-02-06,建投能源：2008年年度报告,finalpage/2009-02-06/48906765.PDF
2009-02-06,建投能源：2008年年度股东大会会议文件,finalpage/2009-02-06/48906758.PDF
2009-02-06,建投能源：2008年年度报告摘要,finalpage/2009-02-06/48906759.PDF
2009-02-06,建投能源：2008年度财务报告之审计报告,finalpage/2009-02-06/48906761.PDF
2009-02-06,建投能源：第五届董事会第十一次会议决议公告,finalpage/2009-02-06/48906762.PDF
2009-02-06,建投能源：关于召开2008年年度股东大会的通知,finalpage/2009-02-06/48906763.PDF
2009-02-06,建投能源：第五届监事会第十一次会议决议公告,finalpage/2009-02-06/48906764.PDF
2009-02-06,建投能源：内部控制自我评价报告,finalpage/2009-02-06/48906766.PDF
2009-02-06,建投能源：2009年日常关联交易公告,finalpage/2009-02-06/48906767.PDF
2009-02-28,建投能源：公司章程（2009年2月）,finalpage/2009-02-28/49624907.PDF
2009-02-28,建投能源：2008年年度股东大会决议公告,finalpage/2009-02-28/49624908.PDF
2009-03-07,建投能源：第五届董事会第十二次临时会议决议公告,finalpage/2009-03-07/49890278.PDF
2009-03-07,建投能源：关于召开2009年第一次临时股东大会的通知,finalpage/2009-03-07/49890275.PDF
2009-03-07,建投能源：关于投资建设沙河2×60万千瓦发电项目的对外投资暨关联交易公告,finalpage/2009-03-07/49890276.PDF
2009-03-07,建投能源：第五届监事会第三次临时会议决议公告,finalpage/2009-03-07/49890277.PDF
2009-03-26,建投能源：2009年第一次临时股东大会决议公告,finalpage/2009-03-26/50575726.PDF
2009-04-22,建投能源：2009年第二次临时股东大会会议文件,finalpage/2009-04-22/51552365.PDF
2009-04-22,建投能源：关于控股子公司2009年度替代发电的关联交易公告,finalpage/2009-04-22/51551864.PDF
2009-04-22,建投能源：关于召开2009年第二次临时股东大会的通知,finalpage/2009-04-22/51551865.PDF
2009-04-22,建投能源：2009年第一季度报告,finalpage/2009-04-22/51551868.PDF
2009-04-22,建投能源：关于收购河北建投任丘热电有限责任公司60%股权并继续增资的关联交易暨对外投资公告,finalpage/2009-04-22/51551869.PDF
2009-04-22,建投能源：第五届监事会第十二次会议决议公告,finalpage/2009-04-22/51551870.PDF
2009-04-22,建投能源：第五届董事会第十二次会议决议公告,finalpage/2009-04-22/51551871.PDF
2009-04-22,建投能源：关于控股子公司西柏坡发电公司委托建投燃料公司采购部分燃料的关联交易公告,finalpage/2009-04-22/51551872.PDF
2009-04-25,建投能源：关于2009年度第一期短期融资券发行情况的公告,finalpage/2009-04-25/51741972.PDF
2009-05-04,建投能源：关于召开2009年第二次临时股东大会的提示性公告,finalpage/2009-05-04/52031897.PDF
2009-05-08,建投能源：中国人寿资产管理有限公司简式权益变动报告书,finalpage/2009-05-08/52273922.PDF
2009-05-09,建投能源：2009年第二次临时股东大会决议公告,finalpage/2009-05-09/52326088.PDF
2009-05-13,建投能源：第六届监事会第一次临时会议决议公告,finalpage/2009-05-13/52394472.PDF
2009-05-13,建投能源：第六届董事会第一次临时会议决议公告,finalpage/2009-05-13/52394473.PDF
2009-05-14,建投能源：2008年度分红派息实施公告,finalpage/2009-05-14/52449238.PDF
2009-06-02,建投能源：关于举行2008年度业绩说明会的公告,finalpage/2009-06-02/53022164.PDF
2009-06-25,建投能源：关于收购河北建投任丘热电有限责任公司60%股权的进展公告,finalpage/2009-06-25/53909554.PDF
2009-08-19,建投能源：2009年半年度财务报告,finalpage/2009-08-19/56088023.PDF
2009-08-19,建投能源：关于召开2009年第三次临时股东大会的通知,finalpage/2009-08-19/56086757.PDF
2009-08-19,建投能源：第六届监事会第一次会议决议公告,finalpage/2009-08-19/56086758.PDF
2009-08-19,建投能源：2009年半年度报告摘要,finalpage/2009-08-19/56086759.PDF
2009-08-19,建投能源：第六届董事会第一次会议决议公告,finalpage/2009-08-19/56086760.PDF
2009-08-19,建投能源：2009年半年度报告,finalpage/2009-08-19/56086761.PDF
2009-08-19,建投能源：关联交易公告,finalpage/2009-08-19/56086762.PDF
2009-08-28,建投能源：关于股东大会增加股东临时提案及延期召开的公告,finalpage/2009-08-28/56535496.PDF
2009-08-28,建投能源：关于董事长辞职的公告,finalpage/2009-08-28/56535497.PDF
2009-09-05,建投能源：2009年第三次临时股东大会的法律意见书,finalpage/2009-09-05/56893702.PDF
2009-09-05,建投能源：2009年第三次临时股东大会决议公告,finalpage/2009-09-05/56893703.PDF
2009-09-05,建投能源：第六届董事会第二次临时会议决议公告,finalpage/2009-09-05/56893704.PDF
2009-10-15,建投能源：2009年第三季度业绩预告公告,finalpage/2009-10-15/57144245.PDF
2009-10-23,建投能源：第六届董事会第二次会议决议公告,finalpage/2009-10-23/57186479.PDF
2009-10-23,建投能源：关于召开2009年第四次临时股东大会的通知,finalpage/2009-10-23/57186480.PDF
2009-10-23,建投能源：第六届监事会第二次会议决议公告,finalpage/2009-10-23/57186481.PDF
2009-10-23,建投能源：2009年第三季度报告,finalpage/2009-10-23/57186484.PDF
2009-10-23,建投能源：关于对2009年日常关联交易重新预计的公告,finalpage/2009-10-23/57186485.PDF
2009-11-06,建投能源：关于控股股东完成增持股份计划的公告,finalpage/2009-11-06/57260333.PDF
2009-11-11,建投能源：2009年第四次临时股东大会的法律意见书,finalpage/2009-11-11/57277582.PDF
2009-11-11,建投能源：关于公司控股子公司电价调整的公告,finalpage/2009-11-11/57277583.PDF
2009-11-11,建投能源：2009年第四次临时股东大会决议公告,finalpage/2009-11-11/57277584.PDF
2009-11-21,建投能源：关于控股子公司河北西柏坡发电有限责任公司电价调整的公告,finalpage/2009-11-21/57315976.PDF
2010-01-12,建投能源：关于河北任丘热电项目获得核准的公告,finalpage/2010-01-12/57494544.PDF
2010-01-20,建投能源：关于控股股东改制并更名的公告,finalpage/2010-01-20/57521169.PDF
2010-01-26,建投能源：关于控股子公司国泰发电公司通过建投燃料公司采购25万吨电煤的关联交易公告,finalpage/2010-01-26/57542767.PDF
2010-01-26,建投能源：第六届董事会第三次临时会议决议公告,finalpage/2010-01-26/57542768.PDF
2010-01-30,建投能源：2009年度业绩预告公告,finalpage/2010-01-30/57560779.PDF
2010-02-26,建投能源：2009年年度股东大会文件,finalpage/2010-02-26/57627872.PDF
2010-02-26,建投能源：2009年年度报告摘要,finalpage/2010-02-26/57627873.PDF
2010-02-26,建投能源：2009年年度报告,finalpage/2010-02-26/57627874.PDF
2010-02-26,建投能源：2009年年度审计报告,finalpage/2010-02-26/57627875.PDF
2010-02-26,建投能源：第六届董事会第三次会议决议公告,finalpage/2010-02-26/57627876.PDF
2010-02-26,建投能源：关于召开2009年年度股东大会的通知,finalpage/2010-02-26/57627877.PDF
2010-02-26,建投能源：第六届监事会第三次会议决议公告,finalpage/2010-02-26/57627878.PDF
2010-02-26,建投能源：关于公司2009年度控股股东及其他关联方资金占用情况的专项说明,finalpage/2010-02-26/57627879.PDF
2010-02-26,建投能源：2009年度内部控制自我评价报告,finalpage/2010-02-26/57627880.PDF
2010-02-26,建投能源：公开发行可转换公司债券募集资金运用可行性分析报告,finalpage/2010-02-26/57627881.PDF
2010-02-26,建投能源：2010年日常关联交易公告,finalpage/2010-02-26/57627882.PDF
2010-02-26,建投能源：关于河北沙河发电项目获得核准的公告,finalpage/2010-02-26/57627883.PDF
2010-03-12,建投能源：关于控股股东所持非公开发行股份解除限售的提示性公告,finalpage/2010-03-12/57680019.PDF
2010-03-16,建投能源：关于召开2009年年度股东大会的提示性公告,finalpage/2010-03-16/57690923.PDF
2010-03-20,建投能源：2009年年度股东大会决议公告,finalpage/2010-03-20/57709184.PDF
2010-03-20,建投能源：2009年年度股东大会的法律意见书,finalpage/2010-03-20/57709185.PDF
2010-03-25,建投能源：2009年度分红派息实施公告,finalpage/2010-03-25/57725694.PDF
2010-04-03,建投能源：前次募集资金使用情况报告,finalpage/2010-04-03/57770119.PDF
2010-04-03,建投能源：第六届董事会第四次临时会议决议公告,finalpage/2010-04-03/57770120.PDF
2010-04-14,建投能源：第六届董事会第五次临时会议决议公告,finalpage/2010-04-14/57808438.PDF
2010-04-30,建投能源：2010年第一季度报告正文,finalpage/2010-04-30/57896821.PDF
2010-04-30,建投能源：2010年第一季度报告全文,finalpage/2010-04-30/57896823.PDF
2010-05-22,建投能源：关于控股子公司2010年度替代发电关联交易的公告,finalpage/2010-05-22/57981753.PDF
2010-05-22,建投能源：关于召开2010年第一次临时股东大会的通知,finalpage/2010-05-22/57981754.PDF
2010-05-22,建投能源：第六届董事会第六次临时会议决议公告,finalpage/2010-05-22/57981755.PDF
2010-06-01,建投能源：关于举行2009年度业绩说明会的公告,finalpage/2010-06-01/58015073.PDF
2010-06-09,建投能源：2010年第一次临时股东大会的法律意见书,finalpage/2010-06-09/58050291.PDF
2010-06-09,建投能源：2010年第一次临时股东大会决议公告,finalpage/2010-06-09/58050292.PDF
2010-07-10,建投能源：2010年半年度业绩预告公告,finalpage/2010-07-10/58155898.PDF
2010-07-16,建投能源：董事会关于重大资产重组停牌公告,finalpage/2010-07-16/58179330.PDF
2010-07-23,建投能源：重大事项进展公告,finalpage/2010-07-23/58208336.PDF
2010-07-24,建投能源：2010年半年度财务报告,finalpage/2010-07-24/58213029.PDF
2010-07-24,建投能源：2010年半年度报告摘要,finalpage/2010-07-24/58212942.PDF
2010-07-24,建投能源：第六届董事会第五次会议决议公告,finalpage/2010-07-24/58212943.PDF
2010-07-24,建投能源：关于召开2010年第二次临时股东大会的通知,finalpage/2010-07-24/58212944.PDF
2010-07-24,建投能源：第六届监事会第五次会议决议公告,finalpage/2010-07-24/58212945.PDF
2010-07-24,建投能源：2010年半年度报告,finalpage/2010-07-24/58212946.PDF
2010-07-30,建投能源：重大事项进展公告,finalpage/2010-07-30/58236924.PDF
2010-08-06,建投能源：重大事项进展公告,finalpage/2010-08-06/58268726.PDF
2010-08-10,建投能源：关于召开2010年第二次临时股东大会的提示性公告,finalpage/2010-08-10/58281905.PDF
2010-08-11,建投能源：2010年第二次临时股东大会决议公告,finalpage/2010-08-11/58287212.PDF
2010-08-11,建投能源：2010年第二次临时股东大会法律意见书,finalpage/2010-08-11/58287213.PDF
2010-08-13,建投能源：关于重大资产重组进展情况暨股票延期复牌的公告,finalpage/2010-08-13/58297041.PDF
2010-08-20,建投能源：重大事项进展公告,finalpage/2010-08-20/58327617.PDF
2010-08-27,建投能源：重大事项进展公告,finalpage/2010-08-27/58361869.PDF
2010-08-30,建投能源：广发证券股份有限公司关于公司发行股份购买资产暨关联交易预案之独立财务顾问核查意见,finalpage/2010-08-30/58368589.PDF
2010-08-30,建投能源：第六届董事会独立董事对发行股份购买资产暨关联交易事项的独立意见,finalpage/2010-08-30/58368558.PDF
2010-08-30,建投能源：董事会关于重组履行法定程序的完备性、合规性及提交法律文件的有效性的说明,finalpage/2010-08-30/58368559.PDF
2010-08-30,建投能源：北京市重光律师事务所关于公司发行股份购买资产暨关联交易相关人员买卖股票情况的专项法律意见书,finalpage/2010-08-30/58368560.PDF
2010-08-30,建投能源：第六届董事会第七次临时会议决议公告,finalpage/2010-08-30/58368561.PDF
2010-08-30,建投能源：发行股份购买资产暨关联交易预案,finalpage/2010-08-30/58368563.PDF
2010-09-02,建投能源：股票交易异常波动公告,finalpage/2010-09-02/58388980.PDF
2010-09-04,建投能源：关于公司董事会秘书辞职的公告,finalpage/2010-09-04/58400742.PDF
2010-10-14,建投能源：2010年第三季度业绩预告公告,finalpage/2010-10-14/58521216.PDF
2010-10-23,建投能源：第六届监事会第二次临时会议决议公告,finalpage/2010-10-23/58559824.PDF
2010-10-23,建投能源：第六届董事会第八次临时会议决议公告,finalpage/2010-10-23/58559826.PDF
2010-10-23,建投能源：关于控股子公司会计估计变更的公告,finalpage/2010-10-23/58559827.PDF
2010-10-26,建投能源：关于召开2010年第三次临时股东大会的通知,finalpage/2010-10-26/58569808.PDF
2010-10-26,建投能源：2010年第三季度报告正文,finalpage/2010-10-26/58569809.PDF
2010-10-26,建投能源：2010年第三季度报告全文,finalpage/2010-10-26/58569811.PDF
2010-10-26,建投能源：第六届董事会第六次会议决议公告,finalpage/2010-10-26/58569813.PDF
2010-10-26,建投能源：关于对2010年日常关联交易重新预计的公告,finalpage/2010-10-26/58569814.PDF
2010-11-12,建投能源：2010年第三次临时股东大会决议公告,finalpage/2010-11-12/58654276.PDF
2010-12-04,建投能源：关于财政部驻河北省财政监察专员办事处对公司会计信息质量检查及公司整改情况公告,finalpage/2010-12-04/58740103.PDF
2010-12-18,建投能源：第六届董事会第九次临时会议决议公告,finalpage/2010-12-18/58798516.PDF
2010-12-18,建投能源：关于设立河北建投国融能源服务股份有限公司的对外投资暨关联交易公告,finalpage/2010-12-18/58798518.PDF
2010-12-18,建投能源：独立董事关于董事会聘任公司高级管理人员的独立意见,finalpage/2010-12-18/58798519.PDF
2010-12-18,建投能源：第六届董事会独立董事对关联交易事项的独立意见,finalpage/2010-12-18/58798520.PDF
2011-01-12,建投能源：关于河北建投国融能源服务股份有限公司注册成立的公告,finalpage/2011-01-12/58891419.PDF
2011-01-29,建投能源：2010年度业绩预告公告,finalpage/2011-01-29/58962784.PDF
2011-02-24,建投能源：详式权益变动报告书,finalpage/2011-02-24/59038145.PDF
2011-02-24,建投能源：广发证券股份有限公司关于公司发行股份购买资产暨关联交易之独立财务顾问报告,finalpage/2011-02-24/59038147.PDF
2011-02-24,建投能源：发行股份购买资产暨关联交易报告书,finalpage/2011-02-24/59038148.PDF
2011-02-24,建投能源：发行股份购买资产暨关联交易报告书（摘要）,finalpage/2011-02-24/59038150.PDF
2011-02-24,建投能源：关于召开2011年第一次临时股东大会的通知,finalpage/2011-02-24/59038152.PDF
2011-02-24,建投能源：河北国华沧东发电有限责任公司审计报告（2008年-2010年1-6月）,finalpage/2011-02-24/59038153.PDF
2011-02-24,建投能源：河北国华沧东发电有限责任公司审计报告（2010年11月30日）,finalpage/2011-02-24/59038154.PDF
2011-02-24,建投能源：拟发行股份收购河北国华沧东发电有限责任公司40%股权项目资产评估报告书,finalpage/2011-02-24/59038155.PDF
2011-02-24,建投能源：第六届董事会第十次临时会议决议公告,finalpage/2011-02-24/59038158.PDF
2011-02-24,建投能源：董事会关于重组履行法定程序的完备性、合规性及提交法律文件的有效性的说明,finalpage/2011-02-24/59038159.PDF
2011-02-24,建投能源：第六届董事会独立董事对发行股份购买资产暨关联交易事项的独立意见,finalpage/2011-02-24/59038160.PDF
2011-02-24,建投能源：河北建设投资集团有限责任公司与公司关于发行股份购买资产协议,finalpage/2011-02-24/59038161.PDF
2011-02-24,建投能源：北京市重光律师事务所关于公司发行股份购买资产暨关联交易法律意见书,finalpage/2011-02-24/59038162.PDF
2011-02-24,建投能源：审计报告（2010年11月30日）,finalpage/2011-02-24/59038164.PDF
2011-02-24,建投能源：备考盈利预测审核报告（2010年6月30日）,finalpage/2011-02-24/59038165.PDF
2011-02-24,建投能源：盈利预测审核报告（2010年7-12月、2011年）,finalpage/2011-02-24/59038166.PDF
2011-02-24,建投能源：2009年度及截止2010年11月30日止备考合并财务报表及专项审计报告,finalpage/2011-02-24/59038167.PDF
2011-02-24,建投能源：河北建设投资集团有限责任公司出售资产模拟合并盈利预测审核报告（2010年7月至2011年12月）,finalpage/2011-02-24/59038168.PDF
2011-02-24,建投能源：秦皇岛秦热发电有限责任公司审计报告（2010年11月30日）,finalpage/2011-02-24/59038169.PDF
2011-02-24,建投能源：秦皇岛秦热发电有限责任公司2008年至2010年6月两年一期审计报告,finalpage/2011-02-24/59038170.PDF
