,date,title,url
254,2009-06-02,襄阳轴承：长江证券承销保荐有限公司关于公司详式权益变动报告书之财务顾问核查意见,finalpage/2009-06-02/53034187.PDF
255,2009-06-02,襄阳轴承：襄樊市人民政府国有资产监督管理委员会简式权益变动报告书,finalpage/2009-06-02/53034185.PDF
256,2009-06-23,襄阳轴承：关于召开2009年第一次临时股东大会通知,finalpage/2009-06-23/53812383.PDF
257,2009-06-23,襄阳轴承：四届监事会第三次会议决议公告,finalpage/2009-06-23/53812384.PDF
258,2009-06-23,襄阳轴承：四届董事会第三次会议决议公告,finalpage/2009-06-23/53812385.PDF
259,2009-07-09,襄阳轴承：公司章程（2009年7月）,finalpage/2009-07-09/54418477.PDF
260,2009-07-09,襄阳轴承：关于选举职工监事的公告,finalpage/2009-07-09/54418478.PDF
261,2009-07-09,襄阳轴承：四届监事会第四次会议决议公告,finalpage/2009-07-09/54418479.PDF
262,2009-07-09,襄阳轴承：四届董事会第四次会议决议公告,finalpage/2009-07-09/54418480.PDF
263,2009-07-09,襄阳轴承：2009年第一次临时股东大会法律意见书,finalpage/2009-07-09/54418481.PDF
264,2009-07-09,襄阳轴承：2009年第一次临时股东大会决议公告,finalpage/2009-07-09/54418482.PDF
265,2009-07-16,襄阳轴承：2009年度（中期）业绩预告公告,finalpage/2009-07-16/54522848.PDF
266,2009-07-31,襄阳轴承：四届董事会第四次会议决议公告,finalpage/2009-07-31/55292906.PDF
267,2009-08-13,襄阳轴承：2009年半年度财务报告,finalpage/2009-08-13/55837941.PDF
268,2009-08-13,襄阳轴承：2009年半年度报告摘要,finalpage/2009-08-13/55837767.PDF
269,2009-08-13,襄阳轴承：2009年半年度报告,finalpage/2009-08-13/55837768.PDF
270,2009-08-13,襄阳轴承：独立董事对公司关联方资金占用和对外担保情况的专项说明和独立意见,finalpage/2009-08-13/55837769.PDF
271,2009-08-14,襄阳轴承：澄清公告,finalpage/2009-08-14/55911250.PDF
272,2009-08-21,襄阳轴承：关于国有法人股股权无偿划转获国务院国有资产监督管理委员会批准的提示性公告,finalpage/2009-08-21/56172919.PDF
273,2009-08-27,襄阳轴承：限售股份解除限售提示性公告,finalpage/2009-08-27/56457420.PDF
274,2009-09-17,襄阳轴承：澄清公告,finalpage/2009-09-17/57061302.PDF
275,2009-10-22,襄阳轴承：2009年第三季度报告,finalpage/2009-10-22/57179459.PDF
276,2009-12-05,襄阳轴承：董事会关于公司高管买卖公司股票情况的公告,finalpage/2009-12-05/57366297.PDF
277,2010-04-02,襄阳轴承：2009年年度审计报告,finalpage/2010-04-02/57765043.PDF
278,2010-04-02,襄阳轴承：2009年年度报告摘要,finalpage/2010-04-02/57764985.PDF
279,2010-04-02,襄阳轴承：四届董事会第八次会议决议公告,finalpage/2010-04-02/57764988.PDF
280,2010-04-02,襄阳轴承：关于召开2009年度股东大会通知,finalpage/2010-04-02/57764989.PDF
281,2010-04-02,襄阳轴承：四届监事会第七次会议决议公告,finalpage/2010-04-02/57764990.PDF
282,2010-04-02,襄阳轴承：关于公司2009年度控股股东及其他关联方资金占用情况的专项说明,finalpage/2010-04-02/57764991.PDF
283,2010-04-02,襄阳轴承：内部控制自我评价报告,finalpage/2010-04-02/57764992.PDF
284,2010-04-02,襄阳轴承：2009年年度报告,finalpage/2010-04-02/57764993.PDF
285,2010-04-02,襄阳轴承：内幕信息知情人登记制度（2010年4月）,finalpage/2010-04-02/57764994.PDF
286,2010-04-02,襄阳轴承：外部单位报送信息管理制度（2010年4月）,finalpage/2010-04-02/57764996.PDF
287,2010-04-02,襄阳轴承：年报报告制度（2010年4月）,finalpage/2010-04-02/57764997.PDF
288,2010-04-02,襄阳轴承：年报披露重大差错责任追究制度（2010年4月）,finalpage/2010-04-02/57764998.PDF
289,2010-04-02,襄阳轴承：独立董事候选人及提名人声明公告,finalpage/2010-04-02/57764999.PDF
290,2010-04-02,襄阳轴承：独立董事的专项说明及独立意见,finalpage/2010-04-02/57765000.PDF
291,2010-04-08,襄阳轴承：2010年第一季度业绩预告公告,finalpage/2010-04-08/57782408.PDF
292,2010-04-22,襄阳轴承：2010年第一季度报告正文,finalpage/2010-04-22/57848375.PDF
293,2010-04-22,襄阳轴承：2010年第一季度报告全文,finalpage/2010-04-22/57848295.PDF
294,2010-04-29,襄阳轴承：2009年度股东大会决议公告,finalpage/2010-04-29/57890521.PDF
295,2010-04-29,襄阳轴承：2009年年度股东大会法律意见书,finalpage/2010-04-29/57890522.PDF
296,2010-06-09,襄阳轴承：2009年年度审计报告（更正后）,finalpage/2010-06-09/58049998.PDF
297,2010-06-09,襄阳轴承：2009年年报更正公告,finalpage/2010-06-09/58049930.PDF
298,2010-06-09,襄阳轴承：2009年年度报告摘要（更正后）,finalpage/2010-06-09/58049931.PDF
299,2010-06-09,襄阳轴承：2009年年度报告（更正后）,finalpage/2010-06-09/58049932.PDF
300,2010-08-13,襄阳轴承：2010年半年度财务报告,finalpage/2010-08-13/58297028.PDF
301,2010-08-13,襄阳轴承：2010年半年度报告摘要,finalpage/2010-08-13/58296987.PDF
302,2010-08-13,襄阳轴承：独立董事对公司关联方资金占用和对外担保情况的专项说明和独立意见,finalpage/2010-08-13/58296988.PDF
303,2010-08-13,襄阳轴承：2010年半年度报告,finalpage/2010-08-13/58296989.PDF
304,2010-08-16,襄阳轴承：关于变更行业分类的公告,finalpage/2010-08-16/58301829.PDF
305,2010-09-11,襄阳轴承：2010年半年度报告（更正后）,finalpage/2010-09-11/58427935.PDF
306,2010-09-11,襄阳轴承：关于2010年半年度报告有关内容的更正公告,finalpage/2010-09-11/58427936.PDF
307,2010-10-22,襄阳轴承：2010年第三季度报告全文,finalpage/2010-10-22/58554749.PDF
308,2010-10-22,襄阳轴承：2010年第三季度报告正文,finalpage/2010-10-22/58554750.PDF
309,2011-01-15,襄阳轴承：关于公司坏账准备会计估计变更的公告,finalpage/2011-01-15/58906270.PDF
310,2011-01-15,襄阳轴承：关于拟购买土地资产的提示性公告,finalpage/2011-01-15/58906271.PDF
311,2011-01-15,襄阳轴承：四届董事会第十二次会议决议公告,finalpage/2011-01-15/58906272.PDF
312,2011-04-01,襄阳轴承：2010年度业绩预告公告,finalpage/2011-04-01/59214282.PDF
313,2011-04-08,襄阳轴承：2011年第一季度业绩预告公告,finalpage/2011-04-08/59235917.PDF
314,2011-04-08,襄阳轴承：关于公开挂牌转让武汉博大电气有限责任公司股权的提示性公告,finalpage/2011-04-08/59235918.PDF
315,2011-04-08,襄阳轴承：2010年度业绩快报,finalpage/2011-04-08/59236106.PDF
316,2011-04-20,襄阳轴承：2011年日常关联交易预计公告,finalpage/2011-04-20/59297952.PDF
317,2011-04-20,襄阳轴承：2010年年度报告摘要,finalpage/2011-04-20/59297953.PDF
318,2011-04-20,襄阳轴承：2010年年度审计报告,finalpage/2011-04-20/59297955.PDF
319,2011-04-20,襄阳轴承：四届董事会第十四次会议决议公告,finalpage/2011-04-20/59297956.PDF
320,2011-04-20,襄阳轴承：关于召开2010年度股东大会通知,finalpage/2011-04-20/59297957.PDF
321,2011-04-20,襄阳轴承：四届监事会第十一次会议决议公告,finalpage/2011-04-20/59297958.PDF
322,2011-04-20,襄阳轴承：关于公司2010年度控股股东及其他关联方资金占用情况的专项说明,finalpage/2011-04-20/59297959.PDF
323,2011-04-20,襄阳轴承：内部控制自我评价报告,finalpage/2011-04-20/59297960.PDF
324,2011-04-20,襄阳轴承：2010年年度报告,finalpage/2011-04-20/59297961.PDF
325,2011-04-20,襄阳轴承：关于前期会计差错更正的公告,finalpage/2011-04-20/59297962.PDF
326,2011-04-20,襄阳轴承：2010年度独立董事述职报告,finalpage/2011-04-20/59297963.PDF
327,2011-04-20,襄阳轴承：独立董事及审计委员会年报工作制度（2011年4月）,finalpage/2011-04-20/59297964.PDF
328,2011-04-20,襄阳轴承：独立董事的专项说明及独立意见,finalpage/2011-04-20/59297965.PDF
329,2011-04-20,襄阳轴承：关于公司2010年度前期差错更正事项的专项说明,finalpage/2011-04-20/59297966.PDF
330,2011-04-23,襄阳轴承：澄清公告,finalpage/2011-04-23/59323916.PDF
331,2011-04-28,襄阳轴承：2011年第一季度报告正文,finalpage/2011-04-28/59352928.PDF
332,2011-04-28,襄阳轴承：2011年第一季度报告全文,finalpage/2011-04-28/59352930.PDF
333,2011-05-11,襄阳轴承：四届十六次董事会决议暨关于确定公开挂牌转让武汉博大电气有限责任公司股权价格的提示性公告,finalpage/2011-05-11/59411969.PDF
334,2011-05-14,襄阳轴承：2010年度股东大会决议公告,finalpage/2011-05-14/59427350.PDF
335,2011-05-14,襄阳轴承：2010年年度股东大会法律意见书,finalpage/2011-05-14/59427351.PDF
336,2011-06-04,襄阳轴承：关联交易公告,finalpage/2011-06-04/59515518.PDF
337,2011-06-04,襄阳轴承：四届监事会第十三次会议决议公告,finalpage/2011-06-04/59515519.PDF
338,2011-06-04,襄阳轴承：四届董事会第十七次会议决议公告,finalpage/2011-06-04/59515520.PDF
339,2011-06-04,襄阳轴承：独立董事的专项说明及独立意见,finalpage/2011-06-04/59515521.PDF
340,2011-06-04,襄阳轴承：辞职公告,finalpage/2011-06-04/59515522.PDF
341,2011-07-09,襄阳轴承：关于召开2011年第一次临时股东大会通知,finalpage/2011-07-09/59654411.PDF
342,2011-07-09,襄阳轴承：四届董事会第十八次会议决议公告,finalpage/2011-07-09/59654412.PDF
343,2011-07-09,襄阳轴承：独立董事的专项说明及独立意见,finalpage/2011-07-09/59654413.PDF
344,2011-07-09,襄阳轴承：出售资产公告,finalpage/2011-07-09/59654414.PDF
345,2011-07-09,襄阳轴承：2011年半年度业绩预告公告,finalpage/2011-07-09/59654415.PDF
346,2011-07-26,襄阳轴承：2011年第一次临时股东大会决议公告,finalpage/2011-07-26/59724731.PDF
347,2011-07-26,襄阳轴承：公司章程（2011年7月）,finalpage/2011-07-26/59724732.PDF
348,2011-07-26,襄阳轴承：2011年度第一次临时股东大会法律意见书,finalpage/2011-07-26/59724733.PDF
349,2011-07-26,襄阳轴承：股东大会议事规则（2011年7月）,finalpage/2011-07-26/59724734.PDF
350,2011-07-28,襄阳轴承：2011年半年度报告摘要,finalpage/2011-07-28/59735432.PDF
351,2011-07-28,襄阳轴承：2011年半年度财务报告,finalpage/2011-07-28/59735438.PDF
352,2011-07-28,襄阳轴承：2011年半年度报告,finalpage/2011-07-28/59735439.PDF
353,2011-07-28,襄阳轴承：独立董事对公司关联方资金占用和对外担保情况的专项说明和独立意见,finalpage/2011-07-28/59735440.PDF
354,2011-09-27,襄阳轴承：停牌公告,finalpage/2011-09-27/60004017.PDF
355,2011-10-11,襄阳轴承：前次募集资金使用情况鉴证报告,finalpage/2011-10-11/60040700.PDF
356,2011-10-11,襄阳轴承：前次募集资金使用情况报告,finalpage/2011-10-11/60040701.PDF
357,2011-10-11,襄阳轴承：四届董事会第二十次会议决议公告,finalpage/2011-10-11/60040702.PDF
358,2011-10-11,襄阳轴承：独立董事关于公司关联交易事项的事先认可函,finalpage/2011-10-11/60040703.PDF
359,2011-10-11,襄阳轴承：独立董事关于公司关联交易事项的独立意见,finalpage/2011-10-11/60040704.PDF
360,2011-10-11,襄阳轴承：非公开发行A股股票预案,finalpage/2011-10-11/60040705.PDF
361,2011-10-11,襄阳轴承：非公开发行A股股票募集资金运用的可行性分析报告,finalpage/2011-10-11/60040706.PDF
362,2011-10-26,襄阳轴承：2011年第三季度报告正文,finalpage/2011-10-26/60112052.PDF
363,2011-10-26,襄阳轴承：2011年第三季度报告全文,finalpage/2011-10-26/60112054.PDF
364,2011-11-11,襄阳轴承：关于非公开发行股票事项获得湖北省国资委批复的公告,finalpage/2011-11-11/60187343.PDF
365,2011-11-12,襄阳轴承：关于召开2011年第二次临时股东大会的通知,finalpage/2011-11-12/60192428.PDF
366,2011-11-16,襄阳轴承：关于公开挂牌转让武汉致远医疗科技有限公司股权的提示性公告,finalpage/2011-11-16/60206371.PDF
367,2011-11-16,襄阳轴承：四届董事会第二十二次会议决议公告,finalpage/2011-11-16/60206372.PDF
368,2011-11-19,襄阳轴承：关于召开2011年第二次临时股东大会的提示性公告,finalpage/2011-11-19/60220050.PDF
369,2011-11-29,襄阳轴承：2011年第二次临时股东大会决议公告,finalpage/2011-11-29/60255873.PDF
370,2011-11-29,襄阳轴承：2011年第二次临时股东大会法律意见,finalpage/2011-11-29/60255874.PDF
371,2011-12-01,襄阳轴承：收购报告书（摘要）,finalpage/2011-12-01/60266163.PDF
372,2011-12-07,襄阳轴承：关于召开2011年第三次临时股东大会通知,finalpage/2011-12-07/60293389.PDF
373,2011-12-07,襄阳轴承：四届监事会第十六次会议决议公告,finalpage/2011-12-07/60293390.PDF
374,2011-12-07,襄阳轴承：四届董事会第二十三次会议决议公告,finalpage/2011-12-07/60293391.PDF
375,2011-12-07,襄阳轴承：独立董事候选人声明（彭翰）,finalpage/2011-12-07/60293392.PDF
376,2011-12-07,襄阳轴承：独立董事候选人声明（徐长生）,finalpage/2011-12-07/60293393.PDF
377,2011-12-07,襄阳轴承：独立董事候选人声明（汪海粟）,finalpage/2011-12-07/60293394.PDF
378,2011-12-07,襄阳轴承：独立董事的专项说明及独立意见,finalpage/2011-12-07/60293395.PDF
379,2011-12-07,襄阳轴承：独立董事提名人声明,finalpage/2011-12-07/60293396.PDF
380,2011-12-07,襄阳轴承：关联交易管理制度（2011年12月）,finalpage/2011-12-07/60293397.PDF
381,2011-12-23,襄阳轴承：2011年第三次临时股东大会决议公告,finalpage/2011-12-23/60358029.PDF
382,2011-12-23,襄阳轴承：五届监事会第一次会议决议公告,finalpage/2011-12-23/60358030.PDF
383,2011-12-23,襄阳轴承：五届董事会第一次会议决议公告,finalpage/2011-12-23/60358031.PDF
384,2011-12-23,襄阳轴承：2011年第三次临时股东大会法律意见,finalpage/2011-12-23/60358032.PDF
385,2011-12-23,襄阳轴承：独立董事关于公司聘任高级管理人员、董事会秘书的独立意见,finalpage/2011-12-23/60358033.PDF
386,2011-12-23,襄阳轴承：工会关于推选公司五届监事会职工监事的决议,finalpage/2011-12-23/60358034.PDF
387,2011-12-24,襄阳轴承：关于三环集团公司避免和减少关联交易承诺的公告,finalpage/2011-12-24/60363089.PDF
388,2012-03-16,襄阳轴承：2012年日常关联交易预计公告,finalpage/2012-03-16/60677626.PDF
389,2012-03-16,襄阳轴承：2011年年度报告摘要,finalpage/2012-03-16/60677627.PDF
390,2012-03-16,襄阳轴承：2011年年度审计报告,finalpage/2012-03-16/60677629.PDF
391,2012-03-16,襄阳轴承：五届董事会第二次会议决议公告,finalpage/2012-03-16/60677630.PDF
392,2012-03-16,襄阳轴承：关于召开2011年度股东大会通知,finalpage/2012-03-16/60677631.PDF
393,2012-03-16,襄阳轴承：五届监事会第二次会议决议公告,finalpage/2012-03-16/60677632.PDF
394,2012-03-16,襄阳轴承：关于公司2011年度控股股东及其他关联方资金占用情况的专项说明,finalpage/2012-03-16/60677633.PDF
395,2012-03-16,襄阳轴承：内部控制自我评价报告,finalpage/2012-03-16/60677634.PDF
396,2012-03-16,襄阳轴承：2011年年度报告,finalpage/2012-03-16/60677635.PDF
397,2012-03-16,襄阳轴承：内幕信息知情人登记制度（2012年3月）,finalpage/2012-03-16/60677636.PDF
398,2012-03-16,襄阳轴承：内部控制鉴证报告,finalpage/2012-03-16/60677637.PDF
399,2012-03-16,襄阳轴承：2011年度独立董事述职报告,finalpage/2012-03-16/60677638.PDF
400,2012-03-16,襄阳轴承：独立董事的专项说明及独立意见,finalpage/2012-03-16/60677639.PDF
401,2012-03-16,襄阳轴承：内部控制规范实施工作方案,finalpage/2012-03-16/60677640.PDF
402,2012-03-16,襄阳轴承：外派人员管理制度（2012年3月）,finalpage/2012-03-16/60677641.PDF
403,2012-04-12,襄阳轴承：2011年度股东大会决议公告,finalpage/2012-04-12/60817082.PDF
404,2012-04-12,襄阳轴承：2011年年度股东大会法律意见书,finalpage/2012-04-12/60817083.PDF
405,2012-04-14,襄阳轴承：2012年第一季度业绩预告公告,finalpage/2012-04-14/60829401.PDF
406,2012-04-25,襄阳轴承：2012年日常关联交易预计调整公告,finalpage/2012-04-25/60899648.PDF
407,2012-04-25,襄阳轴承：2012年第一季度报告正文,finalpage/2012-04-25/60899652.PDF
408,2012-04-25,襄阳轴承：五届董事会第三次会议决议,finalpage/2012-04-25/60899654.PDF
409,2012-04-25,襄阳轴承：五届监事会第三次会议决议,finalpage/2012-04-25/60899655.PDF
410,2012-04-25,襄阳轴承：2012年第一季度报告全文,finalpage/2012-04-25/60899656.PDF
411,2012-04-25,襄阳轴承：关于召开2012年第一次临时股东大会通知,finalpage/2012-04-25/60899657.PDF
412,2012-04-25,襄阳轴承：关于公司2012年日常关联交易预计进行调整的事前认可和独立意见,finalpage/2012-04-25/60899658.PDF
413,2012-05-09,襄阳轴承：关于利润分配相关情况说明的自愿性信息披露公告,finalpage/2012-05-09/60970673.PDF
414,2012-05-12,襄阳轴承：2012年第一次临时股东大会决议公告,finalpage/2012-05-12/60986515.PDF
415,2012-05-12,襄阳轴承：2012年度第一次临时股东大会法律意见书,finalpage/2012-05-12/60986516.PDF
416,2012-05-14,襄阳轴承：停牌公告,finalpage/2012-05-14/60987158.PDF
417,2012-05-15,襄阳轴承：五届董事会第四次会议决议公告,finalpage/2012-05-15/60996606.PDF
418,2012-05-15,襄阳轴承：独立董事关于公司关联交易事项的事先认可函,finalpage/2012-05-15/60996607.PDF
419,2012-05-15,襄阳轴承：独立董事关于公司关联交易事项的独立意见,finalpage/2012-05-15/60996608.PDF
420,2012-05-15,襄阳轴承：非公开发行A股股票预案（修订稿）,finalpage/2012-05-15/60996609.PDF
421,2012-05-15,襄阳轴承：非公开发行A股股票募集资金运用的可行性分析报告（修订稿）,finalpage/2012-05-15/60996610.PDF
422,2012-05-15,襄阳轴承：与三环集团公司之附条件生效的非公开发行股份认购协议（修订稿）,finalpage/2012-05-15/60996611.PDF
423,2012-05-18,襄阳轴承：收购报告书（摘要）,finalpage/2012-05-18/61012913.PDF
424,2012-05-24,襄阳轴承：关于召开2012年第二次临时股东大会的通知,finalpage/2012-05-24/61038761.PDF
425,2012-05-24,襄阳轴承：关于调整非公开发行股票方案获得湖北省国资委批复的公告,finalpage/2012-05-24/61038762.PDF
426,2012-05-29,襄阳轴承：关于三环集团公司认购非公开发行股票承诺的公告,finalpage/2012-05-29/61057377.PDF
427,2012-06-02,襄阳轴承：关于召开2012年第二次临时股东大会的提示性公告,finalpage/2012-06-02/61079057.PDF
428,2012-06-09,襄阳轴承：2012年第二次临时股东大会决议公告,finalpage/2012-06-09/61115309.PDF
429,2012-06-09,襄阳轴承：2012年第二次临时股东大会法律意见,finalpage/2012-06-09/61115311.PDF
430,2012-07-13,襄阳轴承：五届董事会第五次会议决议公告,finalpage/2012-07-13/61261688.PDF
431,2012-07-13,襄阳轴承：关于召开2012年第三次临时股东大会的通知,finalpage/2012-07-13/61261689.PDF
432,2012-07-13,襄阳轴承：独立董事关于公司关联交易事项的事先认可函,finalpage/2012-07-13/61261690.PDF
433,2012-07-13,襄阳轴承：独立董事关于公司关联交易事项的独立意见,finalpage/2012-07-13/61261691.PDF
434,2012-07-13,襄阳轴承：非公开发行A股股票预案（修订稿）,finalpage/2012-07-13/61261692.PDF
435,2012-07-13,襄阳轴承：非公开发行A股股票募集资金运用的可行性分析报告（修订稿）,finalpage/2012-07-13/61261693.PDF
436,2012-07-13,襄阳轴承：公司与三环集团公司之附条件生效的非公开发行股份认购协议（修订稿）,finalpage/2012-07-13/61261695.PDF
437,2012-07-14,襄阳轴承：2012年半年度业绩预告公告,finalpage/2012-07-14/61267985.PDF
438,2012-07-19,襄阳轴承：五届监事会第四次会议决议公告,finalpage/2012-07-19/61289911.PDF
439,2012-07-19,襄阳轴承：五届董事会第六次会议决议公告,finalpage/2012-07-19/61289912.PDF
440,2012-07-19,襄阳轴承：公司章程修正案,finalpage/2012-07-19/61289913.PDF
441,2012-07-19,襄阳轴承：关于召开2012年第四次临时股东大会通知,finalpage/2012-07-19/61289914.PDF
442,2012-07-19,襄阳轴承：关联交易公告,finalpage/2012-07-19/61289915.PDF
443,2012-07-19,襄阳轴承：独立董事的专项说明及独立意见,finalpage/2012-07-19/61289916.PDF
444,2012-07-20,襄阳轴承：收购报告书（摘要）,finalpage/2012-07-20/61296608.PDF
445,2012-07-26,襄阳轴承：关于召开2012年第三次临时股东大会的提示性公告,finalpage/2012-07-26/61323698.PDF
446,2012-07-26,襄阳轴承：关于调整非公开发行股票方案获得湖北省国资委批复的公告,finalpage/2012-07-26/61323700.PDF
447,2012-08-01,襄阳轴承：2012年第三次临时股东大会决议公告,finalpage/2012-08-01/61353645.PDF
448,2012-08-01,襄阳轴承：2012年第三次临时股东大会法律意见,finalpage/2012-08-01/61353646.PDF
449,2012-08-11,襄阳轴承：2012年第四次临时股东大会决议公告,finalpage/2012-08-11/61405773.PDF
450,2012-08-11,襄阳轴承：公司章程（2012年8月）,finalpage/2012-08-11/61405774.PDF
451,2012-08-11,襄阳轴承：2012年度第四次临时股东大会法律意见书,finalpage/2012-08-11/61405775.PDF
452,2012-08-15,襄阳轴承：关于公司获得政府补贴的公告,finalpage/2012-08-15/61422273.PDF
453,2012-08-21,襄阳轴承：2012年半年度报告摘要,finalpage/2012-08-21/61452017.PDF
454,2012-08-21,襄阳轴承：2012年半年度财务报告,finalpage/2012-08-21/61452019.PDF
455,2012-08-21,襄阳轴承：2012年半年度报告,finalpage/2012-08-21/61452020.PDF
456,2012-08-21,襄阳轴承：独立董事对公司关联方资金占用和对外担保情况的专项说明和独立意见,finalpage/2012-08-21/61452021.PDF
457,2012-08-22,襄阳轴承：五届董事会第八次会议决议公告,finalpage/2012-08-22/61458361.PDF
458,2012-08-22,襄阳轴承：关于召开2012年第五次临时股东大会通知,finalpage/2012-08-22/61458362.PDF
459,2012-08-22,襄阳轴承：关于认真贯彻落实现金分红有关事项工作方案,finalpage/2012-08-22/61458363.PDF
460,2012-08-22,襄阳轴承：就股东回报规划事宜的论证报告,finalpage/2012-08-22/61458364.PDF
461,2012-08-22,襄阳轴承：未来三年（2012-2014年）股东回报规划,finalpage/2012-08-22/61458365.PDF
462,2012-08-22,襄阳轴承：独立董事关于股东回报规划事宜的独立意见,finalpage/2012-08-22/61458366.PDF
463,2012-08-30,襄阳轴承：近五年监管部门监管关注事项及整改情况的自愿性信息披露公告,finalpage/2012-08-30/61505943.PDF
464,2012-09-08,襄阳轴承：2012年第五次临时股东大会决议公告,finalpage/2012-09-08/61546664.PDF
465,2012-09-08,襄阳轴承：2012年度第五次临时股东大会法律意见书,finalpage/2012-09-08/61546665.PDF
466,2012-10-13,襄阳轴承：2012年前三季度业绩预告公告,finalpage/2012-10-13/61651234.PDF
467,2012-10-24,襄阳轴承：关于三环襄轴工业园一期建设项目风险提示的自愿性信息披露公告,finalpage/2012-10-24/61693507.PDF
468,2012-10-30,襄阳轴承：2012年第三季度报告正文,finalpage/2012-10-30/61731782.PDF
469,2012-10-30,襄阳轴承：2012年第三季度报告全文,finalpage/2012-10-30/61731784.PDF
470,2012-10-30,襄阳轴承：关于尚未履行完毕承诺情况的自愿性信息披露公告,finalpage/2012-10-30/61731785.PDF
471,2012-11-08,襄阳轴承：关于非公开发行股票申请获得发审委审核通过的公告,finalpage/2012-11-08/61773048.PDF
472,2012-12-15,襄阳轴承：关于非公开发行股票申请获得中国证券监督管理委员会核准的公告,finalpage/2012-12-15/61911393.PDF
473,2012-12-18,襄阳轴承：收购报告书,finalpage/2012-12-18/61920326.PDF
474,2012-12-18,襄阳轴承：收购报告书（摘要）,finalpage/2012-12-18/61920327.PDF
475,2012-12-18,襄阳轴承：上海亚商投资顾问有限公司关于公司收购报告书之核查意见,finalpage/2012-12-18/61920328.PDF
476,2012-12-18,襄阳轴承：国浩律师（上海）事务所关于公司收购报告书的法律意见书,finalpage/2012-12-18/61920329.PDF
477,2012-12-18,襄阳轴承：国浩律师（上海）事务所关于三环集团公司就本次收购公司事宜可免于提交豁免申请的专项核查意见,finalpage/2012-12-18/61920330.PDF
478,2013-01-23,襄阳轴承：收购报告书,finalpage/2013-01-23/62056838.PDF
479,2013-01-23,襄阳轴承：关于三环集团收购报告书的提示性公告,finalpage/2013-01-23/62056839.PDF
480,2013-01-26,襄阳轴承：2012年度业绩预告,finalpage/2013-01-26/62069471.PDF
481,2013-02-05,襄阳轴承：申银万国证券股份有限公司关于公司非公开发行股票上市保荐书,finalpage/2013-02-05/62109016.PDF
482,2013-02-05,襄阳轴承：申银万国证券股份有限公司关于公司非公开发行股票发行过程和认购对象合规性的报告,finalpage/2013-02-05/62109017.PDF
483,2013-02-05,襄阳轴承：非公开发行股票发行情况报告暨上市公告书,finalpage/2013-02-05/62109019.PDF
484,2013-02-05,襄阳轴承：非公开发行股票发行情况报告暨上市公告书（摘要）,finalpage/2013-02-05/62109022.PDF
