,date,title,url
727,2016-08-10,海螺型材：2012年公司债券2016年付息公告,finalpage/2016-08-10/1202552140.PDF
728,2016-08-23,海螺型材：2016年半年度报告摘要,finalpage/2016-08-23/1202600529.PDF
729,2016-08-23,海螺型材：第七届董事会第十次会议决议公告,finalpage/2016-08-23/1202600530.PDF
730,2016-08-23,海螺型材：第七届监事会第七次会议决议公告,finalpage/2016-08-23/1202600531.PDF
731,2016-08-23,海螺型材：关于增加使用自有闲置资金进行委托理财额度的公告,finalpage/2016-08-23/1202600532.PDF
732,2016-08-23,海螺型材：独立董事关于七届十次董事会相关事项的独立意见,finalpage/2016-08-23/1202600533.PDF
733,2016-08-23,海螺型材：2016年半年度财务报告,finalpage/2016-08-23/1202600535.PDF
734,2016-08-23,海螺型材：2016年半年度报告,finalpage/2016-08-23/1202600536.PDF
735,2016-08-30,海螺型材：第七届董事会第十一次会议决议公告,finalpage/2016-08-30/1202642826.PDF
736,2016-08-30,海螺型材：对外投资公告,finalpage/2016-08-30/1202642827.PDF
737,2016-09-08,海螺型材：关于子公司收到政府补助款的提示性公告,finalpage/2016-09-08/1202684165.PDF
738,2016-10-18,海螺型材：2016年第三季度报告正文,finalpage/2016-10-18/1202764211.PDF
739,2016-10-18,海螺型材：2016年第三季度报告全文,finalpage/2016-10-18/1202764213.PDF
740,2016-11-04,海螺型材：关于股东减持股份的公告,finalpage/2016-11-04/1202814632.PDF
741,2016-11-11,海螺型材：第七届董事会第十三次会议决议公告,finalpage/2016-11-11/1202823631.PDF
742,2016-11-11,海螺型材：关于放弃控股子公司40%股份优先受让权的公告,finalpage/2016-11-11/1202823632.PDF
743,2016-11-11,海螺型材：独立董事关于放弃控股子公司40%股份优先受让权的的独立意见,finalpage/2016-11-11/1202823633.PDF
744,2016-12-02,海螺型材：关于子公司收到政府补助款的提示性公告,finalpage/2016-12-02/1202853086.PDF
745,2016-12-17,海螺型材：关于股东减持股份的提示性公告,finalpage/2016-12-17/1202884007.PDF
746,2016-12-17,海螺型材：简式权益变动报告书,finalpage/2016-12-17/1202884008.PDF
747,2017-01-04,海螺型材：关于控股子公司40%股份挂牌转让进展公告,finalpage/2017-01-04/1202986676.PDF
748,2017-02-04,海螺型材：关于子公司收到政府补助款的提示性公告,finalpage/2017-02-04/1203063779.PDF
749,2017-02-14,海螺型材：关于子公司收到政府补助款的提示性公告,finalpage/2017-02-14/1203079733.PDF
750,2017-03-01,海螺型材：关于子公司收到政府补助款的提示性公告,finalpage/2017-03-01/1203117073.PDF
751,2017-03-21,海螺型材：2016年年度报告摘要,finalpage/2017-03-21/1203181276.PDF
752,2017-03-21,海螺型材：2016年年度审计报告,finalpage/2017-03-21/1203181277.PDF
753,2017-03-21,海螺型材：第七届董事会第十四次会议决议公告,finalpage/2017-03-21/1203181278.PDF
754,2017-03-21,海螺型材：关于召开2016年度股东大会的通知,finalpage/2017-03-21/1203181279.PDF
755,2017-03-21,海螺型材：第七届监事会第九次会议决议公告,finalpage/2017-03-21/1203181280.PDF
756,2017-03-21,海螺型材：控股股东及其他关联方资金占用情况的专项说明,finalpage/2017-03-21/1203181281.PDF
757,2017-03-21,海螺型材：2016年度内部控制自我评价报告,finalpage/2017-03-21/1203181282.PDF
758,2017-03-21,海螺型材：为子公司提供授信担保的公告,finalpage/2017-03-21/1203181283.PDF
759,2017-03-21,海螺型材：内部控制审计报告,finalpage/2017-03-21/1203181284.PDF
760,2017-03-21,海螺型材：独立董事关于七届十四次董事会相关事项的独立意见,finalpage/2017-03-21/1203181285.PDF
761,2017-03-21,海螺型材：独立董事2016年度述职报告（张光杰）,finalpage/2017-03-21/1203181286.PDF
762,2017-03-21,海螺型材：独立董事2016年度述职报告（雷华）,finalpage/2017-03-21/1203181287.PDF
763,2017-03-21,海螺型材：独立董事2016年度述职报告（周泽将）,finalpage/2017-03-21/1203181288.PDF
764,2017-03-21,海螺型材：2017年度日常关联交易预计公告,finalpage/2017-03-21/1203181289.PDF
765,2017-03-21,海螺型材：2016年年度报告,finalpage/2017-03-21/1203181291.PDF
766,2017-03-23,海螺型材：关于收到土地使用税奖励款的提示性公告,finalpage/2017-03-23/1203186144.PDF
767,2017-04-01,海螺型材：关于子公司收到土地使用税奖励款的提示性公告,finalpage/2017-04-01/1203246357.PDF
768,2017-04-07,海螺型材：2017年第一季度业绩预告,finalpage/2017-04-07/1203258329.PDF
769,2017-04-11,海螺型材：关于变更2017年第一季度报告披露日期的提示性公告,finalpage/2017-04-11/1203276083.PDF
770,2017-04-13,海螺型材：第七届董事会第十五次会议决议公告,finalpage/2017-04-13/1203291478.PDF
771,2017-04-13,海螺型材：关于公司董事长辞职的公告,finalpage/2017-04-13/1203291479.PDF
772,2017-04-13,海螺型材：独立董事关于控股股东提名董事候选人事项的独立董事意见,finalpage/2017-04-13/1203291480.PDF
773,2017-04-13,海螺型材：2017年第一季度报告正文,finalpage/2017-04-13/1203291481.PDF
774,2017-04-13,海螺型材：2017年第一季度报告全文,finalpage/2017-04-13/1203291483.PDF
775,2017-04-13,海螺型材：关于召开2016年度股东大会的补充通知,finalpage/2017-04-13/1203291484.PDF
776,2017-04-13,海螺型材：关于公司监事及监事会主席辞职的公告,finalpage/2017-04-13/1203291485.PDF
777,2017-04-13,海螺型材：关于控股股东提议增加公司2016年度股东大会临时提案的公告,finalpage/2017-04-13/1203291486.PDF
778,2017-04-22,海螺型材：关于召开2016年度股东大会的提示性公告,finalpage/2017-04-22/1203357604.PDF
779,2017-04-27,海螺型材：2016年度股东大会决议公告,finalpage/2017-04-27/1203405805.PDF
780,2017-04-27,海螺型材：第七届监事会第十一次会议决议公告,finalpage/2017-04-27/1203405806.PDF
781,2017-04-27,海螺型材：第七届董事会第十六次会议决议公告,finalpage/2017-04-27/1203405807.PDF
782,2017-04-27,海螺型材：2016年度股东大会的法律意见书,finalpage/2017-04-27/1203405808.PDF
783,2017-05-16,海螺型材：2012年公司债券跟踪评级报告（2017）,finalpage/2017-05-16/1203520467.PDF
784,2017-05-19,海螺型材：2012年公司债券受托管理事务报告（2016年度）,finalpage/2017-05-19/1203536619.PDF
785,2017-06-13,海螺型材：2016年度分红派息实施公告,finalpage/2017-06-13/1203610974.PDF
786,2017-06-14,海螺型材：关于公司董事会秘书辞职的公告,finalpage/2017-06-14/1203614376.PDF
787,2017-06-14,海螺型材：关于召开2017年第一次临时股东大会的通知,finalpage/2017-06-14/1203614377.PDF
788,2017-06-14,海螺型材：关于修改公司《章程》的公告,finalpage/2017-06-14/1203614378.PDF
789,2017-06-14,海螺型材：对外投资公告,finalpage/2017-06-14/1203614379.PDF
790,2017-06-14,海螺型材：独立董事关于公司高级管理人员调整的独立意见,finalpage/2017-06-14/1203614380.PDF
791,2017-06-14,海螺型材：第七届董事会第十七次会议决议公告,finalpage/2017-06-14/1203614381.PDF
792,2017-06-21,海螺型材：关于控股股东一致行动人终止资管计划管理合同的提示性公告,finalpage/2017-06-21/1203634538.PDF
793,2017-06-29,海螺型材：关于召开2017年第一次临时股东大会的提示性公告,finalpage/2017-06-29/1203659877.PDF
794,2017-07-04,海螺型材：第七届董事会第十八次会议决议公告,finalpage/2017-07-04/1203677744.PDF
795,2017-07-04,海螺型材：关于聘任董事会秘书的公告,finalpage/2017-07-04/1203677745.PDF
796,2017-07-04,海螺型材：2017年第一次临时股东大会决议公告,finalpage/2017-07-04/1203677746.PDF
797,2017-07-04,海螺型材：关于子公司收到政府补助款的提示性公告,finalpage/2017-07-04/1203677747.PDF
798,2017-07-04,海螺型材：独立董事关于聘任董事会秘书的独立意见,finalpage/2017-07-04/1203677748.PDF
799,2017-07-04,海螺型材：2017年第一次临时股东大会的法律意见书,finalpage/2017-07-04/1203677749.PDF
800,2017-07-04,海螺型材：公司章程（2017年7月）,finalpage/2017-07-04/1203677750.PDF
801,2017-07-11,海螺型材：2017年上半年业绩预告,finalpage/2017-07-11/1203692182.PDF
802,2017-07-25,海螺型材：第七届董事会第十九次会议决议公告,finalpage/2017-07-25/1203729480.PDF
803,2017-08-08,海螺型材：2012年公司债券2017年本息兑付及摘牌公告,finalpage/2017-08-08/1203769624.PDF
804,2017-08-10,海螺型材：关于公司董事辞职的公告,finalpage/2017-08-10/1203782376.PDF
805,2017-08-22,海螺型材：2017年半年度报告,finalpage/2017-08-22/1203835843.PDF
806,2017-08-22,海螺型材：对外投资公告,finalpage/2017-08-22/1203835844.PDF
807,2017-08-22,海螺型材：关于召开2017年第二次临时股东大会的通知,finalpage/2017-08-22/1203835845.PDF
808,2017-08-22,海螺型材：关于更换职工代表监事的公告,finalpage/2017-08-22/1203835846.PDF
809,2017-08-22,海螺型材：独立董事关于七届二十次董事会相关事项的独立意见,finalpage/2017-08-22/1203835847.PDF
810,2017-08-22,海螺型材：2017年半年度报告摘要,finalpage/2017-08-22/1203835848.PDF
811,2017-08-22,海螺型材：第七届董事会第二十次会议决议公告,finalpage/2017-08-22/1203835849.PDF
812,2017-08-22,海螺型材：2017年半年度财务报告,finalpage/2017-08-22/1203835850.PDF
813,2017-09-08,海螺型材：关于召开2017年第二次临时股东大会的提示性公告,finalpage/2017-09-08/1203956115.PDF
814,2017-09-13,海螺型材：2017年第二次临时股东大会决议公告,finalpage/2017-09-13/1203968347.PDF
815,2017-09-13,海螺型材：2017年第二次临时股东大会的法律意见书,finalpage/2017-09-13/1203968348.PDF
816,2017-09-16,海螺型材：关于参加2017年安徽上市公司投资者网上集体接待日活动的公告,finalpage/2017-09-16/1203979526.PDF
817,2017-10-10,海螺型材：2017年前三季度业绩预告,finalpage/2017-10-10/1204021853.PDF
818,2017-10-10,海螺型材：第七届董事会第二十一次会议决议公告,finalpage/2017-10-10/1204021854.PDF
819,2017-10-10,海螺型材：对外投资公告,finalpage/2017-10-10/1204021855.PDF
820,2017-10-20,海螺型材：2017年第三季度报告正文,finalpage/2017-10-20/1204054090.PDF
821,2017-10-20,海螺型材：2017年第三季度报告全文,finalpage/2017-10-20/1204054092.PDF
822,2017-10-20,海螺型材：第七届董事会第二十二次会议决议公告,finalpage/2017-10-20/1204054093.PDF
823,2017-10-26,海螺型材：关于子公司收到产业扶持资金的提示性公告,finalpage/2017-10-26/1204070578.PDF
824,2017-12-19,海螺型材：关于子公司收到政府补助款的提示性公告,finalpage/2017-12-19/1204236821.PDF
825,2017-12-28,海螺型材：关于股东减持股份的提示性公告,finalpage/2017-12-28/1204273551.PDF
826,2018-01-09,海螺型材：第七届董事会第二十三次会议决议公告,finalpage/2018-01-09/1204311848.PDF
827,2018-01-11,海螺型材：2017年度业绩预告,finalpage/2018-01-11/1204318964.PDF
828,2018-01-23,海螺型材：第七届董事会第二十四次会议决议公告,finalpage/2018-01-23/1204352690.PDF
829,2018-01-23,海螺型材：对外投资公告,finalpage/2018-01-23/1204352691.PDF
830,2018-02-13,海螺型材：第七届董事会第二十五次会议决议公告,finalpage/2018-02-13/1204418147.PDF
831,2018-02-13,海螺型材：对外投资公告,finalpage/2018-02-13/1204418148.PDF
