,date,title,url
757,2013-09-23,厦门信达：关于召开2013年第四次临时股东大会的提示性公告,finalpage/2013-09-23/63096171.PDF
758,2013-09-25,厦门信达：关于非公开发行股票相关事项获得厦门市国资委批复的公告,finalpage/2013-09-25/63108324.PDF
759,2013-09-27,厦门信达：关于挂牌转让厦门三安电子有限公司股权的进展公告,finalpage/2013-09-27/63115441.PDF
760,2013-09-27,厦门信达：收购资产公告,finalpage/2013-09-27/63115442.PDF
761,2013-09-27,厦门信达：独立董事意见,finalpage/2013-09-27/63115443.PDF
762,2013-09-27,厦门信达：董事会决议公告,finalpage/2013-09-27/63115444.PDF
763,2013-09-28,厦门信达：2013年第四次临时股东大会决议公告,finalpage/2013-09-28/63120533.PDF
764,2013-09-28,厦门信达：高管人员薪酬与绩效管理制度（2013年9月）,finalpage/2013-09-28/63120535.PDF
765,2013-09-28,厦门信达：2013年第四次临时股东大会的法律意见书,finalpage/2013-09-28/63120536.PDF
766,2013-10-16,厦门信达：关于短期融资券获准发行的公告,finalpage/2013-10-16/63159290.PDF
767,2013-10-26,厦门信达：2013年第三季度报告正文,finalpage/2013-10-26/63199183.PDF
768,2013-10-26,厦门信达：董事会决议公告,finalpage/2013-10-26/63199185.PDF
769,2013-10-26,厦门信达：监事会决议公告,finalpage/2013-10-26/63199186.PDF
770,2013-10-26,厦门信达：2013年第三季度报告全文,finalpage/2013-10-26/63199187.PDF
771,2013-10-26,厦门信达：2013年度业绩预告,finalpage/2013-10-26/63199188.PDF
772,2013-10-26,厦门信达：计提资产减值准备的公告,finalpage/2013-10-26/63199189.PDF
773,2013-10-26,厦门信达：独立董事意见,finalpage/2013-10-26/63199190.PDF
774,2013-10-26,厦门信达：监事会对公司2013年第三季度单独计提资产减值准备的意见,finalpage/2013-10-26/63199191.PDF
775,2013-11-19,厦门信达：诉讼进展公告,finalpage/2013-11-19/63279627.PDF
776,2013-11-30,厦门信达：对外担保进展公告,finalpage/2013-11-30/63318377.PDF
777,2013-12-11,厦门信达：董事会决议公告,finalpage/2013-12-11/63363721.PDF
778,2013-12-27,厦门信达：关于最近五年被证券监管部门和交易所采取监管措施及整改情况的公告,finalpage/2013-12-27/63419383.PDF
779,2014-01-16,厦门信达：2014年度日常关联交易预计发生额的公告,finalpage/2014-01-16/63488146.PDF
780,2014-01-16,厦门信达：关于2014年度使用临时闲置资金购买银行理财产品的公告,finalpage/2014-01-16/63488147.PDF
781,2014-01-16,厦门信达：关于2014年度公司为控股子公司向金融机构申请授信额度提供担保的公告,finalpage/2014-01-16/63488148.PDF
782,2014-01-16,厦门信达：关于2014年度开展远期外汇交易的公告,finalpage/2014-01-16/63488149.PDF
783,2014-01-16,厦门信达：关于召开2014年第一次临时股东大会通知（已取消）,finalpage/2014-01-16/63488151.PDF
784,2014-01-16,厦门信达：关联交易公告,finalpage/2014-01-16/63488152.PDF
785,2014-01-16,厦门信达：董事会决议公告,finalpage/2014-01-16/63488153.PDF
786,2014-01-16,厦门信达：独立董事事前审核意见,finalpage/2014-01-16/63488154.PDF
787,2014-01-16,厦门信达：独立董事意见,finalpage/2014-01-16/63488155.PDF
788,2014-01-16,厦门信达：临时公告的更正公告,finalpage/2014-01-16/63489197.PDF
789,2014-01-16,厦门信达：关于召开2014年第一次临时股东大会通知（更新后）,finalpage/2014-01-16/63489198.PDF
790,2014-01-25,厦门信达：关于非公开发行A股股票申请获得中国证监会发审会审核通过的公告,finalpage/2014-01-25/63520781.PDF
791,2014-01-29,厦门信达：2013年度业绩预告修正公告,finalpage/2014-01-29/63534800.PDF
792,2014-02-12,厦门信达：2014年第一次临时股东大会决议公告,finalpage/2014-02-12/63561178.PDF
793,2014-02-12,厦门信达：2014年第一次临时股东大会的法律意见书,finalpage/2014-02-12/63561179.PDF
794,2014-02-15,厦门信达：关于实际控制人、股东、关联方以及上市公司承诺及履行情况的公告,finalpage/2014-02-15/63574322.PDF
795,2014-02-21,厦门信达：关于非公开发行股票获得中国证券监督管理委员会核准批复的公告,finalpage/2014-02-21/63592100.PDF
796,2014-03-05,厦门信达：2014年度第一期短期融资券发行公告,finalpage/2014-03-05/63637960.PDF
797,2014-03-05,厦门信达：关于控股子公司收到政府补贴的公告,finalpage/2014-03-05/63637961.PDF
798,2014-03-05,厦门信达：关于所聘会计师事务所转制更名的公告,finalpage/2014-03-05/63637962.PDF
799,2014-03-07,厦门信达：2014年度第一期短期融资券发行情况公告,finalpage/2014-03-07/63646652.PDF
800,2014-03-20,厦门信达：2014年度第一期非公开定向债务融资工具发行情况公告,finalpage/2014-03-20/63697648.PDF
801,2014-04-02,厦门信达：中信建投证券股份有限公司关于公司非公开发行股票上市保荐书,finalpage/2014-04-02/63771029.PDF
802,2014-04-02,厦门信达：关于非公开发行A股股票相关承诺的公告,finalpage/2014-04-02/63771030.PDF
803,2014-04-02,厦门信达：北京市天元律师事务所关于公司非公开发行股票发行过程及认购对象合规性的法律意见,finalpage/2014-04-02/63771031.PDF
804,2014-04-02,厦门信达：中信建投证券股份有限公司关于公司非公开发行股票发行过程和认购对象合规性的报告,finalpage/2014-04-02/63771032.PDF
805,2014-04-02,厦门信达：福建远大联盟律师事务所关于厦门国贸控股有限公司认购公司非公开发行股票符合免于提交豁免要约收购申请条件的专项法律意见书,finalpage/2014-04-02/63771033.PDF
806,2014-04-02,厦门信达：非公开发行股票发行情况报告暨上市公告书,finalpage/2014-04-02/63771034.PDF
807,2014-04-02,厦门信达：非公开发行股票发行情况报告暨上市公告书摘要,finalpage/2014-04-02/63771035.PDF
808,2014-04-02,厦门信达：验资报告,finalpage/2014-04-02/63771960.PDF
809,2014-04-04,厦门信达：2013年度监事会报告,finalpage/2014-04-04/63788706.PDF
810,2014-04-04,厦门信达：2013年年度报告摘要,finalpage/2014-04-04/63788707.PDF
811,2014-04-04,厦门信达：2013年年度审计报告,finalpage/2014-04-04/63788727.PDF
812,2014-04-04,厦门信达：董事会决议公告,finalpage/2014-04-04/63788728.PDF
813,2014-04-04,厦门信达：关于召开2013年度股东大会的通知,finalpage/2014-04-04/63788729.PDF
814,2014-04-04,厦门信达：监事会决议公告,finalpage/2014-04-04/63788730.PDF
815,2014-04-04,厦门信达：关于对公司控股股东及其他关联方占用资金情况的专项审计说明,finalpage/2014-04-04/63788733.PDF
816,2014-04-04,厦门信达：2013年度内部控制评价报告,finalpage/2014-04-04/63788734.PDF
817,2014-04-04,厦门信达：2013年年度报告,finalpage/2014-04-04/63788735.PDF
818,2014-04-04,厦门信达：独立董事候选人声明（童锦治）,finalpage/2014-04-04/63788736.PDF
819,2014-04-04,厦门信达：独立董事候选人声明（苏伟斌）,finalpage/2014-04-04/63788737.PDF
820,2014-04-04,厦门信达：独立董事候选人声明（薛祖云）,finalpage/2014-04-04/63788738.PDF
821,2014-04-04,厦门信达：2014年第一季度业绩预告,finalpage/2014-04-04/63788739.PDF
822,2014-04-04,厦门信达：2013年度内部控制审计报告,finalpage/2014-04-04/63788740.PDF
823,2014-04-04,厦门信达：对外投资公告,finalpage/2014-04-04/63788741.PDF
824,2014-04-04,厦门信达：计提资产减值准备及核销部分资产的公告,finalpage/2014-04-04/63788742.PDF
825,2014-04-04,厦门信达：独立董事提名人声明（一）,finalpage/2014-04-04/63788743.PDF
826,2014-04-04,厦门信达：独立董事提名人声明（二）,finalpage/2014-04-04/63788744.PDF
827,2014-04-04,厦门信达：独立董事提名人声明（三）,finalpage/2014-04-04/63788745.PDF
828,2014-04-04,厦门信达：独立董事事前审核意见,finalpage/2014-04-04/63788747.PDF
829,2014-04-04,厦门信达：独立董事意见,finalpage/2014-04-04/63788748.PDF
830,2014-04-04,厦门信达：独立董事2013年度述职报告（卢永华）,finalpage/2014-04-04/63788749.PDF
831,2014-04-04,厦门信达：独立董事2013年度述职报告（苏伟斌）,finalpage/2014-04-04/63788750.PDF
832,2014-04-04,厦门信达：独立董事2013年度述职报告（陈芃）,finalpage/2014-04-04/63788751.PDF
833,2014-04-04,厦门信达：监事会对2013年第四季度计提资产减值准备及核销部分资产的意见,finalpage/2014-04-04/63788754.PDF
834,2014-04-04,厦门信达：监事会对公司内部控制评价报告的意见,finalpage/2014-04-04/63788759.PDF
835,2014-04-18,厦门信达：关于签署募集资金三方监管协议的公告,finalpage/2014-04-18/63862270.PDF
836,2014-04-19,厦门信达：关于2013年度股东大会增加网络投票方式的公告,finalpage/2014-04-19/63868030.PDF
837,2014-04-22,厦门信达：关于召开2013年度股东大会的提示性公告,finalpage/2014-04-22/63887050.PDF
838,2014-04-25,厦门信达：2013年度股东大会决议公告,finalpage/2014-04-25/63918841.PDF
839,2014-04-25,厦门信达：公司章程（2014年4月）,finalpage/2014-04-25/63918842.PDF
840,2014-04-25,厦门信达：2013年度股东大会的法律意见书,finalpage/2014-04-25/63918843.PDF
841,2014-04-26,厦门信达：2014年第一季度报告正文,finalpage/2014-04-26/63925867.PDF
842,2014-04-26,厦门信达：董事会决议公告,finalpage/2014-04-26/63925869.PDF
843,2014-04-26,厦门信达：2014年第一季度报告全文,finalpage/2014-04-26/63925870.PDF
844,2014-04-26,厦门信达：2014年第一季度报告全文（已取消）,finalpage/2014-04-26/63925870.PDF
845,2014-04-26,厦门信达：独立董事关于聘任公司高级管理人员的独立董事意见,finalpage/2014-04-26/63925871.PDF
846,2014-05-06,厦门信达：对外担保进展公告,finalpage/2014-05-06/63971178.PDF
847,2014-05-21,厦门信达：关于全资子公司签署募集资金三方监管协议的公告,finalpage/2014-05-21/64047351.PDF
848,2014-05-29,厦门信达：董事会决议公告,finalpage/2014-05-29/64077973.PDF
849,2014-06-13,厦门信达：2013年年度权益分派实施公告,finalpage/2014-06-13/64131799.PDF
850,2014-06-25,厦门信达：关于控股子公司收到政府补贴的公告,finalpage/2014-06-25/1200004262.PDF
851,2014-06-28,厦门信达：关于控股股东进行股票质押式回购交易的公告,finalpage/2014-06-28/1200013230.PDF
852,2014-07-04,厦门信达：独立董事关于聘任公司高级管理人员的独立董事意见,finalpage/2014-07-04/1200029651.PDF
853,2014-07-04,厦门信达：董事会决议公告,finalpage/2014-07-04/1200029652.PDF
854,2014-07-19,厦门信达：中信建投证券股份有限公司关于公司以募集资金置换预先已投入募集资金投资项目的自筹资金的核查意见,finalpage/2014-07-19/1200065381.PDF
855,2014-07-19,厦门信达：关于召开2014年第二次临时股东大会的通知,finalpage/2014-07-19/1200065382.PDF
856,2014-07-19,厦门信达：关于收到厦门证监局责令改正决定书的公告,finalpage/2014-07-19/1200065383.PDF
857,2014-07-19,厦门信达：关于用募集资金置换预先已投入募投项目的自筹资金的公告,finalpage/2014-07-19/1200065384.PDF
858,2014-07-19,厦门信达：募集资金置换鉴证报告（截止2014年3月31日）,finalpage/2014-07-19/1200065385.PDF
859,2014-07-19,厦门信达：董事会决议公告,finalpage/2014-07-19/1200065386.PDF
860,2014-07-19,厦门信达：独立董事意见,finalpage/2014-07-19/1200065387.PDF
861,2014-07-19,厦门信达：监事会决议公告,finalpage/2014-07-19/1200065388.PDF
862,2014-07-19,厦门信达：监事会对用募集资金置换预先已投入募投项目的自筹资金的意见,finalpage/2014-07-19/1200065389.PDF
863,2014-07-29,厦门信达：关于召开2014年第二次临时股东大会的提示性公告,finalpage/2014-07-29/1200084669.PDF
864,2014-08-05,厦门信达：2014年第一季度报告全文（更新后）,finalpage/2014-08-05/1200098806.PDF
865,2014-08-05,厦门信达：关于厦门证监局现场检查问题的整改报告,finalpage/2014-08-05/1200098807.PDF
866,2014-08-05,厦门信达：关于对2014年第一季度报告会计差错更正的公告,finalpage/2014-08-05/1200098808.PDF
867,2014-08-05,厦门信达：2014年第二次临时股东大会决议公告,finalpage/2014-08-05/1200098809.PDF
868,2014-08-05,厦门信达：董事会决议公告,finalpage/2014-08-05/1200098810.PDF
869,2014-08-05,厦门信达：独立董事关于对公司2014年第一季度报告会计差错更正的独立意见,finalpage/2014-08-05/1200098811.PDF
870,2014-08-05,厦门信达：监事会决议公告,finalpage/2014-08-05/1200098812.PDF
871,2014-08-05,厦门信达：监事会关于对公司2014年第一季度报告会计差错更正的意见,finalpage/2014-08-05/1200098813.PDF
872,2014-08-05,厦门信达：2014年度第二次临时股东大会的法律意见书,finalpage/2014-08-05/1200098814.PDF
873,2014-08-14,厦门信达：2014年半年度报告摘要,finalpage/2014-08-14/1200125119.PDF
874,2014-08-14,厦门信达：2014年半年度财务报告,finalpage/2014-08-14/1200125121.PDF
875,2014-08-14,厦门信达：董事会决议公告,finalpage/2014-08-14/1200125122.PDF
876,2014-08-14,厦门信达：监事会决议公告,finalpage/2014-08-14/1200125123.PDF
877,2014-08-14,厦门信达：2014年半年度报告,finalpage/2014-08-14/1200125124.PDF
878,2014-08-14,厦门信达：中信建投证券股份有限公司关于公司使用闲置募集资金暂时补充流动资金的核查意见,finalpage/2014-08-14/1200125125.PDF
879,2014-08-14,厦门信达：关于2014年半年度募集资金存放与使用情况的专项报告,finalpage/2014-08-14/1200125126.PDF
880,2014-08-14,厦门信达：关于使用部分闲置募集资金暂时补充流动资金的公告,finalpage/2014-08-14/1200125127.PDF
881,2014-08-14,厦门信达：关于召开2014年第三次临时股东大会的通知,finalpage/2014-08-14/1200125128.PDF
882,2014-08-14,厦门信达：核销部分资产的公告,finalpage/2014-08-14/1200125129.PDF
883,2014-08-14,厦门信达：独立董事意见,finalpage/2014-08-14/1200125130.PDF
884,2014-08-14,厦门信达：监事会意见,finalpage/2014-08-14/1200125131.PDF
885,2014-08-23,厦门信达：中信建投证券股份有限公司关于公司变更募集资金用途的核查意见,finalpage/2014-08-23/1200154459.PDF
886,2014-08-23,厦门信达：关于变更部分募集资金用途的公告,finalpage/2014-08-23/1200154460.PDF
887,2014-08-23,厦门信达：独立董事关于变更部分募集资金用途的独立意见,finalpage/2014-08-23/1200154461.PDF
888,2014-08-23,厦门信达：关于召开2014年第三次临时股东大会的提示性公告,finalpage/2014-08-23/1200154462.PDF
889,2014-08-23,厦门信达：关于召开2014年第四次临时股东大会的通知,finalpage/2014-08-23/1200154463.PDF
890,2014-08-23,厦门信达：监事会决议公告,finalpage/2014-08-23/1200154464.PDF
891,2014-08-23,厦门信达：董事会决议公告,finalpage/2014-08-23/1200154465.PDF
892,2014-08-23,厦门信达：监事会关于变更部分募集资金用途的意见,finalpage/2014-08-23/1200154466.PDF
893,2014-09-02,厦门信达：2014年第三次临时股东大会决议公告,finalpage/2014-09-02/1200196243.PDF
894,2014-09-02,厦门信达：2014年度第三次临时股东大会的法律意见书,finalpage/2014-09-02/1200196244.PDF
895,2014-09-03,厦门信达：2014年度第二期非公开定向债务融资工具发行情况的公告,finalpage/2014-09-03/1200199443.PDF
896,2014-09-11,厦门信达：2014年第四次临时股东大会决议公告,finalpage/2014-09-11/1200223701.PDF
897,2014-09-11,厦门信达：2014年度第四次临时股东大会的法律意见书,finalpage/2014-09-11/1200223702.PDF
898,2014-09-25,厦门信达：独立董事关于公司挂牌转让部分所持厦门三安电子有限公司股权的独立意见,finalpage/2014-09-25/1200259040.PDF
899,2014-09-25,厦门信达：关于召开2014年第五次临时股东大会的通知,finalpage/2014-09-25/1200259041.PDF
900,2014-09-25,厦门信达：关于挂牌转让部分所持厦门三安电子有限公司股权的公告,finalpage/2014-09-25/1200259042.PDF
901,2014-09-25,厦门信达：厦门三安电子有限公司2013年度财务报表审计报告,finalpage/2014-09-25/1200259043.PDF
902,2014-09-25,厦门信达：厦门三安电子有限公司2014年1-7月财务报表审计报告,finalpage/2014-09-25/1200259044.PDF
903,2014-09-25,厦门信达：股权转让项目涉及的厦门三安电子有限公司股东部分权益价值评估报告书,finalpage/2014-09-25/1200259045.PDF
904,2014-09-25,厦门信达：董事会决议公告,finalpage/2014-09-25/1200259046.PDF
905,2014-09-27,厦门信达：关于召开2014年第五次临时股东大会的提示性公告,finalpage/2014-09-27/1200265110.PDF
906,2014-10-11,厦门信达：2014年前三季度业绩预告,finalpage/2014-10-11/1200289726.PDF
907,2014-10-11,厦门信达：2014年第五次临时股东大会决议公告,finalpage/2014-10-11/1200289727.PDF
908,2014-10-11,厦门信达：2014年度第五次临时股东大会的法律意见书,finalpage/2014-10-11/1200289728.PDF
909,2014-10-25,厦门信达：2014年第三季度报告正文,finalpage/2014-10-25/1200330307.PDF
910,2014-10-25,厦门信达：董事会决议公告,finalpage/2014-10-25/1200330309.PDF
911,2014-10-25,厦门信达：监事会决议公告,finalpage/2014-10-25/1200330310.PDF
912,2014-10-25,厦门信达：2014年第三季度报告全文,finalpage/2014-10-25/1200330311.PDF
913,2014-10-25,厦门信达：关于会计政策变更的公告,finalpage/2014-10-25/1200330312.PDF
914,2014-10-25,厦门信达：独立董事意见,finalpage/2014-10-25/1200330313.PDF
915,2014-10-25,厦门信达：监事会关于会计政策变更的审核意见,finalpage/2014-10-25/1200330314.PDF
916,2014-11-05,厦门信达：关于2014年度第二期短期融资券发行情况公告,finalpage/2014-11-05/1200370731.PDF
917,2014-11-18,厦门信达：关于挂牌转让部分所持厦门三安电子有限公司股权的进展公告,finalpage/2014-11-18/1200399715.PDF
918,2014-11-20,厦门信达：关于挂牌转让部分所持厦门三安电子有限公司股权的进展公告,finalpage/2014-11-20/1200404379.PDF
919,2014-12-02,厦门信达：中信建投证券股份有限公司关于公司定期现场检查报告,finalpage/2014-12-02/1200432340.PDF
920,2014-12-12,厦门信达：关于挂牌转让部分所持厦门三安电子有限公司股权的进展公告,finalpage/2014-12-12/1200460361.PDF
921,2014-12-13,厦门信达：董事会决议公告,finalpage/2014-12-13/1200463251.PDF
922,2014-12-13,厦门信达：中信建投证券股份有限公司关于公司2015年度开展远期外汇交易、关联交易等事项的核查意见,finalpage/2014-12-13/1200463252.PDF
923,2014-12-13,厦门信达：关于会计估计变更的公告,finalpage/2014-12-13/1200463253.PDF
924,2014-12-13,厦门信达：关于召开2014年第六次临时股东大会的通知,finalpage/2014-12-13/1200463254.PDF
925,2014-12-13,厦门信达：2015年度日常关联交易预计发生额的公告,finalpage/2014-12-13/1200463255.PDF
926,2014-12-13,厦门信达：关于2015年度使用临时闲置资金购买银行理财产品的公告,finalpage/2014-12-13/1200463256.PDF
927,2014-12-13,厦门信达：关于2015年度公司为控股子公司向金融机构申请授信额度提供担保的公告,finalpage/2014-12-13/1200463257.PDF
928,2014-12-13,厦门信达：关于2015年度开展远期外汇交易的公告,finalpage/2014-12-13/1200463258.PDF
929,2014-12-13,厦门信达：关联交易公告,finalpage/2014-12-13/1200463259.PDF
930,2014-12-13,厦门信达：监事会决议公告,finalpage/2014-12-13/1200463260.PDF
931,2014-12-13,厦门信达：独立董事事前审核意见,finalpage/2014-12-13/1200463262.PDF
932,2014-12-13,厦门信达：独立董事意见,finalpage/2014-12-13/1200463263.PDF
933,2014-12-13,厦门信达：监事会关于会计估计变更事项的审核意见,finalpage/2014-12-13/1200463264.PDF
934,2014-12-16,厦门信达：关于会计估计变更的更正公告,finalpage/2014-12-16/1200468614.PDF
935,2014-12-20,厦门信达：关于召开2014年第六次临时股东大会的提示性公告,finalpage/2014-12-20/1200479128.PDF
936,2014-12-24,厦门信达：关于挂牌转让部分所持厦门三安电子有限公司股权的进展公告,finalpage/2014-12-24/1200488968.PDF
937,2014-12-30,厦门信达：2014年第六次临时股东大会决议公告,finalpage/2014-12-30/1200504609.PDF
938,2014-12-30,厦门信达：关于挂牌转让部分所持厦门三安电子有限公司股权的进展公告,finalpage/2014-12-30/1200504610.PDF
939,2014-12-30,厦门信达：2014年度第六次临时股东大会的法律意见书,finalpage/2014-12-30/1200504611.PDF
940,2015-01-31,厦门信达：关于超短期融资券获准注册的公告,finalpage/2015-01-31/1200594974.PDF
941,2015-02-03,厦门信达：关于收购资产的自愿性信息披露公告,finalpage/2015-02-03/1200603052.PDF
942,2015-03-10,厦门信达：2015年度第一期超短期融资券发行情况公告,finalpage/2015-03-10/1200683299.PDF
943,2015-03-20,厦门信达：对外投资公告,finalpage/2015-03-20/1200719255.PDF
944,2015-03-20,厦门信达：董事会决议公告,finalpage/2015-03-20/1200719256.PDF
945,2015-03-24,厦门信达：2015年度第二期超短期融资券发行情况公告,finalpage/2015-03-24/1200732221.PDF
946,2015-04-02,厦门信达：中信建投证券股份有限公司关于公司非公开发行限售股解禁的专项核查意见,finalpage/2015-04-02/1200779088.PDF
947,2015-04-02,厦门信达：非公开发行股票限售股份解除限售提示性公告,finalpage/2015-04-02/1200779089.PDF
948,2015-04-11,厦门信达：2014年度监事会工作报告,finalpage/2015-04-11/1200811700.PDF
949,2015-04-11,厦门信达：2014年年度报告摘要,finalpage/2015-04-11/1200811701.PDF
950,2015-04-11,厦门信达：2014年年度审计报告,finalpage/2015-04-11/1200811703.PDF
951,2015-04-11,厦门信达：董事会决议公告,finalpage/2015-04-11/1200811704.PDF
952,2015-04-11,厦门信达：关于召开2014年度股东大会的通知,finalpage/2015-04-11/1200811705.PDF
953,2015-04-11,厦门信达：监事会决议公告,finalpage/2015-04-11/1200811706.PDF
954,2015-04-11,厦门信达：关于对公司控股股东及其他关联方占用资金情况的专项审计说明,finalpage/2015-04-11/1200811707.PDF
955,2015-04-11,厦门信达：2014年度社会责任报告,finalpage/2015-04-11/1200811708.PDF
956,2015-04-11,厦门信达：2014年度内部控制评价报告,finalpage/2015-04-11/1200811709.PDF
957,2015-04-11,厦门信达：2014年年度报告,finalpage/2015-04-11/1200811710.PDF
958,2015-04-11,厦门信达：中信建投证券股份有限公司关于公司2014年度募集资金存放与使用情况的专项核查报告,finalpage/2015-04-11/1200811711.PDF
959,2015-04-11,厦门信达：中信建投证券股份有限公司关于公司2014年度保荐工作报告,finalpage/2015-04-11/1200811712.PDF
960,2015-04-11,厦门信达：中信建投证券股份有限公司关于公司2014年度内部控制自我评价报告的核查意见,finalpage/2015-04-11/1200811713.PDF
961,2015-04-11,厦门信达：中信建投证券股份有限公司关于公司关联交易的专项核查意见,finalpage/2015-04-11/1200811714.PDF
962,2015-04-11,厦门信达：独立董事候选人声明（郑学军）,finalpage/2015-04-11/1200811715.PDF
963,2015-04-11,厦门信达：董事会关于募集资金2014年度存放与使用情况的专项报告,finalpage/2015-04-11/1200811716.PDF
964,2015-04-11,厦门信达：发行长期限含权中期票据的公告,finalpage/2015-04-11/1200811717.PDF
965,2015-04-11,厦门信达：内部控制审计报告,finalpage/2015-04-11/1200811718.PDF
966,2015-04-11,厦门信达：募集资金年度存放与使用情况鉴证报告（2014年度）,finalpage/2015-04-11/1200811719.PDF
967,2015-04-11,厦门信达：关于会计政策变更的公告,finalpage/2015-04-11/1200811720.PDF
968,2015-04-11,厦门信达：关联交易公告,finalpage/2015-04-11/1200811721.PDF
969,2015-04-11,厦门信达：对外投资公告,finalpage/2015-04-11/1200811722.PDF
970,2015-04-11,厦门信达：公司章程（2015年4月）,finalpage/2015-04-11/1200811723.PDF
971,2015-04-11,厦门信达：股东回报规划（2015-2017年）,finalpage/2015-04-11/1200811724.PDF
972,2015-04-11,厦门信达：股东大会议事规则（2015年4月）,finalpage/2015-04-11/1200811725.PDF
973,2015-04-11,厦门信达：计提资产减值准备及核销部分资产的公告,finalpage/2015-04-11/1200811726.PDF
974,2015-04-11,厦门信达：独立董事提名人声明,finalpage/2015-04-11/1200811727.PDF
975,2015-04-11,厦门信达：独立董事事前审核意见,finalpage/2015-04-11/1200811728.PDF
976,2015-04-11,厦门信达：独立董事意见,finalpage/2015-04-11/1200811729.PDF
977,2015-04-11,厦门信达：独立董事2014年度述职报告（卢永华）,finalpage/2015-04-11/1200811730.PDF
978,2015-04-11,厦门信达：独立董事2014年度述职报告（童锦治）,finalpage/2015-04-11/1200811731.PDF
979,2015-04-11,厦门信达：独立董事2014年度述职报告（苏伟斌）,finalpage/2015-04-11/1200811732.PDF
980,2015-04-11,厦门信达：独立董事2014年度述职报告（薛祖云）,finalpage/2015-04-11/1200811733.PDF
