,date,title,url
520,2011-09-17,厦门信达：关于厦门证监局现场检查的整改报告,finalpage/2011-09-17/59966895.PDF
521,2011-09-17,厦门信达：套期保值业务管理制度（2011年9月）,finalpage/2011-09-17/59966896.PDF
522,2011-09-17,厦门信达：套期保值业务管理制度（2011年9月）,finalpage/2011-09-17/59966896.PDF
523,2011-09-17,厦门信达：衍生品投资管理制度（2011年9月）,finalpage/2011-09-17/59966897.PDF
524,2011-09-17,厦门信达：资产减值准备计提和资产核销管理办法（2011年9月）,finalpage/2011-09-17/59966898.PDF
525,2011-09-17,厦门信达：独立董事意见,finalpage/2011-09-17/59966899.PDF
526,2011-09-17,厦门信达：监事会关于会计估计变更等事项的审核意见,finalpage/2011-09-17/59966900.PDF
527,2011-09-17,厦门信达：监事会决议公告,finalpage/2011-09-17/59966901.PDF
528,2011-09-17,厦门信达：董事会决议公告,finalpage/2011-09-17/59966902.PDF
529,2011-10-13,厦门信达：关于控股子公司更名的公告,finalpage/2011-10-13/60050443.PDF
530,2011-10-29,厦门信达：2011年第三季度报告正文,finalpage/2011-10-29/60134388.PDF
531,2011-10-29,厦门信达：董事会决议公告,finalpage/2011-10-29/60134390.PDF
532,2011-10-29,厦门信达：关于召开2011年第三次临时股东大会通知,finalpage/2011-10-29/60134391.PDF
533,2011-10-29,厦门信达：2011年第三季度报告全文,finalpage/2011-10-29/60134392.PDF
534,2011-10-29,厦门信达：关于公司开展2011年度远期外汇交易的独立意见,finalpage/2011-10-29/60134393.PDF
535,2011-10-29,厦门信达：战略管理制度（2011年10月）,finalpage/2011-10-29/60134394.PDF
536,2011-10-29,厦门信达：关于开展2011年度远期外汇交易的公告,finalpage/2011-10-29/60134395.PDF
537,2011-10-29,厦门信达：对外担保公告,finalpage/2011-10-29/60134396.PDF
538,2011-10-29,厦门信达：对外担保进展公告,finalpage/2011-10-29/60134397.PDF
539,2011-10-29,厦门信达：投资管理制度（2011年10月）,finalpage/2011-10-29/60134398.PDF
540,2011-10-29,厦门信达：对外担保管理制度（2011年10月）,finalpage/2011-10-29/60134399.PDF
541,2011-11-16,厦门信达：2011年第三次临时股东大会决议公告,finalpage/2011-11-16/60206199.PDF
542,2011-11-16,厦门信达：对外担保进展公告,finalpage/2011-11-16/60206200.PDF
543,2011-11-16,厦门信达：2011年第三次临时股东大会的法律意见书,finalpage/2011-11-16/60206201.PDF
544,2011-12-14,厦门信达：关于公司向控股子公司提供财务资助的独立意见,finalpage/2011-12-14/60320833.PDF
545,2011-12-14,厦门信达：关于2012年度提供担保事项公告,finalpage/2011-12-14/60320834.PDF
546,2011-12-14,厦门信达：关于召开2011年第四次临时股东大会通知,finalpage/2011-12-14/60320835.PDF
547,2011-12-14,厦门信达：关于向控股子公司提供财务资助的公告,finalpage/2011-12-14/60320836.PDF
548,2011-12-14,厦门信达：董事会决议公告,finalpage/2011-12-14/60320837.PDF
549,2011-12-30,厦门信达：2011年第四次临时股东大会决议公告,finalpage/2011-12-30/60387245.PDF
550,2011-12-30,厦门信达：公司章程（2011年12月）,finalpage/2011-12-30/60387246.PDF
551,2011-12-30,厦门信达：2011年第四次临时股东大会的法律意见书,finalpage/2011-12-30/60387247.PDF
552,2012-02-10,厦门信达：职工监事辞职公告,finalpage/2012-02-10/60523666.PDF
553,2012-03-02,厦门信达：关于增补职工监事的公告,finalpage/2012-03-02/60611900.PDF
554,2012-03-10,厦门信达：对外担保进展公告,finalpage/2012-03-10/60650048.PDF
555,2012-03-16,厦门信达：2012年度日常关联交易预计发生额的公告,finalpage/2012-03-16/60676433.PDF
556,2012-03-16,厦门信达：关于2012年度购买银行理财产品的公告,finalpage/2012-03-16/60676438.PDF
557,2012-03-16,厦门信达：关于公开挂牌转让芜湖鼎邦房地产开发有限公司45%股权的公告,finalpage/2012-03-16/60676443.PDF
558,2012-03-16,厦门信达：关于召开2012年第一次临时股东大会通知,finalpage/2012-03-16/60676448.PDF
559,2012-03-16,厦门信达：关于开展2012年度远期外汇交易的公告,finalpage/2012-03-16/60676449.PDF
560,2012-03-16,厦门信达：对外担保进展补充公告,finalpage/2012-03-16/60676450.PDF
561,2012-03-16,厦门信达：独立董事意见,finalpage/2012-03-16/60676451.PDF
562,2012-03-16,厦门信达：董事会决议公告,finalpage/2012-03-16/60676452.PDF
563,2012-03-16,厦门信达：证券投资管理制度（2012年3月）,finalpage/2012-03-16/60676453.PDF
564,2012-03-16,厦门信达：芜湖鼎邦房地产开发有限公司审计报告及财务报表,finalpage/2012-03-16/60676454.PDF
565,2012-03-16,厦门信达：厦门信达房地产开发有限公司股权转让项目涉及的芜湖鼎邦房地产开发有限公司股东部分权益评估报告书,finalpage/2012-03-16/60676455.PDF
566,2012-03-24,厦门信达：关于召开2012年第一次临时股东大会的提示性公告,finalpage/2012-03-24/60717768.PDF
567,2012-03-30,厦门信达：2011年年度报告摘要,finalpage/2012-03-30/60760548.PDF
568,2012-03-30,厦门信达：2011年年度审计报告,finalpage/2012-03-30/60760555.PDF
569,2012-03-30,厦门信达：董事会决议公告,finalpage/2012-03-30/60760556.PDF
570,2012-03-30,厦门信达：关于对公司控股股东及其他关联方占用资金情况的专项审计说明,finalpage/2012-03-30/60760557.PDF
571,2012-03-30,厦门信达：2011年度内部控制自我评价报告,finalpage/2012-03-30/60760558.PDF
572,2012-03-30,厦门信达：2011年年度报告,finalpage/2012-03-30/60760559.PDF
573,2012-03-30,厦门信达：监事会对2011年下半年计提资产减值准备及核销部分资产的意见,finalpage/2012-03-30/60760560.PDF
574,2012-03-30,厦门信达：关于控股股东及其他关联方占用公司资金及公司对外担保的专项说明和独立意见,finalpage/2012-03-30/60760561.PDF
575,2012-03-30,厦门信达：关于召开2011年度股东大会的通知,finalpage/2012-03-30/60760564.PDF
576,2012-03-30,厦门信达：内部控制规范实施工作方案,finalpage/2012-03-30/60760565.PDF
577,2012-03-30,厦门信达：监事会决议公告,finalpage/2012-03-30/60760566.PDF
578,2012-03-30,厦门信达：计提资产减值准备及核销部分资产的公告,finalpage/2012-03-30/60760567.PDF
579,2012-03-30,厦门信达：独立董事意见,finalpage/2012-03-30/60760568.PDF
580,2012-03-30,厦门信达：独立董事2011年度述职报告（卢永华）,finalpage/2012-03-30/60760569.PDF
581,2012-03-30,厦门信达：独立董事2011年度述职报告（苏伟斌）,finalpage/2012-03-30/60760570.PDF
582,2012-03-30,厦门信达：独立董事2011年度述职报告（陈芃）,finalpage/2012-03-30/60760571.PDF
583,2012-03-30,厦门信达：监事会对公司内部控制自我评价的意见,finalpage/2012-03-30/60760572.PDF
584,2012-03-31,厦门信达：关于参与投资担保公司的情况说明,finalpage/2012-03-31/60773058.PDF
585,2012-04-06,厦门信达：2012年第一次临时股东大会决议公告,finalpage/2012-04-06/60787651.PDF
586,2012-04-06,厦门信达：2012年第一次临时股东大会的法律意见书,finalpage/2012-04-06/60787652.PDF
587,2012-04-24,厦门信达：2011年度股东大会决议公告,finalpage/2012-04-24/60887379.PDF
588,2012-04-24,厦门信达：关于选举职工代表监事的公告,finalpage/2012-04-24/60887380.PDF
589,2012-04-24,厦门信达：2011年度股东大会的法律意见书,finalpage/2012-04-24/60887381.PDF
590,2012-04-25,厦门信达：2012年第一季度报告正文,finalpage/2012-04-25/60899124.PDF
591,2012-04-25,厦门信达：董事会决议公告,finalpage/2012-04-25/60899126.PDF
592,2012-04-25,厦门信达：监事会决议公告,finalpage/2012-04-25/60899127.PDF
593,2012-04-25,厦门信达：2012年第一季度报告全文,finalpage/2012-04-25/60899128.PDF
594,2012-04-25,厦门信达：监事会对2012年第一季度计提资产减值准备及核销部分资产的意见,finalpage/2012-04-25/60899129.PDF
595,2012-04-25,厦门信达：计提资产减值准备及核销部分资产的公告,finalpage/2012-04-25/60899130.PDF
596,2012-04-25,厦门信达：关于计提资产减值准备及核销部分资产的独立意见,finalpage/2012-04-25/60899131.PDF
597,2012-06-07,厦门信达：关于2012年度第一期短期融资券发行公告,finalpage/2012-06-07/61101782.PDF
598,2012-06-12,厦门信达：关于2012年度第一期短期融资券发行情况公告,finalpage/2012-06-12/61123727.PDF
599,2012-06-13,厦门信达：2011年度权益分派实施公告,finalpage/2012-06-13/61130119.PDF
600,2012-06-28,厦门信达：关于公开挂牌转让芜湖鼎邦房地产开发有限公司45%股权的进展公告,finalpage/2012-06-28/61189276.PDF
601,2012-07-05,厦门信达：对外担保进展公告,finalpage/2012-07-05/61224075.PDF
602,2012-07-05,厦门信达：董事会决议公告,finalpage/2012-07-05/61224076.PDF
603,2012-07-11,厦门信达：厦门信达免税商场有限公司审计报告及财务报表（2011年1月1日至2011年12月31日）,finalpage/2012-07-11/61250621.PDF
604,2012-07-11,厦门信达：厦门信达免税商场有限公司股权转让项目股东全部权益评估报告书,finalpage/2012-07-11/61250622.PDF
605,2012-07-11,厦门信达：关于召开2012年第二次临时股东大会的通知,finalpage/2012-07-11/61250623.PDF
606,2012-07-11,厦门信达：关于转让厦门信达免税商场有限公司65%股权暨关联交易公告,finalpage/2012-07-11/61250624.PDF
607,2012-07-11,厦门信达：对外担保公告,finalpage/2012-07-11/61250625.PDF
608,2012-07-11,厦门信达：独立董事意见,finalpage/2012-07-11/61250626.PDF
609,2012-07-11,厦门信达：股东回报规划（2012-2014年）,finalpage/2012-07-11/61250627.PDF
610,2012-07-11,厦门信达：董事会决议公告,finalpage/2012-07-11/61250628.PDF
611,2012-07-11,厦门信达：独立董事关于转让厦门信达免税商场有限公司65%股权暨关联交易的事前审核意见,finalpage/2012-07-11/61250629.PDF
612,2012-07-21,厦门信达：厦门信达免税商场有限公司审计报告及财务报表（2012年1月1日至2012年5月31日）,finalpage/2012-07-21/61302748.PDF
613,2012-07-28,厦门信达：关于召开2012年第二次临时股东大会的提示性公告,finalpage/2012-07-28/61334159.PDF
614,2012-08-01,厦门信达：2012年第二次临时股东大会决议公告,finalpage/2012-08-01/61353470.PDF
615,2012-08-01,厦门信达：关于转让厦门信达免税商场有限公司65%股权的进展公告,finalpage/2012-08-01/61353471.PDF
616,2012-08-01,厦门信达：公司章程（2012年7月）,finalpage/2012-08-01/61353472.PDF
617,2012-08-01,厦门信达：2012年第二次临时股东大会的法律意见书,finalpage/2012-08-01/61353473.PDF
618,2012-08-01,厦门信达：2012年第二次临时股东大会的法律意见书,finalpage/2012-08-01/61353473.PDF
619,2012-08-17,厦门信达：2012年半年度报告摘要,finalpage/2012-08-17/61434960.PDF
620,2012-08-17,厦门信达：2012年半年度财务报告,finalpage/2012-08-17/61434963.PDF
621,2012-08-17,厦门信达：董事会决议公告,finalpage/2012-08-17/61434965.PDF
622,2012-08-17,厦门信达：监事会决议公告,finalpage/2012-08-17/61434966.PDF
623,2012-08-17,厦门信达：2012年半年度报告,finalpage/2012-08-17/61434967.PDF
624,2012-08-17,厦门信达：关于控股股东及其他关联方占用公司资金及公司对外担保的专项说明和独立意见,finalpage/2012-08-17/61434968.PDF
625,2012-08-17,厦门信达：诉讼事项公告,finalpage/2012-08-17/61434969.PDF
626,2012-08-31,厦门信达：诉讼事项公告,finalpage/2012-08-31/61511188.PDF
627,2012-09-28,厦门信达：债务融资工具信息披露管理制度（2012年9月）,finalpage/2012-09-28/61617133.PDF
628,2012-09-28,厦门信达：董事会决议公告,finalpage/2012-09-28/61617134.PDF
629,2012-10-13,厦门信达：诉讼进展公告,finalpage/2012-10-13/61650299.PDF
630,2012-10-27,厦门信达：2012年第三季度报告正文,finalpage/2012-10-27/61719232.PDF
631,2012-10-27,厦门信达：董事会决议公告,finalpage/2012-10-27/61719235.PDF
632,2012-10-27,厦门信达：监事会决议公告,finalpage/2012-10-27/61719236.PDF
633,2012-10-27,厦门信达：2012年第三季度报告全文,finalpage/2012-10-27/61719237.PDF
634,2012-10-27,厦门信达：关于单独计提资产减值准备的独立意见,finalpage/2012-10-27/61719238.PDF
635,2012-10-27,厦门信达：单独计提资产减值准备的公告,finalpage/2012-10-27/61719239.PDF
636,2012-10-27,厦门信达：对外担保公告,finalpage/2012-10-27/61719240.PDF
637,2012-10-27,厦门信达：监事会对2012年第三季度单独计提资产减值准备的意见,finalpage/2012-10-27/61719241.PDF
638,2012-11-01,厦门信达：关于召开2012年第三次临时股东大会通知,finalpage/2012-11-01/61746764.PDF
639,2012-11-01,厦门信达：对外投资公告,finalpage/2012-11-01/61746765.PDF
640,2012-11-01,厦门信达：独立董事关于公开挂牌转让衡阳鑫星河房地产开发有限公司42%股权的独立意见,finalpage/2012-11-01/61746766.PDF
641,2012-11-01,厦门信达：董事会决议公告,finalpage/2012-11-01/61746767.PDF
642,2012-11-01,厦门信达：衡阳鑫星河房地产开发有限公司审计报告及财务报表（2012年1月1日至2012年08月31日）,finalpage/2012-11-01/61746768.PDF
643,2012-11-01,厦门信达：衡阳鑫星河房地产开发有限公司审计报告及财务报表（2011年1月1日至2011年12月31日）,finalpage/2012-11-01/61746769.PDF
644,2012-11-01,厦门信达：股权转让项目涉及的衡阳鑫星河房地产开发有限公司股东部分权益评估报告书,finalpage/2012-11-01/61746772.PDF
645,2012-11-17,厦门信达：2012年第三次临时股东大会决议公告,finalpage/2012-11-17/61808276.PDF
646,2012-11-17,厦门信达：独立董事关于聘任公司财务总监的独立意见,finalpage/2012-11-17/61808277.PDF
647,2012-11-17,厦门信达：董事会决议公告,finalpage/2012-11-17/61808278.PDF
648,2012-11-17,厦门信达：2012年第三次临时股东大会的法律意见书,finalpage/2012-11-17/61808280.PDF
649,2012-12-11,厦门信达：关于公开挂牌转让衡阳鑫星河房地产开发有限公司42%股权的进展公告,finalpage/2012-12-11/61893051.PDF
650,2012-12-20,厦门信达：关于2013年度公司为控股子公司向金融机构申请授信额度提供担保的公告,finalpage/2012-12-20/61929131.PDF
651,2012-12-20,厦门信达：关于2013年度购买银行理财产品的公告,finalpage/2012-12-20/61929132.PDF
652,2012-12-20,厦门信达：关于2013年度远期外汇交易的公告,finalpage/2012-12-20/61929133.PDF
653,2012-12-20,厦门信达：关于发行非公开定向债务融资工具的公告,finalpage/2012-12-20/61929134.PDF
654,2012-12-20,厦门信达：关于召开2013年第一次临时股东大会通知,finalpage/2012-12-20/61929135.PDF
655,2012-12-20,厦门信达：关于申请办理应收账款无追索权保理业务的公告,finalpage/2012-12-20/61929136.PDF
656,2012-12-20,厦门信达：内幕信息知情人登记管理制度（2012年12月）,finalpage/2012-12-20/61929137.PDF
657,2012-12-20,厦门信达：独立董事关于聘请2012年度内部控制审计机构的事前审核意见,finalpage/2012-12-20/61929138.PDF
658,2012-12-20,厦门信达：独立董事意见,finalpage/2012-12-20/61929139.PDF
659,2012-12-20,厦门信达：监事会决议公告,finalpage/2012-12-20/61929140.PDF
660,2012-12-20,厦门信达：董事会决议公告,finalpage/2012-12-20/61929141.PDF
661,2013-01-05,厦门信达：2013年第一次临时股东大会决议公告,finalpage/2013-01-05/61983395.PDF
662,2013-01-05,厦门信达：监事会决议公告,finalpage/2013-01-05/61983396.PDF
663,2013-01-05,厦门信达：董事会决议公告,finalpage/2013-01-05/61983397.PDF
664,2013-01-05,厦门信达：2013年第一次临时股东大会的法律意见书,finalpage/2013-01-05/61983398.PDF
665,2013-01-16,厦门信达：对外投资进展公告,finalpage/2013-01-16/62024112.PDF
666,2013-01-16,厦门信达：对外担保进展公告,finalpage/2013-01-16/62024113.PDF
667,2013-02-22,厦门信达：关于发行非公开定向债务融资工具注册申请获准的公告,finalpage/2013-02-22/62142224.PDF
668,2013-03-12,厦门信达：关于2013年度第一期非公开定向债务融资工具发行情况的公告,finalpage/2013-03-12/62204134.PDF
669,2013-03-13,厦门信达：对外担保进展公告,finalpage/2013-03-13/62207093.PDF
670,2013-03-30,厦门信达：2012年年度报告摘要,finalpage/2013-03-30/62303758.PDF
671,2013-03-30,厦门信达：2012年年度审计报告,finalpage/2013-03-30/62303766.PDF
672,2013-03-30,厦门信达：董事会决议公告,finalpage/2013-03-30/62303767.PDF
673,2013-03-30,厦门信达：关于召开2012年度股东大会的通知,finalpage/2013-03-30/62303768.PDF
674,2013-03-30,厦门信达：监事会决议公告,finalpage/2013-03-30/62303769.PDF
675,2013-03-30,厦门信达：关于对公司控股股东及其他关联方占用资金情况的专项审计说明,finalpage/2013-03-30/62303770.PDF
676,2013-03-30,厦门信达：2012年度内部控制自我评价报告,finalpage/2013-03-30/62303771.PDF
677,2013-03-30,厦门信达：2012年年度报告,finalpage/2013-03-30/62303772.PDF
678,2013-03-30,厦门信达：内部控制审计报告,finalpage/2013-03-30/62303773.PDF
679,2013-03-30,厦门信达：2013年度日常关联交易预计发生额的公告,finalpage/2013-03-30/62303774.PDF
680,2013-03-30,厦门信达：关联交易公告,finalpage/2013-03-30/62303775.PDF
681,2013-03-30,厦门信达：计提资产减值准备及核销部分资产的公告,finalpage/2013-03-30/62303776.PDF
682,2013-03-30,厦门信达：独立董事事前审核意见,finalpage/2013-03-30/62303777.PDF
683,2013-03-30,厦门信达：独立董事意见,finalpage/2013-03-30/62303778.PDF
684,2013-03-30,厦门信达：独立董事2012年度述职报告（卢永华）,finalpage/2013-03-30/62303779.PDF
685,2013-03-30,厦门信达：独立董事2012年度述职报告（苏伟斌）,finalpage/2013-03-30/62303780.PDF
686,2013-03-30,厦门信达：独立董事2012年度述职报告（陈芃）,finalpage/2013-03-30/62303781.PDF
687,2013-03-30,厦门信达：监事会对2012年第四季度计提资产减值准备及核销部分资产的意见,finalpage/2013-03-30/62303782.PDF
688,2013-03-30,厦门信达：监事会对公司内部控制自我评价的意见,finalpage/2013-03-30/62303783.PDF
689,2013-03-30,厦门信达：2012年度监事会工作报告,finalpage/2013-03-30/62303784.PDF
690,2013-04-25,厦门信达：2012年度股东大会决议公告,finalpage/2013-04-25/62419662.PDF
691,2013-04-25,厦门信达：2012年度股东大会的法律意见书,finalpage/2013-04-25/62419663.PDF
692,2013-04-26,厦门信达：2013年第一季度报告正文,finalpage/2013-04-26/62428456.PDF
693,2013-04-26,厦门信达：董事会决议公告,finalpage/2013-04-26/62428460.PDF
694,2013-04-26,厦门信达：监事会决议公告,finalpage/2013-04-26/62428461.PDF
695,2013-04-26,厦门信达：2013年第一季度报告全文,finalpage/2013-04-26/62428462.PDF
696,2013-04-26,厦门信达：监事会对公司2013年第一季度单独计提资产减值准备的意见,finalpage/2013-04-26/62428463.PDF
697,2013-04-26,厦门信达：对外担保公告,finalpage/2013-04-26/62428464.PDF
698,2013-04-26,厦门信达：对外担保进展公告,finalpage/2013-04-26/62428465.PDF
699,2013-04-26,厦门信达：计提资产减值准备的公告,finalpage/2013-04-26/62428466.PDF
700,2013-04-26,厦门信达：关于公司2013年第一季度单独计提资产减值准备的独立意见,finalpage/2013-04-26/62428471.PDF
701,2013-05-14,厦门信达：厦门三安电子有限公司2011年度财务报表审计报告,finalpage/2013-05-14/62487362.PDF
702,2013-05-14,厦门信达：厦门三安电子有限公司2012年度财务报表审计报告,finalpage/2013-05-14/62487373.PDF
703,2013-05-14,厦门信达：股权转让项目涉及的厦门三安电子有限公司股东部分权益价值评估报告书,finalpage/2013-05-14/62487374.PDF
704,2013-05-14,厦门信达：关于召开2013年第二次临时股东大会的通知,finalpage/2013-05-14/62487375.PDF
705,2013-05-14,厦门信达：关于挂牌转让厦门三安电子有限公司股权的公告,finalpage/2013-05-14/62487376.PDF
706,2013-05-14,厦门信达：核销部分资产的公告,finalpage/2013-05-14/62487377.PDF
707,2013-05-14,厦门信达：独立董事意见,finalpage/2013-05-14/62487378.PDF
708,2013-05-14,厦门信达：监事会决议公告,finalpage/2013-05-14/62487379.PDF
709,2013-05-14,厦门信达：董事会决议公告,finalpage/2013-05-14/62487380.PDF
710,2013-05-14,厦门信达：监事会对核销部分资产的意见,finalpage/2013-05-14/62487381.PDF
711,2013-05-22,厦门信达：对外担保进展公告,finalpage/2013-05-22/62512313.PDF
712,2013-05-30,厦门信达：2013年第二次临时股东大会决议公告,finalpage/2013-05-30/62535459.PDF
713,2013-05-30,厦门信达：关于挂牌转让厦门三安电子有限公司股权的进展公告,finalpage/2013-05-30/62535460.PDF
714,2013-05-30,厦门信达：公司章程（2013年5月）,finalpage/2013-05-30/62535461.PDF
715,2013-05-30,厦门信达：2013年第二次临时股东大会的法律意见书,finalpage/2013-05-30/62535462.PDF
716,2013-06-08,厦门信达：2012年年度权益分派实施公告,finalpage/2013-06-08/62570169.PDF
717,2013-06-08,厦门信达：职工监事辞职公告,finalpage/2013-06-08/62570170.PDF
718,2013-06-14,厦门信达：对外投资进展公告,finalpage/2013-06-14/62578372.PDF
719,2013-06-28,厦门信达：信息披露事务管理制度（2013年6月）,finalpage/2013-06-28/62620647.PDF
720,2013-06-28,厦门信达：关于召开2013年第三次临时股东大会的通知,finalpage/2013-06-28/62620648.PDF
721,2013-06-28,厦门信达：董事会决议公告,finalpage/2013-06-28/62620649.PDF
722,2013-06-29,厦门信达：关于挂牌转让厦门三安电子有限公司股权的进展公告,finalpage/2013-06-29/62624812.PDF
723,2013-07-18,厦门信达：2013年第三次临时股东大会决议公告,finalpage/2013-07-18/62844927.PDF
724,2013-07-18,厦门信达：关于增补职工监事的公告,finalpage/2013-07-18/62844928.PDF
725,2013-07-18,厦门信达：对外担保公告,finalpage/2013-07-18/62844929.PDF
726,2013-07-18,厦门信达：董事会决议公告,finalpage/2013-07-18/62844930.PDF
727,2013-07-18,厦门信达：2013年第三次临时股东大会的法律意见书,finalpage/2013-07-18/62844931.PDF
728,2013-07-19,厦门信达：对外担保进展公告,finalpage/2013-07-19/62848383.PDF
729,2013-08-09,厦门信达：对外担保进展公告,finalpage/2013-08-09/62920325.PDF
730,2013-08-22,厦门信达：2013年半年度报告摘要,finalpage/2013-08-22/62974535.PDF
731,2013-08-22,厦门信达：2013年半年度财务报告,finalpage/2013-08-22/62974537.PDF
732,2013-08-22,厦门信达：董事会决议公告,finalpage/2013-08-22/62974538.PDF
733,2013-08-22,厦门信达：监事会决议公告,finalpage/2013-08-22/62974539.PDF
734,2013-08-22,厦门信达：2013年半年度报告,finalpage/2013-08-22/62974540.PDF
735,2013-08-22,厦门信达：监事会对公司2013年第二季度单独计提资产减值准备的意见,finalpage/2013-08-22/62974541.PDF
736,2013-08-22,厦门信达：监事会对公司2013年第二季度单独计提资产减值准备的意见,finalpage/2013-08-22/62974541.PDF
737,2013-08-22,厦门信达：2013年第三季度业绩预告,finalpage/2013-08-22/62974542.PDF
738,2013-08-22,厦门信达：对外担保公告,finalpage/2013-08-22/62974543.PDF
739,2013-08-22,厦门信达：计提资产减值准备的公告,finalpage/2013-08-22/62974544.PDF
740,2013-08-22,厦门信达：独立董事意见,finalpage/2013-08-22/62974546.PDF
741,2013-09-07,厦门信达：重大事项停牌公告,finalpage/2013-09-07/63059075.PDF
742,2013-09-12,厦门信达：关于厦门国贸控股有限公司认购非公开发行股票构成关联交易的公告,finalpage/2013-09-12/63074716.PDF
743,2013-09-12,厦门信达：关于召开2013年第四次临时股东大会的通知,finalpage/2013-09-12/63074717.PDF
744,2013-09-12,厦门信达：截至2013年6月30日止的前次募集资金使用情况报告,finalpage/2013-09-12/63074722.PDF
745,2013-09-12,厦门信达：募集资金使用管理制度（2013年9月）,finalpage/2013-09-12/63074723.PDF
746,2013-09-12,厦门信达：独立董事关于公司关联交易事项的事先认可函,finalpage/2013-09-12/63074724.PDF
747,2013-09-12,厦门信达：独立董事意见,finalpage/2013-09-12/63074725.PDF
748,2013-09-12,厦门信达：监事会决议公告,finalpage/2013-09-12/63074726.PDF
749,2013-09-12,厦门信达：董事会决议公告,finalpage/2013-09-12/63074727.PDF
750,2013-09-12,厦门信达：非公开发行股票募集资金使用可行性分析报告,finalpage/2013-09-12/63074728.PDF
751,2013-09-12,厦门信达：非公开发行股票预案,finalpage/2013-09-12/63074729.PDF
752,2013-09-12,厦门信达：高管人员薪酬与绩效管理制度（2013年9月）,finalpage/2013-09-12/63074730.PDF
753,2013-09-18,厦门信达：对外投资公告,finalpage/2013-09-18/63093461.PDF
754,2013-09-18,厦门信达：收购资产公告,finalpage/2013-09-18/63093462.PDF
755,2013-09-18,厦门信达：独立董事意见,finalpage/2013-09-18/63093463.PDF
756,2013-09-18,厦门信达：董事会决议公告,finalpage/2013-09-18/63093464.PDF
