,date,title,url
981,2015-04-11,厦门信达：独立董事2014年度述职报告（陈芃）,finalpage/2015-04-11/1200811734.PDF
982,2015-04-11,厦门信达：监事会对公司内部控制评价报告的意见,finalpage/2015-04-11/1200811735.PDF
983,2015-04-11,厦门信达：监事会意见,finalpage/2015-04-11/1200811736.PDF
984,2015-04-14,厦门信达：2015年度第三期超短期融资券发行情况公告,finalpage/2015-04-14/1200828060.PDF
985,2015-04-22,厦门信达：关于2015年度增加外汇衍生品交易的公告,finalpage/2015-04-22/1200881949.PDF
986,2015-04-22,厦门信达：2015年第一季度报告正文,finalpage/2015-04-22/1200881950.PDF
987,2015-04-22,厦门信达：董事会决议公告,finalpage/2015-04-22/1200881952.PDF
988,2015-04-22,厦门信达：监事会决议公告,finalpage/2015-04-22/1200881953.PDF
989,2015-04-22,厦门信达：2015年第一季度报告全文,finalpage/2015-04-22/1200881954.PDF
990,2015-04-22,厦门信达：中信建投证券股份有限公司关于公司增加2015年度外汇衍生品交易的核查意见,finalpage/2015-04-22/1200881955.PDF
991,2015-04-22,厦门信达：核销部分资产的公告,finalpage/2015-04-22/1200881956.PDF
992,2015-04-22,厦门信达：独立董事意见,finalpage/2015-04-22/1200881957.PDF
993,2015-04-22,厦门信达：监事会对2015年第一季度核销部分资产的意见,finalpage/2015-04-22/1200881958.PDF
994,2015-04-30,厦门信达：关于召开2014年度股东大会的提示性公告,finalpage/2015-04-30/1200944446.PDF
995,2015-05-07,厦门信达：关于选举职工监事的公告,finalpage/2015-05-07/1200975155.PDF
996,2015-05-07,厦门信达：2014年度股东大会决议公告,finalpage/2015-05-07/1200975156.PDF
997,2015-05-07,厦门信达：监事会决议公告,finalpage/2015-05-07/1200975157.PDF
998,2015-05-07,厦门信达：公司章程（2015年5月）,finalpage/2015-05-07/1200975158.PDF
999,2015-05-07,厦门信达：股东大会议事规则（2015年5月）,finalpage/2015-05-07/1200975159.PDF
1000,2015-05-07,厦门信达：2014年度股东大会的法律意见书,finalpage/2015-05-07/1200975160.PDF
1001,2015-05-16,厦门信达：2015年度第四期超短期融资券发行情况公告,finalpage/2015-05-16/1201021892.PDF
1002,2015-05-19,厦门信达：重大事项停牌公告,finalpage/2015-05-19/1201032534.PDF
1003,2015-05-21,厦门信达：关于参加厦门辖区上市公司投资者网上集体接待日活动的公告,finalpage/2015-05-21/1201042118.PDF
1004,2015-05-21,厦门信达：对外担保进展公告,finalpage/2015-05-21/1201042119.PDF
1005,2015-05-26,厦门信达：重大事项停牌进展公告,finalpage/2015-05-26/1201061752.PDF
1006,2015-05-28,厦门信达：关于部分闲置募集资金补充流动资金到期归还的公告,finalpage/2015-05-28/1201072583.PDF
1007,2015-06-02,厦门信达：重大事项停牌进展公告,finalpage/2015-06-02/1201089091.PDF
1008,2015-06-05,厦门信达：关于发行12亿元非公开定向债务融资工具注册申请获准的公告,finalpage/2015-06-05/1201106279.PDF
1009,2015-06-05,厦门信达：关于发行5亿元中期票据注册申请获准的公告,finalpage/2015-06-05/1201106280.PDF
1010,2015-06-09,厦门信达：中信建投证券股份有限公司关于公司向关联方购买办公写字楼的关联交易的核查意见,finalpage/2015-06-09/1201123035.PDF
1011,2015-06-09,厦门信达：关于厦门国贸控股有限公司认购非公开发行股票构成关联交易的公告,finalpage/2015-06-09/1201123036.PDF
1012,2015-06-09,厦门信达：关于召开2015年第一次临时股东大会的通知,finalpage/2015-06-09/1201123037.PDF
1013,2015-06-09,厦门信达：前次募集资金使用情况鉴证报告,finalpage/2015-06-09/1201123038.PDF
1014,2015-06-09,厦门信达：募集资金使用管理制度（2015年6月）,finalpage/2015-06-09/1201123039.PDF
1015,2015-06-09,厦门信达：前次募集资金使用情况专项报告,finalpage/2015-06-09/1201123040.PDF
1016,2015-06-09,厦门信达：关于聘请2015年度审计机构的公告,finalpage/2015-06-09/1201123041.PDF
1017,2015-06-09,厦门信达：独立董事意见,finalpage/2015-06-09/1201123042.PDF
1018,2015-06-09,厦门信达：监事会决议公告,finalpage/2015-06-09/1201123043.PDF
1019,2015-06-09,厦门信达：董事会决议公告,finalpage/2015-06-09/1201123044.PDF
1020,2015-06-09,厦门信达：购买资产暨关联交易的提示性公告,finalpage/2015-06-09/1201123045.PDF
1021,2015-06-09,厦门信达：重大事项复牌公告,finalpage/2015-06-09/1201123046.PDF
1022,2015-06-09,厦门信达：非公开发行股票募集资金使用的可行性分析报告,finalpage/2015-06-09/1201123047.PDF
1023,2015-06-09,厦门信达：非公开发行股票预案,finalpage/2015-06-09/1201123048.PDF
1024,2015-06-09,厦门信达：拟向公司出售坐落于厦门市湖里区五缘湾片区国贸商务中心的部分房地产项目评估报告,finalpage/2015-06-09/1201123049.PDF
1025,2015-06-09,厦门信达：独立董事事前审核意见,finalpage/2015-06-09/1201123050.PDF
1026,2015-06-13,厦门信达：购买资产暨关联交易公告,finalpage/2015-06-13/1201145052.PDF
1027,2015-06-13,厦门信达：厦门国贸控股有限公司拟向公司出售坐落于厦门市湖里区五缘湾片区国贸商务中心的部分房地产项目评估说明,finalpage/2015-06-13/1201145053.PDF
1028,2015-06-16,厦门信达：关于召开2015年第一次临时股东大会的提示性公告,finalpage/2015-06-16/1201154232.PDF
1029,2015-06-18,厦门信达：关于非公开发行股票相关事项获得厦门市国资委批复的公告,finalpage/2015-06-18/1201163633.PDF
1030,2015-06-20,厦门信达：2014年年度权益分派实施公告,finalpage/2015-06-20/1201174431.PDF
1031,2015-06-25,厦门信达：2015年第一次临时股东大会决议公告,finalpage/2015-06-25/1201191155.PDF
1032,2015-06-25,厦门信达：2015年第一次临时股东大会的法律意见书,finalpage/2015-06-25/1201191156.PDF
1033,2015-06-27,厦门信达：关于调整非公开发行股票发行价格和发行数量的公告,finalpage/2015-06-27/1201201477.PDF
1034,2015-07-07,厦门信达：2015年度第五期超短期融资券发行情况公告,finalpage/2015-07-07/1201247575.PDF
1035,2015-07-08,厦门信达：重大事项停牌公告,finalpage/2015-07-08/1201255489.PDF
1036,2015-07-10,厦门信达：关于维护公司股价稳定方案的公告,finalpage/2015-07-10/1201268832.PDF
1037,2015-07-14,厦门信达：关于签署《股权收购意向协议》暨公司股票复牌的公告,finalpage/2015-07-14/1201287199.PDF
1038,2015-07-14,厦门信达：2015半年度业绩预告,finalpage/2015-07-14/1201287250.PDF
1039,2015-07-17,厦门信达：关于控股股东增持公司股份的公告,finalpage/2015-07-17/1201305135.PDF
1040,2015-08-01,厦门信达：关于收到《中国证监会行政许可申请受理通知书》的公告,finalpage/2015-08-01/1201374768.PDF
1041,2015-08-06,厦门信达：对外担保进展公告,finalpage/2015-08-06/1201397588.PDF
1042,2015-08-07,厦门信达：2015年度第六期超短期融资券发行情况公告,finalpage/2015-08-07/1201402438.PDF
1043,2015-08-12,厦门信达：2015年度第一期中期票据发行结果公告,finalpage/2015-08-12/1201423753.PDF
1044,2015-08-25,厦门信达：2015年度第七期超短期融资券发行情况公告,finalpage/2015-08-25/1201483510.PDF
1045,2015-08-29,厦门信达：2015年度开展商品套期保值业务的公告,finalpage/2015-08-29/1201517079.PDF
1046,2015-08-29,厦门信达：2015年半年度报告摘要,finalpage/2015-08-29/1201517080.PDF
1047,2015-08-29,厦门信达：2015年半年度财务报告,finalpage/2015-08-29/1201517082.PDF
1048,2015-08-29,厦门信达：董事会决议公告,finalpage/2015-08-29/1201517083.PDF
1049,2015-08-29,厦门信达：监事会决议公告,finalpage/2015-08-29/1201517084.PDF
1050,2015-08-29,厦门信达：2015年半年度报告,finalpage/2015-08-29/1201517085.PDF
1051,2015-08-29,厦门信达：中信建投证券股份有限公司关于公司2015年度开展商品套期保值业务的核查意见,finalpage/2015-08-29/1201517086.PDF
1052,2015-08-29,厦门信达：董事会关于募集资金2015年半年度存放与使用情况的专项报告,finalpage/2015-08-29/1201517087.PDF
1053,2015-08-29,厦门信达：公司章程（2015年8月）,finalpage/2015-08-29/1201517088.PDF
1054,2015-08-29,厦门信达：董事会审计委员会实施细则（2015年8月）,finalpage/2015-08-29/1201517089.PDF
1055,2015-08-29,厦门信达：计提资产减值准备的公告,finalpage/2015-08-29/1201517090.PDF
1056,2015-08-29,厦门信达：独立董事意见,finalpage/2015-08-29/1201517091.PDF
1057,2015-08-29,厦门信达：监事会意见,finalpage/2015-08-29/1201517092.PDF
1058,2015-09-12,厦门信达：关于发行2015年度第二期中期票据注册申请获准的公告,finalpage/2015-09-12/1201581607.PDF
1059,2015-09-22,厦门信达：关于2015年度第一期非公开定向债务融资工具发行情况的公告,finalpage/2015-09-22/1201620519.PDF
1060,2015-09-24,厦门信达：2015年度第二期中期票据发行情况公告,finalpage/2015-09-24/1201630276.PDF
1061,2015-09-26,厦门信达：中信建投证券股份有限公司关于公司变更部分募集资金用途的核查意见,finalpage/2015-09-26/1201641678.PDF
1062,2015-09-26,厦门信达：关于变更部分募集资金用途的公告,finalpage/2015-09-26/1201641679.PDF
1063,2015-09-26,厦门信达：关于召开2015年第二次临时股东大会的通知（已取消）,finalpage/2015-09-26/1201641680.PDF
1064,2015-09-26,厦门信达：独立董事意见,finalpage/2015-09-26/1201641681.PDF
1065,2015-09-26,厦门信达：监事会决议公告,finalpage/2015-09-26/1201641682.PDF
1066,2015-09-26,厦门信达：董事会决议公告,finalpage/2015-09-26/1201641683.PDF
1067,2015-09-26,厦门信达：深圳市灏天光电有限公司审计报告,finalpage/2015-09-26/1201641684.PDF
1068,2015-09-26,厦门信达：福建省信达光电科技有限公司拟股权收购涉及的深圳市灏天光电有限公司股东全部权益评估报告书,finalpage/2015-09-26/1201641685.PDF
1069,2015-09-26,厦门信达：福建省信达光电科技有限公司拟股权收购涉及的深圳市灏天光电有限公司股东全部权益评估说明,finalpage/2015-09-26/1201641686.PDF
1070,2015-09-26,厦门信达：监事会意见,finalpage/2015-09-26/1201641687.PDF
1071,2015-09-30,厦门信达：关于召开2015年第二次临时股东大会的提示性公告（已取消）,finalpage/2015-09-30/1201654479.PDF
1072,2015-09-30,厦门信达：关于召开2015年第二次临时股东大会的提示性公告（更新后）,finalpage/2015-09-30/1201656084.PDF
1073,2015-09-30,厦门信达：关于召开2015年第二次临时股东大会的通知（更新后）,finalpage/2015-09-30/1201656085.PDF
1074,2015-09-30,厦门信达：关于召开2015年第二次临时股东大会通知的更正公告,finalpage/2015-09-30/1201656086.PDF
1075,2015-10-13,厦门信达：2015年第二次临时股东大会决议公告,finalpage/2015-10-13/1201684919.PDF
1076,2015-10-13,厦门信达：公司章程（2015年10月）,finalpage/2015-10-13/1201684920.PDF
1077,2015-10-13,厦门信达：2015年第二次临时股东大会的法律意见书,finalpage/2015-10-13/1201684921.PDF
1078,2015-10-20,厦门信达：关于房地产业务相关承诺的公告,finalpage/2015-10-20/1201709561.PDF
1079,2015-10-20,厦门信达：非公开发行股票预案（修订稿）,finalpage/2015-10-20/1201709347.PDF
1080,2015-10-20,厦门信达：独立董事意见,finalpage/2015-10-20/1201709348.PDF
1081,2015-10-20,厦门信达：关于调整公司2015年非公开发行股票方案的公告,finalpage/2015-10-20/1201709349.PDF
1082,2015-10-20,厦门信达：关于修订公司非公开发行股票预案的公告,finalpage/2015-10-20/1201709350.PDF
1083,2015-10-20,厦门信达：关于与特定对象重新签署附生效条件认购协议的公告,finalpage/2015-10-20/1201709351.PDF
1084,2015-10-20,厦门信达：关于召开2015年第三次临时股东大会的通知,finalpage/2015-10-20/1201709352.PDF
1085,2015-10-20,厦门信达：监事会决议公告,finalpage/2015-10-20/1201709353.PDF
1086,2015-10-20,厦门信达：前次募集资金使用情况鉴证报告,finalpage/2015-10-20/1201709354.PDF
1087,2015-10-20,厦门信达：关于挂牌转让所持厦门三安电子有限公司股权的公告,finalpage/2015-10-20/1201709355.PDF
1088,2015-10-20,厦门信达：关于公司非公开发行股票涉及关联交易事项的公告,finalpage/2015-10-20/1201709356.PDF
1089,2015-10-20,厦门信达：前次募集资金使用情况专项报告,finalpage/2015-10-20/1201709357.PDF
1090,2015-10-20,厦门信达：股权转让项目涉及的厦门三安电子有限公司股东部分权益价值评估报告书,finalpage/2015-10-20/1201709358.PDF
1091,2015-10-20,厦门信达：厦门三安电子有限公司2014年度财务报表审计报告,finalpage/2015-10-20/1201709359.PDF
1092,2015-10-20,厦门信达：厦门三安电子有限公司2015年1-8月财务报表审计报告,finalpage/2015-10-20/1201709360.PDF
1093,2015-10-20,厦门信达：独立董事事前审核意见,finalpage/2015-10-20/1201709361.PDF
1094,2015-10-20,厦门信达：股票交易异常波动的公告,finalpage/2015-10-20/1201709362.PDF
1095,2015-10-20,厦门信达：关于涉及的房地产业务的专项自查报告,finalpage/2015-10-20/1201709363.PDF
1096,2015-10-20,厦门信达：董事会决议公告,finalpage/2015-10-20/1201709364.PDF
1097,2015-10-22,厦门信达：股票交易异常波动的公告,finalpage/2015-10-22/1201713980.PDF
1098,2015-10-24,厦门信达：2015年第三季度报告正文,finalpage/2015-10-24/1201717662.PDF
1099,2015-10-24,厦门信达：2015年第三季度报告全文,finalpage/2015-10-24/1201717664.PDF
1100,2015-10-24,厦门信达：董事会决议公告,finalpage/2015-10-24/1201717665.PDF
1101,2015-10-31,厦门信达：关于召开2015年第三次临时股东大会的提示性公告,finalpage/2015-10-31/1201744591.PDF
1102,2015-10-31,厦门信达：关于调整非公开发行股票相关事项获得厦门市国资委批复的公告,finalpage/2015-10-31/1201744592.PDF
1103,2015-11-03,厦门信达：关于进一步细化房地产业务相关承诺的公告,finalpage/2015-11-03/1201748743.PDF
1104,2015-11-03,厦门信达：承诺函（一）,finalpage/2015-11-03/1201748744.PDF
1105,2015-11-03,厦门信达：承诺函（二）,finalpage/2015-11-03/1201748745.PDF
1106,2015-11-06,厦门信达：2015年第三次临时股东大会决议公告,finalpage/2015-11-06/1201755303.PDF
1107,2015-11-06,厦门信达：2015年第三次临时股东大会的法律意见书,finalpage/2015-11-06/1201755304.PDF
1108,2015-11-10,厦门信达：关于收到《中国证监会行政许可项目审查反馈意见通知书》的公告,finalpage/2015-11-10/1201759300.PDF
1109,2015-11-13,厦门信达：董事会决议公告,finalpage/2015-11-13/1201767023.PDF
1110,2015-11-13,厦门信达：关于最近五年被证券监管部门和交易所采取监管措施及整改情况的公告,finalpage/2015-11-13/1201767024.PDF
1111,2015-11-13,厦门信达：监事会决议公告,finalpage/2015-11-13/1201767025.PDF
1112,2015-11-13,厦门信达：关于进一步细化公司非公开发行对象的公告,finalpage/2015-11-13/1201767026.PDF
1113,2015-11-13,厦门信达：关于公司非公开发行股票涉及关联交易事项的公告,finalpage/2015-11-13/1201767027.PDF
1114,2015-11-13,厦门信达：关于非公开发行股票摊薄即期回报的风险提示及相关防范措施的公告,finalpage/2015-11-13/1201767028.PDF
1115,2015-11-13,厦门信达：关于非公开发行申请文件反馈意见回复的公告,finalpage/2015-11-13/1201767029.PDF
1116,2015-11-13,厦门信达：独立董事意见,finalpage/2015-11-13/1201767030.PDF
1117,2015-11-13,厦门信达：独立董事事前审核意见,finalpage/2015-11-13/1201767031.PDF
1118,2015-11-13,厦门信达：非公开发行股票预案（二次修订稿）,finalpage/2015-11-13/1201767032.PDF
1119,2015-11-13,厦门信达：关于修订公司非公开发行股票预案的公告,finalpage/2015-11-13/1201767033.PDF
1120,2015-11-13,厦门信达：非公开发行股票申请文件反馈意见的回复,finalpage/2015-11-13/1201767034.PDF
1121,2015-11-19,厦门信达：2015年度第八期超短期融资券发行情况公告,finalpage/2015-11-19/1201777621.PDF
1122,2015-12-01,厦门信达：关于2016年度开展外汇衍生品交易的公告,finalpage/2015-12-01/1201799607.PDF
1123,2015-12-01,厦门信达：关于2016年度使用临时闲置资金购买银行理财产品的公告,finalpage/2015-12-01/1201799608.PDF
1124,2015-12-01,厦门信达：接受厦门国贸控股有限公司财务资助暨关联交易公告,finalpage/2015-12-01/1201799609.PDF
1125,2015-12-01,厦门信达：2016年度日常关联交易预计发生额的公告,finalpage/2015-12-01/1201799610.PDF
1126,2015-12-01,厦门信达：2016年度开展商品套期保值业务的公告,finalpage/2015-12-01/1201799611.PDF
1127,2015-12-01,厦门信达：关于控股子公司厦门市信达安贸易有限公司与福建三钢闽光股份有限公司签订《关于福建三安钢铁有限公司之盈利预测补偿协议》的公告,finalpage/2015-12-01/1201799612.PDF
1128,2015-12-01,厦门信达：关于2016年度公司为全资子公司向金融机构申请授信额度提供担保的公告,finalpage/2015-12-01/1201799613.PDF
1129,2015-12-01,厦门信达：对外担保公告,finalpage/2015-12-01/1201799614.PDF
1130,2015-12-01,厦门信达：独立董事事前审核意见,finalpage/2015-12-01/1201799615.PDF
1131,2015-12-01,厦门信达：独立董事意见,finalpage/2015-12-01/1201799616.PDF
1132,2015-12-01,厦门信达：中信建投证券股份有限公司关于公司2016年度开展外汇衍生品交易、关联交易等事项的核查意见,finalpage/2015-12-01/1201799617.PDF
1133,2015-12-01,厦门信达：福建三钢闽光股份有限公司与福建省三钢（集团）有限责任公司、福建省安溪荣德矿业有限公司、福建三安集团有限公司、厦门市信达安贸易有限公司关于福建三安钢铁有限公司之盈利预测补偿协议,finalpage/2015-12-01/1201799618.PDF
1134,2015-12-01,厦门信达：关于召开2015年第四次临时股东大会的通知,finalpage/2015-12-01/1201799619.PDF
1135,2015-12-01,厦门信达：2015年度第九期超短期融资券发行情况公告,finalpage/2015-12-01/1201799620.PDF
1136,2015-12-01,厦门信达：董事会决议公告,finalpage/2015-12-01/1201799621.PDF
1137,2015-12-10,厦门信达：关于召开2015年第四次临时股东大会的提示性公告,finalpage/2015-12-10/1201825122.PDF
1138,2015-12-12,厦门信达：关于挂牌转让部分所持厦门三安电子有限公司股权的进展公告,finalpage/2015-12-12/1201830974.PDF
1139,2015-12-17,厦门信达：关于非公开发行A股股票申请获得中国证监会发行审核委员会审核通过的公告,finalpage/2015-12-17/1201841843.PDF
1140,2015-12-17,厦门信达：2015年第四次临时股东大会决议公告,finalpage/2015-12-17/1201841844.PDF
1141,2015-12-17,厦门信达：2015年第四次临时股东大会的法律意见书,finalpage/2015-12-17/1201841845.PDF
1142,2015-12-25,厦门信达：关于挂牌转让部分所持厦门三安电子有限公司股权的进展公告,finalpage/2015-12-25/1201856366.PDF
1143,2015-12-30,厦门信达：可续期委托贷款借款发放公告,finalpage/2015-12-30/1201873801.PDF
1144,2016-01-05,厦门信达：2015年度第十期超短期融资券发行情况公告,finalpage/2016-01-05/1201887338.PDF
1145,2016-01-12,厦门信达：2016年度第一期超短期融资券发行情况公告,finalpage/2016-01-12/1201906278.PDF
1146,2016-01-13,厦门信达：关于非公开发行股票获得中国证券监督管理委员会核准批复的公告,finalpage/2016-01-13/1201908347.PDF
1147,2016-01-18,厦门信达：关于成立光电与物联研究院的自愿性信息披露公告,finalpage/2016-01-18/1201922164.PDF
1148,2016-01-19,厦门信达：福建远大联盟律师事务所关于公司控股股东增持股份的法律意见书,finalpage/2016-01-19/1201923136.PDF
1149,2016-01-19,厦门信达：关于控股股东及其一致行动人承诺增持公司股份的公告,finalpage/2016-01-19/1201923137.PDF
1150,2016-01-19,厦门信达：关于控股股东完成增持公司股份计划的公告,finalpage/2016-01-19/1201923138.PDF
1151,2016-01-30,厦门信达：董事会决议公告,finalpage/2016-01-30/1201954701.PDF
1152,2016-01-30,厦门信达：关于签署募集资金三方监管协议的公告,finalpage/2016-01-30/1201954702.PDF
1153,2016-02-23,厦门信达：2016年度第二期超短期融资券发行情况公告,finalpage/2016-02-23/1201990745.PDF
1154,2016-02-25,厦门信达：中信建投证券股份有限公司关于公司非公开发行股票上市保荐书,finalpage/2016-02-25/1201997244.PDF
1155,2016-02-25,厦门信达：验资报告,finalpage/2016-02-25/1201997245.PDF
1156,2016-02-25,厦门信达：中信建投证券股份有限公司关于公司非公开发行股票发行过程和认购对象合规性的报告,finalpage/2016-02-25/1201997246.PDF
1157,2016-02-25,厦门信达：北京市天元律师事务所关于公司非公开发行股票发行过程及认购对象合规性的法律意见,finalpage/2016-02-25/1201997247.PDF
1158,2016-02-25,厦门信达：关于本次非公开发行股票过程中相关承诺及履行情况的公告,finalpage/2016-02-25/1201997248.PDF
1159,2016-02-25,厦门信达：关于保荐代表人变更的公告,finalpage/2016-02-25/1201997249.PDF
1160,2016-02-25,厦门信达：福建远大联盟律师事务所关于厦门国贸控股有限公司认购公司非公开发行股票符合免于提交豁免要约收购申请条件的专项法律意见书,finalpage/2016-02-25/1201997250.PDF
1161,2016-02-25,厦门信达：非公开发行股票新增股份变动报告及上市公告书摘要,finalpage/2016-02-25/1201997251.PDF
1162,2016-02-25,厦门信达：非公开发行股票新增股份变动报告及上市公告书,finalpage/2016-02-25/1201997252.PDF
1163,2016-02-27,厦门信达：2016年度第三期超短期融资券发行情况公告,finalpage/2016-02-27/1202004385.PDF
1164,2016-03-10,厦门信达：对外投资的自愿性信息披露公告,finalpage/2016-03-10/1202033371.PDF
1165,2016-03-10,厦门信达：董事会决议公告,finalpage/2016-03-10/1202033372.PDF
1166,2016-03-17,厦门信达：关于全资子公司签署募集资金三方监管协议的公告,finalpage/2016-03-17/1202051389.PDF
1167,2016-04-02,厦门信达：计提资产减值准备及核销部分资产的公告,finalpage/2016-04-02/1202132557.PDF
1168,2016-04-02,厦门信达：董事会关于募集资金2015年度存放与使用情况的专项报告,finalpage/2016-04-02/1202132558.PDF
1169,2016-04-02,厦门信达：关于2016年度公司为控股子公司向金融机构申请授信额度提供担保的公告,finalpage/2016-04-02/1202132559.PDF
1170,2016-04-02,厦门信达：关联交易公告,finalpage/2016-04-02/1202132560.PDF
1171,2016-04-02,厦门信达：关于部分董事和监事辞职的公告,finalpage/2016-04-02/1202132561.PDF
1172,2016-04-02,厦门信达：对外担保进展公告,finalpage/2016-04-02/1202132562.PDF
1173,2016-04-02,厦门信达：2015年度监事会工作报告,finalpage/2016-04-02/1202132563.PDF
1174,2016-04-02,厦门信达：独立董事事前审核意见,finalpage/2016-04-02/1202132564.PDF
1175,2016-04-02,厦门信达：独立董事2015年度述职报告（苏伟斌）,finalpage/2016-04-02/1202132565.PDF
1176,2016-04-02,厦门信达：独立董事2015年度述职报告（童锦治）,finalpage/2016-04-02/1202132566.PDF
1177,2016-04-02,厦门信达：独立董事2015年度述职报告（薛祖云）,finalpage/2016-04-02/1202132567.PDF
1178,2016-04-02,厦门信达：独立董事2015年度述职报告（郑学军）,finalpage/2016-04-02/1202132568.PDF
1179,2016-04-02,厦门信达：监事会对2015年度计提资产减值准备及2015年第四季度核销部分资产的意见,finalpage/2016-04-02/1202132569.PDF
1180,2016-04-02,厦门信达：监事会对公司内部控制评价报告的意见,finalpage/2016-04-02/1202132570.PDF
1181,2016-04-02,厦门信达：内部控制审计报告,finalpage/2016-04-02/1202132571.PDF
1182,2016-04-02,厦门信达：募集资金年度存放与使用情况鉴证报告,finalpage/2016-04-02/1202132572.PDF
1183,2016-04-02,厦门信达：公司章程（2016年3月）,finalpage/2016-04-02/1202132573.PDF
1184,2016-04-02,厦门信达：中信建投证券股份有限公司关于公司2015年度保荐工作报告,finalpage/2016-04-02/1202132574.PDF
1185,2016-04-02,厦门信达：中信建投证券股份有限公司关于公司2015年度募集资金存放与使用情况的专项核查报告,finalpage/2016-04-02/1202132575.PDF
1186,2016-04-02,厦门信达：中信建投证券股份有限公司关于公司2015年度内部控制评价报告的核查意见,finalpage/2016-04-02/1202132576.PDF
1187,2016-04-02,厦门信达：中信建投证券股份有限公司关于公司的定期现场检查报告,finalpage/2016-04-02/1202132577.PDF
1188,2016-04-02,厦门信达：中信建投证券股份有限公司关于公司关联交易的专项核查意见,finalpage/2016-04-02/1202132578.PDF
1189,2016-04-02,厦门信达：关于对公司控股股东及其他关联方资金占用情况的专项说明,finalpage/2016-04-02/1202132579.PDF
1190,2016-04-02,厦门信达：2015年度内部控制评价报告,finalpage/2016-04-02/1202132580.PDF
