,date,title,url
0,2001-08-03,山西关铝股份有限公司二00一年中期报告,finalpage/2001-08-03/514459.html
1,2001-11-20,关铝股份：关于变更会计师事务所的议案等,finalpage/2001-11-20/519863.html
2,2001-11-28,关铝股份：公司电解铝发展计划的实施方案,finalpage/2001-11-28/522532.html
3,2001-12-25,关铝股份：中介机构变更等,finalpage/2001-12-25/531289.html
4,2002-01-11,关铝股份：高级管理人员变更,finalpage/2002-01-11/535054.html
5,2002-01-15,关铝股份：2001年业绩大幅上升的提示性公告,finalpage/2002-01-15/535627.html
6,2002-03-01,关铝股份：推迟2001年年度报告披露日期,finalpage/2002-03-01/546047.html
7,2002-03-11,关铝股份：债券兑付公告,finalpage/2002-03-11/550242.PDF
8,2002-03-21,关铝股份：2001年年度利润分配预案等,finalpage/2002-03-21/555686.PDF
9,2002-03-21,山西关铝股份有限公司二OO一年年度报告摘要,finalpage/2002-03-21/555791.html
10,2002-03-21,关铝股份2001年年度报告,finalpage/2002-03-21/555547.PDF
11,2002-04-15,关铝股份：关联交易补充公告,finalpage/2002-04-15/569669.PDF
12,2002-04-24,关铝股份：2001年度利润分配预案等,finalpage/2002-04-24/578293.html
13,2002-04-25,关铝股份：通过2002年第一季度报告,finalpage/2002-04-25/579195.html
14,2002-04-25,关铝股份2002年第一季度报告,finalpage/2002-04-25/579199.PDF
15,2002-05-23,关铝股份：2001年度分红派息实施公告,finalpage/2002-05-23/601317.html
16,2002-07-02,关铝股份：建立现代企业制度自查报告的议案等,finalpage/2002-07-02/613044.html
17,2002-08-02,关铝股份：资产收购,finalpage/2002-08-02/623710.html
18,2002-08-03,关铝股份：收购山西北方制药厂破产财产的议案等,finalpage/2002-08-03/624304.PDF
19,2002-08-03,关铝股份：2002年中期报告摘要,finalpage/2002-08-03/630123.html
20,2002-08-03,关铝股份独立董事工作制度,finalpage/2002-08-03/624303.PDF
21,2002-08-03,关铝股份信息披露管理办法,finalpage/2002-08-03/624301.PDF
22,2002-08-03,关铝股份2002年中期报告,finalpage/2002-08-03/624389.PDF
23,2002-10-26,关铝股份2002年第三季度报告,finalpage/2002-10-26/10073460.PDF
24,2002-10-26,关铝股份：2002年第三季度报告摘要,finalpage/2002-10-26/10068761.html
25,2002-11-15,关铝股份：关于巡回检查的整改报告,finalpage/2002-11-15/10071800.html
26,2002-11-28,关铝股份：关联交易,finalpage/2002-11-28/10077690.html
27,2003-01-18,关铝股份：为他人提供担保公告,finalpage/2003-01-18/10108111.html
28,2003-01-18,关铝股份：第二届董事会第九次会议决议公告,finalpage/2003-01-18/10108106.html
29,2003-03-06,关铝股份：第二届监事会第七次会议决议公告,finalpage/2003-03-06/10198577.html
30,2003-03-06,关铝股份：召开2002年年度股东大会的通知,finalpage/2003-03-06/10198575.html
31,2003-03-06,关铝股份：第二届董事会第十次会议决议公告,finalpage/2003-03-06/10198574.html
32,2003-03-06,关铝股份：2002年度财务报告之审计报告,finalpage/2003-03-06/10198573.PDF
33,2003-03-06,关铝股份2002年年度报告,finalpage/2003-03-06/10198565.PDF
34,2003-03-06,关铝股份2002年年度报告摘要,finalpage/2003-03-06/10198570.PDF
35,2003-03-26,关铝股份2002年年度报告补充公告,finalpage/2003-03-26/10336957.PDF
36,2003-04-09,关铝股份：2002年年度股东大会决议公告,finalpage/2003-04-09/10463345.PDF
37,2003-04-17,关铝股份：第二届董事会第十一次会议决议公告,finalpage/2003-04-17/10539858.html
38,2003-04-17,关铝股份：2002年度分红派息实施公告,finalpage/2003-04-17/10539865.html
39,2003-04-17,关铝股份2003年第一季度报告,finalpage/2003-04-17/10539859.PDF
40,2003-07-03,关铝股份：控股股东改制及名称变更的提示性公告,finalpage/2003-07-03/10751309.html
41,2003-07-16,关铝股份：第二届监事会第八次会议决议公告,finalpage/2003-07-16/10764103.html
42,2003-07-16,关铝股份：关于采购铝母线及阳极钢爪材料之关联交易公告,finalpage/2003-07-16/10764106.html
43,2003-07-16,关铝股份：第二届董事会第十二次会议决议公告,finalpage/2003-07-16/10764105.html
44,2003-07-16,关铝股份：独立董事提名人声明及独立董事候选人声明,finalpage/2003-07-16/10764104.html
45,2003-07-16,关铝股份：前次募集资金使用情况专项审核报告,finalpage/2003-07-16/10764112.PDF
46,2003-07-16,关铝股份2003年半年度报告摘要,finalpage/2003-07-16/10764121.PDF
47,2003-07-16,关铝股份：关于提请修改公司章程的议案,finalpage/2003-07-16/10764109.PDF
48,2003-07-16,关铝股份2003年半年度报告,finalpage/2003-07-16/10764114.PDF
49,2003-08-05,关铝股份2003年半年度报告的补充公告,finalpage/2003-08-05/10946549.PDF
50,2003-09-06,关铝股份：关于召开2003年第一次临时股东大会通知,finalpage/2003-09-06/12508346.html
51,2003-09-06,关铝股份：第二届董事会第十三次会议决议公告,finalpage/2003-09-06/12508345.html
52,2003-09-25,关铝股份：收购报告书摘要,finalpage/2003-09-25/12728151.PDF
53,2003-09-25,关铝股份：收购报告书,finalpage/2003-09-25/12728150.PDF
54,2003-09-27,关铝股份：独立财务顾问报告,finalpage/2003-09-27/12733274.PDF
55,2003-09-27,关铝股份：关于关联交易之独立财务顾问报告的提示性公告,finalpage/2003-09-27/12733200.html
56,2003-10-10,关铝股份：2003年第一次临时股东大会决议公告,finalpage/2003-10-10/12867857.html
57,2003-10-18,关铝股份：关于山西关铝集团有限公司收购事宜致全体股东的报告书,finalpage/2003-10-18/12971222.PDF
58,2003-10-23,关铝股份2003年第三季度报告,finalpage/2003-10-23/12982182.PDF
59,2003-10-28,关铝股份：山西关铝集团有限公司收购报告书,finalpage/2003-10-28/13005662.PDF
60,2003-10-29,关铝股份：董事会关于环保通过全面达标验收的公告,finalpage/2003-10-29/13014508.html
61,2003-11-04,关铝股份：20万吨电解铝技改工程项目可行性研究报告获得批准,finalpage/2003-11-04/13041905.html
62,2003-11-19,关铝股份：关于召开2003年第二次临时股东大会通知,finalpage/2003-11-19/13059549.html
63,2003-11-19,关铝股份：第二届董事会第十五次会议决议公告,finalpage/2003-11-19/13059547.html
64,2003-11-28,关铝股份：关于20万吨电解铝技改项目部分电解槽通电启动试运行的公告,finalpage/2003-11-28/13096402.html
65,2003-12-20,关铝股份：2003年第二次临时股东大会决议公告,finalpage/2003-12-20/13247584.html
66,2004-02-12,关铝股份：第二届董事会第十六次会议决议公告,finalpage/2004-02-12/13679278.html
67,2004-02-12,关铝股份：关于召开2003年年度股东大会的通知,finalpage/2004-02-12/13679251.html
68,2004-02-12,关铝股份：第二届监事会第十次会议决议公告,finalpage/2004-02-12/13610462.html
69,2004-02-12,关铝股份2003年年度报告摘要,finalpage/2004-02-12/13610465.PDF
70,2004-02-12,关铝股份2003年年度报告,finalpage/2004-02-12/13610468.PDF
71,2004-03-17,关铝股份：2003年年度股东大会决议公告,finalpage/2004-03-17/13785754.html
72,2004-04-08,关铝股份：关联交易公告,finalpage/2004-04-08/13881190.PDF
73,2004-04-15,关铝股份2004年第一季度报告,finalpage/2004-04-15/13906430.PDF
74,2004-05-11,关铝股份：2003年度分红派息实施公告,finalpage/2004-05-11/14018831.html
75,2004-05-28,关铝股份：独立董事提名人声明,finalpage/2004-05-28/14096534.html
76,2004-05-28,关铝股份：第二届监事会第十一次会议决议公告,finalpage/2004-05-28/14096496.html
77,2004-05-28,关铝股份：关于召开2004年第一次临时股东大会的通知,finalpage/2004-05-28/14096463.html
78,2004-05-28,关铝股份：第二届董事会第十八次会议决议公告,finalpage/2004-05-28/14096579.html
79,2004-06-30,关铝股份：2004年第一次临时股东大会决议公告,finalpage/2004-06-30/14197672.html
80,2004-06-30,关铝股份：第三届董事会第一次会议决议公告,finalpage/2004-06-30/14197670.html
81,2004-06-30,关铝股份：独立董事关于提名公司高管人员候选人的独立意见,finalpage/2004-06-30/14197666.html
82,2004-06-30,关铝股份：第三届监事会第一次会议决议公告,finalpage/2004-06-30/14197664.html
83,2004-08-25,关铝股份：第三届董事会第二次会议决议,finalpage/2004-08-25/14479620.html
84,2004-08-25,关铝股份：2004年半年度财务报告,finalpage/2004-08-25/14479716.PDF
85,2004-08-25,关铝股份2004年半年度报告摘要,finalpage/2004-08-25/14479714.PDF
86,2004-08-25,关铝股份2004年半年度报告,finalpage/2004-08-25/14479713.PDF
87,2004-10-18,关铝股份2004年第三季度报告,finalpage/2004-10-18/14661200.PDF
88,2005-02-26,关铝股份：关于2005年度增发A股募集资金运用的可行性分析报告,finalpage/2005-02-26/15043090.html
89,2005-02-26,关铝股份：第三届董事会第四次会议决议公告,finalpage/2005-02-26/15043077.html
90,2005-02-26,关铝股份：关于召开2005年第一次临时股东大会的通知,finalpage/2005-02-26/15043107.PDF
91,2005-03-19,关铝股份：关于召开2005年第一次临时股东大会的再次通知,finalpage/2005-03-19/15116152.PDF
92,2005-03-24,关铝股份：关于取消召开2005年第一次临时股东大会及2004年经营业绩预告的公告,finalpage/2005-03-24/15133334.html
93,2005-03-30,关铝股份：关于召开2004年年度股东大会的通知,finalpage/2005-03-30/15158121.html
94,2005-03-30,关铝股份：第三届监事会第二次会议决议公告,finalpage/2005-03-30/15158064.html
95,2005-03-30,关铝股份：第三届董事会第五次会议决议公告,finalpage/2005-03-30/15158061.html
96,2005-03-30,关铝股份：2004年度财务报告之审计报告,finalpage/2005-03-30/15158446.PDF
97,2005-03-30,关铝股份2004年年度报告摘要,finalpage/2005-03-30/15158443.PDF
98,2005-03-30,关铝股份2004年年度报告,finalpage/2005-03-30/15158440.PDF
99,2005-04-05,关铝股份：2005年第二次临时董事会会议决议公告,finalpage/2005-04-05/15182815.html
100,2005-04-05,关铝股份：日常关联交易公告,finalpage/2005-04-05/15182810.PDF
101,2005-04-19,关铝股份2005年第一季度报告,finalpage/2005-04-19/15242883.PDF
102,2005-05-11,关铝股份：2004年年度股东大会决议公告,finalpage/2005-05-11/15356973.html
103,2005-05-19,关铝股份公司章程（2005年5月）,finalpage/2005-05-19/15398502.PDF
104,2005-07-02,关铝股份：2004年度分红派息实施公告,finalpage/2005-07-02/15582711.html
105,2005-08-26,关铝股份：第三届监事会第三次会议决议公告,finalpage/2005-08-26/15841058.html
106,2005-08-26,关铝股份：关于召开2005年第一次临时股东大会的通知,finalpage/2005-08-26/15841020.html
107,2005-08-26,关铝股份：第三届董事会第七次会议决议公告,finalpage/2005-08-26/15841011.html
108,2005-08-26,关铝股份：2005年半年度财务报告,finalpage/2005-08-26/15841459.PDF
109,2005-08-26,关铝股份：关于为他人提供贷款担保的公告,finalpage/2005-08-26/15840471.html
110,2005-08-26,关铝股份2005年半年度报告摘要,finalpage/2005-08-26/15841444.PDF
111,2005-08-26,关铝股份2005年半年度报告,finalpage/2005-08-26/15841439.PDF
112,2005-09-28,关铝股份：2005年第一次临时股东大会决议公告,finalpage/2005-09-28/15978264.html
113,2005-10-20,关铝股份：业绩预告公告,finalpage/2005-10-20/16049412.PDF
114,2005-10-20,关铝股份2005年第三季度报告,finalpage/2005-10-20/16049414.PDF
115,2005-11-28,关铝股份：停牌公告,finalpage/2005-11-28/16228525.html
116,2005-11-30,关铝股份：澄清公告,finalpage/2005-11-30/16244353.html
117,2005-12-07,关铝股份：对外投资公告,finalpage/2005-12-07/16265939.html
118,2005-12-07,关铝股份：关于召开2006年第一次临时股东大会的通知,finalpage/2005-12-07/16265941.html
119,2005-12-07,关铝股份：关于为他人提供贷款担保的公告,finalpage/2005-12-07/16265940.html
120,2005-12-07,关铝股份：第三届董事会第九次会议决议公告,finalpage/2005-12-07/16265943.html
121,2005-12-07,关铝股份：第三届监事会第四次会议决议公告,finalpage/2005-12-07/16265942.html
122,2005-12-16,关铝股份：关于特别停牌的公告,finalpage/2005-12-16/16293516.html
123,2005-12-17,关铝股份：重大事项公告,finalpage/2005-12-17/16295263.html
124,2006-01-10,关铝股份：2006年第一次临时董事会决议公告,finalpage/2006-01-10/16360729.html
125,2006-01-10,关铝股份：2006年第一次临时股东大会决议公告,finalpage/2006-01-10/16360728.html
126,2006-03-06,关铝股份：股权分置改革说明书,finalpage/2006-03-06/16530295.PDF
127,2006-03-06,关铝股份：股权分置改革说明书（摘要）,finalpage/2006-03-06/16530329.PDF
128,2006-03-06,关铝股份：董事会关于召开股权分置改革相关股东会议的通知,finalpage/2006-03-06/16530185.PDF
129,2006-03-06,关铝股份：股权分置改革的法律意见书,finalpage/2006-03-06/16530148.PDF
130,2006-03-06,关铝股份：股权分置改革相关事项的独立董事意见函,finalpage/2006-03-06/16530145.PDF
131,2006-03-06,关铝股份：董事会征集投票权报告书,finalpage/2006-03-06/16530143.PDF
132,2006-03-06,关铝股份：股权分置改革之保荐意见,finalpage/2006-03-06/16530139.PDF
133,2006-03-15,关铝股份：关于股权分置改革方案沟通协商情况暨股权分置改革方案调整公告,finalpage/2006-03-15/16564886.html
134,2006-03-15,关铝股份：股权分置改革之补充保荐意见,finalpage/2006-03-15/16564843.PDF
135,2006-03-15,关铝股份：股权分置改革说明书（修订稿）,finalpage/2006-03-15/16564840.PDF
136,2006-03-15,关铝股份：独立董事关于调整股权分置改革方案的补充意见函,finalpage/2006-03-15/16564884.PDF
137,2006-03-15,关铝股份：股权分置改革的补充法律意见书,finalpage/2006-03-15/16564866.PDF
138,2006-03-15,关铝股份：股权分置改革说明书摘要（修订稿）,finalpage/2006-03-15/16564842.PDF
139,2006-03-25,关铝股份：董事会关于股权分置改革方案获得山西省人民政府国有资产监督管理委员会批复的公告,finalpage/2006-03-25/16610740.html
140,2006-03-25,关铝股份：董事会关于召开股权分置改革相关股东会议的第一次提示公告,finalpage/2006-03-25/16610725.PDF
141,2006-03-30,关铝股份：董事会关于召开股权分置改革相关股东会议的第二次提示公告,finalpage/2006-03-30/16634123.PDF
142,2006-04-04,关铝股份：股权分置改革相关股东会议表决结果公告,finalpage/2006-04-04/16842475.PDF
143,2006-04-04,关铝股份：股权分置改革相关股东会议的法律意见书,finalpage/2006-04-04/16842502.PDF
144,2006-04-08,关铝股份：股权分置改革方案实施公告,finalpage/2006-04-08/16864972.PDF
145,2006-04-11,关铝股份：股票简称变更公告,finalpage/2006-04-11/16873649.html
146,2006-04-11,关铝股份：股份结构变动公告,finalpage/2006-04-11/16873652.PDF
147,2006-04-18,G 关  铝：董事会公告,finalpage/2006-04-18/16917240.PDF
148,2006-04-21,G 关  铝：2005年业绩快报,finalpage/2006-04-21/16942383.PDF
149,2006-04-25,G 关  铝：关于公司2005年度控股股东及其他关联方资金占用情况的专项说明,finalpage/2006-04-25/16966112.PDF
150,2006-04-25,G 关  铝：第三届监事会第五次会议决议公告,finalpage/2006-04-25/16966106.html
151,2006-04-25,G 关  铝：日常关联交易公告,finalpage/2006-04-25/16965904.PDF
152,2006-04-25,G 关  铝：2005年度财务报告之审计报告,finalpage/2006-04-25/16971519.PDF
153,2006-04-25,G 关  铝：关于召开2005年年度股东大会的通知,finalpage/2006-04-25/16966103.html
154,2006-04-25,G 关  铝：第三届董事会第十次会议决议公告,finalpage/2006-04-25/16965901.html
155,2006-04-25,G 关  铝2005年年度报告摘要,finalpage/2006-04-25/16971517.PDF
156,2006-04-25,G 关  铝2006年第一季度报告,finalpage/2006-04-25/16966111.PDF
157,2006-04-25,G 关  铝2005年年度报告,finalpage/2006-04-25/16971516.PDF
158,2006-05-13,G 关  铝：第三届监事会第六次会议决议公告,finalpage/2006-05-13/17075008.PDF
159,2006-05-13,G 关  铝：关于2005年年度股东大会增加审议议案的公告,finalpage/2006-05-13/17075007.PDF
160,2006-05-13,G 关  铝监事会议事规则（ 修订稿）,finalpage/2006-05-13/17075005.PDF
161,2006-05-13,G 关  铝股东大会议事规则（修订稿）,finalpage/2006-05-13/17074999.PDF
162,2006-05-13,G 关  铝公司章程(修订稿),finalpage/2006-05-13/17074996.PDF
163,2006-05-13,G 关  铝董事会议事规则（修订稿）,finalpage/2006-05-13/17075004.PDF
164,2006-05-16,G 关  铝：关于股票交易异常波动的公告,finalpage/2006-05-16/17087464.html
165,2006-05-19,G 关  铝：关于股票交易异常波动的公告,finalpage/2006-05-19/17121575.html
166,2006-05-27,G 关  铝：董事会临时公告,finalpage/2006-05-27/17184408.html
167,2006-05-27,G 关  铝：2005年年度股东大会的法律意见书,finalpage/2006-05-27/17184411.PDF
168,2006-05-27,G 关  铝：2005年年度股东大会决议公告,finalpage/2006-05-27/17184409.PDF
169,2006-07-05,G 关  铝：关于股票价格异常波动及风险警示公告,finalpage/2006-07-05/17651453.PDF
170,2006-08-19,G 关  铝：第三届十二次董事会会议决议公告,finalpage/2006-08-19/18057623.PDF
171,2006-08-19,G 关  铝：关于为山西关铝海门电子铝材有限责任公司提供贷款担保的公告,finalpage/2006-08-19/18057625.PDF
172,2006-08-19,G 关  铝：第三届监事会第七次会议决议公告,finalpage/2006-08-19/18057627.PDF
173,2006-08-19,G 关  铝2006年度中期报告,finalpage/2006-08-19/18059279.PDF
174,2006-08-19,G 关  铝2006年度中期报告摘要,finalpage/2006-08-19/18059289.PDF
175,2006-08-24,G 关  铝：非公开发行募集资金运用的可行性研究报告,finalpage/2006-08-24/18102578.PDF
176,2006-08-24,G 关  铝：关于前次募集资金使用情况的说明,finalpage/2006-08-24/18101870.PDF
177,2006-08-24,G 关  铝：第三届十三次董事会会议决议公告,finalpage/2006-08-24/18101872.PDF
178,2006-08-24,G 关  铝：关于资产收购之关联交易的公告,finalpage/2006-08-24/18101875.PDF
179,2006-08-24,G 关  铝：第三届监事会第八次会议决议公告,finalpage/2006-08-24/18101877.PDF
180,2006-08-24,G 关  铝：关于召开2006年第二次临时股东大会的通知,finalpage/2006-08-24/18101882.PDF
181,2006-08-24,G 关  铝募集资金管理办法（2006年8月）,finalpage/2006-08-24/18101881.PDF
182,2006-09-04,G 关  铝：关于召开2006年第二次临时股东大会的提示性公告,finalpage/2006-09-04/18209345.PDF
183,2006-09-05,G 关  铝：关于2006年第二次临时股东大会延期召开的公告,finalpage/2006-09-05/18246206.PDF
184,2006-09-05,G 关  铝：股权质押公告,finalpage/2006-09-05/18246208.PDF
185,2006-09-07,G 关  铝：关于取消2006年第二次临时股东大会的通知,finalpage/2006-09-07/18260783.PDF
186,2006-09-08,G 关  铝：2006年第二次临时董事会会议决议公告,finalpage/2006-09-08/18267130.PDF
187,2006-09-08,G 关  铝：关于召开2006 年第二次临时股东大会的通知,finalpage/2006-09-08/18267131.PDF
188,2006-09-08,G 关  铝：非公开发行募集资金运用的可行性研究报告,finalpage/2006-09-08/18267132.PDF
189,2006-09-21,G 关  铝：关于召开2006年第二次临时股东大会的提示性公告,finalpage/2006-09-21/18363542.PDF
190,2006-09-26,G 关  铝：2006年第二次临时股东大会决议公告,finalpage/2006-09-26/18385049.PDF
191,2006-09-26,G 关  铝：2006年度第二次临时股东大会的法律意见书,finalpage/2006-09-26/18385052.PDF
192,2006-10-17,关铝股份：重大事项公告,finalpage/2006-10-17/18457609.PDF
193,2006-10-25,关铝股份2006年第三季度报告,finalpage/2006-10-25/18533279.PDF
194,2006-12-14,关铝股份：关于召开2006年第三次临时股东大会的通知,finalpage/2006-12-14/19498114.PDF
195,2006-12-14,关铝股份：第三届监事会第十次会议决议公告,finalpage/2006-12-14/19498115.PDF
196,2006-12-14,关铝股份：第三届董事会第十五次会议决议公告,finalpage/2006-12-14/19498116.PDF
197,2006-12-30,关铝股份：第三届董事会第十六次会议决议公告,finalpage/2006-12-30/19909839.PDF
198,2006-12-30,关铝股份：2006年第三次临时股东大会决议公告,finalpage/2006-12-30/19909841.PDF
199,2006-12-30,关铝股份：2006年度第三次临时股东大会的法律意见书,finalpage/2006-12-30/19909985.PDF
200,2007-03-21,关铝股份：澄清公告,finalpage/2007-03-21/21644914.PDF
201,2007-03-29,关铝股份：关于股东部分股份冻结的公告,finalpage/2007-03-29/21827573.PDF
202,2007-04-07,关铝股份：2006年度业绩预增公告,finalpage/2007-04-07/22491509.PDF
203,2007-04-14,关铝股份：第三届董事会第十七次会议决议公告,finalpage/2007-04-14/22713677.PDF
204,2007-04-14,关铝股份：关于召开2006年年度股东大会的通知,finalpage/2007-04-14/22713778.PDF
205,2007-04-14,关铝股份：关于为他人提供贷款担保的公告,finalpage/2007-04-14/22713780.PDF
206,2007-04-14,关铝股份：关于为控股子公司提供贷款担保的公告,finalpage/2007-04-14/22716014.PDF
207,2007-04-14,关铝股份：关于预计2007年日常关联交易的公告,finalpage/2007-04-14/22718247.PDF
208,2007-04-14,关铝股份：第三届监事会第十一次会议决议公告,finalpage/2007-04-14/22720022.PDF
209,2007-04-14,关铝股份：2006年年度报告,finalpage/2007-04-14/22740163.PDF
210,2007-04-14,关铝股份：2006年年度报告摘要,finalpage/2007-04-14/22740164.PDF
211,2007-04-14,关铝股份：2006年度财务报告之审计报告,finalpage/2007-04-14/22740168.PDF
212,2007-04-18,关铝股份：关于公司2006年度控股股东及其他关联方资金占用情况的专项说明,finalpage/2007-04-18/22794664.PDF
213,2007-04-19,关铝股份：2007年第一季度业绩预增公告,finalpage/2007-04-19/22839027.PDF
214,2007-04-21,关铝股份：关于部分限售股份上市流通提示性公告,finalpage/2007-04-21/22928314.PDF
215,2007-04-25,关铝股份：2007年第一季度报告,finalpage/2007-04-25/23029087.PDF
216,2007-05-10,关铝股份：2006年年度股东大会的法律意见书,finalpage/2007-05-10/23311191.PDF
217,2007-05-10,关铝股份：二00六年年度股东大会决议公告,finalpage/2007-05-10/23311193.PDF
218,2007-06-13,关铝股份：股票交易异常波动公告,finalpage/2007-06-13/29023845.PDF
219,2007-07-20,关铝股份：2007年半年度业绩预增公告,finalpage/2007-07-20/30062030.PDF
220,2007-08-21,关铝股份：第三届董事会第十九次会议决议公告,finalpage/2007-08-21/30922099.PDF
221,2007-08-21,关铝股份：独立董事提名人声明,finalpage/2007-08-21/30922106.PDF
222,2007-08-21,关铝股份：公司章程,finalpage/2007-08-21/30922107.PDF
223,2007-08-21,关铝股份：第三届监事会第十三次会议决议公告,finalpage/2007-08-21/30922109.PDF
224,2007-08-21,关铝股份：关于召开2007年第一次临时股东大会的通知,finalpage/2007-08-21/30922110.PDF
225,2007-08-21,关铝股份：关于“加强上市公司治理专项活动”自查报告及整改计划,finalpage/2007-08-21/30922114.PDF
226,2007-08-21,关铝股份：关于“加强上市公司治理专项活动”自查事项详细情况,finalpage/2007-08-21/30922115.PDF
227,2007-08-21,关铝股份：2007年半年度报告,finalpage/2007-08-21/30923559.PDF
228,2007-08-21,关铝股份：2007年半年度报告摘要,finalpage/2007-08-21/30923599.PDF
229,2007-08-21,关铝股份：2007年半年度财务报告,finalpage/2007-08-21/30923600.PDF
230,2007-08-29,关铝股份：关于股东股份解除冻结的公告,finalpage/2007-08-29/31142737.PDF
231,2007-08-29,关铝股份：关于股票交易异常波动的公告,finalpage/2007-08-29/31142738.PDF
232,2007-08-31,关铝股份：关于部分限售股份上市流通提示性公告,finalpage/2007-08-31/31230034.PDF
233,2007-08-31,关铝股份：华泰证券有限责任公司关于限售股份上市流通的核查报告,finalpage/2007-08-31/31230033.PDF
234,2007-09-07,关铝股份：2007年第一次临时股东大会决议公告,finalpage/2007-09-07/31420000.PDF
235,2007-09-07,关铝股份：2007年第一次临时股东大会的法律意见书,finalpage/2007-09-07/31420001.PDF
236,2007-09-07,关铝股份：独立董事提名人声明,finalpage/2007-09-07/31420002.PDF
237,2007-09-07,关铝股份：第四届监事会第一次会议决议公告,finalpage/2007-09-07/31420003.PDF
238,2007-09-07,关铝股份：第四届董事会第一次会议决议公告,finalpage/2007-09-07/31420004.PDF
239,2007-09-11,关铝股份：董事会公告,finalpage/2007-09-11/31495149.PDF
240,2007-09-12,关铝股份：董事会公告,finalpage/2007-09-12/31555391.PDF
241,2007-09-15,关铝股份：关于限售流通股持有人出售股份情况的公告,finalpage/2007-09-15/31679653.PDF
242,2007-09-25,关铝股份：关于限售流通股持有人出售股份情况的公告,finalpage/2007-09-25/33304292.PDF
243,2007-10-23,关铝股份：关于限售流通股持有人出售股份情况的公告,finalpage/2007-10-23/34675534.PDF
244,2007-10-27,关铝股份：业绩预增公告,finalpage/2007-10-27/34847310.PDF
245,2007-10-27,关铝股份：关于召开2007年第二次临时股东大会的通知,finalpage/2007-10-27/34847311.PDF
