date,title,url
2010-03-16,顺鑫农业：拟转让所持有的北京顺鑫牵手果蔬饮品股份有限公司之股权项目资产评估报告书,finalpage/2010-03-16/57691264.PDF
2010-03-16,顺鑫农业：北京顺鑫农业发展集团有限公司拟转让四宗土地使用权项目资产评估报告书,finalpage/2010-03-16/57691265.PDF
2010-03-17,顺鑫农业：关于发行短期融资券的公告,finalpage/2010-03-17/57695683.PDF
2010-03-25,顺鑫农业：拟对北京顺鑫佳宇房地产开发有限公司增资项目资产评估报告书,finalpage/2010-03-25/57726385.PDF
2010-03-25,顺鑫农业：第四届董事会第三十一次会议决议公告,finalpage/2010-03-25/57726387.PDF
2010-03-25,顺鑫农业：对控股子公司投资公告,finalpage/2010-03-25/57726389.PDF
2010-03-27,顺鑫农业：第四届董事会第九次临时会议决议公告,finalpage/2010-03-27/57735768.PDF
2010-04-01,顺鑫农业：2010年第一次临时股东大会会议决议公告,finalpage/2010-04-01/57758869.PDF
2010-04-01,顺鑫农业：2010年第一次临时股东大会的法律意见书,finalpage/2010-04-01/57758870.PDF
2010-04-03,顺鑫农业：关于大股东所持公司股权解除质押的公告,finalpage/2010-04-03/57769574.PDF
2010-04-13,顺鑫农业：第四届董事会第十次临时会议决议公告,finalpage/2010-04-13/57802265.PDF
2010-04-15,顺鑫农业：2010年第一季度报告正文,finalpage/2010-04-15/57813384.PDF
2010-04-15,顺鑫农业：2010年第一季度财务报告,finalpage/2010-04-15/57813386.PDF
2010-04-15,顺鑫农业：2010年第一季度报告全文,finalpage/2010-04-15/57813387.PDF
2010-04-17,顺鑫农业：土地中标公告,finalpage/2010-04-17/57825143.PDF
2010-04-23,顺鑫农业：2009年度权益分派实施公告,finalpage/2010-04-23/57855824.PDF
2010-05-19,顺鑫农业：第四届董事会第十一次临时会议决议公告,finalpage/2010-05-19/57966198.PDF
2010-06-02,顺鑫农业：业绩预告公告,finalpage/2010-06-02/58019992.PDF
2010-07-27,顺鑫农业：2010年半年度报告摘要,finalpage/2010-07-27/58220346.PDF
2010-07-27,顺鑫农业：2010年半年度财务报告,finalpage/2010-07-27/58220347.PDF
2010-07-27,顺鑫农业：第四届董事会第三十三次会议决议公告,finalpage/2010-07-27/58220350.PDF
2010-07-27,顺鑫农业：2010年半年度报告,finalpage/2010-07-27/58220351.PDF
2010-07-27,顺鑫农业：独立董事对2010年上半年公司关联方资金占用及对外担保情况的专项说明和独立意见,finalpage/2010-07-27/58220352.PDF
2010-09-21,顺鑫农业：业绩预告公告,finalpage/2010-09-21/58461521.PDF
2010-10-26,顺鑫农业：2010年第三季度报告正文,finalpage/2010-10-26/58569390.PDF
2010-10-26,顺鑫农业：2010年第三季度财务报告,finalpage/2010-10-26/58569394.PDF
2010-10-26,顺鑫农业：第四届董事会第三十四次会议决议公告,finalpage/2010-10-26/58569395.PDF
2010-10-26,顺鑫农业：2010年第三季度报告全文,finalpage/2010-10-26/58569396.PDF
2010-10-26,顺鑫农业：内幕信息知情人登记管理制度（2010年10月）,finalpage/2010-10-26/58569397.PDF
2010-10-27,顺鑫农业：限售股份解除限售提示性公告,finalpage/2010-10-27/58577914.PDF
2010-11-09,顺鑫农业：关于公司创新食品分公司发生火灾事故的公告,finalpage/2010-11-09/58639480.PDF
2010-11-09,顺鑫农业：第四届董事会第十二次临时会议决议公告,finalpage/2010-11-09/58639481.PDF
2010-11-20,顺鑫农业：关于投资参股设立北京顺义银座村镇银行股份有限公司的公告,finalpage/2010-11-20/58686223.PDF
2010-11-20,顺鑫农业：关于投资设立北京顺鑫国际种业有限公司的公告,finalpage/2010-11-20/58686224.PDF
2010-11-20,顺鑫农业：第四届董事会第三十五次会议决议公告,finalpage/2010-11-20/58686225.PDF
2010-11-24,顺鑫农业：第四届董事会第十三次临时会议决议公告,finalpage/2010-11-24/58698165.PDF
2010-11-26,顺鑫农业：控股子公司北京顺鑫佳宇房地产开发有限公司土地中标公告,finalpage/2010-11-26/58707025.PDF
2010-12-01,顺鑫农业：2010年第二次临时股东大会会议议程,finalpage/2010-12-01/58725171.PDF
2010-12-01,顺鑫农业：关于提请召开2010年第二次临时股东大会的通知,finalpage/2010-12-01/58725172.PDF
2010-12-01,顺鑫农业：第四届董事会第三十六次会议决议公告,finalpage/2010-12-01/58725173.PDF
2010-12-01,顺鑫农业：第四届监事会第十六次会议决议公告,finalpage/2010-12-01/58725174.PDF
2010-12-01,顺鑫农业：独立董事候选人声明（刘淑敏）,finalpage/2010-12-01/58725175.PDF
2010-12-01,顺鑫农业：独立董事候选人声明（江锡如）,finalpage/2010-12-01/58725176.PDF
2010-12-01,顺鑫农业：独立董事候选人声明（钱明杰）,finalpage/2010-12-01/58725177.PDF
2010-12-01,顺鑫农业：独立董事关于公司董事会换届的独立意见,finalpage/2010-12-01/58725179.PDF
2010-12-01,顺鑫农业：独立董事提名人声明,finalpage/2010-12-01/58725180.PDF
2010-12-17,顺鑫农业：2010年第二次临时股东大会会议决议公告,finalpage/2010-12-17/58793205.PDF
2010-12-17,顺鑫农业：2010年第二次临时股东大会的法律意见书,finalpage/2010-12-17/58793206.PDF
2010-12-17,顺鑫农业：第五届监事会第一次会议决议公告,finalpage/2010-12-17/58793207.PDF
2010-12-17,顺鑫农业：第五届董事会第一次会议决议公告,finalpage/2010-12-17/58793208.PDF
2010-12-17,顺鑫农业：独立董事关于聘任高级管理人员的独立意见,finalpage/2010-12-17/58793209.PDF
2010-12-22,顺鑫农业：第五届董事会第一次临时会议决议公告,finalpage/2010-12-22/58810968.PDF
2010-12-30,顺鑫农业：第五届董事会第二次会议决议公告,finalpage/2010-12-30/58844084.PDF
2010-12-30,顺鑫农业：关于小店畜禽良种场所属豹房种猪养殖场搬迁补偿的公告,finalpage/2010-12-30/58844085.PDF
2010-12-30,顺鑫农业：豹房猪场地上物补偿价值资产评估报告书,finalpage/2010-12-30/58844086.PDF
2010-12-31,顺鑫农业：2010年度业绩预告,finalpage/2010-12-31/58849207.PDF
2011-01-06,顺鑫农业：第五届董事会第二次会议决议公告,finalpage/2011-01-06/58868570.PDF
2011-01-06,顺鑫农业：独立董事关于公司对外投资暨关联交易的独立意见,finalpage/2011-01-06/58868571.PDF
2011-01-06,顺鑫农业：拟对北京鑫大禹水利建筑工程有限公司增资项目资产评估报告书,finalpage/2011-01-06/58868572.PDF
2011-01-06,顺鑫农业：对控股子公司投资暨关联交易公告,finalpage/2011-01-06/58868573.PDF
2011-01-15,顺鑫农业：第五届董事会第四次会议决议公告,finalpage/2011-01-15/58905635.PDF
2011-02-18,顺鑫农业：关于提请召开2011年第一次临时股东大会的通知,finalpage/2011-02-18/59013310.PDF
2011-02-18,顺鑫农业：第五届董事会第五次会议决议公告,finalpage/2011-02-18/59013311.PDF
2011-02-26,顺鑫农业：2010年年度股东大会会议议程,finalpage/2011-02-26/59049003.PDF
2011-02-26,顺鑫农业：2010年年度报告摘要,finalpage/2011-02-26/59049004.PDF
2011-02-26,顺鑫农业：2010年年度审计报告,finalpage/2011-02-26/59049005.PDF
2011-02-26,顺鑫农业：第五届董事会第六次会议决议公告,finalpage/2011-02-26/59049006.PDF
2011-02-26,顺鑫农业：关于提请召开2010年年度股东大会的通知,finalpage/2011-02-26/59049007.PDF
2011-02-26,顺鑫农业：第五届监事会第二次会议决议公告,finalpage/2011-02-26/59049008.PDF
2011-02-26,顺鑫农业：关于公司控股股东及其他关联方占用资金情况的专项说明,finalpage/2011-02-26/59049010.PDF
2011-02-26,顺鑫农业：内部控制自我评价报告,finalpage/2011-02-26/59049011.PDF
2011-02-26,顺鑫农业：2010年年度报告,finalpage/2011-02-26/59049012.PDF
2011-02-26,顺鑫农业：内部控制鉴证报告,finalpage/2011-02-26/59049013.PDF
2011-02-26,顺鑫农业：独立董事2010年度对相关事项的独立意见,finalpage/2011-02-26/59049014.PDF
2011-02-26,顺鑫农业：独立董事对公司累计和当期对外担保情况的专项说明及独立意见,finalpage/2011-02-26/59049015.PDF
2011-02-26,顺鑫农业：监事会对公司内部控制自我评价的意见,finalpage/2011-02-26/59049016.PDF
2011-02-26,顺鑫农业：关于公司2010年度募集资金存放与使用情况的鉴证报告,finalpage/2011-02-26/59049017.PDF
2011-02-26,顺鑫农业：独立董事对内控自我评价的独立意见,finalpage/2011-02-26/59049018.PDF
2011-02-26,顺鑫农业：独立董事2010年度述职报告,finalpage/2011-02-26/59049019.PDF
2011-03-05,顺鑫农业：2011年第二次临时股东大会会议议程,finalpage/2011-03-05/59082481.PDF
2011-03-05,顺鑫农业：关于提请召开2011年第二次临时股东大会的通知,finalpage/2011-03-05/59082482.PDF
2011-03-05,顺鑫农业：第五届董事会第七次会议决议公告,finalpage/2011-03-05/59082483.PDF
2011-03-05,顺鑫农业：关于投资设立北京顺鑫创新国际物流有限公司的公告,finalpage/2011-03-05/59082485.PDF
2011-03-05,顺鑫农业：关于控股子公司北京顺鑫佳宇房地产开发有限公司向控股股东北京顺鑫农业发展集团有限公司借款的关联交易公告,finalpage/2011-03-05/59082486.PDF
2011-03-05,顺鑫农业：独立董事关于控股子公司与控股股东借款的关联交易的独立意见,finalpage/2011-03-05/59082487.PDF
2011-03-08,顺鑫农业：2011年第一次临时股东大会会议决议公告,finalpage/2011-03-08/59090082.PDF
2011-03-08,顺鑫农业：2011年第一次临时股东大会的法律意见书,finalpage/2011-03-08/59090083.PDF
2011-03-09,顺鑫农业：关于公司2010年度非公开发行股票方案到期失效的公告,finalpage/2011-03-09/59096430.PDF
2011-03-16,顺鑫农业：关于召开2011年第二次临时股东大会的提示性公告,finalpage/2011-03-16/59125457.PDF
2011-03-22,顺鑫农业：2011年第二次临时股东大会决议公告,finalpage/2011-03-22/59152694.PDF
2011-03-22,顺鑫农业：2011年第二次临时股东大会的法律意见书,finalpage/2011-03-22/59152697.PDF
2011-03-22,顺鑫农业：2010年年度股东大会会议决议公告,finalpage/2011-03-22/59152772.PDF
2011-03-22,顺鑫农业：2010年年度股东大会的法律意见书,finalpage/2011-03-22/59152773.PDF
2011-03-26,顺鑫农业：第五届董事会第二次临时会议决议公告,finalpage/2011-03-26/59176358.PDF
2011-04-08,顺鑫农业：关于发行2011年度第一期短期融资券的公告,finalpage/2011-04-08/59234093.PDF
2011-04-14,顺鑫农业：关于2011年度第一期短期融资券发行结果的公告,finalpage/2011-04-14/59264293.PDF
2011-04-23,顺鑫农业：2011年第一季度报告正文,finalpage/2011-04-23/59321820.PDF
2011-04-23,顺鑫农业：2011年第一季度报告全文,finalpage/2011-04-23/59321822.PDF
2011-04-27,顺鑫农业：第五届董事会第三次临时会议决议公告,finalpage/2011-04-27/59344169.PDF
2011-04-30,顺鑫农业：控股子公司北京顺鑫佳宇房地产开发有限公司的全资子公司曲阜顺鑫鑫泽园房地产开发有限公司竞得土地使用权的公告,finalpage/2011-04-30/59370143.PDF
2011-05-10,顺鑫农业：第五届董事会第九次会议决议公告,finalpage/2011-05-10/59406482.PDF
2011-05-10,顺鑫农业：关于投资设立北京顺鑫国际电子商务有限公司的公告,finalpage/2011-05-10/59406483.PDF
2011-05-11,顺鑫农业：2010年度分红派息实施公告,finalpage/2011-05-11/59410927.PDF
2011-05-19,顺鑫农业：关于发行2011年度第二期短期融资券的公告,finalpage/2011-05-19/59446052.PDF
2011-05-27,顺鑫农业：关于2011年度第二期短期融资券发行结果的公告,finalpage/2011-05-27/59479551.PDF
2011-06-02,顺鑫农业：关于提请召开2011年第三次临时股东大会的通知,finalpage/2011-06-02/59504503.PDF
2011-06-02,顺鑫农业：独立董事关于公司向北京顺鑫农业发展集团有限公司转让公司全资子公司北京顺鑫茂峰花卉物流有限公司40%的股权暨关联交易的独立意见,finalpage/2011-06-02/59504504.PDF
2011-06-02,顺鑫农业：关于转让子公司股权暨关联交易的公告,finalpage/2011-06-02/59504505.PDF
2011-06-02,顺鑫农业：办公地址门牌号变更公告,finalpage/2011-06-02/59504506.PDF
2011-06-15,顺鑫农业：2011年第三次临时股东大会会议文件,finalpage/2011-06-15/59553436.PDF
2011-06-15,顺鑫农业：关于召开2011年第三次临时股东大会的提示性公告,finalpage/2011-06-15/59553437.PDF
2011-06-22,顺鑫农业：2011年第三次临时股东大会决议公告,finalpage/2011-06-22/59581500.PDF
2011-06-22,顺鑫农业：2011年第三次临时股东大会的法律意见书,finalpage/2011-06-22/59581503.PDF
2011-07-01,顺鑫农业：第五届董事会第四次临时会议决议公告,finalpage/2011-07-01/59618667.PDF
2011-07-01,顺鑫农业：业绩预告公告,finalpage/2011-07-01/59618676.PDF
2011-07-19,顺鑫农业：第五届董事会第十次会议决议公告,finalpage/2011-07-19/59691517.PDF
2011-07-19,顺鑫农业：关于对全资子公司增资的公告,finalpage/2011-07-19/59691518.PDF
2011-07-22,顺鑫农业：第五届董事会第五次临时会议决议公告,finalpage/2011-07-22/59710754.PDF
2011-07-30,顺鑫农业：2011年半年度报告摘要,finalpage/2011-07-30/59746958.PDF
2011-07-30,顺鑫农业：2011年半年度财务报告,finalpage/2011-07-30/59746961.PDF
2011-07-30,顺鑫农业：第五届董事会第十一次会议决议公告,finalpage/2011-07-30/59746962.PDF
2011-07-30,顺鑫农业：2011年半年度报告,finalpage/2011-07-30/59746963.PDF
2011-07-30,顺鑫农业：独立董事对2011年上半年公司关联方资金占用及对外担保情况的专项说明和独立意见,finalpage/2011-07-30/59746964.PDF
2011-08-06,顺鑫农业：第五届董事会第六次临时会议决议公告,finalpage/2011-08-06/59779701.PDF
2011-08-24,顺鑫农业：董事、副总经理辞职公告,finalpage/2011-08-24/59860713.PDF
2011-08-27,顺鑫农业：第五届董事会第七次临时会议决议公告,finalpage/2011-08-27/59883143.PDF
2011-09-03,顺鑫农业：关于提请召开2011年第四次临时股东大会的通知,finalpage/2011-09-03/59915796.PDF
2011-09-03,顺鑫农业：第五届董事会第八次临时会议决议公告,finalpage/2011-09-03/59915797.PDF
2011-09-03,顺鑫农业：独立董事关于公司董事会提名董事的独立意见,finalpage/2011-09-03/59915798.PDF
2011-09-08,顺鑫农业：第五届董事会第九次临时会议决议公告,finalpage/2011-09-08/59935634.PDF
2011-09-08,顺鑫农业：关于使用暂时闲置资金购买银行理财产品的公告,finalpage/2011-09-08/59935635.PDF
2011-09-08,顺鑫农业：独立董事关于公司使用暂时闲置资金购买银行理财产品的独立意见,finalpage/2011-09-08/59935636.PDF
2011-09-08,顺鑫农业：证券投资管理办法（2011年9月）,finalpage/2011-09-08/59935637.PDF
2011-09-21,顺鑫农业：2011年第四次临时股东大会会议决议公告,finalpage/2011-09-21/59980029.PDF
2011-09-21,顺鑫农业：2011年第四次临时股东大会的法律意见书,finalpage/2011-09-21/59980030.PDF
2011-09-21,顺鑫农业：第五届董事会第十次临时会议决议公告,finalpage/2011-09-21/59980031.PDF
2011-10-15,顺鑫农业：第五届董事会第十一次临时会议决议公告,finalpage/2011-10-15/60058982.PDF
2011-10-21,顺鑫农业：2011年第三季度报告正文,finalpage/2011-10-21/60086074.PDF
2011-10-21,顺鑫农业：2011年第三季度报告全文,finalpage/2011-10-21/60086076.PDF
2011-11-12,顺鑫农业：第五届董事会第十二次临时会议决议公告,finalpage/2011-11-12/60192018.PDF
2011-11-12,顺鑫农业：关于完成工商变更登记的公告,finalpage/2011-11-12/60192019.PDF
2011-11-15,顺鑫农业：更正公告,finalpage/2011-11-15/60200737.PDF
2011-12-08,顺鑫农业：第五届董事会第十三次会议决议公告,finalpage/2011-12-08/60297643.PDF
2011-12-17,顺鑫农业：第五届董事会第十四次会议决议公告,finalpage/2011-12-17/60335448.PDF
2011-12-17,顺鑫农业：受让土地使用权公告,finalpage/2011-12-17/60335845.PDF
2012-01-14,顺鑫农业：第五届董事会第十五次会议决议公告,finalpage/2012-01-14/60443525.PDF
2012-02-25,顺鑫农业：2011年年度股东大会会议议程,finalpage/2012-02-25/60584612.PDF
2012-02-25,顺鑫农业：2011年年度报告摘要,finalpage/2012-02-25/60584613.PDF
2012-02-25,顺鑫农业：2011年年度审计报告,finalpage/2012-02-25/60584618.PDF
2012-02-25,顺鑫农业：第五届董事会第十六次会议决议公告,finalpage/2012-02-25/60584619.PDF
2012-02-25,顺鑫农业：关于提请召开2011年年度股东大会的通知,finalpage/2012-02-25/60584620.PDF
2012-02-25,顺鑫农业：第五届监事会第六次会议决议公告,finalpage/2012-02-25/60584621.PDF
2012-02-25,顺鑫农业：内部控制自我评价报告,finalpage/2012-02-25/60584623.PDF
2012-02-25,顺鑫农业：2011年年度报告,finalpage/2012-02-25/60584624.PDF
2012-02-25,顺鑫农业：举报投诉和举报人保护制度（2012年2月）,finalpage/2012-02-25/60584625.PDF
2012-02-25,顺鑫农业：内幕信息保密制度（2012年2月）,finalpage/2012-02-25/60584627.PDF
2012-02-25,顺鑫农业：内部控制鉴证报告,finalpage/2012-02-25/60584628.PDF
2012-02-25,顺鑫农业：独立董事2011年度对相关事项的独立意见,finalpage/2012-02-25/60584629.PDF
2012-02-25,顺鑫农业：独立董事对公司累计和当期对外担保情况的专项说明及独立意见,finalpage/2012-02-25/60584630.PDF
2012-02-25,顺鑫农业：监事会对公司内部控制自我评价的意见,finalpage/2012-02-25/60584631.PDF
2012-02-25,顺鑫农业：反舞弊制度（2012年2月）,finalpage/2012-02-25/60584632.PDF
2012-02-25,顺鑫农业：外部信息使用人管理制度（2012年2月）,finalpage/2012-02-25/60584633.PDF
2012-02-25,顺鑫农业：对外担保管理办法（2012年2月）,finalpage/2012-02-25/60584635.PDF
2012-02-25,顺鑫农业：关于公司2011年度募集资金存放与使用情况的鉴证报告,finalpage/2012-02-25/60584636.PDF
2012-02-25,顺鑫农业：年报信息披露重大差错责任追究制度（2012年2月）,finalpage/2012-02-25/60584637.PDF
2012-02-25,顺鑫农业：关于公司控股股东及其他关联方占用资金情况的专项说明,finalpage/2012-02-25/60584638.PDF
2012-02-25,顺鑫农业：独立董事对内控自我评价的独立意见,finalpage/2012-02-25/60584639.PDF
2012-02-25,顺鑫农业：独立董事2011年度述职报告,finalpage/2012-02-25/60584640.PDF
2012-02-25,顺鑫农业：董事会关于公司购买银行理财产品的专项说明,finalpage/2012-02-25/60584641.PDF
2012-02-25,顺鑫农业：董事会秘书工作细则（2012年2月）,finalpage/2012-02-25/60584642.PDF
2012-02-25,顺鑫农业：重大风险预警管理制度（2012年2月）,finalpage/2012-02-25/60584643.PDF
2012-03-20,顺鑫农业：2011年年度股东大会会议决议公告,finalpage/2012-03-20/60692025.PDF
2012-03-20,顺鑫农业：2011年年度股东大会的法律意见书,finalpage/2012-03-20/60692027.PDF
2012-03-27,顺鑫农业：第五届董事会第十三次临时会议决议公告,finalpage/2012-03-27/60729318.PDF
2012-03-27,顺鑫农业：控股子公司对外投资公告,finalpage/2012-03-27/60729319.PDF
2012-03-27,顺鑫农业：北京鑫大禹水利建筑工程有限公司拟对北京顺鑫天宇建设工程有限公司进行增资项目资产评估报告书,finalpage/2012-03-27/60729320.PDF
2012-03-29,顺鑫农业：第五届董事会第十七次会议决议公告,finalpage/2012-03-29/60748985.PDF
2012-03-29,顺鑫农业：关于投资设立北京顺鑫鹏程商贸有限公司的公告,finalpage/2012-03-29/60748986.PDF
2012-03-29,顺鑫农业：2012年度内部控制规范实施工作方案,finalpage/2012-03-29/60748987.PDF
2012-04-18,顺鑫农业：2011年度分红派息实施公告,finalpage/2012-04-18/60846707.PDF
2012-04-24,顺鑫农业：2012年第一季度报告正文,finalpage/2012-04-24/60887633.PDF
2012-04-24,顺鑫农业：第五届董事会第十八次会议决议公告,finalpage/2012-04-24/60887636.PDF
2012-04-24,顺鑫农业：2012年第一季度报告全文,finalpage/2012-04-24/60887637.PDF
2012-05-19,顺鑫农业：关于非公开定向债务融资工具申请获准的公告,finalpage/2012-05-19/61017756.PDF
2012-05-29,顺鑫农业：关于2012年度第一期非公开定向债务融资工具发行情况的公告,finalpage/2012-05-29/61057168.PDF
2012-06-05,顺鑫农业：第五届董事会第十九次会议决议公告,finalpage/2012-06-05/61089405.PDF
2012-06-05,顺鑫农业：独立董事关于放弃对控股子公司北京顺鑫明珠文化发展有限公司增资扩股权利的独立意见,finalpage/2012-06-05/61089406.PDF
2012-06-05,顺鑫农业：关于放弃对控股子公司北京顺鑫明珠文化发展有限公司增资扩股权利的公告,finalpage/2012-06-05/61089407.PDF
2012-06-05,顺鑫农业：北京顺鑫农业发展集团有限公司和陕西天河文化有限责任公司拟对北京顺鑫明珠文化发展有限公司进行增资项目资产评估报告书,finalpage/2012-06-05/61089409.PDF
2012-06-12,顺鑫农业：关于2012年度第二期非公开定向债务融资工具发行情况的公告,finalpage/2012-06-12/61123917.PDF
2012-06-29,顺鑫农业：第五届董事会第二十次会议决议公告,finalpage/2012-06-29/61194839.PDF
2012-06-29,顺鑫农业：内部控制建设发展规划（2011-2015）,finalpage/2012-06-29/61194843.PDF
2012-07-03,顺鑫农业：业绩预告公告,finalpage/2012-07-03/61211465.PDF
2012-07-12,顺鑫农业：2012年第一次临时股东大会会议议程,finalpage/2012-07-12/61255892.PDF
2012-07-12,顺鑫农业：关于提请召开2012年第一次临时股东大会的通知,finalpage/2012-07-12/61255893.PDF
2012-07-12,顺鑫农业：第五届董事会第二十一次会议决议公告,finalpage/2012-07-12/61255894.PDF
2012-07-28,顺鑫农业：2012年第一次临时股东大会会议决议公告,finalpage/2012-07-28/61334522.PDF
2012-07-28,顺鑫农业：2012年第一次临时股东大会的法律意见书,finalpage/2012-07-28/61334523.PDF
2012-07-28,顺鑫农业：公司章程（2012年7月）,finalpage/2012-07-28/61334524.PDF
2012-08-28,顺鑫农业：2012年半年度报告摘要,finalpage/2012-08-28/61490214.PDF
2012-08-28,顺鑫农业：2012年半年度财务报告,finalpage/2012-08-28/61490233.PDF
2012-08-28,顺鑫农业：2012年半年度报告,finalpage/2012-08-28/61490234.PDF
2012-08-28,顺鑫农业：业绩预告公告,finalpage/2012-08-28/61490235.PDF
2012-09-05,顺鑫农业：第五届董事会第二十三次会议决议公告,finalpage/2012-09-05/61533153.PDF
2012-09-05,顺鑫农业：关于使用暂时闲置资金购买银行理财产品的公告,finalpage/2012-09-05/61533154.PDF
2012-09-05,顺鑫农业：独立董事关于公司使用暂时闲置资金购买银行理财产品的独立意见,finalpage/2012-09-05/61533155.PDF
2012-09-11,顺鑫农业：第五届董事会第二十四次会议决议公告,finalpage/2012-09-11/61554130.PDF
2012-09-26,顺鑫农业：第五届董事会第二十五次会议决议公告,finalpage/2012-09-26/61608877.PDF
2012-09-26,顺鑫农业：银行间债券市场债务融资工具信息披露管理制度（2012年9月）,finalpage/2012-09-26/61608878.PDF
2012-10-08,顺鑫农业：关于短期融资券和中期票据申请获准的公告,finalpage/2012-10-08/61623233.PDF
2012-10-10,顺鑫农业：第五届董事会第二十六次会议决议公告,finalpage/2012-10-10/61636890.PDF
2012-10-22,顺鑫农业：关于发行2012年度第一期短期融资券的公告,finalpage/2012-10-22/61677713.PDF
2012-10-26,顺鑫农业：2012年第三季度报告正文,finalpage/2012-10-26/61709634.PDF
2012-10-26,顺鑫农业：第五届董事会第二十七次会议决议公告,finalpage/2012-10-26/61709636.PDF
2012-10-26,顺鑫农业：2012年第三季度报告全文,finalpage/2012-10-26/61709637.PDF
2012-10-26,顺鑫农业：业绩预告公告,finalpage/2012-10-26/61709638.PDF
2012-10-29,顺鑫农业：关于2012年度第一期短期融资券发行结果的公告,finalpage/2012-10-29/61718170.PDF
2012-10-31,顺鑫农业：关于发行2012年度第一期中期票据的公告,finalpage/2012-10-31/61738000.PDF
2012-10-31,顺鑫农业：关于发行2012年度第二期短期融资券的公告,finalpage/2012-10-31/61738001.PDF
2012-10-31,顺鑫农业：关于2012年度第三期非公开定向债务融资工具发行情况的公告,finalpage/2012-10-31/61738002.PDF
2012-11-05,顺鑫农业：第五届董事会第二十八次会议决议公告,finalpage/2012-11-05/61756018.PDF
2012-11-12,顺鑫农业：关于2012年度第一期中期票据发行结果的公告,finalpage/2012-11-12/61783209.PDF
2012-11-12,顺鑫农业：关于2012年度第二期短期融资券发行结果的公告,finalpage/2012-11-12/61783210.PDF
2012-11-16,顺鑫农业：关于未履行完毕承诺事项专项披露的公告,finalpage/2012-11-16/61804107.PDF
2012-11-19,顺鑫农业：北京顺鑫佳宇房地产开发有限公司拟收购包头市金瑞房地产开发有限责任公司股权项目资产评估报告书,finalpage/2012-11-19/61808186.PDF
2012-11-19,顺鑫农业：关于公司控股子公司北京顺鑫佳宇房地产开发有限公司收购包头市金瑞房地产开发有限责任公司股权的公告,finalpage/2012-11-19/61808187.PDF
