date,title,url
2014-07-16,顺鑫农业：2014年第一次临时股东大会会议决议公告,finalpage/2014-07-16/1200056332.PDF
2014-07-16,顺鑫农业：2014年第一次临时股东大会的法律意见书,finalpage/2014-07-16/1200056333.PDF
2014-07-16,顺鑫农业：公司章程（2014年7月）,finalpage/2014-07-16/1200056334.PDF
2014-07-16,顺鑫农业：股东大会议事规则（2014年7月）,finalpage/2014-07-16/1200056335.PDF
2014-07-19,顺鑫农业：第六届董事会第一次临时会议决议公告,finalpage/2014-07-19/1200064370.PDF
2014-07-30,顺鑫农业：董事会关于2014年半年度募集资金存放与使用情况的专项报告,finalpage/2014-07-30/1200086271.PDF
2014-07-30,顺鑫农业：2014年第二次临时股东大会会议议程,finalpage/2014-07-30/1200086272.PDF
2014-07-30,顺鑫农业：关于提请召开2014年第二次临时股东大会的通知,finalpage/2014-07-30/1200086273.PDF
2014-07-30,顺鑫农业：2014年半年度报告摘要,finalpage/2014-07-30/1200086274.PDF
2014-07-30,顺鑫农业：2014半年度财务报告,finalpage/2014-07-30/1200086276.PDF
2014-07-30,顺鑫农业：第六届董事会第十一次会议决议公告,finalpage/2014-07-30/1200086277.PDF
2014-07-30,顺鑫农业：2014年半年度报告,finalpage/2014-07-30/1200086278.PDF
2014-07-30,顺鑫农业：独立董事关于公司相关事项的独立意见,finalpage/2014-07-30/1200086279.PDF
2014-08-15,顺鑫农业：关于召开2014年第二次临时股东大会的提示性公告,finalpage/2014-08-15/1200127856.PDF
2014-08-19,顺鑫农业：第六届董事会第二次临时会议决议公告,finalpage/2014-08-19/1200135332.PDF
2014-08-20,顺鑫农业：2014年第二次临时股东大会会议决议公告,finalpage/2014-08-20/1200140754.PDF
2014-08-20,顺鑫农业：2014年第二次临时股东大会的法律意见书,finalpage/2014-08-20/1200140755.PDF
2014-08-28,顺鑫农业：关于收到《中国证监会行政许可申请受理通知书》的公告,finalpage/2014-08-28/1200183549.PDF
2014-08-28,顺鑫农业：第六届董事会第三次临时会议决议公告,finalpage/2014-08-28/1200183550.PDF
2014-09-16,顺鑫农业：关于发行2014年度第二期短期融资券的公告,finalpage/2014-09-16/1200236530.PDF
2014-09-18,顺鑫农业：2014年第三次临时股东大会会议议程,finalpage/2014-09-18/1200243344.PDF
2014-09-18,顺鑫农业：关于提请召开2014年第三次临时股东大会的通知,finalpage/2014-09-18/1200243345.PDF
2014-09-18,顺鑫农业：第六届董事会第十二次会议决议公告,finalpage/2014-09-18/1200243346.PDF
2014-09-20,顺鑫农业：关于2014年度第二期短期融资券发行结果的公告,finalpage/2014-09-20/1200249959.PDF
2014-09-25,顺鑫农业：关于提请召开2014年第三次临时股东大会的补充通知,finalpage/2014-09-25/1200258268.PDF
2014-09-25,顺鑫农业：关于增加2014年第三次临时股东大会临时提案的公告,finalpage/2014-09-25/1200258269.PDF
2014-09-25,顺鑫农业：独立董事关于公司调整董事及高级管理人员薪酬的独立意见,finalpage/2014-09-25/1200258270.PDF
2014-09-25,顺鑫农业：第六届董事会第十三次会议决议公告,finalpage/2014-09-25/1200258271.PDF
2014-09-26,顺鑫农业：2014年前三季度业绩预告,finalpage/2014-09-26/1200261430.PDF
2014-09-27,顺鑫农业：关于召开2014年第三次临时股东大会的提示性公告,finalpage/2014-09-27/1200264779.PDF
2014-09-30,顺鑫农业：中德证券有限责任公司关于公司向北京顺鑫农业发展集团有限公司转让北京顺丽鑫园林绿化工程有限责任公司股权暨关联交易的核查意见,finalpage/2014-09-30/1200273386.PDF
2014-09-30,顺鑫农业：关于公司向北京顺鑫农业发展集团有限公司转让北京顺丽鑫园林绿化工程有限责任公司股权暨关联交易的公告,finalpage/2014-09-30/1200273387.PDF
2014-09-30,顺鑫农业：独立董事就公司向北京顺鑫农业发展集团有限公司转让北京顺丽鑫园林绿化工程有限责任公司股权发表独立意见,finalpage/2014-09-30/1200273388.PDF
2014-09-30,顺鑫农业：第六届董事会第十四次会议决议公告,finalpage/2014-09-30/1200273389.PDF
2014-09-30,顺鑫农业：拟转让北京顺丽鑫园林绿化工程有限责任公司股权项目资产评估报告书,finalpage/2014-09-30/1200273390.PDF
2014-10-11,顺鑫农业：2014年第三次临时股东大会会议决议公告,finalpage/2014-10-11/1200288890.PDF
2014-10-11,顺鑫农业：2014年第三次临时股东大会的法律意见书,finalpage/2014-10-11/1200288891.PDF
2014-10-17,顺鑫农业：2014年第四次临时股东大会会议议程,finalpage/2014-10-17/1200305707.PDF
2014-10-17,顺鑫农业：关于提请召开2014年第四次临时股东大会的通知,finalpage/2014-10-17/1200305708.PDF
2014-10-17,顺鑫农业：中德证券有限责任公司关于公司使用部分闲置募集资金暂时补充流动资金的专项意见,finalpage/2014-10-17/1200305709.PDF
2014-10-17,顺鑫农业：第六届监事会第六次会议决议公告,finalpage/2014-10-17/1200305710.PDF
2014-10-17,顺鑫农业：独立董事关于使用部分闲置募集资金补充流动资金的独立意见,finalpage/2014-10-17/1200305711.PDF
2014-10-17,顺鑫农业：监事会关于使用部分闲置募集资金补充流动资金的意见,finalpage/2014-10-17/1200305712.PDF
2014-10-17,顺鑫农业：第六届董事会第十五次会议决议公告,finalpage/2014-10-17/1200305713.PDF
2014-10-17,顺鑫农业：关于使用部分闲置募集资金补充流动资金的公告,finalpage/2014-10-17/1200305714.PDF
2014-10-25,顺鑫农业：2014年第三季度报告正文,finalpage/2014-10-25/1200328528.PDF
2014-10-25,顺鑫农业：第六届董事会第十六次会议决议公告,finalpage/2014-10-25/1200328530.PDF
2014-10-25,顺鑫农业：2014年第三季度报告全文,finalpage/2014-10-25/1200328531.PDF
2014-10-25,顺鑫农业：关于公开发行公司债券申请获得中国证监会发行审核委员会审核通过的公告,finalpage/2014-10-25/1200328532.PDF
2014-10-31,顺鑫农业：关于召开2014年第四次临时股东大会的提示性公告,finalpage/2014-10-31/1200355779.PDF
2014-11-04,顺鑫农业：独立董事辞职公告,finalpage/2014-11-04/1200366380.PDF
2014-11-05,顺鑫农业：2014年第四次临时股东大会会议决议公告,finalpage/2014-11-05/1200369912.PDF
2014-11-05,顺鑫农业：2014年第四次临时股东大会的法律意见书,finalpage/2014-11-05/1200369913.PDF
2014-11-05,顺鑫农业：独立董事辞职公告,finalpage/2014-11-05/1200369914.PDF
2014-11-22,顺鑫农业：2014年第五次临时股东大会会议议程,finalpage/2014-11-22/1200408552.PDF
2014-11-22,顺鑫农业：关于提请召开2014年第五次临时股东大会的通知,finalpage/2014-11-22/1200408553.PDF
2014-11-22,顺鑫农业：独立董事候选人声明（亢韦）,finalpage/2014-11-22/1200408554.PDF
2014-11-22,顺鑫农业：独立董事候选人声明（陈少明）,finalpage/2014-11-22/1200408555.PDF
2014-11-22,顺鑫农业：独立董事关于更换独立董事的独立意见,finalpage/2014-11-22/1200408556.PDF
2014-11-22,顺鑫农业：独立董事提名人声明（一）,finalpage/2014-11-22/1200408557.PDF
2014-11-22,顺鑫农业：独立董事提名人声明（二）,finalpage/2014-11-22/1200408558.PDF
2014-11-22,顺鑫农业：第六届董事会第十七次会议决议公告,finalpage/2014-11-22/1200408559.PDF
2014-11-26,顺鑫农业：关于公开发行公司债券申请获得中国证券监督管理委员会核准批复的公告,finalpage/2014-11-26/1200416182.PDF
2014-12-05,顺鑫农业：关于提请召开2014年第五次临时股东大会的提示性公告,finalpage/2014-12-05/1200440808.PDF
2014-12-10,顺鑫农业：2014年第五次临时股东大会会议决议公告,finalpage/2014-12-10/1200453132.PDF
2014-12-10,顺鑫农业：2014年第五次临时股东大会的法律意见书,finalpage/2014-12-10/1200453133.PDF
2014-12-10,顺鑫农业：第六届董事会第十八次会议决议公告,finalpage/2014-12-10/1200453134.PDF
2014-12-24,顺鑫农业：第六届董事会第十九次会议决议公告,finalpage/2014-12-24/1200488066.PDF
2014-12-26,顺鑫农业：关于控股股东名称变更的公告,finalpage/2014-12-26/1200495085.PDF
2015-01-09,顺鑫农业：中德证券有限责任公司关于公司2014年定期现场检查报告,finalpage/2015-01-09/1200529642.PDF
2015-01-09,顺鑫农业：中德证券有限责任公司关于公司2014年现场专项培训情况报告,finalpage/2015-01-09/1200529643.PDF
2015-01-13,顺鑫农业：中德证券有限责任公司关于公司向北京顺鑫控股集团有限公司出售下属耘丰种业分公司及转让北京顺鑫国际种业有限公司股权暨关联交易的核查意见,finalpage/2015-01-13/1200538217.PDF
2015-01-13,顺鑫农业：关于公司向北京顺鑫控股集团有限公司出售资产暨关联交易的公告,finalpage/2015-01-13/1200538218.PDF
2015-01-13,顺鑫农业：拟转让北京顺鑫国际种业有限公司股权项目资产评估报告书,finalpage/2015-01-13/1200538219.PDF
2015-01-13,顺鑫农业：独立董事就公司向北京顺鑫控股集团有限公司转让北京顺鑫国际种业有限公司股权发表独立意见,finalpage/2015-01-13/1200538220.PDF
2015-01-13,顺鑫农业：独立董事就公司向北京顺鑫控股集团有限公司出售资产发表独立意见,finalpage/2015-01-13/1200538221.PDF
2015-01-13,顺鑫农业：第六届董事会第二十次会议决议公告,finalpage/2015-01-13/1200538222.PDF
2015-01-13,顺鑫农业：拟转让北京顺鑫农业股份有限公司耘丰种业分公司资产和负债项目资产评估报告书,finalpage/2015-01-13/1200538223.PDF
2015-01-13,顺鑫农业：关于公司向北京顺鑫控股集团有限公司转让北京顺鑫国际种业有限公司股权暨关联交易的公告,finalpage/2015-01-13/1200538224.PDF
2015-01-15,顺鑫农业：2014年度业绩预告,finalpage/2015-01-15/1200544795.PDF
2015-03-05,顺鑫农业：重大事项停牌公告,finalpage/2015-03-05/1200669515.PDF
2015-03-12,顺鑫农业：重大事项继续停牌公告,finalpage/2015-03-12/1200690421.PDF
2015-03-19,顺鑫农业：重大事项继续停牌公告,finalpage/2015-03-19/1200713867.PDF
2015-03-25,顺鑫农业：董事会关于2014年年度募集资金存放与使用情况的专项报告,finalpage/2015-03-25/1200736889.PDF
2015-03-25,顺鑫农业：2014年年度股东大会会议议程,finalpage/2015-03-25/1200736890.PDF
2015-03-25,顺鑫农业：2014年年度报告摘要,finalpage/2015-03-25/1200736891.PDF
2015-03-25,顺鑫农业：2014年年度审计报告,finalpage/2015-03-25/1200736893.PDF
2015-03-25,顺鑫农业：第六届董事会第二十一次会议决议公告,finalpage/2015-03-25/1200736894.PDF
2015-03-25,顺鑫农业：关于提请召开2014年年度股东大会的通知,finalpage/2015-03-25/1200736895.PDF
2015-03-25,顺鑫农业：第六届监事会第八次会议决议公告,finalpage/2015-03-25/1200736896.PDF
2015-03-25,顺鑫农业：关于公司控股股东及其他关联方占用资金情况的专项说明,finalpage/2015-03-25/1200736897.PDF
2015-03-25,顺鑫农业：2014年度内部控制自我评价报告,finalpage/2015-03-25/1200736898.PDF
2015-03-25,顺鑫农业：2014年年度报告,finalpage/2015-03-25/1200736899.PDF
2015-03-25,顺鑫农业：中德证券有限责任公司关于公司放弃控股子公司北京顺鑫石门农产品批发市场有限责任公司优先购买权暨关联交易的核查意见,finalpage/2015-03-25/1200736900.PDF
2015-03-25,顺鑫农业：中德证券有限责任公司关于公司2014年度内部控制自我评价报告的核查意见,finalpage/2015-03-25/1200736901.PDF
2015-03-25,顺鑫农业：中德证券有限责任公司关于公司2014年度保荐工作报告,finalpage/2015-03-25/1200736902.PDF
2015-03-25,顺鑫农业：中德证券有限责任公司关于公司2014年度募集资金存放与使用情况的核查意见,finalpage/2015-03-25/1200736903.PDF
2015-03-25,顺鑫农业：中德证券有限责任公司关于公司2015年度预计日常关联交易的核查意见,finalpage/2015-03-25/1200736904.PDF
2015-03-25,顺鑫农业：2014年度内部控制审计报告,finalpage/2015-03-25/1200736905.PDF
2015-03-25,顺鑫农业：关于公司2014年度募集资金存放与使用情况的鉴证报告,finalpage/2015-03-25/1200736906.PDF
2015-03-25,顺鑫农业：关于放弃对控股子公司北京顺鑫石门农产品批发市场有限责任公司优先购买权暨关联交易的公告,finalpage/2015-03-25/1200736907.PDF
2015-03-25,顺鑫农业：日常关联交易预计公告,finalpage/2015-03-25/1200736908.PDF
2015-03-25,顺鑫农业：独立董事2014年度对相关事项的独立意见,finalpage/2015-03-25/1200736909.PDF
2015-03-25,顺鑫农业：独立董事2014年度述职报告,finalpage/2015-03-25/1200736910.PDF
2015-03-25,顺鑫农业：独立董事关于放弃对控股子公司北京顺鑫石门农产品批发市场有限责任公司优先购买权的独立意见,finalpage/2015-03-25/1200736911.PDF
2015-03-25,顺鑫农业：独立董事对公司累计和当期对外担保情况的专项说明及独立意见,finalpage/2015-03-25/1200736912.PDF
2015-03-25,顺鑫农业：独立董事对内控自我评价的独立意见,finalpage/2015-03-25/1200736913.PDF
2015-03-25,顺鑫农业：独立董事关于公司日常关联交易预计情况发表独立意见,finalpage/2015-03-25/1200736914.PDF
2015-03-25,顺鑫农业：监事会对公司内部控制自我评价报告的意见,finalpage/2015-03-25/1200736915.PDF
2015-03-25,顺鑫农业：北京市商务委员会应急储备保障中心拟转让持有的北京顺鑫石门农产品批发市场有限责任公司6.46%股权项目资产评估报告书,finalpage/2015-03-25/1200736916.PDF
2015-03-26,顺鑫农业：重大事项继续停牌公告,finalpage/2015-03-26/1200740519.PDF
2015-04-02,顺鑫农业：关于筹划发行股份购买资产停牌公告,finalpage/2015-04-02/1200779450.PDF
2015-04-10,顺鑫农业：关于筹划发行股份购买资产事项的进展公告,finalpage/2015-04-10/1200803454.PDF
2015-04-15,顺鑫农业：关于提请召开2014年年度股东大会的提示性公告,finalpage/2015-04-15/1200831135.PDF
2015-04-17,顺鑫农业：关于筹划发行股份购买资产事项的进展公告,finalpage/2015-04-17/1200842370.PDF
2015-04-17,顺鑫农业：第六届董事会第二十二次会议决议公告,finalpage/2015-04-17/1200842371.PDF
2015-04-18,顺鑫农业：2014年年度股东大会会议决议公告,finalpage/2015-04-18/1200863312.PDF
2015-04-18,顺鑫农业：2014年度股东大会的法律意见书,finalpage/2015-04-18/1200863313.PDF
2015-04-21,顺鑫农业：2015年第一季度报告正文,finalpage/2015-04-21/1200873237.PDF
2015-04-21,顺鑫农业：第六届董事会第二十三次会议决议公告,finalpage/2015-04-21/1200873239.PDF
2015-04-21,顺鑫农业：2015年第一季度报告全文,finalpage/2015-04-21/1200873240.PDF
2015-04-22,顺鑫农业：发行股份及支付现金购买资产并募集配套资金预案,finalpage/2015-04-22/1200881363.PDF
2015-04-22,顺鑫农业：中德证券有限责任公司关于公司发行股份及支付现金购买资产并募集配套资金预案之独立财务顾问核查意见,finalpage/2015-04-22/1200881364.PDF
2015-04-22,顺鑫农业：重组预案独立财务顾问核查意见表,finalpage/2015-04-22/1200881365.PDF
2015-04-22,顺鑫农业：发行股份及支付现金购买资产之业绩补偿协议,finalpage/2015-04-22/1200881366.PDF
2015-04-22,顺鑫农业：发行股份及支付现金购买资产协议,finalpage/2015-04-22/1200881367.PDF
2015-04-22,顺鑫农业：独立董事关于发行股份及支付现金购买资产并募集配套资金的事前认可意见,finalpage/2015-04-22/1200881368.PDF
2015-04-22,顺鑫农业：独立董事关于发行股份及支付现金购买资产并募集配套资金的独立意见,finalpage/2015-04-22/1200881369.PDF
2015-04-22,顺鑫农业：董事会关于本次交易符合《上市公司重大资产重组管理办法》第十一条规定的说明,finalpage/2015-04-22/1200881370.PDF
2015-04-22,顺鑫农业：董事会关于本次交易符合《上市公司重大资产重组管理办法》第四十三条规定的说明,finalpage/2015-04-22/1200881371.PDF
2015-04-22,顺鑫农业：董事会关于本次交易符合《关于规范上市公司重大资产重组若干问题的规定》第四条规定的说明,finalpage/2015-04-22/1200881372.PDF
2015-04-22,顺鑫农业：董事会关于发行股份及支付现金购买资产并募集配套资金的一般风险提示暨复牌公告,finalpage/2015-04-22/1200881373.PDF
2015-04-22,顺鑫农业：承诺（一）,finalpage/2015-04-22/1200881374.PDF
2015-04-22,顺鑫农业：关于减少和规范关联交易的承诺函（二）,finalpage/2015-04-22/1200881375.PDF
2015-04-22,顺鑫农业：关于减少和规范关联交易的承诺函（一）,finalpage/2015-04-22/1200881376.PDF
2015-04-22,顺鑫农业：关于避免同业竞争的承诺函（一）,finalpage/2015-04-22/1200881377.PDF
2015-04-22,顺鑫农业：关于避免同业竞争的承诺函（二）,finalpage/2015-04-22/1200881378.PDF
2015-04-22,顺鑫农业：关于锁定期相关事宜的承诺函（一）,finalpage/2015-04-22/1200881379.PDF
2015-04-22,顺鑫农业：关于锁定期相关事宜的承诺函（四）,finalpage/2015-04-22/1200881380.PDF
2015-04-22,顺鑫农业：关于锁定期相关事宜的承诺函（五）,finalpage/2015-04-22/1200881381.PDF
2015-04-22,顺鑫农业：关于锁定期相关事宜的承诺函（六）,finalpage/2015-04-22/1200881382.PDF
2015-04-22,顺鑫农业：关于锁定期相关事宜的承诺函（三）,finalpage/2015-04-22/1200881383.PDF
2015-04-22,顺鑫农业：关于锁定期相关事宜的承诺函（九）,finalpage/2015-04-22/1200881384.PDF
2015-04-22,顺鑫农业：关于锁定期相关事宜的承诺函（二）,finalpage/2015-04-22/1200881385.PDF
2015-04-22,顺鑫农业：关于锁定期相关事宜的承诺函（八）,finalpage/2015-04-22/1200881386.PDF
2015-04-22,顺鑫农业：关于锁定期相关事宜的承诺函（七）,finalpage/2015-04-22/1200881387.PDF
2015-04-22,顺鑫农业：2014年年度权益分派实施公告,finalpage/2015-04-22/1200881388.PDF
2015-04-22,顺鑫农业：承诺（二）,finalpage/2015-04-22/1200881389.PDF
2015-04-22,顺鑫农业：承诺（四）,finalpage/2015-04-22/1200881390.PDF
2015-04-22,顺鑫农业：承诺（五）,finalpage/2015-04-22/1200881391.PDF
2015-04-22,顺鑫农业：承诺（三）,finalpage/2015-04-22/1200881392.PDF
2015-04-22,顺鑫农业：第六届监事会第十次会议决议公告,finalpage/2015-04-22/1200881393.PDF
2015-04-22,顺鑫农业：第六届董事会第二十四次会议决议公告,finalpage/2015-04-22/1200881394.PDF
2015-04-22,顺鑫农业：董事会关于本次交易履行法定程序的完备性、合规性及提交法律文件的有效性的说明,finalpage/2015-04-22/1200881395.PDF
2015-04-22,顺鑫农业：关于避免同业竞争的承诺函（三）,finalpage/2015-04-22/1200881396.PDF
2015-05-11,顺鑫农业：2014年公司债券信用评级分析报告,finalpage/2015-05-11/1200986629.PDF
2015-05-11,顺鑫农业：公开发行2015年公司债券（第一期）募集说明书,finalpage/2015-05-11/1200986630.PDF
2015-05-11,顺鑫农业：公开发行2015年公司债券（第一期）募集说明书摘要,finalpage/2015-05-11/1200986631.PDF
2015-05-11,顺鑫农业：公开发行2015年公司债券（第一期）发行公告,finalpage/2015-05-11/1200986632.PDF
2015-05-11,顺鑫农业：关于对拟发行公司债券进行更名的公告,finalpage/2015-05-11/1200986633.PDF
2015-05-13,顺鑫农业：2015年公司债券（第一期）票面利率公告,finalpage/2015-05-13/1201005404.PDF
2015-05-15,顺鑫农业：2015年公司债券（第一期）发行结果公告,finalpage/2015-05-15/1201015721.PDF
2015-05-22,顺鑫农业：关于筹划发行股份购买资产事项的进展公告,finalpage/2015-05-22/1201044802.PDF
2015-05-28,顺鑫农业：关于公司控股子公司北京鑫大禹水利建筑工程有限公司对北京鑫大禹环保工程有限责任公司增资的公告,finalpage/2015-05-28/1201071503.PDF
2015-05-28,顺鑫农业：第六届董事会第二十五次会议决议公告,finalpage/2015-05-28/1201071504.PDF
2015-06-02,顺鑫农业：关于公司投资设立陕西顺鑫种猪选育有限公司的公告,finalpage/2015-06-02/1201087618.PDF
2015-06-02,顺鑫农业：第六届董事会第二十六次会议决议公告,finalpage/2015-06-02/1201087619.PDF
2015-06-11,顺鑫农业：关于2014年非公开发行股票解除限售提示性公告,finalpage/2015-06-11/1201133646.PDF
2015-06-11,顺鑫农业：中德证券有限责任公司关于公司非公开发行股票限售股份解除限售的核查意见,finalpage/2015-06-11/1201133647.PDF
2015-06-26,顺鑫农业：关于终止发行股份及支付现金购买资产的公告,finalpage/2015-06-26/1201195320.PDF
2015-06-26,顺鑫农业：关于终止发行股份及支付现金购买资产事项召开投资者说明会的公告,finalpage/2015-06-26/1201195321.PDF
2015-06-26,顺鑫农业：独立董事关于终止发行股份及支付现金购买资产并募集配套资金的独立意见,finalpage/2015-06-26/1201195322.PDF
2015-06-26,顺鑫农业：第六届董事会第二十七次会议决议公告,finalpage/2015-06-26/1201195323.PDF
2015-06-26,顺鑫农业：2015年公司债券（第一期）上市公告书,finalpage/2015-06-26/1201197613.PDF
2015-07-01,顺鑫农业：关于终止发行股份及支付现金购买资产事项投资者说明会召开情况的公告,finalpage/2015-07-01/1201217943.PDF
2015-07-06,顺鑫农业：2015年度第一期超短期融资券发行公告,finalpage/2015-07-06/1201235872.PDF
2015-07-09,顺鑫农业：关于2015年度第一期超短期融资券发行结果的公告,finalpage/2015-07-09/1201261351.PDF
2015-07-10,顺鑫农业：关于控股股东增持本公司股份的公告,finalpage/2015-07-10/1201267716.PDF
2015-07-25,顺鑫农业：第六届董事会第二十八次会议决议公告,finalpage/2015-07-25/1201342301.PDF
2015-08-12,顺鑫农业：董事会关于2015年半年度募集资金存放与使用情况的专项报告,finalpage/2015-08-12/1201422620.PDF
2015-08-12,顺鑫农业：2015年半年度报告摘要,finalpage/2015-08-12/1201422621.PDF
2015-08-12,顺鑫农业：2015半年度财务报告,finalpage/2015-08-12/1201422623.PDF
2015-08-12,顺鑫农业：第六届董事会第二十九次会议决议公告,finalpage/2015-08-12/1201422624.PDF
2015-08-12,顺鑫农业：2015年半年度报告,finalpage/2015-08-12/1201422625.PDF
2015-08-12,顺鑫农业：独立董事关于公司相关事项的独立意见,finalpage/2015-08-12/1201422626.PDF
2015-08-25,顺鑫农业：关于控股股东继续增持本公司股份的公告,finalpage/2015-08-25/1201484342.PDF
2015-09-01,顺鑫农业：拟转让公司顺科农业技术开发分公司资产及负债项目资产评估报告书,finalpage/2015-09-01/1201531431.PDF
2015-09-01,顺鑫农业：2015年第一次临时股东大会会议议程,finalpage/2015-09-01/1201531432.PDF
2015-09-01,顺鑫农业：关于提请召开2015年第一次临时股东大会的通知,finalpage/2015-09-01/1201531433.PDF
2015-09-01,顺鑫农业：中德证券有限责任公司关于公司向北京顺鑫控股集团有限公司出售资产暨关联交易的核查意见,finalpage/2015-09-01/1201531434.PDF
2015-09-01,顺鑫农业：关于公司向北京顺鑫控股集团有限公司出售资产暨关联交易的公告,finalpage/2015-09-01/1201531435.PDF
2015-09-01,顺鑫农业：募集资金使用管理办法（2015年8月）,finalpage/2015-09-01/1201531436.PDF
2015-09-01,顺鑫农业：独立董事就公司向北京顺鑫控股集团有限公司出售资产发表独立意见,finalpage/2015-09-01/1201531437.PDF
2015-09-01,顺鑫农业：第六届董事会第三十次会议决议公告,finalpage/2015-09-01/1201531438.PDF
2015-09-18,顺鑫农业：关于提请召开2015年第一次临时股东大会的提示性公告,finalpage/2015-09-18/1201607783.PDF
2015-09-23,顺鑫农业：2015年第一次临时股东大会会议决议公告,finalpage/2015-09-23/1201624105.PDF
2015-09-23,顺鑫农业：募集资金使用管理办法（2015年9月）,finalpage/2015-09-23/1201624106.PDF
2015-09-23,顺鑫农业：2015年第一次临时股东大会的法律意见书,finalpage/2015-09-23/1201624107.PDF
2015-10-09,顺鑫农业：关于控股股东完成增持本公司股份的公告,finalpage/2015-10-09/1201669532.PDF
2015-10-09,顺鑫农业：北京市天银律师事务所关于公司控股股东增持股份的专项核查意见,finalpage/2015-10-09/1201669533.PDF
2015-10-21,顺鑫农业：第六届董事会第三十一次会议决议公告,finalpage/2015-10-21/1201709629.PDF
2015-10-21,顺鑫农业：关于公司对北京顺鑫鹏程商贸有限公司增资的公告,finalpage/2015-10-21/1201709630.PDF
2015-10-22,顺鑫农业：公开发行2015年公司债券（第二期）募集说明书,finalpage/2015-10-22/1201713874.PDF
2015-10-22,顺鑫农业：2015年公司债券信用评级分析报告,finalpage/2015-10-22/1201713875.PDF
2015-10-22,顺鑫农业：公开发行2015年公司债券（第二期）募集说明书摘要,finalpage/2015-10-22/1201713876.PDF
2015-10-22,顺鑫农业：公开发行2015年公司债券（第二期）发行公告,finalpage/2015-10-22/1201713877.PDF
2015-10-24,顺鑫农业：关于公司证券事务代表辞职的公告,finalpage/2015-10-24/1201718595.PDF
