date,title,url
2012-11-19,顺鑫农业：独立董事就公司控股子公司北京顺鑫佳宇房地产开发有限公司收购包头市金瑞房地产开发有限责任公司股权发表独立意见,finalpage/2012-11-19/61808188.PDF
2012-11-19,顺鑫农业：第五届董事会第二十九次会议决议公告,finalpage/2012-11-19/61808189.PDF
2012-11-26,顺鑫农业：第五届董事会第三十次会议决议公告,finalpage/2012-11-26/61831849.PDF
2012-11-30,顺鑫农业：控股子公司北京鑫大禹水利建筑工程有限责任公司项目未中标的公告,finalpage/2012-11-30/61851351.PDF
2012-12-06,顺鑫农业：关于控股股东增持本公司股份的公告,finalpage/2012-12-06/61876238.PDF
2012-12-07,顺鑫农业：关于控股股东增持本公司股份进展的提示性公告,finalpage/2012-12-07/61880862.PDF
2012-12-21,顺鑫农业：第五届董事会第三十一次会议决议公告,finalpage/2012-12-21/61933147.PDF
2012-12-31,顺鑫农业：北京市天银律师事务所关于公司控股股东增持股份的专项核查意见,finalpage/2012-12-31/61965171.PDF
2012-12-31,顺鑫农业：关于控股股东完成增持本公司股份的公告,finalpage/2012-12-31/61965172.PDF
2013-01-17,顺鑫农业：2013年第一次临时股东大会会议议程,finalpage/2013-01-17/62028796.PDF
2013-01-17,顺鑫农业：关于提请召开2013年第一次临时股东大会的通知,finalpage/2013-01-17/62028797.PDF
2013-01-17,顺鑫农业：第五届董事会第三十二次会议决议公告,finalpage/2013-01-17/62028798.PDF
2013-01-17,顺鑫农业：公司章程（2013年1月）,finalpage/2013-01-17/62028799.PDF
2013-01-17,顺鑫农业：独立董事关于聘请2012年度内控审计机构的独立意见,finalpage/2013-01-17/62028800.PDF
2013-01-23,顺鑫农业：第五届董事会第三十三次会议决议公告,finalpage/2013-01-23/62056079.PDF
2013-01-23,顺鑫农业：熟食产业技术升级项目可行性研究报告,finalpage/2013-01-23/62056080.PDF
2013-01-23,顺鑫农业：关于投资建设公司鹏程食品分公司熟食产业技术升级项目公告,finalpage/2013-01-23/62056081.PDF
2013-01-23,顺鑫农业：关于投资建设公司牛栏山酒厂研发中心暨升级改造工程（二期）项目公告,finalpage/2013-01-23/62056082.PDF
2013-01-23,顺鑫农业：牛栏山酒厂研发中心暨升级改造工程（二期）项目项目申请报告,finalpage/2013-01-23/62056083.PDF
2013-02-04,顺鑫农业：2013年第一次临时股东大会会议决议公告,finalpage/2013-02-04/62097095.PDF
2013-02-04,顺鑫农业：2013年第一次临时股东大会的法律意见书,finalpage/2013-02-04/62097097.PDF
2013-02-04,顺鑫农业：公司章程（2013年2月）,finalpage/2013-02-04/62097098.PDF
2013-02-21,顺鑫农业：第五届董事会第三十四次会议决议公告,finalpage/2013-02-21/62137820.PDF
2013-03-20,顺鑫农业：内部控制审计报告,finalpage/2013-03-20/62233280.PDF
2013-03-20,顺鑫农业：2012年年度股东大会会议议程,finalpage/2013-03-20/62233281.PDF
2013-03-20,顺鑫农业：2012年年度报告摘要,finalpage/2013-03-20/62233282.PDF
2013-03-20,顺鑫农业：2012年年度报告,finalpage/2013-03-20/62233284.PDF
2013-03-20,顺鑫农业：2012年年度审计报告,finalpage/2013-03-20/62233285.PDF
2013-03-20,顺鑫农业：第五届董事会第三十五次会议决议公告,finalpage/2013-03-20/62233286.PDF
2013-03-20,顺鑫农业：关于提请召开2012年年度股东大会的通知（已取消）,finalpage/2013-03-20/62233287.PDF
2013-03-20,顺鑫农业：第五届监事会第十次会议决议公告,finalpage/2013-03-20/62233288.PDF
2013-03-20,顺鑫农业：关于公司控股股东及其他关联方占用资金情况的专项说明,finalpage/2013-03-20/62233289.PDF
2013-03-20,顺鑫农业：2012年度内部控制自我评价报告,finalpage/2013-03-20/62233290.PDF
2013-03-20,顺鑫农业：关于公司2012年度募集资金存放与使用情况的鉴证报告,finalpage/2013-03-20/62233291.PDF
2013-03-20,顺鑫农业：独立董事2012年度对相关事项的独立意见,finalpage/2013-03-20/62233292.PDF
2013-03-20,顺鑫农业：独立董事对公司累计和当期对外担保情况的专项说明及独立意见,finalpage/2013-03-20/62233293.PDF
2013-03-20,顺鑫农业：独立董事对内部控制自我评价报告的独立意见,finalpage/2013-03-20/62233294.PDF
2013-03-20,顺鑫农业：独立董事2012年度述职报告,finalpage/2013-03-20/62233295.PDF
2013-03-20,顺鑫农业：监事会对公司内部控制自我评价报告的意见,finalpage/2013-03-20/62233296.PDF
2013-03-20,顺鑫农业：董事会关于公司购买银行理财产品的专项说明,finalpage/2013-03-20/62233297.PDF
2013-03-20,顺鑫农业：关于2012年度募集资金存放与使用情况的专项报告,finalpage/2013-03-20/62233298.PDF
2013-03-23,顺鑫农业：《关于提请召开2012年年度股东大会通知公告》的更正公告,finalpage/2013-03-23/62256502.PDF
2013-03-23,顺鑫农业：关于提请召开2012年年度股东大会的通知（更新后）,finalpage/2013-03-23/62256505.PDF
2013-04-03,顺鑫农业：关于召开2012年年度股东大会的提示性公告,finalpage/2013-04-03/62317666.PDF
2013-04-11,顺鑫农业：2012年年度股东大会会议决议公告,finalpage/2013-04-11/62344630.PDF
2013-04-11,顺鑫农业：2012年度股东大会的法律意见书,finalpage/2013-04-11/62344631.PDF
2013-04-24,顺鑫农业：2013年第一季度报告正文,finalpage/2013-04-24/62411248.PDF
2013-04-24,顺鑫农业：2013年第一季度报告全文,finalpage/2013-04-24/62411250.PDF
2013-05-03,顺鑫农业：对控股子公司北京顺鑫腾飞纸制品有限公司增资暨关联交易公告,finalpage/2013-05-03/62450155.PDF
2013-05-03,顺鑫农业：北京顺鑫腾飞纸制品有限公司拟增资项目资产评估报告书,finalpage/2013-05-03/62450156.PDF
2013-05-03,顺鑫农业：独立董事关于公司对控股子公司北京顺鑫腾飞纸制品有限公司增资的独立意见,finalpage/2013-05-03/62450159.PDF
2013-05-03,顺鑫农业：第五届董事会第三十七次会议决议公告,finalpage/2013-05-03/62450160.PDF
2013-05-16,顺鑫农业：2012年年度权益分派实施公告,finalpage/2013-05-16/62493902.PDF
2013-05-22,顺鑫农业：董事长、总经理辞职公告,finalpage/2013-05-22/62512143.PDF
2013-05-28,顺鑫农业：2013年第二次临时股东大会会议议程,finalpage/2013-05-28/62528164.PDF
2013-05-28,顺鑫农业：关于提请召开2013年第二次临时股东大会的通知,finalpage/2013-05-28/62528165.PDF
2013-05-28,顺鑫农业：独立董事对关于推选董事候选人的独立意见,finalpage/2013-05-28/62528166.PDF
2013-05-28,顺鑫农业：第五届董事会第十四次临时会议决议公告,finalpage/2013-05-28/62528167.PDF
2013-06-14,顺鑫农业：2013年第二次临时股东大会会议决议公告,finalpage/2013-06-14/62578083.PDF
2013-06-14,顺鑫农业：2013年第二次临时股东大会的法律意见书,finalpage/2013-06-14/62578084.PDF
2013-06-14,顺鑫农业：独立董事关于选举公司董事长、公司董事会战略与投资委员会主任委员、聘任公司总经理的独立意见,finalpage/2013-06-14/62578085.PDF
2013-06-14,顺鑫农业：第五届董事会第十五次临时会议决议公告,finalpage/2013-06-14/62578086.PDF
2013-07-03,顺鑫农业：第五届董事会第三十八次会议决议公告,finalpage/2013-07-03/62758571.PDF
2013-07-16,顺鑫农业：2013年第三次临时股东大会会议议程,finalpage/2013-07-16/62836860.PDF
2013-07-16,顺鑫农业：关于提请召开2013年第三次临时股东大会的通知,finalpage/2013-07-16/62836861.PDF
2013-07-16,顺鑫农业：第五届董事会第三十九次会议决议公告,finalpage/2013-07-16/62836862.PDF
2013-08-01,顺鑫农业：2013年第三次临时股东大会会议决议公告,finalpage/2013-08-01/62889423.PDF
2013-08-01,顺鑫农业：2013年第三次临时股东大会的法律意见书,finalpage/2013-08-01/62889424.PDF
2013-08-16,顺鑫农业：北京鑫大禹水利建筑工程有限公司拟增资北京鑫大禹华霖节水设备有限责任公司项目资产评估报告书,finalpage/2013-08-16/62948398.PDF
2013-08-16,顺鑫农业：北京顺鑫佳宇房地产开发有限公司拟收购海南香顺房地产开发有限公司股权项目资产评估报告书,finalpage/2013-08-16/62948399.PDF
2013-08-16,顺鑫农业：2013年半年度报告摘要,finalpage/2013-08-16/62948403.PDF
2013-08-16,顺鑫农业：2013半年度财务报告,finalpage/2013-08-16/62948407.PDF
2013-08-16,顺鑫农业：第五届董事会第四十次会议决议公告,finalpage/2013-08-16/62948412.PDF
2013-08-16,顺鑫农业：2013年半年度报告,finalpage/2013-08-16/62948413.PDF
2013-08-16,顺鑫农业：关联交易内部决策规则（2013年8月）,finalpage/2013-08-16/62948414.PDF
2013-08-16,顺鑫农业：总经理工作细则（2013年8月）,finalpage/2013-08-16/62948415.PDF
2013-08-16,顺鑫农业：投资者关系管理制度（2013年8月）,finalpage/2013-08-16/62948416.PDF
2013-08-16,顺鑫农业：董事会议事规则（2013年8月）,finalpage/2013-08-16/62948417.PDF
2013-08-16,顺鑫农业：重大事件内部报告制度（2013年8月）,finalpage/2013-08-16/62948418.PDF
2013-08-16,顺鑫农业：独立董事就公司控股子公司北京顺鑫佳宇房地产开发有限公司对海南香顺房地产开发有限公司增资发表独立意见,finalpage/2013-08-16/62948419.PDF
2013-08-16,顺鑫农业：独立董事对2013年上半年公司关联方资金占用及对外担保情况的专项说明和独立意见,finalpage/2013-08-16/62948420.PDF
2013-08-16,顺鑫农业：控股子公司北京鑫大禹水利建筑工程有限公司对北京鑫大禹华霖节水设备有限责任公司增资的公告,finalpage/2013-08-16/62948421.PDF
2013-08-16,顺鑫农业：控股子公司北京顺鑫佳宇房地产开发有限公司对海南香顺房地产开发有限公司增资暨关联交易的公告,finalpage/2013-08-16/62948422.PDF
2013-09-11,顺鑫农业：第五届董事会第四十一次会议决议公告,finalpage/2013-09-11/63069846.PDF
2013-09-12,顺鑫农业：关于非公开定向债务融资工具申请获准的公告,finalpage/2013-09-12/63073421.PDF
2013-09-17,顺鑫农业：重大事项停牌公告,finalpage/2013-09-17/63089662.PDF
2013-09-25,顺鑫农业：第五届董事会第四十二次会议决议公告,finalpage/2013-09-25/63107982.PDF
2013-09-25,顺鑫农业：公司章程（2013年9月）,finalpage/2013-09-25/63107983.PDF
2013-09-25,顺鑫农业：董事会关于前次募集资金使用情况的专项报告,finalpage/2013-09-25/63107984.PDF
2013-09-25,顺鑫农业：独立董事关于非公开发行股票涉及的关联交易事项的独立意见,finalpage/2013-09-25/63107985.PDF
2013-09-25,顺鑫农业：独立董事关于公司非公开发行股票涉及的关联交易事项的事前认可意见,finalpage/2013-09-25/63107986.PDF
2013-09-25,顺鑫农业：重大事项复牌公告,finalpage/2013-09-25/63107987.PDF
2013-09-25,顺鑫农业：关于本次非公开发行股票涉及关联交易的公告,finalpage/2013-09-25/63107988.PDF
2013-09-25,顺鑫农业：非公开发行股票募集资金使用可行性分析报告,finalpage/2013-09-25/63107989.PDF
2013-09-25,顺鑫农业：非公开发行股票预案,finalpage/2013-09-25/63107990.PDF
2013-09-28,顺鑫农业：第五届董事会第四十三次会议决议公告,finalpage/2013-09-28/63118609.PDF
2013-10-16,顺鑫农业：2012年度第一期短期融资券兑付公告,finalpage/2013-10-16/63158630.PDF
2013-10-18,顺鑫农业：2012年度第二期短期融资券兑付公告,finalpage/2013-10-18/63165344.PDF
2013-10-25,顺鑫农业：2013年第三季度报告正文,finalpage/2013-10-25/63189749.PDF
2013-10-25,顺鑫农业：第五届董事会第四十四次会议决议公告,finalpage/2013-10-25/63189751.PDF
2013-10-25,顺鑫农业：2013年第三季度报告全文,finalpage/2013-10-25/63189752.PDF
2013-11-01,顺鑫农业：关于提请召开2013年第四次临时股东大会的通知,finalpage/2013-11-01/63223863.PDF
2013-11-01,顺鑫农业：关于公司参与认购北京顺鑫农业股份有限公司2013年非公开发行股票可能产生权益变动的提示性公告,finalpage/2013-11-01/63223864.PDF
2013-11-01,顺鑫农业：2013年第四次临时股东大会会议议程,finalpage/2013-11-01/63223865.PDF
2013-11-15,顺鑫农业：关于召开2013年第四次临时股东大会的提示性公告,finalpage/2013-11-15/63268834.PDF
2013-11-16,顺鑫农业：关于非公开发行股票事宜获得国资委批复的公告,finalpage/2013-11-16/63272483.PDF
2013-11-21,顺鑫农业：2013年第四次临时股东大会会议决议公告,finalpage/2013-11-21/63287440.PDF
2013-11-21,顺鑫农业：2013年第四次临时股东大会的法律意见书,finalpage/2013-11-21/63287441.PDF
2013-11-21,顺鑫农业：北京市天银律师事务所关于北京顺鑫农业发展集团有限公司认购公司非公开发行股票符合免于提交豁免要约收购申请条件的专项法律意见,finalpage/2013-11-21/63287442.PDF
2013-11-21,顺鑫农业：公司章程（2013年11月）,finalpage/2013-11-21/63287443.PDF
2013-11-21,顺鑫农业：董事会议事规则（2013年11月）,finalpage/2013-11-21/63287444.PDF
2013-11-22,顺鑫农业：第五届董事会第四十五次会议决议公告,finalpage/2013-11-22/63290262.PDF
2013-11-22,顺鑫农业：募集资金使用管理办法（2013年11月）,finalpage/2013-11-22/63290263.PDF
2013-11-22,顺鑫农业：关于开展融资租赁业务的公告,finalpage/2013-11-22/63290264.PDF
2013-11-28,顺鑫农业：北京顺鑫农业发展集团有限公司拟转让北京顺鑫佳宇房地产开发有限公司股权项目资产评估报告书,finalpage/2013-11-28/63309881.PDF
2013-11-28,顺鑫农业：第五届董事会第十六次临时会议决议公告,finalpage/2013-11-28/63309882.PDF
2013-11-28,顺鑫农业：独立董事就公司向北京顺鑫农业发展集团有限公司收购北京顺鑫佳宇房地产开发有限公司股权发表独立意见,finalpage/2013-11-28/63309883.PDF
2013-11-28,顺鑫农业：关于公司向北京顺鑫农业发展集团有限公司收购北京顺鑫佳宇房地产开发有限公司股权暨关联交易的公告,finalpage/2013-11-28/63309884.PDF
2013-12-07,顺鑫农业：关于提请召开2013年第五次临时股东大会的通知,finalpage/2013-12-07/63347090.PDF
2013-12-07,顺鑫农业：第五届董事会第四十六次会议决议公告,finalpage/2013-12-07/63347091.PDF
2013-12-07,顺鑫农业：第五届监事会第十四次会议决议公告,finalpage/2013-12-07/63347094.PDF
2013-12-07,顺鑫农业：独立董事候选人声明（张雷）,finalpage/2013-12-07/63347095.PDF
2013-12-07,顺鑫农业：独立董事候选人声明（赵长树）,finalpage/2013-12-07/63347097.PDF
2013-12-07,顺鑫农业：独立董事候选人声明（陈英丽）,finalpage/2013-12-07/63347098.PDF
2013-12-07,顺鑫农业：独立董事关于公司董事会换届的独立意见,finalpage/2013-12-07/63347099.PDF
2013-12-07,顺鑫农业：独立董事提名人声明（三）,finalpage/2013-12-07/63347100.PDF
2013-12-07,顺鑫农业：独立董事提名人声明（二）,finalpage/2013-12-07/63347101.PDF
2013-12-07,顺鑫农业：独立董事提名人声明（一）,finalpage/2013-12-07/63347102.PDF
2013-12-07,顺鑫农业：2013年第五次临时股东大会会议议程,finalpage/2013-12-07/63347103.PDF
2013-12-19,顺鑫农业：关于收到《中国证监会行政许可申请受理通知书》的公告,finalpage/2013-12-19/63389318.PDF
2013-12-26,顺鑫农业：2013年第五次临时股东大会会议决议公告,finalpage/2013-12-26/63414255.PDF
2013-12-26,顺鑫农业：2013年第五次临时股东大会的法律意见书,finalpage/2013-12-26/63414256.PDF
2013-12-26,顺鑫农业：第六届监事会第一次会议决议公告,finalpage/2013-12-26/63414257.PDF
2013-12-26,顺鑫农业：第六届董事会第一次会议决议公告,finalpage/2013-12-26/63414258.PDF
2013-12-26,顺鑫农业：独立董事关于聘任高级管理人员的独立意见,finalpage/2013-12-26/63414259.PDF
2013-12-31,顺鑫农业：2013年度业绩预告,finalpage/2013-12-31/63433052.PDF
2014-01-08,顺鑫农业：第六届董事会第二次会议决议公告,finalpage/2014-01-08/63462767.PDF
2014-01-22,顺鑫农业：2013年年度股东大会会议议程,finalpage/2014-01-22/63509238.PDF
2014-01-22,顺鑫农业：2013年年度报告摘要,finalpage/2014-01-22/63509242.PDF
2014-01-22,顺鑫农业：2013年年度审计报告,finalpage/2014-01-22/63509250.PDF
2014-01-22,顺鑫农业：第六届董事会第三次会议决议公告,finalpage/2014-01-22/63509252.PDF
2014-01-22,顺鑫农业：关于提请召开2013年年度股东大会的通知,finalpage/2014-01-22/63509253.PDF
2014-01-22,顺鑫农业：第六届监事会第二次会议决议公告,finalpage/2014-01-22/63509254.PDF
2014-01-22,顺鑫农业：关于公司控股股东及其他关联方占用资金情况的专项说明,finalpage/2014-01-22/63509255.PDF
2014-01-22,顺鑫农业：2013年度内部控制自我评价报告,finalpage/2014-01-22/63509256.PDF
2014-01-22,顺鑫农业：2013年年度报告,finalpage/2014-01-22/63509257.PDF
2014-01-22,顺鑫农业：公司章程（2014年1月）,finalpage/2014-01-22/63509258.PDF
2014-01-22,顺鑫农业：内部审计管理制度（2014年1月）,finalpage/2014-01-22/63509259.PDF
2014-01-22,顺鑫农业：内部控制审计报告,finalpage/2014-01-22/63509260.PDF
2014-01-22,顺鑫农业：日常关联交易预计公告,finalpage/2014-01-22/63509261.PDF
2014-01-22,顺鑫农业：独立董事2013年度对相关事项的独立意见,finalpage/2014-01-22/63509262.PDF
2014-01-22,顺鑫农业：独立董事2013年度述职报告,finalpage/2014-01-22/63509263.PDF
2014-01-22,顺鑫农业：独立董事对公司累计和当期对外担保情况的专项说明及独立意见,finalpage/2014-01-22/63509264.PDF
2014-01-22,顺鑫农业：独立董事对内控自我评价的独立意见,finalpage/2014-01-22/63509265.PDF
2014-01-22,顺鑫农业：独立董事关于公司日常关联交易预计情况发表独立意见,finalpage/2014-01-22/63509266.PDF
2014-01-22,顺鑫农业：监事会对公司内部控制自我评价报告的意见,finalpage/2014-01-22/63509267.PDF
2014-02-12,顺鑫农业：关于召开2013年年度股东大会的提示性公告,finalpage/2014-02-12/63561084.PDF
2014-02-14,顺鑫农业：关于未履行完毕承诺事项专项披露的公告,finalpage/2014-02-14/63568435.PDF
2014-02-15,顺鑫农业：2013年年度股东大会会议决议公告,finalpage/2014-02-15/63574054.PDF
2014-02-15,顺鑫农业：2013年年度股东大会的法律意见书,finalpage/2014-02-15/63574055.PDF
2014-02-15,顺鑫农业：公司章程（2014年2月）,finalpage/2014-02-15/63574056.PDF
2014-02-18,顺鑫农业：关于公司非公开发行股票募集资金使用承诺的公告,finalpage/2014-02-18/63581123.PDF
2014-02-18,顺鑫农业：关于最近五年接受监管措施或处罚及整改情况的公告,finalpage/2014-02-18/63581126.PDF
2014-02-21,顺鑫农业：关于所聘会计师事务所更名的公告,finalpage/2014-02-21/63591444.PDF
2014-02-22,顺鑫农业：第六届董事会第四次会议决议公告,finalpage/2014-02-22/63594845.PDF
2014-03-05,顺鑫农业：关于放弃对参股公司北京顺鑫天河文化发展有限公司优先购买权暨关联交易的公告,finalpage/2014-03-05/63635947.PDF
2014-03-05,顺鑫农业：独立董事关于放弃对参股公司北京顺鑫天河文化发展有限公司优先购买权的独立意见,finalpage/2014-03-05/63635948.PDF
2014-03-05,顺鑫农业：第六届董事会第五次会议决议公告,finalpage/2014-03-05/63635949.PDF
2014-03-05,顺鑫农业：北京顺鑫天河文化发展有限公司因股权转让需要整体资产评估项目资产评估报告书,finalpage/2014-03-05/63635950.PDF
2014-03-08,顺鑫农业：关于2014年度第一期非公开定向债务融资工具发行情况的公告,finalpage/2014-03-08/63649598.PDF
2014-03-14,顺鑫农业：2013年年度权益分派实施公告,finalpage/2014-03-14/63672461.PDF
2014-03-22,顺鑫农业：关于非公开发行股票申请获得中国证监会发行审核委员会审核通过的公告,finalpage/2014-03-22/63707602.PDF
2014-03-22,顺鑫农业：关于调整非公开发行股票发行价格和发行数量的公告,finalpage/2014-03-22/63707603.PDF
2014-03-25,顺鑫农业：2014年第一季度业绩预告,finalpage/2014-03-25/63718526.PDF
2014-03-25,顺鑫农业：关于公司向北京顺鑫农业发展集团有限公司转让北京顺鑫明珠文化发展有限公司股权暨关联交易的公告,finalpage/2014-03-25/63718527.PDF
2014-03-25,顺鑫农业：关于开展融资租赁业务的公告,finalpage/2014-03-25/63718528.PDF
2014-03-25,顺鑫农业：北京顺鑫天河文化发展有限公司股权项目资产评估报告,finalpage/2014-03-25/63718529.PDF
2014-03-25,顺鑫农业：独立董事就公司向北京顺鑫农业发展集团有限公司转让北京顺鑫明珠文化发展有限公司股权发表独立意见,finalpage/2014-03-25/63718532.PDF
2014-03-25,顺鑫农业：第六届董事会第六次会议决议公告,finalpage/2014-03-25/63718533.PDF
2014-04-25,顺鑫农业：2014年第一季度报告正文,finalpage/2014-04-25/63915711.PDF
2014-04-25,顺鑫农业：第六届董事会第七次会议决议公告,finalpage/2014-04-25/63915713.PDF
2014-04-25,顺鑫农业：2014年第一季度报告全文,finalpage/2014-04-25/63915715.PDF
2014-04-30,顺鑫农业：关于2014年度第一期短期融资券发行结果的公告,finalpage/2014-04-30/63948692.PDF
2014-05-16,顺鑫农业：关于非公开发行股票获得中国证券监督管理委员会核准批复的公告,finalpage/2014-05-16/64029762.PDF
2014-05-20,顺鑫农业：关于公司全资子公司北京顺鑫佳宇房地产开发有限公司的全资子公司出售资产的公告,finalpage/2014-05-20/64042760.PDF
2014-05-20,顺鑫农业：独立董事关于公司全资子公司北京顺鑫佳宇房地产开发有限公司的全资子公司出售资产事项的独立意见,finalpage/2014-05-20/64042763.PDF
2014-05-20,顺鑫农业：第六届董事会第八次会议决议公告,finalpage/2014-05-20/64042764.PDF
2014-05-20,顺鑫农业：包头市金瑞房地产开发有限责任公司拟转让土地使用权项目资产评估报告书,finalpage/2014-05-20/64042765.PDF
2014-05-31,顺鑫农业：第六届董事会第九次会议决议公告,finalpage/2014-05-31/64086346.PDF
2014-06-12,顺鑫农业：非公开发行股票相关承诺公告,finalpage/2014-06-12/64127664.PDF
2014-06-12,顺鑫农业：北京市海润律师事务所关于公司非公开发行股票发行过程及认购对象合规性的法律意见书,finalpage/2014-06-12/64127665.PDF
2014-06-12,顺鑫农业：关于签署募集资金三方监管协议的公告,finalpage/2014-06-12/64127666.PDF
2014-06-12,顺鑫农业：非公开发行股票发行情况报告暨上市公告书,finalpage/2014-06-12/64127667.PDF
2014-06-12,顺鑫农业：非公开发行股票发行情况报告暨上市公告书摘要,finalpage/2014-06-12/64127668.PDF
2014-06-12,顺鑫农业：中德证券有限责任公司关于公司非公开发行股票上市保荐书,finalpage/2014-06-12/64127669.PDF
2014-06-12,顺鑫农业：中德证券有限责任公司关于公司非公开发行股票发行过程和认购对象合规性的报告,finalpage/2014-06-12/64127670.PDF
2014-06-12,顺鑫农业：验资报告（2014）,finalpage/2014-06-12/64127672.PDF
2014-06-12,顺鑫农业：关于公司非公开发行A股认购资金到位情况验证报告（2014）,finalpage/2014-06-12/64127673.PDF
2014-06-12,顺鑫农业：简式权益变动报告书,finalpage/2014-06-12/64128467.PDF
2014-06-12,顺鑫农业：关于非公开发行股票股东权益变动的提示性公告,finalpage/2014-06-12/64128468.PDF
2014-06-25,顺鑫农业：2014年半年度业绩预告,finalpage/2014-06-25/1200004259.PDF
2014-06-28,顺鑫农业：2014年第一次临时股东大会会议议程,finalpage/2014-06-28/1200013206.PDF
2014-06-28,顺鑫农业：中德证券有限责任公司关于公司以非公开发行股票募集资金置换预先投入募集资金投资项目自筹资金事项的核查意见,finalpage/2014-06-28/1200013207.PDF
2014-06-28,顺鑫农业：以自筹资金预先投入募集资金用途情况报告及鉴证报告,finalpage/2014-06-28/1200013208.PDF
2014-06-28,顺鑫农业：关于使用募集资金置换预先已投入募投项目的自筹资金的公告,finalpage/2014-06-28/1200013209.PDF
2014-06-28,顺鑫农业：关于提请召开2014年第一次临时股东大会的通知,finalpage/2014-06-28/1200013210.PDF
2014-06-28,顺鑫农业：公司章程（2014年6月）,finalpage/2014-06-28/1200013211.PDF
2014-06-28,顺鑫农业：独立董事关于公司使用募集资金置换预先已投入募投项目的自筹资金的独立意见,finalpage/2014-06-28/1200013212.PDF
2014-06-28,顺鑫农业：监事会关于公司使用募集资金置换预先已投入募投项目的自筹资金的意见,finalpage/2014-06-28/1200013213.PDF
2014-06-28,顺鑫农业：第六届监事会第四次会议决议公告,finalpage/2014-06-28/1200013214.PDF
2014-06-28,顺鑫农业：第六届董事会第十次会议决议公告,finalpage/2014-06-28/1200013215.PDF
2014-06-28,顺鑫农业：股东大会议事规则（2014年6月）,finalpage/2014-06-28/1200013216.PDF
2014-07-11,顺鑫农业：关于召开2014年第一次临时股东大会的提示性公告,finalpage/2014-07-11/1200045619.PDF
