date,title,url
2013-08-17,中国海诚：关于调整公司股权激励计划股票期权行权价格的公告,finalpage/2013-08-17/62953237.PDF
2013-08-17,中国海诚：关于长沙子公司与关联企业进行关联交易的公告,finalpage/2013-08-17/62953240.PDF
2013-08-17,中国海诚：2013年半年度报告摘要,finalpage/2013-08-17/62953241.PDF
2013-08-17,中国海诚：2013年半年度报告,finalpage/2013-08-17/62953254.PDF
2013-08-17,中国海诚：2013年半年度财务报告,finalpage/2013-08-17/62953255.PDF
2013-08-17,中国海诚：第四届董事会第四次会议决议公告,finalpage/2013-08-17/62953256.PDF
2013-08-17,中国海诚：第四届监事会第四次会议决议公告,finalpage/2013-08-17/62953257.PDF
2013-08-17,中国海诚：独立董事关于相关事项的独立意见,finalpage/2013-08-17/62953258.PDF
2013-08-17,中国海诚：国浩律师（上海）事务所关于公司股票期权激励计划股票期权行权价格调整的法律意见书,finalpage/2013-08-17/62953259.PDF
2013-08-30,中国海诚：关于重大诉讼事项进展的公告,finalpage/2013-08-30/63019036.PDF
2013-10-25,中国海诚：2013年第三季度报告正文,finalpage/2013-10-25/63190395.PDF
2013-10-25,中国海诚：2013年第三季度报告全文,finalpage/2013-10-25/63190397.PDF
2013-10-25,中国海诚：第四届董事会第五次会议决议公告,finalpage/2013-10-25/63190399.PDF
2013-10-25,中国海诚：独立董事关于变更财务审计机构的独立意见,finalpage/2013-10-25/63190400.PDF
2013-10-25,中国海诚：关于变更财务审计机构的公告,finalpage/2013-10-25/63191870.PDF
2013-11-29,中国海诚：第四届董事会第六次会议决议公告,finalpage/2013-11-29/63314359.PDF
2013-12-12,中国海诚：停牌公告,finalpage/2013-12-12/63368678.PDF
2013-12-13,中国海诚：第四届董事会第七次会议决议公告,finalpage/2013-12-13/63372740.PDF
2013-12-13,中国海诚：第四届监事会第六次会议决议公告,finalpage/2013-12-13/63372741.PDF
2013-12-13,中国海诚：首期第二批股票期权激励计划（草案）摘要,finalpage/2013-12-13/63372742.PDF
2013-12-13,中国海诚：关于子公司与关联企业签订补充经营合同的公告,finalpage/2013-12-13/63372743.PDF
2013-12-13,中国海诚：首期第二批股票期权激励计划（草案）,finalpage/2013-12-13/63372744.PDF
2013-12-13,中国海诚：国浩律师（上海）事务所关于公司首期第二批股票期权激励计划（草案）的法律意见书,finalpage/2013-12-13/63372745.PDF
2013-12-13,中国海诚：独立董事关于相关事项的独立意见,finalpage/2013-12-13/63372746.PDF
2013-12-13,中国海诚：首期股权激励计划第二批激励对象名单,finalpage/2013-12-13/63372747.PDF
2014-01-22,中国海诚：关于首期第二批股票期权激励计划（草案）获得国务院国资委批复的公告,finalpage/2014-01-22/63509058.PDF
2014-02-15,中国海诚：关于公司及相关方承诺履行情况的公告,finalpage/2014-02-15/63572855.PDF
2014-02-15,中国海诚：关于首期第二批股票期权激励计划（草案）获得中国证监会备案无异议的公告,finalpage/2014-02-15/63575239.PDF
2014-02-15,中国海诚：关于召开2014年第一次临时股东大会的通知,finalpage/2014-02-15/63575240.PDF
2014-02-15,中国海诚：独立董事征集投票权报告书,finalpage/2014-02-15/63575241.PDF
2014-02-19,中国海诚：第四届董事会第八次会议决议公告,finalpage/2014-02-19/63585259.PDF
2014-02-19,中国海诚：关于开展外汇套期保值业务的公告,finalpage/2014-02-19/63585260.PDF
2014-02-19,中国海诚：2013年度业绩快报,finalpage/2014-02-19/63585261.PDF
2014-02-26,中国海诚：关于签订重大经营合同的公告,finalpage/2014-02-26/63606478.PDF
2014-03-04,中国海诚：2014年第一次临时股东大会决议公告,finalpage/2014-03-04/63631876.PDF
2014-03-04,中国海诚：2014年第一次（临时）股东大会的法律意见书,finalpage/2014-03-04/63631877.PDF
2014-03-05,中国海诚：第四届董事会第九次会议决议公告,finalpage/2014-03-05/63638050.PDF
2014-03-05,中国海诚：第四届监事会第七次会议决议公告,finalpage/2014-03-05/63638051.PDF
2014-03-05,中国海诚：关于首期第二批股票期权激励计划授予事项的公告,finalpage/2014-03-05/63638052.PDF
2014-03-05,中国海诚：国浩律师（上海）事务所关于公司首期第二批股票期权激励计划授予股票期权的法律意见书,finalpage/2014-03-05/63638053.PDF
2014-03-05,中国海诚：独立董事关于公司首期第二批股票期权激励计划授予事项的独立意见,finalpage/2014-03-05/63638054.PDF
2014-03-05,中国海诚：首期股权激励计划第二批激励对象名单,finalpage/2014-03-05/63638055.PDF
2014-04-03,中国海诚：关于首期第二批股票期权授予登记完成的公告,finalpage/2014-04-03/63780427.PDF
2014-04-03,中国海诚：首期股权激励计划第二批激励对象名单,finalpage/2014-04-03/63780430.PDF
2014-04-26,中国海诚：2014年度日常关联交易公告,finalpage/2014-04-26/63926766.PDF
2014-04-26,中国海诚：关于全资子公司与关联企业签订关联交易合同的公告,finalpage/2014-04-26/63926767.PDF
2014-04-26,中国海诚：关于举行2013年度报告网上说明会的公告,finalpage/2014-04-26/63926768.PDF
2014-04-26,中国海诚：关于董事长及监事离任的公告,finalpage/2014-04-26/63926769.PDF
2014-04-26,中国海诚：2013年年度报告摘要,finalpage/2014-04-26/63926770.PDF
2014-04-26,中国海诚：2013年年度报告,finalpage/2014-04-26/63926771.PDF
2014-04-26,中国海诚：2013年年度审计报告,finalpage/2014-04-26/63926775.PDF
2014-04-26,中国海诚：第四届董事会第十次会议决议公告,finalpage/2014-04-26/63926779.PDF
2014-04-26,中国海诚：关于召开2013年度股东大会的通知公告,finalpage/2014-04-26/63926780.PDF
2014-04-26,中国海诚：第四届监事会第八次会议决议公告,finalpage/2014-04-26/63926781.PDF
2014-04-26,中国海诚：关于公司关联方占用上市公司资金情况的专项审核报告,finalpage/2014-04-26/63926782.PDF
2014-04-26,中国海诚：2013年度内部控制评价报告,finalpage/2014-04-26/63926786.PDF
2014-04-26,中国海诚：内部控制鉴证报告,finalpage/2014-04-26/63926787.PDF
2014-04-26,中国海诚：独立董事相关事项独立意见,finalpage/2014-04-26/63926788.PDF
2014-04-26,中国海诚：独立董事2013年度述职报告,finalpage/2014-04-26/63926789.PDF
2014-04-26,中国海诚：2014年第一季度报告正文,finalpage/2014-04-26/63926790.PDF
2014-04-26,中国海诚：2014年第一季度报告全文,finalpage/2014-04-26/63926791.PDF
2014-04-26,中国海诚：内部控制规则落实自查表,finalpage/2014-04-26/63926793.PDF
2014-05-06,中国海诚：第四届董事会第十一次会议决议公告,finalpage/2014-05-06/63973259.PDF
2014-05-06,中国海诚：第四届监事会第九次会议决议公告,finalpage/2014-05-06/63973260.PDF
2014-05-06,中国海诚：关于调整公司首期第一批股票期权激励计划激励对象名单和期权数量的公告,finalpage/2014-05-06/63973261.PDF
2014-05-06,中国海诚：关于公司首期第一批股票期权激励计划第一个行权期达到行权条件的公告,finalpage/2014-05-06/63973262.PDF
2014-05-06,中国海诚：国浩律师（上海）事务所关于公司首期第一批股票期权激励计划激励对象名单和期权数量调整及第一个行权期符合行权条件的法律意见书,finalpage/2014-05-06/63973263.PDF
2014-05-06,中国海诚：独立董事关于公司《首期第一批股票期权激励计划》第一个行权期行权事项的独立意见,finalpage/2014-05-06/63973264.PDF
2014-05-06,中国海诚：首期第一批股票期权激励计划激励对象名单,finalpage/2014-05-06/63973265.PDF
2014-05-10,中国海诚：关于首期第一批股票期权激励计划第一个行权期采取自主行权模式的公告,finalpage/2014-05-10/64006608.PDF
2014-05-17,中国海诚：2013年度股东大会决议公告,finalpage/2014-05-17/64035278.PDF
2014-05-17,中国海诚：2013年度股东大会的法律意见书,finalpage/2014-05-17/64035280.PDF
2014-06-12,中国海诚：关于董事、高级管理人员行权的公告,finalpage/2014-06-12/64127889.PDF
2014-06-20,中国海诚：2013年度权益分派实施公告,finalpage/2014-06-20/64155782.PDF
2014-06-27,中国海诚：第四届董事会第十二次会议决议公告,finalpage/2014-06-27/1200010156.PDF
2014-06-27,中国海诚：第四届监事会第十次会议决议公告,finalpage/2014-06-27/1200010157.PDF
2014-06-27,中国海诚：关于调整股票期权激励计划期权数量和行权价格的公告,finalpage/2014-06-27/1200010158.PDF
2014-06-27,中国海诚：国浩律师（上海）事务所关于公司股票期权激励计划股票期权数量和行权价格调整的法律意见书,finalpage/2014-06-27/1200010159.PDF
2014-07-22,中国海诚：关于全资子公司签订重大经营合同的公告,finalpage/2014-07-22/1200068598.PDF
2014-07-30,中国海诚：2014年半年度业绩快报,finalpage/2014-07-30/1200086480.PDF
2014-08-14,中国海诚：2014年半年度报告摘要,finalpage/2014-08-14/1200124849.PDF
2014-08-14,中国海诚：2014年半年度报告,finalpage/2014-08-14/1200124850.PDF
2014-08-14,中国海诚：2014年半年度财务报告,finalpage/2014-08-14/1200124851.PDF
2014-08-14,中国海诚：独立董事相关事项独立意见,finalpage/2014-08-14/1200124852.PDF
2014-09-02,中国海诚：第四届董事会第十四次会议决议公告,finalpage/2014-09-02/1200196021.PDF
2014-09-02,中国海诚：第四届监事会第十二次会议决议公告,finalpage/2014-09-02/1200196022.PDF
2014-09-02,中国海诚：关于武汉子公司与关联企业签订补充经营合同的公告,finalpage/2014-09-02/1200196023.PDF
2014-09-02,中国海诚：关于召开2014年第二次临时股东大会的通知,finalpage/2014-09-02/1200196024.PDF
2014-09-02,中国海诚：公司章程（2014年9月）,finalpage/2014-09-02/1200196025.PDF
2014-09-02,中国海诚：独立董事相关事项独立意见,finalpage/2014-09-02/1200196026.PDF
2014-09-02,中国海诚：第四届董事会董事、第四届监事会监事候选人简历,finalpage/2014-09-02/1200196319.PDF
2014-09-18,中国海诚：2014年第二次临时股东大会决议公告,finalpage/2014-09-18/1200243607.PDF
2014-09-18,中国海诚：2014年第二次临时股东大会的法律意见书,finalpage/2014-09-18/1200243608.PDF
2014-09-18,中国海诚：公司章程（2014年9月）,finalpage/2014-09-18/1200243609.PDF
2014-10-24,中国海诚：关于中轻建设子公司与关联企业签订经营合同的公告,finalpage/2014-10-24/1200323847.PDF
2014-10-24,中国海诚：2014年第三季度报告正文,finalpage/2014-10-24/1200323848.PDF
2014-10-24,中国海诚：2014年第三季度报告全文,finalpage/2014-10-24/1200323849.PDF
2014-10-24,中国海诚：第四届董事会第十五次会议决议公告,finalpage/2014-10-24/1200323850.PDF
2014-10-24,中国海诚：独立董事相关事项独立意见,finalpage/2014-10-24/1200323851.PDF
2014-11-04,中国海诚：关于全资子公司仲裁事项公告,finalpage/2014-11-04/1200366604.PDF
2014-12-25,中国海诚：第四届董事会第十六次会议决议公告,finalpage/2014-12-25/1200492804.PDF
2014-12-25,中国海诚：关于使用自有资金购买银行理财产品的公告,finalpage/2014-12-25/1200492805.PDF
2014-12-25,中国海诚：关于全资子公司与关联企业签订关联交易合同的公告,finalpage/2014-12-25/1200492806.PDF
2014-12-25,中国海诚：关于副总裁辞职的公告,finalpage/2014-12-25/1200492807.PDF
2014-12-25,中国海诚：独立董事相关事项独立意见,finalpage/2014-12-25/1200492808.PDF
2015-01-19,中国海诚：2014年度业绩快报,finalpage/2015-01-19/1200551063.PDF
2015-03-04,中国海诚：第四届董事会第十七次会议决议公告,finalpage/2015-03-04/1200665827.PDF
2015-03-04,中国海诚：关于长沙子公司与关联企业签订关联交易合同的公告,finalpage/2015-03-04/1200665828.PDF
2015-03-04,中国海诚：独立董事相关事项独立意见,finalpage/2015-03-04/1200665829.PDF
2015-03-12,中国海诚：关于武汉子公司竞得土地使用权的公告,finalpage/2015-03-12/1200690579.PDF
2015-04-18,中国海诚：关于举行2014年度报告网上说明会的公告,finalpage/2015-04-18/1200862133.PDF
2015-04-18,中国海诚：2015年度日常关联交易公告,finalpage/2015-04-18/1200862134.PDF
2015-04-18,中国海诚：关于执行新会计准则并变更会计政策的公告,finalpage/2015-04-18/1200862135.PDF
2015-04-18,中国海诚：2014年年度报告摘要,finalpage/2015-04-18/1200862136.PDF
2015-04-18,中国海诚：2014年年度报告,finalpage/2015-04-18/1200862137.PDF
2015-04-18,中国海诚：2014年年度审计报告,finalpage/2015-04-18/1200862138.PDF
2015-04-18,中国海诚：第四届董事会第十八次会议决议公告,finalpage/2015-04-18/1200862139.PDF
2015-04-18,中国海诚：关于召开2014年度股东大会的通知,finalpage/2015-04-18/1200862140.PDF
2015-04-18,中国海诚：第四届监事会第十四次会议决议公告,finalpage/2015-04-18/1200862141.PDF
2015-04-18,中国海诚：关于公司关联方占用上市公司资金情况的专项审核报告,finalpage/2015-04-18/1200862142.PDF
2015-04-18,中国海诚：2014年度内部控制评价报告,finalpage/2015-04-18/1200862143.PDF
2015-04-18,中国海诚：独立董事相关事项独立意见,finalpage/2015-04-18/1200862144.PDF
2015-04-18,中国海诚：独立董事2014年度述职报告,finalpage/2015-04-18/1200862145.PDF
2015-04-18,中国海诚：2015年第一季度报告正文,finalpage/2015-04-18/1200862146.PDF
2015-04-18,中国海诚：2015年第一季度报告全文,finalpage/2015-04-18/1200862147.PDF
2015-04-18,中国海诚：内部控制规则落实自查表,finalpage/2015-04-18/1200862148.PDF
2015-04-23,中国海诚：重大事项停牌公告,finalpage/2015-04-23/1200890330.PDF
2015-04-30,中国海诚：重大事项继续停牌公告,finalpage/2015-04-30/1200943812.PDF
2015-05-08,中国海诚：重大事项继续停牌公告,finalpage/2015-05-08/1200978349.PDF
2015-05-09,中国海诚：2014年度股东大会决议公告,finalpage/2015-05-09/1200985555.PDF
2015-05-09,中国海诚：2014年度股东大会的法律意见书,finalpage/2015-05-09/1200985772.PDF
2015-05-15,中国海诚：重大事项继续停牌公告,finalpage/2015-05-15/1201014988.PDF
2015-05-22,中国海诚：重大事项继续停牌公告,finalpage/2015-05-22/1201044846.PDF
2015-05-29,中国海诚：重大事项继续停牌公告,finalpage/2015-05-29/1201077143.PDF
2015-06-05,中国海诚：重大事项继续停牌公告,finalpage/2015-06-05/1201106080.PDF
2015-06-05,中国海诚：2014年度权益分派实施公告,finalpage/2015-06-05/1201106081.PDF
2015-06-12,中国海诚：重大事项继续停牌公告,finalpage/2015-06-12/1201138690.PDF
2015-06-13,中国海诚：第四届董事会第十九次会议决议公告,finalpage/2015-06-13/1201144307.PDF
2015-06-13,中国海诚：第四届监事会第十五次会议决议公告,finalpage/2015-06-13/1201144308.PDF
2015-06-13,中国海诚：关于调整公司股票期权激励计划激励对象名单、期权数量和行权价格的公告,finalpage/2015-06-13/1201144309.PDF
2015-06-13,中国海诚：关于公司首期第一批股票期权激励计划第二个行权期达到行权条件的公告,finalpage/2015-06-13/1201144310.PDF
2015-06-13,中国海诚：关于为全资子公司向银行申请综合授信额度提供担保的公告,finalpage/2015-06-13/1201144311.PDF
2015-06-13,中国海诚：关于召开2015年第一次临时股东大会的通知,finalpage/2015-06-13/1201144312.PDF
2015-06-13,中国海诚：国浩律师（（上海））事务所关于公司首期股票期权激励计划激励对象名单和期权数量、价格调整及第二个行权期符合行权条件的法律意见书,finalpage/2015-06-13/1201144313.PDF
2015-06-13,中国海诚：独立董事关于公司《首期第一批股票期权激励计划》第二个行权期行权事项的独立意见,finalpage/2015-06-13/1201144314.PDF
2015-06-13,中国海诚：首期第一批股票期权激励计划第二个行权期激励对象名单,finalpage/2015-06-13/1201144315.PDF
2015-06-19,中国海诚：重大事项继续停牌公告,finalpage/2015-06-19/1201168595.PDF
2015-06-26,中国海诚：关于首期第一批股票期权激励计划第二个行权期采取自主行权模式的公告,finalpage/2015-06-26/1201196241.PDF
2015-06-29,中国海诚：重大事项继续停牌公告,finalpage/2015-06-29/1201200832.PDF
2015-06-30,中国海诚：2015年第一次临时股东大会决议公告,finalpage/2015-06-30/1201212287.PDF
2015-06-30,中国海诚：关于副总裁辞职的公告,finalpage/2015-06-30/1201212288.PDF
2015-06-30,中国海诚：2015年第一次临时股东大会的法律意见书,finalpage/2015-06-30/1201212289.PDF
2015-07-03,中国海诚：关于非公开发行股票继续停牌的公告,finalpage/2015-07-03/1201229759.PDF
2015-07-10,中国海诚：关于非公开发行股票继续停牌的公告,finalpage/2015-07-10/1201266966.PDF
2015-07-16,中国海诚：2015年半年度业绩快报,finalpage/2015-07-16/1201299103.PDF
2015-07-17,中国海诚：关于非公开发行股票继续停牌的公告,finalpage/2015-07-17/1201304144.PDF
2015-07-24,中国海诚：关于披露非公开发行股票预案暨股票复牌的公告,finalpage/2015-07-24/1201337949.PDF
2015-07-24,中国海诚：第四届董事会第二十次会议决议公告,finalpage/2015-07-24/1201337950.PDF
2015-07-24,中国海诚：第四届监事会第十六次会议决议公告,finalpage/2015-07-24/1201337951.PDF
2015-07-24,中国海诚：2015年度非公开发行A股股票预案,finalpage/2015-07-24/1201337952.PDF
2015-07-24,中国海诚：关于前次募集资金使用情况的报告,finalpage/2015-07-24/1201337953.PDF
2015-07-24,中国海诚：2015年度非公开发行股票募集资金运用可行性分析报告,finalpage/2015-07-24/1201337954.PDF
2015-07-24,中国海诚：关于与认购对象签署附生效条件股份认购协议的公告,finalpage/2015-07-24/1201337955.PDF
2015-07-24,中国海诚：关于本次非公开发行股票涉及关联交易事项的公告,finalpage/2015-07-24/1201337956.PDF
2015-07-24,中国海诚：全面风险管理办法（2015年7月）,finalpage/2015-07-24/1201337957.PDF
2015-07-24,中国海诚：内部控制评价办法（2015年7月）,finalpage/2015-07-24/1201337958.PDF
2015-07-24,中国海诚：未来三年（2015年—2017年）股东回报规划,finalpage/2015-07-24/1201337959.PDF
2015-07-24,中国海诚：独立董事关于公司非公开发行股票相关事项的独立意见,finalpage/2015-07-24/1201337960.PDF
2015-08-15,中国海诚：2015年半年度报告摘要,finalpage/2015-08-15/1201438031.PDF
2015-08-15,中国海诚：2015年半年度报告,finalpage/2015-08-15/1201438032.PDF
2015-08-15,中国海诚：2015年半年度财务报告,finalpage/2015-08-15/1201438033.PDF
2015-08-15,中国海诚：独立董事相关事项独立意见,finalpage/2015-08-15/1201438034.PDF
2015-08-17,中国海诚：股价异动公告,finalpage/2015-08-17/1201439331.PDF
2015-09-18,中国海诚：重大诉讼进展公告,finalpage/2015-09-18/1201609072.PDF
2015-10-12,中国海诚：关于签订重大经营协议的公告,finalpage/2015-10-12/1201680956.PDF
2015-10-20,中国海诚：第四届董事会第二十二次会议决议公告,finalpage/2015-10-20/1201708233.PDF
2015-10-20,中国海诚：关于中轻建设子公司与关联企业签订分包合同的公告,finalpage/2015-10-20/1201708234.PDF
2015-10-20,中国海诚：独立董事相关事项独立意见,finalpage/2015-10-20/1201708235.PDF
2015-10-20,中国海诚：2015年第三季度报告正文,finalpage/2015-10-20/1201708236.PDF
2015-10-20,中国海诚：2015年第三季度报告全文,finalpage/2015-10-20/1201708237.PDF
2015-12-04,中国海诚：关于副总裁辞职的公告,finalpage/2015-12-04/1201804404.PDF
2016-01-08,中国海诚：关于全资子公司申请变更仲裁请求的公告,finalpage/2016-01-08/1201900629.PDF
2016-01-27,中国海诚：2015年度业绩快报,finalpage/2016-01-27/1201943076.PDF
2016-03-18,中国海诚：关于全资子公司仲裁事项收到仲裁调解书的公告,finalpage/2016-03-18/1202054890.PDF
2016-03-28,中国海诚：关于全资子公司签订重大经营协议的公告,finalpage/2016-03-28/1202085956.PDF
2016-04-11,中国海诚：关于全资子公司签订重大经营合同的公告,finalpage/2016-04-11/1202161198.PDF
2016-04-13,中国海诚：2015年年度报告摘要,finalpage/2016-04-13/1202169689.PDF
2016-04-13,中国海诚：2015年年度报告,finalpage/2016-04-13/1202169690.PDF
2016-04-13,中国海诚：第四届董事会第二十三次会议决议公告,finalpage/2016-04-13/1202169691.PDF
2016-04-13,中国海诚：第四届监事会第十九次会议决议公告,finalpage/2016-04-13/1202169692.PDF
2016-04-13,中国海诚：2015年度内部控制评价报告,finalpage/2016-04-13/1202169693.PDF
2016-04-13,中国海诚：2016年第一季度报告正文,finalpage/2016-04-13/1202169694.PDF
2016-04-13,中国海诚：2016年第一季度报告全文,finalpage/2016-04-13/1202169695.PDF
2016-04-13,中国海诚：关于调整非公开发行A股股票方案的公告,finalpage/2016-04-13/1202169696.PDF
2016-04-13,中国海诚：2015年度非公开发行A股股票预案（修订稿）,finalpage/2016-04-13/1202169697.PDF
2016-04-13,中国海诚：关于2015年度非公开发行A股股票预案（修订稿）修订差异情况的公告,finalpage/2016-04-13/1202169698.PDF
2016-04-13,中国海诚：2015年度非公开发行股票募集资金运用可行性分析报告（修订稿）,finalpage/2016-04-13/1202169699.PDF
2016-04-13,中国海诚：关于非公开发行股票摊薄即期回报及填补回报措施的公告,finalpage/2016-04-13/1202169700.PDF
2016-04-13,中国海诚：关于非公开发行股票涉及关联交易事项的公告,finalpage/2016-04-13/1202169701.PDF
2016-04-13,中国海诚：2016年度日常关联交易公告,finalpage/2016-04-13/1202169702.PDF
2016-04-13,中国海诚：关于设立投资公司的公告,finalpage/2016-04-13/1202169703.PDF
2016-04-13,中国海诚：关于为中轻集团提供反担保的公告,finalpage/2016-04-13/1202169704.PDF
2016-04-13,中国海诚：关于公司与关联企业签订关联交易合同的公告,finalpage/2016-04-13/1202169705.PDF
2016-04-13,中国海诚：关于举行2015年度报告网上说明会的公告,finalpage/2016-04-13/1202169706.PDF
2016-04-13,中国海诚：独立董事相关事项独立意见,finalpage/2016-04-13/1202169707.PDF
2016-04-13,中国海诚：长沙长泰智能装备有限公司2013年度、2014年度及2015年1-10月审计报告,finalpage/2016-04-13/1202169708.PDF
2016-04-13,中国海诚：企业价值评估报告书,finalpage/2016-04-13/1202169709.PDF
2016-04-13,中国海诚：内部控制规则落实自查表,finalpage/2016-04-13/1202169710.PDF
2016-04-13,中国海诚：2015年年度审计报告,finalpage/2016-04-13/1202169711.PDF
2016-04-13,中国海诚：关于公司非经营性资金占用及其他关联资金往来情况汇总表的专项审核报告,finalpage/2016-04-13/1202169712.PDF
2016-04-13,中国海诚：内部控制鉴证报告,finalpage/2016-04-13/1202169713.PDF
2016-04-13,中国海诚：独立董事2015年度述职报告,finalpage/2016-04-13/1202169714.PDF
2016-05-12,中国海诚：第四届董事会第二十四次会议决议公告,finalpage/2016-05-12/1202316527.PDF
2016-05-12,中国海诚：第四届监事会第二十次会议决议公告,finalpage/2016-05-12/1202316528.PDF
2016-05-12,中国海诚：关于调整公司股票期权激励计划激励对象名单、期权数量的公告,finalpage/2016-05-12/1202316529.PDF
2016-05-12,中国海诚：关于公司股票期权激励计划第一批第三个行权期及第二批第一个行权期达到行权条件的公告,finalpage/2016-05-12/1202316530.PDF
2016-05-12,中国海诚：关于为北京公司向银行申请综合授信额度提供担保的公告,finalpage/2016-05-12/1202316531.PDF
2016-05-12,中国海诚：独立董事关于公司股票期权激励计划第一批第三个行权期及第二批第一个行权期行权事项的独立意见,finalpage/2016-05-12/1202316532.PDF
2016-05-12,中国海诚：国浩律师（上海）事务所关于公司首期股票期权激励计划激励对象名单和期权数量调整及第一批第三个行权期、第二批第一个行权期符合行权条件的法律意见书,finalpage/2016-05-12/1202316533.PDF
2016-05-12,中国海诚：首期第一批股票期权激励计划第三个行权期激励对象名单,finalpage/2016-05-12/1202316534.PDF
2016-05-12,中国海诚：首期第二批股票期权激励计划第一个行权期激励对象名单,finalpage/2016-05-12/1202316535.PDF
2016-05-20,中国海诚：关于公司与青岛三利集团有限公司诉讼事项的公告,finalpage/2016-05-20/1202330219.PDF
2016-05-20,中国海诚：关于公司首期第一批股票期权激励计划第三个行权期采取自主行权模式的公告,finalpage/2016-05-20/1202330465.PDF
2016-05-20,中国海诚：关于公司首期第二批股票期权激励计划第一个行权期采取自主行权模式的公告,finalpage/2016-05-20/1202330466.PDF
2016-05-27,中国海诚：关于非公开发行A股股票事项获得国务院国资委批复的公告,finalpage/2016-05-27/1202340545.PDF
