,date,title,url
450,2012-08-25,东港股份：2012年半年度报告摘要,finalpage/2012-08-25/61478548.PDF
451,2012-08-25,东港股份：2012年半年度报告,finalpage/2012-08-25/61478551.PDF
452,2012-08-25,东港股份：2012年半年度财务会计报告,finalpage/2012-08-25/61478552.PDF
453,2012-08-25,东港股份：第三届董事会第二十六次会议公告,finalpage/2012-08-25/61478553.PDF
454,2012-08-25,东港股份：第三届监事会第十九次会议决议公告,finalpage/2012-08-25/61478554.PDF
455,2012-08-25,东港股份：独立董事关于第三届董事会第二十六次会议相关事项的独立意见,finalpage/2012-08-25/61478555.PDF
456,2012-08-25,东港股份：东方证券股份有限公司关于公司公开增发募集资金投资项目增加实施地点的保荐意见,finalpage/2012-08-25/61478557.PDF
457,2012-08-25,东港股份：东方证券股份有限公司关于公司使用部分闲置募集资金暂时补充流动资金事项的保荐意见,finalpage/2012-08-25/61478558.PDF
458,2012-08-25,东港股份：独立董事候选人声明（刘洪渭）,finalpage/2012-08-25/61478559.PDF
459,2012-08-25,东港股份：独立董事候选人声明（刘素英）,finalpage/2012-08-25/61478560.PDF
460,2012-08-25,东港股份：独立董事候选人声明（郑钢）,finalpage/2012-08-25/61478561.PDF
461,2012-08-29,东港股份：关于获得万事达卡全球供应商认证资格的公告,finalpage/2012-08-29/61497556.PDF
462,2012-08-31,东港股份：关于选举职工代表监事的公告,finalpage/2012-08-31/61510573.PDF
463,2012-09-08,东港股份：关于控股股东减持股份的公告,finalpage/2012-09-08/61546369.PDF
464,2012-09-14,东港股份：关于公司实际控制人变更的提示性公告,finalpage/2012-09-14/61568080.PDF
465,2012-09-14,东港股份：东方证券股份有限公司关于公司详式权益变动报告书之财务顾问核查意见,finalpage/2012-09-14/61568081.PDF
466,2012-09-14,东港股份：详式权益变动报告书,finalpage/2012-09-14/61568082.PDF
467,2012-09-15,东港股份：关于召开2012年第一次临时股东大会的提示性公告,finalpage/2012-09-15/61571838.PDF
468,2012-09-15,东港股份：简式权益变动报告书,finalpage/2012-09-15/61571839.PDF
469,2012-09-19,东港股份：2012年第一次临时股东大会决议公告,finalpage/2012-09-19/61584321.PDF
470,2012-09-19,东港股份：2012年第一次临时股东大会的法律意见书,finalpage/2012-09-19/61584322.PDF
471,2012-09-20,东港股份：第四届董事会第一次会议公告,finalpage/2012-09-20/61587866.PDF
472,2012-09-20,东港股份：第四届监事会第一次会议公告,finalpage/2012-09-20/61587867.PDF
473,2012-09-20,东港股份：独立董事对第四届董事会第一次会议相关事项的独立意见,finalpage/2012-09-20/61587868.PDF
474,2012-10-24,东港股份：2012年第三季度报告正文,finalpage/2012-10-24/61693049.PDF
475,2012-10-24,东港股份：2012年第三季度报告全文,finalpage/2012-10-24/61693050.PDF
476,2012-10-30,东港股份：第四届董事会第三次会议公告,finalpage/2012-10-30/61731233.PDF
477,2012-10-30,东港股份：第四届监事会第三次会议公告,finalpage/2012-10-30/61731234.PDF
478,2012-10-30,东港股份：关于回购注销已离职股权激励对象所持已获授但尚未解锁的限制性股票的公告,finalpage/2012-10-30/61731235.PDF
479,2012-10-30,东港股份：关于召开2012年第二次临时股东大会的通知,finalpage/2012-10-30/61731236.PDF
480,2012-10-30,东港股份：减资公告,finalpage/2012-10-30/61731237.PDF
481,2012-10-30,东港股份：江苏泰和律师事务所关于公司2011年限制性股票激励计划之限制性股票第一次解锁及部分回购注销相关事项的法律意见书,finalpage/2012-10-30/61731238.PDF
482,2012-10-30,东港股份：独立董事关于第四届董事会第三次会议相关事项的独立意见,finalpage/2012-10-30/61731239.PDF
483,2012-10-31,东港股份：关于公司及相关主体承诺履行情况的公告,finalpage/2012-10-31/61738018.PDF
484,2012-11-02,东港股份：关于限制性股票第一次解锁股份上市流通提示性公告,finalpage/2012-11-02/61751757.PDF
485,2012-11-17,东港股份：第四届董事会第四次会议公告,finalpage/2012-11-17/61808674.PDF
486,2012-11-17,东港股份：关于召开2012年第二次临时股东大会的补充通知,finalpage/2012-11-17/61808675.PDF
487,2012-11-17,东港股份：关于归还暂时用于补充流动资金的闲置募集资金的公告,finalpage/2012-11-17/61808676.PDF
488,2012-11-24,东港股份：关于提前归还暂时用于补充流动资金的闲置募集资金的公告,finalpage/2012-11-24/61831697.PDF
489,2012-11-24,东港股份：关于召开2012年第二次临时股东大会的提示性公告,finalpage/2012-11-24/61831698.PDF
490,2012-11-28,东港股份：2012年第二次临时股东大会决议公告,finalpage/2012-11-28/61843746.PDF
491,2012-11-28,东港股份：2012年第二次临时股东大会的法律意见书,finalpage/2012-11-28/61843747.PDF
492,2012-11-29,东港股份：投资理财管理制度（2012年11月）,finalpage/2012-11-29/61847455.PDF
493,2012-11-29,东港股份：第四届董事会第五次会议公告,finalpage/2012-11-29/61847456.PDF
494,2012-11-29,东港股份：关于使用自有资金进行投资理财的公告,finalpage/2012-11-29/61847457.PDF
495,2012-11-29,东港股份：第四届监事会第四次会议公告,finalpage/2012-11-29/61847458.PDF
496,2012-11-29,东港股份：东方证券股份有限公司关于公司使用自有闲置资金进行投资理财的核查意见,finalpage/2012-11-29/61847459.PDF
497,2012-11-29,东港股份：独立董事关于公司使用自有资金进行投资理财的独立意见,finalpage/2012-11-29/61847460.PDF
498,2012-12-18,东港股份：关于购买理财产品的公告,finalpage/2012-12-18/61919148.PDF
499,2012-12-21,东港股份：第四届董事会第六次会议公告,finalpage/2012-12-21/61932444.PDF
500,2012-12-21,东港股份：第四届监事会第五次会议公告,finalpage/2012-12-21/61932445.PDF
501,2012-12-21,东港股份：东方证券股份有限公司关于公司变更部分募集资金专项账户的核查意见,finalpage/2012-12-21/61932446.PDF
502,2012-12-21,东港股份：独立董事关于变更募集资金专项账户的独立意见,finalpage/2012-12-21/61932447.PDF
503,2013-01-04,东港股份：关于购买理财产品的公告,finalpage/2013-01-04/61974697.PDF
504,2013-01-16,东港股份：关于部分已不符合激励条件的限制性股票回购注销完成的公告,finalpage/2013-01-16/62024340.PDF
505,2013-01-16,东港股份：江苏泰和律师事务所关于公司回购注销部分限制性股票而减少注册资本的法律意见书,finalpage/2013-01-16/62024341.PDF
506,2013-01-17,东港股份：关于购买理财产品的公告,finalpage/2013-01-17/62028810.PDF
507,2013-01-22,东港股份：关于变更募集资金专用账户并签订募集资金三方监管协议的公告,finalpage/2013-01-22/62048832.PDF
508,2013-02-04,东港股份：关于持续督导保荐机构和财务顾问变更的公告,finalpage/2013-02-04/62097042.PDF
509,2013-02-28,东港股份：关于举行2012年年度报告网上说明会的公告,finalpage/2013-02-28/62161961.PDF
510,2013-02-28,东港股份：关于变更部分募集资金投资项目内容并增加实施地点的公告,finalpage/2013-02-28/62161962.PDF
511,2013-02-28,东港股份：关于增加购买银行理财产品额度的公告,finalpage/2013-02-28/62161963.PDF
512,2013-02-28,东港股份：2012年年度报告摘要,finalpage/2013-02-28/62161965.PDF
513,2013-02-28,东港股份：2012年年度报告,finalpage/2013-02-28/62161970.PDF
514,2013-02-28,东港股份：2012年年度审计报告,finalpage/2013-02-28/62161983.PDF
515,2013-02-28,东港股份：第四届董事会第七次会议公告,finalpage/2013-02-28/62161985.PDF
516,2013-02-28,东港股份：关于召开2012年度股东大会的通知,finalpage/2013-02-28/62161986.PDF
517,2013-02-28,东港股份：第四届监事会第六次会议决议公告,finalpage/2013-02-28/62161987.PDF
518,2013-02-28,东港股份：关于公司关联方占用上市公司资金情况的专项审核报告,finalpage/2013-02-28/62161988.PDF
519,2013-02-28,东港股份：2012年度内部控制的自我评价报告,finalpage/2013-02-28/62161989.PDF
520,2013-02-28,东港股份：内部控制鉴证报告,finalpage/2013-02-28/62161991.PDF
521,2013-02-28,东港股份：关于募集资金年度存放与使用情况的专项报告,finalpage/2013-02-28/62161993.PDF
522,2013-02-28,东港股份：关于公司募集资金年度存放与实际使用情况的鉴证报告,finalpage/2013-02-28/62161994.PDF
523,2013-02-28,东港股份：独立董事对第四届董事会第七次会议相关议案的独立意见,finalpage/2013-02-28/62161995.PDF
524,2013-02-28,东港股份：独立董事刘素英2012年度述职报告等,finalpage/2013-02-28/62161996.PDF
525,2013-02-28,东港股份：东方花旗证券有限公司关于公司2012年度募集资金存放和使用情况的专项核查意见,finalpage/2013-02-28/62161997.PDF
526,2013-02-28,东港股份：东方花旗证券有限公司关于公司《2012年度内部控制的自我评价报告》的核查意见,finalpage/2013-02-28/62161998.PDF
527,2013-02-28,东港股份：东方花旗证券有限公司关于公司内部控制规则落实自查表的核查意见,finalpage/2013-02-28/62161999.PDF
528,2013-02-28,东港股份：东方花旗证券有限公司关于公司变更部分募集资金专用账户的核查意见,finalpage/2013-02-28/62162000.PDF
529,2013-02-28,东港股份：东方花旗证券有限公司关于公司变更部分募集资金投资项目内容并增加实施地点的核查意见,finalpage/2013-02-28/62162001.PDF
530,2013-02-28,东港股份：东方花旗证券有限公司关于公司增加购买银行理财产品额度的核查意见,finalpage/2013-02-28/62162002.PDF
531,2013-02-28,东港股份：内部控制规则落实自查表,finalpage/2013-02-28/62162003.PDF
532,2013-02-28,东港股份：监事会2012年度工作报告,finalpage/2013-02-28/62162004.PDF
533,2013-02-28,东港股份：董事会2012年度工作报告,finalpage/2013-02-28/62162005.PDF
534,2013-03-23,东港股份：2012年度股东大会决议公告,finalpage/2013-03-23/62254248.PDF
535,2013-03-23,东港股份：2012年年度股东大会的法律意见书,finalpage/2013-03-23/62254249.PDF
536,2013-03-27,东港股份：2012年度权益分派实施公告,finalpage/2013-03-27/62277865.PDF
537,2013-04-09,东港股份：关于变更募集资金专用账户并签订募集资金三方监管协议的公告,finalpage/2013-04-09/62334194.PDF
538,2013-04-20,东港股份：2013年第一季度报告正文,finalpage/2013-04-20/62389292.PDF
539,2013-04-20,东港股份：2013年第一季度报告全文,finalpage/2013-04-20/62389293.PDF
540,2013-05-23,东港股份：关于入选中国建设银行IC信用卡空白卡片采购供应商的公告,finalpage/2013-05-23/62515700.PDF
541,2013-05-24,东港股份：关于购买理财产品的公告,finalpage/2013-05-24/62521392.PDF
542,2013-06-04,东港股份：关于购买理财产品的公告,finalpage/2013-06-04/62552444.PDF
543,2013-06-08,东港股份：关于职工代表监事辞职的公告,finalpage/2013-06-08/62569983.PDF
544,2013-06-14,东港股份：关于购买理财产品的公告,finalpage/2013-06-14/62578865.PDF
545,2013-06-29,东港股份：关于董事辞职的公告,finalpage/2013-06-29/62624923.PDF
546,2013-06-29,东港股份：第四届董事会第九次会议决议公告,finalpage/2013-06-29/62624926.PDF
547,2013-06-29,东港股份：关于召开2013年第一次临时股东大会的通知,finalpage/2013-06-29/62624927.PDF
548,2013-06-29,东港股份：第四届监事会第八次会议决议公告,finalpage/2013-06-29/62624928.PDF
549,2013-06-29,东港股份：监事会议事规则（2013年6月）,finalpage/2013-06-29/62624929.PDF
550,2013-06-29,东港股份：公司章程（2013年6月）,finalpage/2013-06-29/62624930.PDF
551,2013-06-29,东港股份：独立董事关于增补董事候选人意见,finalpage/2013-06-29/62624931.PDF
552,2013-07-04,东港股份：重大合同公告,finalpage/2013-07-04/62769805.PDF
553,2013-07-09,东港股份：关于公司聘任的2013年度审计机构合并及更名的公告,finalpage/2013-07-09/62814605.PDF
554,2013-07-11,东港股份：第四届董事会第十次会议决议公告,finalpage/2013-07-11/62823418.PDF
555,2013-07-11,东港股份：关于召开2013年第一次临时股东大会的补充通知,finalpage/2013-07-11/62823419.PDF
556,2013-07-11,东港股份：独立董事关于公司重新聘任2013年度审计机构的独立意见,finalpage/2013-07-11/62823420.PDF
557,2013-07-23,东港股份：2013年第一次临时股东大会决议公告,finalpage/2013-07-23/62860372.PDF
558,2013-07-23,东港股份：2013年第一次临时股东大会的法律意见书,finalpage/2013-07-23/62860373.PDF
559,2013-07-25,东港股份：关于选举职工代表监事的公告,finalpage/2013-07-25/62867038.PDF
560,2013-07-25,东港股份：第四届监事会第九次会议决议公告,finalpage/2013-07-25/62867039.PDF
561,2013-08-16,东港股份：关于购买理财产品的公告,finalpage/2013-08-16/62948754.PDF
562,2013-08-16,东港股份：2013年半年度报告摘要,finalpage/2013-08-16/62948755.PDF
563,2013-08-16,东港股份：2013年半年度报告,finalpage/2013-08-16/62948757.PDF
564,2013-08-16,东港股份：2013半年度财务报告,finalpage/2013-08-16/62948758.PDF
565,2013-08-16,东港股份：第四届董事会第十一次会议决议公告,finalpage/2013-08-16/62948760.PDF
566,2013-08-16,东港股份：独立董事关于控股股东及其他关联方占用资金及公司对外担保情况的独立意见,finalpage/2013-08-16/62948761.PDF
567,2013-08-16,东港股份：董事会关于2013年1-6月募集资金存放与实际使用情况的专项报告,finalpage/2013-08-16/62948762.PDF
568,2013-08-22,东港股份：关于购买理财产品的公告,finalpage/2013-08-22/62972740.PDF
569,2013-09-04,东港股份：关于购买理财产品的公告,finalpage/2013-09-04/63045541.PDF
570,2013-10-16,东港股份：关于中标交通银行“IC卡制卡外包”项目的公告,finalpage/2013-10-16/63159916.PDF
571,2013-10-18,东港股份：关于电子发票项目进展情况的公告,finalpage/2013-10-18/63166244.PDF
572,2013-10-26,东港股份：关于购买理财产品的公告,finalpage/2013-10-26/63197479.PDF
573,2013-10-26,东港股份：2013年第三季度报告正文,finalpage/2013-10-26/63197480.PDF
574,2013-10-26,东港股份：2013年第三季度报告全文,finalpage/2013-10-26/63197483.PDF
575,2013-10-30,东港股份：第四届董事会第十三次会议公告,finalpage/2013-10-30/63213924.PDF
576,2013-10-30,东港股份：第四届监事会第十二次会议公告,finalpage/2013-10-30/63213925.PDF
577,2013-10-30,东港股份：关于回购注销已离职股权激励对象所持已获授但尚未解锁的限制性股票的公告,finalpage/2013-10-30/63213929.PDF
578,2013-10-30,东港股份：减资公告,finalpage/2013-10-30/63213930.PDF
579,2013-10-30,东港股份：关于召开2013年第二次临时股东大会的通知,finalpage/2013-10-30/63213932.PDF
580,2013-10-30,东港股份：江苏泰和律师事务所关于公司限制性股票激励计划之限制性股票第二次解锁及部分回购注销相关事项的法律意见书,finalpage/2013-10-30/63213933.PDF
581,2013-10-30,东港股份：独立董事关于第四届董事会第十三次会议相关事项的独立意见,finalpage/2013-10-30/63213934.PDF
582,2013-11-04,东港股份：关于限制性股票第二次解锁股份上市流通提示性公告,finalpage/2013-11-04/63227504.PDF
583,2013-11-14,东港股份：关于召开2013年第二次临时股东大会的提示性公告,finalpage/2013-11-14/63264773.PDF
584,2013-11-19,东港股份：2013年第二次临时股东大会决议公告,finalpage/2013-11-19/63280143.PDF
585,2013-11-19,东港股份：2013年第二次临时股东大会的法律意见书,finalpage/2013-11-19/63280144.PDF
586,2013-11-26,东港股份：关于中标中信银行卡片制作与邮寄业务外包招标项目的公告,finalpage/2013-11-26/63303069.PDF
587,2013-12-03,东港股份：关于控股股东减持股份的公告,finalpage/2013-12-03/63327943.PDF
588,2013-12-04,东港股份：关于通过维萨卡组织资格认证的公告,finalpage/2013-12-04/63334508.PDF
589,2013-12-20,东港股份：关于购买理财产品的公告,finalpage/2013-12-20/63393418.PDF
590,2013-12-21,东港股份：第四届董事会第十四次会议公告,finalpage/2013-12-21/63397844.PDF
591,2013-12-21,东港股份：对外投资公告,finalpage/2013-12-21/63397845.PDF
592,2013-12-24,东港股份：关于电子发票项目进展情况的公告,finalpage/2013-12-24/63405806.PDF
593,2014-01-03,东港股份：关于入选中国工商银行全行磁条卡空白卡片项目采购供应商的公告,finalpage/2014-01-03/63444750.PDF
594,2014-01-15,东港股份：关于购买理财产品的公告,finalpage/2014-01-15/63484577.PDF
595,2014-01-16,东港股份：关于部分已不符合激励条件的限制性股票回购注销完成的公告,finalpage/2014-01-16/63489120.PDF
596,2014-01-16,东港股份：江苏泰和律师事务所关于公司回购注销部分限制性股票而减少注册资本的法律意见书,finalpage/2014-01-16/63489121.PDF
597,2014-02-11,东港股份：关于公司及承诺相关方承诺及履行工作的公告,finalpage/2014-02-11/63557658.PDF
598,2014-02-22,东港股份：2013年度业绩快报,finalpage/2014-02-22/63595546.PDF
599,2014-03-04,东港股份：关于为控股子公司申请银行授信提供担保的公告,finalpage/2014-03-04/63631330.PDF
600,2014-03-04,东港股份：关于举行2013年年度报告网上说明会的公告,finalpage/2014-03-04/63631331.PDF
601,2014-03-04,东港股份：关于利用自有资金购买理财产品的公告,finalpage/2014-03-04/63631332.PDF
602,2014-03-04,东港股份：2013年年度报告摘要,finalpage/2014-03-04/63631333.PDF
603,2014-03-04,东港股份：2013年年度报告,finalpage/2014-03-04/63631335.PDF
604,2014-03-04,东港股份：2013年年度审计报告,finalpage/2014-03-04/63631336.PDF
605,2014-03-04,东港股份：第四届董事会第十五次会议公告,finalpage/2014-03-04/63631337.PDF
606,2014-03-04,东港股份：关于召开2013年度股东大会的通知,finalpage/2014-03-04/63631338.PDF
607,2014-03-04,东港股份：第四届监事会第十三次会议决议公告,finalpage/2014-03-04/63631339.PDF
608,2014-03-04,东港股份：关于公司关联方占用上市公司资金情况的专项审核报告,finalpage/2014-03-04/63631340.PDF
609,2014-03-04,东港股份：2013年度内部控制评价报告,finalpage/2014-03-04/63631341.PDF
610,2014-03-04,东港股份：内部控制鉴证报告,finalpage/2014-03-04/63631346.PDF
611,2014-03-04,东港股份：董事会关于募集资金存放与实际使用情况的专项报告,finalpage/2014-03-04/63631351.PDF
612,2014-03-04,东港股份：关于公司募集资金年度存放与实际使用情况的鉴证报告,finalpage/2014-03-04/63631352.PDF
613,2014-03-04,东港股份：独立董事对第四届董事会第十五次会议相关议案的独立意见,finalpage/2014-03-04/63631353.PDF
614,2014-03-04,东港股份：独立董事2013年度述职报告,finalpage/2014-03-04/63631354.PDF
615,2014-03-04,东港股份：东方花旗证券有限公司关于公司2013年度募集资金存放和使用情况的专项核查意见,finalpage/2014-03-04/63631355.PDF
616,2014-03-04,东港股份：监事会2013年度工作报告,finalpage/2014-03-04/63631357.PDF
617,2014-03-04,东港股份：董事会2013年度工作报告和2014年度工作计划,finalpage/2014-03-04/63631358.PDF
618,2014-03-20,东港股份：关于获得居民健康卡生产单位及产品备案证书的公告,finalpage/2014-03-20/63697621.PDF
619,2014-03-26,东港股份：2013年度股东大会决议公告,finalpage/2014-03-26/63724697.PDF
620,2014-03-26,东港股份：2013年度股东大会的法律意见书,finalpage/2014-03-26/63724698.PDF
621,2014-03-29,东港股份：2013年度权益分派实施公告,finalpage/2014-03-29/63750587.PDF
622,2014-04-24,东港股份：2014年第一季度报告正文（已取消）,finalpage/2014-04-24/63900566.PDF
623,2014-04-24,东港股份：2014年第一季度报告全文（已取消）,finalpage/2014-04-24/63900567.PDF
624,2014-04-25,东港股份：更正公告,finalpage/2014-04-25/63914895.PDF
625,2014-04-25,东港股份：2014年第一季度报告全文（更新后）,finalpage/2014-04-25/63914896.PDF
626,2014-04-25,东港股份：2014年第一季度报告正文（更新后）,finalpage/2014-04-25/63914898.PDF
627,2014-05-06,东港股份：关于电子发票项目进展情况的公告,finalpage/2014-05-06/63970710.PDF
628,2014-05-08,东港股份：关于电子发票项目进展情况的公告,finalpage/2014-05-08/63998398.PDF
629,2014-05-13,东港股份：关于参加2014年投资者网上集体接待日活动的公告,finalpage/2014-05-13/64017367.PDF
630,2014-05-28,东港股份：第四届董事会第十七次会议公告,finalpage/2014-05-28/64072775.PDF
631,2014-05-28,东港股份：对外投资暨关联交易公告,finalpage/2014-05-28/64072776.PDF
632,2014-05-28,东港股份：第四届监事会第十五次会议公告,finalpage/2014-05-28/64072777.PDF
633,2014-05-28,东港股份：独立董事关于合资设立系统集成公司事项的事前认可意见,finalpage/2014-05-28/64072778.PDF
634,2014-05-29,东港股份：关于中标浦发银行信用卡空白卡及个人化采购项目的公告,finalpage/2014-05-29/64078558.PDF
635,2014-06-25,东港股份：关于与平安银行签订《银行卡卡片订制、个人化及封装邮寄服务协议》的公告,finalpage/2014-06-25/1200004971.PDF
636,2014-07-09,东港股份：关于购买理财产品的公告,finalpage/2014-07-09/1200040320.PDF
637,2014-07-29,东港股份：关于购买理财产品的公告,finalpage/2014-07-29/1200083357.PDF
638,2014-08-21,东港股份：董事会关于2014年1-6月募集资金存放与实际使用情况的专项报告,finalpage/2014-08-21/1200144468.PDF
639,2014-08-21,东港股份：关于购买理财产品的公告,finalpage/2014-08-21/1200144469.PDF
640,2014-08-21,东港股份：2014年半年度报告摘要,finalpage/2014-08-21/1200144470.PDF
641,2014-08-21,东港股份：2014年半年度报告,finalpage/2014-08-21/1200144471.PDF
642,2014-08-21,东港股份：2014半年度财务报告,finalpage/2014-08-21/1200144472.PDF
643,2014-08-21,东港股份：第四届董事会第十八次会议公告,finalpage/2014-08-21/1200144473.PDF
644,2014-08-21,东港股份：独立董事关于控股股东及其他关联方占用资金及公司对外担保情况的独立意见,finalpage/2014-08-21/1200144474.PDF
645,2014-09-03,东港股份：关于与中国民生银行签订《磁条卡和IC卡空白卡片供应商选择项目采购协议》的公告,finalpage/2014-09-03/1200199148.PDF
646,2014-09-17,东港股份：关于董事辞职的公告,finalpage/2014-09-17/1200240702.PDF
647,2014-09-17,东港股份：关于监事辞职的公告,finalpage/2014-09-17/1200240703.PDF
648,2014-09-17,东港股份：第四届董事会第十九次会议决议公告,finalpage/2014-09-17/1200240704.PDF
649,2014-09-17,东港股份：第四届监事会第十七次会议决议公告,finalpage/2014-09-17/1200240705.PDF
650,2014-09-17,东港股份：关于召开2014年第一次临时股东大会的通知,finalpage/2014-09-17/1200240706.PDF
651,2014-09-17,东港股份：独立董事关于增补董事候选人意见,finalpage/2014-09-17/1200240707.PDF
652,2014-09-20,东港股份：关于购买理财产品的公告,finalpage/2014-09-20/1200249767.PDF
653,2014-10-14,东港股份：2014年第一次临时股东大会决议公告,finalpage/2014-10-14/1200295233.PDF
654,2014-10-14,东港股份：2014年第一次临时股东大会的法律意见书,finalpage/2014-10-14/1200295234.PDF
655,2014-10-17,东港股份：独立董事辞职公告,finalpage/2014-10-17/1200306088.PDF
656,2014-10-22,东港股份：关于购买理财产品的公告,finalpage/2014-10-22/1200316749.PDF
657,2014-10-22,东港股份：2014年第三季度报告正文,finalpage/2014-10-22/1200316750.PDF
658,2014-10-22,东港股份：2014年第三季度报告全文,finalpage/2014-10-22/1200316751.PDF
659,2014-10-22,东港股份：第四届董事会第二十次会议决议公告,finalpage/2014-10-22/1200316752.PDF
660,2014-10-30,东港股份：第四届董事会第二十一次会议公告,finalpage/2014-10-30/1200352467.PDF
661,2014-10-30,东港股份：第四届监事会第十九次会议公告,finalpage/2014-10-30/1200352468.PDF
662,2014-10-30,东港股份：关于回购注销股权激励对象所持已获授但尚未解锁的限制性股票的公告,finalpage/2014-10-30/1200352469.PDF
663,2014-10-30,东港股份：减资公告,finalpage/2014-10-30/1200352470.PDF
664,2014-10-30,东港股份：关于召开2014年第二次临时股东大会的通知,finalpage/2014-10-30/1200352471.PDF
665,2014-10-30,东港股份：江苏泰和律师事务所关于公司限制性股票激励计划之限制性股票第三次解锁及部分回购注销相关事项的法律意见书,finalpage/2014-10-30/1200352472.PDF
666,2014-10-30,东港股份：独立董事关于第四届董事会第二十一次会议相关事项的独立意见,finalpage/2014-10-30/1200352473.PDF
667,2014-11-04,东港股份：关于限制性股票第三期解锁股份上市流通提示性公告,finalpage/2014-11-04/1200366868.PDF
