date,title,url
2013-08-08,华天科技：公开发行可转换公司债券发行公告,finalpage/2013-08-08/62917267.PDF
2013-08-08,华天科技：公开发行可转换公司债券网上路演公告,finalpage/2013-08-08/62917268.PDF
2013-08-08,华天科技：江苏永衡昭辉律师事务所关于公司公开发行可转换公司债券的法律意见书,finalpage/2013-08-08/62917269.PDF
2013-08-08,华天科技：江苏永衡昭辉律师事务所关于公司公开发行可转换公司债券的补充法律意见书（一）,finalpage/2013-08-08/62917270.PDF
2013-08-08,华天科技：第一创业摩根大通证券有限责任公司关于公司公开发行可转换公司债券发行保荐书,finalpage/2013-08-08/62917271.PDF
2013-08-12,华天科技：可转换公司债券发行方案提示性公告,finalpage/2013-08-12/62923973.PDF
2013-08-15,华天科技：可转换公司债券网上中签率及优先配售结果公告,finalpage/2013-08-15/62940078.PDF
2013-08-16,华天科技：可转换公司债券网上中签结果公告,finalpage/2013-08-16/62946767.PDF
2013-08-17,华天科技：第四届董事会第四次会议决议公告,finalpage/2013-08-17/62952238.PDF
2013-08-27,华天科技：可转换公司债券上市公告书,finalpage/2013-08-27/62996564.PDF
2013-08-27,华天科技：第一创业摩根大通证券有限责任公司关于公司可转换公司债券之上市保荐书,finalpage/2013-08-27/62996565.PDF
2013-08-27,华天科技：江苏永衡昭辉律师事务所关于公司公开发行可转换公司债券在深圳证券交易所上市的法律意见书,finalpage/2013-08-27/62996566.PDF
2013-08-30,华天科技：2013年半年度报告摘要,finalpage/2013-08-30/63019320.PDF
2013-08-30,华天科技：2013年半年度报告,finalpage/2013-08-30/63019324.PDF
2013-08-30,华天科技：2013年半年度财务报告,finalpage/2013-08-30/63019327.PDF
2013-08-30,华天科技：第四届董事会第五次会议决议公告,finalpage/2013-08-30/63019328.PDF
2013-08-30,华天科技：独立董事对公司关联方资金占用和对外担保情况的专项说明和独立意见,finalpage/2013-08-30/63019329.PDF
2013-08-30,华天科技：关于使用募集资金对全资子公司华天科技（西安）有限公司增资的公告,finalpage/2013-08-30/63019333.PDF
2013-08-30,华天科技：关于签订募集资金三方监管协议的公告,finalpage/2013-08-30/63019334.PDF
2013-08-30,华天科技：董事会关于募集资金存放与使用情况的专项报告（2013年1-6月）,finalpage/2013-08-30/63019335.PDF
2013-09-05,华天科技：关于控股股东减持公司可转换公司债券的公告,finalpage/2013-09-05/63049199.PDF
2013-09-05,华天科技：关于全资子公司华天科技（西安）有限公司签订募集资金三方监管协议的公告,finalpage/2013-09-05/63050307.PDF
2013-09-11,华天科技：第一创业摩根大通证券有限责任公司关于公司2013年度可转换公司债券募集资金置换前期自有资金投入的专项意见,finalpage/2013-09-11/63071019.PDF
2013-09-11,华天科技：关于以募集资金置换预先已投入募投项目的自筹资金鉴证报告,finalpage/2013-09-11/63071020.PDF
2013-09-11,华天科技：关于用可转债募集资金置换预先已投入募集资金投资项目的自筹资金的公告,finalpage/2013-09-11/63071021.PDF
2013-09-11,华天科技：独立董事关于用可转债募集资金置换预先已投入募集资金投资项目的自筹资金的独立意见,finalpage/2013-09-11/63071022.PDF
2013-09-11,华天科技：第四届监事会第三次会议决议公告,finalpage/2013-09-11/63071023.PDF
2013-09-11,华天科技：第四届董事会第六次会议决议公告,finalpage/2013-09-11/63071024.PDF
2013-10-29,华天科技：2013年第三季度报告正文（已取消）,finalpage/2013-10-29/63208292.PDF
2013-10-29,华天科技：2013年第三季度报告全文（已取消）,finalpage/2013-10-29/63208294.PDF
2013-10-29,华天科技：2013年第三季度报告全文及正文更正公告,finalpage/2013-10-29/63209035.PDF
2013-10-29,华天科技：2013年第三季度报告正文（更新后）,finalpage/2013-10-29/63209036.PDF
2013-10-29,华天科技：2013年第三季度报告全文（更新后）,finalpage/2013-10-29/63209038.PDF
2013-12-03,华天科技：关于控股股东部分股权解除质押的公告,finalpage/2013-12-03/63333233.PDF
2013-12-05,华天科技：关于控股股东减持公司可转换公司债券的公告,finalpage/2013-12-05/63341364.PDF
2013-12-17,华天科技：关于子公司金矿探矿权投资进展的公告,finalpage/2013-12-17/63382684.PDF
2014-01-10,华天科技：关于控股子公司住所变更的公告,finalpage/2014-01-10/63470952.PDF
2014-01-21,华天科技：2013年度业绩预告修正公告,finalpage/2014-01-21/63503889.PDF
2014-02-13,华天科技：关于“华天转债”实施转股事宜的公告,finalpage/2014-02-13/63564652.PDF
2014-02-14,华天科技：关于实际控制人、股东、关联方、收购人以及本公司承诺履行情况的公告,finalpage/2014-02-14/63568311.PDF
2014-02-19,华天科技：关于控股子公司名称变更的公告,finalpage/2014-02-19/63584778.PDF
2014-02-28,华天科技：2013年度业绩快报,finalpage/2014-02-28/63615792.PDF
2014-03-25,华天科技：2013年度监事会工作报告,finalpage/2014-03-25/63716098.PDF
2014-03-25,华天科技：2013年度财务决算报告,finalpage/2014-03-25/63716099.PDF
2014-03-25,华天科技：2013年年度报告摘要,finalpage/2014-03-25/63716100.PDF
2014-03-25,华天科技：2013年年度报告,finalpage/2014-03-25/63716102.PDF
2014-03-25,华天科技：2013年年度审计报告,finalpage/2014-03-25/63716105.PDF
2014-03-25,华天科技：第四届董事会第八次会议决议公告,finalpage/2014-03-25/63716108.PDF
2014-03-25,华天科技：关于召开2013年年度股东大会的通知,finalpage/2014-03-25/63716109.PDF
2014-03-25,华天科技：第四届监事会第五次会议决议公告,finalpage/2014-03-25/63716110.PDF
2014-03-25,华天科技：关于公司关联方占用上市公司资金情况的专项审核报告,finalpage/2014-03-25/63716111.PDF
2014-03-25,华天科技：2013年度内部控制自我评价报告,finalpage/2014-03-25/63716112.PDF
2014-03-25,华天科技：内部控制专项报告,finalpage/2014-03-25/63716113.PDF
2014-03-25,华天科技：董事会关于募集资金年度存放与使用情况的专项报告（2013年度）,finalpage/2014-03-25/63716114.PDF
2014-03-25,华天科技：关于公司募集资金年度存放与实际使用情况的鉴证报告,finalpage/2014-03-25/63716115.PDF
2014-03-25,华天科技：独立董事关于公司第四届董事会第八次会议审议相关事项的独立意见,finalpage/2014-03-25/63716116.PDF
2014-03-25,华天科技：2013年度独立董事述职报告,finalpage/2014-03-25/63716117.PDF
2014-03-25,华天科技：第一创业摩根大通证券有限责任公司关于公司2013年度内部控制自我评价报告的核查意见,finalpage/2014-03-25/63716118.PDF
2014-03-25,华天科技：第一创业摩根大通证券有限责任公司关于公司2013年度内部控制规则落实自查表的核查意见,finalpage/2014-03-25/63716119.PDF
2014-03-25,华天科技：第一创业摩根大通证券有限责任公司关于公司2013年度募集资金存放与使用情况的核查报告,finalpage/2014-03-25/63716120.PDF
2014-03-25,华天科技：第一创业摩根大通证券有限责任公司关于公司2014年度日常关联交易预计的核查意见,finalpage/2014-03-25/63716121.PDF
2014-03-25,华天科技：2014年日常关联交易预计的公告,finalpage/2014-03-25/63716122.PDF
2014-03-25,华天科技：关于举行2013年度网上业绩说明会的通知,finalpage/2014-03-25/63716123.PDF
2014-03-25,华天科技：内部控制规则落实自查表,finalpage/2014-03-25/63716124.PDF
2014-04-02,华天科技：关于2014年第一季度“华天转债”转股及公司股份变动情况的公告,finalpage/2014-04-02/63770856.PDF
2014-04-10,华天科技：关于子公司金矿探矿权投资进展的公告,finalpage/2014-04-10/63812056.PDF
2014-04-19,华天科技：2013年年度股东大会决议公告,finalpage/2014-04-19/63867363.PDF
2014-04-19,华天科技：2013年年度股东大会法律意见书,finalpage/2014-04-19/63867364.PDF
2014-04-26,华天科技：2014年第一季度报告正文,finalpage/2014-04-26/63931939.PDF
2014-04-26,华天科技：2014年第一季度报告全文,finalpage/2014-04-26/63931940.PDF
2014-04-30,华天科技：关于实际控制人个别成员变动的公告,finalpage/2014-04-30/63949304.PDF
2014-05-15,华天科技：2013年4.61亿元可转换公司债券2014年跟踪信用评级报告,finalpage/2014-05-15/64026062.PDF
2014-05-15,华天科技：关于“华天转债”跟踪信用评级结果的公告,finalpage/2014-05-15/64026063.PDF
2014-05-29,华天科技：独立董事辞职公告,finalpage/2014-05-29/64077522.PDF
2014-06-06,华天科技：2013年年度权益分派实施公告,finalpage/2014-06-06/64107567.PDF
2014-06-06,华天科技：关于“华天转债”转股价格调整的公告,finalpage/2014-06-06/64107568.PDF
2014-06-14,华天科技：2013年年度权益分派实施结果公告,finalpage/2014-06-14/64135708.PDF
2014-06-28,华天科技：独立董事提名人声明,finalpage/2014-06-28/1200013755.PDF
2014-06-28,华天科技：关于全资子公司与关联方共同对外投资的关联交易公告,finalpage/2014-06-28/1200013756.PDF
2014-06-28,华天科技：全资子公司项目投资公告,finalpage/2014-06-28/1200013757.PDF
2014-06-28,华天科技：公司章程（2014年6月）,finalpage/2014-06-28/1200013758.PDF
2014-06-28,华天科技：关于召开2014年第一次临时股东大会的通知,finalpage/2014-06-28/1200013759.PDF
2014-06-28,华天科技：第一创业摩根大通证券有限责任公司关于公司全资子公司华天科技（西安）有限公司与关联方共同对外投资暨关联交易的专项意见,finalpage/2014-06-28/1200013760.PDF
2014-06-28,华天科技：股东大会议事规则（2014年6月）,finalpage/2014-06-28/1200013761.PDF
2014-06-28,华天科技：未来三年（2014-2016年度）股东分红回报规划,finalpage/2014-06-28/1200013762.PDF
2014-06-28,华天科技：独立董事候选人声明（陈斌才）,finalpage/2014-06-28/1200013763.PDF
2014-06-28,华天科技：独立董事关于公司第四届董事会第十次会议审议相关事项的独立意见,finalpage/2014-06-28/1200013764.PDF
2014-06-28,华天科技：第四届监事会第七次会议决议公告,finalpage/2014-06-28/1200013765.PDF
2014-06-28,华天科技：第四届董事会第十次会议决议公告,finalpage/2014-06-28/1200013766.PDF
2014-07-02,华天科技：关于2014年第二季度“华天转债”转股及公司股份变动情况的公告,finalpage/2014-07-02/1200023563.PDF
2014-07-10,华天科技：第一创业摩根大通证券有限责任公司关于公司2014年上半年定期现场检查报告,finalpage/2014-07-10/1200042932.PDF
2014-07-16,华天科技：2014年第一次临时股东大会决议公告,finalpage/2014-07-16/1200056551.PDF
2014-07-16,华天科技：2014年第一次临时股东大会的法律意见书,finalpage/2014-07-16/1200056552.PDF
2014-07-17,华天科技：关于控股子公司获得02专项2014年度项目立项批复的公告,finalpage/2014-07-17/1200058406.PDF
2014-08-06,华天科技：关于“华天转债”2014年付息事宜的公告,finalpage/2014-08-06/1200100922.PDF
2014-08-06,华天科技：第四届董事会第十一次会议决议公告,finalpage/2014-08-06/1200100923.PDF
2014-08-20,华天科技：2014年半年度报告摘要,finalpage/2014-08-20/1200140637.PDF
2014-08-20,华天科技：2014年半年度报告,finalpage/2014-08-20/1200140638.PDF
2014-08-20,华天科技：2014年半年度财务报告,finalpage/2014-08-20/1200140639.PDF
2014-08-20,华天科技：第四届董事会第十二次会议决议公告,finalpage/2014-08-20/1200140640.PDF
2014-08-20,华天科技：第四届监事会第八次会议决议公告,finalpage/2014-08-20/1200140641.PDF
2014-08-20,华天科技：独立董事对公司关联方资金占用和对外担保情况的专项说明和独立意见,finalpage/2014-08-20/1200140642.PDF
2014-08-20,华天科技：董事会关于募集资金存放与使用情况的专项报告（2014年1-6月）,finalpage/2014-08-20/1200140643.PDF
2014-08-29,华天科技：股票及可转换公司债券停牌公告,finalpage/2014-08-29/1200185693.PDF
2014-08-30,华天科技：股票及可转换公司债券复牌公告,finalpage/2014-08-30/1200189682.PDF
2014-09-18,华天科技：关于控股子公司收到政府补助资金的公告,finalpage/2014-09-18/1200243316.PDF
2014-09-30,华天科技：关于参加甘肃辖区上市公司2014年投资者网上集体接待日活动的公告,finalpage/2014-09-30/1200274160.PDF
2014-10-09,华天科技：关于2014年第三季度“华天转债”转股及公司股份变动情况的公告,finalpage/2014-10-09/1200282094.PDF
2014-10-28,华天科技：2014年第三季度报告正文,finalpage/2014-10-28/1200341243.PDF
2014-10-28,华天科技：2014年第三季度报告全文,finalpage/2014-10-28/1200341244.PDF
2014-10-28,华天科技：第四届董事会第十三次会议决议公告,finalpage/2014-10-28/1200341245.PDF
2014-10-28,华天科技：第四届监事会第九次会议决议公告,finalpage/2014-10-28/1200341246.PDF
2014-10-28,华天科技：关于会计政策变更的公告,finalpage/2014-10-28/1200341247.PDF
2014-10-28,华天科技：江苏永衡昭辉律师事务所关于公司提前赎回可转换公司债券的法律意见书,finalpage/2014-10-28/1200341248.PDF
2014-10-28,华天科技：关于实施“华天转债”赎回事宜的第一次公告,finalpage/2014-10-28/1200341249.PDF
2014-10-28,华天科技：独立董事关于会计政策变更的独立意见,finalpage/2014-10-28/1200341250.PDF
2014-10-28,华天科技：第一创业摩根大通证券有限责任公司关于公司行使“华天转债”赎回权利的保荐意见,finalpage/2014-10-28/1200341251.PDF
2014-10-29,华天科技：关于实施“华天转债”赎回事宜的第二次公告,finalpage/2014-10-29/1200345657.PDF
2014-10-30,华天科技：关于实施“华天转债”赎回事宜的第三次公告,finalpage/2014-10-30/1200352225.PDF
2014-10-31,华天科技：关于实施“华天转债”赎回事宜的第四次公告,finalpage/2014-10-31/1200355955.PDF
2014-11-01,华天科技：关于实施“华天转债”赎回事宜的第五次公告,finalpage/2014-11-01/1200361107.PDF
2014-11-10,华天科技：关关于实施“华天转债”赎回事宜的第六次公告,finalpage/2014-11-10/1200377675.PDF
2014-11-15,"华天科技：关于拟收购FlipChip International,LLC公司及其子公司100%股权的公告",finalpage/2014-11-15/1200393224.PDF
2014-11-15,华天科技：第四届董事会第十四次会议决议公告,finalpage/2014-11-15/1200393225.PDF
2014-11-18,华天科技：关于实施“华天转债”赎回事宜的第七次公告,finalpage/2014-11-18/1200398718.PDF
2014-11-18,"华天科技：关于拟收购FlipChip International,LLC公司及其子公司100%股权的补充公告",finalpage/2014-11-18/1200398719.PDF
2014-11-21,华天科技：关于“华天转债”流通面值低于3000万元并将停止交易的提示性公告,finalpage/2014-11-21/1200407085.PDF
2014-11-24,华天科技：关于实施“华天转债”赎回事宜的第八次公告,finalpage/2014-11-24/1200408737.PDF
2014-11-24,华天科技：关于控股股东部分股权解除质押及重新质押的公告,finalpage/2014-11-24/1200408738.PDF
2014-11-25,华天科技：关于实施“华天转债”赎回事宜的第九次公告,finalpage/2014-11-25/1200413655.PDF
2014-11-26,华天科技：关于实施“华天转债”赎回事宜的第十次公告,finalpage/2014-11-26/1200416317.PDF
2014-11-27,华天科技：关于实施“华天转债”赎回事宜的第十一次公告,finalpage/2014-11-27/1200419275.PDF
2014-12-02,华天科技：关于在香港设立全资子公司的公告,finalpage/2014-12-02/1200431310.PDF
2014-12-08,华天科技：关于“华天转债”摘牌的公告,finalpage/2014-12-08/1200445422.PDF
2014-12-08,华天科技：关于“华天转债”赎回结果的公告,finalpage/2014-12-08/1200445423.PDF
2014-12-08,华天科技：关于公司控股股东持股比例降低5%以上的提示性公告,finalpage/2014-12-08/1200445424.PDF
2014-12-08,华天科技：简式权益变动报告书,finalpage/2014-12-08/1200445425.PDF
2014-12-16,华天科技：关于受让GENTEC INVESTMENT LIMITED持有的华天科技（昆山）电子有限公司16.15%股权的公告,finalpage/2014-12-16/1200467494.PDF
2014-12-16,"华天科技：关于收购FlipChip International, LLC公司及其子公司100%股权的公告",finalpage/2014-12-16/1200467495.PDF
2014-12-16,华天科技：第四届董事会第十五次会议决议公告,finalpage/2014-12-16/1200467496.PDF
2014-12-17,华天科技：公司章程（2014年12月）,finalpage/2014-12-17/1200470708.PDF
2014-12-17,华天科技：关于完成注册资本变更登记的公告,finalpage/2014-12-17/1200470709.PDF
2015-01-05,华天科技：第四届董事会第十六次会议决议公告,finalpage/2015-01-05/1200510609.PDF
2015-01-08,华天科技：关于全资子公司华天科技（香港）产业发展有限公司在美国设立全资子公司的公告,finalpage/2015-01-08/1200527301.PDF
2015-01-14,华天科技：独立董事辞职公告,finalpage/2015-01-14/1200541580.PDF
2015-01-15,华天科技：关于受让华天科技（昆山）电子有限公司16.15%股权的进展公告,finalpage/2015-01-15/1200544500.PDF
2015-01-22,华天科技：重大事项停牌公告,finalpage/2015-01-22/1200566033.PDF
2015-01-29,华天科技：关于重大事项继续停牌的公告,finalpage/2015-01-29/1200586811.PDF
2015-02-03,华天科技：2015年度非公开发行A股股票募集资金运用的可行性报告,finalpage/2015-02-03/1200604092.PDF
2015-02-03,华天科技：2015年度非公开发行A股股票预案,finalpage/2015-02-03/1200604093.PDF
2015-02-03,华天科技：关于前次募集资金使用情况的专项报告,finalpage/2015-02-03/1200604094.PDF
2015-02-03,华天科技：关于召开2015年第一次临时股东大会的通知,finalpage/2015-02-03/1200604095.PDF
2015-02-03,华天科技：关于对全资子公司华天科技（香港）产业发展有限公司增资的公告,finalpage/2015-02-03/1200604096.PDF
2015-02-03,华天科技：关于公司前次募集资金使用情况的鉴证报告,finalpage/2015-02-03/1200604097.PDF
2015-02-03,华天科技：第四届监事会第十次会议决议公告,finalpage/2015-02-03/1200604098.PDF
2015-02-03,华天科技：第四届董事会第十七次会议决议公告,finalpage/2015-02-03/1200604099.PDF
2015-02-03,华天科技：股票复牌公告,finalpage/2015-02-03/1200604100.PDF
2015-02-04,华天科技：简式权益变动报告书,finalpage/2015-02-04/1200607318.PDF
2015-02-26,华天科技：2014年度业绩快报,finalpage/2015-02-26/1200650904.PDF
2015-03-03,华天科技：关于召开2015年第一次临时股东大会的提示性公告,finalpage/2015-03-03/1200661432.PDF
2015-03-07,华天科技：2015年第一次临时股东大会决议公告,finalpage/2015-03-07/1200676341.PDF
2015-03-07,华天科技：2015年第一次临时股东大会的法律意见书,finalpage/2015-03-07/1200676342.PDF
2015-03-10,华天科技：2014年度监事会工作报告,finalpage/2015-03-10/1200682309.PDF
2015-03-10,华天科技：2014年度财务决算报告,finalpage/2015-03-10/1200682310.PDF
2015-03-10,华天科技：2014年年度报告摘要,finalpage/2015-03-10/1200682311.PDF
2015-03-10,华天科技：2014年年度报告,finalpage/2015-03-10/1200682312.PDF
2015-03-10,华天科技：2014年年度审计报告,finalpage/2015-03-10/1200682313.PDF
2015-03-10,华天科技：第四届董事会第十八次会议决议公告,finalpage/2015-03-10/1200682314.PDF
2015-03-10,华天科技：关于召开2014年年股东大会的通知,finalpage/2015-03-10/1200682315.PDF
2015-03-10,华天科技：第四届监事会第十一次会议决议公告,finalpage/2015-03-10/1200682316.PDF
2015-03-10,华天科技：关于公司关联方占用上市公司资金情况的专项审核报告,finalpage/2015-03-10/1200682317.PDF
2015-03-10,华天科技：2014年度内部控制自我评价报告,finalpage/2015-03-10/1200682318.PDF
2015-03-10,华天科技：内部控制专项报告,finalpage/2015-03-10/1200682319.PDF
2015-03-10,华天科技：董事会关于募集资金存放与使用情况的专项报告（2014年度）,finalpage/2015-03-10/1200682320.PDF
2015-03-10,华天科技：关于公司募集资金年度存放与实际使用情况的鉴证报告,finalpage/2015-03-10/1200682321.PDF
2015-03-10,华天科技：独立董事关于公司第四届董事会第十八次会议审议相关事项的独立意见,finalpage/2015-03-10/1200682322.PDF
2015-03-10,华天科技：2014年度独立董事述职报告,finalpage/2015-03-10/1200682323.PDF
2015-03-10,华天科技：独立董事提名人声明,finalpage/2015-03-10/1200682324.PDF
2015-03-10,华天科技：第一创业摩根大通证券有限责任公司关于公司2014年度内部控制自我评价报告的核查意见,finalpage/2015-03-10/1200682325.PDF
2015-03-10,华天科技：第一创业摩根大通证券有限责任公司关于公司2014年度内部控制规则落实自查表的核查意见,finalpage/2015-03-10/1200682326.PDF
2015-03-10,华天科技：第一创业摩根大通证券有限责任公司关于公司2014年度募集资金存放与使用情况的核查报告,finalpage/2015-03-10/1200682327.PDF
2015-03-10,华天科技：2015年日常关联交易预计的公告,finalpage/2015-03-10/1200682328.PDF
2015-03-10,华天科技：关于举行2014年度网上业绩说明会的通知,finalpage/2015-03-10/1200682329.PDF
2015-03-10,华天科技：内部控制规则落实自查表,finalpage/2015-03-10/1200682330.PDF
2015-03-10,华天科技：独立董事候选人声明（孟兆胜）,finalpage/2015-03-10/1200682331.PDF
2015-03-25,华天科技：关于更换持续督导保荐代表人的公告,finalpage/2015-03-25/1200736252.PDF
2015-04-04,"华天科技：关于完成FlipChip International, LLC股权交割的公告",finalpage/2015-04-04/1200787935.PDF
2015-04-10,华天科技：第一创业摩根大通证券有限责任公司关于公司持续督导保荐总结报告书,finalpage/2015-04-10/1200803567.PDF
2015-04-10,华天科技：第一创业摩根大通证券有限责任公司关于公司2014年年度保荐工作报告,finalpage/2015-04-10/1200803568.PDF
2015-04-25,华天科技：2014年年度股东大会决议公告,finalpage/2015-04-25/1200907660.PDF
2015-04-25,华天科技：2014年年度股东大会的法律意见书,finalpage/2015-04-25/1200907661.PDF
2015-04-29,华天科技：2015年第一季度报告正文,finalpage/2015-04-29/1200931492.PDF
2015-04-29,华天科技：2015年第一季度报告全文,finalpage/2015-04-29/1200931493.PDF
2015-04-29,华天科技：第四届董事会第十九次会议决议公告,finalpage/2015-04-29/1200931494.PDF
2015-04-29,华天科技：对外投资公告,finalpage/2015-04-29/1200931495.PDF
2015-05-05,华天科技：关于收到《中国证监会行政许可申请受理通知书》的公告,finalpage/2015-05-05/1200961545.PDF
2015-05-21,华天科技：第一创业摩根大通证券有限责任公司关于公司募集资金存放与使用情况的专项核查报告,finalpage/2015-05-21/1201040686.PDF
2015-05-28,华天科技：关于参加甘肃辖区上市公司2015年投资者网上集体接待日活动的公告,finalpage/2015-05-28/1201071577.PDF
2015-06-11,华天科技：2014年年度权益分派实施公告,finalpage/2015-06-11/1201133803.PDF
2015-06-18,华天科技：关于实施2014年年度权益分派方案后调整非公开发行股票发行底价和发行数量上限的公告,finalpage/2015-06-18/1201163669.PDF
2015-07-09,华天科技：关于部分董事计划增持公司股份的公告,finalpage/2015-07-09/1201261700.PDF
2015-07-10,华天科技：关于控股股东计划增持公司股份的公告,finalpage/2015-07-10/1201266732.PDF
2015-07-14,华天科技：关于对控股子公司华天科技（昆山）电子有限公司单方面增资的公告,finalpage/2015-07-14/1201286730.PDF
2015-07-14,华天科技：第四届董事会第二十次会议决议公告,finalpage/2015-07-14/1201286731.PDF
2015-07-15,华天科技：关于公司非公开发行A股股票申请文件反馈意见之回复,finalpage/2015-07-15/1201292422.PDF
2015-07-15,华天科技：关于非公开发行A股股票申请文件反馈意见回复的公告,finalpage/2015-07-15/1201292423.PDF
2015-07-15,华天科技：关于公司股票交易异常波动的公告,finalpage/2015-07-15/1201293679.PDF
2015-07-29,华天科技：关于控股股东增持公司股份的提示性公告,finalpage/2015-07-29/1201358917.PDF
2015-08-10,华天科技：关于控股股东及一致行动人增持公司股份的进展公告,finalpage/2015-08-10/1201406321.PDF
2015-08-27,华天科技：2015年半年度报告摘要（已取消）,finalpage/2015-08-27/1201500646.PDF
2015-08-27,华天科技：2015年半年度报告（已取消）,finalpage/2015-08-27/1201500647.PDF
2015-08-27,华天科技：2015年半年度财务报告（已取消）,finalpage/2015-08-27/1201500648.PDF
2015-08-27,华天科技：第四届董事会第二十一次会议决议公告,finalpage/2015-08-27/1201500649.PDF
2015-08-27,华天科技：第四届监事会第十三次会议决议公告,finalpage/2015-08-27/1201500650.PDF
