date,title,url
2010-04-07,中国海诚：第三届监事会第五次会议决议公告,finalpage/2010-04-07/57778392.PDF
2010-04-07,中国海诚：关于公司关联方占用上市公司资金情况的专项审核报告,finalpage/2010-04-07/57778393.PDF
2010-04-07,中国海诚：关于2009年度内部控制自我评价报告,finalpage/2010-04-07/57778394.PDF
2010-04-07,中国海诚：内部控制鉴证报告,finalpage/2010-04-07/57778395.PDF
2010-04-07,中国海诚：独立董事相关事项独立意见,finalpage/2010-04-07/57778396.PDF
2010-04-07,中国海诚：外部信息使用人管理制度（2010年4月）,finalpage/2010-04-07/57778397.PDF
2010-04-07,中国海诚：年报信息披露重大差错责任追究制度（2010年4月）,finalpage/2010-04-07/57778398.PDF
2010-04-07,中国海诚：海通证券股份有限公司关于公司持续督导期相关事项的意见,finalpage/2010-04-07/57778399.PDF
2010-04-07,中国海诚：独立董事2009年度述职报告（刘晓红）,finalpage/2010-04-07/57778401.PDF
2010-04-07,中国海诚：独立董事2009年度述职报告（王利平）,finalpage/2010-04-07/57778402.PDF
2010-04-07,中国海诚：独立董事2009年度述职报告（管一民）,finalpage/2010-04-07/57778403.PDF
2010-04-07,中国海诚：独立董事2009年度述职报告（郑培敏）,finalpage/2010-04-07/57778404.PDF
2010-04-29,中国海诚：关于部分控股子公司获得高新技术企业认定的公告,finalpage/2010-04-29/57890548.PDF
2010-04-29,中国海诚：2009年度股东大会决议公告,finalpage/2010-04-29/57890549.PDF
2010-04-29,中国海诚：2009年度股东大会的法律意见书,finalpage/2010-04-29/57890550.PDF
2010-04-29,中国海诚：2010年第一季度报告正文,finalpage/2010-04-29/57890551.PDF
2010-04-29,中国海诚：2010年第一季度报告全文,finalpage/2010-04-29/57890552.PDF
2010-05-11,中国海诚：第三届董事会第八次会议决议公告,finalpage/2010-05-11/57934251.PDF
2010-05-11,中国海诚：套期保值事项公告,finalpage/2010-05-11/57934252.PDF
2010-06-01,中国海诚：收购报告书,finalpage/2010-06-01/58015822.PDF
2010-06-01,中国海诚：国浩律师集团（上海）事务所关于公司国有股份划转的法律意见书,finalpage/2010-06-01/58015823.PDF
2010-06-01,中国海诚：关于中国证监会豁免中国轻工集团公司要约收购义务的公告,finalpage/2010-06-01/58015805.PDF
2010-06-19,中国海诚：2009年度分红派息实施公告,finalpage/2010-06-19/58075613.PDF
2010-06-25,中国海诚：关于国有股权划转过户手续办理完毕的公告,finalpage/2010-06-25/58096477.PDF
2010-07-01,中国海诚：第三届董事会第九次会议决议公告,finalpage/2010-07-01/58118249.PDF
2010-07-01,中国海诚：关于受让关联企业所持中国轻工建设工程有限公司5.88%股权的公告,finalpage/2010-07-01/58118250.PDF
2010-07-01,中国海诚：关于控股子公司向关联企业采购设备的公告,finalpage/2010-07-01/58118251.PDF
2010-07-01,中国海诚：关于控股子公司与关联企业签订重大经营合同的公告,finalpage/2010-07-01/58118252.PDF
2010-07-01,中国海诚：关于召开2010年第一次临时股东大会的通知公告,finalpage/2010-07-01/58118253.PDF
2010-07-01,中国海诚：独立董事关于关联交易的独立意见,finalpage/2010-07-01/58118255.PDF
2010-07-17,中国海诚：2010年第一次临时股东大会决议公告,finalpage/2010-07-17/58183329.PDF
2010-07-17,中国海诚：2010年第一次临时股东大会的法律意见书,finalpage/2010-07-17/58183330.PDF
2010-07-27,中国海诚：2010年半年度业绩快报,finalpage/2010-07-27/58220193.PDF
2010-07-29,中国海诚：关于控股子公司签订重大经营合同的公告,finalpage/2010-07-29/58230721.PDF
2010-08-25,中国海诚：关于召开2010年第二次临时股东大会的通知公告,finalpage/2010-08-25/58349567.PDF
2010-08-25,中国海诚：2010年半年度报告摘要,finalpage/2010-08-25/58349569.PDF
2010-08-25,中国海诚：2010年半年度报告,finalpage/2010-08-25/58349571.PDF
2010-08-25,中国海诚：2010年半年度财务报告,finalpage/2010-08-25/58349572.PDF
2010-08-25,中国海诚：第三届董事会第十次会议决议公告,finalpage/2010-08-25/58349573.PDF
2010-08-25,中国海诚：独立董事关于公司关联方资金占用和对外担保的独立意见,finalpage/2010-08-25/58349576.PDF
2010-08-25,中国海诚：公司章程（2010年8月）,finalpage/2010-08-25/58349577.PDF
2010-09-03,中国海诚：关于股东股权变动的提示性公告,finalpage/2010-09-03/58395605.PDF
2010-09-03,中国海诚：简式权益变动报告书,finalpage/2010-09-03/58395606.PDF
2010-09-10,中国海诚：2010年第二次临时股东大会决议公告,finalpage/2010-09-10/58422876.PDF
2010-09-10,中国海诚：2010年第二次临时股东大会的法律意见书,finalpage/2010-09-10/58422877.PDF
2010-10-12,中国海诚：关于控股子公司签订重大经营合同的公告,finalpage/2010-10-12/58510659.PDF
2010-10-22,中国海诚：2010年第三季度报告正文,finalpage/2010-10-22/58553745.PDF
2010-10-22,中国海诚：2010年第三季度报告全文,finalpage/2010-10-22/58553746.PDF
2010-10-27,中国海诚：关于控股子公司更名的公告,finalpage/2010-10-27/58578925.PDF
2010-10-29,中国海诚：关于签订重大经营合同的公告,finalpage/2010-10-29/58599714.PDF
2010-11-06,中国海诚：第三届董事会第十二次会议决议公告,finalpage/2010-11-06/58631996.PDF
2010-11-06,中国海诚：第三届监事会第九次会议决议公告,finalpage/2010-11-06/58631998.PDF
2010-11-06,中国海诚：关于控股子公司与关联企业签订补充经营合同的公告,finalpage/2010-11-06/58632008.PDF
2010-11-06,中国海诚：关于控股子公司长沙公司拟为其控股子公司长顺监理公司向银行申请授信额度提供担保的公告,finalpage/2010-11-06/58632009.PDF
2010-11-06,中国海诚：关于十八个月内为八家控股子公司申请新增银行授信额度提供担保的公告,finalpage/2010-11-06/58632012.PDF
2010-11-06,中国海诚：独立董事相关事项独立意见,finalpage/2010-11-06/58632013.PDF
2010-11-06,中国海诚：关于召开2010年第三次临时股东大会的通知公告,finalpage/2010-11-06/58632015.PDF
2010-11-23,中国海诚：2010年第三次临时股东大会决议公告,finalpage/2010-11-23/58693134.PDF
2010-11-23,中国海诚：2010年第三次临时股东大会的法律意见书,finalpage/2010-11-23/58693135.PDF
2010-11-30,中国海诚：关于为长沙控股子公司提供担保的公告,finalpage/2010-11-30/58719507.PDF
2010-12-07,中国海诚：关于为成都控股子公司提供担保的公告,finalpage/2010-12-07/58749709.PDF
2011-02-22,中国海诚：2010年度业绩快报,finalpage/2011-02-22/59026551.PDF
2011-04-23,中国海诚：2011年度日常关联交易公告,finalpage/2011-04-23/59322508.PDF
2011-04-23,中国海诚：2010年年度报告摘要,finalpage/2011-04-23/59322512.PDF
2011-04-23,中国海诚：2010年年度报告,finalpage/2011-04-23/59322522.PDF
2011-04-23,中国海诚：2010年年度审计报告,finalpage/2011-04-23/59322530.PDF
2011-04-23,中国海诚：第三届董事会第十三次会议决议公告,finalpage/2011-04-23/59322531.PDF
2011-04-23,中国海诚：关于召开2010年度股东大会的通知公告,finalpage/2011-04-23/59322532.PDF
2011-04-23,中国海诚：第三届监事会第十次会议决议公告,finalpage/2011-04-23/59322533.PDF
2011-04-23,中国海诚：关于公司关联方占用上市公司资金情况的专项审核报告,finalpage/2011-04-23/59322535.PDF
2011-04-23,中国海诚：关于2010年度内部控制自我评价报告,finalpage/2011-04-23/59322536.PDF
2011-04-23,中国海诚：独立董事相关事项独立意见,finalpage/2011-04-23/59322537.PDF
2011-04-23,中国海诚：独立董事2010年度述职报告,finalpage/2011-04-23/59322539.PDF
2011-04-23,中国海诚：2011年第一季度报告正文,finalpage/2011-04-23/59322540.PDF
2011-04-23,中国海诚：2011年第一季度报告全文,finalpage/2011-04-23/59322542.PDF
2011-04-23,中国海诚：独立董事候选人声明（李志强）,finalpage/2011-04-23/59322544.PDF
2011-04-23,中国海诚：独立董事提名人声明,finalpage/2011-04-23/59322545.PDF
2011-04-28,中国海诚：关于部分控股子公司获得高新技术企业认定的公告,finalpage/2011-04-28/59352942.PDF
2011-05-03,中国海诚：关于召开2010年度股东大会的补充通知,finalpage/2011-05-03/59370083.PDF
2011-05-03,中国海诚：关于举行2010年度报告网上说明会的公告,finalpage/2011-05-03/59370084.PDF
2011-05-03,中国海诚：关于长沙子公司与关联企业签订重大经营合同的公告,finalpage/2011-05-03/59370085.PDF
2011-05-03,中国海诚：独立董事关于长沙子公司与关联企业签订重大经营合同的独立意见,finalpage/2011-05-03/59370086.PDF
2011-05-10,中国海诚：关于召开2010年度股东大会的提示性公告,finalpage/2011-05-10/59405593.PDF
2011-05-14,中国海诚：2010年度股东大会决议公告,finalpage/2011-05-14/59427797.PDF
2011-05-14,中国海诚：2010年度股东大会的法律意见书,finalpage/2011-05-14/59427798.PDF
2011-06-01,中国海诚：关于武汉控股子公司购得土地使用权的公告,finalpage/2011-06-01/59499120.PDF
2011-06-09,中国海诚：关于向武汉子公司提供委托贷款的公告,finalpage/2011-06-09/59528686.PDF
2011-06-09,中国海诚：第三届董事会第十六次会议决议公告,finalpage/2011-06-09/59528687.PDF
2011-06-09,中国海诚：独立董事关于公司向武汉子公司提供委托贷款的独立意见,finalpage/2011-06-09/59528688.PDF
2011-06-16,中国海诚：关于限售股份上市流通的提示性公告,finalpage/2011-06-16/59558105.PDF
2011-06-22,中国海诚：2010年度分红派息实施公告,finalpage/2011-06-22/59581287.PDF
2011-07-29,中国海诚：2011半年度业绩快报,finalpage/2011-07-29/59740819.PDF
2011-08-23,中国海诚：关于召开2011年第一次临时股东大会的通知公告,finalpage/2011-08-23/59855092.PDF
2011-08-23,中国海诚：2011年半年度报告摘要,finalpage/2011-08-23/59855093.PDF
2011-08-23,中国海诚：2011年半年度报告,finalpage/2011-08-23/59855094.PDF
2011-08-23,中国海诚：2011年半年度财务报告,finalpage/2011-08-23/59855096.PDF
2011-08-23,中国海诚：第三届董事会第十七次会议决议公告,finalpage/2011-08-23/59855097.PDF
2011-08-23,中国海诚：第三届监事会第十一次会议决议公告,finalpage/2011-08-23/59855098.PDF
2011-08-23,中国海诚：独立董事关于公司关联方资金占用和对外担保的独立意见,finalpage/2011-08-23/59855099.PDF
2011-09-08,中国海诚：2011年第一次临时股东大会的法律意见书,finalpage/2011-09-08/59935769.PDF
2011-09-08,中国海诚：2011年第一次临时股东大会决议公告,finalpage/2011-09-08/59935770.PDF
2011-09-29,中国海诚：第三届董事会第十八次会议决议公告,finalpage/2011-09-29/60015318.PDF
2011-09-29,中国海诚：关于“加强中小企业板上市公司内控规则落实”专项活动的整改报告,finalpage/2011-09-29/60015319.PDF
2011-09-29,中国海诚：内部控制规则落实情况自查表,finalpage/2011-09-29/60015320.PDF
2011-10-21,中国海诚：2011年第三季度报告正文,finalpage/2011-10-21/60084639.PDF
2011-10-21,中国海诚：2011年第三季度报告全文,finalpage/2011-10-21/60084640.PDF
2011-10-25,中国海诚：关于重大工程中标的公告,finalpage/2011-10-25/60103890.PDF
2011-11-10,中国海诚：关于签署重大工程合同的公告,finalpage/2011-11-10/60182937.PDF
2011-11-15,中国海诚：第三届董事会第二十次会议决议公告,finalpage/2011-11-15/60200276.PDF
2011-11-15,中国海诚：关于向西安子公司提供委托贷款的公告,finalpage/2011-11-15/60200277.PDF
2011-11-15,中国海诚：独立董事关于公司向西安子公司提供委托贷款的独立意见,finalpage/2011-11-15/60200278.PDF
2011-12-14,中国海诚：停牌公告,finalpage/2011-12-14/60320529.PDF
2011-12-15,中国海诚：第三届董事会第二十一次会议决议公告,finalpage/2011-12-15/60326151.PDF
2011-12-15,中国海诚：第三届监事会第十三次会议决议公告,finalpage/2011-12-15/60326152.PDF
2011-12-15,中国海诚：股票期权激励计划（草案）摘要,finalpage/2011-12-15/60326153.PDF
2011-12-15,中国海诚：关于控股子公司拟与关联企业签订补充经营合同的议案,finalpage/2011-12-15/60326154.PDF
2011-12-15,中国海诚：关于完成“加强中小企业板上市公司内控规则落实”专项活动的公告,finalpage/2011-12-15/60326155.PDF
2011-12-15,中国海诚：关联交易管理办法（2011年12月）,finalpage/2011-12-15/60326156.PDF
2011-12-15,中国海诚：内幕信息知情人管理制度（2011年12月）,finalpage/2011-12-15/60326157.PDF
2011-12-15,中国海诚：控股子公司管理制度（2011年12月）,finalpage/2011-12-15/60326158.PDF
2011-12-15,中国海诚：董事会提名委员会工作细则 （2011年12月）,finalpage/2011-12-15/60326159.PDF
2011-12-15,中国海诚：独立董事关于相关事项的独立意见,finalpage/2011-12-15/60326160.PDF
2011-12-15,中国海诚：首期股票期权激励计划激励对象名单,finalpage/2011-12-15/60326161.PDF
2011-12-15,中国海诚：股票期权激励计划实施考核办法（2011年12月）,finalpage/2011-12-15/60326162.PDF
2011-12-15,中国海诚：股票期权激励计划（草案）,finalpage/2011-12-15/60326163.PDF
2011-12-21,中国海诚：关于全资子公司签订重大经营合同的公告,finalpage/2011-12-21/60348298.PDF
2012-02-18,中国海诚：关于股票期权激励计划（草案）获得国务院国资委批复的公告,finalpage/2012-02-18/60556088.PDF
2012-02-24,中国海诚：2011年度业绩快报,finalpage/2012-02-24/60579110.PDF
2012-03-06,中国海诚：关于首期股票期权激励计划（草案）获得中国证监会备案无异议的公告,finalpage/2012-03-06/60629189.PDF
2012-03-06,中国海诚：第三届董事会第二十二次会议决议公告,finalpage/2012-03-06/60629190.PDF
2012-03-06,中国海诚：第三届监事会第十四次会议决议公告,finalpage/2012-03-06/60629191.PDF
2012-03-06,中国海诚：关于召开2012年第一次临时股东大会的通知,finalpage/2012-03-06/60629192.PDF
2012-03-06,中国海诚：股票期权激励计划（草案修订稿）摘要,finalpage/2012-03-06/60629193.PDF
2012-03-06,中国海诚：国浩律师（上海）事务所关于公司股票期权激励计划（草案）的补充法律意见书,finalpage/2012-03-06/60629194.PDF
2012-03-06,中国海诚：独立董事征集投票权报告书,finalpage/2012-03-06/60629195.PDF
2012-03-06,中国海诚：独立董事关于公司股票期权激励计划（草案修订稿）的独立意见,finalpage/2012-03-06/60629196.PDF
2012-03-06,中国海诚：首期股票期权激励计划激励对象名单,finalpage/2012-03-06/60629197.PDF
2012-03-06,中国海诚：股票期权激励计划（草案修订稿）,finalpage/2012-03-06/60629198.PDF
2012-03-22,中国海诚：2012年第一次临时股东大会决议公告,finalpage/2012-03-22/60705687.PDF
2012-03-22,中国海诚：2012年第一次临时股东大会的法律意见书,finalpage/2012-03-22/60705688.PDF
2012-03-24,中国海诚：第三届监事会第十五次会议决议公告,finalpage/2012-03-24/60718875.PDF
2012-03-24,中国海诚：董事会关于股票期权激励计划授予事项的公告,finalpage/2012-03-24/60718876.PDF
2012-03-24,中国海诚：第三届董事会第二十三次会议决议公告,finalpage/2012-03-24/60718877.PDF
2012-03-24,中国海诚：国浩律师（上海）事务所关于公司股票期权激励计划授予股票期权的法律意见书,finalpage/2012-03-24/60718879.PDF
2012-03-24,中国海诚：独立董事关于公司股票期权激励计划授予事项的独立意见,finalpage/2012-03-24/60718880.PDF
2012-03-24,中国海诚：首期股票期权激励计划激励对象名单,finalpage/2012-03-24/60718881.PDF
2012-04-10,中国海诚：关于2011年度利润分配及资本公积金转增股本的预披露公告,finalpage/2012-04-10/60803907.PDF
2012-04-17,中国海诚：关于股票期权授予登记完成的公告,finalpage/2012-04-17/60839529.PDF
2012-04-21,中国海诚：关于广州控股子公司更名的公告,finalpage/2012-04-21/60871739.PDF
2012-04-25,中国海诚：2012年度日常关联交易公告,finalpage/2012-04-25/60900990.PDF
2012-04-25,中国海诚：关于长沙控股子公司拟与关联企业签订装修合同的公告,finalpage/2012-04-25/60900991.PDF
2012-04-25,中国海诚：2011年年度报告摘要,finalpage/2012-04-25/60900992.PDF
2012-04-25,中国海诚：2011年年度报告,finalpage/2012-04-25/60900995.PDF
2012-04-25,中国海诚：2011年年度审计报告,finalpage/2012-04-25/60900998.PDF
2012-04-25,中国海诚：第三届董事会第二十四次会议决议公告,finalpage/2012-04-25/60900999.PDF
2012-04-25,中国海诚：关于召开2011年度股东大会的通知公告,finalpage/2012-04-25/60901001.PDF
2012-04-25,中国海诚：第三届监事会第十六次会议决议公告,finalpage/2012-04-25/60901002.PDF
2012-04-25,中国海诚：关于公司关联方占用上市公司资金情况的专项审核报告,finalpage/2012-04-25/60901003.PDF
2012-04-25,中国海诚：关于2011年度内部控制自我评价报告,finalpage/2012-04-25/60901004.PDF
2012-04-25,中国海诚：内部控制鉴证报告,finalpage/2012-04-25/60901005.PDF
2012-04-25,中国海诚：独立董事相关事项独立意见,finalpage/2012-04-25/60901006.PDF
2012-04-25,中国海诚：独立董事2011年度述职报告,finalpage/2012-04-25/60901007.PDF
2012-04-25,中国海诚：2012年第一季度报告正文,finalpage/2012-04-25/60901008.PDF
2012-04-25,中国海诚：2012年第一季度报告全文,finalpage/2012-04-25/60901009.PDF
2012-05-04,中国海诚：关于举行2011年度报告网上说明会的公告,finalpage/2012-05-04/60949719.PDF
2012-05-17,中国海诚：2011年度股东大会决议公告,finalpage/2012-05-17/61007628.PDF
2012-05-17,中国海诚：2011年度股东大会的法律意见书,finalpage/2012-05-17/61007629.PDF
2012-06-15,中国海诚：2011年度权益分派实施公告,finalpage/2012-06-15/61139576.PDF
2012-07-13,中国海诚：关于完成注册资本变更相关事项的公告,finalpage/2012-07-13/61261168.PDF
2012-07-13,中国海诚：公司章程（2012年6月）,finalpage/2012-07-13/61261169.PDF
2012-07-26,中国海诚：2012半年度业绩快报,finalpage/2012-07-26/61322811.PDF
2012-08-18,中国海诚：关于调整公司股权激励计划股票期权数量及行权价格的公告,finalpage/2012-08-18/61440351.PDF
2012-08-18,中国海诚：2012年半年度报告摘要,finalpage/2012-08-18/61440353.PDF
2012-08-18,中国海诚：2012年半年度报告,finalpage/2012-08-18/61440357.PDF
2012-08-18,中国海诚：2012年半年度财务会计报告,finalpage/2012-08-18/61440359.PDF
2012-08-18,中国海诚：第三届董事会第二十五次会议决议公告,finalpage/2012-08-18/61440360.PDF
2012-08-18,中国海诚：第三届监事会第十七次会议决议公告,finalpage/2012-08-18/61440361.PDF
2012-08-18,中国海诚：独立董事关于相关事项的独立意见,finalpage/2012-08-18/61440362.PDF
2012-08-18,中国海诚：国浩律师（上海）事务所关于公司股票期权激励计划调整事项的法律意见书,finalpage/2012-08-18/61440363.PDF
2012-10-25,中国海诚：关于北京子公司与关联企业进行关联交易的公告,finalpage/2012-10-25/61700617.PDF
2012-10-25,中国海诚：关于公司及子公司拟向控股股东申请借款的公告,finalpage/2012-10-25/61700618.PDF
2012-10-25,中国海诚：2012年第三季度报告正文,finalpage/2012-10-25/61700620.PDF
2012-10-25,中国海诚：2012年第三季度报告全文,finalpage/2012-10-25/61700622.PDF
2012-10-25,中国海诚：第三届董事会第二十六次会议决议公告,finalpage/2012-10-25/61700623.PDF
2012-10-25,中国海诚：独立董事关于相关事项的独立意见,finalpage/2012-10-25/61700625.PDF
2012-11-02,中国海诚：关于公司股东及公司承诺履行情况的公告,finalpage/2012-11-02/61751726.PDF
2012-12-05,中国海诚：第三届董事会第二十七次会议决议公告,finalpage/2012-12-05/61872058.PDF
2012-12-05,中国海诚：第三届监事会第十九次会议决议公告,finalpage/2012-12-05/61872059.PDF
2012-12-05,中国海诚：关于为成都子公司向银行申请综合授信额度提供担保的公告,finalpage/2012-12-05/61872060.PDF
2012-12-05,中国海诚：关于十八个月内为八家子公司向银行申请综合授信额度提供担保的公告,finalpage/2012-12-05/61872061.PDF
2012-12-05,中国海诚：关于召开2012年第二次临时股东大会的通知公告,finalpage/2012-12-05/61872062.PDF
2012-12-05,中国海诚：独立董事候选人声明（李志强）,finalpage/2012-12-05/61872063.PDF
2012-12-05,中国海诚：独立董事候选人声明（李文祥）,finalpage/2012-12-05/61872064.PDF
2012-12-05,中国海诚：独立董事候选人声明（王利平）,finalpage/2012-12-05/61872065.PDF
2012-12-05,中国海诚：独立董事候选人声明（郑培敏）,finalpage/2012-12-05/61872066.PDF
2012-12-05,中国海诚：独立董事关于相关事项的独立意见,finalpage/2012-12-05/61872067.PDF
2012-12-05,中国海诚：独立董事提名人声明（三）,finalpage/2012-12-05/61872069.PDF
2012-12-05,中国海诚：独立董事提名人声明（四）,finalpage/2012-12-05/61872070.PDF
2012-12-05,中国海诚：独立董事提名人声明（二）,finalpage/2012-12-05/61872071.PDF
2012-12-05,中国海诚：独立董事提名人声明（一）,finalpage/2012-12-05/61872072.PDF
2012-12-21,中国海诚：2012年第二次临时股东大会决议公告,finalpage/2012-12-21/61933172.PDF
2012-12-21,中国海诚：关于为长沙子公司向银行申请综合授信额度提供担保的公告,finalpage/2012-12-21/61933173.PDF
2012-12-21,中国海诚：关于职工代表监事选举结果的公告,finalpage/2012-12-21/61933174.PDF
2012-12-21,中国海诚：2012年第二次临时股东大会的法律意见书,finalpage/2012-12-21/61933175.PDF
2012-12-21,中国海诚：公司章程（2012年12月）,finalpage/2012-12-21/61933176.PDF
2012-12-27,中国海诚：第四届董事会第一次会议决议公告,finalpage/2012-12-27/61955027.PDF
2012-12-27,中国海诚：第四届监事会第一次会议决议公告,finalpage/2012-12-27/61955028.PDF
2012-12-27,中国海诚：关于财务总监代行董事会秘书职责的公告,finalpage/2012-12-27/61955029.PDF
2012-12-27,中国海诚：独立董事关于公司第四届董事会聘任高级管理人员的独立意见,finalpage/2012-12-27/61955030.PDF
2013-02-06,中国海诚：关于限售股份上市流通的提示性公告,finalpage/2013-02-06/62115768.PDF
2013-02-06,中国海诚：关于重大诉讼事项的公告,finalpage/2013-02-06/62115769.PDF
2013-02-27,中国海诚：2012年度业绩快报,finalpage/2013-02-27/62155403.PDF
2013-04-10,中国海诚：2013年度日常关联交易公告,finalpage/2013-04-10/62340317.PDF
2013-04-10,中国海诚：关于举行2012年度报告网上说明会的公告,finalpage/2013-04-10/62340318.PDF
2013-04-10,中国海诚：2012年年度报告摘要,finalpage/2013-04-10/62340319.PDF
2013-04-10,中国海诚：2012年年度报告（已取消）,finalpage/2013-04-10/62340320.PDF
2013-04-10,中国海诚：2012年年度审计报告（已取消）,finalpage/2013-04-10/62340321.PDF
2013-04-10,中国海诚：第四届董事会第二次会议决议公告,finalpage/2013-04-10/62340322.PDF
2013-04-10,中国海诚：关于召开2012年度股东大会的通知公告,finalpage/2013-04-10/62340323.PDF
2013-04-10,中国海诚：第四届监事会第二次会议决议公告,finalpage/2013-04-10/62340324.PDF
2013-04-10,中国海诚：关于公司关联方占用上市公司资金情况的专项审核报告,finalpage/2013-04-10/62340325.PDF
2013-04-10,中国海诚：2012年度内部控制自我评价报告,finalpage/2013-04-10/62340326.PDF
2013-04-10,中国海诚：独立董事相关事项独立意见,finalpage/2013-04-10/62340327.PDF
2013-04-10,中国海诚：独立董事2012年度述职报告,finalpage/2013-04-10/62340328.PDF
2013-04-10,中国海诚：内部控制规则落实自查表,finalpage/2013-04-10/62340329.PDF
2013-04-11,中国海诚：关于通过高新技术企业复审的公告,finalpage/2013-04-11/62344826.PDF
2013-04-16,中国海诚：关于2012年度报告及财务报告的补充公告,finalpage/2013-04-16/62364583.PDF
2013-04-16,中国海诚：2012年年度报告（更新后）,finalpage/2013-04-16/62364594.PDF
2013-04-16,中国海诚：2012年年度审计报告（更新后）,finalpage/2013-04-16/62364595.PDF
2013-04-24,中国海诚：关于为武汉子公司提供担保的公告,finalpage/2013-04-24/62411746.PDF
2013-04-24,中国海诚：2013年第一季度报告正文,finalpage/2013-04-24/62411747.PDF
2013-04-24,中国海诚：2013年第一季度报告全文,finalpage/2013-04-24/62411748.PDF
2013-04-24,中国海诚：第四届董事会第三次会议决议公告,finalpage/2013-04-24/62411749.PDF
2013-05-04,中国海诚：2012年度股东大会决议公告,finalpage/2013-05-04/62454899.PDF
2013-05-04,中国海诚：2012年度股东大会的法律意见书,finalpage/2013-05-04/62454900.PDF
2013-06-20,中国海诚：2012年度权益分派实施公告,finalpage/2013-06-20/62596256.PDF
2013-07-24,中国海诚：2013年半年度业绩快报,finalpage/2013-07-24/62863805.PDF
