date,title,url
2011-01-18,华天科技：关于前次募集资金使用情况的专项报告,finalpage/2011-01-18/58914036.PDF
2011-01-18,华天科技：国信证券股份有限公司关于公司将结余募集资金永久补充流动资金的保荐意见,finalpage/2011-01-18/58914037.PDF
2011-01-22,华天科技：业绩预告修正公告,finalpage/2011-01-22/58933762.PDF
2011-02-10,华天科技：关于召开2011年第一次临时股东大会的提示性公告,finalpage/2011-02-10/58980556.PDF
2011-02-16,华天科技：2011年第一次临时股东大会决议公告,finalpage/2011-02-16/59001976.PDF
2011-02-16,华天科技：2011年第一次临时股东大会法律意见书,finalpage/2011-02-16/59001977.PDF
2011-02-17,华天科技：2009年年度报告（更正后）,finalpage/2011-02-17/59007776.PDF
2011-02-17,华天科技：2009年年度报告摘要（更正后）,finalpage/2011-02-17/59007777.PDF
2011-02-17,华天科技：2009年年度审计报告（更正后）,finalpage/2011-02-17/59007780.PDF
2011-02-17,华天科技：关于2009年度非经常性损益披露差错的更正公告,finalpage/2011-02-17/59007781.PDF
2011-02-17,华天科技：2010年度财务决算报告,finalpage/2011-02-17/59007784.PDF
2011-02-17,华天科技：2011年日常关联交易预计公告,finalpage/2011-02-17/59007786.PDF
2011-02-17,华天科技：2010年年度报告摘要,finalpage/2011-02-17/59007788.PDF
2011-02-17,华天科技：2010年年度报告,finalpage/2011-02-17/59007792.PDF
2011-02-17,华天科技：2010年年度审计报告,finalpage/2011-02-17/59007795.PDF
2011-02-17,华天科技：第三届董事会第九次会议决议公告,finalpage/2011-02-17/59007796.PDF
2011-02-17,华天科技：关于召开2010年年度股东大会的通知,finalpage/2011-02-17/59007797.PDF
2011-02-17,华天科技：第三届监事会第六次会议决议公告,finalpage/2011-02-17/59007798.PDF
2011-02-17,华天科技：关于公司2010年度控股股东及其他关联方占用资金情况的专项说明,finalpage/2011-02-17/59007799.PDF
2011-02-17,华天科技：2010年度内部控制自我评价报告,finalpage/2011-02-17/59007800.PDF
2011-02-17,华天科技：内部控制鉴证报告,finalpage/2011-02-17/59007801.PDF
2011-02-17,华天科技：董事会关于2010年度募集资金存放与使用情况的专项报告,finalpage/2011-02-17/59007803.PDF
2011-02-17,华天科技：关于公司募集资金年度存放与使用情况鉴证报告,finalpage/2011-02-17/59007808.PDF
2011-02-17,华天科技：独立董事关于公司第三届董事会第九次会议九次会议,finalpage/2011-02-17/59007810.PDF
2011-02-17,华天科技：2010年度独立董事述职报告（董云庭）,finalpage/2011-02-17/59007811.PDF
2011-02-17,华天科技：关于举行2010年度网上业绩说明会的通知,finalpage/2011-02-17/59007813.PDF
2011-02-17,华天科技：关于公司2009年度非经常性损益披露差错情况说明,finalpage/2011-02-17/59007814.PDF
2011-02-17,华天科技：关联交易决策制度（2011年2月）,finalpage/2011-02-17/59007815.PDF
2011-02-17,华天科技：国信证券股份有限公司关于公司2010年度募集资金存放与使用情况的专项核查报告,finalpage/2011-02-17/59007816.PDF
2011-02-17,华天科技：2010年度独立董事述职报告（王芹生）,finalpage/2011-02-17/59007818.PDF
2011-02-17,华天科技：2010年度独立董事述职报告（陈斌才）,finalpage/2011-02-17/59007819.PDF
2011-02-17,华天科技：董事会秘书工作制度（2011年2月）,finalpage/2011-02-17/59007820.PDF
2011-03-17,华天科技：关于获得《极大规模集成电路制造装备及成套工艺》国家科技重大专项2011年度项目立项批复的公告,finalpage/2011-03-17/59130677.PDF
2011-03-22,华天科技：2010年年度股东大会决议公告,finalpage/2011-03-22/59152347.PDF
2011-03-22,华天科技：2010年年度股东大会法律意见书,finalpage/2011-03-22/59152348.PDF
2011-04-15,华天科技：第三届董事会第十次会议决议公告,finalpage/2011-04-15/59270637.PDF
2011-04-28,华天科技：2011年第一季度报告正文,finalpage/2011-04-28/59352062.PDF
2011-04-28,华天科技：2011年第一季度报告全文,finalpage/2011-04-28/59352063.PDF
2011-05-21,华天科技：关于非公开发行股票申请获发审委审核通过的公告,finalpage/2011-05-21/59457097.PDF
2011-06-04,华天科技：关于全资子公司名称及住所变更的公告,finalpage/2011-06-04/59515100.PDF
2011-06-10,华天科技：关于非公开发行股票申请获中国证监会核准的公告,finalpage/2011-06-10/59533862.PDF
2011-08-09,华天科技：2011年半年度报告摘要,finalpage/2011-08-09/59788975.PDF
2011-08-09,华天科技：2011年半年度报告,finalpage/2011-08-09/59788976.PDF
2011-08-09,华天科技：2011年半年度财务报告,finalpage/2011-08-09/59788977.PDF
2011-08-09,华天科技：第三届董事会第十二次会议决议公告,finalpage/2011-08-09/59788978.PDF
2011-08-09,华天科技：独立董事对公司关联方资金占用和对外担保情况的专项说明和独立意见,finalpage/2011-08-09/59788979.PDF
2011-08-09,华天科技：关于为全资子公司华天科技（西安）有限公司提供贷款担保的公告,finalpage/2011-08-09/59788980.PDF
2011-09-19,华天科技：国信证券股份有限公司关于公司限售股份上市流通相关事项的保荐意见,finalpage/2011-09-19/59967253.PDF
2011-09-19,华天科技：首次公开发行前已发行股份上市流通提示性公告,finalpage/2011-09-19/59967254.PDF
2011-09-23,华天科技：第三届董事会第十三次会议决议公告,finalpage/2011-09-23/59988317.PDF
2011-09-23,华天科技：内部控制规则落实情况自查表及整改计划,finalpage/2011-09-23/59988319.PDF
2011-09-23,华天科技：国信证券股份有限公司关于公司内部控制规则落实情况自查表及整改计划的核查意见,finalpage/2011-09-23/59988320.PDF
2011-10-11,华天科技：关于控股股东部分股权质押的公告,finalpage/2011-10-11/60039515.PDF
2011-10-29,华天科技：2011年第三季度报告正文,finalpage/2011-10-29/60133581.PDF
2011-10-29,华天科技：2011年第三季度报告全文,finalpage/2011-10-29/60133582.PDF
2011-10-29,华天科技：第三届董事会第十四次会议决议公告,finalpage/2011-10-29/60133583.PDF
2011-10-29,华天科技：公司章程（2011年10月）,finalpage/2011-10-29/60133585.PDF
2011-11-03,华天科技：国信证券股份有限公司关于公司非公开发行股票发行过程和认购对象合规性的报告,finalpage/2011-11-03/60153516.PDF
2011-11-03,华天科技：国信证券股份有限公司关于公司非公开发行股票之上市保荐书,finalpage/2011-11-03/60153517.PDF
2011-11-03,华天科技：江苏永衡昭辉律师事务所关于公司非公开发行股票过程的法律意见书,finalpage/2011-11-03/60153518.PDF
2011-11-03,华天科技：非公开发行股票发行情况报告暨上市公告书,finalpage/2011-11-03/60153519.PDF
2011-11-03,华天科技：非公开发行股票发行情况报告暨上市公告书摘要,finalpage/2011-11-03/60153522.PDF
2011-11-05,华天科技：第三届董事会第十五次会议决议公告,finalpage/2011-11-05/60165974.PDF
2011-11-05,华天科技：关于使用募集资金对全资子公司华天科技（西安）有限公司增资的公告,finalpage/2011-11-05/60165975.PDF
2011-11-05,华天科技：关于用募集资金置换预先已投入募集资金投资项目的自筹资金的公告,finalpage/2011-11-05/60165976.PDF
2011-11-05,华天科技：关于签订募集资金三方监管协议的公告,finalpage/2011-11-05/60165977.PDF
2011-11-05,华天科技：国信证券股份有限公司关于公司以募集资金置换已预先投入募投项目的自筹资金的核查意见,finalpage/2011-11-05/60165978.PDF
2011-11-05,华天科技：关于公司以自筹资金预先投入募集资金投资项目的鉴证报告,finalpage/2011-11-05/60165979.PDF
2011-11-05,华天科技：公司章程（2011年11月）,finalpage/2011-11-05/60165980.PDF
2011-11-05,华天科技：独立董事关于用募集资金置换预先已投入募集资金投资项目的自筹资金的独立意见,finalpage/2011-11-05/60165981.PDF
2011-11-05,华天科技：第三届监事会第十次会议决议公告,finalpage/2011-11-05/60165982.PDF
2011-11-09,华天科技：关于全资子公司华天科技（西安）有限公司签订募集资金三方监管协议的公告,finalpage/2011-11-09/60178208.PDF
2011-11-25,华天科技：第三届董事会第十六次会议决议公告,finalpage/2011-11-25/60241737.PDF
2011-11-25,华天科技：内幕信息知情人登记管理制度（2011年11月）,finalpage/2011-11-25/60241738.PDF
2011-12-29,华天科技：关于获得2011年度集成电路产业研究与开发专项资金的公告,finalpage/2011-12-29/60381311.PDF
2012-01-10,华天科技：关于公司控股股东以及公司实际控制人增持公司股份的公告,finalpage/2012-01-10/60424039.PDF
2012-01-10,华天科技：更正公告,finalpage/2012-01-10/60424494.PDF
2012-02-10,华天科技：关于控股股东部分股权解除质押及重新质押的公告,finalpage/2012-02-10/60523842.PDF
2012-02-10,华天科技：关于部分董事、监事、高级管理人员购买公司股份以及实际控制人继续增持公司股份的公告,finalpage/2012-02-10/60523843.PDF
2012-02-29,华天科技：2011年度业绩快报,finalpage/2012-02-29/60599009.PDF
2012-03-13,华天科技：2011年度财务决算报告,finalpage/2012-03-13/60659824.PDF
2012-03-13,华天科技：2012年日常关联交易预计公告,finalpage/2012-03-13/60659826.PDF
2012-03-13,华天科技：2011年年度报告摘要,finalpage/2012-03-13/60659827.PDF
2012-03-13,华天科技：2011年年度报告（已取消）,finalpage/2012-03-13/60659828.PDF
2012-03-13,华天科技：2011年年度审计报告,finalpage/2012-03-13/60659829.PDF
2012-03-13,华天科技：第三届董事会第十七次会议决议公告,finalpage/2012-03-13/60659830.PDF
2012-03-13,华天科技：关于召开2011年年度股东大会的通知,finalpage/2012-03-13/60659831.PDF
2012-03-13,华天科技：第三届监事会第十一次会议决议公告,finalpage/2012-03-13/60659832.PDF
2012-03-13,华天科技：关于公司2011年度控股股东及其他关联方占用资金情况的专项说明,finalpage/2012-03-13/60659833.PDF
2012-03-13,华天科技：2011年度内部控制自我评价报告,finalpage/2012-03-13/60659834.PDF
2012-03-13,华天科技：内部控制鉴证报告,finalpage/2012-03-13/60659835.PDF
2012-03-13,华天科技：董事会关于募集资金年度存放与使用情况的专项报告（2011年度）,finalpage/2012-03-13/60659836.PDF
2012-03-13,华天科技：募集资金年度存放与使用情况鉴证报告,finalpage/2012-03-13/60659837.PDF
2012-03-13,华天科技：独立董事关于公司第三届董事会第十七次会议审议相关事项的独立意见,finalpage/2012-03-13/60659838.PDF
2012-03-13,华天科技：2011年度独立董事述职报告,finalpage/2012-03-13/60659839.PDF
2012-03-13,华天科技：关于举行2011年度网上业绩说明会的通知,finalpage/2012-03-13/60659840.PDF
2012-03-13,华天科技：国信证券股份有限公司关于公司2011年度内部控制自我评价报告的核查意见,finalpage/2012-03-13/60659841.PDF
2012-03-13,华天科技：国信证券股份有限公司关于公司2011年度募集资金存放与使用情况的专项核查报告,finalpage/2012-03-13/60659843.PDF
2012-03-13,华天科技：保荐人国信证券股份有限公司关于公司2012年日常关联交易预计的意见,finalpage/2012-03-13/60659844.PDF
2012-03-13,华天科技：公司章程（2012年3月）,finalpage/2012-03-13/60659845.PDF
2012-03-13,华天科技：风险投资管理制度（2012年3月）,finalpage/2012-03-13/60659846.PDF
2012-04-12,华天科技：2011年年度报告（更新后）,finalpage/2012-04-12/60816639.PDF
2012-04-12,华天科技：关于2011年年度报告的补充公告,finalpage/2012-04-12/60816640.PDF
2012-04-17,华天科技：监事辞职公告,finalpage/2012-04-17/60839697.PDF
2012-04-17,华天科技：董事辞职公告,finalpage/2012-04-17/60839698.PDF
2012-04-25,华天科技：2012年第一季度报告正文,finalpage/2012-04-25/60899892.PDF
2012-04-25,华天科技：2012年第一季度报告全文,finalpage/2012-04-25/60899894.PDF
2012-04-25,华天科技：第三届监事会第十二次会议决议公告,finalpage/2012-04-25/60899895.PDF
2012-04-25,华天科技：第三届董事会第十八次会议决议公告,finalpage/2012-04-25/60899896.PDF
2012-04-25,华天科技：独立董事关于公司补选董事及聘任公司总经理的独立意见,finalpage/2012-04-25/60899897.PDF
2012-04-26,华天科技：关于2011年年度股东大会增加临时议案的通知,finalpage/2012-04-26/60910297.PDF
2012-05-10,华天科技：关于控股股东部分股权质押的公告,finalpage/2012-05-10/60975468.PDF
2012-05-17,华天科技：第三届董事会第十九次会议决议公告,finalpage/2012-05-17/61008012.PDF
2012-05-17,华天科技：关于设立矿业公司的公告,finalpage/2012-05-17/61008013.PDF
2012-05-17,华天科技：国信证券股份有限公司关于公司合资设立矿业公司的核查意见,finalpage/2012-05-17/61008014.PDF
2012-05-17,华天科技：关于公司投资设立矿业公司的法律意见书,finalpage/2012-05-17/61008015.PDF
2012-05-17,华天科技：独立董事关于合资设立矿业公司的独立意见,finalpage/2012-05-17/61008016.PDF
2012-05-29,华天科技：2011年年度股东大会决议公告,finalpage/2012-05-29/61056935.PDF
2012-05-29,华天科技：2011年年度股东大会法律意见书,finalpage/2012-05-29/61056936.PDF
2012-06-08,华天科技：第三届董事会第二十次会议决议公告,finalpage/2012-06-08/61109605.PDF
2012-06-08,华天科技：关于设立矿业公司进展的公告,finalpage/2012-06-08/61109606.PDF
2012-06-16,华天科技：关于为全资子公司华天科技（西安）有限公司提供贷款担保的公告,finalpage/2012-06-16/61144252.PDF
2012-06-16,华天科技：第三届董事会第二十一次会议决议公告,finalpage/2012-06-16/61144253.PDF
2012-06-22,华天科技：简式权益变动报告书,finalpage/2012-06-22/61170102.PDF
2012-06-22,华天科技：股东减持股份公告,finalpage/2012-06-22/61170105.PDF
2012-07-06,华天科技：2011年年度权益分派实施公告,finalpage/2012-07-06/61229990.PDF
2012-07-09,华天科技：澄清公告,finalpage/2012-07-09/61243339.PDF
2012-07-11,华天科技：国信证券股份有限公司关于公司参与设立化工新材料产业股权投资基金的核查意见,finalpage/2012-07-11/61250322.PDF
2012-07-11,华天科技：对外投资暨关联交易公告,finalpage/2012-07-11/61250323.PDF
2012-07-11,华天科技：独立董事关于公司对外投资暨关联交易的独立意见,finalpage/2012-07-11/61250324.PDF
2012-07-11,华天科技：第三届董事会第二十二次会议决议公告,finalpage/2012-07-11/61250325.PDF
2012-07-18,华天科技：控股股东及实际控制人增持公司股份进展公告,finalpage/2012-07-18/61282324.PDF
2012-07-25,华天科技：2012半年度业绩快报,finalpage/2012-07-25/61317745.PDF
2012-08-25,华天科技：关于更改2012年半年度报告披露日期的公告,finalpage/2012-08-25/61477193.PDF
2012-08-28,华天科技：2012年半年度报告摘要,finalpage/2012-08-28/61489900.PDF
2012-08-28,华天科技：2012年半年度报告,finalpage/2012-08-28/61489922.PDF
2012-08-28,华天科技：2012年半年度财务报告,finalpage/2012-08-28/61489936.PDF
2012-08-28,华天科技：第三届董事会第二十三次会议决议公告,finalpage/2012-08-28/61489937.PDF
2012-08-28,华天科技：独立董事对公司关联方资金占用和对外担保情况的专项说明和独立意见,finalpage/2012-08-28/61489938.PDF
2012-08-28,华天科技：公司章程（2012年8月）,finalpage/2012-08-28/61489939.PDF
2012-08-28,华天科技：关于召开2012年第一次临时股东大会的通知,finalpage/2012-08-28/61489940.PDF
2012-08-28,华天科技：对外投资公告,finalpage/2012-08-28/61489941.PDF
2012-09-17,华天科技：2012年第一次临时股东大会决议公告,finalpage/2012-09-17/61578725.PDF
2012-09-17,华天科技：2012年第一次临时股东大会法律意见书,finalpage/2012-09-17/61578726.PDF
2012-09-25,华天科技：关于控股股东、实际控制人及一致行动人完成增持本公司股份计划的公告,finalpage/2012-09-25/61604670.PDF
2012-09-25,华天科技：江苏永衡昭辉律师事务所关于控股股东及实际控制人增持公司股份的法律意见书,finalpage/2012-09-25/61604671.PDF
2012-09-29,华天科技：关于证券事务代表辞职的公告,finalpage/2012-09-29/61622386.PDF
2012-10-13,华天科技：关于2012年1-9月业绩预告的修正公告,finalpage/2012-10-13/61650855.PDF
2012-10-20,华天科技：2012年第三季度报告正文,finalpage/2012-10-20/61678863.PDF
2012-10-20,华天科技：2012年第三季度报告全文,finalpage/2012-10-20/61678864.PDF
2012-10-20,华天科技：第三届董事会第二十四次会议决议公告,finalpage/2012-10-20/61678865.PDF
2012-10-31,华天科技：关于公司、股东及关联方承诺履行情况的公告,finalpage/2012-10-31/61738025.PDF
2012-11-01,华天科技：国信证券股份有限公司关于公司限售股份上市流通相关事项的保荐意见,finalpage/2012-11-01/61746504.PDF
2012-11-01,华天科技：非公开发行限售股份上市流通提示性公告,finalpage/2012-11-01/61746505.PDF
2012-11-03,华天科技：关于签订管理昆山西钛微电子科技有限公司股权的股权委托管理协议的公告,finalpage/2012-11-03/61756290.PDF
2012-11-23,华天科技：关于控股股东部分股权解除质押及重新质押的公告,finalpage/2012-11-23/61827969.PDF
2012-12-22,华天科技：关于获得2012年度集成电路产业研究与开发专项资金的公告,finalpage/2012-12-22/61936999.PDF
2013-01-22,华天科技：2012年度业绩预告修正公告,finalpage/2013-01-22/62049959.PDF
2013-02-05,华天科技：关于子公司天水中核华天矿业有限公司工作进展的公告,finalpage/2013-02-05/62107800.PDF
2013-02-23,华天科技：公开发行可转换公司债券募集资金运用可行性分析报告,finalpage/2013-02-23/62145156.PDF
2013-02-23,华天科技：关于召开2013年第一次临时股东大会的通知,finalpage/2013-02-23/62145157.PDF
2013-02-23,华天科技：关于拟受让深圳市汉迪创业投资有限公司持有的昆山西钛微电子科技有限公司28.85%股权的公告,finalpage/2013-02-23/62145158.PDF
2013-02-23,华天科技：关于前次募集资金使用情况的专项报告,finalpage/2013-02-23/62145159.PDF
2013-02-23,华天科技：关于公司截至2012年12月31日止前次募集资金使用情况鉴证报告,finalpage/2013-02-23/62145160.PDF
2013-02-23,华天科技：第三届监事会第十五次会议决议公告,finalpage/2013-02-23/62145161.PDF
2013-02-23,华天科技：第三届董事会第二十五次会议决议公告,finalpage/2013-02-23/62145162.PDF
2013-02-28,华天科技：2012年度业绩快报,finalpage/2013-02-28/62160673.PDF
2013-03-09,华天科技：关于召开2013年第一次临时股东大会的提示性公告,finalpage/2013-03-09/62196420.PDF
2013-03-14,华天科技：2012年度监事会工作报告,finalpage/2013-03-14/62211317.PDF
2013-03-14,华天科技：2012年度财务决算报告,finalpage/2013-03-14/62211318.PDF
2013-03-14,华天科技：2012年年度报告摘要,finalpage/2013-03-14/62211319.PDF
2013-03-14,华天科技：2012年年度报告,finalpage/2013-03-14/62211320.PDF
2013-03-14,华天科技：2012年年度审计报告,finalpage/2013-03-14/62211327.PDF
2013-03-14,华天科技：第三届董事会第二十六次会议决议公告,finalpage/2013-03-14/62211328.PDF
2013-03-14,华天科技：关于召开2012年年度股东大会的通知,finalpage/2013-03-14/62211329.PDF
2013-03-14,华天科技：第三届监事会第十六次会议决议公告,finalpage/2013-03-14/62211330.PDF
2013-03-14,华天科技：关于公司2012年度控股股东及其他关联方占用资金情况之专项说明,finalpage/2013-03-14/62211331.PDF
2013-03-14,华天科技：2012年度内部控制自我评价报告,finalpage/2013-03-14/62211332.PDF
2013-03-14,华天科技：内部控制鉴证报告,finalpage/2013-03-14/62211333.PDF
2013-03-14,华天科技：董事会关于募集资金年度存放与使用情况的专项报告（2012年度）,finalpage/2013-03-14/62211334.PDF
2013-03-14,华天科技：关于公司2012年度募集资金存放与使用情况之鉴证报告,finalpage/2013-03-14/62211335.PDF
2013-03-14,华天科技：独立董事关于公司第三届董事会第二十六次会议审议相关事项的独立意见,finalpage/2013-03-14/62211336.PDF
2013-03-14,华天科技：2012年度独立董事述职报告,finalpage/2013-03-14/62211337.PDF
2013-03-14,华天科技：独立董事提名人声明（三）,finalpage/2013-03-14/62211338.PDF
2013-03-14,华天科技：独立董事提名人声明（二）,finalpage/2013-03-14/62211339.PDF
2013-03-14,华天科技：独立董事提名人声明（一）,finalpage/2013-03-14/62211340.PDF
2013-03-14,华天科技：2013年日常关联交易预计的公告,finalpage/2013-03-14/62211341.PDF
2013-03-14,华天科技：关于举行2012年度网上业绩说明会的通知,finalpage/2013-03-14/62211342.PDF
2013-03-14,华天科技：关于解除管理昆山西钛微电子科技有限公司股权的股权委托管理协议的公告,finalpage/2013-03-14/62211343.PDF
2013-03-14,华天科技：内部控制规则落实自查表,finalpage/2013-03-14/62211344.PDF
2013-03-14,华天科技：国信证券股份有限公司关于公司2012年度内部控制自我评价报告的核查意见,finalpage/2013-03-14/62211345.PDF
2013-03-14,华天科技：国信证券股份有限公司关于公司2012年度募集资金存放与使用情况的专项核查报告,finalpage/2013-03-14/62211346.PDF
2013-03-14,华天科技：国信证券股份有限公司关于公司内部控制规则落实自查表的核查意见,finalpage/2013-03-14/62211347.PDF
2013-03-14,华天科技：独立董事候选人声明（李敬道）,finalpage/2013-03-14/62211348.PDF
2013-03-14,华天科技：独立董事候选人声明（毕克允）,finalpage/2013-03-14/62211349.PDF
2013-03-14,华天科技：独立董事候选人声明（董云庭）,finalpage/2013-03-14/62211350.PDF
2013-03-15,华天科技：2013年第一次临时股东大会决议公告,finalpage/2013-03-15/62214968.PDF
2013-03-15,华天科技：2013年第一次临时股东大会法律意见书,finalpage/2013-03-15/62214969.PDF
2013-04-22,华天科技：2013年第一季度报告正文,finalpage/2013-04-22/62394424.PDF
2013-04-22,华天科技：2013年第一季度报告全文,finalpage/2013-04-22/62394425.PDF
2013-04-22,华天科技：第三届董事会第二十七次会议决议公告,finalpage/2013-04-22/62394426.PDF
2013-04-22,华天科技：公司章程（2013年4月）,finalpage/2013-04-22/62394429.PDF
2013-04-22,华天科技：关于2012年年度股东大会增加临时议案的通知,finalpage/2013-04-22/62394430.PDF
2013-05-14,华天科技：公开发行可转换公司债券募集资金运用可行性分析报告（修订）,finalpage/2013-05-14/62486480.PDF
2013-05-14,华天科技：独立董事关于公司第三届董事会第二十八次会议审议相关事项的独立意见,finalpage/2013-05-14/62486481.PDF
2013-05-14,华天科技：第三届董事会第二十八次会议决议公告,finalpage/2013-05-14/62486482.PDF
2013-05-28,华天科技：二届二次员工会员代表大会决议公告,finalpage/2013-05-28/62528153.PDF
2013-05-29,华天科技：2012年年度股东大会决议公告,finalpage/2013-05-29/62531550.PDF
2013-05-29,华天科技：2012年年度股东大会的法律意见书,finalpage/2013-05-29/62531551.PDF
2013-05-29,华天科技：第四届监事会第一次会议决议公告,finalpage/2013-05-29/62531552.PDF
2013-05-29,华天科技：第四届董事会第一次会议决议公告,finalpage/2013-05-29/62531553.PDF
2013-05-29,华天科技：独立董事关于聘任公司高级管理人员的独立意见,finalpage/2013-05-29/62531554.PDF
2013-06-06,华天科技：关于参加“甘肃省上市公司2012年度业绩集体说明会”的公告,finalpage/2013-06-06/62561971.PDF
2013-06-15,华天科技：2012年年度权益分派实施公告,finalpage/2013-06-15/62582777.PDF
2013-06-20,华天科技：关于前次募集资金使用情况的专项报告,finalpage/2013-06-20/62595932.PDF
2013-06-20,华天科技：关于公司截至2012年12月31日止前次募集资金使用情况鉴证报告,finalpage/2013-06-20/62595933.PDF
2013-06-20,华天科技：第四届董事会第三次会议决议公告,finalpage/2013-06-20/62595934.PDF
2013-07-04,华天科技：关于公开发行可转换公司债券申请获发审委审核通过的公告,finalpage/2013-07-04/62769041.PDF
2013-07-04,华天科技：关于控股子公司竞得挂牌出让的金矿探矿权的公告,finalpage/2013-07-04/62769042.PDF
2013-07-05,华天科技：关于公司审计机构名称变更的公告,finalpage/2013-07-05/62772847.PDF
2013-07-30,华天科技：关于公开发行可转换公司债券获得核准的公告,finalpage/2013-07-30/62884480.PDF
2013-08-08,华天科技：公开发行可转换公司债券募集说明书,finalpage/2013-08-08/62917265.PDF
2013-08-08,华天科技：公开发行可转换公司债券募集说明书摘要,finalpage/2013-08-08/62917266.PDF
