,date,title,url
0,2007-01-31,东港股份：内部控制鉴证报告,finalpage/2007-01-31/20597083.PDF
1,2007-01-31,东港股份：公司章程（草案）,finalpage/2007-01-31/20597114.PDF
2,2007-01-31,东港股份：首次公开发行股票招股意向书（摘要）,finalpage/2007-01-31/20597138.PDF
3,2007-01-31,东港股份：首次公开发行A股初步询价及推介公告,finalpage/2007-01-31/20597154.PDF
4,2007-01-31,东港股份：内部控制鉴证报告,finalpage/2007-01-31/20597168.PDF
5,2007-01-31,东港股份：首次公开发行A 股初步询价表,finalpage/2007-01-31/20597174.PDF
6,2007-01-31,东港股份：首次公开发行股票初步询价参与回执,finalpage/2007-01-31/20597178.PDF
7,2007-01-31,东港股份：首次公开发行股票并上市之发行保荐书,finalpage/2007-01-31/20597182.PDF
8,2007-01-31,东港股份：非经常性损益专项审核报告,finalpage/2007-01-31/20597186.PDF
9,2007-01-31,东港股份：A 股发行、上市的法律意见书,finalpage/2007-01-31/20597191.PDF
10,2007-01-31,东港股份：A 股发行、上市出具法律意见书的律师工作报告,finalpage/2007-01-31/20597195.PDF
11,2007-01-31,东港股份：A 股发行、上市的补充法律意见书（一）,finalpage/2007-01-31/20597202.PDF
12,2007-01-31,东港股份：A 股发行、上市的补充法律意见书（二）,finalpage/2007-01-31/20597210.PDF
13,2007-01-31,东港股份：A 股发行、上市的补充法律意见书（三）,finalpage/2007-01-31/20597216.PDF
14,2007-01-31,东港股份：审计报告,finalpage/2007-01-31/20597221.PDF
15,2007-01-31,东港股份：A 股发行、上市的补充法律意见书（四）,finalpage/2007-01-31/20597225.PDF
16,2007-01-31,东港股份：中国证监会关于核准公司首次公开发行股票的通知,finalpage/2007-01-31/20599643.PDF
17,2007-02-06,东港股份：首次公开发行A股网上路演公告,finalpage/2007-02-06/20722716.PDF
18,2007-02-07,东港股份：首次公开发行股票招股说明书摘要,finalpage/2007-02-07/20756814.PDF
19,2007-02-07,东港股份：首次公开发行股票招股说明书,finalpage/2007-02-07/20756810.PDF
20,2007-02-07,东港股份：首次公开发行A股初步询价结果及定价公告,finalpage/2007-02-07/20756692.PDF
21,2007-02-07,东港股份：首次公开发行A股网下向询价对象配售和网上向社会公众投资者定价发行公告,finalpage/2007-02-07/20756698.PDF
22,2007-02-12,东港股份：首次公开发行A股网下配售结果公告,finalpage/2007-02-12/20862995.PDF
23,2007-02-13,东港股份：首次公开发行A股网上定价发行申购情况及中签率公告,finalpage/2007-02-13/20892683.PDF
24,2007-02-14,东港股份：首次公开发行A股网上定价发行摇号中签结果公告,finalpage/2007-02-14/20926228.PDF
25,2007-03-01,东港股份：首次公开发行股票上市公告书,finalpage/2007-03-01/21093758.PDF
26,2007-03-01,东港股份：东方证券股份有限公司关于公司股票上市保荐书,finalpage/2007-03-01/21093760.PDF
27,2007-03-01,东港股份：首次公开发行股票申请上市的法律意见书,finalpage/2007-03-01/21093764.PDF
28,2007-03-17,东港股份：2006年年度报告摘要,finalpage/2007-03-17/21567139.PDF
29,2007-03-17,东港股份：2006年年度报告,finalpage/2007-03-17/21567143.PDF
30,2007-03-17,东港股份：关于召开2006年年度股东大会的公告,finalpage/2007-03-17/21567156.PDF
31,2007-03-17,东港股份：关于用募集资金置换预先已投入募集资金投资项目的自筹资金的公告,finalpage/2007-03-17/21567138.PDF
32,2007-03-17,东港股份：关于运用部分闲置募集资金补充流动资金的公告,finalpage/2007-03-17/21567140.PDF
33,2007-03-17,东港股份：关于签订募集资金三方监管协议的公告,finalpage/2007-03-17/21567141.PDF
34,2007-03-17,东港股份：信息披露管理制度,finalpage/2007-03-17/21567144.PDF
35,2007-03-17,东港股份：2006年年度财务报告之审计报告,finalpage/2007-03-17/21567146.PDF
36,2007-03-17,东港股份：关联方占用上市公司资金情况的专项说明,finalpage/2007-03-17/21567147.PDF
37,2007-03-17,东港股份：新旧会计准则股东权益差异调节表的审阅报告,finalpage/2007-03-17/21567148.PDF
38,2007-03-17,东港股份：以自筹资金预先投入募集资金投资项目情况的专项审核意见,finalpage/2007-03-17/21567152.PDF
39,2007-03-17,东港股份：第二届董事会第五次会议决议公告,finalpage/2007-03-17/21567153.PDF
40,2007-03-17,东港股份：第二届监事会第二次会议决议公告,finalpage/2007-03-17/21567158.PDF
41,2007-03-17,东港股份：关联交易公告,finalpage/2007-03-17/21567160.PDF
42,2007-03-17,东港股份：日常关联交易公告,finalpage/2007-03-17/21567161.PDF
43,2007-03-17,东港股份：独立董事关于第二届董事会第五次会议相关议案的独立意见,finalpage/2007-03-17/21567162.PDF
44,2007-03-17,东港股份：独立董事2006年度述职报告（刘洪渭）,finalpage/2007-03-17/21567163.PDF
45,2007-03-17,东港股份：独立董事2006年度述职报告（王文福）,finalpage/2007-03-17/21567165.PDF
46,2007-03-17,东港股份：独立董事2006年度述职报告（武文祥）,finalpage/2007-03-17/21567166.PDF
47,2007-03-17,东港股份：募集资金管理办法,finalpage/2007-03-17/21567167.PDF
48,2007-03-17,东港股份：投资者关系管理制度,finalpage/2007-03-17/21567182.PDF
49,2007-03-20,东港股份：关于2007年自有资金项目实施情况的公告,finalpage/2007-03-20/21577525.PDF
50,2007-03-23,东港股份：关于举行2006年年度报告网上说明会的公告,finalpage/2007-03-23/21708121.PDF
51,2007-04-05,东港股份：第二届董事会第六次会议决议公告,finalpage/2007-04-05/22448117.PDF
52,2007-04-05,东港股份：关于公司第三大股东北京中嘉华投资咨询有限公司提议增加2006年度股东大会议案暨关于召开2006年度股东大会的补充通知,finalpage/2007-04-05/22448120.PDF
53,2007-04-10,东港股份：关于召开2006年年度股东大会的提示性公告,finalpage/2007-04-10/22571998.PDF
54,2007-04-14,东港股份：2006年度股东大会的决议公告,finalpage/2007-04-14/22739945.PDF
55,2007-04-14,东港股份：2006年度股东大会的法律意见书,finalpage/2007-04-14/22739948.PDF
56,2007-04-24,东港股份：2007年第一季度季度报告,finalpage/2007-04-24/22982564.PDF
57,2007-04-24,东港股份：第二届董事会第七次会议决议公告,finalpage/2007-04-24/22982565.PDF
58,2007-05-25,东港股份：2006年度分红派息公告,finalpage/2007-05-25/23768048.PDF
59,2007-05-29,东港股份：网下配售股票上市流通的提示性公告,finalpage/2007-05-29/23821681.PDF
60,2007-06-29,东港股份：注册资本及经营范围变更的公告,finalpage/2007-06-29/29447593.PDF
61,2007-06-29,东港股份：第二届董事会第八次会议决议公告,finalpage/2007-06-29/29447605.PDF
62,2007-06-29,东港股份：关于变更部分募集资金项目实施地点和实施方式的公告,finalpage/2007-06-29/29447606.PDF
63,2007-06-29,东港股份：信息披露管理制度,finalpage/2007-06-29/29447608.PDF
64,2007-07-20,东港股份：第二届董事会第九次会议决议公告,finalpage/2007-07-20/30061976.PDF
65,2007-07-20,东港股份：募集资金管理办法,finalpage/2007-07-20/30061983.PDF
66,2007-07-20,东港股份：公司章程,finalpage/2007-07-20/30061984.PDF
67,2007-07-20,东港股份：关于“上市公司治理专项活动”自查情况的报告,finalpage/2007-07-20/30061986.PDF
68,2007-08-04,东港股份：重大投资决策程序,finalpage/2007-08-04/30490807.PDF
69,2007-08-04,东港股份：董事会秘书工作细则,finalpage/2007-08-04/30490809.PDF
70,2007-08-04,东港股份：独立董事制度,finalpage/2007-08-04/30490810.PDF
71,2007-08-04,东港股份：控股股东、实际控制人行为规范,finalpage/2007-08-04/30490811.PDF
72,2007-08-04,东港股份：2007年半年度报告摘要,finalpage/2007-08-04/30490812.PDF
73,2007-08-04,东港股份：2007年半年度报告,finalpage/2007-08-04/30490813.PDF
74,2007-08-04,东港股份：2007年半年度财务报告,finalpage/2007-08-04/30490814.PDF
75,2007-08-04,东港股份：第二届董事会第十次会议决议公告,finalpage/2007-08-04/30490815.PDF
76,2007-08-04,东港股份：投资者关系管理制度,finalpage/2007-08-04/30490816.PDF
77,2007-08-04,东港股份：监事会议事规则,finalpage/2007-08-04/30490817.PDF
78,2007-08-04,东港股份：股东大会议事规则,finalpage/2007-08-04/30490818.PDF
79,2007-08-04,东港股份：董事会议事规则,finalpage/2007-08-04/30490819.PDF
80,2007-08-04,东港股份：第二届监事会第三次会议决议公告,finalpage/2007-08-04/30490825.PDF
81,2007-08-07,东港股份：董事会公告,finalpage/2007-08-07/30523457.PDF
82,2007-08-25,东港股份：第二届董事会第十次会议决议公告,finalpage/2007-08-25/31052258.PDF
83,2007-08-25,东港股份：关于继续将部分闲置募集资金补充流动资金的公告,finalpage/2007-08-25/31052259.PDF
84,2007-08-25,东港股份：关于召开2007年第一次临时股东大会的公告,finalpage/2007-08-25/31052260.PDF
85,2007-09-15,东港股份：2007年第一次临时股东大会决议公告,finalpage/2007-09-15/31698733.PDF
86,2007-09-15,东港股份：2007年第一次临时股东大会的法律意见书,finalpage/2007-09-15/31698732.PDF
87,2007-09-18,东港股份：关于运用部分闲置募集资金补充公司流动资金的归还公告,finalpage/2007-09-18/31732534.PDF
88,2007-10-25,东港股份：第二届董事会第十二次会议公告,finalpage/2007-10-25/34755402.PDF
89,2007-10-25,东港股份：2007年第三季度报告,finalpage/2007-10-25/34755404.PDF
90,2007-10-31,东港股份：第二届董事会第十三次会议公告,finalpage/2007-10-31/34938525.PDF
91,2007-10-31,东港股份：上市公司治理专项活动整改报告,finalpage/2007-10-31/34938526.PDF
92,2007-12-19,东港股份：第二届董事会第十四次会议公告,finalpage/2007-12-19/36083530.PDF
93,2008-01-03,东港股份：关于召开2008年第一次临时股东大会的公告,finalpage/2008-01-03/36390490.PDF
94,2008-01-10,东港股份：关于会计师事务所更名的公告,finalpage/2008-01-10/36587718.PDF
95,2008-01-29,东港股份：2007年年度报告摘要,finalpage/2008-01-29/37018960.PDF
96,2008-01-29,东港股份：2008年第一次临时股东大会的法律意见书,finalpage/2008-01-29/37018956.PDF
97,2008-01-29,东港股份：2008年第一次临时股东大会决议公告,finalpage/2008-01-29/37018957.PDF
98,2008-01-29,东港股份：日常关联交易公告,finalpage/2008-01-29/37018958.PDF
99,2008-01-29,东港股份：董事会关于募集资金年度使用情况的专项报告,finalpage/2008-01-29/37018959.PDF
100,2008-01-29,东港股份：2007年年度报告,finalpage/2008-01-29/37018961.PDF
101,2008-01-29,东港股份：2007年年度报告之审计报告,finalpage/2008-01-29/37018962.PDF
102,2008-01-29,东港股份：第二届董事会第十五次会议公告,finalpage/2008-01-29/37018963.PDF
103,2008-01-29,东港股份：关于召开2007年年度股东大会的公告,finalpage/2008-01-29/37018964.PDF
104,2008-01-29,东港股份：第二届监事会第五次会议决议公告,finalpage/2008-01-29/37018965.PDF
105,2008-01-29,东港股份：公司就东港安全印刷股份有限公司2008年度日常关联交易所发表的意见,finalpage/2008-01-29/37018966.PDF
106,2008-01-29,东港股份：募集资金使用情况的专项审核报告,finalpage/2008-01-29/37018968.PDF
107,2008-01-29,东港股份：关于公司关联方占用上市公司资金情况的专项审核报告,finalpage/2008-01-29/37018969.PDF
108,2008-01-29,东港股份：第二届董事会第十五次会议独立董事对相关议案的独立意见,finalpage/2008-01-29/37018970.PDF
109,2008-01-29,东港股份：独立董事2007年度述职报告（刘洪渭）,finalpage/2008-01-29/37018971.PDF
110,2008-01-29,东港股份：独立董事2007年度述职报告（武文祥）,finalpage/2008-01-29/37018972.PDF
111,2008-02-02,东港股份：关于2007年年度报告更正的公告,finalpage/2008-02-02/37173430.PDF
112,2008-02-02,东港股份：关于举行2007年年度报告网上说明会的公告,finalpage/2008-02-02/37173431.PDF
113,2008-02-02,东港股份：2007年年度报告（更正后）,finalpage/2008-02-02/37173432.PDF
114,2008-02-02,东港股份：新旧会计准则股东权益和净利润差异调节表的审阅报告,finalpage/2008-02-02/37173433.PDF
115,2008-02-26,东港股份：2007年度股东大会决议公告,finalpage/2008-02-26/37519226.PDF
116,2008-02-26,东港股份：2007年度股东大会的法律意见书,finalpage/2008-02-26/37519227.PDF
117,2008-02-29,东港股份：首次公开发行前已发行股份上市流通提示性公告,finalpage/2008-02-29/37615134.PDF
118,2008-04-09,东港股份：关于运用部分闲置募集资金补充公司流动资金的归还公告,finalpage/2008-04-09/38601661.PDF
119,2008-04-14,东港股份：2007年度分红派息公告,finalpage/2008-04-14/38730148.PDF
120,2008-04-25,东港股份：第二届董事会第十六次会议决议公告,finalpage/2008-04-25/39119280.PDF
121,2008-04-25,东港股份：2008年第一季度报告,finalpage/2008-04-25/39119283.PDF
122,2008-04-25,东港股份：审计委员会对年度财务报告审议工作规则,finalpage/2008-04-25/39119286.PDF
123,2008-04-25,东港股份：独立董事年报工作制度,finalpage/2008-04-25/39119288.PDF
124,2008-05-29,东港股份：第二届董事会第十七次会议决议公告,finalpage/2008-05-29/40070292.PDF
125,2008-05-29,东港股份：公司章程（2008年5月）,finalpage/2008-05-29/40070293.PDF
126,2008-07-12,东港股份：第二届董事会第十八次会议决议公告,finalpage/2008-07-12/41204995.PDF
127,2008-07-12,东港股份：中长期发展规划（草案）,finalpage/2008-07-12/41204996.PDF
128,2008-07-19,东港股份：关于公司治理专项活动整改报告中所列事项整改情况的说明,finalpage/2008-07-19/41375269.PDF
129,2008-07-19,东港股份：第二届董事会第十九次会议决议公告,finalpage/2008-07-19/41375270.PDF
130,2008-07-19,东港股份：董事、监事、高级管理人员持股及变动管理制度,finalpage/2008-07-19/41375271.PDF
131,2008-07-19,东港股份：防止大股东及关联方占用资金制度,finalpage/2008-07-19/41375272.PDF
132,2008-07-25,东港股份：2008年半年度业绩快报,finalpage/2008-07-25/41567862.PDF
133,2008-07-26,东港股份：关于召开2008年第二次临时股东大会的公告,finalpage/2008-07-26/41568821.PDF
134,2008-07-26,东港股份：第二届董事会第二十次会议决议公告,finalpage/2008-07-26/41568822.PDF
135,2008-08-12,东港股份：关于公司2008年第二次临时股东大会的法律意见书,finalpage/2008-08-12/42039846.PDF
136,2008-08-12,东港股份：2008年第二次临时股东大会决议公告,finalpage/2008-08-12/42039847.PDF
137,2008-08-16,东港股份：2008年半年度报告,finalpage/2008-08-16/42172371.PDF
138,2008-08-16,东港股份：第二届监事会第七次会议决议公告,finalpage/2008-08-16/42172093.PDF
139,2008-08-16,东港股份：2008年半年度报告摘要,finalpage/2008-08-16/42172094.PDF
140,2008-08-16,东港股份：2008年半年度财务报告,finalpage/2008-08-16/42172095.PDF
141,2008-08-16,东港股份：第二届董事会第二十一次会议决议公告,finalpage/2008-08-16/42172096.PDF
142,2008-08-16,东港股份：独立董事关于关联方资金占用和对外担保情况的专项说明,finalpage/2008-08-16/42172098.PDF
143,2008-10-25,东港股份：2008年第三季度报告,finalpage/2008-10-25/45586191.PDF
144,2008-10-31,东港股份：关联交易公告,finalpage/2008-10-31/45841594.PDF
145,2008-10-31,东港股份：第二届董事会第二十三次会议决议公告,finalpage/2008-10-31/45841593.PDF
146,2008-10-31,东港股份：第二届监事会第九次会议决议公告,finalpage/2008-10-31/45841595.PDF
147,2008-10-31,东港股份：东方证券股份有限公司就公司和日照大地伊索新建材有限公司之间关联交易的独立意见,finalpage/2008-10-31/45841596.PDF
148,2008-10-31,东港股份：独立董事对《关于向日照大地依索新建材有限公司关联采购建筑材料的议案》的独立意见,finalpage/2008-10-31/45841597.PDF
149,2008-11-08,东港股份：关于召开2008年第三次临时股东大会的公告,finalpage/2008-11-08/46122242.PDF
150,2008-11-08,东港股份：第二届董事会第二十四次会议决议公告,finalpage/2008-11-08/46122241.PDF
151,2008-11-08,东港股份：董事会议事规则,finalpage/2008-11-08/46122243.PDF
152,2008-11-08,东港股份：关联交易管理办法,finalpage/2008-11-08/46122244.PDF
153,2008-11-08,东港股份：公司章程（2008年11月）,finalpage/2008-11-08/46122245.PDF
154,2008-11-26,东港股份：2008年第三次临时股东大会决议公告,finalpage/2008-11-26/46653746.PDF
155,2008-11-26,东港股份：2008年第三次临时股东大会的法律意见书,finalpage/2008-11-26/46653745.PDF
156,2008-12-11,东港股份：第二届董事会第二十五次会议决议公告,finalpage/2008-12-11/47191066.PDF
157,2009-02-05,东港股份：关于获得高新技术企业认定的公告,finalpage/2009-02-05/48818608.PDF
158,2009-02-24,东港股份：2008年度业绩快报,finalpage/2009-02-24/49443605.PDF
159,2009-03-06,东港股份：董事会2008年度内部控制的自我评价报告,finalpage/2009-03-06/49842295.PDF
160,2009-03-06,东港股份：2008年度董事会工作报告,finalpage/2009-03-06/49842296.PDF
161,2009-03-06,东港股份：日常关联交易公告,finalpage/2009-03-06/49842297.PDF
162,2009-03-06,东港股份：董事会关于募集资金年度使用情况的专项报告,finalpage/2009-03-06/49842298.PDF
163,2009-03-06,东港股份：2008年年度报告摘要,finalpage/2009-03-06/49842299.PDF
164,2009-03-06,东港股份：2008年年度报告,finalpage/2009-03-06/49842300.PDF
165,2009-03-06,东港股份：2008年年度审计报告,finalpage/2009-03-06/49842301.PDF
166,2009-03-06,东港股份：第二届董事会第二十六次会议公告,finalpage/2009-03-06/49842302.PDF
167,2009-03-06,东港股份：第二届监事会第十次会议决议公告,finalpage/2009-03-06/49842303.PDF
168,2009-03-06,东港股份：东方证券股份有限公司关于公司《2008 年度内部控制的自我评价报告》的核查意见,finalpage/2009-03-06/49842304.PDF
169,2009-03-06,东港股份：关于关联方占用上市公司资金情况的专项审核报告,finalpage/2009-03-06/49842305.PDF
170,2009-03-06,东港股份：募集资金年度使用情况的鉴证报告,finalpage/2009-03-06/49842306.PDF
171,2009-03-06,东港股份：第二届董事会第二十六次会议独立董事对相关议案的独立意见,finalpage/2009-03-06/49842307.PDF
172,2009-03-06,东港股份：独立董事2008年度述职报告（刘洪渭）,finalpage/2009-03-06/49842308.PDF
173,2009-03-06,东港股份：独立董事2008年度述职报告（武文祥）,finalpage/2009-03-06/49842309.PDF
174,2009-03-06,东港股份：独立董事2008年度述职报告（王桂森）,finalpage/2009-03-06/49842310.PDF
175,2009-03-10,东港股份：关于举行2008年度报告网上说明会的公告,finalpage/2009-03-10/49948938.PDF
176,2009-04-02,东港股份：关于召开2008年度股东大会的公告,finalpage/2009-04-02/50897703.PDF
177,2009-04-02,东港股份：第二届董事会第二十七次会议公告,finalpage/2009-04-02/50897704.PDF
178,2009-04-02,东港股份：关于增加募集资金项目实施地点的公告,finalpage/2009-04-02/50897705.PDF
179,2009-04-02,东港股份：东方证券股份有限公司关于公司增加部分募集资金投资项目实施地点的核查意见,finalpage/2009-04-02/50897706.PDF
180,2009-04-02,东港股份：独立董事关于对《关于增加数据处理及可变印刷、邮发封装系统开发应用项目实施地点的议案》的意见,finalpage/2009-04-02/50897707.PDF
181,2009-04-21,东港股份：第二届董事会第二十八次会议公告,finalpage/2009-04-21/51493974.PDF
182,2009-04-21,东港股份：2009年第一季度报告,finalpage/2009-04-21/51493976.PDF
183,2009-04-24,东港股份：2008年度股东大会决议公告,finalpage/2009-04-24/51680955.PDF
184,2009-04-24,东港股份：2008年度股东大会的法律意见书,finalpage/2009-04-24/51680956.PDF
185,2009-05-14,东港股份：2008年度权益分派实施公告,finalpage/2009-05-14/52449279.PDF
186,2009-05-14,东港股份：董事会公告,finalpage/2009-05-14/52449278.PDF
187,2009-05-19,东港股份：关于董事会换届选举的公告,finalpage/2009-05-19/52607978.PDF
188,2009-05-19,东港股份：关于监事会换届选举的公告,finalpage/2009-05-19/52607979.PDF
189,2009-06-09,东港股份：第二届董事会第二十九次会议公告,finalpage/2009-06-09/53265204.PDF
190,2009-06-09,东港股份：第二届监事会第十二次会议决议公告,finalpage/2009-06-09/53265205.PDF
191,2009-06-09,东港股份：关于选举职工代表监事的公告,finalpage/2009-06-09/53265206.PDF
192,2009-06-09,东港股份：独立董事候选人声明（汤云为、郑钢、刘素英）,finalpage/2009-06-09/53265207.PDF
193,2009-06-09,东港股份：独立董事关于对提名董事候选人的独立意见,finalpage/2009-06-09/53265208.PDF
194,2009-06-09,东港股份：独立董事提名人声明,finalpage/2009-06-09/53265209.PDF
195,2009-07-23,东港股份：2009年中期业绩快报,finalpage/2009-07-23/54964627.PDF
196,2009-07-29,东港股份：第二届董事会第三十次会议公告,finalpage/2009-07-29/55167676.PDF
197,2009-07-29,东港股份：关于召开2009年第一次临时股东大会的公告,finalpage/2009-07-29/55167677.PDF
198,2009-08-20,东港股份：2009年第一次临时股东大会的法律意见书,finalpage/2009-08-20/56102424.PDF
199,2009-08-20,东港股份：2009年第一次临时股东大会决议公告,finalpage/2009-08-20/56102425.PDF
200,2009-08-21,东港股份：2009年半年度报告,finalpage/2009-08-21/56160545.PDF
201,2009-08-21,东港股份：2009年半年度财务报告,finalpage/2009-08-21/56160548.PDF
202,2009-08-21,东港股份：2009年半年度报告摘要,finalpage/2009-08-21/56160426.PDF
203,2009-08-21,东港股份：第三届董事会第一次会议公告,finalpage/2009-08-21/56160427.PDF
204,2009-08-21,东港股份：第三届监事会第一次会议公告,finalpage/2009-08-21/56160428.PDF
205,2009-08-21,东港股份：独立董事对第三届董事会第一次会议相关事项的独立意见,finalpage/2009-08-21/56160429.PDF
206,2009-10-24,东港股份：2009年第三季度报告,finalpage/2009-10-24/57194719.PDF
207,2009-11-12,东港股份：2009年公开增发A股募集资金投资项目可行性分析报告,finalpage/2009-11-12/57281812.PDF
208,2009-11-12,东港股份：第三届董事会第三次会议公告,finalpage/2009-11-12/57281813.PDF
209,2009-11-12,东港股份：董事会关于前次募集资金使用情况的报告,finalpage/2009-11-12/57281814.PDF
210,2009-11-12,东港股份：前次募集资金使用情况的专项审核报告,finalpage/2009-11-12/57281815.PDF
211,2009-11-12,东港股份：募集资金管理办法（2009年11月）,finalpage/2009-11-12/57281816.PDF
212,2009-11-12,东港股份：独立董事关于本次公开增发股票前滚存利润分配的独立意见,finalpage/2009-11-12/57281817.PDF
213,2009-11-26,东港股份：第三届董事会第四次会议公告,finalpage/2009-11-26/57331788.PDF
214,2009-11-26,东港股份：关于为控股子公司申请银行授信提供担保的公告,finalpage/2009-11-26/57331789.PDF
215,2009-11-26,东港股份：关于召开2009年第二次临时股东大会的公告,finalpage/2009-11-26/57331790.PDF
216,2009-12-01,东港股份：关于举行公开增发人民币普通股（A股）说明会的公告,finalpage/2009-12-01/57346861.PDF
217,2009-12-08,东港股份：关于召开2009年第二次临时股东大会的提示性公告,finalpage/2009-12-08/57373031.PDF
218,2009-12-12,东港股份：2009年第二次临时股东大会决议公告,finalpage/2009-12-12/57390978.PDF
219,2009-12-12,东港股份：2009年第二次临时股东大会的法律意见书,finalpage/2009-12-12/57390979.PDF
220,2009-12-19,东港股份：关于股东国有股股权性质变更的公告,finalpage/2009-12-19/57415314.PDF
221,2010-01-30,东港股份：关于更换保荐代表人的公告,finalpage/2010-01-30/57560059.PDF
222,2010-02-05,东港股份：2009年年度报告,finalpage/2010-02-05/57581138.PDF
223,2010-02-05,东港股份：关于举行2009年度报告网上说明会的公告,finalpage/2010-02-05/57581063.PDF
224,2010-02-05,东港股份：东方证券股份有限公司关于公司《2009年度内部控制的自我评价报告》的核查意见,finalpage/2010-02-05/57581064.PDF
225,2010-02-05,东港股份：董事会关于前次募集资金使用情况的专项报告,finalpage/2010-02-05/57581065.PDF
226,2010-02-05,东港股份：关于为控股子公司提供财务资助的公告,finalpage/2010-02-05/57581066.PDF
227,2010-02-05,东港股份：2009年年度报告摘要,finalpage/2010-02-05/57581067.PDF
228,2010-02-05,东港股份：2009年年度审计报告,finalpage/2010-02-05/57581068.PDF
229,2010-02-05,东港股份：第三届董事会第五次会议公告,finalpage/2010-02-05/57581069.PDF
230,2010-02-05,东港股份：关于召开2009年度股东大会的公告,finalpage/2010-02-05/57581070.PDF
231,2010-02-05,东港股份：第三届监事会第三次会议决议公告,finalpage/2010-02-05/57581071.PDF
