,date,title,url
232,2010-02-05,东港股份：关于公司关联方占用上市公司资金情况的专项审核报告,finalpage/2010-02-05/57581072.PDF
233,2010-02-05,东港股份：董事会2009年度内部控制的自我评价报告,finalpage/2010-02-05/57581073.PDF
234,2010-02-05,东港股份：内部控制鉴证报告,finalpage/2010-02-05/57581074.PDF
235,2010-02-05,东港股份：募集资金年度使用情况的专项报告,finalpage/2010-02-05/57581075.PDF
236,2010-02-05,东港股份：关于公司募集资金年度使用情况的鉴证报告,finalpage/2010-02-05/57581076.PDF
237,2010-02-05,东港股份：独立董事对第三届董事会第五次会议相关议案的独立意见,finalpage/2010-02-05/57581077.PDF
238,2010-02-05,东港股份：独立董事2009年度述职报告,finalpage/2010-02-05/57581078.PDF
239,2010-02-05,东港股份：东方证券股份有限公司关于公司对控股子公司提供财务资助的保荐意见,finalpage/2010-02-05/57581079.PDF
240,2010-02-05,东港股份：关于公司前次募集资金使用情况的专项审核报告,finalpage/2010-02-05/57581080.PDF
241,2010-02-27,东港股份：2009年度股东大会决议公告,finalpage/2010-02-27/57631796.PDF
242,2010-02-27,东港股份：2009年度股东大会的法律意见书,finalpage/2010-02-27/57631797.PDF
243,2010-03-02,东港股份：2009年度权益分派实施公告,finalpage/2010-03-02/57639621.PDF
244,2010-03-02,东港股份：首次公开发行前已发行股份上市流通提示性公告,finalpage/2010-03-02/57639124.PDF
245,2010-03-02,东港股份：东方证券股份有限公司关于公司限售股份上市流通的核查报告,finalpage/2010-03-02/57639125.PDF
246,2010-03-27,东港股份：第三届董事会第六次会议公告,finalpage/2010-03-27/57735915.PDF
247,2010-03-27,东港股份：内幕信息知情人管理制度（2010年3月）,finalpage/2010-03-27/57735916.PDF
248,2010-03-27,东港股份：年报信息披露重大差错责任追究制度（2010年3月）,finalpage/2010-03-27/57735917.PDF
249,2010-04-24,东港股份：第三届董事会第七次会议公告,finalpage/2010-04-24/57862477.PDF
250,2010-04-24,东港股份：2010年第一季度报告正文,finalpage/2010-04-24/57862478.PDF
251,2010-04-24,东港股份：2010年第一季度报告全文,finalpage/2010-04-24/57862480.PDF
252,2010-04-24,东港股份：关于《东港安全印刷股份有限公司关于前次募集资金使用情况的说明》的专项审核报告,finalpage/2010-04-24/57862481.PDF
253,2010-04-24,东港股份：关于前次募集资金使用情况的说明,finalpage/2010-04-24/57862482.PDF
254,2010-05-20,东港股份：关于公司股东名称变更的公告,finalpage/2010-05-20/57971135.PDF
255,2010-06-01,东港股份：第三届董事会第八次会议公告,finalpage/2010-06-01/58014909.PDF
256,2010-06-01,东港股份：募集资金管理办法（2010年5月）,finalpage/2010-06-01/58014910.PDF
257,2010-07-17,东港股份：关于公开增发A股股票获发审会审核通过的公告,finalpage/2010-07-17/58183873.PDF
258,2010-08-10,东港股份：第三届董事会第九次会议公告,finalpage/2010-08-10/58281875.PDF
259,2010-08-10,东港股份：重大投资公告,finalpage/2010-08-10/58281876.PDF
260,2010-08-10,东港股份：关于召开2010年第一次临时股东大会的公告,finalpage/2010-08-10/58281877.PDF
261,2010-08-27,东港股份：2010年半年度报告,finalpage/2010-08-27/58362133.PDF
262,2010-08-27,东港股份：2010年半年度财务报告,finalpage/2010-08-27/58362136.PDF
263,2010-08-27,东港股份：2010年半年度报告摘要,finalpage/2010-08-27/58361796.PDF
264,2010-08-27,东港股份：独立董事关于关联方资金占用和对外担保情况的专项说明,finalpage/2010-08-27/58361797.PDF
265,2010-08-28,东港股份：2010年第一次临时股东大会决议公告,finalpage/2010-08-28/58367310.PDF
266,2010-08-28,东港股份：2010年第一次临时股东大会的法律意见书,finalpage/2010-08-28/58367311.PDF
267,2010-09-04,东港股份：关于公开增发A股股票获得中国证监会核准的公告,finalpage/2010-09-04/58400526.PDF
268,2010-09-08,东港股份：增发招股意向书摘要,finalpage/2010-09-08/58413589.PDF
269,2010-09-08,东港股份：增发A股网下发行公告,finalpage/2010-09-08/58413601.PDF
270,2010-09-08,东港股份：增发A股网上发行公告,finalpage/2010-09-08/58413603.PDF
271,2010-09-08,东港股份：东方证券股份有限公司关于公司增发发行保荐书,finalpage/2010-09-08/58413548.PDF
272,2010-09-08,东港股份：增发A股网上路演公告,finalpage/2010-09-08/58413549.PDF
273,2010-09-08,东港股份：江苏泰和律师事务所关于公司2009年公开增发股票并上市的法律意见书,finalpage/2010-09-08/58413550.PDF
274,2010-09-08,东港股份：江苏泰和律师事务所关于公司2009年公开增发股票并上市的补充法律意见书（一）,finalpage/2010-09-08/58413551.PDF
275,2010-09-08,东港股份：江苏泰和律师事务所关于公司2009年公开增发股票并上市的补充法律意见书（三）,finalpage/2010-09-08/58413552.PDF
276,2010-09-08,东港股份：江苏泰和律师事务所关于公司2009年公开增发股票并上市的补充法律意见书（二）,finalpage/2010-09-08/58413553.PDF
277,2010-09-08,东港股份：增发招股意向书,finalpage/2010-09-08/58413599.PDF
278,2010-09-10,东港股份：增发A股提示性公告,finalpage/2010-09-10/58422534.PDF
279,2010-09-15,东港股份：增发A股发行结果公告,finalpage/2010-09-15/58439986.PDF
280,2010-09-29,东港股份：东方证券股份有限公司关于公司公开增发新股上市保荐书,finalpage/2010-09-29/58481428.PDF
281,2010-09-29,东港股份：股份变动及增发A股上市公告书,finalpage/2010-09-29/58481431.PDF
282,2010-09-30,东港股份：第三届董事会第十一次会议公告,finalpage/2010-09-30/58486876.PDF
283,2010-09-30,东港股份：关于以募集资金置换已投入募集资金投资项目的自筹资金的公告,finalpage/2010-09-30/58486877.PDF
284,2010-09-30,东港股份：关于签订募集资金三方监管协议的公告,finalpage/2010-09-30/58486878.PDF
285,2010-09-30,东港股份：关于召开2010年第二次临时股东大会的公告,finalpage/2010-09-30/58486879.PDF
286,2010-09-30,东港股份：第三届监事会第六次会议决议公告,finalpage/2010-09-30/58486880.PDF
287,2010-09-30,东港股份：东方证券股份有限公司关于公司使用募集资金置换预先投入募集资金投资项目的自筹资金之专项意见,finalpage/2010-09-30/58486881.PDF
288,2010-09-30,东港股份：独立董事对以募集资金置换已投入募集资金项目的自筹资金的独立意见,finalpage/2010-09-30/58486882.PDF
289,2010-09-30,东港股份：关于公司以自筹资金预先投入募集资金投资项目情况的审核报告,finalpage/2010-09-30/58486883.PDF
290,2010-10-16,东港股份：2010年第二次临时股东大会决议公告,finalpage/2010-10-16/58530848.PDF
291,2010-10-16,东港股份：2010年第二次临时股东大会的法律意见书,finalpage/2010-10-16/58530849.PDF
292,2010-10-23,东港股份：2010年第三季度报告正文,finalpage/2010-10-23/58560239.PDF
293,2010-10-23,东港股份：2010年第三季度报告全文,finalpage/2010-10-23/58560240.PDF
294,2010-11-03,东港股份：第三届董事会第十三次会议公告,finalpage/2010-11-03/58615257.PDF
295,2010-11-03,东港股份：关于使用部分闲置募集资金暂时补充流动资金的公告,finalpage/2010-11-03/58615258.PDF
296,2010-11-03,东港股份：第三届监事会第八次会议决议公告,finalpage/2010-11-03/58615259.PDF
297,2010-11-03,东港股份：关于召开2010年第三次临时股东大会的公告,finalpage/2010-11-03/58615260.PDF
298,2010-11-03,东港股份：东方证券股份有限公司关于公司使用部分闲置募集资金暂时补充流动资金事项的保荐意见,finalpage/2010-11-03/58615261.PDF
299,2010-11-03,东港股份：独立董事对使用募集资金暂时补充流动资金的意见,finalpage/2010-11-03/58615262.PDF
300,2010-11-16,东港股份：关于召开2010年第三次临时股东大会的提示性公告,finalpage/2010-11-16/58666925.PDF
301,2010-11-16,东港股份：关于签订募集资金三方监管补充协议的公告,finalpage/2010-11-16/58666926.PDF
302,2010-11-19,东港股份：2010年第三次临时股东大会决议公告,finalpage/2010-11-19/58681800.PDF
303,2010-11-19,东港股份：2010年第三次临时股东大会的法律意见书,finalpage/2010-11-19/58681801.PDF
304,2010-11-24,东港股份：关于完成工商变更登记的公告,finalpage/2010-11-24/58697969.PDF
305,2010-12-10,东港股份：关于更换保荐代表人的公告,finalpage/2010-12-10/58765152.PDF
306,2011-01-26,东港股份：第三届董事会第十四次会议公告,finalpage/2011-01-26/58948009.PDF
307,2011-01-26,东港股份：重大投资计划调整公告,finalpage/2011-01-26/58948011.PDF
308,2011-01-26,东港股份：关于增加募集资金项目实施地点的公告,finalpage/2011-01-26/58948013.PDF
309,2011-01-26,东港股份：东方证券股份有限公司关于公司公开增发募集资金投资项目增加实施地点的保荐意见,finalpage/2011-01-26/58948016.PDF
310,2011-01-26,东港股份：独立董事关于对《关于增加综合金融服务外包项目实施地点及建立北京分公司、上海分公司的议案》的意见,finalpage/2011-01-26/58948017.PDF
311,2011-02-11,东港股份：第三届董事会第十五次会议公告,finalpage/2011-02-11/58984167.PDF
312,2011-02-11,东港股份：关于召开2011年第一次临时股东大会的公告,finalpage/2011-02-11/58984170.PDF
313,2011-02-24,东港股份：2010年度业绩快报,finalpage/2011-02-24/59037494.PDF
314,2011-03-01,东港股份：2011年第一次临时股东大会的法律意见书,finalpage/2011-03-01/59059194.PDF
315,2011-03-01,东港股份：2011年第一次临时股东大会决议公告,finalpage/2011-03-01/59059195.PDF
316,2011-03-02,东港股份：2010年年度报告摘要,finalpage/2011-03-02/59064228.PDF
317,2011-03-02,东港股份：2010年年度报告,finalpage/2011-03-02/59064229.PDF
318,2011-03-02,东港股份：2010年年度审计报告,finalpage/2011-03-02/59064230.PDF
319,2011-03-02,东港股份：第三届董事会第十六次会议公告,finalpage/2011-03-02/59064231.PDF
320,2011-03-02,东港股份：关于召开2010年度股东大会的通知,finalpage/2011-03-02/59064232.PDF
321,2011-03-02,东港股份：第三届监事会第九次会议决议公告,finalpage/2011-03-02/59064233.PDF
322,2011-03-02,东港股份：关联方占用上市公司资金情况的专项审核报告,finalpage/2011-03-02/59064234.PDF
323,2011-03-02,东港股份：2010年度内部控制的自我评价报告,finalpage/2011-03-02/59064235.PDF
324,2011-03-02,东港股份：内部控制制度报告,finalpage/2011-03-02/59064236.PDF
325,2011-03-02,东港股份：关于募集资金年度存放与使用情况的专项报告,finalpage/2011-03-02/59064237.PDF
326,2011-03-02,东港股份：关于公司募集资金年度存放与使用情况的鉴证报告,finalpage/2011-03-02/59064238.PDF
327,2011-03-02,东港股份：独立董事对第三届董事会第十六次会议相关议案的独立意见,finalpage/2011-03-02/59064239.PDF
328,2011-03-02,东港股份：独立董事2010年度述职报告,finalpage/2011-03-02/59064240.PDF
329,2011-03-02,东港股份：东方证券股份有限公司关于公司2010年度募集资金存放和使用情况的专项核查意见,finalpage/2011-03-02/59064241.PDF
330,2011-03-02,东港股份：东方证券股份有限公司关于公司《2010年度内部控制的自我评价报告》的核查意见,finalpage/2011-03-02/59064242.PDF
331,2011-03-03,东港股份：关于举行2010年年度报告网上说明会的公告,finalpage/2011-03-03/59069364.PDF
332,2011-03-25,东港股份：第三届董事会第十七次会议公告,finalpage/2011-03-25/59170088.PDF
333,2011-03-25,东港股份：关于召开2010年度股东大会的补充通知,finalpage/2011-03-25/59170089.PDF
334,2011-03-25,东港股份：关于使用部分闲置募集资金暂时补充流动资金的公告,finalpage/2011-03-25/59170090.PDF
335,2011-03-25,东港股份：第三届监事会第十次会议决议公告,finalpage/2011-03-25/59170091.PDF
336,2011-03-25,东港股份：东方证券股份有限公司关于公司使用部分闲置募集资金暂时补充流动资金事项的保荐意见,finalpage/2011-03-25/59170092.PDF
337,2011-03-25,东港股份：独立董事对使用募集资金暂时补充流动资金的意见,finalpage/2011-03-25/59170093.PDF
338,2011-04-07,东港股份：关于召开2010年度股东大会的提示性公告,finalpage/2011-04-07/59228694.PDF
339,2011-04-12,东港股份：2010年度股东大会决议公告,finalpage/2011-04-12/59252655.PDF
340,2011-04-12,东港股份：2010年度股东大会的法律意见书,finalpage/2011-04-12/59252657.PDF
341,2011-04-21,东港股份：2011年第一季度报告正文,finalpage/2011-04-21/59303419.PDF
342,2011-04-21,东港股份：2011年第一季度报告全文,finalpage/2011-04-21/59303420.PDF
343,2011-05-20,东港股份：关于归还暂时用于补充流动资金的闲置募集资金的公告,finalpage/2011-05-20/59451950.PDF
344,2011-05-20,东港股份：2010年度权益分派实施公告,finalpage/2011-05-20/59451951.PDF
345,2011-05-30,东港股份：停牌公告,finalpage/2011-05-30/59485219.PDF
346,2011-05-31,东港股份：限制性股票激励计划实施考核办法（2011年5月）,finalpage/2011-05-31/59494241.PDF
347,2011-05-31,东港股份：2011年限制性股票授权人员名单,finalpage/2011-05-31/59494242.PDF
348,2011-05-31,东港股份：第三届董事会第十九次会议公告,finalpage/2011-05-31/59494243.PDF
349,2011-05-31,东港股份：第三届监事会第十二次会议决议公告,finalpage/2011-05-31/59494244.PDF
350,2011-05-31,东港股份：独立董事关于公司限制性股票激励计划（草案）的独立意见,finalpage/2011-05-31/59494245.PDF
351,2011-05-31,东港股份：监事会关于公司限制性股票激励计划授予激励对象名单的核查意见,finalpage/2011-05-31/59494246.PDF
352,2011-05-31,东港股份：限制性股票激励计划（草案）摘要,finalpage/2011-05-31/59494247.PDF
353,2011-05-31,东港股份：限制性股票激励计划（草案）,finalpage/2011-05-31/59494248.PDF
354,2011-08-26,东港股份：2011年半年度报告摘要,finalpage/2011-08-26/59875201.PDF
355,2011-08-26,东港股份：2011年半年度报告,finalpage/2011-08-26/59875203.PDF
356,2011-08-26,东港股份：2011年半年度审计报告,finalpage/2011-08-26/59875204.PDF
357,2011-08-26,东港股份：独立董事关于关联方资金占用和对外担保情况的专项说明,finalpage/2011-08-26/59875205.PDF
358,2011-09-10,东港股份：2011年限制性股票授权人员名单（修订）,finalpage/2011-09-10/59946224.PDF
359,2011-09-10,东港股份：第三届董事会第二十一次会议公告,finalpage/2011-09-10/59946225.PDF
360,2011-09-10,东港股份：关于注销公司上海办事处的公告,finalpage/2011-09-10/59946226.PDF
361,2011-09-10,东港股份：第三届监事会第十四次会议决议公告,finalpage/2011-09-10/59946227.PDF
362,2011-09-10,东港股份：关于召开2011年第二次临时股东大会的公告,finalpage/2011-09-10/59946228.PDF
363,2011-09-10,东港股份：江苏泰和律师事务所关于公司限制性股票激励计划（草案）进行调整的法律意见书,finalpage/2011-09-10/59946229.PDF
364,2011-09-10,东港股份：江苏泰和律师事务所关于公司限制性股票激励计划（草案）的法律意见书,finalpage/2011-09-10/59946230.PDF
365,2011-09-10,东港股份：关于修订《限制性股票激励计划（草案）》的说明,finalpage/2011-09-10/59946231.PDF
366,2011-09-10,东港股份：内部控制规则落实情况的自查报告,finalpage/2011-09-10/59946232.PDF
367,2011-09-10,东港股份：东方证券股份有限公司关于公司内部控制规则落实情况自查表的核查意见,finalpage/2011-09-10/59946233.PDF
368,2011-09-10,东港股份：独立董事关于《限制性股票激励计划（修订稿）》的独立意见,finalpage/2011-09-10/59946234.PDF
369,2011-09-10,东港股份：独立董事公开征集委托投票权报告书,finalpage/2011-09-10/59946235.PDF
370,2011-09-10,东港股份：监事会关于对限制性股票授权人员名单（修订）的核查意见,finalpage/2011-09-10/59946236.PDF
371,2011-09-10,东港股份：限制性股票激励计划（修订稿）,finalpage/2011-09-10/59946237.PDF
372,2011-09-10,东港股份：限制性股票激励计划（修订稿）摘要,finalpage/2011-09-10/59946238.PDF
373,2011-09-24,东港股份：关于通过银联卡产品企业资格认证的公告,finalpage/2011-09-24/59992836.PDF
374,2011-09-27,东港股份：关于召开2011年第二次临时股东大会的提示性公告,finalpage/2011-09-27/60003413.PDF
375,2011-09-30,东港股份：2011年第二次临时股东大会决议公告,finalpage/2011-09-30/60021891.PDF
376,2011-09-30,东港股份：关于签订委托代办股份转让协议的公告,finalpage/2011-09-30/60021892.PDF
377,2011-09-30,东港股份：2011年第二次临时股东大会的法律意见书,finalpage/2011-09-30/60021893.PDF
378,2011-10-18,东港股份：对外担保制度（2011年10月）,finalpage/2011-10-18/60069539.PDF
379,2011-10-18,东港股份：股东大会议事规则（2011年10月）,finalpage/2011-10-18/60069540.PDF
380,2011-10-18,东港股份：第三届董事会第二十二次会议公告,finalpage/2011-10-18/60069541.PDF
381,2011-10-18,东港股份：关于使用部分闲置募集资金暂时补充流动资金的公告,finalpage/2011-10-18/60069542.PDF
382,2011-10-18,东港股份：关于召开2011年第三次临时股东大会的通知,finalpage/2011-10-18/60069543.PDF
383,2011-10-18,东港股份：第三届监事会第十五次会议决议公告,finalpage/2011-10-18/60069544.PDF
384,2011-10-18,东港股份：董事会议事规则（2011年10月）,finalpage/2011-10-18/60069545.PDF
385,2011-10-18,东港股份：2011年第三季度报告正文,finalpage/2011-10-18/60069546.PDF
386,2011-10-18,东港股份：2011年第三季度报告全文,finalpage/2011-10-18/60069547.PDF
387,2011-10-18,东港股份：东方证券股份有限公司关于公司使用部分闲置募集资金暂时补充流动资金事项的保荐意见,finalpage/2011-10-18/60069548.PDF
388,2011-10-18,东港股份：独立董事对使用募集资金暂时补充流动资金的意见,finalpage/2011-10-18/60069549.PDF
389,2011-10-20,东港股份：2011年限制性股票授权人员名单,finalpage/2011-10-20/60079996.PDF
390,2011-10-20,东港股份：第三届董事会第二十三次会议公告,finalpage/2011-10-20/60079997.PDF
391,2011-10-20,东港股份：第三届监事会第十六次会议决议公告,finalpage/2011-10-20/60079998.PDF
392,2011-10-20,东港股份：关于向激励对象授予限制性股票的公告,finalpage/2011-10-20/60079999.PDF
393,2011-10-20,东港股份：江苏泰和律师事务所关于公司限制性股票激励计划股票授予相关事项的法律意见书,finalpage/2011-10-20/60080000.PDF
394,2011-10-20,东港股份：独立董事关于限制性股票激励计划授予相关事项的独立意见,finalpage/2011-10-20/60080001.PDF
395,2011-11-03,东港股份：限制性股票授予完成的公告,finalpage/2011-11-03/60153633.PDF
396,2011-11-08,东港股份：股东权益变动提示性公告,finalpage/2011-11-08/60173710.PDF
397,2011-11-08,东港股份：关于召开2011年第三次临时股东大会的提示性公告,finalpage/2011-11-08/60173711.PDF
398,2011-11-08,东港股份：简式权益变动报告书,finalpage/2011-11-08/60173712.PDF
399,2011-11-11,东港股份：2011年第三次临时股东大会决议公告,finalpage/2011-11-11/60187794.PDF
400,2011-11-11,东港股份：2011年第三次临时股东大会的法律意见书,finalpage/2011-11-11/60187795.PDF
401,2011-11-22,东港股份：关于归还暂时用于补充流动资金的闲置募集资金的公告,finalpage/2011-11-22/60228236.PDF
402,2011-11-26,东港股份：关于更换保荐代表人的公告,finalpage/2011-11-26/60246277.PDF
403,2012-02-08,东港股份：关于通过高新技术企业复审的公告,finalpage/2012-02-08/60513327.PDF
404,2012-02-17,东港股份：2011年度业绩快报,finalpage/2012-02-17/60551642.PDF
405,2012-02-28,东港股份：临时停牌的公告,finalpage/2012-02-28/60598708.PDF
406,2012-03-01,东港股份：关于为控股子公司申请银行授信提供担保的公告,finalpage/2012-03-01/60606806.PDF
407,2012-03-01,东港股份：关于授权北京东港安全印刷有限公司代为行使本公司对北京东港嘉华安全信息技术有限公司股东权利的公告,finalpage/2012-03-01/60606807.PDF
408,2012-03-01,东港股份：关于使用部分闲置募集资金暂时补充流动资金的公告,finalpage/2012-03-01/60606808.PDF
409,2012-03-01,东港股份：2011年年度报告摘要,finalpage/2012-03-01/60606809.PDF
410,2012-03-01,东港股份：2011年年度报告,finalpage/2012-03-01/60606810.PDF
411,2012-03-01,东港股份：2011年年度审计报告,finalpage/2012-03-01/60606811.PDF
412,2012-03-01,东港股份：第三届董事会第二十四次会议公告,finalpage/2012-03-01/60606812.PDF
413,2012-03-01,东港股份：关于召开2011年度股东大会的通知,finalpage/2012-03-01/60606813.PDF
414,2012-03-01,东港股份：第三届监事会第十七次会议决议公告,finalpage/2012-03-01/60606814.PDF
415,2012-03-01,东港股份：关联方占用上市公司资金情况的专项审核报告,finalpage/2012-03-01/60606815.PDF
416,2012-03-01,东港股份：2011年度内部控制的自我评价报告,finalpage/2012-03-01/60606816.PDF
417,2012-03-01,东港股份：内部控制专项报告,finalpage/2012-03-01/60606817.PDF
418,2012-03-01,东港股份：2011年关于募集资金年度存放与使用情况的专项报告,finalpage/2012-03-01/60606818.PDF
419,2012-03-01,东港股份：关于公司募集资金年度存放与使用情况的鉴证报告,finalpage/2012-03-01/60606819.PDF
420,2012-03-01,东港股份：独立董事对第三届董事会第二十四次会议相关议案的独立意见,finalpage/2012-03-01/60606820.PDF
421,2012-03-01,东港股份：独立董事2011年度述职报告,finalpage/2012-03-01/60606821.PDF
422,2012-03-01,东港股份：东方证券股份有限公司关于公司2011年度募集资金存放和使用情况的专项核查意见,finalpage/2012-03-01/60606822.PDF
423,2012-03-01,东港股份：东方证券股份有限公司关于公司使用部分闲置募集资金暂时补充流动资金事项的保荐意见,finalpage/2012-03-01/60606823.PDF
424,2012-03-01,东港股份：东方证券股份有限公司关于公司《2011年度内部控制的自我评价报告》的核查意见,finalpage/2012-03-01/60606824.PDF
425,2012-03-01,东港股份：公司章程（2012年2月）,finalpage/2012-03-01/60606825.PDF
426,2012-03-01,东港股份：内幕信息知情人管理制度（2012年2月）,finalpage/2012-03-01/60606828.PDF
427,2012-03-01,东港股份：控股子公司管理办法（2012年2月）,finalpage/2012-03-01/60606831.PDF
428,2012-03-01,东港股份：董事会2011年度工作报告,finalpage/2012-03-01/60606835.PDF
429,2012-03-02,东港股份：关于举行2011年年度报告网上说明会的公告,finalpage/2012-03-02/60611474.PDF
430,2012-03-17,东港股份：关于召开2011年度股东大会的提示性公告,finalpage/2012-03-17/60682333.PDF
431,2012-03-22,东港股份：2011年度股东大会决议公告,finalpage/2012-03-22/60706269.PDF
432,2012-03-22,东港股份：2011年度股东大会的法律意见书,finalpage/2012-03-22/60706270.PDF
433,2012-04-17,东港股份：2011年度权益分派实施公告,finalpage/2012-04-17/60840156.PDF
434,2012-04-18,东港股份：关于调整2012年第一季度报告披露时间的公告,finalpage/2012-04-18/60847081.PDF
435,2012-04-20,东港股份：2012年第一季度报告正文,finalpage/2012-04-20/60861851.PDF
436,2012-04-20,东港股份：2012年第一季度报告全文,finalpage/2012-04-20/60861852.PDF
437,2012-04-20,东港股份：第三届董事会第二十五次会议公告,finalpage/2012-04-20/60861853.PDF
438,2012-05-15,东港股份：关于举行2012年投资者网上接待日的公告,finalpage/2012-05-15/60995581.PDF
439,2012-05-22,东港股份：关于完成名称变更并取得营业执照的公告,finalpage/2012-05-22/61027308.PDF
440,2012-05-22,东港股份：关于完成工商注册变更的公告,finalpage/2012-05-22/61027309.PDF
441,2012-05-22,东港股份：关于归还暂时用于补充流动资金的闲置募集资金的公告,finalpage/2012-05-22/61027310.PDF
442,2012-07-13,东港股份：2012年半年度业绩预告修正公告,finalpage/2012-07-13/61260651.PDF
443,2012-07-28,东港股份：2012年半年度业绩快报,finalpage/2012-07-28/61334100.PDF
444,2012-08-22,东港股份：关于更换保荐代表人的公告,finalpage/2012-08-22/61457487.PDF
445,2012-08-25,东港股份：2012-2014年分红回报规划,finalpage/2012-08-25/61478543.PDF
446,2012-08-25,东港股份：关于使用部分闲置募集资金暂时补充流动资金的公告,finalpage/2012-08-25/61478544.PDF
447,2012-08-25,东港股份：关于增加募集资金项目实施地点的公告,finalpage/2012-08-25/61478545.PDF
448,2012-08-25,东港股份：独立董事提名人声明,finalpage/2012-08-25/61478546.PDF
449,2012-08-25,东港股份：关于召开2012年第一次临时股东大会的通知,finalpage/2012-08-25/61478547.PDF
