date,title,url
2016-05-27,中国海诚：关于召开2015年度股东大会的通知,finalpage/2016-05-27/1202340546.PDF
2016-06-01,中国海诚：关于诉讼事项的公告,finalpage/2016-06-01/1202347407.PDF
2016-06-21,中国海诚：第四届董事会第二十五次会议决议公告,finalpage/2016-06-21/1202376580.PDF
2016-06-21,中国海诚：关于使用自有资金购买银行理财产品的公告,finalpage/2016-06-21/1202376581.PDF
2016-06-21,中国海诚：关于全资子公司长沙公司开展外汇套期保值业务的公告,finalpage/2016-06-21/1202376582.PDF
2016-06-21,中国海诚：公司章程（2016年6月）,finalpage/2016-06-21/1202376583.PDF
2016-06-21,中国海诚：2015年度股东大会的法律意见书,finalpage/2016-06-21/1202376584.PDF
2016-06-21,中国海诚：独立董事相关事项独立意见,finalpage/2016-06-21/1202376585.PDF
2016-06-21,中国海诚：2015年度股东大会决议公告,finalpage/2016-06-21/1202376586.PDF
2016-07-01,中国海诚：关于公司股东及公司承诺履行情况的公告,finalpage/2016-07-01/1202440690.PDF
2016-07-13,中国海诚：第四届董事会第二十六次会议决议公告,finalpage/2016-07-13/1202468024.PDF
2016-07-13,中国海诚：第四届监事会第二十一次会议决议公告,finalpage/2016-07-13/1202468025.PDF
2016-07-13,中国海诚：关于召开2016年第一次临时股东大会的通知,finalpage/2016-07-13/1202468026.PDF
2016-07-13,中国海诚：独立董事关于相关事项的独立意见,finalpage/2016-07-13/1202468027.PDF
2016-07-13,中国海诚：独立董事候选人声明（李志强）,finalpage/2016-07-13/1202468028.PDF
2016-07-13,中国海诚：独立董事候选人声明（李文祥）,finalpage/2016-07-13/1202468029.PDF
2016-07-13,中国海诚：独立董事候选人声明（张一弛）,finalpage/2016-07-13/1202468030.PDF
2016-07-13,中国海诚：独立董事候选人声明（高凤勇）,finalpage/2016-07-13/1202468031.PDF
2016-07-13,中国海诚：独立董事提名人声明（一）,finalpage/2016-07-13/1202468032.PDF
2016-07-13,中国海诚：独立董事提名人声明（二）,finalpage/2016-07-13/1202468033.PDF
2016-07-13,中国海诚：独立董事提名人声明（三）,finalpage/2016-07-13/1202468034.PDF
2016-07-13,中国海诚：独立董事提名人声明（四）,finalpage/2016-07-13/1202468035.PDF
2016-07-19,中国海诚：2016半年度业绩快报,finalpage/2016-07-19/1202483352.PDF
2016-07-25,中国海诚：2015年度权益分派实施公告,finalpage/2016-07-25/1202499831.PDF
2016-07-28,中国海诚：关于设立投资公司完成工商登记的公告,finalpage/2016-07-28/1202510254.PDF
2016-07-29,中国海诚：2016年第一次临时股东大会的法律意见书,finalpage/2016-07-29/1202514033.PDF
2016-07-29,中国海诚：2016年第一次临时股东大会决议公告,finalpage/2016-07-29/1202514034.PDF
2016-08-02,中国海诚：关于职工代表监事选举结果的公告,finalpage/2016-08-02/1202524578.PDF
2016-08-02,中国海诚：关于2015年度权益分派方案实施后调整非公开发行股票发行价格和发行数量的公告,finalpage/2016-08-02/1202524579.PDF
2016-08-16,中国海诚：2016年半年度报告摘要,finalpage/2016-08-16/1202565285.PDF
2016-08-16,中国海诚：2016年半年度报告,finalpage/2016-08-16/1202565286.PDF
2016-08-16,中国海诚：2016年半年度财务报告,finalpage/2016-08-16/1202565287.PDF
2016-08-16,中国海诚：第五届董事会第一次会议决议公告,finalpage/2016-08-16/1202565288.PDF
2016-08-16,中国海诚：第五届监事会第一次会议决议公告,finalpage/2016-08-16/1202565289.PDF
2016-08-16,中国海诚：独立董事相关事项独立意见,finalpage/2016-08-16/1202565290.PDF
2016-08-16,中国海诚：关于调整公司股权激励计划股票期权行权价格的公告,finalpage/2016-08-16/1202565291.PDF
2016-08-16,中国海诚：国浩律师（上海）事务所关于公司首期股票期权激励计划股票期权行权价格调整的法律意见书,finalpage/2016-08-16/1202565292.PDF
2016-08-23,中国海诚：关于非公开发行股票申请获得中国证监会受理的公告,finalpage/2016-08-23/1202606703.PDF
2016-08-23,中国海诚：第五届董事会第二次会议决议公告,finalpage/2016-08-23/1202599330.PDF
2016-08-23,中国海诚：关于聘任董事会秘书及证券事务代表的公告,finalpage/2016-08-23/1202599332.PDF
2016-08-23,中国海诚：独立董事相关事项独立意见,finalpage/2016-08-23/1202599333.PDF
2016-09-20,中国海诚：关于收到《中国证监会行政许可项目审查反馈意见通知书》的公告,finalpage/2016-09-20/1202709820.PDF
2016-09-22,中国海诚：关于诉讼进展公告,finalpage/2016-09-22/1202719454.PDF
2016-09-23,中国海诚：2016年前三季度业绩预告修正公告,finalpage/2016-09-23/1202719639.PDF
2016-10-12,中国海诚：关于非公开发行股票申请文件反馈意见延期回复的公告,finalpage/2016-10-12/1202750262.PDF
2016-10-19,中国海诚：2016年第三季度报告正文,finalpage/2016-10-19/1202767121.PDF
2016-10-19,中国海诚：2016年第三季度报告全文,finalpage/2016-10-19/1202767122.PDF
2016-10-26,中国海诚：关于对深圳证券交易所2016年半年报问询函回复的公告,finalpage/2016-10-26/1202785522.PDF
2016-12-07,中国海诚：第五届董事会第四次会议决议公告,finalpage/2016-12-07/1202861551.PDF
2016-12-07,中国海诚：第五届监事会第三次会议决议公告,finalpage/2016-12-07/1202861552.PDF
2016-12-07,中国海诚：关于公司与关联企业长沙长泰智能装备有限公司签署附条件生效《借款协议》的公告,finalpage/2016-12-07/1202861553.PDF
2016-12-07,中国海诚：关于聘任2016年度审计机构的公告,finalpage/2016-12-07/1202861554.PDF
2016-12-07,中国海诚：关于召开2016年第二次临时股东大会的通知,finalpage/2016-12-07/1202861555.PDF
2016-12-07,中国海诚：关于控股股东中国轻工集团公司相关承诺事项的公告,finalpage/2016-12-07/1202861556.PDF
2016-12-07,中国海诚：重大诉讼进展公告,finalpage/2016-12-07/1202861557.PDF
2016-12-07,中国海诚：2016年度业绩预告修正公告,finalpage/2016-12-07/1202861558.PDF
2016-12-07,中国海诚：独立董事相关事项独立意见,finalpage/2016-12-07/1202861559.PDF
2016-12-07,中国海诚：长沙长泰智能装备有限公司2014年度、2015年度及2016年1-7月审计报告,finalpage/2016-12-07/1202861560.PDF
2016-12-07,中国海诚：拟对长沙长泰智能装备有限公司增资项目评估报告（基准日为2015年10月31日）,finalpage/2016-12-07/1202861561.PDF
2016-12-07,中国海诚：拟对长沙长泰智能装备有限公司增资项目评估说明（基准日为2015年10月31日）,finalpage/2016-12-07/1202861562.PDF
2016-12-07,中国海诚：拟对长沙长泰智能装备有限公司增资项目评估报告（基准日为2016年7月31日）,finalpage/2016-12-07/1202861563.PDF
2016-12-07,中国海诚：拟对长沙长泰智能装备有限公司增资项目评估说明（基准日为2016年7月31日）,finalpage/2016-12-07/1202861564.PDF
2016-12-07,中国海诚：关于非公开发行股票申请涉及补充评估相关情况的公告,finalpage/2016-12-07/1202861565.PDF
2016-12-07,中国海诚：关于《中国海诚工程科技股份有限公司2015年度非公开发行A股股票申请文件反馈意见》的回复,finalpage/2016-12-07/1202861566.PDF
2016-12-10,中国海诚：关于诉讼事项的公告,finalpage/2016-12-10/1202867178.PDF
2016-12-24,中国海诚：2016年第二次临时股东大会决议公告,finalpage/2016-12-24/1202955117.PDF
2016-12-24,中国海诚：2016年第二次临时股东大会的法律意见书,finalpage/2016-12-24/1202955118.PDF
2016-12-28,中国海诚：重大诉讼进展公告,finalpage/2016-12-28/1202964933.PDF
2017-01-14,中国海诚：2016年度业绩快报,finalpage/2017-01-14/1203014408.PDF
2017-01-20,中国海诚：关于修订非公开发行股票反馈意见回复的公告,finalpage/2017-01-20/1203030502.PDF
2017-01-20,中国海诚：关于《中国海诚工程科技股份有限公司2015年度非公开发行A股股票申请文件反馈意见》的回复（修订稿）,finalpage/2017-01-20/1203030503.PDF
2017-01-23,中国海诚：关于重大诉讼事项的公告,finalpage/2017-01-23/1203038647.PDF
2017-03-04,中国海诚：关于非公开发行股票申请获得中国证监会发行审核委员会审核通过的公告,finalpage/2017-03-04/1203130365.PDF
2017-03-14,中国海诚：关于诉讼进展的公告,finalpage/2017-03-14/1203154435.PDF
2017-03-21,中国海诚：关于控股股东中轻集团筹划重组事项的提示性公告,finalpage/2017-03-21/1203182233.PDF
2017-03-24,中国海诚：股票交易异常波动公告,finalpage/2017-03-24/1203189458.PDF
2017-04-11,中国海诚：关于副总裁辞职的公告,finalpage/2017-04-11/1203274256.PDF
2017-04-15,中国海诚：2016年年度报告摘要,finalpage/2017-04-15/1203299421.PDF
2017-04-15,中国海诚：第五届董事会第五次会议决议公告,finalpage/2017-04-15/1203299422.PDF
2017-04-15,中国海诚：关于召开2016年度股东大会的通知,finalpage/2017-04-15/1203299423.PDF
2017-04-15,中国海诚：第五届监事会第四次会议决议公告,finalpage/2017-04-15/1203299424.PDF
2017-04-15,中国海诚：独立董事2016年度述职报告,finalpage/2017-04-15/1203299425.PDF
2017-04-15,中国海诚：独立董事相关事项独立意见,finalpage/2017-04-15/1203299426.PDF
2017-04-15,中国海诚：2016年度内部控制自我评价报告,finalpage/2017-04-15/1203299427.PDF
2017-04-15,中国海诚：2017年第一季度报告正文,finalpage/2017-04-15/1203299428.PDF
2017-04-15,中国海诚：2017年第一季度报告全文,finalpage/2017-04-15/1203299429.PDF
2017-04-15,中国海诚：2017年度日常关联交易公告,finalpage/2017-04-15/1203299430.PDF
2017-04-15,中国海诚：关于首期第二批股权激励计划第二个行权期未达到行权条件的公告,finalpage/2017-04-15/1203299431.PDF
2017-04-15,中国海诚：关于延长非公开发行股票股东大会决议和授权有效期的公告,finalpage/2017-04-15/1203299432.PDF
2017-04-15,中国海诚：关于举行2016年度报告网上说明会的公告,finalpage/2017-04-15/1203299433.PDF
2017-04-15,中国海诚：国浩律师（上海）事务所关于公司首期第二批股票期权激励计划第二个行权期未达到行权条件予以注销事项的法律意见书,finalpage/2017-04-15/1203299434.PDF
2017-04-15,中国海诚：关于公司控股股东及其他关联方占用资金情况的专项说明,finalpage/2017-04-15/1203299435.PDF
2017-04-15,中国海诚：2016年年度审计报告,finalpage/2017-04-15/1203299436.PDF
2017-04-15,中国海诚：内部控制规则落实自查表,finalpage/2017-04-15/1203299437.PDF
2017-04-15,中国海诚：2016年年度报告,finalpage/2017-04-15/1203299438.PDF
2017-05-06,中国海诚：2016年度股东大会决议公告,finalpage/2017-05-06/1203481967.PDF
2017-05-06,中国海诚：公司章程（2017年5月）,finalpage/2017-05-06/1203481968.PDF
2017-05-06,中国海诚：2016年度股东大会的法律意见书,finalpage/2017-05-06/1203481969.PDF
2017-06-23,中国海诚：2016年度权益分派实施公告,finalpage/2017-06-23/1203641625.PDF
2017-06-30,中国海诚：关于2016年度权益分派方案实施后调整非公开发行股票发行价格和发行数量的公告,finalpage/2017-06-30/1203663422.PDF
2017-07-13,中国海诚：关于使用自有资金购买银行理财产品的公告,finalpage/2017-07-13/1203699551.PDF
2017-07-18,中国海诚：2017年半年度业绩快报,finalpage/2017-07-18/1203709660.PDF
2017-07-27,中国海诚：关于2017年第二季度订单数据及重大项目进展的公告,finalpage/2017-07-27/1203735559.PDF
2017-08-17,中国海诚：企业价值评估报告书,finalpage/2017-08-17/1203806009.PDF
2017-08-17,中国海诚：独立董事相关事项独立意见,finalpage/2017-08-17/1203806010.PDF
2017-08-17,中国海诚：关于非公开发行股票申请涉及补充评估相关情况的公告,finalpage/2017-08-17/1203806011.PDF
2017-08-17,中国海诚：第五届董事会第六次会议决议公告,finalpage/2017-08-17/1203806012.PDF
2017-08-22,中国海诚：关于控股股东中国轻工集团公司与中国保利集团公司重组事项获得国务院国资委批复的提示性公告,finalpage/2017-08-22/1203835375.PDF
2017-08-23,中国海诚：关于董事、独立董事辞职的公告,finalpage/2017-08-23/1203846867.PDF
2017-08-30,中国海诚：2017年半年度报告摘要,finalpage/2017-08-30/1203894534.PDF
2017-08-30,中国海诚：第五届监事会第五次会议决议公告,finalpage/2017-08-30/1203894535.PDF
2017-08-30,中国海诚：关于会计政策变更的公告,finalpage/2017-08-30/1203894536.PDF
2017-08-30,中国海诚：关于调整公司首期第二批股权激励计划行权价格的公告,finalpage/2017-08-30/1203894537.PDF
2017-08-30,中国海诚：关于召开2017年第一次临时股东大会的通知,finalpage/2017-08-30/1203894538.PDF
2017-08-30,中国海诚：独立董事候选人声明（赵艳春）,finalpage/2017-08-30/1203894539.PDF
2017-08-30,中国海诚：独立董事提名人声明,finalpage/2017-08-30/1203894540.PDF
2017-08-30,中国海诚：国浩律师（上海）事务所关于公司股票期权激励计划股票期权行权价格调整的法律意见书,finalpage/2017-08-30/1203894541.PDF
2017-08-30,中国海诚：2017年半年度财务报告,finalpage/2017-08-30/1203894542.PDF
2017-08-30,中国海诚：独立董事相关事项独立意见,finalpage/2017-08-30/1203894543.PDF
2017-08-30,中国海诚：第五届董事会第七次会议决议公告,finalpage/2017-08-30/1203894544.PDF
2017-08-30,中国海诚：2017年半年度报告,finalpage/2017-08-30/1203894545.PDF
2017-09-16,中国海诚：公司章程（2017年9月）,finalpage/2017-09-16/1203978989.PDF
2017-09-16,中国海诚：2017年第一次临时股东大会的法律意见书,finalpage/2017-09-16/1203978990.PDF
2017-09-16,中国海诚：2017年第一次临时股东大会决议公告,finalpage/2017-09-16/1203978991.PDF
2017-09-22,中国海诚：关于全资子公司中标工程项目的提示性公告,finalpage/2017-09-22/1203994246.PDF
2017-09-30,中国海诚：关于全资子公司中标工程项目进展的公告,finalpage/2017-09-30/1204013532.PDF
2017-10-11,中国海诚：第五届监事会第六次会议决议公告,finalpage/2017-10-11/1204025094.PDF
2017-10-11,中国海诚：关于第二次调整非公开发行A股股票方案的公告,finalpage/2017-10-11/1204025095.PDF
2017-10-11,中国海诚：2015年度非公开发行A股股票预案（第二次修订稿）,finalpage/2017-10-11/1204025096.PDF
2017-10-11,中国海诚：2015年度非公开发行股票募集资金运用可行性分析报告（第二次修订稿）,finalpage/2017-10-11/1204025097.PDF
2017-10-11,中国海诚：关于非公开发行股票摊薄即期回报及填补回报措施的公告,finalpage/2017-10-11/1204025098.PDF
2017-10-11,中国海诚：独立董事相关事项独立意见,finalpage/2017-10-11/1204025099.PDF
2017-10-11,中国海诚：第五届董事会第八次会议决议公告,finalpage/2017-10-11/1204025100.PDF
2017-10-12,中国海诚：关于2015年度非公开发行股票会后事项的说明,finalpage/2017-10-12/1204030197.PDF
2017-10-20,中国海诚：2017年第三季度报告全文,finalpage/2017-10-20/1204053768.PDF
2017-10-20,中国海诚：第五届董事会第九次会议决议公告,finalpage/2017-10-20/1204053769.PDF
2017-10-20,中国海诚：关于2017年第三季度订单数据及重大项目进展的公告,finalpage/2017-10-20/1204053770.PDF
2017-10-20,中国海诚：关于中轻建设子公司与关联企业签订设备安装合同的公告,finalpage/2017-10-20/1204053771.PDF
2017-10-20,中国海诚：独立董事相关事项独立意见,finalpage/2017-10-20/1204053772.PDF
2017-10-20,中国海诚：2017年第三季度报告正文,finalpage/2017-10-20/1204053773.PDF
2017-10-21,中国海诚：关于诉讼进展的公告,finalpage/2017-10-21/1204056531.PDF
2017-11-07,中国海诚：关于非公开发行股票申请获得中国证监会核准批复的公告,finalpage/2017-11-07/1204114661.PDF
2017-12-13,中国海诚：关于中国保利集团公司申请豁免要约收购的提示性公告,finalpage/2017-12-13/1204216693.PDF
2017-12-13,中国海诚：收购报告书（摘要）,finalpage/2017-12-13/1204216694.PDF
2017-12-20,中国海诚：关于中国保利集团公司申请豁免要约收购进展的公告,finalpage/2017-12-20/1204238739.PDF
2017-12-22,中国海诚：关于控股股东完成改制更名及工商变更登记的公告,finalpage/2017-12-22/1204246648.PDF
2017-12-29,中国海诚：关于中国保利集团公司申请豁免要约收购义务获得中国证监会核准的公告,finalpage/2017-12-29/1204275095.PDF
2017-12-29,中国海诚：收购报告书,finalpage/2017-12-29/1204275096.PDF
2017-12-29,中国海诚：海通证券股份有限公司关于中国保利集团有限公司收购公司收购报告书暨申请豁免要约收购之财务顾问报告书,finalpage/2017-12-29/1204275097.PDF
2017-12-29,中国海诚：国浩律师（上海）事务所关于中国保利集团公司申请豁免要约收购之法律意见书,finalpage/2017-12-29/1204275098.PDF
2017-12-29,中国海诚：国浩律师（上海）事务所关于公司收购报告书之法律意见书,finalpage/2017-12-29/1204275099.PDF
2017-12-29,中国海诚：关于诉讼进展的公告,finalpage/2017-12-29/1204275100.PDF
2017-12-30,中国海诚：第五届董事会第十次会议决议公告,finalpage/2017-12-30/1204288817.PDF
2017-12-30,中国海诚：第五届监事会第八次会议决议公告,finalpage/2017-12-30/1204288818.PDF
2017-12-30,中国海诚：关于终止公司非公开发行股票事项的公告,finalpage/2017-12-30/1204288819.PDF
2017-12-30,中国海诚：关于修订《公司章程》的公告,finalpage/2017-12-30/1204288820.PDF
2017-12-30,中国海诚：独立董事关于第五届董事会第十次会议相关事项的事前认可意见,finalpage/2017-12-30/1204288821.PDF
2017-12-30,中国海诚：独立董事关于第五届董事会第十次会议相关事项的独立意见,finalpage/2017-12-30/1204288822.PDF
2018-01-11,中国海诚：关于使用自有资金购买银行理财产品的公告,finalpage/2018-01-11/1204318955.PDF
2018-01-17,中国海诚：关于董事长、董事辞职的公告,finalpage/2018-01-17/1204336406.PDF
2018-01-17,中国海诚：独立董事关于相关事项的独立意见,finalpage/2018-01-17/1204336407.PDF
2018-01-22,中国海诚：独立董事相关事项独立意见,finalpage/2018-01-22/1204351545.PDF
2018-01-22,中国海诚：第五届董事会第十一次会议决议公告,finalpage/2018-01-22/1204351543.PDF
2018-01-22,中国海诚：关于召开2018年第一次临时股东大会的通知,finalpage/2018-01-22/1204351544.PDF
2018-01-30,中国海诚：关于2017年第四季度订单数据及重大项目进展的公告,finalpage/2018-01-30/1204371597.PDF
2018-01-31,中国海诚：重大诉讼进展公告,finalpage/2018-01-31/1204374607.PDF
2018-02-02,中国海诚：关于董事辞职的公告,finalpage/2018-02-02/1204385193.PDF
2018-02-07,中国海诚：2017年度业绩快报,finalpage/2018-02-07/1204397048.PDF
2018-02-10,中国海诚：公司章程（2018年2月）,finalpage/2018-02-10/1204411236.PDF
2018-02-10,中国海诚：2018年第一次临时股东大会的法律意见书,finalpage/2018-02-10/1204411237.PDF
2018-02-10,中国海诚：2018年第一次临时股东大会决议公告,finalpage/2018-02-10/1204411238.PDF
2018-02-10,中国海诚：关于使用自有资金购买银行理财产品的公告,finalpage/2018-02-10/1204411239.PDF
