,date,title,url
668,2014-11-18,东港股份：2014年第二次临时股东大会决议公告,finalpage/2014-11-18/1200399176.PDF
669,2014-11-18,东港股份：2014年第二次临时股东大会的法律意见书,finalpage/2014-11-18/1200399177.PDF
670,2014-11-25,东港股份：关于购买理财产品的公告,finalpage/2014-11-25/1200413956.PDF
671,2014-11-27,东港股份：独立董事辞职公告,finalpage/2014-11-27/1200419343.PDF
672,2014-12-02,东港股份：关于控股股东减持股份的公告,finalpage/2014-12-02/1200432190.PDF
673,2014-12-03,东港股份：独立董事辞职公告,finalpage/2014-12-03/1200436105.PDF
674,2014-12-05,东港股份：关于电子发票项目进展事项的公告,finalpage/2014-12-05/1200440796.PDF
675,2014-12-17,东港股份：股东权益变动提示性公告,finalpage/2014-12-17/1200471005.PDF
676,2014-12-17,东港股份：简式权益变动报告书,finalpage/2014-12-17/1200471006.PDF
677,2014-12-24,东港股份：第四届董事会第二十二次会议公告,finalpage/2014-12-24/1200488651.PDF
678,2015-01-24,东港股份：关于部分已不符合激励条件的限制性股票回购注销完成的公告,finalpage/2015-01-24/1200574313.PDF
679,2015-01-24,东港股份：江苏泰和律师事务所关于公司限制性股票激励计划之限制性股票第三次解锁及部分回购注销相关事项的法律意见书,finalpage/2015-01-24/1200574314.PDF
680,2015-01-28,东港股份：第四届董事会第二十三次会议公告,finalpage/2015-01-28/1200583442.PDF
681,2015-01-28,东港股份：关于会计政策变更的公告,finalpage/2015-01-28/1200583443.PDF
682,2015-01-28,东港股份：第四届监事会第二十次会议公告,finalpage/2015-01-28/1200583444.PDF
683,2015-01-28,东港股份：独立董事关于公司会计政策变更事项的独立意见,finalpage/2015-01-28/1200583445.PDF
684,2015-02-04,东港股份：股东权益变动提示性公告,finalpage/2015-02-04/1200607727.PDF
685,2015-02-04,东港股份：简式权益变动报告书,finalpage/2015-02-04/1200607728.PDF
686,2015-02-05,东港股份：关于电子发票项目进展情况的公告,finalpage/2015-02-05/1200610404.PDF
687,2015-02-13,东港股份：2014年度业绩快报,finalpage/2015-02-13/1200632873.PDF
688,2015-03-11,东港股份：关于利用自有资金购买理财产品的公告,finalpage/2015-03-11/1200686754.PDF
689,2015-03-11,东港股份：关于变更部分募集资金项目实施主体的公告,finalpage/2015-03-11/1200686755.PDF
690,2015-03-11,东港股份：关于使用节余募集资金永久补充流动资金的公告,finalpage/2015-03-11/1200686756.PDF
691,2015-03-11,东港股份：关于举行2014年度报告网上说明会的公告,finalpage/2015-03-11/1200686757.PDF
692,2015-03-11,东港股份：2014年年度报告摘要,finalpage/2015-03-11/1200686758.PDF
693,2015-03-11,东港股份：2014年年度报告,finalpage/2015-03-11/1200686759.PDF
694,2015-03-11,东港股份：2014年年度审计报告,finalpage/2015-03-11/1200686760.PDF
695,2015-03-11,东港股份：第四届董事会第二十四次会议公告,finalpage/2015-03-11/1200686761.PDF
696,2015-03-11,东港股份：关于召开2014年度股东大会的通知,finalpage/2015-03-11/1200686762.PDF
697,2015-03-11,东港股份：第四届监事会第二十一次会议决议公告,finalpage/2015-03-11/1200686763.PDF
698,2015-03-11,东港股份：关于公司关联方占用上市公司资金情况的专项审核报告,finalpage/2015-03-11/1200686764.PDF
699,2015-03-11,东港股份：2014年度内部控制自我评价报告,finalpage/2015-03-11/1200686765.PDF
700,2015-03-11,东港股份：内部控制鉴证报告,finalpage/2015-03-11/1200686766.PDF
701,2015-03-11,东港股份：关于募集资金存放与实际使用情况的专项报告,finalpage/2015-03-11/1200686767.PDF
702,2015-03-11,东港股份：关于公司募集资金年度存放与实际使用情况的鉴证报告,finalpage/2015-03-11/1200686768.PDF
703,2015-03-11,东港股份：独立董事对第四届董事会第二十四次会议相关议案的独立意见,finalpage/2015-03-11/1200686769.PDF
704,2015-03-11,东港股份：独立董事2014年度述职报告,finalpage/2015-03-11/1200686770.PDF
705,2015-03-11,东港股份：东方花旗证券有限公司关于公司2014年度募集资金存放和使用情况的专项核查意见,finalpage/2015-03-11/1200686771.PDF
706,2015-03-11,东港股份：东方花旗证券有限公司关于公司使用节余募集资金永久补充流动资金的专项核查意见,finalpage/2015-03-11/1200686772.PDF
707,2015-03-11,东港股份：东方花旗证券有限公司关于公司变更部分募集资金投资项目实施主体的专项核查意见,finalpage/2015-03-11/1200686773.PDF
708,2015-03-11,东港股份：监事会2014年度工作报告,finalpage/2015-03-11/1200686774.PDF
709,2015-03-11,东港股份：董事会2014年度工作报告和2015年度工作计划,finalpage/2015-03-11/1200686775.PDF
710,2015-03-28,东港股份：关于召开2014年度股东大会的提示性公告,finalpage/2015-03-28/1200754668.PDF
711,2015-04-02,东港股份：2014年度股东大会决议公告,finalpage/2015-04-02/1200778937.PDF
712,2015-04-02,东港股份：2014年度股东大会的法律意见书,finalpage/2015-04-02/1200778938.PDF
713,2015-04-14,东港股份：2014年年度权益分派实施公告,finalpage/2015-04-14/1200826807.PDF
714,2015-04-27,东港股份：2015年第一季度报告正文,finalpage/2015-04-27/1200909584.PDF
715,2015-04-27,东港股份：2015年第一季度报告全文,finalpage/2015-04-27/1200909585.PDF
716,2015-05-12,东港股份：关于控股股东减持股份的公告,finalpage/2015-05-12/1200999353.PDF
717,2015-06-03,东港股份：关于电子发票项目进展情况的公告,finalpage/2015-06-03/1201099431.PDF
718,2015-06-16,东港股份：关于控股股东减持股份的公告,finalpage/2015-06-16/1201154513.PDF
719,2015-06-25,东港股份：第四届董事会第二十六次会议公告,finalpage/2015-06-25/1201190545.PDF
720,2015-06-25,东港股份：关联交易公告,finalpage/2015-06-25/1201190546.PDF
721,2015-06-25,东港股份：第四届监事会第二十三次会议公告,finalpage/2015-06-25/1201190547.PDF
722,2015-06-25,东港股份：独立董事关于收购北京瑞宏科技有限公司股权事项的事前认可意见,finalpage/2015-06-25/1201190548.PDF
723,2015-07-14,东港股份：关于维护公司股价稳定的公告,finalpage/2015-07-14/1201287171.PDF
724,2015-07-14,东港股份：关于股东股权质押的公告,finalpage/2015-07-14/1201287172.PDF
725,2015-07-15,东港股份：股票交易异动公告,finalpage/2015-07-15/1201294122.PDF
726,2015-07-16,东港股份：更正公告,finalpage/2015-07-16/1201300380.PDF
727,2015-07-16,东港股份：股东权益变动提示性公告,finalpage/2015-07-16/1201300381.PDF
728,2015-07-16,东港股份：简式权益变动报告书,finalpage/2015-07-16/1201300382.PDF
729,2015-07-20,东港股份：股票交易异动公告,finalpage/2015-07-20/1201310576.PDF
730,2015-07-28,东港股份：筹划重大事项停牌公告,finalpage/2015-07-28/1201354336.PDF
731,2015-08-04,东港股份：关于筹划员工持股计划进展及延期复牌的公告,finalpage/2015-08-04/1201386816.PDF
732,2015-08-04,东港股份：关于电子发票项目进展情况的公告,finalpage/2015-08-04/1201386870.PDF
733,2015-08-08,东港股份：关于中标中信银行借记卡空白卡片及个人化项目的公告,finalpage/2015-08-08/1201407829.PDF
734,2015-08-11,东港股份：股票复牌公告,finalpage/2015-08-11/1201418065.PDF
735,2015-08-11,东港股份：第四届董事会第二十七次会议决议公告,finalpage/2015-08-11/1201418066.PDF
736,2015-08-11,东港股份：第四届监事会第二十四次会议决议公告,finalpage/2015-08-11/1201418067.PDF
737,2015-08-11,东港股份：关于非公开发行股票摊薄即期回报的风险提示及公司采取措施的公告,finalpage/2015-08-11/1201418068.PDF
738,2015-08-11,东港股份：关于与特定对象签订附条件生效的股份认购协议的公告,finalpage/2015-08-11/1201418069.PDF
739,2015-08-11,东港股份：关于前次募集资金使用情况的报告,finalpage/2015-08-11/1201418070.PDF
740,2015-08-11,东港股份：非公开发行A股股票预案,finalpage/2015-08-11/1201418071.PDF
741,2015-08-11,东港股份：非公开发行股票募集资金使用的可行性分析报告,finalpage/2015-08-11/1201418072.PDF
742,2015-08-11,东港股份：关于公司前次募集资金使用情况的鉴证报告,finalpage/2015-08-11/1201418073.PDF
743,2015-08-11,东港股份：2015年度员工持股计划（草案）（认购非公开发行股票方式）,finalpage/2015-08-11/1201418074.PDF
744,2015-08-11,东港股份：2015年度员工持股计划（草案）摘要（认购非公开发行股票方式）,finalpage/2015-08-11/1201418075.PDF
745,2015-08-11,东港股份：独立董事关于公司非公开发行股票涉及关联交易事项的事前认可意见,finalpage/2015-08-11/1201418076.PDF
746,2015-08-11,东港股份：独立董事关于实施员工持股计划及非公开发行股票相关事项的独立意见,finalpage/2015-08-11/1201418077.PDF
747,2015-08-15,东港股份：关于设立青岛瑞宏科技有限公司的公告,finalpage/2015-08-15/1201438439.PDF
748,2015-08-20,东港股份：非公开发行股票附条件生效的股份认购协议,finalpage/2015-08-20/1201460881.PDF
749,2015-08-20,东港股份：东证资管-东港股份定向资产管理计划资产管理合同,finalpage/2015-08-20/1201460882.PDF
750,2015-08-20,东港股份：关于召开2015年第一次临时股东大会的通知,finalpage/2015-08-20/1201460883.PDF
751,2015-08-20,东港股份：独立董事提名人声明,finalpage/2015-08-20/1201460884.PDF
752,2015-08-20,东港股份：2015年半年度报告摘要,finalpage/2015-08-20/1201460885.PDF
753,2015-08-20,东港股份：2015年半年度报告,finalpage/2015-08-20/1201460886.PDF
754,2015-08-20,东港股份：2015年半年度财务报告,finalpage/2015-08-20/1201460887.PDF
755,2015-08-20,东港股份：第四届董事会第二十八次会议公告,finalpage/2015-08-20/1201460888.PDF
756,2015-08-20,东港股份：第四届监事会第二十五次会议决议公告,finalpage/2015-08-20/1201460889.PDF
757,2015-08-20,东港股份：独立董事关于第四届董事会第二十八次会议相关事项的独立意见,finalpage/2015-08-20/1201460890.PDF
758,2015-08-20,东港股份：江苏泰和律师事务所关于公司2015年度员工持股计划的法律意见书,finalpage/2015-08-20/1201460891.PDF
759,2015-08-20,东港股份：独立董事候选人声明（万刚）,finalpage/2015-08-20/1201460892.PDF
760,2015-08-20,东港股份：独立董事候选人声明（许斌）,finalpage/2015-08-20/1201460893.PDF
761,2015-08-20,东港股份：独立董事候选人声明（郝纪勇）,finalpage/2015-08-20/1201460894.PDF
762,2015-08-22,东港股份：关于购买银行理财产品的公告,finalpage/2015-08-22/1201472561.PDF
763,2015-09-07,东港股份：关于召开2015年第一次临时股东大会的提示性公告,finalpage/2015-09-07/1201542353.PDF
764,2015-09-09,东港股份：2015年第一次临时股东大会决议公告,finalpage/2015-09-09/1201568178.PDF
765,2015-09-09,东港股份：关于选举职工代表监事的公告,finalpage/2015-09-09/1201568179.PDF
766,2015-09-09,东港股份：2015年第一次临时股东大会的法律意见书,finalpage/2015-09-09/1201568180.PDF
767,2015-09-10,东港股份：第五届董事会第一次会议公告,finalpage/2015-09-10/1201572108.PDF
768,2015-09-10,东港股份：第五届监事会第一次会议决议公告,finalpage/2015-09-10/1201572109.PDF
769,2015-09-10,东港股份：独立董事对第五届董事会第一次会议相关事项的独立意见,finalpage/2015-09-10/1201572110.PDF
770,2015-10-28,东港股份：2015年第三季度报告正文,finalpage/2015-10-28/1201730385.PDF
771,2015-10-28,东港股份：2015年第三季度报告全文,finalpage/2015-10-28/1201730386.PDF
772,2015-10-30,东港股份：第五届董事会第三次会议公告,finalpage/2015-10-30/1201738435.PDF
773,2015-10-30,东港股份：第五届监事会第三次会议公告,finalpage/2015-10-30/1201738436.PDF
774,2015-10-30,东港股份：关于回购注销股权激励对象所持已获授但尚未解锁的限制性股票的公告,finalpage/2015-10-30/1201738437.PDF
775,2015-10-30,东港股份：减资公告,finalpage/2015-10-30/1201738438.PDF
776,2015-10-30,东港股份：关于召开2015年第二次临时股东大会的通知,finalpage/2015-10-30/1201738439.PDF
777,2015-10-30,东港股份：江苏泰和律师事务所关于公司限制性股票激励计划之限制性股票第四次解锁及部分回购注销相关事项的法律意见书,finalpage/2015-10-30/1201738440.PDF
778,2015-10-30,东港股份：独立董事关于第五届董事会第三次会议相关事项的独立意见,finalpage/2015-10-30/1201738441.PDF
779,2015-11-06,东港股份：关于限制性股票第四期解锁股份上市流通提示性公告,finalpage/2015-11-06/1201754915.PDF
780,2015-11-14,东港股份：关于购买银行理财产品的公告,finalpage/2015-11-14/1201770880.PDF
781,2015-11-17,东港股份：2015年第二次临时股东大会决议公告,finalpage/2015-11-17/1201773442.PDF
782,2015-11-17,东港股份：2015年第二次临时股东大会的法律意见书,finalpage/2015-11-17/1201773600.PDF
783,2015-11-27,东港股份：关于购买银行理财产品的公告,finalpage/2015-11-27/1201789888.PDF
784,2015-12-01,东港股份：关于电子发票项目进展情况的公告,finalpage/2015-12-01/1201800658.PDF
785,2015-12-02,东港股份：关于出资设立山东彩票研究院的公告,finalpage/2015-12-02/1201800902.PDF
786,2015-12-04,东港股份：关于与支付宝合作开展电子发票服务的公告,finalpage/2015-12-04/1201804471.PDF
787,2015-12-15,东港股份：关于财政部、国家档案局修订《会计档案管理办法》对电子发票业务影响情况的公告,finalpage/2015-12-15/1201834510.PDF
788,2015-12-19,东港股份：关于在福建省厦门市提供电子发票服务的公告,finalpage/2015-12-19/1201845297.PDF
789,2015-12-31,东港股份：关于在天津市提供电子发票服务的公告,finalpage/2015-12-31/1201881835.PDF
790,2015-12-31,东港股份：关于董事辞职的公告,finalpage/2015-12-31/1201876872.PDF
791,2016-01-06,东港股份：第五届董事会第四次会议公告,finalpage/2016-01-06/1201890366.PDF
792,2016-01-06,东港股份：关于召开2016年第一次临时股东大会的通知,finalpage/2016-01-06/1201890367.PDF
793,2016-01-06,东港股份：独立董事关于增补董事候选人意见,finalpage/2016-01-06/1201890368.PDF
794,2016-01-16,东港股份：关于购买银行理财产品的公告,finalpage/2016-01-16/1201918259.PDF
795,2016-01-18,东港股份：江苏泰和律师事务所关于公司回购注销部分限制性股票而减少注册资本的法律意见书,finalpage/2016-01-18/1201920512.PDF
796,2016-01-18,东港股份：关于部分已不符合激励条件的限制性股票回购注销完成的公告,finalpage/2016-01-18/1201920513.PDF
797,2016-01-21,东港股份：关于中标北京市国家税务局集中管理全市国税系统存量税务档案项目的公告,finalpage/2016-01-21/1201928955.PDF
798,2016-01-22,东港股份：2016年第一次临时股东大会的法律意见书,finalpage/2016-01-22/1201932177.PDF
799,2016-01-22,东港股份：2016年第一次临时股东大会决议公告,finalpage/2016-01-22/1201932178.PDF
800,2016-01-30,东港股份：关于在山东省济南市提供电子发票服务的公告,finalpage/2016-01-30/1201954978.PDF
801,2016-02-26,东港股份：2015年度业绩快报,finalpage/2016-02-26/1201999411.PDF
802,2016-03-16,东港股份：2015年年度报告摘要,finalpage/2016-03-16/1202046013.PDF
803,2016-03-16,东港股份：2015年年度审计报告,finalpage/2016-03-16/1202046014.PDF
804,2016-03-16,东港股份：第五届董事会第五次会议公告,finalpage/2016-03-16/1202046015.PDF
805,2016-03-16,东港股份：关于召开2015年度股东大会的通知,finalpage/2016-03-16/1202046016.PDF
806,2016-03-16,东港股份：第五届监事会第四次会议决议公告,finalpage/2016-03-16/1202046017.PDF
807,2016-03-16,东港股份：关于公司关联方非经营性资金占用及其他关联资金往来情况汇总表的专项审核报告,finalpage/2016-03-16/1202046018.PDF
808,2016-03-16,东港股份：独立董事2015年度述职报告,finalpage/2016-03-16/1202046019.PDF
809,2016-03-16,东港股份：独立董事对第五届董事会第五次会议相关议案的独立意见,finalpage/2016-03-16/1202046020.PDF
810,2016-03-16,东港股份：2015年度内部控制评价报告,finalpage/2016-03-16/1202046021.PDF
811,2016-03-16,东港股份：内部控制规则落实自查表,finalpage/2016-03-16/1202046022.PDF
812,2016-03-16,东港股份：关于举行2015年度报告网上说明会的公告,finalpage/2016-03-16/1202046023.PDF
813,2016-03-16,东港股份：董事会2015年度工作报告和2016年度工作计划,finalpage/2016-03-16/1202046024.PDF
814,2016-03-16,东港股份：监事会2015年度工作报告,finalpage/2016-03-16/1202046025.PDF
815,2016-03-16,东港股份：关于为控股子公司申请银行授信提供担保的公告,finalpage/2016-03-16/1202046026.PDF
816,2016-03-16,东港股份：关联交易管理办法（2016年3月）,finalpage/2016-03-16/1202046027.PDF
817,2016-03-16,东港股份：2015年年度报告,finalpage/2016-03-16/1202046028.PDF
818,2016-03-16,东港股份：内部控制鉴证报告,finalpage/2016-03-16/1202046029.PDF
819,2016-03-16,东港股份：关于利用自有资金购买理财产品的公告,finalpage/2016-03-16/1202046030.PDF
820,2016-03-18,东港股份：关于与证通股份有限公司签订战略合作协议的公告,finalpage/2016-03-18/1202056736.PDF
821,2016-03-25,东港股份：股东权益变动提示性公告,finalpage/2016-03-25/1202075474.PDF
822,2016-03-25,东港股份：简式权益变动报告书,finalpage/2016-03-25/1202075476.PDF
823,2016-03-28,东港股份：关于在山西省提供电子发票服务的公告,finalpage/2016-03-28/1202085957.PDF
824,2016-03-31,东港股份：股东权益变动提示性公告,finalpage/2016-03-31/1202110172.PDF
825,2016-03-31,东港股份：简式权益变动报告书,finalpage/2016-03-31/1202110173.PDF
826,2016-04-08,东港股份：关于召开2015年度股东大会的补充通知,finalpage/2016-04-08/1202149061.PDF
827,2016-04-08,东港股份：第五届监事会第五次会议决议公告,finalpage/2016-04-08/1202149062.PDF
828,2016-04-08,东港股份：独立董事关于修订公司员工持股计划相关事项的独立意见,finalpage/2016-04-08/1202149063.PDF
829,2016-04-08,东港股份：2015年度员工持股计划（草案）（修订稿）,finalpage/2016-04-08/1202149064.PDF
830,2016-04-08,东港股份：2015年度员工持股计划（草案）摘要（修订稿）,finalpage/2016-04-08/1202149065.PDF
831,2016-04-08,东港股份：第五届董事会第六次会议公告,finalpage/2016-04-08/1202149066.PDF
832,2016-04-12,东港股份：关于购买银行理财产品的公告,finalpage/2016-04-12/1202161736.PDF
833,2016-04-14,东港股份：关于公司股东股份解除质押的公告,finalpage/2016-04-14/1202174112.PDF
834,2016-04-15,东港股份：江苏泰和律师事务所关于公司2015年员工持股计划（草案）（修订稿）的法律意见书,finalpage/2016-04-15/1202180271.PDF
835,2016-04-19,东港股份：2015年度股东大会的法律意见书,finalpage/2016-04-19/1202194849.PDF
836,2016-04-19,东港股份：2015年度股东大会决议公告,finalpage/2016-04-19/1202194850.PDF
837,2016-04-21,东港股份：2015年年度权益分派实施公告,finalpage/2016-04-21/1202210954.PDF
838,2016-04-27,东港股份：第五届董事会第七次会议公告,finalpage/2016-04-27/1202249018.PDF
839,2016-04-27,东港股份：2016年第一季度报告正文,finalpage/2016-04-27/1202249019.PDF
840,2016-04-27,东港股份：2016年第一季度报告全文,finalpage/2016-04-27/1202249020.PDF
841,2016-05-28,东港股份：关于2015年度员工持股计划实施进展的公告,finalpage/2016-05-28/1202343594.PDF
842,2016-05-31,东港股份：关于控股股东减持股份的公告,finalpage/2016-05-31/1202345958.PDF
843,2016-06-14,东港股份：关于购买银行理财产品的公告,finalpage/2016-06-14/1202365820.PDF
844,2016-06-22,东港股份：股东权益变动提示性公告,finalpage/2016-06-22/1202380881.PDF
845,2016-06-22,东港股份：简式权益变动报告书,finalpage/2016-06-22/1202380882.PDF
846,2016-07-01,东港股份：关于2015年度员工持股计划实施进展的公告,finalpage/2016-07-01/1202442004.PDF
847,2016-07-21,东港股份：2016年半年度报告,finalpage/2016-07-21/1202493099.PDF
848,2016-07-21,东港股份：2016年半年度财务报告,finalpage/2016-07-21/1202493100.PDF
849,2016-07-21,东港股份：独立董事关于控股股东及其他关联方占用资金及公司对外担保情况的独立意见,finalpage/2016-07-21/1202493101.PDF
850,2016-07-21,东港股份：2016年半年度报告摘要,finalpage/2016-07-21/1202493102.PDF
851,2016-08-11,东港股份：关于控股股东减持股份的公告,finalpage/2016-08-11/1202554456.PDF
852,2016-08-31,东港股份：关于2015年度员工持股计划实施进展的公告,finalpage/2016-08-31/1202657833.PDF
853,2016-09-09,东港股份：关于控股股东减持股份的公告,finalpage/2016-09-09/1202687435.PDF
854,2016-09-27,东港股份：关于购买银行理财产品的公告,finalpage/2016-09-27/1202726757.PDF
855,2016-09-27,东港股份：2016.9.26理财资料,finalpage/2016-09-27/1202726758.PDF
856,2016-09-30,东港股份：独立董事关于修订公司员工持股计划相关事项的独立意见,finalpage/2016-09-30/1202737793.PDF
857,2016-09-30,东港股份：关于召开2016年第二次临时股东大会的通知,finalpage/2016-09-30/1202737794.PDF
858,2016-09-30,东港股份：第五届监事会第七次会议决议公告,finalpage/2016-09-30/1202737795.PDF
859,2016-09-30,东港股份：第一期员工持股计划（草案）摘要（第二次修订稿）,finalpage/2016-09-30/1202737796.PDF
860,2016-09-30,东港股份：第一期员工持股计划（草案）（第二次修订稿）,finalpage/2016-09-30/1202737797.PDF
861,2016-09-30,东港股份：第五届董事会第九次会议公告,finalpage/2016-09-30/1202737798.PDF
862,2016-09-30,东港股份：江苏泰和律师事务所关于公司调整员工持股计划的法律意见书,finalpage/2016-09-30/1202737799.PDF
863,2016-10-18,东港股份：2016年第二次临时股东大会的法律意见书,finalpage/2016-10-18/1202764194.PDF
864,2016-10-18,东港股份：2016年第二次临时股东大会决议公告,finalpage/2016-10-18/1202764195.PDF
865,2016-10-26,东港股份：2016年第三季度报告正文,finalpage/2016-10-26/1202785222.PDF
866,2016-10-26,东港股份：2016年第三季度报告全文,finalpage/2016-10-26/1202785223.PDF
867,2016-11-26,东港股份：关于第一期员工持股计划实施进展的公告,finalpage/2016-11-26/1202844067.PDF
868,2016-12-06,东港股份：关于控股股东减持股份的公告,finalpage/2016-12-06/1202858699.PDF
869,2016-12-24,东港股份：简式权益变动报告书,finalpage/2016-12-24/1202953429.PDF
870,2016-12-24,东港股份：股东权益变动提示性公告,finalpage/2016-12-24/1202953430.PDF
871,2016-12-28,东港股份：关于第一期员工持股计划实施进展的公告,finalpage/2016-12-28/1202964828.PDF
872,2017-01-04,东港股份：关于对深交所问询函的回复公告,finalpage/2017-01-04/1202986681.PDF
873,2017-01-25,东港股份：关于第一期员工持股计划实施进展的公告,finalpage/2017-01-25/1203050781.PDF
874,2017-02-10,东港股份：关于第一期员工持股计划完成股票购买的公告,finalpage/2017-02-10/1203073549.PDF
875,2017-02-20,东港股份：2016年度业绩快报,finalpage/2017-02-20/1203093218.PDF
876,2017-02-22,东港股份：关于公司股东进行股票质押式回购交易的公告,finalpage/2017-02-22/1203097660.PDF
877,2017-02-23,东港股份：关于控股股东减持股份的公告,finalpage/2017-02-23/1203100711.PDF
878,2017-03-09,东港股份：关于公司股东减持股份的公告,finalpage/2017-03-09/1203142485.PDF
879,2017-03-09,东港股份：关于公司控股股东和实际控制人变更的公告,finalpage/2017-03-09/1203142486.PDF
880,2017-03-09,东港股份：详式权益变动报告书,finalpage/2017-03-09/1203142487.PDF
881,2017-03-09,东港股份：东方花旗证券有限公司关于公司详式权益变动报告书之财务顾问核查意见,finalpage/2017-03-09/1203142488.PDF
882,2017-03-22,东港股份：江苏泰和律师事务所关于公司实际控制人和控股股东认定事项的法律意见书,finalpage/2017-03-22/1203183293.PDF
883,2017-03-22,东港股份：关于对深交所问询函的回复公告,finalpage/2017-03-22/1203183294.PDF
884,2017-03-24,东港股份：关于入围中国银行银行卡制作及个人化选型项目的公告,finalpage/2017-03-24/1203190184.PDF
885,2017-04-25,东港股份：2016年年度审计报告,finalpage/2017-04-25/1203372738.PDF
886,2017-04-25,东港股份：关于召开2016年度股东大会的通知,finalpage/2017-04-25/1203372739.PDF
887,2017-04-25,东港股份：第五届监事会第十次会议决议公告,finalpage/2017-04-25/1203372740.PDF
888,2017-04-25,东港股份：关于公司非经营性资金占用及其他关联资金往来情况汇总表的专项审核报告,finalpage/2017-04-25/1203372741.PDF
