date,title,url
2015-08-27,华天科技：独立董事对公司关联方资金占用和对外担保情况的专项说明和独立意见,finalpage/2015-08-27/1201500651.PDF
2015-08-27,华天科技：董事会关于募集资金存放与使用情况的专项报告（2015年1-6月）,finalpage/2015-08-27/1201500652.PDF
2015-09-08,华天科技：江苏永衡昭辉律师事务所关于公司控股股东及其一致行动人增持股份的法律意见书,finalpage/2015-09-08/1201560510.PDF
2015-09-08,华天科技：关于控股股东及一致行动人完成增持公司股份计划的公告,finalpage/2015-09-08/1201560511.PDF
2015-09-15,华天科技：2015年半年度报告（更新后）,finalpage/2015-09-15/1201592218.PDF
2015-09-15,华天科技：2015年半年度报告摘要（更新后）,finalpage/2015-09-15/1201592219.PDF
2015-09-15,华天科技：2015年半年度财务报告（更新后）,finalpage/2015-09-15/1201592220.PDF
2015-09-15,华天科技：关于2015年半年度报告全文、摘要及财务报告更正的公告,finalpage/2015-09-15/1201592221.PDF
2015-09-16,华天科技：关于控股股东增持公司股份的提示性公告,finalpage/2015-09-16/1201597643.PDF
2015-09-24,华天科技：关于非公开发行股票申请获得中国证监会发行审核委员会审核通过的公告,finalpage/2015-09-24/1201629909.PDF
2015-10-31,华天科技：2015年第三季度报告正文,finalpage/2015-10-31/1201743098.PDF
2015-10-31,华天科技：2015年第三季度报告全文,finalpage/2015-10-31/1201743099.PDF
2015-11-03,华天科技：关于非公开发行股票申请获得中国证监会核准的公告,finalpage/2015-11-03/1201747659.PDF
2015-11-25,华天科技：非公开发行股票发行情况报告暨上市公告书（摘要）,finalpage/2015-11-25/1201786794.PDF
2015-11-25,华天科技：非公开发行股票发行情况报告暨上市公告书,finalpage/2015-11-25/1201786795.PDF
2015-11-25,华天科技：瑞信方正证券有限责任公司关于公司非公开发行股票之上市保荐书,finalpage/2015-11-25/1201786796.PDF
2015-11-25,华天科技：瑞信方正证券有限责任公司关于公司非公开发行股票发行过程和认购对象合规性的报告,finalpage/2015-11-25/1201786797.PDF
2015-11-25,华天科技：江苏永衡昭辉律师事务所关于公司非公开发行A股股票发行过程及认购对象合规性的法律意见书,finalpage/2015-11-25/1201786798.PDF
2015-11-26,华天科技：关于控股股东更名的公告,finalpage/2015-11-26/1201788308.PDF
2015-11-28,华天科技：关于签订募集资金三方监管协议的公告,finalpage/2015-11-28/1201795043.PDF
2015-12-01,华天科技：关于完成对子公司增资的公告,finalpage/2015-12-01/1201798504.PDF
2015-12-05,华天科技：关于使用募集资金置换先期投入自筹资金的公告,finalpage/2015-12-05/1201808089.PDF
2015-12-05,华天科技：独立董事关于使用募集资金置换先期投入自筹资金的独立意见,finalpage/2015-12-05/1201808090.PDF
2015-12-05,华天科技：瑞信方正证券有限责任公司关于公司以募集资金置换预先已投入募集资金投资项目的自筹资金的核查意见,finalpage/2015-12-05/1201808091.PDF
2015-12-05,华天科技：关于公司以自筹资金预先投入募集资金投资项目情况报告的鉴证报告,finalpage/2015-12-05/1201808092.PDF
2015-12-05,华天科技：公司章程（2015年12月）,finalpage/2015-12-05/1201808093.PDF
2015-12-05,华天科技：第四届监事会第十五次会议决议公告,finalpage/2015-12-05/1201808094.PDF
2015-12-05,华天科技：第四届董事会第二十三次会议决议公告,finalpage/2015-12-05/1201808095.PDF
2015-12-05,华天科技：募集资金使用管理办法（2015年12月）,finalpage/2015-12-05/1201808096.PDF
2015-12-10,华天科技：关于控股股东增持公司股份的进展公告,finalpage/2015-12-10/1201825039.PDF
2015-12-26,华天科技：关于控股股东完成增持公司股份的公告,finalpage/2015-12-26/1201862795.PDF
2015-12-30,华天科技：关于使用部分暂时闲置募集资金进行现金管理的公告,finalpage/2015-12-30/1201873676.PDF
2015-12-30,华天科技：独立董事关于公司第四届董事会第二十四次会议审议相关事项的独立意见,finalpage/2015-12-30/1201873677.PDF
2015-12-30,华天科技：瑞信方正证券有限责任公司关于公司使用闲置募集资金进行现金管理的核查意见,finalpage/2015-12-30/1201873678.PDF
2015-12-30,华天科技：第四届监事会第十六次会议决议公告,finalpage/2015-12-30/1201873679.PDF
2015-12-30,华天科技：第四届董事会第二十四次会议决议公告,finalpage/2015-12-30/1201873680.PDF
2015-12-30,华天科技：关于收到政府补助的公告,finalpage/2015-12-30/1201873681.PDF
2015-12-30,华天科技：关于增资深圳市华天迈克光电子科技有限公司的进展公告,finalpage/2015-12-30/1201873682.PDF
2015-12-30,华天科技：关于国家集成电路产业投资基金股份有限公司对子公司华天科技（西安）有限公司增资的公告,finalpage/2015-12-30/1201873683.PDF
2016-01-14,华天科技：关于公司控股股东承诺不减持公司股份的公告,finalpage/2016-01-14/1201913208.PDF
2016-01-27,华天科技：关于控股股东增持公司股份的公告,finalpage/2016-01-27/1201943257.PDF
2016-01-28,华天科技：关于控股股东增持公司股份的进展公告,finalpage/2016-01-28/1201946242.PDF
2016-01-29,华天科技：关于控股股东增持公司股份的进展公告,finalpage/2016-01-29/1201951714.PDF
2016-02-27,华天科技：2015年度业绩快报,finalpage/2016-02-27/1202003029.PDF
2016-03-01,华天科技：关于控股股东增持公司股份的进展公告,finalpage/2016-03-01/1202007159.PDF
2016-03-05,华天科技：第四届董事会第二十五次会议决议公告,finalpage/2016-03-05/1202023322.PDF
2016-03-05,华天科技：关于使用自有资金进行现金管理的公告,finalpage/2016-03-05/1202023323.PDF
2016-03-05,华天科技：独立董事关于公司使用自有资金进行现金管理的独立意见,finalpage/2016-03-05/1202023324.PDF
2016-03-05,华天科技：瑞信方正证券有限责任公司关于公司使用自有资金进行现金管理的核查意见,finalpage/2016-03-05/1202023325.PDF
2016-03-05,华天科技：第四届监事会第十七次会议决议公告,finalpage/2016-03-05/1202023326.PDF
2016-03-05,华天科技：关于与下属子公司合资设立有限合伙企业的公告,finalpage/2016-03-05/1202023327.PDF
2016-03-22,华天科技：关于与下属子公司合资设立有限合伙企业的进展公告,finalpage/2016-03-22/1202063128.PDF
2016-04-15,华天科技：关于参股公司获准挂牌新三板的公告,finalpage/2016-04-15/1202178487.PDF
2016-04-22,华天科技：2015年年度审计报告,finalpage/2016-04-22/1202217641.PDF
2016-04-22,华天科技：第四届董事会第二十六次会议决议公告,finalpage/2016-04-22/1202217642.PDF
2016-04-22,华天科技：第四届监事会第十八次会议决议公告,finalpage/2016-04-22/1202217643.PDF
2016-04-22,华天科技：关于公司关联方占用上市公司资金情况的专项审核报告,finalpage/2016-04-22/1202217644.PDF
2016-04-22,华天科技：2015年度独立董事述职报告,finalpage/2016-04-22/1202217645.PDF
2016-04-22,华天科技：独立董事关于公司第四届董事会第二十六次会议审议相关事项的独立意见,finalpage/2016-04-22/1202217646.PDF
2016-04-22,华天科技：2015年度财务决算报告,finalpage/2016-04-22/1202217647.PDF
2016-04-22,华天科技：内部控制规则落实自查表,finalpage/2016-04-22/1202217648.PDF
2016-04-22,华天科技：内部控制缺陷认定标准（2016年4月）,finalpage/2016-04-22/1202217649.PDF
2016-04-22,华天科技：独立董事候选人声明（陈斌才）,finalpage/2016-04-22/1202217650.PDF
2016-04-22,华天科技：独立董事候选人声明（孟兆胜）,finalpage/2016-04-22/1202217651.PDF
2016-04-22,华天科技：独立董事候选人声明（滕敬信）,finalpage/2016-04-22/1202217652.PDF
2016-04-22,华天科技：独立董事提名人声明（二）,finalpage/2016-04-22/1202217653.PDF
2016-04-22,华天科技：独立董事提名人声明（三）,finalpage/2016-04-22/1202217654.PDF
2016-04-22,华天科技：独立董事提名人声明（一）,finalpage/2016-04-22/1202217655.PDF
2016-04-22,华天科技：关于举行2015年度网上业绩说明会的通知,finalpage/2016-04-22/1202217656.PDF
2016-04-22,华天科技：2015年度监事会工作报告,finalpage/2016-04-22/1202217657.PDF
2016-04-22,华天科技：瑞信方正证券有限责任公司关于公司2015年度募集资金使用与存放情况专项核查报告,finalpage/2016-04-22/1202217658.PDF
2016-04-22,华天科技：瑞信方正证券有限责任公司关于公司2016年度预计日常关联交易的核查报告,finalpage/2016-04-22/1202217659.PDF
2016-04-22,华天科技：瑞信方正证券有限责任公司关于公司2015年度内部控制规则落实自查表的核查意见,finalpage/2016-04-22/1202217660.PDF
2016-04-22,华天科技：瑞信方正证券有限责任公司关于公司2015年度内部控制自我评价报告的核查意见,finalpage/2016-04-22/1202217661.PDF
2016-04-22,华天科技：内部控制专项报告,finalpage/2016-04-22/1202217662.PDF
2016-04-22,华天科技：关于公司募集资金年度存放与使用情况的鉴证报告,finalpage/2016-04-22/1202217663.PDF
2016-04-22,华天科技：2016年日常关联交易预计的公告,finalpage/2016-04-22/1202217664.PDF
2016-04-22,华天科技：关于召开2015年年股东大会的通知,finalpage/2016-04-22/1202217665.PDF
2016-04-22,华天科技：董事会关于募集资金存放与使用情况的专项报告（2015年度）,finalpage/2016-04-22/1202217666.PDF
2016-04-22,华天科技：2015年度内部控制自我评价报告,finalpage/2016-04-22/1202217667.PDF
2016-04-22,华天科技：2015年年度报告摘要,finalpage/2016-04-22/1202217668.PDF
2016-04-22,华天科技：2015年年度报告,finalpage/2016-04-22/1202217669.PDF
2016-04-26,华天科技：瑞信方正证券有限责任公司关于公司2015年持续督导培训情况报告,finalpage/2016-04-26/1202239533.PDF
2016-04-26,华天科技：瑞信方正证券有限责任公司关于公司之现场检查报告,finalpage/2016-04-26/1202239534.PDF
2016-04-27,华天科技：第四届董事会第二十七次会议决议公告,finalpage/2016-04-27/1202248129.PDF
2016-04-27,华天科技：2016年第一季度报告正文,finalpage/2016-04-27/1202248130.PDF
2016-04-27,华天科技：2016年第一季度报告全文,finalpage/2016-04-27/1202248131.PDF
2016-04-27,华天科技：关于为境外下属全资子公司提供内保外贷的公告,finalpage/2016-04-27/1202248132.PDF
2016-05-14,华天科技：二届六次员工会员代表大会决议公告,finalpage/2016-05-14/1202320602.PDF
2016-05-19,华天科技：2015年年度股东大会的法律意见书,finalpage/2016-05-19/1202328873.PDF
2016-05-19,华天科技：独立董事关于聘任公司高级管理人员的独立意见,finalpage/2016-05-19/1202328874.PDF
2016-05-19,华天科技：第五届监事会第一次会议决议公告,finalpage/2016-05-19/1202328875.PDF
2016-05-19,华天科技：第五届董事会第一次会议决议公告,finalpage/2016-05-19/1202328876.PDF
2016-05-19,华天科技：2015年年度股东大会决议公告,finalpage/2016-05-19/1202328878.PDF
2016-06-08,华天科技：2015年年度权益分派实施公告,finalpage/2016-06-08/1202360413.PDF
2016-06-18,华天科技：关于西安天利投资合伙企业（有限合伙）受让华天科技（昆山）电子有限公司6.96%股权的公告,finalpage/2016-06-18/1202373154.PDF
2016-06-25,华天科技：关于参加2016年甘肃上市公司投资者集体接待日活动的公告,finalpage/2016-06-25/1202406287.PDF
2016-07-19,华天科技：关于西安天利投资合伙企业（有限合伙）受让华天科技（昆山）电子有限公司6.96%股权的进展公告,finalpage/2016-07-19/1202486071.PDF
2016-07-26,华天科技：关于控股股东完成增持公司股份计划的公告,finalpage/2016-07-26/1202502450.PDF
2016-08-25,华天科技：2016年半年度报告摘要,finalpage/2016-08-25/1202612302.PDF
2016-08-25,华天科技：2016年半年度报告,finalpage/2016-08-25/1202612303.PDF
2016-08-25,华天科技：2016年半年度财务报告,finalpage/2016-08-25/1202612304.PDF
2016-08-25,华天科技：董事会关于募集资金存放与使用情况的专项报告（2016年1-6月）,finalpage/2016-08-25/1202612307.PDF
2016-08-25,华天科技：公司章程（2016年8月）,finalpage/2016-08-25/1202612309.PDF
2016-08-25,华天科技：关于召开2016年第一次临时股东大会的通知,finalpage/2016-08-25/1202612310.PDF
2016-08-25,华天科技：第五届监事会第二次会议决议公告,finalpage/2016-08-25/1202612311.PDF
2016-08-25,华天科技：独立董事对公司关联方资金占用和对外担保情况的专项说明和独立意见,finalpage/2016-08-25/1202612314.PDF
2016-08-25,华天科技：第五届董事会第二次会议决议公告,finalpage/2016-08-25/1202612315.PDF
2016-09-22,华天科技：2016年第一次临时股东大会决议公告,finalpage/2016-09-22/1202716862.PDF
2016-09-22,华天科技：2016年第一次临时股东大会的法律意见书,finalpage/2016-09-22/1202716863.PDF
2016-10-29,华天科技：2016年第三季度报告正文,finalpage/2016-10-29/1202800914.PDF
2016-10-29,华天科技：2016年第三季度报告全文,finalpage/2016-10-29/1202800915.PDF
2016-11-23,华天科技：关于非公开发行限售股份解除限售的提示性公告,finalpage/2016-11-23/1202839676.PDF
2016-11-23,华天科技：瑞信方正证券有限责任公司关于公司非公开发行限售股份解禁并上市流通之核查意见,finalpage/2016-11-23/1202839677.PDF
2016-11-29,华天科技：关于公司控股股东拟发行可交换债券的公告,finalpage/2016-11-29/1202846378.PDF
2016-11-29,华天科技：关于实际控制人个别成员变动的公告,finalpage/2016-11-29/1202846379.PDF
2016-12-27,华天科技：关于2016年度利润分配及资本公积金转增股本预案的预披露公告,finalpage/2016-12-27/1202961372.PDF
2017-01-07,华天科技：关于对深圳证券交易所问询函回复的公告,finalpage/2017-01-07/1202996955.PDF
2017-01-10,华天科技：关于控股股东股权解除质押的公告,finalpage/2017-01-10/1203000959.PDF
2017-02-22,华天科技：2016年度业绩快报,finalpage/2017-02-22/1203097072.PDF
2017-03-16,华天科技：关于控股股东发行可交换公司债券暨办理股份质押的公告,finalpage/2017-03-16/1203162375.PDF
2017-03-28,华天科技：2016年年度报告,finalpage/2017-03-28/1203208946.PDF
2017-03-28,华天科技：第五届董事会第四次会议决议公告,finalpage/2017-03-28/1203208947.PDF
2017-03-28,华天科技：第五届监事会第四次会议决议公告,finalpage/2017-03-28/1203208948.PDF
2017-03-28,华天科技：2016年度内部控制自我评价报告,finalpage/2017-03-28/1203208949.PDF
2017-03-28,华天科技：2016年年度审计报告,finalpage/2017-03-28/1203208950.PDF
2017-03-28,华天科技：关于公司募集资金年度存放与使用情况的鉴证报告,finalpage/2017-03-28/1203208951.PDF
2017-03-28,华天科技：内部控制专项报告,finalpage/2017-03-28/1203208952.PDF
2017-03-28,华天科技：董事会关于募集资金存放与使用情况的专项报告（2016年度）,finalpage/2017-03-28/1203208953.PDF
2017-03-28,华天科技：2016年度财务决算报告,finalpage/2017-03-28/1203208954.PDF
2017-03-28,华天科技：2016年度监事会工作报告,finalpage/2017-03-28/1203208955.PDF
2017-03-28,华天科技：内部控制规则落实自查表,finalpage/2017-03-28/1203208956.PDF
2017-03-28,华天科技：2017年日常关联交易预计的公告,finalpage/2017-03-28/1203208957.PDF
2017-03-28,华天科技：关于使用自有资金进行现金管理的公告,finalpage/2017-03-28/1203208958.PDF
2017-03-28,华天科技：关于举行2016年度网上业绩说明会的通知,finalpage/2017-03-28/1203208959.PDF
2017-03-28,华天科技：公司章程（2017年3月）,finalpage/2017-03-28/1203208960.PDF
2017-03-28,华天科技：独立董事关于公司第五届董事会第四次会议审议相关事项的独立意见,finalpage/2017-03-28/1203208961.PDF
2017-03-28,华天科技：关于召开2016年年股东大会的通知,finalpage/2017-03-28/1203208962.PDF
2017-03-28,华天科技：2016年度独立董事述职报告,finalpage/2017-03-28/1203208963.PDF
2017-03-28,华天科技：关于公司控股股东及其他关联方资金占用情况汇总表的专项审核报告,finalpage/2017-03-28/1203208964.PDF
2017-03-28,华天科技：瑞信方正证券有限责任公司关于公司2016年度募集资金使用与存放情况专项核查报告,finalpage/2017-03-28/1203208965.PDF
2017-03-28,华天科技：瑞信方正证券有限责任公司关于公司2016年度内部控制规则落实自查表的核查意见,finalpage/2017-03-28/1203208966.PDF
2017-03-28,华天科技：瑞信方正证券有限责任公司关于公司2016年度内部控制自我评价报告的核查意见,finalpage/2017-03-28/1203208967.PDF
2017-03-28,华天科技：2016年年度报告摘要,finalpage/2017-03-28/1203208968.PDF
2017-03-29,华天科技：瑞信方正证券有限责任公司关于公司2016年度保荐工作报告,finalpage/2017-03-29/1203216206.PDF
2017-03-29,华天科技：瑞信方正证券有限责任公司关于公司非公开发行股票之保荐工作总结报告,finalpage/2017-03-29/1203216207.PDF
2017-03-29,华天科技：瑞信方正证券有限责任公司关于公司之年度现场检查报告,finalpage/2017-03-29/1203216208.PDF
2017-04-11,华天科技：关于控股股东完成非公开发行可交换公司债券的公告,finalpage/2017-04-11/1203274927.PDF
2017-04-27,华天科技：2017年第一季度报告正文,finalpage/2017-04-27/1203402638.PDF
2017-04-27,华天科技：2017年第一季度报告全文,finalpage/2017-04-27/1203402639.PDF
2017-05-05,华天科技：第五届董事会第六次会议决议公告,finalpage/2017-05-05/1203475239.PDF
2017-05-05,华天科技：第五届监事会第六次会议决议公告,finalpage/2017-05-05/1203475240.PDF
2017-05-05,华天科技：独立董事关于公司续聘会计师事务所的独立意见,finalpage/2017-05-05/1203475241.PDF
2017-05-06,华天科技：关于2016年年度股东大会增加临时议案暨会议补充通知的公告,finalpage/2017-05-06/1203479886.PDF
2017-05-13,华天科技：第五届董事会第七次会议决议公告,finalpage/2017-05-13/1203514170.PDF
2017-05-13,华天科技：第五届监事会第七次会议决议公告,finalpage/2017-05-13/1203514171.PDF
2017-05-13,华天科技：关联交易公告,finalpage/2017-05-13/1203514172.PDF
2017-05-13,华天科技：独立董事关于全资子公司转让部分闲置不动产的关联交易事项的独立意见,finalpage/2017-05-13/1203514173.PDF
2017-05-19,华天科技：2016年年度股东大会决议公告,finalpage/2017-05-19/1203536547.PDF
2017-05-19,华天科技：2016年年度股东大会之法律意见书,finalpage/2017-05-19/1203536548.PDF
2017-06-14,华天科技：2016年年度权益分派实施公告,finalpage/2017-06-14/1203613878.PDF
2017-07-15,华天科技：第五届董事会第八次会议决议公告,finalpage/2017-07-15/1203706785.PDF
2017-07-15,华天科技：第五届监事会第八次会议决议公告,finalpage/2017-07-15/1203706786.PDF
2017-07-15,华天科技：独立董事关于控股子公司转让在建工程的关联交易事项的独立意见,finalpage/2017-07-15/1203706787.PDF
2017-07-15,华天科技：关联交易公告,finalpage/2017-07-15/1203706788.PDF
2017-08-26,华天科技：2017年半年度财务报告,finalpage/2017-08-26/1203869709.PDF
2017-08-26,华天科技：第五届监事会第九次会议决议公告,finalpage/2017-08-26/1203869712.PDF
2017-08-26,华天科技：独立董事关于公司第五届董事会第九次会议审议相关事项的独立意见,finalpage/2017-08-26/1203869713.PDF
2017-08-26,华天科技：关于会计政策变更的公告,finalpage/2017-08-26/1203869714.PDF
2017-08-26,华天科技：2017年半年度报告摘要,finalpage/2017-08-26/1203869715.PDF
2017-08-26,华天科技：2017年半年度报告,finalpage/2017-08-26/1203869716.PDF
2017-08-26,华天科技：第五届董事会第九次会议决议公告,finalpage/2017-08-26/1203869718.PDF
2017-08-26,华天科技：董事会关于募集资金存放与使用情况的专项报告（2017年1-6月）,finalpage/2017-08-26/1203869719.PDF
2017-09-19,华天科技：关于控股股东可交换公司债券进入换股期的提示性公告,finalpage/2017-09-19/1203981011.PDF
2017-10-21,华天科技：2017年第三季度报告正文,finalpage/2017-10-21/1204055956.PDF
2017-10-21,华天科技：2017年第三季度报告全文,finalpage/2017-10-21/1204055957.PDF
2017-10-31,华天科技：关于实际控制人个别成员变动的公告,finalpage/2017-10-31/1204095850.PDF
2017-11-04,华天科技：关于控股股东可交换公司债券换股情况进展暨权益变动的提示性公告,finalpage/2017-11-04/1204112511.PDF
2017-11-04,华天科技：简式权益变动报告书,finalpage/2017-11-04/1204112512.PDF
2017-11-04,华天科技：关于控股股东和实际控制人承诺不减持公司股份的公告,finalpage/2017-11-04/1204112513.PDF
2017-11-17,华天科技：第五届董事会第十一次会议决议公告,finalpage/2017-11-17/1204144634.PDF
2017-11-17,华天科技：第五届监事会第十一次会议决议公告,finalpage/2017-11-17/1204144635.PDF
2017-11-17,华天科技：独立董事关于下属企业出资参与设立产业基金的关联交易事项的独立意见,finalpage/2017-11-17/1204144636.PDF
2017-11-17,华天科技：关于下属企业出资参与设立产业基金暨关联交易的公告,finalpage/2017-11-17/1204144637.PDF
2017-11-17,华天科技：关于控股股东可交换公司债券换股情况进展公告,finalpage/2017-11-17/1204144638.PDF
2017-12-23,华天科技：关于下属企业出资参与设立产业基金暨关联交易的进展公告,finalpage/2017-12-23/1204250084.PDF
2018-01-09,华天科技：第五届董事会第十二次会议决议公告,finalpage/2018-01-09/1204311798.PDF
2018-01-09,华天科技：关于聘任内部审计负责人的公告,finalpage/2018-01-09/1204311799.PDF
