,date,title,url
445,2012-07-13,彩虹精化：关于召开2012年第二次临时股东大会的提示性公告,finalpage/2012-07-13/61260711.PDF
446,2012-07-13,彩虹精化：2012年半年度业绩预告修正公告,finalpage/2012-07-13/61260712.PDF
447,2012-07-18,彩虹精化：2012年第二次临时股东大会决议公告,finalpage/2012-07-18/61283198.PDF
448,2012-07-18,彩虹精化：2012年第二次临时股东大会的法律意见书,finalpage/2012-07-18/61283199.PDF
449,2012-07-26,彩虹精化：2012年半年度业绩快报,finalpage/2012-07-26/61322960.PDF
450,2012-08-18,彩虹精化：2012年半年度报告摘要,finalpage/2012-08-18/61440849.PDF
451,2012-08-18,彩虹精化：2012年半年度财务报告,finalpage/2012-08-18/61440855.PDF
452,2012-08-18,彩虹精化：第二届董事会第二十八次会议决议公告,finalpage/2012-08-18/61440856.PDF
453,2012-08-18,彩虹精化：第二届监事会第十五次会议决议公告,finalpage/2012-08-18/61440857.PDF
454,2012-08-18,彩虹精化：2012年半年度报告,finalpage/2012-08-18/61440858.PDF
455,2012-08-18,彩虹精化：独立董事关于有关事项发表的独立意见,finalpage/2012-08-18/61440861.PDF
456,2012-08-18,彩虹精化：关于继续使用闲置募集资金暂时补充流动资金的公告,finalpage/2012-08-18/61440862.PDF
457,2012-08-18,彩虹精化：关于召开2012年第三次临时股东大会的通知,finalpage/2012-08-18/61440863.PDF
458,2012-08-18,彩虹精化：关于深圳市格瑞卫康环保科技有限公司股权转让完成工商变更登记及投资设立合资公司完成工商注册登记的公告,finalpage/2012-08-18/61440864.PDF
459,2012-08-18,彩虹精化：国信证券股份有限公司关于公司继续使用闲置募集资金暂时补充流动资金的核查意见,finalpage/2012-08-18/61440865.PDF
460,2012-08-23,彩虹精化：关于控股子公司深圳市新彩再生材料科技有限公司收购海丰县新洲塑料制品有限公司100%股权的公告,finalpage/2012-08-23/61464302.PDF
461,2012-08-29,彩虹精化：第二届董事会第二十九次会议决议公告,finalpage/2012-08-29/61497277.PDF
462,2012-08-29,彩虹精化：关于设立深圳虹彩新材料有限公司的公告,finalpage/2012-08-29/61497278.PDF
463,2012-08-29,彩虹精化：关于深圳虹彩新材料有限公司设立浙江彩虹生物材料有限公司的公告,finalpage/2012-08-29/61497279.PDF
464,2012-09-04,彩虹精化：关于收购深圳市格瑞卫康环保科技有限公司部分股权完成工商变更登记的公告,finalpage/2012-09-04/61526666.PDF
465,2012-09-05,彩虹精化：关于归还募集资金的公告,finalpage/2012-09-05/61536772.PDF
466,2012-09-07,彩虹精化：2012年第三次临时股东大会决议公告,finalpage/2012-09-07/61542386.PDF
467,2012-09-07,彩虹精化：2012年第三次临时股东大会的法律意见书,finalpage/2012-09-07/61542387.PDF
468,2012-10-27,彩虹精化：2012年第三季度报告正文,finalpage/2012-10-27/61719406.PDF
469,2012-10-27,彩虹精化：2012年第三季度报告全文,finalpage/2012-10-27/61719407.PDF
470,2012-10-27,彩虹精化：第二届董事会第三十次会议决议公告,finalpage/2012-10-27/61719408.PDF
471,2012-10-27,彩虹精化：第二届监事会第十六次会议决议公告,finalpage/2012-10-27/61719409.PDF
472,2012-10-27,彩虹精化：关于调整募集资金使用计划的公告,finalpage/2012-10-27/61719410.PDF
473,2012-10-27,彩虹精化：关于控股子公司深圳市彩虹绿世界生物降解材料有限公司解散清算的公告,finalpage/2012-10-27/61719411.PDF
474,2012-10-27,彩虹精化：关于改聘会计师事务所的公告,finalpage/2012-10-27/61719412.PDF
475,2012-10-27,彩虹精化：关于召开2012年第四次临时股东大会的通知,finalpage/2012-10-27/61719413.PDF
476,2012-10-27,彩虹精化：国信证券股份有限公司关于公司调整募集资金使用计划的专项核查意见,finalpage/2012-10-27/61719414.PDF
477,2012-10-27,彩虹精化：独立董事对相关事项的独立意见,finalpage/2012-10-27/61719415.PDF
478,2012-11-07,彩虹精化：关于控股股东股权解除质押的公告,finalpage/2012-11-07/61772331.PDF
479,2012-11-07,彩虹精化：关于公司股东、关联方以及上市公司承诺履行情况的公告,finalpage/2012-11-07/61772332.PDF
480,2012-11-14,彩虹精化：2012年第四次临时股东大会决议公告,finalpage/2012-11-14/61795795.PDF
481,2012-11-14,彩虹精化：2012年第四次临时股东大会的法律意见书,finalpage/2012-11-14/61795796.PDF
482,2012-11-22,彩虹精化：关于控股股东股权解除质押的公告,finalpage/2012-11-22/61827213.PDF
483,2012-11-24,彩虹精化：第二届董事会第三十一次会议决议公告,finalpage/2012-11-24/61832348.PDF
484,2012-11-24,彩虹精化：第二届监事会第十七次会议决议公告,finalpage/2012-11-24/61832349.PDF
485,2012-11-24,彩虹精化：关于转让控股子公司北京纳尔特保温节能材料有限公司52%股权暨关联交易的公告,finalpage/2012-11-24/61832350.PDF
486,2012-11-24,彩虹精化：关于召开2012年第五次临时股东大会的通知,finalpage/2012-11-24/61832351.PDF
487,2012-11-24,彩虹精化：独立董事关于转让控股子公司北京纳尔特保温节能材料有限公司股权暨关联交易的事先认可及独立意见,finalpage/2012-11-24/61832352.PDF
488,2012-11-24,彩虹精化：拟进行股权转让所涉及的北京纳尔特保温节能材料有限公司股东全部权益资产评估报告,finalpage/2012-11-24/61832353.PDF
489,2012-12-01,彩虹精化：关于控股股东股权质押的公告,finalpage/2012-12-01/61855697.PDF
490,2012-12-12,彩虹精化：2012年第五次临时股东大会决议公告,finalpage/2012-12-12/61897845.PDF
491,2012-12-12,彩虹精化：2012年第五次临时股东大会的法律意见书,finalpage/2012-12-12/61897846.PDF
492,2012-12-14,彩虹精化：关于控股股东股权解除质押的公告,finalpage/2012-12-14/61910566.PDF
493,2012-12-18,彩虹精化：关于持股5%以上股东减持股份的提示性公告,finalpage/2012-12-18/61923363.PDF
494,2012-12-18,彩虹精化：简式权益变动报告书,finalpage/2012-12-18/61923364.PDF
495,2012-12-28,彩虹精化：关于控股股东股权质押的公告,finalpage/2012-12-28/61964401.PDF
496,2012-12-28,彩虹精化：第二届董事会第三十二次会议决议公告,finalpage/2012-12-28/61960145.PDF
497,2012-12-28,彩虹精化：第二届监事会第十八次会议决议公告,finalpage/2012-12-28/61960146.PDF
498,2012-12-28,彩虹精化：关于召开2013年第一次临时股东大会的通知,finalpage/2012-12-28/61960147.PDF
499,2012-12-28,彩虹精化：公司章程（2012年12月）,finalpage/2012-12-28/61960148.PDF
500,2012-12-28,彩虹精化：独立董事关于公司董事会换届的独立意见,finalpage/2012-12-28/61960149.PDF
501,2012-12-28,彩虹精化：独立董事候选人声明（刘书锦）,finalpage/2012-12-28/61960150.PDF
502,2012-12-28,彩虹精化：独立董事候选人声明（陈仕明）,finalpage/2012-12-28/61960151.PDF
503,2012-12-28,彩虹精化：独立董事候选人声明（魏达志）,finalpage/2012-12-28/61960152.PDF
504,2012-12-28,彩虹精化：独立董事提名人声明,finalpage/2012-12-28/61960153.PDF
505,2013-01-11,彩虹精化：关于选举职工代表监事的公告,finalpage/2013-01-11/62006570.PDF
506,2013-01-18,彩虹精化：关于控股股东股权解除质押及重新质押的公告,finalpage/2013-01-18/62033511.PDF
507,2013-01-19,彩虹精化：2013年第一次临时股东大会决议公告,finalpage/2013-01-19/62038117.PDF
508,2013-01-19,彩虹精化：第三届董事会第一次会议决议公告,finalpage/2013-01-19/62038118.PDF
509,2013-01-19,彩虹精化：第三届监事会第一次会议决议公告,finalpage/2013-01-19/62038119.PDF
510,2013-01-19,彩虹精化：关于召开2013年第二次临时股东大会的通知,finalpage/2013-01-19/62038120.PDF
511,2013-01-19,彩虹精化：2013年第一次临时股东大会的法律意见书,finalpage/2013-01-19/62038121.PDF
512,2013-01-19,彩虹精化：独立董事对有关事项的独立意见,finalpage/2013-01-19/62038122.PDF
513,2013-01-31,彩虹精化：关于控股子公司深圳市彩虹绿世界生物降解材料有限公司解散清算事宜的进展公告,finalpage/2013-01-31/62087194.PDF
514,2013-02-01,彩虹精化：关于企业法人营业执照变更的公告,finalpage/2013-02-01/62091753.PDF
515,2013-02-05,彩虹精化：2013年第二次临时股东大会决议公告,finalpage/2013-02-05/62107815.PDF
516,2013-02-05,彩虹精化：2013年第二次临时股东大会的法律意见书,finalpage/2013-02-05/62107816.PDF
517,2013-02-07,彩虹精化：关于转让控股子公司北京纳尔特保温节能材料有限公司52%股权暨关联交易的进展公告,finalpage/2013-02-07/62120202.PDF
518,2013-02-22,彩虹精化：第三届董事会第二次会议决议公告,finalpage/2013-02-22/62142717.PDF
519,2013-02-22,彩虹精化：第三届监事会第二次会议决议公告,finalpage/2013-02-22/62142718.PDF
520,2013-02-22,彩虹精化：关于继续使用闲置募集资金暂时补充流动资金的公告,finalpage/2013-02-22/62142719.PDF
521,2013-02-22,彩虹精化：关于延长对控股子公司提供财务资助的公告,finalpage/2013-02-22/62142720.PDF
522,2013-02-22,彩虹精化：关于召开2013年第三次临时股东大会的通知,finalpage/2013-02-22/62142721.PDF
523,2013-02-22,彩虹精化：国信证券股份有限公司关于公司继续使用闲置募集资金暂时补充流动资金的核查意见,finalpage/2013-02-22/62142722.PDF
524,2013-02-22,彩虹精化：独立董事关于相关事项的独立意见,finalpage/2013-02-22/62142723.PDF
525,2013-02-28,彩虹精化：2012年度业绩快报,finalpage/2013-02-28/62161247.PDF
526,2013-03-05,彩虹精化：关于归还募集资金的公告,finalpage/2013-03-05/62184607.PDF
527,2013-03-13,彩虹精化：2013年第三次临时股东大会决议公告,finalpage/2013-03-13/62207761.PDF
528,2013-03-13,彩虹精化：2013年第三次临时股东大会的法律意见书,finalpage/2013-03-13/62207762.PDF
529,2013-03-30,彩虹精化：2013年第一季度业绩预告公告,finalpage/2013-03-30/62301986.PDF
530,2013-04-09,彩虹精化：2012年度独立董事述职报告（张学斌）,finalpage/2013-04-09/62334221.PDF
531,2013-04-09,彩虹精化：2012年度独立董事述职报告（谢汝煊）,finalpage/2013-04-09/62334222.PDF
532,2013-04-09,彩虹精化：2012年年度报告摘要,finalpage/2013-04-09/62334223.PDF
533,2013-04-09,彩虹精化：2012年年度审计报告,finalpage/2013-04-09/62334226.PDF
534,2013-04-09,彩虹精化：第三届董事会第三次会议决议公告,finalpage/2013-04-09/62334227.PDF
535,2013-04-09,彩虹精化：关于召开2012年年度股东大会的通知,finalpage/2013-04-09/62334228.PDF
536,2013-04-09,彩虹精化：第三届监事会第三次会议决议公告,finalpage/2013-04-09/62334230.PDF
537,2013-04-09,彩虹精化：关于公司2012年度控股股东及其他关联方占用资金情况的专项说明,finalpage/2013-04-09/62334231.PDF
538,2013-04-09,彩虹精化：2012年年度报告,finalpage/2013-04-09/62334232.PDF
539,2013-04-09,彩虹精化：2012年度内部控制自我评价报告,finalpage/2013-04-09/62334233.PDF
540,2013-04-09,彩虹精化：2012年度募集资金存放与使用情况的专项报告,finalpage/2013-04-09/62334234.PDF
541,2013-04-09,彩虹精化：2012年度募集资金存放与使用情况鉴证报告,finalpage/2013-04-09/62334235.PDF
542,2013-04-09,彩虹精化：独立董事关于有关事项发表的独立意见,finalpage/2013-04-09/62334236.PDF
543,2013-04-09,彩虹精化：2012年度独立董事述职报告（刘善荣）,finalpage/2013-04-09/62334237.PDF
544,2013-04-09,彩虹精化：关于举行2012年度报告网上说明会的公告,finalpage/2013-04-09/62334238.PDF
545,2013-04-09,彩虹精化：内部控制规则落实自查表,finalpage/2013-04-09/62334239.PDF
546,2013-04-09,彩虹精化：国信证券股份有限公司关于公司2012年度募集资金存放与使用情况的专项核查报告,finalpage/2013-04-09/62334240.PDF
547,2013-04-20,彩虹精化：2013年第一季度报告正文,finalpage/2013-04-20/62390923.PDF
548,2013-04-20,彩虹精化：2013年第一季度报告全文,finalpage/2013-04-20/62390928.PDF
549,2013-04-20,彩虹精化：第三届董事会第四次会议决议公告,finalpage/2013-04-20/62390930.PDF
550,2013-04-20,彩虹精化：关于放弃对控股子公司深圳市新彩再生材料科技有限公司增资扩股优先认缴出资权利的公告,finalpage/2013-04-20/62390934.PDF
551,2013-04-20,彩虹精化：独立董事关于公司放弃控股子公司深圳市新彩再生材料科技有限公司优先认缴出资权的独立意见,finalpage/2013-04-20/62390935.PDF
552,2013-05-07,彩虹精化：2012年年度股东大会决议公告,finalpage/2013-05-07/62464813.PDF
553,2013-05-07,彩虹精化：2012年年度股东大会的法律意见书,finalpage/2013-05-07/62464814.PDF
554,2013-05-16,彩虹精化：关于放弃对控股子公司深圳市新彩再生材料科技有限公司增资扩股优先认缴出资权利的进展公告,finalpage/2013-05-16/62494443.PDF
555,2013-05-22,彩虹精化：关于控股股东股权解除质押及重新质押的公告,finalpage/2013-05-22/62512071.PDF
556,2013-05-30,彩虹精化：关于转让控股子公司北京纳尔特保温节能材料有限公司52%股权暨关联交易的进展公告,finalpage/2013-05-30/62535711.PDF
557,2013-06-06,彩虹精化：2012年年度权益分派实施公告,finalpage/2013-06-06/62562582.PDF
558,2013-06-08,彩虹精化：关于转让控股子公司北京纳尔特保温节能材料有限公司52%股权暨关联交易完成工商变更登记的公告,finalpage/2013-06-08/62570094.PDF
559,2013-07-03,彩虹精化：关于转让控股子公司北京纳尔特保温节能材料有限公司52%股权暨关联交易的补充公告,finalpage/2013-07-03/62765439.PDF
560,2013-07-06,彩虹精化：2013年半年度业绩预告修正公告,finalpage/2013-07-06/62790464.PDF
561,2013-07-24,彩虹精化：2013年半年度业绩快报更正公告,finalpage/2013-07-24/62866234.PDF
562,2013-07-24,彩虹精化：2013年半年度业绩快报,finalpage/2013-07-24/62864463.PDF
563,2013-07-29,彩虹精化：关于控股股东股权解除质押及重新质押的公告,finalpage/2013-07-29/62880436.PDF
564,2013-08-06,彩虹精化：关于控股股东进行股票质押式回购交易的更正公告,finalpage/2013-08-06/62911735.PDF
565,2013-08-06,彩虹精化：关于控股股东进行股票质押式回购交易的公告,finalpage/2013-08-06/62908708.PDF
566,2013-08-15,彩虹精化：第三届董事会第五次会议决议公告,finalpage/2013-08-15/62939168.PDF
567,2013-08-15,彩虹精化：关于转让全资子公司珠海市虹彩精细化工有限公司100%股权的公告,finalpage/2013-08-15/62939169.PDF
568,2013-08-15,彩虹精化：独立董事关于转让全资子公司珠海市虹彩精细化工有限公司100%股权的独立意见,finalpage/2013-08-15/62939170.PDF
569,2013-08-21,彩虹精化：2013年半年度报告摘要（已取消）,finalpage/2013-08-21/62969206.PDF
570,2013-08-21,彩虹精化：2013年半年度财务报告（已取消）,finalpage/2013-08-21/62969208.PDF
571,2013-08-21,彩虹精化：第三届董事会第六次会议决议公告,finalpage/2013-08-21/62969209.PDF
572,2013-08-21,彩虹精化：第三届监事会第五次会议决议公告,finalpage/2013-08-21/62969210.PDF
573,2013-08-21,彩虹精化：2013年半年度报告（已取消）,finalpage/2013-08-21/62969211.PDF
574,2013-08-21,彩虹精化：独立董事关于公司关联方资金占用及对外担保情况的专项说明及独立意见,finalpage/2013-08-21/62969212.PDF
575,2013-08-21,彩虹精化：2013年半年度募集资金存放与使用情况的专项报告,finalpage/2013-08-21/62969213.PDF
576,2013-08-21,彩虹精化：关于对深圳证券交易所监管函的整改报告,finalpage/2013-08-21/62969214.PDF
577,2013-08-27,彩虹精化：关于持股5%以上股东减持股份的提示性公告,finalpage/2013-08-27/63002744.PDF
578,2013-08-27,彩虹精化：简式权益变动报告书,finalpage/2013-08-27/63002745.PDF
579,2013-09-17,彩虹精化：第三届董事会第七次会议决议公告,finalpage/2013-09-17/63088658.PDF
580,2013-09-28,彩虹精化：关于转让全资子公司珠海市虹彩精细化工有限公司100%股权完成工商变更登记的公告,finalpage/2013-09-28/63119687.PDF
581,2013-10-18,彩虹精化：关于控股股东股票解除质押式回购交易暨股权重新质押的公告,finalpage/2013-10-18/63165315.PDF
582,2013-10-24,彩虹精化：股票交易异常波动公告,finalpage/2013-10-24/63186405.PDF
583,2013-10-25,彩虹精化：关于控股股东股权解除质押及重新质押的公告,finalpage/2013-10-25/63190170.PDF
584,2013-10-28,彩虹精化：2013年第三季度报告正文（已取消）,finalpage/2013-10-28/63200416.PDF
585,2013-10-28,彩虹精化：2013年第三季度报告全文（已取消）,finalpage/2013-10-28/63200418.PDF
586,2013-11-07,彩虹精化：关于控股股东股权解除质押及重新质押的公告,finalpage/2013-11-07/63247180.PDF
587,2013-11-09,彩虹精化：关于签订《募集资金三方监管协议》的公告,finalpage/2013-11-09/63251673.PDF
588,2013-11-19,彩虹精化：关于全资子公司名称变更的公告,finalpage/2013-11-19/63282646.PDF
589,2013-11-22,彩虹精化：第三届董事会第九次会议决议公告,finalpage/2013-11-22/63290585.PDF
590,2013-11-22,彩虹精化：第三届监事会第七次会议决议公告,finalpage/2013-11-22/63290586.PDF
591,2013-11-22,彩虹精化：关于变更部分募集资金投资项目的公告,finalpage/2013-11-22/63290587.PDF
592,2013-11-22,彩虹精化：关于对惠州市虹彩新材料科技有限公司增资的公告,finalpage/2013-11-22/63290588.PDF
593,2013-11-22,彩虹精化：关于惠州市虹彩新材料科技有限公司收购深圳市虹彩新材料科技有限公司全部股权的公告,finalpage/2013-11-22/63290589.PDF
594,2013-11-22,彩虹精化：关于为深圳市虹彩新材料科技有限公司及嘉兴市彩联新材料科技有限公司提供授信担保的公告,finalpage/2013-11-22/63290590.PDF
595,2013-11-22,彩虹精化：关于聘任2013年度审计机构的公告,finalpage/2013-11-22/63290591.PDF
596,2013-11-22,彩虹精化：关于召开2013年第四次临时股东大会的通知,finalpage/2013-11-22/63290592.PDF
597,2013-11-22,彩虹精化：国信证券股份有限公司关于公司变更募集资金投向的专项意见,finalpage/2013-11-22/63290593.PDF
598,2013-11-22,彩虹精化：公司章程（2013年11月）,finalpage/2013-11-22/63290594.PDF
599,2013-11-22,彩虹精化：独立董事关于有关事项发表的独立意见,finalpage/2013-11-22/63290595.PDF
600,2013-11-23,彩虹精化：关于控股股东股权解除质押及重新质押的公告,finalpage/2013-11-23/63294130.PDF
601,2013-12-02,彩虹精化：重大事项停牌公告,finalpage/2013-12-02/63318861.PDF
602,2013-12-04,彩虹精化：第三届董事会第十次会议决议公告,finalpage/2013-12-04/63335138.PDF
603,2013-12-04,彩虹精化：第三届监事会第八次会议决议公告,finalpage/2013-12-04/63335139.PDF
604,2013-12-04,彩虹精化：关于2013年半年度报告及第三季度报告非经常性损益披露差错更正的公告,finalpage/2013-12-04/63335140.PDF
605,2013-12-04,彩虹精化：北京市中伦律师事务所关于公司股票期权与限制性股票激励计划（草案）的法律意见书,finalpage/2013-12-04/63335141.PDF
606,2013-12-04,彩虹精化：国信证券股份有限公司关于公司股票期权与限制性股票激励计划（草案）之独立财务顾问报告,finalpage/2013-12-04/63335142.PDF
607,2013-12-04,彩虹精化：2013年半年度报告（更新后）,finalpage/2013-12-04/63335143.PDF
608,2013-12-04,彩虹精化：2013年半年度报告摘要（更新后）,finalpage/2013-12-04/63335144.PDF
609,2013-12-04,彩虹精化：2013年半年度财务报告（更新后）,finalpage/2013-12-04/63335149.PDF
610,2013-12-04,彩虹精化：2013年第三季度报告全文（更新后）,finalpage/2013-12-04/63335150.PDF
611,2013-12-04,彩虹精化：2013年第三季度报告正文（更新后）,finalpage/2013-12-04/63335151.PDF
612,2013-12-04,彩虹精化：独立董事关于公司股票期权与限制性股票激励计划（草案）的独立意见,finalpage/2013-12-04/63335152.PDF
613,2013-12-04,彩虹精化：监事会对股票期权与限制性股票激励计划激励对象名单的核查意见,finalpage/2013-12-04/63335153.PDF
614,2013-12-04,彩虹精化：股权激励计划分配明细表,finalpage/2013-12-04/63335154.PDF
615,2013-12-04,彩虹精化：股票期权与限制性股票激励计划实施考核管理办法,finalpage/2013-12-04/63335155.PDF
616,2013-12-04,彩虹精化：股票期权与限制性股票激励计划（草案）,finalpage/2013-12-04/63335156.PDF
617,2013-12-04,彩虹精化：股票期权与限制性股票激励计划（草案）摘要,finalpage/2013-12-04/63335157.PDF
618,2013-12-10,彩虹精化：2013年第四次临时股东大会决议公告,finalpage/2013-12-10/63359842.PDF
619,2013-12-10,彩虹精化：2013年第四次临时股东大会的法律意见书,finalpage/2013-12-10/63359843.PDF
620,2013-12-12,彩虹精化：关于转让控股子公司北京纳尔特保温节能材料有限公司52%股权暨关联交易的进展公告,finalpage/2013-12-12/63367607.PDF
621,2013-12-18,彩虹精化：第三届董事会第十一次会议决议公告,finalpage/2013-12-18/63386518.PDF
622,2013-12-18,彩虹精化：关于为控股子公司深圳市格瑞卫康环保科技有限公司提供担保的公告,finalpage/2013-12-18/63386519.PDF
623,2013-12-18,彩虹精化：独立董事关于为控股子公司深圳市格瑞卫康环保科技有限公司提供担保的独立意见,finalpage/2013-12-18/63386520.PDF
624,2013-12-18,彩虹精化：关于完成企业章程、经营范围变更备案的公告,finalpage/2013-12-18/63387201.PDF
625,2013-12-28,彩虹精化：关于控股股东股权解除质押的公告,finalpage/2013-12-28/63422918.PDF
626,2014-01-04,彩虹精化：关于控股股东股权质押的公告,finalpage/2014-01-04/63452086.PDF
627,2014-01-14,彩虹精化：关于股票期权激励计划（草案）获得中国证监会备案无异议的公告,finalpage/2014-01-14/63484236.PDF
628,2014-01-21,彩虹精化：第三届董事会第十二次会议决议公告,finalpage/2014-01-21/63505303.PDF
629,2014-01-21,彩虹精化：关于参股深圳市中小微企业投资管理有限公司的公告,finalpage/2014-01-21/63505304.PDF
630,2014-01-21,彩虹精化：关于召开2014年第一次临时股东大会的通知,finalpage/2014-01-21/63505305.PDF
631,2014-01-22,彩虹精化：关于控股股东股权质押的公告,finalpage/2014-01-22/63512874.PDF
632,2014-02-11,彩虹精化：第三届董事会第十三次会议决议公告,finalpage/2014-02-11/63558438.PDF
633,2014-02-11,彩虹精化：关于设立深圳市永晟新能源有限公司的公告,finalpage/2014-02-11/63558439.PDF
634,2014-02-11,彩虹精化：关于公司及相关主体承诺履行情况的公告,finalpage/2014-02-11/63558440.PDF
635,2014-02-12,彩虹精化：关于控股股东进行股票质押式回购交易的公告,finalpage/2014-02-12/63561262.PDF
636,2014-02-18,彩虹精化：关于设立深圳市永晟新能源有限公司完成工商登记的公告,finalpage/2014-02-18/63581171.PDF
637,2014-02-19,彩虹精化：第三届董事会第十四次会议决议公告,finalpage/2014-02-19/63585613.PDF
638,2014-02-19,彩虹精化：第三届监事会第九次会议决议公告,finalpage/2014-02-19/63585614.PDF
639,2014-02-19,彩虹精化：关于继续使用闲置募集资金暂时补充流动资金的公告,finalpage/2014-02-19/63585615.PDF
640,2014-02-19,彩虹精化：关于召开2014年第二次临时股东大会的通知,finalpage/2014-02-19/63585616.PDF
641,2014-02-19,彩虹精化：2014年第一次临时股东大会决议公告,finalpage/2014-02-19/63585617.PDF
642,2014-02-19,彩虹精化：2014年第一次临时股东大会的法律意见书,finalpage/2014-02-19/63585618.PDF
643,2014-02-19,彩虹精化：国信证券股份有限公司关于公司继续使用闲置募集资金暂时补充流动资金的核查意见,finalpage/2014-02-19/63585619.PDF
644,2014-02-19,彩虹精化：独立董事关于继续使用闲置募集资金暂时补充流动资金的独立意见,finalpage/2014-02-19/63585620.PDF
645,2014-02-21,彩虹精化：关于在香港设立全资子公司完成注册登记的公告,finalpage/2014-02-21/63591950.PDF
646,2014-02-28,彩虹精化：2013年度业绩快报,finalpage/2014-02-28/63615958.PDF
647,2014-03-08,彩虹精化：关于归还募集资金的公告,finalpage/2014-03-08/63650737.PDF
648,2014-03-12,彩虹精化：第三届董事会第十五次会议决议公告,finalpage/2014-03-12/63666850.PDF
649,2014-03-12,彩虹精化：第三届监事会第十次会议决议公告,finalpage/2014-03-12/63666851.PDF
650,2014-03-12,彩虹精化：关于对股票期权与限制性股票激励计划进行调整的公告,finalpage/2014-03-12/63666852.PDF
651,2014-03-12,彩虹精化：关于向调整后的激励对象授予股票期权与限制性股票的公告,finalpage/2014-03-12/63666853.PDF
652,2014-03-12,彩虹精化：关于对全资子公司深圳市永晟新能源有限公司进行增资的公告,finalpage/2014-03-12/63666854.PDF
