,date,title,url
852,2015-03-17,彩虹精化：第三届监事会第十九次会议决议公告,finalpage/2015-03-17/1200704920.PDF
853,2015-03-17,彩虹精化：关于向激励对象授予预留股票期权的公告,finalpage/2015-03-17/1200704921.PDF
854,2015-03-17,彩虹精化：广东志润律师事务所关于公司向激励对象授予预留部分股票期权事项的法律意见书,finalpage/2015-03-17/1200704922.PDF
855,2015-03-17,彩虹精化：监事会对股权激励计划预留股票期权激励对象名单的核查意见,finalpage/2015-03-17/1200704923.PDF
856,2015-03-17,彩虹精化：股权激励计划预留股票期权激励对象名单,finalpage/2015-03-17/1200704924.PDF
857,2015-03-17,彩虹精化：独立董事向激励对象授予预留股票期权的独立意见,finalpage/2015-03-17/1200704925.PDF
858,2015-03-17,彩虹精化：关于全资孙公司湖州永聚新能源有限公司取得湖州市吴兴区企业投资项目备案通知书的公告,finalpage/2015-03-17/1200705106.PDF
859,2015-03-19,彩虹精化：2015年第二次临时股东大会决议公告,finalpage/2015-03-19/1200714727.PDF
860,2015-03-19,彩虹精化：2015年第二次临时股东大会的法律意见书,finalpage/2015-03-19/1200714728.PDF
861,2015-03-20,彩虹精化：关于全资孙公司取得企业投资项目备案通知书的公告,finalpage/2015-03-20/1200718492.PDF
862,2015-03-25,彩虹精化：关于对深圳证券交易所监管关注函回复的公告,finalpage/2015-03-25/1200737604.PDF
863,2015-03-31,彩虹精化：广东志润律师事务所关于公司与中国核工业第二二建设有限公司签署的《太阳能光伏电站项目合作框架协议》的法律意见书,finalpage/2015-03-31/1200773069.PDF
864,2015-03-31,彩虹精化：董事会关于重大协议双方履约能力的分析说明,finalpage/2015-03-31/1200773070.PDF
865,2015-03-31,彩虹精化：关于与中国核工业第二二建设有限公司签署《太阳能光伏电站项目合作框架协议》的公告,finalpage/2015-03-31/1200773068.PDF
866,2015-04-02,彩虹精化：第三届董事会第三十四次会议决议公告,finalpage/2015-04-02/1200781946.PDF
867,2015-04-02,彩虹精化：关于变更保荐机构及保荐代表人的公告,finalpage/2015-04-02/1200781947.PDF
868,2015-04-02,彩虹精化：2014年年度股东大会决议公告,finalpage/2015-04-02/1200778797.PDF
869,2015-04-02,彩虹精化：2014年年度股东大会的法律意见书,finalpage/2015-04-02/1200778798.PDF
870,2015-04-03,彩虹精化：关于全资孙公司取得企业投资项目备案通知书的公告,finalpage/2015-04-03/1200787278.PDF
871,2015-04-03,彩虹精化：2014年年度权益分派实施公告,finalpage/2015-04-03/1200784039.PDF
872,2015-04-03,彩虹精化：关于控股股东股权解除质押及重新质押的公告,finalpage/2015-04-03/1200784040.PDF
873,2015-04-07,彩虹精化：关于全资孙公司取得企业投资项目备案通知书的补充公告,finalpage/2015-04-07/1200788334.PDF
874,2015-04-07,彩虹精化：股票交易异常波动公告,finalpage/2015-04-07/1200788335.PDF
875,2015-04-08,彩虹精化：关于控股股东股权解除质押及重新质押的公告,finalpage/2015-04-08/1200798642.PDF
876,2015-04-08,彩虹精化：关于重大意向性协议的进展公告,finalpage/2015-04-08/1200798641.PDF
877,2015-04-10,彩虹精化：关于全资孙公司取得企业投资项目备案通知书的公告,finalpage/2015-04-10/1200804792.PDF
878,2015-04-14,彩虹精化：第三届董事会第三十五次会议决议公告,finalpage/2015-04-14/1200826553.PDF
879,2015-04-14,彩虹精化：第三届监事会第二十次会议决议公告,finalpage/2015-04-14/1200826554.PDF
880,2015-04-14,彩虹精化：关于对股票期权激励计划首次授予期权数量、行权价格、激励对象及预留授予期权行权价格进行调整的公告,finalpage/2015-04-14/1200826555.PDF
881,2015-04-14,彩虹精化：关于股票期权与限制性股票激励计划第一个行权/解锁期可行权/解锁的公告,finalpage/2015-04-14/1200826556.PDF
882,2015-04-14,彩虹精化：关于实际控制人和控股股东不占用上市公司资金承诺及减少和规范关联交易承诺的公告,finalpage/2015-04-14/1200826557.PDF
883,2015-04-14,彩虹精化：广东志润律师事务所关于公司股票期权与限制性股票激励计划调整事宜的法律意见书,finalpage/2015-04-14/1200826558.PDF
884,2015-04-14,彩虹精化：广东志润律师事务所关于公司股票期权与限制性股票激励计划首期行权/解锁事宜的法律意见书,finalpage/2015-04-14/1200826559.PDF
885,2015-04-14,彩虹精化：独立董事对公司股权激励计划相关事项发表的独立意见,finalpage/2015-04-14/1200826560.PDF
886,2015-04-14,彩虹精化：股票期权与限制性股票激励计划第一个行权期/解锁期可行权/解锁对象名单,finalpage/2015-04-14/1200826561.PDF
887,2015-04-14,彩虹精化：股票期权激励计划首次授予期权分配明细表（第二次调整后）,finalpage/2015-04-14/1200826562.PDF
888,2015-04-15,彩虹精化：关于控股股东股权解除质押及重新质押的公告,finalpage/2015-04-15/1200833099.PDF
889,2015-04-16,彩虹精化：关于控股股东进行股票质押式回购交易的公告,finalpage/2015-04-16/1200836484.PDF
890,2015-04-17,彩虹精化：关于股权激励计划预留股票期权授予登记完成的公告,finalpage/2015-04-17/1200845867.PDF
891,2015-04-18,彩虹精化：关于控股股东股权解除质押的公告,finalpage/2015-04-18/1200862156.PDF
892,2015-04-24,彩虹精化：2015年第一季度报告正文,finalpage/2015-04-24/1200897326.PDF
893,2015-04-24,彩虹精化：2015年第一季度报告全文,finalpage/2015-04-24/1200897327.PDF
894,2015-04-24,彩虹精化：关于变更保荐机构后重新签订《募集资金三方监管协议》的公告,finalpage/2015-04-24/1200897328.PDF
895,2015-04-24,彩虹精化：关于非公开发行股票申请获得中国证券监督管理委员会受理的公告,finalpage/2015-04-24/1200897329.PDF
896,2015-04-27,彩虹精化：关于对股票期权激励计划首期授予期权数量、行权价格、激励对象、预留授予期权行权价格进行调整及注销部分已授予期权完成的公告,finalpage/2015-04-27/1200917529.PDF
897,2015-04-30,彩虹精化：关于控股股东股票进行质押式回购交易及解除质押式回购交易的公告,finalpage/2015-04-30/1200943796.PDF
898,2015-05-04,彩虹精化：关于安徽省庐江县白湖社区胜利圩区种养殖基地场20MW分布式光伏发电项目完成并网验收的公告,finalpage/2015-05-04/1200958839.PDF
899,2015-05-07,彩虹精化：关于股票期权与限制性股票激励计划第一个行权期采用自主行权方式的公告,finalpage/2015-05-07/1200974203.PDF
900,2015-05-09,彩虹精化：关于控股股东股票进行质押式回购交易的公告,finalpage/2015-05-09/1200984742.PDF
901,2015-06-01,彩虹精化：股票交易异常波动公告,finalpage/2015-06-01/1201082564.PDF
902,2015-06-05,彩虹精化：关于收到深圳证券交易所2014年年报问询函的回复公告,finalpage/2015-06-05/1201105240.PDF
903,2015-06-12,彩虹精化：关于与华为技术有限公司签署《框架合作协议》的公告,finalpage/2015-06-12/1201138793.PDF
904,2015-06-13,彩虹精化：关于控股股东股权解除质押的公告,finalpage/2015-06-13/1201144240.PDF
905,2015-06-18,彩虹精化：关于控股股东股票进行质押式回购交易的公告,finalpage/2015-06-18/1201163667.PDF
906,2015-06-24,彩虹精化：关于收到《中国证监会行政许可项目审查反馈意见通知书》的公告,finalpage/2015-06-24/1201187186.PDF
907,2015-06-27,彩虹精化：关于肥西国胜太阳能发电有限公司与合肥聚能新能源科技有限公司签署《工程总承包（EPC）合同》,finalpage/2015-06-27/1201203061.PDF
908,2015-06-27,彩虹精化：广东志润律师事务所关于公司与合肥聚能新能源科技有限公司签署的《工程总承包（EPC）合同》的法律意见书,finalpage/2015-06-27/1201203062.PDF
909,2015-07-03,彩虹精化：关于控股股东股权解除质押及进行股票质押式回购交易的公告,finalpage/2015-07-03/1201229971.PDF
910,2015-07-07,彩虹精化：关于重大合同的进展公告,finalpage/2015-07-07/1201251756.PDF
911,2015-07-07,彩虹精化：重大事项停牌公告,finalpage/2015-07-07/1201248353.PDF
912,2015-07-08,彩虹精化：关于控股股东股票进行质押式回购交易的公告,finalpage/2015-07-08/1201253855.PDF
913,2015-07-10,彩虹精化：关于作出维护证券市场持续稳定承诺的公告,finalpage/2015-07-10/1201267129.PDF
914,2015-07-13,彩虹精化：重大事项停牌进展公告,finalpage/2015-07-13/1201274063.PDF
915,2015-07-20,彩虹精化：关于控股股东股权解除质押及重新质押的公告,finalpage/2015-07-20/1201310626.PDF
916,2015-07-20,彩虹精化：重大事项停牌进展公告,finalpage/2015-07-20/1201310627.PDF
917,2015-07-20,彩虹精化：第三届董事会第三十七次会议决议公告,finalpage/2015-07-20/1201316903.PDF
918,2015-07-20,彩虹精化：关于调整本次非公开发行股票发行价格及发行数量的公告,finalpage/2015-07-20/1201316904.PDF
919,2015-07-20,彩虹精化：关于前次募集资金使用情况的报告,finalpage/2015-07-20/1201316905.PDF
920,2015-07-20,彩虹精化：关于非公开发行股票申请文件反馈意见回复的公告,finalpage/2015-07-20/1201316906.PDF
921,2015-07-20,彩虹精化：关于最近五年被证券监管部门和交易所处罚或采取监管措施的情况及整改措施的公告,finalpage/2015-07-20/1201316907.PDF
922,2015-07-20,彩虹精化：关于与具体发行对象签署《附生效条件的非公开发行股票认购协议之补充协议》的公告,finalpage/2015-07-20/1201316908.PDF
923,2015-07-20,彩虹精化：关于公司前次募集资金使用情况的鉴证报告,finalpage/2015-07-20/1201316909.PDF
924,2015-07-20,彩虹精化：关于公司股票减持情况和减持计划的承诺,finalpage/2015-07-20/1201316910.PDF
925,2015-07-20,彩虹精化：关于认购公司非公开发行股份的承诺函,finalpage/2015-07-20/1201316911.PDF
926,2015-07-20,彩虹精化：公司章程（2015年7月）,finalpage/2015-07-20/1201316912.PDF
927,2015-07-20,彩虹精化：关于非公开发行股票申请文件反馈意见的回复,finalpage/2015-07-20/1201316913.PDF
928,2015-07-20,彩虹精化：2015年度非公开发行股票预案（修订稿）,finalpage/2015-07-20/1201316914.PDF
929,2015-07-20,彩虹精化：承诺函（一）,finalpage/2015-07-20/1201316915.PDF
930,2015-07-20,彩虹精化：承诺函（二）,finalpage/2015-07-20/1201316916.PDF
931,2015-07-20,彩虹精化：深圳市前海新旺兆投资合伙企业（有限合伙）合伙协议,finalpage/2015-07-20/1201316917.PDF
932,2015-07-20,彩虹精化：深圳市前海新旺兆投资合伙企业（有限合伙）合伙协议之补充协议,finalpage/2015-07-20/1201316918.PDF
933,2015-07-20,彩虹精化：深圳市汇通正源股权投资基金合伙企业（有限合伙）合伙协议,finalpage/2015-07-20/1201316919.PDF
934,2015-07-20,彩虹精化：深圳市汇通正源股权投资基金合伙企业（有限合伙）合伙协议之补充协议,finalpage/2015-07-20/1201316920.PDF
935,2015-07-23,彩虹精化：重大事项复牌公告,finalpage/2015-07-23/1201334389.PDF
936,2015-07-23,彩虹精化：关于签署合作框架协议的公告,finalpage/2015-07-23/1201334390.PDF
937,2015-07-23,彩虹精化：关于实际控制人增持公司股份计划的公告,finalpage/2015-07-23/1201334391.PDF
938,2015-07-23,彩虹精化：北京市大成（深圳）律师事务所关于深圳市永晟新能源有限公司与广东易事特电源股份有限公司、广东金易盛阳新能源投资有限公司、沭阳清水河光伏发电有限公司签署的《江苏沭阳项目合作框架协议》的法律意见书,finalpage/2015-07-23/1201334392.PDF
939,2015-07-27,彩虹精化：关于控股股东股权质押的公告,finalpage/2015-07-27/1201349174.PDF
940,2015-07-27,彩虹精化：关于与招商局资本投资有限责任公司签署战略合作框架协议的公告,finalpage/2015-07-27/1201349175.PDF
941,2015-07-27,彩虹精化：北京市大成（深圳）律师事务所关于公司与招商局资本投资有限责任公司签署《战略合作框架协议》的法律意见书,finalpage/2015-07-27/1201349176.PDF
942,2015-07-28,彩虹精化：第三届董事会第三十八次会议决议公告,finalpage/2015-07-28/1201354479.PDF
943,2015-07-28,彩虹精化：关于佛山市中盛新能源科技有限公司开展融资租赁业务的公告,finalpage/2015-07-28/1201354480.PDF
944,2015-07-28,彩虹精化：关于为佛山市中盛新能源科技有限公司开展融资租赁提供担保的公告,finalpage/2015-07-28/1201354481.PDF
945,2015-07-28,彩虹精化：关于召开2015年第三次临时股东大会的通知,finalpage/2015-07-28/1201354482.PDF
946,2015-07-28,彩虹精化：股票交易异常波动公告,finalpage/2015-07-28/1201354483.PDF
947,2015-07-28,彩虹精化：独立董事关于公司为佛山市中盛新能源科技有限公司开展融资租赁提供担保的独立意见,finalpage/2015-07-28/1201354484.PDF
948,2015-07-31,彩虹精化：2015年半年度业绩快报,finalpage/2015-07-31/1201373039.PDF
949,2015-08-04,彩虹精化：重大事项停牌公告,finalpage/2015-08-04/1201387829.PDF
950,2015-08-11,彩虹精化：重大事项停牌进展公告,finalpage/2015-08-11/1201417352.PDF
951,2015-08-12,彩虹精化：关于公司全资子公司深圳市虹彩新材料科技有限公司收到《深圳市发展改革委关于深圳市生物质热塑性复合材料制品应用示范项目实施方案地方配套资金申请报告的批复》的公告,finalpage/2015-08-12/1201427388.PDF
952,2015-08-12,彩虹精化：关于股权激励计划限制性股票第一期解锁上市流通的提示性公告,finalpage/2015-08-12/1201423664.PDF
953,2015-08-15,彩虹精化：2015年第三次临时股东大会决议公告,finalpage/2015-08-15/1201438665.PDF
954,2015-08-15,彩虹精化：2015年第三次临时股东大会的法律意见书,finalpage/2015-08-15/1201438666.PDF
955,2015-08-17,彩虹精化：第三届董事会第三十九次会议决议公告,finalpage/2015-08-17/1201447933.PDF
956,2015-08-17,彩虹精化：关于合肥市永聚太阳能电力开发有限公司开展融资租赁业务的公告,finalpage/2015-08-17/1201447934.PDF
957,2015-08-17,彩虹精化：关于为合肥市永聚太阳能电力开发有限公司开展融资租赁提供担保的公告,finalpage/2015-08-17/1201447935.PDF
958,2015-08-17,彩虹精化：关于召开2015年第四次临时股东大会的通知,finalpage/2015-08-17/1201447936.PDF
959,2015-08-17,彩虹精化：独立董事关于公司为合肥市永聚太阳能电力开发有限公司开展融资租赁提供担保的独立意见,finalpage/2015-08-17/1201447937.PDF
960,2015-08-18,彩虹精化：重大事项复牌公告,finalpage/2015-08-18/1201451240.PDF
961,2015-08-20,彩虹精化：股票交易异常波动公告,finalpage/2015-08-20/1201461409.PDF
962,2015-08-20,彩虹精化：关于规范使用流动资金的承诺函,finalpage/2015-08-20/1201461410.PDF
963,2015-08-25,彩虹精化：关于控股股东股权解除质押及重新质押的公告,finalpage/2015-08-25/1201482508.PDF
964,2015-08-27,彩虹精化：重大事项停牌公告,finalpage/2015-08-27/1201503490.PDF
965,2015-08-28,彩虹精化：2015年半年度报告摘要,finalpage/2015-08-28/1201508860.PDF
966,2015-08-28,彩虹精化：2015年半年度财务报告,finalpage/2015-08-28/1201508862.PDF
967,2015-08-28,彩虹精化：第三届董事会第四十次会议决议公告,finalpage/2015-08-28/1201508863.PDF
968,2015-08-28,彩虹精化：第三届监事会第二十二次会议决议公告,finalpage/2015-08-28/1201508864.PDF
969,2015-08-28,彩虹精化：2015年半年度报告,finalpage/2015-08-28/1201508865.PDF
970,2015-08-28,彩虹精化：独立董事关于公司有关事项发表的独立意见,finalpage/2015-08-28/1201508866.PDF
971,2015-08-28,彩虹精化：2015年半年度募集资金存放与实际使用情况的专项报告,finalpage/2015-08-28/1201508867.PDF
972,2015-08-29,彩虹精化：关于公司全资子公司深圳市虹彩新材料科技有限公司收到政府资助的公告,finalpage/2015-08-29/1201518381.PDF
973,2015-09-07,彩虹精化：2015年第四次临时股东大会决议公告,finalpage/2015-09-07/1201542877.PDF
974,2015-09-07,彩虹精化：2015年第四次临时股东大会的法律意见书,finalpage/2015-09-07/1201542878.PDF
975,2015-09-07,彩虹精化：重大事项停牌进展公告,finalpage/2015-09-07/1201542981.PDF
976,2015-09-07,彩虹精化：关于重大事项停牌进展的补充公告,finalpage/2015-09-07/1201543686.PDF
977,2015-09-14,彩虹精化：重大事项复牌公告,finalpage/2015-09-14/1201582374.PDF
978,2015-09-14,彩虹精化：关于深圳市永晟新能源有限公司与浙江贝盛新能源开发有限公司签署《关于湖州10.07MW项目合作协议》和《项目合作协议书》的公告,finalpage/2015-09-14/1201582375.PDF
979,2015-09-14,彩虹精化：关于深圳市永晟新能源有限公司与揭阳中诚集团有限公司、宁夏揭阳中源电力有限公司签署《宁夏揭阳项目合作框架协议》的公告,finalpage/2015-09-14/1201582376.PDF
980,2015-09-14,彩虹精化：北京市大成（深圳）律师事务所关于深圳市永晟新能源有限公司与揭阳中诚集团有限公司、宁夏揭阳中源电力有限公司签署的《宁夏揭阳项目合作框架协议》的法律意见书,finalpage/2015-09-14/1201582377.PDF
981,2015-09-14,彩虹精化：北京市大成（深圳）律师事务所关于深圳市永晟新能源有限公司与浙江贝盛新能源开发有限公司签署《关于湖州10.07MW项目合作协议》和《项目合作协议书》的法律意见书,finalpage/2015-09-14/1201582378.PDF
982,2015-09-14,彩虹精化：2015年度非公开发行股票募集资金使用的可行性分析报告（修订稿）,finalpage/2015-09-14/1201589174.PDF
983,2015-09-14,彩虹精化：第三届董事会第四十一次会议决议公告,finalpage/2015-09-14/1201589175.PDF
984,2015-09-14,彩虹精化：关于调整本次非公开发行股票募集资金金额的公告,finalpage/2015-09-14/1201589176.PDF
985,2015-09-14,彩虹精化：关于公司与具体发行对象签署《附生效条件的非公开发行股票认购协议之补充协议二》的公告,finalpage/2015-09-14/1201589177.PDF
986,2015-09-14,彩虹精化：关于非公开发行股票申请文件反馈意见回复修订的公告,finalpage/2015-09-14/1201589178.PDF
987,2015-09-14,彩虹精化：关于非公开发行摊薄即期收益的风险提示的公告,finalpage/2015-09-14/1201589179.PDF
988,2015-09-14,彩虹精化：关于认购公司非公开发行股份的承诺函的补充承诺,finalpage/2015-09-14/1201589180.PDF
989,2015-09-14,彩虹精化：关于非公开发行股票申请文件反馈意见的回复（修订稿）,finalpage/2015-09-14/1201589181.PDF
990,2015-09-14,彩虹精化：2015年度非公开发行股票预案（修订稿）,finalpage/2015-09-14/1201589182.PDF
991,2015-09-14,彩虹精化：独立董事关于公司有关事项发表的独立意见,finalpage/2015-09-14/1201589183.PDF
992,2015-09-14,彩虹精化：深圳市前海新旺兆投资合伙企业（有限合伙）合伙协议之补充协议二,finalpage/2015-09-14/1201589184.PDF
993,2015-10-08,彩虹精化：关于全资子公司深圳市虹彩新材料科技有限公司收到5200万元政府补助的公告,finalpage/2015-10-08/1201660336.PDF
994,2015-10-12,彩虹精化：第三届董事会第四十二次会议决议公告,finalpage/2015-10-12/1201680958.PDF
995,2015-10-12,彩虹精化：第三届监事会第二十三次会议决议公告,finalpage/2015-10-12/1201680959.PDF
996,2015-10-12,彩虹精化：关于调整本次非公开发行股票募集资金金额的公告,finalpage/2015-10-12/1201680960.PDF
997,2015-10-12,彩虹精化：关于公司与具体发行对象签署《附生效条件的非公开发行股票认购协议之补充协议三》的公告,finalpage/2015-10-12/1201680961.PDF
998,2015-10-12,彩虹精化：关于续聘2015年度审计机构的公告,finalpage/2015-10-12/1201680962.PDF
999,2015-10-12,彩虹精化：关于召开2015年第五次临时股东大会的通知,finalpage/2015-10-12/1201680963.PDF
1000,2015-10-12,彩虹精化：关于非公开发行摊薄即期收益的风险提示的公告,finalpage/2015-10-12/1201680964.PDF
1001,2015-10-12,彩虹精化：关于重大合同的进展公告,finalpage/2015-10-12/1201680965.PDF
1002,2015-10-12,彩虹精化：2015年度非公开发行股票募集资金使用的可行性分析报告（修订稿）,finalpage/2015-10-12/1201680966.PDF
1003,2015-10-12,彩虹精化：2015年度非公开发行股票预案（修订稿）,finalpage/2015-10-12/1201680967.PDF
1004,2015-10-12,彩虹精化：独立董事关于有关事项发表的独立意见,finalpage/2015-10-12/1201680968.PDF
1005,2015-10-17,彩虹精化：关于控股股东股票解除质押式回购交易及重新质押的公告,finalpage/2015-10-17/1201703444.PDF
1006,2015-10-24,彩虹精化：关于控股股东股票解除质押式回购交易及重新质押的公告,finalpage/2015-10-24/1201717232.PDF
1007,2015-10-27,彩虹精化：股票交易异常波动公告,finalpage/2015-10-27/1201725617.PDF
1008,2015-10-29,彩虹精化：2015年第五次临时股东大会决议公告,finalpage/2015-10-29/1201735968.PDF
1009,2015-10-29,彩虹精化：关于非公开发行股票申请文件反馈意见回复修订的公告,finalpage/2015-10-29/1201735969.PDF
1010,2015-10-29,彩虹精化：关于非公开发行股票申请文件反馈意见的回复（修订稿）,finalpage/2015-10-29/1201735970.PDF
1011,2015-10-29,彩虹精化：承诺函,finalpage/2015-10-29/1201735971.PDF
1012,2015-10-29,彩虹精化：2015年第五次临时股东大会的法律意见书,finalpage/2015-10-29/1201735972.PDF
1013,2015-10-29,彩虹精化：关于认购公司非公开发行股份的承诺函,finalpage/2015-10-29/1201735973.PDF
1014,2015-10-30,彩虹精化：2015年第三季度报告正文,finalpage/2015-10-30/1201738464.PDF
1015,2015-10-30,彩虹精化：2015年第三季度报告全文,finalpage/2015-10-30/1201738465.PDF
1016,2015-11-09,彩虹精化：关于非公开发行股票申请获得中国证监会发行审核委员会审核通过的公告,finalpage/2015-11-09/1201756287.PDF
1017,2015-11-09,彩虹精化：关于控股股东股票解除质押式回购交易及重新质押的公告,finalpage/2015-11-09/1201756288.PDF
1018,2015-11-20,彩虹精化：关于全资子公司深圳市永晟新能源有限公司收购深圳市充电易科技有限公司20%股权的公告,finalpage/2015-11-20/1201779423.PDF
1019,2015-12-04,彩虹精化：关于全资子公司深圳市永晟新能源有限公司收购深圳宏旭新能源汽车运营有限公司90%股权的公告,finalpage/2015-12-04/1201805036.PDF
1020,2015-12-08,彩虹精化：关于全资子公司深圳市永晟新能源有限公司收购深圳宏旭新能源汽车运营有限公司90%股权的进展公告,finalpage/2015-12-08/1201812732.PDF
1021,2015-12-12,彩虹精化：关于控股股东股权解除质押及重新质押的公告,finalpage/2015-12-12/1201830058.PDF
1022,2015-12-14,彩虹精化：关于全资子公司深圳市永晟新能源有限公司收购深圳市充电易科技有限公司20%股权完成工商变更登记的公告,finalpage/2015-12-14/1201832527.PDF
1023,2015-12-18,彩虹精化：关于控股股东股票解除质押式回购交易及重新质押的公告,finalpage/2015-12-18/1201843639.PDF
1024,2015-12-29,彩虹精化：关于非公开发行股票申请获得中国证券监督管理委员会核准的公告,finalpage/2015-12-29/1201870734.PDF
1025,2015-12-31,彩虹精化：关于控股股东股票解除质押式回购交易及重新质押的公告,finalpage/2015-12-31/1201881823.PDF
1026,2015-12-31,彩虹精化：独立董事提名人声明（一）,finalpage/2015-12-31/1201877631.PDF
1027,2015-12-31,彩虹精化：独立董事提名人声明（二）,finalpage/2015-12-31/1201877632.PDF
1028,2015-12-31,彩虹精化：独立董事提名人声明（三）,finalpage/2015-12-31/1201877633.PDF
1029,2015-12-31,彩虹精化：独立董事候选人声明（刘善荣）,finalpage/2015-12-31/1201877634.PDF
1030,2015-12-31,彩虹精化：独立董事候选人声明（张学斌）,finalpage/2015-12-31/1201877635.PDF
1031,2015-12-31,彩虹精化：独立董事候选人声明（刘书锦）,finalpage/2015-12-31/1201877636.PDF
1032,2015-12-31,彩虹精化：第三届监事会第二十五次会议决议公告,finalpage/2015-12-31/1201877637.PDF
1033,2015-12-31,彩虹精化：关于召开2016年第一次临时股东大会的通知,finalpage/2015-12-31/1201877638.PDF
1034,2015-12-31,彩虹精化：关于对控股子公司深圳宏旭新能源汽车运营有限公司进行增资的公告,finalpage/2015-12-31/1201877639.PDF
1035,2015-12-31,彩虹精化：关于设立招商彩虹新能源产业投资基金的公告,finalpage/2015-12-31/1201877640.PDF
1036,2015-12-31,彩虹精化：独立董事关于有关事项发表的独立意见,finalpage/2015-12-31/1201877641.PDF
1037,2015-12-31,彩虹精化：第三届董事会第四十四次会议决议公告,finalpage/2015-12-31/1201877642.PDF
1038,2016-01-08,彩虹精化：关于重大合同的进展公告,finalpage/2016-01-08/1201902438.PDF
