,date,title,url
653,2014-03-12,彩虹精化：关于全资子公司深圳市永晟新能源有限公司设立北京市永晟新能源有限公司的公告,finalpage/2014-03-12/63666855.PDF
654,2014-03-12,彩虹精化：广东诚公律师事务所关于公司股票期权与限制性股票激励计划调整和授予事宜的法律意见书,finalpage/2014-03-12/63666856.PDF
655,2014-03-12,彩虹精化：独立董事对公司股权激励计划相关事项发表的独立意见,finalpage/2014-03-12/63666857.PDF
656,2014-03-12,彩虹精化：监事会对调整后的股票期权与限制性股票激励计划激励对象名单的核查意见,finalpage/2014-03-12/63666858.PDF
657,2014-03-12,彩虹精化：股权激励计划分配明细表（调整后）,finalpage/2014-03-12/63666859.PDF
658,2014-03-12,彩虹精化：2014年第二次临时股东大会决议公告,finalpage/2014-03-12/63663813.PDF
659,2014-03-12,彩虹精化：2014年第二次临时股东大会的法律意见书,finalpage/2014-03-12/63663814.PDF
660,2014-03-31,彩虹精化：2014年第一季度业绩预告公告,finalpage/2014-03-31/63749803.PDF
661,2014-04-10,彩虹精化：关于签订《募集资金三方监管协议》的公告,finalpage/2014-04-10/63817628.PDF
662,2014-04-10,彩虹精化：关于对深圳证券交易所监管函的整改报告,finalpage/2014-04-10/63813815.PDF
663,2014-04-22,彩虹精化：关于控股股东股权解除质押的公告,finalpage/2014-04-22/63889090.PDF
664,2014-04-25,彩虹精化：关于控股股东股权质押的公告,finalpage/2014-04-25/63918053.PDF
665,2014-04-28,彩虹精化：2013年度独立董事述职报告（刘书锦）,finalpage/2014-04-28/63928739.PDF
666,2014-04-28,彩虹精化：2013年度独立董事述职报告（陈仕明）,finalpage/2014-04-28/63928740.PDF
667,2014-04-28,彩虹精化：2013年年度报告摘要,finalpage/2014-04-28/63928741.PDF
668,2014-04-28,彩虹精化：2013年年度审计报告,finalpage/2014-04-28/63928750.PDF
669,2014-04-28,彩虹精化：第三届董事会第十六次会议决议公告,finalpage/2014-04-28/63928751.PDF
670,2014-04-28,彩虹精化：关于召开2013年年度股东大会的通知,finalpage/2014-04-28/63928752.PDF
671,2014-04-28,彩虹精化：第三届监事会第十一次会议决议公告,finalpage/2014-04-28/63928753.PDF
672,2014-04-28,彩虹精化：关于公司关联方占用上市公司资金情况的专项审核报告,finalpage/2014-04-28/63928754.PDF
673,2014-04-28,彩虹精化：2013年年度报告,finalpage/2014-04-28/63928755.PDF
674,2014-04-28,彩虹精化：2013年度内部控制自我评价报告,finalpage/2014-04-28/63928756.PDF
675,2014-04-28,彩虹精化：内部控制鉴证报告,finalpage/2014-04-28/63928757.PDF
676,2014-04-28,彩虹精化：关于募集资金2013年度存放与实际使用情况的专项报告,finalpage/2014-04-28/63928758.PDF
677,2014-04-28,彩虹精化：关于公司募集资金年度存放与实际使用情况的鉴证报告,finalpage/2014-04-28/63928759.PDF
678,2014-04-28,彩虹精化：独立董事关于有关事项发表的独立意见,finalpage/2014-04-28/63928760.PDF
679,2014-04-28,彩虹精化：2013年度独立董事述职报告（魏达志）,finalpage/2014-04-28/63928761.PDF
680,2014-04-28,彩虹精化：关于举行2013年度报告网上说明会的公告,finalpage/2014-04-28/63928762.PDF
681,2014-04-28,彩虹精化：内部控制缺陷认定标准,finalpage/2014-04-28/63928763.PDF
682,2014-04-28,彩虹精化：内部控制规则落实自查表,finalpage/2014-04-28/63928766.PDF
683,2014-04-28,彩虹精化：国信证券股份有限公司关于公司2013年度募集资金存放与使用情况的专项核查报告,finalpage/2014-04-28/63928767.PDF
684,2014-04-28,彩虹精化：《公司章程》修订案,finalpage/2014-04-28/63928768.PDF
685,2014-04-28,彩虹精化：公司章程（2014年4月）,finalpage/2014-04-28/63928769.PDF
686,2014-04-28,彩虹精化：投资决策程序与规则（2014年4月）,finalpage/2014-04-28/63928770.PDF
687,2014-04-29,彩虹精化：2014年第一季度报告正文,finalpage/2014-04-29/63941451.PDF
688,2014-04-29,彩虹精化：2014年第一季度报告全文,finalpage/2014-04-29/63941458.PDF
689,2014-04-29,彩虹精化：第三届董事会第十七次会议决议公告,finalpage/2014-04-29/63941461.PDF
690,2014-04-29,彩虹精化：关于全资子公司深圳市永晟新能源有限公司设立广州市永晟新能源有限公司的公告,finalpage/2014-04-29/63941464.PDF
691,2014-04-29,彩虹精化：关于全资子公司深圳市永晟新能源有限公司与比亚迪股份有限公司签署战略合作框架协议的公告,finalpage/2014-04-29/63941465.PDF
692,2014-05-05,彩虹精化：关于审计部经理辞职的公告,finalpage/2014-05-05/63969863.PDF
693,2014-05-15,彩虹精化：关于控股股东股票解除质押式回购交易及重新进行质押式回购交易的公告,finalpage/2014-05-15/64029410.PDF
694,2014-05-20,彩虹精化：2013年年度股东大会决议公告,finalpage/2014-05-20/64044292.PDF
695,2014-05-20,彩虹精化：2013年年度权益分派实施公告,finalpage/2014-05-20/64044293.PDF
696,2014-05-20,彩虹精化：2013年年度股东大会的法律意见书,finalpage/2014-05-20/64044294.PDF
697,2014-05-28,彩虹精化：关于与深圳市中科宏易创业投资管理有限公司和博大资本国际有限公司签署合作框架协议的公告,finalpage/2014-05-28/64074508.PDF
698,2014-05-29,彩虹精化：关于全资子公司深圳市永晟新能源有限公司增资完成工商登记的公告,finalpage/2014-05-29/64081075.PDF
699,2014-06-04,彩虹精化：关于全资子公司深圳市永晟新能源有限公司收购佛山市中盛新能源科技有限公司100%股权的公告,finalpage/2014-06-04/64100902.PDF
700,2014-06-09,彩虹精化：关于全资子公司深圳市永晟新能源有限公司设立广州市永晟电力有限公司完成工商登记的公告,finalpage/2014-06-09/64116811.PDF
701,2014-06-12,彩虹精化：关于完成企业章程、经营范围变更备案的公告,finalpage/2014-06-12/64130937.PDF
702,2014-06-20,彩虹精化：关于全资子公司深圳市永晟新能源有限公司收购新余德佑太阳能电力有限责任公司100%股权的公告,finalpage/2014-06-20/64155079.PDF
703,2014-06-24,彩虹精化：第三届董事会第十八次会议决议公告,finalpage/2014-06-24/1200001757.PDF
704,2014-06-24,彩虹精化：关于取消惠州市虹彩新材料科技有限公司收购深圳市虹彩新材料科技有限公司全部股权暨对深圳市虹彩新材料科技有限公司增资的公告,finalpage/2014-06-24/1200001758.PDF
705,2014-06-25,彩虹精化：关于全资子公司深圳市永晟新能源有限公司收购佛山市中盛新能源科技有限公司100%股权完成工商变更登记的公告,finalpage/2014-06-25/1200004403.PDF
706,2014-07-09,彩虹精化：第三届董事会第十九次会议决议公告,finalpage/2014-07-09/1200040313.PDF
707,2014-07-09,彩虹精化：关于为控股子公司深圳市格瑞卫康环保科技有限公司提供担保的公告,finalpage/2014-07-09/1200040314.PDF
708,2014-07-16,彩虹精化：关于全资子公司深圳市永晟新能源有限公司收购新余德佑太阳能电力有限责任公司100%股权完成工商变更登记的公告,finalpage/2014-07-16/1200055913.PDF
709,2014-07-22,彩虹精化：第三届董事会第二十次会议决议公告,finalpage/2014-07-22/1200069150.PDF
710,2014-07-22,彩虹精化：关于为控股子公司深圳市格瑞卫康环保科技有限公司提供担保部分事项调整的公告,finalpage/2014-07-22/1200069151.PDF
711,2014-07-22,彩虹精化：关于签订日常经营重大合同的公告,finalpage/2014-07-22/1200069226.PDF
712,2014-07-25,彩虹精化：关于佛山市中盛新能源科技有限公司与佛山群志光电有限公司签订光伏发电项目补充合同的公告,finalpage/2014-07-25/1200077195.PDF
713,2014-07-31,彩虹精化：2014年半年度业绩快报,finalpage/2014-07-31/1200090126.PDF
714,2014-08-13,彩虹精化：关于控股股东股票解除质押式回购交易的公告,finalpage/2014-08-13/1200124385.PDF
715,2014-08-14,彩虹精化：关于股票期权与限制性股票首次授予登记完成的公告,finalpage/2014-08-14/1200124879.PDF
716,2014-08-15,彩虹精化：关于控股股东进行股票质押式回购交易的公告,finalpage/2014-08-15/1200131253.PDF
717,2014-08-22,彩虹精化：关于控股股东进行股票质押式回购交易的公告,finalpage/2014-08-22/1200152628.PDF
718,2014-08-27,彩虹精化：2014年半年度报告摘要,finalpage/2014-08-27/1200172452.PDF
719,2014-08-27,彩虹精化：2014年半年度财务报告,finalpage/2014-08-27/1200172454.PDF
720,2014-08-27,彩虹精化：第三届董事会第二十一次会议决议公告,finalpage/2014-08-27/1200172455.PDF
721,2014-08-27,彩虹精化：第三届监事会第十三次会议决议公告,finalpage/2014-08-27/1200172456.PDF
722,2014-08-27,彩虹精化：2014年半年度报告,finalpage/2014-08-27/1200172457.PDF
723,2014-08-27,彩虹精化：独立董事关于公司有关事项发表的独立意见,finalpage/2014-08-27/1200172458.PDF
724,2014-08-27,彩虹精化：2014年半年度募集资金存放与实际使用情况的专项报告,finalpage/2014-08-27/1200172459.PDF
725,2014-08-27,彩虹精化：关于召开2014年第三次临时股东大会的通知,finalpage/2014-08-27/1200172460.PDF
726,2014-08-27,彩虹精化：公司章程（2014年8月）,finalpage/2014-08-27/1200172461.PDF
727,2014-09-03,彩虹精化：关于与中国兴业太阳能技术控股有限公司签署战略合作协议书的补充公告,finalpage/2014-09-03/1200201412.PDF
728,2014-09-03,彩虹精化：关于与中国兴业太阳能技术控股有限公司签署战略合作协议书的公告,finalpage/2014-09-03/1200199354.PDF
729,2014-09-03,彩虹精化：广东志润律师事务所关于公司与中国兴业太阳能技术控股有限公司签署的《战略合作协议书》的法律意见书,finalpage/2014-09-03/1200199355.PDF
730,2014-09-03,彩虹精化：董事会关于重大协议双方履约能力的分析说明,finalpage/2014-09-03/1200199356.PDF
731,2014-09-06,彩虹精化：第三届董事会第二十二次会议决议公告,finalpage/2014-09-06/1200209191.PDF
732,2014-09-13,彩虹精化：2014年第三次临时股东大会决议公告,finalpage/2014-09-13/1200230027.PDF
733,2014-09-13,彩虹精化：2014年第三次临时股东大会的法律意见书,finalpage/2014-09-13/1200230028.PDF
734,2014-09-19,彩虹精化：关于变更董事会办公室办公地址和投资者联系方式的公告,finalpage/2014-09-19/1200249368.PDF
735,2014-10-09,彩虹精化：关于与中国建设银行股份有限公司深圳市分行签署战略合作协议书的公告,finalpage/2014-10-09/1200283350.PDF
736,2014-10-09,彩虹精化：广东志润律师事务所关于公司与中国建设银行股份有限公司深圳市分行签署的《战略合作协议》的法律意见书,finalpage/2014-10-09/1200283351.PDF
737,2014-10-09,彩虹精化：董事会关于重大协议双方履约能力的分析说明,finalpage/2014-10-09/1200283352.PDF
738,2014-10-14,彩虹精化：关于全资子公司深圳市永晟新能源有限公司收购惠州中至正新能源有限公司100%股权的公告,finalpage/2014-10-14/1200295760.PDF
739,2014-10-16,彩虹精化：关于完成企业章程、注册资本、经营范围变更备案的公告,finalpage/2014-10-16/1200302487.PDF
740,2014-10-16,彩虹精化：2014年前三季度业绩预告修正公告,finalpage/2014-10-16/1200302488.PDF
741,2014-10-16,彩虹精化：关于与攀枝花市东区人民政府签署投资意向协议书的公告,finalpage/2014-10-16/1200303227.PDF
742,2014-10-16,彩虹精化：广东志润律师事务所关于公司与攀枝花市东区人民政府签署的《投资意向协议书》的法律意见书,finalpage/2014-10-16/1200303228.PDF
743,2014-10-16,彩虹精化：董事会关于重大协议双方履约能力的分析说明,finalpage/2014-10-16/1200303229.PDF
744,2014-10-28,彩虹精化：关于围场满族蒙古族自治县圣坤仁合光伏发电有限公司与珠海兴业绿色建筑科技有限公司签署《工程总承包（EPC）合同》,finalpage/2014-10-28/1200341809.PDF
745,2014-10-28,彩虹精化：广东志润律师事务所关于围场满族蒙古族自治县圣坤仁合光伏发电有限公司与珠海兴业绿色建筑科技有限公司签署的《围场县中草药种植结合一期50MW光伏发电项目工程总承包（EPC）合同》的法律意见书,finalpage/2014-10-28/1200341810.PDF
746,2014-10-28,彩虹精化：董事会关于日常经营重大合同双方履约能力的分析说明,finalpage/2014-10-28/1200341811.PDF
747,2014-10-30,彩虹精化：2014年第三季度报告正文,finalpage/2014-10-30/1200352114.PDF
748,2014-10-30,彩虹精化：第三届董事会第二十三次会议决议公告,finalpage/2014-10-30/1200352116.PDF
749,2014-10-30,彩虹精化：2014年第三季度报告全文,finalpage/2014-10-30/1200352117.PDF
750,2014-10-30,彩虹精化：关于深圳市永晟新能源有限公司光伏发电项目的进展公告,finalpage/2014-10-30/1200352118.PDF
751,2014-11-06,彩虹精化：第三届董事会第二十四次会议决议公告,finalpage/2014-11-06/1200372427.PDF
752,2014-11-06,彩虹精化：第三届监事会第十五次会议决议公告,finalpage/2014-11-06/1200372428.PDF
753,2014-11-06,彩虹精化：关于变更募集资金投资项目的公告,finalpage/2014-11-06/1200372429.PDF
754,2014-11-06,彩虹精化：关于惠州市虹彩新材料科技有限公司对深圳市永晟新能源有限公司增资的公告,finalpage/2014-11-06/1200372430.PDF
755,2014-11-06,彩虹精化：国信证券股份有限公司关于公司变更募集资金投向的专项意见,finalpage/2014-11-06/1200372431.PDF
756,2014-11-06,彩虹精化：独立董事关于变更募集资金投资项目的独立意见,finalpage/2014-11-06/1200372432.PDF
757,2014-11-06,彩虹精化：关于召开2014年第四次临时股东大会的通知,finalpage/2014-11-06/1200372658.PDF
758,2014-11-07,彩虹精化：关于变更募集资金投资项目的补充公告,finalpage/2014-11-07/1200377358.PDF
759,2014-11-14,彩虹精化：关于控股股东股权解除质押及重新质押的公告,finalpage/2014-11-14/1200392887.PDF
760,2014-11-20,彩虹精化：关于控股股东股权解除质押及重新质押的公告,finalpage/2014-11-20/1200403782.PDF
761,2014-11-25,彩虹精化：2014年第四次临时股东大会决议公告,finalpage/2014-11-25/1200414174.PDF
762,2014-11-25,彩虹精化：第三届董事会第二十五次会议决议公告,finalpage/2014-11-25/1200414175.PDF
763,2014-11-25,彩虹精化：第三届监事会第十六次会议决议公告,finalpage/2014-11-25/1200414176.PDF
764,2014-11-25,彩虹精化：关于续聘2014年度审计机构的公告,finalpage/2014-11-25/1200414177.PDF
765,2014-11-25,彩虹精化：关于召开2014年第五次临时股东大会的通知,finalpage/2014-11-25/1200414178.PDF
766,2014-11-25,彩虹精化：2014年第四次临时股东大会的法律意见书,finalpage/2014-11-25/1200414179.PDF
767,2014-11-25,彩虹精化：公司章程（2014年11月）,finalpage/2014-11-25/1200414180.PDF
768,2014-11-25,彩虹精化：独立董事关于续聘2014年度审计机构的独立意见,finalpage/2014-11-25/1200414181.PDF
769,2014-11-27,彩虹精化：关于控股股东进行股票质押式回购交易的公告,finalpage/2014-11-27/1200419164.PDF
770,2014-12-09,彩虹精化：第三届董事会第二十六次会议决议公告,finalpage/2014-12-09/1200449703.PDF
771,2014-12-09,彩虹精化：关于收购惠州市虹彩新材料科技有限公司持有深圳市永晟新能源有限公司47.75%股权的公告,finalpage/2014-12-09/1200449704.PDF
772,2014-12-09,彩虹精化：关于对深圳市永晟新能源有限公司进行增资暨对光伏发电募集资金投资项目实施主体进行增资的公告,finalpage/2014-12-09/1200449705.PDF
773,2014-12-09,彩虹精化：关于为嘉兴市彩联新材料科技有限公司提供授信担保的公告,finalpage/2014-12-09/1200449706.PDF
774,2014-12-12,彩虹精化：2014年第五次临时股东大会决议公告,finalpage/2014-12-12/1200459640.PDF
775,2014-12-12,彩虹精化：2014年第五次临时股东大会的法律意见书,finalpage/2014-12-12/1200459641.PDF
776,2014-12-18,彩虹精化：关于全资子公司深圳市虹彩新材料科技有限公司收到《深圳市发展改革委关于转发<国家发展改革委办公厅、财政部办公厅关于2014年生物基材料专项实施方案的复函>的通知》的公告,finalpage/2014-12-18/1200474136.PDF
777,2014-12-25,彩虹精化：第三届董事会第二十七次会议决议公告,finalpage/2014-12-25/1200493327.PDF
778,2015-01-05,彩虹精化：关于公司董事、独立董事及高级管理人员辞职的公告,finalpage/2015-01-05/1200519119.PDF
779,2015-01-05,彩虹精化：独立董事关于公司董事长辞职的独立意见,finalpage/2015-01-05/1200519120.PDF
780,2015-01-05,彩虹精化：关于签订《募集资金三方监管协议》的公告,finalpage/2015-01-05/1200511449.PDF
781,2015-01-05,彩虹精化：重大事项停牌公告,finalpage/2015-01-05/1200511450.PDF
782,2015-01-05,彩虹精化：关于控股股东股权解除质押及重新质押的公告,finalpage/2015-01-05/1200511451.PDF
783,2015-01-09,彩虹精化：第三届董事会第二十八次会议决议公告,finalpage/2015-01-09/1200530358.PDF
784,2015-01-09,彩虹精化：关于为控股子公司深圳市格瑞卫康环保科技有限公司提供担保的公告,finalpage/2015-01-09/1200530359.PDF
785,2015-01-09,彩虹精化：关于召开2015年第一次临时股东大会的通知,finalpage/2015-01-09/1200530360.PDF
786,2015-01-09,彩虹精化：关于重大意向性协议的进展公告,finalpage/2015-01-09/1200530361.PDF
787,2015-01-09,彩虹精化：独立董事关于提名补选第三届董事会独立董事、非独立董事的独立意见,finalpage/2015-01-09/1200530362.PDF
788,2015-01-09,彩虹精化：独立董事候选人声明（刘善荣）,finalpage/2015-01-09/1200530363.PDF
789,2015-01-09,彩虹精化：独立董事候选人声明（张学斌）,finalpage/2015-01-09/1200530364.PDF
790,2015-01-09,彩虹精化：独立董事提名人声明（一）,finalpage/2015-01-09/1200530365.PDF
791,2015-01-09,彩虹精化：独立董事提名人声明（二）,finalpage/2015-01-09/1200530366.PDF
792,2015-01-12,彩虹精化：重大事项停牌进展公告,finalpage/2015-01-12/1200532718.PDF
793,2015-01-19,彩虹精化：重大事项停牌进展公告,finalpage/2015-01-19/1200551129.PDF
794,2015-01-20,彩虹精化：关于签订《募集资金三方监管协议》的公告,finalpage/2015-01-20/1200557220.PDF
795,2015-01-26,彩虹精化：重大事项停牌进展公告,finalpage/2015-01-26/1200573377.PDF
796,2015-01-27,彩虹精化：2015年第一次临时股东大会决议公告,finalpage/2015-01-27/1200580480.PDF
797,2015-01-27,彩虹精化：第三届董事会第二十九次会议决议公告,finalpage/2015-01-27/1200580481.PDF
798,2015-01-27,彩虹精化：2015年第一次临时股东大会的法律意见书,finalpage/2015-01-27/1200580482.PDF
799,2015-01-29,彩虹精化：2014年度业绩预告修正公告,finalpage/2015-01-29/1200587195.PDF
800,2015-02-02,彩虹精化：重大事项停牌进展公告,finalpage/2015-02-02/1200594106.PDF
801,2015-02-03,彩虹精化：关于与湖州市南太湖高新技术产业园区管理委员会签署战略合作框架协议的公告,finalpage/2015-02-03/1200605943.PDF
802,2015-02-03,彩虹精化：广东志润律师事务所关于公司与湖州市南太湖高新技术产业园区管理委员会签署的《战略合作框架协议》的法律意见书,finalpage/2015-02-03/1200605944.PDF
803,2015-02-03,彩虹精化：董事会关于重大协议双方履约能力的分析说明,finalpage/2015-02-03/1200605945.PDF
804,2015-02-04,彩虹精化：关于全资子公司深圳市永晟新能源有限公司对外投资设立全资子公司的公告,finalpage/2015-02-04/1200609200.PDF
805,2015-02-09,彩虹精化：第三届董事会第三十次会议决议公告,finalpage/2015-02-09/1200621816.PDF
806,2015-02-09,彩虹精化：重大事项停牌进展公告,finalpage/2015-02-09/1200615891.PDF
807,2015-02-10,彩虹精化：关于完成企业章程、法定代表人变更备案的公告,finalpage/2015-02-10/1200625331.PDF
808,2015-02-12,彩虹精化：关于控股股东股票解除质押式回购交易的公告,finalpage/2015-02-12/1200629300.PDF
809,2015-02-13,彩虹精化：关于控股股东进行股票质押式回购交易的公告,finalpage/2015-02-13/1200633015.PDF
810,2015-02-16,彩虹精化：2014年度业绩快报,finalpage/2015-02-16/1200636971.PDF
811,2015-02-16,彩虹精化：重大事项停牌进展公告,finalpage/2015-02-16/1200636972.PDF
812,2015-03-02,彩虹精化：《公司章程》修订案,finalpage/2015-03-02/1200657000.PDF
813,2015-03-02,彩虹精化：第三届董事会第三十一次会议决议公告,finalpage/2015-03-02/1200657001.PDF
814,2015-03-02,彩虹精化：第三届监事会第十七次会议决议公告,finalpage/2015-03-02/1200657002.PDF
815,2015-03-02,彩虹精化：关于与具体发行对象签署《附生效条件的非公开发行股票认购协议》的公告,finalpage/2015-03-02/1200657003.PDF
816,2015-03-02,彩虹精化：关于公司非公开发行股票涉及关联交易的公告,finalpage/2015-03-02/1200657004.PDF
817,2015-03-02,彩虹精化：关于前次募集资金使用情况的报告,finalpage/2015-03-02/1200657005.PDF
818,2015-03-02,彩虹精化：关于非公开发行摊薄即期收益的风险提示的公告,finalpage/2015-03-02/1200657006.PDF
819,2015-03-02,彩虹精化：关于召开2015年第二次临时股东大会的通知,finalpage/2015-03-02/1200657007.PDF
820,2015-03-02,彩虹精化：关于公司股票复牌的公告,finalpage/2015-03-02/1200657008.PDF
821,2015-03-02,彩虹精化：关于公司前次募集资金使用情况的鉴证报告,finalpage/2015-03-02/1200657009.PDF
822,2015-03-02,彩虹精化：公司章程（2015年2月）,finalpage/2015-03-02/1200657010.PDF
823,2015-03-02,彩虹精化：未来三年（2015-2017年）股东回报规划,finalpage/2015-03-02/1200657011.PDF
824,2015-03-02,彩虹精化：独立董事关于关联交易事项的事前认可函,finalpage/2015-03-02/1200657012.PDF
825,2015-03-02,彩虹精化：独立董事关于有关事项发表的独立意见,finalpage/2015-03-02/1200657013.PDF
826,2015-03-02,彩虹精化：2015年度非公开发行股票募集资金使用的可行性分析报告,finalpage/2015-03-02/1200657014.PDF
827,2015-03-02,彩虹精化：2015年度非公开发行股票预案,finalpage/2015-03-02/1200657015.PDF
828,2015-03-02,彩虹精化：股东大会议事规则（2015年2月）,finalpage/2015-03-02/1200657016.PDF
829,2015-03-05,彩虹精化：股票交易异常波动公告,finalpage/2015-03-05/1200670537.PDF
830,2015-03-10,彩虹精化：关于归还募集资金的公告,finalpage/2015-03-10/1200686494.PDF
831,2015-03-11,彩虹精化：2014年度独立董事述职报告（刘书锦）,finalpage/2015-03-11/1200687752.PDF
832,2015-03-11,彩虹精化：2014年度独立董事述职报告（陈仕明）,finalpage/2015-03-11/1200687753.PDF
833,2015-03-11,彩虹精化：2014年年度报告摘要,finalpage/2015-03-11/1200687754.PDF
834,2015-03-11,彩虹精化：2014年年度审计报告,finalpage/2015-03-11/1200687756.PDF
835,2015-03-11,彩虹精化：第三届董事会第三十二次会议决议公告,finalpage/2015-03-11/1200687757.PDF
836,2015-03-11,彩虹精化：关于召开2014年年度股东大会的通知,finalpage/2015-03-11/1200687758.PDF
837,2015-03-11,彩虹精化：第三届监事会第十八次会议决议公告,finalpage/2015-03-11/1200687759.PDF
838,2015-03-11,彩虹精化：关于公司关联方占用上市公司资金情况的专项审核报告,finalpage/2015-03-11/1200687760.PDF
839,2015-03-11,彩虹精化：2014年年度报告,finalpage/2015-03-11/1200687761.PDF
840,2015-03-11,彩虹精化：2014年度内部控制自我评价报告,finalpage/2015-03-11/1200687762.PDF
841,2015-03-11,彩虹精化：关于募集资金2014年度存放与实际使用情况的专项报告,finalpage/2015-03-11/1200687763.PDF
842,2015-03-11,彩虹精化：关于公司募集资金年度存放与实际使用情况的鉴证报告,finalpage/2015-03-11/1200687764.PDF
843,2015-03-11,彩虹精化：独立董事关于有关事项发表的独立意见,finalpage/2015-03-11/1200687765.PDF
844,2015-03-11,彩虹精化：2014年度独立董事述职报告（魏达志）,finalpage/2015-03-11/1200687766.PDF
845,2015-03-11,彩虹精化：关于执行企业会计准则修订公司会计政策的公告,finalpage/2015-03-11/1200687767.PDF
846,2015-03-11,彩虹精化：关于2015年度公司为合并范围内子公司提供担保的公告,finalpage/2015-03-11/1200687768.PDF
847,2015-03-11,彩虹精化：2015年第一季度业绩预告公告,finalpage/2015-03-11/1200687769.PDF
848,2015-03-11,彩虹精化：关于举行2014年度报告网上说明会的公告,finalpage/2015-03-11/1200687770.PDF
849,2015-03-11,彩虹精化：内部控制规则落实自查表,finalpage/2015-03-11/1200687771.PDF
850,2015-03-11,彩虹精化：国信证券股份有限公司关于公司2014年度募集资金存放与使用情况的专项核查报告,finalpage/2015-03-11/1200687772.PDF
851,2015-03-17,彩虹精化：第三届董事会第三十三次会议决议公告,finalpage/2015-03-17/1200704919.PDF
