,date,title,url
874,2016-09-21,海普瑞：独立董事关于第三届董事会第二十六次会议相关事项的独立意见,finalpage/2016-09-21/1202710291.PDF
875,2016-09-29,海普瑞：关于公司使用自有资金购买低风险理财产品的进展公告,finalpage/2016-09-29/1202734657.PDF
876,2016-10-19,海普瑞：关于关联方获得欧盟药政批准的公告,finalpage/2016-10-19/1202766896.PDF
877,2016-10-29,海普瑞：2016年第三季度报告正文（已取消）,finalpage/2016-10-29/1202801377.PDF
878,2016-10-29,海普瑞：2016年第三季度报告全文,finalpage/2016-10-29/1202801379.PDF
879,2016-10-29,海普瑞：关于公司发行公司债券申请获中国证券监督管理委员会核准的公告,finalpage/2016-10-29/1202801380.PDF
880,2016-10-31,海普瑞：2016年第三季度报告正文的更正公告,finalpage/2016-10-31/1202807862.PDF
881,2016-10-31,海普瑞：2016年第三季度报告正文（更新后）,finalpage/2016-10-31/1202807863.PDF
882,2016-11-04,海普瑞：2016年面向合格投资者公开发行公司债券发行公告,finalpage/2016-11-04/1202814577.PDF
883,2016-11-04,海普瑞：2016年面向合格投资者公开发行公司债券信用评级报告,finalpage/2016-11-04/1202814578.PDF
884,2016-11-04,海普瑞：2016年面向合格投资者公开发行公司债券募集说明书,finalpage/2016-11-04/1202814579.PDF
885,2016-11-04,海普瑞：2016年面向合格投资者公开发行公司债券募集说明书摘要,finalpage/2016-11-04/1202814580.PDF
886,2016-11-08,海普瑞：2016年面向合格投资者公开发行公司债券票面利率公告,finalpage/2016-11-08/1202818367.PDF
887,2016-11-08,"海普瑞：关于对全资子公司对ORI Healthcare Fund, L.P.追加投资的进展公告",finalpage/2016-11-08/1202818380.PDF
888,2016-11-10,海普瑞：2016年面向合格投资者公开发行公司债券发行结果公告,finalpage/2016-11-10/1202821485.PDF
889,2016-11-19,海普瑞：第三届监事会第二十次会议决议公告,finalpage/2016-11-19/1202835910.PDF
890,2016-11-19,海普瑞：关于全资子公司对外投资的公告,finalpage/2016-11-19/1202835912.PDF
891,2016-11-19,海普瑞：关于对全资子公司Hepalink USA Inc.增资的公告,finalpage/2016-11-19/1202835913.PDF
892,2016-11-19,海普瑞：关于新增募集资金专项存储账户的公告,finalpage/2016-11-19/1202835914.PDF
893,2016-11-19,海普瑞：关于公司与汇丰银行进行交叉货币掉期交易的公告,finalpage/2016-11-19/1202835915.PDF
894,2016-11-19,海普瑞：独立董事关于第三届董事会第二十八次会议相关事项的独立意见,finalpage/2016-11-19/1202835916.PDF
895,2016-11-19,海普瑞：独立董事关于增加2016年日常经营性关联交易预计金额的事前认可意见,finalpage/2016-11-19/1202835917.PDF
896,2016-11-19,海普瑞：关于开展交叉货币掉期业务的可行性分析报告,finalpage/2016-11-19/1202835918.PDF
897,2016-11-19,海普瑞：第三届董事会第二十八次会议决议公告,finalpage/2016-11-19/1202835919.PDF
898,2016-11-19,海普瑞：关于增加2016年日常经营性关联交易预计金额的公告,finalpage/2016-11-19/1202835920.PDF
899,2016-11-26,海普瑞：第三届监事会第二十一次会议决议公告,finalpage/2016-11-26/1202845188.PDF
900,2016-11-26,海普瑞：关于召开2016年第三次临时股东大会的通知公告,finalpage/2016-11-26/1202845189.PDF
901,2016-11-26,海普瑞：公司债券募集资金管理制度（2016年11月）,finalpage/2016-11-26/1202845190.PDF
902,2016-11-26,海普瑞：独立董事关于第三届董事会第二十九次会议相关事项的独立意见,finalpage/2016-11-26/1202845191.PDF
903,2016-11-26,海普瑞：第二期员工持股计划管理办法,finalpage/2016-11-26/1202845192.PDF
904,2016-11-26,海普瑞：第三届董事会第二十九次会议决议公告,finalpage/2016-11-26/1202845193.PDF
905,2016-11-26,海普瑞：第二期员工持股计划（草案）,finalpage/2016-11-26/1202845194.PDF
906,2016-11-26,海普瑞：第二期员工持股计划（草案）摘要,finalpage/2016-11-26/1202845195.PDF
907,2016-11-29,海普瑞：独立董事关于变更公司名称暨修改《公司章程》的独立意见,finalpage/2016-11-29/1202846388.PDF
908,2016-12-10,海普瑞：北京市中伦（深圳）律师事务所关于公司第二期员工持股计划的法律意见书,finalpage/2016-12-10/1202867564.PDF
909,2016-12-10,海普瑞：国联海普瑞1号定向资产管理计划资产管理合同,finalpage/2016-12-10/1202867565.PDF
910,2016-12-13,海普瑞：2016年第三次临时股东大会决议公告,finalpage/2016-12-13/1202870953.PDF
911,2016-12-13,海普瑞：2016年第三次临时股东大会的法律意见书,finalpage/2016-12-13/1202870954.PDF
912,2016-12-13,海普瑞：2016年面向合格投资者公开发行公司债券上市公告书,finalpage/2016-12-13/1202871009.PDF
913,2016-12-14,海普瑞：关于控股股东股权质押的公告,finalpage/2016-12-14/1202873587.PDF
914,2016-12-14,海普瑞：第三届董事会第三十次会议决议公告,finalpage/2016-12-14/1202873590.PDF
915,2016-12-14,海普瑞：关于对控股子公司进行投资的公告,finalpage/2016-12-14/1202873591.PDF
916,2016-12-14,海普瑞：关于向银行申请授信的公告,finalpage/2016-12-14/1202873592.PDF
917,2016-12-14,海普瑞：关于公司拟与平安银行进行交叉货币掉期交易的公告,finalpage/2016-12-14/1202873593.PDF
918,2016-12-14,海普瑞：独立董事关于第三届董事会第三十次会议相关事项的独立意见,finalpage/2016-12-14/1202873594.PDF
919,2016-12-14,海普瑞：关于开展交叉货币掉期业务的可行性分析报告,finalpage/2016-12-14/1202873595.PDF
920,2016-12-22,海普瑞：关于对外投资的完成公告,finalpage/2016-12-22/1202923724.PDF
921,2016-12-22,海普瑞：第三届董事会第三十一次会议决议公告,finalpage/2016-12-22/1202923725.PDF
922,2016-12-22,海普瑞：关于公司拟与汇丰银行进行交叉货币掉期交易的公告,finalpage/2016-12-22/1202923726.PDF
923,2016-12-22,海普瑞：独立董事关于第三届董事会第三十一次会议相关事项的独立意见,finalpage/2016-12-22/1202923727.PDF
924,2016-12-22,海普瑞：关于开展交叉货币掉期业务的可行性分析报告,finalpage/2016-12-22/1202923728.PDF
925,2016-12-27,海普瑞：关于公司使用自有资金购买低风险理财产品的进展公告,finalpage/2016-12-27/1202958522.PDF
926,2016-12-31,海普瑞：关于公司使用自有资金购买低风险理财产品的进展公告,finalpage/2016-12-31/1202978630.PDF
927,2016-12-31,海普瑞：关于签订《募集资金三方监管协议》的公告,finalpage/2016-12-31/1202978631.PDF
928,2017-01-12,海普瑞：关于第二期员工持股计划的进展公告,finalpage/2017-01-12/1203008123.PDF
929,2017-01-24,海普瑞：第三届董事会第三十二次会议决议公告,finalpage/2017-01-24/1203042433.PDF
930,2017-01-24,海普瑞：第三届监事会第二十二次会议决议公告,finalpage/2017-01-24/1203042434.PDF
931,2017-01-24,海普瑞：关于2017年度日常经营性关联交易预计的公告,finalpage/2017-01-24/1203042435.PDF
932,2017-01-24,海普瑞：关于公司使用自有资金购买低风险理财产品的公告,finalpage/2017-01-24/1203042436.PDF
933,2017-01-24,海普瑞：独立董事关于2017年度日常关联交易预计的事前认可意见,finalpage/2017-01-24/1203042437.PDF
934,2017-01-24,海普瑞：独立董事关于第三届董事会第三十二次会议相关事项的独立意见,finalpage/2017-01-24/1203042438.PDF
935,2017-01-25,海普瑞：关于公司使用自有资金购买低风险理财产品的进展公告,finalpage/2017-01-25/1203050765.PDF
936,2017-02-11,海普瑞：关于第二期员工持股计划的进展公告,finalpage/2017-02-11/1203076078.PDF
937,2017-02-21,海普瑞：关于完成工商登记变更的公告,finalpage/2017-02-21/1203094869.PDF
938,2017-02-24,海普瑞：第三届董事会第三十三次会议决议公告,finalpage/2017-02-24/1203103203.PDF
939,2017-02-24,海普瑞：第三届监事会第二十三次会议决议公告,finalpage/2017-02-24/1203103204.PDF
940,2017-02-24,海普瑞：关于召开2017年第一次临时股东大会的通知公告,finalpage/2017-02-24/1203103205.PDF
941,2017-02-24,海普瑞：独立董事关于第三届董事会第三十三次会议相关事项的独立意见,finalpage/2017-02-24/1203103206.PDF
942,2017-02-24,海普瑞：关于向中行继续申请内保外贷暨为全资子公司提供反担保的公告,finalpage/2017-02-24/1203103207.PDF
943,2017-02-24,海普瑞：关于向招行继续申请内保外贷暨为全资子公司提供反担保的公告,finalpage/2017-02-24/1203103208.PDF
944,2017-02-24,海普瑞：关于向建行申请内保外贷暨为全资子公司提供反担保的公告,finalpage/2017-02-24/1203103209.PDF
945,2017-02-28,海普瑞：2016年度业绩快报,finalpage/2017-02-28/1203111056.PDF
946,2017-03-11,海普瑞：关于第二期员工持股计划完成股票购买的公告,finalpage/2017-03-11/1203148764.PDF
947,2017-03-14,海普瑞：2017年第一次临时股东大会决议公告,finalpage/2017-03-14/1203154405.PDF
948,2017-03-14,海普瑞：2017年第一次临时股东大会的法律意见书,finalpage/2017-03-14/1203154406.PDF
949,2017-03-30,海普瑞：2017年度第一季度业绩预告,finalpage/2017-03-30/1203224976.PDF
950,2017-03-30,海普瑞：关于公司与花旗银行交叉货币掉期交易平仓的公告,finalpage/2017-03-30/1203224977.PDF
951,2017-03-30,海普瑞：关于全资子公司对外投资的进展公告,finalpage/2017-03-30/1203224978.PDF
952,2017-03-30,海普瑞：关于控股子公司获得澳洲I期临床试验备案的公告,finalpage/2017-03-30/1203224979.PDF
953,2017-04-28,海普瑞：第三届董事会第三十四次会议决议公告,finalpage/2017-04-28/1203413109.PDF
954,2017-04-28,海普瑞：关于召开2016年度股东大会的通知公告,finalpage/2017-04-28/1203413110.PDF
955,2017-04-28,海普瑞：第三届监事会第二十四次会议决议公告,finalpage/2017-04-28/1203413111.PDF
956,2017-04-28,海普瑞：2016年度募集资金存放与使用情况的专项报告,finalpage/2017-04-28/1203413112.PDF
957,2017-04-28,海普瑞：2016年度内部控制自我评价报告,finalpage/2017-04-28/1203413113.PDF
958,2017-04-28,海普瑞：关于公司会计政策变更的公告,finalpage/2017-04-28/1203413114.PDF
959,2017-04-28,海普瑞：关于新增募集资金专项存储账户并转款的公告,finalpage/2017-04-28/1203413115.PDF
960,2017-04-28,海普瑞：关于签署关联交易协议的公告,finalpage/2017-04-28/1203413116.PDF
961,2017-04-28,海普瑞：独立董事提名人声明（一）,finalpage/2017-04-28/1203413117.PDF
962,2017-04-28,海普瑞：独立董事提名人声明（二）,finalpage/2017-04-28/1203413118.PDF
963,2017-04-28,海普瑞：独立董事提名人声明（三）,finalpage/2017-04-28/1203413119.PDF
964,2017-04-28,海普瑞：关于举行2016年度报告网上说明会的公告,finalpage/2017-04-28/1203413120.PDF
965,2017-04-28,海普瑞：独立董事关于第三届董事会第三十四次会议相关事项的独立意见,finalpage/2017-04-28/1203413121.PDF
966,2017-04-28,海普瑞：独立董事2016年度述职报告,finalpage/2017-04-28/1203413122.PDF
967,2017-04-28,海普瑞：关于公司控股股东及其他关联方资金占用情况汇总表的专项审核报告,finalpage/2017-04-28/1203413123.PDF
968,2017-04-28,海普瑞：2016年度财务决算报告,finalpage/2017-04-28/1203413124.PDF
969,2017-04-28,海普瑞：2016年度监事会工作报告,finalpage/2017-04-28/1203413125.PDF
970,2017-04-28,海普瑞：独立董事关于第三届董事会第三十四次会议相关事项的事前认可意见,finalpage/2017-04-28/1203413126.PDF
971,2017-04-28,海普瑞：独立董事候选人声明（陈俊发）,finalpage/2017-04-28/1203413127.PDF
972,2017-04-28,海普瑞：独立董事候选人声明（哈继铭）,finalpage/2017-04-28/1203413128.PDF
973,2017-04-28,海普瑞：独立董事候选人声明（张荣庆）,finalpage/2017-04-28/1203413129.PDF
974,2017-04-28,海普瑞：公司债券募集资金管理制度（2017年4月）,finalpage/2017-04-28/1203413130.PDF
975,2017-04-28,海普瑞：上市公司内部控制规则落实自查表,finalpage/2017-04-28/1203413131.PDF
976,2017-04-28,海普瑞：华英证券有限责任公司关于公司2016年度募集资金存放与使用情况的核查意见,finalpage/2017-04-28/1203413132.PDF
977,2017-04-28,海普瑞：内部控制审计报告,finalpage/2017-04-28/1203413133.PDF
978,2017-04-28,海普瑞：关于公司募集资金年度存放与实际使用情况的鉴证报告,finalpage/2017-04-28/1203413134.PDF
979,2017-04-28,海普瑞：2016年年度审计报告,finalpage/2017-04-28/1203413135.PDF
980,2017-04-28,海普瑞：2016年年度报告摘要,finalpage/2017-04-28/1203413136.PDF
981,2017-04-28,海普瑞：2016年年度报告,finalpage/2017-04-28/1203413138.PDF
982,2017-04-28,海普瑞：重大事项停牌公告,finalpage/2017-04-28/1203413139.PDF
983,2017-04-29,海普瑞：2017年第一季度报告正文,finalpage/2017-04-29/1203424428.PDF
984,2017-04-29,海普瑞：2017年第一季度报告全文,finalpage/2017-04-29/1203424430.PDF
985,2017-05-08,海普瑞：重大事项进展及继续停牌公告,finalpage/2017-05-08/1203479939.PDF
986,2017-05-15,海普瑞：关于筹划发行股份购买资产停牌公告,finalpage/2017-05-15/1203515036.PDF
987,2017-05-22,海普瑞：关于选举职工代表监事的公告,finalpage/2017-05-22/1203543329.PDF
988,2017-05-22,海普瑞：关于筹划发行股份购买资产的停牌进展公告,finalpage/2017-05-22/1203543330.PDF
989,2017-05-24,海普瑞：第四届董事会第一次会议决议公告,finalpage/2017-05-24/1203560278.PDF
990,2017-05-24,海普瑞：第四届监事会第一次会议决议公告,finalpage/2017-05-24/1203560279.PDF
991,2017-05-24,海普瑞：独立董事关于第四届董事会第一次会议相关事项的独立意见,finalpage/2017-05-24/1203560280.PDF
992,2017-05-24,海普瑞：2016年度股东大会决议公告,finalpage/2017-05-24/1203560281.PDF
993,2017-05-24,海普瑞：2016年度股东大会的法律意见书,finalpage/2017-05-24/1203560282.PDF
994,2017-05-31,海普瑞：关于筹划发行股份购买资产停牌进展及继续停牌公告,finalpage/2017-05-31/1203572048.PDF
995,2017-06-07,海普瑞：关于筹划发行股份购买资产的停牌进展公告,finalpage/2017-06-07/1203594157.PDF
996,2017-06-08,海普瑞：关于更换持续督导机构的公告,finalpage/2017-06-08/1203598172.PDF
997,2017-06-08,海普瑞：关于名称变更的补充公告,finalpage/2017-06-08/1203598763.PDF
998,2017-06-14,海普瑞：关于筹划发行股份购买资产的停牌进展公告,finalpage/2017-06-14/1203613464.PDF
999,2017-06-20,海普瑞：2016年公司债券受托管理事务报告（2016年度）,finalpage/2017-06-20/1203630297.PDF
1000,2017-06-21,海普瑞：2016年年度权益分派实施公告,finalpage/2017-06-21/1203634231.PDF
1001,2017-06-21,海普瑞：第四届董事会第二次会议决议公告,finalpage/2017-06-21/1203634232.PDF
1002,2017-06-21,海普瑞：关于筹划发行股份购买资产停牌进展及继续停牌公告,finalpage/2017-06-21/1203634233.PDF
1003,2017-06-24,海普瑞：关于签订《募集资金三方监管协议》的公告,finalpage/2017-06-24/1203643020.PDF
1004,2017-06-28,海普瑞：关于筹划发行股份购买资产的停牌进展公告,finalpage/2017-06-28/1203650977.PDF
1005,2017-06-28,海普瑞：关于公司与汇丰银行交叉货币掉期交易平仓的公告,finalpage/2017-06-28/1203650978.PDF
1006,2017-06-29,海普瑞：公司债券2017年跟踪评级报告,finalpage/2017-06-29/1203660568.PDF
1007,2017-07-05,海普瑞：第四届监事会第二次会议决议公告,finalpage/2017-07-05/1203681900.PDF
1008,2017-07-05,海普瑞：关于召开2017年第二次临时股东大会的通知公告,finalpage/2017-07-05/1203681901.PDF
1009,2017-07-05,海普瑞：海际证券有限责任公司关于公司拟使用闲置募集资金购买银行保本理财产品的核查意见,finalpage/2017-07-05/1203681902.PDF
1010,2017-07-05,海普瑞：关于第四届董事会第三次会议相关事项的独立意见,finalpage/2017-07-05/1203681903.PDF
1011,2017-07-05,海普瑞：关于独立董事辞职的公告,finalpage/2017-07-05/1203681904.PDF
1012,2017-07-05,海普瑞：独立董事候选人声明（王肇辉）,finalpage/2017-07-05/1203681905.PDF
1013,2017-07-05,海普瑞：独立董事提名人声明,finalpage/2017-07-05/1203681906.PDF
1014,2017-07-05,海普瑞：关于筹划发行股份购买资产的停牌进展公告,finalpage/2017-07-05/1203681907.PDF
1015,2017-07-05,海普瑞：第四届董事会第三次会议决议公告,finalpage/2017-07-05/1203681908.PDF
1016,2017-07-05,海普瑞：关于拟使用闲置募集资金购买银行保本理财产品的公告,finalpage/2017-07-05/1203681909.PDF
1017,2017-07-12,海普瑞：关于筹划发行股份购买资产的停牌进展公告,finalpage/2017-07-12/1203694351.PDF
1018,2017-07-18,海普瑞：关于召开2017年第二次临时股东大会的提示性公告,finalpage/2017-07-18/1203709823.PDF
1019,2017-07-19,海普瑞：关于筹划发行股份购买资产的停牌进展公告,finalpage/2017-07-19/1203712880.PDF
1020,2017-07-22,海普瑞：2017年第二次临时股东大会的法律意见书,finalpage/2017-07-22/1203726509.PDF
1021,2017-07-22,海普瑞：2017年第二次临时股东大会决议公告,finalpage/2017-07-22/1203726510.PDF
1022,2017-07-22,海普瑞：关于筹划发行股份购买资产继续停牌公告,finalpage/2017-07-22/1203726653.PDF
1023,2017-07-25,海普瑞：独立董事发生变动的公告,finalpage/2017-07-25/1203728941.PDF
1024,2017-07-26,海普瑞：关于筹划发行股份购买资产的停牌进展公告,finalpage/2017-07-26/1203732138.PDF
1025,2017-07-29,海普瑞：2017年半年度业绩快报,finalpage/2017-07-29/1203742388.PDF
1026,2017-08-02,海普瑞：关于筹划发行股份购买资产的停牌进展公告,finalpage/2017-08-02/1203752589.PDF
1027,2017-08-03,海普瑞：华融证券股份有限公司关于公司公开发行2016年公司债券重大事项受托管理事务临时报告,finalpage/2017-08-03/1203757997.PDF
1028,2017-08-09,海普瑞：关于筹划发行股份购买资产的停牌进展公告,finalpage/2017-08-09/1203773301.PDF
1029,2017-08-09,海普瑞：关于独立财务顾问名称变更的公告,finalpage/2017-08-09/1203773302.PDF
1030,2017-08-15,海普瑞：第四届董事会第四次会议决议公告,finalpage/2017-08-15/1203797238.PDF
1031,2017-08-15,海普瑞：第四届监事会第三次会议决议公告,finalpage/2017-08-15/1203797239.PDF
1032,2017-08-15,海普瑞：独立董事关于第四届董事会第四次会议相关事项的独立意见,finalpage/2017-08-15/1203797240.PDF
1033,2017-08-15,海普瑞：中天国富证券有限公司关于公司使用部分超募资金永久性补充流动资金的核查意见,finalpage/2017-08-15/1203797241.PDF
1034,2017-08-15,海普瑞：关于使用部分超募资金永久性补充流动资金的公告,finalpage/2017-08-15/1203797242.PDF
1035,2017-08-15,海普瑞：关于召开2017年第三次临时股东大会的通知公告,finalpage/2017-08-15/1203797243.PDF
1036,2017-08-15,海普瑞：关于向中行申请授信额度安排与切分暨为全资子公司提供反担保的公告,finalpage/2017-08-15/1203797244.PDF
1037,2017-08-16,海普瑞：关于筹划发行股份购买资产的停牌进展公告,finalpage/2017-08-16/1203801305.PDF
1038,2017-08-19,海普瑞：2017年半年度报告摘要,finalpage/2017-08-19/1203811560.PDF
1039,2017-08-19,海普瑞：第四届董事会第五次会议决议公告,finalpage/2017-08-19/1203811561.PDF
1040,2017-08-19,海普瑞：第四届监事会第四次会议决议公告,finalpage/2017-08-19/1203811562.PDF
1041,2017-08-19,海普瑞：独立董事关于第四届董事会第五次会议相关事项的独立意见,finalpage/2017-08-19/1203811563.PDF
1042,2017-08-19,海普瑞：关于增加2017年度日常经营性关联交易预计金额的公告,finalpage/2017-08-19/1203811564.PDF
1043,2017-08-19,海普瑞：独立董事关于增加2017年度日常经营性关联交易预计的事前认可意见,finalpage/2017-08-19/1203811565.PDF
1044,2017-08-19,海普瑞：关于全资子公司对外投资的完成公告,finalpage/2017-08-19/1203811566.PDF
1045,2017-08-19,海普瑞：2017年半年度募集资金存放与使用情况的专项报告,finalpage/2017-08-19/1203811567.PDF
1046,2017-08-19,海普瑞：2017年半年度报告,finalpage/2017-08-19/1203811569.PDF
1047,2017-08-19,海普瑞：2017年半年度财务报告,finalpage/2017-08-19/1203811570.PDF
1048,2017-08-23,海普瑞：关于筹划发行股份购买资产的停牌进展公告,finalpage/2017-08-23/1203846935.PDF
1049,2017-08-25,海普瑞：关于筹划发行股份购买资产的停牌进展公告,finalpage/2017-08-25/1203865107.PDF
1050,2017-08-25,海普瑞：中天国富证券有限公司关于公司重组停牌期间重组进展信息披露真实性、继续停牌合理性和6个月内复牌可行性的核查意见,finalpage/2017-08-25/1203865108.PDF
1051,2017-08-30,海普瑞：关于筹划发行股份购买资产的停牌进展公告,finalpage/2017-08-30/1203894277.PDF
1052,2017-09-01,海普瑞：2017年第三次临时股东大会决议公告,finalpage/2017-09-01/1203920943.PDF
1053,2017-09-01,海普瑞：2017年第三次临时股东大会的法律意见书,finalpage/2017-09-01/1203920944.PDF
1054,2017-09-06,海普瑞：关于筹划发行股份购买资产的停牌进展公告,finalpage/2017-09-06/1203936124.PDF
1055,2017-09-12,海普瑞：第四届董事会第六次会议决议公告,finalpage/2017-09-12/1203965064.PDF
1056,2017-09-12,海普瑞：第四届监事会第五次会议决议公告,finalpage/2017-09-12/1203965065.PDF
1057,2017-09-12,海普瑞：关于公司本次交易摊薄当期每股收益的影响及填补回报安排的公告,finalpage/2017-09-12/1203965066.PDF
1058,2017-09-12,海普瑞：关于公司股票暂不复牌暨重大资产重组一般风险提示公告,finalpage/2017-09-12/1203965067.PDF
1059,2017-09-12,海普瑞：发行股份购买资产暨关联交易报告书（草案）摘要,finalpage/2017-09-12/1203965068.PDF
1060,2017-09-12,海普瑞：独立董事关于本次发行股份购买资产暨关联交易的事前认可意见,finalpage/2017-09-12/1203965069.PDF
1061,2017-09-12,海普瑞：独立董事关于本次发行股份购买资产暨关联交易的独立意见,finalpage/2017-09-12/1203965070.PDF
1062,2017-09-12,海普瑞：独立董事关于评估机构独立性、评估假设前提合理性、评估方法与评估目的的相关性及评估定价公允性的独立意见,finalpage/2017-09-12/1203965071.PDF
1063,2017-09-12,海普瑞：董事会关于重组履行法定程序的完备性、合规性及提交法律文件的有效性的说明,finalpage/2017-09-12/1203965072.PDF
1064,2017-09-12,海普瑞：董事会关于评估机构独立性、评估假设前提合理性、评估方法与评估目的的相关性及评估定价公允性的意见,finalpage/2017-09-12/1203965073.PDF
1065,2017-09-12,海普瑞：关于公司股票价格波动不构成股价异动情况的说明,finalpage/2017-09-12/1203965074.PDF
1066,2017-09-12,海普瑞：北京市中伦律师事务所关于公司发行股份购买资产暨关联交易的法律意见书,finalpage/2017-09-12/1203965075.PDF
1067,2017-09-12,海普瑞：深圳市多普乐实业发展有限公司审计报告（已取消）,finalpage/2017-09-12/1203965076.PDF
1068,2017-09-12,海普瑞：公司及全体董事、监事和高级管理人员对申请文件真实性、准确性和完整性的承诺函,finalpage/2017-09-12/1203965077.PDF
1069,2017-09-12,海普瑞：关于本次交易前12个月内购买、出售资产情况的说明,finalpage/2017-09-12/1203965078.PDF
1070,2017-09-12,海普瑞：中天国富证券有限公司在充分尽职调查和内核的基础上出具的承诺,finalpage/2017-09-12/1203965079.PDF
1071,2017-09-12,海普瑞：中天国富证券有限公司关于公司发行股份购买资产暨关联交易之独立财务顾问报告,finalpage/2017-09-12/1203965080.PDF
1072,2017-09-12,海普瑞：中天国富证券有限公司关于公司本次交易前12个月内购买、出售资产情况的核查意见,finalpage/2017-09-12/1203965081.PDF
1073,2017-09-12,海普瑞：拟收购股权所涉及深圳市多普乐实业发展有限公司股东全部权益评估报告,finalpage/2017-09-12/1203965082.PDF
1074,2017-09-12,海普瑞：交易对方关于所提供信息真实性、准确性和完整性的声明和承诺函,finalpage/2017-09-12/1203965083.PDF
1075,2017-09-12,海普瑞：关于本次重组相关事项的承诺函,finalpage/2017-09-12/1203965084.PDF
1076,2017-09-12,海普瑞：发行股份购买资产暨关联交易报告书（草案）,finalpage/2017-09-12/1203965085.PDF
1077,2017-09-12,海普瑞：关于召开2017年第四次临时股东大会的通知公告,finalpage/2017-09-12/1203965086.PDF
1078,2017-09-12,海普瑞：中天国富证券有限公司关于公司本次交易产业政策和交易类型之独立财务顾问核查意见,finalpage/2017-09-12/1203965087.PDF
1079,2017-09-12,海普瑞：备考审阅报告（已取消）,finalpage/2017-09-12/1203965088.PDF
1080,2017-09-13,海普瑞：关于筹划发行股份购买资产的停牌进展公告,finalpage/2017-09-13/1203965933.PDF
1081,2017-09-20,海普瑞：关于筹划发行股份购买资产的停牌进展公告,finalpage/2017-09-20/1203987979.PDF
