,date,title,url
433,2014-05-30,赛象科技：第五届监事会第九次会议决议公告,finalpage/2014-05-30/64081703.PDF
434,2014-05-30,赛象科技：关于监事辞职及补选的公告,finalpage/2014-05-30/64081704.PDF
435,2014-05-30,赛象科技：关于召开2014年第二次临时股东大会通知,finalpage/2014-05-30/64081705.PDF
436,2014-05-30,赛象科技：独立董事关于公司五届十二次董事会相关事项的独立意见,finalpage/2014-05-30/64081706.PDF
437,2014-06-18,赛象科技：2014年第二次临时股东大会决议公告,finalpage/2014-06-18/64146975.PDF
438,2014-06-18,赛象科技：第五届监事会第十次会议决议公告,finalpage/2014-06-18/64146976.PDF
439,2014-06-18,赛象科技：2014年第二次临时股东大会的法律意见书,finalpage/2014-06-18/64146977.PDF
440,2014-06-27,赛象科技：第五届董事会第十三次会议决议公告,finalpage/2014-06-27/1200009917.PDF
441,2014-06-27,赛象科技：内部问责制度（2014年6月）,finalpage/2014-06-27/1200009918.PDF
442,2014-07-01,赛象科技：关于收到增值税退税的公告,finalpage/2014-07-01/1200020365.PDF
443,2014-07-07,赛象科技：关于部分限制性股票回购注销完成的公告,finalpage/2014-07-07/1200032950.PDF
444,2014-07-10,赛象科技：关于筹划重大资产重组的停牌公告,finalpage/2014-07-10/1200043957.PDF
445,2014-07-16,赛象科技：第五届董事会第十四次会议决议公告,finalpage/2014-07-16/1200055982.PDF
446,2014-07-17,赛象科技：重大资产重组进展公告,finalpage/2014-07-17/1200058399.PDF
447,2014-07-24,赛象科技：关于发行股份购买资产的进展公告,finalpage/2014-07-24/1200074063.PDF
448,2014-07-25,赛象科技：关于向山东万鑫轮胎有限公司销售产品提供按揭贷款回购担保的公告,finalpage/2014-07-25/1200076129.PDF
449,2014-07-25,赛象科技：第五届董事会第十五次会议决议公告,finalpage/2014-07-25/1200076130.PDF
450,2014-07-25,赛象科技：独立董事关于公司向山东万鑫轮胎有限公司销售产品提供按揭贷款回购担保的议案的独立意见,finalpage/2014-07-25/1200076131.PDF
451,2014-07-31,赛象科技：关于发行股份购买资产的进展公告,finalpage/2014-07-31/1200089454.PDF
452,2014-08-07,赛象科技：发行股份购买资产延期复牌及进展公告,finalpage/2014-08-07/1200103790.PDF
453,2014-08-08,赛象科技：关于第一大股东与第二大股东持股比例差额少于5%的提示性公告,finalpage/2014-08-08/1200105859.PDF
454,2014-08-08,赛象科技：关于控股股东股份转让的提示性公告,finalpage/2014-08-08/1200105860.PDF
455,2014-08-08,赛象科技：简式权益变动报告书,finalpage/2014-08-08/1200105861.PDF
456,2014-08-08,赛象科技：详式权益变动报告书,finalpage/2014-08-08/1200105862.PDF
457,2014-08-13,赛象科技：关于向山东福泰尔轮胎有限公司销售产品提供融资租赁业务回购担保的公告,finalpage/2014-08-13/1200121370.PDF
458,2014-08-13,赛象科技：第五届董事会第十六次会议决议公告,finalpage/2014-08-13/1200121371.PDF
459,2014-08-13,赛象科技：独立董事关于公司向山东福泰尔轮胎有限公司销售产品提供融资租赁业务回购担保的议案的独立意见,finalpage/2014-08-13/1200121372.PDF
460,2014-08-14,赛象科技：发行股份购买资产的进展公告,finalpage/2014-08-14/1200124835.PDF
461,2014-08-21,赛象科技：关于发行股份购买资产的进展公告,finalpage/2014-08-21/1200144672.PDF
462,2014-08-21,赛象科技：关于控股股东股份转让实施完成的公告,finalpage/2014-08-21/1200144673.PDF
463,2014-08-22,赛象科技：2014年半年度报告摘要,finalpage/2014-08-22/1200149455.PDF
464,2014-08-22,赛象科技：2014年半年度财务报告,finalpage/2014-08-22/1200149457.PDF
465,2014-08-22,赛象科技：第五届董事会第十七次会议决议公告,finalpage/2014-08-22/1200149458.PDF
466,2014-08-22,赛象科技：第五届监事会第十一次会议决议公告,finalpage/2014-08-22/1200149459.PDF
467,2014-08-22,赛象科技：2014年半年度报告,finalpage/2014-08-22/1200149461.PDF
468,2014-08-22,赛象科技：独立董事关于控股股东及其他关联方占用公司资金、公司对外担保情况的专项说明和独立意见,finalpage/2014-08-22/1200149462.PDF
469,2014-08-25,赛象科技：关于商业保理公司完成工商登记注册的公告,finalpage/2014-08-25/1200153508.PDF
470,2014-08-28,赛象科技：关于发行股份购买资产的进展公告,finalpage/2014-08-28/1200178034.PDF
471,2014-09-04,赛象科技：关于终止筹划重大事项暨公司股票复牌的公告,finalpage/2014-09-04/1200201925.PDF
472,2014-10-29,赛象科技：关于增补独立董事的公告,finalpage/2014-10-29/1200346496.PDF
473,2014-10-29,赛象科技：关于更换会计师事务所的公告,finalpage/2014-10-29/1200346497.PDF
474,2014-10-29,赛象科技：关于公司进行风险投资事项的公告,finalpage/2014-10-29/1200346498.PDF
475,2014-10-29,赛象科技：关于召开2014年第三次临时股东大会的通知,finalpage/2014-10-29/1200346499.PDF
476,2014-10-29,赛象科技：风险投资管理制度（2014年10月）,finalpage/2014-10-29/1200346500.PDF
477,2014-10-29,赛象科技：2014年第三季度报告正文,finalpage/2014-10-29/1200346501.PDF
478,2014-10-29,赛象科技：第五届董事会第十八次会议决议公告,finalpage/2014-10-29/1200346503.PDF
479,2014-10-29,赛象科技：2014年第三季度报告全文,finalpage/2014-10-29/1200346505.PDF
480,2014-10-29,赛象科技：独立董事关于更换会计师事务所事项的事前认可函,finalpage/2014-10-29/1200346506.PDF
481,2014-10-29,赛象科技：独立董事关于公司五届十八次董事会相关事项的独立意见,finalpage/2014-10-29/1200346507.PDF
482,2014-11-18,赛象科技：2014年第三次临时股东大会决议公告,finalpage/2014-11-18/1200399232.PDF
483,2014-11-18,赛象科技：2014年第三次临时股东大会的法律意见书,finalpage/2014-11-18/1200399233.PDF
484,2014-12-02,赛象科技：关于公司控股股东的一致行动人减持股份的提示性公告,finalpage/2014-12-02/1200431424.PDF
485,2014-12-06,赛象科技：关于向山东福泰尔轮胎有限公司销售产品提供融资租赁业务回购担保的公告,finalpage/2014-12-06/1200443911.PDF
486,2014-12-06,赛象科技：第五届董事会第十九次会议决议公告,finalpage/2014-12-06/1200443912.PDF
487,2014-12-06,赛象科技：独立董事关于公司向山东福泰尔轮胎有限公司销售产品提供融资租赁业务回购担保的议案的独立意见,finalpage/2014-12-06/1200443913.PDF
488,2014-12-20,赛象科技：重大事项停牌公告,finalpage/2014-12-20/1200479925.PDF
489,2014-12-23,赛象科技：公司章程,finalpage/2014-12-23/1200485355.PDF
490,2014-12-23,赛象科技：关于收购广州市井源机电设备有限公司并对其增资的公告,finalpage/2014-12-23/1200485356.PDF
491,2014-12-23,赛象科技：关于向控股子公司增资的公告,finalpage/2014-12-23/1200485357.PDF
492,2014-12-23,赛象科技：关于签订参股廊坊智通机器人系统有限公司的意向性框架协议的公告,finalpage/2014-12-23/1200485358.PDF
493,2014-12-23,赛象科技：关于召开2015年第一次临时股东大会的通知,finalpage/2014-12-23/1200485359.PDF
494,2014-12-23,赛象科技：第五届董事会第二十次会议决议公告,finalpage/2014-12-23/1200485360.PDF
495,2014-12-23,赛象科技：第五届监事会第十三次会议决议公告,finalpage/2014-12-23/1200485361.PDF
496,2014-12-23,赛象科技：复牌公告,finalpage/2014-12-23/1200485362.PDF
497,2014-12-23,赛象科技：独立董事关于收购广州市井源机电设备有限公司并对其增资的议案的独立意见,finalpage/2014-12-23/1200485363.PDF
498,2014-12-25,赛象科技：关于2014年度利润分配预案的预披露公告,finalpage/2014-12-25/1200492796.PDF
499,2014-12-30,赛象科技：股票交易异常波动公告,finalpage/2014-12-30/1200504175.PDF
500,2015-01-10,赛象科技：2015年第一次临时股东大会决议公告,finalpage/2015-01-10/1200532874.PDF
501,2015-01-10,赛象科技：2015年第一次临时股东大会的法律意见书,finalpage/2015-01-10/1200532875.PDF
502,2015-01-14,赛象科技：股票交易异常波动公告,finalpage/2015-01-14/1200541683.PDF
503,2015-02-03,赛象科技：关于使用自有资金进行固定收益类证券投资的公告,finalpage/2015-02-03/1200602662.PDF
504,2015-02-03,赛象科技：日常关联交易预计公告,finalpage/2015-02-03/1200602663.PDF
505,2015-02-03,赛象科技：关于举行2014年度报告网上说明会的通知,finalpage/2015-02-03/1200602664.PDF
506,2015-02-03,赛象科技：2014年年度报告摘要,finalpage/2015-02-03/1200602665.PDF
507,2015-02-03,赛象科技：2014年年度审计报告,finalpage/2015-02-03/1200602667.PDF
508,2015-02-03,赛象科技：第五届董事会第二十一次会议决议公告,finalpage/2015-02-03/1200602668.PDF
509,2015-02-03,赛象科技：关于召开2014年度股东大会的通知,finalpage/2015-02-03/1200602669.PDF
510,2015-02-03,赛象科技：第五届监事会第十四次会议决议公告,finalpage/2015-02-03/1200602670.PDF
511,2015-02-03,赛象科技：控股股东及其他关联方资金占用情况的专项说明,finalpage/2015-02-03/1200602671.PDF
512,2015-02-03,赛象科技：2014年年度报告,finalpage/2015-02-03/1200602673.PDF
513,2015-02-03,赛象科技：2014年度内部控制评价报告,finalpage/2015-02-03/1200602674.PDF
514,2015-02-03,赛象科技：内部控制鉴证报告,finalpage/2015-02-03/1200602675.PDF
515,2015-02-03,赛象科技：独立董事关于控股股东及其他关联方占用公司资金、公司对外担保情况的专项说明和独立意见,finalpage/2015-02-03/1200602676.PDF
516,2015-02-03,赛象科技：2014年度独立董事述职报告,finalpage/2015-02-03/1200602677.PDF
517,2015-02-03,赛象科技：内部控制规则落实自查表,finalpage/2015-02-03/1200602678.PDF
518,2015-02-03,赛象科技：独立董事关于关联交易事项的事前认可函,finalpage/2015-02-03/1200602679.PDF
519,2015-02-03,赛象科技：独立董事关于继续聘请大华会计师事务所（特殊普通合伙）进行审计的事前认可函,finalpage/2015-02-03/1200602680.PDF
520,2015-02-03,赛象科技：独立董事关于公司五届二十一次董事会相关事项的独立意见,finalpage/2015-02-03/1200602681.PDF
521,2015-02-03,赛象科技：监事会对公司内部控制评价的意见,finalpage/2015-02-03/1200602682.PDF
522,2015-02-03,赛象科技：关于收到深圳证券交易所《关于对天津赛象科技股份有限公司的问询函》的回复公告,finalpage/2015-02-03/1200604342.PDF
523,2015-02-13,赛象科技：关于子公司广州市井源机电设备有限公司完成工商变更登记的公告,finalpage/2015-02-13/1200632344.PDF
524,2015-02-13,赛象科技：第五届董事会第二十二次会议决议公告,finalpage/2015-02-13/1200632345.PDF
525,2015-02-13,赛象科技：关于会计政策变更的公告,finalpage/2015-02-13/1200632346.PDF
526,2015-02-13,赛象科技：关于签署廊坊智通机器人系统有限公司增资协议的公告,finalpage/2015-02-13/1200632347.PDF
527,2015-02-13,赛象科技：第五届监事会第十五次会议决议公告,finalpage/2015-02-13/1200632348.PDF
528,2015-02-13,赛象科技：独立董事关于公司会计政策变更的独立意见,finalpage/2015-02-13/1200632349.PDF
529,2015-02-14,赛象科技：关于签署廊坊智通机器人系统有限公司增资协议的补充公告,finalpage/2015-02-14/1200637772.PDF
530,2015-02-26,赛象科技：2014年度股东大会决议公告,finalpage/2015-02-26/1200650894.PDF
531,2015-02-26,赛象科技：2014年度股东大会的法律意见书,finalpage/2015-02-26/1200650895.PDF
532,2015-02-27,赛象科技：关于公司控股股东的一致行动人减持股份的公告,finalpage/2015-02-27/1200653922.PDF
533,2015-02-27,赛象科技：2014年年度权益分派实施公告,finalpage/2015-02-27/1200653923.PDF
534,2015-02-27,赛象科技：简式权益变动报告书,finalpage/2015-02-27/1200653924.PDF
535,2015-03-05,赛象科技：关于公司控股股东的一致行动人减持股份的公告,finalpage/2015-03-05/1200669621.PDF
536,2015-03-05,赛象科技：简式权益变动报告书,finalpage/2015-03-05/1200669622.PDF
537,2015-03-10,赛象科技：关于公司控股股东的一致行动人减持股份的公告,finalpage/2015-03-10/1200682528.PDF
538,2015-03-10,赛象科技：简式权益变动报告书,finalpage/2015-03-10/1200682529.PDF
539,2015-03-14,赛象科技：关于公司控股股东的一致行动人减持股份的公告,finalpage/2015-03-14/1200698962.PDF
540,2015-03-14,赛象科技：简式权益变动报告书,finalpage/2015-03-14/1200698963.PDF
541,2015-03-18,赛象科技：关于公司控股股东的一致行动人减持股份的公告,finalpage/2015-03-18/1200710489.PDF
542,2015-03-18,赛象科技：简式权益变动报告书,finalpage/2015-03-18/1200710490.PDF
543,2015-03-24,赛象科技：关于公司实际控制人及其一致行动人减持股份的公告,finalpage/2015-03-24/1200732671.PDF
544,2015-03-24,赛象科技：简式权益变动报告书,finalpage/2015-03-24/1200732672.PDF
545,2015-03-25,赛象科技：股票交易异常波动公告,finalpage/2015-03-25/1200737415.PDF
546,2015-03-28,赛象科技：关于公司实际控制人的一致行动人减持股份的公告,finalpage/2015-03-28/1200752937.PDF
547,2015-04-28,赛象科技：关于举行“投资者网上集体接待日”活动公告,finalpage/2015-04-28/1200918453.PDF
548,2015-04-28,赛象科技：2015年第一季度报告正文,finalpage/2015-04-28/1200918454.PDF
549,2015-04-28,赛象科技：2015年第一季度报告全文,finalpage/2015-04-28/1200918456.PDF
550,2015-05-12,赛象科技：第五届董事会第二十四次会议决议公告,finalpage/2015-05-12/1200998653.PDF
551,2015-05-12,赛象科技：关于确认限制性股票激励计划第二个解锁期及预留限制性股票第一个解锁期可解锁的公告,finalpage/2015-05-12/1200998654.PDF
552,2015-05-12,赛象科技：关于回购注销部分限制性股票的公告,finalpage/2015-05-12/1200998655.PDF
553,2015-05-12,赛象科技：减资公告,finalpage/2015-05-12/1200998656.PDF
554,2015-05-12,赛象科技：第五届监事会第十七次会议决议公告,finalpage/2015-05-12/1200998657.PDF
555,2015-05-12,赛象科技：关于为子公司提供担保的公告,finalpage/2015-05-12/1200998658.PDF
556,2015-05-12,赛象科技：天津嘉德恒时律师事务所关于公司限制性股票第二次解锁及部分限制性股票回购注销相关事宜的法律意见书,finalpage/2015-05-12/1200998659.PDF
557,2015-05-12,赛象科技：公司章程（2015年5月）,finalpage/2015-05-12/1200998660.PDF
558,2015-05-12,赛象科技：独立董事关于公司五届二十四次董事会相关事项的独立意见,finalpage/2015-05-12/1200998661.PDF
559,2015-05-13,赛象科技：关于公司控股股东变更工商注册信息的公告,finalpage/2015-05-13/1201005057.PDF
560,2015-05-18,赛象科技：关于限制性股票激励计划第二个解锁期及预留限制性股票第一个解锁期解锁股份上市流通的提示性公告,finalpage/2015-05-18/1201020121.PDF
561,2015-06-04,赛象科技：关于控股股东减持股份的公告,finalpage/2015-06-04/1201100109.PDF
562,2015-07-09,赛象科技：关于控股股东增持公司股份计划的公告,finalpage/2015-07-09/1201261891.PDF
563,2015-07-11,赛象科技：关于维护公司股价稳定的公告,finalpage/2015-07-11/1201273414.PDF
564,2015-07-15,赛象科技：关于2015年半年报业绩预告的修正公告,finalpage/2015-07-15/1201292293.PDF
565,2015-07-15,赛象科技：股票交易异常波动公告,finalpage/2015-07-15/1201293285.PDF
566,2015-07-22,赛象科技：关于部分限制性股票回购注销完成的公告,finalpage/2015-07-22/1201330005.PDF
567,2015-08-25,赛象科技：关于使用自有资金购买银行理财产品的公告,finalpage/2015-08-25/1201482254.PDF
568,2015-08-25,赛象科技：2015年半年度报告摘要,finalpage/2015-08-25/1201482255.PDF
569,2015-08-25,赛象科技：2015半年度财务报告,finalpage/2015-08-25/1201482257.PDF
570,2015-08-25,赛象科技：第五届董事会第二十五次会议决议公告,finalpage/2015-08-25/1201482258.PDF
571,2015-08-25,赛象科技：第五届监事会第十八次会议决议公告,finalpage/2015-08-25/1201482259.PDF
572,2015-08-25,赛象科技：2015年半年度报告,finalpage/2015-08-25/1201482261.PDF
573,2015-08-25,赛象科技：独立董事关于控股股东及其他关联方占用公司资金、公司对外担保情况的专项说明和独立意见,finalpage/2015-08-25/1201482262.PDF
574,2015-08-25,赛象科技：独立董事关于公司五届二十五次董事会相关事项的独立意见,finalpage/2015-08-25/1201482263.PDF
575,2015-09-01,赛象科技：关于欧洲与天津之间大部件运输用工装夹具的采购和维修维护服务项目成交结果公示的公告,finalpage/2015-09-01/1201530966.PDF
576,2015-09-29,赛象科技：关于副总经理辞职的公告,finalpage/2015-09-29/1201650263.PDF
577,2015-10-09,赛象科技：关于独立董事辞职的公告,finalpage/2015-10-09/1201668691.PDF
578,2015-10-29,赛象科技：股票交易异常波动公告,finalpage/2015-10-29/1201735019.PDF
579,2015-10-30,赛象科技：2015年第三季度报告正文,finalpage/2015-10-30/1201738659.PDF
580,2015-10-30,赛象科技：2015年第三季度报告全文,finalpage/2015-10-30/1201738662.PDF
581,2015-10-30,赛象科技：第五届董事会第二十六次会议决议公告,finalpage/2015-10-30/1201738663.PDF
582,2015-10-30,赛象科技：第五届监事会第十九次会议决议公告,finalpage/2015-10-30/1201738664.PDF
583,2015-10-30,赛象科技：日常关联交易预计公告,finalpage/2015-10-30/1201738665.PDF
584,2015-10-30,赛象科技：关于召开2015年第二次临时股东大会的通知,finalpage/2015-10-30/1201738666.PDF
585,2015-10-30,赛象科技：股票交易异常波动补充公告,finalpage/2015-10-30/1201738667.PDF
586,2015-10-30,赛象科技：独立董事关于关联交易事项的事前认可函,finalpage/2015-10-30/1201738668.PDF
587,2015-10-30,赛象科技：独立董事关于公司五届二十六次董事会相关事项的独立意见,finalpage/2015-10-30/1201738669.PDF
588,2015-10-30,赛象科技：关于增补独立董事的公告,finalpage/2015-10-30/1201738670.PDF
589,2015-11-18,赛象科技：2015年第二次临时股东大会决议公告,finalpage/2015-11-18/1201775416.PDF
590,2015-11-18,赛象科技：2015年第二次临时股东大会的法律意见书,finalpage/2015-11-18/1201775417.PDF
591,2016-01-09,赛象科技：关于公司股东股份被质押的公告,finalpage/2016-01-09/1201902949.PDF
592,2016-01-09,赛象科技：日常经营重大合同公告,finalpage/2016-01-09/1201902950.PDF
593,2016-02-26,赛象科技：关于计提公司2015年资产减值准备的公告,finalpage/2016-02-26/1202000487.PDF
594,2016-02-26,赛象科技：关于召开2016年第一次临时股东大会的通知,finalpage/2016-02-26/1202000488.PDF
595,2016-02-26,赛象科技：第五届监事会第二十次会议决议公告,finalpage/2016-02-26/1202000489.PDF
596,2016-02-26,赛象科技：关于职工代表监事选举结果的公告,finalpage/2016-02-26/1202000490.PDF
597,2016-02-26,赛象科技：独立董事关于董事会换届选举议案的独立意见,finalpage/2016-02-26/1202000491.PDF
598,2016-02-26,赛象科技：重大事项处置权限管理制度（2016年2月）,finalpage/2016-02-26/1202000492.PDF
599,2016-02-26,赛象科技：审计委员会关于计提资产减值准备的说明,finalpage/2016-02-26/1202000493.PDF
600,2016-02-26,赛象科技：独立董事候选人声明（郭卫锋）,finalpage/2016-02-26/1202000494.PDF
601,2016-02-26,赛象科技：独立董事提名人声明（一）,finalpage/2016-02-26/1202000495.PDF
602,2016-02-26,赛象科技：独立董事候选人声明（张梅）,finalpage/2016-02-26/1202000496.PDF
603,2016-02-26,赛象科技：独立董事提名人声明（二）,finalpage/2016-02-26/1202000497.PDF
604,2016-02-26,赛象科技：第五届董事会第二十七次会议决议公告,finalpage/2016-02-26/1202000498.PDF
605,2016-02-27,赛象科技：2015年度业绩快报,finalpage/2016-02-27/1202004064.PDF
606,2016-02-27,赛象科技：关于计提公司2015年资产减值准备的补充公告,finalpage/2016-02-27/1202004065.PDF
607,2016-03-04,赛象科技：关于召开2016年第一次临时股东大会的提示性公告,finalpage/2016-03-04/1202020348.PDF
608,2016-03-15,赛象科技：2016年第一次临时股东大会决议公告,finalpage/2016-03-15/1202043480.PDF
609,2016-03-15,赛象科技：2016年第一次临时股东大会的法律意见书,finalpage/2016-03-15/1202043481.PDF
610,2016-03-16,赛象科技：第六届董事会第一次会议决议公告,finalpage/2016-03-16/1202046143.PDF
611,2016-03-16,赛象科技：独立董事关于聘任高级管理人员议案的独立意见,finalpage/2016-03-16/1202046144.PDF
612,2016-03-16,赛象科技：第六届监事会第一次会议决议公告,finalpage/2016-03-16/1202046145.PDF
613,2016-03-30,赛象科技：关于完成工商变更登记的公告,finalpage/2016-03-30/1202098267.PDF
614,2016-03-30,赛象科技：2016年度第一季度业绩预告,finalpage/2016-03-30/1202098268.PDF
615,2016-04-26,赛象科技：2015年年度报告摘要,finalpage/2016-04-26/1202238510.PDF
616,2016-04-26,赛象科技：2015年年度审计报告,finalpage/2016-04-26/1202238512.PDF
617,2016-04-26,赛象科技：第六届董事会第二次会议决议公告,finalpage/2016-04-26/1202238513.PDF
618,2016-04-26,赛象科技：关于召开2015年年度股东大会的通知,finalpage/2016-04-26/1202238514.PDF
619,2016-04-26,赛象科技：第六届监事会第二次会议决议公告,finalpage/2016-04-26/1202238515.PDF
620,2016-04-26,赛象科技：2015年年度报告,finalpage/2016-04-26/1202238517.PDF
621,2016-04-26,赛象科技：控股股东及其他关联方资金占用情况的专项说明,finalpage/2016-04-26/1202238518.PDF
622,2016-04-26,赛象科技：2015年度独立董事述职报告,finalpage/2016-04-26/1202238519.PDF
623,2016-04-26,赛象科技：独立董事关于控股股东及其他关联方占用公司资金、公司对外担保情况的专项说明和独立意见,finalpage/2016-04-26/1202238520.PDF
624,2016-04-26,赛象科技：2015年度内部控制评价报告,finalpage/2016-04-26/1202238521.PDF
625,2016-04-26,赛象科技：关于使用自有资金进行投资理财的公告,finalpage/2016-04-26/1202238522.PDF
626,2016-04-26,赛象科技：2016年日常关联交易预计公告,finalpage/2016-04-26/1202238523.PDF
627,2016-04-26,赛象科技：关于公司进行风险投资事项的公告,finalpage/2016-04-26/1202238524.PDF
628,2016-04-26,赛象科技：独立董事关于公司六届二次董事会相关事项的独立意见,finalpage/2016-04-26/1202238525.PDF
629,2016-04-26,赛象科技：独立董事关于关联交易事项的事前认可函,finalpage/2016-04-26/1202238526.PDF
630,2016-04-26,赛象科技：独立董事关于继续聘请大华会计师事务所（特殊普通合伙）进行审计的事前认可函,finalpage/2016-04-26/1202238527.PDF
631,2016-04-26,赛象科技：内部控制规则落实自查表,finalpage/2016-04-26/1202238528.PDF
632,2016-04-26,赛象科技：监事会对公司内部控制评价的意见,finalpage/2016-04-26/1202238529.PDF
633,2016-04-27,赛象科技：日常经营重大合同公告,finalpage/2016-04-27/1202248095.PDF
634,2016-04-29,赛象科技：2016年第一季度报告正文,finalpage/2016-04-29/1202263359.PDF
635,2016-04-29,赛象科技：2016年第一季度报告全文,finalpage/2016-04-29/1202263361.PDF
636,2016-04-30,赛象科技：关于举行2015年度报告网上说明会的通知,finalpage/2016-04-30/1202279805.PDF
637,2016-05-19,赛象科技：2015年年度股东大会决议公告,finalpage/2016-05-19/1202328168.PDF
638,2016-05-19,赛象科技：2015年年度股东大会的法律意见书,finalpage/2016-05-19/1202328169.PDF
639,2016-06-25,赛象科技：关于深圳证券交易所2015年年报问询函的回复,finalpage/2016-06-25/1202404762.PDF
640,2016-07-06,赛象科技：关于公司股东股份解除质押的公告,finalpage/2016-07-06/1202452462.PDF
641,2016-07-27,赛象科技：第六届董事会第四次会议决议公告,finalpage/2016-07-27/1202505794.PDF
642,2016-07-27,赛象科技：关于公司副总经理、财务总监、董事会秘书辞职和聘任公司副总经理、财务总监、董事会秘书的公告,finalpage/2016-07-27/1202505795.PDF
643,2016-07-27,赛象科技：独立董事关于公司六届四次董事会相关事项的独立意见,finalpage/2016-07-27/1202505796.PDF
644,2016-08-23,赛象科技：关于公司董事长变更的公告,finalpage/2016-08-23/1202601270.PDF
645,2016-08-23,赛象科技：关于回购注销激励计划未达到解锁条件的限制性股票的公告,finalpage/2016-08-23/1202601271.PDF
646,2016-08-23,赛象科技：天津嘉德恒时律师事务所关于公司回购注销限制性股票激励计划部分限制性股票的法律意见书,finalpage/2016-08-23/1202601272.PDF
647,2016-08-23,赛象科技：减资公告,finalpage/2016-08-23/1202601273.PDF
648,2016-08-23,赛象科技：2016年半年度报告,finalpage/2016-08-23/1202601274.PDF
649,2016-08-23,赛象科技：财务报告,finalpage/2016-08-23/1202601275.PDF
