,date,title,url
449,2014-04-10,华英农业：利润分配管理制度（2014年4月）,finalpage/2014-04-10/63812955.PDF
450,2014-04-10,华英农业：未来三年（2014-2016年）股东回报规划,finalpage/2014-04-10/63812956.PDF
451,2014-04-10,华英农业：公司章程修订对照表,finalpage/2014-04-10/63812957.PDF
452,2014-04-10,华英农业：公司章程（2014年4月）,finalpage/2014-04-10/63812958.PDF
453,2014-04-10,华英农业：2013年度内部控制规范工作进展的公告,finalpage/2014-04-10/63812959.PDF
454,2014-04-10,华英农业：关于举行2013年度业绩网上说明会的公告,finalpage/2014-04-10/63812960.PDF
455,2014-04-10,华英农业：2013年度报告摘要及股东大会通知的补充公告,finalpage/2014-04-10/63815636.PDF
456,2014-04-29,华英农业：2014年第一季度报告正文,finalpage/2014-04-29/63939812.PDF
457,2014-04-29,华英农业：2014年第一季度报告全文,finalpage/2014-04-29/63939814.PDF
458,2014-04-29,华英农业：第五届监事会第三次会议决议公告,finalpage/2014-04-29/63939815.PDF
459,2014-04-29,华英农业：第五届董事会第三次会议决议公告,finalpage/2014-04-29/63939816.PDF
460,2014-04-30,华英农业：关于收到政府补贴的公告（三）,finalpage/2014-04-30/63957706.PDF
461,2014-05-05,华英农业：2013年度股东大会决议公告,finalpage/2014-05-05/63959252.PDF
462,2014-05-05,华英农业：2013年度股东大会的法律意见书,finalpage/2014-05-05/63959253.PDF
463,2014-05-10,华英农业：关于收到政府补贴的公告（四）,finalpage/2014-05-10/64008335.PDF
464,2014-05-23,华英农业：光大证券股份有限公司关于公司关联交易事项的核查意见,finalpage/2014-05-23/64056381.PDF
465,2014-05-23,华英农业：独立董事对收购股权暨关联交易的独立意见,finalpage/2014-05-23/64056382.PDF
466,2014-05-23,华英农业：第五届董事会第四次会议决议公告,finalpage/2014-05-23/64056383.PDF
467,2014-05-23,华英农业：关于召开2014年第二次临时股东大会的公告,finalpage/2014-05-23/64056384.PDF
468,2014-05-23,华英农业：关于对外投资收购股权的公告,finalpage/2014-05-23/64056385.PDF
469,2014-05-23,华英农业：关于对外投资设立控股子公司的公告,finalpage/2014-05-23/64056386.PDF
470,2014-05-23,华英农业：关于收购股权暨关联交易的公告,finalpage/2014-05-23/64056389.PDF
471,2014-06-03,华英农业：关于收到政府补贴的公告（五）,finalpage/2014-06-03/64096186.PDF
472,2014-06-10,华英农业：2014年第二次临时股东大会的法律意见书,finalpage/2014-06-10/64117904.PDF
473,2014-06-10,华英农业：2014年第二次临时股东大会决议公告,finalpage/2014-06-10/64117907.PDF
474,2014-06-17,华英农业：关于收到政府补贴的公告（六）,finalpage/2014-06-17/64146399.PDF
475,2014-06-24,华英农业：关于拟出售土地使用权关联交易的进展公告,finalpage/2014-06-24/1200001755.PDF
476,2014-07-01,华英农业：关于对外投资设立控股子公司的进展公告,finalpage/2014-07-01/1200021420.PDF
477,2014-07-04,华英农业：光大证券股份有限公司关于公司限售股份上市流通的保荐意见,finalpage/2014-07-04/1200030108.PDF
478,2014-07-04,华英农业：非公开发行限售股份上市流通提示性公告,finalpage/2014-07-04/1200030109.PDF
479,2014-07-23,华英农业：关于公司管理层及部分员工融资增持公司股份的公告,finalpage/2014-07-23/1200073401.PDF
480,2014-07-25,华英农业：权益变动提示性公告,finalpage/2014-07-25/1200078240.PDF
481,2014-07-25,华英农业：简式权益变动报告书,finalpage/2014-07-25/1200078241.PDF
482,2014-07-31,华英农业：2014年半年度业绩快报,finalpage/2014-07-31/1200089711.PDF
483,2014-08-28,华英农业：2014年半年度报告摘要,finalpage/2014-08-28/1200176925.PDF
484,2014-08-28,华英农业：2014年半年度财务报告,finalpage/2014-08-28/1200176927.PDF
485,2014-08-28,华英农业：第五届董事会第五次会议决议公告,finalpage/2014-08-28/1200176928.PDF
486,2014-08-28,华英农业：第五届监事会第四次会议决议公告,finalpage/2014-08-28/1200176929.PDF
487,2014-08-28,华英农业：2014年半年度报告,finalpage/2014-08-28/1200176930.PDF
488,2014-08-28,华英农业：独立董事对第五届董事会第五次会议相关事项的独立意见,finalpage/2014-08-28/1200176931.PDF
489,2014-08-28,华英农业：2014年半年度募集资金存放与实际使用情况的专项报告,finalpage/2014-08-28/1200176932.PDF
490,2014-09-16,华英农业：关于收购股权的进展公告,finalpage/2014-09-16/1200237589.PDF
491,2014-09-17,华英农业：关于公司管理层及部分员工融资增持公司股份的进展公告,finalpage/2014-09-17/1200242901.PDF
492,2014-09-18,华英农业：权益变动提示性公告,finalpage/2014-09-18/1200243711.PDF
493,2014-09-18,华英农业：简式权益变动报告书,finalpage/2014-09-18/1200243712.PDF
494,2014-09-19,华英农业：权益变动提示性公告,finalpage/2014-09-19/1200246765.PDF
495,2014-09-19,华英农业：简式权益变动报告书（二）,finalpage/2014-09-19/1200246766.PDF
496,2014-09-23,华英农业：权益变动提示性公告,finalpage/2014-09-23/1200254401.PDF
497,2014-09-23,华英农业：简式权益变动报告书（三）,finalpage/2014-09-23/1200254402.PDF
498,2014-09-27,华英农业：权益变动提示性公告,finalpage/2014-09-27/1200265173.PDF
499,2014-09-27,华英农业：关于公司管理层及部分员工融资增持公司股份的进展公告,finalpage/2014-09-27/1200265174.PDF
500,2014-09-27,华英农业：简式权益变动报告书,finalpage/2014-09-27/1200265175.PDF
501,2014-09-30,华英农业：公司章程修订对照表（2014年9月）,finalpage/2014-09-30/1200277457.PDF
502,2014-09-30,华英农业：公司章程（2014年9月）,finalpage/2014-09-30/1200277458.PDF
503,2014-09-30,华英农业：第五届董事会第六次会议决议公告,finalpage/2014-09-30/1200277459.PDF
504,2014-09-30,华英农业：关于召开2014年第三次临时股东大会通知的公告,finalpage/2014-09-30/1200277460.PDF
505,2014-09-30,华英农业：关于投资设立全资子公司的公告,finalpage/2014-09-30/1200277461.PDF
506,2014-09-30,华英农业：关于注销华隆羽绒子公司的公告,finalpage/2014-09-30/1200277462.PDF
507,2014-09-30,华英农业：关于注销淮滨分公司的公告,finalpage/2014-09-30/1200277463.PDF
508,2014-09-30,华英农业：关于注销港华羽绒子公司的公告,finalpage/2014-09-30/1200277464.PDF
509,2014-10-17,华英农业：2014年第三次临时股东大会决议公告,finalpage/2014-10-17/1200306069.PDF
510,2014-10-17,华英农业：2014年第三次临时股东大会的法律意见书,finalpage/2014-10-17/1200306070.PDF
511,2014-10-29,华英农业：2014年第三季度报告正文,finalpage/2014-10-29/1200345413.PDF
512,2014-10-29,华英农业：第五届董事会第七次会议决议公告,finalpage/2014-10-29/1200345415.PDF
513,2014-10-29,华英农业：第五届监事会第五次会议决议公告,finalpage/2014-10-29/1200345416.PDF
514,2014-10-29,华英农业：2014年第三季度报告全文,finalpage/2014-10-29/1200345417.PDF
515,2014-12-10,华英农业：关于公司管理层及部分员工融资增持公司股份的进展公告,finalpage/2014-12-10/1200452679.PDF
516,2014-12-11,华英农业：第五届董事会第八次会议决议公告,finalpage/2014-12-11/1200458753.PDF
517,2014-12-11,华英农业：关于收购农户养殖场的公告,finalpage/2014-12-11/1200458754.PDF
518,2014-12-20,华英农业：关于公司加入中国畜牧业协会白羽肉鸭工作委员会的公告,finalpage/2014-12-20/1200479249.PDF
519,2014-12-24,华英农业：关于子公司获得出口欧盟注册资格的公告,finalpage/2014-12-24/1200489639.PDF
520,2015-01-15,华英农业：关于收到政府补贴的公告（一）,finalpage/2015-01-15/1200547358.PDF
521,2015-01-16,华英农业：关于收到政府补贴的补充公告,finalpage/2015-01-16/1200549151.PDF
522,2015-01-17,华英农业：关于收到政府补贴的公告（二）,finalpage/2015-01-17/1200551161.PDF
523,2015-01-24,华英农业：光大证券股份有限公司关于公司2014年度持续督导培训的报告,finalpage/2015-01-24/1200573463.PDF
524,2015-02-28,华英农业：2014年度业绩快报,finalpage/2015-02-28/1200656706.PDF
525,2015-03-07,华英农业：关于为独资子公司提供担保的公告,finalpage/2015-03-07/1200676531.PDF
526,2015-03-07,华英农业：关于召开2015年第一次临时股东大会通知的公告,finalpage/2015-03-07/1200676532.PDF
527,2015-03-07,华英农业：第五届董事会第九次会议的公告,finalpage/2015-03-07/1200676533.PDF
528,2015-03-07,华英农业：独立董事对第五届董事会第九次会议相关事项的独立意见,finalpage/2015-03-07/1200676534.PDF
529,2015-03-19,华英农业：重大事项停牌公告,finalpage/2015-03-19/1200714874.PDF
530,2015-03-24,华英农业：2015年第一次临时股东大会决议公告,finalpage/2015-03-24/1200731774.PDF
531,2015-03-24,华英农业：2015年第一次临时股东大会的法律意见书,finalpage/2015-03-24/1200731775.PDF
532,2015-03-27,华英农业：关于筹划非公开发行股票继续停牌的公告,finalpage/2015-03-27/1200746460.PDF
533,2015-03-31,华英农业：中铁宝盈-宝益16号华英农业定向增发特定资产管理计划资产管理合同（草案）,finalpage/2015-03-31/1200769339.PDF
534,2015-03-31,华英农业：关于与特定发行对象签署《附条件生效的股份认购合同》的公告,finalpage/2015-03-31/1200769340.PDF
535,2015-03-31,华英农业：关于非公开发行股票涉及关联交易的公告,finalpage/2015-03-31/1200769341.PDF
536,2015-03-31,华英农业：关于非公开发行股票的复牌公告,finalpage/2015-03-31/1200769342.PDF
537,2015-03-31,华英农业：第五届监事会第六次会议决议公告,finalpage/2015-03-31/1200769343.PDF
538,2015-03-31,华英农业：关于前次募集资金使用情况的报告,finalpage/2015-03-31/1200769344.PDF
539,2015-03-31,华英农业：关于公司前次募集资金使用情况的鉴证报告,finalpage/2015-03-31/1200769345.PDF
540,2015-03-31,华英农业：2015年度员工持股计划（草案）（非公开发行方式认购）,finalpage/2015-03-31/1200769346.PDF
541,2015-03-31,华英农业：2015年度员工持股计划（草案）摘要（非公开发行方式认购）,finalpage/2015-03-31/1200769347.PDF
542,2015-03-31,华英农业：2015年度非公开发行股票预案,finalpage/2015-03-31/1200769348.PDF
543,2015-03-31,华英农业：未来三年（2015年-2017年）股东回报规划,finalpage/2015-03-31/1200769349.PDF
544,2015-03-31,华英农业：2015年度非公开发行股票募集资金使用可行性分析报告,finalpage/2015-03-31/1200769350.PDF
545,2015-03-31,华英农业：独立董事关于相关事项的事前认可意见,finalpage/2015-03-31/1200769351.PDF
546,2015-03-31,华英农业：独立董事关于相关事项的独立意见,finalpage/2015-03-31/1200769352.PDF
547,2015-03-31,华英农业：监事会关于相关事项的审核意见,finalpage/2015-03-31/1200769353.PDF
548,2015-03-31,华英农业：第五届董事会第十次会议的公告,finalpage/2015-03-31/1200769354.PDF
549,2015-04-01,华英农业：2015年第一季度业绩预告,finalpage/2015-04-01/1200774878.PDF
550,2015-04-14,华英农业：关于延迟披露2014年年度报告的公告,finalpage/2015-04-14/1200830817.PDF
551,2015-04-17,华英农业：第五届董事会第十一次会议决议公告,finalpage/2015-04-17/1200845547.PDF
552,2015-04-17,华英农业：关于终止收购农户养殖场的公告,finalpage/2015-04-17/1200845548.PDF
553,2015-04-27,华英农业：2014年度独立董事述职报告（孟素荷）,finalpage/2015-04-27/1200910789.PDF
554,2015-04-27,华英农业：2014年度独立董事述职报告（潘克勤）,finalpage/2015-04-27/1200910790.PDF
555,2015-04-27,华英农业：2014年年度报告摘要（已取消）,finalpage/2015-04-27/1200910791.PDF
556,2015-04-27,华英农业：2014年年度审计报告,finalpage/2015-04-27/1200910793.PDF
557,2015-04-27,华英农业：第五届董事会第十二次会议决议公告,finalpage/2015-04-27/1200910794.PDF
558,2015-04-27,华英农业：关于召开2014年度股东大会通知的公告,finalpage/2015-04-27/1200910795.PDF
559,2015-04-27,华英农业：第五届监事会第七次会议决议公告,finalpage/2015-04-27/1200910796.PDF
560,2015-04-27,华英农业：关于公司非经营性资金占用及其他关联资金往来情况汇总表的专项审核报告,finalpage/2015-04-27/1200910797.PDF
561,2015-04-27,华英农业：2014年年度报告（已取消）,finalpage/2015-04-27/1200910798.PDF
562,2015-04-27,华英农业：2014年度独立董事述职报告（赵虎林）,finalpage/2015-04-27/1200910799.PDF
563,2015-04-27,华英农业：内部控制审计报告,finalpage/2015-04-27/1200910800.PDF
564,2015-04-27,华英农业：关于公司募集资金年度存放与实际使用情况的鉴证报告,finalpage/2015-04-27/1200910802.PDF
565,2015-04-27,华英农业：独立董事对第五届董事会第十二次会议相关事项的独立意见,finalpage/2015-04-27/1200910803.PDF
566,2015-04-27,华英农业：2015年第一季度报告正文,finalpage/2015-04-27/1200910805.PDF
567,2015-04-27,华英农业：2015年第一季度报告全文,finalpage/2015-04-27/1200910807.PDF
568,2015-04-27,华英农业：光大证券股份有限公司关于公司关联交易事项的核查意见,finalpage/2015-04-27/1200910808.PDF
569,2015-04-27,华英农业：光大证券股份有限公司关于河公司2014年度内部控制自我评价报告的核查意见,finalpage/2015-04-27/1200910809.PDF
570,2015-04-27,华英农业：光大证券股份有限公司关于公司内部控制规则落实自查表的核查意见,finalpage/2015-04-27/1200910810.PDF
571,2015-04-27,华英农业：光大证券股份有限公司关于公司2014年度募集资金存放与使用情况专项核查报告,finalpage/2015-04-27/1200910811.PDF
572,2015-04-27,华英农业：光大证券股份有限公司关于公司对外担保的核查意见,finalpage/2015-04-27/1200910812.PDF
573,2015-04-27,华英农业：光大证券股份有限公司关于公司非公开发行股票的保荐总结报告书,finalpage/2015-04-27/1200910813.PDF
574,2015-04-27,华英农业：2014年度业绩快报修正公告,finalpage/2015-04-27/1200910814.PDF
575,2015-04-27,华英农业：2014年度内部控制规范工作进展的公告,finalpage/2015-04-27/1200910815.PDF
576,2015-04-27,华英农业：关于举行2014年度业绩网上说明会的公告,finalpage/2015-04-27/1200910816.PDF
577,2015-04-27,华英农业：关于监事辞职及补选监事的公告,finalpage/2015-04-27/1200910817.PDF
578,2015-04-27,华英农业：关于办公地址搬迁的公告,finalpage/2015-04-27/1200910818.PDF
579,2015-04-27,华英农业：关于募集资金年度存放与实际使用情况的专项报告,finalpage/2015-04-27/1200910819.PDF
580,2015-04-27,华英农业：关于变更会计政策的公告,finalpage/2015-04-27/1200910820.PDF
581,2015-04-27,华英农业：关于变更注册地址并修改《公司章程》的公告,finalpage/2015-04-27/1200910821.PDF
582,2015-04-27,华英农业：2014年度保荐工作报告,finalpage/2015-04-27/1200910822.PDF
583,2015-04-28,华英农业：2014年年度报告（更新后）,finalpage/2015-04-28/1200922602.PDF
584,2015-04-28,华英农业：2014年年度报告摘要（更新后）,finalpage/2015-04-28/1200922603.PDF
585,2015-04-28,华英农业：公司章程修订对照表,finalpage/2015-04-28/1200922604.PDF
586,2015-04-28,华英农业：公司章程（2015年4月）,finalpage/2015-04-28/1200922605.PDF
587,2015-04-28,华英农业：关于2014年年度报告及摘要的更正公告,finalpage/2015-04-28/1200922606.PDF
588,2015-04-28,华英农业：关于董事辞职的公告,finalpage/2015-04-28/1200922607.PDF
589,2015-05-07,华英农业：关于增加2014年度股东大会临时提案暨召开2014年度股东大会补充通知的公告,finalpage/2015-05-07/1200977764.PDF
590,2015-05-11,华英农业：北京大成律师事务所关于公司实施员工持股计划的法律意见书,finalpage/2015-05-11/1200995652.PDF
591,2015-05-11,华英农业：重大事项进展的公告,finalpage/2015-05-11/1200995653.PDF
592,2015-05-11,华英农业：关于举行2014年度集体业绩网上说明会的公告,finalpage/2015-05-11/1200995651.PDF
593,2015-05-18,华英农业：关于收到政府补贴的公告（三）,finalpage/2015-05-18/1201030710.PDF
594,2015-05-20,华英农业：关于非公开发行A股股票股东权益变动的提示性公告,finalpage/2015-05-20/1201039550.PDF
595,2015-05-20,华英农业：简式权益变动报告书（一）,finalpage/2015-05-20/1201039551.PDF
596,2015-05-20,华英农业：简式权益变动报告书（二）,finalpage/2015-05-20/1201039552.PDF
597,2015-05-20,华英农业：2014年度内部控制评价报告,finalpage/2015-05-20/1201038062.PDF
598,2015-05-20,华英农业：2014年度股东大会决议公告,finalpage/2015-05-20/1201038063.PDF
599,2015-05-20,华英农业：2014年度股东大会的法律意见书,finalpage/2015-05-20/1201038064.PDF
600,2015-06-02,华英农业：关于非公开发行股票申请获得中国证监会受理的公告,finalpage/2015-06-02/1201087957.PDF
601,2015-06-18,华英农业：独立董事对第五届董事会第十三次会议相关事项的独立意见,finalpage/2015-06-18/1201164774.PDF
602,2015-06-18,华英农业：第五届董事会第十三次会议决议公告,finalpage/2015-06-18/1201164775.PDF
603,2015-06-18,华英农业：关于对外投资收购股权的公告,finalpage/2015-06-18/1201164776.PDF
604,2015-06-18,华英农业：关于对外投资自建养殖场的公告,finalpage/2015-06-18/1201164777.PDF
605,2015-06-18,华英农业：关于对外投资设立参股公司暨投资畜禽类屠宰与养殖孵化废弃物无害化处理综合利用项目的公告,finalpage/2015-06-18/1201164778.PDF
606,2015-06-19,华英农业：关于收到政府补贴的公告（四）,finalpage/2015-06-19/1201170416.PDF
607,2015-06-25,华英农业：关于收到政府补贴的公告（五）,finalpage/2015-06-25/1201190899.PDF
608,2015-06-27,华英农业：关于为子公司提供担保的公告,finalpage/2015-06-27/1201203105.PDF
609,2015-06-27,华英农业：关于召开2015年第二次临时股东大会通知的公告,finalpage/2015-06-27/1201203106.PDF
610,2015-06-27,华英农业：关于子公司开展融资租赁业务的公告,finalpage/2015-06-27/1201203107.PDF
611,2015-06-27,华英农业：第五届董事会第十四次会议的公告,finalpage/2015-06-27/1201203108.PDF
612,2015-06-27,华英农业：独立董事对第五届董事会第十四次会议相关事项的独立意见,finalpage/2015-06-27/1201203109.PDF
613,2015-06-29,华英农业：关于收到政府补贴的公告（六）,finalpage/2015-06-29/1201211269.PDF
614,2015-07-07,华英农业：关于高管拟增持公司股份的公告,finalpage/2015-07-07/1201251767.PDF
615,2015-07-08,华英农业：重大事项停牌公告,finalpage/2015-07-08/1201254645.PDF
616,2015-07-14,华英农业：关于与郑州华合英农业科技中心（有限合伙）和深圳市鼎力盛合投资管理有限公司共同发起设立投资管理公司及拟定设立产业并购基金的框架协议暨关联交易的公告,finalpage/2015-07-14/1201288043.PDF
617,2015-07-14,华英农业：复牌公告,finalpage/2015-07-14/1201288044.PDF
618,2015-07-15,华英农业：关于收到政府补贴的公告（七）,finalpage/2015-07-15/1201298132.PDF
619,2015-07-15,华英农业：2015年第二次临时股东大会决议公告,finalpage/2015-07-15/1201293891.PDF
620,2015-07-15,华英农业：2015年第二次临时股东大会的法律意见书,finalpage/2015-07-15/1201293892.PDF
621,2015-07-17,华英农业：股票交易异常波动公告,finalpage/2015-07-17/1201305531.PDF
622,2015-07-22,华英农业：关于证券事务代表辞职的公告,finalpage/2015-07-22/1201329978.PDF
623,2015-07-22,华英农业：股票交易异常波动公告,finalpage/2015-07-22/1201329979.PDF
624,2015-07-23,华英农业：与郑州华合英农业科技中心（有限合伙）和深圳市鼎力盛合投资管理有限公司共同发起设立投资管理公司及拟定设立产业并购基金的框架协议暨关联交易的进展公告,finalpage/2015-07-23/1201335233.PDF
625,2015-07-23,华英农业：关于为子公司养殖分公司提供担保的公告,finalpage/2015-07-23/1201335234.PDF
626,2015-07-23,华英农业：关于召开2015年第三次临时股东大会通知的公告,finalpage/2015-07-23/1201335235.PDF
627,2015-07-23,华英农业：第五届董事会第十五次会议的公告,finalpage/2015-07-23/1201335236.PDF
628,2015-07-23,华英农业：独立董事对第五届董事会第十五次会议相关事项的独立意见,finalpage/2015-07-23/1201335237.PDF
629,2015-07-31,华英农业：2015年半年度业绩快报,finalpage/2015-07-31/1201369376.PDF
630,2015-08-01,华英农业：关于收到政府补贴的公告（八）,finalpage/2015-08-01/1201374714.PDF
631,2015-08-08,华英农业：2015年第三次临时股东大会决议公告,finalpage/2015-08-08/1201407583.PDF
632,2015-08-08,华英农业：2015年第三次临时股东大会的法律意见书,finalpage/2015-08-08/1201407584.PDF
633,2015-08-24,华英农业：关于收到《中国证监会行政许可项目审查反馈意见通知书》的公告,finalpage/2015-08-24/1201480224.PDF
634,2015-08-25,华英农业：关于收到政府补贴的公告（九）,finalpage/2015-08-25/1201489086.PDF
635,2015-08-26,华英农业：2015年半年度报告摘要,finalpage/2015-08-26/1201492638.PDF
636,2015-08-26,华英农业：2015年半年度财务报告,finalpage/2015-08-26/1201492640.PDF
637,2015-08-26,华英农业：第五届董事会第十六次会议决议公告,finalpage/2015-08-26/1201492641.PDF
638,2015-08-26,华英农业：第五届监事会第八次会议决议公告,finalpage/2015-08-26/1201492642.PDF
639,2015-08-26,华英农业：2015年半年度报告,finalpage/2015-08-26/1201492644.PDF
640,2015-08-26,华英农业：独立董事对第五届董事会第十六次会议相关事项的独立意见,finalpage/2015-08-26/1201492645.PDF
641,2015-08-26,华英农业：2015年半年度募集资金存放与实际使用情况的专项报告,finalpage/2015-08-26/1201492646.PDF
642,2015-09-01,华英农业：中铁宝盈-宝益16号华英农业定向增发特定资产管理计划资产管理合同,finalpage/2015-09-01/1201532419.PDF
643,2015-09-01,华英农业：承诺函（十二）,finalpage/2015-09-01/1201532420.PDF
644,2015-09-01,华英农业：关于最近五年被证券监管部门和交易所采取监管措施或处罚的公告,finalpage/2015-09-01/1201532421.PDF
645,2015-09-01,华英农业：关于非公开发行股票摊薄即期回报及相关防范措施的公告,finalpage/2015-09-01/1201532422.PDF
646,2015-09-01,华英农业：关于非公开发行股票申请文件反馈意见回复的公告,finalpage/2015-09-01/1201532423.PDF
647,2015-09-01,华英农业：承诺函（二）,finalpage/2015-09-01/1201532424.PDF
648,2015-09-01,华英农业：承诺函（十一）,finalpage/2015-09-01/1201532425.PDF
649,2015-09-01,华英农业：承诺函（十）,finalpage/2015-09-01/1201532426.PDF
650,2015-09-01,华英农业：承诺函（九）,finalpage/2015-09-01/1201532427.PDF
651,2015-09-01,华英农业：承诺函（八）,finalpage/2015-09-01/1201532428.PDF
652,2015-09-01,华英农业：承诺函（七）,finalpage/2015-09-01/1201532429.PDF
653,2015-09-01,华英农业：2015年度非公开发行股票申请文件反馈意见的回复,finalpage/2015-09-01/1201532430.PDF
654,2015-09-01,华英农业：承诺函（六）,finalpage/2015-09-01/1201532431.PDF
655,2015-09-01,华英农业：承诺函（五）,finalpage/2015-09-01/1201532432.PDF
656,2015-09-01,华英农业：承诺函（四）,finalpage/2015-09-01/1201532433.PDF
657,2015-09-01,华英农业：承诺函（一）,finalpage/2015-09-01/1201532434.PDF
658,2015-09-01,华英农业：深圳盛合汇富二期股权投资合伙企业（有限合伙）之有限合伙协议,finalpage/2015-09-01/1201532435.PDF
659,2015-09-01,华英农业：承诺函（三）,finalpage/2015-09-01/1201532436.PDF
660,2015-09-01,华英农业：附条件生效的股份认购合同之补充合同,finalpage/2015-09-01/1201532437.PDF
661,2015-09-16,华英农业：关于股东增持公司股份的公告,finalpage/2015-09-16/1201598861.PDF
662,2015-09-29,华英农业：土地估价报告,finalpage/2015-09-29/1201653792.PDF
663,2015-09-29,华英农业：独立董事关于相关事项的事前认可意见,finalpage/2015-09-29/1201653793.PDF
664,2015-09-29,华英农业：关于为子公司提供担保的公告,finalpage/2015-09-29/1201651278.PDF
665,2015-09-29,华英农业：关于子公司开展融资租赁业务的公告,finalpage/2015-09-29/1201651279.PDF
666,2015-09-29,华英农业：关于对外投资设立独资子公司的公告,finalpage/2015-09-29/1201651280.PDF
667,2015-09-29,华英农业：关于拟注销控股子公司的公告,finalpage/2015-09-29/1201651281.PDF
668,2015-09-29,华英农业：关于拟转让原总部办公楼综合用地暨关联交易的公告,finalpage/2015-09-29/1201651282.PDF
669,2015-09-29,华英农业：第五届董事会第十七次会议决议公告,finalpage/2015-09-29/1201651283.PDF
670,2015-09-29,华英农业：独立董事对第五届董事会第十七次会议相关事项的独立意见,finalpage/2015-09-29/1201651284.PDF
