,date,title,url
0,2010-04-16,海普瑞：北京市中伦律师事务所关于公司首次公开发行股票并上市的补充法律意见书（八）,finalpage/2010-04-16/57819229.PDF
1,2010-04-16,海普瑞：北京市中伦律师事务所关于公司首次公开发行股票并上市的补充法律意见书（二）,finalpage/2010-04-16/57819235.PDF
2,2010-04-16,海普瑞：北京市中伦律师事务所关于公司首次公开发行股票并上市的补充法律意见书（九）,finalpage/2010-04-16/57819237.PDF
3,2010-04-16,海普瑞：北京市中伦律师事务所关于公司首次公开发行股票并上市的补充法律意见书（六）,finalpage/2010-04-16/57819242.PDF
4,2010-04-16,海普瑞：北京市中伦律师事务所关于公司首次公开发行股票并上市的补充法律意见书（七）,finalpage/2010-04-16/57819244.PDF
5,2010-04-16,海普瑞：北京市中伦律师事务所关于公司首次公开发行股票并上市的补充法律意见书（三）,finalpage/2010-04-16/57819245.PDF
6,2010-04-16,海普瑞：北京市中伦律师事务所关于公司首次公开发行股票并上市的补充法律意见书（四）,finalpage/2010-04-16/57819247.PDF
7,2010-04-16,海普瑞：北京市中伦律师事务所关于公司首次公开发行股票并上市的补充法律意见书（五）,finalpage/2010-04-16/57819248.PDF
8,2010-04-16,海普瑞：北京市中伦律师事务所关于公司首次公开发行股票并上市的补充法律意见书（一）,finalpage/2010-04-16/57819249.PDF
9,2010-04-16,海普瑞：2007年度、2008年度、2009年度审计报告,finalpage/2010-04-16/57819250.PDF
10,2010-04-16,海普瑞：董事会有关本次发行的决议,finalpage/2010-04-16/57819251.PDF
11,2010-04-16,海普瑞：北京市中伦金通律师事务所关于公司首次公开发行股票并上市的法律意见书,finalpage/2010-04-16/57819254.PDF
12,2010-04-16,海普瑞：公司章程（草案）,finalpage/2010-04-16/57819255.PDF
13,2010-04-16,海普瑞：股东大会有关本次发行的决议,finalpage/2010-04-16/57819256.PDF
14,2010-04-16,海普瑞：非经常性损益情况的鉴证报告,finalpage/2010-04-16/57819257.PDF
15,2010-04-16,海普瑞：北京市中伦金通律师事务所关于为公司首次公开发行股票并上市出具法律意见书的律师工作报告,finalpage/2010-04-16/57819258.PDF
16,2010-04-16,海普瑞：内部控制鉴证报告,finalpage/2010-04-16/57819259.PDF
17,2010-04-16,海普瑞：关于公司首次公开发行股票之发行保荐工作报告,finalpage/2010-04-16/57819261.PDF
18,2010-04-16,海普瑞：首次公开发行股票初步询价及推介公告,finalpage/2010-04-16/57819262.PDF
19,2010-04-16,海普瑞：关于公司首次公开发行股票之发行保荐书,finalpage/2010-04-16/57819263.PDF
20,2010-04-16,海普瑞：首次公开发行股票招股意向书,finalpage/2010-04-16/57819264.PDF
21,2010-04-16,海普瑞：首次公开发行股票招股意向书摘要,finalpage/2010-04-16/57819265.PDF
22,2010-04-16,海普瑞：中国证监会关于核准公司首次公开发行股票的批复,finalpage/2010-04-16/57819267.PDF
23,2010-04-22,海普瑞：首次公开发行股票网上路演公告,finalpage/2010-04-22/57850067.PDF
24,2010-04-23,海普瑞：首次公开发行股票发行公告,finalpage/2010-04-23/57857247.PDF
25,2010-04-23,海普瑞：首次公开发行股票投资风险特别公告,finalpage/2010-04-23/57857248.PDF
26,2010-04-23,海普瑞：首次公开发行股票招股说明书,finalpage/2010-04-23/57857249.PDF
27,2010-04-23,海普瑞：首次公开发行股票招股说明书摘要,finalpage/2010-04-23/57857256.PDF
28,2010-04-28,海普瑞：首次公开发行股票网下配售结果公告,finalpage/2010-04-28/57884269.PDF
29,2010-04-28,海普瑞：首次公开发行股票网上定价发行申购情况及中签率公告,finalpage/2010-04-28/57884271.PDF
30,2010-04-29,海普瑞：首次公开发行股票网上定价发行摇号中签结果公告,finalpage/2010-04-29/57890181.PDF
31,2010-05-05,海普瑞：2010年第一季度财务资料,finalpage/2010-05-05/57914231.PDF
32,2010-05-05,海普瑞：首次公开发行股票上市公告书,finalpage/2010-05-05/57911478.PDF
33,2010-05-05,海普瑞：北京市中伦律师事务所关于公司首次公开发行的股票申请在深圳证券交易所上市的法律意见书,finalpage/2010-05-05/57911480.PDF
34,2010-05-05,海普瑞：中国建银投资证券有限责任公司关于公司股票上市保荐书,finalpage/2010-05-05/57911481.PDF
35,2010-05-13,海普瑞：股票交易异常波动公告,finalpage/2010-05-13/57944358.PDF
36,2010-05-15,海普瑞：澄清公告,finalpage/2010-05-15/57954055.PDF
37,2010-05-19,海普瑞：中国建银投资证券有限责任公司关于公司使用部分超额募集资金的保荐意见,finalpage/2010-05-19/57966987.PDF
38,2010-05-19,海普瑞：内幕信息及知情人登记和报备制度（2010年5月）,finalpage/2010-05-19/57966988.PDF
39,2010-05-19,海普瑞：内部审计管理制度（2010年5月）,finalpage/2010-05-19/57966989.PDF
40,2010-05-19,海普瑞：关于签订《募集资金三方监管协议》的公告,finalpage/2010-05-19/57966990.PDF
41,2010-05-19,海普瑞：董事会审计委员会年度财务报告工作制度（2010年5月）,finalpage/2010-05-19/57966991.PDF
42,2010-05-19,海普瑞：对外担保管理制度（2010年5月）,finalpage/2010-05-19/57966992.PDF
43,2010-05-19,海普瑞：投资者关系管理制度（2010年5月）,finalpage/2010-05-19/57966993.PDF
44,2010-05-19,海普瑞：敏感信息排查管理制度（2010年5月）,finalpage/2010-05-19/57966994.PDF
45,2010-05-19,海普瑞：独立董事年报工作制度（2010年5月）,finalpage/2010-05-19/57966995.PDF
46,2010-05-19,海普瑞：独立董事关于使用部分超额募集资金归还银行贷款和补充永久性流动资金的议案所发表的独立意见,finalpage/2010-05-19/57966996.PDF
47,2010-05-19,海普瑞：第一届董事会第十八次会议决议公告,finalpage/2010-05-19/57966997.PDF
48,2010-05-19,海普瑞：董事、监事和高级管理人员所持公司股份及其变动管理制度（2010年5月）,finalpage/2010-05-19/57966998.PDF
49,2010-05-19,海普瑞：关于使用部分超额募集资金归还银行贷款和补充永久性流动资金的公告,finalpage/2010-05-19/57966999.PDF
50,2010-05-19,海普瑞：重大信息内部报告制度（2010年5月）,finalpage/2010-05-19/57967000.PDF
51,2010-05-19,海普瑞：重大投资决策管理制度（2010年5月）,finalpage/2010-05-19/57967001.PDF
52,2010-05-25,海普瑞：澄清公告,finalpage/2010-05-25/57989554.PDF
53,2010-06-18,海普瑞：2010年度1-6月业绩预增公告,finalpage/2010-06-18/58071292.PDF
54,2010-06-19,海普瑞：关于召开2010年第二次临时股东大会的通知,finalpage/2010-06-19/58075984.PDF
55,2010-06-19,海普瑞：会计师事务所选聘制度（2010年6月）,finalpage/2010-06-19/58075985.PDF
56,2010-06-19,海普瑞：中国建银投资证券有限责任公司关于公司2010年度日常关联交易的核查意见,finalpage/2010-06-19/58075986.PDF
57,2010-06-19,海普瑞：公司章程（2010年6月）,finalpage/2010-06-19/58075987.PDF
58,2010-06-19,海普瑞：关于高级管理人员聘任和辞职的公告,finalpage/2010-06-19/58075988.PDF
59,2010-06-19,海普瑞：内部问责制度（2010年6月）,finalpage/2010-06-19/58075993.PDF
60,2010-06-19,海普瑞：子公司管理制度（2010年6月）,finalpage/2010-06-19/58075999.PDF
61,2010-06-19,海普瑞：年报信息披露重大差错责任追究制度（2010年6月）,finalpage/2010-06-19/58076002.PDF
62,2010-06-19,海普瑞：董事会提名委员会关于聘任管理人员的审核意见,finalpage/2010-06-19/58076003.PDF
63,2010-06-19,海普瑞：关于2010年度预计日常经营性关联交易事项的公告,finalpage/2010-06-19/58076006.PDF
64,2010-06-19,海普瑞：独立董事关于2010年度预计日常经营性关联交易事项的意见函,finalpage/2010-06-19/58076007.PDF
65,2010-06-19,海普瑞：独立董事关于任免公司高级管理人员的独立意见,finalpage/2010-06-19/58076008.PDF
66,2010-06-19,海普瑞：突发事件管理制度（2010年6月）,finalpage/2010-06-19/58076011.PDF
67,2010-06-19,海普瑞：第一届董事会第十九次会议决议公告,finalpage/2010-06-19/58076012.PDF
68,2010-06-19,海普瑞：第一届监事会第八次会议决议公告,finalpage/2010-06-19/58076015.PDF
69,2010-06-19,海普瑞：累积投票制实施细则（2010年6月）,finalpage/2010-06-19/58076020.PDF
70,2010-06-19,海普瑞：防止大股东占用上市公司资金管理办法（2010年6月）,finalpage/2010-06-19/58076023.PDF
71,2010-07-06,海普瑞：2010年第二次临时股东大会决议公告,finalpage/2010-07-06/58137217.PDF
72,2010-07-06,海普瑞：2010年第二次临时股东大会的法律意见书,finalpage/2010-07-06/58137218.PDF
73,2010-07-06,海普瑞：2010第二次临时股东大会决议,finalpage/2010-07-06/58137219.PDF
74,2010-07-06,海普瑞：公司章程（2010年7月）,finalpage/2010-07-06/58137220.PDF
75,2010-07-28,海普瑞：关于完成工商变更登记的公告,finalpage/2010-07-28/58226132.PDF
76,2010-07-31,海普瑞：2010年半年度报告,finalpage/2010-07-31/58243492.PDF
77,2010-07-31,海普瑞：2010年半年度报告摘要,finalpage/2010-07-31/58243320.PDF
78,2010-07-31,海普瑞：2010年半年度财务报告,finalpage/2010-07-31/58243322.PDF
79,2010-07-31,海普瑞：独立董事关于控股股东及其他关联方占用公司资金、公司对外担保情况的专项说明和独立意见,finalpage/2010-07-31/58243324.PDF
80,2010-08-04,海普瑞：关于网下配售股份上市流通的提示性公告,finalpage/2010-08-04/58258252.PDF
81,2010-09-14,海普瑞：第一届董事会第二十一次会议决议公告,finalpage/2010-09-14/58435333.PDF
82,2010-09-14,海普瑞：中国建银投资证券有限责任公司关于公司使用部分超额募集资金的保荐意见,finalpage/2010-09-14/58435335.PDF
83,2010-09-14,海普瑞：关于签署《募集资金三方监管协议之补充协议》的公告,finalpage/2010-09-14/58435336.PDF
84,2010-09-14,海普瑞：外部信息报送和使用管理制度（2010年9月）,finalpage/2010-09-14/58435337.PDF
85,2010-09-14,海普瑞：独立董事对《关于使用部分超募资金永久性补充公司流动资金的议案》的独立意见,finalpage/2010-09-14/58435338.PDF
86,2010-09-14,海普瑞：第一届监事会第十次会议决议公告,finalpage/2010-09-14/58435339.PDF
87,2010-09-14,海普瑞：关于在四川省成都市投资设立合资公司的公告,finalpage/2010-09-14/58435340.PDF
88,2010-09-14,海普瑞：关于在香港设立子公司的公告,finalpage/2010-09-14/58435341.PDF
89,2010-09-14,海普瑞：关于使用部分超募资金补充永久性流动资金的公告,finalpage/2010-09-14/58435342.PDF
90,2010-10-23,海普瑞：2010年第三季度报告正文,finalpage/2010-10-23/58560373.PDF
91,2010-10-23,海普瑞：2010年第三季度报告全文,finalpage/2010-10-23/58560374.PDF
92,2010-10-23,海普瑞：关于对成都深瑞畜产品有限公司增资的公告,finalpage/2010-10-23/58560376.PDF
93,2010-10-23,海普瑞：关于开展防止资金占用长效机制建立和落实情况的自查报告,finalpage/2010-10-23/58560377.PDF
94,2010-10-23,海普瑞：关于规范财务会计基础工作专项活动的自查和整改报告,finalpage/2010-10-23/58560379.PDF
95,2010-10-23,海普瑞：第一届董事会第二十二次会议决议公告,finalpage/2010-10-23/58560380.PDF
96,2010-10-23,海普瑞：财务管理制度（2010年10月）,finalpage/2010-10-23/58560381.PDF
97,2010-10-23,海普瑞：财务负责人管理制度（2010年10月）,finalpage/2010-10-23/58560382.PDF
98,2010-10-23,海普瑞：高级管理人员薪酬与绩效考核制度（2010年10月）,finalpage/2010-10-23/58560383.PDF
99,2010-11-13,海普瑞：关于控股子公司完成增资工商变更登记的公告,finalpage/2010-11-13/58659294.PDF
100,2010-11-26,海普瑞：关于设立香港子公司进展的公告,finalpage/2010-11-26/58710743.PDF
101,2010-12-09,海普瑞：关于投资设立成都市海通药业有限公司进展的公告,finalpage/2010-12-09/58764728.PDF
102,2010-12-21,海普瑞：关于监事会换届选举的提示性公告,finalpage/2010-12-21/58805960.PDF
103,2010-12-21,海普瑞：关于董事会换届选举的提示性公告,finalpage/2010-12-21/58805961.PDF
104,2011-01-11,海普瑞：独立董事提名人声明,finalpage/2011-01-11/58886195.PDF
105,2011-01-11,海普瑞：股东大会议事规则（2011年1月）,finalpage/2011-01-11/58886196.PDF
106,2011-01-11,海普瑞：董事会议事规则（2011年1月）,finalpage/2011-01-11/58886197.PDF
107,2011-01-11,海普瑞：中国建银投资证券有限责任公司关于《深圳市海普瑞药业股份有限公司关于公司专项治理的自查报告和整改计划》的核查意见,finalpage/2011-01-11/58886198.PDF
108,2011-01-11,海普瑞：监事会议事规则（2011年1月）,finalpage/2011-01-11/58886199.PDF
109,2011-01-11,海普瑞：关联交易决策制度（2011年1月）,finalpage/2011-01-11/58886200.PDF
110,2011-01-11,海普瑞：关于公司专项治理的自查报告和整改计划,finalpage/2011-01-11/58886201.PDF
111,2011-01-11,海普瑞：远期外汇交易业务内控管理制度（2011年1月）,finalpage/2011-01-11/58886202.PDF
112,2011-01-11,海普瑞：关于召开2011年第一次临时股东大会的通知公告,finalpage/2011-01-11/58886203.PDF
113,2011-01-11,海普瑞：独立董事关于第一届董事会第二十三次会议相关议案所发表的独立意见,finalpage/2011-01-11/58886204.PDF
114,2011-01-11,海普瑞：关于公司专项治理活动的自查事项说明,finalpage/2011-01-11/58886207.PDF
115,2011-01-11,海普瑞：独立董事候选人声明（周海梦）,finalpage/2011-01-11/58886208.PDF
116,2011-01-11,海普瑞：独立董事候选人声明（徐滨）,finalpage/2011-01-11/58886209.PDF
117,2011-01-11,海普瑞：独立董事候选人声明（解冻）,finalpage/2011-01-11/58886210.PDF
118,2011-01-11,海普瑞：第一届董事会第二十三次会议决议公告,finalpage/2011-01-11/58886211.PDF
119,2011-01-11,海普瑞：第一届监事会第十二次会议决议公告,finalpage/2011-01-11/58886212.PDF
120,2011-01-11,海普瑞：关于选举职工代表担任监事的职工代表大会决议公告,finalpage/2011-01-11/58886213.PDF
121,2011-02-17,海普瑞：2011年第一次临时股东大会决议公告,finalpage/2011-02-17/59008228.PDF
122,2011-02-17,海普瑞：2011年第一次临时股东大会的法律意见书,finalpage/2011-02-17/59008229.PDF
123,2011-02-17,海普瑞：信息披露事务管理制度（2011年2月）,finalpage/2011-02-17/59008231.PDF
124,2011-02-17,海普瑞：内幕信息知情人登记和报备制度（2011年2月）,finalpage/2011-02-17/59008232.PDF
125,2011-02-17,海普瑞：子公司管理制度（2011年2月）,finalpage/2011-02-17/59008233.PDF
126,2011-02-17,海普瑞：对外担保管理制度（2011年2月）,finalpage/2011-02-17/59008234.PDF
127,2011-02-17,海普瑞：投资者关系管理制度（2011年2月）,finalpage/2011-02-17/59008235.PDF
128,2011-02-17,海普瑞：敏感信息排查管理制度（2011年2月）,finalpage/2011-02-17/59008236.PDF
129,2011-02-17,海普瑞：独立董事关于第二届董事会第一次会议相关议案所发表的独立意见,finalpage/2011-02-17/59008237.PDF
130,2011-02-17,海普瑞：第二届监事会第一次会议决议公告,finalpage/2011-02-17/59008238.PDF
131,2011-02-17,海普瑞：第二届董事会第一次会议决议公告,finalpage/2011-02-17/59008239.PDF
132,2011-02-17,海普瑞：董事会专门委员会工作细则（2011年2月）,finalpage/2011-02-17/59008240.PDF
133,2011-02-17,海普瑞：重大信息内部报告制度（2011年2月）,finalpage/2011-02-17/59008241.PDF
134,2011-02-17,海普瑞：重大投资决策管理制度（2011年2月）,finalpage/2011-02-17/59008242.PDF
135,2011-02-26,海普瑞：2010年度业绩快报及利润分配预案公告,finalpage/2011-02-26/59049584.PDF
136,2011-03-28,海普瑞：独立董事2010年度述职报告,finalpage/2011-03-28/59177375.PDF
137,2011-03-28,海普瑞：2010年度财务决算报告,finalpage/2011-03-28/59177356.PDF
138,2011-03-28,海普瑞：关于2010年度关联交易执行情况及2011年预计关联交易事项的公告,finalpage/2011-03-28/59177357.PDF
139,2011-03-28,海普瑞：关于开展2011年远期外汇交易情况的公告,finalpage/2011-03-28/59177358.PDF
140,2011-03-28,海普瑞：公司章程（2011年3月）,finalpage/2011-03-28/59177359.PDF
141,2011-03-28,海普瑞：独立董事工作制度（2011年3月）,finalpage/2011-03-28/59177360.PDF
142,2011-03-28,海普瑞：董事、监事和高级管理人员薪酬与绩效考核制度（2011年3月）,finalpage/2011-03-28/59177361.PDF
143,2011-03-28,海普瑞：2010年年度报告摘要,finalpage/2011-03-28/59177362.PDF
144,2011-03-28,海普瑞：2010年年度审计报告,finalpage/2011-03-28/59177364.PDF
145,2011-03-28,海普瑞：第二届董事会第二次会议决议公告,finalpage/2011-03-28/59177365.PDF
146,2011-03-28,海普瑞：关于召开2010年年度股东大会的通知公告,finalpage/2011-03-28/59177366.PDF
147,2011-03-28,海普瑞：第二届监事会第二次会议决议公告,finalpage/2011-03-28/59177367.PDF
148,2011-03-28,海普瑞：关于公司2010年度控股股东及其他关联方占用资金情况的专项说明,finalpage/2011-03-28/59177368.PDF
149,2011-03-28,海普瑞：2010年年度报告,finalpage/2011-03-28/59177369.PDF
150,2011-03-28,海普瑞：董事会2010年度内部控制自我评价报告,finalpage/2011-03-28/59177370.PDF
151,2011-03-28,海普瑞：2010年度募集资金存放与使用情况的专项报告,finalpage/2011-03-28/59177372.PDF
152,2011-03-28,海普瑞：关于公司2010年度募集资金存放与使用情况的鉴证报告,finalpage/2011-03-28/59177373.PDF
153,2011-03-28,海普瑞：独立董事对第二届董事会第二次会议相关事项的独立意见,finalpage/2011-03-28/59177374.PDF
154,2011-03-28,海普瑞：中国建银投资证券有限责任公司关于公司2010年度内部控制自我评价报告的核查意见,finalpage/2011-03-28/59177376.PDF
155,2011-03-28,海普瑞：中国建银投资证券有限责任公司关于公司2010年度募集资金使用与存放情况的专项核查意见,finalpage/2011-03-28/59177377.PDF
156,2011-03-28,海普瑞：中国建银投资证券有限责任公司关于公司2010年度日常关联交易和预计2011年度关联交易等有关事项的核查意见,finalpage/2011-03-28/59177378.PDF
157,2011-03-28,海普瑞：关于控股股东及其他关联方占用资金情况的专项说明,finalpage/2011-03-28/59177380.PDF
158,2011-03-29,海普瑞：关于举行2010年度业绩网上说明会的公告,finalpage/2011-03-29/59189470.PDF
159,2011-04-18,海普瑞：2011年第一季度报告正文,finalpage/2011-04-18/59278047.PDF
160,2011-04-18,海普瑞：2011年第一季度报告全文,finalpage/2011-04-18/59278048.PDF
161,2011-04-18,海普瑞：第二届监事会第三次会议决议公告,finalpage/2011-04-18/59278049.PDF
162,2011-04-18,海普瑞：第二届董事会第三次会议决议公告,finalpage/2011-04-18/59278050.PDF
163,2011-04-18,海普瑞：关于在深圳市投资设立合资企业的公告,finalpage/2011-04-18/59278051.PDF
164,2011-04-18,海普瑞：独立董事关于在深圳市投资设立合资公司的独立意见,finalpage/2011-04-18/59278052.PDF
165,2011-04-19,海普瑞：2010年年度股东大会决议公告,finalpage/2011-04-19/59288678.PDF
166,2011-04-19,海普瑞：2010年年度股东大会的法律意见书,finalpage/2011-04-19/59288679.PDF
167,2011-04-21,海普瑞：2010年度权益分派实施公告,finalpage/2011-04-21/59304425.PDF
168,2011-04-22,海普瑞：股票交易异常波动公告,finalpage/2011-04-22/59312910.PDF
169,2011-05-04,海普瑞：中国建银投资证券有限责任公司关于公司限售股份上市流通事项的核查意见,finalpage/2011-05-04/59381128.PDF
170,2011-05-04,海普瑞：关于首次公开发行前已发行股份上市流通的提示性公告,finalpage/2011-05-04/59381129.PDF
171,2011-05-28,海普瑞：中国建银投资证券有限责任公司关于公司治理专项活动整改报告的核查意见,finalpage/2011-05-28/59485268.PDF
172,2011-05-28,海普瑞：关于公司治理专项活动的整改报告,finalpage/2011-05-28/59485269.PDF
173,2011-05-28,海普瑞：独立董事关于公司治理专项活动的整改报告的独立意见,finalpage/2011-05-28/59485270.PDF
174,2011-05-28,海普瑞：总经理工作细则（2011年5月）,finalpage/2011-05-28/59485271.PDF
175,2011-05-28,海普瑞：内部控制规范实施工作方案,finalpage/2011-05-28/59485272.PDF
176,2011-05-28,海普瑞：第二届监事会第四次会议决议公告,finalpage/2011-05-28/59485273.PDF
177,2011-05-28,海普瑞：第二届董事会第四次会议决议公告,finalpage/2011-05-28/59485274.PDF
178,2011-06-21,海普瑞：关于控股子公司设立进展的公告,finalpage/2011-06-21/59576344.PDF
179,2011-06-30,海普瑞：关于签订对外合作协议的公告,finalpage/2011-06-30/59613615.PDF
180,2011-07-15,海普瑞：关于完成工商变更登记的公告,finalpage/2011-07-15/59677507.PDF
181,2011-07-29,海普瑞：2011半年度业绩快报,finalpage/2011-07-29/59740609.PDF
182,2011-07-30,海普瑞：对外捐赠管理制度（2011年7月）,finalpage/2011-07-30/59747245.PDF
183,2011-07-30,海普瑞：第二届董事会第五次会议决议公告,finalpage/2011-07-30/59747246.PDF
184,2011-07-30,海普瑞：关于签署《募集资金三方监管协议之补充协议》的公告,finalpage/2011-07-30/59747247.PDF
185,2011-07-30,海普瑞：关于使用超额募集资金受让子公司部分股权的公告,finalpage/2011-07-30/59747248.PDF
186,2011-07-30,海普瑞：独立董事关于第二届董事会第五次会议相关议案的独立意见,finalpage/2011-07-30/59747249.PDF
187,2011-07-30,海普瑞：中国建银投资证券有限责任公司关于公司相关超额募集资金使用的核查意见,finalpage/2011-07-30/59747250.PDF
188,2011-07-30,海普瑞：第二届监事会第五次会议决议公告,finalpage/2011-07-30/59747251.PDF
189,2011-08-19,海普瑞：关于使用超额募集资金成立合资企业的公告,finalpage/2011-08-19/59838600.PDF
190,2011-08-19,海普瑞：关于使用超额募集资金对控股子公司进行增资的公告,finalpage/2011-08-19/59838601.PDF
191,2011-08-19,海普瑞：独立董事关于第二届董事会第六次会议相关议案的独立意见,finalpage/2011-08-19/59838602.PDF
192,2011-08-19,海普瑞：2011年半年度报告摘要（已取消）,finalpage/2011-08-19/59838603.PDF
193,2011-08-19,海普瑞：2011年半年度报告（已取消）,finalpage/2011-08-19/59838606.PDF
194,2011-08-19,海普瑞：2011年半年度财务报告,finalpage/2011-08-19/59838607.PDF
195,2011-08-19,海普瑞：第二届董事会第六次会议决议公告,finalpage/2011-08-19/59838608.PDF
196,2011-08-19,海普瑞：第二届监事会第六次会议决议公告,finalpage/2011-08-19/59838609.PDF
197,2011-08-19,海普瑞：独立董事关于对公司关联方资金往来及对外担保情况的独立意见,finalpage/2011-08-19/59838610.PDF
198,2011-08-19,海普瑞：中国建银投资证券有限责任公司关于公司有关超额募集资金使用事项的核查意见,finalpage/2011-08-19/59838611.PDF
199,2011-08-19,海普瑞：关于办公场所迁址的公告,finalpage/2011-08-19/59838612.PDF
200,2011-08-27,海普瑞：2011年半年度报告摘要（更新后）,finalpage/2011-08-27/59882224.PDF
201,2011-08-27,海普瑞：关于2011年半年度报告更正的公告,finalpage/2011-08-27/59882225.PDF
202,2011-08-27,海普瑞：2011年半年度报告（更新后）,finalpage/2011-08-27/59882226.PDF
203,2011-09-10,海普瑞：关于子公司完成股权变更工商备案的公告,finalpage/2011-09-10/59946097.PDF
204,2011-09-15,海普瑞：关于对全资子公司进行增资的公告,finalpage/2011-09-15/59957771.PDF
205,2011-09-15,海普瑞：独立董事关于第二届董事会第七次会议相关议案的独立意见,finalpage/2011-09-15/59957772.PDF
206,2011-09-15,海普瑞：第二届监事会第七次会议决议公告,finalpage/2011-09-15/59957773.PDF
207,2011-09-15,海普瑞：第二届董事会第七次会议决议公告,finalpage/2011-09-15/59957774.PDF
208,2011-09-30,海普瑞：中国建银投资证券有限责任公司关于公司内部控制规则落实情况自查表及整改计划的核查意见,finalpage/2011-09-30/60021718.PDF
209,2011-09-30,海普瑞：关于内部控制规则落实情况自查报告和整改计划,finalpage/2011-09-30/60021720.PDF
210,2011-09-30,海普瑞：第二届董事会第八次会议决议公告,finalpage/2011-09-30/60021721.PDF
211,2011-10-19,海普瑞：2011年第三季度报告正文,finalpage/2011-10-19/60074845.PDF
212,2011-10-19,海普瑞：2011年第三季度报告全文,finalpage/2011-10-19/60074848.PDF
213,2011-10-19,海普瑞：中国建银投资证券有限责任公司关于公司有关委托贷款事项的核查意见,finalpage/2011-10-19/60074849.PDF
214,2011-10-19,海普瑞：关于向控股子公司提供委托贷款的公告,finalpage/2011-10-19/60074850.PDF
215,2011-10-19,海普瑞：独立董事关于第二届董事会第九次会议相关议案的独立意见,finalpage/2011-10-19/60074851.PDF
216,2011-10-19,海普瑞：第二届董事会第九次会议决议公告,finalpage/2011-10-19/60074852.PDF
