,date,title,url
671,2015-10-20,华英农业：独立董事关于第五届董事会第十八次会议相关事项的独立意见,finalpage/2015-10-20/1201708821.PDF
672,2015-10-20,华英农业：独立董事关于第五届董事会第十八次会议相关事项的事前认可意见,finalpage/2015-10-20/1201708823.PDF
673,2015-10-20,华英农业：2015年度非公开发行股票预案（修订）,finalpage/2015-10-20/1201708827.PDF
674,2015-10-20,华英农业：2015年度员工持股计划（草案）（非公开发行方式认购）（修订）,finalpage/2015-10-20/1201708828.PDF
675,2015-10-20,华英农业：2015年度员工持股计划（草案）摘要（非公开发行方式认购）（修订）,finalpage/2015-10-20/1201708829.PDF
676,2015-10-20,华英农业：2015年度非公开发行股票募集资金使用可行性分析报告（修订）,finalpage/2015-10-20/1201708830.PDF
677,2015-10-20,华英农业：附条件生效的股份认购合同之补充合同,finalpage/2015-10-20/1201708831.PDF
678,2015-10-20,华英农业：附条件生效的股份认购合同之补充合同二,finalpage/2015-10-20/1201708832.PDF
679,2015-10-20,华英农业：中铁宝盈-宝益16号华英农业定向增发特定资产管理计划资产管理合同之补充合同,finalpage/2015-10-20/1201708833.PDF
680,2015-10-20,华英农业：2015年度非公开发行股票申请文件反馈意见的回复之补充说明,finalpage/2015-10-20/1201708834.PDF
681,2015-10-20,华英农业：第五届董事会第十八次会议决议公告,finalpage/2015-10-20/1201708835.PDF
682,2015-10-20,华英农业：第五届监事会第九次会议决议公告,finalpage/2015-10-20/1201708836.PDF
683,2015-10-20,华英农业：关于2015年度员工持股计划（草案）修订的公告,finalpage/2015-10-20/1201708837.PDF
684,2015-10-20,华英农业：关于《中铁宝盈-宝益16号华英农业定向增发特定资产管理计划资产管理合同》修订的公告,finalpage/2015-10-20/1201708838.PDF
685,2015-10-20,华英农业：关于2015年度非公开发行A股股票预案修订的公告,finalpage/2015-10-20/1201708839.PDF
686,2015-10-21,华英农业：关于对外投资设立深圳华英盛合投资管理有限公司的进展公告,finalpage/2015-10-21/1201709887.PDF
687,2015-10-22,华英农业：第五届董事会第十九次会议决议公告,finalpage/2015-10-22/1201713664.PDF
688,2015-10-22,华英农业：第五届监事会第十次会议决议公告,finalpage/2015-10-22/1201713665.PDF
689,2015-10-22,华英农业：2015年第三季度报告全文,finalpage/2015-10-22/1201713666.PDF
690,2015-10-22,华英农业：2015年第三季度报告正文,finalpage/2015-10-22/1201713667.PDF
691,2015-10-28,华英农业：关于收到政府补贴的公告（十）,finalpage/2015-10-28/1201732555.PDF
692,2015-10-31,华英农业：关于收到政府补贴的公告（十一）,finalpage/2015-10-31/1201744756.PDF
693,2015-10-31,华英农业：关于签署战略合作协议的公告,finalpage/2015-10-31/1201744757.PDF
694,2015-11-05,华英农业：关于非公开发行股票申请获得审核通过的公告,finalpage/2015-11-05/1201753926.PDF
695,2015-11-10,华英农业：关于对外投资设立独资子公司的进展公告,finalpage/2015-11-10/1201760717.PDF
696,2015-12-15,华英农业：关于非公开发行股票申请获得中国证监会核准批复的公告,finalpage/2015-12-15/1201833037.PDF
697,2016-01-04,华英农业：关于收到政府补贴的公告（十二）,finalpage/2016-01-04/1201883710.PDF
698,2016-01-11,华英农业：关于收到政府补贴的公告,finalpage/2016-01-11/1201904361.PDF
699,2016-01-16,华英农业：关于独立董事辞职的公告,finalpage/2016-01-16/1201919652.PDF
700,2016-01-19,华英农业：关于签订募集资金三方监管协议的公告,finalpage/2016-01-19/1201924063.PDF
701,2016-01-20,华英农业：非公开发行股票发行情况报告书暨上市公告书（摘要）,finalpage/2016-01-20/1201926707.PDF
702,2016-01-20,华英农业：非公开发行股票发行情况报告书暨上市公告书,finalpage/2016-01-20/1201926708.PDF
703,2016-01-20,华英农业：东兴证券股份有限公司关于公司非公开发行股票的上市保荐书,finalpage/2016-01-20/1201926709.PDF
704,2016-01-20,华英农业：东兴证券股份有限公司及华英证券有限责任公司关于公司非公开发行股票发行过程和认购对象合规性的报告,finalpage/2016-01-20/1201926710.PDF
705,2016-01-20,华英农业：北京大成律师事务所关于公司非公开发行A股股票发行合规性的法律意见书,finalpage/2016-01-20/1201926711.PDF
706,2016-01-27,华英农业：第五届董事会第二十次会议决议公告,finalpage/2016-01-27/1201943992.PDF
707,2016-01-27,华英农业：关于拟对外投资暨关联交易的公告,finalpage/2016-01-27/1201943993.PDF
708,2016-01-27,华英农业：关于拟增资河南华姿雪羽绒制品有限公司的公告,finalpage/2016-01-27/1201943994.PDF
709,2016-01-27,华英农业：关于拟投资收购股权的公告,finalpage/2016-01-27/1201943995.PDF
710,2016-01-27,华英农业：关于子公司开展融资租赁业务的公告,finalpage/2016-01-27/1201943996.PDF
711,2016-01-27,华英农业：关于为子公司提供担保的公告,finalpage/2016-01-27/1201943997.PDF
712,2016-01-27,华英农业：关于变更注册资本并修改《公司章程》的公告,finalpage/2016-01-27/1201943998.PDF
713,2016-01-27,华英农业：关于召开2016年第一次临时股东大会通知的公告,finalpage/2016-01-27/1201943999.PDF
714,2016-01-27,华英农业：公司章程（2016年1月）,finalpage/2016-01-27/1201944000.PDF
715,2016-01-27,华英农业：公司章程修订对照表,finalpage/2016-01-27/1201944001.PDF
716,2016-01-27,华英农业：独立董事对第五届董事会第二十次会议相关事项的独立意见,finalpage/2016-01-27/1201944002.PDF
717,2016-01-30,华英农业：关于股东增持公司股份的进展公告,finalpage/2016-01-30/1201954976.PDF
718,2016-02-04,华英农业：关于收到政府补贴的公告（一）,finalpage/2016-02-04/1201966338.PDF
719,2016-02-06,华英农业：关于股东进行股票质押融资的公告,finalpage/2016-02-06/1201979172.PDF
720,2016-02-16,华英农业：关于非公开发行股票发行情况报告书暨上市公告书及其摘要的更正公告,finalpage/2016-02-16/1201980924.PDF
721,2016-02-17,华英农业：2016年第一次临时股东大会的法律意见书,finalpage/2016-02-17/1201982165.PDF
722,2016-02-17,华英农业：2016年第一次临时股东大会决议公告,finalpage/2016-02-17/1201982166.PDF
723,2016-02-22,华英农业：关于收到政府补贴的公告（二）,finalpage/2016-02-22/1201989993.PDF
724,2016-02-27,华英农业：关于2015年度业绩预告修正公告,finalpage/2016-02-27/1202003602.PDF
725,2016-02-27,华英农业：2015年度业绩快报,finalpage/2016-02-27/1202003603.PDF
726,2016-03-17,华英农业：第五届董事会第二十一次会议决议公告,finalpage/2016-03-17/1202051252.PDF
727,2016-03-17,华英农业：关于向华夏银行股份有限公司郑州分行申请贷款的公告,finalpage/2016-03-17/1202051253.PDF
728,2016-03-19,华英农业：关于子公司签署搬迁补偿协议的公告,finalpage/2016-03-19/1202057761.PDF
729,2016-04-08,华英农业：关于公司控股股东及其他关联方资金占用情况汇总表的专项审核报告,finalpage/2016-04-08/1202150618.PDF
730,2016-04-08,华英农业：关于募集资金2015年度存放与实际使用情况的专项报告,finalpage/2016-04-08/1202150619.PDF
731,2016-04-08,华英农业：关于公司募集资金年度存放与实际使用情况的鉴证报告,finalpage/2016-04-08/1202150620.PDF
732,2016-04-08,华英农业：2015年年度审计报告,finalpage/2016-04-08/1202150621.PDF
733,2016-04-08,华英农业：2015年度内部控制评价报告,finalpage/2016-04-08/1202150622.PDF
734,2016-04-08,华英农业：内部控制审计报告,finalpage/2016-04-08/1202150623.PDF
735,2016-04-08,华英农业：关于聘任证券事务代表的公告,finalpage/2016-04-08/1202150624.PDF
736,2016-04-08,华英农业：2015年度独立董事述职报告（孟素荷）,finalpage/2016-04-08/1202150625.PDF
737,2016-04-08,华英农业：2015年度独立董事述职报告（潘克勤）,finalpage/2016-04-08/1202150626.PDF
738,2016-04-08,华英农业：2015年度独立董事述职报告（赵虎林）,finalpage/2016-04-08/1202150627.PDF
739,2016-04-08,华英农业：第五届监事会第十一次会议决议公告,finalpage/2016-04-08/1202150628.PDF
740,2016-04-08,华英农业：关于补选非独立董事的公告,finalpage/2016-04-08/1202150629.PDF
741,2016-04-08,华英农业：关于举行2015年度业绩网上说明会的公告,finalpage/2016-04-08/1202150630.PDF
742,2016-04-08,华英农业：独立董事对第五届董事会第二十二次会议相关事项的独立意见,finalpage/2016-04-08/1202150631.PDF
743,2016-04-08,华英农业：独立董事关于第五届董事会第二十二次会议相关事项的事前认可意见,finalpage/2016-04-08/1202150632.PDF
744,2016-04-08,华英农业：2015年年度报告摘要,finalpage/2016-04-08/1202150634.PDF
745,2016-04-08,华英农业：2015年年度报告,finalpage/2016-04-08/1202150635.PDF
746,2016-04-08,华英农业：第五届董事会第二十二次会议决议公告,finalpage/2016-04-08/1202150636.PDF
747,2016-04-08,华英农业：关于召开2015年度股东大会通知的公告,finalpage/2016-04-08/1202150637.PDF
748,2016-04-14,华英农业：关于举行2015年度业绩网上说明会的补充公告,finalpage/2016-04-14/1202174575.PDF
749,2016-04-22,华英农业：2016年第一季度报告正文,finalpage/2016-04-22/1202219436.PDF
750,2016-04-22,华英农业：2016年第一季度报告全文,finalpage/2016-04-22/1202219438.PDF
751,2016-04-22,华英农业：第五届董事会第二十三次会议决议公告,finalpage/2016-04-22/1202219439.PDF
752,2016-04-22,华英农业：第五届监事会第十二次会议决议公告,finalpage/2016-04-22/1202219440.PDF
753,2016-04-22,华英农业：关于公司投资兴建江西丰城项目的公告,finalpage/2016-04-22/1202219441.PDF
754,2016-04-22,华英农业：关于对外投资设立控股子公司的公告（一）,finalpage/2016-04-22/1202219442.PDF
755,2016-04-22,华英农业：关于对外投资设立控股子公司的公告（二）,finalpage/2016-04-22/1202219443.PDF
756,2016-04-22,华英农业：关于对外投资设立子公司的公告,finalpage/2016-04-22/1202219444.PDF
757,2016-04-28,华英农业：关于对外投资暨关联交易的进展公告,finalpage/2016-04-28/1202259653.PDF
758,2016-04-30,华英农业：2015年度股东大会决议公告,finalpage/2016-04-30/1202282186.PDF
759,2016-04-30,华英农业：2015年度股东大会的法律意见书,finalpage/2016-04-30/1202283520.PDF
760,2016-05-13,华英农业：关于前次募集资金投资项目进展情况的公告,finalpage/2016-05-13/1202319018.PDF
761,2016-05-14,华英农业：关于收到政府补贴的公告（三）,finalpage/2016-05-14/1202320596.PDF
762,2016-05-18,华英农业：关于收到政府补贴的公告（四）,finalpage/2016-05-18/1202326997.PDF
763,2016-05-19,华英农业：关于收到政府补贴的公告（五）,finalpage/2016-05-19/1202328362.PDF
764,2016-05-20,华英农业：第五届董事会第二十四次会议决议公告,finalpage/2016-05-20/1202330864.PDF
765,2016-05-20,华英农业：第五届监事会第十三次会议决议公告,finalpage/2016-05-20/1202330865.PDF
766,2016-05-20,华英农业：关于非公开发行公司债券的公告,finalpage/2016-05-20/1202330866.PDF
767,2016-05-20,华英农业：关于部分变更前次募集资金用途的公告,finalpage/2016-05-20/1202330867.PDF
768,2016-05-20,华英农业：关于对外投资设立控股子公司的公告,finalpage/2016-05-20/1202330868.PDF
769,2016-05-20,华英农业：关于补选独立董事的公告,finalpage/2016-05-20/1202330869.PDF
770,2016-05-20,华英农业：关于召开2016年第二次临时股东大会通知的公告,finalpage/2016-05-20/1202330870.PDF
771,2016-05-20,华英农业：关于董事辞职的公告,finalpage/2016-05-20/1202330871.PDF
772,2016-05-20,华英农业：东兴证券股份有限公司关于公司拟变更部分募集资金用途的核查意见,finalpage/2016-05-20/1202330872.PDF
773,2016-05-20,华英农业：独立董事对第五届董事会第二十四次会议相关事项的独立意见,finalpage/2016-05-20/1202330873.PDF
774,2016-05-20,华英农业：独立董事候选人声明（朱虎平）,finalpage/2016-05-20/1202330874.PDF
775,2016-05-20,华英农业：独立董事提名人声明,finalpage/2016-05-20/1202330875.PDF
776,2016-05-20,华英农业：关于深圳证券交易所问询函的回复公告,finalpage/2016-05-20/1202330936.PDF
777,2016-06-01,华英农业：关于对外投资设立控股子公司的进展公告,finalpage/2016-06-01/1202350179.PDF
778,2016-06-01,华英农业：关于深圳证券交易所对公司2015年年报问询函回函的公告,finalpage/2016-06-01/1202350180.PDF
779,2016-06-07,华英农业：2016年第二次临时股东大会的法律意见书,finalpage/2016-06-07/1202358161.PDF
780,2016-06-07,华英农业：2016年第二次临时股东大会决议公告,finalpage/2016-06-07/1202358162.PDF
781,2016-06-13,华英农业：关于对外投资设立子公司的进展公告,finalpage/2016-06-13/1202365651.PDF
782,2016-06-21,华英农业：关于非公开发行股票摊薄即期回报及采取填补措施的公告,finalpage/2016-06-21/1202378412.PDF
783,2016-06-21,华英农业：关于公司开展融资租赁业务的公告,finalpage/2016-06-21/1202378413.PDF
784,2016-06-21,华英农业：关于最近五年被证券监管部门和交易所采取监管措施或处罚的公告,finalpage/2016-06-21/1202378414.PDF
785,2016-06-21,华英农业：独立董事关于第五届董事会第二十五次会议相关事项的独立意见,finalpage/2016-06-21/1202378415.PDF
786,2016-06-21,华英农业：关于公司前次募集资金使用情况的鉴证报告,finalpage/2016-06-21/1202378416.PDF
787,2016-06-21,华英农业：董事、高级管理人员关于非公开发行股票摊薄即期回报采取填补措施的承诺,finalpage/2016-06-21/1202378417.PDF
788,2016-06-21,华英农业：拟对外合作项目涉及的杭州萧山新塘羽绒有限公司、杭州金弘三鸟羽绒制品有限公司、浙江金弘羽绒制品有限公司部分资产评估报告,finalpage/2016-06-21/1202378418.PDF
789,2016-06-21,华英农业：第五届董事会第二十五次会议决议的公告,finalpage/2016-06-21/1202378420.PDF
790,2016-06-21,华英农业：第五届监事会第十四次会议决议公告,finalpage/2016-06-21/1202378421.PDF
791,2016-06-21,华英农业：关于对外投资收购股权的公告,finalpage/2016-06-21/1202378422.PDF
792,2016-06-21,华英农业：非公开发行A股股票募集资金运用的可行性分析报告,finalpage/2016-06-21/1202378423.PDF
793,2016-06-21,华英农业：2016年度非公开发行A股股票预案,finalpage/2016-06-21/1202378424.PDF
794,2016-06-21,华英农业：控股股东关于非公开发行股票摊薄即期回报采取填补措施的承诺,finalpage/2016-06-21/1202378425.PDF
795,2016-07-12,华英农业：关于2016年半年度业绩预告修正公告,finalpage/2016-07-12/1202466219.PDF
796,2016-07-15,华英农业：关于收到政府补贴的公告（六）,finalpage/2016-07-15/1202476586.PDF
797,2016-07-20,华英农业：关于收到政府补贴的公告（七）,finalpage/2016-07-20/1202492181.PDF
798,2016-07-30,华英农业：2016年半年度业绩快报,finalpage/2016-07-30/1202518276.PDF
799,2016-08-08,华英农业：关于收到政府补贴的公告（八）,finalpage/2016-08-08/1202545307.PDF
800,2016-08-12,华英农业：第五届监事会第十五次会议决议公告,finalpage/2016-08-12/1202559885.PDF
801,2016-08-12,华英农业：独立董事关于控股股东及其他关联方占用公司资金、公司对外担保情况的专项说明和独立意见,finalpage/2016-08-12/1202559886.PDF
802,2016-08-12,华英农业：关于终止向华姿雪增资的公告,finalpage/2016-08-12/1202559887.PDF
803,2016-08-12,华英农业：2016年半年度财务报告,finalpage/2016-08-12/1202559888.PDF
804,2016-08-12,华英农业：2016年半年度报告摘要,finalpage/2016-08-12/1202559890.PDF
805,2016-08-12,华英农业：2016年半年度报告（已取消）,finalpage/2016-08-12/1202559892.PDF
806,2016-08-12,华英农业：2016年半年度募集资金存放与实际使用情况的专项报告,finalpage/2016-08-12/1202559893.PDF
807,2016-08-12,华英农业：投资者投诉处理工作制度（2016年8月）,finalpage/2016-08-12/1202559894.PDF
808,2016-08-12,华英农业：第五届董事会第二十六次会议决议公告,finalpage/2016-08-12/1202559895.PDF
809,2016-08-12,华英农业：关于对外投资设立控股子公司的公告,finalpage/2016-08-12/1202559896.PDF
810,2016-08-24,华英农业：关于公司董事、高管、监事会主席减持公司股份的公告,finalpage/2016-08-24/1202610094.PDF
811,2016-09-09,华英农业：关于收到政府补贴的公告（九）,finalpage/2016-09-09/1202687793.PDF
812,2016-09-13,华英农业：关于董事会秘书辞职的公告,finalpage/2016-09-13/1202695649.PDF
813,2016-09-23,华英农业：关于收到2016年非公开发行公司债券符合深交所转让条件的无异议函的公告,finalpage/2016-09-23/1202720498.PDF
814,2016-09-27,华英农业：第五届董事会第二十七次会议决议公告,finalpage/2016-09-27/1202727578.PDF
815,2016-09-27,华英农业：关于拟开展商品期货套期保值业务的公告,finalpage/2016-09-27/1202727579.PDF
816,2016-09-27,华英农业：关于聘任副总经理、董事会秘书的公告,finalpage/2016-09-27/1202727580.PDF
817,2016-09-27,华英农业：东兴证券股份有限公司关于公司开展商品期货套期保值业务的核查意见,finalpage/2016-09-27/1202727581.PDF
818,2016-09-27,华英农业：独立董事对第五届董事会第二十七次会议相关事项的独立意见,finalpage/2016-09-27/1202727582.PDF
819,2016-09-27,华英农业：商品期货套期保值业务管理制度（2016年9月）,finalpage/2016-09-27/1202727583.PDF
820,2016-09-27,华英农业：关于召开2016年第三次临时股东大会通知的公告,finalpage/2016-09-27/1202727584.PDF
821,2016-09-27,华英农业：关于出资参股设立商业保理公司的公告,finalpage/2016-09-27/1202727585.PDF
822,2016-09-27,华英农业：关于对外投资收购股权的公告,finalpage/2016-09-27/1202727586.PDF
823,2016-09-27,华英农业：关于公司开展融资租赁业务的公告,finalpage/2016-09-27/1202727587.PDF
824,2016-10-13,华英农业：2016年第三次临时股东大会决议公告,finalpage/2016-10-13/1202754572.PDF
825,2016-10-13,华英农业：2016年第三次临时股东大会的法律意见书,finalpage/2016-10-13/1202754573.PDF
826,2016-10-14,华英农业：关于收到政府补贴的公告（十）,finalpage/2016-10-14/1202759021.PDF
827,2016-10-22,华英农业：2016年第三季度报告正文,finalpage/2016-10-22/1202775904.PDF
828,2016-10-22,华英农业：2016年第三季度报告全文,finalpage/2016-10-22/1202775907.PDF
829,2016-10-22,华英农业：第五届董事会第二十九次会议决议公告,finalpage/2016-10-22/1202775908.PDF
830,2016-10-22,华英农业：第五届监事会第十六次会议决议公告,finalpage/2016-10-22/1202775909.PDF
831,2016-10-27,华英农业：关于2016年半年度报告全文的更正公告,finalpage/2016-10-27/1202793357.PDF
832,2016-10-27,华英农业：2016年半年度报告（更新后）,finalpage/2016-10-27/1202793358.PDF
833,2016-11-10,华英农业：关于签订股权转让框架协议的公告,finalpage/2016-11-10/1202822760.PDF
834,2016-11-10,华英农业：关于公司与成都丰丰食品有限公司及自然人张忠伟签订合作框架协议的公告,finalpage/2016-11-10/1202822761.PDF
835,2016-11-10,华英农业：关于股东股权解除质押及再质押的公告,finalpage/2016-11-10/1202822762.PDF
836,2016-11-10,华英农业：关于终止《股权转让合同》的公告,finalpage/2016-11-10/1202822393.PDF
837,2016-11-18,华英农业：关于收到政府补贴的公告（十一）,finalpage/2016-11-18/1202834117.PDF
838,2016-11-29,华英农业：关于拟对外投资设立控股子公司的公告（一）,finalpage/2016-11-29/1202847538.PDF
839,2016-11-29,华英农业：关于拟对外投资设立控股子公司的公告（二）,finalpage/2016-11-29/1202847539.PDF
840,2016-11-29,华英农业：关于公司拟开展融资租赁业务的公告,finalpage/2016-11-29/1202847540.PDF
841,2016-11-29,华英农业：关于召开2016年第四次临时股东大会通知的公告,finalpage/2016-11-29/1202847541.PDF
842,2016-11-29,华英农业：对外担保管理制度（2016年11月）,finalpage/2016-11-29/1202847542.PDF
843,2016-11-29,华英农业：重大经营与投资决策管理制度（2016年11月）,finalpage/2016-11-29/1202847543.PDF
844,2016-11-29,华英农业：总经理工作细则（2016年11月）,finalpage/2016-11-29/1202847544.PDF
845,2016-11-29,华英农业：第五届董事会第三十次会议决议公告,finalpage/2016-11-29/1202847545.PDF
846,2016-12-03,华英农业：关于收到政府补贴的公告（十二）,finalpage/2016-12-03/1202855484.PDF
847,2016-12-07,华英农业：关于对外投资设立控股子公司的进展公告,finalpage/2016-12-07/1202861396.PDF
848,2016-12-08,华英农业：关于收到政府补贴的公告（十三）,finalpage/2016-12-08/1202863717.PDF
849,2016-12-16,华英农业：2016年第四次临时股东大会决议公告,finalpage/2016-12-16/1202877303.PDF
850,2016-12-16,华英农业：2016年第四次临时股东大会的法律意见书,finalpage/2016-12-16/1202878186.PDF
851,2016-12-31,华英农业：东兴证券股份有限公司关于公司2016年度定期现场检查报告,finalpage/2016-12-31/1202981556.PDF
852,2016-12-31,华英农业：东兴证券股份有限公司关于公司2016年度现场培训报告情况,finalpage/2016-12-31/1202981557.PDF
853,2017-01-04,华英农业：关于收到政府补贴的公告（一）,finalpage/2017-01-04/1202985970.PDF
854,2017-01-07,华英农业：关于对外投资设立控股子公司的进展公告,finalpage/2017-01-07/1202997135.PDF
855,2017-01-13,华英农业：关于收到政府补贴的公告（二）,finalpage/2017-01-13/1203013855.PDF
856,2017-01-16,华英农业：关于收到政府补贴的公告（三）,finalpage/2017-01-16/1203018410.PDF
857,2017-01-23,华英农业：关于公司拟开展融资租赁业务的公告,finalpage/2017-01-23/1203039380.PDF
858,2017-01-25,华英农业：2016年度业绩预告修正公告,finalpage/2017-01-25/1203050780.PDF
859,2017-01-26,华英农业：关于公司与自然人张兴坤、张兴华签订《合作框架协议》的公告,finalpage/2017-01-26/1203057173.PDF
860,2017-02-09,华英农业：第五届董事会第三十一次会议决议公告,finalpage/2017-02-09/1203071070.PDF
861,2017-02-09,华英农业：关于为控股子公司提供担保的公告,finalpage/2017-02-09/1203071071.PDF
862,2017-02-09,华英农业：关于召开2017年第一次临时股东大会通知的公告,finalpage/2017-02-09/1203071072.PDF
863,2017-02-09,华英农业：独立董事对第五届董事会第三十一次会议相关事项的独立意见,finalpage/2017-02-09/1203071073.PDF
864,2017-02-09,华英农业：关于对外投资设立控股子公司的进展公告,finalpage/2017-02-09/1203071074.PDF
865,2017-02-28,华英农业：2016年度业绩快报,finalpage/2017-02-28/1203112366.PDF
866,2017-02-28,华英农业：2017年第一次临时股东大会的法律意见书,finalpage/2017-02-28/1203112367.PDF
867,2017-02-28,华英农业：2017年第一次临时股东大会决议公告,finalpage/2017-02-28/1203112368.PDF
868,2017-03-11,华英农业：关于董事会、监事会延期换届选举的公告,finalpage/2017-03-11/1203149758.PDF
869,2017-03-11,华英农业：关于董事会换届选举的提示性公告,finalpage/2017-03-11/1203149759.PDF
870,2017-03-11,华英农业：关于监事会换届选举的提示性公告,finalpage/2017-03-11/1203149760.PDF
871,2017-03-14,华英农业：第五届董事会第三十二次会议决议公告,finalpage/2017-03-14/1203154886.PDF
872,2017-03-14,华英农业：独立董事对第五届董事会第三十二次会议相关事项的独立意见,finalpage/2017-03-14/1203154887.PDF
873,2017-03-14,华英农业：关于为控股子公司提供担保的公告,finalpage/2017-03-14/1203154888.PDF
874,2017-03-24,华英农业：关于更换持续督导保荐代表人的公告,finalpage/2017-03-24/1203191494.PDF
875,2017-03-28,华英农业：独立董事对第五届董事会第三十三次会议相关事项的独立意见,finalpage/2017-03-28/1203211789.PDF
876,2017-03-28,华英农业：2016年度独立董事述职报告（孟素荷）,finalpage/2017-03-28/1203211790.PDF
877,2017-03-28,华英农业：2016年度内部控制评价报告,finalpage/2017-03-28/1203211791.PDF
878,2017-03-28,华英农业：关于募集资金年度存放与实际使用情况的专项报告,finalpage/2017-03-28/1203211792.PDF
879,2017-03-28,华英农业：关于公司拟开展融资租赁业务的公告（一）,finalpage/2017-03-28/1203211793.PDF
880,2017-03-28,华英农业：关于公司拟开展融资租赁业务的公告（二）,finalpage/2017-03-28/1203211794.PDF
881,2017-03-28,华英农业：2016年度财务报告,finalpage/2017-03-28/1203211795.PDF
882,2017-03-28,华英农业：独立董事候选人声明（朱虎平）,finalpage/2017-03-28/1203211796.PDF
