,date,title,url
217,2011-11-03,海普瑞：关于向控股子公司提供委托贷款的进展公告,finalpage/2011-11-03/60154031.PDF
218,2011-11-03,海普瑞：关于控股子公司完成增资工商变更登记的公告,finalpage/2011-11-03/60154032.PDF
219,2011-12-01,海普瑞：关于公司高级管理人员辞职的公告,finalpage/2011-12-01/60265629.PDF
220,2011-12-01,海普瑞：关于投资设立合资企业进展的公告,finalpage/2011-12-01/60265630.PDF
221,2011-12-17,海普瑞：关于更换保荐代表人的公告,finalpage/2011-12-17/60336154.PDF
222,2011-12-20,海普瑞：停牌公告,finalpage/2011-12-20/60343588.PDF
223,2011-12-21,海普瑞：关于内部控制规则落实情况整改完成的公告,finalpage/2011-12-21/60348573.PDF
224,2011-12-21,海普瑞：关于对控股子公司进行增资的公告,finalpage/2011-12-21/60348574.PDF
225,2011-12-21,海普瑞：北京市中伦律师事务所关于公司股权激励计划的法律意见书,finalpage/2011-12-21/60348575.PDF
226,2011-12-21,海普瑞：华英证券有限责任公司关于《深圳市海普瑞药业股份有限公司股票期权激励计划（草案）》之独立财务顾问报告,finalpage/2011-12-21/60348576.PDF
227,2011-12-21,海普瑞：股票期权激励计划（草案）,finalpage/2011-12-21/60348577.PDF
228,2011-12-21,海普瑞：股票期权激励计划（草案）摘要,finalpage/2011-12-21/60348578.PDF
229,2011-12-21,海普瑞：独立董事关于公司股票期权激励计划（草案）的独立意见,finalpage/2011-12-21/60348579.PDF
230,2011-12-21,海普瑞：第二届监事会第九次会议决议公告,finalpage/2011-12-21/60348580.PDF
231,2011-12-21,海普瑞：第二届董事会第十次会议决议公告,finalpage/2011-12-21/60348581.PDF
232,2011-12-21,海普瑞：股票期权激励计划实施考核办法（2011年12月）,finalpage/2011-12-21/60348582.PDF
233,2011-12-21,海普瑞：股票期权激励计划激励对象名单,finalpage/2011-12-21/60348583.PDF
234,2012-01-10,海普瑞：关于控股股东完成增持公司股份的公告,finalpage/2012-01-10/60424390.PDF
235,2012-01-11,海普瑞：关于控股子公司完成增资工商变更登记的公告,finalpage/2012-01-11/60429043.PDF
236,2012-01-14,海普瑞：关于证监会确认股权激励计划（草案）无异议并备案的公告,finalpage/2012-01-14/60443387.PDF
237,2012-02-11,海普瑞：中国中投证券有限责任公司关于公司调整募集资金投资项目投资进度有关事项的核查意见,finalpage/2012-02-11/60529215.PDF
238,2012-02-11,海普瑞：中国中投证券有限责任公司关于公司预计2012年度关联交易有关事项的核查意见,finalpage/2012-02-11/60529216.PDF
239,2012-02-11,海普瑞：关于召开2012年第一次临时股东大会的通知公告,finalpage/2012-02-11/60529217.PDF
240,2012-02-11,海普瑞：北京市中伦律师事务所关于公司股权激励计划的法律意见书,finalpage/2012-02-11/60529218.PDF
241,2012-02-11,海普瑞：北京市中伦律师事务所关于公司股票期权激励计划的补充法律意见书,finalpage/2012-02-11/60529219.PDF
242,2012-02-11,海普瑞：关于调整募投项目投资进度的公告,finalpage/2012-02-11/60529221.PDF
243,2012-02-11,海普瑞：关联交易决策制度（2012年2月）,finalpage/2012-02-11/60529222.PDF
244,2012-02-11,海普瑞：内幕信息知情人登记管理制度（2012年2月）,finalpage/2012-02-11/60529223.PDF
245,2012-02-11,海普瑞：关于《深圳市海普瑞药业股份有限公司股票期权激励计划(草案)修订稿》之独立财务顾问报告,finalpage/2012-02-11/60529224.PDF
246,2012-02-11,海普瑞：2012年度预计日常关联交易公告,finalpage/2012-02-11/60529225.PDF
247,2012-02-11,海普瑞：股票期权激励计划（草案）修订稿,finalpage/2012-02-11/60529226.PDF
248,2012-02-11,海普瑞：股票期权激励计划（草案）修订稿摘要,finalpage/2012-02-11/60529227.PDF
249,2012-02-11,海普瑞：独立董事公开征集委托投票权报告书,finalpage/2012-02-11/60529228.PDF
250,2012-02-11,海普瑞：独立董事关于2012年度日常关联交易预计事项之事前认可意见,finalpage/2012-02-11/60529229.PDF
251,2012-02-11,海普瑞：独立董事关于第二届董事会第十一次会议相关事项的独立意见,finalpage/2012-02-11/60529230.PDF
252,2012-02-11,海普瑞：第二届监事会第十次会议决议公告,finalpage/2012-02-11/60529231.PDF
253,2012-02-11,海普瑞：第二届董事会第十一次会议决议公告,finalpage/2012-02-11/60529232.PDF
254,2012-02-18,海普瑞：2011年度业绩快报,finalpage/2012-02-18/60556208.PDF
255,2012-03-07,海普瑞：关于全资子公司完成增资变更注册的公告,finalpage/2012-03-07/60634077.PDF
256,2012-03-08,海普瑞：2012年第一次临时股东大会决议公告,finalpage/2012-03-08/60640273.PDF
257,2012-03-08,海普瑞：2012年第一次临时股东大会的法律意见书,finalpage/2012-03-08/60640274.PDF
258,2012-03-20,海普瑞：关于取得发明专利证书的公告,finalpage/2012-03-20/60692200.PDF
259,2012-03-28,海普瑞：2011年度独立董事履行职责情况报告,finalpage/2012-03-28/60740373.PDF
260,2012-03-28,海普瑞：2011年度财务决算报告,finalpage/2012-03-28/60740374.PDF
261,2012-03-28,海普瑞：2011年年度报告摘要,finalpage/2012-03-28/60740375.PDF
262,2012-03-28,海普瑞：2011年年度审计报告,finalpage/2012-03-28/60740377.PDF
263,2012-03-28,海普瑞：第二届董事会第十二次会议决议公告,finalpage/2012-03-28/60740378.PDF
264,2012-03-28,海普瑞：关于召开2011年年度股东大会的通知公告,finalpage/2012-03-28/60740379.PDF
265,2012-03-28,海普瑞：第二届监事会第十一次会议决议公告,finalpage/2012-03-28/60740380.PDF
266,2012-03-28,海普瑞：关于公司2011年度控股股东及其他关联方占用资金情况的专项说明,finalpage/2012-03-28/60740381.PDF
267,2012-03-28,海普瑞：2011年年度报告,finalpage/2012-03-28/60740382.PDF
268,2012-03-28,海普瑞：2011年度内部控制自我评价报告,finalpage/2012-03-28/60740383.PDF
269,2012-03-28,海普瑞：内部控制鉴证报告,finalpage/2012-03-28/60740384.PDF
270,2012-03-28,海普瑞：2011年度募集资金存放与使用情况的专项报告,finalpage/2012-03-28/60740385.PDF
271,2012-03-28,海普瑞：关于公司2011年度募集资金存放与使用情况的鉴证报告,finalpage/2012-03-28/60740386.PDF
272,2012-03-28,海普瑞：独立董事关于第二届董事会第十二次会议相关事项的独立意见,finalpage/2012-03-28/60740387.PDF
273,2012-03-28,海普瑞：独立董事2011年度述职报告（周海梦）,finalpage/2012-03-28/60740388.PDF
274,2012-03-28,海普瑞：中国中投证券有限责任公司关于公司2011年度内部控制自我评价报告的核查意见,finalpage/2012-03-28/60740389.PDF
275,2012-03-28,海普瑞：中国中投证券有限责任公司关于公司2011年度募集资金存放与使用情况的核查意见,finalpage/2012-03-28/60740390.PDF
276,2012-03-28,海普瑞：关于举行2011年年度报告网上说明会的公告,finalpage/2012-03-28/60740391.PDF
277,2012-03-28,海普瑞：关于开展2012年远期外汇交易情况的公告,finalpage/2012-03-28/60740392.PDF
278,2012-03-28,海普瑞：中国中投证券有限责任公司关于公司2012年度拟继续租赁关联方物业作为办公场所的核查意见,finalpage/2012-03-28/60740393.PDF
279,2012-03-28,海普瑞：关于无偿租用关联方物业的公告,finalpage/2012-03-28/60740394.PDF
280,2012-03-28,海普瑞：中国中投证券有限责任公司关于公司拟开展2012年度远期外汇交易的核查意见,finalpage/2012-03-28/60740395.PDF
281,2012-03-28,海普瑞：独立董事2011年度述职报告（徐滨）,finalpage/2012-03-28/60740396.PDF
282,2012-03-28,海普瑞：独立董事2011年度述职报告（解冻）,finalpage/2012-03-28/60740397.PDF
283,2012-03-28,海普瑞：董事会关于审计机构2011年度审计工作的总结报告,finalpage/2012-03-28/60740398.PDF
284,2012-04-13,海普瑞：关于增加信息披露指定媒体的公告,finalpage/2012-04-13/60822844.PDF
285,2012-04-21,海普瑞：2011年年度股东大会决议公告,finalpage/2012-04-21/60870943.PDF
286,2012-04-21,海普瑞：关于控股股东撤回豁免要约收购申请文件的公告,finalpage/2012-04-21/60870944.PDF
287,2012-04-21,海普瑞：2011年年度股东大会的法律意见书,finalpage/2012-04-21/60870945.PDF
288,2012-04-24,海普瑞：2012年第一季度报告正文,finalpage/2012-04-24/60888791.PDF
289,2012-04-24,海普瑞：2012年第一季度报告全文,finalpage/2012-04-24/60888795.PDF
290,2012-04-24,海普瑞：第二届董事会第十三次会议决议公告,finalpage/2012-04-24/60888797.PDF
291,2012-04-24,海普瑞：中国中投证券有限责任公司关于公司向控股子公司提供委托贷款事项的核查意见,finalpage/2012-04-24/60888798.PDF
292,2012-04-24,海普瑞：关于向控股子公司提供委托贷款的公告,finalpage/2012-04-24/60888799.PDF
293,2012-04-24,海普瑞：关于签订《募集资金三方监管协议》的公告,finalpage/2012-04-24/60888800.PDF
294,2012-04-24,海普瑞：独立董事关于第二届董事会第十三次会议相关事项的独立意见,finalpage/2012-04-24/60888801.PDF
295,2012-04-26,海普瑞：关于股票期权激励计划授予相关事项公告,finalpage/2012-04-26/60912515.PDF
296,2012-04-26,海普瑞：关于股票期权激励计划预留期权授予的公告,finalpage/2012-04-26/60912517.PDF
297,2012-04-26,海普瑞：内部控制审计报告,finalpage/2012-04-26/60912518.PDF
298,2012-04-26,海普瑞：独立董事关于第二届董事会第十四次会议相关事项的独立意见,finalpage/2012-04-26/60912519.PDF
299,2012-04-26,海普瑞：第二届监事会第十三次会议决议公告,finalpage/2012-04-26/60912520.PDF
300,2012-04-26,海普瑞：第二届董事会第十四次会议决议公告,finalpage/2012-04-26/60912521.PDF
301,2012-04-26,海普瑞：北京市中伦律师事务所关于公司股票期权激励计划期权授予相关事项的法律意见书,finalpage/2012-04-26/60912522.PDF
302,2012-04-26,海普瑞：股票期权激励计划激励对象名单,finalpage/2012-04-26/60912523.PDF
303,2012-04-26,海普瑞：北京市中伦律师事务所关于公司股票期权激励计划预留股票期权授予相关事项的法律意见书,finalpage/2012-04-26/60912524.PDF
304,2012-04-26,海普瑞：预留股票期权的激励对象名单,finalpage/2012-04-26/60912525.PDF
305,2012-05-03,海普瑞：2011年度权益分派实施公告,finalpage/2012-05-03/60942267.PDF
306,2012-05-03,海普瑞：关于向控股子公司提供委托贷款的进展公告,finalpage/2012-05-03/60942268.PDF
307,2012-05-03,海普瑞：关于收到控股子公司归还委托贷款的公告,finalpage/2012-05-03/60942269.PDF
308,2012-05-17,海普瑞：关于股票期权授予登记完成的公告,finalpage/2012-05-17/61007170.PDF
309,2012-05-31,海普瑞：中国中投证券有限责任公司关于公司拟以超募资金受让子公司股权有关事项的核查意见,finalpage/2012-05-31/61068125.PDF
310,2012-05-31,海普瑞：关于使用超额募集资金受让控股子公司部分股权的公告,finalpage/2012-05-31/61068126.PDF
311,2012-05-31,海普瑞：独立董事关于第二届董事会第十五次会议相关事项的独立意见,finalpage/2012-05-31/61068127.PDF
312,2012-05-31,海普瑞：第二届监事会第十四次会议决议公告,finalpage/2012-05-31/61068128.PDF
313,2012-05-31,海普瑞：第二届董事会第十五次会议决议公告,finalpage/2012-05-31/61068129.PDF
314,2012-06-09,海普瑞：关于控股子公司成都深瑞畜产品有限公司投产的公告,finalpage/2012-06-09/61115005.PDF
315,2012-06-15,海普瑞：关于控股子公司完成工商变更登记的公告,finalpage/2012-06-15/61139375.PDF
316,2012-07-14,海普瑞：关于召开2012年第二次临时股东大会的通知公告,finalpage/2012-07-14/61267721.PDF
317,2012-07-14,海普瑞：关于向银行申请专项授信额度的公告,finalpage/2012-07-14/61267722.PDF
318,2012-07-14,海普瑞：关于股东回报规划事宜的论证报告,finalpage/2012-07-14/61267723.PDF
319,2012-07-14,海普瑞：《公司章程》修正案,finalpage/2012-07-14/61267724.PDF
320,2012-07-14,海普瑞：未来三年（2012-2014年）股东分红回报规划,finalpage/2012-07-14/61267725.PDF
321,2012-07-14,海普瑞：独立董事关于第二届董事会第十六次会议相关事项的独立意见,finalpage/2012-07-14/61267726.PDF
322,2012-07-14,海普瑞：第二届监事会第十五次会议决议公告,finalpage/2012-07-14/61267727.PDF
323,2012-07-14,海普瑞：第二届董事会第十六次会议决议公告,finalpage/2012-07-14/61267728.PDF
324,2012-07-21,海普瑞：2012半年度业绩快报,finalpage/2012-07-21/61303144.PDF
325,2012-07-21,海普瑞：关于控股子公司获得药品GMP证书的公告,finalpage/2012-07-21/61303145.PDF
326,2012-08-02,海普瑞：2012年第二次临时股东大会决议公告,finalpage/2012-08-02/61359037.PDF
327,2012-08-02,海普瑞：2012年第二次临时股东大会的法律意见书,finalpage/2012-08-02/61359038.PDF
328,2012-08-03,海普瑞：2012年半年度报告摘要,finalpage/2012-08-03/61364319.PDF
329,2012-08-03,海普瑞：2012年半年度报告,finalpage/2012-08-03/61364320.PDF
330,2012-08-03,海普瑞：2012年半年度财务报告,finalpage/2012-08-03/61364322.PDF
331,2012-08-03,海普瑞：独立董事关于公司对外担保和控股股东及其他关联方资金占用情况的专项说明及独立意见,finalpage/2012-08-03/61364323.PDF
332,2012-08-17,海普瑞：关于签订《募集资金三方监管协议》的公告,finalpage/2012-08-17/61434538.PDF
333,2012-08-17,海普瑞：独立董事关于第二届董事会第十八次会议相关事项的独立意见,finalpage/2012-08-17/61434539.PDF
334,2012-08-17,海普瑞：第二届董事会第十八次会议决议公告,finalpage/2012-08-17/61434540.PDF
335,2012-10-16,海普瑞：关于变更固定资产折旧年限的的公告,finalpage/2012-10-16/61661299.PDF
336,2012-10-16,海普瑞：关于对外投资的公告,finalpage/2012-10-16/61661300.PDF
337,2012-10-16,海普瑞：关于签订技术合作协议的公告,finalpage/2012-10-16/61661301.PDF
338,2012-10-16,海普瑞：投资者关系管理制度（2012年10月）,finalpage/2012-10-16/61661302.PDF
339,2012-10-16,海普瑞：独立董事关于第二届董事会第十九次会议相关事项的独立意见,finalpage/2012-10-16/61661303.PDF
340,2012-10-16,海普瑞：第二届监事会第十七次会议决议公告,finalpage/2012-10-16/61661304.PDF
341,2012-10-16,海普瑞：第二届董事会第十九次会议决议公告,finalpage/2012-10-16/61661305.PDF
342,2012-10-27,海普瑞：2012年第三季度报告正文,finalpage/2012-10-27/61719944.PDF
343,2012-10-27,海普瑞：2012年第三季度报告全文,finalpage/2012-10-27/61719946.PDF
344,2012-11-07,海普瑞：关于承诺履行情况的公告,finalpage/2012-11-07/61768643.PDF
345,2012-11-24,海普瑞：中国中投证券有限责任公司关于公司拟调整募集资金投资项目投资进度的核查意见,finalpage/2012-11-24/61832260.PDF
346,2012-11-24,海普瑞：关于变更会计师事务所的公告,finalpage/2012-11-24/61832261.PDF
347,2012-11-24,海普瑞：关于召开2012年第三次临时股东大会的通知公告,finalpage/2012-11-24/61832262.PDF
348,2012-11-24,海普瑞：关于调整募投项目投资进度的公告,finalpage/2012-11-24/61832263.PDF
349,2012-11-24,海普瑞：独立董事关于第二届董事会第二十一次会议相关事项的独立意见,finalpage/2012-11-24/61832264.PDF
350,2012-11-24,海普瑞：第二届监事会第十九次会议决议公告,finalpage/2012-11-24/61832265.PDF
351,2012-11-24,海普瑞：第二届董事会第二十一次会议决议公告,finalpage/2012-11-24/61832266.PDF
352,2012-11-30,海普瑞：关于更换保荐代表人的公告,finalpage/2012-11-30/61855290.PDF
353,2012-12-13,海普瑞：2012年第三次临时股东大会决议公告,finalpage/2012-12-13/61902021.PDF
354,2012-12-13,海普瑞：2012年第三次临时股东大会的法律意见书,finalpage/2012-12-13/61902022.PDF
355,2012-12-28,海普瑞：中国中投证券有限责任公司关于公司部分超募资金使用有关事项的保荐意见,finalpage/2012-12-28/61960187.PDF
356,2012-12-28,海普瑞：关于使用部分超募资金受让控股子公司部分股权并对其进行增资的公告,finalpage/2012-12-28/61960188.PDF
357,2012-12-28,海普瑞：关于拟使用部分超募资金参与竞买土地使用权的公告,finalpage/2012-12-28/61960189.PDF
358,2012-12-28,海普瑞：反舞弊制度（2012年12月）,finalpage/2012-12-28/61960190.PDF
359,2012-12-28,海普瑞：独立董事关于第二届董事会第二十二次会议相关事项的独立意见,finalpage/2012-12-28/61960191.PDF
360,2012-12-28,海普瑞：第二届监事会第二十次会议决议公告,finalpage/2012-12-28/61960192.PDF
361,2012-12-28,海普瑞：第二届董事会第二十二次会议决议公告,finalpage/2012-12-28/61960193.PDF
362,2013-01-09,海普瑞：关于竞得土地使用权的公告,finalpage/2013-01-09/62001744.PDF
363,2013-01-11,海普瑞：关于对外投资进展的公告,finalpage/2013-01-11/62006642.PDF
364,2013-01-21,海普瑞：关于持股5%以上股东减持股份的提示性公告,finalpage/2013-01-21/62048341.PDF
365,2013-01-21,海普瑞：简式权益变动报告书（已取消）,finalpage/2013-01-21/62048342.PDF
366,2013-01-23,海普瑞：关于简式权益变动报告书的更正公告,finalpage/2013-01-23/62055882.PDF
367,2013-01-23,海普瑞：简式权益变动报告书（更新后）,finalpage/2013-01-23/62055883.PDF
368,2013-02-07,海普瑞：关于股东减持公司股份后持股比例低于5%的提示性公告,finalpage/2013-02-07/62124399.PDF
369,2013-02-07,海普瑞：简式权益变动报告书,finalpage/2013-02-07/62124400.PDF
370,2013-02-26,海普瑞：2012年度业绩快报,finalpage/2013-02-26/62151314.PDF
371,2013-03-29,海普瑞：关于公司取得国家高新技术企业复审证书的公告,finalpage/2013-03-29/62293355.PDF
372,2013-03-29,海普瑞：关于控股子公司完成工商变更登记的公告,finalpage/2013-03-29/62293356.PDF
373,2013-04-12,海普瑞：2012年度监事会报告,finalpage/2013-04-12/62351098.PDF
374,2013-04-12,海普瑞：2012年度财务决算报告,finalpage/2013-04-12/62351099.PDF
375,2013-04-12,海普瑞：2013年度预计日常关联交易公告,finalpage/2013-04-12/62351100.PDF
376,2013-04-12,海普瑞：2012年年度报告摘要,finalpage/2013-04-12/62351101.PDF
377,2013-04-12,海普瑞：2012年年度报告,finalpage/2013-04-12/62351103.PDF
378,2013-04-12,海普瑞：2012年年度审计报告,finalpage/2013-04-12/62351114.PDF
379,2013-04-12,海普瑞：第二届董事会第二十三次会议决议公告,finalpage/2013-04-12/62351115.PDF
380,2013-04-12,海普瑞：关于召开2012年年度股东大会的通知公告,finalpage/2013-04-12/62351116.PDF
381,2013-04-12,海普瑞：第二届监事会第二十一次会议决议公告,finalpage/2013-04-12/62351117.PDF
382,2013-04-12,海普瑞：关于公司关联方占用上市公司资金情况的专项审核报告,finalpage/2013-04-12/62351118.PDF
383,2013-04-12,海普瑞：2012年度内部控制自我评价报告,finalpage/2013-04-12/62351119.PDF
384,2013-04-12,海普瑞：2012年度募集资金存放与使用情况的专项报告,finalpage/2013-04-12/62351120.PDF
385,2013-04-12,海普瑞：关于公司募集资金年度存放与实际使用情况的鉴证报告,finalpage/2013-04-12/62351121.PDF
386,2013-04-12,海普瑞：独立董事关于第二届董事会第二十三次会议相关事项的独立意见,finalpage/2013-04-12/62351122.PDF
387,2013-04-12,海普瑞：独立董事2012年度述职报告（周海梦）,finalpage/2013-04-12/62351123.PDF
388,2013-04-12,海普瑞：《公司章程》修正案,finalpage/2013-04-12/62351124.PDF
389,2013-04-12,海普瑞：内部控制审计报告,finalpage/2013-04-12/62351125.PDF
390,2013-04-12,海普瑞：公司章程（2013年4月）,finalpage/2013-04-12/62351126.PDF
391,2013-04-12,海普瑞：中国中投证券有限责任公司关于公司2012年度内部控制自我评价报告的核查意见,finalpage/2013-04-12/62351127.PDF
392,2013-04-12,海普瑞：中国中投证券有限责任公司关于公司2012年度募集资金存放与使用情况的核查意见,finalpage/2013-04-12/62351128.PDF
393,2013-04-12,海普瑞：中国中投证券有限责任公司关于公司2013年度预计关联交易的核查意见,finalpage/2013-04-12/62351129.PDF
394,2013-04-12,海普瑞：关于举行2012年年度报告网上说明会的公告,finalpage/2013-04-12/62351130.PDF
395,2013-04-12,海普瑞：关于使用自有闲置资金购买银行理财产品的公告,finalpage/2013-04-12/62351131.PDF
396,2013-04-12,海普瑞：中国中投证券有限责任公司关于公司内部控制规则落实自查表的核查意见,finalpage/2013-04-12/62351133.PDF
397,2013-04-12,海普瑞：中国中投证券有限责任公司关于公司向控股子公司提供委托贷款事项的核查意见,finalpage/2013-04-12/62351134.PDF
398,2013-04-12,海普瑞：关于向控股子公司提供委托贷款的公告,finalpage/2013-04-12/62351135.PDF
399,2013-04-12,海普瑞：关于向银行申请专项授信额度的公告,finalpage/2013-04-12/62351136.PDF
400,2013-04-12,海普瑞：关于开展2013年远期外汇交易情况的公告,finalpage/2013-04-12/62351137.PDF
401,2013-04-12,海普瑞：中国中投证券有限责任公司关于公司拟以自有闲置资金购买银行理财产品的核查意见,finalpage/2013-04-12/62351138.PDF
402,2013-04-12,海普瑞：中国中投证券有限责任公司关于公司拟开展2013年度远期外汇交易的核查意见,finalpage/2013-04-12/62351139.PDF
403,2013-04-12,海普瑞：内部控制规则落实自查表,finalpage/2013-04-12/62351140.PDF
404,2013-04-12,海普瑞：委托理财管理制度（2013年4月）,finalpage/2013-04-12/62351141.PDF
405,2013-04-12,海普瑞：独立董事2012年度述职报告（徐滨）,finalpage/2013-04-12/62351142.PDF
406,2013-04-12,海普瑞：独立董事2012年度述职报告（解冻）,finalpage/2013-04-12/62351143.PDF
407,2013-04-12,海普瑞：独立董事关于2013年度日常关联交易预计事项之事前认可意见,finalpage/2013-04-12/62351144.PDF
408,2013-04-20,海普瑞：2013年第一季度报告正文,finalpage/2013-04-20/62389213.PDF
409,2013-04-20,海普瑞：2013年第一季度报告全文,finalpage/2013-04-20/62389214.PDF
410,2013-04-26,海普瑞：关于首次公开发行前已发行股份上市流通的提示性公告,finalpage/2013-04-26/62426879.PDF
411,2013-05-23,海普瑞：2012年年度股东大会决议公告,finalpage/2013-05-23/62515153.PDF
412,2013-05-23,海普瑞：2012年年度股东大会的法律意见书,finalpage/2013-05-23/62515154.PDF
413,2013-05-29,海普瑞：2012年年度权益分派实施公告,finalpage/2013-05-29/62532196.PDF
414,2013-07-13,海普瑞：关于公司取消股票期权激励计划的会计处理意见,finalpage/2013-07-13/62830301.PDF
415,2013-07-13,海普瑞：关于对外投资的公告,finalpage/2013-07-13/62830302.PDF
416,2013-07-13,海普瑞：关于终止实施公司股票期权激励计划的公告,finalpage/2013-07-13/62830304.PDF
417,2013-07-13,海普瑞：北京市中伦律师事务所关于公司终止股票期权激励计划的法律意见书,finalpage/2013-07-13/62830305.PDF
418,2013-07-13,海普瑞：独立董事关于第二届董事会第二十五次会议相关事项的独立意见,finalpage/2013-07-13/62830306.PDF
419,2013-07-13,海普瑞：第二届监事会第二十三次会议决议公告,finalpage/2013-07-13/62830307.PDF
420,2013-07-13,海普瑞：第二届董事会第二十五次会议决议公告,finalpage/2013-07-13/62830308.PDF
421,2013-07-26,海普瑞：关于股票期权激励计划已授予股票期权注销完成的公告,finalpage/2013-07-26/62870543.PDF
422,2013-07-31,海普瑞：2013年半年度业绩快报,finalpage/2013-07-31/62885169.PDF
423,2013-08-02,海普瑞：关于设立全资子公司进展的公告,finalpage/2013-08-02/62893873.PDF
424,2013-08-13,海普瑞：关于媒体报道的澄清公告,finalpage/2013-08-13/62931399.PDF
425,2013-08-24,海普瑞：关于股东迁址及更名等的提示性公告,finalpage/2013-08-24/62986434.PDF
426,2013-08-29,海普瑞：2013年半度募集资金存放与使用情况的专项报告,finalpage/2013-08-29/63014540.PDF
427,2013-08-29,海普瑞：2013年半年度报告摘要,finalpage/2013-08-29/63014541.PDF
428,2013-08-29,海普瑞：2013年半年度报告,finalpage/2013-08-29/63014542.PDF
429,2013-08-29,海普瑞：2013年1-6月财务报告,finalpage/2013-08-29/63014544.PDF
430,2013-08-29,海普瑞：第二届董事会第二十六次会议决议公告,finalpage/2013-08-29/63014546.PDF
431,2013-08-29,海普瑞：第二届监事会第二十四次会议决议公告,finalpage/2013-08-29/63014547.PDF
432,2013-08-29,海普瑞：独立董事关于第二届董事会第二十六次会议相关事项的独立意见,finalpage/2013-08-29/63014548.PDF
433,2013-08-29,海普瑞：《公司章程》修正案,finalpage/2013-08-29/63014549.PDF
434,2013-08-29,海普瑞：中国中投证券有限责任公司关于公司变更部分超额募集资金存放专项账户的核查意见,finalpage/2013-08-29/63014550.PDF
435,2013-08-29,海普瑞：公司章程（2013年8月）,finalpage/2013-08-29/63014551.PDF
