date,title,url
2013-03-30,亚厦股份：关于举行网上2012年度报告说明会的通知,finalpage/2013-03-30/62305032.PDF
2013-03-30,亚厦股份：内部控制规则落实自查表,finalpage/2013-03-30/62305033.PDF
2013-03-30,亚厦股份：北京市康达律师事务所关于公司控股股东增持公司股份的专项法律意见书,finalpage/2013-03-30/62305034.PDF
2013-03-30,亚厦股份：关于控股股东完成增持公司股份的公告,finalpage/2013-03-30/62305035.PDF
2013-03-30,亚厦股份：独立董事对2013度日常关联交易的事前认可函,finalpage/2013-03-30/62305036.PDF
2013-03-30,亚厦股份：2012年度独立董事述职报告（任永平）,finalpage/2013-03-30/62305037.PDF
2013-03-30,亚厦股份：2012年度独立董事述职报告（唐世定）,finalpage/2013-03-30/62305038.PDF
2013-03-30,亚厦股份：2012年度独立董事述职报告（王维安）,finalpage/2013-03-30/62305039.PDF
2013-03-30,亚厦股份：2012年度独立董事述职报告（董宜君）,finalpage/2013-03-30/62305040.PDF
2013-04-08,亚厦股份：股票期权激励计划首次授予第一个行权期高管人员行权股份上市流通提示性公告,finalpage/2013-04-08/62326003.PDF
2013-04-09,亚厦股份：关于公司和子公司收到《中标通知书》及签订施工程合同的公告,finalpage/2013-04-09/62336840.PDF
2013-04-17,亚厦股份：股东股份质押的公告,finalpage/2013-04-17/62370723.PDF
2013-04-18,亚厦股份：控股股东部分股权解冻及质押公告,finalpage/2013-04-18/62374750.PDF
2013-04-20,亚厦股份：控股股东部分股权解冻及质押公告,finalpage/2013-04-20/62389540.PDF
2013-04-23,亚厦股份：2012年度股东大会决议公告,finalpage/2013-04-23/62402772.PDF
2013-04-23,亚厦股份：2012年年度股东大会的法律意见书,finalpage/2013-04-23/62402773.PDF
2013-04-26,亚厦股份：2013年第一季度报告正文,finalpage/2013-04-26/62426867.PDF
2013-04-26,亚厦股份：2013年第一季度报告全文,finalpage/2013-04-26/62426869.PDF
2013-04-26,亚厦股份：第二届董事会第三十八次会议决议公告,finalpage/2013-04-26/62426870.PDF
2013-05-04,亚厦股份：2012年度非公开发行股票预案（修订稿）,finalpage/2013-05-04/62456913.PDF
2013-05-04,亚厦股份：第二届董事会第三十九次会议决议公告,finalpage/2013-05-04/62456914.PDF
2013-05-04,亚厦股份：第二届监事会第二十九次会议决议公告,finalpage/2013-05-04/62456915.PDF
2013-05-04,亚厦股份：关于选举第三届监事会职工代表监事公告,finalpage/2013-05-04/62456916.PDF
2013-05-04,亚厦股份：前次募集资金使用情况鉴证报告,finalpage/2013-05-04/62456917.PDF
2013-05-04,亚厦股份：独立董事关于第二届董事会第三十九次会议相关事项的独立意见,finalpage/2013-05-04/62456918.PDF
2013-05-04,亚厦股份：关于召开2013年第一次临时股东大会的通知,finalpage/2013-05-04/62456919.PDF
2013-05-04,亚厦股份：《公司章程修正案》,finalpage/2013-05-04/62456920.PDF
2013-05-04,亚厦股份：公司章程（2013年5月）,finalpage/2013-05-04/62456921.PDF
2013-05-04,亚厦股份：独立董事候选人声明（王力）,finalpage/2013-05-04/62456922.PDF
2013-05-04,亚厦股份：独立董事候选人声明（顾云昌）,finalpage/2013-05-04/62456923.PDF
2013-05-04,亚厦股份：独立董事候选人声明（汪祥耀）,finalpage/2013-05-04/62456924.PDF
2013-05-04,亚厦股份：独立董事提名人声明（三）,finalpage/2013-05-04/62456925.PDF
2013-05-04,亚厦股份：独立董事提名人声明（二）,finalpage/2013-05-04/62456926.PDF
2013-05-04,亚厦股份：独立董事提名人声明（一）,finalpage/2013-05-04/62456927.PDF
2013-05-11,亚厦股份：关于公司和全资子公司收到《中标通知书》及签订施工程合同的公告,finalpage/2013-05-11/62481086.PDF
2013-05-17,亚厦股份：关于召开2013年第一次临时股东大会的提示性公告,finalpage/2013-05-17/62498116.PDF
2013-05-21,亚厦股份：2013年第一次临时股东大会决议公告,finalpage/2013-05-21/62509780.PDF
2013-05-21,亚厦股份：2013年第一次临时股东大会的法律意见书,finalpage/2013-05-21/62509781.PDF
2013-05-21,亚厦股份：第三届监事会第一次会议决议公告,finalpage/2013-05-21/62509782.PDF
2013-05-21,亚厦股份：第三届董事会第一次会议决议公告,finalpage/2013-05-21/62509783.PDF
2013-05-21,亚厦股份：关于增资收购大连正泰开宇装饰有限公司51%股权的公告,finalpage/2013-05-21/62509784.PDF
2013-05-21,亚厦股份：关于对全资子公司增资的公告,finalpage/2013-05-21/62509785.PDF
2013-05-21,亚厦股份：董事会审计委员会工作细则（2013年5月）,finalpage/2013-05-21/62509786.PDF
2013-05-21,亚厦股份：董事会战略委员会工作细则（2013年5月）,finalpage/2013-05-21/62509787.PDF
2013-05-21,亚厦股份：董事会提名委员会工作细则（2013年5月）,finalpage/2013-05-21/62509788.PDF
2013-05-21,亚厦股份：董事会薪酬与考核委员会工作细则（2013年5月）,finalpage/2013-05-21/62509789.PDF
2013-05-21,亚厦股份：独立董事关于聘任高级管理人员的独立意见,finalpage/2013-05-21/62509790.PDF
2013-05-22,亚厦股份：股票交易异常波动公告,finalpage/2013-05-22/62513089.PDF
2013-05-24,亚厦股份：首次公开发行前已发行股份部分上市流通提示性公告,finalpage/2013-05-24/62518872.PDF
2013-05-28,亚厦股份：2012年公司债券受托管理人报告（2012年度）,finalpage/2013-05-28/62528692.PDF
2013-05-31,亚厦股份：2012年度权益分派实施公告,finalpage/2013-05-31/62538430.PDF
2013-06-08,亚厦股份：控股股东股份解除质押的公告,finalpage/2013-06-08/62569794.PDF
2013-06-08,亚厦股份：关于根据2012年度利润分配方案调整非公开发行股票发行底价和发行数量的公告,finalpage/2013-06-08/62569795.PDF
2013-06-14,亚厦股份：关于收到《中国证监会行政许可申请受理通知书》的公告,finalpage/2013-06-14/62578025.PDF
2013-06-22,亚厦股份：控股股东部分股权解除质押的公告,finalpage/2013-06-22/62602807.PDF
2013-06-28,亚厦股份：2012年10亿元公司债券2013年跟踪信用评级报告,finalpage/2013-06-28/62620896.PDF
2013-07-02,亚厦股份：控股股东部分股权解除质押的公告,finalpage/2013-07-02/62754731.PDF
2013-07-06,亚厦股份：“12亚厦债”2013年付息公告,finalpage/2013-07-06/62789400.PDF
2013-07-17,亚厦股份：关于全资子公司发生火灾事故的公告,finalpage/2013-07-17/62841953.PDF
2013-08-15,亚厦股份：2013年半年度报告摘要,finalpage/2013-08-15/62939236.PDF
2013-08-15,亚厦股份：2013年半年度财务报告,finalpage/2013-08-15/62939239.PDF
2013-08-15,亚厦股份：第三届董事会第二次会议决议公告,finalpage/2013-08-15/62939240.PDF
2013-08-15,亚厦股份：第三届监事会第二次会议决议公告,finalpage/2013-08-15/62939241.PDF
2013-08-15,亚厦股份：2013年半年度报告,finalpage/2013-08-15/62939242.PDF
2013-08-15,亚厦股份：独立董事关于第三届董事会第二次会议相关事项的独立意见,finalpage/2013-08-15/62939243.PDF
2013-08-15,亚厦股份：关于举行2013年半年度报告网上业绩说明会的通知,finalpage/2013-08-15/62939244.PDF
2013-08-15,亚厦股份：关于对公司股票期权激励计划涉及的股票期权行权价格进行调整的公告,finalpage/2013-08-15/62939245.PDF
2013-08-15,亚厦股份：董事会前次募集资金使用情况报告,finalpage/2013-08-15/62939246.PDF
2013-08-15,亚厦股份：短期理财业务管理制度（2013年8月）,finalpage/2013-08-15/62939247.PDF
2013-08-15,亚厦股份：董事会2013年半年度募集资金存放与使用情况的专项报告,finalpage/2013-08-15/62939248.PDF
2013-08-15,亚厦股份：京衡律师集团事务所关于公司股票期权激励计划行权价格调整的法律意见书,finalpage/2013-08-15/62939249.PDF
2013-09-26,亚厦股份：关于非公开发行股票获得中国证监会发审会审核通过的公告,finalpage/2013-09-26/63111457.PDF
2013-10-12,亚厦股份：第三届董事会第三次会议决议公告,finalpage/2013-10-12/63147889.PDF
2013-10-12,亚厦股份：关于召开2013年第二次临时股东大会的通知,finalpage/2013-10-12/63147890.PDF
2013-10-12,亚厦股份：关于投资设立全资子公司的公告,finalpage/2013-10-12/63147891.PDF
2013-10-12,亚厦股份：募资资金管理制度（2013年10月）,finalpage/2013-10-12/63147892.PDF
2013-10-12,亚厦股份：公司章程（2013年10月）,finalpage/2013-10-12/63147893.PDF
2013-10-12,亚厦股份：公司章程修正案,finalpage/2013-10-12/63147894.PDF
2013-10-24,亚厦股份：关于荣获2012年度中国建筑装饰行业百强第二和幕墙行业第三的公告,finalpage/2013-10-24/63184887.PDF
2013-10-24,亚厦股份：控股股东部分股权解冻及质押公告,finalpage/2013-10-24/63184888.PDF
2013-10-29,亚厦股份：2013年第三季度报告正文,finalpage/2013-10-29/63206801.PDF
2013-10-29,亚厦股份：第三届董事会第四次会议决议公告,finalpage/2013-10-29/63206803.PDF
2013-10-29,亚厦股份：第三届监事会第三次会议决议公告,finalpage/2013-10-29/63206804.PDF
2013-10-29,亚厦股份：2013年第三季度报告全文,finalpage/2013-10-29/63206805.PDF
2013-10-29,亚厦股份：董事会前次募集资金使用情况报告,finalpage/2013-10-29/63206806.PDF
2013-10-29,亚厦股份：关于对公司全资子公司提供担保的公告,finalpage/2013-10-29/63206807.PDF
2013-11-01,亚厦股份：2013年第二次临时股东大会决议公告,finalpage/2013-11-01/63222599.PDF
2013-11-01,亚厦股份：2013年第二次临时股东大会的法律意见书,finalpage/2013-11-01/63222600.PDF
2013-11-06,亚厦股份：关于董事、监事违规买卖股票的公告,finalpage/2013-11-06/63240541.PDF
2013-11-13,亚厦股份：控股股东部分股权解冻及质押公告,finalpage/2013-11-13/63261530.PDF
2013-11-20,亚厦股份：澄清公告,finalpage/2013-11-20/63284314.PDF
2013-12-11,亚厦股份：关于非公开发行股票获得中国证监会核准批文的公告,finalpage/2013-12-11/63364248.PDF
2013-12-14,亚厦股份：第三届监事会第四次会议决议公告,finalpage/2013-12-14/63375161.PDF
2013-12-14,亚厦股份：第三届董事会第五次会议决议公告,finalpage/2013-12-14/63375162.PDF
2013-12-14,亚厦股份：关于使用自有资金进行投资理财的公告,finalpage/2013-12-14/63375163.PDF
2013-12-14,亚厦股份：独立董事关于第三届董事会第五次会议相关事项的独立意见,finalpage/2013-12-14/63375164.PDF
2013-12-18,亚厦股份：关于购买理财产品的公告,finalpage/2013-12-18/63386326.PDF
2013-12-20,亚厦股份：关于购买理财产品的公告,finalpage/2013-12-20/63396853.PDF
2013-12-27,亚厦股份：关于购买理财产品的公告,finalpage/2013-12-27/63419426.PDF
2013-12-30,亚厦股份：关于限售股份上市流通的提示性公告,finalpage/2013-12-30/63422920.PDF
2014-01-11,亚厦股份：控股股东部分股权解冻及质押公告,finalpage/2014-01-11/63473410.PDF
2014-01-14,亚厦股份：关于公司及全资子公司通过高新技术企业复审的公告,finalpage/2014-01-14/63480852.PDF
2014-01-22,亚厦股份：关于购买理财产品的公告,finalpage/2014-01-22/63509127.PDF
2014-02-12,亚厦股份：关于公司及相关主体承诺履行情况的公告,finalpage/2014-02-12/63561714.PDF
2014-02-12,亚厦股份：关于公司和全资子公司收到《中标通知书》及签订施工程合同的公告,finalpage/2014-02-12/63561716.PDF
2014-02-14,亚厦股份：关于与银行签订购买理财产品框架协议的公告,finalpage/2014-02-14/63568347.PDF
2014-02-28,亚厦股份：2013年度业绩快报,finalpage/2014-02-28/63614048.PDF
2014-02-28,亚厦股份：关于投资设立全资子公司的公告,finalpage/2014-02-28/63614049.PDF
2014-02-28,亚厦股份：第三届董事会第六次会议决议公告,finalpage/2014-02-28/63614050.PDF
2014-03-01,亚厦股份：控股股东部分股权质押公告,finalpage/2014-03-01/63620015.PDF
2014-03-20,亚厦股份：关于签订《战略合作框架协议》的公告,finalpage/2014-03-20/63697096.PDF
2014-03-21,亚厦股份：关于签订《战略合作框架协议》的公告,finalpage/2014-03-21/63702184.PDF
2014-03-22,亚厦股份：2014年第一季度业绩预增公告,finalpage/2014-03-22/63707837.PDF
2014-04-02,亚厦股份：关于购买理财产品的进展公告,finalpage/2014-04-02/63770838.PDF
2014-04-08,亚厦股份：关于重大事项停牌公告,finalpage/2014-04-08/63803850.PDF
2014-04-08,亚厦股份：首期股票期权激励计划预留对象名单,finalpage/2014-04-08/63798295.PDF
2014-04-08,亚厦股份：关于股票期权激励计划预留股票期权授予登记完成的公告,finalpage/2014-04-08/63798296.PDF
2014-04-10,亚厦股份：关于公司股票及债券复牌的公告,finalpage/2014-04-10/63813316.PDF
2014-04-10,亚厦股份：关于公司签订合作框架协议的公告,finalpage/2014-04-10/63813317.PDF
2014-04-18,亚厦股份：关于公司股票期权激励计划预留股票期权授予第一个行权期和首次授予股票期权第二个行权期可行权相关事项的法律意见书,finalpage/2014-04-18/63860626.PDF
2014-04-18,亚厦股份：关于股票期权激励计划预留股票期权授予第一个行权期可行权的公告,finalpage/2014-04-18/63860627.PDF
2014-04-18,亚厦股份：关于股票期权激励计划预留股票期权授予第一个行权期激励对象调整的公告,finalpage/2014-04-18/63860629.PDF
2014-04-18,亚厦股份：关于股票期权激励计划首次授予第二个行权期可行权的公告,finalpage/2014-04-18/63860630.PDF
2014-04-18,亚厦股份：关于股票期权激励计划首次授予第二个行权期激励对象调整的公告,finalpage/2014-04-18/63860631.PDF
2014-04-18,亚厦股份：独立董事关于公司股权激励计划预留股票期权授予第一个行权期和首次授予第二个行权期行权相关事项的独立意见,finalpage/2014-04-18/63860632.PDF
2014-04-18,亚厦股份：第三届监事会第五次会议决议公告,finalpage/2014-04-18/63860633.PDF
2014-04-18,亚厦股份：第三届董事会第七次会议决议公告,finalpage/2014-04-18/63860635.PDF
2014-04-18,亚厦股份：股票期权激励计划预留股票期权授予第一个行权期可行权对象名单,finalpage/2014-04-18/63860636.PDF
2014-04-23,亚厦股份：关于股票期权激励计划预留股票期权授予第一个行权期采取自主行权模式的公告,finalpage/2014-04-23/63894700.PDF
2014-04-23,亚厦股份：关于股票期权激励计划首次授予第二个行权期采取自主行权模式的公告,finalpage/2014-04-23/63894723.PDF
2014-04-24,亚厦股份：中信证券股份有限公司关于公司非公开发行股票发行过程和认购对象合规性的报告,finalpage/2014-04-24/63904144.PDF
2014-04-24,亚厦股份：中信证券股份有限公司关于公司非公开发行股票之上市保荐书,finalpage/2014-04-24/63904145.PDF
2014-04-24,亚厦股份：非公开发行股票发行情况报告暨上市公告书,finalpage/2014-04-24/63904147.PDF
2014-04-24,亚厦股份：非公开发行股票发行情况报告暨上市公告书（摘要）,finalpage/2014-04-24/63904148.PDF
2014-04-24,亚厦股份：北京市康达律师事务所关于公司非公开发行股票发行过程和认购对象合规性的法律意见书,finalpage/2014-04-24/63904149.PDF
2014-04-26,亚厦股份：2013年年度报告摘要,finalpage/2014-04-26/63928008.PDF
2014-04-26,亚厦股份：2013年年度审计报告,finalpage/2014-04-26/63928010.PDF
2014-04-26,亚厦股份：第三届董事会第八次会议决议公告,finalpage/2014-04-26/63928011.PDF
2014-04-26,亚厦股份：关于召开2013年度股东大会的通知,finalpage/2014-04-26/63928012.PDF
2014-04-26,亚厦股份：第三届监事会第六次会议决议公告,finalpage/2014-04-26/63928013.PDF
2014-04-26,亚厦股份：关于公司控股股东及其他关联方占用资金情况的专项说明,finalpage/2014-04-26/63928014.PDF
2014-04-26,亚厦股份：2013年年度报告,finalpage/2014-04-26/63928015.PDF
2014-04-26,亚厦股份：关于2013年度内部控制自我评价报告,finalpage/2014-04-26/63928016.PDF
2014-04-26,亚厦股份：内部控制鉴证报告,finalpage/2014-04-26/63928017.PDF
2014-04-26,亚厦股份：2013年度募集资金存放与实际使用情况的专项说明,finalpage/2014-04-26/63928018.PDF
2014-04-26,亚厦股份：关于公司2013年度募集资金存放与使用情况鉴证报告,finalpage/2014-04-26/63928019.PDF
2014-04-26,亚厦股份：独立董事关于公司2013年年报相关事项的独立意见,finalpage/2014-04-26/63928020.PDF
2014-04-26,亚厦股份：2013年度独立董事述职报告（顾云昌）,finalpage/2014-04-26/63928021.PDF
2014-04-26,亚厦股份：2014年第一季度报告正文,finalpage/2014-04-26/63928022.PDF
2014-04-26,亚厦股份：2014年第一季度报告全文,finalpage/2014-04-26/63928024.PDF
2014-04-26,亚厦股份：中信证券股份有限公司关于公司2014年度日常关联交易预计情况的专项意见,finalpage/2014-04-26/63928025.PDF
2014-04-26,亚厦股份：中信证券股份有限公司关于公司2013年度募集资金存放与使用情况的核查意见,finalpage/2014-04-26/63928026.PDF
2014-04-26,亚厦股份：《公司章程修正案》（因权益分派修订）,finalpage/2014-04-26/63928027.PDF
2014-04-26,亚厦股份：《公司章程修正案》（因非公开发行修订）,finalpage/2014-04-26/63928028.PDF
2014-04-26,亚厦股份：公司章程（因权益分派修订稿）（2014年4月）,finalpage/2014-04-26/63928031.PDF
2014-04-26,亚厦股份：公司章程（因非公开发行修订稿）（2014年4月）,finalpage/2014-04-26/63928032.PDF
2014-04-26,亚厦股份：关于2014年度日常关联交易预计情况的公告,finalpage/2014-04-26/63928033.PDF
2014-04-26,亚厦股份：关于为公司子公司提供担保的公告,finalpage/2014-04-26/63928034.PDF
2014-04-26,亚厦股份：关于举办投资者接待日活动的公告,finalpage/2014-04-26/63928035.PDF
2014-04-26,亚厦股份：关于举行网上2013年度报告说明会的通知,finalpage/2014-04-26/63928036.PDF
2014-04-26,亚厦股份：内部控制规则落实自查表,finalpage/2014-04-26/63928037.PDF
2014-04-26,亚厦股份：独立董事对2014度日常关联交易的事前认可函,finalpage/2014-04-26/63928038.PDF
2014-04-26,亚厦股份：2013年度独立董事述职报告（任永平）,finalpage/2014-04-26/63928039.PDF
2014-04-26,亚厦股份：2013年度独立董事述职报告（唐世定）,finalpage/2014-04-26/63928040.PDF
2014-04-26,亚厦股份：2013年度独立董事述职报告（汪祥耀）,finalpage/2014-04-26/63928041.PDF
2014-04-26,亚厦股份：2013年度独立董事述职报告（王力）,finalpage/2014-04-26/63928042.PDF
2014-04-26,亚厦股份：2013年度独立董事述职报告（王维安）,finalpage/2014-04-26/63928043.PDF
2014-05-06,亚厦股份：关于购买理财产品的进展公告,finalpage/2014-05-06/63970683.PDF
2014-05-07,亚厦股份：关于签订募集资金三方监管协议的公告,finalpage/2014-05-07/63989841.PDF
2014-05-23,亚厦股份：2012年10亿元公司债券2014年跟踪信用评级报告,finalpage/2014-05-23/64055769.PDF
2014-05-23,亚厦股份：2012年公司债券受托管理人报告（2013年度）,finalpage/2014-05-23/64056194.PDF
2014-05-29,亚厦股份：2013年度股东大会决议公告,finalpage/2014-05-29/64077495.PDF
2014-05-29,亚厦股份：2013年度股东大会的法律意见书,finalpage/2014-05-29/64077496.PDF
2014-05-31,亚厦股份：中信证券股份有限公司关于公司使用暂时闲置募集资金购买银行理财产品的核查意见,finalpage/2014-05-31/64086783.PDF
2014-05-31,亚厦股份：关于使用暂时闲置募集资金购买银行理财产品的公告,finalpage/2014-05-31/64086784.PDF
2014-05-31,亚厦股份：关于控股子公司上海蓝天房屋装饰工程有限公司未达到业绩承诺对公司进行补偿的公告,finalpage/2014-05-31/64086785.PDF
2014-05-31,亚厦股份：独立董事关于使用暂时闲置募集资金购买银行理财产品的议案的独立意见,finalpage/2014-05-31/64086786.PDF
2014-05-31,亚厦股份：第三届监事会第七次会议决议公告,finalpage/2014-05-31/64086787.PDF
2014-05-31,亚厦股份：第三届董事会第九次会议决议公告,finalpage/2014-05-31/64086788.PDF
2014-06-10,亚厦股份：关于使用暂时闲置募集资金购买银行理财产品的公告,finalpage/2014-06-10/64119076.PDF
2014-06-10,亚厦股份：关于使用自有资金购买理财产品的进展公告,finalpage/2014-06-10/64119077.PDF
2014-06-14,亚厦股份：关于使用暂时闲置募集资金购买银行理财产品的进展公告,finalpage/2014-06-14/64136128.PDF
2014-06-28,亚厦股份：关于以募集资金置换预先已投入募集资金投资项目自筹资金的公告,finalpage/2014-06-28/1200013375.PDF
2014-06-28,亚厦股份：关于实施募集资金向子公司增资的公告,finalpage/2014-06-28/1200013376.PDF
2014-06-28,亚厦股份：关于股权激励计划行权期结束拟注销失效股票期权相关事项的公告,finalpage/2014-06-28/1200013377.PDF
2014-06-28,亚厦股份：第三届监事会第八次会议决议公告,finalpage/2014-06-28/1200013379.PDF
2014-06-28,亚厦股份：第三届董事会第十次会议决议公告,finalpage/2014-06-28/1200013380.PDF
2014-06-28,亚厦股份：关于公司以自筹资金预先投入募集资金投资项目情况鉴证报告,finalpage/2014-06-28/1200013381.PDF
2014-06-28,亚厦股份：关于公司股票期权激励计划行权期结束拟注销失效股票期权相关事项的法律意见书,finalpage/2014-06-28/1200013382.PDF
2014-06-28,亚厦股份：独立董事关于第三届董事会第十次会议相关事项的独立意见,finalpage/2014-06-28/1200013383.PDF
2014-06-28,亚厦股份：中信证券股份有限公司关于公司以募集资金置换预先投入募集资金投资项目自筹资金事项的核查意见,finalpage/2014-06-28/1200013564.PDF
2014-07-03,亚厦股份：2013年度权益分派实施公告,finalpage/2014-07-03/1200026622.PDF
2014-07-08,亚厦股份：“12亚厦债”2014年付息公告,finalpage/2014-07-08/1200038561.PDF
2014-07-23,亚厦股份：关于签订募集资金四方监管协议的公告,finalpage/2014-07-23/1200071609.PDF
2014-08-20,亚厦股份：2014年半年度报告摘要,finalpage/2014-08-20/1200140853.PDF
2014-08-20,亚厦股份：2014年半年度财务报告,finalpage/2014-08-20/1200140855.PDF
2014-08-20,亚厦股份：第三届董事会第十一次会议决议公告,finalpage/2014-08-20/1200140856.PDF
2014-08-20,亚厦股份：第三届监事会第九次会议决议公告,finalpage/2014-08-20/1200140857.PDF
2014-08-20,亚厦股份：2014年半年度报告,finalpage/2014-08-20/1200140858.PDF
2014-08-20,亚厦股份：独立董事关于第三届董事会第十一次会议相关事项的独立意见,finalpage/2014-08-20/1200140859.PDF
2014-08-20,亚厦股份：关于使用暂时闲置募集资金购买银行理财产品的进展公告,finalpage/2014-08-20/1200140860.PDF
2014-08-20,亚厦股份：2014年上半年度IPO募集资金存放与实际使用情况的专项报告,finalpage/2014-08-20/1200140861.PDF
2014-08-20,亚厦股份：2014年上半年度非公开募集资金存放与实际使用情况的专项报告,finalpage/2014-08-20/1200140862.PDF
2014-08-20,亚厦股份：关于举行2014年半年度报告网上业绩说明会的通知,finalpage/2014-08-20/1200140863.PDF
2014-08-20,亚厦股份：关于对公司股票期权激励计划涉及的股票期权数量和行权价格进行调整的公告,finalpage/2014-08-20/1200140864.PDF
2014-08-20,亚厦股份：浙江京衡律师事务所关于公司股票期权激励计划股票期权数量和行权价格调整的法律意见书,finalpage/2014-08-20/1200140865.PDF
2014-08-21,亚厦股份：控股股东部分股权质押公告,finalpage/2014-08-21/1200144769.PDF
2014-08-26,亚厦股份：关于重大事项停牌公告,finalpage/2014-08-26/1200165497.PDF
2014-08-30,亚厦股份：关于重大事项继续停牌公告,finalpage/2014-08-30/1200188710.PDF
2014-09-04,亚厦股份：厦门万安智能股份有限公司2013年度审计报告（合并）,finalpage/2014-09-04/1200202499.PDF
2014-09-04,亚厦股份：厦门万安智能股份有限公司2013年度审计报告（母公司）,finalpage/2014-09-04/1200202500.PDF
2014-09-04,亚厦股份：厦门万安智能股份有限公司2014年1-3月审计报告,finalpage/2014-09-04/1200202501.PDF
2014-09-04,亚厦股份：中信证券股份有限公司关于公司关联交易的核查意见,finalpage/2014-09-04/1200202502.PDF
2014-09-04,亚厦股份：中信证券股份有限公司关于公司变更部分非公开发行股票募集资金投资项目并用于收购厦门万安智能股份有限公司65%股权及增资的核查意见,finalpage/2014-09-04/1200202503.PDF
2014-09-04,亚厦股份：关于变更部分非公开发行股票募集资金项目并用于收购厦门万安智能股份有限公司65%股权及增资的公告,finalpage/2014-09-04/1200202504.PDF
2014-09-04,亚厦股份：关于收购厦门万安智能股份有限公司65%股权的公告,finalpage/2014-09-04/1200202505.PDF
2014-09-04,亚厦股份：关于签订房屋租赁协议暨关联交易的公告,finalpage/2014-09-04/1200202506.PDF
