,date,title,url
218,2012-08-23,赛象科技：关于董事长、总经理辞职的公告,finalpage/2012-08-23/61464267.PDF
219,2012-08-23,赛象科技：关于召开2012年第二次临时股东大会的通知,finalpage/2012-08-23/61464268.PDF
220,2012-08-23,赛象科技：2012年半年度报告摘要,finalpage/2012-08-23/61464270.PDF
221,2012-08-23,赛象科技：2012年半年度财务报告,finalpage/2012-08-23/61464273.PDF
222,2012-08-23,赛象科技：第四届董事会第十九次会议决议公告,finalpage/2012-08-23/61464275.PDF
223,2012-08-23,赛象科技：2012年半年度报告,finalpage/2012-08-23/61464277.PDF
224,2012-08-23,赛象科技：独立董事关于控股股东及其他关联方占用公司资金、公司对外担保情况的专项说明和独立意见,finalpage/2012-08-23/61464278.PDF
225,2012-08-23,赛象科技：独立董事关于公司四届十九次董事会相关事项的独立意见,finalpage/2012-08-23/61464280.PDF
226,2012-09-11,赛象科技：2012年第二次临时股东大会决议公告,finalpage/2012-09-11/61553764.PDF
227,2012-09-11,赛象科技：2012年第二次临时股东大会的法律意见书,finalpage/2012-09-11/61553765.PDF
228,2012-10-08,赛象科技：第四届董事会第二十次会议决议公告,finalpage/2012-10-08/61622851.PDF
229,2012-10-08,赛象科技：会计估计变更公告,finalpage/2012-10-08/61622852.PDF
230,2012-10-08,赛象科技：第四届监事会第十四次会议决议公告,finalpage/2012-10-08/61622853.PDF
231,2012-10-08,赛象科技：独立董事对公司会计估计变更的独立意见,finalpage/2012-10-08/61622854.PDF
232,2012-10-29,赛象科技：关于用部分超募资金永久补充流动资金的公告,finalpage/2012-10-29/61718691.PDF
233,2012-10-29,赛象科技：2012年第三季度报告正文,finalpage/2012-10-29/61718694.PDF
234,2012-10-29,赛象科技：第四届董事会第二十一次会议决议公告,finalpage/2012-10-29/61718703.PDF
235,2012-10-29,赛象科技：第四届监事会第十五次会议决议公告,finalpage/2012-10-29/61718706.PDF
236,2012-10-29,赛象科技：2012年第三季度报告全文,finalpage/2012-10-29/61718715.PDF
237,2012-10-29,赛象科技：渤海证券股份有限公司关于公司用部分超募资金永久补充流动资金的核查意见,finalpage/2012-10-29/61718718.PDF
238,2012-10-29,赛象科技：独立董事关于用部分超募资金永久补充流动资金事项的独立意见,finalpage/2012-10-29/61718721.PDF
239,2012-11-05,赛象科技：关于公司股东、关联方以及公司承诺履行情况的公告,finalpage/2012-11-05/61755872.PDF
240,2012-11-15,赛象科技：重大合同公告,finalpage/2012-11-15/61799889.PDF
241,2012-12-31,赛象科技：第四届董事会第二十二次会议决议公告,finalpage/2012-12-31/61966226.PDF
242,2012-12-31,赛象科技：关于副总经理辞职的公告,finalpage/2012-12-31/61966227.PDF
243,2012-12-31,赛象科技：第四届监事会第十六次会议决议公告,finalpage/2012-12-31/61966228.PDF
244,2012-12-31,赛象科技：关于所聘审计机构大华会计师事务所有限公司转制的公告,finalpage/2012-12-31/61966229.PDF
245,2012-12-31,赛象科技：A股限制性股票激励计划（草案）摘要,finalpage/2012-12-31/61966230.PDF
246,2012-12-31,赛象科技：A股限制性股票激励计划（草案）,finalpage/2012-12-31/61966231.PDF
247,2012-12-31,赛象科技：A股限制性股票激励计划激励对象名单,finalpage/2012-12-31/61966232.PDF
248,2012-12-31,赛象科技：A股限制性股票激励计划实施考核办法（草案）,finalpage/2012-12-31/61966233.PDF
249,2012-12-31,赛象科技：独立董事关于公司高管任免的独立意见,finalpage/2012-12-31/61966234.PDF
250,2012-12-31,赛象科技：独立董事关于公司四届二十二次董事会相关事项的独立意见,finalpage/2012-12-31/61966235.PDF
251,2012-12-31,赛象科技：天津嘉德恒时律师事务所关于公司A股限制性股票激励计划（草案）的法律意见书,finalpage/2012-12-31/61966237.PDF
252,2013-01-11,赛象科技：关于首次公开发行前已发行股份上市流通提示性公告,finalpage/2013-01-11/62006882.PDF
253,2013-01-11,赛象科技：股东追加承诺公告,finalpage/2013-01-11/62006883.PDF
254,2013-01-11,赛象科技：渤海证券股份有限公司关于公司限售股份上市流通事项的核查意见,finalpage/2013-01-11/62006884.PDF
255,2013-01-29,赛象科技：关于完成股东股份性质变更的公告,finalpage/2013-01-29/62077571.PDF
256,2013-01-30,赛象科技：关于2012年年度业绩预告的修正公告,finalpage/2013-01-30/62082961.PDF
257,2013-02-23,赛象科技：关于A股限制性股票激励计划（草案）获得中国证监会备案无异议的公告,finalpage/2013-02-23/62145139.PDF
258,2013-02-26,赛象科技：2012年度业绩快报,finalpage/2013-02-26/62151116.PDF
259,2013-03-13,赛象科技：A股限制性股票激励计划（草案修订稿）,finalpage/2013-03-13/62207213.PDF
260,2013-03-13,赛象科技：天津嘉德恒时律师事务所关于公司A股限制性股票激励计划之补充法律意见书,finalpage/2013-03-13/62207214.PDF
261,2013-03-13,赛象科技：天津嘉德恒时律师事务所关于公司A股限制性股票激励计划（草案修订稿）的法律意见书,finalpage/2013-03-13/62207215.PDF
262,2013-03-13,赛象科技：关于公司A股限制性股票激励计划（草案修订稿）的修订说明,finalpage/2013-03-13/62207216.PDF
263,2013-03-13,赛象科技：第四届董事会第二十三次会议决议公告,finalpage/2013-03-13/62207217.PDF
264,2013-03-13,赛象科技：独立董事关于股权激励的投票委托征集函,finalpage/2013-03-13/62207218.PDF
265,2013-03-13,赛象科技：关于部分终止募集资金投资《子午线轮胎装备技术（工程）中心及产业化项目》的公告,finalpage/2013-03-13/62207219.PDF
266,2013-03-13,赛象科技：关于召开2013年第一次临时度股东大会的通知,finalpage/2013-03-13/62207220.PDF
267,2013-03-13,赛象科技：第四届监事会第十七次会议决议公告,finalpage/2013-03-13/62207221.PDF
268,2013-03-13,赛象科技：关于使用闲置募集资金购买银行理财产品的公告,finalpage/2013-03-13/62207222.PDF
269,2013-03-13,赛象科技：内部控制制度（2013年3月）,finalpage/2013-03-13/62207223.PDF
270,2013-03-13,赛象科技：渤海证券股份有限公司关于公司使用闲置募集资金购买银行理财产品的保荐意见,finalpage/2013-03-13/62207224.PDF
271,2013-03-13,赛象科技：渤海证券股份有限公司关于公司部分终止募集资金投资项目的核查意见,finalpage/2013-03-13/62207225.PDF
272,2013-03-13,赛象科技：独立董事关于公司四届二十三次董事会相关事项的独立意见,finalpage/2013-03-13/62207226.PDF
273,2013-03-13,赛象科技：A股限制性股票激励计划激励对象名单,finalpage/2013-03-13/62207227.PDF
274,2013-03-19,赛象科技：关于公司控股股东变更工商注册信息的公告,finalpage/2013-03-19/62225797.PDF
275,2013-04-11,赛象科技：日常关联交易预计公告,finalpage/2013-04-11/62344879.PDF
276,2013-04-11,赛象科技：渤海证券股份有限公司关于《天津赛象科技股份有限公司2012年度内部控制自我评价报告》的核查意见,finalpage/2013-04-11/62344880.PDF
277,2013-04-11,赛象科技：渤海证券股份有限公司关于公司2012年内部控制规则落实自查表的核查意见,finalpage/2013-04-11/62344881.PDF
278,2013-04-11,赛象科技：渤海证券股份有限公司关于公司2012年度募集资金存放和实际使用情况的核查意见,finalpage/2013-04-11/62344882.PDF
279,2013-04-11,赛象科技：2012年度监事会工作报告,finalpage/2013-04-11/62344883.PDF
280,2013-04-11,赛象科技：关于举行2012年度报告网上说明会的通知,finalpage/2013-04-11/62344884.PDF
281,2013-04-11,赛象科技：2012年年度报告摘要,finalpage/2013-04-11/62344885.PDF
282,2013-04-11,赛象科技：2012年年度审计报告,finalpage/2013-04-11/62344889.PDF
283,2013-04-11,赛象科技：第四届董事会第二十四次会议决议公告,finalpage/2013-04-11/62344890.PDF
284,2013-04-11,赛象科技：关于召开2012年度股东大会的通知,finalpage/2013-04-11/62344891.PDF
285,2013-04-11,赛象科技：第四届监事会第十八次会议决议公告,finalpage/2013-04-11/62344892.PDF
286,2013-04-11,赛象科技：控股股东及其他关联方资金占用情况的专项说明,finalpage/2013-04-11/62344893.PDF
287,2013-04-11,赛象科技：2012年年度报告,finalpage/2013-04-11/62344894.PDF
288,2013-04-11,赛象科技：2012年度内部控制自我评价报告,finalpage/2013-04-11/62344895.PDF
289,2013-04-11,赛象科技：内部控制鉴证报告,finalpage/2013-04-11/62344897.PDF
290,2013-04-11,赛象科技：董事会关于募集资金年度存放与使用情况的专项报告,finalpage/2013-04-11/62344898.PDF
291,2013-04-11,赛象科技：募集资金存放与使用情况鉴证报告,finalpage/2013-04-11/62344899.PDF
292,2013-04-11,赛象科技：独立董事关于控股股东及其他关联方占用公司资金、公司对外担保情况的专项说明和独立意见,finalpage/2013-04-11/62344900.PDF
293,2013-04-11,赛象科技：2012年度独立董事述职报告,finalpage/2013-04-11/62344901.PDF
294,2013-04-11,赛象科技：会计政策、会计估计变更和前期重大会计差错更正的专项说明,finalpage/2013-04-11/62344902.PDF
295,2013-04-11,赛象科技：内部控制规则落实自查表,finalpage/2013-04-11/62344903.PDF
296,2013-04-11,赛象科技：独立董事关于关联交易事项的事前认可函,finalpage/2013-04-11/62344904.PDF
297,2013-04-11,赛象科技：独立董事关于公司四届二十四次董事会相关事项的独立意见,finalpage/2013-04-11/62344905.PDF
298,2013-04-25,赛象科技：2013年第一次临时股东大会决议公告（已取消）,finalpage/2013-04-25/62421019.PDF
299,2013-04-25,赛象科技：2013年第一次临时股东大会的法律意见书（已取消）,finalpage/2013-04-25/62421021.PDF
300,2013-04-25,赛象科技：2013年第一次临时股东大会决议公告（更新后）,finalpage/2013-04-25/62423089.PDF
301,2013-04-25,赛象科技：更正公告,finalpage/2013-04-25/62423090.PDF
302,2013-04-25,赛象科技：2013年第一次临时股东大会的法律意见书（更新后）,finalpage/2013-04-25/62423091.PDF
303,2013-04-26,赛象科技：关于向激励对象授予限制性股票的公告,finalpage/2013-04-26/62430257.PDF
304,2013-04-26,赛象科技：关于使用自有资金购买银行理财产品的公告,finalpage/2013-04-26/62430258.PDF
305,2013-04-26,赛象科技：2013年第一季度报告正文,finalpage/2013-04-26/62430259.PDF
306,2013-04-26,赛象科技：2013年第一季度报告全文,finalpage/2013-04-26/62430261.PDF
307,2013-04-26,赛象科技：第四届监事会第十九次会议决议公告,finalpage/2013-04-26/62430262.PDF
308,2013-04-26,赛象科技：第四届董事会第二十五次会议决议公告,finalpage/2013-04-26/62430263.PDF
309,2013-04-26,赛象科技：独立董事关于使用自有资金购买银行理财产品的独立意见,finalpage/2013-04-26/62430264.PDF
310,2013-04-26,赛象科技：独立董事关于公司向激励对象授予限制性股票的独立意见,finalpage/2013-04-26/62430265.PDF
311,2013-04-26,赛象科技：天津嘉德恒时律师事务所关于公司A股限制性股票激励计划首次授予限制性股票相关事项的法律意见书,finalpage/2013-04-26/62430266.PDF
312,2013-05-07,赛象科技：2012年度股东大会决议公告,finalpage/2013-05-07/62464680.PDF
313,2013-05-07,赛象科技：2012年度股东大会的法律意见书,finalpage/2013-05-07/62464681.PDF
314,2013-05-09,赛象科技：第四届董事会第二十六次会议决议公告,finalpage/2013-05-09/62472856.PDF
315,2013-05-09,赛象科技：关于与关联方共同投资的关联交易公告,finalpage/2013-05-09/62472857.PDF
316,2013-05-09,赛象科技：2012年度权益分派实施公告,finalpage/2013-05-09/62472858.PDF
317,2013-05-09,赛象科技：独立董事关于公司与关联方共同投资的关联交易的独立意见,finalpage/2013-05-09/62472859.PDF
318,2013-05-22,赛象科技：限制性股票授予完成的公告,finalpage/2013-05-22/62512206.PDF
319,2013-05-23,赛象科技：第四届董事会第二十七次会议决议公告,finalpage/2013-05-23/62516126.PDF
320,2013-05-23,赛象科技：第四届监事会第二十次会议决议公告,finalpage/2013-05-23/62516127.PDF
321,2013-05-23,赛象科技：关于召开2013年第二次临时股东大会通知,finalpage/2013-05-23/62516128.PDF
322,2013-05-23,赛象科技：关于调整自有资金购买银行理财产品额度的公告,finalpage/2013-05-23/62516129.PDF
323,2013-05-23,赛象科技：关于职工代表监事选举结果的公告,finalpage/2013-05-23/62516130.PDF
324,2013-05-23,赛象科技：公司章程（2013年5月）,finalpage/2013-05-23/62516131.PDF
325,2013-05-23,赛象科技：独立董事候选人声明（李淑芬）,finalpage/2013-05-23/62516132.PDF
326,2013-05-23,赛象科技：独立董事候选人声明（杨蔚东）,finalpage/2013-05-23/62516133.PDF
327,2013-05-23,赛象科技：独立董事关于调整自有资金购买银行理财产品额度的独立意见,finalpage/2013-05-23/62516134.PDF
328,2013-05-23,赛象科技：独立董事关于董事会换届选举议案的独立意见,finalpage/2013-05-23/62516135.PDF
329,2013-05-23,赛象科技：独立董事提名人声明（二）,finalpage/2013-05-23/62516136.PDF
330,2013-05-23,赛象科技：独立董事提名人声明（一）,finalpage/2013-05-23/62516137.PDF
331,2013-06-04,赛象科技：关于变更保荐代表人的公告,finalpage/2013-06-04/62551984.PDF
332,2013-06-06,赛象科技：关于2013年第二次临时股东大会增加临时提案的公告,finalpage/2013-06-06/62563012.PDF
333,2013-06-06,赛象科技：关于职工代表监事辞职及补选的公告,finalpage/2013-06-06/62563013.PDF
334,2013-06-15,赛象科技：2013年第二次临时股东大会决议公告,finalpage/2013-06-15/62583333.PDF
335,2013-06-15,赛象科技：第五届董事会第一次会议决议公告,finalpage/2013-06-15/62583334.PDF
336,2013-06-15,赛象科技：第五届监事会第一次会议决议公告,finalpage/2013-06-15/62583335.PDF
337,2013-06-15,赛象科技：2013年第二次临时股东大会的法律意见书,finalpage/2013-06-15/62583336.PDF
338,2013-06-15,赛象科技：独立董事关于聘任高级管理人员议案的独立意见,finalpage/2013-06-15/62583337.PDF
339,2013-06-29,赛象科技：关于使用自有资金进行固定收益类证券投资的公告,finalpage/2013-06-29/62625248.PDF
340,2013-06-29,赛象科技：第五届董事会第二次会议决议公告,finalpage/2013-06-29/62625249.PDF
341,2013-06-29,赛象科技：独立董事关于公司使用自有资金进行固定收益类证券投资的独立意见,finalpage/2013-06-29/62625250.PDF
342,2013-07-10,赛象科技：关于追加承诺限售股份上市流通的提示性公告,finalpage/2013-07-10/62818133.PDF
343,2013-08-15,赛象科技：关于完成募集资金项目建设并将节余募集资金永久补充流动资金的公告,finalpage/2013-08-15/62939665.PDF
344,2013-08-15,赛象科技：关于召开2013年第三次临时股东大会通知,finalpage/2013-08-15/62939666.PDF
345,2013-08-15,赛象科技：关于调整固定收益类证券投资额度的公告,finalpage/2013-08-15/62939667.PDF
346,2013-08-15,赛象科技：董事会2013半年度募集资金存放与使用情况的专项报告,finalpage/2013-08-15/62939668.PDF
347,2013-08-15,赛象科技：2013年半年度报告摘要,finalpage/2013-08-15/62939669.PDF
348,2013-08-15,赛象科技：2013半年度财务报告,finalpage/2013-08-15/62939671.PDF
349,2013-08-15,赛象科技：第五届董事会第三次会议决议公告,finalpage/2013-08-15/62939672.PDF
350,2013-08-15,赛象科技：第五届监事会第二次会议决议公告,finalpage/2013-08-15/62939673.PDF
351,2013-08-15,赛象科技：2013年半年度报告,finalpage/2013-08-15/62939675.PDF
352,2013-08-15,赛象科技：独立董事关于控股股东及其他关联方占用公司资金、公司对外担保情况的专项说明和独立意见,finalpage/2013-08-15/62939676.PDF
353,2013-08-15,赛象科技：渤海证券股份有限公司关于公司完成募集资金项目建设并将结余募集资金永久补充流动资金的核查意见,finalpage/2013-08-15/62939677.PDF
354,2013-08-15,赛象科技：独立董事关于公司五届三次董事会相关事项的独立意见,finalpage/2013-08-15/62939678.PDF
355,2013-08-23,赛象科技：第五届董事会第四次会议决议公告,finalpage/2013-08-23/62979289.PDF
356,2013-08-23,赛象科技：第五届监事会第三次会议决议公告,finalpage/2013-08-23/62979290.PDF
357,2013-08-23,赛象科技：关于向激励对象授予预留限制性股票的公告,finalpage/2013-08-23/62979291.PDF
358,2013-08-23,赛象科技：独立董事关于公司向激励对象授予预留限制性股票的独立意见,finalpage/2013-08-23/62979292.PDF
359,2013-08-23,赛象科技：预留部分限制性股票激励对象名单,finalpage/2013-08-23/62979293.PDF
360,2013-08-23,赛象科技：天津嘉德恒时律师事务所关于公司A股限制性股票激励计划预留限制性股票授予相关事项的法律意见书,finalpage/2013-08-23/62979294.PDF
361,2013-09-03,赛象科技：关于收到增值税退税的公告,finalpage/2013-09-03/63040588.PDF
362,2013-09-06,赛象科技：2013年第三次临时股东大会决议公告,finalpage/2013-09-06/63052909.PDF
363,2013-09-06,赛象科技：2013年第三次临时股东大会的法律意见书,finalpage/2013-09-06/63052910.PDF
364,2013-09-18,赛象科技：预留限制性股票授予完成的公告,finalpage/2013-09-18/63092841.PDF
365,2013-10-19,赛象科技：关于控股股东减持股份的公告,finalpage/2013-10-19/63169322.PDF
366,2013-10-22,赛象科技：第五届董事会第五次会议决议公告,finalpage/2013-10-22/63177175.PDF
367,2013-10-22,赛象科技：关于投资设立天津赛象保理有限公司的公告,finalpage/2013-10-22/63177176.PDF
368,2013-10-22,赛象科技：关于投资设立赛象信诚国际融资租赁有限公司的公告,finalpage/2013-10-22/63177177.PDF
369,2013-10-22,赛象科技：关于召开2013年第四次临时股东大会通知,finalpage/2013-10-22/63177178.PDF
370,2013-10-22,赛象科技：公司章程（2013年10月）,finalpage/2013-10-22/63177179.PDF
371,2013-10-28,赛象科技：2013年第三季度报告正文,finalpage/2013-10-28/63200095.PDF
372,2013-10-28,赛象科技：2013年第三季度报告全文,finalpage/2013-10-28/63200098.PDF
373,2013-11-08,赛象科技：2013年第四次临时股东大会决议公告,finalpage/2013-11-08/63247946.PDF
374,2013-11-08,赛象科技：2013年第四次临时股东大会的法律意见书,finalpage/2013-11-08/63247949.PDF
375,2013-12-27,赛象科技：关于收到增值税退税的公告,finalpage/2013-12-27/63419767.PDF
376,2013-12-27,赛象科技：关于获得政府补助资金的公告,finalpage/2013-12-27/63419768.PDF
377,2014-01-28,赛象科技：关于小额贷款公司完成工商登记注册的公告,finalpage/2014-01-28/63530003.PDF
378,2014-01-28,赛象科技：关于增补独立董事的公告,finalpage/2014-01-28/63530004.PDF
379,2014-01-28,赛象科技：第五届董事会第七次会议决议公告,finalpage/2014-01-28/63530005.PDF
380,2014-01-28,赛象科技：关于召开2014年第一次临时股东大会通知,finalpage/2014-01-28/63530006.PDF
381,2014-01-28,赛象科技：独立董事候选人声明（张建勋）,finalpage/2014-01-28/63530007.PDF
382,2014-01-28,赛象科技：独立董事关于增补公司独立董事的独立意见,finalpage/2014-01-28/63530008.PDF
383,2014-01-28,赛象科技：独立董事提名人声明,finalpage/2014-01-28/63530009.PDF
384,2014-02-14,赛象科技：关于未履行完毕承诺事项专项披露的公告,finalpage/2014-02-14/63568740.PDF
385,2014-02-14,赛象科技：2014年第一临时股东大会决议公告,finalpage/2014-02-14/63568743.PDF
386,2014-02-14,赛象科技：2014年第一次临时股东大会的法律意见书,finalpage/2014-02-14/63568744.PDF
387,2014-02-28,赛象科技：2013年度业绩快报,finalpage/2014-02-28/63614703.PDF
388,2014-02-28,赛象科技：第五届董事会第八次会议决议公告,finalpage/2014-02-28/63614704.PDF
389,2014-02-28,赛象科技：第五届监事会第五次会议决议公告,finalpage/2014-02-28/63614705.PDF
390,2014-02-28,赛象科技：关于计提公司2013年资产减值准备的公告,finalpage/2014-02-28/63614706.PDF
391,2014-02-28,赛象科技：审计委员会关于计提资产减值准备的说明,finalpage/2014-02-28/63614707.PDF
392,2014-03-01,赛象科技：关于融资租赁公司完成工商登记注册的公告,finalpage/2014-03-01/63620010.PDF
393,2014-03-27,赛象科技：关于举行2013年度报告网上说明会的通知,finalpage/2014-03-27/63730370.PDF
394,2014-03-27,赛象科技：关于更换会计师事务所的公告,finalpage/2014-03-27/63730371.PDF
395,2014-03-27,赛象科技：日常关联交易预计公告,finalpage/2014-03-27/63730372.PDF
396,2014-03-27,赛象科技：2013年年度报告摘要,finalpage/2014-03-27/63730373.PDF
397,2014-03-27,赛象科技：2013年年度审计报告（已取消）,finalpage/2014-03-27/63730387.PDF
398,2014-03-27,赛象科技：第五届董事会第九次会议决议公告,finalpage/2014-03-27/63730388.PDF
399,2014-03-27,赛象科技：关于召开2013年度股东大会的通知,finalpage/2014-03-27/63730389.PDF
400,2014-03-27,赛象科技：第五届监事会第六次会议决议公告,finalpage/2014-03-27/63730390.PDF
401,2014-03-27,赛象科技：控股股东及其他关联方资金占用情况的专项说明,finalpage/2014-03-27/63730391.PDF
402,2014-03-27,赛象科技：2013年年度报告,finalpage/2014-03-27/63730392.PDF
403,2014-03-27,赛象科技：2013年度内部控制评价报告,finalpage/2014-03-27/63730393.PDF
404,2014-03-27,赛象科技：董事会关于募集资金年度存放与使用情况的专项报告,finalpage/2014-03-27/63730394.PDF
405,2014-03-27,赛象科技：募集资金存放与使用情况鉴证报告,finalpage/2014-03-27/63730395.PDF
406,2014-03-27,赛象科技：独立董事关于控股股东及其他关联方占用公司资金、公司对外担保情况的专项说明和独立意见,finalpage/2014-03-27/63730396.PDF
407,2014-03-27,赛象科技：2013年度独立董事述职报告,finalpage/2014-03-27/63730397.PDF
408,2014-03-27,赛象科技：内部控制规则落实自查表,finalpage/2014-03-27/63730398.PDF
409,2014-03-27,赛象科技：渤海证券股份有限公司关于公司2013年度募集资金存放和实际使用情况的核查意见,finalpage/2014-03-27/63730399.PDF
410,2014-03-27,赛象科技：独立董事关于关联交易事项的事前认可函,finalpage/2014-03-27/63730400.PDF
411,2014-03-27,赛象科技：独立董事关于更换会计师事务所事项的事前认可函,finalpage/2014-03-27/63730401.PDF
412,2014-03-27,赛象科技：独立董事关于公司五届九次董事会相关事项的独立意见,finalpage/2014-03-27/63730402.PDF
413,2014-03-27,赛象科技：监事会对公司内部控制评价的意见,finalpage/2014-03-27/63730403.PDF
414,2014-03-27,赛象科技：2013年年度审计报告（更新后）,finalpage/2014-03-27/63732371.PDF
415,2014-04-02,赛象科技：关于收到增值税退税的公告,finalpage/2014-04-02/63772211.PDF
416,2014-04-18,赛象科技：2013年度股东大会决议公告,finalpage/2014-04-18/63860810.PDF
417,2014-04-18,赛象科技：2013年度股东大会的法律意见书,finalpage/2014-04-18/63860815.PDF
418,2014-04-21,赛象科技：2013年度权益分派实施公告,finalpage/2014-04-21/63869853.PDF
419,2014-04-25,赛象科技：2014年第一季度报告正文,finalpage/2014-04-25/63912873.PDF
420,2014-04-25,赛象科技：2014年第一季度报告全文,finalpage/2014-04-25/63912875.PDF
421,2014-05-05,赛象科技：关于参加“天津辖区上市公司2013年度业绩网上集体说明会”的公告,finalpage/2014-05-05/63969857.PDF
422,2014-05-09,赛象科技：第五届监事会第八次会议决议公告,finalpage/2014-05-09/64001122.PDF
423,2014-05-09,赛象科技：关于限制性股票激励计划第一个解锁期解锁条件成就的公告,finalpage/2014-05-09/64001124.PDF
424,2014-05-09,赛象科技：关于回购注销部分限制性股票的公告,finalpage/2014-05-09/64001125.PDF
425,2014-05-09,赛象科技：减资公告,finalpage/2014-05-09/64001126.PDF
426,2014-05-09,赛象科技：第五届董事会第十一次会议决议公告,finalpage/2014-05-09/64001127.PDF
427,2014-05-09,赛象科技：天津嘉德恒时律师事务所关于公司公司限制性股票第一次解锁及部分限制性股票回购注销相关事宜的法律意见书,finalpage/2014-05-09/64001128.PDF
428,2014-05-09,赛象科技：公司章程（2014年5月）,finalpage/2014-05-09/64001129.PDF
429,2014-05-09,赛象科技：独立董事关于公司五届十一次董事会相关事项的独立意见,finalpage/2014-05-09/64001130.PDF
430,2014-05-22,赛象科技：关于限制性股票激励计划第一个解锁期解锁股份上市流通的提示性公告,finalpage/2014-05-22/64051192.PDF
431,2014-05-30,赛象科技：关于使用自有资金购买银行理财产品的公告,finalpage/2014-05-30/64081699.PDF
432,2014-05-30,赛象科技：第五届董事会第十二次会议决议公告,finalpage/2014-05-30/64081702.PDF
