date,title,url
2010-03-04,亚厦股份：首次公开发行A股初步询价及推介公告,finalpage/2010-03-04/57649586.PDF
2010-03-04,亚厦股份：2008年第一次临时股东大会决议,finalpage/2010-03-04/57649310.PDF
2010-03-04,亚厦股份：2008年年度股东大会决议,finalpage/2010-03-04/57649312.PDF
2010-03-04,亚厦股份：2009年年度股东大会决议,finalpage/2010-03-04/57649313.PDF
2010-03-04,亚厦股份：财富里昂证券有限责任公司关于公司申请首次公开发行人民币普通股（A股）股票的发行保荐书,finalpage/2010-03-04/57649319.PDF
2010-03-04,亚厦股份：首次公开发行股票之保荐工作报告,finalpage/2010-03-04/57649321.PDF
2010-03-04,亚厦股份：截至2009年12月31日止前三个年度财务报表的审计报告,finalpage/2010-03-04/57649323.PDF
2010-03-04,亚厦股份：内部控制鉴证报告,finalpage/2010-03-04/57649324.PDF
2010-03-04,亚厦股份：截至2009年12月31日止前三个年度非经常性损益专项鉴证报告,finalpage/2010-03-04/57649326.PDF
2010-03-04,亚厦股份：北京市康达律师事务所关于公司2008年度首次公开发行股票并上市的法律意见书,finalpage/2010-03-04/57649330.PDF
2010-03-04,亚厦股份：北京市康达律师事务所关于公司2008年度首次公开发行股票并上市的律师工作报告,finalpage/2010-03-04/57649332.PDF
2010-03-04,亚厦股份：北京市康达律师事务所关于公司2008年度首次公开发行股票并上市的补充法律意见书（一）,finalpage/2010-03-04/57649334.PDF
2010-03-04,亚厦股份：北京市康达律师事务所关于公司2008年度首次公开发行股票并上市的补充法律意见书（二）,finalpage/2010-03-04/57649337.PDF
2010-03-04,亚厦股份：北京市康达律师事务所关于公司2008年度首次公开发行股票并上市的补充法律意见书（三）,finalpage/2010-03-04/57649340.PDF
2010-03-04,亚厦股份：北京市康达律师事务所关于公司首次公开发行股票并上市的补充法律意见书（四）,finalpage/2010-03-04/57649342.PDF
2010-03-04,亚厦股份：北京市康达律师事务所关于公司首次公开发行股票并上市的补充法律意见书（五）,finalpage/2010-03-04/57649344.PDF
2010-03-04,亚厦股份：北京市康达律师事务所关于公司首次公开发行股票并上市的补充法律意见书（六）,finalpage/2010-03-04/57649347.PDF
2010-03-04,亚厦股份：公司章程（上市草案）,finalpage/2010-03-04/57649349.PDF
2010-03-04,亚厦股份：第一届董事会第六次会议决议,finalpage/2010-03-04/57649352.PDF
2010-03-04,亚厦股份：第一届董事会第十次会议决议,finalpage/2010-03-04/57649354.PDF
2010-03-04,亚厦股份：第一届董事会第十四次会议决议,finalpage/2010-03-04/57649355.PDF
2010-03-04,亚厦股份：中国证监会关于核准公司首次公开发行股票的批复,finalpage/2010-03-04/57649356.PDF
2010-03-04,亚厦股份：首次公开发行股票招股意向书摘要,finalpage/2010-03-04/57649580.PDF
2010-03-04,亚厦股份：首次公开发行股票招股意向书,finalpage/2010-03-04/57649583.PDF
2010-03-10,亚厦股份：首次公开发行股票网上路演公告,finalpage/2010-03-10/57671509.PDF
2010-03-11,亚厦股份：首次公开发行股票发行公告,finalpage/2010-03-11/57676352.PDF
2010-03-11,亚厦股份：首次公开发行股票投资风险特别公告,finalpage/2010-03-11/57676353.PDF
2010-03-11,亚厦股份：首次公开发行股票招股说明书,finalpage/2010-03-11/57676451.PDF
2010-03-11,亚厦股份：首次公开发行股票招股说明书摘要,finalpage/2010-03-11/57676454.PDF
2010-03-16,亚厦股份：首次公开发行股票网上定价发行申购情况及中签率公告,finalpage/2010-03-16/57691502.PDF
2010-03-16,亚厦股份：首次公开发行股票网下配售结果公告,finalpage/2010-03-16/57691506.PDF
2010-03-17,亚厦股份：首次公开发行股票网上定价发行摇号中签结果公告,finalpage/2010-03-17/57695994.PDF
2010-03-22,亚厦股份：财富里昂证券有限责任公司关于公司股票上市保荐书,finalpage/2010-03-22/57713264.PDF
2010-03-22,亚厦股份：北京市康达律师事务所关于公司首次公开发行的股票于深圳证券交易所上市的法律意见书,finalpage/2010-03-22/57713265.PDF
2010-03-22,亚厦股份：首次公开发行股票上市公告书,finalpage/2010-03-22/57713266.PDF
2010-03-30,亚厦股份：第一届董事会第十五次会议决议公告,finalpage/2010-03-30/57745834.PDF
2010-03-30,亚厦股份：关于签订募集资金三方监管协议的公告,finalpage/2010-03-30/57745836.PDF
2010-03-30,亚厦股份：信息披露管理制度（2010年3月）,finalpage/2010-03-30/57745837.PDF
2010-03-30,亚厦股份：内幕信息知情人登记制度（2010年3月）,finalpage/2010-03-30/57745838.PDF
2010-03-30,亚厦股份：投资者关系管理制度（2010年3月）,finalpage/2010-03-30/57745841.PDF
2010-03-30,亚厦股份：公司章程（2010年3月）,finalpage/2010-03-30/57745844.PDF
2010-03-30,亚厦股份：章程修改对照表（2010年3月修改）,finalpage/2010-03-30/57745845.PDF
2010-03-30,亚厦股份：董事会秘书工作细则（2010年3月）,finalpage/2010-03-30/57745846.PDF
2010-04-08,亚厦股份：2010年第一季度业绩预增公告,finalpage/2010-04-08/57782254.PDF
2010-04-13,亚厦股份：关于使用闲置募集资金暂时补充流动资金的公告,finalpage/2010-04-13/57802297.PDF
2010-04-13,亚厦股份：第一届监事会第七次会议决议公告,finalpage/2010-04-13/57802298.PDF
2010-04-13,亚厦股份：以自筹资金预先投入募投项目的专项鉴证报告,finalpage/2010-04-13/57802299.PDF
2010-04-13,亚厦股份：第一届董事会第十六次会议决议公告,finalpage/2010-04-13/57802300.PDF
2010-04-13,亚厦股份：关于召开2010年第一次临时股东大会的通知,finalpage/2010-04-13/57802301.PDF
2010-04-13,亚厦股份：关于用募集资金置换预先已投入募投项目的自筹资金的公告,finalpage/2010-04-13/57802302.PDF
2010-04-13,亚厦股份：独立董事关于募集资金使用相关事项的独立意见,finalpage/2010-04-13/57802303.PDF
2010-04-13,亚厦股份：董事、监事和高级管理人员持有和买卖本公司股票管理制度（2010年4月）,finalpage/2010-04-13/57802304.PDF
2010-04-13,亚厦股份：财富里昂证券有限责任公司关于公司使用募集资金置换已投入募集资金项目自筹资金事项发表的保荐意见,finalpage/2010-04-13/57802305.PDF
2010-04-28,亚厦股份：2010年第一季度报告正文,finalpage/2010-04-28/57882539.PDF
2010-04-28,亚厦股份：2010年第一季度报告全文,finalpage/2010-04-28/57882540.PDF
2010-04-30,亚厦股份：2010年第一次临时股东大会决议公告,finalpage/2010-04-30/57897448.PDF
2010-04-30,亚厦股份：第一届董事会第十八次会议决议公告,finalpage/2010-04-30/57897449.PDF
2010-04-30,亚厦股份：关于实施募集资金向子公司增资的公告,finalpage/2010-04-30/57897450.PDF
2010-04-30,亚厦股份：关联交易公告,finalpage/2010-04-30/57897451.PDF
2010-04-30,亚厦股份：关于召开2010年第二次临时股东大会的通知,finalpage/2010-04-30/57897452.PDF
2010-04-30,亚厦股份：2010年第一次临时股东大会的法律意见书,finalpage/2010-04-30/57897453.PDF
2010-04-30,亚厦股份：独立董事关于关联交易事项的独立意见,finalpage/2010-04-30/57897454.PDF
2010-04-30,亚厦股份：独立董事对关联交易的事前认可函,finalpage/2010-04-30/57897455.PDF
2010-04-30,亚厦股份：财富里昂证券有限公司关于公司关联交易的专项核查意见,finalpage/2010-04-30/57897456.PDF
2010-05-12,亚厦股份：关于全资子公司浙江亚厦产业园发展有限公司签订募集资金三方监管协议的公告,finalpage/2010-05-12/57938966.PDF
2010-05-19,亚厦股份：2010年第二次临时股东大会决议公告,finalpage/2010-05-19/57966172.PDF
2010-05-19,亚厦股份：2010年第二次临时股东大会的法律意见书,finalpage/2010-05-19/57966173.PDF
2010-05-26,亚厦股份：关于完成注册资本工商变更登记的公告,finalpage/2010-05-26/57993806.PDF
2010-05-29,亚厦股份：第一届董事会第十九次会议决议公告,finalpage/2010-05-29/58007102.PDF
2010-05-29,亚厦股份：关于加强上市公司治理专项活动的自查事项,finalpage/2010-05-29/58007103.PDF
2010-05-29,亚厦股份：关于加强上市公司治理专项活动自查报告及整改计划的公告,finalpage/2010-05-29/58007104.PDF
2010-06-12,亚厦股份：第一届董事会第二十次会议决议公告,finalpage/2010-06-12/58063223.PDF
2010-06-18,亚厦股份：关于网下配售股票上市流通的提示性公告,finalpage/2010-06-18/58070482.PDF
2010-07-06,亚厦股份：第一届董事会第二十一次会议决议公告,finalpage/2010-07-06/58137312.PDF
2010-07-06,亚厦股份：关于为浙江亚厦产业园提供担保的公告,finalpage/2010-07-06/58137313.PDF
2010-07-06,亚厦股份：独立董事关于变更营销网络项目实施方案的独立意见,finalpage/2010-07-06/58137314.PDF
2010-07-06,亚厦股份：关于变更营销网络项目实施方案的公告,finalpage/2010-07-06/58137315.PDF
2010-07-06,亚厦股份：关于选举第二届监事会职工代表监事公告,finalpage/2010-07-06/58137316.PDF
2010-07-06,亚厦股份：独立董事关于董事会换届相关事项的独立意见,finalpage/2010-07-06/58137317.PDF
2010-07-06,亚厦股份：独立董事提名人声明,finalpage/2010-07-06/58137318.PDF
2010-07-06,亚厦股份：第一届监事会第九次会议决议公告,finalpage/2010-07-06/58137319.PDF
2010-07-06,亚厦股份：财富里昂证券有限责任公司关于公司变更营销网络项目实施方案的专项意见,finalpage/2010-07-06/58137321.PDF
2010-07-06,亚厦股份：关于召开2010年第三次临时股东大会的通知,finalpage/2010-07-06/58137322.PDF
2010-07-06,亚厦股份：独立董事候选人声明,finalpage/2010-07-06/58137323.PDF
2010-07-22,亚厦股份：2010年第三次临时股东大会决议公告,finalpage/2010-07-22/58202871.PDF
2010-07-22,亚厦股份：2010年第三次临时股东大会的法律意见书,finalpage/2010-07-22/58202872.PDF
2010-07-22,亚厦股份：第二届监事会第一次会议决议公告,finalpage/2010-07-22/58202873.PDF
2010-08-03,亚厦股份：第二届监事会第二次会议决议公告,finalpage/2010-08-03/58251675.PDF
2010-08-03,亚厦股份：浙江亚厦产业园发展有限公司与浙江梁湖建设有限公司签署关联交易合同的公告,finalpage/2010-08-03/58251676.PDF
2010-08-03,亚厦股份：浙江亚厦景观园林工程有限公司与镇江亚厦房地产开发有限公司签署关联交易合同的公告,finalpage/2010-08-03/58251677.PDF
2010-08-03,亚厦股份：累积投票制实施细则（2010年7月）,finalpage/2010-08-03/58251678.PDF
2010-08-03,亚厦股份：第二届董事会第一次会议决议公告,finalpage/2010-08-03/58251679.PDF
2010-08-03,亚厦股份：独立董事关于变更营销网络项目和建筑装饰技术研发中心项目实施方案的独立意见,finalpage/2010-08-03/58251680.PDF
2010-08-03,亚厦股份：关于调整建筑装饰技术研发中心项目实施方案的公告,finalpage/2010-08-03/58251681.PDF
2010-08-03,亚厦股份：关于调整营销网络项目实施方案的公告,finalpage/2010-08-03/58251682.PDF
2010-08-03,亚厦股份：关于部分超募资金使用方案的公告,finalpage/2010-08-03/58251683.PDF
2010-08-03,亚厦股份：年报信息披露重大差错责任追究制度（2010年7月）,finalpage/2010-08-03/58251684.PDF
2010-08-03,亚厦股份：独立董事关于聘任高级管理人员的独立意见,finalpage/2010-08-03/58251685.PDF
2010-08-03,亚厦股份：关于加强上市公司治理专项活动的整改报告,finalpage/2010-08-03/58251686.PDF
2010-08-03,亚厦股份：关于召开2010年第四次临时股东大会的通知,finalpage/2010-08-03/58251687.PDF
2010-08-03,亚厦股份：独立董事关于关联交易事项的独立意见,finalpage/2010-08-03/58251688.PDF
2010-08-03,亚厦股份：关于公司部分超募资金使用方案的独立意见,finalpage/2010-08-03/58251689.PDF
2010-08-03,亚厦股份：独立董事对关联交易的事前认可函,finalpage/2010-08-03/58251690.PDF
2010-08-03,亚厦股份：突发事件处理制度（2010年7月）,finalpage/2010-08-03/58251691.PDF
2010-08-03,亚厦股份：财富里昂证券有限公司关于公司关联交易的专项意见,finalpage/2010-08-03/58251692.PDF
2010-08-03,亚厦股份：财富里昂证券有限公司关于公司关联交易的专项核查意见,finalpage/2010-08-03/58251693.PDF
2010-08-03,亚厦股份：财富里昂证券有限责任公司关于公司变更营销网络项目和建筑装饰技术研发中心项目实施方案的专项意见,finalpage/2010-08-03/58251694.PDF
2010-08-03,亚厦股份：财富里昂证券有限公司关于公司部分超募资金使用方案的专项核查意见,finalpage/2010-08-03/58251695.PDF
2010-08-26,亚厦股份：2010年半年度报告,finalpage/2010-08-26/58355270.PDF
2010-08-26,亚厦股份：2010年第四次临时股东大会决议公告,finalpage/2010-08-26/58355189.PDF
2010-08-26,亚厦股份：2010年半年度报告摘要,finalpage/2010-08-26/58355190.PDF
2010-08-26,亚厦股份：2010年半年度财务报告,finalpage/2010-08-26/58355196.PDF
2010-08-26,亚厦股份：第二届董事会第二次会议决议公告,finalpage/2010-08-26/58355197.PDF
2010-08-26,亚厦股份：独立董事对公司累计和当期对外担保情况及关联方占用资金情况的专项说明和独立意见,finalpage/2010-08-26/58355199.PDF
2010-08-26,亚厦股份：2010年第四次临时股东大会的法律意见书,finalpage/2010-08-26/58355200.PDF
2010-08-26,亚厦股份：独立董事关于聘任高级管理人员的独立意见,finalpage/2010-08-26/58355203.PDF
2010-09-03,亚厦股份：停牌公告,finalpage/2010-09-03/58395782.PDF
2010-09-04,亚厦股份：关于投资设立子公司的公告,finalpage/2010-09-04/58400581.PDF
2010-09-04,亚厦股份：股票期权激励计划草案（摘要）,finalpage/2010-09-04/58400582.PDF
2010-09-04,亚厦股份：股票期权激励计划（草案）,finalpage/2010-09-04/58400583.PDF
2010-09-04,亚厦股份：第二届董事会第三次会议决议公告,finalpage/2010-09-04/58400584.PDF
2010-09-04,亚厦股份：第二届监事会第四次会议决议公告,finalpage/2010-09-04/58400585.PDF
2010-09-04,亚厦股份：股票期权激励计划实施考核办法,finalpage/2010-09-04/58400586.PDF
2010-09-04,亚厦股份：独立董事关于公司股票期权激励计划（草案）的独立意见,finalpage/2010-09-04/58400587.PDF
2010-09-04,亚厦股份：股权激励人员名单,finalpage/2010-09-04/58400588.PDF
2010-10-12,亚厦股份：第二届董事会第四次会议决议公告,finalpage/2010-10-12/58510092.PDF
2010-10-12,亚厦股份：关于归还前次补充流动资金的募集资金并继续使用部分闲置募集资金暂时补充流动资金的公告,finalpage/2010-10-12/58510095.PDF
2010-10-12,亚厦股份：第二届监事会第五次会议决议公告,finalpage/2010-10-12/58510098.PDF
2010-10-12,亚厦股份：独立董事关于继续使用部分闲置募集资金暂时补充流动资金的独立意见,finalpage/2010-10-12/58510099.PDF
2010-10-12,亚厦股份：财富里昂证券有限责任公司关于公司继续使用部分闲置的募集资金暂时补充流动资金事项发表的保荐意见,finalpage/2010-10-12/58510100.PDF
2010-10-28,亚厦股份：2010年第三季度报告正文,finalpage/2010-10-28/58585701.PDF
2010-10-28,亚厦股份：2010年第三季度报告全文,finalpage/2010-10-28/58585702.PDF
2010-11-11,亚厦股份：第二届董事会第六次会议决议公告,finalpage/2010-11-11/58650039.PDF
2010-11-11,亚厦股份：关于召开2010年第五次临时股东大会的通知,finalpage/2010-11-11/58650040.PDF
2010-11-11,亚厦股份：关于部分超募集资金使用方案的公告,finalpage/2010-11-11/58650041.PDF
2010-11-11,亚厦股份：第二届监事会第七次会议决议公告,finalpage/2010-11-11/58650042.PDF
2010-11-11,亚厦股份：独立董事关于聘任高级管理人员的独立意见,finalpage/2010-11-11/58650043.PDF
2010-11-11,亚厦股份：独立董事关于公司部分超募资金使用方案的独立意见,finalpage/2010-11-11/58650044.PDF
2010-11-11,亚厦股份：财富里昂证券有限责任公司关于公司部分超额募集资金使用方案事项发表的保荐意见,finalpage/2010-11-11/58650045.PDF
2010-11-19,亚厦股份：股东股权质押公告,finalpage/2010-11-19/58681181.PDF
2010-11-23,亚厦股份：关于召开2010年第五次临时股东大会的提示性公告,finalpage/2010-11-23/58693124.PDF
2010-11-23,亚厦股份：关于与恒大地产集团有限公司签署战略合作协议的公告,finalpage/2010-11-23/58693933.PDF
2010-11-25,亚厦股份：股东股权质押公告,finalpage/2010-11-25/58702917.PDF
2010-11-27,亚厦股份：2010年第五次临时股东大会决议公告,finalpage/2010-11-27/58711740.PDF
2010-11-27,亚厦股份：2010年第五次临时股东大会的法律意见书,finalpage/2010-11-27/58711741.PDF
2010-12-24,亚厦股份：股东股权质押公告,finalpage/2010-12-24/58819928.PDF
2010-12-31,亚厦股份：关于公司及全资子公司浙江亚厦幕墙有限公司被认定为高新技术企业的公告,finalpage/2010-12-31/58849629.PDF
2011-01-19,亚厦股份：第二届董事会第七次会议决议公告,finalpage/2011-01-19/58918411.PDF
2011-01-19,亚厦股份：关于继续使用募集资金对子公司增资的公告,finalpage/2011-01-19/58918412.PDF
2011-02-19,亚厦股份：股东股权质押公告,finalpage/2011-02-19/59018154.PDF
2011-02-23,亚厦股份：第二届董事会第八次会议决议公告,finalpage/2011-02-23/59032095.PDF
2011-02-26,亚厦股份：2010年度业绩快报,finalpage/2011-02-26/59048446.PDF
2011-03-18,亚厦股份：财富里昂证券有限责任公司关于公司首次公开发行前已发行部分股份上市流通的核查意见,finalpage/2011-03-18/59135898.PDF
2011-03-18,亚厦股份：首次公开发行前已发行股份上市流通提示性公告,finalpage/2011-03-18/59135899.PDF
2011-03-23,亚厦股份：关于更换保荐代表人的公告,finalpage/2011-03-23/59158766.PDF
2011-03-26,亚厦股份：财富里昂证券有限责任公司关于公司2010年度募集资金存放与使用情况的专项核查报告,finalpage/2011-03-26/59177034.PDF
2011-03-26,亚厦股份：2010年年度报告摘要,finalpage/2011-03-26/59177035.PDF
2011-03-26,亚厦股份：2010年年度报告,finalpage/2011-03-26/59177037.PDF
2011-03-26,亚厦股份：2010年年度审计报告,finalpage/2011-03-26/59177038.PDF
2011-03-26,亚厦股份：第二届董事会第九次会议决议公告,finalpage/2011-03-26/59177039.PDF
2011-03-26,亚厦股份：关于召开2010年度股东大会的通知,finalpage/2011-03-26/59177040.PDF
2011-03-26,亚厦股份：第二届监事会第八次会议决议公告,finalpage/2011-03-26/59177041.PDF
2011-03-26,亚厦股份：关于公司控股股东及其他关联方资金占用情况的专项说明,finalpage/2011-03-26/59177042.PDF
2011-03-26,亚厦股份：关于2010年度内部控制的自我评价报告,finalpage/2011-03-26/59177043.PDF
2011-03-26,亚厦股份：董事会关于募集资金2009年度存放和使用情况的专项说明,finalpage/2011-03-26/59177044.PDF
2011-03-26,亚厦股份：募集资金存放与使用情况鉴证报告,finalpage/2011-03-26/59177045.PDF
2011-03-26,亚厦股份：独立董事关于公司相关事项的独立意见,finalpage/2011-03-26/59177046.PDF
2011-03-26,亚厦股份：2010年度独立董事述职报告（董宜君）,finalpage/2011-03-26/59177047.PDF
2011-03-26,亚厦股份：关于为公司全资子公司提供担保的公告,finalpage/2011-03-26/59177048.PDF
2011-03-26,亚厦股份：子公司管理制度（2011年3月）,finalpage/2011-03-26/59177049.PDF
2011-03-26,亚厦股份：授权管理制度（2011年3月）,finalpage/2011-03-26/59177050.PDF
2011-03-26,亚厦股份：关于2011年度日常关联交易预计情况的公告,finalpage/2011-03-26/59177051.PDF
2011-03-26,亚厦股份：关于举行网上2010年度报告说明会的通知,finalpage/2011-03-26/59177052.PDF
2011-03-26,亚厦股份：关于使用超募资金投资建设石材制品工厂化项目的公告,finalpage/2011-03-26/59177053.PDF
2011-03-26,亚厦股份：关于使用超募资金永久补充流动资金的公告,finalpage/2011-03-26/59177054.PDF
2011-03-26,亚厦股份：财富里昂证券有限责任公司关于公司《2010年度内部控制的自我评价报告》的核查意见,finalpage/2011-03-26/59177055.PDF
2011-03-26,亚厦股份：公司章程（2011年3月）,finalpage/2011-03-26/59177056.PDF
2011-03-26,亚厦股份：2010年度独立董事述职报告（任永平）,finalpage/2011-03-26/59177057.PDF
2011-03-26,亚厦股份：2010年度独立董事述职报告（唐世定）,finalpage/2011-03-26/59177058.PDF
2011-03-26,亚厦股份：2010年度独立董事述职报告（王维安）,finalpage/2011-03-26/59177059.PDF
2011-03-26,亚厦股份：财富里昂证券有限责任公司关于公司部分超额募集资金使用方案事项发表的保荐意见,finalpage/2011-03-26/59177060.PDF
2011-03-26,亚厦股份：财富里昂证券有限责任公司关于公司2011年度日常关联交易预计情况的专项意见,finalpage/2011-03-26/59177062.PDF
2011-04-09,亚厦股份：关于归还募集资金的公告,finalpage/2011-04-09/59240882.PDF
2011-04-19,亚厦股份：2010年度股东大会决议公告,finalpage/2011-04-19/59288839.PDF
2011-04-19,亚厦股份：2010年年度股东大会的法律意见书,finalpage/2011-04-19/59288840.PDF
2011-04-19,亚厦股份：关于召开2011年第一次临时股东大会的通知,finalpage/2011-04-19/59288841.PDF
2011-04-19,亚厦股份：关于公司《股票期权激励计划（草案）》的补充法律意见书,finalpage/2011-04-19/59288842.PDF
2011-04-19,亚厦股份：关于公司《股票期权激励计划（草案）》的法律意见书,finalpage/2011-04-19/59288843.PDF
2011-04-19,亚厦股份：股票期权激励计划（修订稿）,finalpage/2011-04-19/59288844.PDF
2011-04-19,亚厦股份：股票期权激励计划摘要（修订稿）,finalpage/2011-04-19/59288845.PDF
2011-04-19,亚厦股份：第二届董事会第十次会议决议公告,finalpage/2011-04-19/59288846.PDF
2011-04-19,亚厦股份：独立董事关于《公司股票期权激励计划（草案）》(修订稿)的独立意见,finalpage/2011-04-19/59288847.PDF
2011-04-19,亚厦股份：独立董事征集投票权授权报告书,finalpage/2011-04-19/59288848.PDF
2011-04-19,亚厦股份：第二届监事会第九次会议决议公告,finalpage/2011-04-19/59288849.PDF
2011-04-19,亚厦股份：股权激励人员名单,finalpage/2011-04-19/59288850.PDF
2011-04-23,亚厦股份：关于募集资金专项账户升级的公告,finalpage/2011-04-23/59321688.PDF
2011-04-28,亚厦股份：2011年第一季度报告正文,finalpage/2011-04-28/59353299.PDF
2011-04-28,亚厦股份：2011年第一季度报告全文,finalpage/2011-04-28/59353302.PDF
2011-04-28,亚厦股份：第二届监事会第十次会议决议公告,finalpage/2011-04-28/59353303.PDF
2011-04-28,亚厦股份：第二届董事会第十一次会议决议公告,finalpage/2011-04-28/59353304.PDF
2011-04-28,亚厦股份：关于召开2011年第一次临时股东大会的提示性公告,finalpage/2011-04-28/59353305.PDF
2011-04-28,亚厦股份：关于继续使用募集资金对子公司增资的公告,finalpage/2011-04-28/59353306.PDF
2011-04-28,亚厦股份：关于使用超募资金对子公司增资的公告,finalpage/2011-04-28/59353307.PDF
2011-04-28,亚厦股份：独立董事关于第二届董事会第十一次会议相关事项的独立意见,finalpage/2011-04-28/59353308.PDF
2011-04-28,亚厦股份：财富里昂证券有限责任公司关于公司使用超额募集资金对子公司增资事项发表的保荐意见,finalpage/2011-04-28/59353309.PDF
2011-05-06,亚厦股份：2011年第一次临时股东大会决议公告,finalpage/2011-05-06/59391826.PDF
2011-05-06,亚厦股份：2011年第一次临时股东大会的法律意见书,finalpage/2011-05-06/59391827.PDF
2011-05-07,亚厦股份：关于股票期权激励计划授予相关事项的公告,finalpage/2011-05-07/59397082.PDF
2011-05-07,亚厦股份：关于公司授予股票期权相关事项的法律意见书,finalpage/2011-05-07/59397083.PDF
2011-05-07,亚厦股份：2010年度权益分派实施公告,finalpage/2011-05-07/59397084.PDF
2011-05-07,亚厦股份：第二届董事会第十二次会议决议公告,finalpage/2011-05-07/59397085.PDF
2011-05-07,亚厦股份：独立董事关于股票期权激励计划授予相关事项的独立意见,finalpage/2011-05-07/59397086.PDF
2011-05-07,亚厦股份：第二届监事会第十一次会议决议公告,finalpage/2011-05-07/59397087.PDF
2011-05-07,亚厦股份：股权激励人员名单,finalpage/2011-05-07/59397088.PDF
2011-05-10,亚厦股份：关于对公司股票期权激励计划涉及的股票期权数量和行权价格进行调整的公告,finalpage/2011-05-10/59405542.PDF
2011-05-10,亚厦股份：关于公司股票期权激励计划期权数量和行权价格调整的法律意见书,finalpage/2011-05-10/59405543.PDF
2011-05-10,亚厦股份：第二届董事会第十三次会议决议公告,finalpage/2011-05-10/59405544.PDF
