,date,title,url
0,2009-12-25,赛象科技：首次公开发行A股股票初步询价及推介公告,finalpage/2009-12-25/57435979.PDF
1,2009-12-25,赛象科技：渤海证券股份有限公司关于公司首次公开发行股票之发行保荐工作报告,finalpage/2009-12-25/57435958.PDF
2,2009-12-25,赛象科技：渤海证券股份有限公司关于公司首次公开发行股票之发行保荐书,finalpage/2009-12-25/57435964.PDF
3,2009-12-25,赛象科技：关于公司截止2009年6月30日内部控制制度完整性、合理性、有效性的鉴证报告,finalpage/2009-12-25/57435965.PDF
4,2009-12-25,赛象科技：2009年1-6月、2008年度、2007年度、2006年度非经常性损益表,finalpage/2009-12-25/57435966.PDF
5,2009-12-25,赛象科技：公司章程（草案）,finalpage/2009-12-25/57435967.PDF
6,2009-12-25,赛象科技：三届四次董事会决议,finalpage/2009-12-25/57435968.PDF
7,2009-12-25,赛象科技：2008年第一次临时股东大会决议,finalpage/2009-12-25/57435969.PDF
8,2009-12-25,赛象科技：截止2009年6月30日、2008年12月31日、2007年12月31日、2006年12月31日财务报表的审计报告,finalpage/2009-12-25/57435970.PDF
9,2009-12-25,赛象科技：嘉德恒时律师事务所关于公司发行A股并上市的法律意见书,finalpage/2009-12-25/57435973.PDF
10,2009-12-25,赛象科技：嘉德恒时律师事务所关于公司发行A股并上市的律师工作报告,finalpage/2009-12-25/57435976.PDF
11,2009-12-25,赛象科技：中国证监会关于核准公司首次公开发行股票的批复,finalpage/2009-12-25/57435980.PDF
12,2009-12-25,赛象科技：首次公开发行股票招股意向书,finalpage/2009-12-25/57435981.PDF
13,2009-12-25,赛象科技：首次公开发行股票招股意向书摘要,finalpage/2009-12-25/57435982.PDF
14,2009-12-31,赛象科技：首次公开发行A股股票网上路演公告,finalpage/2009-12-31/57457205.PDF
15,2010-01-04,赛象科技：首次公开发行A股股票发行公告,finalpage/2010-01-04/57461684.PDF
16,2010-01-04,赛象科技：首次公开发行A股股票投资风险特别公告,finalpage/2010-01-04/57461686.PDF
17,2010-01-04,赛象科技：首次公开发行股票招股说明书,finalpage/2010-01-04/57461687.PDF
18,2010-01-04,赛象科技：首次公开发行股票招股说明书摘要,finalpage/2010-01-04/57461688.PDF
19,2010-01-07,赛象科技：首次公开发行A股股票网上定价发行申购情况及中签率公告,finalpage/2010-01-07/57479213.PDF
20,2010-01-07,赛象科技：首次公开发行A股股票网下配售结果公告,finalpage/2010-01-07/57479215.PDF
21,2010-01-08,赛象科技：首次公开发行A股股票网上定价发行摇号中签结果公告,finalpage/2010-01-08/57483427.PDF
22,2010-01-14,赛象科技：首次公开发行股票上市公告书,finalpage/2010-01-14/57503097.PDF
23,2010-01-14,赛象科技：嘉德恒时律师事务所关于公司首次公开发行股票并在深圳证券交易所上市之法律意见书,finalpage/2010-01-14/57503102.PDF
24,2010-01-14,赛象科技：渤海证券股份有限公司关于公司股票上市保荐书,finalpage/2010-01-14/57503105.PDF
25,2010-02-10,赛象科技：第三届董事会第十九次会议决议公告,finalpage/2010-02-10/57598574.PDF
26,2010-02-10,赛象科技：关于变更公司2009年度财务审计机构议案的公告,finalpage/2010-02-10/57598575.PDF
27,2010-02-10,赛象科技：关于签订募集资金三方监管协议的公告,finalpage/2010-02-10/57598576.PDF
28,2010-02-10,赛象科技：关于用募集资金置换预先已投入募集资金投资项目的自筹资金的公告,finalpage/2010-02-10/57598577.PDF
29,2010-02-10,赛象科技：日常关联交易公告,finalpage/2010-02-10/57598578.PDF
30,2010-02-10,赛象科技：关于召开2010年第一次临时股东大会的通知,finalpage/2010-02-10/57598579.PDF
31,2010-02-10,赛象科技：第三届监事会第八次会议决议公告,finalpage/2010-02-10/57598580.PDF
32,2010-02-10,赛象科技：公司章程（2010年2月）,finalpage/2010-02-10/57598581.PDF
33,2010-02-10,赛象科技：董事会议事规则（2010年2月）,finalpage/2010-02-10/57598582.PDF
34,2010-02-10,赛象科技：监事会议事规则,finalpage/2010-02-10/57598583.PDF
35,2010-02-10,赛象科技：股东大会议事规则（2010年2月）,finalpage/2010-02-10/57598584.PDF
36,2010-02-10,赛象科技：独立董事制度,finalpage/2010-02-10/57598585.PDF
37,2010-02-10,赛象科技：总经理工作细则,finalpage/2010-02-10/57598586.PDF
38,2010-02-10,赛象科技：董事会审计委员会实施细则,finalpage/2010-02-10/57598587.PDF
39,2010-02-10,赛象科技：董事会提名委员会实施细则,finalpage/2010-02-10/57598588.PDF
40,2010-02-10,赛象科技：董事会薪酬与考核委员会实施细则,finalpage/2010-02-10/57598589.PDF
41,2010-02-10,赛象科技：董事会战略及投资评审委员会实施细则,finalpage/2010-02-10/57598590.PDF
42,2010-02-10,赛象科技：验资报告,finalpage/2010-02-10/57598591.PDF
43,2010-02-10,赛象科技：关于公司募集资金投资项目实际自筹资金使用情况专项审计报告,finalpage/2010-02-10/57598592.PDF
44,2010-02-10,赛象科技：渤海证券股份有限公司关于公司用募集资金置换预先已投入募集资金投资项目的自筹资金的核查意见,finalpage/2010-02-10/57598593.PDF
45,2010-02-10,赛象科技：独立董事关于关联交易事项的事前认可函,finalpage/2010-02-10/57598594.PDF
46,2010-02-10,赛象科技：独立董事对《公司与天津赛象酒店有限公司签署服务协议的议案》发表的独立意见,finalpage/2010-02-10/57598595.PDF
47,2010-02-10,赛象科技：独立董事对《关于用募集资金置换预先已投入募集资金项目的自筹资金的议案》发表的独立意见,finalpage/2010-02-10/57598596.PDF
48,2010-02-10,赛象科技：独立董事对《关于更换公司2009年度财务审计机构的的议案》发表的独立意见,finalpage/2010-02-10/57598597.PDF
49,2010-02-26,赛象科技：2010年第一次临时股东大会决议公告,finalpage/2010-02-26/57627052.PDF
50,2010-02-26,赛象科技：2010年第一次临时股东大会见证的法律意见书,finalpage/2010-02-26/57627053.PDF
51,2010-04-02,赛象科技：2009年年度审计报告,finalpage/2010-04-02/57764610.PDF
52,2010-04-02,赛象科技：信息披露管理制度（2010年3月）,finalpage/2010-04-02/57764602.PDF
53,2010-04-02,赛象科技：内部审计制度（2010年3月）,finalpage/2010-04-02/57764603.PDF
54,2010-04-02,赛象科技：投资者关系管理办法（2010年3月）,finalpage/2010-04-02/57764604.PDF
55,2010-04-02,赛象科技：内幕信息知情人报备制度（2010年3月）,finalpage/2010-04-02/57764605.PDF
56,2010-04-02,赛象科技：独立董事年报工作制度（2010年3月）,finalpage/2010-04-02/57764606.PDF
57,2010-04-02,赛象科技：内部控制制度（2010年3月）,finalpage/2010-04-02/57764607.PDF
58,2010-04-02,赛象科技：2009年年度报告摘要,finalpage/2010-04-02/57764608.PDF
59,2010-04-02,赛象科技：第三届董事会第二十次会议决议公告,finalpage/2010-04-02/57764611.PDF
60,2010-04-02,赛象科技：关于召开2009年度股东大会通知,finalpage/2010-04-02/57764612.PDF
61,2010-04-02,赛象科技：第三届监事会第九次会议决议公告,finalpage/2010-04-02/57764613.PDF
62,2010-04-02,赛象科技：控股股东及其他关联方资金占用情况的专项说明,finalpage/2010-04-02/57764614.PDF
63,2010-04-02,赛象科技：2009年年度报告,finalpage/2010-04-02/57764615.PDF
64,2010-04-02,赛象科技：2009年度内部控制自我评价报告,finalpage/2010-04-02/57764616.PDF
65,2010-04-02,赛象科技：独立董事关于公司对外担保情况的独立意见,finalpage/2010-04-02/57764617.PDF
66,2010-04-02,赛象科技：2009年度独立董事述职报告,finalpage/2010-04-02/57764618.PDF
67,2010-04-02,赛象科技：渤海证券股份有限公司关于公司内部控制自我评价报告的核查意见,finalpage/2010-04-02/57764619.PDF
68,2010-04-02,赛象科技：独立董事关于公司三届二十次董事会相关事项的独立意见,finalpage/2010-04-02/57764620.PDF
69,2010-04-06,赛象科技：关于举行2009年度报告网上说明会的通知,finalpage/2010-04-06/57770012.PDF
70,2010-04-12,赛象科技：关于网下配售股票上市流通的提示性公告,finalpage/2010-04-12/57794401.PDF
71,2010-04-21,赛象科技：2010年第一季度报告正文,finalpage/2010-04-21/57841972.PDF
72,2010-04-21,赛象科技：2010年第一季度报告全文,finalpage/2010-04-21/57841974.PDF
73,2010-04-23,赛象科技：2009年度股东大会决议公告,finalpage/2010-04-23/57854873.PDF
74,2010-04-23,赛象科技：2009年度股东大会见证的法律意见书,finalpage/2010-04-23/57854874.PDF
75,2010-05-15,赛象科技：第三届董事会第二十二次会议决议公告,finalpage/2010-05-15/57953278.PDF
76,2010-05-15,赛象科技：第三届监事会第十一次会议决议公告,finalpage/2010-05-15/57953279.PDF
77,2010-05-15,赛象科技：关于召开2010年第二次临时股东大会通知,finalpage/2010-05-15/57953280.PDF
78,2010-05-15,赛象科技：关于职工代表监事选举结果的公告,finalpage/2010-05-15/57953281.PDF
79,2010-05-15,赛象科技：2009年度权益分派实施公告,finalpage/2010-05-15/57953282.PDF
80,2010-05-15,赛象科技：董事会审计委员会年报工作规程（2010年5月）,finalpage/2010-05-15/57953283.PDF
81,2010-05-15,赛象科技：年报信息披露重大差错责任追究制度（2010年5月）,finalpage/2010-05-15/57953284.PDF
82,2010-05-15,赛象科技：外部信息使用人管理制度（2010年5月）,finalpage/2010-05-15/57953285.PDF
83,2010-05-15,赛象科技：独立董事候选人声明,finalpage/2010-05-15/57953286.PDF
84,2010-05-15,赛象科技：独立董事关于董事会换届选举议案的独立意见,finalpage/2010-05-15/57953287.PDF
85,2010-05-15,赛象科技：独立董事提名人声明,finalpage/2010-05-15/57953288.PDF
86,2010-06-02,赛象科技：2010年第二次临时股东大会决议公告,finalpage/2010-06-02/58019747.PDF
87,2010-06-02,赛象科技：第四届董事会第一次会议决议公告,finalpage/2010-06-02/58019748.PDF
88,2010-06-02,赛象科技：关于用部分超募资金永久补充流动资金的公告,finalpage/2010-06-02/58019749.PDF
89,2010-06-02,赛象科技：第四届监事会第一次会议决议公告,finalpage/2010-06-02/58019750.PDF
90,2010-06-02,赛象科技：2010年第二次临时股东大会见证的法律意见书,finalpage/2010-06-02/58019751.PDF
91,2010-06-02,赛象科技：公司承诺,finalpage/2010-06-02/58019752.PDF
92,2010-06-02,赛象科技：独立董事关于用部分超募资金永久补充流动资金事项的独立意见,finalpage/2010-06-02/58019755.PDF
93,2010-06-02,赛象科技：独立董事关于聘任高级管理人员议案的独立意见,finalpage/2010-06-02/58019756.PDF
94,2010-06-02,赛象科技：渤海证券股份有限公司关于公司用部分超募资金永久补充流动资金的核查意见,finalpage/2010-06-02/58019761.PDF
95,2010-06-18,赛象科技：关于公司证券部联系电话变更的公告,finalpage/2010-06-18/58070483.PDF
96,2010-08-10,赛象科技：关于召开2010年第三次临时股东大会通知,finalpage/2010-08-10/58281713.PDF
97,2010-08-10,赛象科技：2010年半年度报告摘要,finalpage/2010-08-10/58281716.PDF
98,2010-08-10,赛象科技：2010年半年度财务报告,finalpage/2010-08-10/58281722.PDF
99,2010-08-10,赛象科技：第四届董事会第二次会议决议公告,finalpage/2010-08-10/58281723.PDF
100,2010-08-10,赛象科技：2010年半年度报告,finalpage/2010-08-10/58281724.PDF
101,2010-08-10,赛象科技：独立董事关于控股股东及其他关联方占用公司资金、公司对外担保情况的专项说明和独立意见,finalpage/2010-08-10/58281727.PDF
102,2010-08-26,赛象科技：2010年第三次临时股东大会决议公告,finalpage/2010-08-26/58354748.PDF
103,2010-08-26,赛象科技：2010年第三次临时股东大会见证的法律意见书,finalpage/2010-08-26/58354749.PDF
104,2010-09-29,赛象科技：第四届董事会第三次会议决议公告,finalpage/2010-09-29/58481443.PDF
105,2010-09-29,赛象科技：内幕信息知情人登记备案制度（2010年9月）,finalpage/2010-09-29/58481444.PDF
106,2010-10-20,赛象科技：2010年第三季度报告正文,finalpage/2010-10-20/58543271.PDF
107,2010-10-20,赛象科技：2010年第三季度报告全文,finalpage/2010-10-20/58543273.PDF
108,2010-11-15,赛象科技：第四届董事会第五次会议决议公告,finalpage/2010-11-15/58658998.PDF
109,2010-11-15,赛象科技：关于向山东德瑞宝轮胎有限公司销售产品提供按揭贷款回购担保的公告,finalpage/2010-11-15/58658999.PDF
110,2010-11-15,赛象科技：独立董事关于向山东德瑞宝轮胎有限公司销售产品提供按揭贷款回购担保的议案的独立意见,finalpage/2010-11-15/58659000.PDF
111,2010-11-15,赛象科技：渤海证券股份有限公司关于公司对外提供担保的核查意见,finalpage/2010-11-15/58659001.PDF
112,2011-01-15,赛象科技：关于首次公开发行前已发行股份上市流通提示性公告,finalpage/2011-01-15/58905996.PDF
113,2011-01-15,赛象科技：渤海证券股份有限公司关于公司限售股份上市流通事项的核查意见,finalpage/2011-01-15/58905997.PDF
114,2011-02-11,赛象科技：第四届董事会第六次会议决议公告,finalpage/2011-02-11/58983897.PDF
115,2011-02-11,赛象科技：关于向山东德瑞宝轮胎有限公司销售产品提供按揭贷款回购担保的公告,finalpage/2011-02-11/58983898.PDF
116,2011-02-11,赛象科技：独立董事关于向山东德瑞宝轮胎有限公司销售产品提供按揭贷款回购担保的议案的独立意见,finalpage/2011-02-11/58983899.PDF
117,2011-02-11,赛象科技：渤海证券股份有限公司关于公司对外提供担保的核查意见,finalpage/2011-02-11/58983900.PDF
118,2011-02-24,赛象科技：2010年度业绩快报,finalpage/2011-02-24/59037559.PDF
119,2011-03-30,赛象科技：关于2010年度利润分配及公积金转增股本预案的公告,finalpage/2011-03-30/59197564.PDF
120,2011-04-11,赛象科技：关于举行2010年度报告网上说明会的通知,finalpage/2011-04-11/59241079.PDF
121,2011-04-11,赛象科技：2010年年度报告摘要,finalpage/2011-04-11/59241080.PDF
122,2011-04-11,赛象科技：2010年年度审计报告,finalpage/2011-04-11/59241117.PDF
123,2011-04-11,赛象科技：第四届董事会第七次会议决议公告,finalpage/2011-04-11/59241118.PDF
124,2011-04-11,赛象科技：关于召开2010年度股东大会的通知,finalpage/2011-04-11/59241119.PDF
125,2011-04-11,赛象科技：第四届监事会第四次会议决议公告,finalpage/2011-04-11/59241120.PDF
126,2011-04-11,赛象科技：控股股东及其他关联方资金占用情况专项说明,finalpage/2011-04-11/59241121.PDF
127,2011-04-11,赛象科技：2010年年度报告,finalpage/2011-04-11/59241122.PDF
128,2011-04-11,赛象科技：2010年度内部控制自我评价报告,finalpage/2011-04-11/59241123.PDF
129,2011-04-11,赛象科技：内部控制鉴证报告,finalpage/2011-04-11/59241124.PDF
130,2011-04-11,赛象科技：董事会关于募集资金年度存放与使用情况的专项报告,finalpage/2011-04-11/59241125.PDF
131,2011-04-11,赛象科技：2010年度募集资金存放与使用情况的鉴证报告,finalpage/2011-04-11/59241126.PDF
132,2011-04-11,赛象科技：独立董事关于控股股东及其他关联方占用公司资金、公司对外担保情况的专项说明和独立意见,finalpage/2011-04-11/59241127.PDF
133,2011-04-11,赛象科技：2010年度独立董事述职报告,finalpage/2011-04-11/59241128.PDF
134,2011-04-11,赛象科技：渤海证券股份有限公司关于《天津赛象科技股份有限公司2010年度内部控制自我评价报告》的核查意见,finalpage/2011-04-11/59241129.PDF
135,2011-04-11,赛象科技：渤海证券股份有限公司关于公司2010年度募集资金存放和实际使用情况的核查意见,finalpage/2011-04-11/59241130.PDF
136,2011-04-11,赛象科技：独立董事关于公司四届七次董事会相关事项的独立意见,finalpage/2011-04-11/59241131.PDF
137,2011-04-13,赛象科技：2010年年度审计报告（更正后）,finalpage/2011-04-13/59258450.PDF
138,2011-04-13,赛象科技：2010年年度报告（更正后）,finalpage/2011-04-13/59258455.PDF
139,2011-04-13,赛象科技：更正公告,finalpage/2011-04-13/59258456.PDF
140,2011-04-28,赛象科技：对外担保管理制度（2011年4月）,finalpage/2011-04-28/59352408.PDF
141,2011-04-28,赛象科技：分公司、子公司管理制度（2011年4月）,finalpage/2011-04-28/59352409.PDF
142,2011-04-28,赛象科技：投资管理制度（2011年4月）,finalpage/2011-04-28/59352410.PDF
143,2011-04-28,赛象科技：重大事项处置权限管理制度（2011年4月）,finalpage/2011-04-28/59352411.PDF
144,2011-04-28,赛象科技：关联交易公允决策制度（2011年4月）,finalpage/2011-04-28/59352412.PDF
145,2011-04-28,赛象科技：2011年第一季度报告正文,finalpage/2011-04-28/59352413.PDF
146,2011-04-28,赛象科技：2011年第一季度报告全文,finalpage/2011-04-28/59352415.PDF
147,2011-04-28,赛象科技：第四届董事会第八次会议决议公告,finalpage/2011-04-28/59352416.PDF
148,2011-04-28,赛象科技：独立董事关于聘任高级管理人员议案的独立意见,finalpage/2011-04-28/59352417.PDF
149,2011-05-06,赛象科技：2010年度股东大会的法律意见书,finalpage/2011-05-06/59391556.PDF
150,2011-05-06,赛象科技：2010年度股东大会决议公告,finalpage/2011-05-06/59391557.PDF
151,2011-05-18,赛象科技：2010年度权益分派实施公告,finalpage/2011-05-18/59441761.PDF
152,2011-08-15,赛象科技：关于向山东德瑞宝轮胎有限公司销售产品提供融资租赁业务回购担保的公告,finalpage/2011-08-15/59811705.PDF
153,2011-08-15,赛象科技：关于用部分超募资金永久补充流动资金的公告,finalpage/2011-08-15/59811706.PDF
154,2011-08-15,赛象科技：第四届董事会第九次会议决议公告,finalpage/2011-08-15/59811707.PDF
155,2011-08-15,赛象科技：第四届监事会第六次会议决议公告,finalpage/2011-08-15/59811708.PDF
156,2011-08-15,赛象科技：独立董事关于用部分超募资金永久补充流动资金事项的独立意见,finalpage/2011-08-15/59811709.PDF
157,2011-08-15,赛象科技：独立董事关于向山东德瑞宝轮胎有限公司销售产品提供融资租赁业务回购担保的议案的独立意见,finalpage/2011-08-15/59811710.PDF
158,2011-08-15,赛象科技：渤海证券股份有限公司关于公司对外提供担保的核查意见,finalpage/2011-08-15/59811711.PDF
159,2011-08-15,赛象科技：独立董事关于聘任、解聘高级管理人员议案的独立意见,finalpage/2011-08-15/59811713.PDF
160,2011-08-19,赛象科技：2011年半年度报告摘要,finalpage/2011-08-19/59838492.PDF
161,2011-08-19,赛象科技：2011年半年度财务报告,finalpage/2011-08-19/59838496.PDF
162,2011-08-19,赛象科技：2011年半年度报告,finalpage/2011-08-19/59838497.PDF
163,2011-08-19,赛象科技：独立董事关于控股股东及其他关联方占用公司资金、公司对外担保情况的专项说明和独立意见,finalpage/2011-08-19/59838498.PDF
164,2011-09-23,赛象科技：第四届董事会第十一次会议决议公告,finalpage/2011-09-23/59988312.PDF
165,2011-09-23,赛象科技：渤海证券股份有限公司关于公司内部控制规则落实情况自查表的核查意见,finalpage/2011-09-23/59988313.PDF
166,2011-09-23,赛象科技：内部控制规则落实情况的自查报告,finalpage/2011-09-23/59988314.PDF
167,2011-10-13,赛象科技：关于2011年度前三季度业绩预告的修正公告,finalpage/2011-10-13/60049973.PDF
168,2011-10-21,赛象科技：第四届董事会第十二次会议决议公告,finalpage/2011-10-21/60085420.PDF
169,2011-10-21,赛象科技：关于使用自有资金购买银行理财产品的公告,finalpage/2011-10-21/60085421.PDF
170,2011-10-21,赛象科技：第四届监事会第八次会议决议公告,finalpage/2011-10-21/60085422.PDF
171,2011-10-21,赛象科技：关于会计师事务所更名的公告,finalpage/2011-10-21/60085423.PDF
172,2011-10-21,赛象科技：2011年第三季度报告正文,finalpage/2011-10-21/60085424.PDF
173,2011-10-21,赛象科技：2011年第三季度报告全文,finalpage/2011-10-21/60085426.PDF
174,2011-10-21,赛象科技：独立董事关于使用自有资金购买银行理财产品的独立意见,finalpage/2011-10-21/60085427.PDF
175,2011-11-18,赛象科技：第四届董事会第十三次会议决议公告,finalpage/2011-11-18/60214939.PDF
176,2011-11-23,赛象科技：关于签订《推荐恢复上市、委托代办股份转让协议书》的公告,finalpage/2011-11-23/60232524.PDF
177,2011-12-08,赛象科技：内幕信息知情人登记管理制度（2011年12月）,finalpage/2011-12-08/60297448.PDF
178,2011-12-08,赛象科技：第四届董事会第十四次会议决议公告,finalpage/2011-12-08/60297449.PDF
179,2012-01-31,赛象科技：关于2011年年度业绩预告的修正公告,finalpage/2012-01-31/60481348.PDF
180,2012-02-06,赛象科技：重大合同公告,finalpage/2012-02-06/60500632.PDF
181,2012-02-28,赛象科技：2011年度业绩快报,finalpage/2012-02-28/60592589.PDF
182,2012-04-06,赛象科技：渤海证券股份有限公司关于《天津赛象科技股份有限公司2011年度内部控制自我评价报告》的核查意见,finalpage/2012-04-06/60787586.PDF
183,2012-04-06,赛象科技：渤海证券股份有限公司关于公司2011年度募集资金存放和实际使用情况的核查意见,finalpage/2012-04-06/60787587.PDF
184,2012-04-06,赛象科技：日常关联交易预计公告,finalpage/2012-04-06/60787588.PDF
185,2012-04-06,赛象科技：关于举行2011年度报告网上说明会的通知,finalpage/2012-04-06/60787589.PDF
186,2012-04-06,赛象科技：关于监事辞职及补选的公告,finalpage/2012-04-06/60787590.PDF
187,2012-04-06,赛象科技：关于副总经理辞职的公告,finalpage/2012-04-06/60787591.PDF
188,2012-04-06,赛象科技：2011年年度报告摘要,finalpage/2012-04-06/60787593.PDF
189,2012-04-06,赛象科技：2011年年度审计报告,finalpage/2012-04-06/60787598.PDF
190,2012-04-06,赛象科技：第四届董事会第十五次会议决议公告,finalpage/2012-04-06/60787599.PDF
191,2012-04-06,赛象科技：关于召开2011年度股东大会的通知,finalpage/2012-04-06/60787600.PDF
192,2012-04-06,赛象科技：第四届监事会第九次会议决议公告,finalpage/2012-04-06/60787601.PDF
193,2012-04-06,赛象科技：控股股股东及其他关联方资金占用情况的专项说明,finalpage/2012-04-06/60787602.PDF
194,2012-04-06,赛象科技：2011年年度报告,finalpage/2012-04-06/60787604.PDF
195,2012-04-06,赛象科技：2011年度内部控制自我评价报告,finalpage/2012-04-06/60787605.PDF
196,2012-04-06,赛象科技：董事会关于募集资金年度存放与使用情况的专项报告,finalpage/2012-04-06/60787606.PDF
197,2012-04-06,赛象科技：2011年度募集资金存放与使用情况的鉴证报告,finalpage/2012-04-06/60787607.PDF
198,2012-04-06,赛象科技：独立董事关于控股股东及其他关联方占用公司资金、公司对外担保情况的专项说明和独立意见,finalpage/2012-04-06/60787609.PDF
199,2012-04-06,赛象科技：2011年度独立董事述职报告,finalpage/2012-04-06/60787610.PDF
200,2012-04-06,赛象科技：独立董事关于公司四届十五次董事会相关事项的独立意见,finalpage/2012-04-06/60787611.PDF
201,2012-04-06,赛象科技：监事会对公司内部控制自我评价的意见,finalpage/2012-04-06/60787612.PDF
202,2012-04-25,赛象科技：2012年第一季度报告正文,finalpage/2012-04-25/60898257.PDF
203,2012-04-25,赛象科技：2012年第一季度报告全文,finalpage/2012-04-25/60898259.PDF
204,2012-04-28,赛象科技：2011年度股东大会决议公告,finalpage/2012-04-28/60930636.PDF
205,2012-04-28,赛象科技：第四届监事会第十一次会议决议公告,finalpage/2012-04-28/60930639.PDF
206,2012-04-28,赛象科技：2011年年度股东大会的法律意见书,finalpage/2012-04-28/60930640.PDF
207,2012-05-19,赛象科技：2011年度权益分派实施公告,finalpage/2012-05-19/61017780.PDF
208,2012-06-13,赛象科技：第四届董事会第十七次会议决议公告,finalpage/2012-06-13/61130123.PDF
209,2012-06-13,赛象科技：关于使用自有资金购买银行理财产品的公告,finalpage/2012-06-13/61130124.PDF
210,2012-06-13,赛象科技：第四届监事会第十二次会议决议公告,finalpage/2012-06-13/61130125.PDF
211,2012-06-13,赛象科技：独立董事关于使用自有资金购买银行理财产品的独立意见,finalpage/2012-06-13/61130126.PDF
212,2012-07-13,赛象科技：公司章程（2012年7月）,finalpage/2012-07-13/61260725.PDF
213,2012-07-13,赛象科技：第四届董事会第十八次会议决议公告,finalpage/2012-07-13/61260726.PDF
214,2012-07-13,赛象科技：股东回报规划,finalpage/2012-07-13/61260727.PDF
215,2012-07-13,赛象科技：关于召开2012年第一次临时股东大会的通知,finalpage/2012-07-13/61260728.PDF
216,2012-07-31,赛象科技：2012年第一次临时股东大会决议公告,finalpage/2012-07-31/61344342.PDF
217,2012-07-31,赛象科技：2012年第一次临时股东大会的法律意见书,finalpage/2012-07-31/61344343.PDF
