,date,title,url
650,2016-08-23,赛象科技：2016年半年度报告摘要,finalpage/2016-08-23/1202601276.PDF
651,2016-08-23,赛象科技：第六届监事会第四次会议决议公告,finalpage/2016-08-23/1202601277.PDF
652,2016-08-23,赛象科技：第六届董事会第五次会议决议公告,finalpage/2016-08-23/1202601278.PDF
653,2016-08-23,赛象科技：公司章程（2016年8月）,finalpage/2016-08-23/1202601279.PDF
654,2016-08-23,赛象科技：独立董事关于控股股东及其他关联方占用公司资金、公司对外担保情况的专项说明和独立意见,finalpage/2016-08-23/1202601280.PDF
655,2016-08-23,赛象科技：独立董事关于公司六届五次董事会相关事项的独立意见,finalpage/2016-08-23/1202601281.PDF
656,2016-10-21,赛象科技：2016年第三季度报告正文,finalpage/2016-10-21/1202772403.PDF
657,2016-10-21,赛象科技：2016年第三季度报告全文,finalpage/2016-10-21/1202772405.PDF
658,2016-10-31,赛象科技：关于部分限制性股票回购注销完成的公告,finalpage/2016-10-31/1202801882.PDF
659,2016-11-21,赛象科技：关于深圳证券交易所2016年第三季度报告问询函的回复,finalpage/2016-11-21/1202835125.PDF
660,2017-01-16,赛象科技：重大合同公告,finalpage/2017-01-16/1203014161.PDF
661,2017-01-25,赛象科技：第六届董事会第七次会议决议公告,finalpage/2017-01-25/1203049863.PDF
662,2017-01-25,赛象科技：关于为控股子公司提供担保的公告,finalpage/2017-01-25/1203049864.PDF
663,2017-02-27,赛象科技：2016年度业绩快报,finalpage/2017-02-27/1203105978.PDF
664,2017-03-31,赛象科技：2017年度第一季度业绩预告,finalpage/2017-03-31/1203236022.PDF
665,2017-04-12,赛象科技：第六届董事会第八次会议决议公告,finalpage/2017-04-12/1203282108.PDF
666,2017-04-12,赛象科技：关于计提公司2016年资产减值准备的公告,finalpage/2017-04-12/1203282109.PDF
667,2017-04-12,赛象科技：审计委员会关于计提资产减值准备的说明,finalpage/2017-04-12/1203282110.PDF
668,2017-04-12,赛象科技：第六届监事会第六次会议决议公告,finalpage/2017-04-12/1203282111.PDF
669,2017-04-20,赛象科技：2016年年度报告摘要,finalpage/2017-04-20/1203332346.PDF
670,2017-04-20,赛象科技：2016年年度审计报告,finalpage/2017-04-20/1203332349.PDF
671,2017-04-20,赛象科技：第六届董事会第九次会议决议公告,finalpage/2017-04-20/1203332352.PDF
672,2017-04-20,赛象科技：第六届监事会第七次会议决议公告,finalpage/2017-04-20/1203332353.PDF
673,2017-04-20,赛象科技：2016年年度报告,finalpage/2017-04-20/1203332355.PDF
674,2017-04-20,赛象科技：控股股东及其他关联方资金占用情况的专顼说明,finalpage/2017-04-20/1203332357.PDF
675,2017-04-20,赛象科技：2016年度独立董事述职报告,finalpage/2017-04-20/1203332358.PDF
676,2017-04-20,赛象科技：独立董事关于控股股东及其他关联方占用公司资金、公司对外担保情况的专项说明和独立意见,finalpage/2017-04-20/1203332359.PDF
677,2017-04-20,赛象科技：2016年度内部控制评价报告,finalpage/2017-04-20/1203332360.PDF
678,2017-04-20,赛象科技：内部控制鉴证报告,finalpage/2017-04-20/1203332361.PDF
679,2017-04-20,赛象科技：关于公司进行风险投资事项的公告,finalpage/2017-04-20/1203332363.PDF
680,2017-04-20,赛象科技：关于使用自有资金进行投资理财的公告,finalpage/2017-04-20/1203332365.PDF
681,2017-04-20,赛象科技：2017年日常关联交易预计公告,finalpage/2017-04-20/1203332367.PDF
682,2017-04-20,赛象科技：关于增加公司经营范围及修改《公司章程》相应条款的公告,finalpage/2017-04-20/1203332368.PDF
683,2017-04-20,赛象科技：独立董事关于公司六届九次董事会相关事项的独立意见,finalpage/2017-04-20/1203332370.PDF
684,2017-04-20,赛象科技：独立董事关于关联交易事项的事前认可函,finalpage/2017-04-20/1203332371.PDF
685,2017-04-20,赛象科技：独立董事关于继续聘请大华会计师事务所（特殊普通合伙）进行审计的事前认可函,finalpage/2017-04-20/1203332372.PDF
686,2017-04-20,赛象科技：内部控制规则落实自查表,finalpage/2017-04-20/1203332373.PDF
687,2017-04-20,赛象科技：公司章程,finalpage/2017-04-20/1203332375.PDF
688,2017-04-20,赛象科技：监事会对公司内部控制评价的意见,finalpage/2017-04-20/1203332376.PDF
689,2017-04-20,赛象科技：关于召开2016年年度股东大会的通知,finalpage/2017-04-20/1203332377.PDF
690,2017-04-27,赛象科技：2017年第一季度报告正文,finalpage/2017-04-27/1203402034.PDF
691,2017-04-27,赛象科技：2017年第一季度报告全文,finalpage/2017-04-27/1203402036.PDF
692,2017-04-27,赛象科技：关于举行2016年度报告网上说明会的通知,finalpage/2017-04-27/1203402037.PDF
693,2017-05-12,赛象科技：2016年年度股东大会决议公告,finalpage/2017-05-12/1203504943.PDF
694,2017-05-12,赛象科技：2016年年度股东大会的法律意见书,finalpage/2017-05-12/1203504944.PDF
695,2017-05-12,赛象科技：公司章程（2017年5月）,finalpage/2017-05-12/1203504945.PDF
696,2017-06-09,赛象科技：关于变更增加公司经营范围及修改《公司章程》相应条款的公告,finalpage/2017-06-09/1203601947.PDF
697,2017-06-09,赛象科技：第六届董事会第十一次会议决议公告,finalpage/2017-06-09/1203601948.PDF
698,2017-06-09,赛象科技：关于召开2017年第一次临时股东大会的通知,finalpage/2017-06-09/1203601949.PDF
699,2017-06-09,赛象科技：关于对深圳证券交易所2016年年报问询函的回复,finalpage/2017-06-09/1203601950.PDF
700,2017-06-09,赛象科技：公司章程（2017年6月）,finalpage/2017-06-09/1203601951.PDF
701,2017-06-28,赛象科技：2017年第一次临时股东大会决议公告,finalpage/2017-06-28/1203651180.PDF
702,2017-06-28,赛象科技：2017年第一次临时股东大会的法律意见书,finalpage/2017-06-28/1203651181.PDF
703,2017-08-23,赛象科技：2017年半年度报告摘要,finalpage/2017-08-23/1203846824.PDF
704,2017-08-23,赛象科技：2017年半年度财务报告,finalpage/2017-08-23/1203846826.PDF
705,2017-08-23,赛象科技：第六届董事会第十二次会议决议公告,finalpage/2017-08-23/1203846827.PDF
706,2017-08-23,赛象科技：第六届监事会第九次会议决议公告,finalpage/2017-08-23/1203846828.PDF
707,2017-08-23,赛象科技：独立董事关于控股股东及其他关联方占用公司资金、公司对外担保情况的专项说明和独立意见,finalpage/2017-08-23/1203846830.PDF
708,2017-08-23,赛象科技：2017年半年度报告,finalpage/2017-08-23/1203846831.PDF
709,2017-08-23,赛象科技：关于为子公司提供担保的公告,finalpage/2017-08-23/1203846832.PDF
710,2017-10-26,赛象科技：2017年第三季度报告正文,finalpage/2017-10-26/1204068835.PDF
711,2017-10-26,赛象科技：2017年第三季度报告全文,finalpage/2017-10-26/1204068836.PDF
712,2017-11-07,赛象科技：关于使用自有资金进行投资理财的进展公告,finalpage/2017-11-07/1204114040.PDF
713,2017-12-05,赛象科技：关于召开2017年第二次临时股东大会的通知,finalpage/2017-12-05/1204191526.PDF
714,2017-12-05,赛象科技：第六届监事会第十一次会议决议公告,finalpage/2017-12-05/1204191527.PDF
715,2017-12-05,赛象科技：关于监事辞职及补选的公告,finalpage/2017-12-05/1204191528.PDF
716,2017-12-05,赛象科技：关于使用自有资金进行投资理财的进展公告,finalpage/2017-12-05/1204191529.PDF
717,2017-12-05,赛象科技：第六届董事会第十四次会议决议公告,finalpage/2017-12-05/1204191530.PDF
718,2017-12-05,赛象科技：公司章程修订案,finalpage/2017-12-05/1204191531.PDF
719,2017-12-05,赛象科技：公司章程（2017年12月）,finalpage/2017-12-05/1204191532.PDF
720,2017-12-22,赛象科技：第六届监事会第十二次会议决议公告,finalpage/2017-12-22/1204246226.PDF
721,2017-12-22,赛象科技：2017年第二次临时股东大会决议公告,finalpage/2017-12-22/1204246227.PDF
722,2017-12-22,赛象科技：2017年第二次临时股东大会的法律意见书,finalpage/2017-12-22/1204246228.PDF
723,2017-12-26,赛象科技：关于获得政府补助的公告,finalpage/2017-12-26/1204252851.PDF
724,2018-01-05,赛象科技：关于使用自有资金进行投资理财的进展公告,finalpage/2018-01-05/1204304380.PDF
725,2018-02-07,赛象科技：关于使用自有资金进行投资理财的进展公告,finalpage/2018-02-07/1204395526.PDF
726,2018-02-13,赛象科技：2017年度业绩快报,finalpage/2018-02-13/1204416998.PDF
727,2018-02-13,赛象科技：第六届董事会第十五次会议决议公告,finalpage/2018-02-13/1204416999.PDF
728,2018-02-13,赛象科技：关于计提公司2017年资产减值准备的公告,finalpage/2018-02-13/1204417000.PDF
729,2018-02-13,赛象科技：第六届监事会第十三次会议决议公告,finalpage/2018-02-13/1204417001.PDF
730,2018-02-13,赛象科技：审计委员会关于计提资产减值准备合理性说明,finalpage/2018-02-13/1204417002.PDF
