date,title,url
2015-08-04,亚厦股份：关于使用闲置募集资金购买银行理财产品的进展公告,finalpage/2015-08-04/1201387238.PDF
2015-08-04,亚厦股份：2015年第二次临时股东大会的法律意见书,finalpage/2015-08-04/1201387239.PDF
2015-08-19,亚厦股份：关于获得中国合格评定国家认可委员会实验室认可证书的公告,finalpage/2015-08-19/1201460012.PDF
2015-08-21,亚厦股份：关于会计估计变更的公告,finalpage/2015-08-21/1201467121.PDF
2015-08-21,亚厦股份：第三届监事会第十九次会议决议公告,finalpage/2015-08-21/1201467122.PDF
2015-08-21,亚厦股份：第三届董事会第二十四次会议决议公告,finalpage/2015-08-21/1201467123.PDF
2015-08-21,亚厦股份：独立董事关于会计估计变更的独立意见,finalpage/2015-08-21/1201467124.PDF
2015-08-22,亚厦股份：关于会计估计变更公告的补充公告,finalpage/2015-08-22/1201473257.PDF
2015-08-29,亚厦股份：2015年上半年度非公开募集资金存放与实际使用情况的专项报告,finalpage/2015-08-29/1201517007.PDF
2015-08-29,亚厦股份：2015年半年度报告摘要,finalpage/2015-08-29/1201517008.PDF
2015-08-29,亚厦股份：2015年半年度报告,finalpage/2015-08-29/1201517009.PDF
2015-08-29,亚厦股份：2015年半年度财务报告,finalpage/2015-08-29/1201517010.PDF
2015-08-29,亚厦股份：第三届董事会第二十五次会议决议公告,finalpage/2015-08-29/1201517011.PDF
2015-08-29,亚厦股份：第三届监事会第二十次会议决议公告,finalpage/2015-08-29/1201517012.PDF
2015-08-29,亚厦股份：独立董事关于第三届董事会第二十五次会议相关事项的独立意见,finalpage/2015-08-29/1201517013.PDF
2015-08-29,亚厦股份：关于公司股票期权激励计划首次授予股票期权第四个行权期和预留股票期权授予第三个行权期可行权相关事项的法律意见书,finalpage/2015-08-29/1201517014.PDF
2015-08-29,亚厦股份：关于财务总监辞职的公告,finalpage/2015-08-29/1201517015.PDF
2015-08-29,亚厦股份：关于股票期权激励计划预留股票期权授予三个行权期可行权的公告,finalpage/2015-08-29/1201517016.PDF
2015-08-29,亚厦股份：关于股票期权激励计划预留股票期权授予第三个行权期激励对象调整的公告,finalpage/2015-08-29/1201517017.PDF
2015-08-29,亚厦股份：关于股票期权激励计划首次授予第四个行权期可行权的公告,finalpage/2015-08-29/1201517018.PDF
2015-08-29,亚厦股份：关于股票期权激励计划首次授予第四个行权期激励对象调整的公告,finalpage/2015-08-29/1201517019.PDF
2015-08-29,亚厦股份：股票期权激励计划首次授予第四个行权期可行权对象名单,finalpage/2015-08-29/1201517020.PDF
2015-09-18,亚厦股份：关于股票期权激励计划首次授予第四个行权期采取自主行权模式的公告,finalpage/2015-09-18/1201608401.PDF
2015-09-18,亚厦股份：关于股票期权激励计划预留股票期权授予第三个行权期采取自主行权模式的公告,finalpage/2015-09-18/1201608402.PDF
2015-10-08,亚厦股份：控股股东部分股权解除质押的公告,finalpage/2015-10-08/1201661003.PDF
2015-10-13,亚厦股份：关于子公司浙江亚厦产业投资发展有限公司使用闲置募集资金购买银行理财产品的进展公告,finalpage/2015-10-13/1201683948.PDF
2015-10-13,亚厦股份：关于第二期员工持股计划实施进展的公告,finalpage/2015-10-13/1201683949.PDF
2015-10-31,亚厦股份：关于控股子公司成都恒基装饰工程有限公司未达到业绩承诺对公司进行补偿的公告,finalpage/2015-10-31/1201743205.PDF
2015-10-31,亚厦股份：关于免去李彤副总经理职务公告,finalpage/2015-10-31/1201743206.PDF
2015-10-31,亚厦股份：2015年第三季度报告全文,finalpage/2015-10-31/1201743207.PDF
2015-10-31,亚厦股份：2015年第三季度报告正文,finalpage/2015-10-31/1201743208.PDF
2015-10-31,亚厦股份：第三届董事会第二十六次会议决议公告,finalpage/2015-10-31/1201743209.PDF
2015-10-31,亚厦股份：独立董事关于免去李彤副总经理职务的独立意见,finalpage/2015-10-31/1201744272.PDF
2015-11-13,亚厦股份：关于第二期员工持股计划实施进展的公告,finalpage/2015-11-13/1201766266.PDF
2015-12-12,亚厦股份：关于第二期员工持股计划实施进展的公告,finalpage/2015-12-12/1201830099.PDF
2015-12-30,亚厦股份：第三届董事会第二十七次会议决议公告,finalpage/2015-12-30/1201873695.PDF
2015-12-30,亚厦股份：关于公司全资子公司浙江亚厦景观园林工程有限公司获得城市园林绿化企业壹级资质的公告,finalpage/2015-12-30/1201873696.PDF
2015-12-30,亚厦股份：第三届监事会第二十二次会议决议公告,finalpage/2015-12-30/1201873697.PDF
2015-12-30,亚厦股份：独立董事关于第三届董事会第二十七次会议相关事项的独立意见,finalpage/2015-12-30/1201873698.PDF
2015-12-30,亚厦股份：控股股东部分股权解除质押的公告,finalpage/2015-12-30/1201873699.PDF
2015-12-30,亚厦股份：第三期员工持股计划（草案）,finalpage/2015-12-30/1201873700.PDF
2015-12-30,亚厦股份：第三期员工持股计划（草案摘要）,finalpage/2015-12-30/1201873701.PDF
2016-01-07,亚厦股份：控股股东部分股权质押公告,finalpage/2016-01-07/1201892276.PDF
2016-01-09,亚厦股份：第三届监事会第二十三次会议决议公告,finalpage/2016-01-09/1201902625.PDF
2016-01-09,亚厦股份：关于张建夫先生辞去副总经理职务的公告,finalpage/2016-01-09/1201902626.PDF
2016-01-09,亚厦股份：关于使用暂时闲置募集资金和自有资金购买银行理财产品的公告,finalpage/2016-01-09/1201902627.PDF
2016-01-09,亚厦股份：独立董事关于第三届董事会第二十八次会议相关事项的独立意见,finalpage/2016-01-09/1201902628.PDF
2016-01-09,亚厦股份：中信证券股份有限公司关于公司使用暂时闲置募集资金和自有资金购买银行理财产品的核查意见,finalpage/2016-01-09/1201902629.PDF
2016-01-09,亚厦股份：第三届董事会第二十八次会议决议公告,finalpage/2016-01-09/1201902630.PDF
2016-01-09,亚厦股份：关于召开2016年第一次临时股东大会的通知,finalpage/2016-01-09/1201902631.PDF
2016-01-12,亚厦股份：关于第二期员工持股计划实施进展的公告,finalpage/2016-01-12/1201905323.PDF
2016-01-20,亚厦股份：关于召开2016年第一次临时股东大会的提示性公告,finalpage/2016-01-20/1201925716.PDF
2016-01-20,亚厦股份：浙江京衡律师事务所关于公司实施第三期员工持股计划的法律意见书,finalpage/2016-01-20/1201925717.PDF
2016-01-26,亚厦股份：2016年第一次临时股东大会决议公告,finalpage/2016-01-26/1201940932.PDF
2016-01-26,亚厦股份：2016年第一次临时股东大会的法律意见书,finalpage/2016-01-26/1201940933.PDF
2016-01-28,亚厦股份：2015年业绩预告修正公告,finalpage/2016-01-28/1201946099.PDF
2016-02-03,亚厦股份：关于第二期员工持股计划完成股票购买的公告,finalpage/2016-02-03/1201962727.PDF
2016-02-27,亚厦股份：2015年度业绩快报,finalpage/2016-02-27/1202003957.PDF
2016-03-02,亚厦股份：关于使用闲置资金购买银行理财产品的进展公告,finalpage/2016-03-02/1202010053.PDF
2016-03-23,亚厦股份：第三届董事会第二十九次会议决议公告,finalpage/2016-03-23/1202066261.PDF
2016-03-23,亚厦股份：关于出售大连正泰开宇装饰有限公司51%股权的公告,finalpage/2016-03-23/1202066262.PDF
2016-04-22,亚厦股份：关于举行网上2015年度报告说明会的通知,finalpage/2016-04-22/1202217399.PDF
2016-04-22,亚厦股份：关于召开2015年度股东大会的通知,finalpage/2016-04-22/1202217400.PDF
2016-04-22,亚厦股份：第三届董事会第三十次会议决议公告,finalpage/2016-04-22/1202217401.PDF
2016-04-22,亚厦股份：中信证券股份有限公司关于公司使用部分募投项目节余募集资金永久补充流动资金的的核查意见,finalpage/2016-04-22/1202217402.PDF
2016-04-22,亚厦股份：独立董事关于第三届董事会第三十次会议相关事项的独立意见,finalpage/2016-04-22/1202217403.PDF
2016-04-22,亚厦股份：关于为子公司提供担保的公告,finalpage/2016-04-22/1202217404.PDF
2016-04-22,亚厦股份：独立董事对第三届董事会第三十次会议相关事项的事前认可意见,finalpage/2016-04-22/1202217405.PDF
2016-04-22,亚厦股份：2015年公司企业社会责任报告,finalpage/2016-04-22/1202217406.PDF
2016-04-22,亚厦股份：关于2015年度内部控制自我评价报告,finalpage/2016-04-22/1202217407.PDF
2016-04-22,亚厦股份：内部控制鉴证报告,finalpage/2016-04-22/1202217408.PDF
2016-04-22,亚厦股份：2015年度募集资金存放与实际使用情况的专项报告,finalpage/2016-04-22/1202217409.PDF
2016-04-22,亚厦股份：关于公司2015年度募集资金存放与使用情况鉴证报告,finalpage/2016-04-22/1202217410.PDF
2016-04-22,亚厦股份：中信证券股份有限公司关于公司2015年内部控制自我评价报告的核查意见,finalpage/2016-04-22/1202217411.PDF
2016-04-22,亚厦股份：关于2016年度日常关联交易预计情况的公告,finalpage/2016-04-22/1202217412.PDF
2016-04-22,亚厦股份：关于选举第四届监事会职工代表监事公告,finalpage/2016-04-22/1202217413.PDF
2016-04-22,亚厦股份：中信证券股份有限公司关于公司2015年度募集资金存放与使用情况的核查意见,finalpage/2016-04-22/1202217414.PDF
2016-04-22,亚厦股份：关于使用部分募投项目节余募集资金永久补充流动资金的公告,finalpage/2016-04-22/1202217415.PDF
2016-04-22,亚厦股份：2015年度独立董事述职报告（顾云昌）,finalpage/2016-04-22/1202217416.PDF
2016-04-22,亚厦股份：2015年度独立董事述职报告（李秉仁）,finalpage/2016-04-22/1202217417.PDF
2016-04-22,亚厦股份：2015年度独立董事述职报告（汪祥耀）,finalpage/2016-04-22/1202217418.PDF
2016-04-22,亚厦股份：2015年度独立董事述职报告（顾云昌）,finalpage/2016-04-22/1202217419.PDF
2016-04-22,亚厦股份：独立董事候选人声明（顾云昌）,finalpage/2016-04-22/1202217420.PDF
2016-04-22,亚厦股份：独立董事候选人声明（王力）,finalpage/2016-04-22/1202217421.PDF
2016-04-22,亚厦股份：独立董事候选人声明（李秉仁）,finalpage/2016-04-22/1202217422.PDF
2016-04-22,亚厦股份：独立董事候选人声明（汪祥耀）,finalpage/2016-04-22/1202217423.PDF
2016-04-22,亚厦股份：独立董事提名人声明（一）,finalpage/2016-04-22/1202217424.PDF
2016-04-22,亚厦股份：独立董事提名人声明（二）,finalpage/2016-04-22/1202217425.PDF
2016-04-22,亚厦股份：独立董事提名人声明（三）,finalpage/2016-04-22/1202217426.PDF
2016-04-22,亚厦股份：独立董事提名人声明（四）,finalpage/2016-04-22/1202217427.PDF
2016-04-22,亚厦股份：中信证券股份有限公司关于公司《公司内部控制规则落实自查表》的核查意见,finalpage/2016-04-22/1202217428.PDF
2016-04-22,亚厦股份：内部控制规则落实自查表,finalpage/2016-04-22/1202217429.PDF
2016-04-22,亚厦股份：关于公司控股股东及其他关联方占用资金情况的专项说明,finalpage/2016-04-22/1202217430.PDF
2016-04-22,亚厦股份：第三届监事会第二十四次会议决议公告,finalpage/2016-04-22/1202217431.PDF
2016-04-22,亚厦股份：2015年度公司监事会工作报告,finalpage/2016-04-22/1202217434.PDF
2016-04-22,亚厦股份：2015年年度审计报告,finalpage/2016-04-22/1202217435.PDF
2016-04-22,亚厦股份：2015年年度报告摘要,finalpage/2016-04-22/1202217436.PDF
2016-04-22,亚厦股份：2016年第一季度报告正文,finalpage/2016-04-22/1202217437.PDF
2016-04-22,亚厦股份：2016年第一季度报告全文,finalpage/2016-04-22/1202217438.PDF
2016-04-22,亚厦股份：2015年年度报告（已取消）,finalpage/2016-04-22/1202217439.PDF
2016-04-22,亚厦股份：关于举办投资者接待日活动的公告,finalpage/2016-04-22/1202217441.PDF
2016-04-23,亚厦股份：关于2015年年报及相关报告补充更正公告,finalpage/2016-04-23/1202226062.PDF
2016-04-23,亚厦股份：2015年度独立董事述职报告（王力）,finalpage/2016-04-23/1202226063.PDF
2016-04-23,亚厦股份：2015年年度报告（更新后）,finalpage/2016-04-23/1202226064.PDF
2016-05-05,亚厦股份：关于使用闲置募集资金购买银行理财产品的进展公告,finalpage/2016-05-05/1202293813.PDF
2016-05-07,亚厦股份：中信证券股份有限公司关于公司2015年度保荐工作报告,finalpage/2016-05-07/1202302988.PDF
2016-05-19,亚厦股份：第四届监事会第一次会议决议公告,finalpage/2016-05-19/1202328549.PDF
2016-05-19,亚厦股份：关于股权激励计划预留第四个行权期不符合行权条件暨第三个行权期结束拟注销全部失效股票期权相关事项的公告,finalpage/2016-05-19/1202328550.PDF
2016-05-19,亚厦股份：关于公司股票期权激励计划行权期结束拟注销失效股票期权相关事项的法律意见书（二）,finalpage/2016-05-19/1202328551.PDF
2016-05-19,亚厦股份：关于公司股票期权激励计划行权期结束拟注销失效股票期权相关事项的法律意见书（一）,finalpage/2016-05-19/1202328552.PDF
2016-05-19,亚厦股份：独立董事关于第四届董事会第一次会议相关事项的独立意见,finalpage/2016-05-19/1202328553.PDF
2016-05-19,亚厦股份：董事会战略委员会工作细则（2016年5月）,finalpage/2016-05-19/1202328554.PDF
2016-05-19,亚厦股份：第四届董事会第一次会议决议公告,finalpage/2016-05-19/1202328555.PDF
2016-05-19,亚厦股份：关于股权激励计划首期第四个行权期结束拟注销全部失效股票期权相关事项的公告,finalpage/2016-05-19/1202328556.PDF
2016-05-19,亚厦股份：2015年度股东大会决议公告,finalpage/2016-05-19/1202328557.PDF
2016-05-19,亚厦股份：2015年度股东大会的法律意见书,finalpage/2016-05-19/1202328558.PDF
2016-05-20,亚厦股份：2012年公司债券受托管理人报告（2015年度）,finalpage/2016-05-20/1202330327.PDF
2016-05-27,亚厦股份：关于股权激励计划首期和预留股票期权注销完成的公告,finalpage/2016-05-27/1202340759.PDF
2016-05-31,亚厦股份：关于深圳证券交易所2015年年报问询函回复的公告,finalpage/2016-05-31/1202346019.PDF
2016-06-21,亚厦股份：2012年公司债券2016年跟踪信用评级报告,finalpage/2016-06-21/1202376077.PDF
2016-06-22,亚厦股份：关于上海迪士尼乐园精装修工程的实施进展公告,finalpage/2016-06-22/1202380234.PDF
2016-06-30,亚厦股份：关于回收大连正泰开宇装饰有限公司股权转让款的进展公告,finalpage/2016-06-30/1202437257.PDF
2016-07-07,亚厦股份：2015年度权益分派实施公告,finalpage/2016-07-07/1202455604.PDF
2016-07-08,亚厦股份：“12亚厦债”2016年付息公告,finalpage/2016-07-08/1202458406.PDF
2016-07-18,亚厦股份：关于第三期员工持股计划完成股票购买的公告,finalpage/2016-07-18/1202479991.PDF
2016-07-23,亚厦股份：关于使用闲置募集资金购买银行理财产品的进展公告,finalpage/2016-07-23/1202499386.PDF
2016-08-11,亚厦股份：关于注销部分募集资金专项账户的公告,finalpage/2016-08-11/1202553496.PDF
2016-08-24,亚厦股份：第四届董事会第二次会议决议公告,finalpage/2016-08-24/1202607350.PDF
2016-08-24,亚厦股份：独立董事关于第四届董事会第二次会议相关事项的独立意见,finalpage/2016-08-24/1202607351.PDF
2016-08-24,亚厦股份：2016年上半年度非公开募集资金存放与实际使用情况的专项报告,finalpage/2016-08-24/1202607352.PDF
2016-08-24,亚厦股份：2016年半年度报告,finalpage/2016-08-24/1202607353.PDF
2016-08-24,亚厦股份：2016年半年度财务报告,finalpage/2016-08-24/1202607354.PDF
2016-08-24,亚厦股份：第四届监事会第二次会议决议公告,finalpage/2016-08-24/1202607355.PDF
2016-08-24,亚厦股份：2016年半年度报告摘要,finalpage/2016-08-24/1202607356.PDF
2016-08-30,亚厦股份：控股股东部分股权质押公告,finalpage/2016-08-30/1202644888.PDF
2016-09-13,亚厦股份：关于杭州国际博览中心及酒店装修工程的合同签订及实施公告,finalpage/2016-09-13/1202694641.PDF
2016-09-23,"亚厦股份：关于参股子公司盈创建筑科技（上海）有限公司与Hyperloop Transportation Technologies,Inc.签订独立合作协议的公告",finalpage/2016-09-23/1202719671.PDF
2016-09-27,亚厦股份：控股股东部分股权解除质押公告,finalpage/2016-09-27/1202726384.PDF
2016-10-11,亚厦股份：关于使用闲置募集资金购买银行理财产品的进展公告,finalpage/2016-10-11/1202746428.PDF
2016-10-29,亚厦股份：第四届董事会第三次会议决议公告,finalpage/2016-10-29/1202803141.PDF
2016-10-29,亚厦股份：第四届监事会第三次会议决议公告,finalpage/2016-10-29/1202803142.PDF
2016-10-29,亚厦股份：关于召开2016年第二次临时股东大会的通知,finalpage/2016-10-29/1202803143.PDF
2016-10-29,亚厦股份：关于出售浙江亚厦景观园林工程有限公司100%股权暨关联交易的公告,finalpage/2016-10-29/1202803144.PDF
2016-10-29,亚厦股份：2016年第三季度报告正文,finalpage/2016-10-29/1202803145.PDF
2016-10-29,亚厦股份：2016年第三季度报告全文,finalpage/2016-10-29/1202803146.PDF
2016-10-29,亚厦股份：浙江亚厦景观园林工程有限公司审计报告（2016年1-9月）,finalpage/2016-10-29/1202803147.PDF
2016-10-29,亚厦股份：独立董事关于出售浙江亚厦景观园林工程有限公司100%股权暨关联交易的独立意见,finalpage/2016-10-29/1202803148.PDF
2016-10-29,亚厦股份：《章程修正案》,finalpage/2016-10-29/1202803149.PDF
2016-10-29,亚厦股份：公司章程（2016年10月）,finalpage/2016-10-29/1202803150.PDF
2016-10-29,亚厦股份：对外担保管理制度（2016年10月）,finalpage/2016-10-29/1202803151.PDF
2016-10-29,亚厦股份：关联交易决策制度（2016年10月）,finalpage/2016-10-29/1202803152.PDF
2016-10-29,亚厦股份：独立董事关于出售浙江亚厦景观园林工程有限公司100%股权暨关联交易的事前认可意见,finalpage/2016-10-29/1202803153.PDF
2016-10-29,亚厦股份：拟转让股权涉及的浙江亚厦景观园林工程有限公司股东全部权益价值评估项目资产评估报告,finalpage/2016-10-29/1202803154.PDF
2016-11-16,亚厦股份：2016年第二次临时股东大会决议公告,finalpage/2016-11-16/1202830319.PDF
2016-11-16,亚厦股份：第四届董事会第四次会议决议公告,finalpage/2016-11-16/1202830320.PDF
2016-11-16,亚厦股份：关于投资设立南京扬子亚创酒店管理有限公司的公告,finalpage/2016-11-16/1202830321.PDF
2016-11-16,亚厦股份：2016年第二次临时股东大会的法律意见书,finalpage/2016-11-16/1202830322.PDF
2016-11-18,亚厦股份：持续督导期间定期现场检查报告,finalpage/2016-11-18/1202834920.PDF
2016-11-18,亚厦股份：中信证券股份有限公司关于公司持续督导保荐总结报告书,finalpage/2016-11-18/1202834921.PDF
2016-12-21,亚厦股份：控股股东部分股权质押公告,finalpage/2016-12-21/1202918343.PDF
2016-12-24,亚厦股份：第四届董事会第五次会议决议公告,finalpage/2016-12-24/1202953359.PDF
2016-12-24,亚厦股份：关于使用暂时闲置募集资金和自有资金购买理财产品的公告,finalpage/2016-12-24/1202953360.PDF
2016-12-24,亚厦股份：关于开展票据池业务的公告,finalpage/2016-12-24/1202953361.PDF
2016-12-24,亚厦股份：关于签订房屋租赁协议暨关联交易的公告,finalpage/2016-12-24/1202953362.PDF
2016-12-24,亚厦股份：关于召开2017年第一次临时股东大会的通知,finalpage/2016-12-24/1202953363.PDF
2016-12-24,亚厦股份：独立董事关于第四届董事会第五次会议的独立意见,finalpage/2016-12-24/1202953364.PDF
2016-12-24,亚厦股份：独立董事关于第四届董事会第五次会议相关事项的事前认可意见,finalpage/2016-12-24/1202953365.PDF
2016-12-24,亚厦股份：中信证券股份有限公司关于公司使用暂时闲置募集资金购买理财产品的核查意见,finalpage/2016-12-24/1202953366.PDF
2016-12-24,亚厦股份：第四届监事会第四次会议决议公告,finalpage/2016-12-24/1202953367.PDF
2016-12-28,亚厦股份：关于公司及全资子公司被认定为高新技术企业的公告,finalpage/2016-12-28/1202964825.PDF
2017-01-11,亚厦股份：2017年第一次临时股东大会决议公告,finalpage/2017-01-11/1203004925.PDF
2017-01-11,亚厦股份：2017年第一次临时股东大会的法律意见书,finalpage/2017-01-11/1203004926.PDF
2017-01-12,亚厦股份：关于使用自有资金和闲置募集资金购买银行理财产品的进展公告,finalpage/2017-01-12/1203008343.PDF
2017-01-26,亚厦股份：2016年第四季度经营情况简报,finalpage/2017-01-26/1203056363.PDF
2017-02-14,亚厦股份：关于增资收购塔吉克斯坦共和国亚洲建设有限公司67%股权的公告,finalpage/2017-02-14/1203079504.PDF
2017-02-14,亚厦股份：关于公司和全资子公司收到《中标通知书》及签订施工合同的公告,finalpage/2017-02-14/1203079505.PDF
2017-02-18,亚厦股份：控股股东部分股权解除质押公告,finalpage/2017-02-18/1203090356.PDF
2017-02-28,亚厦股份：2016年度业绩快报,finalpage/2017-02-28/1203111224.PDF
2017-04-18,亚厦股份：关于使用暂时闲置自有资金购买银行理财产品的进展公告,finalpage/2017-04-18/1203312047.PDF
2017-04-28,亚厦股份：第四届监事会第五次会议决议公告,finalpage/2017-04-28/1203413859.PDF
2017-04-28,亚厦股份：企业社会责任报告,finalpage/2017-04-28/1203413860.PDF
2017-04-28,亚厦股份：2016年度独立董事述职报告（顾云昌）,finalpage/2017-04-28/1203413861.PDF
2017-04-28,亚厦股份：2016年度独立董事述职报告（李秉仁）,finalpage/2017-04-28/1203413862.PDF
2017-04-28,亚厦股份：2016年度独立董事述职报告（汪祥耀）,finalpage/2017-04-28/1203413863.PDF
2017-04-28,亚厦股份：2016年度独立董事述职报告（王力）,finalpage/2017-04-28/1203413864.PDF
2017-04-28,亚厦股份：第四届董事会第六次会议决议公告,finalpage/2017-04-28/1203413865.PDF
2017-04-28,亚厦股份：关于召开2016年度股东大会的通知（已取消）,finalpage/2017-04-28/1203413866.PDF
2017-04-28,亚厦股份：关于2016年度内部控制自我评价报告,finalpage/2017-04-28/1203413867.PDF
2017-04-28,亚厦股份：独立董事关于第四届董事会第六次会议相关事项的独立意见,finalpage/2017-04-28/1203413868.PDF
2017-04-28,亚厦股份：独立董事对第四届董事会第六次会议相关事项的事前认可意见,finalpage/2017-04-28/1203413869.PDF
2017-04-28,亚厦股份：关于为子公司提供担保的公告,finalpage/2017-04-28/1203413870.PDF
2017-04-28,亚厦股份：关于举行网上2016年度网上业绩说明会的通知,finalpage/2017-04-28/1203413871.PDF
2017-04-28,亚厦股份：内部控制规则落实自查表,finalpage/2017-04-28/1203413872.PDF
2017-04-28,亚厦股份：关于2017年度日常关联交易预计情况的公告,finalpage/2017-04-28/1203413873.PDF
2017-04-28,亚厦股份：关于使用闲置自有资金购买国债逆回购品种的公告,finalpage/2017-04-28/1203413874.PDF
2017-04-28,亚厦股份：关于使用闲置自有资金购买理财和信托产品的公告,finalpage/2017-04-28/1203413875.PDF
2017-04-28,亚厦股份：关于举办投资者接待日活动的公告,finalpage/2017-04-28/1203413876.PDF
2017-04-28,亚厦股份：风险投资管理制度（2017年4月）,finalpage/2017-04-28/1203413877.PDF
2017-04-28,亚厦股份：2016年度公司监事会工作报告,finalpage/2017-04-28/1203413878.PDF
2017-04-28,亚厦股份：中信证券股份有限公司关于公司2016年度募集资金存放与使用情况的核查意见,finalpage/2017-04-28/1203413879.PDF
2017-04-28,亚厦股份：2016年度募集资金存放与实际使用情况的专项报告,finalpage/2017-04-28/1203413880.PDF
2017-04-28,亚厦股份：2017年第一季度报告正文,finalpage/2017-04-28/1203413881.PDF
2017-04-28,亚厦股份：2017年第一季度报告全文,finalpage/2017-04-28/1203413882.PDF
2017-04-28,亚厦股份：关于公司控股股东及其他关联方占用资金情况的专项说明,finalpage/2017-04-28/1203413883.PDF
2017-04-28,亚厦股份：关于公司2016年度募集资金存放与使用情况鉴证报告,finalpage/2017-04-28/1203413884.PDF
2017-04-28,亚厦股份：2016年年度审计报告,finalpage/2017-04-28/1203413885.PDF
2017-04-28,亚厦股份：关于投资设立亚厦春泥投资合伙企业的公告,finalpage/2017-04-28/1203413886.PDF
2017-04-28,亚厦股份：2016年年度报告,finalpage/2017-04-28/1203413887.PDF
2017-04-28,亚厦股份：2016年年度报告摘要,finalpage/2017-04-28/1203413888.PDF
2017-04-28,亚厦股份：2017年第一季度经营情况简报,finalpage/2017-04-28/1203413889.PDF
2017-05-10,亚厦股份：2012年公司债券受托管理人报告（2016年度）,finalpage/2017-05-10/1203491286.PDF
2017-05-12,亚厦股份：关于延期召开2016年度股东大会的公告,finalpage/2017-05-12/1203504324.PDF
