,date,title,url
0,2009-11-27,华英农业：首次公开发行A股初步询价及推介公告,finalpage/2009-11-27/57336300.PDF
1,2009-11-27,华英农业：关于公司首次公开发行股票并上市的律师工作报告,finalpage/2009-11-27/57336138.PDF
2,2009-11-27,华英农业：关于公司首次公开发行股票并上市的补充法律意见书（二）,finalpage/2009-11-27/57336139.PDF
3,2009-11-27,华英农业：关于公司首次公开发行股票并上市的补充法律意见书（三）,finalpage/2009-11-27/57336140.PDF
4,2009-11-27,华英农业：内部控制鉴证报告,finalpage/2009-11-27/57336141.PDF
5,2009-11-27,华英农业：首次公开发行股票招股意向书,finalpage/2009-11-27/57336142.PDF
6,2009-11-27,华英农业：关于公司首次公开发行股票并上市的补充法律意见书（四）,finalpage/2009-11-27/57336143.PDF
7,2009-11-27,华英农业：关于公司首次公开发行股票并上市的补充法律意见书（一）,finalpage/2009-11-27/57336144.PDF
8,2009-11-27,华英农业：首次公开发行股票招股意向书摘要,finalpage/2009-11-27/57336145.PDF
9,2009-11-27,华英农业：光大证券股份有限公司关于公司首次公开发行股票的证券发行保荐工作报告,finalpage/2009-11-27/57336146.PDF
10,2009-11-27,华英农业：光大证券股份有限公司关于公司首次公开发行股票的证券发行保荐书,finalpage/2009-11-27/57336147.PDF
11,2009-11-27,华英农业：第三届董事会第三次会议决议,finalpage/2009-11-27/57336298.PDF
12,2009-11-27,华英农业：第二届董事会第八次会议决议,finalpage/2009-11-27/57336299.PDF
13,2009-11-27,华英农业：中国证监会关于核准公司首次公开发行股票的批复,finalpage/2009-11-27/57336301.PDF
14,2009-11-27,华英农业：2007年第二次临时股东大会决议,finalpage/2009-11-27/57336302.PDF
15,2009-11-27,华英农业：公司章程（草案）,finalpage/2009-11-27/57336303.PDF
16,2009-11-27,华英农业：非经常性损益明细表审核报告,finalpage/2009-11-27/57336304.PDF
17,2009-11-27,华英农业：审计报告,finalpage/2009-11-27/57336311.PDF
18,2009-11-27,华英农业：关于公司首次公开发行股票并上市的法律意见书,finalpage/2009-11-27/57336314.PDF
19,2009-12-03,华英农业：首次公开发行A股网上路演公告,finalpage/2009-12-03/57355753.PDF
20,2009-12-04,华英农业：首次公开发行A股发行公告,finalpage/2009-12-04/57361990.PDF
21,2009-12-04,华英农业：首次公开发行A股投资风险特别公告,finalpage/2009-12-04/57361980.PDF
22,2009-12-04,华英农业：首次公开发行股票招股说明书,finalpage/2009-12-04/57362044.PDF
23,2009-12-04,华英农业：首次公开发行股票招股说明书摘要,finalpage/2009-12-04/57362045.PDF
24,2009-12-09,华英农业：首次公开发行A股网下配售结果公告,finalpage/2009-12-09/57378176.PDF
25,2009-12-09,华英农业：首次公开发行A股网上定价发行申购情况及中签率公告,finalpage/2009-12-09/57378178.PDF
26,2009-12-10,华英农业：首次公开发行A股网上定价发行摇号中签结果公告,finalpage/2009-12-10/57382349.PDF
27,2009-12-15,华英农业：首次公开发行股票上市公告书,finalpage/2009-12-15/57398043.PDF
28,2009-12-15,华英农业：光大证券股份有限公司关于公司股票上市保荐书,finalpage/2009-12-15/57397975.PDF
29,2009-12-15,华英农业：关于公司首次公开发行股票并在深圳证券交易所上市的法律意见书,finalpage/2009-12-15/57398037.PDF
30,2009-12-26,华英农业：第三届董事会第十一次会议决议公告,finalpage/2009-12-26/57439632.PDF
31,2009-12-26,华英农业：第三届监事会第六次会议决议公告,finalpage/2009-12-26/57439633.PDF
32,2009-12-26,华英农业：关于用募集资金置换预先已投入募集资金投资项目的自筹资金的公告,finalpage/2009-12-26/57439634.PDF
33,2009-12-26,华英农业：关于用超募资金归还银行贷款的公告,finalpage/2009-12-26/57439635.PDF
34,2009-12-26,华英农业：关于召开2010年第一次临时股东大会的公告,finalpage/2009-12-26/57439636.PDF
35,2009-12-26,华英农业：关于会计师事务所更名的公告,finalpage/2009-12-26/57439637.PDF
36,2009-12-26,华英农业：光大证券股份有限公司关于公司首次公开发行股票募集资金使用等相关事项的保荐意见,finalpage/2009-12-26/57439638.PDF
37,2009-12-26,华英农业：募集资金投资项目先期使用自筹资金情况专项审核报告,finalpage/2009-12-26/57439639.PDF
38,2009-12-26,华英农业：公司章程（草案）,finalpage/2009-12-26/57439640.PDF
39,2009-12-26,华英农业：独立董事意见,finalpage/2009-12-26/57439641.PDF
40,2009-12-29,华英农业：关于签订募集资金三方监管协议的公告,finalpage/2009-12-29/57451289.PDF
41,2010-01-12,华英农业：2010年第一次临时股东大会决议公告,finalpage/2010-01-12/57493887.PDF
42,2010-01-12,华英农业：2010年第一次临时股东大会的法律意见书,finalpage/2010-01-12/57493888.PDF
43,2010-01-30,华英农业：关于完成注册资本工商变更登记的公告,finalpage/2010-01-30/57560056.PDF
44,2010-02-26,华英农业：2009年度业绩快报,finalpage/2010-02-26/57627710.PDF
45,2010-03-12,华英农业：关于网下配售股票上市流通的提示性公告,finalpage/2010-03-12/57679615.PDF
46,2010-03-13,华英农业：2009年度业绩快报修正公告,finalpage/2010-03-13/57683864.PDF
47,2010-03-29,华英农业：关于召开2009年年度股东大会的公告,finalpage/2010-03-29/57736417.PDF
48,2010-03-29,华英农业：独立董事对公司第三届董事会第十二次会议相关事项所发表的独立意见,finalpage/2010-03-29/57736557.PDF
49,2010-03-29,华英农业：独立董事2009年度述职报告,finalpage/2010-03-29/57736558.PDF
50,2010-03-29,华英农业：内部控制鉴证报告,finalpage/2010-03-29/57736562.PDF
51,2010-03-29,华英农业：2009年度内部控制自我评价报告,finalpage/2010-03-29/57736563.PDF
52,2010-03-29,华英农业：关于公司募集资金年度存放与使用情况鉴证报告,finalpage/2010-03-29/57736565.PDF
53,2010-03-29,华英农业：董事会关于2009年度募集资金存放与使用情况的专项说明,finalpage/2010-03-29/57736569.PDF
54,2010-03-29,华英农业：淮滨分公司加工厂、饲料厂迁址扩建项目的公告,finalpage/2010-03-29/57736579.PDF
55,2010-03-29,华英农业：内幕信息知情人报备制度（2010年3月）,finalpage/2010-03-29/57736581.PDF
56,2010-03-29,华英农业：重大信息内部报告制度（2010年3月）,finalpage/2010-03-29/57736582.PDF
57,2010-03-29,华英农业：全资子公司菏泽华英禽业有限公司新建2000万只/年肉鸭屠宰加工项目的公告,finalpage/2010-03-29/57736584.PDF
58,2010-03-29,华英农业：光大证券股份有限公司关于公司募集资金年度使用情况的专项核查意见,finalpage/2010-03-29/57736585.PDF
59,2010-03-29,华英农业：光大证券股份有限公司关于公司《2009年度内部控制自我评价报告》的核查意见,finalpage/2010-03-29/57736586.PDF
60,2010-03-29,华英农业：关于公司2009年度担保情况的专项说明,finalpage/2010-03-29/57736412.PDF
61,2010-03-29,华英农业：2009年年度报告摘要,finalpage/2010-03-29/57736413.PDF
62,2010-03-29,华英农业：2009年年度审计报告,finalpage/2010-03-29/57736415.PDF
63,2010-03-29,华英农业：第三届董事会第十二次会议决议公告,finalpage/2010-03-29/57736416.PDF
64,2010-03-29,华英农业：第三届监事会第七次会议决议公告,finalpage/2010-03-29/57736418.PDF
65,2010-03-29,华英农业：关于公司2009年度控股股东及其他关联方占用资金情况的专项说明,finalpage/2010-03-29/57736419.PDF
66,2010-03-29,华英农业：2009年年度报告,finalpage/2010-03-29/57736420.PDF
67,2010-04-03,华英农业：关于举行2009年年度报告网上说明会的通知,finalpage/2010-04-03/57769344.PDF
68,2010-04-03,华英农业：更正公告,finalpage/2010-04-03/57769345.PDF
69,2010-04-06,华英农业：2009年年度报告（更正后）,finalpage/2010-04-06/57777399.PDF
70,2010-04-06,华英农业：更正公告,finalpage/2010-04-06/57777400.PDF
71,2010-04-20,华英农业：2009年度股东大会的法律意见书,finalpage/2010-04-20/57834081.PDF
72,2010-04-20,华英农业：2009年度股东大会决议公告,finalpage/2010-04-20/57834083.PDF
73,2010-04-22,华英农业：2010年第一季度报告正文,finalpage/2010-04-22/57848464.PDF
74,2010-04-22,华英农业：2010年第一季度报告全文,finalpage/2010-04-22/57848466.PDF
75,2010-05-21,华英农业：2009年度权益分派实施公告,finalpage/2010-05-21/57976344.PDF
76,2010-06-30,华英农业：光大证券股份有限公司关于公司与安钢集团信阳钢铁有限责任公司互保事项的核查意见,finalpage/2010-06-30/58112442.PDF
77,2010-06-30,华英农业：关于为控股子公司提供担保的公告,finalpage/2010-06-30/58112443.PDF
78,2010-06-30,华英农业：关于与安钢集团信阳钢铁有限责任公司进行互相担保的公告,finalpage/2010-06-30/58112444.PDF
79,2010-06-30,华英农业：关于召开2010年第二次临时股东大会的公告,finalpage/2010-06-30/58112445.PDF
80,2010-06-30,华英农业：建设年产十八万吨配合饲料加工厂项目的公告,finalpage/2010-06-30/58112446.PDF
81,2010-06-30,华英农业：公司章程（2010年6月）,finalpage/2010-06-30/58112447.PDF
82,2010-06-30,华英农业：第三届董事会第十四次会议决议公告,finalpage/2010-06-30/58112448.PDF
83,2010-06-30,华英农业：独立董事意见,finalpage/2010-06-30/58112449.PDF
84,2010-07-14,华英农业：关于举行投资者网上集体接待日的公告,finalpage/2010-07-14/58173382.PDF
85,2010-07-20,华英农业：2010年第二次临时股东大会的法律意见书,finalpage/2010-07-20/58191890.PDF
86,2010-07-20,华英农业：公司章程（2010年7月）,finalpage/2010-07-20/58191891.PDF
87,2010-07-20,华英农业：2010年第二次临时股东大会决议公告,finalpage/2010-07-20/58191892.PDF
88,2010-07-20,华英农业：关于“华英农业”富民计划有关情况说明的公告,finalpage/2010-07-20/58192345.PDF
89,2010-07-29,华英农业：独立董事对公司关联方资金占用和对外担保情况出具的专项说明和发表的独立意见,finalpage/2010-07-29/58231608.PDF
90,2010-07-29,华英农业：2010年半年度报告摘要,finalpage/2010-07-29/58231563.PDF
91,2010-07-29,华英农业：2010年半年度报告,finalpage/2010-07-29/58231565.PDF
92,2010-07-29,华英农业：2010年半年度财务报告,finalpage/2010-07-29/58231566.PDF
93,2010-07-29,华英农业：第三届董事会第十五次会议决议公告,finalpage/2010-07-29/58231567.PDF
94,2010-07-29,华英农业：第三届监事会第九次会议决议公告,finalpage/2010-07-29/58231568.PDF
95,2010-08-05,华英农业：关于完成工商变更登记的公告,finalpage/2010-08-05/58262923.PDF
96,2010-10-19,华英农业：2010年第三季度报告正文,finalpage/2010-10-19/58538856.PDF
97,2010-10-19,华英农业：2010年第三季度报告全文,finalpage/2010-10-19/58538858.PDF
98,2010-10-19,华英农业：关于设立河南华姿雪羽绒制品有限公司的对外投资公告,finalpage/2010-10-19/58538859.PDF
99,2010-10-19,华英农业：关于召开2010年第三次临时股东大会的公告,finalpage/2010-10-19/58538860.PDF
100,2010-10-19,华英农业：第三届董事会第十六次会议决议公告,finalpage/2010-10-19/58538861.PDF
101,2010-10-19,华英农业：浙江东兴羽绒制品有限公司羽绒制品加工项目可行性研究报告,finalpage/2010-10-19/58538862.PDF
102,2010-10-19,华英农业：河南陈州华英禽业有限公司建设年产1000万只商品肉鸡养殖场项目的公告,finalpage/2010-10-19/58538863.PDF
103,2010-10-19,华英农业：河南陈州华英禽业有限公司建设年产1000万只/年商品肉鸡养殖场项目可行性研究报告,finalpage/2010-10-19/58538864.PDF
104,2010-11-10,华英农业：2010年第三次临时股东大会的法律意见书,finalpage/2010-11-10/58645315.PDF
105,2010-11-10,华英农业：2010年第三次临时股东大会决议公告,finalpage/2010-11-10/58645316.PDF
106,2010-11-29,华英农业：关于股东股权质押的公告,finalpage/2010-11-29/58711254.PDF
107,2010-12-01,华英农业：关于完成工商变更登记的公告,finalpage/2010-12-01/58728984.PDF
108,2010-12-14,华英农业：光大证券股份有限公司关于公司限售股份上市流通的核查意见,finalpage/2010-12-14/58778423.PDF
109,2010-12-14,华英农业：首次公开发行前已发行股份上市流通提示性公告,finalpage/2010-12-14/58778424.PDF
110,2010-12-21,华英农业：股票交易异常波动公告,finalpage/2010-12-21/58806496.PDF
111,2011-01-11,华英农业：关于召开2011年第一次临时股东大会的通知,finalpage/2011-01-11/58886657.PDF
112,2011-01-11,华英农业：第三届监事会第十一次会议决议公告,finalpage/2011-01-11/58886659.PDF
113,2011-01-11,华英农业：第三届董事会第十七次会议决议公告,finalpage/2011-01-11/58886660.PDF
114,2011-01-11,华英农业：独立董事候选人声明,finalpage/2011-01-11/58886661.PDF
115,2011-01-11,华英农业：独立董事对公司董事会换届选举的独立意见,finalpage/2011-01-11/58886662.PDF
116,2011-01-11,华英农业：独立董事提名人声明,finalpage/2011-01-11/58886663.PDF
117,2011-01-21,华英农业：关于选举产生第四届监事会职工监事的公告,finalpage/2011-01-21/58932385.PDF
118,2011-01-27,华英农业：2011年第一次临时股东大会的法律意见书,finalpage/2011-01-27/58953437.PDF
119,2011-01-27,华英农业：2011年第一次临时股东大会决议公告,finalpage/2011-01-27/58953438.PDF
120,2011-01-27,华英农业：第四届监事会第一次会议决议公告,finalpage/2011-01-27/58953439.PDF
121,2011-01-27,华英农业：第四届董事会第一次会议决议公告,finalpage/2011-01-27/58953440.PDF
122,2011-01-27,华英农业：独立董事关于聘任高级管理人员的意见,finalpage/2011-01-27/58953441.PDF
123,2011-02-26,华英农业：2010年度业绩快报,finalpage/2011-02-26/59049424.PDF
124,2011-03-10,华英农业：关于证券事务代表辞职的公告,finalpage/2011-03-10/59101212.PDF
125,2011-03-18,华英农业：关于公司募集资金年度存放与使用情况鉴证报告,finalpage/2011-03-18/59137848.PDF
126,2011-03-18,华英农业：2010年年度报告摘要,finalpage/2011-03-18/59137849.PDF
127,2011-03-18,华英农业：2010年年度审计报告,finalpage/2011-03-18/59137853.PDF
128,2011-03-18,华英农业：第四届董事会第二次会议决议公告,finalpage/2011-03-18/59137854.PDF
129,2011-03-18,华英农业：关于召开2010年度股东大会的公告,finalpage/2011-03-18/59137855.PDF
130,2011-03-18,华英农业：第四届监事会第二次会议决议公告,finalpage/2011-03-18/59137856.PDF
131,2011-03-18,华英农业：关于公司2010年度控股股东及其他关联方占用资金情况的专项说明,finalpage/2011-03-18/59137857.PDF
132,2011-03-18,华英农业：2010年年度报告,finalpage/2011-03-18/59137858.PDF
133,2011-03-18,华英农业：2010年度内部控制自我评价报告,finalpage/2011-03-18/59137859.PDF
134,2011-03-18,华英农业：光大证券股份有限公司关于公司<内部控制自我评价报告>的核查意见,finalpage/2011-03-18/59137860.PDF
135,2011-03-18,华英农业：董事会关于2010年度募集资金存放与使用情况的专项说明,finalpage/2011-03-18/59137861.PDF
136,2011-03-18,华英农业：光大证券股份有限公司关于公司募集资金年度使用情况的专项核查意见,finalpage/2011-03-18/59137862.PDF
137,2011-03-18,华英农业：独立董事对相关事项的独立意见,finalpage/2011-03-18/59137863.PDF
138,2011-03-18,华英农业：独立董事2010年度述职报告,finalpage/2011-03-18/59137864.PDF
139,2011-03-18,华英农业：关于注销徐州分公司的公告,finalpage/2011-03-18/59137865.PDF
140,2011-03-18,华英农业：关于聘任公司证券事务代表的公告,finalpage/2011-03-18/59137866.PDF
141,2011-03-18,华英农业：内幕信息知情人登记报备及责任追究制度（2011年3月）,finalpage/2011-03-18/59137867.PDF
142,2011-03-18,华英农业：年报重大差错责任追究制度（2011年3月）,finalpage/2011-03-18/59137868.PDF
143,2011-04-13,华英农业：2010年度股东大会决议公告,finalpage/2011-04-13/59258444.PDF
144,2011-04-13,华英农业：2010年度股东大会的法律意见书,finalpage/2011-04-13/59258445.PDF
145,2011-04-15,华英农业：2011年第一季度业绩预告,finalpage/2011-04-15/59269863.PDF
146,2011-04-18,华英农业：关于股东股权质押的公告,finalpage/2011-04-18/59276429.PDF
147,2011-04-21,华英农业：2011年第一季度报告正文,finalpage/2011-04-21/59303698.PDF
148,2011-04-21,华英农业：2011年第一季度报告全文,finalpage/2011-04-21/59303700.PDF
149,2011-05-18,华英农业：淮滨分公司在建项目火灾及工期延误情况的公告,finalpage/2011-05-18/59441592.PDF
150,2011-06-02,华英农业：2010年度权益分派实施公告,finalpage/2011-06-02/59504554.PDF
151,2011-06-08,华英农业：关于公司证券部办公地点变更公告,finalpage/2011-06-08/59523074.PDF
152,2011-06-18,华英农业：关于举行2010年度业绩网上说明会的公告,finalpage/2011-06-18/59568256.PDF
153,2011-07-06,华英农业：关于举行2010年度报告网上说明会的通知,finalpage/2011-07-06/59639334.PDF
154,2011-07-28,华英农业：2011年半年度报告摘要,finalpage/2011-07-28/59735289.PDF
155,2011-07-28,华英农业：2011年半年度财务报告,finalpage/2011-07-28/59735295.PDF
156,2011-07-28,华英农业：第四届董事会第四次会议决议公告,finalpage/2011-07-28/59735296.PDF
157,2011-07-28,华英农业：第四届监事会第四次会议决议公告,finalpage/2011-07-28/59735297.PDF
158,2011-07-28,华英农业：2011年半年度报告,finalpage/2011-07-28/59735299.PDF
159,2011-07-28,华英农业：独立董事关于公司对外担保情况及控股股东、其他关联方占用公司资金情况的专项说明和独立意见,finalpage/2011-07-28/59735300.PDF
160,2011-07-28,华英农业：对外投资公告,finalpage/2011-07-28/59735301.PDF
161,2011-07-28,华英农业：关于拟投资信阳银行的审查报告,finalpage/2011-07-28/59735302.PDF
162,2011-07-28,华英农业：机构调研接待工作管理办法（2011年7月）,finalpage/2011-07-28/59735303.PDF
163,2011-08-27,华英农业：关于持股5%以上股东减持股份的提示性公告,finalpage/2011-08-27/59882036.PDF
164,2011-08-27,华英农业：简式权益变动报告书,finalpage/2011-08-27/59882039.PDF
165,2011-09-29,华英农业：光大证券股份有限公司关于公司《内部控制规则落实情况自查表》的核查意见,finalpage/2011-09-29/60015564.PDF
166,2011-09-29,华英农业：第四届董事会第五次会议决议公告,finalpage/2011-09-29/60015565.PDF
167,2011-09-29,华英农业：关于落实深圳证券交易所《关于开展“加强中小企业板上市公司内控规则落实”专项活动的通知》的整改计划,finalpage/2011-09-29/60015566.PDF
168,2011-09-29,华英农业：内部审计制度（2011年9月）,finalpage/2011-09-29/60015567.PDF
169,2011-09-29,华英农业：中小企业板上市公司内部控制规则落实情况自查表,finalpage/2011-09-29/60015568.PDF
170,2011-09-29,华英农业：风险投资管理制度（2011年8月）,finalpage/2011-09-29/60015569.PDF
171,2011-10-11,华英农业：2011年1-9月业绩预告的修正公告,finalpage/2011-10-11/60040392.PDF
172,2011-10-13,华英农业：关于更换保荐代表人的公告,finalpage/2011-10-13/60050440.PDF
173,2011-10-18,华英农业：2011年第三季度报告正文,finalpage/2011-10-18/60069126.PDF
174,2011-10-18,华英农业：2011年第三季度报告全文,finalpage/2011-10-18/60069129.PDF
175,2011-10-20,华英农业：关于签订委托代办股份转让协议的公告,finalpage/2011-10-20/60079590.PDF
176,2011-11-30,华英农业：内幕信息知情人报备制度（2011年11月）,finalpage/2011-11-30/60264696.PDF
177,2011-11-30,华英农业：定期报告编制管理制度（2011年11月）,finalpage/2011-11-30/60264697.PDF
178,2011-11-30,华英农业：关于“加强上市公司治理专项活动”的自查报告,finalpage/2011-11-30/60264698.PDF
179,2011-11-30,华英农业：关于“加强上市公司治理专项活动”的自查报告和整改计划,finalpage/2011-11-30/60264699.PDF
180,2011-11-30,华英农业：第四届监事会第六次会议决议公告,finalpage/2011-11-30/60264700.PDF
181,2011-11-30,华英农业：第四届董事会第七次会议决议公告,finalpage/2011-11-30/60264701.PDF
182,2012-01-05,华英农业：重大事项停牌公告,finalpage/2012-01-05/60405425.PDF
183,2012-01-09,华英农业：2012年非公开发行募投项目可行性研究报告,finalpage/2012-01-09/60416406.PDF
184,2012-01-09,华英农业：第四届董事会第八次会议决议公告,finalpage/2012-01-09/60416407.PDF
185,2012-01-09,华英农业：关于公司前次募集资金使用情况专项鉴证报告,finalpage/2012-01-09/60416409.PDF
186,2012-01-09,华英农业：向特定对象非公开发行股票预案,finalpage/2012-01-09/60416410.PDF
187,2012-01-09,华英农业：独立董事关于非公开发行股票的独立意见,finalpage/2012-01-09/60416411.PDF
188,2012-02-13,华英农业：关于召开2012年第一次临时股东大会的公告,finalpage/2012-02-13/60536936.PDF
189,2012-02-23,华英农业：重大事项进展公告,finalpage/2012-02-23/60578383.PDF
190,2012-02-28,华英农业：2011年度业绩快报,finalpage/2012-02-28/60592759.PDF
191,2012-02-29,华英农业：2012年第一次临时股东大会决议,finalpage/2012-02-29/60601177.PDF
192,2012-02-29,华英农业：2012年第一次临时股东大会的法律意见书,finalpage/2012-02-29/60601178.PDF
193,2012-03-07,华英农业：2011年年度报告摘要,finalpage/2012-03-07/60634838.PDF
194,2012-03-07,华英农业：2011年年度审计报告,finalpage/2012-03-07/60634843.PDF
195,2012-03-07,华英农业：第四届董事会第九次会议决议公告,finalpage/2012-03-07/60634844.PDF
196,2012-03-07,华英农业：关于召开2011年度股东大会的公告,finalpage/2012-03-07/60634845.PDF
197,2012-03-07,华英农业：第四届监事会第七次会议决议公告,finalpage/2012-03-07/60634846.PDF
198,2012-03-07,华英农业：关于公司2011年度控股股东及其他关联方占用资金情况的专项说明,finalpage/2012-03-07/60634847.PDF
199,2012-03-07,华英农业：2011年年度报告,finalpage/2012-03-07/60634848.PDF
200,2012-03-07,华英农业：关于公司内部控制的自我评估报告,finalpage/2012-03-07/60634849.PDF
201,2012-03-07,华英农业：内部控制鉴证报告,finalpage/2012-03-07/60634850.PDF
202,2012-03-07,华英农业：2011年度募集资金使用专项报告,finalpage/2012-03-07/60634851.PDF
203,2012-03-07,华英农业：关于公司前次募集资金使用情况专项鉴证报告,finalpage/2012-03-07/60634852.PDF
204,2012-03-07,华英农业：独立董事对相关事项的独立意见,finalpage/2012-03-07/60634853.PDF
205,2012-03-07,华英农业：关于举行2011年度报告网上说明会的公告,finalpage/2012-03-07/60634854.PDF
206,2012-03-07,华英农业：独立董事2011年度述职报告（孟素荷）,finalpage/2012-03-07/60634855.PDF
207,2012-03-07,华英农业：独立董事2011年度述职报告（尹效华）,finalpage/2012-03-07/60634856.PDF
208,2012-03-07,华英农业：独立董事2011年度述职报告（赵虎林）,finalpage/2012-03-07/60634857.PDF
209,2012-03-08,华英农业：募集资金管理制度（2012年3月）,finalpage/2012-03-08/60639356.PDF
210,2012-03-08,华英农业：独立董事工作制度（2012年3月）,finalpage/2012-03-08/60639357.PDF
211,2012-03-19,华英农业：关于媒体报道情况说明的公告,finalpage/2012-03-19/60691714.PDF
212,2012-03-22,华英农业：继续停牌公告,finalpage/2012-03-22/60704912.PDF
213,2012-03-27,华英农业：关于媒体质疑情况说明的公告,finalpage/2012-03-27/60731078.PDF
214,2012-03-29,华英农业：2011年度股东大会决议公告,finalpage/2012-03-29/60748539.PDF
215,2012-03-29,华英农业：2011年度股东大会的法律意见书,finalpage/2012-03-29/60748540.PDF
216,2012-03-30,华英农业：第四届董事会第十次会议决议公告,finalpage/2012-03-30/60770898.PDF
217,2012-03-30,华英农业：关于《中国证监会河南监管局对公司治理情况的综合评价及整改意见》的整改措施的公告,finalpage/2012-03-30/60770899.PDF
218,2012-03-30,华英农业：关于收到中国证监会河南监管局对公司治理情况的综合评价及整改意见的公告,finalpage/2012-03-30/60770900.PDF
219,2012-03-30,华英农业：内部控制规范实施工作方案,finalpage/2012-03-30/60770901.PDF
220,2012-04-11,华英农业：2011年年度权益分派实施公告,finalpage/2012-04-11/60811409.PDF
221,2012-04-19,华英农业：2012年第一季度报告正文,finalpage/2012-04-19/60854651.PDF
222,2012-04-19,华英农业：2012年第一季度报告全文,finalpage/2012-04-19/60854654.PDF
223,2012-04-19,华英农业：第四届监事会第八次会议决议公告,finalpage/2012-04-19/60854872.PDF
224,2012-04-19,华英农业：第四届董事会第十一次会议决议公,finalpage/2012-04-19/60854874.PDF
225,2012-05-10,华英农业：信息披露管理办法（2012年5月）,finalpage/2012-05-10/60976205.PDF
