date,title,url
2011-05-10,亚厦股份：独立董事关于股票期权数量和行权价格调整的独立意见,finalpage/2011-05-10/59405545.PDF
2011-05-21,亚厦股份：关于股票期权激励计划首次授予的期权登记完成公告,finalpage/2011-05-21/59456748.PDF
2011-06-18,亚厦股份：股东股权质押公告,finalpage/2011-06-18/59568069.PDF
2011-06-25,亚厦股份：拟收购上海蓝天房屋装饰工程有限公司股权项目评估报告,finalpage/2011-06-25/59594740.PDF
2011-06-25,亚厦股份：第二届董事会第十四次会议决议公告,finalpage/2011-06-25/59594741.PDF
2011-06-25,亚厦股份：关于使用超募资金收购上海蓝天房屋装饰工程有限公司60%股权的公告,finalpage/2011-06-25/59594742.PDF
2011-06-25,亚厦股份：独立董事关于使用超募资金收购上海蓝天房屋装饰工程有限公司股权的独立意见,finalpage/2011-06-25/59594743.PDF
2011-06-25,亚厦股份：第二届监事会第十二次会议决议公告,finalpage/2011-06-25/59594744.PDF
2011-06-25,亚厦股份：财富里昂证券有限责任公司关于公司使用超募资金收购上海蓝天房屋装饰工程有限公司60%股权的核查意见,finalpage/2011-06-25/59594745.PDF
2011-07-02,亚厦股份：第二届董事会第十五次会议决议公告,finalpage/2011-07-02/59624154.PDF
2011-07-02,亚厦股份：第二届监事会第十三次会议决议公告,finalpage/2011-07-02/59624155.PDF
2011-07-02,亚厦股份：关于使用超募资金对子公司增资的公告,finalpage/2011-07-02/59624156.PDF
2011-07-02,亚厦股份：独立董事关于公司使用超募资金对子公司增资的独立意见,finalpage/2011-07-02/59624157.PDF
2011-07-02,亚厦股份：财富里昂证券有限责任公司关于公司使用超募资金对子公司增资事项发表的保荐意见,finalpage/2011-07-02/59624158.PDF
2011-07-21,亚厦股份：关于签定投资框架协议的公告,finalpage/2011-07-21/59703645.PDF
2011-07-22,亚厦股份：关于更换保荐代表人的公告,finalpage/2011-07-22/59710204.PDF
2011-08-09,亚厦股份：第二届董事会第十六次会议决议公告,finalpage/2011-08-09/59788957.PDF
2011-08-09,亚厦股份：第二届监事会第十四次会议决议公告,finalpage/2011-08-09/59788958.PDF
2011-08-09,亚厦股份：关于使用超募资金收购成都恒基装饰工程有限公司60%股权的公告,finalpage/2011-08-09/59788959.PDF
2011-08-09,亚厦股份：拟收购成都恒基装饰工程有限公司股权项目评估报告,finalpage/2011-08-09/59788960.PDF
2011-08-09,亚厦股份：独立董事关于相关事项的独立意见,finalpage/2011-08-09/59788961.PDF
2011-08-09,亚厦股份：财富里昂证券有限责任公司关于公司使用超募资金收购成都恒基装饰工程有限公司60%股权的核查意见,finalpage/2011-08-09/59788962.PDF
2011-08-20,亚厦股份：股东股权质押公告,finalpage/2011-08-20/59844155.PDF
2011-08-25,亚厦股份：2011年半年度报告摘要,finalpage/2011-08-25/59867322.PDF
2011-08-25,亚厦股份：2011年半年度报告,finalpage/2011-08-25/59867323.PDF
2011-08-25,亚厦股份：2011年半年度财务报告,finalpage/2011-08-25/59867329.PDF
2011-08-25,亚厦股份：独立董事对公司累计和当期对外担保情况及关联方占用资金情况的专项说明和独立意见,finalpage/2011-08-25/59867330.PDF
2011-09-15,亚厦股份：第二届董事会第十八次会议决议公告,finalpage/2011-09-15/59957780.PDF
2011-09-15,亚厦股份：第二届监事会第十六次会议决议公告,finalpage/2011-09-15/59957781.PDF
2011-09-15,亚厦股份：关于召开2011年第二次临时股东大会的通知,finalpage/2011-09-15/59957782.PDF
2011-09-15,亚厦股份：关于调整变更“石材制品工厂化项目”的公告,finalpage/2011-09-15/59957783.PDF
2011-09-15,亚厦股份：独立董事对公司调整变更“石材制品工厂化项目”的独立意见,finalpage/2011-09-15/59957784.PDF
2011-09-15,亚厦股份：财富里昂证券有限责任公司关于公司调整变更“石材制品工厂化项目”的保荐意见,finalpage/2011-09-15/59957785.PDF
2011-09-17,亚厦股份：股东股权质押公告,finalpage/2011-09-17/59967217.PDF
2011-10-10,亚厦股份：2011年第二次临时股东大会决议公告,finalpage/2011-10-10/60026693.PDF
2011-10-10,亚厦股份：2011年第二次临时股东大会的法律意见书,finalpage/2011-10-10/60026694.PDF
2011-10-27,亚厦股份：2011年第三季度报告正文,finalpage/2011-10-27/60119621.PDF
2011-10-27,亚厦股份：2011年第三季度报告全文,finalpage/2011-10-27/60119622.PDF
2011-10-27,亚厦股份：第二届董事会第十九次会议决议公告,finalpage/2011-10-27/60119623.PDF
2011-10-27,亚厦股份：关于对全资子公司增资的公告,finalpage/2011-10-27/60119624.PDF
2011-10-27,亚厦股份：关于全资子公司浙江亚厦产业园发展有限公司签订募集资金三方监管协议的公告,finalpage/2011-10-27/60119625.PDF
2011-10-27,亚厦股份：位于章镇镇104国道西侧的工业用房、土地使用权资产评估报告书,finalpage/2011-10-27/60119626.PDF
2011-11-16,亚厦股份：关于取消陈志刚所获授公司股票期权的公告,finalpage/2011-11-16/60205698.PDF
2011-12-01,亚厦股份：控股股东部分股权解冻及质押公告,finalpage/2011-12-01/60265306.PDF
2011-12-09,亚厦股份：关于收到《中标通知书》的公告,finalpage/2011-12-09/60302811.PDF
2011-12-17,亚厦股份：关于公司控股子公司收到《中标通知书》的公告,finalpage/2011-12-17/60335925.PDF
2011-12-17,亚厦股份：关于公司控股子公司获得壹级资质证书的公告,finalpage/2011-12-17/60335926.PDF
2011-12-22,亚厦股份：股东股权质押公告,finalpage/2011-12-22/60352959.PDF
2011-12-31,亚厦股份：第二届董事会第二十次会议决议公告,finalpage/2011-12-31/60392879.PDF
2011-12-31,亚厦股份：第二届监事会第十八次会议决议公告,finalpage/2011-12-31/60392880.PDF
2011-12-31,亚厦股份：关于召开2012年第一次临时股东大会的通知,finalpage/2011-12-31/60392881.PDF
2011-12-31,亚厦股份：关于使用超募资金投资建设“装饰部品部件（木制品）工厂化项目二期”的公告,finalpage/2011-12-31/60392882.PDF
2011-12-31,亚厦股份：关于全资子公司浙江亚厦产业园发展有限公司签订募集资金三方监管协议的公告,finalpage/2011-12-31/60392883.PDF
2011-12-31,亚厦股份：独立董事对使用超募资金投资建设“装饰部品部件（木制品）工厂化项目二期”的独立意见,finalpage/2011-12-31/60392884.PDF
2011-12-31,亚厦股份：财富里昂证券有限责任公司关于公司使用超募资金投资建设“装饰部品部件（木制品）工厂化项目二期”的保荐意见,finalpage/2011-12-31/60392885.PDF
2012-01-13,亚厦股份：关于召开2012年第一次临时股东大会的提示性公告,finalpage/2012-01-13/60438411.PDF
2012-01-17,亚厦股份：2012年第一次临时股东大会决议公告,finalpage/2012-01-17/60451976.PDF
2012-01-17,亚厦股份：2012年第一次临时股东大会的法律意见书,finalpage/2012-01-17/60451977.PDF
2012-01-19,亚厦股份：关于公司及全资子公司签订重大合同的公告,finalpage/2012-01-19/60461419.PDF
2012-02-08,亚厦股份：关于取消费维国所获授公司股票期权的公告,finalpage/2012-02-08/60513170.PDF
2012-02-09,亚厦股份：第二届董事会第二十一次会议决议公告,finalpage/2012-02-09/60518051.PDF
2012-02-09,亚厦股份：第二届监事会第十九次会议决议公告,finalpage/2012-02-09/60518052.PDF
2012-02-09,亚厦股份：关于竞拍取得国有土地使用权的公告,finalpage/2012-02-09/60518053.PDF
2012-02-09,亚厦股份：独立董事关于参与竞拍国有土地使用权的独立意见,finalpage/2012-02-09/60518054.PDF
2012-02-09,亚厦股份：财富里昂证券有限责任公司关于公司使用超募资金参与竞拍国有土地使用权的保荐意见,finalpage/2012-02-09/60518055.PDF
2012-02-22,亚厦股份：2011年度业绩快报,finalpage/2012-02-22/60569270.PDF
2012-02-22,亚厦股份：关于2011年度利润分配预案的预披露公告,finalpage/2012-02-22/60569271.PDF
2012-03-15,亚厦股份：第二届董事会第二十二次会议决议公告,finalpage/2012-03-15/60670835.PDF
2012-03-15,亚厦股份：对外投资公告,finalpage/2012-03-15/60670836.PDF
2012-03-20,亚厦股份：2011年年度报告摘要,finalpage/2012-03-20/60693598.PDF
2012-03-20,亚厦股份：2011年年度报告,finalpage/2012-03-20/60693599.PDF
2012-03-20,亚厦股份：2011年年度审计报告,finalpage/2012-03-20/60693600.PDF
2012-03-20,亚厦股份：第二届董事会第二十三次会议决议公告,finalpage/2012-03-20/60693601.PDF
2012-03-20,亚厦股份：关于召开2011年度股东大会的通知,finalpage/2012-03-20/60693602.PDF
2012-03-20,亚厦股份：第二届监事会第二十次会议决议公告,finalpage/2012-03-20/60693603.PDF
2012-03-20,亚厦股份：关于公司控股股东及其他关联方资金占用情况的专项说明,finalpage/2012-03-20/60693604.PDF
2012-03-20,亚厦股份：董事会关于内部控制有效性的自我评价报告,finalpage/2012-03-20/60693605.PDF
2012-03-20,亚厦股份：截至2011年12月31日止内部控制鉴证报告,finalpage/2012-03-20/60693606.PDF
2012-03-20,亚厦股份：董事会关于募集资金2011年度存放和使用情况的专项报告,finalpage/2012-03-20/60693607.PDF
2012-03-20,亚厦股份：募集资金年度存放与使用情况鉴证报告,finalpage/2012-03-20/60693609.PDF
2012-03-20,亚厦股份：独立董事关于公司相关事项的独立意见,finalpage/2012-03-20/60693610.PDF
2012-03-20,亚厦股份：2011年度独立董事述职报告（董宜君）,finalpage/2012-03-20/60693611.PDF
2012-03-20,亚厦股份：关于为公司全资子公司提供担保的公告,finalpage/2012-03-20/60693612.PDF
2012-03-20,亚厦股份：关于2012年度日常关联交易预计情况的公告,finalpage/2012-03-20/60693613.PDF
2012-03-20,亚厦股份：关于举行网上2011年度报告说明会的通知,finalpage/2012-03-20/60693614.PDF
2012-03-20,亚厦股份：内幕信息知情人登记管理制度（2012年3月）,finalpage/2012-03-20/60693615.PDF
2012-03-20,亚厦股份：外部信息使用人管理制度（2012年3月）,finalpage/2012-03-20/60693616.PDF
2012-03-20,亚厦股份：公司章程（2012年3月）,finalpage/2012-03-20/60693617.PDF
2012-03-20,亚厦股份：2011年度独立董事述职报告（任永平）,finalpage/2012-03-20/60693618.PDF
2012-03-20,亚厦股份：2011年度独立董事述职报告（唐世定）,finalpage/2012-03-20/60693619.PDF
2012-03-20,亚厦股份：2011年度独立董事述职报告（王维安）,finalpage/2012-03-20/60693620.PDF
2012-03-20,亚厦股份：财富里昂证券有限责任公司关于公司2011年内部控制自我评价报告的核查意见,finalpage/2012-03-20/60693621.PDF
2012-03-20,亚厦股份：财富里昂证券有限责任公司关于公司2012年度日常关联交易预计情况的专项意见,finalpage/2012-03-20/60693622.PDF
2012-03-20,亚厦股份：财富里昂证券有限责任公司关于公司2011年度募集资金存放与使用情况的专项核查报告,finalpage/2012-03-20/60693623.PDF
2012-03-22,亚厦股份：关于发行公司债券申请获得中国证券监督管理委员会发行审核委员会审核通过的公告,finalpage/2012-03-22/60705067.PDF
2012-03-22,亚厦股份：控股股东部分股权解冻及质押公告,finalpage/2012-03-22/60705068.PDF
2012-04-11,亚厦股份：2011年度股东大会决议公告,finalpage/2012-04-11/60810543.PDF
2012-04-11,亚厦股份：第二届监事会第二十一次会议决议公告,finalpage/2012-04-11/60810544.PDF
2012-04-11,亚厦股份：2011年度股东大会的法律意见书,finalpage/2012-04-11/60810545.PDF
2012-04-11,亚厦股份：关于部分调整营销网络项目实施方案的公告,finalpage/2012-04-11/60810546.PDF
2012-04-11,亚厦股份：第二届董事会第二十四次会议决议公告,finalpage/2012-04-11/60810547.PDF
2012-04-11,亚厦股份：关于召开2012年第二次临时股东大会的通知,finalpage/2012-04-11/60810548.PDF
2012-04-11,亚厦股份：独立董事对公司部分调整营销网络项目实施方案的独立意见,finalpage/2012-04-11/60810549.PDF
2012-04-11,亚厦股份：财富里昂证券有限责任公司关于公司部分调整“营销网络项目”实施方案的保荐意见,finalpage/2012-04-11/60810550.PDF
2012-04-19,亚厦股份：控股股东部分股权解冻及质押公告,finalpage/2012-04-19/60854504.PDF
2012-04-26,亚厦股份：2012年第一季度报告正文,finalpage/2012-04-26/60909130.PDF
2012-04-26,亚厦股份：2012年第一季度报告全文,finalpage/2012-04-26/60909131.PDF
2012-04-26,亚厦股份：第二届董事会第二十五次会议决议公告,finalpage/2012-04-26/60909132.PDF
2012-04-27,亚厦股份：2012年第二次临时股东大会决议公告,finalpage/2012-04-27/60920007.PDF
2012-04-27,亚厦股份：2012年第二次临时股东大会的法律意见书,finalpage/2012-04-27/60920008.PDF
2012-04-27,亚厦股份：独立董事关于第二届董事会第二十五次会议相关事项的独立意见,finalpage/2012-04-27/60920009.PDF
2012-05-04,亚厦股份：第二届监事会第二十三次会议决议公告,finalpage/2012-05-04/60950728.PDF
2012-05-04,亚厦股份：第二届董事会第二十六次会议决议公告,finalpage/2012-05-04/60950729.PDF
2012-05-04,亚厦股份：关于为公司全资子公司提供担保的公告,finalpage/2012-05-04/60950730.PDF
2012-05-04,亚厦股份：关于股票期权激励计划预留股票期权授予相关事项的公告,finalpage/2012-05-04/60950731.PDF
2012-05-04,亚厦股份：独立董事关于第二届董事会第二十六次会议相关事项的独立意见,finalpage/2012-05-04/60950732.PDF
2012-05-04,亚厦股份：京衡律师集团事务所关于公司预留股票期权授予相关事项的法律意见书,finalpage/2012-05-04/60950733.PDF
2012-05-31,亚厦股份：2011年度权益分派实施公告,finalpage/2012-05-31/61068117.PDF
2012-06-01,亚厦股份：关于获得中国证券监督管理委员会核准公开发行公司债券批复的公告,finalpage/2012-06-01/61073370.PDF
2012-06-08,亚厦股份：独立董事关于股票期权数量和行权价格调整的独立意见,finalpage/2012-06-08/61109003.PDF
2012-06-08,亚厦股份：关于对公司股票期权激励计划涉及的股票期权数量和行权价格进行调整的公告,finalpage/2012-06-08/61109004.PDF
2012-06-08,亚厦股份：京衡律师集团事务所关于公司股票期权激励计划期权数量和行权价格调整的法律意见书（二）,finalpage/2012-06-08/61109005.PDF
2012-06-08,亚厦股份：第二届董事会第二十七次会议决议公告,finalpage/2012-06-08/61109006.PDF
2012-06-13,亚厦股份：股东股权质押公告,finalpage/2012-06-13/61129494.PDF
2012-06-21,亚厦股份：关于公司全资子公司浙江亚厦景观园林工程有限公司核准获得城市园林绿化二级施工企业资质的公告,finalpage/2012-06-21/61163972.PDF
2012-07-10,亚厦股份：关于重大事项停牌公告,finalpage/2012-07-10/61244619.PDF
2012-07-11,亚厦股份：2012年度非公开发行股票预案,finalpage/2012-07-11/61250409.PDF
2012-07-11,亚厦股份：本次非公开发行股票募集资金使用可行性分析报告,finalpage/2012-07-11/61250410.PDF
2012-07-11,亚厦股份：未来三年（2012-2014年）股东回报规划,finalpage/2012-07-11/61250411.PDF
2012-07-11,亚厦股份：第二届董事会第二十八次会议决议公告,finalpage/2012-07-11/61250412.PDF
2012-07-11,亚厦股份：前次募集资金使用情况鉴证报告,finalpage/2012-07-11/61250413.PDF
2012-07-11,亚厦股份：公司章程修订对照表,finalpage/2012-07-11/61250414.PDF
2012-07-11,亚厦股份：关于召开2012年第三次临时股东大会的通知,finalpage/2012-07-11/61250415.PDF
2012-07-11,亚厦股份：控股股东股份解除质押的公告,finalpage/2012-07-11/61250416.PDF
2012-07-11,亚厦股份：2012年不超过10亿元公司债券信用评级报告,finalpage/2012-07-11/61250417.PDF
2012-07-11,亚厦股份：2012年公司债券发行公告,finalpage/2012-07-11/61250418.PDF
2012-07-11,亚厦股份：公开发行2012年公司债券募集说明书,finalpage/2012-07-11/61250421.PDF
2012-07-11,亚厦股份：公开发行2012年公司债券募集说明书摘要,finalpage/2012-07-11/61250422.PDF
2012-07-11,亚厦股份：公司章程（2012年7月）,finalpage/2012-07-11/61250423.PDF
2012-07-11,亚厦股份：独立董事关于利润分配政策及未来三年股东回报规划的独立意见,finalpage/2012-07-11/61250424.PDF
2012-07-13,亚厦股份：2012年公司债券票面利率公告,finalpage/2012-07-13/61261884.PDF
2012-07-18,亚厦股份：2012年公司债券发行结果公告,finalpage/2012-07-18/61282885.PDF
2012-07-20,亚厦股份：关于取得专利证书和软件著作权的公告,finalpage/2012-07-20/61296229.PDF
2012-08-03,亚厦股份：关于召开2012年第三次临时股东大会的提示性公告,finalpage/2012-08-03/61363828.PDF
2012-08-08,亚厦股份：2012年第三次临时股东大会决议公告,finalpage/2012-08-08/61388095.PDF
2012-08-08,亚厦股份：2012年半年度报告摘要,finalpage/2012-08-08/61388097.PDF
2012-08-08,亚厦股份：2012年半年度报告,finalpage/2012-08-08/61388099.PDF
2012-08-08,亚厦股份：2012年半年度财务报告,finalpage/2012-08-08/61388100.PDF
2012-08-08,亚厦股份：第二届董事会第二十九次会议决议公告,finalpage/2012-08-08/61388101.PDF
2012-08-08,亚厦股份：独立董事关于相关事项的独立意见,finalpage/2012-08-08/61388102.PDF
2012-08-08,亚厦股份：2012年第三次临时股东大会的法律意见书,finalpage/2012-08-08/61388103.PDF
2012-08-08,亚厦股份：关于变更财务总监的公告,finalpage/2012-08-08/61388104.PDF
2012-08-08,亚厦股份：关于召开2012年第四次临时股东大会的通知,finalpage/2012-08-08/61388106.PDF
2012-08-08,亚厦股份：关于对全资子公司增资的公告,finalpage/2012-08-08/61388107.PDF
2012-08-08,亚厦股份：关于改聘会计师事务所的公告,finalpage/2012-08-08/61388108.PDF
2012-08-21,亚厦股份：2012年公司债券上市公告书,finalpage/2012-08-21/61451313.PDF
2012-08-24,亚厦股份：2012年第四次临时股东大会决议公告,finalpage/2012-08-24/61469864.PDF
2012-08-24,亚厦股份：2012年第四次临时股东大会的法律意见书,finalpage/2012-08-24/61469865.PDF
2012-08-28,亚厦股份：关于变更保荐机构的公告,finalpage/2012-08-28/61489367.PDF
2012-09-13,亚厦股份：澄清公告,finalpage/2012-09-13/61563072.PDF
2012-09-15,亚厦股份：关于重新签订募集资金三方监管协议的公告,finalpage/2012-09-15/61571711.PDF
2012-09-21,亚厦股份：第二届董事会第三十次会议决议公告,finalpage/2012-09-21/61592658.PDF
2012-09-21,亚厦股份：第二届监事会第二十五次会议决议公告,finalpage/2012-09-21/61592659.PDF
2012-09-21,亚厦股份：关于股票期权激励计划首次授予第一个行权期可行权的公告,finalpage/2012-09-21/61592660.PDF
2012-09-21,亚厦股份：关于股票期权激励计划首次授予第一个行权期激励对象调整的公告,finalpage/2012-09-21/61592661.PDF
2012-09-21,亚厦股份：股票期权激励计划首次授予第一个行权期可行权对象名单,finalpage/2012-09-21/61592662.PDF
2012-09-21,亚厦股份：独立董事关于公司股票期权第一个行权期行权相关事项的独立意见,finalpage/2012-09-21/61592663.PDF
2012-09-21,亚厦股份：关于公司股票期权激励计划首次授予第一个行权期可行权相关事项的法律意见书,finalpage/2012-09-21/61592664.PDF
2012-09-28,亚厦股份：股票期权激励计划首次授予第一个行权期行权情况公告,finalpage/2012-09-28/61616956.PDF
2012-10-11,亚厦股份：第二届董事会第三十一次会议决议公告,finalpage/2012-10-11/61640891.PDF
2012-10-11,亚厦股份：中信证券股份有限公司关于公司关联交易的专项核查意见,finalpage/2012-10-11/61640892.PDF
2012-10-11,亚厦股份：关于召开2012年第五次临时股东大会的通知,finalpage/2012-10-11/61640893.PDF
2012-10-11,亚厦股份：关于与杭州浪森石材有限公司联合收购浙江雅迪装饰工程有限公司100%股权暨关联交易的公告,finalpage/2012-10-11/61640894.PDF
2012-10-11,亚厦股份：公司章程（2012年10月）,finalpage/2012-10-11/61640895.PDF
2012-10-11,亚厦股份：独立董事关于关联交易事项的独立意见,finalpage/2012-10-11/61640896.PDF
2012-10-30,亚厦股份：2012年第五次临时股东大会决议公告,finalpage/2012-10-30/61730468.PDF
2012-10-30,亚厦股份：2012年第三季度报告正文,finalpage/2012-10-30/61730469.PDF
2012-10-30,亚厦股份：2012年第三季度报告全文,finalpage/2012-10-30/61730471.PDF
2012-10-30,亚厦股份：2012年第五次临时股东大会的法律意见书,finalpage/2012-10-30/61730472.PDF
2012-11-29,亚厦股份：关于控股股东增持公司股份的公告,finalpage/2012-11-29/61846977.PDF
2012-12-07,亚厦股份：第二届董事会第三十三次会议决议公告,finalpage/2012-12-07/61880821.PDF
2012-12-19,亚厦股份：中信证券股份有限公司关于公司关联交易的专项核查意见,finalpage/2012-12-19/61923725.PDF
2012-12-19,亚厦股份：关于与关联法人对控股子公司浙江雅迪装饰工程有限公司同比例增资的公告,finalpage/2012-12-19/61923726.PDF
2012-12-19,亚厦股份：关于取得专利证书的公告,finalpage/2012-12-19/61923727.PDF
2012-12-19,亚厦股份：独立董事关于关联交易事项的独立意见,finalpage/2012-12-19/61923728.PDF
2012-12-19,亚厦股份：第二届董事会第三十四次会议决议公告,finalpage/2012-12-19/61923729.PDF
2012-12-29,亚厦股份：关于公司和子公司收到《中标通知书》及签订施工程合同的公告,finalpage/2012-12-29/61966276.PDF
2013-01-12,亚厦股份：第二届董事会第三十五次会议决议公告,finalpage/2013-01-12/62011240.PDF
2013-01-12,亚厦股份：关于取得专利证书的公告,finalpage/2013-01-12/62011242.PDF
2013-01-12,亚厦股份：独立董事关于第二届董事会第三十五次会议相关事项的独立意见,finalpage/2013-01-12/62011243.PDF
2013-01-26,亚厦股份：第二届董事会第三十六次会议决议公告,finalpage/2013-01-26/62069992.PDF
2013-01-26,亚厦股份：关于使用自有资金对成都恒基装饰工程有限公司增资的公告,finalpage/2013-01-26/62069993.PDF
2013-01-26,亚厦股份：关于使用超募资金和自有资金对浙江亚厦产业投资发展有限公司增资的公告,finalpage/2013-01-26/62069994.PDF
2013-01-26,亚厦股份：关于公司全资子公司浙江亚厦景观园林工程有限公司核准获得市政公用工程施工总承包资质的公告,finalpage/2013-01-26/62069995.PDF
2013-02-27,亚厦股份：2012年度业绩快报,finalpage/2013-02-27/62155460.PDF
2013-03-25,亚厦股份：首次公开发行前已发行股份部分上市流通提示性公告,finalpage/2013-03-25/62252836.PDF
2013-03-30,亚厦股份：2012年年度报告摘要,finalpage/2013-03-30/62305004.PDF
2013-03-30,亚厦股份：2012年年度审计报告,finalpage/2013-03-30/62305014.PDF
2013-03-30,亚厦股份：第二届董事会第三十七次会议决议公告,finalpage/2013-03-30/62305015.PDF
2013-03-30,亚厦股份：关于召开2012年度股东大会的通知,finalpage/2013-03-30/62305016.PDF
2013-03-30,亚厦股份：第二届监事会第二十七次会议决议公告,finalpage/2013-03-30/62305017.PDF
2013-03-30,亚厦股份：关于公司控股股东及其他关联方占用资金情况的专项说明,finalpage/2013-03-30/62305018.PDF
2013-03-30,亚厦股份：2012年年度报告,finalpage/2013-03-30/62305019.PDF
2013-03-30,亚厦股份：董事会关于内部控制有效性的自我评价报告,finalpage/2013-03-30/62305020.PDF
2013-03-30,亚厦股份：董事会关于募集资金年度存放与使用情况的专项报告,finalpage/2013-03-30/62305021.PDF
2013-03-30,亚厦股份：关于公司2012年度募集资金存放与使用情况鉴证报告,finalpage/2013-03-30/62305022.PDF
2013-03-30,亚厦股份：独立董事关于公司2012年年报相关事项的独立意见,finalpage/2013-03-30/62305023.PDF
2013-03-30,亚厦股份：中信证券股份有限公司关于公司2012年度募集资金存放与使用情况的核查意见,finalpage/2013-03-30/62305024.PDF
2013-03-30,亚厦股份：中信证券股份有限公司关于公司2012年内部控制自我评价报告的核查意见,finalpage/2013-03-30/62305025.PDF
2013-03-30,亚厦股份：中信证券股份有限公司关于公司2013年度日常关联交易预计情况的专项意见,finalpage/2013-03-30/62305026.PDF
2013-03-30,亚厦股份：中信证券股份有限公司关于公司《公司内部控制规则落实自查表》的核查意见,finalpage/2013-03-30/62305027.PDF
2013-03-30,亚厦股份：关于2013年度日常关联交易预计情况的公告,finalpage/2013-03-30/62305028.PDF
2013-03-30,亚厦股份：关于为公司子公司提供担保的公告,finalpage/2013-03-30/62305029.PDF
2013-03-30,亚厦股份：关于为江苏分公司购买办公楼的公告,finalpage/2013-03-30/62305030.PDF
2013-03-30,亚厦股份：关于举办投资者接待日活动的公告,finalpage/2013-03-30/62305031.PDF
