,date,title,url
436,2013-08-29,海普瑞：关于变更会计师事务所的公告,finalpage/2013-08-29/63014552.PDF
437,2013-08-29,海普瑞：关于变更部分募集资金存放专项账户并签订募集资金三方监管协议的公告,finalpage/2013-08-29/63014553.PDF
438,2013-08-29,海普瑞：关于召开2013年第一次临时股东大会的通知公告,finalpage/2013-08-29/63014554.PDF
439,2013-08-29,海普瑞：关于向银行申请专项授信额度的公告,finalpage/2013-08-29/63014555.PDF
440,2013-08-29,海普瑞：关于调整2013年度部分日常关联交易预计的公告,finalpage/2013-08-29/63014556.PDF
441,2013-08-29,海普瑞：独立董事关于调整2013年度部分日常关联交易预计之事前认可意见,finalpage/2013-08-29/63014557.PDF
442,2013-09-14,海普瑞：2013年第一次临时股东大会的法律意见书,finalpage/2013-09-14/63081096.PDF
443,2013-09-14,海普瑞：2013年第一次临时股东大会决议公告,finalpage/2013-09-14/63081097.PDF
444,2013-09-14,海普瑞：关于公司高级管理人员辞职的公告,finalpage/2013-09-14/63081240.PDF
445,2013-09-26,海普瑞：重大事项停牌公告,finalpage/2013-09-26/63111681.PDF
446,2013-10-09,海普瑞：关于筹划重大资产重组的停牌公告,finalpage/2013-10-09/63134845.PDF
447,2013-10-09,海普瑞：第二届董事会第二十七次会议决议公告,finalpage/2013-10-09/63134848.PDF
448,2013-10-10,海普瑞：关于部分产品生产停产的公告,finalpage/2013-10-10/63140532.PDF
449,2013-10-15,海普瑞：关于重大资产重组事项的进展公告,finalpage/2013-10-15/63155044.PDF
450,2013-10-21,海普瑞：关于重大资产重组事项的进展公告,finalpage/2013-10-21/63174809.PDF
451,2013-10-25,海普瑞：关于重大资产重组事项的进展公告,finalpage/2013-10-25/63191546.PDF
452,2013-10-28,海普瑞：2013年第三季度报告正文（已取消）,finalpage/2013-10-28/63199223.PDF
453,2013-10-28,海普瑞：2013年第三季度报告全文（已取消）,finalpage/2013-10-28/63199224.PDF
454,2013-10-28,海普瑞：第二届董事会第二十八次会议决议公告,finalpage/2013-10-28/63199225.PDF
455,2013-10-28,海普瑞：关于向银行申请专项授信额度的公告,finalpage/2013-10-28/63199226.PDF
456,2013-10-29,海普瑞：2013年第三季度报告全文（更新后）,finalpage/2013-10-29/63208274.PDF
457,2013-10-29,海普瑞：2013年第三季度报告正文（更新后）,finalpage/2013-10-29/63208275.PDF
458,2013-10-29,海普瑞：关于2013年第三季度报告的更正公告,finalpage/2013-10-29/63208276.PDF
459,2013-10-31,海普瑞：关于重大资产重组事项的进展公告,finalpage/2013-10-31/63218903.PDF
460,2013-11-06,海普瑞：关于公司完成工商变更登记的公告,finalpage/2013-11-06/63241648.PDF
461,2013-11-06,海普瑞：关于重大资产重组延期复牌暨进展公告,finalpage/2013-11-06/63241649.PDF
462,2013-11-12,海普瑞：关于重大资产重组事项的进展公告,finalpage/2013-11-12/63257853.PDF
463,2013-11-19,海普瑞：关于重大资产重组事项的进展公告,finalpage/2013-11-19/63279886.PDF
464,2013-11-23,海普瑞：关于股东迁址及更名等的提示性公告,finalpage/2013-11-23/63294873.PDF
465,2013-11-26,海普瑞：关于重大资产重组事项的进展公告,finalpage/2013-11-26/63303229.PDF
466,2013-11-30,海普瑞：关于募集资金投资项目投产的公告,finalpage/2013-11-30/63318957.PDF
467,2013-12-03,海普瑞：关于重大资产重组事项的进展公告,finalpage/2013-12-03/63327531.PDF
468,2013-12-10,海普瑞：关于重大资产重组事项的进展公告,finalpage/2013-12-10/63360322.PDF
469,2013-12-17,海普瑞：关于重大资产重组事项的进展公告,finalpage/2013-12-17/63383099.PDF
470,2013-12-24,海普瑞：关于重大资产重组事项的进展公告,finalpage/2013-12-24/63405739.PDF
471,2013-12-27,海普瑞：中国中投证券有限责任公司关于公司拟以部分超募资金对全资子公司进行增资暨收购美国公司股权的核查意见,finalpage/2013-12-27/63420180.PDF
472,2013-12-27,海普瑞：交易对方承诺与声明,finalpage/2013-12-27/63420181.PDF
473,2013-12-27,海普瑞：关于使用部分超募资金对全资子公司进行增资的公告,finalpage/2013-12-27/63420182.PDF
474,2013-12-27,海普瑞：关于重大资产重组的一般风险提示暨复牌公告,finalpage/2013-12-27/63420183.PDF
475,2013-12-27,海普瑞：董事会关于重组履行法定程序完备性、合规性及提交的法律文件有效性的说明,finalpage/2013-12-27/63420184.PDF
476,2013-12-27,海普瑞：独立董事对重大资产购买相关事项的独立意见,finalpage/2013-12-27/63420185.PDF
477,2013-12-27,海普瑞：华英证券有限责任公司关于公司重大资产购买预案之独立财务顾问核查意见,finalpage/2013-12-27/63420186.PDF
478,2013-12-27,海普瑞：第二届监事会第二十六次会议决议公告,finalpage/2013-12-27/63420187.PDF
479,2013-12-27,海普瑞：第二届董事会第二十九次会议决议公告,finalpage/2013-12-27/63420188.PDF
480,2013-12-27,海普瑞：重大资产购买预案,finalpage/2013-12-27/63420189.PDF
481,2014-01-13,海普瑞：关于召开2014年第一次临时股东大会的通知公告,finalpage/2014-01-13/63474686.PDF
482,2014-01-13,海普瑞：关于向银行申请综合授信额度的公告,finalpage/2014-01-13/63474687.PDF
483,2014-01-13,海普瑞：关于对控股子公司进行增资的公告,finalpage/2014-01-13/63474688.PDF
484,2014-01-13,海普瑞：关于申请内保外贷暨为全资子公司提供反担保的公告,finalpage/2014-01-13/63474689.PDF
485,2014-01-13,海普瑞：备考财务报表,finalpage/2014-01-13/63474690.PDF
486,2014-01-13,海普瑞：SPL Acquisition Corp.及其子公司审计报告,finalpage/2014-01-13/63474691.PDF
487,2014-01-13,海普瑞：北京市中伦律师事务所关于公司重大资产购买的法律意见书,finalpage/2014-01-13/63474692.PDF
488,2014-01-13,海普瑞：独立董事关于第二届董事会第三十次会议相关事项的独立意见,finalpage/2014-01-13/63474693.PDF
489,2014-01-13,海普瑞：华英证券有限责任公司关于公司重大资产购买之独立财务顾问报告,finalpage/2014-01-13/63474694.PDF
490,2014-01-13,海普瑞：SPL Acquisition Corp.及其子公司盈利预测审核报告,finalpage/2014-01-13/63474695.PDF
491,2014-01-13,海普瑞：第二届监事会第二十七次会议决议公告,finalpage/2014-01-13/63474696.PDF
492,2014-01-13,海普瑞：第二届董事会第三十次会议决议公告,finalpage/2014-01-13/63474697.PDF
493,2014-01-13,海普瑞：拟收购SPL Acquisition Corp.股权项目资产评估报告书,finalpage/2014-01-13/63474698.PDF
494,2014-01-13,海普瑞：重大资产购买报告书（草案）,finalpage/2014-01-13/63474700.PDF
495,2014-01-13,海普瑞：重大资产购买报告书（草案）摘要,finalpage/2014-01-13/63474701.PDF
496,2014-01-29,海普瑞：2014年第一次临时股东大会决议公告,finalpage/2014-01-29/63535525.PDF
497,2014-01-29,海普瑞：2014年第一次临时股东大会的法律意见书,finalpage/2014-01-29/63535796.PDF
498,2014-02-12,海普瑞：关于承诺履行情况的公告,finalpage/2014-02-12/63561219.PDF
499,2014-02-12,海普瑞：关于监事会换届选举的提示性公告,finalpage/2014-02-12/63561220.PDF
500,2014-02-12,海普瑞：关于董事会换届选举的提示性公告,finalpage/2014-02-12/63561221.PDF
501,2014-02-13,海普瑞：关于收到《中国证监会行政许可申请材料补正通知书》的公告,finalpage/2014-02-13/63565222.PDF
502,2014-02-25,海普瑞：关于重大资产重组材料获得中国证监会行政许可申请受理的公告,finalpage/2014-02-25/63605237.PDF
503,2014-02-27,海普瑞：2013年度业绩快报,finalpage/2014-02-27/63610247.PDF
504,2014-03-01,海普瑞：关于证券事务代表辞职的公告,finalpage/2014-03-01/63620096.PDF
505,2014-03-04,海普瑞：关于控股子公司完成工商变更登记的公告,finalpage/2014-03-04/63631075.PDF
506,2014-03-22,海普瑞：关于成都深瑞相关事项的公告,finalpage/2014-03-22/63708282.PDF
507,2014-03-29,海普瑞：北京市中伦律师事务所关于公司重大资产购买的补充法律意见书（一）,finalpage/2014-03-29/63748580.PDF
508,2014-03-29,海普瑞：北京市中伦律师事务所关于公司重大资产购买的补充法律意见书（二）,finalpage/2014-03-29/63748581.PDF
509,2014-03-29,海普瑞：北京市中伦律师事务所关于公司重大资产购买的法律意见书,finalpage/2014-03-29/63748582.PDF
510,2014-03-29,海普瑞：华英证券有限责任公司关于公司重大资产购买之独立财务顾问报告,finalpage/2014-03-29/63748584.PDF
511,2014-03-29,海普瑞：华英证券有限责任公司关于公司重大资产购买申请文件反馈意见的回复之核查意见,finalpage/2014-03-29/63748585.PDF
512,2014-03-29,海普瑞：华英证券有限责任公司关于《深圳市海普瑞药业股份有限公司关于重大资产购买申报文件》补正材料之独立财务顾问意见,finalpage/2014-03-29/63748586.PDF
513,2014-03-29,海普瑞：关于重大资产购买报告书修订说明的公告,finalpage/2014-03-29/63748587.PDF
514,2014-03-29,海普瑞：关于重大资产重组方案获得中国证监会核准的公告,finalpage/2014-03-29/63748588.PDF
515,2014-03-29,海普瑞：重大资产购买报告书（修订稿）,finalpage/2014-03-29/63748592.PDF
516,2014-04-11,海普瑞：北京市中伦律师事务所关于公司重大资产购买之实施情况的法律意见书,finalpage/2014-04-11/63821261.PDF
517,2014-04-11,海普瑞：华英证券有限责任公司关于公司重大资产购买实施情况之独立财务顾问核查意见,finalpage/2014-04-11/63821262.PDF
518,2014-04-11,海普瑞：董事会关于重大资产重组的实施情况报告书,finalpage/2014-04-11/63821263.PDF
519,2014-04-15,海普瑞：2014年第一季度业绩预告,finalpage/2014-04-15/63843402.PDF
520,2014-04-18,海普瑞：中国中投证券有限责任公司关于公司2013年度募集资金存放与使用情况的核查意见,finalpage/2014-04-18/63861732.PDF
521,2014-04-18,海普瑞：2013年度监事会报告,finalpage/2014-04-18/63861733.PDF
522,2014-04-18,海普瑞：2013年度财务决算报告,finalpage/2014-04-18/63861734.PDF
523,2014-04-18,海普瑞：2013年年度报告摘要,finalpage/2014-04-18/63861735.PDF
524,2014-04-18,海普瑞：2013年年度报告,finalpage/2014-04-18/63861749.PDF
525,2014-04-18,海普瑞：2013年年度审计报告,finalpage/2014-04-18/63861766.PDF
526,2014-04-18,海普瑞：第二届董事会第三十一次会议决议公告,finalpage/2014-04-18/63861768.PDF
527,2014-04-18,海普瑞：关于召开2013年度股东大会的通知公告,finalpage/2014-04-18/63861769.PDF
528,2014-04-18,海普瑞：第二届监事会第二十八次会议决议公告,finalpage/2014-04-18/63861770.PDF
529,2014-04-18,海普瑞：关于公司关联方占用上市公司资金情况的专项审核报告,finalpage/2014-04-18/63861771.PDF
530,2014-04-18,海普瑞：2013年度内部控制评价报告,finalpage/2014-04-18/63861772.PDF
531,2014-04-18,海普瑞：内部控制审计报告,finalpage/2014-04-18/63861773.PDF
532,2014-04-18,海普瑞：2013年度募集资金存放与使用情况的专项报告,finalpage/2014-04-18/63861774.PDF
533,2014-04-18,海普瑞：关于公司募集资金年度存放与实际使用情况的鉴证报告,finalpage/2014-04-18/63861775.PDF
534,2014-04-18,海普瑞：独立董事关于第二届董事会第三十一次会议相关事项的独立意见,finalpage/2014-04-18/63861776.PDF
535,2014-04-18,海普瑞：独立董事2013年度述职报告（解冻）,finalpage/2014-04-18/63861778.PDF
536,2014-04-18,海普瑞：《公司章程》修正案,finalpage/2014-04-18/63861779.PDF
537,2014-04-18,海普瑞：公司章程（2014年4月）,finalpage/2014-04-18/63861781.PDF
538,2014-04-18,海普瑞：关于举行2013年度报告网上说明会的公告,finalpage/2014-04-18/63861783.PDF
539,2014-04-18,海普瑞：关于使用自有闲置资金购买银行理财产品的公告,finalpage/2014-04-18/63861784.PDF
540,2014-04-18,海普瑞：关于向控股子公司提供委托贷款的公告,finalpage/2014-04-18/63861789.PDF
541,2014-04-18,海普瑞：关于开展2014年远期外汇交易情况的公告,finalpage/2014-04-18/63861790.PDF
542,2014-04-18,海普瑞：关于注销全资子公司的公告,finalpage/2014-04-18/63861791.PDF
543,2014-04-18,海普瑞：内部控制规则落实自查表,finalpage/2014-04-18/63861792.PDF
544,2014-04-18,海普瑞：独立董事2013年度述职报告（周海梦）,finalpage/2014-04-18/63861793.PDF
545,2014-04-18,海普瑞：独立董事2013年度述职报告（徐滨）,finalpage/2014-04-18/63861794.PDF
546,2014-04-18,海普瑞：独立董事候选人声明（张荣庆）,finalpage/2014-04-18/63861795.PDF
547,2014-04-18,海普瑞：独立董事候选人声明（徐滨）,finalpage/2014-04-18/63861796.PDF
548,2014-04-18,海普瑞：独立董事候选人声明（解冻）,finalpage/2014-04-18/63861798.PDF
549,2014-04-18,海普瑞：独立董事关于第二届董事会第三十一次会议相关事项之事前认可意见,finalpage/2014-04-18/63861799.PDF
550,2014-04-18,海普瑞：独立董事提名人声明,finalpage/2014-04-18/63861800.PDF
551,2014-04-28,海普瑞：2014年第一季度报告正文,finalpage/2014-04-28/63929713.PDF
552,2014-04-28,海普瑞：2014年第一季度报告全文,finalpage/2014-04-28/63929714.PDF
553,2014-04-28,海普瑞：第二届监事会第二十九次会议决议公告,finalpage/2014-04-28/63929715.PDF
554,2014-04-28,海普瑞：第二届董事会第三十二次会议决议公告,finalpage/2014-04-28/63929716.PDF
555,2014-04-28,海普瑞：关于签署关联交易协议的公告,finalpage/2014-04-28/63929717.PDF
556,2014-04-28,海普瑞：独立董事关于第二届董事会第三十二次会议相关事项的独立意见,finalpage/2014-04-28/63929718.PDF
557,2014-04-28,海普瑞：独立董事关于签署关联交易协议之事前认可意见,finalpage/2014-04-28/63929719.PDF
558,2014-05-10,海普瑞：关于选举职工代表监事的公告,finalpage/2014-05-10/64006249.PDF
559,2014-05-17,海普瑞：2013年度股东大会决议公告,finalpage/2014-05-17/64035916.PDF
560,2014-05-17,海普瑞：2013年度股东大会的法律意见书,finalpage/2014-05-17/64035917.PDF
561,2014-05-17,海普瑞：独立董事关于第三届董事会第一次会议相关事项的独立意见,finalpage/2014-05-17/64035918.PDF
562,2014-05-17,海普瑞：第三届监事会第一次会议决议公告,finalpage/2014-05-17/64035919.PDF
563,2014-05-17,海普瑞：第三届董事会第一次会议决议公告,finalpage/2014-05-17/64035920.PDF
564,2014-05-30,海普瑞：2013年年度权益分派实施公告,finalpage/2014-05-30/64083141.PDF
565,2014-07-08,海普瑞：关于公司股票临时停牌的公告,finalpage/2014-07-08/1200038482.PDF
566,2014-07-10,海普瑞：关于公司股票复牌的公告,finalpage/2014-07-10/1200043656.PDF
567,2014-07-10,海普瑞：关于召开2014年第二次临时股东大会的通知公告,finalpage/2014-07-10/1200043657.PDF
568,2014-07-10,海普瑞：关于对全资子公司进行增资的公告,finalpage/2014-07-10/1200043658.PDF
569,2014-07-10,海普瑞：北京市中伦（深圳）律师事务所关于公司实施员工持股计划的法律意见书,finalpage/2014-07-10/1200043659.PDF
570,2014-07-10,海普瑞：关于签署关联交易协议的公告,finalpage/2014-07-10/1200043660.PDF
571,2014-07-10,海普瑞：员工持股计划（草案）,finalpage/2014-07-10/1200043661.PDF
572,2014-07-10,海普瑞：员工持股计划（草案）摘要,finalpage/2014-07-10/1200043662.PDF
573,2014-07-10,海普瑞：国联汇金29号集合资产管理计划资产管理合同,finalpage/2014-07-10/1200043663.PDF
574,2014-07-10,海普瑞：独立董事关于第三届董事会第二次会议相关事项的独立意见,finalpage/2014-07-10/1200043664.PDF
575,2014-07-10,海普瑞：独立董事关于签署关联交易协议之事前认可意见,finalpage/2014-07-10/1200043665.PDF
576,2014-07-10,海普瑞：第三届监事会第二次会议决议公告,finalpage/2014-07-10/1200043666.PDF
577,2014-07-10,海普瑞：第三届董事会第二次会议决议公告,finalpage/2014-07-10/1200043667.PDF
578,2014-07-29,海普瑞：2014年第二次临时股东大会决议公告,finalpage/2014-07-29/1200084454.PDF
579,2014-07-29,海普瑞：2014年第二次临时股东大会的法律意见书,finalpage/2014-07-29/1200084455.PDF
580,2014-07-31,海普瑞：2014年半年度业绩快报,finalpage/2014-07-31/1200090512.PDF
581,2014-08-28,海普瑞：2014年半年度报告摘要,finalpage/2014-08-28/1200178599.PDF
582,2014-08-28,海普瑞：2014年半年度财务报告,finalpage/2014-08-28/1200178601.PDF
583,2014-08-28,海普瑞：第三届董事会第三次会议决议公告,finalpage/2014-08-28/1200178602.PDF
584,2014-08-28,海普瑞：第三届监事会第三次会议决议公告,finalpage/2014-08-28/1200178603.PDF
585,2014-08-28,海普瑞：2014年半年度报告,finalpage/2014-08-28/1200178604.PDF
586,2014-08-28,海普瑞：独立董事关于第三届董事会第三次会议相关事项的独立意见,finalpage/2014-08-28/1200178605.PDF
587,2014-08-28,海普瑞：关于美国全资子公司雇主养老金计划投资的公告,finalpage/2014-08-28/1200178606.PDF
588,2014-08-28,海普瑞：关于公司使用自有资金购买低风险理财产品的公告,finalpage/2014-08-28/1200178607.PDF
589,2014-08-28,海普瑞：关于公司及美国全资子公司向银行申请授信额度的公告,finalpage/2014-08-28/1200178608.PDF
590,2014-08-28,海普瑞：关于公司员工持股计划实施的进展公告,finalpage/2014-08-28/1200178609.PDF
591,2014-08-28,海普瑞：关于召开2014年第三次临时股东大会的通知公告,finalpage/2014-08-28/1200178610.PDF
592,2014-08-28,海普瑞：董事会关于募集资金2014年半年度存放与使用的专项报告,finalpage/2014-08-28/1200178611.PDF
593,2014-08-28,海普瑞：风险投资管理制度（2014年8月）,finalpage/2014-08-28/1200179073.PDF
594,2014-09-05,海普瑞：关于控股股东股权质押的公告,finalpage/2014-09-05/1200205353.PDF
595,2014-09-23,海普瑞：关于公司员工持股计划完成股票购买的公告,finalpage/2014-09-23/1200251559.PDF
596,2014-09-23,海普瑞：关于董事辞职的公告,finalpage/2014-09-23/1200251560.PDF
597,2014-09-24,海普瑞：2014年第三次临时股东大会决议公告,finalpage/2014-09-24/1200255952.PDF
598,2014-09-24,海普瑞：关于公司使用自有资金购买低风险理财产品的进展公告,finalpage/2014-09-24/1200255953.PDF
599,2014-09-24,海普瑞：2014年第三次临时股东大会的法律意见书,finalpage/2014-09-24/1200255954.PDF
600,2014-09-26,海普瑞：关于全资子公司完成工商注销手续的公告,finalpage/2014-09-26/1200261985.PDF
601,2014-10-11,海普瑞：关于全资子公司完成增资变更注册的公告,finalpage/2014-10-11/1200288481.PDF
602,2014-10-30,海普瑞：2014年第三季度报告正文,finalpage/2014-10-30/1200353139.PDF
603,2014-10-30,海普瑞：第三届董事会第四次会议决议公告,finalpage/2014-10-30/1200353141.PDF
604,2014-10-30,海普瑞：第三届监事会第四次会议决议公告,finalpage/2014-10-30/1200353142.PDF
605,2014-10-30,海普瑞：2014年第三季度报告全文,finalpage/2014-10-30/1200353143.PDF
606,2014-10-30,海普瑞：关于会计政策变更的公告,finalpage/2014-10-30/1200353144.PDF
607,2014-10-30,海普瑞：关于公司向花旗银行（中国）深圳分行申请授信的公告,finalpage/2014-10-30/1200353145.PDF
608,2014-10-30,海普瑞：关于召开2014年第四次临时股东大会的通知,finalpage/2014-10-30/1200353146.PDF
609,2014-10-30,海普瑞：关于增加自有资金购买银行保本理财产品额度的公告,finalpage/2014-10-30/1200353147.PDF
610,2014-10-30,海普瑞：关于开展利率掉期和远期外汇交易的公告,finalpage/2014-10-30/1200353148.PDF
611,2014-10-30,海普瑞：独立董事关于第三届董事会第四次会议相关议案的独立意见,finalpage/2014-10-30/1200353149.PDF
612,2014-11-04,"海普瑞：关于公司使用自有资金对TPG BIOTECHNOLOGY PARTNERS IV,L.P.进行投资的公告",finalpage/2014-11-04/1200366486.PDF
613,2014-11-04,海普瑞：独立董事关于第三届董事会第五次会议相关议案的独立意见,finalpage/2014-11-04/1200366487.PDF
614,2014-11-04,海普瑞：第三届董事会第五次会议决议公告,finalpage/2014-11-04/1200366488.PDF
615,2014-11-20,海普瑞：2014年第四次临时股东大会决议公告,finalpage/2014-11-20/1200404377.PDF
616,2014-11-20,海普瑞：2014年第四次临时股东大会的法律意见书,finalpage/2014-11-20/1200404378.PDF
617,2014-11-21,海普瑞：关于全资子公司使用自有资金对CANTEX进行投资的公告,finalpage/2014-11-21/1200406178.PDF
618,2014-11-21,海普瑞：独立董事关于第三届董事会第六次会议相关议案的独立意见,finalpage/2014-11-21/1200406179.PDF
619,2014-11-21,海普瑞：第三届董事会第六次会议决议公告,finalpage/2014-11-21/1200406180.PDF
620,2014-11-26,海普瑞：关于全资子公司使用自有资金对CANTEX进行投资的进展公告,finalpage/2014-11-26/1200416246.PDF
621,2014-12-03,"海普瑞：关于公司使用自有资金对TPG BIOTECHNOLOGY PARTNERS IV, L.P.进行投资的进展公告",finalpage/2014-12-03/1200435124.PDF
622,2014-12-03,海普瑞：关于公司使用自有资金购买低风险理财产品的进展公告,finalpage/2014-12-03/1200435125.PDF
623,2014-12-12,海普瑞：关于公司使用自有资金购买低风险理财产品的进展公告,finalpage/2014-12-12/1200459245.PDF
624,2015-01-15,海普瑞：关于子公司医疗器械产品完成欧盟注册的公告,finalpage/2015-01-15/1200545195.PDF
625,2015-01-28,海普瑞：关于子公司医疗器械产品完成欧盟注册的公告,finalpage/2015-01-28/1200583666.PDF
626,2015-02-17,海普瑞：关于2015年度日常关联交易预计的公告,finalpage/2015-02-17/1200643831.PDF
627,2015-02-17,海普瑞：关于使用节余募集资金永久补充流动资金的公告,finalpage/2015-02-17/1200643832.PDF
628,2015-02-17,海普瑞：关于公司使用自有资金购买低风险理财产品的公告,finalpage/2015-02-17/1200643833.PDF
629,2015-02-17,海普瑞：关于向银行申请授信的公告,finalpage/2015-02-17/1200643834.PDF
630,2015-02-17,海普瑞：华英证券有限责任公司关于公司使用节余募集资金永久补充流动资金的专项核查意见,finalpage/2015-02-17/1200643835.PDF
631,2015-02-17,海普瑞：独立董事关于2015年度日常关联交易预计的事前认可意见,finalpage/2015-02-17/1200643836.PDF
632,2015-02-17,海普瑞：独立董事关于第三届董事会第七次会议相关事项的独立意见,finalpage/2015-02-17/1200643837.PDF
633,2015-02-17,海普瑞：第三届监事会第五次会议决议公告,finalpage/2015-02-17/1200643838.PDF
634,2015-02-17,海普瑞：第三届董事会第七次会议决议公告,finalpage/2015-02-17/1200643839.PDF
635,2015-02-28,海普瑞：2014年度业绩快报,finalpage/2015-02-28/1200657697.PDF
636,2015-03-17,海普瑞：关于公司使用自有资金购买低风险理财产品的进展公告,finalpage/2015-03-17/1200705022.PDF
637,2015-03-19,海普瑞：关于设立产业并购基金的公告,finalpage/2015-03-19/1200714161.PDF
638,2015-03-19,海普瑞：独立董事关于第三届董事会第八次会议相关事项的独立意见,finalpage/2015-03-19/1200714162.PDF
639,2015-03-19,海普瑞：第三届监事会第六次会议决议公告,finalpage/2015-03-19/1200714163.PDF
640,2015-03-19,海普瑞：第三届董事会第八次会议决议公告,finalpage/2015-03-19/1200714164.PDF
641,2015-03-31,海普瑞：2015年度第一季度业绩预告,finalpage/2015-03-31/1200764500.PDF
642,2015-04-08,"海普瑞：关于全资子公司使用自有资金对CDH Avatar,L.P.进行投资的公告",finalpage/2015-04-08/1200795385.PDF
643,2015-04-08,海普瑞：独立董事关于第三届董事会第九次会议相关议案的独立意见,finalpage/2015-04-08/1200795386.PDF
644,2015-04-08,海普瑞：第三届董事会第九次会议决议公告,finalpage/2015-04-08/1200795387.PDF
645,2015-04-14,海普瑞：关于设立产业并购基金的进展公告,finalpage/2015-04-14/1200827830.PDF
646,2015-04-17,"海普瑞：关于全资子公司使用自有资金对CDH Avatar,L.P.进行投资的进展公告",finalpage/2015-04-17/1200842835.PDF
647,2015-04-23,海普瑞：关于全资子公司使用自有资金对CANTEX进行投资的完成公告,finalpage/2015-04-23/1200888747.PDF
648,2015-04-28,海普瑞：华英证券有限责任公司关于公司2014年度募集资金存放与使用情况的核查意见,finalpage/2015-04-28/1200927312.PDF
649,2015-04-28,海普瑞：华英证券有限责任公司关于公司重大资产购买之持续督导意见,finalpage/2015-04-28/1200927313.PDF
650,2015-04-28,海普瑞：2014年度监事会报告,finalpage/2015-04-28/1200922215.PDF
651,2015-04-28,海普瑞：2014年度财务决算报告,finalpage/2015-04-28/1200922216.PDF
652,2015-04-28,海普瑞：关于SPL Acquisition Corp.及其子公司盈利预测实现情况的专项审核报告,finalpage/2015-04-28/1200922217.PDF
653,2015-04-28,海普瑞：2014年年度报告摘要,finalpage/2015-04-28/1200922218.PDF
654,2015-04-28,海普瑞：2014年年度审计报告,finalpage/2015-04-28/1200922220.PDF
