date,title,url
2012-10-26,中海科技：2012年第三季度报告正文,finalpage/2012-10-26/61710096.PDF
2012-10-26,中海科技：第四届董事会第十九次会议决议公告,finalpage/2012-10-26/61710104.PDF
2012-10-26,中海科技：第四届监事会第十四次会议决议公告,finalpage/2012-10-26/61710105.PDF
2012-10-26,中海科技：2012年第三季度报告全文,finalpage/2012-10-26/61710106.PDF
2012-10-31,中海科技：关于公司股东、关联方以及公司承诺履行情况的公告,finalpage/2012-10-31/61745783.PDF
2012-12-14,中海科技：关于审计机构转制更名的公告,finalpage/2012-12-14/61906811.PDF
2012-12-26,中海科技：第四届董事会第二十次会议决议公告,finalpage/2012-12-26/61951283.PDF
2012-12-26,中海科技：第四届监事会第十五次会议决议公告,finalpage/2012-12-26/61951284.PDF
2012-12-26,中海科技：关于使用部分超募资金收购参股公司股权的公告,finalpage/2012-12-26/61951285.PDF
2012-12-26,中海科技：日信证券有限责任公司关于公司使用部分超募资金收购参股公司股权的核查意见,finalpage/2012-12-26/61951286.PDF
2012-12-26,中海科技：独立董事关于公司使用部分超募资金收购参股公司股权的独立意见,finalpage/2012-12-26/61951287.PDF
2013-02-05,中海科技：关于控股子公司完成工商变更登记的公告,finalpage/2013-02-05/62107265.PDF
2013-02-28,中海科技：日信证券有限责任公司关于公司《2012年度内部控制自我评价报告》及《内部控制规则落实自查表》的核查意见,finalpage/2013-02-28/62163180.PDF
2013-02-28,中海科技：日信证券有限责任公司关于公司2012年度募集资金存放和使用情况的专项核查报告,finalpage/2013-02-28/62163181.PDF
2013-02-28,中海科技：2012年年度报告摘要,finalpage/2013-02-28/62163182.PDF
2013-02-28,中海科技：2012年年度报告,finalpage/2013-02-28/62163184.PDF
2013-02-28,中海科技：2012年年度审计报告,finalpage/2013-02-28/62163185.PDF
2013-02-28,中海科技：第四届董事会第二十一次会议决议公告,finalpage/2013-02-28/62163186.PDF
2013-02-28,中海科技：第四届监事会第十六次会议决议公告,finalpage/2013-02-28/62163187.PDF
2013-02-28,中海科技：关于公司2012年度控股股东及其他关联方资金占用情况的专项说明,finalpage/2013-02-28/62163188.PDF
2013-02-28,中海科技：2012年度内部控制自我评价报告,finalpage/2013-02-28/62163190.PDF
2013-02-28,中海科技：内部控制鉴证报告,finalpage/2013-02-28/62163191.PDF
2013-02-28,中海科技：2012年度募集资金存放与使用情况的专项报告,finalpage/2013-02-28/62163192.PDF
2013-02-28,中海科技：募集资金存放与使用情况鉴证报告,finalpage/2013-02-28/62163193.PDF
2013-02-28,中海科技：独立董事关于第四届董事会第二十一次会议相关事项的独立意见,finalpage/2013-02-28/62163194.PDF
2013-02-28,中海科技：独立董事2012年度述职报告,finalpage/2013-02-28/62163195.PDF
2013-02-28,中海科技：内部控制规则落实自查表,finalpage/2013-02-28/62163196.PDF
2013-02-28,中海科技：监事会对《公司2012年度内部控制自我评价报告》的审核意见,finalpage/2013-02-28/62163197.PDF
2013-02-28,中海科技：监事会对《公司2012年度报告》及其摘要的审核意见,finalpage/2013-02-28/62163198.PDF
2013-03-05,中海科技：项目中标提示性公告,finalpage/2013-03-05/62184618.PDF
2013-03-05,中海科技：董事会关于重大合同双方履约能力的分析说明,finalpage/2013-03-05/62184619.PDF
2013-03-06,中海科技：关于举行2012年度网上业绩说明会的通知,finalpage/2013-03-06/62184820.PDF
2013-03-19,中海科技：关于取得专利证书和软件著作权的公告,finalpage/2013-03-19/62230644.PDF
2013-03-26,中海科技：关于董事、监事辞职的公告,finalpage/2013-03-26/62269564.PDF
2013-03-28,中海科技：重大项目中标公告,finalpage/2013-03-28/62285367.PDF
2013-04-10,中海科技：募集资金管理办法（2013年4月）,finalpage/2013-04-10/62340412.PDF
2013-04-10,中海科技：独立董事关于第四届董事会第二十二次会议相关事项的独立意见,finalpage/2013-04-10/62340413.PDF
2013-04-10,中海科技：第四届董事会第二十二次会议决议公告,finalpage/2013-04-10/62340414.PDF
2013-04-10,中海科技：日信证券有限责任公司关于公司使用部分超募资金暂时补充流动资金的核查意见,finalpage/2013-04-10/62340415.PDF
2013-04-10,中海科技：关于使用部分超募资金暂时补充流动资金的公告,finalpage/2013-04-10/62340416.PDF
2013-04-10,中海科技：日信证券有限责任公司关于公司2013年预计发生2000万元以内关联交易的核查意见,finalpage/2013-04-10/62340417.PDF
2013-04-10,中海科技：2013年度日常关联交易预计的公告,finalpage/2013-04-10/62340418.PDF
2013-04-10,中海科技：监事会关于使用部分超募资金暂时补充流动资金的意见,finalpage/2013-04-10/62340419.PDF
2013-04-10,中海科技：第四届监事会第十七次会议决议公告,finalpage/2013-04-10/62340420.PDF
2013-04-11,中海科技：2013年第一次临时股东大会的通知,finalpage/2013-04-11/62345370.PDF
2013-04-19,中海科技：2013年第一季度报告正文,finalpage/2013-04-19/62380926.PDF
2013-04-19,中海科技：2013年第一季度报告全文,finalpage/2013-04-19/62380930.PDF
2013-04-19,中海科技：第四届董事会第二十三次会议决议公告,finalpage/2013-04-19/62380931.PDF
2013-04-19,中海科技：内控规范实施计划及工作方案,finalpage/2013-04-19/62380932.PDF
2013-04-19,中海科技：监事会对《公司2013年第一季度报告正文》及《公司2013年第一季度报告全文》的审核意见,finalpage/2013-04-19/62380933.PDF
2013-04-22,中海科技：签订重大合同的公告,finalpage/2013-04-22/62401953.PDF
2013-04-22,中海科技：日信证券有限责任公司关于公司签订日常经营重大合同的核查意见,finalpage/2013-04-22/62401954.PDF
2013-04-26,中海科技：关于限售股份上市流通的提示性公告,finalpage/2013-04-26/62427392.PDF
2013-04-26,中海科技：关于完成工商变更的公告,finalpage/2013-04-26/62427393.PDF
2013-04-26,中海科技：日信证券有限责任公司关于公司限售股上市流通的核查意见,finalpage/2013-04-26/62427394.PDF
2013-04-27,中海科技：2013年第一次临时股东大会决议公告,finalpage/2013-04-27/62435981.PDF
2013-04-27,中海科技：2013年第一次临时股东大会召开的法律意见书,finalpage/2013-04-27/62435982.PDF
2013-05-07,中海科技：关于召开2012年度股东大会的通知,finalpage/2013-05-07/62464434.PDF
2013-05-08,中海科技：关于召开2012年度股东大会的补充通知,finalpage/2013-05-08/62468514.PDF
2013-05-16,中海科技：第四届董事会第二十四次会议决议公告,finalpage/2013-05-16/62494901.PDF
2013-05-16,中海科技：关于处置部分固定资产的公告,finalpage/2013-05-16/62494902.PDF
2013-05-16,中海科技：第四届监事会第十九次会议决议公告,finalpage/2013-05-16/62494903.PDF
2013-05-16,中海科技：独立董事关于处置部分固定资产的独立意见,finalpage/2013-05-16/62494904.PDF
2013-05-17,中海科技：关于2012年度股东大会增加临时提案的补充通知,finalpage/2013-05-17/62498412.PDF
2013-05-17,中海科技：公司章程（2013年5月）,finalpage/2013-05-17/62498413.PDF
2013-05-29,中海科技：2012年度股东大会决议公告,finalpage/2013-05-29/62531482.PDF
2013-05-29,中海科技：2012年度股东大会召开的法律意见书,finalpage/2013-05-29/62531483.PDF
2013-06-18,中海科技：关于控股子公司资本公积转增股本并完成工商变更的公告,finalpage/2013-06-18/62592422.PDF
2013-06-22,中海科技：第四届董事会第二十五次会议决议公告,finalpage/2013-06-22/62603408.PDF
2013-06-22,中海科技：第四届监事会第二十次会议决议公告,finalpage/2013-06-22/62603409.PDF
2013-06-22,中海科技：关于增加2013年度部分日常关联交易预计金额的公告,finalpage/2013-06-22/62603410.PDF
2013-06-22,中海科技：日信证券有限责任公司关于公司重新预计2013年度部分日常关联交易金额的核查意见,finalpage/2013-06-22/62603411.PDF
2013-06-22,中海科技：独立董事关于公司第四届董事会第二十五次会议相关议案的独立意见,finalpage/2013-06-22/62603412.PDF
2013-06-25,中海科技：关于向中海集团财务有限责任公司申请综合授信额度的关联交易公告,finalpage/2013-06-25/62609003.PDF
2013-07-10,中海科技：2013年第二次临时股东大会的通知,finalpage/2013-07-10/62818482.PDF
2013-07-12,中海科技：2012年度权益分派实施公告,finalpage/2013-07-12/62826420.PDF
2013-07-19,中海科技：第四届董事会第二十六次会议决议公告,finalpage/2013-07-19/62850431.PDF
2013-07-19,中海科技：独立董事关于聘任高级管理人员的独立意见,finalpage/2013-07-19/62850432.PDF
2013-07-27,中海科技：2013年第二次临时股东大会决议公告,finalpage/2013-07-27/62874182.PDF
2013-07-27,中海科技：2013年第二次临时股东大会召开的法律意见书,finalpage/2013-07-27/62874183.PDF
2013-07-30,中海科技：签订关联交易合同的公告,finalpage/2013-07-30/62881565.PDF
2013-08-10,中海科技：2013年半年度募集资金存放与使用情况的专项报告,finalpage/2013-08-10/62924748.PDF
2013-08-10,中海科技：2013年半年度报告摘要,finalpage/2013-08-10/62924749.PDF
2013-08-10,中海科技：2013半年度财务报告,finalpage/2013-08-10/62924752.PDF
2013-08-10,中海科技：第四届董事会第二十七次会议决议公告,finalpage/2013-08-10/62924753.PDF
2013-08-10,中海科技：第四届监事会第二十一次会议决议公告,finalpage/2013-08-10/62924754.PDF
2013-08-10,中海科技：2013年半年度报告,finalpage/2013-08-10/62924755.PDF
2013-08-10,中海科技：独立董事关于第四届董事会第二十七次会议相关事项的独立意见,finalpage/2013-08-10/62924756.PDF
2013-08-21,中海科技：关于取得多项管理体系认证证书的公告,finalpage/2013-08-21/62969498.PDF
2013-08-31,中海科技：关于董秘辞职的公告,finalpage/2013-08-31/63028964.PDF
2013-09-06,中海科技：第四届董事会第二十八次会议决议公告,finalpage/2013-09-06/63053360.PDF
2013-09-06,中海科技：独立董事关于聘任高级管理人员的独立意见,finalpage/2013-09-06/63053361.PDF
2013-09-27,中海科技：关于取得专利证书的公告,finalpage/2013-09-27/63118258.PDF
2013-10-11,中海科技：关于变更保荐代表人的公告,finalpage/2013-10-11/63143146.PDF
2013-10-26,中海科技：2013年第三季度报告正文,finalpage/2013-10-26/63196230.PDF
2013-10-26,中海科技：2013年第三季度报告全文,finalpage/2013-10-26/63196234.PDF
2013-11-30,中海科技：关于总经理辞职的公告,finalpage/2013-11-30/63318259.PDF
2013-12-04,中海科技：第四届董事会第三十次会议决议公告,finalpage/2013-12-04/63334153.PDF
2013-12-04,中海科技：独立董事关于第四届董事会第三十次会议相关事项的独立意见,finalpage/2013-12-04/63334154.PDF
2014-02-14,中海科技：关于公司及相关主体承诺履行情况的公告,finalpage/2014-02-14/63568350.PDF
2014-02-20,中海科技：关于归还用于暂时补充流动资金的募集资金的公告,finalpage/2014-02-20/63588171.PDF
2014-02-28,中海科技：2013年年度报告摘要,finalpage/2014-02-28/63616263.PDF
2014-02-28,中海科技：2013年年度审计报告,finalpage/2014-02-28/63616268.PDF
2014-02-28,中海科技：第四届董事会第三十一次会议决议公告,finalpage/2014-02-28/63616270.PDF
2014-02-28,中海科技：第四届监事会第二十三次会议决议公告,finalpage/2014-02-28/63616271.PDF
2014-02-28,中海科技：关于公司2013年度控股股东及其他关联方资金占用情况的专项说明,finalpage/2014-02-28/63616272.PDF
2014-02-28,中海科技：2013年年度报告,finalpage/2014-02-28/63616273.PDF
2014-02-28,中海科技：2013年度内部控制自我评价报告,finalpage/2014-02-28/63616274.PDF
2014-02-28,中海科技：2013年度募集资金存放与使用情况的专项报告,finalpage/2014-02-28/63616275.PDF
2014-02-28,中海科技：募集资金存放与使用情况鉴证报告,finalpage/2014-02-28/63616276.PDF
2014-02-28,中海科技：独立董事关于第四届董事会第三十一次会议相关事项的独立意见,finalpage/2014-02-28/63616277.PDF
2014-02-28,中海科技：独立董事2013年度述职报告,finalpage/2014-02-28/63616278.PDF
2014-02-28,中海科技：内部控制规则落实自查表,finalpage/2014-02-28/63616279.PDF
2014-02-28,中海科技：日信证券有限责任公司关于公司2013年度募集资金存放和使用情况的专项核查报告,finalpage/2014-02-28/63616280.PDF
2014-02-28,中海科技：日信证券有限责任公司关于公司《2013年度内部控制自我评价报告》及《内部控制规则落实自查表》的核查意见,finalpage/2014-02-28/63616281.PDF
2014-02-28,中海科技：监事会对《公司2013年度内部控制自我评价报告》的审核意见,finalpage/2014-02-28/63616282.PDF
2014-02-28,中海科技：监事会对《公司2013年度报告》及其摘要的审核意见,finalpage/2014-02-28/63616283.PDF
2014-03-12,中海科技：关于举行2013年度网上业绩说明会的通知,finalpage/2014-03-12/63662775.PDF
2014-03-27,中海科技：第四届董事会第三十二次会议决议公告,finalpage/2014-03-27/63732175.PDF
2014-03-27,中海科技：第四届监事会第二十四次会议决议公告,finalpage/2014-03-27/63732177.PDF
2014-03-27,中海科技：关于使用部分超募资金暂时补充流动资金的公告,finalpage/2014-03-27/63732178.PDF
2014-03-27,中海科技：2014年度日常关联交易预计的公告,finalpage/2014-03-27/63732179.PDF
2014-03-27,中海科技：关于召开2013年度股东大会的通知,finalpage/2014-03-27/63732180.PDF
2014-03-27,中海科技：职工代表大会决议公告,finalpage/2014-03-27/63732181.PDF
2014-03-27,中海科技：监事会关于使用部分超募资金暂时补充流动资金的意见,finalpage/2014-03-27/63732182.PDF
2014-03-27,中海科技：日信证券有限责任公司关于公司2014年预计发生日常关联交易的核查意见,finalpage/2014-03-27/63732183.PDF
2014-03-27,中海科技：日信证券有限责任公司关于公司使用部分超募资金暂时补充流动资金的核查意见,finalpage/2014-03-27/63732184.PDF
2014-03-27,中海科技：独立董事关于第四届董事会第三十二次会议相关事项的独立意见,finalpage/2014-03-27/63732185.PDF
2014-04-19,中海科技：2013年度股东大会决议公告,finalpage/2014-04-19/63868244.PDF
2014-04-19,中海科技：2013年度股东大会召开的法律意见书,finalpage/2014-04-19/63868248.PDF
2014-04-19,中海科技：第五届董事会第一次会议决议公告,finalpage/2014-04-19/63869847.PDF
2014-04-19,中海科技：第五届监事会第一次会议决议公告,finalpage/2014-04-19/63869848.PDF
2014-04-19,中海科技：独立董事关于聘任高级管理人员的独立意见,finalpage/2014-04-19/63869849.PDF
2014-04-22,中海科技：关于2013年度股东大会决议公告的更正公告,finalpage/2014-04-22/63888969.PDF
2014-04-25,中海科技：2014年第一季度报告正文,finalpage/2014-04-25/63913707.PDF
2014-04-25,中海科技：2014年第一季度报告全文,finalpage/2014-04-25/63913713.PDF
2014-04-29,中海科技：2013年年度权益分派实施公告,finalpage/2014-04-29/63944590.PDF
2014-05-14,中海科技：第五届董事会第三次会议决议公告,finalpage/2014-05-14/64023178.PDF
2014-05-14,中海科技：第五届监事会第三次会议决议公告,finalpage/2014-05-14/64023179.PDF
2014-05-14,中海科技：关于内部组织机构调整的公告,finalpage/2014-05-14/64023180.PDF
2014-05-14,中海科技：关于与上海船舶运输科学研究所签署《委托管理协议》的公告,finalpage/2014-05-14/64023181.PDF
2014-05-14,中海科技：日信证券有限责任公司关于公司与上海船舶运输科学研究所签署《委托管理协议》的核查意见,finalpage/2014-05-14/64023182.PDF
2014-05-14,中海科技：独立董事关于与上海船舶运输科学研究所签署《委托管理协议》的独立意见,finalpage/2014-05-14/64023183.PDF
2014-06-26,中海科技：第五届董事会第四次会议决议公告,finalpage/2014-06-26/1200007245.PDF
2014-06-26,中海科技：第五届监事会第四次会议决议公告,finalpage/2014-06-26/1200007246.PDF
2014-06-26,中海科技：关于向中海集团财务有限责任公司申请综合授信额度的关联交易公告,finalpage/2014-06-26/1200007247.PDF
2014-06-26,中海科技：日信证券有限责任公司关于公司向中海集团财务有限责任公司申请综合授信额度的核查意见,finalpage/2014-06-26/1200007248.PDF
2014-06-26,中海科技：独立董事关于向中海集团财务有限责任公司申请综合授信额度的独立意见,finalpage/2014-06-26/1200007249.PDF
2014-07-09,中海科技：关于完成工商变更的公告,finalpage/2014-07-09/1200041258.PDF
2014-07-11,中海科技：独立董事关于与中海集装箱运输股份有限公司、阿里巴巴（中国）网络技术有限公司签署合作协议的独立意见,finalpage/2014-07-11/1200047832.PDF
2014-07-11,中海科技：第五届董事会第五次会议决议公告,finalpage/2014-07-11/1200047833.PDF
2014-07-11,中海科技：第五届监事会第五次会议决议公告,finalpage/2014-07-11/1200047834.PDF
2014-07-11,中海科技：关于与中海集装箱运输股份有限公司、阿里巴巴（中国）网络技术有限公司签署合作协议的公告,finalpage/2014-07-11/1200047835.PDF
2014-07-11,中海科技：日信证券有限责任公司关于公司与中海集装箱运输股份有限公司、阿里巴巴（中国）网络技术有限公司签署合作协议的独立意见,finalpage/2014-07-11/1200047836.PDF
2014-07-12,中海科技：关于与中海集装箱运输股份有限公司、阿里巴巴（中国）网络技术有限公司签署合作协议的补充公告,finalpage/2014-07-12/1200049502.PDF
2014-07-19,中海科技：第五届董事会第六次会议决议公告,finalpage/2014-07-19/1200064660.PDF
2014-07-19,中海科技：第五届监事会第六次会议决议公告,finalpage/2014-07-19/1200064661.PDF
2014-07-19,中海科技：关于使用超募资金投资设立公司的关联交易公告,finalpage/2014-07-19/1200064662.PDF
2014-07-19,中海科技：日信证券有限责任公司关于公司使用超募资金投资设立公司的关联交易议案的独立意见,finalpage/2014-07-19/1200064663.PDF
2014-07-19,中海科技：独立董事关于使用超募资金投资设立公司的关联交易议案的独立意见,finalpage/2014-07-19/1200064664.PDF
2014-07-31,中海科技：关于参股公司完成工商注册登记的公告,finalpage/2014-07-31/1200089256.PDF
2014-08-08,中海科技：2014年半年度募集资金存放与使用情况的专项报告,finalpage/2014-08-08/1200105361.PDF
2014-08-08,中海科技：2014年半年度报告摘要,finalpage/2014-08-08/1200105362.PDF
2014-08-08,中海科技：财务报告,finalpage/2014-08-08/1200105364.PDF
2014-08-08,中海科技：第五届董事会第七次会议决议公告,finalpage/2014-08-08/1200105365.PDF
2014-08-08,中海科技：第五届监事会第七次会议决议公告,finalpage/2014-08-08/1200105366.PDF
2014-08-08,中海科技：2014年半年度报告,finalpage/2014-08-08/1200105367.PDF
2014-08-08,中海科技：独立董事关于第五届董事会第七次会议相关事项的独立意见,finalpage/2014-08-08/1200105368.PDF
2014-09-03,中海科技：关于重大项目完成交工验收的公告,finalpage/2014-09-03/1200198898.PDF
2014-09-25,中海科技：股票交易异常波动公告,finalpage/2014-09-25/1200258850.PDF
2014-10-24,中海科技：2014年第三季度报告正文,finalpage/2014-10-24/1200324734.PDF
2014-10-24,中海科技：2014年第三季度报告全文,finalpage/2014-10-24/1200324736.PDF
2014-12-09,中海科技：第五届董事会第九次会议决议公告,finalpage/2014-12-09/1200450755.PDF
2014-12-09,中海科技：第五届监事会第九次会议决议公告,finalpage/2014-12-09/1200450756.PDF
2014-12-09,中海科技：关于变更部分募集资金用途用于吸收合并中海信息系统有限公司的公告,finalpage/2014-12-09/1200450757.PDF
2014-12-09,中海科技：关于单个募投项目建设完成并将节余募集资金用于吸收合并中海信息系统有限公司的公告,finalpage/2014-12-09/1200450758.PDF
2014-12-09,中海科技：关于使用募集资金吸收合并中海信息系统有限公司的关联交易公告,finalpage/2014-12-09/1200450759.PDF
2014-12-09,中海科技：关于监事辞职的公告,finalpage/2014-12-09/1200450760.PDF
2014-12-09,中海科技：关于召开2014年第一次临时股东大会的通知,finalpage/2014-12-09/1200450761.PDF
2014-12-09,中海科技：监事会关于使用募集资金相关事项的意见,finalpage/2014-12-09/1200450762.PDF
2014-12-09,中海科技：日信证券有限责任公司关于公司使用募集资金吸收合并中海信息系统有限公司的关联交易的独立意见,finalpage/2014-12-09/1200450763.PDF
2014-12-09,中海科技：日信证券有限责任公司关于公司使用募集资金吸收合并中海信息系统有限公司的独立意见,finalpage/2014-12-09/1200450764.PDF
2014-12-09,中海科技：独立董事关于第五届董事会第九次会议相关事项的独立意见,finalpage/2014-12-09/1200450765.PDF
2014-12-26,中海科技：2014年第一次临时股东大会决议公告,finalpage/2014-12-26/1200495939.PDF
2014-12-26,中海科技：2014年第一次临时股东大会的法律意见书,finalpage/2014-12-26/1200495940.PDF
2015-01-05,中海科技：关于吸收合并中海信息系统有限公司的债权人公告,finalpage/2015-01-05/1200519124.PDF
2015-01-30,中海科技：第五届董事会第十次会议决议公告,finalpage/2015-01-30/1200590081.PDF
2015-01-30,中海科技：关于内部组织架构调整的公告,finalpage/2015-01-30/1200590082.PDF
2015-01-30,中海科技：独立董事关于聘任高级管理人员的独立意见,finalpage/2015-01-30/1200590083.PDF
2015-02-13,中海科技：2014年度业绩快报,finalpage/2015-02-13/1200633180.PDF
2015-03-03,中海科技：关于获得政府补助的公告,finalpage/2015-03-03/1200661621.PDF
2015-03-20,中海科技：2015年度日常关联交易预计的公告,finalpage/2015-03-20/1200718622.PDF
2015-03-20,中海科技：2014年年度报告摘要（已取消）,finalpage/2015-03-20/1200718623.PDF
2015-03-20,中海科技：2014年年度审计报告,finalpage/2015-03-20/1200718625.PDF
2015-03-20,中海科技：第五届董事会第十一次会议决议公告,finalpage/2015-03-20/1200718626.PDF
2015-03-20,中海科技：第五届监事会第十次会议决议公告,finalpage/2015-03-20/1200718627.PDF
2015-03-20,中海科技：关于公司2014年度控股股东及其他关联方资金占用情况的专项说明,finalpage/2015-03-20/1200718628.PDF
2015-03-20,中海科技：2014年年度报告（已取消）,finalpage/2015-03-20/1200718629.PDF
2015-03-20,中海科技：2014年度内部控制自我评价报告,finalpage/2015-03-20/1200718630.PDF
2015-03-20,中海科技：内部控制审计报告,finalpage/2015-03-20/1200718631.PDF
2015-03-20,中海科技：2014年度募集资金存放与使用情况的专项报告,finalpage/2015-03-20/1200718632.PDF
2015-03-20,中海科技：募集资金存放与使用情况鉴证报告,finalpage/2015-03-20/1200718633.PDF
2015-03-20,中海科技：独立董事关于第五届董事会第十一次会议相关事项的独立意见,finalpage/2015-03-20/1200718634.PDF
2015-03-20,中海科技：独立董事2014年度述职报告,finalpage/2015-03-20/1200718635.PDF
2015-03-20,中海科技：公司章程修订对照表,finalpage/2015-03-20/1200718636.PDF
2015-03-20,中海科技：股东大会议事规则修订对照表,finalpage/2015-03-20/1200718637.PDF
2015-03-20,中海科技：内部控制规则落实自查表,finalpage/2015-03-20/1200718638.PDF
2015-03-20,中海科技：监事会对《公司2014年度内部控制自我评价报告》的审核意见,finalpage/2015-03-20/1200718639.PDF
2015-03-20,中海科技：日信证券有限责任公司关于公司2014年度保荐工作报告,finalpage/2015-03-20/1200718640.PDF
2015-03-20,中海科技：日信证券有限责任公司关于公司2014年度内部控制自我评价的核查意见,finalpage/2015-03-20/1200718641.PDF
2015-03-20,中海科技：日信证券有限责任公司关于公司2014年度募集资金存放和使用情况的专项核查报告,finalpage/2015-03-20/1200718642.PDF
2015-03-20,中海科技：日信证券有限责任公司关于公司2015年预计发生日常关联交易的核查意见,finalpage/2015-03-20/1200718643.PDF
2015-03-21,中海科技：关于归还用于暂时补充流动资金的募集资金的公告,finalpage/2015-03-21/1200722596.PDF
2015-03-24,中海科技：2014年年度报告（更新后）,finalpage/2015-03-24/1200735562.PDF
2015-03-24,中海科技：2014年年度报告摘要（更新后）,finalpage/2015-03-24/1200735564.PDF
2015-03-24,中海科技：关于2014年年度报告及相关公告的更正公告,finalpage/2015-03-24/1200735565.PDF
