date,title,url
2015-03-28,中海科技：关于举行2014年度网上业绩说明会的通知,finalpage/2015-03-28/1200752935.PDF
2015-04-15,中海科技：2015年第一季度报告正文,finalpage/2015-04-15/1200831273.PDF
2015-04-15,中海科技：2015年第一季度报告全文,finalpage/2015-04-15/1200831275.PDF
2015-04-15,中海科技：第五届监事会第十一次会议决议公告,finalpage/2015-04-15/1200831276.PDF
2015-04-15,中海科技：第五届董事会第十二次会议决议公告,finalpage/2015-04-15/1200831277.PDF
2015-04-16,中海科技：关于召开2014年度股东大会的通知,finalpage/2015-04-16/1200836504.PDF
2015-04-28,中海科技：项目中标提示性公告,finalpage/2015-04-28/1200920258.PDF
2015-05-09,中海科技：2014年度股东大会的法律意见书,finalpage/2015-05-09/1200986474.PDF
2015-05-09,中海科技：2014年度股东大会决议公告,finalpage/2015-05-09/1200986475.PDF
2015-05-15,中海科技：项目中标公告,finalpage/2015-05-15/1201014970.PDF
2015-05-28,中海科技：关于控股股东减持股份的公告,finalpage/2015-05-28/1201071562.PDF
2015-06-27,中海科技：第五届董事会第十三次会议决议公告,finalpage/2015-06-27/1201201380.PDF
2015-06-27,中海科技：第五届监事会第十二次会议决议公告,finalpage/2015-06-27/1201201381.PDF
2015-06-27,中海科技：关于使用部分超募资金暂时补充流动资金的公告,finalpage/2015-06-27/1201201382.PDF
2015-06-27,中海科技：关于向中海集团财务有限责任公司申请综合授信额度的关联交易公告,finalpage/2015-06-27/1201201383.PDF
2015-06-27,中海科技：关于部分募投项目建设完成后节余募集资金转入超募资金账户的议案,finalpage/2015-06-27/1201201384.PDF
2015-06-27,中海科技：独立董事关于第五届董事会第十三次会议相关事项的独立意见,finalpage/2015-06-27/1201201385.PDF
2015-06-27,中海科技：日信证券有限责任公司关于公司使用部分超募资金暂时补充流动资金的核查意见,finalpage/2015-06-27/1201201386.PDF
2015-06-27,中海科技：日信证券有限责任公司关于公司向中海集团财务有限责任公司申请综合授信额度的核查意见,finalpage/2015-06-27/1201201387.PDF
2015-06-27,中海科技：日信证券有限责任公司关于公司部分募投项目节余募集资金转入超募资金账户的核查意见,finalpage/2015-06-27/1201201388.PDF
2015-06-30,中海科技：2014年度权益分派实施公告,finalpage/2015-06-30/1201212512.PDF
2015-07-09,中海科技：股票交易异常波动公告,finalpage/2015-07-09/1201261597.PDF
2015-07-10,中海科技：控股股东关于维护上市公司股价稳定及董事、监事、高级管理人员不减持公司股份的公告,finalpage/2015-07-10/1201266468.PDF
2015-07-15,中海科技：股票交易异常波动公告,finalpage/2015-07-15/1201293853.PDF
2015-07-24,中海科技：关于选举职工监事的公告,finalpage/2015-07-24/1201338510.PDF
2015-07-29,中海科技：关于控股股东增持公司股份的公告,finalpage/2015-07-29/1201358813.PDF
2015-08-08,中海科技：重大事项停牌公告,finalpage/2015-08-08/1201408160.PDF
2015-08-15,中海科技：关于重大事项继续停牌公告,finalpage/2015-08-15/1201438761.PDF
2015-08-21,中海科技：2015年半年度募集资金存放与使用情况的专项报告,finalpage/2015-08-21/1201467823.PDF
2015-08-21,中海科技：2015年半年度报告摘要,finalpage/2015-08-21/1201467824.PDF
2015-08-21,中海科技：2015年半年度财务报告,finalpage/2015-08-21/1201467826.PDF
2015-08-21,中海科技：第五届董事会第十四次会议决议公告,finalpage/2015-08-21/1201467827.PDF
2015-08-21,中海科技：第五届监事会第十三次会议决议公告,finalpage/2015-08-21/1201467828.PDF
2015-08-21,中海科技：2015年半年度报告,finalpage/2015-08-21/1201467829.PDF
2015-08-21,中海科技：独立董事关于第五届董事会第十四次会议相关事项的独立意见,finalpage/2015-08-21/1201467830.PDF
2015-08-22,中海科技：关于重大事项继续停牌公告,finalpage/2015-08-22/1201472160.PDF
2015-08-29,中海科技：关于重大事项继续停牌公告,finalpage/2015-08-29/1201519148.PDF
2015-09-09,中海科技：关于重大事项继续停牌公告,finalpage/2015-09-09/1201567301.PDF
2015-09-16,中海科技：关于重大事项继续停牌公告,finalpage/2015-09-16/1201597489.PDF
2015-09-23,中海科技：重大事项进展公告,finalpage/2015-09-23/1201623838.PDF
2015-09-30,中海科技：重大事项进展公告,finalpage/2015-09-30/1201654454.PDF
2015-10-14,中海科技：重大事项进展公告,finalpage/2015-10-14/1201688486.PDF
2015-10-16,中海科技：重大事项继续停牌公告,finalpage/2015-10-16/1201699166.PDF
2015-10-16,中海科技：2015年第三季度报告正文,finalpage/2015-10-16/1201699167.PDF
2015-10-16,中海科技：2015年第三季度报告全文,finalpage/2015-10-16/1201699169.PDF
2015-10-23,中海科技：重大事项进展公告,finalpage/2015-10-23/1201715490.PDF
2015-10-30,中海科技：重大事项进展公告,finalpage/2015-10-30/1201739060.PDF
2015-11-03,中海科技：第五届董事会第十六次会议决议公告,finalpage/2015-11-03/1201747924.PDF
2015-11-03,中海科技：独立董事关于聘任高级管理人员的独立意见,finalpage/2015-11-03/1201747925.PDF
2015-11-06,中海科技：重大事项进展公告,finalpage/2015-11-06/1201755137.PDF
2015-11-10,中海科技：继续停牌公告,finalpage/2015-11-10/1201759400.PDF
2015-11-10,中海科技：第五届董事会第十七次会议决议公告,finalpage/2015-11-10/1201759401.PDF
2015-11-17,中海科技：继续停牌进展公告,finalpage/2015-11-17/1201774020.PDF
2015-11-17,中海科技：关于对深圳证券交易所监管关注函回复的公告,finalpage/2015-11-17/1201774021.PDF
2015-11-24,中海科技：继续停牌进展公告,finalpage/2015-11-24/1201785040.PDF
2015-11-28,中海科技：第五届董事会第十八次会议决议公告,finalpage/2015-11-28/1201795301.PDF
2015-11-28,中海科技：第五届监事会第十五次会议决议公告,finalpage/2015-11-28/1201795302.PDF
2015-11-28,中海科技：关于深圳一海通全球供应链管理有限公司增资扩股暨公司放弃优先增资权的关联交易公告,finalpage/2015-11-28/1201795303.PDF
2015-11-28,中海科技：独立董事关于深圳一海通全球供应链管理有限公司增资扩股暨公司放弃优先增资权的关联交易的独立意见,finalpage/2015-11-28/1201795305.PDF
2015-11-28,中海科技：日信证券有限责任公司关于公司放弃向深圳一海通全球供应链管理有限公司行使优先增资权利的关联交易的核查意见,finalpage/2015-11-28/1201795306.PDF
2015-12-01,中海科技：继续停牌进展公告,finalpage/2015-12-01/1201798652.PDF
2015-12-08,中海科技：继续停牌进展公告,finalpage/2015-12-08/1201811787.PDF
2015-12-12,中海科技：终止筹划重大事项暨复牌公告,finalpage/2015-12-12/1201830965.PDF
2015-12-23,中海科技：日信证券有限责任公司关于公司2015年度现场检查报告,finalpage/2015-12-23/1201851806.PDF
2015-12-29,中海科技：关于国有股份无偿划转的提示性公告,finalpage/2015-12-29/1201870586.PDF
2016-01-06,中海科技：股票交易异常波动公告,finalpage/2016-01-06/1201890330.PDF
2016-01-13,中海科技：股票交易异常波动公告,finalpage/2016-01-13/1201907894.PDF
2016-01-13,中海科技：关于控股股东增持计划实施完毕的公告,finalpage/2016-01-13/1201907895.PDF
2016-01-14,中海科技：关于国有股份无偿划转进展的公告,finalpage/2016-01-14/1201910272.PDF
2016-02-17,中海科技：关于国有股份无偿划转完成过户登记的公告,finalpage/2016-02-17/1201982154.PDF
2016-02-26,中海科技：2015年度业绩快报,finalpage/2016-02-26/1201999516.PDF
2016-03-25,中海科技：关于保荐机构更名的公告,finalpage/2016-03-25/1202075811.PDF
2016-03-25,中海科技：2015年年度审计报告,finalpage/2016-03-25/1202075812.PDF
2016-03-25,中海科技：第五届董事会第十九次会议决议公告,finalpage/2016-03-25/1202075813.PDF
2016-03-25,中海科技：第五届监事会第十六次会议决议公告,finalpage/2016-03-25/1202075814.PDF
2016-03-25,中海科技：2015年年度报告,finalpage/2016-03-25/1202075817.PDF
2016-03-25,中海科技：控股股东及其他关联方资金占用情况的专项说明,finalpage/2016-03-25/1202075818.PDF
2016-03-25,中海科技：2015年度募集资金存放与使用情况的专项报告,finalpage/2016-03-25/1202075819.PDF
2016-03-25,中海科技：募集资金年度存放与使用情况鉴证报告,finalpage/2016-03-25/1202075820.PDF
2016-03-25,中海科技：独立董事2015年度述职报告,finalpage/2016-03-25/1202075821.PDF
2016-03-25,中海科技：2015年年度报告摘要,finalpage/2016-03-25/1202075822.PDF
2016-03-25,中海科技：独立董事关于第五届董事会第十九次会议相关事项的独立意见,finalpage/2016-03-25/1202075823.PDF
2016-03-25,中海科技：2015年度内部控制自我评价报告,finalpage/2016-03-25/1202075824.PDF
2016-03-25,中海科技：国融证券股份有限公司关于公司2015年度保荐工作报告,finalpage/2016-03-25/1202075825.PDF
2016-03-25,中海科技：国融证券股份有限公司关于公司2015年度募集资金存放和使用情况的专项核查报告,finalpage/2016-03-25/1202075826.PDF
2016-03-25,中海科技：国融证券股份有限公司关于公司2015年度内部控制自我评价的核查意见,finalpage/2016-03-25/1202075827.PDF
2016-03-25,中海科技：国融证券股份有限公司关于公司2016年预计发生日常关联交易的核查意见,finalpage/2016-03-25/1202075828.PDF
2016-03-25,中海科技：内部控制规则落实自查表,finalpage/2016-03-25/1202075829.PDF
2016-03-25,中海科技：2016年度日常关联交易预计的公告,finalpage/2016-03-25/1202075830.PDF
2016-04-06,中海科技：关于举行2015年度网上业绩说明会的通知,finalpage/2016-04-06/1202138753.PDF
2016-04-20,中海科技：第五届董事会第二十次会议决议公告,finalpage/2016-04-20/1202202383.PDF
2016-04-20,中海科技：2016年第一季度报告正文,finalpage/2016-04-20/1202202384.PDF
2016-04-20,中海科技：2016年第一季度报告全文,finalpage/2016-04-20/1202202386.PDF
2016-04-20,中海科技：第五届监事会第十七次会议决议公告,finalpage/2016-04-20/1202202387.PDF
2016-04-20,中海科技：关于召开2015年度股东大会的通知,finalpage/2016-04-20/1202202388.PDF
2016-05-05,中海科技：关于股东权益变动的提示公告,finalpage/2016-05-05/1202294155.PDF
2016-05-06,中海科技：收购报告书摘要,finalpage/2016-05-06/1202298715.PDF
2016-05-21,中海科技：2015年度股东大会决议公告,finalpage/2016-05-21/1202333124.PDF
2016-05-21,中海科技：2015年度股东大会的法律意见书,finalpage/2016-05-21/1202333125.PDF
2016-05-31,中海科技：关于中国远洋海运集团有限公司申请豁免要约收购义务获得中国证监会核准的公告,finalpage/2016-05-31/1202345979.PDF
2016-05-31,中海科技：收购报告书,finalpage/2016-05-31/1202345980.PDF
2016-05-31,中海科技：五矿证券有限公司关于公司收购报告书之财务顾问报告,finalpage/2016-05-31/1202345981.PDF
2016-05-31,中海科技：北京市通商律师事务所关于《中海网络科技股份有限公司收购报告书》的法律意见书,finalpage/2016-05-31/1202345982.PDF
2016-05-31,中海科技：北京市通商律师事务所关于中国远洋海运集团有限公司申请豁免要约收购之法律意见书,finalpage/2016-05-31/1202345983.PDF
2016-06-30,中海科技：第五届董事会第二十一次会议决议公告,finalpage/2016-06-30/1202437027.PDF
2016-06-30,中海科技：第五届监事会第十八次会议决议公告,finalpage/2016-06-30/1202437028.PDF
2016-06-30,中海科技：关于向中海集团财务有限责任公司申请综合授信额度的关联交易公告,finalpage/2016-06-30/1202437029.PDF
2016-06-30,中海科技：独立董事关于向中海集团财务有限责任公司申请综合授信额度的独立意见,finalpage/2016-06-30/1202437030.PDF
2016-06-30,中海科技：国融证券股份有限公司关于公司申请综合授信额度的关联交易的核查意见,finalpage/2016-06-30/1202437031.PDF
2016-07-02,中海科技：2015年度权益分派实施公告,finalpage/2016-07-02/1202446114.PDF
2016-08-12,中海科技：2016年半年度财务报告,finalpage/2016-08-12/1202558627.PDF
2016-08-12,中海科技：第五届董事会第二十二次会议决议公告,finalpage/2016-08-12/1202558628.PDF
2016-08-12,中海科技：第五届监事会第十九次会议决议公告,finalpage/2016-08-12/1202558629.PDF
2016-08-12,中海科技：独立董事关于第五届董事会第二十二次会议相关事项的独立意见,finalpage/2016-08-12/1202558630.PDF
2016-08-12,中海科技：2016年半年度募集资金存放与使用情况的专项报告,finalpage/2016-08-12/1202558631.PDF
2016-08-12,中海科技：重新预计2016年度日常关联交易的公告,finalpage/2016-08-12/1202558632.PDF
2016-08-12,中海科技：国融证券股份有限公司关于公司重新预计2016年度日常关联交易的核查意见,finalpage/2016-08-12/1202558633.PDF
2016-08-12,中海科技：关于变更保荐代表人的公告,finalpage/2016-08-12/1202558634.PDF
2016-08-12,中海科技：2016年半年度报告,finalpage/2016-08-12/1202558636.PDF
2016-08-12,中海科技：2016年半年度报告摘要,finalpage/2016-08-12/1202558637.PDF
2016-10-25,中海科技：2016年第三季度报告正文,finalpage/2016-10-25/1202780435.PDF
2016-10-25,中海科技：2016年第三季度报告全文,finalpage/2016-10-25/1202780437.PDF
2016-11-09,中海科技：关于公司获得政府补助的公告,finalpage/2016-11-09/1202819723.PDF
2016-12-22,中海科技：国融证券股份有限公司关于公司2016年度现场检查报告,finalpage/2016-12-22/1202922463.PDF
2017-02-27,中海科技：2016年度业绩快报,finalpage/2017-02-27/1203106048.PDF
2017-03-22,中海科技：2016年年度报告摘要,finalpage/2017-03-22/1203183957.PDF
2017-03-22,中海科技：2016年年度审计报告,finalpage/2017-03-22/1203183959.PDF
2017-03-22,中海科技：第五届董事会第二十四次会议决议公告,finalpage/2017-03-22/1203183960.PDF
2017-03-22,中海科技：关于召开2016年度股东大会的通知,finalpage/2017-03-22/1203183961.PDF
2017-03-22,中海科技：第五届监事会第二十一次会议决议公告,finalpage/2017-03-22/1203183962.PDF
2017-03-22,中海科技：控股股东及其他关联方资金占用情况的专项说明,finalpage/2017-03-22/1203183963.PDF
2017-03-22,中海科技：2016年年度报告,finalpage/2017-03-22/1203183964.PDF
2017-03-22,中海科技：2016年度募集资金存放与使用情况的专项报告,finalpage/2017-03-22/1203183965.PDF
2017-03-22,中海科技：募集资金年度存放与使用情况鉴证报告,finalpage/2017-03-22/1203183966.PDF
2017-03-22,中海科技：独立董事2016年度述职报告,finalpage/2017-03-22/1203183967.PDF
2017-03-22,中海科技：独立董事关于第五届董事会第二十四次会议相关事项的独立意见,finalpage/2017-03-22/1203183968.PDF
2017-03-22,中海科技：2016年度内部控制自我评价报告,finalpage/2017-03-22/1203183969.PDF
2017-03-22,中海科技：内部控制审计报告,finalpage/2017-03-22/1203183970.PDF
2017-03-22,中海科技：公司章程修订对照表,finalpage/2017-03-22/1203183971.PDF
2017-03-22,中海科技：国融证券股份有限公司关于公司2016年度保荐工作报告,finalpage/2017-03-22/1203183972.PDF
2017-03-22,中海科技：国融证券股份有限公司关于公司2016年度募集资金存放和使用情况的专项核查报告,finalpage/2017-03-22/1203183973.PDF
2017-03-22,中海科技：国融证券股份有限公司关于公司2016年度内部控制自我评价的核查意见,finalpage/2017-03-22/1203183974.PDF
2017-03-22,中海科技：国融证券股份有限公司关于公司确认2016年度日常关联交易和预计2017年度日常关联交易的核查意见,finalpage/2017-03-22/1203183975.PDF
2017-03-22,中海科技：独立董事关于确认2016年度日常关联交易和预计2017年度日常关联交易事项的事前确认意见,finalpage/2017-03-22/1203183976.PDF
2017-03-22,中海科技：监事会对《公司2016年度内部控制自我评价报告》的审核意见,finalpage/2017-03-22/1203183977.PDF
2017-03-22,中海科技：监事会对《公司2016年度报告》正文及摘要的审核意见,finalpage/2017-03-22/1203183978.PDF
2017-03-22,中海科技：关于拟变更公司全称及证券简称的公告,finalpage/2017-03-22/1203183979.PDF
2017-03-22,中海科技：确认2016年度日常关联交易和预计2017年度日常关联交易的公告,finalpage/2017-03-22/1203183980.PDF
2017-03-23,中海科技：关于举行2016年度网上业绩说明会的通知,finalpage/2017-03-23/1203187208.PDF
2017-03-29,中海科技：关于公司证券事务代表辞职的公告,finalpage/2017-03-29/1203215122.PDF
2017-04-21,中海科技：2017年第一季度报告正文,finalpage/2017-04-21/1203342485.PDF
2017-04-21,中海科技：2017年第一季度报告全文,finalpage/2017-04-21/1203342487.PDF
2017-04-22,中海科技：2016年度股东大会决议公告,finalpage/2017-04-22/1203358840.PDF
2017-04-22,中海科技：2016年度股东大会的法律意见书,finalpage/2017-04-22/1203358841.PDF
2017-05-05,中海科技：关于变更公司全称及证券简称的公告,finalpage/2017-05-05/1203475827.PDF
2017-06-03,中远海科：2016年年度权益分派实施公告,finalpage/2017-06-03/1203587353.PDF
2017-06-28,中远海科：第五届董事会第二十六次会议决议公告,finalpage/2017-06-28/1203650998.PDF
2017-06-28,中远海科：第五届监事会第二十三次会议决议公告,finalpage/2017-06-28/1203650999.PDF
2017-06-28,中远海科：关于向中海集团财务有限责任公司申请综合授信额度的关联交易公告,finalpage/2017-06-28/1203651000.PDF
2017-06-28,中远海科：独立董事关于向中海集团财务有限责任公司申请综合授信额度事项的事前确认意见,finalpage/2017-06-28/1203651001.PDF
2017-06-28,中远海科：独立董事关于向中海集团财务有限责任公司申请综合授信额度的独立意见,finalpage/2017-06-28/1203651002.PDF
2017-06-28,中远海科：国融证券股份有限公司关于公司申请综合授信额度的关联交易的核查意见,finalpage/2017-06-28/1203651003.PDF
2017-07-11,中远海科：项目中标提示性公告,finalpage/2017-07-11/1203692036.PDF
2017-08-09,中远海科：第五届董事会第二十七次会议决议公告,finalpage/2017-08-09/1203777311.PDF
2017-08-09,中远海科：独立董事关于与中国远洋海运集团有限公司签署股权收购意向书的事前确认意见,finalpage/2017-08-09/1203777312.PDF
2017-08-09,中远海科：独立董事关于与中国远洋海运集团有限公司签署股权收购意向书的独立意见,finalpage/2017-08-09/1203777313.PDF
2017-08-09,中远海科：关于签署股权收购意向书的公告,finalpage/2017-08-09/1203777314.PDF
2017-08-12,中远海科：关于收到中标结果通知的公告,finalpage/2017-08-12/1203789672.PDF
2017-08-18,中远海科：2017年半年度报告摘要,finalpage/2017-08-18/1203807499.PDF
2017-08-18,中远海科：2017年半年度财务报告,finalpage/2017-08-18/1203807501.PDF
2017-08-18,中远海科：第五届董事会第二十八次会议决议公告,finalpage/2017-08-18/1203807502.PDF
2017-08-18,中远海科：第五届监事会第二十四次会议决议公告,finalpage/2017-08-18/1203807503.PDF
2017-08-18,中远海科：独立董事关于第五届董事会第二十八次会议相关事项的独立意见,finalpage/2017-08-18/1203807504.PDF
2017-08-18,中远海科：2017年半年度报告,finalpage/2017-08-18/1203807505.PDF
2017-08-18,中远海科：2017年半年度募集资金存放与使用情况的专项报告,finalpage/2017-08-18/1203807506.PDF
2017-10-20,中远海科：2017年第三季度报告正文,finalpage/2017-10-20/1204053833.PDF
2017-10-20,中远海科：2017年第三季度报告全文,finalpage/2017-10-20/1204053835.PDF
2017-10-25,中远海科：股票交易异常波动公告,finalpage/2017-10-25/1204064193.PDF
2017-11-04,中远海科：签订重大合同的公告,finalpage/2017-11-04/1204111668.PDF
2017-11-25,中远海科：第五届董事会第三十次会议决议公告,finalpage/2017-11-25/1204164806.PDF
2017-11-25,中远海科：第五届监事会第二十六次会议决议公告,finalpage/2017-11-25/1204164807.PDF
2017-11-25,中远海科：独立董事关于会计估计变更事项的独立意见,finalpage/2017-11-25/1204164808.PDF
2017-11-25,中远海科：关于会计估计变更的公告,finalpage/2017-11-25/1204164809.PDF
2017-12-14,中远海科：关于董事会换届选举的公告,finalpage/2017-12-14/1204221495.PDF
2017-12-14,中远海科：关于监事会换届选举的公告,finalpage/2017-12-14/1204221496.PDF
2017-12-14,中远海科：国融证券股份有限公司关于公司使用超募资金收购股权暨关联交易的核查意见,finalpage/2017-12-14/1204221497.PDF
2017-12-14,中远海科：国融证券股份有限公司关于公司使用超募资金用于现金收购股权的核查意见,finalpage/2017-12-14/1204221498.PDF
2017-12-14,中远海科：独立董事提名人声明（一）,finalpage/2017-12-14/1204221504.PDF
2017-12-14,中远海科：关于以现金方式收购股权的关联交易公告,finalpage/2017-12-14/1204221506.PDF
2017-12-14,中远海科：关于使用超募资金用于现金收购股权的公告,finalpage/2017-12-14/1204221507.PDF
2017-12-14,中远海科：关于修改《公司章程》和《董事会议事规则》的公告,finalpage/2017-12-14/1204221508.PDF
2017-12-14,中远海科：关于召开2017年第一次临时股东大会的通知,finalpage/2017-12-14/1204221509.PDF
2017-12-14,中远海科：独立董事提名人声明（三）,finalpage/2017-12-14/1204221510.PDF
2017-12-14,中远海科：第五届监事会第二十七次会议决议公告,finalpage/2017-12-14/1204221494.PDF
2017-12-14,中远海科：独立董事关于第五届董事会第三十一次会议相关事项的独立意见,finalpage/2017-12-14/1204221499.PDF
2017-12-14,中远海科：独立董事候选人声明（钱志昂）,finalpage/2017-12-14/1204221500.PDF
2017-12-14,中远海科：独立董事候选人声明（王清华）,finalpage/2017-12-14/1204221501.PDF
2017-12-14,中远海科：独立董事候选人声明（杨珉）,finalpage/2017-12-14/1204221502.PDF
2017-12-14,中远海科：独立董事关于第五届董事会第三十一次会议相关事项的事前确认意见,finalpage/2017-12-14/1204221503.PDF
2017-12-14,中远海科：独立董事提名人声明（二）,finalpage/2017-12-14/1204221505.PDF
2017-12-14,中远海科：第五届董事会第三十一次会议决议公告,finalpage/2017-12-14/1204221511.PDF
2017-12-19,中远海科：关于间接控股股东改制更名及相关工商登记事项变更的公告,finalpage/2017-12-19/1204236070.PDF
2017-12-19,中远海科：国融证券股份有限公司关于限公司2017年度现场检查报告,finalpage/2017-12-19/1204236071.PDF
2017-12-26,中远海科：关联交易进展公告,finalpage/2017-12-26/1204253344.PDF
2017-12-30,中远海科：2017年第一次临时股东大会决议公告,finalpage/2017-12-30/1204290664.PDF
2017-12-30,中远海科：职工代表大会决议公告,finalpage/2017-12-30/1204290665.PDF
2017-12-30,中远海科：2017年第一次临时股东大会的法律意见书,finalpage/2017-12-30/1204290666.PDF
2017-12-30,中远海科：公司章程（2017年12月）,finalpage/2017-12-30/1204290667.PDF
2018-01-31,中远海科：第六届监事会第一次会议决议公告,finalpage/2018-01-31/1204375458.PDF
2018-01-31,中远海科：关于签署《委托管理协议》的关联交易公告,finalpage/2018-01-31/1204375459.PDF
2018-01-31,中远海科：独立董事关于签署《委托管理协议》的事前确认意见,finalpage/2018-01-31/1204375460.PDF
2018-01-31,中远海科：独立董事关于第六届董事会第一次会议相关事项的独立意见,finalpage/2018-01-31/1204375461.PDF
2018-01-31,中远海科：国融证券股份有限公司关于公司签署《委托管理协议》的关联交易的核查意见,finalpage/2018-01-31/1204375462.PDF
2018-01-31,中远海科：第六届董事会第一次会议决议公告,finalpage/2018-01-31/1204375463.PDF
2018-02-13,中远海科：2017年度业绩快报,finalpage/2018-02-13/1204417712.PDF
