date,title,url
2015-10-09,利源精制：独立董事关于公司第三届董事会第五次会议相关内容的独立意见,finalpage/2015-10-09/1201668699.PDF
2015-10-09,利源精制：第三届监事会第四次会议决议公告,finalpage/2015-10-09/1201668700.PDF
2015-10-09,利源精制：第三届董事会第五次会议决议公告,finalpage/2015-10-09/1201668701.PDF
2015-10-19,利源精制：关于公司2015年度非公开发行A股股票申请获得中国证监会发审会审核通过的公告,finalpage/2015-10-19/1201703446.PDF
2015-10-23,利源精制：第三届董事会第六次会议决议公告,finalpage/2015-10-23/1201715422.PDF
2015-10-23,利源精制：2015年第四次临时股东大会通知,finalpage/2015-10-23/1201715423.PDF
2015-10-27,利源精制：2015年第三次临时股东大会决议的公告,finalpage/2015-10-27/1201726106.PDF
2015-10-27,利源精制：2015年第三次临时股东大会的法律意见书,finalpage/2015-10-27/1201726107.PDF
2015-10-31,利源精制：2015年第三季度报告正文,finalpage/2015-10-31/1201743249.PDF
2015-10-31,利源精制：第三届董事会第七次会议决议的公告,finalpage/2015-10-31/1201743251.PDF
2015-10-31,利源精制：2015年第三季度报告全文,finalpage/2015-10-31/1201743252.PDF
2015-10-31,利源精制：第三届监事会第五次会议决议的公告,finalpage/2015-10-31/1201743253.PDF
2015-11-10,利源精制：2015年第四次临时股东大会决议公告,finalpage/2015-11-10/1201759350.PDF
2015-11-10,利源精制：2015年第四次临时股东大会的法律意见书,finalpage/2015-11-10/1201759351.PDF
2015-12-31,利源精制：关于非公开发行股票申请获得中国证监会核准批文的公告,finalpage/2015-12-31/1201877465.PDF
2016-01-06,利源精制：股票交易异常波动公告,finalpage/2016-01-06/1201889960.PDF
2016-01-15,利源精制：股票交易异常波动公告,finalpage/2016-01-15/1201916320.PDF
2016-02-27,利源精制：2015年度业绩快报,finalpage/2016-02-27/1202004313.PDF
2016-03-07,利源精制：中信建投证券股份有限公司关于公司非公开发行股票发行过程和认购对象合规性的报告,finalpage/2016-03-07/1202023511.PDF
2016-03-07,利源精制：北京安杰律师事务所关于公司非公开发行股票发行过程及发行对象合规性之见证法律意见书,finalpage/2016-03-07/1202023512.PDF
2016-03-07,利源精制：中信建投证券股份有限公司关于公司非公开发行股票上市保荐书,finalpage/2016-03-07/1202023513.PDF
2016-03-07,利源精制：非公开发行A股股票新增股份变动报告及上市公告书,finalpage/2016-03-07/1202023514.PDF
2016-03-07,利源精制：非公开发行A股股票新增股份变动报告及上市公告书摘要,finalpage/2016-03-07/1202023515.PDF
2016-03-09,利源精制：截至2016年2月29日止的前次募集资金使用情况报告,finalpage/2016-03-09/1202030728.PDF
2016-03-09,利源精制：关于签订募集资金三方监管协议的公告,finalpage/2016-03-09/1202030729.PDF
2016-03-09,利源精制：独立董事关于非公开发行股票预案的独立意见,finalpage/2016-03-09/1202030730.PDF
2016-03-09,利源精制：关于员工持股计划认购完成的公告,finalpage/2016-03-09/1202030731.PDF
2016-03-09,利源精制：非公开发行股票募集资金运用可行性分析报告,finalpage/2016-03-09/1202030732.PDF
2016-03-09,利源精制：公司章程（2016年3月）,finalpage/2016-03-09/1202030733.PDF
2016-03-09,利源精制：公司章程修正案,finalpage/2016-03-09/1202030734.PDF
2016-03-09,利源精制：公司董事、高级管理人员相关承诺,finalpage/2016-03-09/1202030735.PDF
2016-03-09,利源精制：公司的控股股东、实际控制人相关承诺,finalpage/2016-03-09/1202030736.PDF
2016-03-09,利源精制：非公开发行A股股票预案,finalpage/2016-03-09/1202030737.PDF
2016-03-09,利源精制：2016年第一次临时股东大会通知,finalpage/2016-03-09/1202030738.PDF
2016-03-09,利源精制：第三届董事会第八次会议决议的公告,finalpage/2016-03-09/1202030739.PDF
2016-03-09,利源精制：关于非公开发行股票摊薄即期回报的风险提示及采取填补措施的公告,finalpage/2016-03-09/1202030740.PDF
2016-03-09,利源精制：关于公司前次募集资金使用情况的鉴证报告,finalpage/2016-03-09/1202030741.PDF
2016-03-21,利源精制：第三届董事会第九次会议决议的公告,finalpage/2016-03-21/1202060008.PDF
2016-03-21,利源精制：关于召开2016年第一次临时股东大会的通知的提示性公告,finalpage/2016-03-21/1202060009.PDF
2016-03-21,利源精制：关于取消2016年第一次临时股东大会部分议案暨补充通知的公告,finalpage/2016-03-21/1202060010.PDF
2016-03-23,利源精制：2016年第二次临时股东大会通知,finalpage/2016-03-23/1202067399.PDF
2016-03-23,利源精制：独立董事关于非公开发行股票预案的独立意见,finalpage/2016-03-23/1202067400.PDF
2016-03-23,利源精制：公司董事、高级管理人员相关承诺,finalpage/2016-03-23/1202067401.PDF
2016-03-23,利源精制：公司的控股股东、实际控制人相关承诺,finalpage/2016-03-23/1202067402.PDF
2016-03-23,利源精制：关于非公开发行股票摊薄即期回报的风险提示及采取填补措施的公告（已取消）,finalpage/2016-03-23/1202067403.PDF
2016-03-23,利源精制：非公开发行股票募集资金运用可行性分析报告,finalpage/2016-03-23/1202067404.PDF
2016-03-23,利源精制：第三届董事会第十次会议决议的公告,finalpage/2016-03-23/1202067405.PDF
2016-03-23,利源精制：非公开发行A股股票预案,finalpage/2016-03-23/1202067406.PDF
2016-03-25,利源精制：2016年第一次临时股东大会决议的公告,finalpage/2016-03-25/1202075716.PDF
2016-03-25,利源精制：2016年第一次临时股东大会的法律意见书,finalpage/2016-03-25/1202075717.PDF
2016-03-30,利源精制：关于公司控股股东及其他关联方资金占用情况的专项说明,finalpage/2016-03-30/1202099960.PDF
2016-03-30,利源精制：2015年度内部控制自我评价报告,finalpage/2016-03-30/1202099961.PDF
2016-03-30,利源精制：2015年度独立董事段德炳述职报告,finalpage/2016-03-30/1202099962.PDF
2016-03-30,利源精制：关于公司募集资金存放与实际使用情况的专项报告,finalpage/2016-03-30/1202099963.PDF
2016-03-30,利源精制：关于公司2015年度募集资金存放与使用情况的鉴证报告,finalpage/2016-03-30/1202099964.PDF
2016-03-30,利源精制：2015年年度报告摘要,finalpage/2016-03-30/1202099965.PDF
2016-03-30,利源精制：2015年年度股东大会通知,finalpage/2016-03-30/1202099966.PDF
2016-03-30,利源精制：关于举行2015年年度报告网上说明会的公告,finalpage/2016-03-30/1202099967.PDF
2016-03-30,利源精制：内部控制规则落实自查表,finalpage/2016-03-30/1202099968.PDF
2016-03-30,利源精制：中信建投证券股份有限公司关于公司2015年度募集资金存放与使用情况专项核查报告,finalpage/2016-03-30/1202099969.PDF
2016-03-30,利源精制：第三届董事会第十一次会议决议的公告,finalpage/2016-03-30/1202099970.PDF
2016-03-30,利源精制：第三届监事会第六次会议决议的公告,finalpage/2016-03-30/1202099971.PDF
2016-03-30,利源精制：独立董事关于公司第三届董事会第十一次会议相关议案及其他相关事项的独立意见,finalpage/2016-03-30/1202099972.PDF
2016-03-30,利源精制：关于2015年度拟不进行现金分红的专项说明,finalpage/2016-03-30/1202099973.PDF
2016-03-30,利源精制：2015年年度报告,finalpage/2016-03-30/1202099974.PDF
2016-03-30,利源精制：2015年年度审计报告,finalpage/2016-03-30/1202099975.PDF
2016-04-08,利源精制：2016年第二次临时股东大会的法律意见书,finalpage/2016-04-08/1202149080.PDF
2016-04-08,利源精制：2016年第二次临时股东大会决议的公告,finalpage/2016-04-08/1202149081.PDF
2016-04-21,利源精制：2015年年度股东大会的法律意见书,finalpage/2016-04-21/1202210742.PDF
2016-04-21,利源精制：2015年年度股东大会决议的公告,finalpage/2016-04-21/1202210743.PDF
2016-04-26,利源精制：第三届董事会第十二次会议决议的公告,finalpage/2016-04-26/1202238675.PDF
2016-04-26,利源精制：2016年第一季度报告正文,finalpage/2016-04-26/1202238676.PDF
2016-04-26,利源精制：第三届监事会第七次会议决议的公告,finalpage/2016-04-26/1202238677.PDF
2016-04-26,利源精制：2016年第一季度报告全文,finalpage/2016-04-26/1202238678.PDF
2016-05-27,利源精制：公司债券2016年跟踪评级报告,finalpage/2016-05-27/1202341279.PDF
2016-05-31,利源精制：2014年公司债券受托管理事务报告（2015年度）,finalpage/2016-05-31/1202345590.PDF
2016-06-15,利源精制：关于非公开发行股票摊薄即期回报的风险提示及采取填补措施的公告（更新后）,finalpage/2016-06-15/1202369639.PDF
2016-06-15,利源精制：关于最近五年被证券监管部门和交易所采取监管措施或处罚及整改情况的公告,finalpage/2016-06-15/1202369640.PDF
2016-06-15,利源精制：关于非公开发行股票申请文件反馈意见的回复,finalpage/2016-06-15/1202369641.PDF
2016-06-27,利源精制：关于非公开发行股票申请文件反馈意见的回复,finalpage/2016-06-27/1202414094.PDF
2016-07-19,利源精制：关于非公开发行股票申请文件反馈意见的回复（修订稿）,finalpage/2016-07-19/1202487815.PDF
2016-07-19,利源精制：关于非公开发行股票摊薄即期回报的风险提示及采取填补措施的公告（二次更新稿）,finalpage/2016-07-19/1202487811.PDF
2016-07-19,利源精制：独立董事关于公司非公开发行股票的独立意见,finalpage/2016-07-19/1202487812.PDF
2016-07-19,利源精制：非公开发行股票募集资金运用可行性分析报告（修订稿）,finalpage/2016-07-19/1202487813.PDF
2016-07-19,利源精制：关于非公开发行A股股票预案修订情况说明的公告,finalpage/2016-07-19/1202487814.PDF
2016-07-19,利源精制：第三届董事会第十三次会议决议的公告,finalpage/2016-07-19/1202487809.PDF
2016-07-19,利源精制：非公开发行A股股票预案（修订稿）,finalpage/2016-07-19/1202487810.PDF
2016-07-29,利源精制：2016年半年度业绩快报,finalpage/2016-07-29/1202516904.PDF
2016-07-29,利源精制：关于定期报告预约披露时间变更的公告,finalpage/2016-07-29/1202513780.PDF
2016-08-18,利源精制：关于公司非公开发行A股股票申请获得中国证监会发审会审核通过的公告,finalpage/2016-08-18/1202575275.PDF
2016-08-29,利源精制：2016年半年度报告摘要,finalpage/2016-08-29/1202629896.PDF
2016-08-29,利源精制：2016年半年度报告,finalpage/2016-08-29/1202629897.PDF
2016-08-29,利源精制：2016年半年度财务报告,finalpage/2016-08-29/1202629898.PDF
2016-08-29,利源精制：第三届董事会第十四次会议决议公告,finalpage/2016-08-29/1202629899.PDF
2016-08-29,利源精制：第三届监事会第八次会议决议的公告,finalpage/2016-08-29/1202629900.PDF
2016-08-29,利源精制：独立董事关于公司第三届董事会第十四次会议相关内容的独立意见,finalpage/2016-08-29/1202629901.PDF
2016-08-29,利源精制：关于公司募集资金存放与实际使用情况的专项报告,finalpage/2016-08-29/1202629902.PDF
2016-09-19,利源精制：“14利源债”2016年付息公告,finalpage/2016-09-19/1202704357.PDF
2016-10-21,利源精制：第三届董事会第十五次会议决议的公告,finalpage/2016-10-21/1202772415.PDF
2016-10-21,利源精制：第三届监事会第九次会议决议的公告,finalpage/2016-10-21/1202772416.PDF
2016-10-21,利源精制：2016年第三季度报告正文,finalpage/2016-10-21/1202772417.PDF
2016-10-21,利源精制：2016年第三季度报告全文,finalpage/2016-10-21/1202772418.PDF
2016-11-15,利源精制：关于限售股份上市流通的公告,finalpage/2016-11-15/1202827869.PDF
2016-12-08,利源精制：关于非公开发行股票申请获得中国证监会核准批文的公告,finalpage/2016-12-08/1202863399.PDF
2017-01-20,利源精制：关于非公开发行股票相关承诺事项的公告,finalpage/2017-01-20/1203031907.PDF
2017-01-20,利源精制：中信建投证券股份有限公司关于公司非公开发行股票上市保荐书,finalpage/2017-01-20/1203031908.PDF
2017-01-20,利源精制：中信建投证券股份有限公司关于公司非公开发行股票发行过程和认购对象合规性的报告,finalpage/2017-01-20/1203031909.PDF
2017-01-20,利源精制：北京安杰律师事务所关于公司非公开发行股票发行过程和认购对象合规性的法律意见书,finalpage/2017-01-20/1203031910.PDF
2017-01-20,利源精制：简式权益变动报告书,finalpage/2017-01-20/1203031911.PDF
2017-01-20,利源精制：非公开发行股票新增股份变动报告及上市公告书,finalpage/2017-01-20/1203031912.PDF
2017-01-20,利源精制：非公开发行股票新增股份变动报告及上市公告书摘要,finalpage/2017-01-20/1203031913.PDF
2017-01-24,利源精制：第三届董事会第十六次会议决议的公告,finalpage/2017-01-24/1203042439.PDF
2017-01-24,利源精制：关于签订募集资金三方监管协议的公告,finalpage/2017-01-24/1203042440.PDF
2017-02-28,利源精制：2016年度业绩快报,finalpage/2017-02-28/1203112369.PDF
2017-04-20,利源精制：2016年年度审计报告,finalpage/2017-04-20/1203332019.PDF
2017-04-20,利源精制：关于公司控股股东及其他关联方资金占用情况的专项说明,finalpage/2017-04-20/1203332020.PDF
2017-04-20,利源精制：2016年度独立董事段德炳述职报告,finalpage/2017-04-20/1203332021.PDF
2017-04-20,利源精制：关于会计政策变更的公告,finalpage/2017-04-20/1203332022.PDF
2017-04-20,利源精制：关于举行2016年业绩说明会的公告,finalpage/2017-04-20/1203332023.PDF
2017-04-20,利源精制：内部控制规则落实自查表,finalpage/2017-04-20/1203332024.PDF
2017-04-20,利源精制：公司章程修正案,finalpage/2017-04-20/1203332025.PDF
2017-04-20,利源精制：公司章程（2017年4月）,finalpage/2017-04-20/1203332026.PDF
2017-04-20,利源精制：2016年年度报告摘要,finalpage/2017-04-20/1203332027.PDF
2017-04-20,利源精制：第三届监事会第十次会议决议的公告,finalpage/2017-04-20/1203332028.PDF
2017-04-20,利源精制：关于2016年度现金分红的专项说明,finalpage/2017-04-20/1203332029.PDF
2017-04-20,利源精制：中信建投证券股份有限公司关于公司《内部控制规则落实自查表》的核查意见,finalpage/2017-04-20/1203332030.PDF
2017-04-20,利源精制：中信建投证券股份有限公司关于公司2016年度保荐工作报告,finalpage/2017-04-20/1203332031.PDF
2017-04-20,利源精制：中信建投证券股份有限公司关于公司2016年度持续督导培训情况报告书,finalpage/2017-04-20/1203332032.PDF
2017-04-20,利源精制：中信建投证券股份有限公司关于公司2016年度定期现场检查报告,finalpage/2017-04-20/1203332033.PDF
2017-04-20,利源精制：中信建投证券股份有限公司关于公司2016年度内部控制自我评价报告的核查意见,finalpage/2017-04-20/1203332034.PDF
2017-04-20,利源精制：中信建投证券股份有限公司关于公司将首次公开发行股票募集资金投资项目结项并将节余募集资金永久性补充流动资金的核查意见,finalpage/2017-04-20/1203332035.PDF
2017-04-20,利源精制：中信建投证券股份有限公司关于公司将首次公开发行股票募集资金投资项目结项并将节余募集资金永久性补充流动资金的核查意见,finalpage/2017-04-20/1203332036.PDF
2017-04-20,利源精制：关于使用结余募集资金永久补充流动资金的公告,finalpage/2017-04-20/1203332037.PDF
2017-04-20,利源精制：第三届董事会第十七次会议决议的公告,finalpage/2017-04-20/1203332038.PDF
2017-04-20,利源精制：内部控制自我评价报告,finalpage/2017-04-20/1203332039.PDF
2017-04-20,利源精制：关于公司内部控制鉴证报告,finalpage/2017-04-20/1203332040.PDF
2017-04-20,利源精制：独立董事关于公司第三届董事会第十七次会议相关议案及其他相关事项的独立意见,finalpage/2017-04-20/1203332041.PDF
2017-04-20,利源精制：关于公司募集资金存放与实际使用情况的专项报告,finalpage/2017-04-20/1203332042.PDF
2017-04-20,利源精制：关于公司2016年度募集资金存放与使用情况的鉴证报告,finalpage/2017-04-20/1203332043.PDF
2017-04-20,利源精制：2016年年度报告,finalpage/2017-04-20/1203332044.PDF
2017-04-20,利源精制：中信建投证券股份有限公司关于公司2016年度募集资金存放与使用情况专项核查报告,finalpage/2017-04-20/1203332602.PDF
2017-04-24,利源精制：第三届董事会第十八次会议决议的公告,finalpage/2017-04-24/1203357937.PDF
2017-04-24,利源精制：2017年第一季度报告正文,finalpage/2017-04-24/1203357938.PDF
2017-04-24,利源精制：2017年第一季度报告全文,finalpage/2017-04-24/1203357939.PDF
2017-04-24,利源精制：第三届监事会第十一次会议决议的公告,finalpage/2017-04-24/1203357940.PDF
2017-05-27,利源精制：独立董事关于公司用募集资金置换预先投入募投项目自筹资金的独立意见,finalpage/2017-05-27/1203571154.PDF
2017-05-27,利源精制：第三届监事会第十二次会议决议,finalpage/2017-05-27/1203571155.PDF
2017-05-27,利源精制：第三届董事会第十九次会议决议,finalpage/2017-05-27/1203571156.PDF
2017-05-27,利源精制：中信建投证券股份有限公司关于公司以募集资金置换预先投入募投项目自筹资金的核查意见,finalpage/2017-05-27/1203571157.PDF
2017-05-27,利源精制：关于用募集资金置换预先投入募投项目自筹资金的公告,finalpage/2017-05-27/1203571158.PDF
2017-05-27,利源精制：关于公司以自筹资金预先投入募投项目的鉴证报告,finalpage/2017-05-27/1203571159.PDF
2017-05-27,利源精制：2016年年度股东大会通知,finalpage/2017-05-27/1203571160.PDF
2017-06-16,利源精制：公司债券2017年跟踪评级报告,finalpage/2017-06-16/1203618287.PDF
2017-06-17,利源精制：2016年年度股东大会的法律意见书,finalpage/2017-06-17/1203624883.PDF
2017-06-17,利源精制：2016年年度股东大会决议的公告,finalpage/2017-06-17/1203624884.PDF
2017-06-20,利源精制：董事、副总经理辞职公告,finalpage/2017-06-20/1203629901.PDF
2017-06-20,利源精制：第三届董事会第二十次会议决议,finalpage/2017-06-20/1203629902.PDF
2017-06-20,利源精制：2017年第一次临时股东大会通知,finalpage/2017-06-20/1203629903.PDF
2017-06-28,利源精制：2014年公司债券受托管理事务报告（2016年度）,finalpage/2017-06-28/1203651193.PDF
2017-07-06,利源精制：2017年第一次临时股东大会的法律意见书,finalpage/2017-07-06/1203683924.PDF
2017-07-06,利源精制：2017年第一次临时股东大会决议的公告,finalpage/2017-07-06/1203683925.PDF
2017-07-27,利源精制：2017年半年度业绩快报,finalpage/2017-07-27/1203735618.PDF
2017-08-04,利源精制：第三届董事会第二十一次会议决议的公告,finalpage/2017-08-04/1203759272.PDF
2017-08-04,利源精制：第三届监事会第十三次会议决议的公告,finalpage/2017-08-04/1203759273.PDF
2017-08-04,利源精制：独立董事关于公司第三届董事会第二十一次会议相关议案的独立意见,finalpage/2017-08-04/1203759274.PDF
2017-08-04,利源精制：关于董事辞职及提名董事候选人的公告,finalpage/2017-08-04/1203759275.PDF
2017-08-04,利源精制：关于独立董事辞职及提名独立董事候选人的公告,finalpage/2017-08-04/1203759276.PDF
2017-08-04,利源精制：关于监事辞职及提名监事候选人的公告,finalpage/2017-08-04/1203759277.PDF
2017-08-04,利源精制：2017年第二次临时股东大会通知,finalpage/2017-08-04/1203759278.PDF
2017-08-05,利源精制：关于2017年第二次临时股东大会通知更正的公告,finalpage/2017-08-05/1203765279.PDF
2017-08-05,利源精制：关于延期披露定期报告的公告,finalpage/2017-08-05/1203766085.PDF
2017-08-10,利源精制：2016年年度权益分派实施公告,finalpage/2017-08-10/1203778964.PDF
2017-08-11,利源精制：关于2017年第二次临时股东大会通知更正的公告,finalpage/2017-08-11/1203784820.PDF
2017-08-11,利源精制：关于“14利源债”公司债券利率上调、债券回售的第一次提示性公告,finalpage/2017-08-11/1203785459.PDF
2017-08-14,利源精制：关于“14利源债”公司债券回售的第二次提示性公告,finalpage/2017-08-14/1203789952.PDF
2017-08-15,利源精制：关于“14利源债”公司债券回售的第三次提示性公告,finalpage/2017-08-15/1203796799.PDF
2017-08-15,利源精制：第三届董事会第二十二次会议决议公告,finalpage/2017-08-15/1203796987.PDF
2017-08-15,利源精制：第三届监事会第十四次会议决议的公告,finalpage/2017-08-15/1203796988.PDF
2017-08-15,利源精制：独立董事关于公司第三届董事会第二十二次会议相关内容的独立意见,finalpage/2017-08-15/1203796989.PDF
2017-08-15,利源精制：关于公司募集资金存放与实际使用情况的专项报告,finalpage/2017-08-15/1203796990.PDF
2017-08-15,利源精制：2017年半年度报告摘要,finalpage/2017-08-15/1203796991.PDF
2017-08-15,利源精制：2017年半年度报告（已取消）,finalpage/2017-08-15/1203796992.PDF
2017-08-15,利源精制：2017年半年度财务报告（已取消）,finalpage/2017-08-15/1203796993.PDF
2017-08-16,利源精制：关于定期报告更正的公告,finalpage/2017-08-16/1203802489.PDF
2017-08-16,利源精制：2017年半年度报告（更新后）,finalpage/2017-08-16/1203802491.PDF
2017-08-16,利源精制：2017年半年度财务报告（更新后）,finalpage/2017-08-16/1203802494.PDF
2017-08-17,利源精制：关于“14利源债”公司债券回售申报情况的公告,finalpage/2017-08-17/1203806180.PDF
2017-08-22,利源精制：2017年第二次临时股东大会决议的公告,finalpage/2017-08-22/1203834445.PDF
2017-08-22,利源精制：2017年第二次临时股东大会的法律意见书,finalpage/2017-08-22/1203834446.PDF
2017-09-05,利源精制：关于聘任公司财务总监兼董事会秘书的公告,finalpage/2017-09-05/1203930707.PDF
2017-09-05,利源精制：第三届董事会第二十三次会议决议公告,finalpage/2017-09-05/1203930708.PDF
2017-09-05,利源精制：独立董事关于公司第三届第二十三次董事会相关议案的独立意见,finalpage/2017-09-05/1203930709.PDF
2017-09-13,利源精制：关于第三届董事会第二十四次会议决议相关议案及内容的更正公告,finalpage/2017-09-13/1203971347.PDF
2017-09-13,利源精制：第三届董事会第二十四次会议决议,finalpage/2017-09-13/1203967887.PDF
2017-09-13,利源精制：关于为公司全资子公司提供担保的公告,finalpage/2017-09-13/1203967888.PDF
2017-09-13,利源精制：关于对公司全资子公司增资的公告,finalpage/2017-09-13/1203967889.PDF
2017-09-13,利源精制：关于提请股东大会审批对全资子公司担保的公告,finalpage/2017-09-13/1203967890.PDF
2017-09-13,利源精制：2017年第三次临时股东大会通知,finalpage/2017-09-13/1203967891.PDF
2017-09-14,利源精制：关于召开2017年第三次临时股东大会的提示性公告,finalpage/2017-09-14/1203972360.PDF
2017-09-18,利源精制：“14利源债”2017年付息公告,finalpage/2017-09-18/1203978934.PDF
2017-09-22,利源精制：关于“14利源债”公司债券回售结果的公告,finalpage/2017-09-22/1203994390.PDF
2017-09-29,利源精制：2017年第三次临时股东大会决议的公告,finalpage/2017-09-29/1204011629.PDF
2017-09-29,利源精制：2017年第三次临时股东大会的法律意见书,finalpage/2017-09-29/1204011630.PDF
2017-10-24,利源精制：关于全资子公司完成注册资本工商变更登记的公告,finalpage/2017-10-24/1204059952.PDF
2017-10-30,利源精制：关于第三届董事会第二十五次会议决议的公告,finalpage/2017-10-30/1204088007.PDF
2017-10-30,利源精制：第三届监事会第十五次会议决议的公告,finalpage/2017-10-30/1204088008.PDF
2017-10-30,利源精制：三季报财务报表,finalpage/2017-10-30/1204088009.PDF
2017-10-30,利源精制：2017年第三季度报告正文,finalpage/2017-10-30/1204088011.PDF
2017-10-30,利源精制：2017年第三季度报告全文,finalpage/2017-10-30/1204088012.PDF
2017-11-30,利源精制：第三届董事会第二十六次会议决议公告,finalpage/2017-11-30/1204175811.PDF
2017-11-30,利源精制：关于公司申请银行借款的公告,finalpage/2017-11-30/1204175812.PDF
2017-12-05,利源精制：关于募集资金投资项目“轨道车辆制造及铝型材深加工建设项目”实施进展公告,finalpage/2017-12-05/1204191447.PDF
2018-01-02,利源精制：长城国融投资管理有限公司关于增持公司股份的简式权益变动报告书（已取消）,finalpage/2018-01-02/1204295853.PDF
2018-01-02,利源精制：关于简式权益报告书的提示性公告,finalpage/2018-01-02/1204295854.PDF
2018-01-03,利源精制：关于《长城国融投资管理有限公司简式权益变动报告书》的补充公告,finalpage/2018-01-03/1204298298.PDF
