date,title,url
2013-05-24,利源铝业：华林证券有限责任公司关于公司非公开发行股票发行合规性的说明,finalpage/2013-05-24/62518332.PDF
2013-05-24,利源铝业：非公开发行股票发行情况报告暨上市公告书,finalpage/2013-05-24/62518333.PDF
2013-05-24,利源铝业：非公开发行股票发行情况报告暨上市公告书摘要,finalpage/2013-05-24/62518334.PDF
2013-05-24,利源铝业：华林证券有限责任公司关于公司非公开发行股票上市保荐书,finalpage/2013-05-24/62518335.PDF
2013-05-25,利源铝业：关于召开2013年第二次临时股东大会的通知,finalpage/2013-05-25/62522168.PDF
2013-05-25,利源铝业：公司章程（2013年5月）,finalpage/2013-05-25/62522169.PDF
2013-05-25,利源铝业：公司章程修正案,finalpage/2013-05-25/62522170.PDF
2013-05-25,利源铝业：第二届董事会第十三次会议决议,finalpage/2013-05-25/62522171.PDF
2013-06-14,利源铝业：2013年第二次临时股东大会决议公告,finalpage/2013-06-14/62578120.PDF
2013-06-14,利源铝业：2013年第二次临时股东大会的法律意见书,finalpage/2013-06-14/62578121.PDF
2013-06-20,利源铝业：第二届董事会第十四次会议决议,finalpage/2013-06-20/62595865.PDF
2013-06-22,利源铝业：关于公司以自筹资金预先投入募投项目的鉴证报告,finalpage/2013-06-22/62602525.PDF
2013-06-22,利源铝业：华林证券有限责任公司关于公司使用募集资金置换预先投入募投项目自筹资金的核查意见,finalpage/2013-06-22/62602526.PDF
2013-06-22,利源铝业：关于举办《维护“三公”原则保护投资者合法权益责任书》签字仪式暨2012年年度业绩网上集体说明的公告,finalpage/2013-06-22/62602527.PDF
2013-06-22,利源铝业：关于非公开发行保荐代表人的公告,finalpage/2013-06-22/62602528.PDF
2013-06-22,利源铝业：独立董事关于公司用募集资金置换预先投入募投项目自筹资金的独立意见,finalpage/2013-06-22/62602529.PDF
2013-06-22,利源铝业：关于完成工商变更登记的公告,finalpage/2013-06-22/62602530.PDF
2013-06-22,利源铝业：关于签订募集资金三方监管协议的公告,finalpage/2013-06-22/62602531.PDF
2013-06-22,利源铝业：第二届监事会第八次会议决议,finalpage/2013-06-22/62602532.PDF
2013-06-22,利源铝业：第二届董事会第十五次会议决议,finalpage/2013-06-22/62602533.PDF
2013-06-22,利源铝业：关于用募集资金置换预先投入募投项目自筹资金的公告,finalpage/2013-06-22/62602534.PDF
2013-07-31,利源铝业：2013年半年度业绩快报,finalpage/2013-07-31/62885139.PDF
2013-08-02,利源铝业：关于召开2013年第三次临时股东大会的通知,finalpage/2013-08-02/62894165.PDF
2013-08-02,利源铝业：第二届董事会第十六次会议决议的公告,finalpage/2013-08-02/62894166.PDF
2013-08-02,利源铝业：公司章程修正案,finalpage/2013-08-02/62894167.PDF
2013-08-02,利源铝业：公司章程（2013年8月）,finalpage/2013-08-02/62894168.PDF
2013-08-13,利源铝业：2013年半年度报告摘要,finalpage/2013-08-13/62931693.PDF
2013-08-13,利源铝业：2013年半年度报告,finalpage/2013-08-13/62931695.PDF
2013-08-13,利源铝业：2013半年度财务报告,finalpage/2013-08-13/62931696.PDF
2013-08-13,利源铝业：第二届董事会第十七次会议决议公告,finalpage/2013-08-13/62931697.PDF
2013-08-13,利源铝业：第二届监事会第九次会议决议公告,finalpage/2013-08-13/62931698.PDF
2013-08-13,利源铝业：独立董事关于控股股东及其他关联方占用公司资金、公司对外担保情况的专项说明和独立意见,finalpage/2013-08-13/62931699.PDF
2013-08-13,利源铝业：2013年半年度募集资金存放与实际使用情况的专项报告,finalpage/2013-08-13/62931700.PDF
2013-08-20,利源铝业：2013年第三次临时股东大会决议公告,finalpage/2013-08-20/62963260.PDF
2013-08-20,利源铝业：2013年第三次临时股东大会的法律意见书,finalpage/2013-08-20/62963262.PDF
2013-09-13,利源铝业：关于完成工商变更登记的公告,finalpage/2013-09-13/63077361.PDF
2013-09-13,利源铝业：关于通过高新技术企业复审的公告,finalpage/2013-09-13/63077362.PDF
2013-10-15,利源铝业：关于更换持续督导保荐代表人的公告,finalpage/2013-10-15/63154151.PDF
2013-10-22,利源铝业：关于召开2013年第四次临时股东大会的通知,finalpage/2013-10-22/63176933.PDF
2013-10-22,利源铝业：2013年第三季度报告正文,finalpage/2013-10-22/63176934.PDF
2013-10-22,利源铝业：2013年第三季度报告全文,finalpage/2013-10-22/63176935.PDF
2013-10-22,利源铝业：第二届董事会第十八次会议决议公告,finalpage/2013-10-22/63176937.PDF
2013-10-22,利源铝业：第二届监事会第十次会议决议公告,finalpage/2013-10-22/63176938.PDF
2013-10-22,利源铝业：公司章程修正案,finalpage/2013-10-22/63176939.PDF
2013-10-22,利源铝业：公司章程（2013年10月）,finalpage/2013-10-22/63176941.PDF
2013-11-07,利源铝业：2013年第四次临时股东大会决议公告,finalpage/2013-11-07/63244351.PDF
2013-11-07,利源铝业：2013年第四次临时股东大会的法律意见书,finalpage/2013-11-07/63244352.PDF
2013-11-14,利源铝业：关于控股股东及实际控制人追加股份锁定承诺的公告,finalpage/2013-11-14/63265517.PDF
2013-11-19,利源铝业：关于完成股份锁定登记的公告,finalpage/2013-11-19/63280016.PDF
2013-11-20,利源铝业：关于完成工商变更登记、变更公司全称和证券简称的公告,finalpage/2013-11-20/63283211.PDF
2013-12-25,利源精制：第二届董事会第十九次会议决议的公告,finalpage/2013-12-25/63410160.PDF
2014-02-14,利源精制：关于相关承诺履行情况的公告,finalpage/2014-02-14/63568388.PDF
2014-02-27,利源精制：关于发行公司债券申请获得中国证券监督管理委员会发行审核委员会审核通过的公告,finalpage/2014-02-27/63609878.PDF
2014-02-28,利源精制：华林证券有限责任公司关于公司内部控制规则落实自查表的核查意见,finalpage/2014-02-28/63616199.PDF
2014-02-28,利源精制：华林证券有限责任公司关于公司2013年度内部控制自我评价报告的核查意见,finalpage/2014-02-28/63616201.PDF
2014-02-28,利源精制：华林证券有限责任公司关于公司2013年度募集资金存放与使用情况专项核查报告,finalpage/2014-02-28/63616204.PDF
2014-02-28,利源精制：2013年年度报告摘要,finalpage/2014-02-28/63616209.PDF
2014-02-28,利源精制：2013年年度报告,finalpage/2014-02-28/63616225.PDF
2014-02-28,利源精制：2013年度年度审计报告,finalpage/2014-02-28/63616231.PDF
2014-02-28,利源精制：第二届董事会第二十次会议决议的公告,finalpage/2014-02-28/63616232.PDF
2014-02-28,利源精制：关于召开2013年年度股东大会的通知,finalpage/2014-02-28/63616233.PDF
2014-02-28,利源精制：第二届监事会第十一次会议决议的公告,finalpage/2014-02-28/63616234.PDF
2014-02-28,利源精制：关于对公司控股股东及其他关联方占用资金情况的专项审计说明,finalpage/2014-02-28/63616235.PDF
2014-02-28,利源精制：2013年度内部控制自我评价报告,finalpage/2014-02-28/63616237.PDF
2014-02-28,利源精制：关于公司募集资金存放与实际使用情况的专项报告,finalpage/2014-02-28/63616238.PDF
2014-02-28,利源精制：募集资金年度存放与使用情况鉴证报告,finalpage/2014-02-28/63616239.PDF
2014-02-28,利源精制：独立董事关于公司第二届董事会第二十次会议相关议案及其他相关事项的独立意见,finalpage/2014-02-28/63616240.PDF
2014-02-28,利源精制：2013年度独立董事段德炳述职报告等,finalpage/2014-02-28/63616241.PDF
2014-02-28,利源精制：关于举行2013年年度报告网上说明会的公告,finalpage/2014-02-28/63616242.PDF
2014-02-28,利源精制：内部控制规则落实自查表,finalpage/2014-02-28/63616243.PDF
2014-03-21,利源精制：2013年年度股东大会决议的公告,finalpage/2014-03-21/63702936.PDF
2014-03-21,利源精制：2013年年度股东大会的法律意见书,finalpage/2014-03-21/63702937.PDF
2014-04-01,利源精制：董事、副总经理辞职公告,finalpage/2014-04-01/63763213.PDF
2014-04-09,利源精制：2014年一季度业绩预告,finalpage/2014-04-09/63806189.PDF
2014-04-15,利源精制：关于公开发行公司债券申请获得证监会核准批复的公告,finalpage/2014-04-15/63837733.PDF
2014-04-19,利源精制：2014年第一季度报告正文,finalpage/2014-04-19/63867581.PDF
2014-04-19,利源精制：2014年第一季度报告全文,finalpage/2014-04-19/63867582.PDF
2014-04-19,利源精制：第二届监事会第十二次会议决议的公告,finalpage/2014-04-19/63867583.PDF
2014-04-19,利源精制：第二届董事会第二十一次会议决议的公告,finalpage/2014-04-19/63867584.PDF
2014-04-23,利源精制：华林证券有限责任公司关于公司2013年年度保荐工作报告,finalpage/2014-04-23/63893537.PDF
2014-05-13,利源精制：2013年年度权益分派实施公告,finalpage/2014-05-13/64017090.PDF
2014-05-23,利源精制：华林证券有限责任公司关于公司非公开发行限售股份上市流通的核查意见,finalpage/2014-05-23/64055596.PDF
2014-05-23,利源精制：非公开发行限售股份上市流通提示性公告,finalpage/2014-05-23/64055597.PDF
2014-06-11,利源精制：关于公司被批准为二级保密资格单位的公告,finalpage/2014-06-11/64123747.PDF
2014-06-11,利源精制：关于公司被批准为二级保密资格单位的补充公告,finalpage/2014-06-11/64124600.PDF
2014-06-13,利源精制：董事、副总经理辞职公告,finalpage/2014-06-13/64132055.PDF
2014-07-02,利源精制：华林证券有限责任公司关于公司2014年度上半年定期现场检查报告,finalpage/2014-07-02/1200023540.PDF
2014-07-31,利源精制：2014年半年度报告摘要,finalpage/2014-07-31/1200089238.PDF
2014-07-31,利源精制：2014年半年度财务报告,finalpage/2014-07-31/1200089240.PDF
2014-07-31,利源精制：第二届董事会第二十二次会议决议公告,finalpage/2014-07-31/1200089241.PDF
2014-07-31,利源精制：第二届监事会第十三次会议决议公告,finalpage/2014-07-31/1200089242.PDF
2014-07-31,利源精制：2014年半年度报告,finalpage/2014-07-31/1200089243.PDF
2014-07-31,利源精制：独立董事关于控股股东及其他关联方占用公司资金、公司对外担保情况的专项说明和独立意见,finalpage/2014-07-31/1200089244.PDF
2014-07-31,利源精制：关于规范公司控股股东及实际控制人行为的专项工作方案,finalpage/2014-07-31/1200089245.PDF
2014-07-31,利源精制：关于保护中小投资者权益工作方案,finalpage/2014-07-31/1200089246.PDF
2014-07-31,利源精制：关于公司募集资金存放与实际使用情况的专项报告,finalpage/2014-07-31/1200089247.PDF
2014-07-31,利源精制：大股东、实际控制人行为规范及信息问询制度（2014年7月）,finalpage/2014-07-31/1200089248.PDF
2014-09-18,利源精制：2014年公司债券发行公告,finalpage/2014-09-18/1200243743.PDF
2014-09-18,利源精制：2014年公司债券信用评级分析报告,finalpage/2014-09-18/1200243744.PDF
2014-09-18,利源精制：公开发行公司债券募集说明书,finalpage/2014-09-18/1200243745.PDF
2014-09-18,利源精制：公开发行公司债券募集说明书摘要,finalpage/2014-09-18/1200243746.PDF
2014-09-22,利源精制：2014年公司债券票面利率公告,finalpage/2014-09-22/1200250063.PDF
2014-09-25,利源精制：2014年公司债券发行结果公告,finalpage/2014-09-25/1200258700.PDF
2014-09-27,利源精制：关于持股5%以上股东减持股份的提示性公告,finalpage/2014-09-27/1200265978.PDF
2014-09-27,利源精制：简式权益变动报告书,finalpage/2014-09-27/1200265979.PDF
2014-10-21,利源精制：2014年第三季度报告正文,finalpage/2014-10-21/1200312883.PDF
2014-10-21,利源精制：第二届董事会第二十三次会议决议的公告,finalpage/2014-10-21/1200312885.PDF
2014-10-21,利源精制：第二届监事会第十四次会议决议的公告,finalpage/2014-10-21/1200312886.PDF
2014-10-21,利源精制：2014年第三季度报告全文,finalpage/2014-10-21/1200312887.PDF
2014-12-02,利源精制：2014年年度利润分配预案的公告,finalpage/2014-12-02/1200431334.PDF
2014-12-02,利源精制：2014年公司债券上市公告书,finalpage/2014-12-02/1200432535.PDF
2014-12-17,利源精制：关于监事会换届选举的公告,finalpage/2014-12-17/1200471076.PDF
2014-12-17,利源精制：关于董事会换届选举的公告,finalpage/2014-12-17/1200471077.PDF
2014-12-24,利源精制：重大事项停牌公告,finalpage/2014-12-24/1200488775.PDF
2014-12-25,利源精制：关于召开2015年第一次临时股东大会的通知,finalpage/2014-12-25/1200493272.PDF
2014-12-25,利源精制：独立董事关于非公开发行股票的独立意见,finalpage/2014-12-25/1200493273.PDF
2014-12-25,利源精制：截至2014年9月30日止的前次募集资金使用情况报告,finalpage/2014-12-25/1200493274.PDF
2014-12-25,利源精制：前次募集资金使用情况鉴证报告（截至2014年9月30日止）,finalpage/2014-12-25/1200493275.PDF
2014-12-25,利源精制：非公开发行股票募集资金使用可行性报告,finalpage/2014-12-25/1200493276.PDF
2014-12-25,利源精制：第二届董事会第二十四次会议决议的公告,finalpage/2014-12-25/1200493277.PDF
2014-12-25,利源精制：重大事项复牌公告,finalpage/2014-12-25/1200493278.PDF
2014-12-25,利源精制：非公开发行A股股票预案,finalpage/2014-12-25/1200493279.PDF
2014-12-30,利源精制：股票交易异常波动公告,finalpage/2014-12-30/1200504580.PDF
2015-01-05,利源精制：关于董事、高级管理人员减持公司股份的公告,finalpage/2015-01-05/1200511716.PDF
2015-01-10,利源精制：2015年第一次临时股东大会决议公告,finalpage/2015-01-10/1200533401.PDF
2015-01-10,利源精制：2015年第一次临时股东大会的法律意见书,finalpage/2015-01-10/1200533402.PDF
2015-02-27,利源精制：重大事项停牌公告,finalpage/2015-02-27/1200653921.PDF
2015-02-28,利源精制：华林证券有限责任公司关于公司内部控制规则落实自查表的核查意见,finalpage/2015-02-28/1200656305.PDF
2015-02-28,利源精制：华林证券有限责任公司关于公司2014年度内部控制自我评价报告的核查意见,finalpage/2015-02-28/1200656306.PDF
2015-02-28,利源精制：华林证券有限责任公司关于公司2014年度募集资金存放与使用情况专项核查报告,finalpage/2015-02-28/1200656307.PDF
2015-02-28,利源精制：2014年年度报告摘要,finalpage/2015-02-28/1200656308.PDF
2015-02-28,利源精制：2014年年度报告,finalpage/2015-02-28/1200656309.PDF
2015-02-28,利源精制：2014年年度审计报告,finalpage/2015-02-28/1200656310.PDF
2015-02-28,利源精制：第二届董事会第二十五次会议决议的公告,finalpage/2015-02-28/1200656311.PDF
2015-02-28,利源精制：关于召开2014年年度股东大会的通知,finalpage/2015-02-28/1200656312.PDF
2015-02-28,利源精制：第二届监事会第十五次会议决议的公告,finalpage/2015-02-28/1200656313.PDF
2015-02-28,利源精制：关于对公司控股股东及其他关联方占用资金情况的专项审计说明,finalpage/2015-02-28/1200656314.PDF
2015-02-28,利源精制：2014年度内部控制自我评价报告,finalpage/2015-02-28/1200656315.PDF
2015-02-28,利源精制：2014年度内部控制鉴证报告,finalpage/2015-02-28/1200656316.PDF
2015-02-28,利源精制：关于公司募集资金存放与实际使用情况的专项报告,finalpage/2015-02-28/1200656317.PDF
2015-02-28,利源精制：募集资金年度存放与使用情况鉴证报告（2014年度）,finalpage/2015-02-28/1200656318.PDF
2015-02-28,利源精制：独立董事关于公司第二届董事会第二十五次会议相关议案及其他相关事项的独立意见,finalpage/2015-02-28/1200656319.PDF
2015-02-28,利源精制：2014年度独立董事述职报告,finalpage/2015-02-28/1200656320.PDF
2015-02-28,利源精制：关于举行2014年年度报告网上说明会的公告,finalpage/2015-02-28/1200656321.PDF
2015-02-28,利源精制：关于选举职工代表监事的公告,finalpage/2015-02-28/1200656322.PDF
2015-02-28,利源精制：内部控制规则落实自查表,finalpage/2015-02-28/1200656323.PDF
2015-02-28,利源精制：独立董事候选人声明（段德炳）,finalpage/2015-02-28/1200656324.PDF
2015-02-28,利源精制：独立董事提名人声明,finalpage/2015-02-28/1200656325.PDF
2015-02-28,利源精制：独立董事候选人声明（王文生）,finalpage/2015-02-28/1200656326.PDF
2015-02-28,利源精制：独立董事候选人声明（王立国）,finalpage/2015-02-28/1200656327.PDF
2015-03-05,利源精制：关于2014年年度股东大会通知更正的公告,finalpage/2015-03-05/1200669224.PDF
2015-03-05,利源精制：重大事项停牌进展公告,finalpage/2015-03-05/1200669225.PDF
2015-03-10,利源精制：关于召开2014年年度股东大会的补充通知,finalpage/2015-03-10/1200683259.PDF
2015-03-10,利源精制：关于2014年年度股东大会增加临时提案的公告,finalpage/2015-03-10/1200683260.PDF
2015-03-10,利源精制：公司章程修正案,finalpage/2015-03-10/1200683261.PDF
2015-03-10,利源精制：关于非公开发行股票涉及关联交易事项暨签订非公开发行股份认购协议的公告,finalpage/2015-03-10/1200683262.PDF
2015-03-10,利源精制：分红管理制度（2015年3月）,finalpage/2015-03-10/1200683263.PDF
2015-03-10,利源精制：2015年度员工持股计划（草案）,finalpage/2015-03-10/1200683264.PDF
2015-03-10,利源精制：2015年度员工持股计划（草案）摘要,finalpage/2015-03-10/1200683265.PDF
2015-03-10,利源精制：截至2014年12月31日止的前次募集资金使用情况报告,finalpage/2015-03-10/1200683266.PDF
2015-03-10,利源精制：前次募集资金使用情况鉴证报告（截至2014年12月31日止）,finalpage/2015-03-10/1200683267.PDF
2015-03-10,利源精制：未来三年股东回报规划（2015-2017年）,finalpage/2015-03-10/1200683268.PDF
2015-03-10,利源精制：北京安杰律师事务所关于公司实施2015年度员工持股计划的法律意见书,finalpage/2015-03-10/1200683269.PDF
2015-03-10,利源精制：独立董事关于公司非公开发行股票涉及关联交易事项的事前认可意见,finalpage/2015-03-10/1200683270.PDF
2015-03-10,利源精制：独立董事关于第二届董事会第二十六次会议相关事项的独立意见,finalpage/2015-03-10/1200683271.PDF
2015-03-10,利源精制：第二届监事会第十六次会议决议的公告,finalpage/2015-03-10/1200683272.PDF
2015-03-10,利源精制：监事会关于员工持股计划相关事项的审核意见,finalpage/2015-03-10/1200683273.PDF
2015-03-10,利源精制：公司章程（2015年3月）,finalpage/2015-03-10/1200683274.PDF
2015-03-10,利源精制：第二届董事会第二十六次会议决议的公告,finalpage/2015-03-10/1200683275.PDF
2015-03-10,利源精制：重大事项复牌公告,finalpage/2015-03-10/1200683276.PDF
2015-03-10,利源精制：2015年度非公开发行股票募集资金运用可行性分析报告,finalpage/2015-03-10/1200683277.PDF
2015-03-10,利源精制：2015年度非公开发行A股股票预案,finalpage/2015-03-10/1200683278.PDF
2015-03-11,利源精制：华林证券有限责任公司关于公司2014年年度保荐工作报告,finalpage/2015-03-11/1200686745.PDF
2015-03-11,利源精制：华林证券有限责任公司关于公司之保荐总结报告书,finalpage/2015-03-11/1200686746.PDF
2015-03-21,利源精制：2014年年度股东大会决议的公告,finalpage/2015-03-21/1200724057.PDF
2015-03-21,利源精制：2014年年度股东大会的法律意见书,finalpage/2015-03-21/1200724058.PDF
2015-03-31,利源精制：2015年一季度业绩预告,finalpage/2015-03-31/1200764234.PDF
2015-04-02,利源精制：2014年年度权益分派实施公告,finalpage/2015-04-02/1200778703.PDF
2015-04-10,利源精制：关于实施2014年度权益分派方案后调整公司2015年度非公开发行股票发行价格和发行数量的公告,finalpage/2015-04-10/1200804332.PDF
2015-04-10,利源精制：关于实施2014年度权益分派方案后调整公司非公开发行股票发行价格和发行数量的公告,finalpage/2015-04-10/1200804333.PDF
2015-04-11,利源精制：独立董事关于公司第三届董事会第一次会议相关议案的独立意见,finalpage/2015-04-11/1200812173.PDF
2015-04-11,利源精制：第三届监事会第一次会议决议的公告,finalpage/2015-04-11/1200812174.PDF
2015-04-11,利源精制：第三届董事会第一次会议决议的公告,finalpage/2015-04-11/1200812175.PDF
2015-04-22,利源精制：2015年第一季度报告正文,finalpage/2015-04-22/1200881689.PDF
2015-04-22,利源精制：2015年第一季度报告全文,finalpage/2015-04-22/1200881690.PDF
2015-04-22,利源精制：第三届监事会第二次会议决议的公告,finalpage/2015-04-22/1200881691.PDF
2015-04-22,利源精制：第三届董事会第二次会议决议的公告,finalpage/2015-04-22/1200881692.PDF
2015-04-28,利源精制：跟踪评级报告,finalpage/2015-04-28/1200919497.PDF
2015-04-29,利源精制：关于2015年度非公开发行股票申请获得中国证监会受理的公告,finalpage/2015-04-29/1200931659.PDF
2015-04-30,利源精制：关于媒体报告相关情况的公告,finalpage/2015-04-30/1200944270.PDF
2015-05-04,利源精制：2014年公司债券受托管理事务报告（2014年度）,finalpage/2015-05-04/1200957015.PDF
2015-06-09,利源精制：重大事项停牌公告,finalpage/2015-06-09/1201122831.PDF
2015-06-10,利源精制：关于召开2015年第二次临时股东大会的通知,finalpage/2015-06-10/1201128042.PDF
2015-06-10,利源精制：公司章程修正案,finalpage/2015-06-10/1201128043.PDF
2015-06-10,利源精制：关于就轨道车辆制造及铝型材深加工建设项目与沈阳市沈北新区人民政府签订协议书及项目完成备案的公告,finalpage/2015-06-10/1201128044.PDF
2015-06-10,利源精制：独立董事关于非公开发行股票预案修订的独立意见,finalpage/2015-06-10/1201128045.PDF
2015-06-10,利源精制：公司章程（2015年6月）,finalpage/2015-06-10/1201128046.PDF
2015-06-10,利源精制：第三届董事会第三次会议决议的公告,finalpage/2015-06-10/1201128047.PDF
2015-06-10,利源精制：重大事项复牌公告,finalpage/2015-06-10/1201128048.PDF
2015-06-10,利源精制：关于非公开发行A股股票预案修订情况的公告,finalpage/2015-06-10/1201128049.PDF
2015-06-10,利源精制：非公开发行股票募集资金使用可行性报告（修订）,finalpage/2015-06-10/1201128050.PDF
2015-06-10,利源精制：非公开发行A股股票预案（修订）,finalpage/2015-06-10/1201128051.PDF
2015-06-26,利源精制：2015年第二次临时股东大会的法律意见书,finalpage/2015-06-26/1201195925.PDF
2015-06-26,利源精制：2015年第二次临时股东大会决议的公告,finalpage/2015-06-26/1201195926.PDF
2015-07-08,利源精制：重大事项停牌公告,finalpage/2015-07-08/1201255808.PDF
2015-07-13,利源精制：关于维护公司股价具体方案的公告,finalpage/2015-07-13/1201282265.PDF
2015-07-15,利源精制：复牌公告,finalpage/2015-07-15/1201294844.PDF
2015-07-17,利源精制：股票交易异常波动公告,finalpage/2015-07-17/1201304814.PDF
2015-07-25,利源精制：关于2015年度非公开发行股票申请文件反馈意见的回复,finalpage/2015-07-25/1201342344.PDF
2015-07-25,利源精制：关于最近五年被证券监管部门和交易所采取监管措施或处罚及整改情况的公告,finalpage/2015-07-25/1201342345.PDF
2015-07-25,利源精制：关于非公开发行股票承诺事项的公告,finalpage/2015-07-25/1201342346.PDF
2015-07-25,利源精制：关于非公开发行股票摊薄即期回报的风险提示及相关防范措施的公告,finalpage/2015-07-25/1201342347.PDF
2015-07-31,利源精制：关于公司募集资金存放与实际使用情况的专项报告,finalpage/2015-07-31/1201369343.PDF
2015-07-31,利源精制：2015年半年度报告摘要,finalpage/2015-07-31/1201369344.PDF
2015-07-31,利源精制：2015年半年度报告,finalpage/2015-07-31/1201369345.PDF
2015-07-31,利源精制：2015年半年度财务报告,finalpage/2015-07-31/1201369346.PDF
2015-07-31,利源精制：第三届董事会第四次会议决议公告,finalpage/2015-07-31/1201369347.PDF
2015-07-31,利源精制：第三届监事会第三次会议决议公告,finalpage/2015-07-31/1201369348.PDF
2015-07-31,利源精制：独立董事关于公司第三届董事会第四次会议相关内容的独立意见,finalpage/2015-07-31/1201369349.PDF
2015-08-29,利源精制：关于控股股东、实际控制人增持公司股份的公告,finalpage/2015-08-29/1201517041.PDF
2015-09-16,利源精制：“14利源债”2015年付息公告,finalpage/2015-09-16/1201598508.PDF
2015-09-25,利源精制：关于2015年度非公开发行股票募集资金使用的承诺函,finalpage/2015-09-25/1201634711.PDF
2015-09-25,利源精制：关于2015年度非公开发行股票申请文件反馈意见的回复,finalpage/2015-09-25/1201634712.PDF
2015-10-09,利源精制：2015年第三次临时股东大会通知,finalpage/2015-10-09/1201668697.PDF
2015-10-09,利源精制：关于取消非公开发行A股股票预案的公告,finalpage/2015-10-09/1201668698.PDF
