date,title,url
2015-08-31,北玻股份：关于对外投资事项处于筹划阶段的提示性公告,finalpage/2015-08-31/1201523936.PDF
2015-09-08,北玻股份：关于使用部分节余募集资金投资设立控股子公司的公告,finalpage/2015-09-08/1201560255.PDF
2015-09-08,北玻股份：召开2015年第一次临时股东大会的通知,finalpage/2015-09-08/1201560256.PDF
2015-09-08,北玻股份：独立董事关于第五届董事会第二十二次会议的独立意见,finalpage/2015-09-08/1201560257.PDF
2015-09-08,北玻股份：第一创业摩根大通证券有限责任公司关于公司使用部分节余募集资金投资设立控股子公司的核查意见,finalpage/2015-09-08/1201560258.PDF
2015-09-08,北玻股份：第五届监事会第十七次会议决议公告,finalpage/2015-09-08/1201560259.PDF
2015-09-08,北玻股份：第五届董事会第二十二次会议决议公告,finalpage/2015-09-08/1201560260.PDF
2015-09-23,北玻股份：关于使用部分闲置募集资金购买银行理财产品的进展公告,finalpage/2015-09-23/1201623826.PDF
2015-09-24,北玻股份：关于2015年第一次临时股东大会决议的公告,finalpage/2015-09-24/1201629567.PDF
2015-09-24,北玻股份：2015年第一次临时股东大会的法律意见书,finalpage/2015-09-24/1201629568.PDF
2015-10-01,北玻股份：2015年第三季度业绩预告修正公告,finalpage/2015-10-01/1201660109.PDF
2015-10-28,北玻股份：2015年第三季度报告正文,finalpage/2015-10-28/1201730399.PDF
2015-10-28,北玻股份：2015年第三季度报告全文,finalpage/2015-10-28/1201730400.PDF
2015-11-13,北玻股份：独立董事辞职公告,finalpage/2015-11-13/1201766263.PDF
2015-11-26,北玻股份：关于使用部分闲置募集资金购买银行理财产品的进展公告,finalpage/2015-11-26/1201788029.PDF
2015-12-19,北玻股份：关于控股子公司取得营业执照的公告,finalpage/2015-12-19/1201845192.PDF
2016-01-28,北玻股份：2015年度业绩预告修正公告,finalpage/2016-01-28/1201946333.PDF
2016-02-26,北玻股份：2015年度业绩快报,finalpage/2016-02-26/1201999412.PDF
2016-03-05,北玻股份：关于控股子公司获得高新技术企业证书的公告,finalpage/2016-03-05/1202022739.PDF
2016-03-09,北玻股份：关于董事会及监事会换届选举的提示性公告,finalpage/2016-03-09/1202029716.PDF
2016-03-31,北玻股份：合并及公司资产负债表,finalpage/2016-03-31/1202117768.PDF
2016-03-31,北玻股份：2015年年度报告,finalpage/2016-03-31/1202110564.PDF
2016-03-31,北玻股份：第五届董事会第二十四次会议决议公告,finalpage/2016-03-31/1202110565.PDF
2016-03-31,北玻股份：召开2015年度股东大会的通知,finalpage/2016-03-31/1202110566.PDF
2016-03-31,北玻股份：第五届监事会第十九次会议决议公告,finalpage/2016-03-31/1202110567.PDF
2016-03-31,北玻股份：控股股东及其他关联方占用资金情况专项说明,finalpage/2016-03-31/1202110568.PDF
2016-03-31,北玻股份：2015年度募集资金存放与使用情况专项报告,finalpage/2016-03-31/1202110569.PDF
2016-03-31,北玻股份：募集资金存放与使用情况鉴证报告,finalpage/2016-03-31/1202110570.PDF
2016-03-31,北玻股份：2015年度内部控制自我评价报告,finalpage/2016-03-31/1202110571.PDF
2016-03-31,北玻股份：关于公司2015年度的内部控制鉴证报告,finalpage/2016-03-31/1202110572.PDF
2016-03-31,北玻股份：内部控制规则落实自查表,finalpage/2016-03-31/1202110573.PDF
2016-03-31,北玻股份：关于公司及子公司使用闲置募集资金购买保本型银行理财产品的公告,finalpage/2016-03-31/1202110574.PDF
2016-03-31,北玻股份：关于公司及子公司使用部分闲置自有资金购买保本型银行理财产品的公告,finalpage/2016-03-31/1202110575.PDF
2016-03-31,北玻股份：关于使用剩余超募资金永久性补充流动资金的公告,finalpage/2016-03-31/1202110576.PDF
2016-03-31,北玻股份：关于续聘会计师事务所的公告,finalpage/2016-03-31/1202110577.PDF
2016-03-31,北玻股份：关于子公司向银行申请综合授信以及公司为其提供担保的公告,finalpage/2016-03-31/1202110578.PDF
2016-03-31,北玻股份：关于控股子公司设立海外子公司的公告,finalpage/2016-03-31/1202110579.PDF
2016-03-31,北玻股份：关于控股子公司设立子公司的公告,finalpage/2016-03-31/1202110580.PDF
2016-03-31,北玻股份：独立董事提名人声明（三）,finalpage/2016-03-31/1202110581.PDF
2016-03-31,北玻股份：独立董事候选人声明（金文辉）,finalpage/2016-03-31/1202110582.PDF
2016-03-31,北玻股份：独立董事提名人声明（二）,finalpage/2016-03-31/1202110583.PDF
2016-03-31,北玻股份：独立董事候选人声明（吴跃平）,finalpage/2016-03-31/1202110584.PDF
2016-03-31,北玻股份：独立董事提名人声明（一）,finalpage/2016-03-31/1202110585.PDF
2016-03-31,北玻股份：独立董事候选人声明（熊熊）,finalpage/2016-03-31/1202110586.PDF
2016-03-31,北玻股份：关于选举第六届职工代表监事的公告,finalpage/2016-03-31/1202110587.PDF
2016-03-31,北玻股份：独立董事2015年度述职报告（郭雪萌）,finalpage/2016-03-31/1202110588.PDF
2016-03-31,北玻股份：独立董事2015年度述职报告（金文辉）,finalpage/2016-03-31/1202110589.PDF
2016-03-31,北玻股份：独立董事2015年度述职报告（吴跃平）,finalpage/2016-03-31/1202110590.PDF
2016-03-31,北玻股份：第一创业摩根大通证券有限责任公司关于公司2015年度募集资金存放与使用情况的核查意见,finalpage/2016-03-31/1202110591.PDF
2016-03-31,北玻股份：第一创业摩根大通证券有限责任公司关于公司使用剩余超募资金永久性补充流动资金的核查意见,finalpage/2016-03-31/1202110592.PDF
2016-03-31,北玻股份：2015年年度报告摘要,finalpage/2016-03-31/1202110593.PDF
2016-03-31,北玻股份：独立董事关于第五届董事会第二十四次会议相关事项的独立意见,finalpage/2016-03-31/1202110594.PDF
2016-03-31,北玻股份：第一创业摩根大通证券有限责任公司关于公司及子公司使用闲置募集资金购买保本型银行理财产品的核查意见,finalpage/2016-03-31/1202110595.PDF
2016-03-31,北玻股份：2015年度财务决算报告,finalpage/2016-03-31/1202110596.PDF
2016-03-31,北玻股份：2015年年度审计报告,finalpage/2016-03-31/1202110597.PDF
2016-04-06,北玻股份：关于举行2015年度网上业绩说明会的通知,finalpage/2016-04-06/1202138755.PDF
2016-04-27,北玻股份：2015年年度股东大会的法律意见书,finalpage/2016-04-27/1202249216.PDF
2016-04-27,北玻股份：关于2015年度股东大会决议的公告,finalpage/2016-04-27/1202249217.PDF
2016-04-28,北玻股份：第六届监事会第一次会议决议公告,finalpage/2016-04-28/1202256940.PDF
2016-04-28,北玻股份：2016年第一季度报告正文,finalpage/2016-04-28/1202256941.PDF
2016-04-28,北玻股份：2016年第一季度报告全文,finalpage/2016-04-28/1202256942.PDF
2016-04-28,北玻股份：第六届董事会第一次会议决议公告,finalpage/2016-04-28/1202256943.PDF
2016-04-28,北玻股份：关于使用部分闲置募集资金购买银行理财产品的进展公告,finalpage/2016-04-28/1202257250.PDF
2016-04-28,北玻股份：关于聘任公司高级管理人员的独立意见,finalpage/2016-04-28/1202258235.PDF
2016-05-10,北玻股份：关于使用部分闲置募集资金购买银行理财产品的进展公告,finalpage/2016-05-10/1202311785.PDF
2016-05-11,北玻股份：2015年年度权益分派实施公告,finalpage/2016-05-11/1202315589.PDF
2016-05-12,北玻股份：关于注销超募资金专户的公告,finalpage/2016-05-12/1202316522.PDF
2016-05-18,北玻股份：关于实际控制人及董监高人员减持股份计划的公告,finalpage/2016-05-18/1202325656.PDF
2016-06-07,北玻股份：公司及其控股子公司关于换领“三证合一”营业执照的公告,finalpage/2016-06-07/1202357504.PDF
2016-06-22,北玻股份：关于深圳证券交易所问询函回复的公告,finalpage/2016-06-22/1202380178.PDF
2016-06-23,北玻股份：亚太（集团）会计师事务所（特殊普通合伙）关于公司收购北玻臻兴51%的股权购买日确认的说明,finalpage/2016-06-23/1202387541.PDF
2016-07-01,北玻股份：2016年半年度业绩预告修正公告,finalpage/2016-07-01/1202440726.PDF
2016-07-05,北玻股份：关于联讯北玻投资基金增资控股{尔久公司的公告,finalpage/2016-07-05/1202449581.PDF
2016-07-05,北玻股份：关于投资设立联讯北玻投资管理公司的公告,finalpage/2016-07-05/1202449582.PDF
2016-07-05,北玻股份：召开2016年第一次临时股东大会的通知,finalpage/2016-07-05/1202449583.PDF
2016-07-05,北玻股份：关于申请银行综合授信额度的公告,finalpage/2016-07-05/1202449584.PDF
2016-07-05,北玻股份：第六届董事会第二次会议决议公告,finalpage/2016-07-05/1202449585.PDF
2016-07-05,北玻股份：独立董事关于第六届董事会第二次会议的独立意见,finalpage/2016-07-05/1202449586.PDF
2016-07-05,北玻股份：关于投资设立联讯北玻投资基金暨关联交易的公告,finalpage/2016-07-05/1202449587.PDF
2016-07-12,北玻股份：控股子公司关于换领“三证合一”营业执照的公告,finalpage/2016-07-12/1202464342.PDF
2016-08-12,北玻股份：关于使用部分闲置募集资金购买银行理财产品的进展公告,finalpage/2016-08-12/1202557941.PDF
2016-08-29,北玻股份：关于部分限售股份上市流通的提示性公告,finalpage/2016-08-29/1202635572.PDF
2016-08-30,北玻股份：关于2016年第一次临时股东大会决议的公告,finalpage/2016-08-30/1202642711.PDF
2016-08-30,北玻股份：2016年第一次临时股东大会的法律意见书,finalpage/2016-08-30/1202642712.PDF
2016-08-31,北玻股份：2016年半年度报告摘要,finalpage/2016-08-31/1202655812.PDF
2016-08-31,北玻股份：2016年半年度报告,finalpage/2016-08-31/1202655813.PDF
2016-08-31,北玻股份：2016年半年度财务报告,finalpage/2016-08-31/1202655814.PDF
2016-08-31,北玻股份：第五届监事会第十六次会议决议公告,finalpage/2016-08-31/1202655815.PDF
2016-08-31,北玻股份：独立董事关于第六届董事会第三次会议的独立意见,finalpage/2016-08-31/1202655816.PDF
2016-08-31,北玻股份：2016年半年度募集资金存放与使用情况专项报告,finalpage/2016-08-31/1202655818.PDF
2016-08-31,北玻股份：第六届董事会第三次会议决议公告,finalpage/2016-08-31/1202655819.PDF
2016-08-31,北玻股份：关于控股子公司天津北玻申请授信并为授信额度提供担保的公告,finalpage/2016-08-31/1202655820.PDF
2016-10-28,北玻股份：2016年第三季度报告正文,finalpage/2016-10-28/1202794944.PDF
2016-10-28,北玻股份：2016年第三季度报告全文,finalpage/2016-10-28/1202794945.PDF
2016-11-12,北玻股份：关于使用部分闲置募集资金购买银行理财产品的进展公告,finalpage/2016-11-12/1202824849.PDF
2016-12-31,北玻股份：关于实际控制人及董监高人员股份减持计划实施完毕的公告,finalpage/2016-12-31/1202978468.PDF
2017-01-07,北玻股份：关于对外投资设立控股子公司的公告,finalpage/2017-01-07/1202996913.PDF
2017-01-07,北玻股份：第六届董事会第五次会议决议公告,finalpage/2017-01-07/1202996914.PDF
2017-01-18,北玻股份：第六届董事会第六次临时会议决议公告,finalpage/2017-01-18/1203023139.PDF
2017-01-18,北玻股份：关于对外投资设立控股子公司的补充公告,finalpage/2017-01-18/1203023140.PDF
2017-02-28,北玻股份：2016年度业绩快报,finalpage/2017-02-28/1203110827.PDF
2017-03-31,北玻股份：独立董事2016年度述职报告（金文辉）,finalpage/2017-03-31/1203235771.PDF
2017-03-31,北玻股份：独立董事2016年度述职报告（吴跃平）,finalpage/2017-03-31/1203235772.PDF
2017-03-31,北玻股份：独立董事2016年度述职报告（郭雪萌）,finalpage/2017-03-31/1203235773.PDF
2017-03-31,北玻股份：独立董事2016年度述职报告（熊熊）,finalpage/2017-03-31/1203235774.PDF
2017-03-31,北玻股份：2016年度内部控制自我评价报告,finalpage/2017-03-31/1203235775.PDF
2017-03-31,北玻股份：内部控制规则落实自查表,finalpage/2017-03-31/1203235776.PDF
2017-03-31,北玻股份：关于公司及子公司使用闲置募集资金购买保本型银行理财产品的公告,finalpage/2017-03-31/1203235777.PDF
2017-03-31,北玻股份：关于公司及子公司使用部分闲置自有资金购买保本型银行理财产品的公告,finalpage/2017-03-31/1203235778.PDF
2017-03-31,北玻股份：关于申请银行综合授信额度的公告,finalpage/2017-03-31/1203235779.PDF
2017-03-31,北玻股份：关于续聘会计师事务所的公告,finalpage/2017-03-31/1203235780.PDF
2017-03-31,北玻股份：关于举行2016年度网上业绩说明会的通知,finalpage/2017-03-31/1203235781.PDF
2017-03-31,北玻股份：关于使用部分闲置募集资金购买银行理财产品的进展公告,finalpage/2017-03-31/1203235782.PDF
2017-03-31,北玻股份：公司章程（2017年3月）,finalpage/2017-03-31/1203235783.PDF
2017-03-31,北玻股份：独立董事关于第六届董事会第七次会议相关事项的独立意见,finalpage/2017-03-31/1203235784.PDF
2017-03-31,北玻股份：第六届董事会第七次会议决议公告,finalpage/2017-03-31/1203235785.PDF
2017-03-31,北玻股份：第六届监事会第四次会议决议公告,finalpage/2017-03-31/1203235786.PDF
2017-03-31,北玻股份：2016年年度报告摘要,finalpage/2017-03-31/1203235787.PDF
2017-03-31,北玻股份：2016年年度报告（已取消）,finalpage/2017-03-31/1203235788.PDF
2017-03-31,北玻股份：2016年年度审计报告,finalpage/2017-03-31/1203235789.PDF
2017-03-31,北玻股份：控股股东及其他关联方占用资金情况专项说明,finalpage/2017-03-31/1203235791.PDF
2017-03-31,北玻股份：2016年度募集资金存放与使用情况专项报告,finalpage/2017-03-31/1203235792.PDF
2017-03-31,北玻股份：募集资金存放与使用情况鉴证报告,finalpage/2017-03-31/1203235793.PDF
2017-03-31,北玻股份：召开2016年度股东大会的通知,finalpage/2017-03-31/1203235794.PDF
2017-03-31,北玻股份：第一创业摩根大通证券有限责任公司关于公司2016年度募集资金存放与使用情况的核查意见,finalpage/2017-03-31/1203235795.PDF
2017-03-31,北玻股份：第一创业摩根大通证券有限责任公司关于公司及子公司使用闲置募集资金购买保本型银行理财产品的核查意见,finalpage/2017-03-31/1203235796.PDF
2017-03-31,北玻股份：2016年度财务决算报告,finalpage/2017-03-31/1203235797.PDF
2017-04-01,北玻股份：关于对第六届董事会第七次会议决议公告的更正公告,finalpage/2017-04-01/1203245650.PDF
2017-04-08,北玻股份：停牌公告,finalpage/2017-04-08/1203262331.PDF
2017-04-12,北玻股份：关于深圳证券交易所问询函回复及澄清、复牌公告,finalpage/2017-04-12/1203284833.PDF
2017-04-21,北玻股份：2016年年度股东大会的法律意见书,finalpage/2017-04-21/1203343436.PDF
2017-04-21,北玻股份：关于2016年度股东大会决议的公告,finalpage/2017-04-21/1203343437.PDF
2017-04-22,北玻股份：2017年第一季度报告正文,finalpage/2017-04-22/1203355945.PDF
2017-04-22,北玻股份：2017年第一季度报告全文,finalpage/2017-04-22/1203355946.PDF
2017-05-04,北玻股份：2016年度权益分派实施公告,finalpage/2017-05-04/1203474080.PDF
2017-05-05,北玻股份：关于诉讼事项的公告,finalpage/2017-05-05/1203475245.PDF
2017-05-26,北玻股份：关于参加2017年度投资者网上集体接待日活动的公告,finalpage/2017-05-26/1203569250.PDF
2017-06-02,北玻股份：关于公司完成工商变更登记并换发营业执照的公告,finalpage/2017-06-02/1203579407.PDF
2017-06-03,北玻股份：关于2016年年度报告更正的公告,finalpage/2017-06-03/1203587707.PDF
2017-06-03,北玻股份：关于补充披露公司控股子公司2016年度获得政府补助的公告,finalpage/2017-06-03/1203587708.PDF
2017-06-03,北玻股份：2016年年度报告（更新后）,finalpage/2017-06-03/1203587709.PDF
2017-06-03,北玻股份：亚太（集团）会计师事务所（特殊普通合伙）关于公司年报问询函相关问题的意见,finalpage/2017-06-03/1203587710.PDF
2017-06-03,北玻股份：关于2016年年报问询函回复的公告,finalpage/2017-06-03/1203587711.PDF
2017-06-17,北玻股份：关于子公司向银行申请综合授信以及公司为其提供担保的公告,finalpage/2017-06-17/1203624508.PDF
2017-06-17,北玻股份：第六届董事会第九次会议决议公告,finalpage/2017-06-17/1203624509.PDF
2017-07-05,北玻股份：关于使用部分闲置募集资金购买银行理财产品的进展公告,finalpage/2017-07-05/1203681391.PDF
2017-07-07,北玻股份：2017年半年度修正公告,finalpage/2017-07-07/1203685626.PDF
2017-08-09,北玻股份：关于诉讼事项的公告,finalpage/2017-08-09/1203773063.PDF
2017-08-12,北玻股份：关于控股子公司使用部分闲置募集资金购买银行理财产品的进展公告,finalpage/2017-08-12/1203789843.PDF
2017-08-18,北玻股份：第六届董事会第十次会议决议公告,finalpage/2017-08-18/1203807643.PDF
2017-08-18,北玻股份：独立董事关于第六届董事会第十次会议的独立意见,finalpage/2017-08-18/1203807644.PDF
2017-08-18,北玻股份：第六届监事会第六次会议决议公告,finalpage/2017-08-18/1203807645.PDF
2017-08-18,北玻股份：2017年半年度报告摘要,finalpage/2017-08-18/1203807646.PDF
2017-08-18,北玻股份：2017年半年度报告,finalpage/2017-08-18/1203807647.PDF
2017-08-18,北玻股份：2017年半年度财务报告,finalpage/2017-08-18/1203807648.PDF
2017-08-18,北玻股份：2017年半年度募集资金存放与使用情况专项报告,finalpage/2017-08-18/1203807649.PDF
2017-08-29,北玻股份：关于部分限售股份上市流通的提示性公告,finalpage/2017-08-29/1203889384.PDF
2017-08-31,北玻股份：关于会计政策变更的公告,finalpage/2017-08-31/1203907415.PDF
2017-08-31,北玻股份：关于对控股子公司广东北玻电子玻璃有限公司增资的公告,finalpage/2017-08-31/1203907416.PDF
2017-08-31,北玻股份：第六届监事会第七次会议决议公告,finalpage/2017-08-31/1203907417.PDF
2017-08-31,北玻股份：独立董事关于第六届董事会第十一次会议的独立意见,finalpage/2017-08-31/1203907418.PDF
2017-08-31,北玻股份：第六届董事会第十一次会议决议公告,finalpage/2017-08-31/1203907419.PDF
2017-09-21,北玻股份：关于向控股子公司提供财务资助的公告,finalpage/2017-09-21/1203989287.PDF
2017-09-21,北玻股份：第六届董事会第十二次会议决议公告,finalpage/2017-09-21/1203989288.PDF
2017-09-21,北玻股份：独立董事关于公司向控股子公司提供财务资助的独立意见,finalpage/2017-09-21/1203989289.PDF
2017-10-11,北玻股份：关于使用部分闲置募集资金购买银行理财产品的进展公告,finalpage/2017-10-11/1204024156.PDF
2017-10-21,北玻股份：2017年第三季度报告正文,finalpage/2017-10-21/1204055963.PDF
2017-10-21,北玻股份：2017年第三季度报告全文,finalpage/2017-10-21/1204055964.PDF
2017-10-26,北玻股份：关于2017年半年报的问询函回复的公告,finalpage/2017-10-26/1204069387.PDF
2017-11-03,北玻股份：关于诉讼事项的进展公告,finalpage/2017-11-03/1204108727.PDF
2017-11-22,北玻股份：关于向控股子公司提供财务资助的公告,finalpage/2017-11-22/1204155064.PDF
2017-11-22,北玻股份：第六届董事会第十四次会议决议公告,finalpage/2017-11-22/1204155065.PDF
2017-11-22,北玻股份：独立董事关于公司向控股子公司提供财务资助的独立意见,finalpage/2017-11-22/1204155066.PDF
2017-12-02,北玻股份：关于变更会计师事务所的公告,finalpage/2017-12-02/1204184028.PDF
2017-12-02,北玻股份：召开2017年第一次临时股东大会的通知,finalpage/2017-12-02/1204184029.PDF
2017-12-02,北玻股份：第六届董事会第十五次会议决议公告,finalpage/2017-12-02/1204184030.PDF
2017-12-02,北玻股份：第六届监事会第九次会议决议公告,finalpage/2017-12-02/1204184031.PDF
2017-12-02,北玻股份：独立董事关于公司第六届董事会第十五次会议有关事项的独立意见,finalpage/2017-12-02/1204184032.PDF
2017-12-02,北玻股份：关于转让控股子公司北京北玻安全玻璃有限公司股权的公告,finalpage/2017-12-02/1204184033.PDF
2017-12-13,北玻股份：关于对深圳证券交易所问询函回复的公告,finalpage/2017-12-13/1204217317.PDF
2017-12-19,北玻股份：关于2017年第一次临时股东大会决议的公告,finalpage/2017-12-19/1204236281.PDF
2017-12-19,北玻股份：2017年第一次临时股东大会的法律意见书,finalpage/2017-12-19/1204236282.PDF
2017-12-20,北玻股份：关于控股子公司提供担保的公告,finalpage/2017-12-20/1204238885.PDF
2017-12-20,北玻股份：第六届董事会第十六次会议决议公告,finalpage/2017-12-20/1204238886.PDF
2017-12-30,北玻股份：关于控股子公司设立子公司的公告,finalpage/2017-12-30/1204288144.PDF
2017-12-30,北玻股份：关于终止对上海泰威技术发展股份有限公司投资的公告,finalpage/2017-12-30/1204288145.PDF
2017-12-30,北玻股份：第六届董事会第十七次会议决议公告,finalpage/2017-12-30/1204288146.PDF
2018-01-13,北玻股份：关于使用部分闲置募集资金购买银行理财产品的进展公告,finalpage/2018-01-13/1204325742.PDF
2018-01-18,北玻股份：关于转让控股子公司北京北玻安全玻璃有限公司股权的进展公告,finalpage/2018-01-18/1204342519.PDF
