,date,title,url
623,2016-08-18,金安国纪：第三届董事会第十六次会议决议公告,finalpage/2016-08-18/1202575636.PDF
624,2016-08-18,金安国纪：第三届监事会第十三次会议决议公告,finalpage/2016-08-18/1202575637.PDF
625,2016-08-18,金安国纪：独立董事关于公司第三届董事会第十六次会议相关事项的独立意见,finalpage/2016-08-18/1202575638.PDF
626,2016-08-18,金安国纪：关于为子公司申请银行授信提供担保的公告,finalpage/2016-08-18/1202575639.PDF
627,2016-08-18,金安国纪：关于投资者关系电子邮箱变更的公告,finalpage/2016-08-18/1202575640.PDF
628,2016-08-18,金安国纪：关于2016年上半年募集资金存放与使用情况的专项报告,finalpage/2016-08-18/1202575641.PDF
629,2016-08-18,金安国纪：2016年半年度报告摘要,finalpage/2016-08-18/1202575642.PDF
630,2016-08-18,金安国纪：2016年半年度财务报告,finalpage/2016-08-18/1202575645.PDF
631,2016-08-18,金安国纪：2016年半年度报告,finalpage/2016-08-18/1202575646.PDF
632,2016-08-27,金安国纪：第三届董事会第十七次会议决议公告,finalpage/2016-08-27/1202633177.PDF
633,2016-08-27,金安国纪：关于签署担保合同的公告,finalpage/2016-08-27/1202633182.PDF
634,2016-08-30,金安国纪：关于购买银行理财产品的公告,finalpage/2016-08-30/1202645845.PDF
635,2016-09-01,金安国纪：关于购买银行理财产品的公告,finalpage/2016-09-01/1202663649.PDF
636,2016-09-06,金安国纪：关于购买银行理财产品的公告,finalpage/2016-09-06/1202676474.PDF
637,2016-09-22,金安国纪：关于购买银行理财产品的公告,finalpage/2016-09-22/1202716556.PDF
638,2016-09-27,金安国纪：第三届董事会第十八次会议决议公告,finalpage/2016-09-27/1202726713.PDF
639,2016-09-27,金安国纪：证券投资管理制度（2016年9月）,finalpage/2016-09-27/1202726714.PDF
640,2016-09-29,金安国纪：关于使用闲置募集资金购买银行理财产品的公告,finalpage/2016-09-29/1202734003.PDF
641,2016-09-30,金安国纪：第三届董事会第十九次会议决议公告,finalpage/2016-09-30/1202736937.PDF
642,2016-09-30,金安国纪：关于拟购置商业地产用于办公场所建设的公告,finalpage/2016-09-30/1202736938.PDF
643,2016-10-12,金安国纪：关于使用闲置募集资金购买银行理财产品的公告,finalpage/2016-10-12/1202750366.PDF
644,2016-10-14,金安国纪：2016年三季度业绩预告修正公告,finalpage/2016-10-14/1202757269.PDF
645,2016-10-21,金安国纪：关于使用闲置募集资金购买银行理财产品的公告,finalpage/2016-10-21/1202773167.PDF
646,2016-10-25,金安国纪：关于购置房产的公告,finalpage/2016-10-25/1202781665.PDF
647,2016-10-28,金安国纪：2016年第三季度报告正文,finalpage/2016-10-28/1202797074.PDF
648,2016-10-28,金安国纪：2016年第三季度报告全文,finalpage/2016-10-28/1202797075.PDF
649,2016-11-08,金安国纪：关于公司股东追加限售承诺的公告,finalpage/2016-11-08/1202817814.PDF
650,2016-12-08,金安国纪：关于使用闲置募集资金购买银行理财产品的公告,finalpage/2016-12-08/1202863799.PDF
651,2016-12-15,金安国纪：关于公司为控股子公司提供担保额度的公告,finalpage/2016-12-15/1202875223.PDF
652,2016-12-15,金安国纪：第三届董事会第二十一次会议决议公告,finalpage/2016-12-15/1202875224.PDF
653,2016-12-15,金安国纪：第三届监事会第十五次会议决议公告,finalpage/2016-12-15/1202875225.PDF
654,2016-12-15,金安国纪：关于将募集资金利息及理财收益用于临安项目后续规划建设的公告,finalpage/2016-12-15/1202875226.PDF
655,2016-12-15,金安国纪：华泰联合证券有限责任公司关于公司使用部分闲置募集资金、超募资金和自有资金进行现金管理的专项核查意见,finalpage/2016-12-15/1202875227.PDF
656,2016-12-15,金安国纪：《股东大会议事规则》修订对照表,finalpage/2016-12-15/1202875228.PDF
657,2016-12-15,金安国纪：关于召开2016年第一次临时股东大会的通知,finalpage/2016-12-15/1202875229.PDF
658,2016-12-15,金安国纪：独立董事关于公司第三届董事会第二十一次会议相关事项的独立意见,finalpage/2016-12-15/1202875230.PDF
659,2016-12-15,金安国纪：华泰联合证券有限责任公司关于公司使用募集资金利息及理财收益用于临安项目后续规划建设的专项核查意见,finalpage/2016-12-15/1202875231.PDF
660,2016-12-31,金安国纪：关于使用闲置募集资金购买银行理财产品的公告,finalpage/2016-12-31/1202981653.PDF
661,2016-12-31,金安国纪：2016年第一次临时股东大会的法律意见,finalpage/2016-12-31/1202981654.PDF
662,2016-12-31,金安国纪：2016年第一次临时股东大会决议公告,finalpage/2016-12-31/1202981655.PDF
663,2017-01-14,"金安国纪：关于“年产2,016万米电子级玻纤布”项目完工投产的公告",finalpage/2017-01-14/1203014523.PDF
664,2017-01-18,金安国纪：2016年度业绩预告修正公告,finalpage/2017-01-18/1203022402.PDF
665,2017-02-09,金安国纪：关于控股子公司获得高新技术企业证书的公告,finalpage/2017-02-09/1203070522.PDF
666,2017-02-28,金安国纪：2016年度业绩快报,finalpage/2017-02-28/1203110823.PDF
667,2017-03-09,金安国纪：关于使用闲置募集资金购买银行理财产品的公告,finalpage/2017-03-09/1203141373.PDF
668,2017-03-30,金安国纪：2017年第一季度业绩预告,finalpage/2017-03-30/1203223066.PDF
669,2017-04-01,金安国纪：关于使用闲置募集资金购买银行理财产品的公告,finalpage/2017-04-01/1203244985.PDF
670,2017-04-28,金安国纪：2016年年度报告摘要,finalpage/2017-04-28/1203413668.PDF
671,2017-04-28,金安国纪：第三届董事会第二十二次会议决议公告,finalpage/2017-04-28/1203413669.PDF
672,2017-04-28,金安国纪：关于召开2016年度股东大会的通知,finalpage/2017-04-28/1203413670.PDF
673,2017-04-28,金安国纪：第三届监事会第十六次会议决议公告,finalpage/2017-04-28/1203413671.PDF
674,2017-04-28,金安国纪：非经营性资金占用及其他关联资金往来情况的专项说明,finalpage/2017-04-28/1203413672.PDF
675,2017-04-28,金安国纪：董事会关于年度募集资金存放与使用情况的专项报告,finalpage/2017-04-28/1203413673.PDF
676,2017-04-28,金安国纪：募集资金存放与使用情况的鉴证报告,finalpage/2017-04-28/1203413674.PDF
677,2017-04-28,金安国纪：2016年度独立董事述职报告,finalpage/2017-04-28/1203413675.PDF
678,2017-04-28,金安国纪：独立董事关于公司第三届董事会第二十二次会议相关事项的独立意见,finalpage/2017-04-28/1203413676.PDF
679,2017-04-28,金安国纪：2016年度内部控制自我评价报告,finalpage/2017-04-28/1203413677.PDF
680,2017-04-28,金安国纪：内部控制鉴证报告,finalpage/2017-04-28/1203413678.PDF
681,2017-04-28,金安国纪：关于2016年度证券投资情况的专项说明,finalpage/2017-04-28/1203413679.PDF
682,2017-04-28,金安国纪：2017年第一季度报告正文,finalpage/2017-04-28/1203413680.PDF
683,2017-04-28,金安国纪：2017年第一季度报告全文,finalpage/2017-04-28/1203413681.PDF
684,2017-04-28,金安国纪：关于开展票据池业务的公告,finalpage/2017-04-28/1203413682.PDF
685,2017-04-28,金安国纪：关于公司及子公司核销坏账的公告,finalpage/2017-04-28/1203413683.PDF
686,2017-04-28,金安国纪：关于举行2016年度网上业绩说明会的公告,finalpage/2017-04-28/1203413684.PDF
687,2017-04-28,金安国纪：内部控制规则落实自查表,finalpage/2017-04-28/1203413685.PDF
688,2017-04-28,金安国纪：华泰联合证券有限责任公司关于公司2016年度募集资金存放和使用情况的专项核查意见,finalpage/2017-04-28/1203413686.PDF
689,2017-04-28,金安国纪：2016年财务决算报告,finalpage/2017-04-28/1203413687.PDF
690,2017-04-28,金安国纪：2016年监事会工作报告,finalpage/2017-04-28/1203413688.PDF
691,2017-04-28,金安国纪：2016年年度报告,finalpage/2017-04-28/1203413689.PDF
692,2017-04-28,金安国纪：2016年年度审计报告,finalpage/2017-04-28/1203413690.PDF
693,2017-05-19,金安国纪：2016年度股东大会的法律意见,finalpage/2017-05-19/1203536997.PDF
694,2017-05-19,金安国纪：2016年度股东大会决议公告,finalpage/2017-05-19/1203536998.PDF
695,2017-06-08,金安国纪：关于使用闲置募集资金购买银行理财产品的公告,finalpage/2017-06-08/1203598087.PDF
696,2017-07-05,金安国纪：关于使用闲置募集资金购买银行理财产品的公告,finalpage/2017-07-05/1203681836.PDF
697,2017-07-06,金安国纪：2016年年度利润分配实施公告,finalpage/2017-07-06/1203684214.PDF
698,2017-08-30,金安国纪：独立董事关于公司第三届董事会第二十三次会议相关事项的独立意见,finalpage/2017-08-30/1203894250.PDF
699,2017-08-30,金安国纪：关于会计政策变更的公告,finalpage/2017-08-30/1203894251.PDF
700,2017-08-30,金安国纪：关于2017年上半年募集资金存放与使用情况的专项报告,finalpage/2017-08-30/1203894252.PDF
701,2017-08-30,金安国纪：第三届董事会第二十三次会议决议公告,finalpage/2017-08-30/1203894253.PDF
702,2017-08-30,金安国纪：2017年半年度报告摘要,finalpage/2017-08-30/1203894254.PDF
703,2017-08-30,金安国纪：第三届监事会第十七次会议决议公告,finalpage/2017-08-30/1203894255.PDF
704,2017-08-30,金安国纪：2017年半年度报告,finalpage/2017-08-30/1203894256.PDF
705,2017-08-30,金安国纪：2017年半年度财务报告,finalpage/2017-08-30/1203894257.PDF
706,2017-09-07,金安国纪：关于使用闲置募集资金购买银行理财产品的公告,finalpage/2017-09-07/1203941897.PDF
707,2017-09-16,金安国纪：关于公司股东减持股份的预披露公告,finalpage/2017-09-16/1203979276.PDF
708,2017-10-12,金安国纪：关于使用闲置募集资金购买银行理财产品的公告,finalpage/2017-10-12/1204030241.PDF
709,2017-10-31,金安国纪：2017年第三季度报告正文,finalpage/2017-10-31/1204095248.PDF
710,2017-10-31,金安国纪：2017年第三季度报告全文,finalpage/2017-10-31/1204095249.PDF
711,2017-10-31,金安国纪：第三届董事会第二十四次会议决议公告,finalpage/2017-10-31/1204095250.PDF
712,2017-10-31,金安国纪：第三届监事会第十八次会议决议公告,finalpage/2017-10-31/1204095251.PDF
713,2017-11-07,金安国纪：第三届董事会第二十五次会议决议公告,finalpage/2017-11-07/1204114344.PDF
714,2017-11-07,金安国纪：关于子公司拟签署房屋征收补偿协议的公告,finalpage/2017-11-07/1204114345.PDF
715,2017-11-07,金安国纪：独立董事关于公司第三届董事会第二十五次会议相关事项的独立意见,finalpage/2017-11-07/1204114346.PDF
716,2017-11-16,金安国纪：关于公司股东追加限售承诺的公告,finalpage/2017-11-16/1204142247.PDF
717,2017-12-06,金安国纪：关于使用闲置募集资金购买理财产品的公告,finalpage/2017-12-06/1204194558.PDF
718,2017-12-16,金安国纪：关于增加以自有资金开展现金管理业务额度的公告,finalpage/2017-12-16/1204233267.PDF
719,2017-12-16,金安国纪：关于继续开展证券投资业务的公告,finalpage/2017-12-16/1204233268.PDF
720,2017-12-16,金安国纪：关于召开2018年第一次临时股东大会的通知,finalpage/2017-12-16/1204233269.PDF
721,2017-12-16,金安国纪：独立董事候选人声明（姚超豪）,finalpage/2017-12-16/1204233270.PDF
722,2017-12-16,金安国纪：独立董事候选人声明（周昌生）,finalpage/2017-12-16/1204233271.PDF
723,2017-12-16,金安国纪：独立董事关于公司第三届董事会第二十六次会议相关事项的独立意见,finalpage/2017-12-16/1204233272.PDF
724,2017-12-16,金安国纪：第三届董事会第二十六次会议决议公告,finalpage/2017-12-16/1204233273.PDF
725,2017-12-16,金安国纪：关于修改《公司章程》的公告,finalpage/2017-12-16/1204233274.PDF
726,2017-12-16,金安国纪：独立董事候选人声明（孙伟）,finalpage/2017-12-16/1204233275.PDF
727,2017-12-16,金安国纪：独立董事提名人声明（一）,finalpage/2017-12-16/1204233276.PDF
728,2017-12-16,金安国纪：独立董事提名人声明（二）,finalpage/2017-12-16/1204233277.PDF
729,2017-12-16,金安国纪：独立董事提名人声明（三）,finalpage/2017-12-16/1204233278.PDF
730,2017-12-16,金安国纪：第三届监事会第十九次会议决议公告,finalpage/2017-12-16/1204233279.PDF
731,2017-12-19,金安国纪：关于签署并购意向书的公告,finalpage/2017-12-19/1204236631.PDF
732,2017-12-29,金安国纪：签署《关于上海埃尔顿医疗器械有限公司的股权转让之框架协议》的公告,finalpage/2017-12-29/1204275782.PDF
733,2018-01-04,金安国纪：第四届董事会第一次会议决议公告,finalpage/2018-01-04/1204302512.PDF
734,2018-01-04,金安国纪：第四届监事会第一次会议决议公告,finalpage/2018-01-04/1204302513.PDF
735,2018-01-04,金安国纪：独立董事关于公司第四届董事会第一会议相关事项的独立意见,finalpage/2018-01-04/1204302514.PDF
736,2018-01-04,金安国纪：关于公司职工代表监事换届选举的公告,finalpage/2018-01-04/1204302515.PDF
737,2018-01-04,金安国纪：2018年第一次临时股东大会的法律意见,finalpage/2018-01-04/1204302516.PDF
738,2018-01-04,金安国纪：2018年第一次临时股东大会决议公告（已取消）,finalpage/2018-01-04/1204302517.PDF
739,2018-01-05,金安国纪：关于2018年第一次临时股东大会决议的更正公告,finalpage/2018-01-05/1204304289.PDF
740,2018-01-05,金安国纪：2018年第一次临时股东大会决议公告（更新后）,finalpage/2018-01-05/1204304292.PDF
741,2018-01-12,金安国纪：关于使用闲置募集资金购买理财产品的公告,finalpage/2018-01-12/1204323823.PDF
742,2018-01-16,金安国纪：关于公司股东股份减持进展公告,finalpage/2018-01-16/1204331577.PDF
743,2018-02-02,金安国纪：关于收购上海埃尔顿医疗器械有限公司股份的完成公告,finalpage/2018-02-02/1204385269.PDF
744,2018-02-13,金安国纪：2017年度业绩快报,finalpage/2018-02-13/1204416989.PDF
