date,title,url
2014-05-14,京威股份：宁波福尔达智能科技股份有限公司2014年度盈利预测审核报告,finalpage/2014-05-14/64023082.PDF
2014-05-14,京威股份：2014年度盈利预测审核报告,finalpage/2014-05-14/64023083.PDF
2014-05-14,京威股份：秦皇岛威卡威汽车零部件有限公司2014年度盈利预测审核报告,finalpage/2014-05-14/64023084.PDF
2014-05-14,京威股份：关于以部分超募资金收购股权的公告,finalpage/2014-05-14/64023085.PDF
2014-05-14,京威股份：关于重大资产重组事项复牌公告,finalpage/2014-05-14/64023086.PDF
2014-05-14,京威股份：关于重大资产重组的一般风险提示性公告,finalpage/2014-05-14/64023087.PDF
2014-05-14,京威股份：交易对方出具的关于提供信息及材料真实性、准确性、完整性的承诺函,finalpage/2014-05-14/64023088.PDF
2014-05-14,京威股份：关于召开2014年第二次临时股东大会的通知,finalpage/2014-05-14/64023089.PDF
2014-05-14,京威股份：董事会关于重组履行法定程序的完备性、合规性及提交的法律文件的有效性的说明,finalpage/2014-05-14/64023090.PDF
2014-05-14,京威股份：第三届监事会第四次会议决议公告,finalpage/2014-05-14/64023091.PDF
2014-05-14,京威股份：股份及支付现金购买资产报告书（草案）摘要,finalpage/2014-05-14/64023092.PDF
2014-05-14,京威股份：承诺函,finalpage/2014-05-14/64023093.PDF
2014-05-14,京威股份：股东权益变动的提示性公告,finalpage/2014-05-14/64023094.PDF
2014-05-14,京威股份：北京市嘉源律师事务所关于公司发行股份及支付现金购买资产之法律意见书,finalpage/2014-05-14/64023095.PDF
2014-05-14,京威股份：关于公司发行股份及支付现金购买资产的承诺和声明,finalpage/2014-05-14/64023096.PDF
2014-05-14,京威股份：关于独立性的承诺函,finalpage/2014-05-14/64023097.PDF
2014-05-14,京威股份：规范关联交易的承诺函,finalpage/2014-05-14/64023098.PDF
2014-05-14,京威股份：避免同业竞争承诺函,finalpage/2014-05-14/64023099.PDF
2014-05-14,京威股份：简式权益变动报告书,finalpage/2014-05-14/64023100.PDF
2014-05-14,京威股份：关于股份锁定的承诺函,finalpage/2014-05-14/64023101.PDF
2014-05-14,京威股份：国信证券股份有限公司关于公司超募资金使用计划的核查意见,finalpage/2014-05-14/64023102.PDF
2014-05-16,京威股份：投资者交流会公告,finalpage/2014-05-16/64029887.PDF
2014-05-27,京威股份：关于召开2014年第二次临时股东大会的提示性公告,finalpage/2014-05-27/64067830.PDF
2014-05-30,京威股份：2014年第二次临时股东大会的法律意见书,finalpage/2014-05-30/64083047.PDF
2014-05-30,京威股份：2014年第二次临时股东大会决议公告,finalpage/2014-05-30/64083048.PDF
2014-06-05,京威股份：第三届董事会第七次会议决议公告,finalpage/2014-06-05/64105220.PDF
2014-06-11,京威股份：2013年年度权益分派实施公告,finalpage/2014-06-11/64123510.PDF
2014-06-26,京威股份：关于收到《中国证监会行政许可申请受理通知书》的公告,finalpage/2014-06-26/1200007152.PDF
2014-06-28,京威股份：关于实际控制人之一麦尔家族的主要成员去世的公告,finalpage/2014-06-28/1200014380.PDF
2014-07-30,京威股份：关于收到中国证监会行政许可项目审查一次反馈意见通知书的公告,finalpage/2014-07-30/1200086996.PDF
2014-08-26,京威股份：2014年半年度报告摘要,finalpage/2014-08-26/1200165490.PDF
2014-08-26,京威股份：2014年半年度报告,finalpage/2014-08-26/1200165491.PDF
2014-08-26,京威股份：2014年半年度审计报告,finalpage/2014-08-26/1200165492.PDF
2014-08-26,京威股份：第三届董事会第八次会议决议公告,finalpage/2014-08-26/1200165493.PDF
2014-08-26,京威股份：第三届监事会第五次会议决议的公告,finalpage/2014-08-26/1200165494.PDF
2014-08-26,京威股份：独立董事关于公司关联方资金占用和对外担保情况的专项说明和独立意见,finalpage/2014-08-26/1200165495.PDF
2014-08-26,京威股份：董事会关于募集资金2014年半年度存放与使用情况的专项报告,finalpage/2014-08-26/1200165496.PDF
2014-08-29,京威股份：业绩补偿协议之补充协议（福尔达）,finalpage/2014-08-29/1200187951.PDF
2014-08-29,京威股份：业绩补偿协议之补充协议（秦皇岛威卡威）,finalpage/2014-08-29/1200187952.PDF
2014-08-29,京威股份：2014年1-6月、2013年度备考审计报告,finalpage/2014-08-29/1200187953.PDF
2014-08-29,京威股份：宁波福尔达智能科技股份有限公司2014年1-6月、2013年度、2012年度审计报告,finalpage/2014-08-29/1200187954.PDF
2014-08-29,京威股份：秦皇岛威卡威汽车零部件有限公司2014年1-6月、2013年度、2012年度审计报告,finalpage/2014-08-29/1200187955.PDF
2014-08-29,京威股份：第三届董事会第九次会议决议公告,finalpage/2014-08-29/1200184686.PDF
2014-08-29,京威股份：定期现场检查报告,finalpage/2014-08-29/1200184687.PDF
2014-09-11,京威股份：关于中国证监会上市公司并购重组委员会审核公司发行股份并支付现金购买资产事项的停牌公告,finalpage/2014-09-11/1200224360.PDF
2014-09-12,京威股份：关于变更经办会计师的公告,finalpage/2014-09-12/1200226313.PDF
2014-09-18,京威股份：关于发行股份并支付现金购买资产获中国证监会上市公司并购重组审核委员会审核通过暨公司股票复牌的公告,finalpage/2014-09-18/1200243748.PDF
2014-10-14,京威股份：发行股份及支付现金购买资产报告书的修订说明公告,finalpage/2014-10-14/1200295749.PDF
2014-10-14,京威股份：发行股份及支付现金购买资产报告书,finalpage/2014-10-14/1200295750.PDF
2014-10-14,京威股份：发行股份及支付现金购买资产报告书摘要,finalpage/2014-10-14/1200295751.PDF
2014-10-14,京威股份：国信证券股份有限公司关于公司发行股份及支付现金购买资产之独立财务顾问报告,finalpage/2014-10-14/1200295752.PDF
2014-10-14,京威股份：国信证券股份有限公司关于公司发行股份及支付现金购买资产申请文件补正材料的专项核查意见,finalpage/2014-10-14/1200295753.PDF
2014-10-14,京威股份：国信证券股份有限公司关于公司发行股份及支付现金购买资产申请文件反馈意见的专项核查意见,finalpage/2014-10-14/1200295754.PDF
2014-10-14,京威股份：北京市嘉源律师事务所关于公司发行股份及支付现金购买资产之补充法律意见书（一）,finalpage/2014-10-14/1200295755.PDF
2014-10-14,京威股份：北京市嘉源律师事务所关于公司发行股份及支付现金购买资产之补充法律意见书（二）,finalpage/2014-10-14/1200295756.PDF
2014-10-14,京威股份：北京市嘉源律师事务所关于公司发行股份及支付现金购买资产之补充法律意见书（三）,finalpage/2014-10-14/1200295757.PDF
2014-10-14,京威股份：关于发行股份并支付现金购买资产取得中国证监会核准批复的公告,finalpage/2014-10-14/1200295758.PDF
2014-10-29,京威股份：关于发行股份及支付现金购买资产之标的资产过户完成的公告,finalpage/2014-10-29/1200350158.PDF
2014-10-29,京威股份：北京市嘉源律师事务所关于公司发行股份及支付现金购买资产之资产过户情况的法律意见书,finalpage/2014-10-29/1200350159.PDF
2014-10-29,京威股份：国信证券股份有限公司关于公司发行股份及支付现金购买资产之标的资产过户情况的核查意见,finalpage/2014-10-29/1200350160.PDF
2014-10-29,京威股份：2014年第三季度报告正文,finalpage/2014-10-29/1200345035.PDF
2014-10-29,京威股份：2014年第三季度报告全文,finalpage/2014-10-29/1200345036.PDF
2014-11-12,京威股份：发行股份及支付现金购买资产实施情况报告书暨新增股份上市公告书（摘要）,finalpage/2014-11-12/1200385707.PDF
2014-11-12,京威股份：董事、监事和高级管理人员持股情况变动公告,finalpage/2014-11-12/1200385708.PDF
2014-11-12,京威股份：关于交易相关方发行股份购买资产承诺事项及其履行情况的公告,finalpage/2014-11-12/1200385709.PDF
2014-11-12,京威股份：国信证券股份有限公司关于公司发行股份及支付现金购买资产实施情况之独立财务顾问核查意见,finalpage/2014-11-12/1200385710.PDF
2014-11-12,京威股份：北京市嘉源律师事务所关于公司发行股份及支付现金购买资产实施情况之法律意见书,finalpage/2014-11-12/1200385711.PDF
2014-11-12,京威股份：国信证券股份有限公司关于公司发行股份及支付现金购买资产涉及向特定对象发行股份之上市推荐书,finalpage/2014-11-12/1200385712.PDF
2014-11-12,京威股份：发行股份及支付现金购买资产实施情况报告书暨新增股份上市公告书,finalpage/2014-11-12/1200385975.PDF
2014-11-15,京威股份：投资者交流会公告,finalpage/2014-11-15/1200393156.PDF
2014-11-25,京威股份：关于召开2014年第三次临时股东大会的通知,finalpage/2014-11-25/1200415932.PDF
2014-11-25,京威股份：独立董事关于相关事项的独立意见,finalpage/2014-11-25/1200415933.PDF
2014-11-25,京威股份：第三届董事会第十一次会议决议公告,finalpage/2014-11-25/1200415931.PDF
2014-12-11,京威股份：2014年第三次临时股东大会的法律意见书,finalpage/2014-12-11/1200456605.PDF
2014-12-11,京威股份：2014年第三次临时股东大会决议公告,finalpage/2014-12-11/1200456606.PDF
2014-12-11,京威股份：关于选举职工代表董事的公告,finalpage/2014-12-11/1200456607.PDF
2014-12-16,京威股份：第三届董事会第十二次会议决议公告,finalpage/2014-12-16/1200468069.PDF
2014-12-16,京威股份：关于召开2014年第四次临时股东大会的通知,finalpage/2014-12-16/1200468070.PDF
2014-12-16,京威股份：国信证券股份有限公司关于公司超募资金使用的核查意见,finalpage/2014-12-16/1200468071.PDF
2014-12-16,京威股份：独立董事对相关事项的独立意见,finalpage/2014-12-16/1200468072.PDF
2014-12-27,京威股份：关于取消《关于召开2014年第四次临时股东大会的通知》的公告,finalpage/2014-12-27/1200498777.PDF
2015-01-05,京威股份：关于股东股权质押的公告,finalpage/2015-01-05/1200511220.PDF
2015-01-21,京威股份：关于股东股权质押的公告,finalpage/2015-01-21/1200565419.PDF
2015-01-23,京威股份：关于完成注册资本变更工商登记的公告,finalpage/2015-01-23/1200573016.PDF
2015-02-04,京威股份：国信证券股份有限公司关于公司超募资金使用事项的核查意见,finalpage/2015-02-04/1200606865.PDF
2015-02-04,京威股份：第三届董事会第十三次会议决议公告,finalpage/2015-02-04/1200606866.PDF
2015-02-04,京威股份：独立董事对相关事项的独立意见,finalpage/2015-02-04/1200606867.PDF
2015-02-26,京威股份：第三届董事会第十四次会议决议公告,finalpage/2015-02-26/1200652625.PDF
2015-02-26,京威股份：关于召开2015年第一次临时股东大会的通知,finalpage/2015-02-26/1200652626.PDF
2015-02-26,京威股份：独立董事关于罢免董事的独立意见,finalpage/2015-02-26/1200652627.PDF
2015-02-27,京威股份：2014年度业绩快报,finalpage/2015-02-27/1200655546.PDF
2015-02-28,京威股份：关于2015年第一次临时股东大会延期召开的公告,finalpage/2015-02-28/1200657972.PDF
2015-03-05,京威股份：关于首次公开发行前已发行股份上市流通的提示性公告,finalpage/2015-03-05/1200670498.PDF
2015-03-05,京威股份：国信证券股份有限公司关于公司限售股份解除限售及上市流通的核查意见,finalpage/2015-03-05/1200670499.PDF
2015-03-18,京威股份：2015年第一次临时股东大会的法律意见书,finalpage/2015-03-18/1200710899.PDF
2015-03-18,京威股份：2015年第一次临时股东大会决议公告,finalpage/2015-03-18/1200710900.PDF
2015-03-31,京威股份：关于举行2014年年度报告网上说明会的通知,finalpage/2015-03-31/1200764953.PDF
2015-03-31,京威股份：2015年度日常关联交易预测公告,finalpage/2015-03-31/1200764954.PDF
2015-03-31,京威股份：关于变更会计准则并实行新的会计政策的公告,finalpage/2015-03-31/1200764955.PDF
2015-03-31,京威股份：独立董事对相关事项的事前认可意见,finalpage/2015-03-31/1200764956.PDF
2015-03-31,京威股份：关于宁波福尔达智能科技有限公司业绩补偿协议执行情况的专项审核报告,finalpage/2015-03-31/1200764957.PDF
2015-03-31,京威股份：关于秦皇岛威卡威汽车零部件有限公司业绩补偿协议执行情况的专项审核报告,finalpage/2015-03-31/1200764958.PDF
2015-03-31,京威股份：关于公司收购宁波福尔达智能科技有限公司100%股权、秦皇岛威卡威汽车零部件有限公司49%股权备考盈利预测实现情况的专项审核报告,finalpage/2015-03-31/1200764959.PDF
2015-03-31,京威股份：国信证券股份有限公司关于公司2014年度内部控制自我评价报告的核查意见,finalpage/2015-03-31/1200764960.PDF
2015-03-31,京威股份：国信证券股份有限公司关于公司2014年度募集资金存放与使用专项核查报告,finalpage/2015-03-31/1200764961.PDF
2015-03-31,京威股份：国信证券股份有限公司关于公司《内部控制规则落实自查表》的核查意见,finalpage/2015-03-31/1200764962.PDF
2015-03-31,京威股份：国信证券股份有限公司关于公司2015年度关联交易预计的核查意见,finalpage/2015-03-31/1200764963.PDF
2015-03-31,京威股份：国信证券股份有限公司关于公司首次公开发行股票2014年度保荐工作报告,finalpage/2015-03-31/1200764964.PDF
2015-03-31,京威股份：内部控制规则落实自查表,finalpage/2015-03-31/1200764965.PDF
2015-03-31,京威股份：2014年年度报告摘要,finalpage/2015-03-31/1200764966.PDF
2015-03-31,京威股份：2014年年度报告,finalpage/2015-03-31/1200764967.PDF
2015-03-31,京威股份：2014年年度审计报告,finalpage/2015-03-31/1200764968.PDF
2015-03-31,京威股份：第三届董事会第十五次会议决议公告,finalpage/2015-03-31/1200764969.PDF
2015-03-31,京威股份：关于召开2014年年度股东大会的通知,finalpage/2015-03-31/1200764970.PDF
2015-03-31,京威股份：第三届监事会第七次会议决议的公告,finalpage/2015-03-31/1200764971.PDF
2015-03-31,京威股份：2014年度控股股东及其他关联方资金占用情况的专项说明,finalpage/2015-03-31/1200764972.PDF
2015-03-31,京威股份：2014年度内部控制自我评价报告,finalpage/2015-03-31/1200764973.PDF
2015-03-31,京威股份：董事会关于募集资金2014年度存放与使用情况的专项报告,finalpage/2015-03-31/1200764974.PDF
2015-03-31,京威股份：2014年度募集资金年度存放与使用情况鉴证报告,finalpage/2015-03-31/1200764975.PDF
2015-03-31,京威股份：独立董事对第三届董事会第十五次会议相关事项的独立意见,finalpage/2015-03-31/1200764976.PDF
2015-03-31,京威股份：2014年度独立董事述职报告,finalpage/2015-03-31/1200764977.PDF
2015-04-08,京威股份：独立董事对第三届董事会第十六次会议相关事项的独立意见,finalpage/2015-04-08/1200798628.PDF
2015-04-08,京威股份：国信证券股份有限公司关于公司超募资金使用事项的核查意见,finalpage/2015-04-08/1200798625.PDF
2015-04-08,京威股份：第三届董事会第十六次会议决议公告,finalpage/2015-04-08/1200798626.PDF
2015-04-08,京威股份：关于召开2015年第二次临时股东大会的通知,finalpage/2015-04-08/1200798627.PDF
2015-04-09,京威股份：关于股东股权质押的公告,finalpage/2015-04-09/1200803100.PDF
2015-04-11,京威股份：关于股东股份解除质押的公告,finalpage/2015-04-11/1200809425.PDF
2015-04-15,京威股份：关于德国威卡威集团公司违反《市场划分协议》的仲裁结果公告,finalpage/2015-04-15/1200831190.PDF
2015-04-20,京威股份：投资者交流会公告,finalpage/2015-04-20/1200872442.PDF
2015-04-21,京威股份：2014年年度股东大会的法律意见书,finalpage/2015-04-21/1200875405.PDF
2015-04-21,京威股份：2014年度股东大会决议公告,finalpage/2015-04-21/1200875406.PDF
2015-04-23,京威股份：2015年第一季度报告正文,finalpage/2015-04-23/1200889712.PDF
2015-04-23,京威股份：2015年第一季度报告全文,finalpage/2015-04-23/1200889713.PDF
2015-04-23,京威股份：国信证券股份有限公司关于公司发行股份购买资产之持续督导工作报告书,finalpage/2015-04-23/1200889714.PDF
2015-04-23,京威股份：国信证券股份有限公司关于公司首次公开发行的保荐总结报告书,finalpage/2015-04-23/1200889715.PDF
2015-04-25,京威股份：2015年第二次临时股东大会的法律意见书,finalpage/2015-04-25/1200905938.PDF
2015-04-25,京威股份：2015年第二次临时股东大会决议公告,finalpage/2015-04-25/1200905939.PDF
2015-05-16,京威股份：关于重大事项停牌公告,finalpage/2015-05-16/1201020122.PDF
2015-05-21,京威股份：重大事项继续停牌公告,finalpage/2015-05-21/1201040079.PDF
2015-05-27,京威股份：重大事项继续停牌公告,finalpage/2015-05-27/1201065937.PDF
2015-06-02,京威股份：重大事项继续停牌公告,finalpage/2015-06-02/1201087428.PDF
2015-06-08,京威股份：2014年年度权益分派实施公告,finalpage/2015-06-08/1201111274.PDF
2015-06-08,京威股份：关于暂不向股东德国埃贝斯乐股份有限公司派发2014年度现金红利的公告,finalpage/2015-06-08/1201111275.PDF
2015-06-09,京威股份：重大事项继续停牌公告,finalpage/2015-06-09/1201121457.PDF
2015-06-15,京威股份：重大事项继续停牌公告,finalpage/2015-06-15/1201145408.PDF
2015-06-23,京威股份：重大事项继续停牌公告,finalpage/2015-06-23/1201173867.PDF
2015-06-24,京威股份：关于与小岛冲压工业株式会社、住友商事（中国）有限公司等签署《合作意向书》的公告,finalpage/2015-06-24/1201185942.PDF
2015-06-30,京威股份：重大事项继续停牌公告,finalpage/2015-06-30/1201211839.PDF
2015-07-06,京威股份：重大事项继续停牌公告,finalpage/2015-07-06/1201246501.PDF
2015-07-13,京威股份：重大事项继续停牌公告,finalpage/2015-07-13/1201273012.PDF
2015-07-20,京威股份：重大事项继续停牌公告,finalpage/2015-07-20/1201309597.PDF
2015-07-27,京威股份：重大事项继续停牌公告,finalpage/2015-07-27/1201342382.PDF
2015-08-03,京威股份：重大事项继续停牌公告,finalpage/2015-08-03/1201374377.PDF
2015-08-10,京威股份：重大事项继续停牌公告,finalpage/2015-08-10/1201406316.PDF
2015-08-11,京威股份：关于与无锡华光汽车部件集团有限公司签署合作意向书的公告,finalpage/2015-08-11/1201421934.PDF
2015-08-11,京威股份：关于与佛吉亚（中国）投资有限公司签署《合作备忘录》的公告,finalpage/2015-08-11/1201417067.PDF
2015-08-13,京威股份：第三届董事会第十八次会议决议公告,finalpage/2015-08-13/1201428741.PDF
2015-08-13,京威股份：关于收购吉林省华翼汽车零部件有限公司100%股权的公告,finalpage/2015-08-13/1201428742.PDF
2015-08-13,京威股份：关于收购无锡市星亿涂装环保设备有限公司51%股权的公告,finalpage/2015-08-13/1201428743.PDF
2015-08-13,京威股份：关于重大事项复牌公告,finalpage/2015-08-13/1201428744.PDF
2015-08-13,京威股份：无锡市星亿涂装环保设备有限公司2015年1-4月、2014年度及2013年度专项审计报告,finalpage/2015-08-13/1201428745.PDF
2015-08-13,京威股份：拟收购无锡市星亿涂装环保设备有限公司股权项目评估报告,finalpage/2015-08-13/1201428746.PDF
2015-08-21,京威股份：拟以现金收购吉林省华翼汽车零部件有限公司股权项目评估报告,finalpage/2015-08-21/1201466954.PDF
2015-08-21,京威股份：第三届董事会第十九次会议决议公告,finalpage/2015-08-21/1201466955.PDF
2015-08-21,京威股份：关于收购吉林省华翼汽车零部件有限公司100%股权的公告,finalpage/2015-08-21/1201466956.PDF
2015-08-21,京威股份：吉林省华翼汽车零部件有限公司2013年1月1日-2015年6月30财务报表审计报告,finalpage/2015-08-21/1201466957.PDF
2015-08-26,京威股份：2015年半年度报告摘要（已取消）,finalpage/2015-08-26/1201492971.PDF
2015-08-26,京威股份：2015年半年度报告（已取消）,finalpage/2015-08-26/1201492972.PDF
2015-08-26,京威股份：2015年半年度财务报告（已取消）,finalpage/2015-08-26/1201492973.PDF
2015-08-26,京威股份：第三届董事会第二十次会议决议公告,finalpage/2015-08-26/1201492974.PDF
2015-08-26,京威股份：第三届监事会第九次会议决议的公告,finalpage/2015-08-26/1201492975.PDF
2015-08-26,京威股份：独立董事关于公司关联方资金占用和对外担保情况的专项说明和独立意见,finalpage/2015-08-26/1201492976.PDF
2015-08-26,京威股份：董事会关于募集资金2015年1-6月存放与使用情况的专项报告,finalpage/2015-08-26/1201492977.PDF
2015-08-27,京威股份：2015年半年度报告（更新后）,finalpage/2015-08-27/1201502387.PDF
2015-08-27,京威股份：2015年半年度财务报告（更新后）,finalpage/2015-08-27/1201502388.PDF
2015-08-27,京威股份：2015年半年度报告摘要（更新后）,finalpage/2015-08-27/1201502389.PDF
2015-08-27,京威股份：关于2015年半年度报告全文、摘要及财务报告的更正公告,finalpage/2015-08-27/1201502390.PDF
2015-09-01,京威股份：关于股东股权质押的公告,finalpage/2015-09-01/1201532012.PDF
2015-09-07,京威股份：第三届董事会第二十一次会议决议公告,finalpage/2015-09-07/1201542780.PDF
2015-09-07,京威股份：公司债券发行预案公告,finalpage/2015-09-07/1201542781.PDF
2015-09-07,京威股份：关于召开2015年第三次临时股东大会的通知,finalpage/2015-09-07/1201542782.PDF
2015-09-09,京威股份：关于股东股权质押的公告,finalpage/2015-09-09/1201568240.PDF
2015-09-18,京威股份：关于股东股权质押的公告,finalpage/2015-09-18/1201608163.PDF
2015-09-23,京威股份：2015年第三次临时股东大会的法律意见书,finalpage/2015-09-23/1201625049.PDF
2015-09-23,京威股份：2015年第三次临时股东大会决议公告,finalpage/2015-09-23/1201625050.PDF
2015-09-26,京威股份：关于收购吉林省华翼汽车零部件有限公司100%股权之股权交割完成的公告,finalpage/2015-09-26/1201640091.PDF
2015-09-29,京威股份：关于股东股权质押的公告,finalpage/2015-09-29/1201650738.PDF
2015-10-10,京威股份：第三届董事会第二十二次会议决议公告,finalpage/2015-10-10/1201673318.PDF
2015-10-14,京威股份：关于公司股东德国埃贝斯乐股份有限公司违反避免同业竞争承诺的诉讼公告,finalpage/2015-10-14/1201693413.PDF
2015-10-27,京威股份：第三届董事会第二十四次会议决议公告,finalpage/2015-10-27/1201725358.PDF
2015-10-27,京威股份：2015年第三季度报告正文,finalpage/2015-10-27/1201725359.PDF
2015-10-27,京威股份：2015年第三季度报告全文,finalpage/2015-10-27/1201725360.PDF
2015-11-10,京威股份：国信证券股份有限公司关于公司限售股份解除限售及上市流通的核查意见,finalpage/2015-11-10/1201759886.PDF
2015-11-10,京威股份：关于发行股份购买资产之限售股份上市流通的提示性公告,finalpage/2015-11-10/1201759887.PDF
2015-11-17,京威股份：关于股东对外投资的重要提示性公告,finalpage/2015-11-17/1201775049.PDF
2015-11-20,京威股份：股票交易异常波动公告,finalpage/2015-11-20/1201779189.PDF
2015-11-24,京威股份：第三届董事会第二十五次会议决议公告,finalpage/2015-11-24/1201784822.PDF
2015-11-30,京威股份：关于公司就德方股东违反《市场划分协议》与《避免同业竞争承诺函》签订《和解协议书》的公告,finalpage/2015-11-30/1201796846.PDF
2015-12-02,京威股份：关于公开发行公司债券（面向合格投资者）申请获得中国证监会核准批复的公告,finalpage/2015-12-02/1201801036.PDF
2015-12-07,京威股份：第三届董事会第二十六次会议决议公告,finalpage/2015-12-07/1201810342.PDF
2015-12-07,京威股份：关于收购深圳市五洲龙汽车有限公司48%股权的公告,finalpage/2015-12-07/1201810343.PDF
2015-12-08,京威股份：关于首次公开发行前已发行股份上市流通的提示性公告,finalpage/2015-12-08/1201812729.PDF
2015-12-08,京威股份：公开发行公司债券募集说明书（面向合格投资者）,finalpage/2015-12-08/1201813012.PDF
2015-12-08,京威股份：2015年公司债券信用评级分析报告,finalpage/2015-12-08/1201813013.PDF
2015-12-08,京威股份：公开发行2015年公司债券发行公告（面向合格投资者）,finalpage/2015-12-08/1201813014.PDF
2015-12-08,京威股份：公开发行2015年公司债券募集说明书摘要（面向合格投资者）,finalpage/2015-12-08/1201813015.PDF
2015-12-10,京威股份：公开发行2015年公司债券票面利率公告（面向合格投资者）,finalpage/2015-12-10/1201825262.PDF
2015-12-12,京威股份：公开发行2015年公司债券发行结果公告（面向合格投资者）,finalpage/2015-12-12/1201830635.PDF
2015-12-15,京威股份：投资者交流会公告,finalpage/2015-12-15/1201832785.PDF
