date,title,url
2017-01-05,融钰集团：独立董事关于第三届董事会第二十二次临时会议相关事项的独立意见,finalpage/2017-01-05/1202990345.PDF
2017-01-05,融钰集团：关于使用剩余超募资金支付江西智容部分股权转让款的公告,finalpage/2017-01-05/1202990346.PDF
2017-01-05,融钰集团：关于受让上海辰商软件科技有限公司部分股权并增资暨签署股权转让与增资协议的公告,finalpage/2017-01-05/1202990347.PDF
2017-01-05,融钰集团：关于调整公司热镀铝产品及电控产品业务剥离基准日的公告,finalpage/2017-01-05/1202990348.PDF
2017-01-05,融钰集团：关于召开2017年第一次临时股东大会的通知,finalpage/2017-01-05/1202990349.PDF
2017-01-05,融钰集团：广发证券股份有限公司关于公司使用剩余超募资金支付江西智容部分股权转让款的核查意见,finalpage/2017-01-05/1202990350.PDF
2017-01-05,融钰集团：拟收购上海辰商软件科技有限公司股权项目评估报告,finalpage/2017-01-05/1202990351.PDF
2017-01-05,融钰集团：上海辰商软件科技有限公司审计报告,finalpage/2017-01-05/1202990352.PDF
2017-01-12,融钰集团：关于全资子公司名称变更的公告,finalpage/2017-01-12/1203008417.PDF
2017-01-17,融钰集团：关于《融钰集团股份有限公司与联保投资集团有限公司关于北京联合保险经纪有限公司股权转让框架协议》履行情况的进展公告,finalpage/2017-01-17/1203022121.PDF
2017-01-19,融钰集团：关于启用新版官方网站的公告,finalpage/2017-01-19/1203026194.PDF
2017-01-21,融钰集团：2017年第一次临时股东大会的法律意见书,finalpage/2017-01-21/1203036117.PDF
2017-01-21,融钰集团：2017年第一次临时股东大会决议公告,finalpage/2017-01-21/1203036118.PDF
2017-02-03,融钰集团：2016年度业绩预告修正公告,finalpage/2017-02-03/1203058863.PDF
2017-02-10,融钰集团：关于监事辞职的公告,finalpage/2017-02-10/1203073082.PDF
2017-02-21,融钰集团：关于全资子公司名称变更的公告,finalpage/2017-02-21/1203094004.PDF
2017-02-28,融钰集团：关于调整账面存货价值事项的公告,finalpage/2017-02-28/1203112880.PDF
2017-02-28,融钰集团：2016年度业绩快报,finalpage/2017-02-28/1203112881.PDF
2017-03-03,融钰集团：第三届董事会第二十三次临时会议决议公告,finalpage/2017-03-03/1203126498.PDF
2017-03-03,融钰集团：第三届监事会第五次临时会议决议公告,finalpage/2017-03-03/1203126499.PDF
2017-03-03,融钰集团：独立董事关于第三届董事会第二十三次临时会议相关事项的独立意见,finalpage/2017-03-03/1203126500.PDF
2017-03-03,融钰集团：关于全资子公司使用自有流动资金购买短期保本型理财产品的公告,finalpage/2017-03-03/1203126501.PDF
2017-03-10,融钰集团：关于深圳证券交易所问询函回复的公告,finalpage/2017-03-10/1203144928.PDF
2017-03-10,融钰集团：关于全资子公司变更名称、法定代表人及经营范围的公告,finalpage/2017-03-10/1203145288.PDF
2017-03-21,融钰集团：深圳证券交易所关于对公司2016年度财务报告审计工作的关注函之回复,finalpage/2017-03-21/1203182469.PDF
2017-03-31,融钰集团：2017年度第一季度业绩预告,finalpage/2017-03-31/1203239898.PDF
2017-04-01,融钰集团：全资子公司智容科技有限公司关于抚州市企业信用监管警示系统升级建设项目中标的公告,finalpage/2017-04-01/1203245894.PDF
2017-04-06,融钰集团：关于公司全资子公司智容科技有限公司获得高新技术企业证书的公告,finalpage/2017-04-06/1203251917.PDF
2017-04-20,融钰集团：重大事项停牌公告,finalpage/2017-04-20/1203338034.PDF
2017-04-21,融钰集团：关于设立控股孙公司的公告,finalpage/2017-04-21/1203343973.PDF
2017-04-21,融钰集团：第三届董事会第二十四次临时会议决议公告,finalpage/2017-04-21/1203343974.PDF
2017-04-27,融钰集团：重大事项停牌进展公告,finalpage/2017-04-27/1203401355.PDF
2017-04-28,融钰集团：2016年年度报告摘要,finalpage/2017-04-28/1203412548.PDF
2017-04-28,融钰集团：2016年年度报告,finalpage/2017-04-28/1203412549.PDF
2017-04-28,融钰集团：2016年年度审计报告,finalpage/2017-04-28/1203412550.PDF
2017-04-28,融钰集团：第三届董事会第十七次会议决议公告,finalpage/2017-04-28/1203412551.PDF
2017-04-28,融钰集团：第三届监事会第十四次会议决议公告,finalpage/2017-04-28/1203412552.PDF
2017-04-28,融钰集团：2016年度控股股东及其他关联方资金占用情况的专项说明,finalpage/2017-04-28/1203412553.PDF
2017-04-28,融钰集团：2016年募集资金年度存放与使用情况专项报告,finalpage/2017-04-28/1203412554.PDF
2017-04-28,融钰集团：截至2016年12月31日止募集资金存放及实际使用情况鉴证报告,finalpage/2017-04-28/1203412555.PDF
2017-04-28,融钰集团：独立董事2016年度述职报告（普峰）,finalpage/2017-04-28/1203412556.PDF
2017-04-28,融钰集团：独立董事关于公司2016年度有关事项及第三届董事会第十七次会议相关事项的独立意见,finalpage/2017-04-28/1203412557.PDF
2017-04-28,融钰集团：2016年度内部控制自我评价报告,finalpage/2017-04-28/1203412558.PDF
2017-04-28,融钰集团：截止2016年12月31日内部控制鉴证报告,finalpage/2017-04-28/1203412559.PDF
2017-04-28,融钰集团：2017年第一季度报告正文,finalpage/2017-04-28/1203412560.PDF
2017-04-28,融钰集团：2017年第一季度报告全文,finalpage/2017-04-28/1203412561.PDF
2017-04-28,融钰集团：独立董事2016年度述职报告（吴铁华）,finalpage/2017-04-28/1203412562.PDF
2017-04-28,融钰集团：2016年度财务决算报告,finalpage/2017-04-28/1203412563.PDF
2017-04-28,融钰集团：2016年度董事会工作报告,finalpage/2017-04-28/1203412564.PDF
2017-04-28,融钰集团：2016年度监事会工作报告,finalpage/2017-04-28/1203412565.PDF
2017-04-28,融钰集团：关于举行2016年度报告网上说明会的公告,finalpage/2017-04-28/1203412566.PDF
2017-04-28,融钰集团：广发证券股份有限公司关于公司2016年度募集资金存放与使用情况的专项核查意见,finalpage/2017-04-28/1203412567.PDF
2017-04-28,融钰集团：内部控制规则落实自查表,finalpage/2017-04-28/1203412568.PDF
2017-04-28,融钰集团：职工代表大会关于选举公司职工代表监事的决议公告,finalpage/2017-04-28/1203412569.PDF
2017-04-28,融钰集团：关于签署收购智容科技有限公司股权的股权收购协议之补充协议的公告,finalpage/2017-04-28/1203412570.PDF
2017-04-28,融钰集团：关于召开2016年度股东大会的通知,finalpage/2017-04-28/1203412571.PDF
2017-04-28,融钰集团：独立董事候选人声明（普峰）,finalpage/2017-04-28/1203412572.PDF
2017-04-28,融钰集团：独立董事候选人声明（于雷）,finalpage/2017-04-28/1203412573.PDF
2017-04-28,融钰集团：独立董事提名人声明（一）,finalpage/2017-04-28/1203412574.PDF
2017-04-28,融钰集团：独立董事提名人声明（二）,finalpage/2017-04-28/1203412575.PDF
2017-04-28,融钰集团：独立董事提名人声明（三）,finalpage/2017-04-28/1203412576.PDF
2017-04-28,融钰集团：独立董事候选人声明（韩光）,finalpage/2017-04-28/1203412577.PDF
2017-05-03,融钰集团：第三届董事会第二十五次临时会议决议公告,finalpage/2017-05-03/1203470207.PDF
2017-05-03,融钰集团：独立董事关于第三届董事会第二十五次临时会议相关事项的独立意见,finalpage/2017-05-03/1203470208.PDF
2017-05-03,融钰集团：关于向国投泰康信托有限公司申请信托贷款的公告,finalpage/2017-05-03/1203470209.PDF
2017-05-03,融钰集团：关于召开2017年第二次临时股东大会的通知,finalpage/2017-05-03/1203470210.PDF
2017-05-05,融钰集团：关于筹划重大资产重组的停牌公告,finalpage/2017-05-05/1203476193.PDF
2017-05-05,融钰集团：重组交易对手方关于不存在《关于加强与上市公司重大资产重组相关股票异常交易监管的暂行规定》第十三条情形的说明,finalpage/2017-05-05/1203476194.PDF
2017-05-09,融钰集团：关于控股孙公司完成工商登记的公告,finalpage/2017-05-09/1203486796.PDF
2017-05-12,融钰集团：关于筹划重大资产重组的停牌进展公告,finalpage/2017-05-12/1203504699.PDF
2017-05-16,融钰集团：关于上海辰商软件科技有限公司完成股权变更及过户的公告,finalpage/2017-05-16/1203519375.PDF
2017-05-19,融钰集团：关于筹划重大资产重组的停牌进展公告,finalpage/2017-05-19/1203537428.PDF
2017-05-19,融钰集团：2017年第二次临时股东大会的法律意见书,finalpage/2017-05-19/1203537429.PDF
2017-05-19,融钰集团：2017年第二次临时股东大会决议公告,finalpage/2017-05-19/1203537430.PDF
2017-05-20,融钰集团：关于筹划重组停牌期满申请继续停牌公告,finalpage/2017-05-20/1203543535.PDF
2017-05-24,融钰集团：关于收到中标通知书的公告,finalpage/2017-05-24/1203561704.PDF
2017-05-25,融钰集团：关于对深圳证券交易所2016年年报问询函回复的公告,finalpage/2017-05-25/1203566494.PDF
2017-05-25,融钰集团：深圳证券交易所关于对公司2016年年报问询函之回复,finalpage/2017-05-25/1203566495.PDF
2017-05-26,融钰集团：2016年度股东大会的法律意见书,finalpage/2017-05-26/1203568292.PDF
2017-05-26,融钰集团：2016年度股东大会决议公告,finalpage/2017-05-26/1203568293.PDF
2017-05-26,融钰集团：关于筹划重大资产重组的停牌进展公告,finalpage/2017-05-26/1203568294.PDF
2017-05-27,融钰集团：第四届董事会第一次会议决议公告,finalpage/2017-05-27/1203571308.PDF
2017-05-27,融钰集团：第四届监事会第一次会议决议公告,finalpage/2017-05-27/1203571309.PDF
2017-05-27,融钰集团：独立董事关于第四届董事会第一次会议相关事项的独立意见,finalpage/2017-05-27/1203571310.PDF
2017-05-27,融钰集团：关于拟发起设立汽车金融产业投资基金的公告,finalpage/2017-05-27/1203571311.PDF
2017-05-27,融钰集团：关于拟发起设立融钰网络小额贷款有限公司的公告,finalpage/2017-05-27/1203571312.PDF
2017-05-27,融钰集团：关于拟与海淘车、云飞扬共同成立合资公司的公告,finalpage/2017-05-27/1203571313.PDF
2017-05-27,融钰集团：关于召开2017年第三次临时股东大会的通知,finalpage/2017-05-27/1203571314.PDF
2017-06-06,融钰集团：关于筹划重大资产重组的停牌进展公告,finalpage/2017-06-06/1203589967.PDF
2017-06-09,融钰集团：关于对深圳证券交易所关注函回复的公告,finalpage/2017-06-09/1203601954.PDF
2017-06-13,融钰集团：关于重大资产重组停牌期间更换重组标的暨停牌进展公告,finalpage/2017-06-13/1203610595.PDF
2017-06-14,融钰集团：2017年第三次临时股东大会决议公告,finalpage/2017-06-14/1203613736.PDF
2017-06-14,融钰集团：2017年第三次临时股东大会的法律意见书,finalpage/2017-06-14/1203613737.PDF
2017-06-20,融钰集团：第四届董事会第一次临时会议决议公告,finalpage/2017-06-20/1203630815.PDF
2017-06-20,融钰集团：关于筹划重大资产重组停牌期满申请继续停牌暨停牌进展公告,finalpage/2017-06-20/1203630816.PDF
2017-06-20,融钰集团：关于向银行申请授信额度和申请银行贷款的公告,finalpage/2017-06-20/1203630817.PDF
2017-06-20,融钰集团：关于公司全资子公司融钰华通（天津）租赁有限公司对外担保的公告,finalpage/2017-06-20/1203630818.PDF
2017-06-20,融钰集团：关于续聘会计师事务所的公告,finalpage/2017-06-20/1203630819.PDF
2017-06-20,融钰集团：关于召开2017年第四次临时股东大会的通知,finalpage/2017-06-20/1203630820.PDF
2017-06-20,融钰集团：独立董事关于第四届董事会第一次临时会议相关事项的独立意见,finalpage/2017-06-20/1203630821.PDF
2017-06-24,融钰集团：关于募集资金专用账户销户的公告,finalpage/2017-06-24/1203643589.PDF
2017-06-27,融钰集团：关于筹划重大资产重组的停牌进展公告,finalpage/2017-06-27/1203648347.PDF
2017-06-28,融钰集团：关于宁波融钰博胜汽车销售服务有限公司设立完成并取得营业执照的公告,finalpage/2017-06-28/1203651025.PDF
2017-07-04,融钰集团：关于筹划重大资产重组的停牌进展公告,finalpage/2017-07-04/1203676872.PDF
2017-07-06,融钰集团：2017年第四次临时股东大会决议公告,finalpage/2017-07-06/1203684570.PDF
2017-07-06,融钰集团：2017年第四次临时股东大会的法律意见书,finalpage/2017-07-06/1203684571.PDF
2017-07-11,融钰集团：关于筹划重大资产重组的停牌进展公告,finalpage/2017-07-11/1203692678.PDF
2017-07-11,融钰集团：关于子公司参与设立的有限合伙企业完成工商登记并取得营业执照的公告,finalpage/2017-07-11/1203692679.PDF
2017-07-14,融钰集团：第四届董事会第二次临时会议决议公告,finalpage/2017-07-14/1203703930.PDF
2017-07-14,融钰集团：独立董事关于第四届董事会第二次临时会议相关事项的独立意见,finalpage/2017-07-14/1203703931.PDF
2017-07-14,融钰集团：关于集团公司办公地址变更的公告,finalpage/2017-07-14/1203703932.PDF
2017-07-14,融钰集团：关于与深圳国投供应链管理有限公司进行战略合作并由公司全资子公司融钰创新投资（深圳）有限公司向其增资参股的公告,finalpage/2017-07-14/1203703933.PDF
2017-07-15,融钰集团：2017年半年度业绩预告修正公告,finalpage/2017-07-15/1203706782.PDF
2017-07-18,融钰集团：关于披露重大资产购买的一般风险提示性公告,finalpage/2017-07-18/1203710218.PDF
2017-07-18,融钰集团：关于披露重大资产购买预案暨股票暂不复牌的公告,finalpage/2017-07-18/1203710219.PDF
2017-07-18,融钰集团：董事会关于公司股票价格波动是否达到《关于规范上市公司信息披露及相关各方行为的通知》第五条相关标准的说明,finalpage/2017-07-18/1203710220.PDF
2017-07-18,融钰集团：独立董事关于重大资产购买的独立意见,finalpage/2017-07-18/1203710221.PDF
2017-07-18,融钰集团：独立董事关于重大资产购买的事前认可意见,finalpage/2017-07-18/1203710222.PDF
2017-07-18,融钰集团：上市公司并购重组财务顾问专业意见附表第2号――重大资产重组,finalpage/2017-07-18/1203710223.PDF
2017-07-18,融钰集团：国金证券股份有限公司关于公司重大资产购买预案之独立财务顾问核查意见,finalpage/2017-07-18/1203710224.PDF
2017-07-18,融钰集团：第四届董事会第二次会议决议公告,finalpage/2017-07-18/1203710225.PDF
2017-07-18,融钰集团：第四届监事会第二次会议决议公告,finalpage/2017-07-18/1203710226.PDF
2017-07-18,融钰集团：中小板上市公司重大资产重组方案首次披露对照表,finalpage/2017-07-18/1203710227.PDF
2017-07-18,融钰集团：董事会关于重大资产购买履行法定程序的完备性、合规性及提交的法律文件的有效性的说明,finalpage/2017-07-18/1203710228.PDF
2017-07-18,融钰集团：重大资产购买预案,finalpage/2017-07-18/1203710229.PDF
2017-07-19,融钰集团：关于收到《承德市金融工作办公室关于同意融钰集团股份有限公司筹组设立互联网小额贷款公司的批复》的公告,finalpage/2017-07-19/1203715291.PDF
2017-07-21,融钰集团：关于承德融钰互联网小额贷款有限公司取得《企业名称预先核准通知书》的公告,finalpage/2017-07-21/1203721618.PDF
2017-07-25,融钰集团：关于筹划重大资产重组的停牌进展公告,finalpage/2017-07-25/1203728948.PDF
2017-08-01,融钰集团：关于筹划重大资产重组的停牌进展公告暨延期回复深圳证券交易所重组问询函的公告,finalpage/2017-08-01/1203745848.PDF
2017-08-04,融钰集团：关于筹划重大资产重组的停牌进展公告,finalpage/2017-08-04/1203759984.PDF
2017-08-11,融钰集团：关于筹划重大资产重组的停牌进展公告,finalpage/2017-08-11/1203784608.PDF
2017-08-18,融钰集团：关于筹划重大资产重组的停牌进展公告,finalpage/2017-08-18/1203807632.PDF
2017-08-18,融钰集团：关于全资子公司完成工商变更登记并取得新营业执照的公告,finalpage/2017-08-18/1203807633.PDF
2017-08-25,融钰集团：关于筹划重大资产重组的停牌进展公告,finalpage/2017-08-25/1203863440.PDF
2017-08-30,融钰集团：2017年半年度报告摘要,finalpage/2017-08-30/1203893992.PDF
2017-08-30,融钰集团：第四届董事会第三次会议决议公告,finalpage/2017-08-30/1203893993.PDF
2017-08-30,融钰集团：第四届监事会第三次会议决议公告,finalpage/2017-08-30/1203893994.PDF
2017-08-30,融钰集团：2017年上半年度募集资金存放与使用情况专项报告,finalpage/2017-08-30/1203893995.PDF
2017-08-30,融钰集团：关于会计政策变更的公告,finalpage/2017-08-30/1203893996.PDF
2017-08-30,融钰集团：2017年半年度报告,finalpage/2017-08-30/1203893997.PDF
2017-08-30,融钰集团：2017年半年度财务报告,finalpage/2017-08-30/1203893998.PDF
2017-08-30,融钰集团：独立董事关于第四届董事会第三次会议相关事项的独立意见,finalpage/2017-08-30/1203893999.PDF
2017-09-01,融钰集团：关于筹划重大资产重组的停牌进展公告,finalpage/2017-09-01/1203919874.PDF
2017-09-08,融钰集团：关于筹划重大资产重组的停牌进展公告,finalpage/2017-09-08/1203957791.PDF
2017-09-15,融钰集团：关于筹划重大资产重组的停牌进展公告,finalpage/2017-09-15/1203975331.PDF
2017-09-22,融钰集团：关于筹划重大资产重组的停牌进展公告,finalpage/2017-09-22/1203993987.PDF
2017-09-23,融钰集团：第四届董事会第四次会议决议公告,finalpage/2017-09-23/1203996207.PDF
2017-09-23,融钰集团：关于终止重大资产重组事项的公告,finalpage/2017-09-23/1203996208.PDF
2017-09-23,融钰集团：关于终止重大资产重组召开投资者说明会的提示性公告,finalpage/2017-09-23/1203996209.PDF
2017-09-23,融钰集团：独立董事关于第四届董事会第四次会议相关事项的独立意见,finalpage/2017-09-23/1203996210.PDF
2017-09-26,融钰集团：关于公司股票复牌的提示性公告,finalpage/2017-09-26/1203999239.PDF
2017-09-26,融钰集团：关于终止重大资产重组事项的投资者说明会召开情况的公告,finalpage/2017-09-26/1203999240.PDF
2017-09-27,融钰集团：国金证券股份有限公司关于公司终止重大资产重组事项之独立财务顾问核查意见,finalpage/2017-09-27/1204004968.PDF
2017-09-29,融钰集团：关于与北京碳世纪科技有限公司签署战略合作框架协议的公告,finalpage/2017-09-29/1204011827.PDF
2017-10-12,融钰集团：关于全资子公司智容科技有限公司收到中标通知书的公告,finalpage/2017-10-12/1204030265.PDF
2017-10-12,融钰集团：关于全资孙公司签署合同的公告,finalpage/2017-10-12/1204030266.PDF
2017-10-13,融钰集团：2017年前三季度业绩预告修正公告,finalpage/2017-10-13/1204033034.PDF
2017-10-27,融钰集团：关于收到《承德市人民政府关于同意设立承德融钰互联网小额贷款公司的批复》的公告,finalpage/2017-10-27/1204077484.PDF
2017-10-28,融钰集团：2017年第三季度报告全文,finalpage/2017-10-28/1204088539.PDF
2017-10-28,融钰集团：第四届董事会第五次会议决议公告,finalpage/2017-10-28/1204088540.PDF
2017-10-28,融钰集团：第四届监事会第四次会议决议公告,finalpage/2017-10-28/1204088541.PDF
2017-10-28,融钰集团：2017年第三季度报告正文,finalpage/2017-10-28/1204088542.PDF
2017-10-31,融钰集团：关于承德融钰互联网小额贷款有限公司设立完成并取得营业执照的公告,finalpage/2017-10-31/1204096964.PDF
2017-11-02,融钰集团：第四届董事会第三次临时会议决议公告,finalpage/2017-11-02/1204106593.PDF
2017-11-02,融钰集团：独立董事关于第四届董事会第三次临时会议相关事项的独立意见,finalpage/2017-11-02/1204106594.PDF
2017-11-02,融钰集团：北京陆陆捌科技有限公司2016年度、2017年1-9月财务报表及审计报告,finalpage/2017-11-02/1204106595.PDF
2017-11-02,融钰集团：关于收购北京陆陆捌科技有限公司100%股权暨签署股权转让协议的公告,finalpage/2017-11-02/1204106596.PDF
2017-11-11,融钰集团：第四届董事会第四次临时会议决议公告,finalpage/2017-11-11/1204132618.PDF
2017-11-11,融钰集团：独立董事关于第四届董事会第四次临时会议相关事项的独立意见,finalpage/2017-11-11/1204132619.PDF
2017-11-11,融钰集团：关于收购财龙基金管理有限公司部分股权暨签署股权转让协议的公告,finalpage/2017-11-11/1204132620.PDF
2017-12-05,融钰集团：第四届董事会第五次临时会议决议公告,finalpage/2017-12-05/1204192981.PDF
2017-12-05,融钰集团：关于向控股子公司增资的公告,finalpage/2017-12-05/1204192982.PDF
2017-12-05,融钰集团：独立董事关于第四届董事会第五次临时会议相关事项的独立意见,finalpage/2017-12-05/1204192983.PDF
2017-12-05,融钰集团：关于控股子公司变更注册资本并完成工商登记的公告,finalpage/2017-12-05/1204192984.PDF
2017-12-06,融钰集团：关于全资子公司完成工商变更登记并取得新营业执照的公告,finalpage/2017-12-06/1204194449.PDF
2017-12-06,融钰集团：重大事项停牌公告,finalpage/2017-12-06/1204195543.PDF
2017-12-13,融钰集团：重大事项停牌进展公告,finalpage/2017-12-13/1204216799.PDF
2017-12-15,融钰集团：关于大股东减持计划的预披露公告,finalpage/2017-12-15/1204222508.PDF
2017-12-19,融钰集团：第四届董事会第六次临时会议决议公告,finalpage/2017-12-19/1204236648.PDF
2017-12-19,融钰集团：关于收购中远恒信企业管理有限公司部分股权的公告,finalpage/2017-12-19/1204236649.PDF
2017-12-19,融钰集团：独立董事关于第四届董事会第六次临时会议相关事项的独立意见,finalpage/2017-12-19/1204236650.PDF
2017-12-19,融钰集团：拟进行股权收购所涉及的中远恒信企业管理有限公司股东全部权益价值资产评估报告,finalpage/2017-12-19/1204236651.PDF
2017-12-19,融钰集团：中远恒信企业管理有限公司审计报告,finalpage/2017-12-19/1204236652.PDF
2017-12-20,融钰集团：关于公司股票复牌的提示性公告,finalpage/2017-12-20/1204238901.PDF
2017-12-20,融钰集团：关于第一大股东拟变更的提示性公告,finalpage/2017-12-20/1204238904.PDF
2017-12-20,融钰集团：关于原第一大股东拟协议转让公司股份的提示性公告,finalpage/2017-12-20/1204238905.PDF
2017-12-20,融钰集团：关于第一大股东拟变更的提示性公告之补充公告,finalpage/2017-12-20/1204239503.PDF
2017-12-20,融钰集团：关于原第一大股东拟协议转让公司股份的提示性公告之补充公告,finalpage/2017-12-20/1204239504.PDF
2017-12-21,融钰集团：关于公司全资子公司吉林永大电气开关有限公司获得高新技术企业证书的公告,finalpage/2017-12-21/1204242159.PDF
2017-12-21,融钰集团：关于公司全资子公司吉林永大电气开关有限公司获得知识产权管理体系认证证书的公告,finalpage/2017-12-21/1204242160.PDF
2017-12-26,融钰集团：重大事项停牌公告,finalpage/2017-12-26/1204265585.PDF
2017-12-30,融钰集团：简式权益变动报告书（一）,finalpage/2017-12-30/1204289245.PDF
2017-12-30,融钰集团：简式权益变动报告书（二）,finalpage/2017-12-30/1204289246.PDF
2017-12-30,融钰集团：关于第一大股东签署股份转让协议的提示性公告（一）,finalpage/2017-12-30/1204289247.PDF
2017-12-30,融钰集团：关于第一大股东签署股份转让协议的提示性公告（二）,finalpage/2017-12-30/1204289248.PDF
2017-12-30,融钰集团：详式权益变动报告书,finalpage/2017-12-30/1204289249.PDF
2018-01-03,融钰集团：重大事项停牌进展公告,finalpage/2018-01-03/1204297681.PDF
2018-01-10,融钰集团：关于拟发起设立并购基金事项处于筹划阶段的提示性公告,finalpage/2018-01-10/1204317533.PDF
2018-01-10,融钰集团：重大事项停牌公告,finalpage/2018-01-10/1204317534.PDF
2018-01-16,融钰集团：天津金诺律师事务所关于公司实际控制人认定事宜的法律意见书,finalpage/2018-01-16/1204331570.PDF
2018-01-16,融钰集团：关于对深圳证券交易所问询函回复的公告,finalpage/2018-01-16/1204331571.PDF
2018-01-17,融钰集团：重大事项停牌进展公告,finalpage/2018-01-17/1204335869.PDF
2018-01-18,融钰集团：关于财龙基金管理有限公司完成股权变更及过户的公告,finalpage/2018-01-18/1204338122.PDF
2018-01-18,融钰集团：关于官方微信及官方微博正式开通的公告,finalpage/2018-01-18/1204339012.PDF
2018-01-19,融钰集团：关于对深圳证券交易所关注函回复的公告,finalpage/2018-01-19/1204343788.PDF
2018-01-23,融钰集团：第四届董事会第七次临时会议决议公告,finalpage/2018-01-23/1204353028.PDF
2018-01-23,融钰集团：独立董事关于第四届董事会第七次临时会议相关事项的独立意见,finalpage/2018-01-23/1204353029.PDF
2018-01-23,融钰集团：关于全资子公司拟申请银行贷款并由公司为其提供担保的公告,finalpage/2018-01-23/1204353030.PDF
