date,title,url
2017-09-14,京威股份：独立董事关于第四届董事会第十三次会议相关事项的独立意见,finalpage/2017-09-14/1203972215.PDF
2017-09-14,京威股份：公司章程（2017年9月）,finalpage/2017-09-14/1203972216.PDF
2017-09-14,京威股份：股东大会议事规则（2017年9月）,finalpage/2017-09-14/1203972217.PDF
2017-09-14,京威股份：董事会议事规则（2017年9月）,finalpage/2017-09-14/1203972218.PDF
2017-09-14,京威股份：监事会议事规则（2017年9月）,finalpage/2017-09-14/1203972219.PDF
2017-09-14,京威股份：独立董事制度（2017年9月）,finalpage/2017-09-14/1203972220.PDF
2017-09-14,京威股份：总经理工作细则（2017年9月）,finalpage/2017-09-14/1203972221.PDF
2017-09-14,京威股份：对外担保管理办法（2017年9月）,finalpage/2017-09-14/1203972222.PDF
2017-09-14,京威股份：关联交易管理办法（2017年9月）,finalpage/2017-09-14/1203972223.PDF
2017-09-14,京威股份：信息披露事务管理制度（2017年9月）,finalpage/2017-09-14/1203972224.PDF
2017-09-14,京威股份：重大信息内部报告制度（2017年9月）,finalpage/2017-09-14/1203972225.PDF
2017-09-14,京威股份：投资者关系管理制度（2017年9月）,finalpage/2017-09-14/1203972226.PDF
2017-09-14,京威股份：董事会审计委员会议事规则（2017年9月）,finalpage/2017-09-14/1203972227.PDF
2017-09-14,京威股份：董事会薪酬与考核委员会议事规则（2017年9月）,finalpage/2017-09-14/1203972228.PDF
2017-09-14,京威股份：募集资金管理办法（2017年9月）,finalpage/2017-09-14/1203972229.PDF
2017-09-14,京威股份：高级管理人员薪酬管理制度（2017年9月）,finalpage/2017-09-14/1203972230.PDF
2017-09-14,京威股份：内幕信息知情人登记备案制度（2017年9月）,finalpage/2017-09-14/1203972231.PDF
2017-09-14,京威股份：定期报告编制管理制度（2017年9月）,finalpage/2017-09-14/1203972232.PDF
2017-09-14,京威股份：年报信息披露重大差错责任追究制度（2017年9月）,finalpage/2017-09-14/1203972233.PDF
2017-09-14,京威股份：董事会秘书工作细则（2017年9月）,finalpage/2017-09-14/1203972234.PDF
2017-09-14,京威股份：对外投资管理制度（2017年9月）,finalpage/2017-09-14/1203972235.PDF
2017-09-14,京威股份：董事、监事和高级管理人员所持本公司股份及其变动管理制度（2017年9月）,finalpage/2017-09-14/1203972236.PDF
2017-09-14,京威股份：内部审计工作制度（2017年9月）,finalpage/2017-09-14/1203972237.PDF
2017-09-14,京威股份：关联方资金往来管理制度（2017年9月）,finalpage/2017-09-14/1203972238.PDF
2017-09-14,京威股份：特定对象接待和推广工作制度（2017年9月）,finalpage/2017-09-14/1203972239.PDF
2017-09-14,京威股份：第四届监事会第七次会议决议的公告,finalpage/2017-09-14/1203972240.PDF
2017-09-14,京威股份：第四届董事会第十三次会议决议公告,finalpage/2017-09-14/1203972241.PDF
2017-09-14,京威股份：2016年非公开发行A股股票募集资金运用的可行性分析报告,finalpage/2017-09-14/1203972242.PDF
2017-09-14,京威股份：2016年非公开发行A股股票摊薄即期回报对公司主要财务指标的影响及公司拟采取的措施、相关主体的承诺的公告,finalpage/2017-09-14/1203972243.PDF
2017-09-16,京威股份：关于延期回复《中国证监会行政许可项目审查一次反馈意见通知书》的公告,finalpage/2017-09-16/1203978421.PDF
2017-09-29,京威股份：独立董事关于第四届董事会第十四次会议相关事项的独立意见,finalpage/2017-09-29/1204012088.PDF
2017-09-29,京威股份：第四届董事会第十四次会议决议公告,finalpage/2017-09-29/1204012089.PDF
2017-09-29,京威股份：关于召开2017年第五次临时股东大会的通知公告,finalpage/2017-09-29/1204012090.PDF
2017-09-29,京威股份：关于与正道集团有限公司合资建设年产30万台清洁能源乘用车基地项目的公告,finalpage/2017-09-29/1204012091.PDF
2017-09-30,京威股份：2017年第四次临时股东大会的法律意见书,finalpage/2017-09-30/1204014499.PDF
2017-09-30,京威股份：2017年第四次临时股东大会决议公告,finalpage/2017-09-30/1204014500.PDF
2017-10-11,京威股份：股票交易异常波动公告,finalpage/2017-10-11/1204024515.PDF
2017-10-12,京威股份：关于在德国投资建设10万台高端电动汽车研发生产基地项目获得北京市商务委员会《对外投资批准证书》的公告,finalpage/2017-10-12/1204030303.PDF
2017-10-13,京威股份：关于股东股权质押的公告,finalpage/2017-10-13/1204033303.PDF
2017-10-17,京威股份：2017年第五次临时股东大会决议公告,finalpage/2017-10-17/1204045293.PDF
2017-10-17,京威股份：2017年第五次临时股东大会的法律意见书,finalpage/2017-10-17/1204045294.PDF
2017-10-20,京威股份：关于公司最近五年未被证券监管部门和证券交易所采取监管措施或处罚的公告,finalpage/2017-10-20/1204054286.PDF
2017-10-20,京威股份：非公开发行A股股票预案（修订稿）,finalpage/2017-10-20/1204054287.PDF
2017-10-20,京威股份：关于公司非公开发行股票申请文件反馈意见的回复,finalpage/2017-10-20/1204054288.PDF
2017-10-20,京威股份：关于非公开发行股票申请文件反馈回复的公告,finalpage/2017-10-20/1204054289.PDF
2017-10-20,京威股份：北京中环投资管理有限公司关于持有公司股票不存在减持计划的承诺函,finalpage/2017-10-20/1204054290.PDF
2017-10-24,京威股份：2017年第三季度报告全文,finalpage/2017-10-24/1204061131.PDF
2017-10-24,京威股份：2017年第三季度报告正文,finalpage/2017-10-24/1204061132.PDF
2017-11-08,京威股份：关于发行股份购买资产之限售股份上市流通的提示性公告,finalpage/2017-11-08/1204122501.PDF
2017-11-25,京威股份：关于股东股份质押的公告,finalpage/2017-11-25/1204165276.PDF
2017-12-07,京威股份：关于公司大股东无偿提供资金支持的公告,finalpage/2017-12-07/1204197388.PDF
2017-12-07,京威股份：关于股东股份质押及解除质押的公告,finalpage/2017-12-07/1204197389.PDF
2017-12-07,京威股份：当年累计新增借款超过上年末净资产的百分之二十公告,finalpage/2017-12-07/1204197407.PDF
2017-12-07,京威股份：公司债券“15京威债”本息兑付和摘牌公告,finalpage/2017-12-07/1204197408.PDF
2017-12-26,京威股份：关于股东部分股份质押的公告,finalpage/2017-12-26/1204253196.PDF
2017-12-30,京威股份：关于股东股份质押的公告,finalpage/2017-12-30/1204288970.PDF
2018-01-16,京威股份：公司债券发行预案公告,finalpage/2018-01-16/1204332105.PDF
2018-01-16,京威股份：关于召开2018年第一次临时股东大会的通知公告,finalpage/2018-01-16/1204332106.PDF
2018-01-16,京威股份：第四届董事会第十六次会议决议公告,finalpage/2018-01-16/1204332107.PDF
2018-01-20,京威股份：关于股东部分股份质押的公告,finalpage/2018-01-20/1204346984.PDF
2018-01-31,京威股份：2017年度业绩预告的修正公告,finalpage/2018-01-31/1204374912.PDF
2018-02-01,京威股份：2018年第一次临时股东大会决议公告,finalpage/2018-02-01/1204379454.PDF
2018-02-01,京威股份：关于筹划重大事项的停牌公告,finalpage/2018-02-01/1204379455.PDF
2018-02-01,京威股份：2018年第一次临时股东大会的法律意见书,finalpage/2018-02-01/1204379456.PDF
2018-02-01,京威股份：关于参股公司江苏卡威公司引进战略投资者的公告,finalpage/2018-02-01/1204379457.PDF
2018-02-06,京威股份：关于股东股份质押的公告,finalpage/2018-02-06/1204393238.PDF
2018-02-08,京威股份：第四届董事会第十七次会议决议公告,finalpage/2018-02-08/1204401148.PDF
2018-02-08,京威股份：关于召开2018年第二次临时股东大会的通知公告,finalpage/2018-02-08/1204401149.PDF
2018-02-08,京威股份：关于筹划重大事项停牌进展公告,finalpage/2018-02-08/1204401754.PDF
