date,title,url
2012-02-20,京威股份：第一届董事会2010年第六次会议决议,finalpage/2012-02-20/60560579.PDF
2012-02-20,京威股份：2010年第三次临时股东大会决议,finalpage/2012-02-20/60560580.PDF
2012-02-20,京威股份：2011年第三次临时股东大会决议,finalpage/2012-02-20/60560581.PDF
2012-02-20,京威股份：第二届董事会第四次会议决议,finalpage/2012-02-20/60560582.PDF
2012-02-20,京威股份：中国证监会关于核准公司首次公开发行股票的批复,finalpage/2012-02-20/60560583.PDF
2012-02-20,京威股份：审计报告（2011年度、2010年度、2009年度）,finalpage/2012-02-20/60560584.PDF
2012-02-20,京威股份：非经常性损益明细表鉴证报告（2011年度、2010年度、2009年度）,finalpage/2012-02-20/60560585.PDF
2012-02-20,京威股份：内部控制审计报告（2011年12月31日）,finalpage/2012-02-20/60560586.PDF
2012-02-20,京威股份：公司章程（草案）,finalpage/2012-02-20/60560587.PDF
2012-02-20,京威股份：北京市嘉源律师事务所关于公司首次公开发行股票并上市的律师工作报告,finalpage/2012-02-20/60560588.PDF
2012-02-20,京威股份：北京市嘉源律师事务所关于公司首次公开发行股票并上市的法律意见书,finalpage/2012-02-20/60560589.PDF
2012-02-20,京威股份：北京市嘉源律师事务所关于公司首次公开发行股票并上市的补充法律意见书（一）,finalpage/2012-02-20/60560590.PDF
2012-02-20,京威股份：北京市嘉源律师事务所关于公司首次公开发行股票并上市的补充法律意见书（三）,finalpage/2012-02-20/60560591.PDF
2012-02-20,京威股份：北京市嘉源律师事务所关于公司首次公开发行股票并上市的补充法律意见书（二）,finalpage/2012-02-20/60560592.PDF
2012-02-20,京威股份：北京市嘉源律师事务所关于公司首次公开发行股票并上市的补充法律意见书（五）,finalpage/2012-02-20/60560593.PDF
2012-02-20,京威股份：北京市嘉源律师事务所关于公司首次公开发行股票并上市的补充法律意见书（六）,finalpage/2012-02-20/60560594.PDF
2012-02-20,京威股份：北京市嘉源律师事务所关于公司首次公开发行股票并上市的补充法律意见书（四）,finalpage/2012-02-20/60560595.PDF
2012-02-20,京威股份：国信证券股份有限公司关于公司首次公开发行股票的发行保荐书,finalpage/2012-02-20/60560596.PDF
2012-02-20,京威股份：国信证券股份有限公司关于公司首次公开发行股票的发行保荐工作报告,finalpage/2012-02-20/60560597.PDF
2012-02-20,京威股份：首次公开发行股票招股意向书摘要,finalpage/2012-02-20/60560598.PDF
2012-02-20,京威股份：首次公开发行股票招股意向书,finalpage/2012-02-20/60560599.PDF
2012-02-20,京威股份：首次公开发行股票初步询价及推介公告,finalpage/2012-02-20/60560601.PDF
2012-02-27,京威股份：首次公开发行股票网上路演公告,finalpage/2012-02-27/60584527.PDF
2012-02-28,京威股份：首次公开发行股票发行公告,finalpage/2012-02-28/60593105.PDF
2012-02-28,京威股份：首次公开发行股票招股说明书,finalpage/2012-02-28/60593106.PDF
2012-02-28,京威股份：首次公开发行股票招股说明书摘要,finalpage/2012-02-28/60593107.PDF
2012-02-28,京威股份：首次公开发行股票投资风险特别公告,finalpage/2012-02-28/60593108.PDF
2012-03-02,京威股份：首次公开发行股票网上定价发行申购情况及中签率公告,finalpage/2012-03-02/60612208.PDF
2012-03-02,京威股份：首次公开发行股票网下摇号中签及配售结果公告,finalpage/2012-03-02/60612209.PDF
2012-03-05,京威股份：首次公开发行股票网上定价发行摇号中签结果公告,finalpage/2012-03-05/60617204.PDF
2012-03-08,京威股份：北京市嘉源律师事务所关于公司首次公开发行的股票上市之法律意见书,finalpage/2012-03-08/60640330.PDF
2012-03-08,京威股份：国信证券股份有限公司关于公司股票上市保荐书,finalpage/2012-03-08/60640331.PDF
2012-03-08,京威股份：首次公开发行股票上市公告书,finalpage/2012-03-08/60640332.PDF
2012-04-06,京威股份：第二届董事会第九次会议决议公告,finalpage/2012-04-06/60785987.PDF
2012-04-06,京威股份：关于对北京联合密封件有限公司增资的公告,finalpage/2012-04-06/60785989.PDF
2012-04-09,京威股份：募集资金三方监管协议的公告,finalpage/2012-04-09/60802994.PDF
2012-04-09,京威股份：内幕信息知情人登记备案制度（2012年4月）,finalpage/2012-04-09/60802995.PDF
2012-04-09,京威股份：定期报告编制管理制度（2012年4月）,finalpage/2012-04-09/60802996.PDF
2012-04-09,京威股份：年报信息披露重大差错责任追究制度（2012年4月）,finalpage/2012-04-09/60802997.PDF
2012-04-17,京威股份：2012年第一季度报告正文,finalpage/2012-04-17/60840117.PDF
2012-04-17,京威股份：2012年第一季度报告全文,finalpage/2012-04-17/60840120.PDF
2012-04-17,京威股份：第二届监事会第四次会议决议公告,finalpage/2012-04-17/60840121.PDF
2012-04-17,京威股份：第二届董事会第十次会议决议公告,finalpage/2012-04-17/60840122.PDF
2012-05-03,京威股份：关于监事辞职的公告,finalpage/2012-05-03/60948960.PDF
2012-05-07,京威股份：股权分布连续10个交易日不符合上市条件风险提示公告,finalpage/2012-05-07/60956702.PDF
2012-05-08,京威股份：股权分布连续10个交易日不符合上市条件风险提示公告,finalpage/2012-05-08/60965455.PDF
2012-05-09,京威股份：股权分布连续10个交易日不符合上市条件风险提示公告,finalpage/2012-05-09/60970616.PDF
2012-05-10,京威股份：股权分布连续10个交易日不符合上市条件风险提示公告,finalpage/2012-05-10/60976117.PDF
2012-05-11,京威股份：董事会公告,finalpage/2012-05-11/60981401.PDF
2012-05-15,京威股份：第二届监事会第五次会议决议的公告,finalpage/2012-05-15/60996382.PDF
2012-05-15,京威股份：第二届董事会第十一次会议决议公告,finalpage/2012-05-15/60996383.PDF
2012-05-15,京威股份：关于召开2012年第一次临时股东大会的通知,finalpage/2012-05-15/60996384.PDF
2012-05-16,京威股份：关于媒体报道的澄清公告,finalpage/2012-05-16/61006440.PDF
2012-05-19,京威股份：关于解决股权分布问题的重大进展公告,finalpage/2012-05-19/61019263.PDF
2012-05-31,京威股份：2012年第一次临时股东大会的法律意见书,finalpage/2012-05-31/61068772.PDF
2012-05-31,京威股份：2012年第一次临时股东大会决议公告,finalpage/2012-05-31/61068773.PDF
2012-05-31,京威股份：第二届监事会第六次会议决议的公告,finalpage/2012-05-31/61068774.PDF
2012-06-06,京威股份：关于网下配售限售股上市流通的提示性公告,finalpage/2012-06-06/61095746.PDF
2012-07-19,京威股份：第二届监事会第七次会议决议的公告,finalpage/2012-07-19/61290254.PDF
2012-07-19,京威股份：第二届董事会第十二次会议决议公告,finalpage/2012-07-19/61290255.PDF
2012-07-19,京威股份：关于以部分超募资金收购子公司少数股东权益的公告,finalpage/2012-07-19/61290256.PDF
2012-07-19,京威股份：关于以部分募集资金置换前期投入募投项目的自筹资金的公告,finalpage/2012-07-19/61290257.PDF
2012-07-19,京威股份：国信证券股份有限公司关于公司拟使用部分超募资金收购子公司少数股东权益事项及收购股权的关联交易事项的核查意见,finalpage/2012-07-19/61290258.PDF
2012-07-19,京威股份：国信证券股份有限公司关于公司拟以募集资金置换部分已预先投入募投项目的自筹资金事项的核查意见,finalpage/2012-07-19/61290259.PDF
2012-07-19,京威股份：独立董事对相关事项的独立意见,finalpage/2012-07-19/61290260.PDF
2012-07-21,京威股份：关于公司以自筹资金预先投入募集资金投资项目的鉴证报告,finalpage/2012-07-21/61303040.PDF
2012-08-15,京威股份：2012年半年度报告摘要,finalpage/2012-08-15/61422447.PDF
2012-08-15,京威股份：2012年半年度报告,finalpage/2012-08-15/61422448.PDF
2012-08-15,京威股份：2012年半年度审计报告,finalpage/2012-08-15/61422449.PDF
2012-08-15,京威股份：第二届董事会第十三次会议决议公告,finalpage/2012-08-15/61422450.PDF
2012-08-15,京威股份：第二届监事会第八次会议决议的公告,finalpage/2012-08-15/61422451.PDF
2012-08-15,京威股份：独立董事关于公司关联方资金占用和对外担保情况的专项说明和独立意见,finalpage/2012-08-15/61422452.PDF
2012-08-15,京威股份：关于召开2012年第二次临时股东大会的通知,finalpage/2012-08-15/61422453.PDF
2012-08-15,京威股份：关于以部分募集资金置换前期投入募投项目的自筹资金的公告,finalpage/2012-08-15/61422455.PDF
2012-08-15,京威股份：关于变更募投项目实施主体的的公告,finalpage/2012-08-15/61422456.PDF
2012-08-15,京威股份：关联方资金往来管理制度（2012年8月）,finalpage/2012-08-15/61422457.PDF
2012-08-15,京威股份：内部审计工作制度（2012年8月）,finalpage/2012-08-15/61422459.PDF
2012-08-15,京威股份：国信证券股份有限公司关于公司募集资金使用事项的核查意见,finalpage/2012-08-15/61422460.PDF
2012-08-15,京威股份：对外投资管理制度（2012年8月）,finalpage/2012-08-15/61422461.PDF
2012-08-15,京威股份：独立董事对相关事项的独立意见,finalpage/2012-08-15/61422462.PDF
2012-08-15,京威股份：董事、监事和高级管理人员所持本公司股份及其变动管理制度（2012年8月）,finalpage/2012-08-15/61422463.PDF
2012-08-15,京威股份：董事会秘书工作细则（2012年8月）,finalpage/2012-08-15/61422464.PDF
2012-08-31,京威股份：2012年第二次临时股东大会的法律意见书,finalpage/2012-08-31/61511683.PDF
2012-08-31,京威股份：2012年第二次临时股东大会决议公告,finalpage/2012-08-31/61511684.PDF
2012-09-04,京威股份：关于完成工商变更登记的公告,finalpage/2012-09-04/61526237.PDF
2012-09-13,京威股份：2012年半年度权益分派实施公告,finalpage/2012-09-13/61563946.PDF
2012-10-20,京威股份：2012年第三季度报告正文,finalpage/2012-10-20/61678279.PDF
2012-10-20,京威股份：2012年第三季度报告全文,finalpage/2012-10-20/61678280.PDF
2012-10-30,京威股份：关于公司及相关主体承诺履行情况的公告,finalpage/2012-10-30/61730821.PDF
2012-12-12,京威股份：关于设立募集资金专项账户并签订募集资金三方监管协议的公告,finalpage/2012-12-12/61897850.PDF
2013-01-04,京威股份：关于四家子公司完成工商变更登记的公告,finalpage/2013-01-04/61975239.PDF
2013-01-24,京威股份：关于完成工商变更登记的公告,finalpage/2013-01-24/62060282.PDF
2013-02-26,京威股份：2012年度业绩快报,finalpage/2013-02-26/62150988.PDF
2013-03-29,京威股份：2012年度财务决算报告,finalpage/2013-03-29/62296226.PDF
2013-03-29,京威股份：2012年年度报告摘要,finalpage/2013-03-29/62296227.PDF
2013-03-29,京威股份：2012年年度报告,finalpage/2013-03-29/62296228.PDF
2013-03-29,京威股份：2012年年度审计报告,finalpage/2013-03-29/62296229.PDF
2013-03-29,京威股份：第二届董事会第十五次会议决议公告,finalpage/2013-03-29/62296230.PDF
2013-03-29,京威股份：关于召开2012年度股东大会的通知,finalpage/2013-03-29/62296231.PDF
2013-03-29,京威股份：第二届监事会第十次会议决议的公告,finalpage/2013-03-29/62296232.PDF
2013-03-29,京威股份：关于公司2012年度控股股东及其他关联方资金占用情况的专项说明,finalpage/2013-03-29/62296233.PDF
2013-03-29,京威股份：2012年度内部控制自我评价报告,finalpage/2013-03-29/62296234.PDF
2013-03-29,京威股份：关于2012年度募集资金存放与使用情况的专项报告,finalpage/2013-03-29/62296235.PDF
2013-03-29,京威股份：募集资金年度存放与使用情况鉴证报告,finalpage/2013-03-29/62296236.PDF
2013-03-29,京威股份：独立董事对相关事项发表的独立意见,finalpage/2013-03-29/62296237.PDF
2013-03-29,京威股份：2012年度独立董事述职报告,finalpage/2013-03-29/62296238.PDF
2013-03-29,京威股份：2013年度日常关联交易预测公告,finalpage/2013-03-29/62296239.PDF
2013-03-29,京威股份：关于举行2012年年度报告网上说明会的通知,finalpage/2013-03-29/62296240.PDF
2013-03-29,京威股份：内部控制规则落实自查表,finalpage/2013-03-29/62296241.PDF
2013-03-29,京威股份：国信证券股份有限公司关于公司2012年度内部控制自我评价报告的核查意见,finalpage/2013-03-29/62296242.PDF
2013-03-29,京威股份：国信证券股份有限公司关于公司《内部控制规则落实自查表》的核查意见,finalpage/2013-03-29/62296243.PDF
2013-03-29,京威股份：国信证券股份有限公司关于公司2012年度募集资金存放与使用专项核查报告,finalpage/2013-03-29/62296245.PDF
2013-03-29,京威股份：国信证券股份有限公司关于公司2013年度关联交易预计的核查意见,finalpage/2013-03-29/62296246.PDF
2013-03-29,京威股份：董事会审计委员会年度报告工作规程（2013年3月）,finalpage/2013-03-29/62296247.PDF
2013-04-09,京威股份：关于2012年度股东大会增加临时提案并开通网络投票补充通知的更正公告,finalpage/2013-04-09/62338655.PDF
2013-04-09,京威股份：北京中环投资管理有限公司拟转让5#、7#生产厂房等房地产项目资产评估报告书,finalpage/2013-04-09/62335925.PDF
2013-04-09,京威股份：北京中环投资管理有限公司拟转让部分生产厂房等房地产项目资产评估报告书,finalpage/2013-04-09/62335926.PDF
2013-04-09,京威股份：国信证券股份有限公司关于公司超募资金使用及关联交易事项的核查意见,finalpage/2013-04-09/62335927.PDF
2013-04-09,京威股份：第二届董事会第十六次会议决议公告,finalpage/2013-04-09/62335928.PDF
2013-04-09,京威股份：关联交易公告,finalpage/2013-04-09/62335929.PDF
2013-04-09,京威股份：关于2012年度股东大会增加临时提案并开通网络投票的补充通知,finalpage/2013-04-09/62335930.PDF
2013-04-09,京威股份：独立董事事前认可意见,finalpage/2013-04-09/62335931.PDF
2013-04-09,京威股份：独立董事对关联交易事项的独立意见,finalpage/2013-04-09/62335932.PDF
2013-04-09,京威股份：拟收购无形资产-花纹铝板生产技术项目资产评估报告书,finalpage/2013-04-09/62335933.PDF
2013-04-20,京威股份：2013年第一季度报告正文,finalpage/2013-04-20/62389408.PDF
2013-04-20,京威股份：2013年第一季度报告全文,finalpage/2013-04-20/62389409.PDF
2013-04-23,京威股份：2012年度股东大会的法律意见书,finalpage/2013-04-23/62405895.PDF
2013-04-23,京威股份：2012年度股东大会决议公告,finalpage/2013-04-23/62405896.PDF
2013-05-14,京威股份：投资者交流会公告,finalpage/2013-05-14/62487215.PDF
2013-06-06,京威股份：2012年年度权益分派实施公告,finalpage/2013-06-06/62562584.PDF
2013-06-15,京威股份：第二届董事会第十八次会议决议公告,finalpage/2013-06-15/62583457.PDF
2013-06-15,京威股份：独立董事关于德国威卡威公司违反承诺在中国境内销售汽车零部件的独立意见,finalpage/2013-06-15/62583458.PDF
2013-07-13,京威股份：2013年半年度业绩预告修正公告,finalpage/2013-07-13/62830267.PDF
2013-08-21,京威股份：2013年半年度报告摘要,finalpage/2013-08-21/62969738.PDF
2013-08-21,京威股份：2013年半年度报告,finalpage/2013-08-21/62969757.PDF
2013-08-21,京威股份：2013半年度财务报告,finalpage/2013-08-21/62969761.PDF
2013-08-21,京威股份：第二届董事会第十九次会议决议公告,finalpage/2013-08-21/62969762.PDF
2013-08-21,京威股份：第二届监事会第十二次会议决议的公告,finalpage/2013-08-21/62969763.PDF
2013-08-21,京威股份：独立董事关于公司关联方资金占用和对外担保情况的专项说明和独立意见,finalpage/2013-08-21/62969764.PDF
2013-08-21,京威股份：关于合营公司完成工商变更登记的公告,finalpage/2013-08-21/62969765.PDF
2013-08-21,京威股份：董事会关于募集资金2013年半年度存放与使用情况的专项报告,finalpage/2013-08-21/62969766.PDF
2013-08-31,京威股份：关于股东德国威卡威集团公司违反市场划分协议及避免同业竞争承诺事件的进展情况的提示性公,finalpage/2013-08-31/63029722.PDF
2013-09-24,京威股份：第二届董事会第二十次会议决议公告,finalpage/2013-09-24/63104449.PDF
2013-09-24,京威股份：拟收购北京威卡威密封件有限公司股权项目资产评估报告,finalpage/2013-09-24/63104450.PDF
2013-10-12,京威股份：关于北京威卡威密封件有限公司完成工商变更登记的提示性公告,finalpage/2013-10-12/63147533.PDF
2013-10-16,京威股份：关于董事辞职的公告,finalpage/2013-10-16/63159289.PDF
2013-10-19,京威股份：关于子公司完成工商变更登记的公告,finalpage/2013-10-19/63169008.PDF
2013-10-23,京威股份：2013年第三季度报告正文,finalpage/2013-10-23/63181395.PDF
2013-10-23,京威股份：2013年第三季度报告全文,finalpage/2013-10-23/63181396.PDF
2013-10-30,京威股份：第二届董事会第二十二次会议决议公告,finalpage/2013-10-30/63213660.PDF
2013-10-30,京威股份：独立董事对相关事项发表的独立意见,finalpage/2013-10-30/63213661.PDF
2013-11-27,京威股份：第二届董事会第二十三次会议决议公告,finalpage/2013-11-27/63306940.PDF
2013-11-27,京威股份：关于注销下属子公司的公告,finalpage/2013-11-27/63306941.PDF
2013-11-27,京威股份：关于子公司完成工商变更登记的公告,finalpage/2013-11-27/63306942.PDF
2013-12-21,京威股份：第二届监事会第十四次会议决议公告,finalpage/2013-12-21/63398254.PDF
2013-12-21,京威股份：第二届董事会第二十四次会议决议公告,finalpage/2013-12-21/63398255.PDF
2013-12-21,京威股份：关于召开2014年第一次临时股东大会的通知,finalpage/2013-12-21/63398256.PDF
2013-12-21,京威股份：关于选举职工代表监事的公告,finalpage/2013-12-21/63398257.PDF
2013-12-21,京威股份：独立董事候选人声明（戴华）,finalpage/2013-12-21/63398260.PDF
2013-12-21,京威股份：独立董事候选人声明（金锦萍）,finalpage/2013-12-21/63398261.PDF
2013-12-21,京威股份：独立董事候选人声明（马朝松）,finalpage/2013-12-21/63398262.PDF
2013-12-21,京威股份：独立董事提名人声明（三）,finalpage/2013-12-21/63398263.PDF
2013-12-21,京威股份：独立董事提名人声明（二）,finalpage/2013-12-21/63398264.PDF
2013-12-21,京威股份：独立董事提名人声明（一）,finalpage/2013-12-21/63398265.PDF
2013-12-21,京威股份：独立董事关于相关事项的独立意见,finalpage/2013-12-21/63398266.PDF
2014-01-11,京威股份：2014年第一次临时股东大会的法律意见书,finalpage/2014-01-11/63474335.PDF
2014-01-11,京威股份：2014年第一次临时股东大会决议公告,finalpage/2014-01-11/63474339.PDF
2014-01-13,京威股份：第三届监事会第一次会议决议的公告,finalpage/2014-01-13/63480278.PDF
2014-01-13,京威股份：独立董事关于相关事项的独立意见,finalpage/2014-01-13/63480279.PDF
2014-01-13,京威股份：第三届董事会第一次会议决议公告,finalpage/2014-01-13/63480280.PDF
2014-02-14,京威股份：关于公司及相关主体承诺履行情况的公告,finalpage/2014-02-14/63568775.PDF
2014-02-19,京威股份：关于重大事项停牌公告,finalpage/2014-02-19/63585721.PDF
2014-02-26,京威股份：重大事项继续停牌公告,finalpage/2014-02-26/63607074.PDF
2014-02-27,京威股份：2013年度业绩快报,finalpage/2014-02-27/63613063.PDF
2014-03-05,京威股份：重大事项继续停牌公告,finalpage/2014-03-05/63636046.PDF
2014-03-12,京威股份：第三届董事会第二次会议决议公告,finalpage/2014-03-12/63666869.PDF
2014-03-12,京威股份：重大事项继续停牌公告,finalpage/2014-03-12/63664636.PDF
2014-03-19,京威股份：关于筹划重大资产重组的停牌公告,finalpage/2014-03-19/63692355.PDF
2014-03-25,京威股份：第三届董事会第三次会议决议公告,finalpage/2014-03-25/63716470.PDF
2014-03-26,京威股份：重大资产重组进展公告,finalpage/2014-03-26/63723402.PDF
2014-03-27,京威股份：2013年年度报告摘要,finalpage/2014-03-27/63732311.PDF
2014-03-27,京威股份：2013年年度报告,finalpage/2014-03-27/63732314.PDF
2014-03-27,京威股份：2013年年度审计报告,finalpage/2014-03-27/63732316.PDF
2014-03-27,京威股份：第三届董事会第四次会议决议公告,finalpage/2014-03-27/63732317.PDF
2014-03-27,京威股份：关于召开2013年度股东大会的通知,finalpage/2014-03-27/63732318.PDF
2014-03-27,京威股份：第三届监事会第二次会议决议的公告,finalpage/2014-03-27/63732319.PDF
2014-03-27,京威股份：2013年度控股股东及其他关联方资金占用情况的专项说明,finalpage/2014-03-27/63732320.PDF
2014-03-27,京威股份：2013年度内部控制自我评价报告,finalpage/2014-03-27/63732321.PDF
2014-03-27,京威股份：内部控制审计报告,finalpage/2014-03-27/63732322.PDF
2014-03-27,京威股份：董事会关于募集资金2013年度存放与使用情况的专项报告,finalpage/2014-03-27/63732323.PDF
2014-03-27,京威股份：2013年度募集资金年度存放与使用情况鉴证报告,finalpage/2014-03-27/63732324.PDF
2014-03-27,京威股份：独立董事对第三届董事会第四次会议相关事项的独立意见,finalpage/2014-03-27/63732325.PDF
2014-03-27,京威股份：2013年度独立董事述职报告,finalpage/2014-03-27/63732326.PDF
2014-03-27,京威股份：关于举行2013年年度报告网上说明会的通知,finalpage/2014-03-27/63732327.PDF
2014-03-27,京威股份：2014年度日常关联交易预测公告,finalpage/2014-03-27/63732328.PDF
2014-03-27,京威股份：内部控制规则落实自查表,finalpage/2014-03-27/63732329.PDF
2014-03-27,京威股份：国信证券股份有限公司关于公司2013年度内部控制自我评价报告的核查意见,finalpage/2014-03-27/63732330.PDF
2014-03-27,京威股份：国信证券股份有限公司关于公司《内部控制规则落实自查表》的核查意见,finalpage/2014-03-27/63732331.PDF
2014-03-27,京威股份：国信证券股份有限公司关于公司2014年度关联交易预计的核查意见,finalpage/2014-03-27/63732332.PDF
2014-03-27,京威股份：国信证券股份有限公司关于公司2013年度募集资金存放与使用专项核查报告,finalpage/2014-03-27/63732333.PDF
2014-03-27,京威股份：独立董事对相关事项的事前认可意见,finalpage/2014-03-27/63732334.PDF
2014-04-02,京威股份：重大资产重组进展公告,finalpage/2014-04-02/63772295.PDF
2014-04-09,京威股份：重大资产重组进展公告,finalpage/2014-04-09/63806558.PDF
2014-04-15,京威股份：关于重大资产重组延期复牌的公告,finalpage/2014-04-15/63840556.PDF
2014-04-22,京威股份：重大资产重组进展公告,finalpage/2014-04-22/63887295.PDF
2014-04-25,京威股份：2014年第一季度报告正文,finalpage/2014-04-25/63911560.PDF
2014-04-25,京威股份：2014年第一季度报告全文,finalpage/2014-04-25/63916043.PDF
2014-04-26,京威股份：2013年度股东大会的法律意见书,finalpage/2014-04-26/63926230.PDF
2014-04-26,京威股份：2013年度股东大会决议公告,finalpage/2014-04-26/63926231.PDF
2014-04-29,京威股份：重大资产重组进展公告,finalpage/2014-04-29/63940153.PDF
2014-05-08,京威股份：重大资产重组进展公告,finalpage/2014-05-08/63997046.PDF
2014-05-14,京威股份：发行股份及支付现金购买资产报告书（草案）,finalpage/2014-05-14/64023071.PDF
2014-05-14,京威股份：独立董事关于相关事项的独立意见,finalpage/2014-05-14/64023072.PDF
2014-05-14,京威股份：国信证券股份有限公司关于公司本次交易产业政策和交易类型之独立财务顾问核查意见,finalpage/2014-05-14/64023073.PDF
2014-05-14,京威股份：国信证券股份有限公司关于公司发行股份及支付现金购买资产之独立财务顾问报告,finalpage/2014-05-14/64023074.PDF
2014-05-14,京威股份：拟发行股份及支付现金购买资产项目涉及之宁波福尔达智能科技股份有限公司资产评估报告,finalpage/2014-05-14/64023075.PDF
2014-05-14,京威股份：第三届董事会第六次会议决议公告,finalpage/2014-05-14/64023076.PDF
2014-05-14,京威股份：拟发行股份及支付现金购买资产项目涉及之秦皇岛威卡威汽车零部件有限公司资产评估报告,finalpage/2014-05-14/64023077.PDF
2014-05-14,京威股份：宁波福尔达智能科技股份有限公司2013年度、2012年度审计报告,finalpage/2014-05-14/64023078.PDF
2014-05-14,京威股份：秦皇岛威卡威汽车零部件有限公司2013年度、2012年度审计报告,finalpage/2014-05-14/64023079.PDF
2014-05-14,京威股份：2013年度备考审计报告,finalpage/2014-05-14/64023080.PDF
2014-05-14,京威股份：2014年度备考盈利预测审核报告,finalpage/2014-05-14/64023081.PDF
