,date,title,url
205,2013-05-04,金安国纪：关于使用银行承兑汇票支付募投项目资金的公告,finalpage/2013-05-04/62456021.PDF
206,2013-05-04,金安国纪：华泰联合证券有限责任公司关于公司关于使用部分闲置募集资金、超募资金和自有资金购买银行理财产品的保荐意见,finalpage/2013-05-04/62456022.PDF
207,2013-05-04,金安国纪：华泰联合证券有限责任公司关于公司使用银行承兑汇票支付募投项目资金的保荐意见,finalpage/2013-05-04/62456023.PDF
208,2013-05-04,金安国纪：关于第二届董事会第二十四次会议相关事项的独立董事意见,finalpage/2013-05-04/62456024.PDF
209,2013-05-07,金安国纪：关于使用闲置募集资金购买银行理财产品的公告,finalpage/2013-05-07/62464999.PDF
210,2013-05-10,金安国纪：关于全资子公司竞拍取得土地使用权的公告,finalpage/2013-05-10/62475454.PDF
211,2013-05-11,金安国纪：2012年度股东大会决议公告,finalpage/2013-05-11/62479877.PDF
212,2013-05-11,金安国纪：2012年年度股东大会的法律意见,finalpage/2013-05-11/62479878.PDF
213,2013-06-15,金安国纪：第二届董事会第二十五次会议决议公告,finalpage/2013-06-15/62582701.PDF
214,2013-06-15,金安国纪：关于为全资子公司安徽金瑞提供担保的公告,finalpage/2013-06-15/62582702.PDF
215,2013-06-15,金安国纪：关于第二届董事会第二十五次会议相关事项的独立董事意见,finalpage/2013-06-15/62582703.PDF
216,2013-06-15,"金安国纪：关于对全资子公司杭州国纪“年产1,020万张中高等级覆铜板和出售半固化片600万米项目”追加投资的公告",finalpage/2013-06-15/62582704.PDF
217,2013-06-29,金安国纪：关于使用闲置募集资金和自有资金购买银行理财产品的公告,finalpage/2013-06-29/62624987.PDF
218,2013-07-19,金安国纪：第二届董事会第二十六次会议决议公告,finalpage/2013-07-19/62850135.PDF
219,2013-07-19,金安国纪：关于使用闲置自有资金购买银行理财产品的公告,finalpage/2013-07-19/62850137.PDF
220,2013-07-19,金安国纪：关于控股子公司珠海国纪购买土地使用权事项的独立董事意见,finalpage/2013-07-19/62850138.PDF
221,2013-07-19,金安国纪：关于控股子公司珠海国纪购买土地使用权的公告,finalpage/2013-07-19/62850139.PDF
222,2013-07-25,金安国纪：关于使用闲置自有资金购买银行理财产品的公告,finalpage/2013-07-25/62867200.PDF
223,2013-08-02,金安国纪：第二届董事会第二十七次会议决议公告,finalpage/2013-08-02/62894026.PDF
224,2013-08-02,金安国纪：关于为控股子公司珠海国纪提供担保的公告,finalpage/2013-08-02/62894027.PDF
225,2013-08-02,金安国纪：关于为控股子公司珠海国纪提供担保的独立董事意见,finalpage/2013-08-02/62894028.PDF
226,2013-08-06,金安国纪：关于使用闲置募集资金和自有资金购买银行理财产品的公告,finalpage/2013-08-06/62907984.PDF
227,2013-08-07,金安国纪：关于签署收购东方金德股权意向协议的公告,finalpage/2013-08-07/62913442.PDF
228,2013-08-10,金安国纪：第二届董事会第二十八次会议决议公告,finalpage/2013-08-10/62923597.PDF
229,2013-08-10,金安国纪：第二届监事会第二十次会议决议公告,finalpage/2013-08-10/62923598.PDF
230,2013-08-10,金安国纪：关于使用部分超募资金投入临安在建项目的公告,finalpage/2013-08-10/62923599.PDF
231,2013-08-10,金安国纪：关于设立BVI公司的公告,finalpage/2013-08-10/62923600.PDF
232,2013-08-10,金安国纪：华泰联合证券有限责任公司对公司使用剩余超募资金投入在建项目的专项意见,finalpage/2013-08-10/62923601.PDF
233,2013-08-10,金安国纪：关于第二届董事会第二十八次会议相关事项的独立董事意见,finalpage/2013-08-10/62923602.PDF
234,2013-08-21,金安国纪：董事会关于2013年半年度募集资金存放与使用情况的专项报告,finalpage/2013-08-21/62969556.PDF
235,2013-08-21,金安国纪：2013年半年度报告摘要,finalpage/2013-08-21/62969558.PDF
236,2013-08-21,金安国纪：2013年半年度报告,finalpage/2013-08-21/62969675.PDF
237,2013-08-21,金安国纪：2013半年度财务会计报告,finalpage/2013-08-21/62969676.PDF
238,2013-08-21,金安国纪：第二届董事会第二十九次会议决议公告,finalpage/2013-08-21/62969677.PDF
239,2013-08-21,金安国纪：第二届监事会第二十一次会议决议公告,finalpage/2013-08-21/62969678.PDF
240,2013-08-21,金安国纪：独立董事关于公司第二届董事会第二十九次会议相关事项的独立意见,finalpage/2013-08-21/62969679.PDF
241,2013-08-28,金安国纪：关于使用自有资金购买银行理财产品的公告,finalpage/2013-08-28/63006145.PDF
242,2013-09-03,金安国纪：关于使用自有资金购买银行理财产品的公告,finalpage/2013-09-03/63039224.PDF
243,2013-09-03,金安国纪：关于全资子公司签订募集资金三方监管协议的公告,finalpage/2013-09-03/63039225.PDF
244,2013-09-26,金安国纪：关于使用自有资金购买银行理财产品的公告,finalpage/2013-09-26/63111426.PDF
245,2013-10-08,金安国纪：第二届董事会第三十次会议决议公告,finalpage/2013-10-08/63126679.PDF
246,2013-10-08,金安国纪：关于全资子公司杭州国纪申请银行授信及公司为其提供担保的公告,finalpage/2013-10-08/63126680.PDF
247,2013-10-08,金安国纪：关于对全资子公司金安国际控股有限公司追加投资的公告,finalpage/2013-10-08/63126681.PDF
248,2013-10-08,金安国纪：关于收购东方金德投资有限公司股份的公告,finalpage/2013-10-08/63126682.PDF
249,2013-10-08,金安国纪：关于第二届董事会第三十次会议相关事项的独立董事意见,finalpage/2013-10-08/63126683.PDF
250,2013-10-19,金安国纪：关于使用自有资金购买银行理财产品的公告,finalpage/2013-10-19/63168692.PDF
251,2013-10-23,金安国纪：2013年第三季度报告正文,finalpage/2013-10-23/63180439.PDF
252,2013-10-23,金安国纪：2013年第三季度报告全文,finalpage/2013-10-23/63180440.PDF
253,2013-11-16,金安国纪：关于使用自有资金购买银行理财产品的公告,finalpage/2013-11-16/63272045.PDF
254,2013-11-26,金安国纪：关于收购东方金德投资有限公司股份的进展公告,finalpage/2013-11-26/63303138.PDF
255,2013-11-28,金安国纪：第二届董事会第三十二次会议决议公告,finalpage/2013-11-28/63309875.PDF
256,2013-11-28,金安国纪：关于向全资子公司金安国纪科技（杭州）有限公司增加注册资本的公告,finalpage/2013-11-28/63309876.PDF
257,2013-12-13,金安国纪：关于使用自有资金购买银行理财产品的公告,finalpage/2013-12-13/63372294.PDF
258,2013-12-13,金安国纪：关于公司监事提出辞职申请的公告,finalpage/2013-12-13/63372295.PDF
259,2013-12-14,金安国纪：关于召开2014年第一次临时股东大会通知的公告,finalpage/2013-12-14/63376301.PDF
260,2013-12-14,金安国纪：第二届董事会第三十三次会议决议公告,finalpage/2013-12-14/63376302.PDF
261,2013-12-14,金安国纪：第二届监事会第二十三次会议决议公告,finalpage/2013-12-14/63376303.PDF
262,2013-12-14,金安国纪：华泰联合证券有限责任公司对公司终止部分募投项目并变更部分募集资金投向的专项意见,finalpage/2013-12-14/63376304.PDF
263,2013-12-14,金安国纪：关于终止部分募投项目，变更部分募集资金投向的公告,finalpage/2013-12-14/63376305.PDF
264,2013-12-14,金安国纪：关于终止部分募投项目，变更部分募集资金投向事项的独立董事意见,finalpage/2013-12-14/63376306.PDF
265,2013-12-25,金安国纪：关于使用闲置自有资金购买银行理财产品的公告,finalpage/2013-12-25/63409238.PDF
266,2013-12-25,金安国纪：关于会计师事务所名称变更的公告,finalpage/2013-12-25/63409239.PDF
267,2013-12-25,"金安国纪：关于年产4,800万米电子级玻纤布项目的进展情况公告",finalpage/2013-12-25/63409240.PDF
268,2013-12-28,金安国纪：关于公司控股股东及一致行动人完成增持公司股份的公告,finalpage/2013-12-28/63424750.PDF
269,2013-12-28,金安国纪：关于上海东临实业有限公司及韩涛增持公司股份专项核查的法律意见,finalpage/2013-12-28/63424751.PDF
270,2013-12-31,金安国纪：关于使用闲置募集资金购买银行理财产品的公告,finalpage/2013-12-31/63433283.PDF
271,2013-12-31,金安国纪：关于东方金德股权收购完成的公告,finalpage/2013-12-31/63433284.PDF
272,2014-01-04,金安国纪：关于使用闲置募集资金购买银行理财产品的公告,finalpage/2014-01-04/63450285.PDF
273,2014-01-09,金安国纪：2014年第一次临时股东大会决议公告,finalpage/2014-01-09/63467232.PDF
274,2014-01-09,金安国纪：2014年第一次临时股东大会法律意见,finalpage/2014-01-09/63467233.PDF
275,2014-01-10,金安国纪：关于监事会成员变更的公告,finalpage/2014-01-10/63469989.PDF
276,2014-01-25,金安国纪：关于使用自有资金购买银行理财产品的公告,finalpage/2014-01-25/63522876.PDF
277,2014-02-15,金安国纪：关于公司及相关主体承诺履行情况的公告,finalpage/2014-02-15/63573390.PDF
278,2014-02-20,金安国纪：关于使用闲置募集资金购买银行理财产品的公告,finalpage/2014-02-20/63587955.PDF
279,2014-02-27,金安国纪：2013年度业绩快报,finalpage/2014-02-27/63610235.PDF
280,2014-02-28,金安国纪：关于使用自有资金购买银行理财产品的公告,finalpage/2014-02-28/63614837.PDF
281,2014-03-05,金安国纪：第二届董事会第三十四次会议决议公告,finalpage/2014-03-05/63636040.PDF
282,2014-03-05,金安国纪：第二届监事会第二十四次会议决议公告,finalpage/2014-03-05/63636041.PDF
283,2014-03-05,金安国纪：关于使用闲置募集资金购买银行理财产品的公告,finalpage/2014-03-05/63636042.PDF
284,2014-03-05,金安国纪：关于公司及子公司核销坏账的公告,finalpage/2014-03-05/63636043.PDF
285,2014-03-05,金安国纪：关于核销坏账事项的独立董事意见,finalpage/2014-03-05/63636044.PDF
286,2014-03-29,金安国纪：关于使用闲置募集资金和自有资金购买银行理财产品的公告,finalpage/2014-03-29/63748070.PDF
287,2014-03-29,"金安国纪：关于年产4,800万米电子级玻纤布项目的进展情况公告",finalpage/2014-03-29/63748071.PDF
288,2014-03-29,金安国纪：关于延期换届选举的提示性公告,finalpage/2014-03-29/63748073.PDF
289,2014-04-02,金安国纪：关于使用闲置募集资金购买银行理财产品的公告,finalpage/2014-04-02/63772200.PDF
290,2014-04-22,金安国纪：关于控股子公司上海国纪申请银行授信及公司为其提供担保的公告,finalpage/2014-04-22/63887597.PDF
291,2014-04-22,金安国纪：关于举行2013年度报告网上业绩说明会的公告,finalpage/2014-04-22/63887599.PDF
292,2014-04-22,金安国纪：2013年年度报告摘要,finalpage/2014-04-22/63887600.PDF
293,2014-04-22,金安国纪：2013年年度报告,finalpage/2014-04-22/63887606.PDF
294,2014-04-22,金安国纪：2013年年度审计报告,finalpage/2014-04-22/63887607.PDF
295,2014-04-22,金安国纪：第二届董事会第三十五次会议决议公告,finalpage/2014-04-22/63887608.PDF
296,2014-04-22,金安国纪：关于召开2013年度股东大会通知的公告,finalpage/2014-04-22/63887609.PDF
297,2014-04-22,金安国纪：第二届监事会第二十五次会议决议公告,finalpage/2014-04-22/63887611.PDF
298,2014-04-22,金安国纪：关于公司与关联方资金往来的专项审计报告,finalpage/2014-04-22/63887612.PDF
299,2014-04-22,金安国纪：2013年度内部控制自我评价报告,finalpage/2014-04-22/63887613.PDF
300,2014-04-22,金安国纪：董事会关于年度募集资金存放与使用情况的专项报告,finalpage/2014-04-22/63887614.PDF
301,2014-04-22,金安国纪：关于公司2013年度募集资金存放与使用情况的鉴证报告,finalpage/2014-04-22/63887615.PDF
302,2014-04-22,金安国纪：独立董事关于公司第二届董事会第三十五次会议及年度相关事项的独立意见,finalpage/2014-04-22/63887616.PDF
303,2014-04-22,金安国纪：2013年度独立董事述职报告,finalpage/2014-04-22/63887618.PDF
304,2014-04-22,金安国纪：内部控制规则落实自查表,finalpage/2014-04-22/63887619.PDF
305,2014-04-22,金安国纪：华泰联合证券有限责任公司关于公司2013年度内部控制自我评价报告的核查意见,finalpage/2014-04-22/63887620.PDF
306,2014-04-22,金安国纪：华泰联合证券有限责任公司关于公司内部控制规则落实自查表的核查意见,finalpage/2014-04-22/63887622.PDF
307,2014-04-22,金安国纪：华泰联合证券有限责任公司关于公司募集资金2013年度使用情况的专项核查意见,finalpage/2014-04-22/63887623.PDF
308,2014-04-28,金安国纪：2014年第一季度报告正文,finalpage/2014-04-28/63928065.PDF
309,2014-04-28,金安国纪：2014年第一季度报告全文,finalpage/2014-04-28/63928066.PDF
310,2014-04-30,金安国纪：关于使用闲置募集资金购买银行理财产品的公告,finalpage/2014-04-30/63949572.PDF
311,2014-05-08,金安国纪：关于使用闲置募集资金和自有资金购买银行理财产品的公告,finalpage/2014-05-08/63997755.PDF
312,2014-05-08,金安国纪：华泰联合证券有限责任公司关于公司2013年度保荐工作报告,finalpage/2014-05-08/63997758.PDF
313,2014-05-08,金安国纪：首次公开发行股票并上市之保荐总结报告书,finalpage/2014-05-08/63997761.PDF
314,2014-05-09,金安国纪：第二届董事会第三十七次会议决议公告,finalpage/2014-05-09/64001960.PDF
315,2014-05-09,金安国纪：第二届监事会第二十七次会议决议公告,finalpage/2014-05-09/64001961.PDF
316,2014-05-09,"金安国纪：关于“年产1,020万张中高等级覆铜板和出售半固化片600万米项目”投产延期的公告",finalpage/2014-05-09/64001962.PDF
317,2014-05-09,金安国纪：关于变更内部审计部负责人的公告,finalpage/2014-05-09/64001963.PDF
318,2014-05-09,金安国纪：独立董事关于公司第二届董事会第三十七次会议相关事项的独立意见,finalpage/2014-05-09/64001964.PDF
319,2014-05-21,金安国纪：关于使用闲置募集资金购买银行理财产品的公告,finalpage/2014-05-21/64047238.PDF
320,2014-05-30,金安国纪：关于使用闲置募集资金和自有资金购买银行理财产品的公告,finalpage/2014-05-30/64082229.PDF
321,2014-06-06,金安国纪：关于使用闲置募集资金和自有资金购买银行理财产品的公告,finalpage/2014-06-06/64105641.PDF
322,2014-06-10,金安国纪：关于使用闲置募集资金购买银行理财产品的公告,finalpage/2014-06-10/64117982.PDF
323,2014-06-10,金安国纪：关于子公司股权变更的公告,finalpage/2014-06-10/64117991.PDF
324,2014-06-19,金安国纪：2013年度股东大会决议公告,finalpage/2014-06-19/64150924.PDF
325,2014-06-19,金安国纪：2013年度股东大会法律意见,finalpage/2014-06-19/64150925.PDF
326,2014-07-01,金安国纪：关于使用闲置募集资金和自有资金购买银行理财产品的公告,finalpage/2014-07-01/1200021212.PDF
327,2014-07-04,金安国纪：2013年年度权益分派实施公告,finalpage/2014-07-04/1200029984.PDF
328,2014-07-09,金安国纪：关于使用闲置募集资金和自有资金购买银行理财产品的公告,finalpage/2014-07-09/1200040292.PDF
329,2014-07-12,金安国纪：关于使用闲置募集资金购买银行理财产品的公告,finalpage/2014-07-12/1200048264.PDF
330,2014-07-15,金安国纪：2014年半年度业绩预告修正公告,finalpage/2014-07-15/1200053488.PDF
331,2014-07-18,金安国纪：关于对外投资处于筹划阶段的提示性公告,finalpage/2014-07-18/1200061152.PDF
332,2014-07-30,金安国纪：关于使用闲置募集资金和自有资金购买银行理财产品的公告,finalpage/2014-07-30/1200086864.PDF
333,2014-08-01,金安国纪：关于使用自有资金购买银行理财产品的公告,finalpage/2014-08-01/1200092119.PDF
334,2014-08-13,金安国纪：关于使用闲置募集资金和自有资金购买银行理财产品的公告,finalpage/2014-08-13/1200121533.PDF
335,2014-08-20,金安国纪：董事会关于2014年上半年度募集资金存放与使用情况的专项报告,finalpage/2014-08-20/1200140744.PDF
336,2014-08-20,金安国纪：2014年半年度报告摘要,finalpage/2014-08-20/1200140745.PDF
337,2014-08-20,金安国纪：2014年半年度报告,finalpage/2014-08-20/1200140746.PDF
338,2014-08-20,金安国纪：2014年半年度财务报告,finalpage/2014-08-20/1200140747.PDF
339,2014-08-20,金安国纪：第二届董事会第三十八次会议决议公告,finalpage/2014-08-20/1200140748.PDF
340,2014-08-20,金安国纪：第二届监事会第二十八次会议决议公告,finalpage/2014-08-20/1200140749.PDF
341,2014-08-20,金安国纪：独立董事关于公司第二届董事会第三十八次会议相关事项的独立意见,finalpage/2014-08-20/1200140750.PDF
342,2014-08-20,金安国纪：关于为控股子公司珠海国纪提供担保的公告,finalpage/2014-08-20/1200140751.PDF
343,2014-08-29,金安国纪：关于使用闲置募集资金购买银行理财产品的公告,finalpage/2014-08-29/1200183923.PDF
344,2014-09-02,金安国纪：关于使用自有资金购买银行理财产品的公告,finalpage/2014-09-02/1200195473.PDF
345,2014-09-03,金安国纪：关于使用闲置募集资金和自有资金购买银行理财产品的公告,finalpage/2014-09-03/1200198679.PDF
346,2014-09-05,金安国纪：关于监事会换届选举的提示性公告,finalpage/2014-09-05/1200205411.PDF
347,2014-09-05,金安国纪：关于董事会换届选举的提示性公告,finalpage/2014-09-05/1200205412.PDF
348,2014-09-10,金安国纪：关于公司职工代表监事换届选举的公告,finalpage/2014-09-10/1200219579.PDF
349,2014-09-16,金安国纪：关于使用闲置募集资金和自有资金购买银行理财产品的公告,finalpage/2014-09-16/1200236277.PDF
350,2014-09-23,金安国纪：第二届董事会第三十九次会议决议公告,finalpage/2014-09-23/1200252138.PDF
351,2014-09-23,金安国纪：第二届监事会第二十九次会议决议公告,finalpage/2014-09-23/1200252139.PDF
352,2014-09-23,金安国纪：关于投资建设PCB印制电路板项目的公告,finalpage/2014-09-23/1200252140.PDF
353,2014-09-23,金安国纪：独立董事关于投资建设PCB印制电路板项目相关事项的独立意见,finalpage/2014-09-23/1200252141.PDF
354,2014-09-26,金安国纪：关于使用自有资金购买银行理财产品的公告,finalpage/2014-09-26/1200261745.PDF
355,2014-09-30,金安国纪：关于使用闲置募集资金和自有资金购买银行理财产品的公告,finalpage/2014-09-30/1200274192.PDF
356,2014-10-10,金安国纪：关于使用闲置募集资金和自有资金购买银行理财产品的公告,finalpage/2014-10-10/1200285081.PDF
357,2014-10-15,金安国纪：关于使用闲置募集资金和自有资金购买银行理财产品的公告,finalpage/2014-10-15/1200298931.PDF
358,2014-10-15,金安国纪：关于子公司取得营业执照的公告,finalpage/2014-10-15/1200298932.PDF
359,2014-10-22,金安国纪：关于使用闲置募集资金和自有资金购买银行理财产品的公告,finalpage/2014-10-22/1200316973.PDF
360,2014-10-28,金安国纪：2014年第三季度报告正文,finalpage/2014-10-28/1200340032.PDF
361,2014-10-28,金安国纪：2014年第三季度报告全文,finalpage/2014-10-28/1200340033.PDF
362,2014-10-29,金安国纪：关于使用闲置募集资金购买银行理财产品的公告,finalpage/2014-10-29/1200344762.PDF
363,2014-10-31,金安国纪：关于使用自有资金购买银行理财产品的公告,finalpage/2014-10-31/1200356333.PDF
364,2014-10-31,"金安国纪：关于年产1,020万张中高等级覆铜板和出售半固化片600万米项目的进展公告",finalpage/2014-10-31/1200356334.PDF
365,2014-11-08,金安国纪：关于使用闲置募集资金和自有资金购买银行理财产品的公告,finalpage/2014-11-08/1200377696.PDF
366,2014-11-14,金安国纪：关于公司为控股子公司提供担保额度的公告,finalpage/2014-11-14/1200390861.PDF
367,2014-11-14,金安国纪：关于召开2014年第二次临时股东大会通知的公告,finalpage/2014-11-14/1200390862.PDF
368,2014-11-14,金安国纪：独立董事候选人声明（姚超豪）,finalpage/2014-11-14/1200390863.PDF
369,2014-11-14,金安国纪：独立董事候选人声明（王鸿祥）,finalpage/2014-11-14/1200390864.PDF
370,2014-11-14,金安国纪：独立董事候选人声明（程焱）,finalpage/2014-11-14/1200390865.PDF
371,2014-11-14,金安国纪：独立董事关于公司第二届董事会第四十一次会议相关事项的独立意见,finalpage/2014-11-14/1200390866.PDF
372,2014-11-14,金安国纪：独立董事提名人声明（三）,finalpage/2014-11-14/1200390867.PDF
373,2014-11-14,金安国纪：独立董事提名人声明（二）,finalpage/2014-11-14/1200390868.PDF
374,2014-11-14,金安国纪：独立董事提名人声明（一）,finalpage/2014-11-14/1200390869.PDF
375,2014-11-14,金安国纪：第二届监事会第三十一次会议决议公告,finalpage/2014-11-14/1200390870.PDF
376,2014-11-14,金安国纪：第二届董事会第四十一次会议决议公告,finalpage/2014-11-14/1200390871.PDF
377,2014-11-19,金安国纪：关于使用闲置募集资金和自有资金购买银行理财产品的公告,finalpage/2014-11-19/1200401218.PDF
378,2014-11-19,金安国纪：关于公司股东追加承诺的公告,finalpage/2014-11-19/1200401219.PDF
379,2014-11-20,金安国纪：关于限售股解禁上市流通的提示性公告,finalpage/2014-11-20/1200403654.PDF
380,2014-11-21,金安国纪：关于使用闲置募集资金和自有资金购买银行理财产品的公告,finalpage/2014-11-21/1200406303.PDF
381,2014-11-27,金安国纪：关于公司股东追加承诺的进展公告,finalpage/2014-11-27/1200419013.PDF
382,2014-11-28,金安国纪：关于使用闲置募集资金和自有资金购买银行理财产品的公告,finalpage/2014-11-28/1200421668.PDF
383,2014-11-29,金安国纪：关于使用自有资金购买银行理财产品的公告,finalpage/2014-11-29/1200424837.PDF
384,2014-12-03,金安国纪：2014年第二次临时股东大会决议公告,finalpage/2014-12-03/1200435866.PDF
385,2014-12-03,金安国纪：2014年第二次临时股东大会法律意见,finalpage/2014-12-03/1200435867.PDF
386,2014-12-04,金安国纪：第三届监事会第一次会议决议公告,finalpage/2014-12-04/1200438226.PDF
387,2014-12-04,金安国纪：第三届董事会第一次会议决议公告,finalpage/2014-12-04/1200438227.PDF
388,2014-12-04,金安国纪：关于注册设立全资子公司的公告,finalpage/2014-12-04/1200438228.PDF
389,2014-12-04,金安国纪：独立董事关于第三届董事会第一次会议相关事项的独立意见,finalpage/2014-12-04/1200438229.PDF
390,2014-12-10,金安国纪：关于使用闲置募集资金购买银行理财产品的公告,finalpage/2014-12-10/1200452647.PDF
391,2014-12-19,金安国纪：关于公司董事提出辞职申请的公告,finalpage/2014-12-19/1200475888.PDF
392,2014-12-24,金安国纪：关于使用闲置募集资金和自有资金购买银行理财产品的公告,finalpage/2014-12-24/1200488440.PDF
393,2014-12-31,金安国纪：关于使用自有资金购买银行理财产品的公告,finalpage/2014-12-31/1200506749.PDF
394,2015-01-09,金安国纪：关于使用闲置募集资金购买银行理财产品的公告,finalpage/2015-01-09/1200529667.PDF
395,2015-01-17,金安国纪：关于使用闲置募集资金和自有资金购买银行理财产品的公告,finalpage/2015-01-17/1200551134.PDF
396,2015-01-23,金安国纪：关于使用闲置募集资金和自有资金购买银行理财产品的公告,finalpage/2015-01-23/1200570292.PDF
397,2015-02-06,金安国纪：关于使用闲置募集资金和自有资金购买银行理财产品的公告,finalpage/2015-02-06/1200612661.PDF
398,2015-02-12,金安国纪：关于子公司取得营业执照的公告,finalpage/2015-02-12/1200629112.PDF
399,2015-02-13,金安国纪：关于使用闲置募集资金购买银行理财产品的公告,finalpage/2015-02-13/1200632597.PDF
400,2015-02-17,金安国纪：2014年度业绩快报,finalpage/2015-02-17/1200643979.PDF
401,2015-02-17,金安国纪：关于使用自有资金购买银行理财产品的公告,finalpage/2015-02-17/1200643980.PDF
402,2015-02-28,金安国纪：关于使用自有资金购买银行理财产品的公告,finalpage/2015-02-28/1200656509.PDF
403,2015-03-04,金安国纪：关于使用自有资金购买银行理财产品的公告,finalpage/2015-03-04/1200665715.PDF
404,2015-03-12,金安国纪：关于使用闲置募集资金购买银行理财产品的公告,finalpage/2015-03-12/1200690989.PDF
405,2015-03-13,金安国纪：关于使用闲置募集资金和自有资金购买银行理财产品的公告,finalpage/2015-03-13/1200694094.PDF
406,2015-03-17,金安国纪：关于使用自有资金购买银行理财产品的公告,finalpage/2015-03-17/1200705685.PDF
407,2015-03-21,金安国纪：第三届监事会第二次会议决议公告,finalpage/2015-03-21/1200722760.PDF
408,2015-03-21,金安国纪：第三届董事会第二次会议决议公告,finalpage/2015-03-21/1200722761.PDF
409,2015-03-21,金安国纪：关于公司及子公司核销坏账的公告,finalpage/2015-03-21/1200722762.PDF
