date,title,url
2015-12-03,永大集团：2015年第三次临时股东大会取消部分提案暨补充通知的公告,finalpage/2015-12-03/1201803662.PDF
2015-12-03,永大集团：关于2015年度利润分配预案的预披露公告,finalpage/2015-12-03/1201803663.PDF
2015-12-03,永大集团：关于2015年第三季度资本公积金转增股本预案的更正公告,finalpage/2015-12-03/1201803664.PDF
2015-12-04,永大集团：关于筹划重大资产重组的停牌进展公告,finalpage/2015-12-04/1201804598.PDF
2015-12-11,永大集团：关于筹划重大资产重组的停牌进展公告,finalpage/2015-12-11/1201826751.PDF
2015-12-15,永大集团：2015年第三次临时股东大会决议公告,finalpage/2015-12-15/1201833034.PDF
2015-12-15,永大集团：2015年第三次临时股东大会的法律意见书,finalpage/2015-12-15/1201833035.PDF
2015-12-16,永大集团：关于参与寿险公司股权竞标的提示性公告,finalpage/2015-12-16/1201835787.PDF
2015-12-16,永大集团：第三届董事会第九次临时会议决议公告,finalpage/2015-12-16/1201835905.PDF
2015-12-16,永大集团：关于召开2016年第一次临时股东大会的通知,finalpage/2015-12-16/1201835906.PDF
2015-12-18,永大集团：关于筹划重大资产重组的停牌进展公告,finalpage/2015-12-18/1201843222.PDF
2015-12-24,永大集团：关于股东协议转让公司股份的提示性公告,finalpage/2015-12-24/1201854409.PDF
2015-12-24,永大集团：简式权益变动报告书,finalpage/2015-12-24/1201854410.PDF
2015-12-25,永大集团：关于控股股东签订股份转让协议的提示性公告,finalpage/2015-12-25/1201856478.PDF
2015-12-25,永大集团：中小板上市公司重大资产重组方案首次披露对照表,finalpage/2015-12-25/1201856798.PDF
2015-12-25,永大集团：上市公司并购重组财务顾问专业意见附表第2号――重大资产重组,finalpage/2015-12-25/1201856799.PDF
2015-12-25,永大集团：上市公司并购重组财务顾问专业意见附表第3号――发行股份购买资产,finalpage/2015-12-25/1201856800.PDF
2015-12-25,永大集团：重组预案独立财务顾问核查意见表,finalpage/2015-12-25/1201856801.PDF
2015-12-25,永大集团：关于重大资产重组的一般风险提示公告,finalpage/2015-12-25/1201856802.PDF
2015-12-25,永大集团：关于披露重大资产重组预案暨公司股票继续停牌的公告,finalpage/2015-12-25/1201856803.PDF
2015-12-25,永大集团：独立董事关于公司发行股份及支付现金购买资产并募集配套资金暨关联交易的事前认可意见,finalpage/2015-12-25/1201856804.PDF
2015-12-25,永大集团：独立董事关于公司发行股份及支付现金购买资产并募集配套资金暨关联交易的独立董事意见,finalpage/2015-12-25/1201856805.PDF
2015-12-25,永大集团：董事会关于本次重大资产履行法定程序完备性、合规性及提交的法律文件的有效性的说明,finalpage/2015-12-25/1201856806.PDF
2015-12-25,永大集团：第三届董事会第十一次会议决议公告,finalpage/2015-12-25/1201856807.PDF
2015-12-25,永大集团：董事会关于本次重大资产重组停牌前股价波动的说明,finalpage/2015-12-25/1201856808.PDF
2015-12-25,永大集团：国金证券股份有限公司关于公司发行股份及支付现金购买资产并募集配套资金暨关联交易事项之独立财务顾问声明,finalpage/2015-12-25/1201856809.PDF
2015-12-25,永大集团：发行股份及支付现金购买资产并募集配套资金暨关联交易预案,finalpage/2015-12-25/1201856810.PDF
2015-12-25,永大集团：国金证券股份有限公司关于公司发行股份及支付现金购买资产并募集配套资金暨关联交易预案之独立财务顾问核查意见,finalpage/2015-12-25/1201856811.PDF
2015-12-25,永大集团：第三届监事会第九次会议决议公告,finalpage/2015-12-25/1201856812.PDF
2016-01-04,永大集团：关于筹划重大资产重组进展情况的公告,finalpage/2016-01-04/1201882980.PDF
2016-01-04,永大集团：国泰君安证券股份有限公司关于公司详式权益变动报告书之财务顾问核查意见,finalpage/2016-01-04/1201884965.PDF
2016-01-04,永大集团：详式权益变动报告书,finalpage/2016-01-04/1201884966.PDF
2016-01-04,永大集团：关于召开现场投资者说明会的公告,finalpage/2016-01-04/1201884967.PDF
2016-01-05,永大集团：2016年第一次临时股东大会决议公告,finalpage/2016-01-05/1201886459.PDF
2016-01-05,永大集团：2016年第一次临时股东大会的法律意见书,finalpage/2016-01-05/1201886460.PDF
2016-01-06,永大集团：关于拟受让公司股份股东承诺继续履行公司拟出让股份股东相关承诺的公告,finalpage/2016-01-06/1201891938.PDF
2016-01-08,永大集团：发行股份及支付现金购买资产并募集配套资金暨关联交易预案（修订稿）,finalpage/2016-01-08/1201901508.PDF
2016-01-08,永大集团：关于公司股票复牌的提示性公告,finalpage/2016-01-08/1201901509.PDF
2016-01-08,永大集团：关于发行股份及支付现金购买资产并募集配套资金暨关联交易预案的修订说明公告,finalpage/2016-01-08/1201901510.PDF
2016-01-08,永大集团：关于深圳证券交易所重组问询函回复的公告,finalpage/2016-01-08/1201901511.PDF
2016-01-08,永大集团：国金证券股份有限公司关于公司重大资产重组之深交所问询函回复之核查意见,finalpage/2016-01-08/1201901512.PDF
2016-01-12,永大集团：股票交易异常波动公告,finalpage/2016-01-12/1201906349.PDF
2016-01-14,永大集团：重大事项停牌公告,finalpage/2016-01-14/1201911268.PDF
2016-01-14,永大集团：关于董事长增持公司股份的公告,finalpage/2016-01-14/1201910603.PDF
2016-01-18,永大集团：关于拟受让公司股份股东相关承诺事项的公告,finalpage/2016-01-18/1201921800.PDF
2016-01-21,永大集团：关于签订战略合作框架协议暨股票复牌的公告,finalpage/2016-01-21/1201929910.PDF
2016-01-23,永大集团：关于董事、高级管理人员增持公司股份的公告,finalpage/2016-01-23/1201935418.PDF
2016-01-23,永大集团：关于股东质押股份的公告,finalpage/2016-01-23/1201935419.PDF
2016-01-29,永大集团：关于高级管理人员增持公司股份的公告,finalpage/2016-01-29/1201951718.PDF
2016-02-19,永大集团：重大资产重组进展公告,finalpage/2016-02-19/1201986652.PDF
2016-02-29,永大集团：2015年度业绩快报,finalpage/2016-02-29/1202005091.PDF
2016-03-19,永大集团：重大资产重组进展公告,finalpage/2016-03-19/1202056866.PDF
2016-03-26,永大集团：关于股东协议转让的公司部分股份已完成过户登记的公告,finalpage/2016-03-26/1202082826.PDF
2016-03-31,永大集团：2015年年度审计报告,finalpage/2016-03-31/1202113729.PDF
2016-03-31,永大集团：第三届董事会第十二次会议决议公告,finalpage/2016-03-31/1202113730.PDF
2016-03-31,永大集团：关于召开2015年度股东大会的通知,finalpage/2016-03-31/1202113731.PDF
2016-03-31,永大集团：第三届监事会第十次会议决议公告,finalpage/2016-03-31/1202113732.PDF
2016-03-31,永大集团：2015年度控股股东及其他关联方资金占用情况的专项说明,finalpage/2016-03-31/1202113733.PDF
2016-03-31,永大集团：独立董事2015年度述职报告（张炜）,finalpage/2016-03-31/1202113734.PDF
2016-03-31,永大集团：独立董事2015年度述职报告（韩波）,finalpage/2016-03-31/1202113735.PDF
2016-03-31,永大集团：独立董事2015年度述职报告（吴铁华）,finalpage/2016-03-31/1202113736.PDF
2016-03-31,永大集团：独立董事关于公司2015年度有关事项及第三届董事会第十二次会议相关事项的独立意见,finalpage/2016-03-31/1202113737.PDF
2016-03-31,永大集团：2015年度内部控制自我评价报告,finalpage/2016-03-31/1202113738.PDF
2016-03-31,永大集团：关于举行2015年度报告网上说明会的公告,finalpage/2016-03-31/1202113739.PDF
2016-03-31,永大集团：2015年度董事会工作报告,finalpage/2016-03-31/1202113740.PDF
2016-03-31,永大集团：2015年度财务决算报告,finalpage/2016-03-31/1202113741.PDF
2016-03-31,永大集团：2015年度监事会工作报告,finalpage/2016-03-31/1202113742.PDF
2016-03-31,永大集团：公司章程（2016年3月）,finalpage/2016-03-31/1202113743.PDF
2016-03-31,永大集团：公司章程修正案,finalpage/2016-03-31/1202113744.PDF
2016-03-31,永大集团：内部控制规则落实自查表,finalpage/2016-03-31/1202113745.PDF
2016-03-31,永大集团：专项鉴证报告,finalpage/2016-03-31/1202113746.PDF
2016-03-31,永大集团：2015年募集资金年度存放与使用情况专项报告,finalpage/2016-03-31/1202113747.PDF
2016-03-31,永大集团：广发证券股份有限公司关于公司2015年度募集资金存放与使用情况的专项核查意见,finalpage/2016-03-31/1202113748.PDF
2016-03-31,永大集团：2015年年度报告摘要,finalpage/2016-03-31/1202113749.PDF
2016-03-31,永大集团：关于全资子公司之间吸收合并事项的公告,finalpage/2016-03-31/1202113750.PDF
2016-03-31,永大集团：2015年年度报告,finalpage/2016-03-31/1202113751.PDF
2016-04-19,永大集团：重大资产重组进展公告,finalpage/2016-04-19/1202194013.PDF
2016-04-30,永大集团：第三届董事会第十三次会议决议公告,finalpage/2016-04-30/1202281695.PDF
2016-04-30,永大集团：第三届监事会第十一次会议决议公告,finalpage/2016-04-30/1202281696.PDF
2016-04-30,永大集团：2016年第一季度报告正文,finalpage/2016-04-30/1202281697.PDF
2016-04-30,永大集团：2016年第一季度报告全文,finalpage/2016-04-30/1202281698.PDF
2016-05-06,永大集团：2015年度股东大会的律师见证法律意见书,finalpage/2016-05-06/1202299627.PDF
2016-05-06,永大集团：2015年度股东大会决议公告,finalpage/2016-05-06/1202299628.PDF
2016-05-12,永大集团：2015年年度权益分派实施公告,finalpage/2016-05-12/1202317073.PDF
2016-05-19,永大集团：重大资产重组进展公告,finalpage/2016-05-19/1202327899.PDF
2016-06-03,永大集团：第三届董事会第十次临时会议决议公告,finalpage/2016-06-03/1202354618.PDF
2016-06-03,永大集团：独立董事关于第三届董事会第十次临时会议相关事项的独立意见,finalpage/2016-06-03/1202354619.PDF
2016-06-03,永大集团：关于召开2016年第二次临时股东大会的通知,finalpage/2016-06-03/1202354620.PDF
2016-06-03,永大集团：关于全资子公司永大创新金融服务（深圳）有限公司拟参与投资产业并购基金的公告,finalpage/2016-06-03/1202354621.PDF
2016-06-04,永大集团：关于全资子公司永大创新金融服务（深圳）有限公司拟参与投资产业并购基金公告的补充更正公告,finalpage/2016-06-04/1202355986.PDF
2016-06-15,永大集团：关于对深圳证券交易所2015年年报问询函回复的公告,finalpage/2016-06-15/1202368069.PDF
2016-06-20,永大集团：重大资产重组进展公告,finalpage/2016-06-20/1202374990.PDF
2016-06-21,永大集团：2016年第二次临时股东大会决议公告,finalpage/2016-06-21/1202378211.PDF
2016-06-21,永大集团：2016年第二次临时股东大会的法律意见书,finalpage/2016-06-21/1202378212.PDF
2016-06-24,永大集团：第三届董事会第十四次会议决议公告,finalpage/2016-06-24/1202396127.PDF
2016-06-24,永大集团：独立董事关于第三届董事会第十四次会议相关事项的独立意见,finalpage/2016-06-24/1202396130.PDF
2016-06-24,永大集团：独立董事关于终止重大资产重组事项的事前认可意见,finalpage/2016-06-24/1202396132.PDF
2016-06-24,永大集团：关于终止重大资产重组事项的公告,finalpage/2016-06-24/1202396133.PDF
2016-06-24,永大集团：关于终止重大资产重组事项召开投资者说明会的提示性公告,finalpage/2016-06-24/1202396135.PDF
2016-07-02,永大集团：关于董事减持股份的公告,finalpage/2016-07-02/1202445974.PDF
2016-07-06,永大集团：关于控股股东签订股份转让协议之补充协议的提示性公告,finalpage/2016-07-06/1202452744.PDF
2016-07-15,永大集团：2016年半年度业绩预告修正公告,finalpage/2016-07-15/1202475729.PDF
2016-07-16,永大集团：关于详式权益变动报告书的补充更新公告,finalpage/2016-07-16/1202478055.PDF
2016-07-16,永大集团：详式权益变动报告书（修订）,finalpage/2016-07-16/1202478056.PDF
2016-07-19,永大集团：关于控股股东协议转让公司相关股份完成过户登记的公告,finalpage/2016-07-19/1202480110.PDF
2016-07-22,永大集团：关于股东股票质押式回购交易延期购回的公告,finalpage/2016-07-22/1202499053.PDF
2016-07-28,永大集团：关于深圳证券交易所重组关注函回复的公告,finalpage/2016-07-28/1202510233.PDF
2016-08-06,永大集团：关于董事辞职的公告,finalpage/2016-08-06/1202542578.PDF
2016-08-09,永大集团：第三届董事会第十一次临时会议决议公告,finalpage/2016-08-09/1202547304.PDF
2016-08-09,永大集团：关于推荐邓强先生出任抚顺银行股份有限公司董事的公告,finalpage/2016-08-09/1202547305.PDF
2016-08-13,永大集团：关于中欧体育投资管理长兴有限公司与Fininvest S.p.A签署收购AC米兰俱乐部99.93%股权协议的公告,finalpage/2016-08-13/1202562697.PDF
2016-08-17,永大集团：第三届董事会第十二次临时会议决议公告,finalpage/2016-08-17/1202570775.PDF
2016-08-17,永大集团：关于补选非独立董事的公告,finalpage/2016-08-17/1202570776.PDF
2016-08-17,永大集团：关于召开2016年第三次临时股东大会的通知,finalpage/2016-08-17/1202570777.PDF
2016-08-17,永大集团：独立董事关于补选非独立董事的独立意见,finalpage/2016-08-17/1202570778.PDF
2016-08-17,永大集团：董事会提名委员会关于提名非独立董事候选人的意见,finalpage/2016-08-17/1202570779.PDF
2016-08-19,永大集团：关于详式权益变动报告书的补充变更公告,finalpage/2016-08-19/1202581779.PDF
2016-08-22,永大集团：关于收到股东临时提案的公告,finalpage/2016-08-22/1202598106.PDF
2016-08-23,永大集团：关于2016年第三次临时股东大会增加临时提案暨补充通知的公告,finalpage/2016-08-23/1202601967.PDF
2016-08-23,永大集团：第三届董事会第十三次临时会议决议公告,finalpage/2016-08-23/1202601968.PDF
2016-08-23,永大集团：独立董事关于增选非独立董事的独立意见,finalpage/2016-08-23/1202601969.PDF
2016-08-23,永大集团：关于增选非独立董事的公告,finalpage/2016-08-23/1202601970.PDF
2016-08-23,永大集团：董事会提名委员会关于提名非独立董事候选人的意见,finalpage/2016-08-23/1202601971.PDF
2016-08-29,永大集团：与中欧体育投资管理长兴有限公司签署关于体育文化产业并购基金的合作协议的公告,finalpage/2016-08-29/1202640881.PDF
2016-08-29,永大集团：2016年半年度报告摘要,finalpage/2016-08-29/1202637405.PDF
2016-08-29,永大集团：2016年半年度报告,finalpage/2016-08-29/1202637406.PDF
2016-08-29,永大集团：2016半年度财务报告,finalpage/2016-08-29/1202637407.PDF
2016-08-29,永大集团：2016年上半年度募集资金存放与使用情况专项报告,finalpage/2016-08-29/1202637408.PDF
2016-08-29,永大集团：第三届董事会第十五次会议决议公告,finalpage/2016-08-29/1202637409.PDF
2016-08-29,永大集团：第三届监事会第十二次会议决议公告,finalpage/2016-08-29/1202637410.PDF
2016-08-29,永大集团：独立董事关于公司2016年上半年度相关事项的独立意见,finalpage/2016-08-29/1202637411.PDF
2016-08-30,永大集团：关于转让北京中通华数据软件技术有限公司股权的公告,finalpage/2016-08-30/1202642852.PDF
2016-08-30,永大集团：第三届董事会第十四次临时会议决议公告,finalpage/2016-08-30/1202642853.PDF
2016-08-30,永大集团：独立董事关于转让北京中通华数据软件技术有限公司股权的独立意见,finalpage/2016-08-30/1202642854.PDF
2016-08-31,永大集团：独立董事关于公司董事长辞职的独立意见,finalpage/2016-08-31/1202658302.PDF
2016-08-31,永大集团：关于董事长辞职的公告,finalpage/2016-08-31/1202658303.PDF
2016-09-02,永大集团：2016年第三次临时股东大会的法律意见书,finalpage/2016-09-02/1202670359.PDF
2016-09-02,永大集团：2016年第三次临时股东大会决议公告,finalpage/2016-09-02/1202670360.PDF
2016-09-03,永大集团：关于独立董事辞职的公告,finalpage/2016-09-03/1202674563.PDF
2016-09-05,永大集团：独立董事关于选举公司董事长的独立意见,finalpage/2016-09-05/1202675066.PDF
2016-09-05,永大集团：关于选举公司董事长的公告,finalpage/2016-09-05/1202675067.PDF
2016-09-05,永大集团：第三届董事会第十五次临时会议决议公告,finalpage/2016-09-05/1202675068.PDF
2016-09-26,永大集团：关于高管辞职的公告,finalpage/2016-09-26/1202725399.PDF
2016-09-26,永大集团：关于公司热镀铝产品及电控产品业务剥离的公告,finalpage/2016-09-26/1202725400.PDF
2016-09-26,永大集团：关于聘任公司总经理、副总经理的公告,finalpage/2016-09-26/1202725401.PDF
2016-09-26,永大集团：关于续聘会计师事务所的公告,finalpage/2016-09-26/1202725402.PDF
2016-09-26,永大集团：关于召开2016年第四次临时股东大会的通知,finalpage/2016-09-26/1202725403.PDF
2016-09-26,永大集团：独立董事关于第三届董事会第十六次临时会议相关事项的独立意见,finalpage/2016-09-26/1202725404.PDF
2016-09-26,永大集团：第三届董事会第十六次临时会议决议公告,finalpage/2016-09-26/1202725405.PDF
2016-09-26,永大集团：关于组织架构调整的公告,finalpage/2016-09-26/1202725406.PDF
2016-09-27,永大集团：关于收到国家电网公司集中招标活动供应商资质能力核实结果证明函件的公告,finalpage/2016-09-27/1202726902.PDF
2016-09-27,永大集团：关于收到中铁武汉电气化局集团有限公司及中国通信建设集团有限公司中标通知书的公告,finalpage/2016-09-27/1202726903.PDF
2016-09-29,永大集团：关于聘任公司总经理、副总经理的补充公告,finalpage/2016-09-29/1202736297.PDF
2016-10-10,永大集团：独立董事关于第三届董事会第十七次临时会议相关事项的独立意见,finalpage/2016-10-10/1202746191.PDF
2016-10-10,永大集团：公司章程（2016年10月）,finalpage/2016-10-10/1202746192.PDF
2016-10-10,永大集团：关于拟变更公司名称及证券简称的公告,finalpage/2016-10-10/1202746193.PDF
2016-10-10,永大集团：关于使用部分超募资金对外投资成立融资租赁公司的公告,finalpage/2016-10-10/1202746194.PDF
2016-10-10,永大集团：关于使用部分超募资金对外投资成立商业保理公司的公告,finalpage/2016-10-10/1202746195.PDF
2016-10-10,永大集团：关于选举独立董事的公告,finalpage/2016-10-10/1202746196.PDF
2016-10-10,永大集团：关于召开2016年第五次临时股东大会的通知,finalpage/2016-10-10/1202746197.PDF
2016-10-10,永大集团：广发证券股份有限公司关于公司使用部分超募资金对外投资成立融资租赁公司的核查意见,finalpage/2016-10-10/1202746198.PDF
2016-10-10,永大集团：广发证券股份有限公司关于公司使用部分超募资金对外投资成立商业保理公司的核查意见,finalpage/2016-10-10/1202746199.PDF
2016-10-10,永大集团：独立董事候选人声明（普峰）,finalpage/2016-10-10/1202746200.PDF
2016-10-10,永大集团：独立董事提名人声明,finalpage/2016-10-10/1202746201.PDF
2016-10-10,永大集团：公司章程修正案,finalpage/2016-10-10/1202746202.PDF
2016-10-10,永大集团：第三届董事会第十七次临时会议决议公告,finalpage/2016-10-10/1202746188.PDF
2016-10-10,永大集团：第三届监事会第三次临时会议决议公告,finalpage/2016-10-10/1202746189.PDF
2016-10-10,永大集团：董事会提名委员会关于提名独立董事候选人的意见,finalpage/2016-10-10/1202746190.PDF
2016-10-18,永大集团：公司章程（2016年10月）,finalpage/2016-10-18/1202765861.PDF
2016-10-18,永大集团：关于增加公司经营范围并修订《公司章程》相应条款的公告,finalpage/2016-10-18/1202765862.PDF
2016-10-18,永大集团：公司章程修正案,finalpage/2016-10-18/1202765863.PDF
2016-10-18,永大集团：第三届董事会第十八次临时会议决议公告,finalpage/2016-10-18/1202765864.PDF
2016-10-18,永大集团：关于2016年第五次临时股东大会延期召开并增加临时提案的公告,finalpage/2016-10-18/1202765865.PDF
2016-10-21,永大集团：关于签订收购江西智容科技有限公司股权的《股权收购框架协议》的公告,finalpage/2016-10-21/1202773366.PDF
2016-10-22,永大集团：2016年第四次临时股东大会之法律意见书,finalpage/2016-10-22/1202776272.PDF
2016-10-22,永大集团：2016年第四次临时股东大会决议公告,finalpage/2016-10-22/1202776273.PDF
2016-10-22,永大集团：关于收到中核集团合格供应商证书的公告,finalpage/2016-10-22/1202776274.PDF
2016-10-22,永大集团：关于对深圳证券交易所2016年半年报问询函回复的公告,finalpage/2016-10-22/1202776659.PDF
2016-10-25,永大集团：2016年第三季度报告全文,finalpage/2016-10-25/1202781201.PDF
2016-10-25,永大集团：2016年第三季度报告正文,finalpage/2016-10-25/1202781202.PDF
2016-10-25,永大集团：第三届董事会第十六次会议决议公告,finalpage/2016-10-25/1202781203.PDF
2016-10-25,永大集团：第三届监事会第十三次会议决议公告,finalpage/2016-10-25/1202781204.PDF
2016-10-28,永大集团：2016年第五次临时股东大会之法律意见书,finalpage/2016-10-28/1202797209.PDF
2016-10-28,永大集团：2016年第五次临时股东大会决议公告,finalpage/2016-10-28/1202797210.PDF
2016-10-29,永大集团：关于股东办理股票质押式回购交易提前购回的公告,finalpage/2016-10-29/1202803155.PDF
2016-11-01,永大集团：简式权益变动报告书,finalpage/2016-11-01/1202809410.PDF
2016-11-01,永大集团：关于股东减持公司股份的公告,finalpage/2016-11-01/1202809409.PDF
2016-11-08,永大集团：关于变更公司经营范围的公告,finalpage/2016-11-08/1202818447.PDF
2016-11-08,永大集团：关于完成工商变更登记并取得新营业执照的公告,finalpage/2016-11-08/1202818448.PDF
2016-11-08,永大集团：关于变更公司名称及证券简称的公告,finalpage/2016-11-08/1202818449.PDF
2016-11-12,融钰集团：关于独立董事辞职的公告,finalpage/2016-11-12/1202824851.PDF
2016-11-21,融钰集团：第三届董事会第十九次临时会议决议公告,finalpage/2016-11-21/1202836841.PDF
2016-11-21,融钰集团：独立董事关于收购江西智容科技有限公司100%股权暨签署股权收购协议的独立意见,finalpage/2016-11-21/1202836842.PDF
2016-11-21,融钰集团：江西智容科技有限公司2015年度及2016年1-10月审计报告,finalpage/2016-11-21/1202836843.PDF
2016-11-21,融钰集团：拟收购股权项目涉及的江西智容科技有限公司股东全部权益价值资产评估报告,finalpage/2016-11-21/1202836844.PDF
2016-11-21,融钰集团：关于第一大股东执行事务合伙人委派代表变更的公告,finalpage/2016-11-21/1202836845.PDF
2016-11-21,融钰集团：关于收购江西智容科技有限公司100%股权暨签署股权收购协议的公告,finalpage/2016-11-21/1202836846.PDF
2016-12-01,融钰集团：关于江西智容科技有限公司完成股权变更及过户的公告,finalpage/2016-12-01/1202850384.PDF
2016-12-07,融钰集团：关于全资子公司融钰信通（天津）商业保理有限公司完成工商登记的公告,finalpage/2016-12-07/1202861202.PDF
2016-12-09,融钰集团：关于签订收购上海辰商软件科技有限公司股权并增资的《股权收购与增资框架协议》的公告,finalpage/2016-12-09/1202865284.PDF
2016-12-17,融钰集团：重大事项停牌公告,finalpage/2016-12-17/1202881525.PDF
2016-12-19,融钰集团：第三届董事会第二十次临时会议决议公告,finalpage/2016-12-19/1202893775.PDF
2016-12-19,融钰集团：独立董事关于第三届董事会第二十次临时会议相关事项的独立意见,finalpage/2016-12-19/1202893776.PDF
2016-12-19,融钰集团：关于向中国工商银行股份有限公司吉林市高新技术产业开发区支行申请并购贷款的公告,finalpage/2016-12-19/1202893777.PDF
2016-12-21,融钰集团：关于全资子公司江西智容科技有限公司收到中标通知书的公告,finalpage/2016-12-21/1202909219.PDF
2016-12-23,融钰集团：重大事项停牌进展公告,finalpage/2016-12-23/1202939496.PDF
2016-12-30,融钰集团：第三届董事会第二十一次临时会议决议公告,finalpage/2016-12-30/1202974297.PDF
2016-12-30,融钰集团：关于签订股权转让框架协议暨股票复牌的公告,finalpage/2016-12-30/1202974298.PDF
2017-01-04,融钰集团：关于对深圳证券交易所问询函回复的公告,finalpage/2017-01-04/1202986591.PDF
2017-01-04,融钰集团：华西证券股份有限公司关于深圳证券交易所《关于对融钰集团股份有限公司的问询函》之核查意见,finalpage/2017-01-04/1202986592.PDF
2017-01-05,融钰集团：第三届董事会第二十二次临时会议决议公告,finalpage/2017-01-05/1202990343.PDF
2017-01-05,融钰集团：第三届监事会第四次临时会议决议公告,finalpage/2017-01-05/1202990344.PDF
