date,title,url
2015-12-18,京威股份：关于收购深圳市五洲龙汽车有限公司48%股权之股权交割完成的公告,finalpage/2015-12-18/1201843411.PDF
2015-12-31,京威股份：2015年公开发行公司债券上市公告（面向合格投资者）,finalpage/2015-12-31/1201876390.PDF
2016-01-04,京威股份：关于公司撤销对股东德国埃贝斯乐股份有限公司违反避免同业竞争承诺诉讼的公告,finalpage/2016-01-04/1201883322.PDF
2016-01-15,京威股份：关于签订募集资金及偿债保障金三方监管协议的公告,finalpage/2016-01-15/1201916073.PDF
2016-01-15,京威股份：第三届董事会第二十七次会议决议公告,finalpage/2016-01-15/1201916074.PDF
2016-02-27,京威股份：2015年度内部控制自我评价报告,finalpage/2016-02-27/1202003085.PDF
2016-02-27,京威股份：第三届董事会第二十八次会议决议公告,finalpage/2016-02-27/1202003086.PDF
2016-02-27,京威股份：第三届监事会第十一次会议决议的公告,finalpage/2016-02-27/1202003087.PDF
2016-02-27,京威股份：内部控制规则落实自查表,finalpage/2016-02-27/1202003088.PDF
2016-02-27,京威股份：关于召开2015年年度股东大会的通知,finalpage/2016-02-27/1202003089.PDF
2016-02-27,京威股份：独立董事对第三届董事会第二十八次会议相关事项的独立意见,finalpage/2016-02-27/1202003090.PDF
2016-02-27,京威股份：2015年度独立董事述职报告,finalpage/2016-02-27/1202003091.PDF
2016-02-27,京威股份：2015年年度报告摘要,finalpage/2016-02-27/1202003092.PDF
2016-02-27,京威股份：董事会关于募集资金2015年度存放与使用情况的专项报告,finalpage/2016-02-27/1202003093.PDF
2016-02-27,京威股份：2016年度日常关联交易预测公告,finalpage/2016-02-27/1202003094.PDF
2016-02-27,京威股份：独立董事对相关事项的事前认可意见,finalpage/2016-02-27/1202003095.PDF
2016-02-27,京威股份：2015年度控股股东及其他关联方资金占用情况的专项说明,finalpage/2016-02-27/1202003096.PDF
2016-02-27,京威股份：2015年度募集资金年度存放与使用情况鉴证报告,finalpage/2016-02-27/1202003097.PDF
2016-02-27,京威股份：关于宁波福尔达智能科技有限公司业绩补偿协议执行情况的专项审核报告,finalpage/2016-02-27/1202003098.PDF
2016-02-27,京威股份：关于秦皇岛威卡威汽车零部件有限公司业绩补偿协议执行情况的专项审核报告,finalpage/2016-02-27/1202003099.PDF
2016-02-27,京威股份：2015年12月31日内部控制审计报告,finalpage/2016-02-27/1202003100.PDF
2016-02-27,京威股份：关于举行2015年年度报告网上说明会的通知,finalpage/2016-02-27/1202003101.PDF
2016-02-27,京威股份：2015年年度报告,finalpage/2016-02-27/1202003102.PDF
2016-02-27,京威股份：2015年年度审计报告,finalpage/2016-02-27/1202003103.PDF
2016-03-02,京威股份：第三届董事会第二十九次会议决议公告,finalpage/2016-03-02/1202010598.PDF
2016-03-19,京威股份：国信证券股份有限公司关于公司发行股份购买资产之持续督导工作报告书,finalpage/2016-03-19/1202057434.PDF
2016-03-22,京威股份：2015年度股东大会决议公告,finalpage/2016-03-22/1202064217.PDF
2016-03-22,京威股份：2015年度股东大会的法律意见书,finalpage/2016-03-22/1202064218.PDF
2016-03-23,京威股份：关于公司中方股东北京中环投资管理有限公司与公司德方股东德国埃贝斯乐股份有限公司修订《共同控制协议》的提示性公告,finalpage/2016-03-23/1202066260.PDF
2016-03-24,京威股份：第三届董事会第三十次会议决议公告,finalpage/2016-03-24/1202068828.PDF
2016-04-01,京威股份：关于参股公司启动上市工作的提示性公告,finalpage/2016-04-01/1202123027.PDF
2016-04-06,京威股份：关于股东减持计划的提示性公告,finalpage/2016-04-06/1202139650.PDF
2016-04-21,京威股份：公司债券2016年跟踪评级报告,finalpage/2016-04-21/1202210747.PDF
2016-04-23,京威股份：关于股东股权质押的公告,finalpage/2016-04-23/1202227716.PDF
2016-04-26,京威股份：2016年第一季度报告全文,finalpage/2016-04-26/1202238694.PDF
2016-04-26,京威股份：2016年第一季度报告正文,finalpage/2016-04-26/1202238695.PDF
2016-04-27,京威股份：第三届董事会第三十二次会议决议公告,finalpage/2016-04-27/1202249016.PDF
2016-04-27,京威股份：关于召开2016年第一次临时股东大会的通知,finalpage/2016-04-27/1202249017.PDF
2016-05-10,京威股份：2015年年度权益分派实施公告,finalpage/2016-05-10/1202312818.PDF
2016-05-14,京威股份：2016年第一次临时股东大会决议公告,finalpage/2016-05-14/1202321912.PDF
2016-05-14,京威股份：2016年第一次临时股东大会的法律意见书,finalpage/2016-05-14/1202321913.PDF
2016-06-18,京威股份：第三届董事会第三十三会议决议公告,finalpage/2016-06-18/1202373148.PDF
2016-06-18,京威股份：关于购买江苏卡威汽车工业集团有限公司35%股权的公告,finalpage/2016-06-18/1202373149.PDF
2016-06-18,京威股份：关于股东减持的公告,finalpage/2016-06-18/1202373986.PDF
2016-06-28,京威股份：第三届董事会第三十四次会议决议公告,finalpage/2016-06-28/1202418550.PDF
2016-06-29,京威股份：国信证券股份有限公司关于公司2015年公司债券（面向合格投资者）受托管理事务报告（2015年度）,finalpage/2016-06-29/1202431342.PDF
2016-07-01,京威股份：关于股东减持的公告,finalpage/2016-07-01/1202440944.PDF
2016-07-09,京威股份：关于股东减持的公告,finalpage/2016-07-09/1202462390.PDF
2016-08-01,京威股份：第三届董事会第三十五次会议决议公告,finalpage/2016-08-01/1202523552.PDF
2016-08-06,京威股份：国信证券股份有限公司关于公司2015年面向合格投资者公开发行公司债券重大事项的临时受托管理事务报告,finalpage/2016-08-06/1202542511.PDF
2016-08-18,京威股份：2016年半年度报告,finalpage/2016-08-18/1202577510.PDF
2016-08-18,京威股份：2016年半年度财务报告,finalpage/2016-08-18/1202577511.PDF
2016-08-18,京威股份：第三届董事会第三十六次会议决议公告,finalpage/2016-08-18/1202577512.PDF
2016-08-18,京威股份：第三届监事会第十三次会议决议的公告,finalpage/2016-08-18/1202577513.PDF
2016-08-18,京威股份：董事会关于募集资金2016年度1-6月存放与使用情况的专项报告,finalpage/2016-08-18/1202577514.PDF
2016-08-18,京威股份：独立董事关于公司关联方资金占用和对外担保情况的专项说明和独立意见,finalpage/2016-08-18/1202577515.PDF
2016-08-18,京威股份：2016年半年度报告摘要,finalpage/2016-08-18/1202577516.PDF
2016-08-19,京威股份：关于股东股份解除质押的公告,finalpage/2016-08-19/1202582306.PDF
2016-08-19,京威股份：投资者交流会公告,finalpage/2016-08-19/1202582320.PDF
2016-08-19,京威股份：关于股东股权质押的公告,finalpage/2016-08-19/1202582335.PDF
2016-08-20,京威股份：第三届董事会第三十七次会议决议公告,finalpage/2016-08-20/1202592592.PDF
2016-08-20,京威股份：第三届监事会第十四次会议决议公告,finalpage/2016-08-20/1202592593.PDF
2016-08-20,京威股份：2016年非公开发行A股股票摊薄即期回报对公司主要财务指标的影响及公司拟采取的措施、相关主体的承诺的公告,finalpage/2016-08-20/1202592594.PDF
2016-08-20,京威股份：独立董事关于第三届董事会第三十七次会议相关事项的独立意见,finalpage/2016-08-20/1202592595.PDF
2016-08-20,京威股份：2016年非公开发行A股股票募集资金运用的可行性分析报告,finalpage/2016-08-20/1202592596.PDF
2016-08-20,京威股份：截至2015年12月31日止前次募集资金使用情况报告,finalpage/2016-08-20/1202592597.PDF
2016-08-20,京威股份：未来三年股东回报规划（2017-2019年）,finalpage/2016-08-20/1202592598.PDF
2016-08-20,京威股份：非公开发行A股股票预案,finalpage/2016-08-20/1202592599.PDF
2016-08-20,京威股份：截至2015年12月31日止前次募集资金使用情况鉴证报告,finalpage/2016-08-20/1202592600.PDF
2016-08-20,京威股份：关于召开2016年第二次临时股东大会的通知,finalpage/2016-08-20/1202592601.PDF
2016-09-02,京威股份：关于股东股权质押的公告,finalpage/2016-09-02/1202669332.PDF
2016-09-02,京威股份：关于股东股份解除质押的公告,finalpage/2016-09-02/1202669333.PDF
2016-09-06,京威股份：2016年第二次临时股东大会决议公告,finalpage/2016-09-06/1202676589.PDF
2016-09-06,京威股份：2016年第二次临时股东大会的法律意见书,finalpage/2016-09-06/1202676590.PDF
2016-09-09,京威股份：关于重大事项停牌公告,finalpage/2016-09-09/1202689364.PDF
2016-09-10,京威股份：关于重大事项复牌公告,finalpage/2016-09-10/1202690985.PDF
2016-09-12,京威股份：关于参股公司深圳市五洲龙汽车有限公司改制完成的公告,finalpage/2016-09-12/1202693630.PDF
2016-09-19,京威股份：关于收到《北京市发改委行政事项受理告知书》的提示性公告,finalpage/2016-09-19/1202702872.PDF
2016-10-11,京威股份：关于《在德国投资建设高端电动汽车研发生产基地项目备案事项进展》的提示性公告,finalpage/2016-10-11/1202747780.PDF
2016-10-22,京威股份：2016年第三季度报告正文,finalpage/2016-10-22/1202775780.PDF
2016-10-22,京威股份：2016年第三季度报告全文,finalpage/2016-10-22/1202775781.PDF
2016-11-24,京威股份：第三届董事会第三十九次会议决议公告,finalpage/2016-11-24/1202840621.PDF
2016-11-25,京威股份：关于《德国投资建设高端电动汽车研发生产基地项目获得国家发改委备案》的提示性公告,finalpage/2016-11-25/1202842508.PDF
2016-11-26,京威股份：关于参股公司无锡星亿智能环保装备有限公司改制完成的公告,finalpage/2016-11-26/1202844831.PDF
2016-12-06,京威股份：“15京威债”2016年付息公告,finalpage/2016-12-06/1202858828.PDF
2016-12-07,京威股份：关于公司收到德方股东2.7亿元赔偿款的公告,finalpage/2016-12-07/1202861426.PDF
2016-12-15,京威股份：第三届董事会第四十次会议决议公告,finalpage/2016-12-15/1202876624.PDF
2016-12-15,京威股份：独立董事候选人声明（金锦萍）,finalpage/2016-12-15/1202876615.PDF
2016-12-15,京威股份：独立董事候选人声明（马朝松）,finalpage/2016-12-15/1202876616.PDF
2016-12-15,京威股份：独立董事候选人声明（郑元武）,finalpage/2016-12-15/1202876617.PDF
2016-12-15,京威股份：独立董事提名人声明（一）,finalpage/2016-12-15/1202876618.PDF
2016-12-15,京威股份：独立董事提名人声明（二）,finalpage/2016-12-15/1202876619.PDF
2016-12-15,京威股份：独立董事提名人声明（三）,finalpage/2016-12-15/1202876620.PDF
2016-12-15,京威股份：关于召开2016年第三次临时股东大会的通知,finalpage/2016-12-15/1202876621.PDF
2016-12-15,京威股份：独立董事关于第三届董事会第四十次会议相关事项的独立意见,finalpage/2016-12-15/1202876622.PDF
2016-12-15,京威股份：第三届监事会第十六次会议决议公告,finalpage/2016-12-15/1202876623.PDF
2016-12-21,京威股份：关于首次公开发行前已发行股份上市流通的提示性公告,finalpage/2016-12-21/1202907187.PDF
2016-12-31,京威股份：2016年第三次临时股东大会决议公告,finalpage/2016-12-31/1202983003.PDF
2016-12-31,京威股份：2016年第三次临时股东大会的法律意见书,finalpage/2016-12-31/1202983004.PDF
2016-12-31,京威股份：关于股东股份解除质押的公告,finalpage/2016-12-31/1202983183.PDF
2016-12-31,京威股份：关于股东股权质押的公告,finalpage/2016-12-31/1202983184.PDF
2016-12-31,京威股份：关于参股公司江苏卡威汽车工业集团有限公司改制完成的公告,finalpage/2016-12-31/1202983185.PDF
2016-12-31,京威股份：第四届董事会第一次会议决议公告,finalpage/2016-12-31/1202983471.PDF
2016-12-31,京威股份：关于选举职工代表董事的公告,finalpage/2016-12-31/1202983472.PDF
2016-12-31,京威股份：关于选举职工代表监事的公告,finalpage/2016-12-31/1202983473.PDF
2016-12-31,京威股份：第四届监事会第一次会议决议公告,finalpage/2016-12-31/1202983474.PDF
2016-12-31,京威股份：独立董事关于第四届董事会第一次会议相关事项的独立意见,finalpage/2016-12-31/1202983475.PDF
2017-01-11,京威股份：关于股东股权质押的公告,finalpage/2017-01-11/1203004700.PDF
2017-01-20,京威股份：关于股东股权质押及解除质押的公告,finalpage/2017-01-20/1203031032.PDF
2017-01-23,京威股份：关于对外投资公司设立完成的公告,finalpage/2017-01-23/1203038249.PDF
2017-01-23,京威股份：关于参股公司深圳五洲龙公司引进战略投资者的公告,finalpage/2017-01-23/1203038250.PDF
2017-02-20,京威股份：关于合资组建《宁波京威动力电池有限公司》与合作方签署《战略合作框架协议》的公告,finalpage/2017-02-20/1203093226.PDF
2017-02-22,京威股份：关于2016年度利润分配及资本公积转增股本预案的预披露公告,finalpage/2017-02-22/1203100063.PDF
2017-02-22,京威股份：2016年度业绩快报,finalpage/2017-02-22/1203097119.PDF
2017-03-08,京威股份：第四届监事会第二次会议决议公告,finalpage/2017-03-08/1203138580.PDF
2017-03-08,京威股份：2016年度独立董事述职报告,finalpage/2017-03-08/1203138581.PDF
2017-03-08,京威股份：2016年度内部控制自我评价报告,finalpage/2017-03-08/1203138582.PDF
2017-03-08,京威股份：2017年度日常关联交易预测公告,finalpage/2017-03-08/1203138583.PDF
2017-03-08,京威股份：内部控制规则落实自查表,finalpage/2017-03-08/1203138584.PDF
2017-03-08,京威股份：董事会关于募集资金2016年度存放与使用情况的专项报告,finalpage/2017-03-08/1203138585.PDF
2017-03-08,京威股份：关于举行2016年年度报告网上说明会的通知,finalpage/2017-03-08/1203138586.PDF
2017-03-08,京威股份：独立董事对相关事项的事前认可意见,finalpage/2017-03-08/1203138587.PDF
2017-03-08,京威股份：国信证券股份有限公司关于公司2014年发行股份购买资产之标的公司业绩实现及减值测试的核查意见,finalpage/2017-03-08/1203138588.PDF
2017-03-08,京威股份：2016年年度报告,finalpage/2017-03-08/1203138589.PDF
2017-03-08,京威股份：关于宁波福尔达智能科技有限公司股东权益价值2016年12月31日减值测试报告的专项审核报告,finalpage/2017-03-08/1203138590.PDF
2017-03-08,京威股份：关于宁波福尔达智能科技有限公司业绩补偿协议执行情况的专项审核报告,finalpage/2017-03-08/1203138591.PDF
2017-03-08,京威股份：关于秦皇岛威卡威汽车零部件有限公司业绩补偿协议执行情况的专项审核报告,finalpage/2017-03-08/1203138592.PDF
2017-03-08,京威股份：关于召开2016年度股东大会的通知,finalpage/2017-03-08/1203138593.PDF
2017-03-08,京威股份：2016年年度审计报告,finalpage/2017-03-08/1203138594.PDF
2017-03-08,京威股份：2016年度募集资金年度存放与使用情况鉴证报告,finalpage/2017-03-08/1203138595.PDF
2017-03-08,京威股份：独立董事对第四届董事会第二次会议相关事项的独立意见,finalpage/2017-03-08/1203138596.PDF
2017-03-08,京威股份：2016年度控股股东及其他关联人资金占用情况的专项说明,finalpage/2017-03-08/1203138597.PDF
2017-03-08,京威股份：2016年年度报告摘要,finalpage/2017-03-08/1203138598.PDF
2017-03-08,京威股份：关于对秦皇岛威卡威汽车零部件有限公司股东权益价值2016年12月31日减值测试报告的专项审核报告,finalpage/2017-03-08/1203138599.PDF
2017-03-08,京威股份：第四届董事会第二次会议决议公告,finalpage/2017-03-08/1203138600.PDF
2017-03-10,京威股份：关于召开2017年第一次临时股东大会的通知,finalpage/2017-03-10/1203146133.PDF
2017-03-10,京威股份：非公开发行A股股票预案（修订稿）,finalpage/2017-03-10/1203146134.PDF
2017-03-10,京威股份：2016年非公开发行A股股票摊薄即期回报对公司主要财务指标的影响及公司拟采取的措施、相关主体的承诺的公告,finalpage/2017-03-10/1203146135.PDF
2017-03-10,京威股份：前次募集资金使用情况鉴证报告（截至2016年12月31日止）,finalpage/2017-03-10/1203146136.PDF
2017-03-10,京威股份：关于股东股权质押及解除质押的公告,finalpage/2017-03-10/1203146137.PDF
2017-03-10,京威股份：2016年非公开发行A股股票募集资金运用的可行性分析报告,finalpage/2017-03-10/1203146138.PDF
2017-03-10,京威股份：第四届董事会第三次会议决议公告,finalpage/2017-03-10/1203146139.PDF
2017-03-10,京威股份：第四届监事会第三次会议决议公告,finalpage/2017-03-10/1203146140.PDF
2017-03-10,京威股份：独立董事关于第四届董事会第三次会议相关事项的独立意见,finalpage/2017-03-10/1203146141.PDF
2017-03-11,京威股份：第四届董事会第四次会议决议公告,finalpage/2017-03-11/1203150130.PDF
2017-03-11,京威股份：关于对外投资设立宁波京威动力电池有限公司的公告,finalpage/2017-03-11/1203150131.PDF
2017-03-11,京威股份：关于召开2017年第一次临时股东大会的通知的更正公告,finalpage/2017-03-11/1203150132.PDF
2017-03-14,京威股份：关于召开2017年第一次临时股东大会的通知的更正公告,finalpage/2017-03-14/1203154578.PDF
2017-03-14,京威股份：关于对外投资设立宁波京威动力电池有限公司的进展公告,finalpage/2017-03-14/1203154579.PDF
2017-03-21,京威股份：关于与香港正道集团签署全面战略合作备忘录的公告,finalpage/2017-03-21/1203179800.PDF
2017-03-29,京威股份：2016年度股东大会决议公告,finalpage/2017-03-29/1203216528.PDF
2017-03-29,京威股份：2016年度股东大会的法律意见书,finalpage/2017-03-29/1203216529.PDF
2017-04-06,京威股份：关于成立宁波合资公司之补充协议的公告,finalpage/2017-04-06/1203252012.PDF
2017-04-07,京威股份：2017年第一次临时股东大会的法律意见书,finalpage/2017-04-07/1203258313.PDF
2017-04-07,京威股份：2017年第一次临时股东大会决议公告,finalpage/2017-04-07/1203258314.PDF
2017-04-13,京威股份：2016年年度权益分派实施公告,finalpage/2017-04-13/1203291050.PDF
2017-04-22,京威股份：公司债券2017年跟踪评级报告,finalpage/2017-04-22/1203358666.PDF
2017-04-28,京威股份：2017年第一季度报告正文,finalpage/2017-04-28/1203412945.PDF
2017-04-28,京威股份：2017年第一季度报告全文,finalpage/2017-04-28/1203412946.PDF
2017-05-03,京威股份：关于第四届董事会第六次会议决议的公告,finalpage/2017-05-03/1203470359.PDF
2017-05-03,京威股份：关于对外投资设立德国全资子公司的公告,finalpage/2017-05-03/1203470360.PDF
2017-05-03,京威股份：关于对外投资设立香港全资子公司的公告,finalpage/2017-05-03/1203470361.PDF
2017-05-12,京威股份：关于股东股权解除质押的公告,finalpage/2017-05-12/1203504760.PDF
2017-05-19,京威股份：关于第四届董事会第三次会议决议暨非公开发行股票方案调整的公告,finalpage/2017-05-19/1203536892.PDF
2017-05-19,京威股份：非公开发行A股股票预案（修订稿）,finalpage/2017-05-19/1203536893.PDF
2017-05-19,京威股份：第四届监事会第五次会议决议的公告,finalpage/2017-05-19/1203536894.PDF
2017-05-20,京威股份：投资者交流会公告,finalpage/2017-05-20/1203544462.PDF
2017-05-24,京威股份：关于完成注册资本工商登记变更的公告,finalpage/2017-05-24/1203560040.PDF
2017-06-02,京威股份：关于投资购买奥杰股份定向发行股份的公告,finalpage/2017-06-02/1203579497.PDF
2017-06-02,京威股份：关于国信证券发出债券持有人会议召开通知的公告,finalpage/2017-06-02/1203579823.PDF
2017-06-02,京威股份：国信证券股份有限公司关于召开“15京威债”2017年第一次债券持有人会议的通知,finalpage/2017-06-02/1203579824.PDF
2017-06-02,京威股份：国信证券股份有限公司关于召开“16京威01”2017年第一次债券持有人会议的通知,finalpage/2017-06-02/1203579825.PDF
2017-06-02,京威股份：国信证券股份有限公司关于召开“17京威债”2017年第一次债券持有人会议的通知,finalpage/2017-06-02/1203579826.PDF
2017-06-09,京威股份：关于公司先行全部自筹资金建设德国高端电动汽车研发生产基地项目的公告,finalpage/2017-06-09/1203602509.PDF
2017-06-16,京威股份：关于第四届董事会第九次会议决议的公告,finalpage/2017-06-16/1203617976.PDF
2017-06-16,京威股份：关于召开2017年第二次临时股东大会的通知,finalpage/2017-06-16/1203617977.PDF
2017-06-17,京威股份：关于召开2017年第二次临时股东大会的通知的更正公告,finalpage/2017-06-17/1203625436.PDF
2017-06-21,京威股份：关于召开2017年第二次临时股东大会的通知的更正公告,finalpage/2017-06-21/1203634405.PDF
2017-06-24,京威股份：2015年向合格投资者公开发行公司债券2017年第一次债券持有人会议决议公告,finalpage/2017-06-24/1203644058.PDF
2017-06-24,京威股份：北京市嘉源律师事务所关于公司2015年公司债券2017年第一次债券持有人会议之法律意见书,finalpage/2017-06-24/1203644059.PDF
2017-06-24,京威股份：2016年非公开发行公司债券2017年第一次债券持有人会议决议公告,finalpage/2017-06-24/1203644060.PDF
2017-06-24,京威股份：北京市嘉源律师事务所关于公司2016年公司债券（第一期）2017年第一次债券持有人会议之法律意见书,finalpage/2017-06-24/1203644061.PDF
2017-06-24,京威股份：2017年非公开发行公司债券2017年第一次债券持有人会议决议公告,finalpage/2017-06-24/1203644062.PDF
2017-06-24,京威股份：北京市嘉源律师事务所关于公司2017年公司债券2017年第一次债券持有人会议之法律意见书,finalpage/2017-06-24/1203644063.PDF
2017-06-30,京威股份：国信证券股份有限公司关于公司2015年公司债券（面向合格投资者）受托管理事务报告（2016年度）,finalpage/2017-06-30/1203664242.PDF
2017-07-04,京威股份：2017年第二次临时股东大会决议公告,finalpage/2017-07-04/1203677398.PDF
2017-07-04,京威股份：2017年第二次临时股东大会的法律意见书,finalpage/2017-07-04/1203677399.PDF
2017-07-04,京威股份：关于收到《中国证监会行政许可申请受理通知书》的公告,finalpage/2017-07-04/1203677400.PDF
2017-07-11,京威股份：关于购买苏州达思灵新能源科技有限公司23%股权的公告,finalpage/2017-07-11/1203692234.PDF
2017-07-11,京威股份：关于第四届董事会第十次会议决议的公告,finalpage/2017-07-11/1203692235.PDF
2017-07-20,京威股份：关于职工代表大会决议的公告,finalpage/2017-07-20/1203716531.PDF
2017-07-21,京威股份：关于公司在德国投资建设高端电动汽车研发生产基地进展情况的公告,finalpage/2017-07-21/1203722074.PDF
2017-07-22,京威股份：关于股东部分股权补充质押的公告,finalpage/2017-07-22/1203726586.PDF
2017-08-01,京威股份：关于第四届董事会第十一次会议决议的公告,finalpage/2017-08-01/1203744852.PDF
2017-08-01,京威股份：关于召开2017年第三次临时股东大会的通知,finalpage/2017-08-01/1203744853.PDF
2017-08-05,京威股份：关于第四届董事会第十二次会议决议的公告,finalpage/2017-08-05/1203766468.PDF
2017-08-05,京威股份：第四届监事会第六次会议决议的公告,finalpage/2017-08-05/1203766469.PDF
2017-08-05,京威股份：2017年度新增关联交易预计的公告,finalpage/2017-08-05/1203766470.PDF
2017-08-05,京威股份：关于参股公司深圳五洲龙公司引进战略投资者的进度公告,finalpage/2017-08-05/1203766471.PDF
2017-08-05,京威股份：独立董事关于公司关联方资金占用和对外担保情况的专项说明和独立意见,finalpage/2017-08-05/1203766472.PDF
2017-08-05,京威股份：董事会关于募集资金2017年1-6月存放与使用情况的专项报告,finalpage/2017-08-05/1203766473.PDF
2017-08-05,京威股份：独立董事关于公司2017年度新增关联交易预计的议案独立意见,finalpage/2017-08-05/1203766474.PDF
2017-08-05,京威股份：2017年半年度财务报告,finalpage/2017-08-05/1203766475.PDF
2017-08-05,京威股份：2017年半年度报告摘要,finalpage/2017-08-05/1203766477.PDF
2017-08-05,京威股份：2017年半年度报告,finalpage/2017-08-05/1203766478.PDF
2017-08-17,京威股份：2017年第三次临时股东大会决议公告,finalpage/2017-08-17/1203806489.PDF
2017-08-17,京威股份：2017年第三次临时股东大会的法律意见书,finalpage/2017-08-17/1203806490.PDF
2017-08-18,京威股份：关于股东部分股权补充质押的公告,finalpage/2017-08-18/1203808723.PDF
2017-08-24,京威股份：关于收到《中国证监会行政许可项目审查一次反馈意见通知书》的公告,finalpage/2017-08-24/1203855131.PDF
2017-09-14,京威股份：关于召开2017年第四次临时股东大会的通知公告,finalpage/2017-09-14/1203972214.PDF
