date,title,url
2011-09-16,永大集团：首次公开发行股票招股意向书摘要,finalpage/2011-09-16/59963072.PDF
2011-09-16,永大集团：首次公开发行股票招股意向书,finalpage/2011-09-16/59963055.PDF
2011-09-16,永大集团：第一届董事会第十次会议决议等,finalpage/2011-09-16/59963056.PDF
2011-09-16,永大集团：2010年第二次临时股东大会决议等,finalpage/2011-09-16/59963057.PDF
2011-09-16,永大集团：广发证券股份有限公司关于公司首次公开发行股票并上市之发行保荐书,finalpage/2011-09-16/59963058.PDF
2011-09-16,永大集团：广发证券股份有限公司关于公司首次公开发行股票并上市之发行保荐工作报告,finalpage/2011-09-16/59963059.PDF
2011-09-16,永大集团：财务报表及审计报告（2008年度、2009年度、2010年度及2011年1-6月）,finalpage/2011-09-16/59963060.PDF
2011-09-16,永大集团：关于公司于2011年6月30日的内部控制鉴证报告,finalpage/2011-09-16/59963061.PDF
2011-09-16,永大集团：关于公司非经常性损益明细表的专项鉴证意见（2008年度、2009年度、2010年度及2011年1-6月）,finalpage/2011-09-16/59963062.PDF
2011-09-16,永大集团：北京市君致律师事务所关于公司首次公开发行股票并上市的法律意见书,finalpage/2011-09-16/59963063.PDF
2011-09-16,永大集团：北京市君致律师事务所关于公司首次公开发行股票并上市的律师工作报告,finalpage/2011-09-16/59963064.PDF
2011-09-16,永大集团：公司章程（草案）,finalpage/2011-09-16/59963065.PDF
2011-09-16,永大集团：中国证监会关于核准公司首次公开发行股票的批复,finalpage/2011-09-16/59963066.PDF
2011-09-16,永大集团：首次公开发行股票初步询价及推介公告,finalpage/2011-09-16/59963067.PDF
2011-09-16,永大集团：北京市君致律师事务所关于公司首次公开发行股票并上市的补充法律意见书之一,finalpage/2011-09-16/59963068.PDF
2011-09-16,永大集团：北京市君致律师事务所关于公司首次公开发行股票并上市的补充法律意见书之三,finalpage/2011-09-16/59963069.PDF
2011-09-16,永大集团：北京市君致律师事务所关于公司首次公开发行股票并上市的补充法律意见书之二,finalpage/2011-09-16/59963070.PDF
2011-09-16,永大集团：北京市君致律师事务所关于公司首次公开发行股票并上市的补充法律意见书之四,finalpage/2011-09-16/59963071.PDF
2011-09-29,永大集团：首次公开发行股票网上路演公告,finalpage/2011-09-29/60015189.PDF
2011-09-30,永大集团：首次公开发行股票发行公告,finalpage/2011-09-30/60021982.PDF
2011-09-30,永大集团：首次公开发行股票投资风险特别公告,finalpage/2011-09-30/60021985.PDF
2011-09-30,永大集团：首次公开发行股票招股说明书,finalpage/2011-09-30/60021986.PDF
2011-09-30,永大集团：首次公开发行股票招股说明书摘要,finalpage/2011-09-30/60021987.PDF
2011-10-12,永大集团：首次公开发行股票网上定价发行申购情况及中签率公告,finalpage/2011-10-12/60045948.PDF
2011-10-12,永大集团：首次公开发行股票网下摇号中签及配售结果公告,finalpage/2011-10-12/60045950.PDF
2011-10-13,永大集团：首次公开发行股票网上定价发行摇号中签结果公告,finalpage/2011-10-13/60050197.PDF
2011-10-17,永大集团：北京市君致律师事务所关于公司首次公开发行的股票于深圳证券交易所上市的法律意见书,finalpage/2011-10-17/60060474.PDF
2011-10-17,永大集团：广发证券股份有限公司关于公司股票上市保荐书,finalpage/2011-10-17/60060475.PDF
2011-10-17,永大集团：首次公开发行股票上市公告书,finalpage/2011-10-17/60060476.PDF
2011-10-21,永大集团：2011年第二次临时董事会决议公告,finalpage/2011-10-21/60091794.PDF
2011-10-28,永大集团：关于吉林永大电气开关有限公司完成工商登记变更的公告,finalpage/2011-10-28/60126841.PDF
2011-10-28,永大集团：关于完成工商变更登记的公告,finalpage/2011-10-28/60126842.PDF
2011-10-28,永大集团：公司章程（2011年10月）,finalpage/2011-10-28/60126844.PDF
2011-11-12,永大集团：2011年第三次临时董事会决议公告,finalpage/2011-11-12/60192130.PDF
2011-11-12,永大集团：关于设立募集资金专用账户并签订募集资金专户存储三方监管协议和四方监管协议的公告,finalpage/2011-11-12/60192131.PDF
2011-11-12,永大集团：募集资金管理办法（2008年3月）,finalpage/2011-11-12/60192132.PDF
2011-11-12,永大集团：关于董事辞职的公告,finalpage/2011-11-12/60192349.PDF
2011-11-29,永大集团：以自筹资金预先投入募投项目的鉴证报告,finalpage/2011-11-29/60255007.PDF
2011-11-29,永大集团：广发证券股份有限公司关于公司以募集资金置换预先已投入募投项目自筹资金的专项意见,finalpage/2011-11-29/60255008.PDF
2011-11-29,永大集团：广发证券股份有限公司关于公司使用部分超募资金归还银行贷款事项的专项意见,finalpage/2011-11-29/60255009.PDF
2011-11-29,永大集团：2011年第四次临时董事会决议公告,finalpage/2011-11-29/60255010.PDF
2011-11-29,永大集团：关于以募集资金置换预先已投入募投项目的自筹资金的公告,finalpage/2011-11-29/60255011.PDF
2011-11-29,永大集团：关于使用部分超募资金归还银行贷款的公告,finalpage/2011-11-29/60255012.PDF
2011-11-29,永大集团：内幕信息及知情人登记和报备制度（2011年11月）,finalpage/2011-11-29/60255013.PDF
2011-11-29,永大集团：独立董事关于使用募集资金置换已预先投入募投项目的自筹资金的独立意见,finalpage/2011-11-29/60255014.PDF
2011-11-29,永大集团：独立董事关于使用部分超募资金归还银行贷款的独立意见,finalpage/2011-11-29/60255015.PDF
2011-11-29,永大集团：第二届监事会第二次临时会议决议公告,finalpage/2011-11-29/60255016.PDF
2012-01-13,永大集团：关于网下配售股份上市流通的提示性公告,finalpage/2012-01-13/60438743.PDF
2012-01-20,永大集团：2011年度业绩预告,finalpage/2012-01-20/60468794.PDF
2012-02-28,永大集团：2011年度业绩快报,finalpage/2012-02-28/60593078.PDF
2012-03-20,永大集团：关于召开2012年第一次临时股东大会的通知,finalpage/2012-03-20/60692720.PDF
2012-03-20,永大集团：会计师事务所选聘制度（2012年3月）,finalpage/2012-03-20/60692721.PDF
2012-03-20,永大集团：公司章程（2012年3月）,finalpage/2012-03-20/60692722.PDF
2012-03-20,永大集团：关于使用不超过八千万元自有闲置资金投资低风险银行短期理财产品的公告,finalpage/2012-03-20/60692723.PDF
2012-03-20,永大集团：关于监事辞职的公告,finalpage/2012-03-20/60692724.PDF
2012-03-20,永大集团：关于续聘会计师事务所的公告,finalpage/2012-03-20/60692725.PDF
2012-03-20,永大集团：内部审计工作制度（2012年3月）,finalpage/2012-03-20/60692726.PDF
2012-03-20,永大集团：参、控股公司管理制度（2012年3月）,finalpage/2012-03-20/60692727.PDF
2012-03-20,永大集团：外部信息报送和使用管理制度（2012年3月）,finalpage/2012-03-20/60692728.PDF
2012-03-20,永大集团：媒体来访和投资者调研接待工作管理制度（2012年3月）,finalpage/2012-03-20/60692729.PDF
2012-03-20,永大集团：定期报告编制管理制度（2012年3月）,finalpage/2012-03-20/60692730.PDF
2012-03-20,永大集团：审计委员会年报工作制度（2012年3月）,finalpage/2012-03-20/60692731.PDF
2012-03-20,永大集团：对外担保管理制度（2012年3月）,finalpage/2012-03-20/60692733.PDF
2012-03-20,永大集团：年报信息披露重大差错责任追究制度（2012年3月）,finalpage/2012-03-20/60692734.PDF
2012-03-20,永大集团：年报审核制度（2012年3月）,finalpage/2012-03-20/60692735.PDF
2012-03-20,永大集团：广发证券股份有限公司关于公司使用不超过八千万元自有闲置资金投资低风险银行短期理财产品的核查意见,finalpage/2012-03-20/60692736.PDF
2012-03-20,永大集团：独立董事关于第二届董事会第三次会议相关事项的独立意见,finalpage/2012-03-20/60692737.PDF
2012-03-20,永大集团：短期理财业务管理制度（2012年3月）,finalpage/2012-03-20/60692738.PDF
2012-03-20,永大集团：第二届监事会第三次会议决议公告,finalpage/2012-03-20/60692739.PDF
2012-03-20,永大集团：第二届董事会第三次会议决议公告,finalpage/2012-03-20/60692740.PDF
2012-03-20,永大集团：职工代表大会关于选举公司职工代表监事的决议公告,finalpage/2012-03-20/60692741.PDF
2012-03-20,永大集团：规范与关联方资金往来管理制度（2012年3月）,finalpage/2012-03-20/60692742.PDF
2012-03-20,永大集团：重大信息内部保密制度（2012年3月）,finalpage/2012-03-20/60692743.PDF
2012-03-20,永大集团：重大经营和投资决策管理制度（2012年3月）,finalpage/2012-03-20/60692744.PDF
2012-03-23,永大集团：关于签署《委托代办股份转让协议》的公告,finalpage/2012-03-23/60710847.PDF
2012-03-31,永大集团：2012年度第一季度业绩预告,finalpage/2012-03-31/60772237.PDF
2012-04-07,永大集团：2012年第一次临时股东大会决议公告,finalpage/2012-04-07/60794325.PDF
2012-04-07,永大集团：2012年第一次临时股东大会的法律意见书,finalpage/2012-04-07/60794326.PDF
2012-04-11,永大集团：第二届监事会第四次会议决议公告,finalpage/2012-04-11/60810159.PDF
2012-04-25,永大集团：2011年度财务决算报告,finalpage/2012-04-25/60898341.PDF
2012-04-25,永大集团：2011年年度报告摘要,finalpage/2012-04-25/60898342.PDF
2012-04-25,永大集团：2011年年度报告,finalpage/2012-04-25/60898344.PDF
2012-04-25,永大集团：2011年年度审计报告,finalpage/2012-04-25/60898345.PDF
2012-04-25,永大集团：第二届董事会第四次会议决议公告,finalpage/2012-04-25/60898346.PDF
2012-04-25,永大集团：关于召开2011年度股东大会的通知,finalpage/2012-04-25/60898347.PDF
2012-04-25,永大集团：第二届监事会第五次会议决议公告,finalpage/2012-04-25/60898348.PDF
2012-04-25,永大集团：2011年度非经营性资金占用及其他关联资金往来情况的专项说明,finalpage/2012-04-25/60898349.PDF
2012-04-25,永大集团：2011年度内部控制自我评价报告,finalpage/2012-04-25/60898350.PDF
2012-04-25,永大集团：董事会关于募集资金年度存放与使用情况的专项报告,finalpage/2012-04-25/60898351.PDF
2012-04-25,永大集团：关于公司截至2011年12月31日止募集资金年度使用情况专项鉴证报告,finalpage/2012-04-25/60898353.PDF
2012-04-25,永大集团：独立董事对2011年度相关事项发表的独立意见,finalpage/2012-04-25/60898354.PDF
2012-04-25,永大集团：2011年度独立董事述职报告（穆钢）,finalpage/2012-04-25/60898355.PDF
2012-04-25,永大集团：2012年第一季度报告正文,finalpage/2012-04-25/60898356.PDF
2012-04-25,永大集团：2012年第一季度报告全文,finalpage/2012-04-25/60898357.PDF
2012-04-25,永大集团：信息披露事务管理制度（2012年4月）,finalpage/2012-04-25/60898358.PDF
2012-04-25,永大集团：关于监事辞职的公告,finalpage/2012-04-25/60898359.PDF
2012-04-25,永大集团：关联交易决策制度（2012年4月）,finalpage/2012-04-25/60898360.PDF
2012-04-25,永大集团：广发证券股份有限公司关于公司2011年度内部控制自我评价报告的核查意见,finalpage/2012-04-25/60898361.PDF
2012-04-25,永大集团：广发证券股份有限公司关于公司2011年度募集资金存放与使用情况的专项核查意见,finalpage/2012-04-25/60898362.PDF
2012-04-25,永大集团：总经理工作细则（2012年4月）,finalpage/2012-04-25/60898363.PDF
2012-04-25,永大集团：投资者关系管理制度（2012年4月）,finalpage/2012-04-25/60898364.PDF
2012-04-25,永大集团：2011年度独立董事述职报告（张茂）,finalpage/2012-04-25/60898365.PDF
2012-04-25,永大集团：2011年度独立董事述职报告（韩波）,finalpage/2012-04-25/60898366.PDF
2012-04-25,永大集团：独立董事制度（2012年4月）,finalpage/2012-04-25/60898367.PDF
2012-04-25,永大集团：监事会议事规则（2012年4月）,finalpage/2012-04-25/60898368.PDF
2012-04-25,永大集团：股东大会议事规则（2012年4月）,finalpage/2012-04-25/60898369.PDF
2012-04-25,永大集团：董事会审计委员会议事规则（2012年4月）,finalpage/2012-04-25/60898370.PDF
2012-04-25,永大集团：董事会战略委员会议事规则（2012年4月）,finalpage/2012-04-25/60898371.PDF
2012-04-25,永大集团：董事会提名委员会议事规则（2012年4月）,finalpage/2012-04-25/60898372.PDF
2012-04-25,永大集团：董事会薪酬与考核委员会议事规则（2012年4月）,finalpage/2012-04-25/60898373.PDF
2012-04-25,永大集团：董事会议事规则（2012年4月）,finalpage/2012-04-25/60898374.PDF
2012-04-25,永大集团：重大信息内部报告制度（2012年4月）,finalpage/2012-04-25/60898375.PDF
2012-05-09,永大集团：关于举行2011年度报告网上说明会的公告,finalpage/2012-05-09/60970171.PDF
2012-05-18,永大集团：2011年度股东大会决议公告,finalpage/2012-05-18/61013241.PDF
2012-05-18,永大集团：2011年度股东大会的法律意见书,finalpage/2012-05-18/61013242.PDF
2012-05-31,永大集团：2011年年度权益分派实施公告,finalpage/2012-05-31/61068704.PDF
2012-06-21,永大集团：关于举办上市公司投资者接待日活动公告,finalpage/2012-06-21/61163516.PDF
2012-08-25,永大集团：关于内部审计机构负责人辞职的公告,finalpage/2012-08-25/61476638.PDF
2012-08-28,永大集团：2012年半年度报告摘要,finalpage/2012-08-28/61491236.PDF
2012-08-28,永大集团：2012年半年度报告,finalpage/2012-08-28/61491237.PDF
2012-08-28,永大集团：2012年半年度财务报告,finalpage/2012-08-28/61491238.PDF
2012-08-28,永大集团：第二届董事会第五次会议决议公告,finalpage/2012-08-28/61491239.PDF
2012-08-28,永大集团：第二届监事会第六次会议决议公告,finalpage/2012-08-28/61491240.PDF
2012-08-28,永大集团：独立董事关于控股股东及其他关联方占用公司资金及对外担保情况的专项说明和独立意见,finalpage/2012-08-28/61491241.PDF
2012-08-28,永大集团：公司章程（2012年8月）,finalpage/2012-08-28/61491242.PDF
2012-08-28,永大集团：关于召开2012年第二次临时股东大会的通知,finalpage/2012-08-28/61491243.PDF
2012-08-28,永大集团：关于聘任公司内部审计机构负责人的公告,finalpage/2012-08-28/61491244.PDF
2012-08-28,永大集团：独立董事关于聘任公司内部审计机构负责人的独立意见,finalpage/2012-08-28/61491245.PDF
2012-08-28,永大集团：董事会审计委员会关于提名公司内部审计机构负责人的专项意见,finalpage/2012-08-28/61491246.PDF
2012-09-17,永大集团：2012年第二次临时股东大会决议公告,finalpage/2012-09-17/61571663.PDF
2012-09-17,永大集团：2012年第二次临时股东大会的法律意见书,finalpage/2012-09-17/61571664.PDF
2012-10-16,永大集团：广发证券股份有限公司关于公司限售股份上市流通事项的核查意见,finalpage/2012-10-16/61660332.PDF
2012-10-16,永大集团：首次公开发行前已发行股份上市流通提示性公告,finalpage/2012-10-16/61660333.PDF
2012-10-24,永大集团：2012年第三季度报告正文,finalpage/2012-10-24/61693650.PDF
2012-10-24,永大集团：第二届董事会第六次会议决议公告,finalpage/2012-10-24/61693652.PDF
2012-10-24,永大集团：第二届监事会第七次会议决议公告,finalpage/2012-10-24/61693653.PDF
2012-10-24,永大集团：2012年第三季度报告全文,finalpage/2012-10-24/61693654.PDF
2012-10-24,永大集团：广发证券股份有限公司关于公司变更部分募投项目实施地点事项的专项核查意见,finalpage/2012-10-24/61693655.PDF
2012-10-24,永大集团：关于变更部分募投项目实施地点的公告,finalpage/2012-10-24/61693656.PDF
2012-10-24,永大集团：独立董事关于变更部分募投项目实施地点事项的独立意见,finalpage/2012-10-24/61693657.PDF
2012-10-30,永大集团：关于公司股东、关联方以及公司承诺履行情况的公告,finalpage/2012-10-30/61730745.PDF
2012-11-23,永大集团：关于使用部分超募资金购买用于募投项目建设土地使用权的公告,finalpage/2012-11-23/61827851.PDF
2012-11-23,永大集团：广发证券股份有限公司关于公司使用部分超募资金购买用于募投项目建设的土地使用权事项的专项核查意见,finalpage/2012-11-23/61827852.PDF
2012-11-23,永大集团：独立董事关于使用部分超募资金购买用于募投项目建设土地使用权事项的独立意见,finalpage/2012-11-23/61827853.PDF
2012-11-23,永大集团：第二届监事会第八次会议决议公告,finalpage/2012-11-23/61827854.PDF
2012-11-23,永大集团：第二届董事会第七次会议决议公告,finalpage/2012-11-23/61827855.PDF
2012-12-26,永大集团：关于变更募集资金专用账户并签订募集资金专户存储三方监管协议和四方监管协议的公告,finalpage/2012-12-26/61950595.PDF
2013-02-28,永大集团：2012年度业绩快报,finalpage/2013-02-28/62160758.PDF
2013-03-30,永大集团：2013年度第一季度业绩预告,finalpage/2013-03-30/62301660.PDF
2013-04-22,永大集团：2012年度监事会工作报告,finalpage/2013-04-22/62390372.PDF
2013-04-22,永大集团：2012年度财务决算报告,finalpage/2013-04-22/62390373.PDF
2013-04-22,永大集团：独立董事2012年度述职报告（张茂）,finalpage/2013-04-22/62390374.PDF
2013-04-22,永大集团：独立董事2012年度述职报告（穆钢）,finalpage/2013-04-22/62390375.PDF
2013-04-22,永大集团：2012年年度报告摘要,finalpage/2013-04-22/62390376.PDF
2013-04-22,永大集团：2012年年度报告,finalpage/2013-04-22/62390378.PDF
2013-04-22,永大集团：2012年年度审计报告,finalpage/2013-04-22/62390383.PDF
2013-04-22,永大集团：第二届董事会第八次会议决议公告,finalpage/2013-04-22/62390384.PDF
2013-04-22,永大集团：关于召开2012年度股东大会的通知,finalpage/2013-04-22/62390385.PDF
2013-04-22,永大集团：第二届监事会第九次会议决议公告,finalpage/2013-04-22/62390386.PDF
2013-04-22,永大集团：2012年度控股股东及其他关联方资金占用情况的专项说明,finalpage/2013-04-22/62390387.PDF
2013-04-22,永大集团：2012年度内部控制自我评价报告,finalpage/2013-04-22/62390388.PDF
2013-04-22,永大集团：内部控制鉴证报告,finalpage/2013-04-22/62390389.PDF
2013-04-22,永大集团：2012年募集资金年度存放与使用情况专项报告,finalpage/2013-04-22/62390390.PDF
2013-04-22,永大集团：关于公司截至2012年12月31日止募集资金年度使用情况专项鉴证报告,finalpage/2013-04-22/62390391.PDF
2013-04-22,永大集团：独立董事关于公司第二届董事会第八次会议相关事项的独立意见,finalpage/2013-04-22/62390392.PDF
2013-04-22,永大集团：独立董事2012年度述职报告（韩波）,finalpage/2013-04-22/62390394.PDF
2013-04-22,永大集团：2013年第一季度报告正文,finalpage/2013-04-22/62390397.PDF
2013-04-22,永大集团：2013年第一季度报告全文,finalpage/2013-04-22/62390401.PDF
2013-04-22,永大集团：公司章程（2013年4月）,finalpage/2013-04-22/62390405.PDF
2013-04-22,永大集团：关于举行2012年度报告网上说明会的公告,finalpage/2013-04-22/62390406.PDF
2013-04-22,永大集团：关于变更经营范围、延长营业执照中营业期限并换发营业执照的公告,finalpage/2013-04-22/62390407.PDF
2013-04-22,永大集团：关于签订《股份转让框架协议》的公告,finalpage/2013-04-22/62390409.PDF
2013-04-22,永大集团：关于续聘会计师事务所的公告,finalpage/2013-04-22/62390412.PDF
2013-04-22,永大集团：关于参股抚顺银行股份有限公司的公告,finalpage/2013-04-22/62390413.PDF
2013-04-22,永大集团：广发证券股份有限公司关于公司2012年度内部控制自我评价报告的核查意见,finalpage/2013-04-22/62390414.PDF
2013-04-22,永大集团：广发证券股份有限公司关于公司2012年度募集资金存放与使用情况的专项核查意见,finalpage/2013-04-22/62390415.PDF
2013-04-22,永大集团：广发证券股份有限公司关于公司参股抚顺银行事项的专项核查意见,finalpage/2013-04-22/62390416.PDF
2013-04-22,永大集团：公司章程修正案,finalpage/2013-04-22/62390417.PDF
2013-04-22,永大集团：审计委员会关于公司参股抚顺银行事项的事前审查意见,finalpage/2013-04-22/62390418.PDF
2013-04-22,永大集团：2012年度董事会工作报告,finalpage/2013-04-22/62390419.PDF
2013-04-22,永大集团：财务管理制度（2013年4月）,finalpage/2013-04-22/62390420.PDF
2013-05-04,永大集团：2013年第一次临时董事会决议公告,finalpage/2013-05-04/62455784.PDF
2013-05-04,永大集团：关于增资抚顺银行股份有限公司的公告,finalpage/2013-05-04/62455785.PDF
2013-05-04,永大集团：关于签订《抚顺银行股份有限公司增资入股协议书》的公告,finalpage/2013-05-04/62455786.PDF
2013-05-04,永大集团：关于增加2012年度股东大会临时提案暨召开2012年度股东大会补充通知的公告,finalpage/2013-05-04/62455787.PDF
2013-05-04,永大集团：广发证券股份有限公司关于公司增资抚顺银行事项的专项核查意见,finalpage/2013-05-04/62455788.PDF
2013-05-04,永大集团：独立董事关于公司增资抚顺银行事项的独立意见,finalpage/2013-05-04/62455789.PDF
2013-05-04,永大集团：董事会关于股东提请增加2012年度股东大会临时提案的意见,finalpage/2013-05-04/62455790.PDF
2013-05-04,永大集团：审计委员会关于公司增资抚顺银行事项的事前审查意见,finalpage/2013-05-04/62455791.PDF
2013-05-18,永大集团：2012年度股东大会决议公告,finalpage/2013-05-18/62501924.PDF
2013-05-18,永大集团：2012年度股东大会的法律意见书,finalpage/2013-05-18/62501925.PDF
2013-06-22,永大集团：关于举办2012年度业绩网上说明会的公告,finalpage/2013-06-22/62602508.PDF
2013-08-26,永大集团：2013年半年度报告摘要,finalpage/2013-08-26/62988772.PDF
2013-08-26,永大集团：2013年半年度报告,finalpage/2013-08-26/62988773.PDF
2013-08-26,永大集团：2013半年度财务报告,finalpage/2013-08-26/62988774.PDF
2013-08-26,永大集团：第二届董事会第九次会议决议公告,finalpage/2013-08-26/62988775.PDF
2013-08-26,永大集团：第二届监事会第十次会议决议公告,finalpage/2013-08-26/62988776.PDF
2013-08-26,永大集团：独立董事关于第二届董事会第九次会议相关事项的独立意见,finalpage/2013-08-26/62988777.PDF
2013-08-26,永大集团：2013年上半年度募集资金存放与使用情况专项报告,finalpage/2013-08-26/62988778.PDF
2013-10-24,永大集团：董事会秘书辞职公告,finalpage/2013-10-24/63188876.PDF
2013-10-29,永大集团：2013年第三季度报告正文,finalpage/2013-10-29/63208149.PDF
2013-10-29,永大集团：2013年第三季度报告全文,finalpage/2013-10-29/63208150.PDF
2013-10-29,永大集团：第二届董事会第十次会议决议公告,finalpage/2013-10-29/63208151.PDF
2013-10-29,永大集团：第二届监事会第十一次会议决议公告,finalpage/2013-10-29/63208152.PDF
2013-10-29,永大集团：关于聘任董事会秘书的公告,finalpage/2013-10-29/63208153.PDF
2013-10-29,永大集团：独立董事关于聘任董事会秘书的独立意见,finalpage/2013-10-29/63208154.PDF
2013-12-10,永大集团：关于重新签订募集资金专户存储三方监管协议和四方监管协议的公告,finalpage/2013-12-10/63358624.PDF
2013-12-14,永大集团：吉林永大科技有限公司关于将超募资金专项用于购买和装修北京营销总部和研发中心办公用房的公告,finalpage/2013-12-14/63376908.PDF
2013-12-14,永大集团：关于参股抚顺银行股份有限公司的公告,finalpage/2013-12-14/63376909.PDF
2013-12-14,永大集团：关于召开2013年第一次临时股东大会的通知,finalpage/2013-12-14/63376910.PDF
2013-12-14,永大集团：关于在北京设立全资子公司作为公司营销总部和研发中心的公告,finalpage/2013-12-14/63376911.PDF
2013-12-14,永大集团：关于续聘会计师事务所的公告,finalpage/2013-12-14/63376912.PDF
2013-12-14,永大集团：媒体质疑处理制度（2013年12月）,finalpage/2013-12-14/63376913.PDF
2013-12-14,永大集团：广发证券股份有限公司关于公司参股抚顺银行事项的专项核查意见,finalpage/2013-12-14/63376914.PDF
2013-12-14,永大集团：广发证券股份有限公司关于公司使用部分超募资金向全资子公司投资并专项用于购买和装修北京营销总部和研发中心办公用房事项的专项核查意见,finalpage/2013-12-14/63376915.PDF
2013-12-14,永大集团：独立董事关于公司第二届董事会第十一次会议相关事项的独立意见,finalpage/2013-12-14/63376916.PDF
2013-12-14,永大集团：第二届董事会第十一次会议决议公告,finalpage/2013-12-14/63376917.PDF
2013-12-30,永大集团：2013年第一次临时股东大会决议公告,finalpage/2013-12-30/63430775.PDF
