,date,title,url
410,2015-03-21,金安国纪：关于核销坏账事项的独立董事意见,finalpage/2015-03-21/1200722763.PDF
411,2015-03-26,金安国纪：关于使用闲置募集资金和自有资金购买银行理财产品的公告,finalpage/2015-03-26/1200740617.PDF
412,2015-03-28,金安国纪：关于使用自有资金购买银行理财产品的公告,finalpage/2015-03-28/1200754006.PDF
413,2015-04-03,金安国纪：关于使用自有资金购买银行理财产品的公告,finalpage/2015-04-03/1200782688.PDF
414,2015-04-09,金安国纪：关于使用闲置募集资金购买银行理财产品的公告,finalpage/2015-04-09/1200801078.PDF
415,2015-04-09,金安国纪：关于2014年度利润分配预案的预披露公告,finalpage/2015-04-09/1200801079.PDF
416,2015-04-09,金安国纪：关于股价异动的公告,finalpage/2015-04-09/1200801080.PDF
417,2015-04-14,金安国纪：关于股价异动的公告,finalpage/2015-04-14/1200826974.PDF
418,2015-04-15,金安国纪：关于使用自有资金购买银行理财产品的公告,finalpage/2015-04-15/1200831193.PDF
419,2015-04-17,金安国纪：关于再次通过高新技术企业认定的公告,finalpage/2015-04-17/1200844997.PDF
420,2015-04-18,"金安国纪：关于年产1,020万张中高等级覆铜板和出售半固化片600万米项目的进展公告",finalpage/2015-04-18/1200862185.PDF
421,2015-04-22,金安国纪：关于对临安项目追加投资的公告,finalpage/2015-04-22/1200882564.PDF
422,2015-04-22,金安国纪：关于举行2014年度网上业绩说明会的公告,finalpage/2015-04-22/1200882565.PDF
423,2015-04-22,金安国纪：2014年财务决算报告,finalpage/2015-04-22/1200882566.PDF
424,2015-04-22,金安国纪：2014年监事会工作报告,finalpage/2015-04-22/1200882567.PDF
425,2015-04-22,金安国纪：股东分红回报规划（2015-2017年）,finalpage/2015-04-22/1200882568.PDF
426,2015-04-22,金安国纪：证券投资管理制度（2015年4月）,finalpage/2015-04-22/1200882569.PDF
427,2015-04-22,金安国纪：关于公司会计政策变更的公告,finalpage/2015-04-22/1200882570.PDF
428,2015-04-22,金安国纪：关于使用部分闲置募集资金、超募资金和自有资金进行现金管理的公告,finalpage/2015-04-22/1200882571.PDF
429,2015-04-22,金安国纪：关于开展证券投资业务的公告,finalpage/2015-04-22/1200882572.PDF
430,2015-04-22,金安国纪：关于子公司安徽金辉科技有限公司PCB项目暂停投资建设的公告,finalpage/2015-04-22/1200882573.PDF
431,2015-04-22,金安国纪：关于对宁国项目追加投资的公告,finalpage/2015-04-22/1200882574.PDF
432,2015-04-22,金安国纪：2014年年度报告摘要,finalpage/2015-04-22/1200882575.PDF
433,2015-04-22,金安国纪：2014年年度报告,finalpage/2015-04-22/1200882576.PDF
434,2015-04-22,金安国纪：2014年年度审计报告,finalpage/2015-04-22/1200882577.PDF
435,2015-04-22,金安国纪：第三届董事会第三次会议决议公告,finalpage/2015-04-22/1200882578.PDF
436,2015-04-22,金安国纪：关于召开2014年度股东大会通知的公告,finalpage/2015-04-22/1200882579.PDF
437,2015-04-22,金安国纪：第三届监事会第三次会议决议公告,finalpage/2015-04-22/1200882580.PDF
438,2015-04-22,金安国纪：关于公司与关联方资金往来的专项审计报告,finalpage/2015-04-22/1200882581.PDF
439,2015-04-22,金安国纪：2014年度内部控制自我评价报告,finalpage/2015-04-22/1200882582.PDF
440,2015-04-22,金安国纪：内部控制鉴证报告,finalpage/2015-04-22/1200882583.PDF
441,2015-04-22,金安国纪：董事会关于年度募集资金存放与使用情况的专项报告,finalpage/2015-04-22/1200882584.PDF
442,2015-04-22,金安国纪：关于公司2014年度募集资金存放与使用情况的鉴证报告,finalpage/2015-04-22/1200882585.PDF
443,2015-04-22,金安国纪：独立董事关于公司第三届董事会第三次会议相关事项的独立意见,finalpage/2015-04-22/1200882586.PDF
444,2015-04-22,金安国纪：2014年度独立董事述职报告,finalpage/2015-04-22/1200882587.PDF
445,2015-04-22,金安国纪：内部控制规则落实自查表,finalpage/2015-04-22/1200882588.PDF
446,2015-04-22,金安国纪：华泰联合证券有限责任公司关于公司2014年度募集资金存放和使用情况的专项核查意见,finalpage/2015-04-22/1200882589.PDF
447,2015-04-22,金安国纪：华泰联合证券有限责任公司关于公司使用部分闲置募集资金、超募资金和自有资金进行现金管理的专项意见,finalpage/2015-04-22/1200882590.PDF
448,2015-04-25,金安国纪：2015年第一季度报告正文,finalpage/2015-04-25/1200905830.PDF
449,2015-04-25,金安国纪：2015年第一季度报告全文,finalpage/2015-04-25/1200905831.PDF
450,2015-05-13,金安国纪：2014年度股东大会决议公告,finalpage/2015-05-13/1201005922.PDF
451,2015-05-13,金安国纪：2014年度股东大会的法律意见,finalpage/2015-05-13/1201005923.PDF
452,2015-05-18,金安国纪：2014年度资本公积转增股本实施公告,finalpage/2015-05-18/1201021017.PDF
453,2015-05-18,金安国纪：关于股价异动的公告,finalpage/2015-05-18/1201021018.PDF
454,2015-05-23,金安国纪：关于全资子公司金联科技（金寨）有限公司进行暂停生产的公告,finalpage/2015-05-23/1201049968.PDF
455,2015-05-23,金安国纪：第三届董事会第五次会议决议公告,finalpage/2015-05-23/1201049969.PDF
456,2015-05-29,金安国纪：关于股价异动的公告,finalpage/2015-05-29/1201077702.PDF
457,2015-06-12,金安国纪：关于深圳证券交易所对公司2014年年报问询函的回复,finalpage/2015-06-12/1201139489.PDF
458,2015-06-17,金安国纪：第三届监事会第五次会议决议公告,finalpage/2015-06-17/1201159742.PDF
459,2015-06-17,金安国纪：关于召开2015年第一次临时股东大会通知的公告,finalpage/2015-06-17/1201159743.PDF
460,2015-06-17,金安国纪：第三届董事会第六次会议决议公告,finalpage/2015-06-17/1201159744.PDF
461,2015-06-17,金安国纪：《股东大会议事规则》修订对照表,finalpage/2015-06-17/1201159745.PDF
462,2015-06-19,金安国纪：关于股价异动的公告,finalpage/2015-06-19/1201169124.PDF
463,2015-06-27,金安国纪：重大事项停牌公告,finalpage/2015-06-27/1201201879.PDF
464,2015-07-03,金安国纪：2015年第一次临时股东大会决议公告,finalpage/2015-07-03/1201230642.PDF
465,2015-07-03,金安国纪：2015年第一次临时股东大会的法律意见,finalpage/2015-07-03/1201230643.PDF
466,2015-07-04,金安国纪：重大事项继续停牌公告,finalpage/2015-07-04/1201236766.PDF
467,2015-07-09,金安国纪：重大事项停牌进展公告,finalpage/2015-07-09/1201259922.PDF
468,2015-07-11,金安国纪：关于积极实施维护证券市场稳定举措的公告,finalpage/2015-07-11/1201273974.PDF
469,2015-07-11,金安国纪：重大事项继续停牌公告,finalpage/2015-07-11/1201273975.PDF
470,2015-07-18,金安国纪：重大事项继续停牌公告,finalpage/2015-07-18/1201309607.PDF
471,2015-07-25,金安国纪：重大事项继续停牌公告,finalpage/2015-07-25/1201342397.PDF
472,2015-08-01,金安国纪：重大事项继续停牌公告,finalpage/2015-08-01/1201375090.PDF
473,2015-08-08,金安国纪：重大事项继续停牌公告,finalpage/2015-08-08/1201407039.PDF
474,2015-08-13,金安国纪：关于完成注册资本工商变更登记的公告,finalpage/2015-08-13/1201428300.PDF
475,2015-08-15,金安国纪：重大事项继续停牌公告,finalpage/2015-08-15/1201438444.PDF
476,2015-08-20,金安国纪：关于2015年上半年度募集资金存放与使用情况的专项报告,finalpage/2015-08-20/1201461093.PDF
477,2015-08-20,金安国纪：2015年半年度报告摘要,finalpage/2015-08-20/1201461094.PDF
478,2015-08-20,金安国纪：2015年半年度报告,finalpage/2015-08-20/1201461095.PDF
479,2015-08-20,金安国纪：2015年半年度财务报告,finalpage/2015-08-20/1201461096.PDF
480,2015-08-20,金安国纪：第三届董事会第七次会议决议公告,finalpage/2015-08-20/1201461097.PDF
481,2015-08-20,金安国纪：第三届监事会第六次会议决议公告,finalpage/2015-08-20/1201461098.PDF
482,2015-08-20,金安国纪：独立董事关于公司第三届董事会第七次会议相关事项的独立意见,finalpage/2015-08-20/1201461099.PDF
483,2015-08-22,金安国纪：重大事项继续停牌公告,finalpage/2015-08-22/1201473027.PDF
484,2015-08-29,金安国纪：重大事项继续停牌公告,finalpage/2015-08-29/1201518033.PDF
485,2015-09-09,金安国纪：重大事项停牌进展的补充公告,finalpage/2015-09-09/1201571633.PDF
486,2015-09-09,金安国纪：重大事项继续停牌公告,finalpage/2015-09-09/1201568226.PDF
487,2015-09-11,金安国纪：重大资产重组停牌公告,finalpage/2015-09-11/1201578278.PDF
488,2015-09-18,金安国纪：重大资产重组停牌进展公告,finalpage/2015-09-18/1201608270.PDF
489,2015-09-25,金安国纪：重大资产重组停牌进展公告,finalpage/2015-09-25/1201635062.PDF
490,2015-10-09,金安国纪：重大资产重组停牌进展公告,finalpage/2015-10-09/1201669053.PDF
491,2015-10-10,金安国纪：关于公司股票延期复牌的公告,finalpage/2015-10-10/1201674124.PDF
492,2015-10-16,金安国纪：重大资产重组停牌进展公告,finalpage/2015-10-16/1201699356.PDF
493,2015-10-20,金安国纪：关于设立投资者咨询专线的公告,finalpage/2015-10-20/1201708552.PDF
494,2015-10-23,金安国纪：重大资产重组停牌进展公告,finalpage/2015-10-23/1201715378.PDF
495,2015-10-28,金安国纪：2015年第三季度报告正文,finalpage/2015-10-28/1201731148.PDF
496,2015-10-28,金安国纪：2015年第三季度报告全文,finalpage/2015-10-28/1201731153.PDF
497,2015-10-30,金安国纪：重大资产重组停牌进展公告,finalpage/2015-10-30/1201740051.PDF
498,2015-11-06,金安国纪：重大资产重组停牌进展公告,finalpage/2015-11-06/1201755306.PDF
499,2015-11-13,金安国纪：重大资产重组停牌进展公告,finalpage/2015-11-13/1201766505.PDF
500,2015-11-19,金安国纪：第三届董事会第九次会议决议公告,finalpage/2015-11-19/1201777684.PDF
501,2015-11-19,金安国纪：关于公司为控股子公司提供担保额度的公告,finalpage/2015-11-19/1201777685.PDF
502,2015-11-19,金安国纪：关于召开2015年第二次临时股东大会通知的公告,finalpage/2015-11-19/1201777686.PDF
503,2015-11-19,金安国纪：独立董事关于公司第三届董事会第九次会议相关事项的独立意见,finalpage/2015-11-19/1201777687.PDF
504,2015-11-19,金安国纪：关于重大资产重组继续停牌的公告,finalpage/2015-11-19/1201777688.PDF
505,2015-11-20,金安国纪：重大资产重组停牌进展公告,finalpage/2015-11-20/1201778933.PDF
506,2015-11-21,"金安国纪：关于“年产1,440万米电子级玻纤布项目”提前三个月顺利完成的公告",finalpage/2015-11-21/1201782728.PDF
507,2015-11-21,金安国纪：关于公司股东追加承诺的公告,finalpage/2015-11-21/1201782729.PDF
508,2015-11-27,金安国纪：重大资产重组停牌进展公告,finalpage/2015-11-27/1201790014.PDF
509,2015-11-27,金安国纪：关于公司股东追加承诺的进展公告,finalpage/2015-11-27/1201790015.PDF
510,2015-12-04,金安国纪：关于重大资产重组停牌进展公告,finalpage/2015-12-04/1201804793.PDF
511,2015-12-05,金安国纪：2015年第二次临时股东大会决议公告,finalpage/2015-12-05/1201808944.PDF
512,2015-12-05,金安国纪：2015年第二次临时股东大会的法律意见,finalpage/2015-12-05/1201808945.PDF
513,2015-12-09,金安国纪：关于重大资产重组进展情况暨继续停牌公告,finalpage/2015-12-09/1201821381.PDF
514,2015-12-14,金安国纪：北京市天元律师事务所关于公司重大资产重组股票交易自查期间内相关人员买卖股票行为的专项法律意见,finalpage/2015-12-14/1201832036.PDF
515,2015-12-14,金安国纪：第三届董事会第十次会议决议公告,finalpage/2015-12-14/1201832037.PDF
516,2015-12-14,金安国纪：第三届监事会第八次会议决议公告,finalpage/2015-12-14/1201832038.PDF
517,2015-12-14,金安国纪：东方花旗证券有限公司关于公司连续停牌前股票价格未发生异动的核查意见,finalpage/2015-12-14/1201832039.PDF
518,2015-12-14,金安国纪：东方花旗证券有限公司关于公司发行股份及支付现金购买资产并募集配套资金暨关联交易预案之独立财务顾问核查意见,finalpage/2015-12-14/1201832040.PDF
519,2015-12-14,金安国纪：董事会关于重组履行法定程序的完备性、合规性及提交的法律文件的有效性说明,finalpage/2015-12-14/1201832041.PDF
520,2015-12-14,金安国纪：关于成立覆铜板事业部的公告,finalpage/2015-12-14/1201832042.PDF
521,2015-12-14,金安国纪：关于公司股票暂不复牌的提示性公告,finalpage/2015-12-14/1201832043.PDF
522,2015-12-14,金安国纪：关于重大资产重组的一般风险提示性公告,finalpage/2015-12-14/1201832044.PDF
523,2015-12-14,金安国纪：关于提供材料真实、准确、完整的承诺函,finalpage/2015-12-14/1201832045.PDF
524,2015-12-14,金安国纪：董事会关于连续停牌前股票价格未发生异动说明,finalpage/2015-12-14/1201832046.PDF
525,2015-12-14,金安国纪：独立董事关于公司发行股份及支付现金购买资产并募集配套资金暨关联交易之重大资产重组事项的独立意见,finalpage/2015-12-14/1201832047.PDF
526,2015-12-14,金安国纪：独立董事关于公司发行股份及支付现金购买资产并募集配套资金暨关联交易之重大资产重组事项的事前认可意见,finalpage/2015-12-14/1201832048.PDF
527,2015-12-14,金安国纪：公司及其全体董事关于发行股份及支付现金购买资产并募集配套资金暨关联交易预案真实、准确、完整的承诺函,finalpage/2015-12-14/1201832049.PDF
528,2015-12-14,金安国纪：发行股份及支付现金购买资产并募集配套资金暨关联交易预案,finalpage/2015-12-14/1201832050.PDF
529,2015-12-16,金安国纪：关于重大资产重组停牌进展公告,finalpage/2015-12-16/1201836103.PDF
530,2015-12-22,金安国纪：关于深圳证券交易所重组问询函的回复公告,finalpage/2015-12-22/1201850556.PDF
531,2015-12-22,金安国纪：关于发行股份及支付现金购买资产并募集配套资金暨关联交易预案的修订说明公告,finalpage/2015-12-22/1201850557.PDF
532,2015-12-22,金安国纪：关于公司股票复牌的提示性公告,finalpage/2015-12-22/1201850558.PDF
533,2015-12-22,金安国纪：发行股份及支付现金购买资产并募集配套资金暨关联交易预案（修订稿）,finalpage/2015-12-22/1201850559.PDF
534,2015-12-22,金安国纪：北京市天元律师事务所关于公司发行股份及支付现金购买资产并募集配套资金暨关联交易预案相关问题的专项法律意见,finalpage/2015-12-22/1201850560.PDF
535,2015-12-22,金安国纪：东方花旗证券有限公司关于公司重组问询函之专项核查意见,finalpage/2015-12-22/1201850561.PDF
536,2015-12-22,金安国纪：关于对公司的重组问询函的答复,finalpage/2015-12-22/1201850562.PDF
537,2015-12-22,金安国纪：关于对公司重组问询函相关问题回复,finalpage/2015-12-22/1201850563.PDF
538,2015-12-24,金安国纪：关于股价异动的公告,finalpage/2015-12-24/1201853900.PDF
539,2015-12-30,金安国纪：关于使用自有资金购买银行理财产品的公告,finalpage/2015-12-30/1201873767.PDF
540,2016-01-04,金安国纪：关于使用闲置募集资金购买银行理财产品的公告,finalpage/2016-01-04/1201884662.PDF
541,2016-01-04,金安国纪：关于深圳证券交易所问询函的回复,finalpage/2016-01-04/1201884663.PDF
542,2016-01-04,金安国纪：东方花旗证券有限公司关于公司深圳证券交易所问询函之专项核查意见,finalpage/2016-01-04/1201884664.PDF
543,2016-01-04,金安国纪：北京市天元律师事务所关于公司发行股份及支付现金购买资产并募集配套资金暨关联交易预案相关问题的专项法律意见（二）,finalpage/2016-01-04/1201884665.PDF
544,2016-01-09,金安国纪：关于重大资产重组进展公告,finalpage/2016-01-09/1201903196.PDF
545,2016-01-09,金安国纪：关于证券事务代表辞职的公告,finalpage/2016-01-09/1201903197.PDF
546,2016-01-13,金安国纪：关于使用闲置募集资金购买银行理财产品的公告,finalpage/2016-01-13/1201908052.PDF
547,2016-01-22,金安国纪：关于使用自有资金购买银行理财产品的公告,finalpage/2016-01-22/1201931731.PDF
548,2016-01-28,金安国纪：关于使用自有资金购买银行理财产品的公告,finalpage/2016-01-28/1201946380.PDF
549,2016-02-06,金安国纪：关于重大资产重组进展公告,finalpage/2016-02-06/1201974369.PDF
550,2016-02-22,金安国纪：签署《关于杭州联合电路板有限公司之股权转让框架协议》的公告,finalpage/2016-02-22/1201988829.PDF
551,2016-02-27,金安国纪：2015年度业绩快报,finalpage/2016-02-27/1202004150.PDF
552,2016-02-27,金安国纪：关于公司及子公司核销坏账的公告,finalpage/2016-02-27/1202004151.PDF
553,2016-02-27,金安国纪：第三届董事会第十一次决议的公告,finalpage/2016-02-27/1202004152.PDF
554,2016-02-27,金安国纪：关于第三届董事会第十一次会议相关事项的独立董事意见,finalpage/2016-02-27/1202004153.PDF
555,2016-02-27,金安国纪：第三届监事会第九次会议决议公告,finalpage/2016-02-27/1202004154.PDF
556,2016-03-03,金安国纪：关于使用闲置募集资金和自有资金购买银行理财产品的公告,finalpage/2016-03-03/1202018713.PDF
557,2016-03-05,金安国纪：关于重大资产重组进展公告,finalpage/2016-03-05/1202024121.PDF
558,2016-03-09,金安国纪：重大事项停牌公告,finalpage/2016-03-09/1202030763.PDF
559,2016-03-11,金安国纪：独立董事关于第三届董事会第十二次会议相关事项的独立意见,finalpage/2016-03-11/1202037170.PDF
560,2016-03-11,金安国纪：关于使用闲置募集资金购买银行理财产品的公告,finalpage/2016-03-11/1202037171.PDF
561,2016-03-11,金安国纪：第三届董事会第十二次会议决议公告,finalpage/2016-03-11/1202037172.PDF
562,2016-03-11,金安国纪：关于终止重大资产重组召开投资者说明会的公告,finalpage/2016-03-11/1202037173.PDF
563,2016-03-11,金安国纪：关于终止重大资产重组事项暨复牌的公告,finalpage/2016-03-11/1202037174.PDF
564,2016-03-16,金安国纪：关于投资者说明会召开情况的公告,finalpage/2016-03-16/1202048190.PDF
565,2016-03-18,金安国纪：关于深圳证券交易所关注函回复的公告,finalpage/2016-03-18/1202055303.PDF
566,2016-03-19,金安国纪：关于使用自有资金购买银行理财产品的公告,finalpage/2016-03-19/1202057433.PDF
567,2016-03-31,金安国纪：关于使用自有资金购买银行理财产品的公告,finalpage/2016-03-31/1202110175.PDF
568,2016-04-02,金安国纪：关于第三届董事会第十三次会议相关事项的独立董事意见,finalpage/2016-04-02/1202132188.PDF
569,2016-04-02,金安国纪：第三届董事会第十三次会议决议公告,finalpage/2016-04-02/1202132189.PDF
570,2016-04-02,金安国纪：关于收购杭州联合电路板有限公司100%股权的公告,finalpage/2016-04-02/1202132190.PDF
571,2016-04-02,金安国纪：关于转让子公司股权的公告,finalpage/2016-04-02/1202132191.PDF
572,2016-04-02,金安国纪：关于对宁国项目追加投资的公告,finalpage/2016-04-02/1202132192.PDF
573,2016-04-02,金安国纪：第三届监事会第十次会议决议公告,finalpage/2016-04-02/1202132193.PDF
574,2016-04-02,金安国纪：关于使用自有资金购买银行理财产品的公告,finalpage/2016-04-02/1202132194.PDF
575,2016-04-12,金安国纪：2016年第一季度业绩预告,finalpage/2016-04-12/1202168485.PDF
576,2016-04-13,金安国纪：关于使用闲置募集资金购买银行理财产品的公告,finalpage/2016-04-13/1202168891.PDF
577,2016-04-15,金安国纪：关于使用闲置募集资金购买银行理财产品的公告,finalpage/2016-04-15/1202178850.PDF
578,2016-04-21,金安国纪：关于使用自有资金购买银行理财产品的公告,finalpage/2016-04-21/1202211639.PDF
579,2016-04-22,金安国纪：2015年年度报告摘要,finalpage/2016-04-22/1202218154.PDF
580,2016-04-22,金安国纪：2015年年度审计报告,finalpage/2016-04-22/1202218155.PDF
581,2016-04-22,金安国纪：第三届董事会第十四次会议决议公告,finalpage/2016-04-22/1202218156.PDF
582,2016-04-22,金安国纪：关于召开2015年度股东大会通知的公告,finalpage/2016-04-22/1202218157.PDF
583,2016-04-22,金安国纪：第三届监事会第十一次会议决议公告,finalpage/2016-04-22/1202218158.PDF
584,2016-04-22,金安国纪：关于公司2015年度控股股东、实际控制人及其他关联方占用资金情况的专项审计报告（已取消）,finalpage/2016-04-22/1202218159.PDF
585,2016-04-22,金安国纪：董事会关于年度募集资金存放与使用情况的专项报告,finalpage/2016-04-22/1202218160.PDF
586,2016-04-22,金安国纪：关于公司2015年度募集资金存放与使用情况的鉴证报告,finalpage/2016-04-22/1202218161.PDF
587,2016-04-22,金安国纪：2015年度独立董事述职报告,finalpage/2016-04-22/1202218162.PDF
588,2016-04-22,金安国纪：2015年年度报告,finalpage/2016-04-22/1202218163.PDF
589,2016-04-22,金安国纪：关于受让子公司25%股权的公告,finalpage/2016-04-22/1202218164.PDF
590,2016-04-22,金安国纪：关于举行2015年度网上业绩说明会的公告,finalpage/2016-04-22/1202218165.PDF
591,2016-04-22,金安国纪：独立董事关于公司第三届董事会第十四次会议相关事项的独立意见,finalpage/2016-04-22/1202218166.PDF
592,2016-04-22,金安国纪：华泰联合证券有限责任公司关于公司2015年度募集资金存放和使用情况的专项核查意见,finalpage/2016-04-22/1202218167.PDF
593,2016-04-22,金安国纪：内部控制规则落实自查表,finalpage/2016-04-22/1202218168.PDF
594,2016-04-22,金安国纪：2015年监事会工作报告,finalpage/2016-04-22/1202218169.PDF
595,2016-04-22,金安国纪：2015年财务决算报告,finalpage/2016-04-22/1202218170.PDF
596,2016-04-22,金安国纪：2015年度内部控制自我评价报告,finalpage/2016-04-22/1202218171.PDF
597,2016-04-22,金安国纪：内部控制鉴证报告,finalpage/2016-04-22/1202218174.PDF
598,2016-04-23,金安国纪：关于公司2015年度控股股东、实际控制人及其他关联方占用资金情况的专项审计报告（更新后）,finalpage/2016-04-23/1202227790.PDF
599,2016-04-23,金安国纪：补充公告,finalpage/2016-04-23/1202227791.PDF
600,2016-04-23,金安国纪：关于使用自有资金购买银行理财产品的公告,finalpage/2016-04-23/1202227792.PDF
601,2016-04-23,金安国纪：关于子公司股权转让完成的公告,finalpage/2016-04-23/1202227793.PDF
602,2016-04-27,金安国纪：2016年第一季度报告正文,finalpage/2016-04-27/1202248119.PDF
603,2016-04-27,金安国纪：2016年第一季度报告全文,finalpage/2016-04-27/1202248121.PDF
604,2016-05-05,金安国纪：关于使用自有资金购买银行理财产品的公告,finalpage/2016-05-05/1202294222.PDF
605,2016-05-07,金安国纪：关于杭州联合电路板有限公司100%股权收购完成的公告,finalpage/2016-05-07/1202303087.PDF
606,2016-05-07,金安国纪：关于公司商标被认定为上海市著名商标的公告,finalpage/2016-05-07/1202303088.PDF
607,2016-05-13,金安国纪：2015年度股东大会的法律意见,finalpage/2016-05-13/1202319329.PDF
608,2016-05-13,金安国纪：2015年度股东大会决议公告,finalpage/2016-05-13/1202319330.PDF
609,2016-05-20,金安国纪：关于使用闲置募集资金购买银行理财产品的公告,finalpage/2016-05-20/1202330516.PDF
610,2016-06-04,金安国纪：关于使用自有资金购买银行理财产品的公告,finalpage/2016-06-04/1202355575.PDF
611,2016-06-13,金安国纪：关于子公司股权受让完成公告,finalpage/2016-06-13/1202363041.PDF
612,2016-06-13,金安国纪：关于年产660万张中高等级覆铜板项目建设的进展公告,finalpage/2016-06-13/1202363042.PDF
613,2016-06-21,金安国纪：关于使用自有资金购买银行理财产品的公告,finalpage/2016-06-21/1202375667.PDF
614,2016-06-28,金安国纪：关于使用自有资金购买银行理财产品的公告,finalpage/2016-06-28/1202418058.PDF
615,2016-06-30,金安国纪：关于使用自有资金购买银行理财产品的公告,finalpage/2016-06-30/1202437155.PDF
616,2016-07-13,金安国纪：关于使用闲置募集资金购买银行理财产品的公告,finalpage/2016-07-13/1202467625.PDF
617,2016-07-15,金安国纪：2016年半年度业绩预告修正公告,finalpage/2016-07-15/1202474300.PDF
618,2016-07-20,金安国纪：关于使用闲置募集资金购买银行理财产品的公告,finalpage/2016-07-20/1202489063.PDF
619,2016-07-22,金安国纪：关于使用自有资金购买银行理财产品的公告,finalpage/2016-07-22/1202496694.PDF
620,2016-07-28,金安国纪：关于使用闲置募集资金和自有资金购买银行理财产品的公告,finalpage/2016-07-28/1202511145.PDF
621,2016-07-30,金安国纪：关于使用自有资金购买银行理财产品的公告,finalpage/2016-07-30/1202517635.PDF
622,2016-08-05,金安国纪：关于使用自有资金购买银行理财产品的公告,finalpage/2016-08-05/1202538874.PDF
