date,title,url
2013-12-30,永大集团：关于签订《股份转让框架协议》的公告,finalpage/2013-12-30/63430776.PDF
2013-12-30,永大集团：2013年第一次临时股东大会的法律意见书,finalpage/2013-12-30/63430777.PDF
2014-01-07,永大集团：关于年审会计师事务所转制的公告,finalpage/2014-01-07/63458351.PDF
2014-02-13,永大集团：关于截止2013年底有关承诺人尚未履行完毕的相关承诺的公告,finalpage/2014-02-13/63564473.PDF
2014-02-27,永大集团：2013年度业绩快报,finalpage/2014-02-27/63609895.PDF
2014-03-28,永大集团：2013年度监事会工作报告,finalpage/2014-03-28/63738303.PDF
2014-03-28,永大集团：2013年度财务决算报告,finalpage/2014-03-28/63738306.PDF
2014-03-28,永大集团：独立董事2013年度述职报告（张茂）,finalpage/2014-03-28/63738309.PDF
2014-03-28,永大集团：独立董事2013年度述职报告（穆钢）,finalpage/2014-03-28/63738312.PDF
2014-03-28,永大集团：2014年度第一季度业绩预告,finalpage/2014-03-28/63738315.PDF
2014-03-28,永大集团：2013年年度报告摘要,finalpage/2014-03-28/63738320.PDF
2014-03-28,永大集团：2013年年度报告,finalpage/2014-03-28/63738341.PDF
2014-03-28,永大集团：2013年年度审计报告,finalpage/2014-03-28/63738343.PDF
2014-03-28,永大集团：第二届董事会第十二次会议决议公告,finalpage/2014-03-28/63738344.PDF
2014-03-28,永大集团：关于召开2013年度股东大会的通知,finalpage/2014-03-28/63738345.PDF
2014-03-28,永大集团：第二届监事会第十二次会议决议公告,finalpage/2014-03-28/63738346.PDF
2014-03-28,永大集团：2013年度控股股东及其他关联方资金占用情况的专项说明,finalpage/2014-03-28/63738347.PDF
2014-03-28,永大集团：2013年度内部控制自我评价报告,finalpage/2014-03-28/63738348.PDF
2014-03-28,永大集团：2013年募集资金年度存放与使用情况专项报告,finalpage/2014-03-28/63738349.PDF
2014-03-28,永大集团：募集资金年度存放与使用情况专项报告,finalpage/2014-03-28/63738350.PDF
2014-03-28,永大集团：独立董事关于公司第二届董事会第十二次会议相关事项的独立意见,finalpage/2014-03-28/63738351.PDF
2014-03-28,永大集团：独立董事2013年度述职报告（韩波）,finalpage/2014-03-28/63738352.PDF
2014-03-28,永大集团：公司章程（2014年3月）,finalpage/2014-03-28/63738353.PDF
2014-03-28,永大集团：关于举行2013年度报告网上说明会的公告,finalpage/2014-03-28/63738354.PDF
2014-03-28,永大集团：关于吸收合并全资子公司的公告,finalpage/2014-03-28/63738355.PDF
2014-03-28,永大集团：广发证券股份有限公司关于公司2013年度内部控制自我评价报告的核查意见,finalpage/2014-03-28/63738356.PDF
2014-03-28,永大集团：广发证券股份有限公司关于公司2013年度募集资金存放与使用情况的专项核查意见,finalpage/2014-03-28/63738357.PDF
2014-03-28,永大集团：独立董事候选人声明（张茂）,finalpage/2014-03-28/63738358.PDF
2014-03-28,永大集团：独立董事候选人声明（韩波）,finalpage/2014-03-28/63738359.PDF
2014-03-28,永大集团：独立董事候选人声明（吴铁华）,finalpage/2014-03-28/63738360.PDF
2014-03-28,永大集团：独立董事提名人声明,finalpage/2014-03-28/63738361.PDF
2014-03-28,永大集团：公司章程修正案,finalpage/2014-03-28/63738362.PDF
2014-03-28,永大集团：职工代表大会关于选举公司职工代表监事的决议公告,finalpage/2014-03-28/63738364.PDF
2014-03-28,永大集团：董事会报告,finalpage/2014-03-28/63738372.PDF
2014-03-28,永大集团：关于召开2013年度股东大会通知的补充公告,finalpage/2014-03-28/63741050.PDF
2014-04-19,永大集团：2013年度股东大会决议公告,finalpage/2014-04-19/63867518.PDF
2014-04-19,永大集团：2013年度股东大会的法律意见书,finalpage/2014-04-19/63867520.PDF
2014-04-19,永大集团：独立董事关于公司第三届董事会第一次会议相关事项的独立意见,finalpage/2014-04-19/63867523.PDF
2014-04-19,永大集团：第三届监事会第一次会议决议公告,finalpage/2014-04-19/63867524.PDF
2014-04-19,永大集团：第三届董事会第一次会议决议公告,finalpage/2014-04-19/63867528.PDF
2014-04-26,永大集团：2014年第一季度报告正文,finalpage/2014-04-26/63926295.PDF
2014-04-26,永大集团：2014年第一季度报告全文,finalpage/2014-04-26/63926296.PDF
2014-04-26,永大集团：第三届监事会第二次会议决议公告,finalpage/2014-04-26/63926297.PDF
2014-04-26,永大集团：第三届董事会第二次会议决议公告,finalpage/2014-04-26/63926298.PDF
2014-04-26,永大集团：关于规范公司控股股东及实际控制人行为的专项工作方案,finalpage/2014-04-26/63926299.PDF
2014-05-16,永大集团：2013年年度权益分派实施公告,finalpage/2014-05-16/64030476.PDF
2014-06-03,永大集团：重大事项停牌公告,finalpage/2014-06-03/64096236.PDF
2014-06-10,永大集团：重大事项停牌进展公告,finalpage/2014-06-10/64118743.PDF
2014-06-17,永大集团：关于筹划重大资产重组的停牌公告,finalpage/2014-06-17/64141005.PDF
2014-06-24,永大集团：关于筹划重大资产重组的停牌进展公告,finalpage/2014-06-24/1200001849.PDF
2014-06-24,永大集团：第三届董事会第一次临时会议决议公告,finalpage/2014-06-24/1200001850.PDF
2014-07-01,永大集团：关于筹划重大资产重组的停牌进展公告,finalpage/2014-07-01/1200020331.PDF
2014-07-08,永大集团：关于筹划重大资产重组的停牌进展公告,finalpage/2014-07-08/1200037458.PDF
2014-07-15,永大集团：关于筹划重大资产重组事项的进展暨延期复牌公告,finalpage/2014-07-15/1200054267.PDF
2014-07-22,永大集团：关于筹划重大资产重组的停牌进展公告,finalpage/2014-07-22/1200068467.PDF
2014-07-29,永大集团：关于筹划重大资产重组的停牌进展公告,finalpage/2014-07-29/1200083327.PDF
2014-08-05,永大集团：关于筹划重大资产重组的停牌进展公告,finalpage/2014-08-05/1200097516.PDF
2014-08-12,永大集团：关于筹划重大资产重组的停牌进展公告,finalpage/2014-08-12/1200118389.PDF
2014-08-19,永大集团：关于终止筹划重大资产重组事项暨股票复牌公告,finalpage/2014-08-19/1200136238.PDF
2014-08-26,永大集团：2014年上半年度募集资金存放与使用情况专项报告,finalpage/2014-08-26/1200164462.PDF
2014-08-26,永大集团：2014年半年度报告摘要,finalpage/2014-08-26/1200164463.PDF
2014-08-26,永大集团：2014年半年度报告,finalpage/2014-08-26/1200164464.PDF
2014-08-26,永大集团：2014半年度财务报告,finalpage/2014-08-26/1200164465.PDF
2014-08-26,永大集团：第三届董事会第三次会议决议公告,finalpage/2014-08-26/1200164466.PDF
2014-08-26,永大集团：第三届监事会第三次会议决议公告,finalpage/2014-08-26/1200164467.PDF
2014-08-26,永大集团：独立董事关于公司2014年上半年度相关事项的独立意见,finalpage/2014-08-26/1200164468.PDF
2014-08-26,永大集团：关于“企业营销网络建设项目”初步建设完成的公告,finalpage/2014-08-26/1200164469.PDF
2014-10-17,永大集团：首次公开发行前已发行股份上市流通提示性公告,finalpage/2014-10-17/1200306125.PDF
2014-10-17,永大集团：广发证券股份有限公司关于公司首次公开发行前限售股份上市流通的核查意见,finalpage/2014-10-17/1200306126.PDF
2014-10-23,永大集团：对外投资参股抚顺银行事项的进展情况公告,finalpage/2014-10-23/1200319677.PDF
2014-10-30,永大集团：2014年第三季度报告正文,finalpage/2014-10-30/1200350769.PDF
2014-10-30,永大集团：2014年第三季度报告全文,finalpage/2014-10-30/1200350770.PDF
2014-10-30,永大集团：第三届董事会第四次会议决议公告,finalpage/2014-10-30/1200350771.PDF
2014-10-30,永大集团：第三届监事会第四次会议决议公告,finalpage/2014-10-30/1200350772.PDF
2014-12-22,永大集团：关于2014年度利润分配预案的预披露公告,finalpage/2014-12-22/1200478670.PDF
2014-12-23,永大集团：股票交易异常波动公告,finalpage/2014-12-23/1200484786.PDF
2014-12-26,永大集团：股票交易异常波动公告,finalpage/2014-12-26/1200495738.PDF
2015-01-15,永大集团：股票交易异常波动公告,finalpage/2015-01-15/1200544873.PDF
2015-01-29,永大集团：2014年度业绩预告修正公告,finalpage/2015-01-29/1200586740.PDF
2015-02-04,永大集团：2014年度监事会工作报告,finalpage/2015-02-04/1200606467.PDF
2015-02-04,永大集团：2014年度财务决算报告,finalpage/2015-02-04/1200606468.PDF
2015-02-04,永大集团：独立董事2014年度述职报告（吴铁华）,finalpage/2015-02-04/1200606469.PDF
2015-02-04,永大集团：独立董事2014年度述职报告（张茂）,finalpage/2015-02-04/1200606470.PDF
2015-02-04,永大集团：2014年年度报告摘要,finalpage/2015-02-04/1200606471.PDF
2015-02-04,永大集团：2014年年度报告,finalpage/2015-02-04/1200606472.PDF
2015-02-04,永大集团：2014年年度审计报告,finalpage/2015-02-04/1200606473.PDF
2015-02-04,永大集团：第三届董事会第五次会议决议公告,finalpage/2015-02-04/1200606474.PDF
2015-02-04,永大集团：关于召开2014年度股东大会的通知,finalpage/2015-02-04/1200606475.PDF
2015-02-04,永大集团：第三届监事会第五次会议决议公告,finalpage/2015-02-04/1200606476.PDF
2015-02-04,永大集团：2014年度控股股东及其他关联方资金占用情况的专项说明,finalpage/2015-02-04/1200606477.PDF
2015-02-04,永大集团：2014年度内部控制自我评价报告,finalpage/2015-02-04/1200606478.PDF
2015-02-04,永大集团：截止2014年12月31日内部控制鉴证报告,finalpage/2015-02-04/1200606479.PDF
2015-02-04,永大集团：2014年募集资金年度存放与使用情况专项报告,finalpage/2015-02-04/1200606480.PDF
2015-02-04,永大集团：截至2014年12月31日止募集资金存放及实际使用情况鉴证报告,finalpage/2015-02-04/1200606481.PDF
2015-02-04,永大集团：独立董事关于公司2014年度有关事项及第三届董事会第五次会议相关事项的独立意见,finalpage/2015-02-04/1200606482.PDF
2015-02-04,永大集团：独立董事2014年度述职报告（韩波）,finalpage/2015-02-04/1200606483.PDF
2015-02-04,永大集团：公司章程修正案,finalpage/2015-02-04/1200606484.PDF
2015-02-04,永大集团：公司章程（2015年2月）,finalpage/2015-02-04/1200606485.PDF
2015-02-04,永大集团：关于举行2014年度报告网上说明会的公告,finalpage/2015-02-04/1200606486.PDF
2015-02-04,永大集团：关于会计估计变更的公告,finalpage/2015-02-04/1200606487.PDF
2015-02-04,永大集团：关于部分募投项目延期的公告,finalpage/2015-02-04/1200606488.PDF
2015-02-04,永大集团：关于续聘会计师事务所的公告,finalpage/2015-02-04/1200606489.PDF
2015-02-04,永大集团：广发证券股份有限公司关于公司2014年度募集资金存放与使用情况的专项核查意见,finalpage/2015-02-04/1200606490.PDF
2015-02-04,永大集团：广发证券股份有限公司关于公司部分募投项目延期事项的核查意见,finalpage/2015-02-04/1200606491.PDF
2015-02-04,永大集团：关于增加经营范围并换发营业执照的公告,finalpage/2015-02-04/1200606492.PDF
2015-02-04,永大集团：2014年度董事会工作报告,finalpage/2015-02-04/1200606493.PDF
2015-02-05,永大集团：关于召开2014年度股东大会的通知的更正公告,finalpage/2015-02-05/1200609495.PDF
2015-03-04,永大集团：2014年度股东大会决议公告,finalpage/2015-03-04/1200666656.PDF
2015-03-04,永大集团：2014年度股东大会的法律意见书,finalpage/2015-03-04/1200666657.PDF
2015-03-11,永大集团：关于向银行申请综合授信额度的公告,finalpage/2015-03-11/1200686819.PDF
2015-03-11,永大集团：第三届董事会第六次会议决议公告,finalpage/2015-03-11/1200686820.PDF
2015-03-17,永大集团：2014年年度权益分派实施公告,finalpage/2015-03-17/1200705251.PDF
2015-03-19,永大集团：关于控股股东、实际控制人及一致行动人拟减持公司股份的提示性公告,finalpage/2015-03-19/1200713975.PDF
2015-03-20,永大集团：股票交易异常波动公告,finalpage/2015-03-20/1200718603.PDF
2015-03-25,永大集团：股票交易异常波动公告,finalpage/2015-03-25/1200736921.PDF
2015-03-27,永大集团：2015年度第一季度业绩预告,finalpage/2015-03-27/1200746170.PDF
2015-03-27,永大集团：关于高管辞职的公告,finalpage/2015-03-27/1200746171.PDF
2015-04-08,永大集团：2015年度第一季度业绩预告修正公告,finalpage/2015-04-08/1200795357.PDF
2015-04-09,永大集团：2015年第一季度报告正文,finalpage/2015-04-09/1200799120.PDF
2015-04-09,永大集团：2015年第一季度报告全文,finalpage/2015-04-09/1200799121.PDF
2015-04-09,永大集团：第三届监事会第六次会议决议公告,finalpage/2015-04-09/1200799122.PDF
2015-04-09,永大集团：第三届董事会第七次会议决议公告,finalpage/2015-04-09/1200799123.PDF
2015-04-15,永大集团：简式权益变动报告书,finalpage/2015-04-15/1200833248.PDF
2015-04-15,永大集团：股东减持股份的公告,finalpage/2015-04-15/1200833249.PDF
2015-04-22,永大集团：简式权益变动报告书,finalpage/2015-04-22/1200882837.PDF
2015-04-22,永大集团：股东减持股份的公告,finalpage/2015-04-22/1200882838.PDF
2015-04-28,永大集团：控股股东、实际控制人及其一致行动人减持股份的公告,finalpage/2015-04-28/1200920026.PDF
2015-04-28,永大集团：简式权益变动报告书,finalpage/2015-04-28/1200920027.PDF
2015-05-06,永大集团：控股股东、实际控制人及其一致行动人减持股份的公告,finalpage/2015-05-06/1200968657.PDF
2015-05-06,永大集团：简式权益变动报告书,finalpage/2015-05-06/1200968658.PDF
2015-05-08,永大集团：关于持股5%以上股东协议转让公司股份的提示性公告,finalpage/2015-05-08/1200983713.PDF
2015-05-08,永大集团：简式权益变动报告书,finalpage/2015-05-08/1200983714.PDF
2015-05-25,永大集团：关于持股5%以上股东协议转让公司部分股份已完成过户登记的公告,finalpage/2015-05-25/1201060012.PDF
2015-06-03,永大集团：关于独立董事辞职的公告,finalpage/2015-06-03/1201099416.PDF
2015-06-03,永大集团：关于监事辞职的公告,finalpage/2015-06-03/1201099417.PDF
2015-06-03,永大集团：关于董事长、副董事长辞职的公告,finalpage/2015-06-03/1201094066.PDF
2015-06-03,永大集团：独立董事关于公司董事长、总经理辞职的独立意见,finalpage/2015-06-03/1201094067.PDF
2015-06-06,永大集团：关于召开2015年第一次临时股东大会的通知,finalpage/2015-06-06/1201110592.PDF
2015-06-06,永大集团：关于聘任公司副总经理的公告,finalpage/2015-06-06/1201110593.PDF
2015-06-06,永大集团：关于聘任公司董事会秘书的公告,finalpage/2015-06-06/1201110594.PDF
2015-06-06,永大集团：关于补选独立董事的公告,finalpage/2015-06-06/1201110595.PDF
2015-06-06,永大集团：关于补选监事的公告,finalpage/2015-06-06/1201110596.PDF
2015-06-06,永大集团：关于补选非独立董事的公告,finalpage/2015-06-06/1201110597.PDF
2015-06-06,永大集团：独立董事候选人声明（张炜）,finalpage/2015-06-06/1201110598.PDF
2015-06-06,永大集团：独立董事提名人声明,finalpage/2015-06-06/1201110599.PDF
2015-06-06,永大集团：独立董事关于公司第三届董事会第二次临时会议相关事项的独立意见,finalpage/2015-06-06/1201110600.PDF
2015-06-06,永大集团：第三届监事会第一次临时会议决议公告,finalpage/2015-06-06/1201110601.PDF
2015-06-06,永大集团：第三届董事会第二次临时会议决议公告,finalpage/2015-06-06/1201110602.PDF
2015-06-11,永大集团：董事会关于深圳证券交易所监管关注函回函的公告,finalpage/2015-06-11/1201133626.PDF
2015-06-12,永大集团：关于聘任公司副总经理的公告,finalpage/2015-06-12/1201138920.PDF
2015-06-12,永大集团：独立董事关于公司第三届董事会第三次临时会议相关事项的独立意见,finalpage/2015-06-12/1201138921.PDF
2015-06-12,永大集团：第三届董事会第三次临时会议决议公告,finalpage/2015-06-12/1201138922.PDF
2015-06-24,永大集团：2015年第一次临时股东大会决议公告,finalpage/2015-06-24/1201186791.PDF
2015-06-24,永大集团：2015年第一次临时股东大会的法律意见书,finalpage/2015-06-24/1201186792.PDF
2015-06-25,永大集团：关于聘任公司总经理的公告,finalpage/2015-06-25/1201190320.PDF
2015-06-25,永大集团：关于选举公司董事长的公告,finalpage/2015-06-25/1201190321.PDF
2015-06-25,永大集团：独立董事关于公司第三届董事会第四次临时会议相关事项的独立意见,finalpage/2015-06-25/1201190322.PDF
2015-06-25,永大集团：第三届董事会第四次临时会议决议公告,finalpage/2015-06-25/1201190323.PDF
2015-07-01,永大集团：关于变更公司法定代表人的公告,finalpage/2015-07-01/1201223763.PDF
2015-07-03,永大集团：重大事项停牌公告,finalpage/2015-07-03/1201231011.PDF
2015-07-09,永大集团：重大事项停牌进展公告,finalpage/2015-07-09/1201261886.PDF
2015-07-10,永大集团：关于维护公司股价稳定的工作方案,finalpage/2015-07-10/1201271772.PDF
2015-07-16,永大集团：重大事项停牌进展公告,finalpage/2015-07-16/1201298610.PDF
2015-07-23,永大集团：重大事项停牌进展公告,finalpage/2015-07-23/1201333426.PDF
2015-07-29,永大集团：关于公司董事、副总经理辞职的公告,finalpage/2015-07-29/1201359530.PDF
2015-07-30,永大集团：重大事项停牌进展公告,finalpage/2015-07-30/1201363572.PDF
2015-08-01,永大集团：关于投资设立全资子公司的公告,finalpage/2015-08-01/1201375092.PDF
2015-08-01,永大集团：第三届董事会第五次临时会议决议公告,finalpage/2015-08-01/1201375093.PDF
2015-08-05,永大集团：关于举办投资者网上说明会的公告,finalpage/2015-08-05/1201396820.PDF
2015-08-06,永大集团：重大事项停牌进展公告,finalpage/2015-08-06/1201397367.PDF
2015-08-13,永大集团：重大事项停牌进展公告,finalpage/2015-08-13/1201427905.PDF
2015-08-20,永大集团：重大事项停牌进展公告,finalpage/2015-08-20/1201460607.PDF
2015-08-26,永大集团：2015年上半年度募集资金存放与使用情况专项报告,finalpage/2015-08-26/1201492251.PDF
2015-08-26,永大集团：2015年半年度报告摘要,finalpage/2015-08-26/1201492252.PDF
2015-08-26,永大集团：2015年半年度报告,finalpage/2015-08-26/1201492253.PDF
2015-08-26,永大集团：2015半年度财务报告,finalpage/2015-08-26/1201492254.PDF
2015-08-26,永大集团：第三届董事会第八次会议决议公告,finalpage/2015-08-26/1201492255.PDF
2015-08-26,永大集团：第三届监事会第七次会议决议公告,finalpage/2015-08-26/1201492256.PDF
2015-08-26,永大集团：独立董事关于公司2015年上半年度相关事项的独立意见,finalpage/2015-08-26/1201492257.PDF
2015-08-26,永大集团：关于召开2015年第二次临时股东大会的通知,finalpage/2015-08-26/1201492258.PDF
2015-08-26,永大集团：监事薪酬情况,finalpage/2015-08-26/1201492259.PDF
2015-08-26,永大集团：董事薪酬情况,finalpage/2015-08-26/1201492260.PDF
2015-08-26,永大集团：薪酬管理制度（2015年8月）,finalpage/2015-08-26/1201492261.PDF
2015-08-26,永大集团：高级管理人员薪酬情况,finalpage/2015-08-26/1201492262.PDF
2015-08-27,永大集团：重大事项停牌进展公告,finalpage/2015-08-27/1201501590.PDF
2015-09-07,永大集团：重大事项停牌进展公告,finalpage/2015-09-07/1201542137.PDF
2015-09-14,永大集团：重大事项停牌进展公告,finalpage/2015-09-14/1201581627.PDF
2015-09-16,永大集团：2015年第二次临时股东大会决议公告,finalpage/2015-09-16/1201598006.PDF
2015-09-16,永大集团：2015年第二次临时股东大会的法律意见书,finalpage/2015-09-16/1201598007.PDF
2015-09-21,永大集团：重大事项停牌进展公告,finalpage/2015-09-21/1201613153.PDF
2015-09-22,永大集团：关于股东协议转让公司股份的提示性公告,finalpage/2015-09-22/1201623235.PDF
2015-09-22,永大集团：简式权益变动报告书,finalpage/2015-09-22/1201623236.PDF
2015-09-25,永大集团：关于筹划重大资产重组的停牌公告,finalpage/2015-09-25/1201635380.PDF
2015-09-28,永大集团：关于向银行申请贷款的公告,finalpage/2015-09-28/1201649168.PDF
2015-09-28,永大集团：第三届董事会第六次临时会议决议公告,finalpage/2015-09-28/1201649169.PDF
2015-10-09,永大集团：关于筹划重大资产重组的停牌进展公告,finalpage/2015-10-09/1201669539.PDF
2015-10-13,永大集团：关于股东协议转让公司部分股份已完成过户登记的公告,finalpage/2015-10-13/1201685740.PDF
2015-10-16,永大集团：关于筹划重大资产重组的停牌进展公告,finalpage/2015-10-16/1201699163.PDF
2015-10-23,永大集团：关于筹划重大资产重组事项的进展暨延期复牌公告,finalpage/2015-10-23/1201715489.PDF
2015-10-27,永大集团：第三届董事会第七次临时会议决议公告,finalpage/2015-10-27/1201724741.PDF
2015-10-27,永大集团：关于变更部分全资子公司注册地址及法定代表人的公告,finalpage/2015-10-27/1201724742.PDF
2015-10-27,永大集团：关于变更注册地址并修订《公司章程》的公告,finalpage/2015-10-27/1201724743.PDF
2015-10-27,永大集团：关于召开2015年第三次临时股东大会的通知,finalpage/2015-10-27/1201724744.PDF
2015-10-27,永大集团：公司章程（2015年10月）,finalpage/2015-10-27/1201724745.PDF
2015-10-30,永大集团：2015年第三季度报告正文,finalpage/2015-10-30/1201739051.PDF
2015-10-30,永大集团：2015年第三季度报告全文,finalpage/2015-10-30/1201739052.PDF
2015-10-30,永大集团：第三届监事会第八次会议决议公告,finalpage/2015-10-30/1201739053.PDF
2015-10-30,永大集团：独立董事关于第三届董事会第九次会议相关事项的独立意见,finalpage/2015-10-30/1201739054.PDF
2015-10-30,永大集团：广发证券股份有限公司关于公司使用结余募集资金及部分超募资金永久性补充流动资金的核查意见,finalpage/2015-10-30/1201739055.PDF
2015-10-30,永大集团：关于公司使用结余募集资金及部分超募资金永久性补充流动资金的公告,finalpage/2015-10-30/1201739056.PDF
2015-10-30,永大集团：关于召开2015年第四次临时股东大会的通知,finalpage/2015-10-30/1201739057.PDF
2015-10-30,永大集团：关于筹划重大资产重组的停牌进展公告,finalpage/2015-10-30/1201739058.PDF
2015-10-30,永大集团：第三届董事会第九次会议决议公告,finalpage/2015-10-30/1201739059.PDF
2015-11-06,永大集团：关于筹划重大资产重组的停牌进展公告,finalpage/2015-11-06/1201754604.PDF
2015-11-13,永大集团：关于筹划重大资产重组的停牌进展公告,finalpage/2015-11-13/1201766264.PDF
2015-11-20,永大集团：关于筹划重大资产重组的停牌进展公告,finalpage/2015-11-20/1201778619.PDF
2015-11-23,永大集团：独立董事关于续聘众华会计师事务所（特殊普通合伙）为公司2015年度审计机构的的独立意见,finalpage/2015-11-23/1201784087.PDF
2015-11-23,永大集团：关于组织机构调整的公告,finalpage/2015-11-23/1201784088.PDF
2015-11-23,永大集团：关于聘任证券事务代表的公告,finalpage/2015-11-23/1201784089.PDF
2015-11-23,永大集团：关于续聘会计师事务所的公告,finalpage/2015-11-23/1201784090.PDF
2015-11-23,永大集团：2016年度财务预算报告,finalpage/2015-11-23/1201784091.PDF
2015-11-23,永大集团：第三届董事会第十次会议决议公告,finalpage/2015-11-23/1201784092.PDF
2015-11-23,永大集团：永大创新金融服务（深圳）有限公司对外投资公告,finalpage/2015-11-23/1201784093.PDF
2015-11-23,永大集团：关于公司2015年第三次临时股东大会增加提案暨补充通知的公告,finalpage/2015-11-23/1201784094.PDF
2015-11-27,永大集团：关于筹划重大资产重组的停牌进展公告,finalpage/2015-11-27/1201789659.PDF
2015-12-01,永大集团：第三届董事会第八次临时会议决议公告,finalpage/2015-12-01/1201799248.PDF
2015-12-01,永大集团：第三届监事会第二次临时会议决议公告,finalpage/2015-12-01/1201799249.PDF
2015-12-01,永大集团：关于2015年第三季度资本公积金转增股本预案的公告,finalpage/2015-12-01/1201799250.PDF
2015-12-01,永大集团：关于公司2015年第三次临时股东大会增加提案暨补充通知的公告,finalpage/2015-12-01/1201799251.PDF
2015-12-01,永大集团：公司章程（2015年11月）,finalpage/2015-12-01/1201799252.PDF
2015-12-01,永大集团：公司章程修正案,finalpage/2015-12-01/1201799253.PDF
2015-12-01,永大集团：独立董事关于公司2015年第三季度资本公积金转增股本预案的独立意见,finalpage/2015-12-01/1201799254.PDF
2015-12-01,永大集团：2015年1-9月财务报表及审计报告,finalpage/2015-12-01/1201799255.PDF
2015-12-03,永大集团：2015年第四次临时股东大会的法律意见书,finalpage/2015-12-03/1201803330.PDF
2015-12-03,永大集团：2015年第四次临时股东大会决议公告,finalpage/2015-12-03/1201803331.PDF
