,date,title,url
0,2015-02-02,富煌钢构：中国证监会关于核准公司首次公开发行股票的批复,finalpage/2015-02-02/1200600565.PDF
1,2015-02-02,富煌钢构：安徽承义律师事务所关于公司首次公开发行股票并上市的法律意见书,finalpage/2015-02-02/1200600566.PDF
2,2015-02-02,富煌钢构：安徽承义律师事务所关于公司首次公开发行股票并上市之补充法律意见书（十）,finalpage/2015-02-02/1200600567.PDF
3,2015-02-02,富煌钢构：安徽承义律师事务所关于公司首次公开发行股票并上市之补充法律意见书（十一）,finalpage/2015-02-02/1200600568.PDF
4,2015-02-02,富煌钢构：安徽承义律师事务所关于公司首次公开发行股票并上市之补充法律意见书（十二）,finalpage/2015-02-02/1200600569.PDF
5,2015-02-02,富煌钢构：安徽承义律师事务所关于公司首次公开发行股票申请文件反馈意见回复更新之法律意见书（十三）,finalpage/2015-02-02/1200600570.PDF
6,2015-02-02,富煌钢构：安徽承义律师事务所关于公司股东中不存在私募投资基金的专项核查意见书（十四）,finalpage/2015-02-02/1200600571.PDF
7,2015-02-02,富煌钢构：安徽承义律师事务所关于公司首次公开发行股票并上市之补充法律意见书（十五）,finalpage/2015-02-02/1200600572.PDF
8,2015-02-02,富煌钢构：安徽承义律师事务所关于公司首次公开发行股票申请文件反馈意见回复更新之补充法律意见书（十六）,finalpage/2015-02-02/1200600573.PDF
9,2015-02-02,富煌钢构：安徽承义律师事务所关于公司首次公开发行股票并上市之补充法律意见书（二）,finalpage/2015-02-02/1200600574.PDF
10,2015-02-02,富煌钢构：安徽承义律师事务所关于公司首次公开发行股票并上市之补充法律意见书（三）,finalpage/2015-02-02/1200600575.PDF
11,2015-02-02,富煌钢构：安徽承义律师事务所关于公司首次公开发行股票并上市之补充法律意见书（四）,finalpage/2015-02-02/1200600576.PDF
12,2015-02-02,富煌钢构：安徽承义律师事务所关于公司首次公开发行股票并上市之补充法律意见书（五）,finalpage/2015-02-02/1200600577.PDF
13,2015-02-02,富煌钢构：安徽承义律师事务所关于公司首次公开发行股票并上市之补充法律意见书（六）,finalpage/2015-02-02/1200600578.PDF
14,2015-02-02,富煌钢构：安徽承义律师事务所关于公司首次公开发行股票并上市之补充法律意见书（七）,finalpage/2015-02-02/1200600579.PDF
15,2015-02-02,富煌钢构：安徽承义律师事务所关于公司首次公开发行股票并上市之补充法律意见书（八）,finalpage/2015-02-02/1200600580.PDF
16,2015-02-02,富煌钢构：安徽承义律师事务所关于公司首次公开发行股票并上市之补充法律意见书（九）,finalpage/2015-02-02/1200600581.PDF
17,2015-02-02,富煌钢构：首次公开发行股票招股意向书,finalpage/2015-02-02/1200600582.PDF
18,2015-02-02,富煌钢构：首次公开发行股票招股意向书摘要,finalpage/2015-02-02/1200600583.PDF
19,2015-02-02,富煌钢构：首次公开发行股票初步询价及推介公告,finalpage/2015-02-02/1200600584.PDF
20,2015-02-02,富煌钢构：公司章程（草案）,finalpage/2015-02-02/1200600585.PDF
21,2015-02-02,富煌钢构：第三届董事会第二次会议决议等,finalpage/2015-02-02/1200600586.PDF
22,2015-02-02,富煌钢构：2010年度股东大会会议决议等,finalpage/2015-02-02/1200600587.PDF
23,2015-02-02,富煌钢构：平安证券有限责任公司关于公司首次公开发行股票发行保荐工作报告,finalpage/2015-02-02/1200600588.PDF
24,2015-02-02,富煌钢构：平安证券有限责任公司关于公司首次公开发行股票发行保荐书,finalpage/2015-02-02/1200600589.PDF
25,2015-02-02,富煌钢构：审计报告,finalpage/2015-02-02/1200600590.PDF
26,2015-02-02,富煌钢构：内部控制鉴证报告,finalpage/2015-02-02/1200600591.PDF
27,2015-02-02,富煌钢构：非经常性损益明细表的鉴证报告,finalpage/2015-02-02/1200600592.PDF
28,2015-02-02,富煌钢构：安徽承义律师事务所为公司首次股票发行上市出具法律意见书的律师工作报告,finalpage/2015-02-02/1200600593.PDF
29,2015-02-06,富煌钢构：首次公开发行股票网上路演公告,finalpage/2015-02-06/1200612836.PDF
30,2015-02-09,富煌钢构：首次公开发行股票发行公告,finalpage/2015-02-09/1200617961.PDF
31,2015-02-09,富煌钢构：首次公开发行股票投资风险特别公告,finalpage/2015-02-09/1200617962.PDF
32,2015-02-09,富煌钢构：首次公开发行股票招股说明书摘要,finalpage/2015-02-09/1200620627.PDF
33,2015-02-09,富煌钢构：首次公开发行股票招股说明书,finalpage/2015-02-09/1200620628.PDF
34,2015-02-12,富煌钢构：首次公开发行股票网上定价发行申购情况及中签率公告（更新后）,finalpage/2015-02-12/1200631962.PDF
35,2015-02-12,富煌钢构：更正公告,finalpage/2015-02-12/1200631964.PDF
36,2015-02-12,富煌钢构：首次公开发行股票网下配售结果公告,finalpage/2015-02-12/1200630646.PDF
37,2015-02-12,富煌钢构：首次公开发行股票网上定价发行申购情况及中签率公告（已取消）,finalpage/2015-02-12/1200630648.PDF
38,2015-02-13,富煌钢构：首次公开发行股票网上定价发行摇号中签结果公告,finalpage/2015-02-13/1200634668.PDF
39,2015-02-16,富煌钢构：安徽承义律师事务所关于公司首次公开发行股票于深圳证券交易所上市之法律意见书,finalpage/2015-02-16/1200641761.PDF
40,2015-02-16,富煌钢构：平安证券有限责任公司关于公司股票上市保荐书,finalpage/2015-02-16/1200641763.PDF
41,2015-02-16,富煌钢构：首次公开发行股票上市公告书,finalpage/2015-02-16/1200641764.PDF
42,2015-02-17,富煌钢构：上市首日风险提示公告,finalpage/2015-02-17/1200644868.PDF
43,2015-02-27,富煌钢构：第四届董事会第七次会议决议公告,finalpage/2015-02-27/1200653920.PDF
44,2015-02-28,富煌钢构：2014年度业绩快报,finalpage/2015-02-28/1200656762.PDF
45,2015-03-02,富煌钢构：股票交易异常波动公告,finalpage/2015-03-02/1200657259.PDF
46,2015-03-03,富煌钢构：关于完成工商变更登记的公告,finalpage/2015-03-03/1200665332.PDF
47,2015-03-03,富煌钢构：公司章程（2015年2月）,finalpage/2015-03-03/1200665333.PDF
48,2015-03-05,富煌钢构：股票交易异常波动公告,finalpage/2015-03-05/1200669734.PDF
49,2015-03-09,富煌钢构：股票交易异常波动公告,finalpage/2015-03-09/1200676464.PDF
50,2015-03-12,富煌钢构：关于签署募集资金三方监管协议的公告,finalpage/2015-03-12/1200690451.PDF
51,2015-03-13,富煌钢构：关于使用募集资金置换先期投入募集资金投资项目的自筹资金的公告,finalpage/2015-03-13/1200694467.PDF
52,2015-03-13,富煌钢构：关于公司以自筹资金预先投入募集资金投资项目的鉴证报告,finalpage/2015-03-13/1200694468.PDF
53,2015-03-13,富煌钢构：信息披露管理制度（2015年3月）,finalpage/2015-03-13/1200694469.PDF
54,2015-03-13,富煌钢构：内幕信息知情人登记备案制度（2015年3月）,finalpage/2015-03-13/1200694470.PDF
55,2015-03-13,富煌钢构：内部审计制度（2015年3月）,finalpage/2015-03-13/1200694471.PDF
56,2015-03-13,富煌钢构：董事、监事和高级管理人员持有和买卖本公司股票管理制度（2015年3月）,finalpage/2015-03-13/1200694472.PDF
57,2015-03-13,富煌钢构：平安证券有限责任公司关于公司使用募集资金置换预先投入募投项目自筹资金的核查意见,finalpage/2015-03-13/1200694473.PDF
58,2015-03-13,富煌钢构：独立董事意见,finalpage/2015-03-13/1200694474.PDF
59,2015-03-13,富煌钢构：第四届监事会第五次会议决议公告,finalpage/2015-03-13/1200694475.PDF
60,2015-03-13,富煌钢构：第四届董事会第八次会议决议公告,finalpage/2015-03-13/1200694476.PDF
61,2015-03-26,富煌钢构：关于董事辞职的公告,finalpage/2015-03-26/1200741012.PDF
62,2015-04-16,富煌钢构：关于公司2015年度董事、高级管理人员薪酬的议案,finalpage/2015-04-16/1200840381.PDF
63,2015-04-16,富煌钢构：2014年度监事会工作报告,finalpage/2015-04-16/1200840382.PDF
64,2015-04-16,富煌钢构：2014年年度报告摘要,finalpage/2015-04-16/1200840383.PDF
65,2015-04-16,富煌钢构：2014年年度报告,finalpage/2015-04-16/1200840384.PDF
66,2015-04-16,富煌钢构：2014年年度审计报告,finalpage/2015-04-16/1200840385.PDF
67,2015-04-16,富煌钢构：第四届董事会第九次会议决议公告,finalpage/2015-04-16/1200840386.PDF
68,2015-04-16,富煌钢构：关于召开2014年年度股东大会的通知,finalpage/2015-04-16/1200840387.PDF
69,2015-04-16,富煌钢构：第四届监事会第六次会议决议公告,finalpage/2015-04-16/1200840388.PDF
70,2015-04-16,富煌钢构：控股股东及其他关联方资金占用情况专项审核报告,finalpage/2015-04-16/1200840389.PDF
71,2015-04-16,富煌钢构：平安证券有限责任公司关于公司《内部控制自我评价报告》的核查意见,finalpage/2015-04-16/1200840390.PDF
72,2015-04-16,富煌钢构：独立董事对公司第四届董事会第九次会议相关议案发表的独立意见,finalpage/2015-04-16/1200840391.PDF
73,2015-04-16,富煌钢构：独立董事2014年度述职报告（孙昌兴）,finalpage/2015-04-16/1200840392.PDF
74,2015-04-16,富煌钢构：公司2014年财务决算报告,finalpage/2015-04-16/1200840393.PDF
75,2015-04-16,富煌钢构：公司章程（2015年4月）,finalpage/2015-04-16/1200840394.PDF
76,2015-04-16,富煌钢构：募集资金使用管理办法（2015年3月）,finalpage/2015-04-16/1200840395.PDF
77,2015-04-16,富煌钢构：股东大会议事规则（2015年4月）,finalpage/2015-04-16/1200840396.PDF
78,2015-04-16,富煌钢构：董事会议事规则（2015年3月）,finalpage/2015-04-16/1200840397.PDF
79,2015-04-16,富煌钢构：监事会议事规则（2015年4月）,finalpage/2015-04-16/1200840398.PDF
80,2015-04-16,富煌钢构：平安证券有限责任公司关于公司《内部控制规则落实情况自查表》的核查意见,finalpage/2015-04-16/1200840400.PDF
81,2015-04-16,富煌钢构：独立董事2014年度述职报告（乔如林）,finalpage/2015-04-16/1200840401.PDF
82,2015-04-16,富煌钢构：独立董事2014年度述职报告（朱华）,finalpage/2015-04-16/1200840402.PDF
83,2015-04-16,富煌钢构：独立董事2014年度述职报告（竺长安）,finalpage/2015-04-16/1200840403.PDF
84,2015-04-16,富煌钢构：关于内部控制有效性的自我评价报告,finalpage/2015-04-16/1200840458.PDF
85,2015-04-17,富煌钢构：2015年度财务预算报告,finalpage/2015-04-17/1200842312.PDF
86,2015-04-20,富煌钢构：关于举行2014年度业绩网上说明会的通知,finalpage/2015-04-20/1200872450.PDF
87,2015-04-24,富煌钢构：2015年第一季度报告正文,finalpage/2015-04-24/1200897975.PDF
88,2015-04-24,富煌钢构：2015年第一季度报告全文,finalpage/2015-04-24/1200897976.PDF
89,2015-05-09,富煌钢构：2014年年度股东大会决议公告,finalpage/2015-05-09/1200987281.PDF
90,2015-05-09,富煌钢构：2014年年度股东大会的法律意见书,finalpage/2015-05-09/1200987282.PDF
91,2015-05-15,富煌钢构：股票交易异常波动公告,finalpage/2015-05-15/1201015859.PDF
92,2015-05-22,富煌钢构：股票交易异常波动公告,finalpage/2015-05-22/1201046147.PDF
93,2015-05-28,富煌钢构：关于筹划重大事项股票停牌的公告,finalpage/2015-05-28/1201072805.PDF
94,2015-06-04,富煌钢构：关于筹划重大事项股票继续停牌的公告,finalpage/2015-06-04/1201100045.PDF
95,2015-06-11,富煌钢构：关于重大事项进展的公告,finalpage/2015-06-11/1201133159.PDF
96,2015-06-17,富煌钢构：关于股东股权司法冻结的补充公告,finalpage/2015-06-17/1201163074.PDF
97,2015-06-17,富煌钢构：关于股东股权司法冻结的公告,finalpage/2015-06-17/1201158823.PDF
98,2015-06-18,富煌钢构：2014年年度权益分派实施公告,finalpage/2015-06-18/1201164261.PDF
99,2015-06-18,富煌钢构：关于重大事项进展的公告,finalpage/2015-06-18/1201164262.PDF
100,2015-06-25,富煌钢构：关于重大事项进展的公告,finalpage/2015-06-25/1201190057.PDF
101,2015-06-30,富煌钢构：2015年度非公开发行股票预案,finalpage/2015-06-30/1201213431.PDF
102,2015-06-30,富煌钢构：非公开发行股票募集资金使用可行性分析报告,finalpage/2015-06-30/1201213432.PDF
103,2015-06-30,富煌钢构：第四届董事会第十一次会议决议公告,finalpage/2015-06-30/1201213433.PDF
104,2015-06-30,富煌钢构：前次募集资金使用情况鉴证报告,finalpage/2015-06-30/1201213434.PDF
105,2015-06-30,富煌钢构：独立董事关于公司2015年度非公开发行股票的独立意见,finalpage/2015-06-30/1201213435.PDF
106,2015-06-30,富煌钢构：前次募集资金使用情况专项报告,finalpage/2015-06-30/1201213436.PDF
107,2015-06-30,富煌钢构：第四届监事会第八次会议决议公告,finalpage/2015-06-30/1201213437.PDF
108,2015-06-30,富煌钢构：重大事项复牌公告,finalpage/2015-06-30/1201213438.PDF
109,2015-07-02,富煌钢构：股票交易异常波动公告,finalpage/2015-07-02/1201224997.PDF
110,2015-07-09,富煌钢构：股票交易异常波动公告,finalpage/2015-07-09/1201260869.PDF
111,2015-07-10,富煌钢构：关于维护股价稳定的公告,finalpage/2015-07-10/1201271814.PDF
112,2015-07-17,富煌钢构：股票交易异常波动公告,finalpage/2015-07-17/1201304631.PDF
113,2015-08-13,富煌钢构：关于公司符合非公开发行A股条件的议案,finalpage/2015-08-13/1201428445.PDF
114,2015-08-13,富煌钢构：关于公司2015年度非公开发行股票方案的议案（修正案）,finalpage/2015-08-13/1201428446.PDF
115,2015-08-13,富煌钢构：2015年度非公开发行股票预案（修正案）,finalpage/2015-08-13/1201428447.PDF
116,2015-08-13,富煌钢构：第四届董事会第十二次会议决议公告,finalpage/2015-08-13/1201428448.PDF
117,2015-08-13,富煌钢构：第四届监事会第九次会议决议公告,finalpage/2015-08-13/1201428449.PDF
118,2015-08-13,富煌钢构：关于召开2015年第一次临时股东大会的通知,finalpage/2015-08-13/1201428450.PDF
119,2015-08-13,富煌钢构：非公开发行股票募集资金使用可行性分析报告（修正案）,finalpage/2015-08-13/1201428451.PDF
120,2015-08-13,富煌钢构：关于提请股东大会授权董事会全权办理本次非公开发行股票相关事宜的议案,finalpage/2015-08-13/1201428452.PDF
121,2015-08-13,富煌钢构：独立董事关于公司2015年度非公开发行股票的独立意见,finalpage/2015-08-13/1201428453.PDF
122,2015-08-19,富煌钢构：关于增加2015年第一次临时股东大会临时提案暨召开2015年第一次临时股东大会补充通知的公告,finalpage/2015-08-19/1201456660.PDF
123,2015-08-21,富煌钢构：股票交易异常波动公告,finalpage/2015-08-21/1201468167.PDF
124,2015-08-26,富煌钢构：2015年半年度报告摘要（更新后）,finalpage/2015-08-26/1201498391.PDF
125,2015-08-26,富煌钢构：关于2015年半年度报告的更正公告,finalpage/2015-08-26/1201498392.PDF
126,2015-08-26,富煌钢构：2015年半年度报告（更新后）,finalpage/2015-08-26/1201498390.PDF
127,2015-08-26,富煌钢构：关于2015年半年度募集资金存放与使用情况的专项报告,finalpage/2015-08-26/1201492606.PDF
128,2015-08-26,富煌钢构：中小投资者单独计票管理办法（2015年8月）,finalpage/2015-08-26/1201492607.PDF
129,2015-08-26,富煌钢构：2015年半年度报告摘要（已取消）,finalpage/2015-08-26/1201492608.PDF
130,2015-08-26,富煌钢构：2015年半年度财务报告,finalpage/2015-08-26/1201492610.PDF
131,2015-08-26,富煌钢构：第四届董事会第十三次会议决议公告,finalpage/2015-08-26/1201492611.PDF
132,2015-08-26,富煌钢构：第四届监事会第十次会议决议公告,finalpage/2015-08-26/1201492612.PDF
133,2015-08-26,富煌钢构：2015年半年度报告（已取消）,finalpage/2015-08-26/1201492614.PDF
134,2015-08-26,富煌钢构：独立董事关于公司第四届董事会第十三次会议相关事项的独立意见,finalpage/2015-08-26/1201492615.PDF
135,2015-08-28,富煌钢构：股票交易异常波动公告,finalpage/2015-08-28/1201508955.PDF
136,2015-08-29,富煌钢构：2015年第一次临时股东大会决议公告,finalpage/2015-08-29/1201517838.PDF
137,2015-08-29,富煌钢构：2015年第一次临时股东大会的法律意见书,finalpage/2015-08-29/1201517839.PDF
138,2015-09-15,富煌钢构：关于变更持续督导保荐代表人的公告,finalpage/2015-09-15/1201592183.PDF
139,2015-10-24,富煌钢构：2015年第三季度报告正文,finalpage/2015-10-24/1201717503.PDF
140,2015-10-24,富煌钢构：2015年第三季度报告全文,finalpage/2015-10-24/1201717504.PDF
141,2015-11-18,富煌钢构：关于非公开发行股票申请获得中国证监会受理的公告,finalpage/2015-11-18/1201775226.PDF
142,2015-11-20,富煌钢构：关于董事辞职的公告,finalpage/2015-11-20/1201778621.PDF
143,2015-11-23,富煌钢构：关于独立董事辞职的公告,finalpage/2015-11-23/1201784096.PDF
144,2015-11-24,富煌钢构：第四届董事会第十五次会议决议公告,finalpage/2015-11-24/1201784832.PDF
145,2015-11-24,富煌钢构：关于为控股子公司提供担保的公告,finalpage/2015-11-24/1201784833.PDF
146,2015-11-25,富煌钢构：第四届董事会第十六次会议决议公告,finalpage/2015-11-25/1201786466.PDF
147,2015-11-25,富煌钢构：关于董事会秘书辞职的公告,finalpage/2015-11-25/1201786467.PDF
148,2015-11-25,富煌钢构：关于聘任董事会秘书的公告,finalpage/2015-11-25/1201786468.PDF
149,2015-12-02,富煌钢构：公司章程（2015年12月）,finalpage/2015-12-02/1201800879.PDF
150,2015-12-02,富煌钢构：董事会议事规则（2015年12月）,finalpage/2015-12-02/1201800880.PDF
151,2015-12-02,富煌钢构：独立董事候选人声明（陈青）,finalpage/2015-12-02/1201800881.PDF
152,2015-12-02,富煌钢构：独立董事提名人声明,finalpage/2015-12-02/1201800882.PDF
153,2015-12-02,富煌钢构：独立董事关于对第四届董事会第十七次会议相关议案的独立意见,finalpage/2015-12-02/1201800883.PDF
154,2015-12-02,富煌钢构：第四届董事会第十七次会议决议公告,finalpage/2015-12-02/1201800884.PDF
155,2015-12-02,富煌钢构：关于提名独立董事候选人的公告,finalpage/2015-12-02/1201800885.PDF
156,2015-12-02,富煌钢构：关于聘任公司副总经理的公告,finalpage/2015-12-02/1201800886.PDF
157,2015-12-02,富煌钢构：关于召开2015年第二次临时股东大会的通知,finalpage/2015-12-02/1201800887.PDF
158,2015-12-12,富煌钢构：关于重大合同中标的提示性公告,finalpage/2015-12-12/1201830044.PDF
159,2015-12-17,富煌钢构：关于重大合同中标的确认公告,finalpage/2015-12-17/1201843061.PDF
160,2015-12-19,富煌钢构：2015年第二次临时股东大会的法律意见书,finalpage/2015-12-19/1201846028.PDF
161,2015-12-19,富煌钢构：2015年第二次临时股东大会决议公告,finalpage/2015-12-19/1201846029.PDF
162,2015-12-30,富煌钢构：关于收到《中国证监会行政许可项目审查反馈意见通知书》的公告,finalpage/2015-12-30/1201873310.PDF
163,2015-12-31,富煌钢构：关于更换保荐机构和保荐代表人的公告,finalpage/2015-12-31/1201881870.PDF
164,2015-12-31,富煌钢构：关于签署日常经营重大合同的公告,finalpage/2015-12-31/1201881871.PDF
165,2016-01-23,富煌钢构：关于申请延期回复非公开发行股票反馈意见的公告,finalpage/2016-01-23/1201934857.PDF
166,2016-01-26,富煌钢构：第四届董事会第十八次会议决议公告,finalpage/2016-01-26/1201937257.PDF
167,2016-01-26,富煌钢构：关于投资设立子公司的公告,finalpage/2016-01-26/1201937258.PDF
168,2016-01-27,富煌钢构：关于控股股东部分股权质押的公告,finalpage/2016-01-27/1201943077.PDF
169,2016-02-05,富煌钢构：国元证券股份有限公司关于公司部分限售股份上市流通的核查意见,finalpage/2016-02-05/1201972221.PDF
170,2016-02-05,富煌钢构：首次公开发行前已发行股份上市流通的提示性公告,finalpage/2016-02-05/1201972222.PDF
171,2016-02-17,富煌钢构：关于股东减持计划的提示性公告,finalpage/2016-02-17/1201983634.PDF
172,2016-02-26,富煌钢构：关于非公开发行股票摊薄即期回报影响及公司采取措施、相关主体承诺的公告,finalpage/2016-02-26/1201999580.PDF
173,2016-02-26,富煌钢构：关于最近五年被证券监管部门和交易所处罚或采取监管措施及整改情况的公告,finalpage/2016-02-26/1201999581.PDF
174,2016-02-26,富煌钢构：关于非公开发行股票募集资金投资项目涉及补充披露事项的公告,finalpage/2016-02-26/1201999582.PDF
175,2016-02-26,富煌钢构：关于非公开发行股票申请文件反馈意见回复的公告,finalpage/2016-02-26/1201999583.PDF
176,2016-02-26,富煌钢构：关于公司非公开发行股票申请文件反馈意见的回复,finalpage/2016-02-26/1201999584.PDF
177,2016-02-29,富煌钢构：2015年度业绩快报,finalpage/2016-02-29/1202006724.PDF
178,2016-03-04,富煌钢构：关于控股股东部分股权质押的公告,finalpage/2016-03-04/1202022547.PDF
179,2016-03-22,富煌钢构：2016年度第一季度业绩预告,finalpage/2016-03-22/1202066076.PDF
180,2016-03-23,富煌钢构：关于全资子公司完成设立登记的公告,finalpage/2016-03-23/1202066179.PDF
181,2016-03-25,富煌钢构：关于非公开发行股票申请获得中国证监会发行审核委员会审核通过的公告,finalpage/2016-03-25/1202080377.PDF
182,2016-04-01,富煌钢构：关于研发项目取得重大技术进展的公告,finalpage/2016-04-01/1202121898.PDF
183,2016-04-11,富煌钢构：内部控制规则落实自查表,finalpage/2016-04-11/1202156525.PDF
184,2016-04-11,富煌钢构：公司章程（2016年4月）,finalpage/2016-04-11/1202156526.PDF
185,2016-04-11,富煌钢构：关于2015年度利润分配方案的公告,finalpage/2016-04-11/1202156527.PDF
186,2016-04-11,富煌钢构：2015年度内部控制评价报告,finalpage/2016-04-11/1202156528.PDF
187,2016-04-11,富煌钢构：内部控制鉴证报告,finalpage/2016-04-11/1202156529.PDF
188,2016-04-11,富煌钢构：第四届监事会第十二次会议决议公告,finalpage/2016-04-11/1202156530.PDF
189,2016-04-11,富煌钢构：第四届董事会第十九次会议决议公告,finalpage/2016-04-11/1202156531.PDF
190,2016-04-11,富煌钢构：关于2016年度向银行申请综合授信额度的公告,finalpage/2016-04-11/1202156532.PDF
191,2016-04-11,富煌钢构：关于举行2015年度业绩网上说明会的通知,finalpage/2016-04-11/1202156533.PDF
192,2016-04-11,富煌钢构：独立董事2015年度述职报告（吴林）,finalpage/2016-04-11/1202156534.PDF
193,2016-04-11,富煌钢构：独立董事2015年度述职报告（王玉瑛）,finalpage/2016-04-11/1202156535.PDF
194,2016-04-11,富煌钢构：独立董事2015年度述职报告（朱华）,finalpage/2016-04-11/1202156536.PDF
195,2016-04-11,富煌钢构：独立董事2015年度述职报告（陈青）,finalpage/2016-04-11/1202156537.PDF
196,2016-04-11,富煌钢构：2015年度监事会工作报告,finalpage/2016-04-11/1202156538.PDF
197,2016-04-11,富煌钢构：独立董事关于公司第四届董事会第十九次会议相关议案的独立意见,finalpage/2016-04-11/1202156539.PDF
198,2016-04-11,富煌钢构：关于募集资金年度存放与使用情况的专项报告,finalpage/2016-04-11/1202156540.PDF
199,2016-04-11,富煌钢构：募集资金年度存放与使用情况鉴证报告,finalpage/2016-04-11/1202156541.PDF
200,2016-04-11,富煌钢构：关于召开2015年度股东大会的通知,finalpage/2016-04-11/1202156542.PDF
201,2016-04-11,富煌钢构：控股股东及其他关联方资金占用情况专项审核报告,finalpage/2016-04-11/1202156543.PDF
202,2016-04-11,富煌钢构：国元证券股份有限公司关于《安徽富煌钢构股份有限公司2015年度内部控制评价报告》的核查意见,finalpage/2016-04-11/1202156544.PDF
203,2016-04-11,富煌钢构：国元证券股份有限公司关于公司《内部控制规则落实自查表》的核查意见,finalpage/2016-04-11/1202156545.PDF
204,2016-04-11,富煌钢构：国元证券股份有限公司关于公司2015年度募集资金存放与使用情况的专项核查意见,finalpage/2016-04-11/1202156546.PDF
205,2016-04-11,富煌钢构：2015年年度报告摘要,finalpage/2016-04-11/1202156547.PDF
206,2016-04-11,富煌钢构：2015年年度报告,finalpage/2016-04-11/1202156548.PDF
207,2016-04-11,富煌钢构：2015年年度审计报告,finalpage/2016-04-11/1202156549.PDF
208,2016-04-12,富煌钢构：国元证券股份有限公司关于公司2015年度保荐工作报告,finalpage/2016-04-12/1202168474.PDF
209,2016-04-19,富煌钢构：关于对深圳证券交易所问询函回复的公告,finalpage/2016-04-19/1202193750.PDF
210,2016-04-21,富煌钢构：2016年1-3月份新签合同情况简报,finalpage/2016-04-21/1202210510.PDF
211,2016-04-29,富煌钢构：2016年第一季度报告正文,finalpage/2016-04-29/1202263206.PDF
212,2016-04-29,富煌钢构：2016年第一季度报告全文,finalpage/2016-04-29/1202263207.PDF
213,2016-05-04,富煌钢构：2015年年度股东大会的法律意见书,finalpage/2016-05-04/1202287850.PDF
