,date,title,url
214,2016-05-04,富煌钢构：2015年度股东大会决议公告,finalpage/2016-05-04/1202287851.PDF
215,2016-05-05,富煌钢构：关于2015年年报问询函回复的公告,finalpage/2016-05-05/1202294523.PDF
216,2016-05-05,富煌钢构：华普天健会计师事务所（特殊普通合伙）关于公司2015年年报问询函的回复,finalpage/2016-05-05/1202294524.PDF
217,2016-05-06,富煌钢构：关于2015年年度权益分派实施的公告,finalpage/2016-05-06/1202299133.PDF
218,2016-05-13,富煌钢构：关于2015年年度权益分派方案实施后调整非公开发行股票发行底价和发行数量的公告,finalpage/2016-05-13/1202319179.PDF
219,2016-05-24,富煌钢构：第四届董事会第二十一次会议决议公告,finalpage/2016-05-24/1202336400.PDF
220,2016-05-24,富煌钢构：关于聘任常务副总经理兼总工程师的公告,finalpage/2016-05-24/1202336401.PDF
221,2016-05-24,富煌钢构：独立董事关于聘任常务副总经理兼总工程师的独立意见,finalpage/2016-05-24/1202336402.PDF
222,2016-06-24,富煌钢构：关于投资设立子公司的公告,finalpage/2016-06-24/1202394067.PDF
223,2016-06-24,富煌钢构：第四届董事会第二十二次会议决议公告,finalpage/2016-06-24/1202394068.PDF
224,2016-07-07,富煌钢构：独立董事关于日常性关联交易事项的事前认可意见,finalpage/2016-07-07/1202455472.PDF
225,2016-07-07,富煌钢构：独立董事关于日常性关联交易事项的独立意见,finalpage/2016-07-07/1202455473.PDF
226,2016-07-07,富煌钢构：2016年4-6月份新签销售合同情况简报,finalpage/2016-07-07/1202455474.PDF
227,2016-07-07,富煌钢构：第四届董事会第二十三次会议决议公告,finalpage/2016-07-07/1202455475.PDF
228,2016-07-07,富煌钢构：关于日常性关联交易事项的公告,finalpage/2016-07-07/1202455476.PDF
229,2016-07-07,富煌钢构：国元证券股份有限公司关于公司日常性关联交易事项的核查意见,finalpage/2016-07-07/1202455477.PDF
230,2016-07-14,富煌钢构：关于非公开发行股票申请获中国证监会核准批复的公告,finalpage/2016-07-14/1202469383.PDF
231,2016-07-15,富煌钢构：关于全资子公司完成设立登记的公告,finalpage/2016-07-15/1202473753.PDF
232,2016-08-18,富煌钢构：国元证券股份有限公司关于公司非公开发行股票之上市保荐书,finalpage/2016-08-18/1202577274.PDF
233,2016-08-18,富煌钢构：国元证券股份有限公司关于公司非公开发行股票发行过程和认购对象合规性的报告,finalpage/2016-08-18/1202577275.PDF
234,2016-08-18,富煌钢构：安徽承义律师事务所关于公司2015年非公开发行股票询价及配售过程的见证法律意见书,finalpage/2016-08-18/1202577276.PDF
235,2016-08-18,富煌钢构：非公开发行股票发行情况报告暨上市公告书,finalpage/2016-08-18/1202577277.PDF
236,2016-08-18,富煌钢构：非公开发行股票发行情况报告暨上市公告书摘要,finalpage/2016-08-18/1202577278.PDF
237,2016-08-19,富煌钢构：关于修改《公司章程》部分条款的公告,finalpage/2016-08-19/1202581829.PDF
238,2016-08-19,富煌钢构：第四届董事会第二十四次会议决议公告,finalpage/2016-08-19/1202581830.PDF
239,2016-08-19,富煌钢构：公司章程（2016年8月）,finalpage/2016-08-19/1202581831.PDF
240,2016-08-19,富煌钢构：北京市天元律师事务所关于平安大华基金管理有限公司旗下特定客户资产管理计划及证券投资基金投资公司非公开发行股票一致行动人之法律意见书,finalpage/2016-08-19/1202581832.PDF
241,2016-08-19,富煌钢构：关于签署募集资金三方监管协议的公告,finalpage/2016-08-19/1202581833.PDF
242,2016-08-19,富煌钢构：简式权益变动报告书（二）,finalpage/2016-08-19/1202581834.PDF
243,2016-08-19,富煌钢构：简式权益变动报告书（一）,finalpage/2016-08-19/1202581835.PDF
244,2016-08-24,富煌钢构：第四届监事会第十四次会议决议公告,finalpage/2016-08-24/1202606837.PDF
245,2016-08-24,富煌钢构：独立董事关于第四届董事会第二十五次会议相关议案的独立意见,finalpage/2016-08-24/1202606840.PDF
246,2016-08-24,富煌钢构：2016年半年度报告,finalpage/2016-08-24/1202606841.PDF
247,2016-08-24,富煌钢构：第四届董事会第二十五次会议决议公告,finalpage/2016-08-24/1202606842.PDF
248,2016-08-24,富煌钢构：2016年半年度报告摘要,finalpage/2016-08-24/1202606843.PDF
249,2016-08-24,富煌钢构：2016年半年度财务报告,finalpage/2016-08-24/1202606989.PDF
250,2016-08-25,富煌钢构：第四届董事会第二十六次会议决议公告,finalpage/2016-08-25/1202612121.PDF
251,2016-08-26,富煌钢构：关于为控股子公司提供担保的公告,finalpage/2016-08-26/1202616697.PDF
252,2016-09-20,富煌钢构：关于以募集资金置换预先投入自筹资金的公告,finalpage/2016-09-20/1202707881.PDF
253,2016-09-20,富煌钢构：独立董事关于第四届董事会第二十七次会议相关议案的独立意见,finalpage/2016-09-20/1202707882.PDF
254,2016-09-20,富煌钢构：关于公司以自筹资金预先投入募集资金投资项目的鉴证报告,finalpage/2016-09-20/1202707883.PDF
255,2016-09-20,富煌钢构：国元证券股份有限公司关于公司以募集资金置换预先投入自筹资金的核查意见,finalpage/2016-09-20/1202707884.PDF
256,2016-09-20,富煌钢构：国元证券股份有限公司关于公司使用银行承兑汇票或商业承兑汇票支付募投项目所需资金并以募集资金等额置换的核查意见,finalpage/2016-09-20/1202707885.PDF
257,2016-09-20,富煌钢构：第四届董事会第二十七次会议决议公告,finalpage/2016-09-20/1202707886.PDF
258,2016-09-20,富煌钢构：第四届监事会第十五次会议决议公告,finalpage/2016-09-20/1202707887.PDF
259,2016-09-20,富煌钢构：关于使用银行承兑汇票或商业承兑汇票支付募集资金投资项目所需资金并以募集资金等额置换的公告,finalpage/2016-09-20/1202707888.PDF
260,2016-10-11,富煌钢构：2016年7-9月份新签销售合同情况简报,finalpage/2016-10-11/1202746697.PDF
261,2016-10-14,富煌钢构：第四届董事会第二十八次会议决议公告,finalpage/2016-10-14/1202756346.PDF
262,2016-10-14,富煌钢构：独立董事关于日常性关联交易事项的事前认可意见,finalpage/2016-10-14/1202756347.PDF
263,2016-10-14,富煌钢构：独立董事关于日常性关联交易事项的独立意见,finalpage/2016-10-14/1202756348.PDF
264,2016-10-14,富煌钢构：关于日常性关联交易事项的公告,finalpage/2016-10-14/1202756349.PDF
265,2016-10-14,富煌钢构：国元证券股份有限公司关于公司新增日常关联交易的核查意见,finalpage/2016-10-14/1202756350.PDF
266,2016-10-28,富煌钢构：2016年第三季度报告正文,finalpage/2016-10-28/1202795374.PDF
267,2016-10-28,富煌钢构：2016年第三季度报告全文,finalpage/2016-10-28/1202795375.PDF
268,2016-11-14,富煌钢构：第四届董事会第三十次会议决议公告,finalpage/2016-11-14/1202826411.PDF
269,2016-11-14,富煌钢构：第四届监事会第十七次会议决议公告,finalpage/2016-11-14/1202826412.PDF
270,2016-11-14,富煌钢构：2016年限制性股票激励计划实施考核办法,finalpage/2016-11-14/1202826413.PDF
271,2016-11-14,富煌钢构：监事会关于2016年限制性股票激励计划相关事项的审核意见,finalpage/2016-11-14/1202826414.PDF
272,2016-11-14,富煌钢构：独立董事关于2016年限制性股票激励计划（草案）的独立意见,finalpage/2016-11-14/1202826415.PDF
273,2016-11-14,富煌钢构：中小企业板上市公司股权激励计划草案自查表,finalpage/2016-11-14/1202826416.PDF
274,2016-11-14,富煌钢构：2016年限制性股票激励计划（草案）,finalpage/2016-11-14/1202826417.PDF
275,2016-11-14,富煌钢构：2016年限制性股票激励计划（草案）摘要,finalpage/2016-11-14/1202826418.PDF
276,2016-11-14,富煌钢构：2016年限制性股票激励计划激励对象名单,finalpage/2016-11-14/1202826419.PDF
277,2016-11-18,富煌钢构：独立董事候选人声明（吴林）,finalpage/2016-11-18/1202833505.PDF
278,2016-11-18,富煌钢构：独立董事候选人声明（王玉瑛）,finalpage/2016-11-18/1202833506.PDF
279,2016-11-18,富煌钢构：独立董事候选人声明（朱华）,finalpage/2016-11-18/1202833507.PDF
280,2016-11-18,富煌钢构：独立董事候选人声明（陈青）,finalpage/2016-11-18/1202833508.PDF
281,2016-11-18,富煌钢构：独立董事提名人声明（一）,finalpage/2016-11-18/1202833509.PDF
282,2016-11-18,富煌钢构：独立董事提名人声明（四）,finalpage/2016-11-18/1202833510.PDF
283,2016-11-18,富煌钢构：独立董事提名人声明（三）,finalpage/2016-11-18/1202833511.PDF
284,2016-11-18,富煌钢构：独立董事提名人声明（二）,finalpage/2016-11-18/1202833512.PDF
285,2016-11-18,富煌钢构：第四届监事会第十八次会议决议公告,finalpage/2016-11-18/1202833513.PDF
286,2016-11-18,富煌钢构：公司章程（2016年11月）,finalpage/2016-11-18/1202833514.PDF
287,2016-11-18,富煌钢构：股东大会议事规则（2016年11月）,finalpage/2016-11-18/1202833515.PDF
288,2016-11-18,富煌钢构：安徽承义律师事务所关于公司2016年限制性股票激励计划之法律意见书,finalpage/2016-11-18/1202833516.PDF
289,2016-11-18,富煌钢构：独立董事关于第四届董事会第三十一次会议相关议案的独立意见,finalpage/2016-11-18/1202833517.PDF
290,2016-11-18,富煌钢构：关于召开2016年第一次临时股东大会的通知,finalpage/2016-11-18/1202833518.PDF
291,2016-11-18,富煌钢构：独立董事公开征集委托投票权报告书,finalpage/2016-11-18/1202833519.PDF
292,2016-11-18,富煌钢构：第四届董事会第三十一次会议决议公告,finalpage/2016-11-18/1202833520.PDF
293,2016-11-18,富煌钢构：平安证券有限责任公司关于公司持续督导定期现场检查报告,finalpage/2016-11-18/1202833521.PDF
294,2016-11-21,富煌钢构：第四届董事会第三十二次会议决议公告,finalpage/2016-11-21/1202836820.PDF
295,2016-11-21,富煌钢构：关于为控股子公司提供担保的公告,finalpage/2016-11-21/1202836821.PDF
296,2016-11-30,富煌钢构：监事会关于激励对象名单审核及在公司公示情况的说明,finalpage/2016-11-30/1202848509.PDF
297,2016-12-06,富煌钢构：2016年第一次临时股东大会决议公告,finalpage/2016-12-06/1202859592.PDF
298,2016-12-06,富煌钢构：2016年第一次职工代表大会会议决议,finalpage/2016-12-06/1202859593.PDF
299,2016-12-06,富煌钢构：关于限制性股票激励计划内幕信息知情人买卖公司股票的自查报告,finalpage/2016-12-06/1202859594.PDF
300,2016-12-06,富煌钢构：2016年第一次临时股东大会的法律意见书,finalpage/2016-12-06/1202859595.PDF
301,2016-12-06,富煌钢构：职工代表大会会议决议公告,finalpage/2016-12-06/1202859596.PDF
302,2016-12-07,富煌钢构：第五届董事会第一次会议决议公告,finalpage/2016-12-07/1202861799.PDF
303,2016-12-07,富煌钢构：第五届监事会第一次会议决议公告,finalpage/2016-12-07/1202861800.PDF
304,2016-12-07,富煌钢构：关于投资设立子公司的公告,finalpage/2016-12-07/1202861801.PDF
305,2016-12-07,富煌钢构：独立董事关于第五届董事会聘任高级管理人员事项的独立意见,finalpage/2016-12-07/1202861802.PDF
306,2016-12-09,富煌钢构：国元证券股份有限公司关于公司2016年定期现场检查报告,finalpage/2016-12-09/1202865466.PDF
307,2016-12-13,富煌钢构：第五届董事会第二次会议决议公告,finalpage/2016-12-13/1202872248.PDF
308,2016-12-13,富煌钢构：第五届监事会第二次会议决议公告,finalpage/2016-12-13/1202872249.PDF
309,2016-12-13,富煌钢构：关于2016年限制性股票激励计划授予事项的公告,finalpage/2016-12-13/1202872250.PDF
310,2016-12-13,富煌钢构：独立董事关于2016年限制性股票激励计划授予事项的独立意见,finalpage/2016-12-13/1202872251.PDF
311,2016-12-13,富煌钢构：监事会关于公司向激励对象授予限制性股票的核查意见,finalpage/2016-12-13/1202872252.PDF
312,2016-12-13,富煌钢构：安徽承义律师事务所关于公司2016年限制性股票激励计划之补充法律意见书（一）,finalpage/2016-12-13/1202872253.PDF
313,2016-12-17,富煌钢构：关于全资子公司完成设立登记的公告,finalpage/2016-12-17/1202878768.PDF
314,2016-12-20,富煌钢构：关于变更持续督导保荐代表人的公告,finalpage/2016-12-20/1202896946.PDF
315,2016-12-24,富煌钢构：关于投资设立全资子公司的公告,finalpage/2016-12-24/1202953370.PDF
316,2016-12-24,富煌钢构：第五届董事会第三次会议决议公告,finalpage/2016-12-24/1202953371.PDF
317,2016-12-28,富煌钢构：关于公司控股股东拟非公开发行可交换公司债券的公告,finalpage/2016-12-28/1202968586.PDF
318,2016-12-30,富煌钢构：关于全资子公司完成设立登记的公告,finalpage/2016-12-30/1202973750.PDF
319,2017-01-13,富煌钢构：关于2016年限制性股票授予登记完成的公告,finalpage/2017-01-13/1203011611.PDF
320,2017-01-14,富煌钢构：2016年10-12月份新签销售合同情况简报,finalpage/2017-01-14/1203013941.PDF
321,2017-02-16,富煌钢构：关于投资设立全资子公司的公告（一）,finalpage/2017-02-16/1203085090.PDF
322,2017-02-16,富煌钢构：关于投资设立全资子公司的公告（二）,finalpage/2017-02-16/1203085091.PDF
323,2017-02-16,富煌钢构：第五届董事会第四次会议决议公告,finalpage/2017-02-16/1203085092.PDF
324,2017-02-17,富煌钢构：关于公司控股股东非公开发行可交换公司债券完成股份质押的公告,finalpage/2017-02-17/1203090192.PDF
325,2017-02-23,富煌钢构：关于全资子公司完成设立登记的公告,finalpage/2017-02-23/1203102792.PDF
326,2017-02-28,富煌钢构：2016年度业绩快报,finalpage/2017-02-28/1203111739.PDF
327,2017-03-22,富煌钢构：第五届董事会第五次会议决议公告,finalpage/2017-03-22/1203182767.PDF
328,2017-03-22,富煌钢构：关于投资设立全资子公司的公告,finalpage/2017-03-22/1203182768.PDF
329,2017-03-24,富煌钢构：关于控股股东完成非公开发行可交换公司债券的公告,finalpage/2017-03-24/1203191497.PDF
330,2017-04-10,富煌钢构：2017年1-3月份新签销售合同情况简报,finalpage/2017-04-10/1203273710.PDF
331,2017-04-26,富煌钢构：关于全资子公司完成设立登记的公告,finalpage/2017-04-26/1203381749.PDF
332,2017-04-26,富煌钢构：2016年度业绩快报修正公告,finalpage/2017-04-26/1203381751.PDF
333,2017-04-27,富煌钢构：独立董事关于公司第五届董事会第六次会议相关议案的独立意见,finalpage/2017-04-27/1203403023.PDF
334,2017-04-27,富煌钢构：第五届董事会第六次会议决议公告,finalpage/2017-04-27/1203403024.PDF
335,2017-04-27,富煌钢构：第五届监事会第三次会议决议公告,finalpage/2017-04-27/1203403025.PDF
336,2017-04-27,富煌钢构：关于使用部分闲置募集资金暂时补充流动资金的公告,finalpage/2017-04-27/1203403026.PDF
337,2017-04-27,富煌钢构：国元证券股份有限公司关于公司使用部分闲置募集资金暂时补充流动资金的核查意见,finalpage/2017-04-27/1203403027.PDF
338,2017-04-28,富煌钢构：独立董事关于第五届董事会第七次会议相关事项的独立意见,finalpage/2017-04-28/1203414266.PDF
339,2017-04-28,富煌钢构：2016年度内部控制评价报告,finalpage/2017-04-28/1203414267.PDF
340,2017-04-28,富煌钢构：关于募集资金年度存放与使用情况的专项报告,finalpage/2017-04-28/1203414268.PDF
341,2017-04-28,富煌钢构：独立董事关于第五届董事会第七次会议相关事项的独立意见,finalpage/2017-04-28/1203414269.PDF
342,2017-04-28,富煌钢构：2016年度内部控制评价报告,finalpage/2017-04-28/1203414270.PDF
343,2017-04-28,富煌钢构：内部控制规则落实自查表,finalpage/2017-04-28/1203414271.PDF
344,2017-04-28,富煌钢构：未来三年（2017—2019年）股东回报规划,finalpage/2017-04-28/1203414272.PDF
345,2017-04-28,富煌钢构：2017年度向银行申请综合授信额度,finalpage/2017-04-28/1203414273.PDF
346,2017-04-28,富煌钢构：国元证券股份有限公司关于《安徽富煌钢构股份有限公司2016年度内部控制评价报告》的核查意见,finalpage/2017-04-28/1203414274.PDF
347,2017-04-28,富煌钢构：国元证券股份有限公司关于公司《内部控制规则落实自查表》的核查意见,finalpage/2017-04-28/1203414275.PDF
348,2017-04-28,富煌钢构：关于举行2016年度业绩网上说明会的通知,finalpage/2017-04-28/1203414276.PDF
349,2017-04-28,富煌钢构：2016年年度审计报告,finalpage/2017-04-28/1203414278.PDF
350,2017-04-28,富煌钢构：2017年第一季度报告全文,finalpage/2017-04-28/1203414279.PDF
351,2017-04-28,富煌钢构：2016年年度报告,finalpage/2017-04-28/1203414280.PDF
352,2017-04-28,富煌钢构：控股股东及其他关联方资金占用情况专项审核报告,finalpage/2017-04-28/1203414282.PDF
353,2017-04-28,富煌钢构：国元证券股份有限公司关于公司2016年度保荐工作报告,finalpage/2017-04-28/1203414283.PDF
354,2017-04-28,富煌钢构：第五届监事会第四次会议决议公告,finalpage/2017-04-28/1203414284.PDF
355,2017-04-28,富煌钢构：第五届董事会第七次会议决议公告,finalpage/2017-04-28/1203414285.PDF
356,2017-04-28,富煌钢构：关于募集资金年度存放与使用情况的专项报告,finalpage/2017-04-28/1203414286.PDF
357,2017-04-28,富煌钢构：独立董事2016年度述职报告（陈青）,finalpage/2017-04-28/1203414287.PDF
358,2017-04-28,富煌钢构：2017年第一季度报告正文,finalpage/2017-04-28/1203414288.PDF
359,2017-04-28,富煌钢构：独立董事2016年度述职报告（王玉瑛）,finalpage/2017-04-28/1203414289.PDF
360,2017-04-28,富煌钢构：独立董事2016年度述职报告（吴林）,finalpage/2017-04-28/1203414290.PDF
361,2017-04-28,富煌钢构：独立董事2016年度述职报告（朱华）,finalpage/2017-04-28/1203414291.PDF
362,2017-04-28,富煌钢构：国元证券股份有限公司关于公司2016年度募集资金存放与使用情况的专项核查意见,finalpage/2017-04-28/1203414292.PDF
363,2017-04-28,富煌钢构：2016年年度监事会工作报告,finalpage/2017-04-28/1203414293.PDF
364,2017-04-28,富煌钢构：2016年年度报告摘要,finalpage/2017-04-28/1203414294.PDF
365,2017-04-28,富煌钢构：募集资金年度存放与使用情况鉴证报告,finalpage/2017-04-28/1203414295.PDF
366,2017-04-28,富煌钢构：关于召开2016年年度股东大会的通知,finalpage/2017-04-28/1203414296.PDF
367,2017-04-29,富煌钢构：第五届董事会第八次会议决议公告,finalpage/2017-04-29/1203422768.PDF
368,2017-04-29,富煌钢构：独立董事关于第五届董事会第八次会议相关议案的独立意见,finalpage/2017-04-29/1203422769.PDF
369,2017-04-29,富煌钢构：关于收购资产的公告,finalpage/2017-04-29/1203422770.PDF
370,2017-05-09,富煌钢构：独立董事关于第五届董事会第九次会议相关议案的独立意见,finalpage/2017-05-09/1203484668.PDF
371,2017-05-09,富煌钢构：关于聘任常务副总经理的公告,finalpage/2017-05-09/1203484669.PDF
372,2017-05-09,富煌钢构：第五届董事会第九次会议决议公告,finalpage/2017-05-09/1203484670.PDF
373,2017-05-09,富煌钢构：关于证券事务代表辞职及聘任新证券事务代表的公告,finalpage/2017-05-09/1203484671.PDF
374,2017-05-16,富煌钢构：关于控股股东部分股权解除质押的公告,finalpage/2017-05-16/1203519370.PDF
375,2017-05-20,富煌钢构：第五届监事会第五次会议决议公告,finalpage/2017-05-20/1203543640.PDF
376,2017-05-20,富煌钢构：独立董事关于第五届董事会第十次会议相关议案的独立意见,finalpage/2017-05-20/1203543641.PDF
377,2017-05-20,富煌钢构：安徽承义律师事务所关于公司2016年限制性股票激励计划的补充法律意见书（二）,finalpage/2017-05-20/1203543642.PDF
378,2017-05-20,富煌钢构：关于2016年限制性股票激励计划第一个解锁期未达到解锁条件的公告,finalpage/2017-05-20/1203543643.PDF
379,2017-05-20,富煌钢构：第五届董事会第十次会议决议公告,finalpage/2017-05-20/1203543644.PDF
380,2017-05-23,富煌钢构：2016年年度股东大会的法律意见书,finalpage/2017-05-23/1203556587.PDF
381,2017-05-23,富煌钢构：2016年年度股东大会决议公告,finalpage/2017-05-23/1203556588.PDF
382,2017-06-09,富煌钢构：关于重大合同中标的公告,finalpage/2017-06-09/1203601959.PDF
383,2017-07-08,富煌钢构：关于2016年年报问询函回复的公告,finalpage/2017-07-08/1203688787.PDF
384,2017-07-11,富煌钢构：第五届董事会第十一次会议决议公告,finalpage/2017-07-11/1203691961.PDF
385,2017-07-11,富煌钢构：独立董事关于日常性关联交易事项的事前认可意见,finalpage/2017-07-11/1203691962.PDF
386,2017-07-11,富煌钢构：独立董事关于日常性关联交易事项的独立意见,finalpage/2017-07-11/1203691963.PDF
387,2017-07-11,富煌钢构：国元证券股份有限公司关于公司日常性关联交易事项的核查意见,finalpage/2017-07-11/1203691964.PDF
388,2017-07-11,富煌钢构：关于日常性关联交易事项的公告,finalpage/2017-07-11/1203691965.PDF
389,2017-07-11,富煌钢构：关于部分限制性股票回购注销完成的公告,finalpage/2017-07-11/1203692464.PDF
390,2017-07-12,富煌钢构：独立董事关于聘任副总经理、董事会秘书的独立意见,finalpage/2017-07-12/1203694132.PDF
391,2017-07-12,富煌钢构：关于副总经理、董事会秘书辞职的公告,finalpage/2017-07-12/1203694133.PDF
392,2017-07-12,富煌钢构：第五届董事会第十二次会议决议公告,finalpage/2017-07-12/1203694134.PDF
393,2017-07-12,富煌钢构：关于聘任副总经理、董事会秘书的公告,finalpage/2017-07-12/1203694135.PDF
394,2017-07-12,富煌钢构：关于2016年年度权益分派实施的公告,finalpage/2017-07-12/1203694428.PDF
395,2017-07-13,富煌钢构：第五届董事会第十三次会议决议公告,finalpage/2017-07-13/1203699856.PDF
396,2017-07-13,富煌钢构：第五届监事会第六次会议决议公告,finalpage/2017-07-13/1203699857.PDF
397,2017-07-13,富煌钢构：关于调整董事、监事和高管薪酬的公告,finalpage/2017-07-13/1203699858.PDF
398,2017-07-13,富煌钢构：独立董事关于第五届董事会第十三次会议相关议案的独立意见,finalpage/2017-07-13/1203699859.PDF
399,2017-07-13,富煌钢构：公司章程（2017年7月）,finalpage/2017-07-13/1203699860.PDF
400,2017-07-13,富煌钢构：关于召开2017年第一次临时股东大会的通知,finalpage/2017-07-13/1203699861.PDF
401,2017-07-13,富煌钢构：安徽承义律师事务所关于公司2016年限制性股票激励计划的补充法律意见书（三）,finalpage/2017-07-13/1203699862.PDF
402,2017-07-13,富煌钢构：关于回购注销部分限制性股票的公告,finalpage/2017-07-13/1203699863.PDF
403,2017-07-14,富煌钢构：2017年4-6月份新签销售合同情况简报,finalpage/2017-07-14/1203703060.PDF
404,2017-07-14,富煌钢构：关于控股股东可交换债券换股价格调整的公告,finalpage/2017-07-14/1203703061.PDF
405,2017-07-29,富煌钢构：2017年第一次临时股东大会决议公告,finalpage/2017-07-29/1203741477.PDF
406,2017-07-29,富煌钢构：2017年第一次临时股东大会的法律意见书,finalpage/2017-07-29/1203741478.PDF
407,2017-08-14,富煌钢构：股票交易异常波动公告,finalpage/2017-08-14/1203790080.PDF
408,2017-08-17,富煌钢构：国元证券股份有限公司关于公司部分限售股份上市流通的核查意见,finalpage/2017-08-17/1203806138.PDF
409,2017-08-17,富煌钢构：关于非公开发行限售股份上市流通的提示性公告,finalpage/2017-08-17/1203806139.PDF
410,2017-08-29,富煌钢构：2017年半年度财务报告,finalpage/2017-08-29/1203890698.PDF
411,2017-08-29,富煌钢构：第五届董事会第十四次会议决议公告,finalpage/2017-08-29/1203890699.PDF
412,2017-08-29,富煌钢构：第五届监事会第七次会议决议公告,finalpage/2017-08-29/1203890700.PDF
413,2017-08-29,富煌钢构：独立董事关于第五届董事会第十四次会议相关事项的独立意见,finalpage/2017-08-29/1203890701.PDF
414,2017-08-29,富煌钢构：第五届董事会第十四次会议决议公告,finalpage/2017-08-29/1203890702.PDF
415,2017-08-29,富煌钢构：关于2017年半年度募集资金存放与使用情况的专项报告,finalpage/2017-08-29/1203890703.PDF
416,2017-08-29,富煌钢构：国元证券股份有限公司关于公司2017年半年度募集资金存放与使用情况的专项核查意见,finalpage/2017-08-29/1203890704.PDF
417,2017-08-29,富煌钢构：2017年半年度报告摘要,finalpage/2017-08-29/1203890705.PDF
418,2017-08-29,富煌钢构：2017年半年度报告,finalpage/2017-08-29/1203890706.PDF
419,2017-09-11,富煌钢构：关于部分限制性股票回购注销完成的公告,finalpage/2017-09-11/1203960643.PDF
420,2017-09-19,富煌钢构：关于参加2017年安徽上市公司投资者网上集体接待日活动的公告,finalpage/2017-09-19/1203987487.PDF
