,date,title,url
421,2017-09-25,富煌钢构：关于持股5%以上股东减持计划的提示性公告,finalpage/2017-09-25/1203996029.PDF
422,2017-10-13,富煌钢构：2017年7-9月份新签销售合同情况简报,finalpage/2017-10-13/1204033063.PDF
423,2017-10-14,富煌钢构：关于签订战略合作协议的公告,finalpage/2017-10-14/1204039475.PDF
424,2017-10-17,富煌钢构：关于公司成为第一中标候选人公示的提示性公告,finalpage/2017-10-17/1204045375.PDF
425,2017-10-27,富煌钢构：第五届董事会第十五次会议决议公告,finalpage/2017-10-27/1204077537.PDF
426,2017-10-27,富煌钢构：独立董事关于日常性关联交易事项的事前认可意见,finalpage/2017-10-27/1204077538.PDF
427,2017-10-27,富煌钢构：独立董事关于日常性关联交易事项的独立意见,finalpage/2017-10-27/1204077539.PDF
428,2017-10-27,富煌钢构：国元证券股份有限公司关于公司日常性关联交易事项的核查意见,finalpage/2017-10-27/1204077540.PDF
429,2017-10-27,富煌钢构：关于日常性关联交易事项的公告,finalpage/2017-10-27/1204077541.PDF
430,2017-10-28,富煌钢构：2017年第三季度报告正文,finalpage/2017-10-28/1204085467.PDF
431,2017-10-28,富煌钢构：2017年第三季度报告全文,finalpage/2017-10-28/1204085468.PDF
432,2017-11-01,富煌钢构：关于签署重大合同的公告,finalpage/2017-11-01/1204103288.PDF
433,2017-11-03,富煌钢构：第五届董事会第十七次会议决议公告,finalpage/2017-11-03/1204108577.PDF
434,2017-11-03,富煌钢构：关于向银行申请增加综合授信额度的公告,finalpage/2017-11-03/1204108578.PDF
435,2017-11-03,富煌钢构：关于增加经营范围并修订《公司章程》的公告,finalpage/2017-11-03/1204108579.PDF
436,2017-11-03,富煌钢构：公司章程（2017年11月）,finalpage/2017-11-03/1204108580.PDF
437,2017-11-03,富煌钢构：关于召开2017年第二次临时股东大会的通知,finalpage/2017-11-03/1204108581.PDF
438,2017-11-10,富煌钢构：关于2017年第二次临时股东大会延期召开的公告,finalpage/2017-11-10/1204128271.PDF
439,2017-11-14,富煌钢构：关于公司通过高新技术企业再认定的公告,finalpage/2017-11-14/1204138205.PDF
440,2017-11-22,富煌钢构：关于重大合同中标的公告,finalpage/2017-11-22/1204155337.PDF
441,2017-11-24,富煌钢构：2017年第二次临时股东大会的法律意见书,finalpage/2017-11-24/1204163366.PDF
442,2017-11-24,富煌钢构：2017年第二次临时股东大会决议公告,finalpage/2017-11-24/1204163367.PDF
443,2017-12-05,富煌钢构：国元证券股份有限公司关于公司2017年定期现场检查报告,finalpage/2017-12-05/1204192118.PDF
444,2017-12-09,富煌钢构：独立董事关于第五届董事会第十八次会议相关事项的独立意见,finalpage/2017-12-09/1204205532.PDF
445,2017-12-09,富煌钢构：第五届董事会第十八次会议决议公告,finalpage/2017-12-09/1204205533.PDF
446,2017-12-09,富煌钢构：关于合作投资设立控股子公司的公告,finalpage/2017-12-09/1204205534.PDF
447,2017-12-09,富煌钢构：关于聘任内部审计负责人的公告,finalpage/2017-12-09/1204205535.PDF
448,2017-12-21,富煌钢构：关于签署重大合同的公告,finalpage/2017-12-21/1204243424.PDF
449,2017-12-27,富煌钢构：第五届监事会第九次会议决议公告,finalpage/2017-12-27/1204269422.PDF
450,2017-12-27,富煌钢构：独立董事关于公司更换会计师事务所相关事项的事前认可意见,finalpage/2017-12-27/1204269423.PDF
451,2017-12-27,富煌钢构：独立董事关于第五届董事会第十九次会议相关事项的独立意见,finalpage/2017-12-27/1204269424.PDF
452,2017-12-27,富煌钢构：第五届董事会第十九次会议决议公告,finalpage/2017-12-27/1204269425.PDF
453,2017-12-27,富煌钢构：关于更换会计师事务所的公告,finalpage/2017-12-27/1204269426.PDF
454,2018-01-09,富煌钢构：关于提前归还募集资金的公告,finalpage/2018-01-09/1204311830.PDF
455,2018-01-10,富煌钢构：关于公司聘任副总经理的公告,finalpage/2018-01-10/1204317235.PDF
456,2018-01-10,富煌钢构：关于召开2018年第一次临时股东大会的通知,finalpage/2018-01-10/1204317236.PDF
457,2018-01-10,富煌钢构：第五届董事会第二十次会议决议公告,finalpage/2018-01-10/1204317237.PDF
458,2018-01-10,富煌钢构：第五届监事会第十次会议决议公告,finalpage/2018-01-10/1204317238.PDF
459,2018-01-10,富煌钢构：关于使用部分闲置募集资金暂时补充流动资金的公告,finalpage/2018-01-10/1204317239.PDF
460,2018-01-10,富煌钢构：国元证券股份有限公司关于公司使用部分闲置募集资金暂时补充流动资金的的核查意见,finalpage/2018-01-10/1204317240.PDF
461,2018-01-10,富煌钢构：独立董事关于公司第五届董事会第二十次会议相关议案的独立意见,finalpage/2018-01-10/1204317241.PDF
462,2018-01-17,富煌钢构：2017年10-12月份新签销售合同情况简报,finalpage/2018-01-17/1204335874.PDF
463,2018-01-20,富煌钢构：第五届董事会第二十一次会议相关议案的独立意见,finalpage/2018-01-20/1204346203.PDF
464,2018-01-20,富煌钢构：第五届董事会第二十一次会议决议公告,finalpage/2018-01-20/1204346204.PDF
465,2018-01-20,富煌钢构：关于公司聘任副总经理的公告,finalpage/2018-01-20/1204346205.PDF
466,2018-01-23,富煌钢构：关于持股5%以上股东股份减持计划的进展公告,finalpage/2018-01-23/1204351747.PDF
467,2018-01-26,富煌钢构：2018年第一次临时股东大会决议公告,finalpage/2018-01-26/1204362353.PDF
468,2018-01-26,富煌钢构：2018年第一次临时股东大会的法律意见书,finalpage/2018-01-26/1204362354.PDF
469,2018-02-05,富煌钢构：关于合作设立的控股子公司完成设立登记的公告,finalpage/2018-02-05/1204390806.PDF
470,2018-02-09,富煌钢构：关于控股股东非公开发行可交换公司债券进入换股期的提示性公告,finalpage/2018-02-09/1204405786.PDF
471,2018-02-13,富煌钢构：关于首次公开发行前已发行股份上市流通的提示性公告,finalpage/2018-02-13/1204418474.PDF
472,2018-02-13,富煌钢构：关于控股股东追加承诺的公告,finalpage/2018-02-13/1204418538.PDF
