,date,title,url
0,2016-04-25,世嘉科技：首次公开发行股票招股说明书,finalpage/2016-04-25/1202237114.PDF
1,2016-04-25,世嘉科技：首次公开发行股票招股说明书摘要,finalpage/2016-04-25/1202237115.PDF
2,2016-04-25,世嘉科技：控股股东、实际控制人对招股说明书的确认意见,finalpage/2016-04-25/1202237116.PDF
3,2016-04-25,世嘉科技：关于公司设立以来股本演变情况的说明及董事、监事、高级管理人员的确认意见,finalpage/2016-04-25/1202237117.PDF
4,2016-04-25,世嘉科技：中国证监会关于核准公司首次公开发行股票的批复,finalpage/2016-04-25/1202237118.PDF
5,2016-04-25,世嘉科技：首次公开发行股票网上路演公告,finalpage/2016-04-25/1202237119.PDF
6,2016-04-25,世嘉科技：董事会及股东大会决议,finalpage/2016-04-25/1202237120.PDF
7,2016-04-25,世嘉科技：审计报告,finalpage/2016-04-25/1202237121.PDF
8,2016-04-25,世嘉科技：公司章程（草案）,finalpage/2016-04-25/1202237122.PDF
9,2016-04-25,世嘉科技：江苏永衡昭辉律师事务所关于公司首次公开发行人民币普通股（A股）股票并上市的法律意见书,finalpage/2016-04-25/1202237123.PDF
10,2016-04-25,世嘉科技：内部控制鉴证报告,finalpage/2016-04-25/1202237124.PDF
11,2016-04-25,世嘉科技：华林证券股份有限公司关于公司首次公开发行股票发行保荐书,finalpage/2016-04-25/1202237125.PDF
12,2016-04-25,世嘉科技：华林证券股份有限公司关于公司首次公开发行股票并上市发行保荐工作报告,finalpage/2016-04-25/1202237126.PDF
13,2016-04-25,世嘉科技：非经常性损益鉴证报告,finalpage/2016-04-25/1202237127.PDF
14,2016-04-26,世嘉科技：首次公开发行股票发行公告,finalpage/2016-04-26/1202242533.PDF
15,2016-04-26,世嘉科技：首次公开发行股票投资风险特别公告,finalpage/2016-04-26/1202242559.PDF
16,2016-04-28,世嘉科技：首次公开发行股票网上定价发行申购情况及中签率公告,finalpage/2016-04-28/1202259455.PDF
17,2016-04-29,世嘉科技：首次公开发行股票网上定价发行摇号中签结果公告,finalpage/2016-04-29/1202265475.PDF
18,2016-05-04,世嘉科技：首次公开发行股票网上定价发行结果公告,finalpage/2016-05-04/1202288105.PDF
19,2016-05-09,世嘉科技：华林证券股份有限公司关于公司股票上市保荐书,finalpage/2016-05-09/1202304771.PDF
20,2016-05-09,世嘉科技：首次公开发行股票上市公告书,finalpage/2016-05-09/1202304772.PDF
21,2016-05-09,世嘉科技：江苏永衡昭辉律师事务所关于公司首次公开发行的股票于深圳证券交易所上市的法律意见书,finalpage/2016-05-09/1202304773.PDF
22,2016-05-10,世嘉科技：上市首日风险提示公告,finalpage/2016-05-10/1202312135.PDF
23,2016-05-13,世嘉科技：股票交易异常波动公告,finalpage/2016-05-13/1202319237.PDF
24,2016-05-18,世嘉科技：股票交易异常波动公告,finalpage/2016-05-18/1202325960.PDF
25,2016-05-20,世嘉科技：股票交易异常波动公告,finalpage/2016-05-20/1202330398.PDF
26,2016-05-25,世嘉科技：股票交易异常波动公告,finalpage/2016-05-25/1202337149.PDF
27,2016-05-25,世嘉科技：第二届董事会第六次会议决议公告,finalpage/2016-05-25/1202337367.PDF
28,2016-05-25,世嘉科技：关于使用部分闲置自有资金购买理财产品的公告,finalpage/2016-05-25/1202337395.PDF
29,2016-05-25,世嘉科技：关于使用闲置募集资金购买理财产品的公告,finalpage/2016-05-25/1202337402.PDF
30,2016-05-25,世嘉科技：关于聘任公司证券事务代表的公告,finalpage/2016-05-25/1202337616.PDF
31,2016-05-25,世嘉科技：关于签署募集资金专户存储三方监管协议的公告,finalpage/2016-05-25/1202337758.PDF
32,2016-05-25,世嘉科技：第二届监事会第五次会议决议公告,finalpage/2016-05-25/1202337778.PDF
33,2016-05-25,世嘉科技：华林证券股份有限公司关于公司使用部分闲置募集资金进行现金管理的核查意见,finalpage/2016-05-25/1202337779.PDF
34,2016-05-25,世嘉科技：独立董事关于公司第二届董事会第六次会议相关事宜的独立意见,finalpage/2016-05-25/1202337780.PDF
35,2016-05-25,世嘉科技：公司章程（2016年5月）,finalpage/2016-05-25/1202337781.PDF
36,2016-05-25,世嘉科技：股东大会议事规则（2016年5月）,finalpage/2016-05-25/1202337782.PDF
37,2016-05-25,世嘉科技：投资管理制度（2016年5月）,finalpage/2016-05-25/1202337783.PDF
38,2016-05-25,世嘉科技：累积投票制实施细则（2016年5月）,finalpage/2016-05-25/1202337784.PDF
39,2016-05-25,世嘉科技：内部审计制度（2016年5月）,finalpage/2016-05-25/1202337785.PDF
40,2016-05-25,世嘉科技：信息披露管理办法（2016年5月）,finalpage/2016-05-25/1202337786.PDF
41,2016-05-25,世嘉科技：募集资金管理办法（2016年5月）,finalpage/2016-05-25/1202337787.PDF
42,2016-05-25,世嘉科技：投资者关系管理制度（2016年5月）,finalpage/2016-05-25/1202337788.PDF
43,2016-05-25,世嘉科技：内幕信息知情人登记管理制度（2016年5月）,finalpage/2016-05-25/1202337789.PDF
44,2016-05-25,世嘉科技：重大信息内部报告制度（2016年5月）,finalpage/2016-05-25/1202337790.PDF
45,2016-05-25,世嘉科技：董事、监事和高级管理人员所持公司股份及其变动管理办法（2016年5月）,finalpage/2016-05-25/1202337791.PDF
46,2016-05-25,世嘉科技：关于拟变更董事的公告,finalpage/2016-05-25/1202337983.PDF
47,2016-05-26,世嘉科技：股票交易异常波动公告,finalpage/2016-05-26/1202339525.PDF
48,2016-05-26,世嘉科技：2016年第一次临时股东大会的通知,finalpage/2016-05-26/1202339526.PDF
49,2016-05-26,世嘉科技：关于使用闲置自有资金购买理财产品的进展公告,finalpage/2016-05-26/1202339527.PDF
50,2016-06-07,世嘉科技：关于使用闲置自有资金购买理财产品的进展公告,finalpage/2016-06-07/1202358685.PDF
51,2016-06-14,世嘉科技：2016年第一次临时股东大会决议公告,finalpage/2016-06-14/1202367042.PDF
52,2016-06-21,世嘉科技：关于使用闲置募集资金购买理财产品的进展公告,finalpage/2016-06-21/1202376013.PDF
53,2016-06-22,世嘉科技：更正公告,finalpage/2016-06-22/1202380734.PDF
54,2016-07-04,世嘉科技：股票交易异常波动公告,finalpage/2016-07-04/1202445448.PDF
55,2016-07-07,世嘉科技：关于使用闲置自有资金购买理财产品的进展公告,finalpage/2016-07-07/1202455772.PDF
56,2016-07-08,世嘉科技：2016年半年度业绩预告,finalpage/2016-07-08/1202459001.PDF
57,2016-07-13,世嘉科技：关于完成工商变更登记的公告,finalpage/2016-07-13/1202468193.PDF
58,2016-08-09,世嘉科技：2016年半年度报告摘要,finalpage/2016-08-09/1202548730.PDF
59,2016-08-09,世嘉科技：第二届董事会第七次会议决议公告,finalpage/2016-08-09/1202548732.PDF
60,2016-08-09,世嘉科技：第二届监事会第六次会议决议公告,finalpage/2016-08-09/1202548733.PDF
61,2016-08-09,世嘉科技：2016年半年度报告,finalpage/2016-08-09/1202548734.PDF
62,2016-08-09,世嘉科技：2016年半年度利润分配预案的公告,finalpage/2016-08-09/1202548735.PDF
63,2016-08-09,世嘉科技：关于2016年半年度募集资金存放与使用情况的专项报告,finalpage/2016-08-09/1202548736.PDF
64,2016-08-09,世嘉科技：关于聘任公司副总经理的公告,finalpage/2016-08-09/1202548737.PDF
65,2016-08-09,世嘉科技：关于召开2016年第二次临时股东大会的通知,finalpage/2016-08-09/1202548738.PDF
66,2016-08-09,世嘉科技：独立董事关于控股股东及其他关联方占用公司资金、公司对外担保情况的专项说明和独立意见,finalpage/2016-08-09/1202548739.PDF
67,2016-08-09,世嘉科技：关于控股股东及其他关联方占用公司资金、公司对外担保情况的专项说明和独立意见,finalpage/2016-08-09/1202548740.PDF
68,2016-08-09,世嘉科技：投资者投诉管理制度（2016年8月）,finalpage/2016-08-09/1202548741.PDF
69,2016-08-09,世嘉科技：舆情管理制度（2016年8月）,finalpage/2016-08-09/1202548742.PDF
70,2016-08-09,世嘉科技：2016年半年度财务报告,finalpage/2016-08-09/1202548743.PDF
71,2016-08-09,世嘉科技：独立董事关于公司第二届董事会第七次会议相关事宜的独立意见,finalpage/2016-08-09/1202548744.PDF
72,2016-08-11,世嘉科技：补充、更正公告,finalpage/2016-08-11/1202553568.PDF
73,2016-08-26,世嘉科技：2016年第二次临时股东大会决议公告,finalpage/2016-08-26/1202619971.PDF
74,2016-08-26,世嘉科技：2016年第二次临时股东大会法律意见书,finalpage/2016-08-26/1202619972.PDF
75,2016-08-30,世嘉科技：2016年半年度权益分派实施公告,finalpage/2016-08-30/1202642849.PDF
76,2016-08-30,世嘉科技：关于使用闲置自有资金购买理财产品的进展公告,finalpage/2016-08-30/1202642850.PDF
77,2016-10-13,世嘉科技：关于使用闲置募集资金购买理财产品的进展公告,finalpage/2016-10-13/1202753264.PDF
78,2016-10-26,世嘉科技：第二届监事会第七次会议决议公告,finalpage/2016-10-26/1202784503.PDF
79,2016-10-26,世嘉科技：第二届董事会第八次会议决议公告,finalpage/2016-10-26/1202784504.PDF
80,2016-10-26,世嘉科技：2016年第三季度报告正文,finalpage/2016-10-26/1202784505.PDF
81,2016-10-26,世嘉科技：2016年第三季度报告全文,finalpage/2016-10-26/1202784506.PDF
82,2016-11-30,世嘉科技：关于使用闲置自有资金购买理财产品的进展公告,finalpage/2016-11-30/1202848680.PDF
83,2016-12-15,世嘉科技：股东股份质押的公告,finalpage/2016-12-15/1202874622.PDF
84,2016-12-19,世嘉科技：华林证券股份有限公司关于公司2016年度持续督导工作定期现场检查报告,finalpage/2016-12-19/1202878806.PDF
85,2016-12-19,世嘉科技：华林证券股份有限公司关于公司2016年度持续督导培训情况报告书,finalpage/2016-12-19/1202878807.PDF
86,2016-12-23,世嘉科技：关于使用闲置募集资金购买理财产品的进展公告,finalpage/2016-12-23/1202939795.PDF
87,2017-01-11,世嘉科技：关于使用闲置自有资金购买理财产品的进展公告,finalpage/2017-01-11/1203004697.PDF
88,2017-01-18,世嘉科技：关于证券事务代表辞职的公告,finalpage/2017-01-18/1203022569.PDF
89,2017-01-19,世嘉科技：关于使用闲置募集资金购买理财产品的进展公告,finalpage/2017-01-19/1203025800.PDF
90,2017-02-09,世嘉科技：第二届董事会第九次会议决议公告,finalpage/2017-02-09/1203071253.PDF
91,2017-02-09,世嘉科技：关于聘任公司审计部负责人的公告,finalpage/2017-02-09/1203071254.PDF
92,2017-02-10,世嘉科技：2016年度业绩快报,finalpage/2017-02-10/1203073471.PDF
93,2017-03-01,世嘉科技：关于公司通过高新技术企业重新认定的公告,finalpage/2017-03-01/1203116665.PDF
94,2017-03-03,世嘉科技：关于使用闲置自有资金购买理财产品的进展公告,finalpage/2017-03-03/1203123565.PDF
95,2017-03-21,世嘉科技：关于公司董事辞职的公告,finalpage/2017-03-21/1203180553.PDF
96,2017-03-22,世嘉科技：关于补选公司董事会提名委员会委员的公告,finalpage/2017-03-22/1203184629.PDF
97,2017-03-22,世嘉科技：第二届董事会第十次会议决议公告,finalpage/2017-03-22/1203184630.PDF
98,2017-03-25,世嘉科技：关于2016年度利润分配预案的预披露公告,finalpage/2017-03-25/1203195966.PDF
99,2017-03-31,世嘉科技：关于使用闲置募集资金购买理财产品的进展公告,finalpage/2017-03-31/1203238478.PDF
100,2017-04-07,世嘉科技：独立董事2016年度述职报告,finalpage/2017-04-07/1203257673.PDF
101,2017-04-07,世嘉科技：关于2016年度利润分配预案的公告,finalpage/2017-04-07/1203257674.PDF
102,2017-04-07,世嘉科技：关于关联交易的公告,finalpage/2017-04-07/1203257675.PDF
103,2017-04-07,世嘉科技：关于补选公司董事的公告,finalpage/2017-04-07/1203257676.PDF
104,2017-04-07,世嘉科技：关于聘任公司证券事务代表的公告,finalpage/2017-04-07/1203257677.PDF
105,2017-04-07,世嘉科技：关于举行2016年年度报告网上说明会的公告,finalpage/2017-04-07/1203257678.PDF
106,2017-04-07,世嘉科技：华林证券股份有限公司关于公司2016年度保荐工作报告,finalpage/2017-04-07/1203257679.PDF
107,2017-04-07,世嘉科技：华林证券股份有限公司关于公司2016年度募集资金存放与使用情况的专项核查意见,finalpage/2017-04-07/1203257680.PDF
108,2017-04-07,世嘉科技：华林证券股份有限公司关于公司关联交易事项的核查意见,finalpage/2017-04-07/1203257681.PDF
109,2017-04-07,世嘉科技：华林证券股份有限公司关于公司内部控制规则落实自查表的核查意见,finalpage/2017-04-07/1203257682.PDF
110,2017-04-07,世嘉科技：华林证券股份有限公司关于公司内部控制自我评价报告的核查意见,finalpage/2017-04-07/1203257683.PDF
111,2017-04-07,世嘉科技：2016年年度审计报告,finalpage/2017-04-07/1203257684.PDF
112,2017-04-07,世嘉科技：募集资金年度存放与使用情况鉴证报告,finalpage/2017-04-07/1203257685.PDF
113,2017-04-07,世嘉科技：独立董事关于公司第二届董事会第十一次会议相关事项的事前认可及独立意见,finalpage/2017-04-07/1203257686.PDF
114,2017-04-07,世嘉科技：控股股东及其他关联方资金占用情况专项审核报告,finalpage/2017-04-07/1203257687.PDF
115,2017-04-07,世嘉科技：2016年度内部控制自我评价报告,finalpage/2017-04-07/1203257688.PDF
116,2017-04-07,世嘉科技：内部控制鉴证报告,finalpage/2017-04-07/1203257689.PDF
117,2017-04-07,世嘉科技：独立董事关于关联交易的事前认可及独立意见,finalpage/2017-04-07/1203257690.PDF
118,2017-04-07,世嘉科技：内部控制规则落实自查表,finalpage/2017-04-07/1203257691.PDF
119,2017-04-07,世嘉科技：2016年年度报告摘要,finalpage/2017-04-07/1203257692.PDF
120,2017-04-07,世嘉科技：第二届董事会第十一次会议决议公告,finalpage/2017-04-07/1203257694.PDF
121,2017-04-07,世嘉科技：关于召开2016年年度股东大会的通知,finalpage/2017-04-07/1203257695.PDF
122,2017-04-07,世嘉科技：第二届监事会第八次会议决议公告,finalpage/2017-04-07/1203257696.PDF
123,2017-04-07,世嘉科技：2016年年度报告,finalpage/2017-04-07/1203257697.PDF
124,2017-04-07,世嘉科技：关于募集资金年度存放与使用情况的专项报告,finalpage/2017-04-07/1203257698.PDF
125,2017-04-07,世嘉科技：关于补选公司董事的公告的补充说明,finalpage/2017-04-07/1203259153.PDF
126,2017-04-12,世嘉科技：关于举行2016年年度报告网上说明会的提示性公告,finalpage/2017-04-12/1203283290.PDF
127,2017-04-13,世嘉科技：关于使用闲置自有资金购买理财产品的进展公告,finalpage/2017-04-13/1203290088.PDF
128,2017-04-22,世嘉科技：第二届董事会第十二次会议决议公告,finalpage/2017-04-22/1203355931.PDF
129,2017-04-22,世嘉科技：第二届监事会第九次会议决议公告,finalpage/2017-04-22/1203355932.PDF
130,2017-04-22,世嘉科技：2017年第一季度报告正文,finalpage/2017-04-22/1203355933.PDF
131,2017-04-22,世嘉科技：2017年第一季度报告全文,finalpage/2017-04-22/1203355935.PDF
132,2017-04-25,世嘉科技：关于召开2016年年度股东大会的提示性公告,finalpage/2017-04-25/1203373253.PDF
133,2017-04-27,世嘉科技：关于使用闲置募集资金购买理财产品的进展公告,finalpage/2017-04-27/1203404000.PDF
134,2017-04-29,世嘉科技：2016年年度股东大会决议公告,finalpage/2017-04-29/1203426210.PDF
135,2017-04-29,世嘉科技：2016年年度股东大会法律意见书,finalpage/2017-04-29/1203426211.PDF
136,2017-05-05,世嘉科技：华林证券股份有限公司关于公司首次公开发行前已发行股份上市流通的核查意见,finalpage/2017-05-05/1203475874.PDF
137,2017-05-05,世嘉科技：首次公开发行前已发行股份上市流通提示性公告,finalpage/2017-05-05/1203475875.PDF
138,2017-05-05,世嘉科技：持股5%以上股东股份减持的预披露公告,finalpage/2017-05-05/1203475876.PDF
139,2017-05-05,世嘉科技：首次公开发行前持股5%以上股东股份减持的预披露公告,finalpage/2017-05-05/1203475877.PDF
140,2017-05-15,世嘉科技：2016年年度权益分派实施公告,finalpage/2017-05-15/1203515285.PDF
141,2017-06-03,世嘉科技：关于重大事项停牌的公告,finalpage/2017-06-03/1203587355.PDF
142,2017-06-06,世嘉科技：关于控股股东、实际控制人股份补充质押的公告,finalpage/2017-06-06/1203589947.PDF
143,2017-06-10,世嘉科技：关于重大事项停牌进展的公告,finalpage/2017-06-10/1203605947.PDF
144,2017-06-16,世嘉科技：关于重大资产重组停牌的公告,finalpage/2017-06-16/1203618223.PDF
145,2017-06-23,世嘉科技：关于重大资产重组停牌进展的公告,finalpage/2017-06-23/1203641038.PDF
146,2017-06-30,世嘉科技：关于重大资产重组停牌进展的公告,finalpage/2017-06-30/1203663423.PDF
147,2017-07-05,世嘉科技：关于重大资产重组停牌进展暨延期复牌的公告,finalpage/2017-07-05/1203681611.PDF
148,2017-07-12,世嘉科技：关于重大资产重组停牌进展的公告,finalpage/2017-07-12/1203693880.PDF
149,2017-07-15,世嘉科技：2017年半年度业绩快报,finalpage/2017-07-15/1203707169.PDF
150,2017-07-19,世嘉科技：关于重大资产重组停牌进展的公告,finalpage/2017-07-19/1203711986.PDF
151,2017-07-26,世嘉科技：关于重大资产重组停牌进展的公告,finalpage/2017-07-26/1203732328.PDF
152,2017-08-02,世嘉科技：关于重大资产重组停牌进展的公告,finalpage/2017-08-02/1203752486.PDF
153,2017-08-04,世嘉科技：第二届董事会第十三次会议决议公告,finalpage/2017-08-04/1203759439.PDF
154,2017-08-04,世嘉科技：关于重大资产重组停牌进展暨延期复牌的公告,finalpage/2017-08-04/1203759440.PDF
155,2017-08-09,世嘉科技：第二届董事会第十四次会议决议公告,finalpage/2017-08-09/1203775090.PDF
156,2017-08-09,世嘉科技：第二届监事会第十次会议决议公告,finalpage/2017-08-09/1203775091.PDF
157,2017-08-09,世嘉科技：关于披露重大资产重组报告书暨公司股票暂不复牌的公告,finalpage/2017-08-09/1203775092.PDF
158,2017-08-09,世嘉科技：关于暂不召开股东大会的公告,finalpage/2017-08-09/1203775093.PDF
159,2017-08-09,世嘉科技：关于重大资产重组的一般风险提示公告,finalpage/2017-08-09/1203775094.PDF
160,2017-08-09,世嘉科技：独立董事关于公司发行股份及支付现金购买资产并募集配套资金暨关联交易的事前认可意见,finalpage/2017-08-09/1203775095.PDF
161,2017-08-09,世嘉科技：独立董事关于公司发行股份及支付现金购买资产并募集配套资金暨关联交易的独立意见,finalpage/2017-08-09/1203775096.PDF
162,2017-08-09,世嘉科技：独立董事关于对评估机构的独立性、评估假设前提的合理性和评估方法与评估目的的相关性及评估定价的公允性的独立意见,finalpage/2017-08-09/1203775097.PDF
163,2017-08-09,世嘉科技：独立董事关于公司未来三年（2018-2020年度）股东回报规划的独立意见,finalpage/2017-08-09/1203775098.PDF
164,2017-08-09,世嘉科技：独立董事关于前次募集资金使用情况的独立意见,finalpage/2017-08-09/1203775099.PDF
165,2017-08-09,世嘉科技：发行股份及支付现金购买资产并募集配套资金暨关联交易报告书（草案）,finalpage/2017-08-09/1203775100.PDF
166,2017-08-09,世嘉科技：发行股份及支付现金购买资产并募集配套资金暨关联交易报告书（草案）摘要,finalpage/2017-08-09/1203775101.PDF
167,2017-08-09,世嘉科技：中小板上市公司重大资产重组方案首次披露对照表,finalpage/2017-08-09/1203775102.PDF
168,2017-08-09,世嘉科技：上市公司并购重组财务顾问专业意见附表第2号——重大资产重组,finalpage/2017-08-09/1203775103.PDF
169,2017-08-09,世嘉科技：上市公司并购重组财务顾问专业意见附表第3号——发行股份购买资产,finalpage/2017-08-09/1203775104.PDF
170,2017-08-09,世嘉科技：重组报告书独立财务顾问核查意见表,finalpage/2017-08-09/1203775105.PDF
171,2017-08-09,世嘉科技：华林证券股份有限公司关于公司本次交易产业政策和交易类型之独立财务顾问核查意见,finalpage/2017-08-09/1203775106.PDF
172,2017-08-09,世嘉科技：华林证券股份有限公司在充分尽职调查和内核的基础上出具的承诺,finalpage/2017-08-09/1203775107.PDF
173,2017-08-09,世嘉科技：发行股份及支付现金购买资产并募集配套资金暨关联交易之重组情况表,finalpage/2017-08-09/1203775108.PDF
174,2017-08-09,世嘉科技：华林证券股份有限公司关于公司发行股份购买资产并募集配套资金暨关联交易之独立财务顾问报告,finalpage/2017-08-09/1203775109.PDF
175,2017-08-09,世嘉科技：上海市锦天城律师事务所关于公司发行股份及支付现金购买资产并募集配套资金暨关联交易的法律意见书,finalpage/2017-08-09/1203775110.PDF
176,2017-08-09,世嘉科技：苏州波发特通讯技术股份有限公司审计报告,finalpage/2017-08-09/1203775111.PDF
177,2017-08-09,世嘉科技：备考审阅报告,finalpage/2017-08-09/1203775112.PDF
178,2017-08-09,世嘉科技：拟发行股份及支付现金购买苏州波发特通讯技术股份有限公司股权项目资产评估报告,finalpage/2017-08-09/1203775113.PDF
179,2017-08-09,世嘉科技：关于公司股票价格波动未达到《关于规范上市公司信息披露及相关各方行为的通知》第五条相关标准的说明,finalpage/2017-08-09/1203775114.PDF
180,2017-08-09,世嘉科技：华林证券股份有限公司关于《苏州市世嘉科技股份有限公司关于停牌前股票价格波动未达到“128号文”第五条相关标准的说明》之核查意见,finalpage/2017-08-09/1203775115.PDF
181,2017-08-09,世嘉科技：关于公司本次交易摊薄即期回报的风险提示及公司采取的填补措施的说明,finalpage/2017-08-09/1203775116.PDF
182,2017-08-09,世嘉科技：华林证券股份有限公司关于公司本次交易摊薄即期回报及其填补措施的核查意见,finalpage/2017-08-09/1203775117.PDF
183,2017-08-09,世嘉科技：董事会关于本次交易履行法定程序的完备性、合规性及提交的法律文件的有效性的说明,finalpage/2017-08-09/1203775118.PDF
184,2017-08-09,世嘉科技：董事会关于对评估机构的独立性、评估假设前提的合理性、评估方法与评估目的的相关性及评估定价的公允性的说明,finalpage/2017-08-09/1203775119.PDF
185,2017-08-09,世嘉科技：关于发行股份及支付现金购买资产并募集配套资金暨关联交易事项的保密措施及保密制度的说明,finalpage/2017-08-09/1203775120.PDF
186,2017-08-09,世嘉科技：未来三年（2018-2020年度）股东回报规划,finalpage/2017-08-09/1203775121.PDF
187,2017-08-09,世嘉科技：前次募集资金使用情况专项报告,finalpage/2017-08-09/1203775122.PDF
188,2017-08-09,世嘉科技：前次募集资金使用情况鉴证报告,finalpage/2017-08-09/1203775123.PDF
189,2017-08-09,世嘉科技：关于权益变动的提示公告,finalpage/2017-08-09/1203775124.PDF
190,2017-08-09,世嘉科技：简式权益变动报告书（一）,finalpage/2017-08-09/1203775125.PDF
191,2017-08-09,世嘉科技：简式权益变动报告书（二）,finalpage/2017-08-09/1203775126.PDF
192,2017-08-09,世嘉科技：简式权益变动报告书（三）,finalpage/2017-08-09/1203775127.PDF
193,2017-08-09,世嘉科技：简式权益变动报告书（四）,finalpage/2017-08-09/1203775128.PDF
194,2017-08-09,世嘉科技：发行股份及支付现金购买资产协议书,finalpage/2017-08-09/1203775129.PDF
195,2017-08-09,世嘉科技：公司与陈宝华、张嘉平关于发行股份及支付现金购买资产之业绩补偿协议,finalpage/2017-08-09/1203775130.PDF
196,2017-08-09,世嘉科技：公司与王娟之附条件生效的股份认购协议,finalpage/2017-08-09/1203775131.PDF
197,2017-08-10,世嘉科技：持股5%以上股东股份减持进展公告,finalpage/2017-08-10/1203778871.PDF
198,2017-08-16,世嘉科技：关于重大资产重组停牌进展的公告,finalpage/2017-08-16/1203801181.PDF
199,2017-08-19,世嘉科技：2017年半年度报告摘要,finalpage/2017-08-19/1203811059.PDF
200,2017-08-19,世嘉科技：2017年半年度财务报告,finalpage/2017-08-19/1203811061.PDF
201,2017-08-19,世嘉科技：第二届董事会第十五次会议决议公告,finalpage/2017-08-19/1203811062.PDF
202,2017-08-19,世嘉科技：第二届监事会第十一次会议决议公告,finalpage/2017-08-19/1203811063.PDF
203,2017-08-19,世嘉科技：关于2017年半年度募集资金存放与使用情况的专项报告,finalpage/2017-08-19/1203811064.PDF
204,2017-08-19,世嘉科技：独立董事关于控股股东及其他关联方占用公司资金、公司对外担保情况的专项说明和独立意见,finalpage/2017-08-19/1203811065.PDF
205,2017-08-19,世嘉科技：独立董事关于公司第二届董事会第十五次会议相关事项的独立意见,finalpage/2017-08-19/1203811066.PDF
206,2017-08-19,世嘉科技：关于会计政策变更的公告,finalpage/2017-08-19/1203811067.PDF
