,date,title,url
411,2017-02-28,众兴菌业：关于使用部分闲置募集资金进行现金管理的进展公告,finalpage/2017-02-28/1203112265.PDF
412,2017-02-28,众兴菌业：2016年年度报告,finalpage/2017-02-28/1203112266.PDF
413,2017-02-28,众兴菌业：2016年度财务决算报告,finalpage/2017-02-28/1203112267.PDF
414,2017-02-28,众兴菌业：2016年度董事会工作报告,finalpage/2017-02-28/1203112268.PDF
415,2017-02-28,众兴菌业：2016年度监事会工作报告,finalpage/2017-02-28/1203112269.PDF
416,2017-02-28,众兴菌业：募集资金年度存放与实际使用情况的鉴证报告（2016年12月31日）,finalpage/2017-02-28/1203112270.PDF
417,2017-02-28,众兴菌业：内部控制鉴证报告（2016年12月31日）,finalpage/2017-02-28/1203112271.PDF
418,2017-02-28,众兴菌业：2016年度内部控制自我评价报告,finalpage/2017-02-28/1203112272.PDF
419,2017-02-28,众兴菌业：2016年年度审计报告,finalpage/2017-02-28/1203112273.PDF
420,2017-02-28,众兴菌业：关联方占用上市公司资金情况的专项审核报告（2016年12月31日）,finalpage/2017-02-28/1203112274.PDF
421,2017-02-28,众兴菌业：2017年度财务预算报告,finalpage/2017-02-28/1203112275.PDF
422,2017-02-28,众兴菌业：2017年度董事、高级管理人员薪酬（津贴）绩效方案,finalpage/2017-02-28/1203112276.PDF
423,2017-02-28,众兴菌业：2017年度监事会人员薪酬绩效方案,finalpage/2017-02-28/1203112277.PDF
424,2017-02-28,众兴菌业：独立董事关于2016年控股股东及其他关联方占用公司资金及公司对外担保、关联交易情况的专项说明和独立意见,finalpage/2017-02-28/1203112278.PDF
425,2017-02-28,众兴菌业：独立董事关于第二届董事会第二十九次会议相关事项的独立意见,finalpage/2017-02-28/1203112279.PDF
426,2017-02-28,众兴菌业：独立董事关于聘请2017年度审计机构的事前认可意见,finalpage/2017-02-28/1203112280.PDF
427,2017-02-28,众兴菌业：董事会关于2016年度募集资金存放与实际使用情况的专项报告,finalpage/2017-02-28/1203112281.PDF
428,2017-02-28,众兴菌业：监事会关于《2016年度内部控制自我评价报告》的审核意见,finalpage/2017-02-28/1203112282.PDF
429,2017-02-28,众兴菌业：内部控制规则落实自查表,finalpage/2017-02-28/1203112283.PDF
430,2017-02-28,众兴菌业：中国国际金融股份有限公司关于公司《2016年度内部控制自我评价报告》的核查意见,finalpage/2017-02-28/1203112284.PDF
431,2017-02-28,众兴菌业：中国国际金融股份有限公司关于公司《关于2016年度募集资金存放与实际使用情况的专项报告》的核查意见,finalpage/2017-02-28/1203112285.PDF
432,2017-02-28,众兴菌业：中国国际金融股份有限公司关于公司2016年《内部控制规则落实自查表》的核查意见,finalpage/2017-02-28/1203112286.PDF
433,2017-02-28,众兴菌业：中国国际金融股份有限公司关于公司2016年度保荐工作报告,finalpage/2017-02-28/1203112287.PDF
434,2017-02-28,众兴菌业：第二届董事会第二十九次会议决议公告,finalpage/2017-02-28/1203112288.PDF
435,2017-02-28,众兴菌业：2016年度独立董事述职报告（孙宝文）,finalpage/2017-02-28/1203113116.PDF
436,2017-02-28,众兴菌业：2016年度独立董事述职报告（赵新民）,finalpage/2017-02-28/1203113117.PDF
437,2017-02-28,众兴菌业：2016年度独立董事述职报告（邵立新）,finalpage/2017-02-28/1203113118.PDF
438,2017-03-02,众兴菌业：关于使用部分闲置自有资金进行现金管理的进展公告,finalpage/2017-03-02/1203121070.PDF
439,2017-03-10,众兴菌业：关于全资子公司签订债务重组协议的公告,finalpage/2017-03-10/1203145321.PDF
440,2017-03-15,众兴菌业：关于限制性股票激励计划第一个解锁期解锁股份上市流通的提示性公告,finalpage/2017-03-15/1203158708.PDF
441,2017-03-15,众兴菌业：关于2017年第一季度业绩预告的公告,finalpage/2017-03-15/1203158709.PDF
442,2017-03-18,众兴菌业：关于全资子公司签订债务重组协议的进展公告,finalpage/2017-03-18/1203172685.PDF
443,2017-03-22,众兴菌业：关于使用部分闲置自有资金进行现金管理的进展公告,finalpage/2017-03-22/1203183557.PDF
444,2017-03-22,众兴菌业：关于使用部分闲置募集资金进行现金管理的进展公告,finalpage/2017-03-22/1203183558.PDF
445,2017-03-22,众兴菌业：2016年度股东大会决议公告,finalpage/2017-03-22/1203183559.PDF
446,2017-03-22,众兴菌业：2016年度股东大会之法律意见书,finalpage/2017-03-22/1203185258.PDF
447,2017-03-23,众兴菌业：2016年度权益分派实施公告,finalpage/2017-03-23/1203187169.PDF
448,2017-03-29,众兴菌业：2016年度股东大会决议更正公告,finalpage/2017-03-29/1203216116.PDF
449,2017-03-29,众兴菌业：2016年度股东大会之补充法律意见书,finalpage/2017-03-29/1203216117.PDF
450,2017-04-07,众兴菌业：关于首发后持股5%以上股东减持计划实施完毕的公告,finalpage/2017-04-07/1203257805.PDF
451,2017-04-11,众兴菌业：关于使用部分闲置自有资金进行现金管理的进展公告,finalpage/2017-04-11/1203274042.PDF
452,2017-04-19,众兴菌业：第二届董事会第三十次会议决议公告,finalpage/2017-04-19/1203322722.PDF
453,2017-04-19,众兴菌业：第二届监事会第二十一次会议决议公告,finalpage/2017-04-19/1203322723.PDF
454,2017-04-19,众兴菌业：关于终止2016年非公开发行A股股票的公告,finalpage/2017-04-19/1203322724.PDF
455,2017-04-19,众兴菌业：独立董事关于第二届董事会第三十次会议相关事项的独立意见,finalpage/2017-04-19/1203322725.PDF
456,2017-04-28,众兴菌业：第二届董事会第三十一次会议决议公告,finalpage/2017-04-28/1203411677.PDF
457,2017-04-28,众兴菌业：第二届监事会第二十二次会议决议公告,finalpage/2017-04-28/1203411678.PDF
458,2017-04-28,众兴菌业：2017年第一季度报告正文,finalpage/2017-04-28/1203411679.PDF
459,2017-04-28,众兴菌业：2017年第一季度报告全文,finalpage/2017-04-28/1203411680.PDF
460,2017-04-28,众兴菌业：关于使用部分闲置募集资金进行现金管理的进展公告,finalpage/2017-04-28/1203411681.PDF
461,2017-04-28,众兴菌业：关于使用部分闲置自有资金进行现金管理的进展公告,finalpage/2017-04-28/1203411682.PDF
462,2017-05-04,众兴菌业：关于控股股东进行股票质押式回购交易补充质押的公告,finalpage/2017-05-04/1203473813.PDF
463,2017-05-09,众兴菌业：第二届董事会第三十二次会议决议公告,finalpage/2017-05-09/1203484946.PDF
464,2017-05-09,众兴菌业：第二届监事会第二十三次会议决议公告,finalpage/2017-05-09/1203484947.PDF
465,2017-05-09,众兴菌业：关于公开发行可转换公司债券摊薄即期回报及填补措施的公告,finalpage/2017-05-09/1203484948.PDF
466,2017-05-09,众兴菌业：关于最近五年被证券监管部门和交易所处罚或采取监管措施情况的公告,finalpage/2017-05-09/1203484949.PDF
467,2017-05-09,众兴菌业：关于召开2017年第一次临时股东大会通知的公告,finalpage/2017-05-09/1203484950.PDF
468,2017-05-09,众兴菌业：独立董事关于第二届董事会第三十二次会议相关事项的独立意见,finalpage/2017-05-09/1203484951.PDF
469,2017-05-09,众兴菌业：公开发行可转换公司债券募集资金使用的可行性分析报告,finalpage/2017-05-09/1203484952.PDF
470,2017-05-09,众兴菌业：公开发行可转换公司债券预案,finalpage/2017-05-09/1203484953.PDF
471,2017-05-09,众兴菌业：关于公司非经常性损益明细表的鉴证报告（2014-2016年度）,finalpage/2017-05-09/1203484954.PDF
472,2017-05-09,众兴菌业：关于公司净资产收益率、每股收益明细表的鉴证报告（2014-2016年度）,finalpage/2017-05-09/1203484955.PDF
473,2017-05-09,众兴菌业：可转换公司债券持有人会议规则（2017年5月）,finalpage/2017-05-09/1203484956.PDF
474,2017-05-09,众兴菌业：截至2017年3月31日的前次募集资金使用情况报告,finalpage/2017-05-09/1203484957.PDF
475,2017-05-09,众兴菌业：关于公司前次募集资金使用情况的鉴证报告（2017年3月31日）,finalpage/2017-05-09/1203484958.PDF
476,2017-05-25,众兴菌业：2017年第一次临时股东大会之法律意见书,finalpage/2017-05-25/1203566246.PDF
477,2017-05-25,众兴菌业：2017年第一次临时股东大会决议公告,finalpage/2017-05-25/1203566247.PDF
478,2017-05-26,众兴菌业：关于使用部分闲置募集资金进行现金管理的进展公告,finalpage/2017-05-26/1203567845.PDF
479,2017-05-26,众兴菌业：关于使用部分闲置自有资金进行现金管理的进展公告,finalpage/2017-05-26/1203567846.PDF
480,2017-06-14,众兴菌业：关于收购四川丰藏现代农业有限公司部分股权完成工商变更登记的公告,finalpage/2017-06-14/1203613552.PDF
481,2017-06-23,众兴菌业：关于使用部分闲置自有资金进行现金管理的进展公告,finalpage/2017-06-23/1203641241.PDF
482,2017-06-23,众兴菌业：关于使用部分闲置募集资金进行现金管理的进展公告,finalpage/2017-06-23/1203641242.PDF
483,2017-06-24,众兴菌业：关于收到《中国证监会行政许可申请受理通知书》的公告,finalpage/2017-06-24/1203643733.PDF
484,2017-06-29,众兴菌业：2017年半年度业绩预告修正公告,finalpage/2017-06-29/1203658663.PDF
485,2017-07-18,众兴菌业：关于部分董事、高级管理人员减持股份的预披露公告,finalpage/2017-07-18/1203709853.PDF
486,2017-07-22,众兴菌业：关于公司股东质押股份解除质押的公告,finalpage/2017-07-22/1203726152.PDF
487,2017-07-27,众兴菌业：关于股东股份补充质押及解除质押的公告,finalpage/2017-07-27/1203736234.PDF
488,2017-07-27,众兴菌业：关于收到《中国证监会行政许可项目审查一次反馈意见通知书》的公告,finalpage/2017-07-27/1203736235.PDF
489,2017-07-27,众兴菌业：关于使用部分闲置自有资金进行现金管理的进展公告,finalpage/2017-07-27/1203736236.PDF
490,2017-07-27,众兴菌业：关于使用部分闲置募集资金进行现金管理的进展公告,finalpage/2017-07-27/1203736237.PDF
491,2017-07-29,众兴菌业：2017年半年度报告摘要,finalpage/2017-07-29/1203741401.PDF
492,2017-07-29,众兴菌业：第二届董事会第三十三次会议决议公告,finalpage/2017-07-29/1203741402.PDF
493,2017-07-29,众兴菌业：第二届监事会第二十四次会议决议公告,finalpage/2017-07-29/1203741403.PDF
494,2017-07-29,众兴菌业：关于对公司内部组织机构设置进行部分调整的公告,finalpage/2017-07-29/1203741404.PDF
495,2017-07-29,众兴菌业：董事会关于2017年半年度募集资金存放和实际使用情况的专项报告,finalpage/2017-07-29/1203741405.PDF
496,2017-07-29,众兴菌业：独立董事对第二届董事会第三十三次会议相关事项的独立意见,finalpage/2017-07-29/1203741406.PDF
497,2017-07-29,众兴菌业：2017年半年度财务报告,finalpage/2017-07-29/1203741407.PDF
498,2017-07-29,众兴菌业：2017年半年度报告,finalpage/2017-07-29/1203741408.PDF
499,2017-08-02,众兴菌业：关于使用部分闲置自有资金进行现金管理的进展公告,finalpage/2017-08-02/1203752556.PDF
500,2017-08-02,众兴菌业：关于使用部分闲置募集资金进行现金管理的进展公告,finalpage/2017-08-02/1203752557.PDF
501,2017-08-12,众兴菌业：关于股东进行股票质押式回购交易的公告,finalpage/2017-08-12/1203789973.PDF
502,2017-08-14,众兴菌业：关于申请延期回复《中国证监会行政许可项目审查一次反馈意见通知书》的公告,finalpage/2017-08-14/1203792110.PDF
503,2017-08-17,众兴菌业：关于使用部分闲置自有资金进行现金管理的进展公告,finalpage/2017-08-17/1203805833.PDF
504,2017-08-17,众兴菌业：关于使用部分闲置募集资金进行现金管理的进展公告,finalpage/2017-08-17/1203805834.PDF
505,2017-08-18,众兴菌业：关于公司股东质押股份解除质押的公告,finalpage/2017-08-18/1203808368.PDF
506,2017-08-18,众兴菌业：关于非公开发行股份解除限售的提示性公告,finalpage/2017-08-18/1203808391.PDF
507,2017-08-18,众兴菌业：中国国际金融股份有限公司关于公司非公开发行股票限售股解禁的核查意见,finalpage/2017-08-18/1203808392.PDF
508,2017-08-24,众兴菌业：关于使用部分闲置募集资金进行现金管理的进展公告,finalpage/2017-08-24/1203855317.PDF
509,2017-08-24,众兴菌业：关于使用部分闲置自有资金进行现金管理的进展公告,finalpage/2017-08-24/1203855318.PDF
510,2017-08-26,众兴菌业：关于注销首发部分募集资金专项账户的公告,finalpage/2017-08-26/1203870414.PDF
511,2017-09-01,众兴菌业：关于使用部分闲置募集资金进行现金管理的进展公告,finalpage/2017-09-01/1203920681.PDF
512,2017-09-01,众兴菌业：关于使用部分闲置自有资金进行现金管理的进展公告,finalpage/2017-09-01/1203920682.PDF
513,2017-09-06,众兴菌业：第二届董事会第三十四次会议决议公告,finalpage/2017-09-06/1203938188.PDF
514,2017-09-06,众兴菌业：第二届监事会第二十五次会议决议公告,finalpage/2017-09-06/1203938189.PDF
515,2017-09-06,众兴菌业：关于使用部分闲置自有资金进行现金管理的公告,finalpage/2017-09-06/1203938190.PDF
516,2017-09-06,众兴菌业：独立董事对第二届董事会第三十四次会议相关事项的独立意见,finalpage/2017-09-06/1203938191.PDF
517,2017-09-06,众兴菌业：中国国际金融股份有限公司关于公司继续使用部分闲置募集资金进行现金管理的核查意见,finalpage/2017-09-06/1203938192.PDF
518,2017-09-06,众兴菌业：关于继续使用部分闲置募集资金进行现金管理的公告,finalpage/2017-09-06/1203938193.PDF
519,2017-09-12,众兴菌业：关于《中国证监会行政许可项目审查一次反馈意见通知书》之反馈意见回复的公告,finalpage/2017-09-12/1203963525.PDF
520,2017-09-12,众兴菌业：关于公司公开发行可转换债券申请文件反馈意见的回复,finalpage/2017-09-12/1203963526.PDF
521,2017-09-26,众兴菌业：关于公司公开发行可转换债券申请文件补充反馈意见的回复,finalpage/2017-09-26/1203998974.PDF
522,2017-09-26,众兴菌业：关于《关于请做好相关项目发审委会议准备工作的函》相关问题回复的公告,finalpage/2017-09-26/1203998975.PDF
523,2017-09-29,众兴菌业：关于公开发行可转换公司债券申请获得中国证监会发行审核委员会审核通过的公告,finalpage/2017-09-29/1204012177.PDF
524,2017-10-11,众兴菌业：2017年度前三季度业绩预告修正公告,finalpage/2017-10-11/1204024237.PDF
525,2017-10-14,众兴菌业：关于深圳证券交易所《关于对天水众兴菌业科技股份有限公司2016年年报的问询函（中小板年报问询函【2017】第171号）》的书面回复,finalpage/2017-10-14/1204039705.PDF
526,2017-10-14,众兴菌业：关于公司2016年年报问询函相关事项的说明（2017年10月12日）,finalpage/2017-10-14/1204039706.PDF
527,2017-10-21,众兴菌业：第二届董事会第三十五次会议决议公告,finalpage/2017-10-21/1204056645.PDF
528,2017-10-21,众兴菌业：第二届监事会第二十六次会议决议公告,finalpage/2017-10-21/1204056646.PDF
529,2017-10-21,众兴菌业：关于部分董事、高级管理人员减持股份计划的进展公告,finalpage/2017-10-21/1204056647.PDF
530,2017-10-21,众兴菌业：2017年第三季度报告全文,finalpage/2017-10-21/1204056648.PDF
531,2017-10-21,众兴菌业：2017年第三季度报告正文,finalpage/2017-10-21/1204056649.PDF
532,2017-10-30,众兴菌业：第二届董事会第三十六次会议决议公告,finalpage/2017-10-30/1204090771.PDF
533,2017-10-30,众兴菌业：关于对外投资设立全资子公司的公告,finalpage/2017-10-30/1204090772.PDF
534,2017-10-30,众兴菌业：关于与安徽省定远县人民政府签订《招商引资协议书》的公告,finalpage/2017-10-30/1204090773.PDF
535,2017-11-02,众兴菌业：关于使用部分闲置募集资金进行现金管理的进展公告,finalpage/2017-11-02/1204105981.PDF
536,2017-11-02,众兴菌业：关于使用部分闲置自有资金进行现金管理的进展公告,finalpage/2017-11-02/1204105982.PDF
537,2017-11-09,众兴菌业：关于使用部分闲置募集资金进行现金管理的进展公告,finalpage/2017-11-09/1204125651.PDF
538,2017-11-09,众兴菌业：关于全资子公司完成工商注册登记的公告,finalpage/2017-11-09/1204125652.PDF
539,2017-11-17,众兴菌业：关于公开发行可转换公司债券会后事项的专项说明,finalpage/2017-11-17/1204145174.PDF
540,2017-11-17,众兴菌业：中国国际金融股份有限公司关于公司公开发行可转换公司债券会后事项的专项说明,finalpage/2017-11-17/1204145175.PDF
541,2017-11-18,众兴菌业：关于公开发行可转换公司债券申请获得中国证监会核准批文的公告,finalpage/2017-11-18/1204146441.PDF
542,2017-11-25,众兴菌业：关于使用部分闲置募集资金进行现金管理的进展公告,finalpage/2017-11-25/1204165184.PDF
543,2017-11-25,众兴菌业：关于使用部分闲置自有资金进行现金管理的进展公告,finalpage/2017-11-25/1204165185.PDF
544,2017-12-01,众兴菌业：关于使用部分闲置自有资金进行现金管理的进展公告,finalpage/2017-12-01/1204178195.PDF
545,2017-12-11,众兴菌业：国浩律师（北京）事务所关于公司公开发行可转换公司债券之法律意见书,finalpage/2017-12-11/1204206405.PDF
546,2017-12-11,众兴菌业：国浩律师（北京）事务所关于公司公开发行可转换公司债券之补充法律意见书（一）,finalpage/2017-12-11/1204206406.PDF
547,2017-12-11,众兴菌业：国浩律师（北京）事务所关于公司公开发行可转换公司债券之补充法律意见书（二）,finalpage/2017-12-11/1204206407.PDF
548,2017-12-11,众兴菌业：2017年公开发行可转换公司债券信用评级报告,finalpage/2017-12-11/1204206408.PDF
549,2017-12-11,众兴菌业：公开发行可转换公司债券网上路演公告,finalpage/2017-12-11/1204206409.PDF
550,2017-12-11,众兴菌业：关于公司公开发行可转换公司债券的发行保荐书,finalpage/2017-12-11/1204206410.PDF
551,2017-12-11,众兴菌业：第二届董事会第三十七次会议决议公告,finalpage/2017-12-11/1204206411.PDF
552,2017-12-11,众兴菌业：公开发行可转换公司债券募集说明书摘要,finalpage/2017-12-11/1204206412.PDF
553,2017-12-11,众兴菌业：公开发行可转换公司债券募集说明书,finalpage/2017-12-11/1204206413.PDF
554,2017-12-11,众兴菌业：公开发行可转换公司债券发行公告,finalpage/2017-12-11/1204206414.PDF
555,2017-12-12,众兴菌业：关于控股股东及其一致行动人进行股票质押式回购交易的公告,finalpage/2017-12-12/1204214797.PDF
556,2017-12-13,众兴菌业：公开发行可转换公司债券发行提示性公告,finalpage/2017-12-13/1204216695.PDF
557,2017-12-14,众兴菌业：公开发行可转换公司债券网上发行中签率公告,finalpage/2017-12-14/1204220671.PDF
558,2017-12-15,众兴菌业：公开发行可转换公司债券网上中签结果公告,finalpage/2017-12-15/1204221913.PDF
559,2017-12-19,众兴菌业：公开发行可转换公司债券发行结果公告,finalpage/2017-12-19/1204237477.PDF
560,2017-12-20,众兴菌业：第二届董事会第三十八次会议决议公告,finalpage/2017-12-20/1204238991.PDF
561,2017-12-22,众兴菌业：关于使用部分闲置自有资金进行现金管理的进展公告,finalpage/2017-12-22/1204246235.PDF
562,2017-12-22,众兴菌业：关于使用部分闲置募集资金进行现金管理的进展公告,finalpage/2017-12-22/1204246236.PDF
563,2017-12-26,众兴菌业：中国国际金融股份有限公司关于公司现场检查报告,finalpage/2017-12-26/1204252978.PDF
564,2017-12-26,众兴菌业：中国国际金融股份有限公司关于公司2017年度持续督导培训报告,finalpage/2017-12-26/1204252979.PDF
565,2017-12-27,众兴菌业：第二届董事会第三十九次会议决议公告,finalpage/2017-12-27/1204269490.PDF
566,2017-12-27,众兴菌业：第二届监事会第二十七次会议决议公告,finalpage/2017-12-27/1204269491.PDF
567,2017-12-27,众兴菌业：关于政府补助会计政策变更的公告,finalpage/2017-12-27/1204269492.PDF
568,2017-12-27,众兴菌业：独立董事关于第二届董事会第三十九次会议相关事项的独立意见,finalpage/2017-12-27/1204269493.PDF
569,2017-12-28,众兴菌业：国浩律师（北京）事务所关于公司公开发行可转换公司债券在深圳证券交易所上市的法律意见书,finalpage/2017-12-28/1204273070.PDF
570,2017-12-28,众兴菌业：可转换公司债券上市公告书,finalpage/2017-12-28/1204273071.PDF
571,2017-12-28,众兴菌业：关于公司公开发行可转换公司债券的上市保荐书,finalpage/2017-12-28/1204273072.PDF
572,2018-01-02,众兴菌业：关于部分董事、高级管理人员减持股份计划实施结果公告,finalpage/2018-01-02/1204295850.PDF
573,2018-01-04,众兴菌业：关于使用部分闲置自有资金进行现金管理的进展公告,finalpage/2018-01-04/1204302776.PDF
574,2018-01-04,众兴菌业：关于使用部分闲置募集资金进行现金管理的进展公告,finalpage/2018-01-04/1204302777.PDF
575,2018-01-12,众兴菌业：关于签订募集资金监管协议的公告,finalpage/2018-01-12/1204323790.PDF
576,2018-01-13,众兴菌业：第二届董事会第四十次会议决议公告,finalpage/2018-01-13/1204326253.PDF
577,2018-01-13,众兴菌业：第二届监事会第二十八次会议决议公告,finalpage/2018-01-13/1204326254.PDF
578,2018-01-13,众兴菌业：关于使用募集资金置换已预先投入募投项目自筹资金的公告,finalpage/2018-01-13/1204326255.PDF
579,2018-01-13,众兴菌业：关于使用部分闲置募集资金进行现金管理的公告,finalpage/2018-01-13/1204326256.PDF
580,2018-01-13,众兴菌业：关于使用部分闲置自有资金进行现金管理的公告,finalpage/2018-01-13/1204326257.PDF
581,2018-01-13,众兴菌业：关于召开2018年第一次临时股东大会通知的公告,finalpage/2018-01-13/1204326258.PDF
582,2018-01-13,众兴菌业：以自筹资金预先投入募投项目的鉴证报告,finalpage/2018-01-13/1204326276.PDF
583,2018-01-13,众兴菌业：中国国际金融股份有限公司关于公司使用部分闲置募集资金进行现金管理的核查意见,finalpage/2018-01-13/1204326277.PDF
584,2018-01-13,众兴菌业：中国国际金融股份有限公司关于公司使用募集资金置换预先已投入募投项目自筹资金的核查意见,finalpage/2018-01-13/1204326278.PDF
585,2018-01-13,众兴菌业：独立董事关于第二届董事会第四十次会议相关事项的独立意见,finalpage/2018-01-13/1204326279.PDF
586,2018-01-17,众兴菌业：关于使用部分闲置自有资金进行现金管理的进展公告,finalpage/2018-01-17/1204335739.PDF
587,2018-01-24,众兴菌业：简式权益变动报告书,finalpage/2018-01-24/1204357552.PDF
588,2018-01-24,众兴菌业：关于持股5%以上股东减持至5%以下的提示性公告,finalpage/2018-01-24/1204357553.PDF
589,2018-01-30,众兴菌业：2018年第一次临时股东大会决议公告,finalpage/2018-01-30/1204372252.PDF
590,2018-01-30,众兴菌业：2018年第一次临时股东大会之法律意见书,finalpage/2018-01-30/1204372253.PDF
591,2018-02-01,众兴菌业：关于使用部分闲置自有资金进行现金管理的进展公告,finalpage/2018-02-01/1204379190.PDF
592,2018-02-01,众兴菌业：关于使用部分闲置募集资金进行现金管理的进展公告,finalpage/2018-02-01/1204379191.PDF
593,2018-02-08,众兴菌业：关于控股股东进行股票质押式回购交易补充质押的公告,finalpage/2018-02-08/1204400944.PDF
594,2018-02-09,众兴菌业：关于使用部分闲置自有资金进行现金管理的进展公告,finalpage/2018-02-09/1204405792.PDF
595,2018-02-09,众兴菌业：关于使用部分闲置募集资金进行现金管理的进展公告,finalpage/2018-02-09/1204405793.PDF
596,2018-02-13,众兴菌业：第二届董事会第四十一次会议决议公告,finalpage/2018-02-13/1204417924.PDF
597,2018-02-13,众兴菌业：第二届监事会第二十九次会议决议公告,finalpage/2018-02-13/1204417925.PDF
598,2018-02-13,众兴菌业：关于首发部分募投项目变更暨增加募投项目产品种类的公告,finalpage/2018-02-13/1204417926.PDF
599,2018-02-13,众兴菌业：关于召开2018年第二次临时股东大会的通知,finalpage/2018-02-13/1204417927.PDF
600,2018-02-13,众兴菌业：关于控股股东进行股票质押式回购交易补充质押的公告,finalpage/2018-02-13/1204417928.PDF
601,2018-02-13,众兴菌业：中国国际金融股份有限公司关于公司首发部分募投项目变更暨增加募投项目产品种类的核查意见,finalpage/2018-02-13/1204417929.PDF
602,2018-02-13,众兴菌业：独立董事关于第二届董事会第四十一次会议相关事项的独立意见,finalpage/2018-02-13/1204417930.PDF
