,date,title,url
208,2016-02-26,众兴菌业：中国国际金融股份有限公司关于公司2015年《内部控制规则落实自查表》的核查意见,finalpage/2016-02-26/1202000481.PDF
209,2016-02-26,众兴菌业：关于2015年度利润分配方案的公告,finalpage/2016-02-26/1202000482.PDF
210,2016-02-26,众兴菌业：2015年年度报告,finalpage/2016-02-26/1202000483.PDF
211,2016-02-26,众兴菌业：2015年度独立董事述职报告（孙宝文）,finalpage/2016-02-26/1202000586.PDF
212,2016-02-26,众兴菌业：2015年度独立董事述职报告（赵新民）,finalpage/2016-02-26/1202000587.PDF
213,2016-02-26,众兴菌业：2015年度独立董事述职报告（邵立新）,finalpage/2016-02-26/1202000588.PDF
214,2016-02-27,众兴菌业：关于使用闲置自有资金购买理财产品的进展公告,finalpage/2016-02-27/1202004363.PDF
215,2016-02-27,众兴菌业：关于闲置募集资金购买的理财产品部分赎回的公告,finalpage/2016-02-27/1202004364.PDF
216,2016-03-02,众兴菌业：2016年第一次临时股东大会决议公告,finalpage/2016-03-02/1202011244.PDF
217,2016-03-02,众兴菌业：关于深圳证券交易所监管关注函回复的公告,finalpage/2016-03-02/1202011245.PDF
218,2016-03-02,众兴菌业：关于非公开发行股票申请文件反馈意见回复的公告,finalpage/2016-03-02/1202011246.PDF
219,2016-03-02,众兴菌业：2016年第一次临时股东大会之法律意见书,finalpage/2016-03-02/1202011247.PDF
220,2016-03-02,众兴菌业：关于公司非公开发行股票申请文件反馈意见的回复,finalpage/2016-03-02/1202011248.PDF
221,2016-03-11,众兴菌业：关于使用闲置自有资金购买理财产品的进展公告,finalpage/2016-03-11/1202036663.PDF
222,2016-03-14,众兴菌业：第二届董事会第十七次会议决议公告,finalpage/2016-03-14/1202041196.PDF
223,2016-03-14,众兴菌业：关于为全资子公司申请银行贷款提供担保的公告,finalpage/2016-03-14/1202041197.PDF
224,2016-03-14,众兴菌业：独立董事关于第二届董事会第十七次会议相关事项的独立意见,finalpage/2016-03-14/1202041198.PDF
225,2016-03-15,众兴菌业：关于限制性股票授予登记完成的公告,finalpage/2016-03-15/1202043748.PDF
226,2016-03-23,众兴菌业：关于2016年第一季度业绩预告的公告,finalpage/2016-03-23/1202067897.PDF
227,2016-03-23,众兴菌业：简式权益变动报告书（已取消）,finalpage/2016-03-23/1202067898.PDF
228,2016-03-24,众兴菌业：关于持股5%以上股东被动稀释为持股5%以下股东的提示性公告,finalpage/2016-03-24/1202069556.PDF
229,2016-03-24,众兴菌业：关于《简式权益变动报告书》的更正公告,finalpage/2016-03-24/1202069557.PDF
230,2016-03-24,众兴菌业：简式权益变动报告书（更新后）,finalpage/2016-03-24/1202069558.PDF
231,2016-03-25,众兴菌业：股票交易异常波动公告,finalpage/2016-03-25/1202077820.PDF
232,2016-03-26,众兴菌业：关于收到《关于请做好相关项目发审委会议准备工作的函》的公告,finalpage/2016-03-26/1202083144.PDF
233,2016-03-31,众兴菌业：关于非公开发行股票获得中国证监会发行审核委员会审核通过的公告,finalpage/2016-03-31/1202112939.PDF
234,2016-03-31,众兴菌业：关于闲置自有资金购买理财产品的进展公告,finalpage/2016-03-31/1202112940.PDF
235,2016-03-31,众兴菌业：关于闲置募集资金购买的理财产品部分赎回的公告,finalpage/2016-03-31/1202112941.PDF
236,2016-04-01,众兴菌业：2015年度股东大会之法律意见书,finalpage/2016-04-01/1202123480.PDF
237,2016-04-01,众兴菌业：2015年度股东大会决议公告,finalpage/2016-04-01/1202123481.PDF
238,2016-04-09,众兴菌业：2015年度权益分派实施公告,finalpage/2016-04-09/1202156731.PDF
239,2016-04-12,众兴菌业：关于闲置自有资金购买理财产品的进展公告,finalpage/2016-04-12/1202163358.PDF
240,2016-04-23,众兴菌业：关于闲置自有资金购买理财产品的进展公告,finalpage/2016-04-23/1202229534.PDF
241,2016-04-23,众兴菌业：关于闲置募集资金购买理财产品的进展公告,finalpage/2016-04-23/1202229535.PDF
242,2016-04-23,众兴菌业：关于实施2015年度权益分派方案后调整非公开发行股票发行价格和发行数量的公告,finalpage/2016-04-23/1202229536.PDF
243,2016-04-23,众兴菌业：第二届董事会第十八次会议决议公告,finalpage/2016-04-23/1202229537.PDF
244,2016-04-23,众兴菌业：2016年第一季度报告全文,finalpage/2016-04-23/1202229538.PDF
245,2016-04-23,众兴菌业：2016年第一季度报告正文,finalpage/2016-04-23/1202229539.PDF
246,2016-04-23,众兴菌业：关于深圳证券交易所2015年报问询函回复的公告,finalpage/2016-04-23/1202229541.PDF
247,2016-04-23,众兴菌业：第二届监事会第十二次会议决议公告,finalpage/2016-04-23/1202229542.PDF
248,2016-05-14,众兴菌业：关于完成工商变更登记的公告,finalpage/2016-05-14/1202321991.PDF
249,2016-05-18,众兴菌业：第二届董事会第十九次会议决议公告,finalpage/2016-05-18/1202326584.PDF
250,2016-05-18,众兴菌业：关于召开2016年第二次临时股东大会通知的公告,finalpage/2016-05-18/1202326585.PDF
251,2016-05-18,众兴菌业：公司章程（2016年5月）,finalpage/2016-05-18/1202326586.PDF
252,2016-05-18,众兴菌业：股东大会议事规则（2016年5月）,finalpage/2016-05-18/1202326587.PDF
253,2016-05-18,众兴菌业：董事会议事规则（2016年5月）,finalpage/2016-05-18/1202326588.PDF
254,2016-05-18,众兴菌业：关于修订《公司章程》的公告,finalpage/2016-05-18/1202326589.PDF
255,2016-05-20,众兴菌业：关于闲置募集资金购买理财产品的进展公告,finalpage/2016-05-20/1202330883.PDF
256,2016-05-20,众兴菌业：关于闲置自有资金购买理财产品的进展公告,finalpage/2016-05-20/1202330884.PDF
257,2016-05-27,众兴菌业：关于闲置自有资金购买理财产品的进展公告,finalpage/2016-05-27/1202341760.PDF
258,2016-06-01,众兴菌业：关于闲置募集资金购买理财产品的进展公告,finalpage/2016-06-01/1202348559.PDF
259,2016-06-08,众兴菌业：2016年第二次临时股东大会决议公告,finalpage/2016-06-08/1202361283.PDF
260,2016-06-08,众兴菌业：2016年第二次临时股东大会之法律意见书,finalpage/2016-06-08/1202361284.PDF
261,2016-06-13,众兴菌业：第二届董事会第二十次会议决议公告,finalpage/2016-06-13/1202364187.PDF
262,2016-06-13,众兴菌业：关于对外投资设立全资子公司的公告,finalpage/2016-06-13/1202364188.PDF
263,2016-06-13,众兴菌业：关于闲置自有资金购买理财产品的进展公告,finalpage/2016-06-13/1202364189.PDF
264,2016-06-13,众兴菌业：关于闲置募集资金购买理财产品的进展公告,finalpage/2016-06-13/1202364190.PDF
265,2016-06-18,众兴菌业：关于闲置自有资金购买理财产品的进展公告,finalpage/2016-06-18/1202374181.PDF
266,2016-06-22,众兴菌业：中国国际金融股份有限公司关于公司限售股份上市流通的核查意见,finalpage/2016-06-22/1202381069.PDF
267,2016-06-22,众兴菌业：关于首次公开发行前已发行股份上市流通的提示性公告,finalpage/2016-06-22/1202381070.PDF
268,2016-06-23,众兴菌业：关于全资子公司完成工商注册登记的公告,finalpage/2016-06-23/1202388317.PDF
269,2016-06-25,众兴菌业：关于参加“2016年甘肃上市公司投资者集体接待日活动”的公告,finalpage/2016-06-25/1202404761.PDF
270,2016-06-30,众兴菌业：关于闲置募集资金购买理财产品的进展公告,finalpage/2016-06-30/1202437793.PDF
271,2016-06-30,众兴菌业：关于首发前持股5%以上股东减持公司股份的预披露公告,finalpage/2016-06-30/1202437794.PDF
272,2016-07-02,众兴菌业：关于持股5%以上股东减持公司股份的预披露公告,finalpage/2016-07-02/1202445527.PDF
273,2016-07-09,众兴菌业：关于闲置自有资金购买理财产品的进展公告,finalpage/2016-07-09/1202462529.PDF
274,2016-07-09,众兴菌业：关于首发前持股5%以上股东减持公司股份的预披露公告,finalpage/2016-07-09/1202462530.PDF
275,2016-07-11,众兴菌业：第二届董事会第二十一次会议决议公告,finalpage/2016-07-11/1202463522.PDF
276,2016-07-11,众兴菌业：独立董事关于继续使用闲置募集资金购买理财产品的独立意见,finalpage/2016-07-11/1202463523.PDF
277,2016-07-11,众兴菌业：第二届监事会第十三次会议决议公告,finalpage/2016-07-11/1202463524.PDF
278,2016-07-11,众兴菌业：关于继续使用闲置募集资金购买理财产品公告,finalpage/2016-07-11/1202463525.PDF
279,2016-07-11,众兴菌业：中国国际金融股份有限公司关于公司继续使用闲置募集资金购买理财产品的专项核查意见,finalpage/2016-07-11/1202463526.PDF
280,2016-07-13,众兴菌业：关于持股5%以上股东减持至5%以下的提示性公告,finalpage/2016-07-13/1202468485.PDF
281,2016-07-13,众兴菌业：简式权益变动报告书,finalpage/2016-07-13/1202468486.PDF
282,2016-07-14,众兴菌业：关于控股股东进行股票质押式回购交易的公告,finalpage/2016-07-14/1202470186.PDF
283,2016-07-14,众兴菌业：关于闲置募集资金购买理财产品的进展公告,finalpage/2016-07-14/1202470187.PDF
284,2016-07-15,众兴菌业：关于使用闲置自有资金购买理财产品的进展公告,finalpage/2016-07-15/1202475236.PDF
285,2016-07-19,众兴菌业：关于闲置募集资金购买理财产品的进展公告,finalpage/2016-07-19/1202483357.PDF
286,2016-07-19,众兴菌业：关于非公开发行股票申请获得中国证监会核准批文的公告,finalpage/2016-07-19/1202483359.PDF
287,2016-07-27,众兴菌业：关于闲置募集资金购买理财产品的进展公告,finalpage/2016-07-27/1202506089.PDF
288,2016-07-27,众兴菌业：关于完成工商变更登记的公告,finalpage/2016-07-27/1202506090.PDF
289,2016-07-30,众兴菌业：2016年半年度报告摘要,finalpage/2016-07-30/1202517400.PDF
290,2016-07-30,众兴菌业：2016年半年度财务报告,finalpage/2016-07-30/1202517401.PDF
291,2016-07-30,众兴菌业：第二届董事会第二十二次会议决议公告,finalpage/2016-07-30/1202517402.PDF
292,2016-07-30,众兴菌业：第二届监事会第十四次会议决议公告,finalpage/2016-07-30/1202517403.PDF
293,2016-07-30,众兴菌业：独立董事关于2016年半年度报告相关事项的独立意见,finalpage/2016-07-30/1202517404.PDF
294,2016-07-30,众兴菌业：董事会关于2016年半年度募集资金存放与实际使用情况的专项报告,finalpage/2016-07-30/1202517405.PDF
295,2016-07-30,众兴菌业：2016年半年度报告,finalpage/2016-07-30/1202517406.PDF
296,2016-08-12,众兴菌业：关于闲置自有资金购买理财产品的进展公告,finalpage/2016-08-12/1202557938.PDF
297,2016-08-12,众兴菌业：关于闲置募集资金购买理财产品的进展公告,finalpage/2016-08-12/1202557939.PDF
298,2016-08-17,众兴菌业：关于闲置自有资金购买理财产品的进展公告,finalpage/2016-08-17/1202570774.PDF
299,2016-08-19,众兴菌业：北京安杰律师事务所关于公司非公开发行A股股票发行过程和发行对象合规性的法律意见书,finalpage/2016-08-19/1202581847.PDF
300,2016-08-19,众兴菌业：关于公司非公开发行A股股票上市保荐书,finalpage/2016-08-19/1202581848.PDF
301,2016-08-19,众兴菌业：中国国际金融股份有限公司关于公司非公开发行股票发行合规性的说明,finalpage/2016-08-19/1202581849.PDF
302,2016-08-19,众兴菌业：简式权益变动报告书（一）,finalpage/2016-08-19/1202581850.PDF
303,2016-08-19,众兴菌业：简式权益变动报告书（二）,finalpage/2016-08-19/1202581851.PDF
304,2016-08-19,众兴菌业：简式权益变动报告书（三）,finalpage/2016-08-19/1202581852.PDF
305,2016-08-19,众兴菌业：关于披露简式权益变动报告书的提示性公告,finalpage/2016-08-19/1202581853.PDF
306,2016-08-19,众兴菌业：非公开发行A股股票之发行情况报告暨上市公告书,finalpage/2016-08-19/1202581854.PDF
307,2016-08-19,众兴菌业：非公开发行A股股票之发行情况报告暨上市公告书摘要,finalpage/2016-08-19/1202581855.PDF
308,2016-08-23,众兴菌业：第二届董事会第二十三次会议决议公告,finalpage/2016-08-23/1202599693.PDF
309,2016-08-23,众兴菌业：第二届监事会第十五次会议决议公告,finalpage/2016-08-23/1202599694.PDF
310,2016-08-23,众兴菌业：关于召开2016年第三次临时股东大会通知的公告,finalpage/2016-08-23/1202599695.PDF
311,2016-08-23,众兴菌业：关于使用部分闲置募集资金进行现金管理的公告,finalpage/2016-08-23/1202599696.PDF
312,2016-08-23,众兴菌业：关于使用部分闲置自有资金进行现金管理的公告,finalpage/2016-08-23/1202599697.PDF
313,2016-08-23,众兴菌业：关于为子公司申请银行贷款提供担保的公告,finalpage/2016-08-23/1202599698.PDF
314,2016-08-23,众兴菌业：关于使用募集资金向全资子公司提供借款实施募投项目的公告,finalpage/2016-08-23/1202599699.PDF
315,2016-08-23,众兴菌业：关于修订《公司章程》部分条款的公告,finalpage/2016-08-23/1202599700.PDF
316,2016-08-23,众兴菌业：公司章程（2016年8月）,finalpage/2016-08-23/1202599701.PDF
317,2016-08-23,众兴菌业：《公司章程》修订案,finalpage/2016-08-23/1202599702.PDF
318,2016-08-23,众兴菌业：关于公司以自筹资金预先投入募集资金投资项目情况的专项说明的鉴证报告,finalpage/2016-08-23/1202599703.PDF
319,2016-08-23,众兴菌业：独立董事对第二届董事会第二十三次会议相关事项的独立意见,finalpage/2016-08-23/1202599704.PDF
320,2016-08-23,众兴菌业：关于签订募集资金监管协议的公告,finalpage/2016-08-23/1202599705.PDF
321,2016-08-23,众兴菌业：关于使用募集资金置换已预先投入募投项目自筹资金的公告,finalpage/2016-08-23/1202599706.PDF
322,2016-08-23,众兴菌业：中国国际金融股份有限公司关于公司使用部分闲置募集资金进行现金管理的核查意见,finalpage/2016-08-23/1202599707.PDF
323,2016-08-23,众兴菌业：中国国际金融股份有限公司关于公司使用募集资金向全资子公司提供借款实施募投项目的核查意见,finalpage/2016-08-23/1202599708.PDF
324,2016-08-23,众兴菌业：中国国际金融股份有限公司关于公司使用募集资金置换已预先投入募投项目自筹资金的核查意见,finalpage/2016-08-23/1202599709.PDF
325,2016-08-31,众兴菌业：关于闲置自有资金购买理财产品的进展公告,finalpage/2016-08-31/1202656303.PDF
326,2016-09-02,众兴菌业：关于闲置募集资金购买理财产品的进展公告,finalpage/2016-09-02/1202669331.PDF
327,2016-09-09,众兴菌业：2016年第三次临时股东大会决议公告,finalpage/2016-09-09/1202687708.PDF
328,2016-09-09,众兴菌业：2016年第三次临时股东大会之法律意见书,finalpage/2016-09-09/1202687709.PDF
329,2016-09-19,众兴菌业：关于使用部分闲置自有资金进行现金管理的进展公告,finalpage/2016-09-19/1202702988.PDF
330,2016-09-19,众兴菌业：关于使用部分闲置募集资金进行现金管理的进展公告,finalpage/2016-09-19/1202702989.PDF
331,2016-09-20,众兴菌业：关于闲置募集资金购买理财产品的进展公告,finalpage/2016-09-20/1202708227.PDF
332,2016-09-20,众兴菌业：关于使用部分闲置自有资金进行现金管理的进展公告,finalpage/2016-09-20/1202708228.PDF
333,2016-09-20,众兴菌业：关于使用部分闲置募集资金进行现金管理的进展公告,finalpage/2016-09-20/1202708229.PDF
334,2016-09-24,众兴菌业：关于使用部分闲置募集资金进行现金管理的进展公告,finalpage/2016-09-24/1202722706.PDF
335,2016-10-10,众兴菌业：关于使用部分闲置募集资金进行现金管理的进展公告,finalpage/2016-10-10/1202745958.PDF
336,2016-10-11,众兴菌业：关于完成工商变更登记的公告,finalpage/2016-10-11/1202746545.PDF
337,2016-10-13,众兴菌业：关于闲置募集资金购买理财产品的进展公告,finalpage/2016-10-13/1202753302.PDF
338,2016-10-20,众兴菌业：关于召开2016年第四次临时股东大会通知的公告,finalpage/2016-10-20/1202769751.PDF
339,2016-10-20,众兴菌业：第二届董事会第二十四次会议决议公告,finalpage/2016-10-20/1202769752.PDF
340,2016-10-20,众兴菌业：第二届监事会第十六次会议决议公告,finalpage/2016-10-20/1202769755.PDF
341,2016-10-20,众兴菌业：中国国际金融股份有限公司关于公司变更首发部分募集资金用途的核查意见,finalpage/2016-10-20/1202769756.PDF
342,2016-10-20,众兴菌业：关于变更首发部分募集资金用途的公告,finalpage/2016-10-20/1202769757.PDF
343,2016-10-20,众兴菌业：独立董事对第二届董事会第二十四次会议相关事项的独立意见,finalpage/2016-10-20/1202769758.PDF
344,2016-10-22,众兴菌业：关于筹划非公开发行股票事项的停牌公告,finalpage/2016-10-22/1202775118.PDF
345,2016-10-25,众兴菌业：第二届董事会第二十五次会议决议公告,finalpage/2016-10-25/1202780752.PDF
346,2016-10-25,众兴菌业：第二届监事会第十七次会议决议公告,finalpage/2016-10-25/1202780753.PDF
347,2016-10-25,众兴菌业：2016年第三季度报告正文,finalpage/2016-10-25/1202780754.PDF
348,2016-10-25,众兴菌业：2016年第三季度报告全文,finalpage/2016-10-25/1202780755.PDF
349,2016-10-25,众兴菌业：关于使用部分闲置自有资金进行现金管理的进展公告,finalpage/2016-10-25/1202780756.PDF
350,2016-10-25,众兴菌业：关于使用部分闲置募集资金进行现金管理的进展公告,finalpage/2016-10-25/1202780757.PDF
351,2016-10-29,众兴菌业：复牌公告,finalpage/2016-10-29/1202802375.PDF
352,2016-10-29,众兴菌业：第二届董事会第二十六次会议决议公告,finalpage/2016-10-29/1202802376.PDF
353,2016-10-29,众兴菌业：第二届监事会第十八次会议决议公告,finalpage/2016-10-29/1202802377.PDF
354,2016-10-29,众兴菌业：关于非公开发行股票摊薄即期回报及填补措施的公告,finalpage/2016-10-29/1202802378.PDF
355,2016-10-29,众兴菌业：全体董事、高级管理人员、控股股东及实际控制人关于保障公司填补即期回报措施切实履行的承诺的公告,finalpage/2016-10-29/1202802379.PDF
356,2016-10-29,众兴菌业：独立董事关于第二届董事会第二十六次会议相关事项的独立意见,finalpage/2016-10-29/1202802380.PDF
357,2016-10-29,众兴菌业：非公开发行A股股票预案,finalpage/2016-10-29/1202802381.PDF
358,2016-10-29,众兴菌业：关于公司符合非公开发行A股股票条件的说明,finalpage/2016-10-29/1202802382.PDF
359,2016-10-29,众兴菌业：关于公司前次募集资金使用情况的鉴证报告,finalpage/2016-10-29/1202802383.PDF
360,2016-10-29,众兴菌业：截至2016年09月30日的前次募集资金使用情况报告,finalpage/2016-10-29/1202802384.PDF
361,2016-10-29,众兴菌业：非公开发行A股股票募集资金使用的可行性分析报告,finalpage/2016-10-29/1202802385.PDF
362,2016-11-02,众兴菌业：关于使用部分闲置募集资金进行现金管理的进展公告,finalpage/2016-11-02/1202809866.PDF
363,2016-11-04,众兴菌业：关于全资子公司获得政府补助资金的公告,finalpage/2016-11-04/1202813968.PDF
364,2016-11-05,众兴菌业：2016年第四次临时股东大会决议公告,finalpage/2016-11-05/1202816293.PDF
365,2016-11-05,众兴菌业：关于披露简式权益变动报告书的提示性公告,finalpage/2016-11-05/1202816294.PDF
366,2016-11-05,众兴菌业：2016年第四次临时股东大会之法律意见书,finalpage/2016-11-05/1202816295.PDF
367,2016-11-05,众兴菌业：简式权益变动报告书,finalpage/2016-11-05/1202816296.PDF
368,2016-11-09,众兴菌业：第二届董事会第二十七次会议决议公告,finalpage/2016-11-09/1202819900.PDF
369,2016-11-09,众兴菌业：关于召开2016年第五次临时股东大会通知的公告,finalpage/2016-11-09/1202819901.PDF
370,2016-11-10,众兴菌业：关于全资子公司获得政府补助资金的公告,finalpage/2016-11-10/1202821314.PDF
371,2016-11-15,众兴菌业：关于为子公司申请银行贷款提供担保的进展公告,finalpage/2016-11-15/1202827488.PDF
372,2016-11-17,众兴菌业：关于闲置募集资金购买理财产品的进展公告,finalpage/2016-11-17/1202831852.PDF
373,2016-11-17,众兴菌业：关于使用部分闲置募集资金进行现金管理的进展公告,finalpage/2016-11-17/1202831853.PDF
374,2016-11-24,众兴菌业：关于签订《股权收购意向书》的公告,finalpage/2016-11-24/1202840681.PDF
375,2016-11-26,众兴菌业：关于注销非公开发行部分募集资金专项账户的公告,finalpage/2016-11-26/1202844825.PDF
376,2016-11-26,众兴菌业：关于签订募集资金监管协议的公告,finalpage/2016-11-26/1202844826.PDF
377,2016-11-26,众兴菌业：关于为全资子公司申请银行贷款提供担保的进展公告,finalpage/2016-11-26/1202844827.PDF
378,2016-11-26,众兴菌业：2016年第五次临时股东大会之法律意见书,finalpage/2016-11-26/1202844828.PDF
379,2016-11-26,众兴菌业：2016年第五次临时股东大会决议公告,finalpage/2016-11-26/1202844829.PDF
380,2016-12-17,众兴菌业：关于使用部分闲置自有资金进行现金管理的进展公告,finalpage/2016-12-17/1202879572.PDF
381,2016-12-17,众兴菌业：关于闲置募集资金购买理财产品的进展公告,finalpage/2016-12-17/1202879573.PDF
382,2016-12-17,众兴菌业：关于使用部分闲置募集资金进行现金管理的进展公告,finalpage/2016-12-17/1202879574.PDF
383,2016-12-21,众兴菌业：关于使用部分闲置自有资金进行现金管理的进展公告,finalpage/2016-12-21/1202907035.PDF
384,2016-12-23,众兴菌业：关于收到《中国证监会行政许可申请受理通知书》的公告,finalpage/2016-12-23/1202939581.PDF
385,2017-01-05,众兴菌业：中国国际金融股份有限公司关于公司现场检查报告,finalpage/2017-01-05/1202989767.PDF
386,2017-01-05,众兴菌业：中国国际金融股份有限公司关于公司2016年度持续督导培训报告,finalpage/2017-01-05/1202989768.PDF
387,2017-01-18,众兴菌业：关于控股股东进行股票质押式回购交易的公告,finalpage/2017-01-18/1203022586.PDF
388,2017-01-18,众兴菌业：关于签订《股权收购意向书》的公告,finalpage/2017-01-18/1203022587.PDF
389,2017-01-18,众兴菌业：关于使用部分闲置募集资金进行现金管理的进展公告,finalpage/2017-01-18/1203022588.PDF
390,2017-01-21,众兴菌业：关于使用部分闲置募集资金进行现金管理的进展公告,finalpage/2017-01-21/1203036064.PDF
391,2017-01-25,众兴菌业：关于控股股东部分股权解除质押的公告,finalpage/2017-01-25/1203050503.PDF
392,2017-02-03,众兴菌业：关于收到《中国证监会行政许可项目审查反馈意见通知书》的公告,finalpage/2017-02-03/1203058867.PDF
393,2017-02-10,众兴菌业：关于使用部分闲置募集资金进行现金管理的进展公告,finalpage/2017-02-10/1203073042.PDF
394,2017-02-10,众兴菌业：关于使用部分闲置自有资金进行现金管理的进展公告,finalpage/2017-02-10/1203073043.PDF
395,2017-02-14,众兴菌业：关于申请延期回复非公开发行股票反馈意见的公告,finalpage/2017-02-14/1203079347.PDF
396,2017-02-21,众兴菌业：第二届董事会第二十八次会议决议公告,finalpage/2017-02-21/1203094376.PDF
397,2017-02-21,众兴菌业：第二届监事会第十九次会议决议公告,finalpage/2017-02-21/1203094377.PDF
398,2017-02-21,众兴菌业：关于限制性股票激励计划第一个解锁期解锁条件成就的公告,finalpage/2017-02-21/1203094378.PDF
399,2017-02-21,众兴菌业：关于使用部分闲置自有资金进行现金管理的进展公告,finalpage/2017-02-21/1203094379.PDF
400,2017-02-21,众兴菌业：关于使用部分闲置募集资金进行现金管理的进展公告,finalpage/2017-02-21/1203094380.PDF
401,2017-02-21,众兴菌业：北京安杰律师事务所关于公司限制性股票激励计划第一期解锁之法律意见书,finalpage/2017-02-21/1203094381.PDF
402,2017-02-21,众兴菌业：独立董事关于第二届董事会第二十八次会议相关事项的独立意见,finalpage/2017-02-21/1203094382.PDF
403,2017-02-21,众兴菌业：限制性股票激励计划第一个解锁期符合解锁条件的激励对象名单,finalpage/2017-02-21/1203094383.PDF
404,2017-02-28,众兴菌业：第二届监事会第二十次会议决议公告,finalpage/2017-02-28/1203112258.PDF
405,2017-02-28,众兴菌业：2016年年度报告摘要,finalpage/2017-02-28/1203112259.PDF
406,2017-02-28,众兴菌业：关于聘任证券事务代表的公告,finalpage/2017-02-28/1203112260.PDF
407,2017-02-28,众兴菌业：关于收购四川丰藏现代农业有限公司部分股权的公告,finalpage/2017-02-28/1203112261.PDF
408,2017-02-28,众兴菌业：关于召开2016年度股东大会通知的公告,finalpage/2017-02-28/1203112262.PDF
409,2017-02-28,众兴菌业：关于通过互联网举行2016年度报告说明会的公告,finalpage/2017-02-28/1203112263.PDF
410,2017-02-28,众兴菌业：关于使用部分闲置自有资金进行现金管理的进展公告,finalpage/2017-02-28/1203112264.PDF
