,date,title,url
0,2015-06-10,众兴菌业：首次公开发行股票初步询价及推介公告,finalpage/2015-06-10/1201130148.PDF
1,2015-06-10,众兴菌业：首次公开发行股票招股意向书,finalpage/2015-06-10/1201130149.PDF
2,2015-06-10,众兴菌业：首次公开发行股票招股意向书摘要,finalpage/2015-06-10/1201130150.PDF
3,2015-06-10,众兴菌业：公司章程（草案）,finalpage/2015-06-10/1201130151.PDF
4,2015-06-10,众兴菌业：2012年第四次临时股东大会决议,finalpage/2015-06-10/1201130152.PDF
5,2015-06-10,众兴菌业：2014年第二次临时股东大会会议决议,finalpage/2015-06-10/1201130153.PDF
6,2015-06-10,众兴菌业：第一届董事会第七次会议决议,finalpage/2015-06-10/1201130154.PDF
7,2015-06-10,众兴菌业：第一届董事会第九次会议决议,finalpage/2015-06-10/1201130155.PDF
8,2015-06-10,众兴菌业：第一届董事会第二十次会议决议,finalpage/2015-06-10/1201130156.PDF
9,2015-06-10,众兴菌业：第二届董事会第三次会议决议,finalpage/2015-06-10/1201130157.PDF
10,2015-06-10,众兴菌业：关于公司首次公开发行A股股票并上市的发行保荐书,finalpage/2015-06-10/1201130158.PDF
11,2015-06-10,众兴菌业：关于公司首次发行A股股票并上市的发行保荐工作报告,finalpage/2015-06-10/1201130159.PDF
12,2015-06-10,众兴菌业：内部控制鉴证报告（2014年12月31日）,finalpage/2015-06-10/1201130160.PDF
13,2015-06-10,众兴菌业：关于公司非经常性损益的专项审核报告,finalpage/2015-06-10/1201130161.PDF
14,2015-06-10,众兴菌业：审计报告（2014年12月31日）,finalpage/2015-06-10/1201130162.PDF
15,2015-06-10,众兴菌业：国浩律师（北京）事务所关于公司申请首次公开发行股票并上市的律师工作报告,finalpage/2015-06-10/1201130163.PDF
16,2015-06-10,众兴菌业：国浩律师（北京）事务所关于公司申请首次公开发行股票并上市的法律意见书,finalpage/2015-06-10/1201130164.PDF
17,2015-06-10,众兴菌业：国浩律师（北京）事务所关于公司申请首次公开发行股票并上市的补充法律意见书（一）,finalpage/2015-06-10/1201130165.PDF
18,2015-06-10,众兴菌业：国浩律师（北京）事务所关于公司首次公开发行股票并上市之补充法律意见书（三）,finalpage/2015-06-10/1201130166.PDF
19,2015-06-10,众兴菌业：国浩律师（北京）事务所关于公司首次公开发行股票并上市之补充法律意见书（二）,finalpage/2015-06-10/1201130167.PDF
20,2015-06-10,众兴菌业：国浩律师（北京）事务所关于公司首次公开发行股票并上市之补充法律意见书（四）,finalpage/2015-06-10/1201130168.PDF
21,2015-06-10,众兴菌业：中国证监会关于核准公司首次公开发行股票的批复,finalpage/2015-06-10/1201130169.PDF
22,2015-06-15,众兴菌业：首次公开发行股票网上路演公告,finalpage/2015-06-15/1201146124.PDF
23,2015-06-16,众兴菌业：首次公开发行股票发行公告,finalpage/2015-06-16/1201155180.PDF
24,2015-06-16,众兴菌业：首次公开发行股票投资风险特别公告,finalpage/2015-06-16/1201155182.PDF
25,2015-06-16,众兴菌业：首次公开发行股票招股说明书,finalpage/2015-06-16/1201155631.PDF
26,2015-06-16,众兴菌业：首次公开发行股票招股说明书摘要,finalpage/2015-06-16/1201155632.PDF
27,2015-06-19,众兴菌业：首次公开发行股票网下配售结果公告,finalpage/2015-06-19/1201169977.PDF
28,2015-06-19,众兴菌业：首次公开发行股票网上定价发行申购情况及中签率公告,finalpage/2015-06-19/1201169979.PDF
29,2015-06-23,众兴菌业：首次公开发行股票网上定价发行摇号中签结果公告,finalpage/2015-06-23/1201175539.PDF
30,2015-06-25,众兴菌业：中国国际金融股份有限公司关于公司股票上市保荐书,finalpage/2015-06-25/1201190951.PDF
31,2015-06-25,众兴菌业：国浩律师（北京）事务所关于公司首次公开发行股票于深圳证券交易所上市之法律意见书,finalpage/2015-06-25/1201190952.PDF
32,2015-06-25,众兴菌业：首次公开发行股票上市公告书,finalpage/2015-06-25/1201190953.PDF
33,2015-06-26,众兴菌业：上市首日风险提示公告,finalpage/2015-06-26/1201195391.PDF
34,2015-07-01,众兴菌业：股票交易异常波动公告,finalpage/2015-07-01/1201218301.PDF
35,2015-07-03,众兴菌业：股票交易异常波动公告,finalpage/2015-07-03/1201230609.PDF
36,2015-07-06,众兴菌业：股票交易异常波动公告,finalpage/2015-07-06/1201237007.PDF
37,2015-07-13,众兴菌业：第二届监事会第二次会议决议公告,finalpage/2015-07-13/1201273062.PDF
38,2015-07-13,众兴菌业：中国国际金融股份有限公司关于公司使用闲置募集资金购买理财产品的专项核查意见,finalpage/2015-07-13/1201273151.PDF
39,2015-07-13,众兴菌业：第二届董事会第四次会议决议公告,finalpage/2015-07-13/1201273152.PDF
40,2015-07-13,众兴菌业：关于签订募集资金监管协议的公告,finalpage/2015-07-13/1201273153.PDF
41,2015-07-13,众兴菌业：关于使用闲置募集资金购买理财产品的公告,finalpage/2015-07-13/1201273154.PDF
42,2015-07-13,众兴菌业：信息披露管理制度（2015年7月）,finalpage/2015-07-13/1201273155.PDF
43,2015-07-13,众兴菌业：内幕信息知情人登记管理制度（2015年7月）,finalpage/2015-07-13/1201273156.PDF
44,2015-07-13,众兴菌业：公司章程（2015年7月）,finalpage/2015-07-13/1201273157.PDF
45,2015-07-13,众兴菌业：独立董事关于使用闲置募集资金购买保本型银行理财产品相关事项的独立意见,finalpage/2015-07-13/1201273158.PDF
46,2015-07-14,众兴菌业：关于使用闲置募集资金购买理财产品的进展公告,finalpage/2015-07-14/1201287799.PDF
47,2015-07-15,众兴菌业：股票交易异常波动公告,finalpage/2015-07-15/1201292880.PDF
48,2015-07-22,众兴菌业：关于全资子公司签订合作意向书的公告,finalpage/2015-07-22/1201327156.PDF
49,2015-08-03,众兴菌业：股票交易异常波动公告,finalpage/2015-08-03/1201374812.PDF
50,2015-08-17,众兴菌业：关于签订《股权收购意向书》的公告,finalpage/2015-08-17/1201439467.PDF
51,2015-08-26,众兴菌业：关于完成工商变更登记的公告,finalpage/2015-08-26/1201492381.PDF
52,2015-08-28,众兴菌业：2015年半年度报告摘要,finalpage/2015-08-28/1201510694.PDF
53,2015-08-28,众兴菌业：2015年半年度财务报告（已取消）,finalpage/2015-08-28/1201510696.PDF
54,2015-08-28,众兴菌业：第二届董事会第五次会议决议公告,finalpage/2015-08-28/1201510697.PDF
55,2015-08-28,众兴菌业：2015年半年度报告（已取消）,finalpage/2015-08-28/1201510699.PDF
56,2015-08-28,众兴菌业：独立董事对第二届董事会第五次会议相关事项的独立意见,finalpage/2015-08-28/1201510700.PDF
57,2015-08-28,众兴菌业：中国国际金融股份有限公司关于公司使用募集资金置换预先已投入募投项目自筹资金的核查意见,finalpage/2015-08-28/1201510701.PDF
58,2015-08-28,众兴菌业：第二届监事会第三次会议决议公告,finalpage/2015-08-28/1201510703.PDF
59,2015-08-28,众兴菌业：关于2015年半年度募集资金存放与使用情况的专项报告,finalpage/2015-08-28/1201510704.PDF
60,2015-08-28,众兴菌业：关于使用募集资金置换已预先投入募投项目自筹资金的公告,finalpage/2015-08-28/1201510705.PDF
61,2015-08-28,众兴菌业：关于使用闲置自有资金购买理财产品的公告,finalpage/2015-08-28/1201510706.PDF
62,2015-08-28,众兴菌业：关于修订《公司章程》部分条款的公告,finalpage/2015-08-28/1201510707.PDF
63,2015-08-28,众兴菌业：关于召开2015年第三次临时股东大会通知的公告,finalpage/2015-08-28/1201510708.PDF
64,2015-08-28,众兴菌业：监事会议事规则（2015年8月）,finalpage/2015-08-28/1201510709.PDF
65,2015-08-28,众兴菌业：公司章程（2015年8月）,finalpage/2015-08-28/1201510710.PDF
66,2015-08-28,众兴菌业：股东大会议事规则则（2015年8月）,finalpage/2015-08-28/1201510711.PDF
67,2015-08-28,众兴菌业：董事、监事和高级管理人员持有和买卖本公司股票管理制度（2015年8月）,finalpage/2015-08-28/1201510712.PDF
68,2015-08-28,众兴菌业：董事会议事规则（2015年8月）,finalpage/2015-08-28/1201510713.PDF
69,2015-09-01,众兴菌业：2015年半年度报告（已取消）,finalpage/2015-09-01/1201532326.PDF
70,2015-09-01,众兴菌业：2015年半年度财务报告（更新后）,finalpage/2015-09-01/1201532327.PDF
71,2015-09-01,众兴菌业：更正公告,finalpage/2015-09-01/1201532328.PDF
72,2015-09-01,众兴菌业：2015年1-9月业绩预计修正公告,finalpage/2015-09-01/1201532329.PDF
73,2015-09-02,众兴菌业：关于签订《股权收购意向书》的公告,finalpage/2015-09-02/1201538287.PDF
74,2015-09-11,众兴菌业：关于收到宁津县劳动人事争议仲裁委员会答辩通知书的公告,finalpage/2015-09-11/1201578274.PDF
75,2015-09-16,众兴菌业：2015年第三次临时股东大会之法律意见书,finalpage/2015-09-16/1201598630.PDF
76,2015-09-16,众兴菌业：2015年第三次临时股东大会决议公告,finalpage/2015-09-16/1201598631.PDF
77,2015-09-23,众兴菌业：第二届董事会第六次会议决议公告,finalpage/2015-09-23/1201624972.PDF
78,2015-09-23,众兴菌业：第二届监事会第四次会议决议公告,finalpage/2015-09-23/1201624973.PDF
79,2015-09-23,众兴菌业：关于收购眉山昌宏农业生物科技有限公司70%股权的公告,finalpage/2015-09-23/1201624974.PDF
80,2015-09-23,众兴菌业：独立董事关于相关事项的独立意见,finalpage/2015-09-23/1201624975.PDF
81,2015-10-01,众兴菌业：上海荣正投资咨询有限公司关于公司限制性股票激励计划（草案）之独立财务顾问报告,finalpage/2015-10-01/1201661143.PDF
82,2015-10-01,众兴菌业：监事会关于限制性股票激励计划激励对象人员名单的核查意见,finalpage/2015-10-01/1201661144.PDF
83,2015-10-01,众兴菌业：限制性股票激励计划激励对象名单,finalpage/2015-10-01/1201661145.PDF
84,2015-10-01,众兴菌业：限制性股票激励计划考核管理办法,finalpage/2015-10-01/1201661146.PDF
85,2015-10-01,众兴菌业：限制性股票激励计划（草案）,finalpage/2015-10-01/1201661147.PDF
86,2015-10-01,众兴菌业：限制性股票激励计划（草案）摘要,finalpage/2015-10-01/1201661148.PDF
87,2015-10-01,众兴菌业：第二届董事会第七次会议决议公告,finalpage/2015-10-01/1201661149.PDF
88,2015-10-01,众兴菌业：第二届监事会第五次会议决议公告,finalpage/2015-10-01/1201661150.PDF
89,2015-10-01,众兴菌业：关于召开2015年第四次临时股东大会通知的公告,finalpage/2015-10-01/1201661151.PDF
90,2015-10-01,众兴菌业：北京安杰律师事务所关于公司限制性股票激励计划之法律意见书,finalpage/2015-10-01/1201661152.PDF
91,2015-10-01,众兴菌业：独立董事公开征集委托投票权报告书,finalpage/2015-10-01/1201661153.PDF
92,2015-10-01,众兴菌业：独立董事关于《公司限制性股票激励计划（草案）》的独立意见,finalpage/2015-10-01/1201661154.PDF
93,2015-10-10,众兴菌业：第二届董事会第八次会议决议公告,finalpage/2015-10-10/1201673944.PDF
94,2015-10-10,众兴菌业：第二届监事会第六次会议决议公告,finalpage/2015-10-10/1201673945.PDF
95,2015-10-10,众兴菌业：关于收购新乡市星河生物科技有限公司100%股权的公告,finalpage/2015-10-10/1201673946.PDF
96,2015-10-10,众兴菌业：关于召开2015年第五次临时股东大会通知的公告,finalpage/2015-10-10/1201673947.PDF
97,2015-10-10,众兴菌业：独立董事关于收购新乡市星河生物科技有限公司100%股权的独立意见,finalpage/2015-10-10/1201673948.PDF
98,2015-10-12,众兴菌业：关于股权收购公司完成工商变更登记的公告,finalpage/2015-10-12/1201681267.PDF
99,2015-10-13,众兴菌业：2015年半年度报告（更新后）,finalpage/2015-10-13/1201684446.PDF
100,2015-10-13,众兴菌业：2015年第三季度报告正文,finalpage/2015-10-13/1201684447.PDF
101,2015-10-13,众兴菌业：第二届董事会第九次会议决议公告,finalpage/2015-10-13/1201684449.PDF
102,2015-10-13,众兴菌业：第二届监事会第七次会议决议公告,finalpage/2015-10-13/1201684450.PDF
103,2015-10-13,众兴菌业：2015年第三季度报告全文,finalpage/2015-10-13/1201684452.PDF
104,2015-10-13,众兴菌业：关于召开2015年第四次临时股东大会的提示性公告,finalpage/2015-10-13/1201684453.PDF
105,2015-10-13,众兴菌业：关于召开2015年第五次临时股东大会的提示性公告,finalpage/2015-10-13/1201684454.PDF
106,2015-10-13,众兴菌业：关于公司2015年中期报告中前十名股东股份状态的更正公告,finalpage/2015-10-13/1201684455.PDF
107,2015-10-15,众兴菌业：关于使用闲置募集资金购买理财产品的进展公告,finalpage/2015-10-15/1201694830.PDF
108,2015-10-15,众兴菌业：股票交易异常波动公告,finalpage/2015-10-15/1201694831.PDF
109,2015-10-20,众兴菌业：2015年第四次临时股东大会决议公告,finalpage/2015-10-20/1201709343.PDF
110,2015-10-20,众兴菌业：2015年第四次临时股东大会之法律意见书,finalpage/2015-10-20/1201709344.PDF
111,2015-10-27,众兴菌业：2015年第五次临时股东大会决议公告,finalpage/2015-10-27/1201727412.PDF
112,2015-10-27,众兴菌业：2015年第五次临时股东大会之法律意见书,finalpage/2015-10-27/1201727413.PDF
113,2015-10-27,众兴菌业：第二届董事会第十次会议决议公告,finalpage/2015-10-27/1201727414.PDF
114,2015-10-27,众兴菌业：第二届监事会第八次会议决议公告,finalpage/2015-10-27/1201727415.PDF
115,2015-10-27,众兴菌业：关于召开2015年第六次临时股东大会通知的公告,finalpage/2015-10-27/1201727416.PDF
116,2015-10-27,众兴菌业：关于对限制性股票激励计划进行调整的公告,finalpage/2015-10-27/1201727417.PDF
117,2015-10-27,众兴菌业：关于向激励对象授予限制性股票的公告,finalpage/2015-10-27/1201727418.PDF
118,2015-10-27,众兴菌业：北京安杰律师事务所关于公司限制性股票激励计划股票授予相关事项之法律意见书,finalpage/2015-10-27/1201727419.PDF
119,2015-10-27,众兴菌业：限制性股票激励计划激励对象名单,finalpage/2015-10-27/1201727420.PDF
120,2015-10-27,众兴菌业：独立董事关于第二届董事会第十次会议相关事项的独立意见,finalpage/2015-10-27/1201727421.PDF
121,2015-10-27,众兴菌业：关于部分募投项目资金变更暨投入子公司项目建设的公告,finalpage/2015-10-27/1201727422.PDF
122,2015-10-27,众兴菌业：中国国际金融股份有限公司关于公司变更部分募集资金投资项目的核查意见,finalpage/2015-10-27/1201727423.PDF
123,2015-10-28,众兴菌业：关于披露“年产15000吨食用菌（多糖子实体原料）一期生产线建设项目”可行性研究报告全文的公告,finalpage/2015-10-28/1201730876.PDF
124,2015-10-28,"众兴菌业：陕西众兴菌业科技有限公司年产15,000吨食用菌（多糖子实体原料）一期生产线建设项目可行性研究报告",finalpage/2015-10-28/1201730877.PDF
125,2015-10-31,众兴菌业：关于股权收购公司完成工商变更登记的公告,finalpage/2015-10-31/1201745425.PDF
126,2015-11-03,众兴菌业：重大事项停牌公告,finalpage/2015-11-03/1201749077.PDF
127,2015-11-10,众兴菌业：复牌公告,finalpage/2015-11-10/1201759690.PDF
128,2015-11-10,众兴菌业：独立董事关于第二届董事会第十一次会议相关事项的独立意见,finalpage/2015-11-10/1201759691.PDF
129,2015-11-10,众兴菌业：未来三年（2016－2018年）股东分红回报规划,finalpage/2015-11-10/1201759692.PDF
130,2015-11-10,众兴菌业：第二届监事会第九次会议决议公告,finalpage/2015-11-10/1201759693.PDF
131,2015-11-10,众兴菌业：关于公司前次募集资金使用情况的报告,finalpage/2015-11-10/1201759694.PDF
132,2015-11-10,众兴菌业：关于公司前次募集资金使用情况的鉴证报告,finalpage/2015-11-10/1201759695.PDF
133,2015-11-10,众兴菌业：关于公司非公开发行股票摊薄即期回报及填补措施的公告,finalpage/2015-11-10/1201759696.PDF
134,2015-11-10,众兴菌业：简式权益变动报告书,finalpage/2015-11-10/1201759697.PDF
135,2015-11-10,众兴菌业：非公开发行A股股票募集资金使用的可行性分析报告,finalpage/2015-11-10/1201759698.PDF
136,2015-11-10,众兴菌业：第二届董事会第十一次会议决议公告,finalpage/2015-11-10/1201759699.PDF
137,2015-11-10,众兴菌业：非公开发行A股股票预案,finalpage/2015-11-10/1201759700.PDF
138,2015-11-12,众兴菌业：2015年第六次临时股东大会决议公告,finalpage/2015-11-12/1201765149.PDF
139,2015-11-12,众兴菌业：2015年第六次临时股东大会之法律意见书,finalpage/2015-11-12/1201765150.PDF
140,2015-11-13,众兴菌业：关于签订募集资金监管协议的公告,finalpage/2015-11-13/1201766709.PDF
141,2015-11-14,众兴菌业：关于使用闲置募集资金购买理财产品的进展公告,finalpage/2015-11-14/1201771413.PDF
142,2015-11-14,众兴菌业：关于公司控股股东部分股权质押的公告,finalpage/2015-11-14/1201771414.PDF
143,2015-11-17,众兴菌业：关于使用闲置自有资金购买理财产品的进展公告,finalpage/2015-11-17/1201774225.PDF
144,2015-11-20,众兴菌业：第二届董事会第十二次会议决议公告,finalpage/2015-11-20/1201779344.PDF
145,2015-11-20,众兴菌业：关于召开2015年第七次临时股东大会通知的公告,finalpage/2015-11-20/1201779345.PDF
146,2015-11-23,众兴菌业：关于控股子公司收到法院应诉通知书和民事起诉状的公告,finalpage/2015-11-23/1201784097.PDF
147,2015-11-27,众兴菌业：关于公司股东部分股权质押的公告,finalpage/2015-11-27/1201790747.PDF
148,2015-11-27,众兴菌业：关于注销部分募集资金专项账户的公告,finalpage/2015-11-27/1201790748.PDF
149,2015-12-07,众兴菌业：关于使用闲置自有资金购买理财产品的进展公告,finalpage/2015-12-07/1201810353.PDF
150,2015-12-07,众兴菌业：第二届董事会第十三次会议决议公告,finalpage/2015-12-07/1201810354.PDF
151,2015-12-07,众兴菌业：独立董事关于第二届董事会第十三次会议相关事项的独立意见,finalpage/2015-12-07/1201810355.PDF
152,2015-12-07,众兴菌业：关于为全资子公司申请银行贷款提供担保的公告,finalpage/2015-12-07/1201810356.PDF
153,2015-12-07,众兴菌业：关于以自有资金向控股子公司提供借款的公告,finalpage/2015-12-07/1201810357.PDF
154,2015-12-08,众兴菌业：2015年第七次临时股东大会决议公告,finalpage/2015-12-08/1201813129.PDF
155,2015-12-08,众兴菌业：2015年第七次临时股东大会之法律意见书,finalpage/2015-12-08/1201813130.PDF
156,2015-12-08,众兴菌业：关于闲置募集资金购买的理财产品部分赎回的公告,finalpage/2015-12-08/1201813131.PDF
157,2015-12-11,众兴菌业：关于控股子公司收到法院民事裁定书和民事判决书的公告,finalpage/2015-12-11/1201827247.PDF
158,2015-12-17,众兴菌业：关于控股子公司诉讼判决执行情况的公告,finalpage/2015-12-17/1201841594.PDF
159,2015-12-19,众兴菌业：中国国际金融股份有限公司关于公司现场检查报告,finalpage/2015-12-19/1201846613.PDF
160,2015-12-21,众兴菌业：关于全资子公司收到仲裁裁决书的公告,finalpage/2015-12-21/1201848667.PDF
161,2015-12-24,众兴菌业：关于收到《中国证监会行政许可申请受理通知书》的公告,finalpage/2015-12-24/1201854176.PDF
162,2015-12-25,众兴菌业：关于使用闲置自有资金购买理财产品的进展公告,finalpage/2015-12-25/1201856474.PDF
163,2015-12-29,众兴菌业：关于控股子公司诉讼情况的进展公告,finalpage/2015-12-29/1201871443.PDF
164,2015-12-29,众兴菌业：关于闲置募集资金购买的理财产品部分赎回的公告,finalpage/2015-12-29/1201871444.PDF
165,2015-12-31,众兴菌业：关于使用闲置自有资金购买理财产品的进展公告,finalpage/2015-12-31/1201877768.PDF
166,2016-01-05,众兴菌业：关于全资子公司获得政府补助资金的公告,finalpage/2016-01-05/1201887664.PDF
167,2016-01-05,众兴菌业：关于聘任的会计事务所名称变更的公告,finalpage/2016-01-05/1201887665.PDF
168,2016-01-09,众兴菌业：关于全资子公司诉讼进展情况的公告,finalpage/2016-01-09/1201903257.PDF
169,2016-01-21,众兴菌业：关于闲置自有资金购买的理财产品赎回的公告,finalpage/2016-01-21/1201929954.PDF
170,2016-01-22,众兴菌业：第二届董事会第十四次会议决议公告,finalpage/2016-01-22/1201931845.PDF
171,2016-01-22,众兴菌业：关于全资子公司签署设备采购合同的公告,finalpage/2016-01-22/1201931846.PDF
172,2016-02-04,众兴菌业：关于使用闲置自有资金购买理财产品的进展公告,finalpage/2016-02-04/1201969743.PDF
173,2016-02-04,众兴菌业：关于收到《中国证监会行政许可项目审查反馈意见通知书》的公告,finalpage/2016-02-04/1201969744.PDF
174,2016-02-15,众兴菌业：关于公司非公开发行股票摊薄即期回报及填补措施（修订稿）的公告,finalpage/2016-02-15/1201979583.PDF
175,2016-02-15,众兴菌业：关于非公开发行A股股票预案修订情况说明的公告,finalpage/2016-02-15/1201979584.PDF
176,2016-02-15,众兴菌业：非公开发行A股股票预案（修订稿）,finalpage/2016-02-15/1201979585.PDF
177,2016-02-15,众兴菌业：第二届董事会第十五次会议决议公告,finalpage/2016-02-15/1201979586.PDF
178,2016-02-15,众兴菌业：独立董事关于相关事项的独立意见,finalpage/2016-02-15/1201979587.PDF
179,2016-02-15,众兴菌业：第二届监事会第十次会议决议公告,finalpage/2016-02-15/1201979588.PDF
180,2016-02-15,众兴菌业：关于召开2016年第一次临时股东大会通知的公告,finalpage/2016-02-15/1201979589.PDF
181,2016-02-17,众兴菌业：关于定期报告预约披露时间变更的公告,finalpage/2016-02-17/1201982009.PDF
182,2016-02-20,众兴菌业：关于2015年度利润分配及资本公积金转增股本预案的预披露公告,finalpage/2016-02-20/1201988685.PDF
183,2016-02-26,众兴菌业：2015年年度报告摘要,finalpage/2016-02-26/1202000456.PDF
184,2016-02-26,众兴菌业：2015年年度审计报告,finalpage/2016-02-26/1202000457.PDF
185,2016-02-26,众兴菌业：第二届董事会第十六次会议决议公告,finalpage/2016-02-26/1202000458.PDF
186,2016-02-26,众兴菌业：关于召开2015年度股东大会通知的公告,finalpage/2016-02-26/1202000459.PDF
187,2016-02-26,众兴菌业：第二届监事会第十一次会议决议公告,finalpage/2016-02-26/1202000460.PDF
188,2016-02-26,众兴菌业：关联方占用上市公司资金情况的专项审核报告,finalpage/2016-02-26/1202000461.PDF
189,2016-02-26,众兴菌业：董事会关于2015年度募集资金存放与实际使用情况的专项报告,finalpage/2016-02-26/1202000462.PDF
190,2016-02-26,众兴菌业：募集资金年度存放与实际使用情况的鉴证报告,finalpage/2016-02-26/1202000463.PDF
191,2016-02-26,众兴菌业：独立董事关于2015年控股股东及其他关联方占用公司资金及公司对外担保、关联交易情况的专项说明和独立意见,finalpage/2016-02-26/1202000464.PDF
192,2016-02-26,众兴菌业：2015年度内部控制自我评价报告,finalpage/2016-02-26/1202000465.PDF
193,2016-02-26,众兴菌业：内部控制鉴证报告,finalpage/2016-02-26/1202000466.PDF
194,2016-02-26,众兴菌业：2015年度财务决算报告,finalpage/2016-02-26/1202000467.PDF
195,2016-02-26,众兴菌业：2016年度财务预算报告,finalpage/2016-02-26/1202000468.PDF
196,2016-02-26,众兴菌业：独立董事关于聘请2016年度审计机构的事前认可意见,finalpage/2016-02-26/1202000469.PDF
197,2016-02-26,众兴菌业：独立董事关于第二届董事会第十六次会议相关议案的独立董事意见,finalpage/2016-02-26/1202000470.PDF
198,2016-02-26,众兴菌业：2016年度董事、高级管理人员薪酬（津贴）绩效方案,finalpage/2016-02-26/1202000471.PDF
199,2016-02-26,众兴菌业：2015年度监事会工作报告,finalpage/2016-02-26/1202000472.PDF
200,2016-02-26,众兴菌业：2016年度监事会人员薪酬绩效方案,finalpage/2016-02-26/1202000473.PDF
201,2016-02-26,众兴菌业：监事会关于《2015年度内部控制自我评价报告》的审核意见,finalpage/2016-02-26/1202000474.PDF
202,2016-02-26,众兴菌业：关于拟变更公司董事的公告,finalpage/2016-02-26/1202000475.PDF
203,2016-02-26,众兴菌业：内部控制规则落实自查表,finalpage/2016-02-26/1202000476.PDF
204,2016-02-26,众兴菌业：关于通过互联网举行2015年度报告说明会的公告,finalpage/2016-02-26/1202000477.PDF
205,2016-02-26,众兴菌业：中国国际金融股份有限公司关于公司2015年度保荐工作报告,finalpage/2016-02-26/1202000478.PDF
206,2016-02-26,众兴菌业：中国国际金融股份有限公司关于公司《2015年度内部控制自我评价报告》的核查意见,finalpage/2016-02-26/1202000479.PDF
207,2016-02-26,众兴菌业：中国国际金融股份有限公司关于公司《关于2015年度募集资金存放与实际使用情况的专项报告》的核查意见,finalpage/2016-02-26/1202000480.PDF
