,date,title,url
0,2017-08-21,赛隆药业：2014年度、2015年度、2016年度及2017年1-6月审计报告,finalpage/2017-08-21/1203829609.PDF
1,2017-08-21,赛隆药业：2015年第七次临时股东大会会议决议,finalpage/2017-08-21/1203829610.PDF
2,2017-08-21,赛隆药业：内部控制鉴证报告,finalpage/2017-08-21/1203829611.PDF
3,2017-08-21,赛隆药业：中国证监会关于核准公司首次公开发行股票的批复,finalpage/2017-08-21/1203829612.PDF
4,2017-08-21,赛隆药业：公司章程（草案）,finalpage/2017-08-21/1203829613.PDF
5,2017-08-21,赛隆药业：北京市康达律师事务所关于公司首次公开发行股票并上市之律师工作报告,finalpage/2017-08-21/1203829614.PDF
6,2017-08-21,赛隆药业：北京市康达律师事务所关于公司首次公开发行股票并上市的法律意见书,finalpage/2017-08-21/1203829615.PDF
7,2017-08-21,赛隆药业：北京市康达律师事务所关于公司首次公开发行股票并上市的补充法律意见书（一）,finalpage/2017-08-21/1203829616.PDF
8,2017-08-21,赛隆药业：北京市康达律师事务所关于公司首次公开发行股票并上市的补充法律意见书（三）,finalpage/2017-08-21/1203829617.PDF
9,2017-08-21,赛隆药业：北京市康达律师事务所关于公司首次公开发行股票并上市的补充法律意见书（二）,finalpage/2017-08-21/1203829618.PDF
10,2017-08-21,赛隆药业：北京市康达律师事务所关于公司首次公开发行股票并上市的补充法律意见书（五）,finalpage/2017-08-21/1203829619.PDF
11,2017-08-21,赛隆药业：北京市康达律师事务所关于公司首次公开发行股票并上市的补充法律意见书（六）,finalpage/2017-08-21/1203829620.PDF
12,2017-08-21,赛隆药业：北京市康达律师事务所关于公司首次公开发行股票并上市的补充法律意见书（四）,finalpage/2017-08-21/1203829621.PDF
13,2017-08-21,赛隆药业：第一届董事会第十二次会议决议,finalpage/2017-08-21/1203829622.PDF
14,2017-08-21,赛隆药业：关于公司非经常性损益的审核报告,finalpage/2017-08-21/1203829623.PDF
15,2017-08-21,赛隆药业：西部证券股份有限公司关于公司首次公开发行股票之发行保荐书,finalpage/2017-08-21/1203829624.PDF
16,2017-08-21,赛隆药业：西部证券股份有限公司关于公司首次公开发行股票之发行保荐工作报告,finalpage/2017-08-21/1203829625.PDF
17,2017-08-21,赛隆药业：首次公开发行股票初步询价及推介公告,finalpage/2017-08-21/1203829626.PDF
18,2017-08-21,赛隆药业：首次公开发行股票招股意向书,finalpage/2017-08-21/1203829627.PDF
19,2017-08-21,赛隆药业：首次公开发行股票招股意向书摘要,finalpage/2017-08-21/1203829628.PDF
20,2017-08-28,赛隆药业：首次公开发行股票网上路演公告,finalpage/2017-08-28/1203873657.PDF
21,2017-08-29,赛隆药业：首次公开发行股票发行公告,finalpage/2017-08-29/1203890447.PDF
22,2017-08-29,赛隆药业：首次公开发行股票投资风险特别公告,finalpage/2017-08-29/1203890448.PDF
23,2017-08-29,赛隆药业：首次公开发行股票招股说明书,finalpage/2017-08-29/1203890449.PDF
24,2017-08-29,赛隆药业：首次公开发行股票招股说明书摘要,finalpage/2017-08-29/1203890454.PDF
25,2017-08-31,赛隆药业：首次公开发行股票网上申购情况及中签率公告,finalpage/2017-08-31/1203908670.PDF
26,2017-09-01,赛隆药业：首次公开发行股票网上摇号中签结果公告,finalpage/2017-09-01/1203921533.PDF
27,2017-09-01,赛隆药业：首次公开发行股票网下发行初步配售结果公告,finalpage/2017-09-01/1203921534.PDF
28,2017-09-05,赛隆药业：首次公开发行股票发行结果公告,finalpage/2017-09-05/1203931661.PDF
29,2017-09-11,赛隆药业：北京市康达律师事务所关于公司首次公开发行的股票在深圳证券交易所上市的法律意见书,finalpage/2017-09-11/1203961126.PDF
30,2017-09-11,赛隆药业：西部证券股份有限公司关于公司首次公开发行股票上市保荐书,finalpage/2017-09-11/1203961127.PDF
31,2017-09-11,赛隆药业：首次公开发行股票上市公告书,finalpage/2017-09-11/1203961128.PDF
32,2017-09-12,赛隆药业：上市首日风险公告,finalpage/2017-09-12/1203964776.PDF
33,2017-09-18,赛隆药业：股票交易异常波动公告,finalpage/2017-09-18/1203978734.PDF
34,2017-09-21,赛隆药业：股票交易异常波动公告,finalpage/2017-09-21/1203990115.PDF
35,2017-09-25,赛隆药业：股票交易异常波动公告,finalpage/2017-09-25/1203996098.PDF
36,2017-09-27,赛隆药业：股票交易异常波动公告,finalpage/2017-09-27/1204004602.PDF
37,2017-09-28,赛隆药业：股票交易异常波动公告,finalpage/2017-09-28/1204007128.PDF
38,2017-10-11,赛隆药业：关于签订募集资金三方监管协议的公告,finalpage/2017-10-11/1204023951.PDF
39,2017-10-20,赛隆药业：第一届监事会第八次会议决议公告,finalpage/2017-10-20/1204054947.PDF
40,2017-10-20,赛隆药业：关于召开2017年第三次临时股东大会的通知,finalpage/2017-10-20/1204054948.PDF
41,2017-10-20,赛隆药业：公司章程（2017年10月）,finalpage/2017-10-20/1204054949.PDF
42,2017-10-20,赛隆药业：公司章程前后对照表,finalpage/2017-10-20/1204054950.PDF
43,2017-10-20,赛隆药业：第一届董事会第二十九次会议决议公告,finalpage/2017-10-20/1204054951.PDF
44,2017-10-20,赛隆药业：2017年第三季度报告全文,finalpage/2017-10-20/1204054952.PDF
45,2017-10-20,赛隆药业：2017年第三季度报告正文,finalpage/2017-10-20/1204054953.PDF
46,2017-11-03,赛隆药业：关于股东部分股份质押的公告,finalpage/2017-11-03/1204110054.PDF
47,2017-11-07,赛隆药业：2017年第三次临时股东大会决议公告,finalpage/2017-11-07/1204116739.PDF
48,2017-11-07,赛隆药业：2017年第三次临时股东大会的法律意见书,finalpage/2017-11-07/1204116740.PDF
49,2017-11-09,赛隆药业：西部证券股份有限公司关于公司2017年度培训情况报告,finalpage/2017-11-09/1204128179.PDF
50,2017-11-22,赛隆药业：第一届监事会第九次会议决议公告,finalpage/2017-11-22/1204155068.PDF
51,2017-11-22,赛隆药业：独立董事提名人声明（一）,finalpage/2017-11-22/1204155069.PDF
52,2017-11-22,赛隆药业：独立董事提名人声明（二）,finalpage/2017-11-22/1204155070.PDF
53,2017-11-22,赛隆药业：独立董事提名人声明（三）,finalpage/2017-11-22/1204155071.PDF
54,2017-11-22,赛隆药业：独立董事候选人声明（袁自强）,finalpage/2017-11-22/1204155072.PDF
55,2017-11-22,赛隆药业：独立董事候选人声明（徐杰）,finalpage/2017-11-22/1204155073.PDF
56,2017-11-22,赛隆药业：独立董事候选人声明（张维）,finalpage/2017-11-22/1204155074.PDF
57,2017-11-22,赛隆药业：关于使用募集资金置换预先投入募投项目自筹资金的公告,finalpage/2017-11-22/1204155075.PDF
58,2017-11-22,赛隆药业：关于变更部分募集资金投资项目实施主体的公告,finalpage/2017-11-22/1204155076.PDF
59,2017-11-22,赛隆药业：独立董事关于第一届董事会第三十次会议相关事项的独立意见,finalpage/2017-11-22/1204155077.PDF
60,2017-11-22,赛隆药业：西部证券股份有限公司关于公司使用募集资金置换预先投入募集资金投资项目自筹资金的核查意见,finalpage/2017-11-22/1204155078.PDF
61,2017-11-22,赛隆药业：第一届董事会第三十次会议决议公告,finalpage/2017-11-22/1204155079.PDF
62,2017-11-22,赛隆药业：西部证券股份有限公司关于公司变更部分募集资金投资项目实施主体的核查意见,finalpage/2017-11-22/1204155080.PDF
63,2017-11-22,赛隆药业：关于召开2017年第四次临时股东大会的通知,finalpage/2017-11-22/1204155081.PDF
64,2017-11-27,赛隆药业：关于完成工商变更登记的公告,finalpage/2017-11-27/1204166541.PDF
65,2017-12-09,赛隆药业：关于子公司获得注射用奥美拉唑钠药品注册批件的公告,finalpage/2017-12-09/1204207193.PDF
66,2017-12-09,赛隆药业：关于选举第二届监事会职工代表监事的公告,finalpage/2017-12-09/1204207194.PDF
67,2017-12-09,赛隆药业：第二届监事会第一次会议决议公告,finalpage/2017-12-09/1204207195.PDF
68,2017-12-09,赛隆药业：2017年第四次临时股东大会的法律意见书,finalpage/2017-12-09/1204207196.PDF
69,2017-12-09,赛隆药业：2017年第四次临时股东大会决议公告,finalpage/2017-12-09/1204207197.PDF
70,2017-12-09,赛隆药业：第二届董事会第一次会议决议公告,finalpage/2017-12-09/1204207198.PDF
71,2017-12-27,赛隆药业：关于变更募投项目实施主体后重新签订募集资金三方监管协议的公告,finalpage/2017-12-27/1204269277.PDF
72,2018-01-16,赛隆药业：第二届董事会第二次会议决议公告,finalpage/2018-01-16/1204335606.PDF
73,2018-01-16,赛隆药业：关于聘任公司总经理的公告,finalpage/2018-01-16/1204335607.PDF
74,2018-01-16,赛隆药业：关于聘任公司副总经理的公告,finalpage/2018-01-16/1204335608.PDF
75,2018-01-16,赛隆药业：关于聘任公司董事会秘书的公告,finalpage/2018-01-16/1204335609.PDF
76,2018-01-16,赛隆药业：独立董事关于公司聘任高级管理人员的独立意见,finalpage/2018-01-16/1204335610.PDF
77,2018-02-01,赛隆药业：第二届董事会第三次会议决议公告,finalpage/2018-02-01/1204377067.PDF
78,2018-02-02,赛隆药业：关于签订《长沙县商品房买卖合同》的公告,finalpage/2018-02-02/1204385408.PDF
