date,title,url
2012-09-05,太阳鸟：重大合同进展公告,finalpage/2012-09-05/61533099.PDF
2012-09-06,太阳鸟：关于珠海太阳鸟游艇制造有限公司全资子公司完成工商变更登记的公告,finalpage/2012-09-06/61542400.PDF
2012-09-06,太阳鸟：华泰联合证券有限责任公司关于公司持续督导期间跟踪报告,finalpage/2012-09-06/61542401.PDF
2012-09-13,太阳鸟：2012年第二次临时股东大会决议公告,finalpage/2012-09-13/61563094.PDF
2012-09-13,太阳鸟：2012年第二次临时股东大会的法律意见书,finalpage/2012-09-13/61563095.PDF
2012-09-27,太阳鸟：华泰联合证券有限责任公司关于公司限售股份上市流通事项的保荐意见,finalpage/2012-09-27/61617194.PDF
2012-09-27,太阳鸟：关于限售股份上市流通提示性公告,finalpage/2012-09-27/61617196.PDF
2012-10-13,太阳鸟：2012年前三季度业绩预告,finalpage/2012-10-13/61652197.PDF
2012-10-24,太阳鸟：2012年第三季度报告正文,finalpage/2012-10-24/61693690.PDF
2012-10-24,太阳鸟：2012年第三季度报告全文,finalpage/2012-10-24/61693696.PDF
2012-10-24,太阳鸟：第二届监事会第六次会议决议,finalpage/2012-10-24/61693697.PDF
2012-10-24,太阳鸟：第二届董事会第六次会议决议,finalpage/2012-10-24/61693700.PDF
2012-11-08,太阳鸟：关于拟订重大合同的公告,finalpage/2012-11-08/61777263.PDF
2012-11-15,太阳鸟：关于全资子公司广东宝达游艇制造有限公司拟订重大合同的公告,finalpage/2012-11-15/61803254.PDF
2012-11-28,太阳鸟：独立董事对第二届董事会第七次会议相关事项的独立意见,finalpage/2012-11-28/61846656.PDF
2012-11-28,太阳鸟：为全资子公司珠海太阳鸟游艇制造有限公司提供担保的公告,finalpage/2012-11-28/61846657.PDF
2012-11-28,太阳鸟：为珠海雄达游艇制造有限公司提供担保的公告,finalpage/2012-11-28/61846658.PDF
2012-11-28,太阳鸟：第二届监事会第七次会议决议,finalpage/2012-11-28/61846659.PDF
2012-11-28,太阳鸟：第二届董事会第七次会议决议,finalpage/2012-11-28/61846660.PDF
2012-12-15,太阳鸟：关于向普兰帝（美国）游艇有限公司增资的公告,finalpage/2012-12-15/61911841.PDF
2012-12-15,太阳鸟：关于向马可波罗游艇有限公司增资的公告,finalpage/2012-12-15/61911842.PDF
2012-12-15,太阳鸟：第二届监事会第八次会议决议,finalpage/2012-12-15/61911843.PDF
2012-12-15,太阳鸟：第二届董事会第八次会议决议,finalpage/2012-12-15/61911844.PDF
2012-12-25,太阳鸟：关于全资子公司广东宝达游艇制造有限公司重大合同进展公告,finalpage/2012-12-25/61945330.PDF
2013-01-16,太阳鸟：重大合同进展公告,finalpage/2013-01-16/62024907.PDF
2013-01-30,太阳鸟：2012年度业绩预告,finalpage/2013-01-30/62082616.PDF
2013-02-27,太阳鸟：2012年度业绩快报,finalpage/2013-02-27/62160592.PDF
2013-04-03,太阳鸟：2013年度第一季度业绩预告,finalpage/2013-04-03/62325941.PDF
2013-04-18,太阳鸟：关于使用募集资金投资项目节余资金永久补充流动资金的公告,finalpage/2013-04-18/62377498.PDF
2013-04-18,太阳鸟：关于举行2012年年度报告网上说明会的通知,finalpage/2013-04-18/62377499.PDF
2013-04-18,太阳鸟：关于签署募集资金三方监管协议的公告,finalpage/2013-04-18/62377500.PDF
2013-04-18,太阳鸟：2012年度内部控制自我评价报告,finalpage/2013-04-18/62377501.PDF
2013-04-18,太阳鸟：关于年度募集资金存放与使用情况的专项报告,finalpage/2013-04-18/62377502.PDF
2013-04-18,太阳鸟：2012年年度报告摘要,finalpage/2013-04-18/62377503.PDF
2013-04-18,太阳鸟：2012年年度审计报告,finalpage/2013-04-18/62377505.PDF
2013-04-18,太阳鸟：第二届董事会第九次会议决议,finalpage/2013-04-18/62377506.PDF
2013-04-18,太阳鸟：关于召开2012年年度股东大会的公告,finalpage/2013-04-18/62377507.PDF
2013-04-18,太阳鸟：关于2012年年度报告披露的提示性公告,finalpage/2013-04-18/62377508.PDF
2013-04-18,太阳鸟：第二届监事会第九次会议决议公告,finalpage/2013-04-18/62377509.PDF
2013-04-18,太阳鸟：2012年年度报告,finalpage/2013-04-18/62377510.PDF
2013-04-18,太阳鸟：关于公司内部控制的鉴证报告,finalpage/2013-04-18/62377511.PDF
2013-04-18,太阳鸟：华泰联合证券有限责任公司关于公司使用募投项目节余资金永久补充流动资金的核查意见,finalpage/2013-04-18/62377512.PDF
2013-04-18,太阳鸟：华泰联合证券有限责任公司关于公司内部控制自我评价报告的核查意见,finalpage/2013-04-18/62377513.PDF
2013-04-18,太阳鸟：华泰联合证券有限责任公司关于公司募集资金年度使用情况的专项核查意见,finalpage/2013-04-18/62377514.PDF
2013-04-18,太阳鸟：控股股东及其他关联方资金占用情况的专项审计说明,finalpage/2013-04-18/62377515.PDF
2013-04-18,太阳鸟：募集资金年度存放与使用情况鉴证报告,finalpage/2013-04-18/62377516.PDF
2013-04-18,太阳鸟：独立董事2012年度述职报告（李荻辉）,finalpage/2013-04-18/62377517.PDF
2013-04-18,太阳鸟：独立董事2012年度述职报告（杨新发）,finalpage/2013-04-18/62377518.PDF
2013-04-18,太阳鸟：独立董事2012年度述职报告（颜爱民）,finalpage/2013-04-18/62377519.PDF
2013-04-18,太阳鸟：独立董事对第二届董事会第九次会议相关事项的独立意见,finalpage/2013-04-18/62377520.PDF
2013-04-25,太阳鸟：关于2013第一季度报告披露的提示性公告,finalpage/2013-04-25/62419309.PDF
2013-04-25,太阳鸟：2013年第一季度报告全文,finalpage/2013-04-25/62421262.PDF
2013-05-07,太阳鸟：华泰联合证券有限责任公司关于公司持续督导期间跟踪报告,finalpage/2013-05-07/62468161.PDF
2013-05-10,太阳鸟：2012年年度股东大会决议公告,finalpage/2013-05-10/62479248.PDF
2013-05-10,太阳鸟：2012年年度股东大会的法律意见书,finalpage/2013-05-10/62479249.PDF
2013-05-21,太阳鸟：2012年度权益分派实施公告,finalpage/2013-05-21/62509477.PDF
2013-05-30,太阳鸟：北京市天银律师事务所关于公司股票期权与限制性股票激励计划（草案）的法律意见书,finalpage/2013-05-30/62536071.PDF
2013-05-30,太阳鸟：华泰联合证券有限责任公司关于公司股票期权与限制性股票激励计划之独立财务顾问报告,finalpage/2013-05-30/62536072.PDF
2013-05-30,太阳鸟：股票期权与限制性股票激励计划（草案）,finalpage/2013-05-30/62536073.PDF
2013-05-30,太阳鸟：独立董事关于股票期权与限制性股票激励计划（草案）的独立意见,finalpage/2013-05-30/62536074.PDF
2013-05-30,太阳鸟：监事会对激励对象名单的核查意见,finalpage/2013-05-30/62536075.PDF
2013-05-30,太阳鸟：股票期权与限制性股票激励对象名单,finalpage/2013-05-30/62536076.PDF
2013-05-30,太阳鸟：股票期权与限制性股票激励计划实施考核管理办法（2013年5月）,finalpage/2013-05-30/62536077.PDF
2013-05-30,太阳鸟：股票期权与限制性股票激励计划（草案）摘要,finalpage/2013-05-30/62536078.PDF
2013-05-30,太阳鸟：为全资子公司珠海太阳鸟游艇制造有限公司提供担保的公告,finalpage/2013-05-30/62536079.PDF
2013-05-30,太阳鸟：第二届监事会第十一次会议决议公告,finalpage/2013-05-30/62536080.PDF
2013-05-30,太阳鸟：第二届董事会第十一次会议决议,finalpage/2013-05-30/62536081.PDF
2013-05-30,太阳鸟：独立董事对第二届董事会第十一次会议相关事项的独立意见,finalpage/2013-05-30/62536082.PDF
2013-07-02,太阳鸟：关于向长沙太阳鸟游艇有限责任公司增资的公告,finalpage/2013-07-02/62755216.PDF
2013-07-02,太阳鸟：关于全资子公司长沙太阳鸟游艇有限责任公司拟参与竞拍土地使用权的公告,finalpage/2013-07-02/62755217.PDF
2013-07-02,太阳鸟：公司章程修订对照说明,finalpage/2013-07-02/62755218.PDF
2013-07-02,太阳鸟：第二届监事会第十二次会议决议公告,finalpage/2013-07-02/62755219.PDF
2013-07-02,太阳鸟：第二届董事会第十二次会议决议,finalpage/2013-07-02/62755220.PDF
2013-07-06,太阳鸟：关于股东股权质押的公告,finalpage/2013-07-06/62788595.PDF
2013-07-13,太阳鸟：2013年半年度业绩预告,finalpage/2013-07-13/62830521.PDF
2013-08-07,太阳鸟：关于全资子公司珠海太阳鸟游艇制造有限公司签订投资意向协议的公告,finalpage/2013-08-07/62912475.PDF
2013-08-15,太阳鸟：关于召开2013年第一次临时股东大会的公告,finalpage/2013-08-15/62949603.PDF
2013-08-15,太阳鸟：关于聘任高级管理人员暨更换董事会秘书的公告,finalpage/2013-08-15/62949604.PDF
2013-08-15,太阳鸟：北京市天银律师事务所关于公司股票期权与限制性股票激励计划（草案修订稿）的法律意见书,finalpage/2013-08-15/62949605.PDF
2013-08-15,太阳鸟：华泰联合证券有限责任公司关于公司股票期权与限制性股票激励计划之独立财务顾问报告,finalpage/2013-08-15/62949606.PDF
2013-08-15,太阳鸟：关于对股票期权与限制性股票激励计划（草案）的修订说明,finalpage/2013-08-15/62949607.PDF
2013-08-15,太阳鸟：股票期权与限制性股票激励对象名单,finalpage/2013-08-15/62949608.PDF
2013-08-15,太阳鸟：股票期权与限制性股票激励计划（草案修订稿）,finalpage/2013-08-15/62949609.PDF
2013-08-15,太阳鸟：监事会对激励对象名单的核查意见,finalpage/2013-08-15/62949610.PDF
2013-08-15,太阳鸟：股票期权与限制性股票激励计划实施考核管理办法（修订稿）,finalpage/2013-08-15/62949613.PDF
2013-08-15,太阳鸟：股票期权与限制性股票激励计划（草案修订稿）摘要,finalpage/2013-08-15/62949616.PDF
2013-08-15,太阳鸟：独立董事关于股票期权与限制性股票激励计划（草案修订稿）的独立意见,finalpage/2013-08-15/62949617.PDF
2013-08-15,太阳鸟：独立董事征集投票权报告书,finalpage/2013-08-15/62949618.PDF
2013-08-15,太阳鸟：第二届监事会第十三次会议决议公告,finalpage/2013-08-15/62949619.PDF
2013-08-15,太阳鸟：第二届董事会第十三次会议决议,finalpage/2013-08-15/62949620.PDF
2013-08-15,太阳鸟：独立董事对第二届董事会第十三次会议相关事项的独立意见,finalpage/2013-08-15/62949621.PDF
2013-08-24,太阳鸟：2013年半年度报告摘要,finalpage/2013-08-24/62986016.PDF
2013-08-24,太阳鸟：关于2013年半年度报告披露的提示性公告,finalpage/2013-08-24/62986018.PDF
2013-08-24,太阳鸟：2013年半年度报告,finalpage/2013-08-24/62986019.PDF
2013-08-24,太阳鸟：2013年半年度募集资金存放与使用情况的专项报告,finalpage/2013-08-24/62986020.PDF
2013-08-24,太阳鸟：独立董事对第二届董事会第十四次会议相关事项的独立意见,finalpage/2013-08-24/62986021.PDF
2013-08-31,太阳鸟：2013年第一次临时股东大会决议公告,finalpage/2013-08-31/63029845.PDF
2013-08-31,太阳鸟：关于董事辞职的公告,finalpage/2013-08-31/63029846.PDF
2013-08-31,太阳鸟：2013年第一次临时股东大会的法律意见书,finalpage/2013-08-31/63029847.PDF
2013-09-10,太阳鸟：关于向激励对象授予股票期权与限制性股票的公告,finalpage/2013-09-10/63070613.PDF
2013-09-10,太阳鸟：关于对股权激励计划进行调整的公告,finalpage/2013-09-10/63070614.PDF
2013-09-10,太阳鸟：监事会对激励对象名单的核查意见,finalpage/2013-09-10/63070615.PDF
2013-09-10,太阳鸟：股票期权与限制性股票首次授予激励对象名单,finalpage/2013-09-10/63070616.PDF
2013-09-10,太阳鸟：北京市天银律师事务所关于公司股票期权与限制性股票激励计划授予事项的法律意见书,finalpage/2013-09-10/63070619.PDF
2013-09-10,太阳鸟：北京市天银律师事务所关于公司股票期权与限制性股票激励计划调整事项的法律意见书,finalpage/2013-09-10/63070620.PDF
2013-09-10,太阳鸟：关于公司第二届董事会第十五次会议相关事项的独立意见,finalpage/2013-09-10/63070621.PDF
2013-09-10,太阳鸟：第二届监事会第十五次会议决议公告,finalpage/2013-09-10/63070623.PDF
2013-09-10,太阳鸟：第二届董事会第十五次会议决议,finalpage/2013-09-10/63070624.PDF
2013-09-11,太阳鸟：华泰联合证券有限责任公司关于公司持续督导期间跟踪报告,finalpage/2013-09-11/63073909.PDF
2013-09-27,太阳鸟：华泰联合证券有限责任公司关于公司限售股份上市流通事项的保荐意见,finalpage/2013-09-27/63118302.PDF
2013-09-27,太阳鸟：关于限售股份上市流通提示性公告,finalpage/2013-09-27/63118303.PDF
2013-09-30,太阳鸟：关于全资子公司广东宝达游艇制造有限公司签订投资意向协议的公告,finalpage/2013-09-30/63127515.PDF
2013-10-15,太阳鸟：2013年前三季度业绩预告,finalpage/2013-10-15/63154239.PDF
2013-10-17,太阳鸟：第二届董事会第十六次会议决议,finalpage/2013-10-17/63162619.PDF
2013-10-17,太阳鸟：关于股票期权与限制性股票首次授予登记完成的公告,finalpage/2013-10-17/63163299.PDF
2013-10-25,太阳鸟：关于2013年第三季度报告披露的提示性公告,finalpage/2013-10-25/63191470.PDF
2013-10-25,太阳鸟：2013年第三季度报告全文,finalpage/2013-10-25/63191472.PDF
2013-10-25,太阳鸟：关于使用超募资金及募投项目节余资金永久补充流动资金的公告,finalpage/2013-10-25/63191473.PDF
2013-10-25,太阳鸟：华泰联合证券有限责任公司关于公司使用超募资金及募投项目节余资金永久补充流动资金的核查意见,finalpage/2013-10-25/63191474.PDF
2013-10-25,太阳鸟：独立董事对第二届董事会第十七次会议相关事项的独立意见,finalpage/2013-10-25/63191475.PDF
2013-10-25,太阳鸟：第二届监事会第十六次会议决议公告,finalpage/2013-10-25/63191476.PDF
2013-10-25,太阳鸟：第二届董事会第十七次会议决议,finalpage/2013-10-25/63191477.PDF
2013-11-07,太阳鸟：全资子公司取得国土证的公告,finalpage/2013-11-07/63248000.PDF
2013-12-03,太阳鸟：关于持股5%以上股东暨副董事长减持的公告,finalpage/2013-12-03/63334506.PDF
2013-12-09,太阳鸟：关于完成工商变更登记的公告,finalpage/2013-12-09/63359680.PDF
2013-12-13,太阳鸟：关于召开2013年第二次临时股东大会的公告,finalpage/2013-12-13/63376218.PDF
2013-12-13,太阳鸟：为全资子公司珠海太阳鸟游艇制造有限公司提供担保的公告,finalpage/2013-12-13/63376220.PDF
2013-12-13,太阳鸟：第二届监事会第十七次会议决议公告,finalpage/2013-12-13/63376221.PDF
2013-12-13,太阳鸟：第二届董事会第十八次会议决议,finalpage/2013-12-13/63376222.PDF
2013-12-13,太阳鸟：独立董事对第二届董事会第十八次会议相关事项的独立意见,finalpage/2013-12-13/63376223.PDF
2013-12-30,太阳鸟：2013年第二次临时股东大会决议公告,finalpage/2013-12-30/63434209.PDF
2013-12-30,太阳鸟：关于控股股东股权质押的公告,finalpage/2013-12-30/63434210.PDF
2013-12-30,太阳鸟：2013年第二次临时股东大会的法律意见书,finalpage/2013-12-30/63434211.PDF
2014-01-25,太阳鸟：2013年度业绩预告,finalpage/2014-01-25/63522922.PDF
2014-01-25,太阳鸟：关于2013年年度利润分配预案的预披露公告,finalpage/2014-01-25/63522923.PDF
2014-02-13,太阳鸟：关于实际控制人、股东、关联方以及本公司承诺履行情况的公告,finalpage/2014-02-13/63569537.PDF
2014-02-20,太阳鸟：关于股东进行股票质押式回购交易的公告,finalpage/2014-02-20/63592559.PDF
2014-02-28,太阳鸟：2013年度业绩快报,finalpage/2014-02-28/63619502.PDF
2014-03-10,太阳鸟：关于控股股东进行股票质押式回购交易的公告,finalpage/2014-03-10/63658316.PDF
2014-03-21,太阳鸟：关于推迟年报披露时间的公告,finalpage/2014-03-21/63709898.PDF
2014-04-09,太阳鸟：2014年度第一季度业绩预告,finalpage/2014-04-09/63813150.PDF
2014-04-18,太阳鸟：关于举行2013年年度报告网上说明会的通知,finalpage/2014-04-18/63862669.PDF
2014-04-18,太阳鸟：关于证券事务代表辞职及聘任的公告,finalpage/2014-04-18/63862670.PDF
2014-04-18,太阳鸟：2013年度内部控制评价报告,finalpage/2014-04-18/63862671.PDF
2014-04-18,太阳鸟：关于募集资金年度存放与使用情况的专项报告,finalpage/2014-04-18/63862672.PDF
2014-04-18,太阳鸟：关于向普兰帝（香港）游艇有限公司增资的公告,finalpage/2014-04-18/63862673.PDF
2014-04-18,太阳鸟：控股股东及其他关联方资金占用情况的专项审计说明,finalpage/2014-04-18/63862674.PDF
2014-04-18,太阳鸟：募集资金年度存放与使用情况鉴证报告,finalpage/2014-04-18/63862675.PDF
2014-04-18,太阳鸟：2013年年度报告摘要,finalpage/2014-04-18/63862676.PDF
2014-04-18,太阳鸟：2013年年度审计报告,finalpage/2014-04-18/63862683.PDF
2014-04-18,太阳鸟：第二届董事会第十九次会议决议,finalpage/2014-04-18/63862685.PDF
2014-04-18,太阳鸟：关于召开2013年年度股东大会的公告,finalpage/2014-04-18/63862686.PDF
2014-04-18,太阳鸟：关于2013年年度报告披露的提示性公告,finalpage/2014-04-18/63862687.PDF
2014-04-18,太阳鸟：第二届监事会第十八次会议决议公告,finalpage/2014-04-18/63862688.PDF
2014-04-18,太阳鸟：2013年年度报告,finalpage/2014-04-18/63862689.PDF
2014-04-18,太阳鸟：华泰联合证券有限责任公司关于公司内部控制自我评价报告的核查意见,finalpage/2014-04-18/63862690.PDF
2014-04-18,太阳鸟：华泰联合证券有限责任公司关于公司募集资金年度使用情况的专项核查意见,finalpage/2014-04-18/63862691.PDF
2014-04-18,太阳鸟：公司章程（2014年4月）,finalpage/2014-04-18/63862692.PDF
2014-04-18,太阳鸟：未来三年股东回报规划（2014年—2016年）,finalpage/2014-04-18/63862693.PDF
2014-04-18,太阳鸟：独立董事2013年度述职报告（李荻辉）,finalpage/2014-04-18/63862694.PDF
2014-04-18,太阳鸟：独立董事2013年度述职报告（杨新发）,finalpage/2014-04-18/63862695.PDF
2014-04-18,太阳鸟：独立董事2013年度述职报告（颜爱民）,finalpage/2014-04-18/63862696.PDF
2014-04-18,太阳鸟：公司章程修订情况对照表,finalpage/2014-04-18/63862697.PDF
2014-04-18,太阳鸟：独立董事对第二届董事会第十九次会议相关事项的独立意见,finalpage/2014-04-18/63862699.PDF
2014-04-22,太阳鸟：华泰联合证券有限责任公司关于公司持续督导期间跟踪报告,finalpage/2014-04-22/63891967.PDF
2014-04-24,太阳鸟：关于2014年第一季度报告披露的提示性公告,finalpage/2014-04-24/63904427.PDF
2014-04-24,太阳鸟：2014年第一季度报告全文,finalpage/2014-04-24/63904428.PDF
2014-05-07,太阳鸟：申请首次公开发行股票并在创业板上市之保荐总结报告书,finalpage/2014-05-07/63998212.PDF
2014-05-12,太阳鸟：2013年年度股东大会决议公告,finalpage/2014-05-12/64016740.PDF
2014-05-12,太阳鸟：2013年度股东大会的法律意见书,finalpage/2014-05-12/64016741.PDF
2014-05-13,太阳鸟：2013年年度股东大会决议更正公告,finalpage/2014-05-13/64020516.PDF
2014-05-29,太阳鸟：2013年度权益分派实施公告,finalpage/2014-05-29/64078303.PDF
2014-06-09,太阳鸟：关于董事辞职的公告,finalpage/2014-06-09/64119839.PDF
2014-06-13,太阳鸟：关于控股股东解除质押和质押的公告,finalpage/2014-06-13/64135274.PDF
2014-06-25,太阳鸟：第二届董事会第二十一次会议决议,finalpage/2014-06-25/1200007759.PDF
2014-06-25,太阳鸟：第二届监事会第二十次会议决议公告,finalpage/2014-06-25/1200007760.PDF
2014-06-25,太阳鸟：关于回购注销部分限制性股票及注销部分股票期权并调整的公告,finalpage/2014-06-25/1200007761.PDF
2014-06-25,太阳鸟：北京市天银律师事务所关于公司调整股权激励计划及回购注销部分限制性股票、注销部分股票期权相关事项的法律意见书,finalpage/2014-06-25/1200007762.PDF
2014-06-25,太阳鸟：独立董事对第二届董事会第二十一次会议相关事项的独立意见,finalpage/2014-06-25/1200007994.PDF
2014-07-14,太阳鸟：关于对外投资设立合资公司的公告,finalpage/2014-07-14/1200052796.PDF
2014-07-14,太阳鸟：2014年半年度业绩预告,finalpage/2014-07-14/1200052797.PDF
2014-07-14,太阳鸟：关于全资子公司珠海太阳鸟游艇制造有限公司拟参与竞拍土地使用权的公告,finalpage/2014-07-14/1200052798.PDF
2014-07-14,太阳鸟：第二届监事会第二十一次会议决议公告,finalpage/2014-07-14/1200052799.PDF
2014-07-14,太阳鸟：第二届董事会第二十二次会议决议公告,finalpage/2014-07-14/1200052800.PDF
2014-07-15,太阳鸟：关于全资子公司变更住所地址及法人代表的公告,finalpage/2014-07-15/1200056874.PDF
2014-08-01,太阳鸟：关于控股子公司完成工商登记的公告,finalpage/2014-08-01/1200095742.PDF
2014-08-26,太阳鸟：2014年半年度报告摘要,finalpage/2014-08-26/1200165075.PDF
2014-08-26,太阳鸟：关于2014年半年度报告披露的提示性公告,finalpage/2014-08-26/1200165077.PDF
2014-08-26,太阳鸟：2014年半年度报告,finalpage/2014-08-26/1200165078.PDF
2014-08-26,太阳鸟：独立董事对第二届董事会第二十三次会议相关事项的独立意见,finalpage/2014-08-26/1200165079.PDF
2014-08-29,太阳鸟：关于更换保荐代表人的公告,finalpage/2014-08-29/1200189859.PDF
2014-08-29,太阳鸟：关于参加湖南上市公司投资者网上集体接待日活动的公告,finalpage/2014-08-29/1200189860.PDF
2014-09-05,太阳鸟：关于召开2014年第一次临时股东大会的公告,finalpage/2014-09-05/1200206556.PDF
2014-09-05,太阳鸟：关于控股股东解除质押式回购交易的公告,finalpage/2014-09-05/1200206557.PDF
2014-09-05,太阳鸟：关于股票期权与限制性股票激励计划预留期权授予的公告,finalpage/2014-09-05/1200206558.PDF
2014-09-05,太阳鸟：关联交易决策制度（2014年9月）,finalpage/2014-09-05/1200206559.PDF
2014-09-05,太阳鸟：北京市天银律师事务所关于公司股票期权与限制性股票激励计划预留期权授予的法律意见书,finalpage/2014-09-05/1200206560.PDF
2014-09-05,太阳鸟：监事会对激励对象名单的核查意见,finalpage/2014-09-05/1200206561.PDF
2014-09-05,太阳鸟：接待特定对象调研采访活动管理办法（2014年9月）,finalpage/2014-09-05/1200206562.PDF
2014-09-05,太阳鸟：关于公司股票期权与限制性股票激励计划预留期权授予相关事项的独立意见,finalpage/2014-09-05/1200206563.PDF
2014-09-05,太阳鸟：公司章程修订情况对照表,finalpage/2014-09-05/1200206564.PDF
2014-09-05,太阳鸟：第二届监事会第二十三次会议决议公告,finalpage/2014-09-05/1200206565.PDF
2014-09-05,太阳鸟：第二届董事会第二十四次会议决议公告,finalpage/2014-09-05/1200206566.PDF
2014-09-05,太阳鸟：股票期权与限制性股票激励计划预留期权授予对象名单,finalpage/2014-09-05/1200206567.PDF
2014-09-15,太阳鸟：关于召开2014年第一次临时股东大会的公告（调整后）,finalpage/2014-09-15/1200237154.PDF
2014-09-15,太阳鸟：关于2014年第一次临时股东大会网络投票时间调整公告,finalpage/2014-09-15/1200237155.PDF
2014-09-15,太阳鸟：关于重大事项停牌公告,finalpage/2014-09-15/1200235888.PDF
2014-09-19,太阳鸟：关于重大事项进展及继续停牌公告,finalpage/2014-09-19/1200250002.PDF
2014-09-22,太阳鸟：2014年第一次临时股东大会的法律意见书,finalpage/2014-09-22/1200252490.PDF
2014-09-22,太阳鸟：2014年第一次临时股东大会决议公告,finalpage/2014-09-22/1200252491.PDF
2014-09-25,太阳鸟：关联交易公告,finalpage/2014-09-25/1200262070.PDF
2014-09-25,太阳鸟：减资公告,finalpage/2014-09-25/1200262071.PDF
2014-09-25,太阳鸟：独立董事关于关联交易事前认可意见及独立意见,finalpage/2014-09-25/1200262072.PDF
2014-09-25,太阳鸟：第二届监事会第二十四次会议决议公告,finalpage/2014-09-25/1200262073.PDF
2014-09-25,太阳鸟：第二届董事会第二十五次会议决议公告,finalpage/2014-09-25/1200262074.PDF
2014-09-26,太阳鸟：关于重大事项进展及继续停牌公告,finalpage/2014-09-26/1200265569.PDF
2014-10-08,太阳鸟：非公开发行股票预案披露提示性公告,finalpage/2014-10-08/1200279245.PDF
2014-10-08,太阳鸟：关于非公开发行股票的关联交易公告,finalpage/2014-10-08/1200279246.PDF
2014-10-08,太阳鸟：关于召开2014年第二次临时股东大会的公告,finalpage/2014-10-08/1200279247.PDF
2014-10-08,太阳鸟：复牌公告,finalpage/2014-10-08/1200279248.PDF
2014-10-08,太阳鸟：独立董事关于关联交易等相关事项的事前认可意见及第二届董事会第二十六次会议相关事项的独立意见,finalpage/2014-10-08/1200279249.PDF
2014-10-08,太阳鸟：补选董事的公告,finalpage/2014-10-08/1200279250.PDF
2014-10-08,太阳鸟：2014年度前三季度业绩预告,finalpage/2014-10-08/1200279251.PDF
2014-10-08,太阳鸟：关于实际控制人签订战略合作协议的公告,finalpage/2014-10-08/1200279252.PDF
2014-10-08,太阳鸟：第二届董事会第二十六次会议决议公告,finalpage/2014-10-08/1200279253.PDF
