date,title,url
2017-01-26,太阳鸟：审阅报告,finalpage/2017-01-26/1203059313.PDF
2017-01-26,太阳鸟：成都亚光电子股份有限公司审计报告,finalpage/2017-01-26/1203059314.PDF
2017-01-26,太阳鸟：董事会关于评估机构的独立性、评估假设前提的合理性、评估方法与评估目的的相关性以及评估定价的公允性的说明,finalpage/2017-01-26/1203059315.PDF
2017-01-26,太阳鸟：董事会关于停牌前公司股票价格波动未达到“128号文”第五条相关标准的说明,finalpage/2017-01-26/1203059316.PDF
2017-01-26,太阳鸟：发行股份购买资产并募集配套资金暨关联交易报告书（草案）摘要,finalpage/2017-01-26/1203059317.PDF
2017-01-26,太阳鸟：西部证券股份有限公司关于公司本次重大资产重组前12个月内购买、出售资产的核查意见,finalpage/2017-01-26/1203059318.PDF
2017-01-26,太阳鸟：西部证券股份有限公司在充分尽职调查和内核的基础上出具的承诺,finalpage/2017-01-26/1203059319.PDF
2017-01-26,太阳鸟：发行股份购买资产并募集配套资金暨关联交易报告书（草案）,finalpage/2017-01-26/1203059320.PDF
2017-01-26,太阳鸟：创业板上市公司重大资产重组方案首次披露对照表,finalpage/2017-01-26/1203059321.PDF
2017-01-26,太阳鸟：西部证券股份有限公司关于公司重大资产重组审核分道制的专项核查意见,finalpage/2017-01-26/1203059322.PDF
2017-01-26,太阳鸟：公司与成都亚光电子股份有限公司股东之发行股份购买资产协议（除天通外其他交易对方）,finalpage/2017-01-26/1203059323.PDF
2017-01-26,太阳鸟：公司与成都亚光电子股份有限公司股东之发行股份购买资产协议（与天通）,finalpage/2017-01-26/1203059324.PDF
2017-01-26,太阳鸟：公司与成都亚光电子股份有限公司股东之发行股份购买资产盈利预测补偿协议,finalpage/2017-01-26/1203059325.PDF
2017-01-26,太阳鸟：北京金杜（成都）律师事务所关于公司发行股份购买资产并募集配套资金暨关联交易的法律意见书,finalpage/2017-01-26/1203059326.PDF
2017-01-26,太阳鸟：关于发行股份购买资产并募集配套资金一般风险提示暨暂不复牌公告,finalpage/2017-01-26/1203059304.PDF
2017-01-26,太阳鸟：第三届董事会第二十三次会议决议公告,finalpage/2017-01-26/1203059305.PDF
2017-01-26,太阳鸟：第三届监事会第二十二次会议决议公告,finalpage/2017-01-26/1203059306.PDF
2017-01-26,太阳鸟：独立董事关于公司发行股份购买资产并募集配套资金暨关联交易事项的事前认可意见,finalpage/2017-01-26/1203059307.PDF
2017-01-26,太阳鸟：独立董事关于公司发行股份购买资产并募集配套资金暨关联交易事项的独立意见,finalpage/2017-01-26/1203059308.PDF
2017-01-26,太阳鸟：关于本次重大资产重组前12个月内购买、出售资产的说明,finalpage/2017-01-26/1203059309.PDF
2017-01-26,太阳鸟：关于召开2017年第二次临时股东大会的通知,finalpage/2017-01-26/1203059310.PDF
2017-01-26,太阳鸟：企业价值评估报告,finalpage/2017-01-26/1203059312.PDF
2017-01-26,太阳鸟：2016年年度业绩预告,finalpage/2017-01-26/1203058999.PDF
2017-02-09,太阳鸟：关于重大资产重组事项的进展公告,finalpage/2017-02-09/1203073411.PDF
2017-02-14,太阳鸟：简式权益变动报告书（一）,finalpage/2017-02-14/1203079294.PDF
2017-02-14,太阳鸟：简式权益变动报告书（二）,finalpage/2017-02-14/1203079295.PDF
2017-02-14,太阳鸟：简式权益变动报告书（三）,finalpage/2017-02-14/1203079296.PDF
2017-02-14,太阳鸟：简式权益变动报告书（四）,finalpage/2017-02-14/1203079297.PDF
2017-02-15,太阳鸟：关于公司股票复牌的提示性公告,finalpage/2017-02-15/1203082563.PDF
2017-02-15,太阳鸟：关于发行股份购买资产并募集配套资金暨关联交易报告书修订说明的公告,finalpage/2017-02-15/1203082564.PDF
2017-02-15,太阳鸟：关于召开2017年第二次临时股东大会的提示性公告,finalpage/2017-02-15/1203082565.PDF
2017-02-15,太阳鸟：上海东洲资产评估有限公司关于深圳证券交易所《关于对太阳鸟游艇股份有限公司的重组问询函》回复说明之专项核查意见,finalpage/2017-02-15/1203082566.PDF
2017-02-15,太阳鸟：北京金杜（成都）律师事务所关于深圳证券交易所《关于对太阳鸟游艇股份有限公司的重组问询函》之专项法律意见书,finalpage/2017-02-15/1203082567.PDF
2017-02-15,太阳鸟：发行股份购买资产并募集配套资金暨关联交易报告书（草案）修订稿,finalpage/2017-02-15/1203082568.PDF
2017-02-15,太阳鸟：关于深圳证券交易所《关于对太阳鸟游艇股份有限公司的重组问询函》创业板许可类重组问询函【2017】第9号之回复,finalpage/2017-02-15/1203082569.PDF
2017-02-15,太阳鸟：西部证券股份有限公司关于深圳证券交易所《关于对太阳鸟游艇股份有限公司的重组问询函》之核查意见,finalpage/2017-02-15/1203082570.PDF
2017-02-16,太阳鸟：关于公司股票交易异常波动的公告,finalpage/2017-02-16/1203088410.PDF
2017-02-20,太阳鸟：2017年第二次临时股东大会的法律意见书,finalpage/2017-02-20/1203094574.PDF
2017-02-20,太阳鸟：公司章程（2017年2月）,finalpage/2017-02-20/1203094575.PDF
2017-02-20,太阳鸟：公司章程修订情况说明,finalpage/2017-02-20/1203094576.PDF
2017-02-20,太阳鸟：2017年第二次临时股东大会决议公告,finalpage/2017-02-20/1203094577.PDF
2017-02-28,太阳鸟：关于2016年年度业绩快报的补充公告,finalpage/2017-02-28/1203117351.PDF
2017-02-28,太阳鸟：2016年年度业绩快报,finalpage/2017-02-28/1203116401.PDF
2017-03-01,太阳鸟：关于收到《中国证监会行政许可申请补正通知书》的公告,finalpage/2017-03-01/1203121490.PDF
2017-03-07,太阳鸟：第三届监事会第二十三次会议决议公告,finalpage/2017-03-07/1203138874.PDF
2017-03-07,太阳鸟：独立董事关于调整公司发行股份购买资产并募集配套资金暨关联交易的方案的独立意见,finalpage/2017-03-07/1203138875.PDF
2017-03-07,太阳鸟：独立董事关于调整公司发行股份购买资产并募集配套资金暨关联交易的方案的事前认可意见,finalpage/2017-03-07/1203138876.PDF
2017-03-07,太阳鸟：关于发行股份购买资产并募集配套资金暨关联交易报告书修订说明的公告,finalpage/2017-03-07/1203138877.PDF
2017-03-07,太阳鸟：第三届董事会第二十四次会议决议公告,finalpage/2017-03-07/1203138873.PDF
2017-03-07,太阳鸟：发行股份购买资产并募集配套资金暨关联交易报告书（草案）修订稿,finalpage/2017-03-07/1203138878.PDF
2017-03-07,太阳鸟：发行股份购买资产并募集配套资金暨关联交易报告书（草案）摘要修订稿,finalpage/2017-03-07/1203138879.PDF
2017-03-10,太阳鸟：发行股份购买资产并募集配套资金暨关联交易报告书（草案）修订稿,finalpage/2017-03-10/1203148342.PDF
2017-03-10,太阳鸟：发行股份购买资产并募集配套资金暨关联交易报告书（草案）摘要修订稿,finalpage/2017-03-10/1203148343.PDF
2017-03-10,太阳鸟：关于召开2017年第三次临时股东大会的通知,finalpage/2017-03-10/1203148344.PDF
2017-03-10,太阳鸟：关于为全资子公司长沙太阳鸟游艇有限责任公司提供担保的公告,finalpage/2017-03-10/1203148345.PDF
2017-03-10,太阳鸟：关于向全资子公司长沙太阳鸟游艇有限责任公司增资的公告,finalpage/2017-03-10/1203148346.PDF
2017-03-10,太阳鸟：关于发行股份购买资产并募集配套资金暨关联交易报告书修订说明的公告,finalpage/2017-03-10/1203148347.PDF
2017-03-10,太阳鸟：独立董事关于第三届董事会第二十五次会议相关事项的独立意见,finalpage/2017-03-10/1203148348.PDF
2017-03-10,太阳鸟：第三届董事会第二十五次会议决议公告,finalpage/2017-03-10/1203148349.PDF
2017-03-10,太阳鸟：第三届监事会第二十四次会议决议公告,finalpage/2017-03-10/1203148350.PDF
2017-03-14,太阳鸟：简式权益变动报告书（一）,finalpage/2017-03-14/1203154031.PDF
2017-03-14,太阳鸟：简式权益变动报告书（二）,finalpage/2017-03-14/1203154032.PDF
2017-03-14,太阳鸟：简式权益变动报告书（三）,finalpage/2017-03-14/1203154033.PDF
2017-03-14,太阳鸟：简式权益变动报告书（四）,finalpage/2017-03-14/1203154034.PDF
2017-03-17,太阳鸟：关于控股股东部分股份解除质押及进行股票质押式回购交易的公告,finalpage/2017-03-17/1203172962.PDF
2017-03-24,太阳鸟：关于召开2017年第三次临时股东大会的提示性公告,finalpage/2017-03-24/1203194568.PDF
2017-03-27,太阳鸟：2017年第三次临时股东大会决议公告,finalpage/2017-03-27/1203210891.PDF
2017-03-27,太阳鸟：2017年第三次临时股东大会的法律意见书,finalpage/2017-03-27/1203210892.PDF
2017-03-30,太阳鸟：关于收到《中国证监会行政许可申请受理通知书》的公告,finalpage/2017-03-30/1203235812.PDF
2017-03-31,太阳鸟：关于控股股东进行股票质押式回购交易的公告,finalpage/2017-03-31/1203244623.PDF
2017-04-06,太阳鸟：关于高级管理人员辞职的公告,finalpage/2017-04-06/1203257816.PDF
2017-04-07,太阳鸟：2017年第一季度业绩预告,finalpage/2017-04-07/1203263493.PDF
2017-04-10,太阳鸟：关于子公司取得《中标通知书》的公告,finalpage/2017-04-10/1203275312.PDF
2017-04-12,太阳鸟：关于子公司取得《中标通知书》的公告,finalpage/2017-04-12/1203290517.PDF
2017-04-24,太阳鸟：关于收到《中国证监会行政许可项目审查一次反馈意见通知书》的公告,finalpage/2017-04-24/1203362079.PDF
2017-04-25,太阳鸟：关于变更2016年年度报告披露时间的公告,finalpage/2017-04-25/1203380749.PDF
2017-04-26,太阳鸟：关于益阳中海船舶有限责任公司业绩承诺完成情况的鉴证报告,finalpage/2017-04-26/1203383995.PDF
2017-04-26,太阳鸟：控股股东及其他关联方资金占用情况的专项审计说明,finalpage/2017-04-26/1203383996.PDF
2017-04-26,太阳鸟：募集资金年度存放与使用情况鉴证报告,finalpage/2017-04-26/1203383997.PDF
2017-04-26,太阳鸟：2017年第一季度报告披露提示性公告,finalpage/2017-04-26/1203383998.PDF
2017-04-26,太阳鸟：广州证券股份有限公司关于公司2016年度募集资金存放与使用情况的核查意见,finalpage/2017-04-26/1203383999.PDF
2017-04-26,太阳鸟：广州证券股份有限公司关于公司发行股份购买资产并募集配套资金暨关联交易之2016年度业绩承诺实现情况之核查意见,finalpage/2017-04-26/1203384000.PDF
2017-04-26,太阳鸟：2016年年度报告披露提示性公告,finalpage/2017-04-26/1203384001.PDF
2017-04-26,太阳鸟：2016年年度报告摘要,finalpage/2017-04-26/1203384002.PDF
2017-04-26,太阳鸟：第三届董事会二十六次会议决议公告,finalpage/2017-04-26/1203384004.PDF
2017-04-26,太阳鸟：2016年年度报告,finalpage/2017-04-26/1203384005.PDF
2017-04-26,太阳鸟：2016年度监事会工作报告,finalpage/2017-04-26/1203384006.PDF
2017-04-26,太阳鸟：2016年度总经理工作报告,finalpage/2017-04-26/1203384007.PDF
2017-04-26,太阳鸟：2016年度内部控制自我评价报告,finalpage/2017-04-26/1203384008.PDF
2017-04-26,太阳鸟：2016年度财务决算报告,finalpage/2017-04-26/1203384009.PDF
2017-04-26,太阳鸟：关于举行2016年年度报告网上说明会的通知,finalpage/2017-04-26/1203384010.PDF
2017-04-26,太阳鸟：关于公司总经理辞职及聘任新总经理的公告,finalpage/2017-04-26/1203384011.PDF
2017-04-26,太阳鸟：关于召开2016年年度股东大会的通知,finalpage/2017-04-26/1203384012.PDF
2017-04-26,太阳鸟：关于续聘天健会计师事务所为公司审计机构的公告,finalpage/2017-04-26/1203384013.PDF
2017-04-26,太阳鸟：独立董事李荻辉2016年度述职报告,finalpage/2017-04-26/1203384014.PDF
2017-04-26,太阳鸟：独立董事李国强2016年度述职报告,finalpage/2017-04-26/1203384015.PDF
2017-04-26,太阳鸟：独立董事颜爱民2016年度述职报告,finalpage/2017-04-26/1203384016.PDF
2017-04-26,太阳鸟：关于控股股东为公司申请银行授信提供关联担保的公告,finalpage/2017-04-26/1203384017.PDF
2017-04-26,太阳鸟：关于公司2017年日常关联交易计划的公告,finalpage/2017-04-26/1203384018.PDF
2017-04-26,太阳鸟：关于向有关商业银行申请综合授信额度的公告,finalpage/2017-04-26/1203384019.PDF
2017-04-26,太阳鸟：关于益阳中海船舶有限责任公司2016年度业绩承诺实现情况的专项说明,finalpage/2017-04-26/1203384020.PDF
2017-04-26,太阳鸟：独立董事关于第三届董事会第二十六次会议审议事项的事前认可意见及独立意见,finalpage/2017-04-26/1203384021.PDF
2017-04-26,太阳鸟：2016年度董事会工作报告,finalpage/2017-04-26/1203384022.PDF
2017-04-26,太阳鸟：2016年年度审计报告,finalpage/2017-04-26/1203384023.PDF
2017-04-26,太阳鸟：2017年第一季度报告全文,finalpage/2017-04-26/1203384024.PDF
2017-04-26,太阳鸟：第三届监事会第二十五次会议决议公告,finalpage/2017-04-26/1203384026.PDF
2017-04-26,太阳鸟：关于2016年度不进行利润分配的专项说明,finalpage/2017-04-26/1203384027.PDF
2017-05-02,太阳鸟：关于子公司中标项目的后续进展公告,finalpage/2017-05-02/1203455663.PDF
2017-05-08,太阳鸟：广州证券股份有限公司关于公司发行股份购买资产并募集配套资金暨关联交易之2016年度持续督导报告,finalpage/2017-05-08/1203484724.PDF
2017-05-15,太阳鸟：关于召开2016年年度股东大会的提示性公告,finalpage/2017-05-15/1203519399.PDF
2017-05-17,太阳鸟：2016年年度股东大会决议公告,finalpage/2017-05-17/1203531504.PDF
2017-05-17,太阳鸟：2016年度股东大会的法律意见书,finalpage/2017-05-17/1203531505.PDF
2017-05-23,太阳鸟：关于公司实际控制人及其配偶拟增持公司股份的提示性公告,finalpage/2017-05-23/1203561034.PDF
2017-05-26,太阳鸟：第三届董事会第二十七次会议决议公告,finalpage/2017-05-26/1203573290.PDF
2017-05-26,太阳鸟：第三届监事会第二十六次会议决议公告,finalpage/2017-05-26/1203573291.PDF
2017-05-26,太阳鸟：北京金杜（成都）律师事务所关于公司发行股份购买资产并募集配套资金暨关联交易的补充法律意见书（二）,finalpage/2017-05-26/1203573292.PDF
2017-05-26,太阳鸟：上海东洲资产评估有限公司关于公司发行股份购买资产并募集配套资金暨关联交易申报材料之证监会反馈意见回复,finalpage/2017-05-26/1203573293.PDF
2017-05-26,太阳鸟：成都亚光电子股份有限公司审计报告,finalpage/2017-05-26/1203573294.PDF
2017-05-26,太阳鸟：审阅报告,finalpage/2017-05-26/1203573295.PDF
2017-05-26,太阳鸟：发行股份购买资产并募集配套资金暨关联交易申报材料之证监会反馈意见回复,finalpage/2017-05-26/1203573296.PDF
2017-05-26,太阳鸟：西部证券股份有限公司关于公司发行股份购买资产并募集配套资金暨关联交易申报材料之证监会反馈意见回复之专项核查意见,finalpage/2017-05-26/1203573297.PDF
2017-05-26,太阳鸟：独立董事关于调整公司发行股份购买资产并募集配套资金暨关联交易的方案的独立意见,finalpage/2017-05-26/1203573298.PDF
2017-05-26,太阳鸟：独立董事关于调整公司发行股份购买资产并募集配套资金暨关联交易的方案的事前认可意见,finalpage/2017-05-26/1203573299.PDF
2017-05-26,太阳鸟：关于公司发行股份购买资产并募集配套资金反馈意见中有关财务事项的说明,finalpage/2017-05-26/1203573300.PDF
2017-06-08,太阳鸟：第三届董事会第二十八次会议决议公告,finalpage/2017-06-08/1203602841.PDF
2017-06-08,太阳鸟：第三届监事会第二十七次会议决议公告,finalpage/2017-06-08/1203602842.PDF
2017-06-08,太阳鸟：独立董事关于调整公司发行股份购买资产并募集配套资金暨关联交易的方案的独立意见,finalpage/2017-06-08/1203602843.PDF
2017-06-08,太阳鸟：独立董事关于调整公司发行股份购买资产并募集配套资金暨关联交易的方案的事前认可意见,finalpage/2017-06-08/1203602844.PDF
2017-06-12,太阳鸟：关于控股股东进行股票质押式回购交易的公告,finalpage/2017-06-12/1203610671.PDF
2017-06-16,太阳鸟：关于收到《中国证监会行政许可项目审查二次反馈意见通知书》的公告,finalpage/2017-06-16/1203626000.PDF
2017-07-03,太阳鸟：第三届董事会第二十九次会议决议公告,finalpage/2017-07-03/1203675992.PDF
2017-07-03,太阳鸟：第三届监事会第二十八次会议决议公告,finalpage/2017-07-03/1203675993.PDF
2017-07-03,太阳鸟：关于控股股东部分股份解除质押及进行股票质押式回购交易的公告,finalpage/2017-07-03/1203675994.PDF
2017-07-03,太阳鸟：独立董事关于调整公司发行股份购买资产并募集配套资金暨关联交易的方案的事前认可意见,finalpage/2017-07-03/1203675995.PDF
2017-07-03,太阳鸟：独立董事关于调整公司发行股份购买资产并募集配套资金暨关联交易的方案的独立意见,finalpage/2017-07-03/1203675996.PDF
2017-07-03,太阳鸟：关于公司发行股份购买资产并募集配套资金第二次反馈意见中有关财务事项的说明,finalpage/2017-07-03/1203675997.PDF
2017-07-03,太阳鸟：北京金杜（成都）律师事务所关于公司发行股份购买资产并募集配套资金暨关联交易的补充法律意见书（三）,finalpage/2017-07-03/1203675998.PDF
2017-07-03,太阳鸟：西部证券股份有限公司关于公司发行股份购买资产并募集配套资金暨关联交易申报材料之证监会二次反馈意见回复之专项核查意见,finalpage/2017-07-03/1203675999.PDF
2017-07-03,太阳鸟：发行股份购买资产并募集配套资金暨关联交易申报材料之证监会二次反馈意见回复,finalpage/2017-07-03/1203676000.PDF
2017-07-07,太阳鸟：关于控股股东部分股份进行质押的公告,finalpage/2017-07-07/1203690206.PDF
2017-07-10,太阳鸟：关于控股股东股票质押式回购交易的公告,finalpage/2017-07-10/1203691571.PDF
2017-07-11,太阳鸟：关于获得政府补贴的公告,finalpage/2017-07-11/1203693756.PDF
2017-07-13,太阳鸟：2017年半年度业绩预告,finalpage/2017-07-13/1203704427.PDF
2017-07-13,太阳鸟：关于中国证监会上市公司并购重组审核委员会审核公司资产重组事项的停牌公告,finalpage/2017-07-13/1203701597.PDF
2017-07-17,太阳鸟：关于控股股东股票质押式回购交易的公告,finalpage/2017-07-17/1203709650.PDF
2017-07-20,太阳鸟：关于资产重组事项获得中国证监会并购重组委审核有条件通过暨公司股票复牌的公告,finalpage/2017-07-20/1203715602.PDF
2017-08-07,太阳鸟：成都亚光电子股份有限公司审计报告,finalpage/2017-08-07/1203769308.PDF
2017-08-07,太阳鸟：审阅报告,finalpage/2017-08-07/1203769309.PDF
2017-08-14,太阳鸟：关于控股股东进行股票质押式回购交易及部分股份质押的公告,finalpage/2017-08-14/1203795532.PDF
2017-08-15,太阳鸟：广州证券股份有限公司关于公司发行股份购买资产并募集配套资金暨关联交易之限售股解禁的核查意见,finalpage/2017-08-15/1203795885.PDF
2017-08-15,太阳鸟：关于非公开发行限售股份上市流通的提示性公告,finalpage/2017-08-15/1203795886.PDF
2017-08-29,太阳鸟：2017年半年度报告披露提示性公告,finalpage/2017-08-29/1203889493.PDF
2017-08-29,太阳鸟：2017年半年度报告摘要,finalpage/2017-08-29/1203889494.PDF
2017-08-29,太阳鸟：2017年半年度报告,finalpage/2017-08-29/1203889496.PDF
2017-08-29,太阳鸟：关于2017年半年度募集资金存放与使用情况的专项报告,finalpage/2017-08-29/1203889497.PDF
2017-08-29,太阳鸟：独立董事关于第三届董事会第三十次会议审议事项的独立意见,finalpage/2017-08-29/1203889498.PDF
2017-08-29,太阳鸟：第三届董事会第三十次会议决议公告,finalpage/2017-08-29/1203889499.PDF
2017-08-29,太阳鸟：第三届监事会第二十九次会议决议公告,finalpage/2017-08-29/1203889500.PDF
2017-08-30,太阳鸟：关于控股股东部分股份解除质押的公告,finalpage/2017-08-30/1203907526.PDF
2017-09-05,太阳鸟：关于子公司中标的公告,finalpage/2017-09-05/1203938599.PDF
2017-09-06,太阳鸟：关于控股股东部分股份进行质押的公告,finalpage/2017-09-06/1203941844.PDF
2017-09-07,太阳鸟：关于参加2017年湖南辖区上市公司投资者网上接待日活动的公告,finalpage/2017-09-07/1203956076.PDF
2017-09-12,太阳鸟：关于控股股东股票质押式回购交易的公告,finalpage/2017-09-12/1203967962.PDF
2017-09-18,太阳鸟：关于发行股份购买资产并募集配套资金暨关联交易事项获得中国证监会核准批文的公告,finalpage/2017-09-18/1203981731.PDF
2017-09-18,太阳鸟：关于发行股份购买资产并募集配套资金暨关联交易报告书（草案）及其摘要的修订说明公告,finalpage/2017-09-18/1203981732.PDF
2017-09-18,太阳鸟：发行股份购买资产并募集配套资金暨关联交易报告书（草案）摘要修订稿,finalpage/2017-09-18/1203981733.PDF
2017-09-18,太阳鸟：西部证券股份有限公司关于公司发行股份购买资产并募集配套资金暨关联交易之独立财务顾问报告,finalpage/2017-09-18/1203981735.PDF
2017-09-18,太阳鸟：发行股份购买资产并募集配套资金暨关联交易报告书（草案）修订稿,finalpage/2017-09-18/1203981734.PDF
2017-09-22,太阳鸟：关于公司控股股东非公开发行可交换债券获得深圳证券交易所无异议函的公告,finalpage/2017-09-22/1203995948.PDF
2017-09-22,太阳鸟：关于全资孙公司沅江中海船舶工程有限公司完成工商变更登记的公告,finalpage/2017-09-22/1203995949.PDF
2017-09-25,太阳鸟：关于全资子公司获得政府补贴的公告,finalpage/2017-09-25/1203998976.PDF
2017-09-27,太阳鸟：西部证券股份有限公司关于公司发行股份购买资产并募集配套资金暨关联交易标的资产过户情况之独立财务顾问核查意见,finalpage/2017-09-27/1204004767.PDF
2017-09-27,太阳鸟：北京金杜（成都）律师事务所关于公司发行股份购买资产并募集配套资金暨关联交易之资产交割的法律意见书,finalpage/2017-09-27/1204004768.PDF
2017-09-27,太阳鸟：关于发行股份购买资产并募集配套资金暨关联交易标的资产过户完成的公告,finalpage/2017-09-27/1204004769.PDF
2017-10-10,太阳鸟：关于子公司中标项目的后续进展公告,finalpage/2017-10-10/1204024336.PDF
2017-10-13,太阳鸟：2017年前三季度业绩预告,finalpage/2017-10-13/1204032937.PDF
2017-10-20,太阳鸟：关于重大资产重组相关方承诺事项的公告,finalpage/2017-10-20/1204053672.PDF
2017-10-20,太阳鸟：发行股份购买资产并募集配套资金暨关联交易之非公开发行股票购买资产股票发行情况暨上市公告书（摘要）,finalpage/2017-10-20/1204053673.PDF
2017-10-20,太阳鸟：发行股份购买资产并募集配套资金暨关联交易之非公开发行股票购买资产股票发行情况暨上市公告书,finalpage/2017-10-20/1204053674.PDF
2017-10-20,太阳鸟：北京金杜（成都）律师事务所关于公司发行股份购买资产并募集配套资金暨关联交易之交易实施情况的法律意见书,finalpage/2017-10-20/1204053675.PDF
2017-10-20,太阳鸟：董事、监事和高级管理人员持股情况变动的报告,finalpage/2017-10-20/1204053676.PDF
2017-10-20,太阳鸟：西部证券股份有限公司关于公司发行股份购买资产并募集配套资金暨关联交易实施情况之独立财务顾问核查意见,finalpage/2017-10-20/1204053677.PDF
2017-10-23,太阳鸟：关于实际控制人进行股票质押式回购交易的公告,finalpage/2017-10-23/1204060058.PDF
2017-10-28,太阳鸟：关于2017年第三季度报告披露的提示性公告,finalpage/2017-10-28/1204088550.PDF
2017-10-28,太阳鸟：2017年第三季度报告全文,finalpage/2017-10-28/1204088552.PDF
2017-10-28,太阳鸟：第三届董事会第三十一次会议决议公告,finalpage/2017-10-28/1204088553.PDF
2017-10-28,太阳鸟：第三届监事会第三十次会议决议公告,finalpage/2017-10-28/1204088554.PDF
2017-10-28,太阳鸟：关于为子公司提供担保的公告,finalpage/2017-10-28/1204088555.PDF
2017-10-28,太阳鸟：关于召开2017年第四次临时股东大会的通知,finalpage/2017-10-28/1204088556.PDF
2017-10-28,太阳鸟：关于控股股东股票质押式回购交易的公告,finalpage/2017-10-28/1204088557.PDF
2017-10-28,太阳鸟：关于子公司开展融资租赁业务暨关联交易的公告,finalpage/2017-10-28/1204088558.PDF
2017-10-28,太阳鸟：独立董事关于第三届董事会第三十一次会议相关事项的独立意见,finalpage/2017-10-28/1204088559.PDF
2017-11-07,太阳鸟：关于控股股东部分股份进行质押的公告,finalpage/2017-11-07/1204122034.PDF
2017-11-10,太阳鸟：关于召开2017年第四次临时股东大会的提示性公告,finalpage/2017-11-10/1204131603.PDF
