date,title,url
2010-09-03,太阳鸟：首次公开发行股票并在创业板上市初步询价及推介公告,finalpage/2010-09-03/58395852.PDF
2010-09-03,太阳鸟：首次公开发行股票并在创业板上市提示公告,finalpage/2010-09-03/58395855.PDF
2010-09-03,太阳鸟：华泰联合证券有限责任公司关于公司首次公开发行股票并在创业板上市证券发行保荐书,finalpage/2010-09-03/58395857.PDF
2010-09-03,太阳鸟：华泰联合证券有限责任公司关于公司首次公开发行股票并在创业板上市证券发行保荐工作报告,finalpage/2010-09-03/58395859.PDF
2010-09-03,太阳鸟：关于公司设立以来股本演变情况的说明及董事、监事、高级管理人员的确认意见,finalpage/2010-09-03/58395864.PDF
2010-09-03,太阳鸟：控股股东、实际控制人对招股说明书的确认意见,finalpage/2010-09-03/58395865.PDF
2010-09-03,太阳鸟：首次公开发行股票并在创业板上市招股意向书,finalpage/2010-09-03/58395866.PDF
2010-09-03,太阳鸟：中国证监会关于核准公司首次公开发行股票并在创业板上市的批复,finalpage/2010-09-03/58395868.PDF
2010-09-03,太阳鸟：2009年度股东大会决议,finalpage/2010-09-03/58395870.PDF
2010-09-03,太阳鸟：第一届董事会第九次会议决议,finalpage/2010-09-03/58395876.PDF
2010-09-03,太阳鸟：北京市天银律师事务所关于公司首次公开发行股票并在创业板上市的补充法律意见书（八）,finalpage/2010-09-03/58395883.PDF
2010-09-03,太阳鸟：北京市天银律师事务所关于公司首次公开发行股票并在创业板上市的补充法律意见书（七）,finalpage/2010-09-03/58395897.PDF
2010-09-03,太阳鸟：北京市天银律师事务所关于公司首次公开发行股票并在创业板上市的补充法律意见书（六）,finalpage/2010-09-03/58395898.PDF
2010-09-03,太阳鸟：北京市天银律师事务所关于公司首次公开发行股票并在创业板上市的补充法律意见书（五）,finalpage/2010-09-03/58395899.PDF
2010-09-03,太阳鸟：北京市天银律师事务所关于公司首次公开发行股票并在创业板上市的补充法律意见书（四）,finalpage/2010-09-03/58395909.PDF
2010-09-03,太阳鸟：北京市天银律师事务所关于公司首次公开发行股票并在创业板上市的补充法律意见书（三）,finalpage/2010-09-03/58395911.PDF
2010-09-03,太阳鸟：北京市天银律师事务所关于公司首次公开发行股票并在创业板上市的补充法律意见书（二）,finalpage/2010-09-03/58395913.PDF
2010-09-03,太阳鸟：北京市天银律师事务所关于公司首次公开发行股票并在创业板上市的补充法律意见书（一）,finalpage/2010-09-03/58395916.PDF
2010-09-03,太阳鸟：北京市天银律师事务所关于公司首次公开发行股票并在创业板上市的法律意见书,finalpage/2010-09-03/58395919.PDF
2010-09-03,太阳鸟：北京市天银律师事务所关于公司首次公开发行股票并在创业板上市的律师工作报告,finalpage/2010-09-03/58395921.PDF
2010-09-03,太阳鸟：关于公司最近三年及一期非经常性损益的鉴证报告,finalpage/2010-09-03/58395924.PDF
2010-09-03,太阳鸟：关于公司内部控制的鉴证报告,finalpage/2010-09-03/58395928.PDF
2010-09-03,太阳鸟：公司章程（草案）,finalpage/2010-09-03/58395960.PDF
2010-09-03,太阳鸟：三年一期审计报告,finalpage/2010-09-03/58395985.PDF
2010-09-09,太阳鸟：首次公开发行股票并在创业板上市网上路演公告,finalpage/2010-09-09/58417637.PDF
2010-09-10,太阳鸟：首次公开发行股票并在创业板上市招股说明书,finalpage/2010-09-10/58423070.PDF
2010-09-10,太阳鸟：首次公开发行股票并在创业板上市投资风险特别公告,finalpage/2010-09-10/58423071.PDF
2010-09-10,太阳鸟：首次公开发行股票并在创业板上市发行公告,finalpage/2010-09-10/58423072.PDF
2010-09-15,太阳鸟：首次公开发行股票并在创业板上市网下配售结果公告,finalpage/2010-09-15/58440154.PDF
2010-09-15,太阳鸟：首次公开发行股票并在创业板上市网上定价发行申购情况及中签率公告,finalpage/2010-09-15/58440156.PDF
2010-09-16,太阳鸟：首次公开发行股票并在创业板上市网上定价发行摇号中签结果公告,finalpage/2010-09-16/58444472.PDF
2010-09-27,太阳鸟：首次公开发行股票并在创业板上市之上市公告书,finalpage/2010-09-27/58466367.PDF
2010-09-27,太阳鸟：首次公开发行股票并在创业板上市公告书提示性公告,finalpage/2010-09-27/58466373.PDF
2010-09-27,太阳鸟：华泰联合证券有限责任公司关于公司股票上市保荐书,finalpage/2010-09-27/58466376.PDF
2010-09-27,太阳鸟：北京市天银律师事务所关于公司首次公开发行股票于深圳证券交易所创业板上市的法律意见书,finalpage/2010-09-27/58466380.PDF
2010-09-27,太阳鸟：公司章程（草案）,finalpage/2010-09-27/58466386.PDF
2010-09-27,太阳鸟：2009年度股东大会决议,finalpage/2010-09-27/58466444.PDF
2010-10-20,太阳鸟：关于拟订重大合同的公告,finalpage/2010-10-20/58543121.PDF
2010-10-22,太阳鸟：股票交易异常波动公告,finalpage/2010-10-22/58554378.PDF
2010-10-27,太阳鸟：2010年第三季度报告正文,finalpage/2010-10-27/58579328.PDF
2010-10-27,太阳鸟：2010年第三季度报告全文,finalpage/2010-10-27/58579329.PDF
2010-10-27,太阳鸟：公司章程（2010年10月）,finalpage/2010-10-27/58579330.PDF
2010-10-27,太阳鸟：华泰联合证券有限责任公司关于公司使用部分主营业务相关的运营资金永久补充流动资金的核查意见,finalpage/2010-10-27/58579331.PDF
2010-10-27,太阳鸟：关于使用部分主营业务相关的运营资金永久补充流动资金的公告,finalpage/2010-10-27/58579332.PDF
2010-10-27,太阳鸟：关于签署募集资金三方监管协议的公告,finalpage/2010-10-27/58579334.PDF
2010-10-27,太阳鸟：独立董事关于使用部分主营业务相关的运营资金永久补充流动资金的独立董事意见的公告,finalpage/2010-10-27/58579335.PDF
2010-10-27,太阳鸟：第一届监事会第七次会议决议公告,finalpage/2010-10-27/58579336.PDF
2010-10-27,太阳鸟：第一届董事会第十四次会议决议公告,finalpage/2010-10-27/58579338.PDF
2010-10-29,太阳鸟：关于完成工商变更登记的公告,finalpage/2010-10-29/58600129.PDF
2010-11-08,太阳鸟：关于媒体报告的澄清公告,finalpage/2010-11-08/58639053.PDF
2010-12-06,太阳鸟：第一届董事会第十四次会议决议公告,finalpage/2010-12-06/58750010.PDF
2010-12-06,太阳鸟：更正公告,finalpage/2010-12-06/58750013.PDF
2010-12-06,太阳鸟：关于召开2010年第一次临时股东大会的通知,finalpage/2010-12-06/58750014.PDF
2010-12-17,太阳鸟：重大合同进展公告,finalpage/2010-12-17/58798099.PDF
2010-12-23,太阳鸟：2010年第一次临时股东大会的法律意见书,finalpage/2010-12-23/58816004.PDF
2010-12-23,太阳鸟：2010年第一次临时股东大会决议公告,finalpage/2010-12-23/58816005.PDF
2010-12-27,太阳鸟：关于网下配售股份上市流通的提示性公告,finalpage/2010-12-27/58833310.PDF
2011-02-25,太阳鸟：2010年度业绩快报,finalpage/2011-02-25/59048114.PDF
2011-03-29,太阳鸟：关于公司2010年年报延迟披露及股票停牌的公告,finalpage/2011-03-29/59190196.PDF
2011-03-30,太阳鸟：2010年度内部控制的自我评价报告的公告,finalpage/2011-03-30/59199054.PDF
2011-03-30,太阳鸟：关于年度募集资金存放与使用情况的专项报告,finalpage/2011-03-30/59199055.PDF
2011-03-30,太阳鸟：关于董事辞职的公告,finalpage/2011-03-30/59199056.PDF
2011-03-30,太阳鸟：关于主营业务相关的运营资金使用计划的公告,finalpage/2011-03-30/59199057.PDF
2011-03-30,太阳鸟：以募集资金置换预先已投入募集资金投资项目自筹资金事项的公告,finalpage/2011-03-30/59199058.PDF
2011-03-30,太阳鸟：独立董事2010年度述职报告（杨新发）,finalpage/2011-03-30/59199059.PDF
2011-03-30,太阳鸟：独立董事2010年度述职报告（欧阳润平）,finalpage/2011-03-30/59199060.PDF
2011-03-30,太阳鸟：独立董事2010年度述职报告（吴建敏）,finalpage/2011-03-30/59199061.PDF
2011-03-30,太阳鸟：独立董事对第一届董事会第十六次会议相关事项的独立意见,finalpage/2011-03-30/59199062.PDF
2011-03-30,太阳鸟：关于加强上市公司治理专项活动自查事项报告,finalpage/2011-03-30/59199063.PDF
2011-03-30,太阳鸟：2010年年度报告摘要,finalpage/2011-03-30/59199064.PDF
2011-03-30,太阳鸟：2010年年度审计报告,finalpage/2011-03-30/59199066.PDF
2011-03-30,太阳鸟：第一届董事会第十六次会议决议公告,finalpage/2011-03-30/59199067.PDF
2011-03-30,太阳鸟：关于召开2010年股东大会的公告,finalpage/2011-03-30/59199068.PDF
2011-03-30,太阳鸟：第一届监事会第八次会议决议公告,finalpage/2011-03-30/59199069.PDF
2011-03-30,太阳鸟：2010年年度报告,finalpage/2011-03-30/59199070.PDF
2011-03-30,太阳鸟：关于公司内部控制的鉴证报告,finalpage/2011-03-30/59199071.PDF
2011-03-30,太阳鸟：华泰联合证券有限责任公司关于公司主营业务相关的运营资金使用计划之专项核查意见,finalpage/2011-03-30/59199072.PDF
2011-03-30,太阳鸟：华泰联合证券有限责任公司关于公司以募集资金置换预先已投入募集资金投资项目自筹资金事项之专项核查意见,finalpage/2011-03-30/59199073.PDF
2011-03-30,太阳鸟：华泰联合证券有限责任公司关于公司内部控制自我评价报告的核查意见,finalpage/2011-03-30/59199074.PDF
2011-03-30,太阳鸟：华泰联合证券有限责任公司关于公司募集资金年度使用情况的专项核查意见,finalpage/2011-03-30/59199075.PDF
2011-03-30,太阳鸟：关于公司年度募集资金存放与使用情况鉴证报告,finalpage/2011-03-30/59199076.PDF
2011-03-30,太阳鸟：控股股东及其他关联方资金占用情况的专项审计说明,finalpage/2011-03-30/59199077.PDF
2011-03-30,太阳鸟：关于公司以自筹资金预先投入募投项目的鉴证报告,finalpage/2011-03-30/59199078.PDF
2011-04-08,太阳鸟：华泰联合证券有限责任公司关于公司持续督导期间跟踪报告,finalpage/2011-04-08/59240286.PDF
2011-04-12,太阳鸟：关于增加2010年年度股东大会临时提案的公告,finalpage/2011-04-12/59252698.PDF
2011-04-21,太阳鸟：2010年年度股东大会决议公告,finalpage/2011-04-21/59304218.PDF
2011-04-21,太阳鸟：2010年度股东大会的法律意见书,finalpage/2011-04-21/59304219.PDF
2011-04-25,太阳鸟：关于举行2010年度业绩说明会的公告,finalpage/2011-04-25/59335125.PDF
2011-04-26,太阳鸟：2011年第一季度报告正文,finalpage/2011-04-26/59336686.PDF
2011-04-26,太阳鸟：2011年第一季度报告全文,finalpage/2011-04-26/59336688.PDF
2011-05-07,太阳鸟：2010年度权益分派实施公告,finalpage/2011-05-07/59396527.PDF
2011-05-24,太阳鸟：关于取得实用新型专利证书、外观设计专利证书、商标注册证书的公告,finalpage/2011-05-24/59465827.PDF
2011-05-30,太阳鸟：关于公司商标被认定为中国驰名商标的公告,finalpage/2011-05-30/59493294.PDF
2011-08-01,太阳鸟：第一届董事会第十八次会议决议公告,finalpage/2011-08-01/59756424.PDF
2011-08-01,太阳鸟：关于独立董事辞职的公告,finalpage/2011-08-01/59756425.PDF
2011-08-01,太阳鸟：第一届监事会第十次会议决议公告,finalpage/2011-08-01/59756426.PDF
2011-08-01,太阳鸟：关于主营业务相关的运营资金使用计划的公告,finalpage/2011-08-01/59756427.PDF
2011-08-01,太阳鸟：华泰联合证券有限责任公司关于公司主营业务相关的运营资金使用计划之专项核查意见,finalpage/2011-08-01/59756428.PDF
2011-08-01,太阳鸟：独立董事对第一届董事会第十八次会议相关事项的独立意见,finalpage/2011-08-01/59756429.PDF
2011-08-01,太阳鸟：关于召开2011年第一次临时股东大会的公告,finalpage/2011-08-01/59756430.PDF
2011-08-01,太阳鸟：外部信息使用人管理制度（2011年8月）,finalpage/2011-08-01/59756431.PDF
2011-08-01,太阳鸟：审计委员会年报工作规程（2011年8月）,finalpage/2011-08-01/59756432.PDF
2011-08-01,太阳鸟：年报重大差错责任追究制度（2011年8月）,finalpage/2011-08-01/59756433.PDF
2011-08-01,太阳鸟：接待特定对象调研采访活动管理办法（2011年8月）,finalpage/2011-08-01/59756434.PDF
2011-08-01,太阳鸟：珠海太阳鸟游艇制造有限公司复合材料游艇扩能建设项目可行性研究报告,finalpage/2011-08-01/59756435.PDF
2011-08-01,太阳鸟：防范控股股东及关联方占用上市公司资金的管理办法（2011年8月）,finalpage/2011-08-01/59756436.PDF
2011-08-01,太阳鸟：使用部分主营业务相关的运营资金对全资子公司普兰帝（香港）游艇有限公司增资的可行性研究报告,finalpage/2011-08-01/59756437.PDF
2011-08-02,太阳鸟：独立董事候选人声明（李荻辉）,finalpage/2011-08-02/59762454.PDF
2011-08-02,太阳鸟：独立董事提名人声明,finalpage/2011-08-02/59762455.PDF
2011-08-18,太阳鸟：关于完成工商变更登记的公告,finalpage/2011-08-18/59837963.PDF
2011-08-23,太阳鸟：2011年第一次临时股东大会决议公告,finalpage/2011-08-23/59855303.PDF
2011-08-23,太阳鸟：2011年第一次临时股东大会的法律意见书,finalpage/2011-08-23/59855304.PDF
2011-08-24,太阳鸟：2011年半年度报告摘要,finalpage/2011-08-24/59861714.PDF
2011-08-24,太阳鸟：2011年半年度报告,finalpage/2011-08-24/59861715.PDF
2011-08-24,太阳鸟：独立董事关于控股股东及其他关联方占用公司资金、公司对外担保情况的专项说明和独立意见,finalpage/2011-08-24/59861716.PDF
2011-09-09,太阳鸟：华泰联合证券有限责任公司关于公司持续督导期间跟踪报告,finalpage/2011-09-09/59945960.PDF
2011-09-26,太阳鸟：华泰联合证券有限责任公司关于公司限售股份上市流通事项的保荐意见,finalpage/2011-09-26/60002903.PDF
2011-09-26,太阳鸟：关于限售股份上市流通提示性公告,finalpage/2011-09-26/60002904.PDF
2011-09-28,太阳鸟：第一届董事会第二十次会议决议公告,finalpage/2011-09-28/60015085.PDF
2011-09-28,太阳鸟：关于主营业务相关的运营资金使用计划的公告,finalpage/2011-09-28/60015086.PDF
2011-09-28,太阳鸟：第一届监事会第十二次会议决议公告,finalpage/2011-09-28/60015087.PDF
2011-09-28,太阳鸟：独立董事对第一届董事会第二十次会议相关事项的独立意见,finalpage/2011-09-28/60015088.PDF
2011-09-28,太阳鸟：关于召开2011年第二次临时股东大会的公告,finalpage/2011-09-28/60015089.PDF
2011-09-28,太阳鸟：华泰联合证券有限责任公司关于公司主营业务相关的运营资金使用计划之专项核查意见,finalpage/2011-09-28/60015090.PDF
2011-09-28,太阳鸟：使用部分主营业务相关的运营资金收购广东宝达游艇公司100%股权的可行性研究报告,finalpage/2011-09-28/60015092.PDF
2011-10-17,太阳鸟：关于拟订重大合同的公告,finalpage/2011-10-17/60069081.PDF
2011-10-18,太阳鸟：2011年第二次临时股东大会决议,finalpage/2011-10-18/60068881.PDF
2011-10-18,太阳鸟：2011年第二次临时股东大会的法律意见书,finalpage/2011-10-18/60068882.PDF
2011-10-26,太阳鸟：2011年第三季度报告正文,finalpage/2011-10-26/60112601.PDF
2011-10-26,太阳鸟：2011年第三季度报告全文,finalpage/2011-10-26/60112603.PDF
2011-10-26,太阳鸟：关于增加对“高性能复合材料船艇扩能建设项目”投入暨部分主营业务相关的运营资金使用计划的公告,finalpage/2011-10-26/60112604.PDF
2011-10-26,太阳鸟：华泰联合证券有限责任公司关于公司增加对“高性能复合材料船艇扩能建设项目”投入暨部分主营业务相关的运营资金使用计划之专项核查意见,finalpage/2011-10-26/60112605.PDF
2011-10-26,太阳鸟：独立董事对第一届董事会第二十一次会议相关事项的独立意见,finalpage/2011-10-26/60112606.PDF
2011-10-26,太阳鸟：第一届监事会第十三次会议决议公告,finalpage/2011-10-26/60112607.PDF
2011-10-26,太阳鸟：第一届董事会第二十一次会议决议公告,finalpage/2011-10-26/60112608.PDF
2011-11-04,太阳鸟：关于持股5%以上股东减持股份的提示性公告,finalpage/2011-11-04/60165920.PDF
2011-11-16,太阳鸟：简式权益变动报告书,finalpage/2011-11-16/60210580.PDF
2011-11-16,太阳鸟：关于持股5%以上股东减持股份的提示性公告,finalpage/2011-11-16/60210583.PDF
2011-12-05,太阳鸟：重大合同进展公告,finalpage/2011-12-05/60285991.PDF
2011-12-05,太阳鸟：关于全资子公司签署募集资金三方监管协议的公告,finalpage/2011-12-05/60285992.PDF
2011-12-07,太阳鸟：关于取得外观设计专利证书、商标注册证书的公告,finalpage/2011-12-07/60297380.PDF
2011-12-07,太阳鸟：关于全资子公司完成工商变更登记的公告,finalpage/2011-12-07/60297381.PDF
2011-12-12,太阳鸟：关于更换持续督导保荐代表人的公告,finalpage/2011-12-12/60315519.PDF
2011-12-21,太阳鸟：关于控股股东股权质押的公告,finalpage/2011-12-21/60352930.PDF
2011-12-27,太阳鸟：关于召开2012年第一次临时股东大会的公告,finalpage/2011-12-27/60376529.PDF
2011-12-27,太阳鸟：关于选举职工代表监事的公告,finalpage/2011-12-27/60376530.PDF
2011-12-27,太阳鸟：独立董事候选人声明（李荻辉）,finalpage/2011-12-27/60376531.PDF
2011-12-27,太阳鸟：独立董事候选人声明（杨新发）,finalpage/2011-12-27/60376532.PDF
2011-12-27,太阳鸟：独立董事候选人声明（颜爱民）,finalpage/2011-12-27/60376533.PDF
2011-12-27,太阳鸟：独立董事对公司董事会换届选举的独立意见,finalpage/2011-12-27/60376534.PDF
2011-12-27,太阳鸟：独立董事提名人声明,finalpage/2011-12-27/60376535.PDF
2011-12-27,太阳鸟：第一届监事会第十四次会议决议公告,finalpage/2011-12-27/60376536.PDF
2011-12-27,太阳鸟：第一届董事会第二十二次会议决议公告,finalpage/2011-12-27/60376537.PDF
2012-01-12,太阳鸟：关于签订投资意向合同的公告,finalpage/2012-01-12/60438996.PDF
2012-01-13,太阳鸟：关于全资子公司完成工商变更登记的公告,finalpage/2012-01-13/60443484.PDF
2012-01-13,太阳鸟：关于全资子公司珠海太阳鸟游艇制造有限公司完成工商变更登记的公告,finalpage/2012-01-13/60443485.PDF
2012-01-13,太阳鸟：独立董事对公司第二届董事会第一次会议相关事项的独立意见,finalpage/2012-01-13/60443486.PDF
2012-01-13,太阳鸟：第二届监事会第一次会议决议公告,finalpage/2012-01-13/60443487.PDF
2012-01-13,太阳鸟：第二届董事会第一次会议决议公告,finalpage/2012-01-13/60443488.PDF
2012-01-13,太阳鸟：2012年第一次临时股东大会决议公告,finalpage/2012-01-13/60438997.PDF
2012-01-13,太阳鸟：2012年第一次临时股东大会的法律意见书,finalpage/2012-01-13/60438998.PDF
2012-01-30,太阳鸟：2011年度业绩预告,finalpage/2012-01-30/60481421.PDF
2012-02-28,太阳鸟：2011年度业绩快报,finalpage/2012-02-28/60599096.PDF
2012-03-27,太阳鸟：2012年一季度业绩预告,finalpage/2012-03-27/60730775.PDF
2012-03-27,太阳鸟：2011年年度报告摘要,finalpage/2012-03-27/60730776.PDF
2012-03-27,太阳鸟：2011年年度审计报告,finalpage/2012-03-27/60730778.PDF
2012-03-27,太阳鸟：第二届董事会第二次会议决议,finalpage/2012-03-27/60730779.PDF
2012-03-27,太阳鸟：关于召开2011年年度股东大会的公告,finalpage/2012-03-27/60730780.PDF
2012-03-27,太阳鸟：第二届监事会第二次会议决议公告,finalpage/2012-03-27/60730781.PDF
2012-03-27,太阳鸟：2011年年度报告,finalpage/2012-03-27/60730782.PDF
2012-03-27,太阳鸟：关于主营业务相关的运营资金使用计划的公告,finalpage/2012-03-27/60730783.PDF
2012-03-27,太阳鸟：关于年度募集资金存放与使用情况的专项报告,finalpage/2012-03-27/60730784.PDF
2012-03-27,太阳鸟：关于控股股东名称变更的公告,finalpage/2012-03-27/60730785.PDF
2012-03-27,太阳鸟：内幕信息知情人登记管理制度（2012年3月）,finalpage/2012-03-27/60730786.PDF
2012-03-27,太阳鸟：2011年度内部控制评价报告,finalpage/2012-03-27/60730787.PDF
2012-03-27,太阳鸟：募集资金年度存放与使用情况鉴证报告,finalpage/2012-03-27/60730788.PDF
2012-03-27,太阳鸟：华泰联合证券有限责任公司关于公司主营业务相关的运营资金使用计划之专项核查意见,finalpage/2012-03-27/60730789.PDF
2012-03-27,太阳鸟：华泰联合证券有限责任公司关于公司内部控制自我评价报告的核查意见,finalpage/2012-03-27/60730790.PDF
2012-03-27,太阳鸟：华泰联合证券有限责任公司关于公司募集资金年度使用情况的专项核查意见,finalpage/2012-03-27/60730791.PDF
2012-03-27,太阳鸟：控股股东及其他关联方资金占用情况的专项审计说明,finalpage/2012-03-27/60730792.PDF
2012-03-27,太阳鸟：独立董事2011年度述职报告（吴建敏）,finalpage/2012-03-27/60730793.PDF
2012-03-27,太阳鸟：独立董事2011年度述职报告（李荻辉）,finalpage/2012-03-27/60730794.PDF
2012-03-27,太阳鸟：独立董事2011年度述职报告（杨新发）,finalpage/2012-03-27/60730795.PDF
2012-03-27,太阳鸟：独立董事2011年度述职报告（欧阳润平）,finalpage/2012-03-27/60730796.PDF
2012-03-27,太阳鸟：独立董事对第二届董事会第二次会议相关事项的独立意见,finalpage/2012-03-27/60730797.PDF
2012-03-27,太阳鸟：关于公司资金风险状况的专项审计报告,finalpage/2012-03-27/60730798.PDF
2012-03-29,太阳鸟：关于签订重大合同的公告,finalpage/2012-03-29/60760089.PDF
2012-04-10,太阳鸟：华泰联合证券有限责任公司关于公司持续督导期间跟踪报告,finalpage/2012-04-10/60810188.PDF
2012-04-17,太阳鸟：关于举行2011年年度报告网上业绩说明会的通知,finalpage/2012-04-17/60846681.PDF
2012-04-21,太阳鸟：2011年年度股东大会决议公告,finalpage/2012-04-21/60870123.PDF
2012-04-21,太阳鸟：2011年度股东大会的法律意见书,finalpage/2012-04-21/60870124.PDF
2012-04-23,太阳鸟：2012年第一季度报告正文,finalpage/2012-04-23/60872682.PDF
2012-04-23,太阳鸟：2012年第一季度报告全文,finalpage/2012-04-23/60872684.PDF
2012-05-04,太阳鸟：关于全资子公司签署募集资金三方监管协议的公告,finalpage/2012-05-04/60955724.PDF
2012-05-11,太阳鸟：2011年度权益分派实施公告,finalpage/2012-05-11/60985703.PDF
2012-06-12,太阳鸟：关于主营业务相关的运营资金使用计划的公告,finalpage/2012-06-12/61129193.PDF
2012-06-12,太阳鸟：关于全资子公司珠海太阳鸟游艇制造有限公司拟收购珠海雄达游艇制造有限公司100%股权的公告,finalpage/2012-06-12/61129194.PDF
2012-06-12,太阳鸟：华泰联合证券有限责任公司关于公司主营业务相关的运营资金使用计划之专项核查意见,finalpage/2012-06-12/61129195.PDF
2012-06-12,太阳鸟：独立董事对第二届董事会第四次会议相关事项的独立意见,finalpage/2012-06-12/61129196.PDF
2012-06-12,太阳鸟：第二届监事会第四次会议决议公告,finalpage/2012-06-12/61129197.PDF
2012-06-12,太阳鸟：第二届董事会第四次会议决议,finalpage/2012-06-12/61129198.PDF
2012-06-14,太阳鸟：关于公司及全资子公司广东宝达游艇制造有限公司拟订重大合同的公告,finalpage/2012-06-14/61139443.PDF
2012-07-13,太阳鸟：2012年半年度业绩预告,finalpage/2012-07-13/61267062.PDF
2012-07-17,太阳鸟：重大合同进展公告,finalpage/2012-07-17/61277584.PDF
2012-07-26,太阳鸟：珠海太阳鸟游艇制造有限公司关于收购珠海雄达游艇制造有限公司100%合作权益之项目可行性研究报告,finalpage/2012-07-26/61323511.PDF
2012-07-26,太阳鸟：关于全资子公司珠海太阳鸟游艇制造有限公司收购珠海雄达游艇制造有限公司100%合作权益的进展公告,finalpage/2012-07-26/61323512.PDF
2012-08-22,太阳鸟：关于全资子公司广东宝达游艇制造有限公司拟订重大合同的公告,finalpage/2012-08-22/61457736.PDF
2012-08-25,太阳鸟：2012年半年度报告摘要,finalpage/2012-08-25/61478794.PDF
2012-08-25,太阳鸟：第二届董事会第五次会议决议,finalpage/2012-08-25/61478797.PDF
2012-08-25,太阳鸟：第二届监事会第五次会议决议,finalpage/2012-08-25/61478798.PDF
2012-08-25,太阳鸟：2012年半年度报告,finalpage/2012-08-25/61478799.PDF
2012-08-25,太阳鸟：关于召开2012年第二次临时股东大会的公告,finalpage/2012-08-25/61478800.PDF
2012-08-25,太阳鸟：关于部分变更募投项目及调整募投项目投资进度的公告,finalpage/2012-08-25/61478801.PDF
2012-08-25,太阳鸟：华泰联合证券有限责任公司关于公司部分变更募投项目及调整募投项目投资进度之专项核查意见,finalpage/2012-08-25/61478803.PDF
2012-08-25,太阳鸟：公司章程修正案,finalpage/2012-08-25/61478804.PDF
2012-08-25,太阳鸟：独立董事对第二届董事会第五次会议相关事项的独立意见,finalpage/2012-08-25/61478805.PDF
