date,title,url
2016-09-12,神农基因：新时代证券股份有限公司关于公司发行股份购买资产暨关联交易之SPT技术所生产的种子产品不含有转基因之独立财务顾问核查意见,finalpage/2016-09-12/1202695104.PDF
2016-09-12,神农基因：关于SPT技术所生产的种子产品不含有转基因的说明,finalpage/2016-09-12/1202695105.PDF
2016-09-19,神农基因：2016年第一次临时股东大会决议公告,finalpage/2016-09-19/1202708793.PDF
2016-09-19,神农基因：2016年第一次临时股东大会的法律意见书,finalpage/2016-09-19/1202708794.PDF
2016-09-20,神农基因：关于举行专题事项网上说明会的公告,finalpage/2016-09-20/1202710835.PDF
2016-09-20,神农基因：关于发行股份购买资产申请被否的后续相关情况说明,finalpage/2016-09-20/1202710836.PDF
2016-09-20,神农基因：关于中国证监会上市公司并购重组审核委员会对公司发行股份购买资产事项审核结果暨公司股票复牌公告,finalpage/2016-09-20/1202708795.PDF
2016-10-13,神农基因：关于控股子公司申请生物技术发明专利的公告,finalpage/2016-10-13/1202757801.PDF
2016-10-14,神农基因：2016年前三季度业绩预告,finalpage/2016-10-14/1202760201.PDF
2016-10-29,神农基因：2016年第三季度报告披露提示性公告,finalpage/2016-10-29/1202801402.PDF
2016-10-29,神农基因：2016年第三季度报告全文（已取消）,finalpage/2016-10-29/1202801404.PDF
2016-11-01,神农基因：关于股东所持股权质押解除的公告,finalpage/2016-11-01/1202810153.PDF
2016-11-02,神农基因：第五届董事会第三十一次会议决议公告,finalpage/2016-11-02/1202812500.PDF
2016-11-02,神农基因：独立董事关于第五届董事会第三十一次会议审议事项的独立意见,finalpage/2016-11-02/1202812501.PDF
2016-12-07,神农基因：关于英文全称、英文简称变更的补充公告,finalpage/2016-12-07/1202864257.PDF
2016-12-07,神农基因：第五届董事会第三十二次会议决议公告,finalpage/2016-12-07/1202863417.PDF
2016-12-07,神农基因：英文全称、英文简称变更公告,finalpage/2016-12-07/1202863418.PDF
2016-12-13,神农基因：关于重大资产重组停牌的公告,finalpage/2016-12-13/1202870804.PDF
2016-12-16,神农基因：股票继续停牌公告,finalpage/2016-12-16/1202878870.PDF
2016-12-23,神农基因：股票继续停牌公告,finalpage/2016-12-23/1202953700.PDF
2016-12-30,神农基因：股票继续停牌公告,finalpage/2016-12-30/1202978818.PDF
2017-01-09,神农基因：股票继续停牌公告,finalpage/2017-01-09/1203001077.PDF
2017-01-12,神农基因：关于公司控股股东收到《仲裁通知书》的公告,finalpage/2017-01-12/1203011780.PDF
2017-01-12,神农基因：重大资产重组延期复牌公告,finalpage/2017-01-12/1203008454.PDF
2017-01-18,神农基因：股票继续停牌公告,finalpage/2017-01-18/1203025999.PDF
2017-01-25,神农基因：2016年年度业绩预告,finalpage/2017-01-25/1203055984.PDF
2017-01-25,神农基因：股票继续停牌公告,finalpage/2017-01-25/1203055985.PDF
2017-02-07,神农基因：股票继续停牌公告,finalpage/2017-02-07/1203068080.PDF
2017-02-11,神农基因：关于终止本次重大资产重组并继续停牌的公告,finalpage/2017-02-11/1203076400.PDF
2017-02-17,神农基因：股票继续停牌公告,finalpage/2017-02-17/1203090904.PDF
2017-02-24,神农基因：股票继续停牌公告,finalpage/2017-02-24/1203107048.PDF
2017-02-27,神农基因：2016年度业绩快报,finalpage/2017-02-27/1203112393.PDF
2017-02-28,神农基因：关于股东拟减持股份的公告,finalpage/2017-02-28/1203113697.PDF
2017-02-28,神农基因：关于公司股票复牌的提示性公告,finalpage/2017-02-28/1203113698.PDF
2017-02-28,神农基因：关于控股股东签署《协议书》的公告,finalpage/2017-02-28/1203113699.PDF
2017-02-28,神农基因：关于公司控股股东收到《长沙仲裁委员会调解书》的公告,finalpage/2017-02-28/1203113700.PDF
2017-03-10,神农基因：关于控股股东减持公司股份的公告,finalpage/2017-03-10/1203149684.PDF
2017-03-22,神农基因：关于控股股东股份质押的公告,finalpage/2017-03-22/1203186008.PDF
2017-04-07,神农基因：2017年第一季度业绩预告,finalpage/2017-04-07/1203260667.PDF
2017-04-21,神农基因：关于控股子公司申请生物技术发明专利的公告,finalpage/2017-04-21/1203358856.PDF
2017-04-21,神农基因：2016年度业绩快报修正公告,finalpage/2017-04-21/1203358855.PDF
2017-04-26,神农基因：关于召开2016年年度股东大会的通知的更正公告,finalpage/2017-04-26/1203402427.PDF
2017-04-26,神农基因：2016年年度报告披露提示性公告,finalpage/2017-04-26/1203388338.PDF
2017-04-26,神农基因：2016年年度报告摘要,finalpage/2017-04-26/1203388339.PDF
2017-04-26,神农基因：2016年年度审计报告,finalpage/2017-04-26/1203388341.PDF
2017-04-26,神农基因：第五届董事会第三十三次会议决议公告,finalpage/2017-04-26/1203388342.PDF
2017-04-26,神农基因：第五届监事会第二十次会议决议公告,finalpage/2017-04-26/1203388343.PDF
2017-04-26,神农基因：2016年年度报告（已取消）,finalpage/2017-04-26/1203388344.PDF
2017-04-26,神农基因：2017年第一季度报告披露提示性公告,finalpage/2017-04-26/1203388345.PDF
2017-04-26,神农基因：2016年度募集资金存放与使用情况的专项报告,finalpage/2017-04-26/1203388346.PDF
2017-04-26,神农基因：2016年度内部控制自我评价报告,finalpage/2017-04-26/1203388347.PDF
2017-04-26,神农基因：关于会计政策变更的公告,finalpage/2017-04-26/1203388348.PDF
2017-04-26,神农基因：独立董事关于第五届董事会第三十三次会议审议事项的独立意见,finalpage/2017-04-26/1203388349.PDF
2017-04-26,神农基因：关于举行2016年年度报告网上说明会的通知,finalpage/2017-04-26/1203388350.PDF
2017-04-26,神农基因：2017年度投资者关系管理工作计划,finalpage/2017-04-26/1203388351.PDF
2017-04-26,神农基因：2017年第一季度报告全文（已取消）,finalpage/2017-04-26/1203388352.PDF
2017-04-26,神农基因：2016年度独立董事述职报告（冯克珊）,finalpage/2017-04-26/1203388354.PDF
2017-04-26,神农基因：2016年度独立董事述职报告（吕品图）,finalpage/2017-04-26/1203388355.PDF
2017-04-26,神农基因：2016年度独立董事述职报告（欧学旺）,finalpage/2017-04-26/1203388356.PDF
2017-04-26,神农基因：平安证券股份有限公司关于公司2016年度募集资金存放与使用情况的专项核查意见,finalpage/2017-04-26/1203388357.PDF
2017-04-26,神农基因：平安证券股份有限公司关于公司部分募投项目延期的核查意见,finalpage/2017-04-26/1203388358.PDF
2017-04-26,神农基因：控股股东及其他关联方占用资金情况的专项审计说明,finalpage/2017-04-26/1203388359.PDF
2017-04-26,神农基因：募集资金年度存放与使用情况鉴证报告（2016年度）,finalpage/2017-04-26/1203388360.PDF
2017-04-26,神农基因：内部控制鉴证报告（2016年12月31日）,finalpage/2017-04-26/1203388361.PDF
2017-04-26,神农基因：关于召开2016年年度股东大会的通知,finalpage/2017-04-26/1203388362.PDF
2017-04-26,神农基因：关于公司募集资金投资项目完成时间调整的公告,finalpage/2017-04-26/1203388363.PDF
2017-04-27,神农基因：关于召开2016年年度股东大会的通知的补充更正公告,finalpage/2017-04-27/1203411229.PDF
2017-05-17,神农基因：关于参加“海南辖区上市公司2016年度业绩网上集体说明会”的公告,finalpage/2017-05-17/1203531021.PDF
2017-05-26,神农基因：2016年年度股东大会决议公告,finalpage/2017-05-26/1203572065.PDF
2017-05-26,神农基因：2016年年度股东大会的法律意见书,finalpage/2017-05-26/1203572066.PDF
2017-05-31,神农基因：关于签订《合作备忘录》的公告,finalpage/2017-05-31/1203577059.PDF
2017-06-09,神农基因：关于股票存在被实施暂停上市风险的提示性公告,finalpage/2017-06-09/1203607262.PDF
2017-06-09,神农基因：关于收到中国证券监督管理委员会海南监管局下发的《调查通知书》的公告,finalpage/2017-06-09/1203607265.PDF
2017-06-16,神农基因：关于子公司收到两项发明专利授权及办登通知的公告,finalpage/2017-06-16/1203625269.PDF
2017-07-08,神农基因：关于股票存在被实施暂停上市风险的提示性公告,finalpage/2017-07-08/1203689297.PDF
2017-07-13,神农基因：2017年半年度业绩预告,finalpage/2017-07-13/1203703563.PDF
2017-07-13,神农基因：2016年度分红派息实施公告,finalpage/2017-07-13/1203700043.PDF
2017-07-24,神农基因：关于子公司收到两项发明专利授权及办登通知的公告,finalpage/2017-07-24/1203729155.PDF
2017-08-07,神农基因：关于立案调查进展暨风险提示性公告,finalpage/2017-08-07/1203769880.PDF
2017-08-29,神农基因：关于延期披露2017年半年度报告的公告,finalpage/2017-08-29/1203892461.PDF
2017-08-30,神农基因：2017年半年度报告摘要（已取消）,finalpage/2017-08-30/1203895460.PDF
2017-08-30,神农基因：财务报告（2017年1-6月）（已取消）,finalpage/2017-08-30/1203895461.PDF
2017-08-30,神农基因：公司章程（2017年8月）,finalpage/2017-08-30/1203895462.PDF
2017-08-30,神农基因：独立董事关于对公司第五届董事会第三十四次会议审议事项的独立意见,finalpage/2017-08-30/1203895463.PDF
2017-08-30,神农基因：2017年半年度募集资金存放与使用情况的专项报告,finalpage/2017-08-30/1203895464.PDF
2017-08-30,神农基因：2016年第一季度报告全文（更新后）,finalpage/2017-08-30/1203895465.PDF
2017-08-30,神农基因：2016年半年度报告（更新后）,finalpage/2017-08-30/1203895466.PDF
2017-08-30,神农基因：2016年第三季度报告全文（更新后）,finalpage/2017-08-30/1203895467.PDF
2017-08-30,神农基因：2016年年度报告（更新后）,finalpage/2017-08-30/1203895468.PDF
2017-08-30,神农基因：2017年第一季度报告全文（更新后）,finalpage/2017-08-30/1203895469.PDF
2017-08-30,神农基因：2017年半年度报告披露提示性公告,finalpage/2017-08-30/1203895470.PDF
2017-08-30,神农基因：第五届董事会第三十四次会议决议公告,finalpage/2017-08-30/1203895472.PDF
2017-08-30,神农基因：第五届监事会第二十一次会议决议公告,finalpage/2017-08-30/1203895473.PDF
2017-08-30,神农基因：关于拟变更公司名称的公告,finalpage/2017-08-30/1203895474.PDF
2017-08-30,神农基因：关于召开2017年第一次临时股东大会的通知,finalpage/2017-08-30/1203895475.PDF
2017-08-30,神农基因：关于2016年定期报告及《2017年第一季度报告》的更正公告,finalpage/2017-08-30/1203895476.PDF
2017-08-30,神农基因：2017年半年度报告（已取消）,finalpage/2017-08-30/1203895477.PDF
2017-09-01,神农基因：关于股东所持股份达到股本总额5%的公告,finalpage/2017-09-01/1203923953.PDF
2017-09-01,神农基因：简式权益变动报告书,finalpage/2017-09-01/1203923954.PDF
2017-09-07,神农基因：关于立案调查进展暨风险提示性公告,finalpage/2017-09-07/1203943814.PDF
2017-09-13,神农基因：关于持股5%以上股东增持股份超过1%的公告,finalpage/2017-09-13/1203971523.PDF
2017-09-15,神农基因：2017年第一次临时股东大会决议公告,finalpage/2017-09-15/1203979236.PDF
2017-09-15,神农基因：2017年第一次临时股东大会的法律意见书,finalpage/2017-09-15/1203979237.PDF
2017-09-29,神农基因：关于立案调查进展暨风险提示性公告,finalpage/2017-09-29/1204013891.PDF
2017-10-09,神农基因：关于签订《合作框架协议》的公告,finalpage/2017-10-09/1204020587.PDF
2017-10-13,神农基因：2017年前三季度业绩预告,finalpage/2017-10-13/1204039698.PDF
2017-10-26,神农基因：2017年半年度报告（更新后）,finalpage/2017-10-26/1204080574.PDF
2017-10-26,神农基因：2017年半年度报告摘要（更新后）,finalpage/2017-10-26/1204080575.PDF
2017-10-26,神农基因：财务报告（2017年1-6月）（更新后）,finalpage/2017-10-26/1204080576.PDF
2017-10-26,神农基因：关于《2017年半年度报告》的更正公告,finalpage/2017-10-26/1204080577.PDF
2017-10-27,神农基因：2017年第三季度报告披露提示性公告,finalpage/2017-10-27/1204078594.PDF
2017-10-27,神农基因：2017年第三季度报告全文,finalpage/2017-10-27/1204078596.PDF
2017-10-30,神农基因：关于持股5%以上股东增持股份超过1%的公告,finalpage/2017-10-30/1204097179.PDF
2017-11-08,神农基因：关于立案调查进展暨风险提示性公告,finalpage/2017-11-08/1204125461.PDF
2017-11-23,神农基因：第五届董事会第三十六次会议决议公告,finalpage/2017-11-23/1204163184.PDF
2017-11-29,神农基因：关于收购控股子公司股权的进展公告,finalpage/2017-11-29/1204176401.PDF
2017-11-29,神农基因：深圳市神农惟谷供应链有限公司审计报告及财务报表（2017年10月31日）,finalpage/2017-11-29/1204176402.PDF
2017-12-07,神农基因：关于立案调查进展暨风险提示性公告,finalpage/2017-12-07/1204199875.PDF
2017-12-26,神农基因：第五届董事会第三十七次会议决议公告,finalpage/2017-12-26/1204270096.PDF
2017-12-26,神农基因：关于以实物资产对外投资设立子公司的公告,finalpage/2017-12-26/1204270097.PDF
2017-12-26,神农基因：房地产估价报告（一）,finalpage/2017-12-26/1204270098.PDF
2017-12-26,神农基因：房地产估价报告（二）,finalpage/2017-12-26/1204270099.PDF
2018-01-05,神农基因：关于立案调查进展暨风险提示性公告,finalpage/2018-01-05/1204310013.PDF
2018-01-23,神农基因：第五届董事会第三十八次会议决议公告,finalpage/2018-01-23/1204352213.PDF
2018-01-23,神农基因：关于召开2018年第一次临时股东大会的通知,finalpage/2018-01-23/1204352214.PDF
2018-01-31,神农基因：2017年年度业绩预告,finalpage/2018-01-31/1204378841.PDF
2018-02-02,神农基因：关于立案调查进展暨风险提示性公告,finalpage/2018-02-02/1204389754.PDF
2018-02-07,神农基因：2018年第一次临时股东大会决议公告,finalpage/2018-02-07/1204401007.PDF
2018-02-07,神农基因：2018年第一次临时股东大会的法律意见书,finalpage/2018-02-07/1204401008.PDF
