date,title,url
2015-09-15,神农大丰：2015年第二次临时股东大会的法律意见书,finalpage/2015-09-15/1201598528.PDF
2015-09-15,神农大丰：股票继续停牌公告,finalpage/2015-09-15/1201598529.PDF
2015-09-22,神农大丰：关于召开2015年第三次临时股东大会的通知,finalpage/2015-09-22/1201625275.PDF
2015-09-22,神农大丰：第五届董事会第十三次会议决议公告,finalpage/2015-09-22/1201625276.PDF
2015-09-22,神农大丰：股票继续停牌公告,finalpage/2015-09-22/1201624177.PDF
2015-09-23,神农大丰：关于召开2015年第三次临时股东大会的通知的更正公告,finalpage/2015-09-23/1201628829.PDF
2015-09-29,神农大丰：股票继续停牌公告,finalpage/2015-09-29/1201654437.PDF
2015-10-08,神农大丰：2015年第三次临时股东大会的法律意见书,finalpage/2015-10-08/1201669300.PDF
2015-10-08,神农大丰：2015年第三次临时股东大会决议公告,finalpage/2015-10-08/1201669299.PDF
2015-10-09,神农大丰：股票延期复牌公告,finalpage/2015-10-09/1201673849.PDF
2015-10-12,神农大丰：公司章程（2015年10月）,finalpage/2015-10-12/1201685209.PDF
2015-10-12,神农大丰：关于召开2015年第四次临时股东大会的通知,finalpage/2015-10-12/1201685210.PDF
2015-10-12,神农大丰：关于控股子公司与战略投资者签订《增资协议》的公告,finalpage/2015-10-12/1201685211.PDF
2015-10-12,神农大丰：关于控股子公司增资暨关联交易的公告,finalpage/2015-10-12/1201685212.PDF
2015-10-12,神农大丰：南波莲水稻基因科技有限公司审计报告及财务报表,finalpage/2015-10-12/1201685213.PDF
2015-10-12,神农大丰：海南波莲水稻基因科技有限公司拟增资扩股项目涉及的海南波莲水稻基因科技有限公司股东全部权益价值资产评估报告,finalpage/2015-10-12/1201685214.PDF
2015-10-12,神农大丰：独立董事关于第五届董事会第十四次会议审议事项的独立意见,finalpage/2015-10-12/1201685215.PDF
2015-10-12,神农大丰：第五届监事会第十一次会议决议公告,finalpage/2015-10-12/1201685216.PDF
2015-10-12,神农大丰：第五届董事会第十四次会议决议公告,finalpage/2015-10-12/1201685217.PDF
2015-10-13,神农大丰：股票继续停牌公告,finalpage/2015-10-13/1201688526.PDF
2015-10-13,神农大丰：关于获批设立博士后科研工作站的公告,finalpage/2015-10-13/1201687653.PDF
2015-10-14,神农大丰：2015年前三季度业绩预告,finalpage/2015-10-14/1201695000.PDF
2015-10-20,神农大丰：股票继续停牌公告,finalpage/2015-10-20/1201709756.PDF
2015-10-23,神农大丰：2015年第三季度报告披露提示性公告,finalpage/2015-10-23/1201716530.PDF
2015-10-23,神农大丰：2015年第三季度报告全文,finalpage/2015-10-23/1201716532.PDF
2015-10-27,神农大丰：2015年第四次临时股东大会决议公告,finalpage/2015-10-27/1201731822.PDF
2015-10-27,神农大丰：2015年第四次临时股东大会的法律意见书,finalpage/2015-10-27/1201731823.PDF
2015-10-27,神农大丰：股票继续停牌公告,finalpage/2015-10-27/1201731824.PDF
2015-10-30,神农大丰：股票延期复牌公告,finalpage/2015-10-30/1201744794.PDF
2015-11-02,神农大丰：股东股份质押公告,finalpage/2015-11-02/1201748884.PDF
2015-11-03,神农大丰：股票继续停牌公告,finalpage/2015-11-03/1201750730.PDF
2015-11-06,神农大丰：名称、证券简称变更公告,finalpage/2015-11-06/1201757090.PDF
2015-11-10,神农基因：股票继续停牌公告,finalpage/2015-11-10/1201762363.PDF
2015-11-12,神农基因：关于近期有关公司新闻报道的说明公告,finalpage/2015-11-12/1201766284.PDF
2015-11-17,神农基因：关于控股子公司股东转让股权的更正公告,finalpage/2015-11-17/1201776074.PDF
2015-11-17,神农基因：股票继续停牌公告,finalpage/2015-11-17/1201775271.PDF
2015-11-17,神农基因：关于控股子公司股东转让股权的公告,finalpage/2015-11-17/1201775272.PDF
2015-11-24,神农基因：股票继续停牌公告,finalpage/2015-11-24/1201787115.PDF
2015-11-26,神农基因：审计报告及财务报表（2015年1-10月）,finalpage/2015-11-26/1201790951.PDF
2015-11-26,神农基因：拟发行股份购买资产项目涉及的海南波莲水稻基因科技有限公司股东全部权益价值资产评估报告,finalpage/2015-11-26/1201790949.PDF
2015-11-26,神农基因：审计报告及备考合并财务报表（2014年度至2015年1-10月）,finalpage/2015-11-26/1201790950.PDF
2015-11-26,神农基因：未来三年分红回报规划（2015-2017年）,finalpage/2015-11-26/1201790898.PDF
2015-11-26,神农基因：关于本次重大资产重组前12月内购买、出售资产情况的说明,finalpage/2015-11-26/1201790899.PDF
2015-11-26,神农基因：关于公司股票暂不复牌的提示性公告,finalpage/2015-11-26/1201790900.PDF
2015-11-26,神农基因：关于召开2015年第五次临时股东大会的通知,finalpage/2015-11-26/1201790901.PDF
2015-11-26,神农基因：发行股份购买资产暨关联交易报告书（草案）,finalpage/2015-11-26/1201790902.PDF
2015-11-26,神农基因：发行股份购买资产暨关联交易报告书（草案）摘要,finalpage/2015-11-26/1201790903.PDF
2015-11-26,神农基因：北京市中伦律师事务所关于公司发行股份购买资产暨关联交易的法律意见书,finalpage/2015-11-26/1201790904.PDF
2015-11-26,神农基因：新时代证券股份有限公司关于公司发行股份购买资产暨关联交易之独立财务顾问报告,finalpage/2015-11-26/1201790905.PDF
2015-11-26,神农基因：全体高级管理人员声明,finalpage/2015-11-26/1201790889.PDF
2015-11-26,神农基因：全体监事声明,finalpage/2015-11-26/1201790890.PDF
2015-11-26,神农基因：第五届董事会第十六次会议决议公告,finalpage/2015-11-26/1201790891.PDF
2015-11-26,神农基因：第五届监事会第十三次会议决议公告,finalpage/2015-11-26/1201790892.PDF
2015-11-26,神农基因：董事会关于公司发行股份购买资产事项履行法定程序的完备性、合规性及提交法律文件有效性的说明,finalpage/2015-11-26/1201790893.PDF
2015-11-26,神农基因：关于重大资产重组的一般风险提示公告,finalpage/2015-11-26/1201790894.PDF
2015-11-26,神农基因：董事会关于公司发行股份购买资产事项停牌前股票波动是否达到《关于规范上市公司信息披露及相关各方行为的通知》（证监公司字[2007]128号）标准的说明,finalpage/2015-11-26/1201790895.PDF
2015-11-26,神农基因：独立董事关于公司向特定对象发行股份购买资产暨关联交易事项的事前认可意见,finalpage/2015-11-26/1201790896.PDF
2015-11-26,神农基因：独立董事关于第五届董事会第十六次会议审议事项的独立意见,finalpage/2015-11-26/1201790897.PDF
2015-11-26,神农基因：交易对方关于所提供信息真实性、准确性和完整性的承诺函,finalpage/2015-11-26/1201790886.PDF
2015-11-26,神农基因：上市公司及全体董事对申请文件真实性、准确性和完整性的承诺函,finalpage/2015-11-26/1201790887.PDF
2015-11-26,神农基因：上市公司及全体董事声明,finalpage/2015-11-26/1201790888.PDF
2015-12-01,神农基因：股票延期复牌公告,finalpage/2015-12-01/1201799470.PDF
2015-12-04,神农基因：第五届董事会第十七次会议决议公告,finalpage/2015-12-04/1201805347.PDF
2015-12-04,神农基因：独立董事关于第五届董事会第十七次会议审议事项的独立意见,finalpage/2015-12-04/1201805348.PDF
2015-12-04,神农基因：独立董事关于公司向特定对象发行股份购买资产暨关联交易事项的事前认可意见,finalpage/2015-12-04/1201805349.PDF
2015-12-04,神农基因：关于深圳证券交易所《关于对海南神农基因科技股份有限公司的重组问询函》的回复,finalpage/2015-12-04/1201805350.PDF
2015-12-04,神农基因：第五届监事会第十四次会议决议公告,finalpage/2015-12-04/1201805351.PDF
2015-12-04,神农基因：关于公司股票复牌的提示性公告,finalpage/2015-12-04/1201805352.PDF
2015-12-04,神农基因：董事会关于公司发行股份购买资产事项履行法定程序的完备性、合规性及提交法律文件有效性的说明,finalpage/2015-12-04/1201805353.PDF
2015-12-04,神农基因：北京市中伦律师事务所关于公司重组的专项说明,finalpage/2015-12-04/1201805354.PDF
2015-12-04,神农基因：关于重组报告书的修订说明,finalpage/2015-12-04/1201805355.PDF
2015-12-04,神农基因：发行股份购买资产暨关联交易报告书（草案）,finalpage/2015-12-04/1201805356.PDF
2015-12-04,神农基因：发行股份购买资产暨关联交易报告书摘要（草案）,finalpage/2015-12-04/1201805357.PDF
2015-12-04,神农基因：新时代证券股份有限公司关于公司发行股份购买资产暨关联交易之独立财务顾问报告,finalpage/2015-12-04/1201805358.PDF
2015-12-07,神农基因：股票交易异常波动公告,finalpage/2015-12-07/1201812745.PDF
2015-12-07,神农基因：关于签订《战略合作框架协议》的公告,finalpage/2015-12-07/1201811809.PDF
2015-12-09,神农基因：第五届董事会第十八次会议决议公告,finalpage/2015-12-09/1201825486.PDF
2015-12-09,神农基因：关于投资设立北京全资子公司的公告,finalpage/2015-12-09/1201825487.PDF
2015-12-09,神农基因：关于董事张雄飞先生减持公司股票的公告,finalpage/2015-12-09/1201824802.PDF
2015-12-11,神农基因：2015年第五次临时股东大会决议公告,finalpage/2015-12-11/1201831257.PDF
2015-12-11,神农基因：2015年第五次临时股东大会的法律意见书,finalpage/2015-12-11/1201831256.PDF
2015-12-14,神农基因：关于董事、高级管理人员增持本公司股票的公告,finalpage/2015-12-14/1201832826.PDF
2015-12-21,神农基因：关于收到《中国证监会行政许可申请受理通知书》的公告,finalpage/2015-12-21/1201849778.PDF
2015-12-28,神农基因：关于公司董事兼副总经理辞职的公告,finalpage/2015-12-28/1201869838.PDF
2016-01-05,神农基因：关于控股股东、董事和高级管理人员不减持公司股份的公告,finalpage/2016-01-05/1201889549.PDF
2016-01-18,神农基因：中国证监会行政许可项目审查一次反馈意见通知书,finalpage/2016-01-18/1201922215.PDF
2016-01-18,神农基因：关于收到《中国证监会行政许可项目审查一次反馈意见通知书》的公告,finalpage/2016-01-18/1201922214.PDF
2016-01-28,神农基因：关于控股子公司申请生物技术发明专利的公告,finalpage/2016-01-28/1201950758.PDF
2016-01-29,神农基因：第五届董事会第十九次会议决议公告,finalpage/2016-01-29/1201954745.PDF
2016-01-29,神农基因：独立董事关于签署《业绩承诺与补偿协议》的事前认可意见,finalpage/2016-01-29/1201954746.PDF
2016-01-29,神农基因：独立董事关于签署《业绩承诺与补偿协议》的独立意见,finalpage/2016-01-29/1201954747.PDF
2016-01-29,神农基因：公司与海南波莲水稻基因科技有限公司股东黄培劲签署之业绩承诺与补偿协议,finalpage/2016-01-29/1201954748.PDF
2016-01-29,神农基因：2015年年度业绩预告,finalpage/2016-01-29/1201953851.PDF
2016-02-01,神农基因：关于签订《一站式粮食生产供应链管理战略合作框架协议》的公告,finalpage/2016-02-01/1201957348.PDF
2016-02-04,神农基因：发行股份购买资产暨关联交易申请文件一次反馈意见之回复,finalpage/2016-02-04/1201971718.PDF
2016-02-04,神农基因：新时代证券股份有限公司关于公司发行股份购买资产暨关联交易之补充独立财务顾问报告,finalpage/2016-02-04/1201971719.PDF
2016-02-04,神农基因：北京北方亚事资产评估有限责任公司关于公司发行股份购买资产暨关联交易申请文件一次反馈意见之回复,finalpage/2016-02-04/1201971720.PDF
2016-02-04,神农基因：北京市中伦律师事务所关于公司发行股份购买资产暨关联交易的补充法律意见书,finalpage/2016-02-04/1201971721.PDF
2016-02-04,神农基因：关于对中国证券监督管理委员会行政许可项目审查一次反馈意见153607号通知书的回复,finalpage/2016-02-04/1201971722.PDF
2016-02-05,神农基因：关于第二大股东名称变更的公告,finalpage/2016-02-05/1201974305.PDF
2016-02-16,神农基因：关于签订《战略合作框架协议》的公告,finalpage/2016-02-16/1201982259.PDF
2016-02-24,神农基因：第五届董事会第二十次会议决议公告,finalpage/2016-02-24/1201997000.PDF
2016-02-24,神农基因：关于投资设立深圳控股子公司的公告,finalpage/2016-02-24/1201997001.PDF
2016-02-25,神农基因：关于公司股票停牌的公告,finalpage/2016-02-25/1201998716.PDF
2016-02-29,神农基因：2015年度业绩快报,finalpage/2016-02-29/1202006813.PDF
2016-03-16,神农基因：关于控股子公司申请生物技术发明专利的公告,finalpage/2016-03-16/1202049216.PDF
2016-03-18,神农基因：第五届董事会第二十一次会议决议公告,finalpage/2016-03-18/1202055540.PDF
2016-03-18,神农基因：关于发行股份购买资产事项未获得中国证监会并购重组审核委员会审核通过及公司股票继续停牌的公告,finalpage/2016-03-18/1202055541.PDF
2016-03-24,神农基因：关于公司股票继续停牌的公告,finalpage/2016-03-24/1202075719.PDF
2016-03-30,神农基因：关于控股子公司申请生物技术发明专利的公告,finalpage/2016-03-30/1202109637.PDF
2016-03-31,神农基因：关于公司股票继续停牌的公告,finalpage/2016-03-31/1202121950.PDF
2016-04-08,神农基因：关于公司股票继续停牌的公告,finalpage/2016-04-08/1202152077.PDF
2016-04-08,神农基因：2016年第一季度业绩预告,finalpage/2016-04-08/1202152076.PDF
2016-04-11,神农基因：关于收到中国证监会不予核准公司发行股份购买资产决定的公告,finalpage/2016-04-11/1202162207.PDF
2016-04-15,神农基因：关于公司股票继续停牌的公告,finalpage/2016-04-15/1202185833.PDF
2016-04-22,神农基因：董事会关于公司发行股份购买资产事项履行法定程序的完备性、合规性及提交法律文件有效性的说明,finalpage/2016-04-22/1202229064.PDF
2016-04-22,神农基因：第五届董事会第二十二次会议决议公告,finalpage/2016-04-22/1202229065.PDF
2016-04-22,神农基因：独立董事关于第五届董事会第二十二次会议审议事项的独立意见,finalpage/2016-04-22/1202229066.PDF
2016-04-22,神农基因：独立董事关于公司向特定对象发行股份购买资产暨关联交易事项的事前认可意见,finalpage/2016-04-22/1202229067.PDF
2016-04-22,神农基因：关于“证监许可[2016]675号”文所述问题的相关回复,finalpage/2016-04-22/1202229068.PDF
2016-04-22,神农基因：发行股份购买资产暨关联交易报告书,finalpage/2016-04-22/1202229070.PDF
2016-04-22,神农基因：发行股份购买资产暨关联交易报告书摘要,finalpage/2016-04-22/1202229071.PDF
2016-04-22,神农基因：公司与海南波莲水稻基因科技有限公司股东黄培劲签署之业绩承诺与补偿协议之补充协议,finalpage/2016-04-22/1202229072.PDF
2016-04-22,神农基因：关于公司股票继续停牌的公告,finalpage/2016-04-22/1202229063.PDF
2016-04-22,神农基因：关于发行股份购买资产暨关联交易报告书的修订对比说明,finalpage/2016-04-22/1202229069.PDF
2016-04-26,神农基因：2015年年度报告披露提示性公告,finalpage/2016-04-26/1202244121.PDF
2016-04-26,神农基因：2015年年度报告摘要,finalpage/2016-04-26/1202244122.PDF
2016-04-26,神农基因：2015年年度审计报告,finalpage/2016-04-26/1202244124.PDF
2016-04-26,神农基因：第五届董事会第二十三次会议决议公告,finalpage/2016-04-26/1202244125.PDF
2016-04-26,神农基因：第五届监事会第十五次会议决议公告,finalpage/2016-04-26/1202244126.PDF
2016-04-26,神农基因：2015年年度报告,finalpage/2016-04-26/1202244127.PDF
2016-04-26,神农基因：2016年第一季度报告披露提示性公告,finalpage/2016-04-26/1202244128.PDF
2016-04-26,神农基因：2016年第一季度报告全文（已取消）,finalpage/2016-04-26/1202244130.PDF
2016-04-26,神农基因：2015年度募集资金存放与使用情况的专项报告,finalpage/2016-04-26/1202244131.PDF
2016-04-26,神农基因：2015年度内部控制自我评价报告,finalpage/2016-04-26/1202244132.PDF
2016-04-26,神农基因：关于召开2015年年度股东大会的通知,finalpage/2016-04-26/1202244133.PDF
2016-04-26,神农基因：2016年度投资者关系管理工作计划,finalpage/2016-04-26/1202244134.PDF
2016-04-26,神农基因：关于举行2015年年度报告网上说明会的通知,finalpage/2016-04-26/1202244135.PDF
2016-04-26,神农基因：2015年度独立董事述职报告（冯克珊）,finalpage/2016-04-26/1202244136.PDF
2016-04-26,神农基因：2015年度独立董事述职报告（吕品图）,finalpage/2016-04-26/1202244137.PDF
2016-04-26,神农基因：2015年度独立董事述职报告（欧学旺）,finalpage/2016-04-26/1202244138.PDF
2016-04-26,神农基因：独立董事关于第五届董事会第二十三次会议审议事项的独立意见,finalpage/2016-04-26/1202244139.PDF
2016-04-26,神农基因：控股股东及其他关联方占用资金情况的专项审计说明,finalpage/2016-04-26/1202244140.PDF
2016-04-26,神农基因：募集资金年度存放与使用情况鉴证报告（2015年度）,finalpage/2016-04-26/1202244141.PDF
2016-04-29,神农基因：关于公司股票继续停牌的公告,finalpage/2016-04-29/1202280351.PDF
2016-05-09,神农基因：关于公司股票继续停牌的公告,finalpage/2016-05-09/1202312327.PDF
2016-05-10,神农基因：审计报告及备考合并财务报表（2014年度至2015年度）,finalpage/2016-05-10/1202315142.PDF
2016-05-10,神农基因：第五届董事会第二十四次会议决议公告,finalpage/2016-05-10/1202315143.PDF
2016-05-10,神农基因：第五届监事会第十六次会议决议公告,finalpage/2016-05-10/1202315144.PDF
2016-05-12,神农基因：关于公司股票复牌的提示性公告,finalpage/2016-05-12/1202317222.PDF
2016-05-12,神农基因：关于深圳证券交易所《关于对海南神农基因科技股份有限公司的重组问询函》的回复,finalpage/2016-05-12/1202317223.PDF
2016-05-12,神农基因：新时代证券股份有限公司关于对公司重组问询函回复之核查意见,finalpage/2016-05-12/1202317224.PDF
2016-05-12,神农基因：北京北方亚事资产评估事务所（特殊普通合伙）关于公司重组的专项说明,finalpage/2016-05-12/1202317225.PDF
2016-05-12,神农基因：北京市中伦律师事务所关于公司重组的专项说明,finalpage/2016-05-12/1202317226.PDF
2016-05-16,神农基因：第五届董事会第二十五次会议决议公告,finalpage/2016-05-16/1202324102.PDF
2016-05-16,神农基因：股票交易异常波动公告,finalpage/2016-05-16/1202324101.PDF
2016-05-16,神农基因：董事会关于公司发行股份购买资产事项履行法定程序的完备性、合规性及提交法律文件有效性的说明,finalpage/2016-05-16/1202324103.PDF
2016-05-16,神农基因：独立董事关于第五届董事会第二十五次会议审议事项的独立意见,finalpage/2016-05-16/1202324104.PDF
2016-05-16,神农基因：独立董事关于公司向特定对象发行股份购买资产暨关联交易事项的事前认可意见,finalpage/2016-05-16/1202324105.PDF
2016-05-16,神农基因：发行股份购买资产暨关联交易报告书,finalpage/2016-05-16/1202324106.PDF
2016-05-16,神农基因：发行股份购买资产暨关联交易报告书摘要,finalpage/2016-05-16/1202324107.PDF
2016-05-19,神农基因：关于收到《中国证监会行政许可申请受理通知书》的公告,finalpage/2016-05-19/1202330037.PDF
2016-05-19,神农基因：关于参加“海南辖区上市公司2015年度业绩网上集体说明会”的公告,finalpage/2016-05-19/1202330038.PDF
2016-05-25,神农基因：平安证券有限责任公司关于公司2015年度募集资金存放与使用情况的核查意见,finalpage/2016-05-25/1202338736.PDF
2016-05-26,神农基因：2015年年度股东大会决议公告,finalpage/2016-05-26/1202341182.PDF
2016-05-26,神农基因：2015年年度股东大会的法律意见书,finalpage/2016-05-26/1202341183.PDF
2016-06-01,神农基因：关于控股子公司收到发明专利《办理登记手续通知书》的公告,finalpage/2016-06-01/1202350878.PDF
2016-06-22,神农基因：关于公司申请抵押担保贷款的公告,finalpage/2016-06-22/1202388489.PDF
2016-06-22,神农基因：第五届董事会第二十六次会议决议公告,finalpage/2016-06-22/1202388487.PDF
2016-06-22,神农基因：独立董事关于公司申请抵押担保贷款的独立意见,finalpage/2016-06-22/1202388488.PDF
2016-07-06,神农基因：2016年半年度业绩预告,finalpage/2016-07-06/1202455288.PDF
2016-07-07,神农基因：关于控股子公司收到《发明专利证书》的公告,finalpage/2016-07-07/1202457976.PDF
2016-07-09,神农基因：2015年度分红派息实施公告,finalpage/2016-07-09/1202462160.PDF
2016-07-18,神农基因：关于投资设立基金管理公司的公告,finalpage/2016-07-18/1202480350.PDF
2016-07-18,神农基因：第五届董事会第二十七次会议决议公告,finalpage/2016-07-18/1202480351.PDF
2016-07-20,神农基因：关于申请延期提交《中国证监会行政许可项目审查一次反馈意见通知书》回复的公告,finalpage/2016-07-20/1202493020.PDF
2016-07-27,神农基因：关于签订《粮食生产加工销售一站式管理战略合作框架协议》的公告,finalpage/2016-07-27/1202511508.PDF
2016-07-28,神农基因：关于签订《粮食生产加工销售一站式管理战略合作框架协议》的补充公告,finalpage/2016-07-28/1202514290.PDF
2016-08-12,神农基因：关于控股子公司发明专利进入办理登记手续阶段的公告,finalpage/2016-08-12/1202562534.PDF
2016-08-24,神农基因：关于控股子公司收到三项发明专利授权及办登通知的公告,finalpage/2016-08-24/1202612691.PDF
2016-08-27,神农基因：2016年半年度报告披露提示性公告,finalpage/2016-08-27/1202638124.PDF
2016-08-27,神农基因：2016年半年度报告摘要,finalpage/2016-08-27/1202638125.PDF
2016-08-27,神农基因：第五届董事会第二十八次会议决议公告,finalpage/2016-08-27/1202638126.PDF
2016-08-27,神农基因：第五届监事会第十七次会议决议公告,finalpage/2016-08-27/1202638127.PDF
2016-08-27,神农基因：2016年半年度募集资金存放与使用情况的专项报告,finalpage/2016-08-27/1202638129.PDF
2016-08-27,神农基因：独立董事关于对公司第五届董事会第二十八次会议审议事项的独立意见,finalpage/2016-08-27/1202638130.PDF
2016-08-27,神农基因：2016年半年度报告（已取消）,finalpage/2016-08-27/1202638131.PDF
2016-08-29,神农基因：海南波莲水稻基因科技有限公司盈利预测审核报告,finalpage/2016-08-29/1202650556.PDF
2016-08-29,神农基因：审计报告及财务报表（2016年1-6月）,finalpage/2016-08-29/1202650557.PDF
2016-08-29,神农基因：海南波莲水稻基因科技有限公司审计报告及财务报表（2016年1月1日至2016年6月30日止）,finalpage/2016-08-29/1202650558.PDF
2016-08-29,神农基因：审计报告及备考合并财务报表（2015年度至2016年1-6月）,finalpage/2016-08-29/1202650559.PDF
2016-08-29,神农基因：公司与海南波莲水稻基因科技有限公司股东黄培劲签署之业绩承诺与补偿协议之补充协议,finalpage/2016-08-29/1202650560.PDF
2016-08-29,神农基因：关于召开2016年第一次临时股东大会的通知,finalpage/2016-08-29/1202650561.PDF
2016-08-29,神农基因：独立董事关于公司向特定对象发行股份购买资产暨关联交易事项的事前认可意见,finalpage/2016-08-29/1202650562.PDF
2016-08-29,神农基因：独立董事关于第五届董事会第二十九次会议审议事项的独立意见,finalpage/2016-08-29/1202650563.PDF
2016-08-29,神农基因：发行股份购买资产暨关联交易申请文件一次反馈意见之回复,finalpage/2016-08-29/1202650564.PDF
2016-08-29,神农基因：发行股份购买资产暨关联交易报告书,finalpage/2016-08-29/1202650565.PDF
2016-08-29,神农基因：第五届监事会第十八次会议决议公告,finalpage/2016-08-29/1202650566.PDF
2016-08-29,神农基因：第五届董事会第二十九次会议决议公告,finalpage/2016-08-29/1202650567.PDF
2016-08-29,神农基因：董事会关于公司发行股份购买资产事项履行法定程序的完备性、合规性及提交法律文件有效性的说明,finalpage/2016-08-29/1202650568.PDF
2016-08-30,神农基因：关于召开2016年第一次临时股东大会的通知的更正公告,finalpage/2016-08-30/1202654499.PDF
2016-09-05,神农基因：新时代证券股份有限公司关于公司发行股份购买资产暨关联交易之补充评估报告的说明,finalpage/2016-09-05/1202675876.PDF
2016-09-05,神农基因：拟发行股份购买资产项目涉及的海南波莲水稻基因科技有限公司股东全部权益价值补充资产评估报告,finalpage/2016-09-05/1202675796.PDF
2016-09-05,神农基因：拟发行股份购买资产项目涉及的海南波莲水稻基因科技有限公司股东全部权益价值补充资产评估说明,finalpage/2016-09-05/1202675797.PDF
2016-09-09,神农基因：关于公司股票停牌的公告,finalpage/2016-09-09/1202689361.PDF
