date,title,url
2013-04-20,神农大丰：关于使用部分超募资金对贵州新中一种业股份有限公司增资的可行性研究报告,finalpage/2013-04-20/62393090.PDF
2013-04-20,神农大丰：关于公司募集资金投资项目完成时间调整的公告,finalpage/2013-04-20/62393091.PDF
2013-04-20,神农大丰：关于变更部分募投项目实施主体和实施地点的公告,finalpage/2013-04-20/62393092.PDF
2013-04-20,神农大丰：关于召开2013年第二次临时股东大会的通知,finalpage/2013-04-20/62393093.PDF
2013-04-20,神农大丰：平安证券有限责任公司关于公司募集资金投资项目完成时间调整的核查意见,finalpage/2013-04-20/62393094.PDF
2013-04-20,神农大丰：平安证券有限责任公司关于公司变更部分募投项目实施主体和实施地点的核查意见,finalpage/2013-04-20/62393095.PDF
2013-04-20,神农大丰：平安证券有限责任公司关于公司使用部分超募资金对贵州新中一种业股份有限公司增资的核查意见,finalpage/2013-04-20/62393096.PDF
2013-04-20,神农大丰：独立董事候选人声明（冯克珊）,finalpage/2013-04-20/62393097.PDF
2013-04-20,神农大丰：独立董事候选人声明（吕品图）,finalpage/2013-04-20/62393098.PDF
2013-04-20,神农大丰：独立董事候选人声明（欧学旺）,finalpage/2013-04-20/62393099.PDF
2013-04-20,神农大丰：独立董事关于公司第四届董事会第二十一次会议审议事项的独立意见,finalpage/2013-04-20/62393100.PDF
2013-04-20,神农大丰：独立董事工作制度（2013年4月）,finalpage/2013-04-20/62393101.PDF
2013-04-20,神农大丰：独立董事提名人声明,finalpage/2013-04-20/62393102.PDF
2013-04-20,神农大丰：第四届监事会第十七次会议决议公告,finalpage/2013-04-20/62393104.PDF
2013-04-20,神农大丰：第四届董事会第二十一次会议决议公告,finalpage/2013-04-20/62393106.PDF
2013-04-20,神农大丰：董事会议事规则（2013年4月）,finalpage/2013-04-20/62393107.PDF
2013-05-03,神农大丰：公司章程（2012年11月）,finalpage/2013-05-03/62455040.PDF
2013-05-03,神农大丰：关于召开2013年第三次临时股东大会的通知,finalpage/2013-05-03/62455041.PDF
2013-05-03,神农大丰：对外投资公告,finalpage/2013-05-03/62455042.PDF
2013-05-03,神农大丰：第四届董事会第二十二次会议决议公告,finalpage/2013-05-03/62455043.PDF
2013-05-10,神农大丰：关于参加“海南辖区上市公司2012年度业绩网上集体说明会”的公告,finalpage/2013-05-10/62479303.PDF
2013-05-16,神农大丰：2012年年度股东大会的法律意见书,finalpage/2013-05-16/62498977.PDF
2013-05-16,神农大丰：2012年度股东大会决议公告,finalpage/2013-05-16/62498978.PDF
2013-05-17,神农大丰：独立董事关于公司聘任高级管理人员事项的独立意见,finalpage/2013-05-17/62501864.PDF
2013-05-17,神农大丰：第五届监事会第一次会议决议公告,finalpage/2013-05-17/62501865.PDF
2013-05-17,神农大丰：第五届董事会第一次会议决议公告,finalpage/2013-05-17/62501866.PDF
2013-05-17,神农大丰：2013年第二次临时股东大会决议公告,finalpage/2013-05-17/62501484.PDF
2013-05-17,神农大丰：2013年第二次临时股东大会的法律意见书,finalpage/2013-05-17/62501485.PDF
2013-05-20,神农大丰：2013年第三次临时股东大会决议公告,finalpage/2013-05-20/62508084.PDF
2013-05-20,神农大丰：2013年第三次临时股东大会的法律意见书,finalpage/2013-05-20/62508085.PDF
2013-06-05,神农大丰：关于签订募集资金四方监管协议的公告,finalpage/2013-06-05/62561329.PDF
2013-06-24,神农大丰：关于签订募集资金四方监管协议的公告,finalpage/2013-06-24/62609918.PDF
2013-07-03,神农大丰：2012年度权益分派实施公告,finalpage/2013-07-03/62769426.PDF
2013-07-12,神农大丰：2013年半年度业绩预告,finalpage/2013-07-12/62829662.PDF
2013-07-22,神农大丰：关于签订《战略合作协议》的公告,finalpage/2013-07-22/62860180.PDF
2013-07-23,神农大丰：对外投资进展公告,finalpage/2013-07-23/62863816.PDF
2013-08-05,神农大丰：关于使用部分超募资金投资设立参股子公司的公告,finalpage/2013-08-05/62908790.PDF
2013-08-05,神农大丰：关于使用部分超募资金投资参股设立子公司的可行性研究报告,finalpage/2013-08-05/62908791.PDF
2013-08-05,神农大丰：平安证券有限责任公司关于公司使用部分超募资金投资设立参股子公司的核查意见,finalpage/2013-08-05/62908792.PDF
2013-08-05,神农大丰：独立董事关于使用部分超募资金投资设立参股子公司的独立意见,finalpage/2013-08-05/62908793.PDF
2013-08-05,神农大丰：第五届董事会第二次会议决议公告,finalpage/2013-08-05/62908794.PDF
2013-08-24,神农大丰：2013年半年度报告摘要,finalpage/2013-08-24/62988636.PDF
2013-08-24,神农大丰：第五届董事会第三次会议决议公告,finalpage/2013-08-24/62988662.PDF
2013-08-24,神农大丰：2013年半年度报告披露提示性公告,finalpage/2013-08-24/62988663.PDF
2013-08-24,神农大丰：第五届监事会第二次会议决议公告,finalpage/2013-08-24/62988664.PDF
2013-08-24,神农大丰：2013年半年度报告,finalpage/2013-08-24/62988665.PDF
2013-08-24,神农大丰：信息披露管理办法（2013年8月）,finalpage/2013-08-24/62988666.PDF
2013-08-24,神农大丰：募集资金管理制度（2013年8月）,finalpage/2013-08-24/62988667.PDF
2013-08-24,神农大丰：对外投资管理办法（2013年8月）,finalpage/2013-08-24/62988668.PDF
2013-08-24,神农大丰：董事、监事和高级管理人员持有本公司股份及其变动的管理制度（2013年8月）,finalpage/2013-08-24/62988669.PDF
2013-08-24,神农大丰：关于投资建设海南南繁种业高技术产业基地的公告,finalpage/2013-08-24/62988670.PDF
2013-08-24,神农大丰：关于投资建设海南南繁种业高技术产业基地的可行性研究报告,finalpage/2013-08-24/62988671.PDF
2013-08-24,神农大丰：独立董事关于对公司第五届董事会第三次会议相关审议事项的独立意见,finalpage/2013-08-24/62988672.PDF
2013-09-03,神农大丰：关于更换持续督导保荐代表人的公告,finalpage/2013-09-03/63045547.PDF
2013-09-05,神农大丰：关于诉讼事项进展的公告,finalpage/2013-09-05/63053221.PDF
2013-09-06,神农大丰：平安证券有限责任公司关于公司2013半年度跟踪报告,finalpage/2013-09-06/63058229.PDF
2013-09-30,神农大丰：对外投资进展公告,finalpage/2013-09-30/63127014.PDF
2013-10-14,神农大丰：2013年前三季度业绩预告,finalpage/2013-10-14/63154602.PDF
2013-10-26,神农大丰：第五届董事会第四次会议决议公告,finalpage/2013-10-26/63197231.PDF
2013-10-26,神农大丰：第五届监事会第三次会议决议公告,finalpage/2013-10-26/63197232.PDF
2013-10-26,神农大丰：2013年第三季度报告全文披露提示性公告,finalpage/2013-10-26/63197313.PDF
2013-10-26,神农大丰：2013年第三季度报告全文,finalpage/2013-10-26/63197314.PDF
2013-10-26,神农大丰：关于投资设立小额贷款公司的公告,finalpage/2013-10-26/63197320.PDF
2013-10-26,神农大丰：关于投资设立小额贷款公司的可行性研究报告,finalpage/2013-10-26/63197321.PDF
2013-10-26,神农大丰：独立董事关于对公司投资设立小额贷款公司事项的独立意见,finalpage/2013-10-26/63197322.PDF
2013-12-27,神农大丰：关于诉讼事项进展的公告,finalpage/2013-12-27/63424412.PDF
2014-01-17,神农大丰：关于召开2014年第一次临时股东大会的通知,finalpage/2014-01-17/63496751.PDF
2014-01-17,神农大丰：关于已建募投项目不再实施并将结余募集资金永久性补充流动资金的公告,finalpage/2014-01-17/63496752.PDF
2014-01-17,神农大丰：平安证券关于公司已建募投项目不再实施并将结余募集资金永久性补充流动资金的核查意见,finalpage/2014-01-17/63496753.PDF
2014-01-17,神农大丰：独立董事关于已建募投项目不再实施并将结余募集资金永久性补充流动资金事项的独立意见,finalpage/2014-01-17/63496754.PDF
2014-01-17,神农大丰：高产优质广适杂交水稻种子产业化工程建设项目募集资金收支结余情况之专项审核报告,finalpage/2014-01-17/63496755.PDF
2014-01-17,神农大丰：第五届监事会第四次会议决议公告,finalpage/2014-01-17/63496756.PDF
2014-01-17,神农大丰：第五届董事会第五次会议决议公告,finalpage/2014-01-17/63496757.PDF
2014-01-28,神农大丰：2013年年度业绩预告,finalpage/2014-01-28/63534720.PDF
2014-02-11,神农大丰：2014年第一次临时股东大会决议公告,finalpage/2014-02-11/63561704.PDF
2014-02-11,神农大丰：2014年第一次临时股东大会的法律意见书,finalpage/2014-02-11/63561705.PDF
2014-02-13,神农大丰：关于实际控制人、股东、关联方以及公司承诺履行情况的公告,finalpage/2014-02-13/63569511.PDF
2014-02-19,神农大丰：关于签订《一站式粮食生产供应链管理战略合作框架协议》的公告,finalpage/2014-02-19/63587808.PDF
2014-02-27,神农大丰：2013年度业绩快报,finalpage/2014-02-27/63616427.PDF
2014-03-14,神农大丰：平安证券有限责任公司关于公司首次公开发行前已发行股份上市流通核查意见,finalpage/2014-03-14/63678662.PDF
2014-03-14,神农大丰：首次公开发行前已发行股份上市流通提示性公告,finalpage/2014-03-14/63678663.PDF
2014-04-09,神农大丰：2014年第一季度业绩预告,finalpage/2014-04-09/63813817.PDF
2014-04-25,神农大丰：2013年度内部控制自我评价报告,finalpage/2014-04-25/63918520.PDF
2014-04-25,神农大丰：2013年度募集资金存放与使用情况的专项报告,finalpage/2014-04-25/63918521.PDF
2014-04-25,神农大丰：2013年度独立董事述职报告（冯克珊）,finalpage/2014-04-25/63918522.PDF
2014-04-25,神农大丰：2013年度独立董事述职报告（吕品图）,finalpage/2014-04-25/63918523.PDF
2014-04-25,神农大丰：2013年度独立董事述职报告（欧学旺）,finalpage/2014-04-25/63918524.PDF
2014-04-25,神农大丰：2013年年度报告摘要,finalpage/2014-04-25/63918525.PDF
2014-04-25,神农大丰：2013年年度审计报告,finalpage/2014-04-25/63918529.PDF
2014-04-25,神农大丰：第五届董事会第六次会议决议公告,finalpage/2014-04-25/63918530.PDF
2014-04-25,神农大丰：2013年年度报告披露提示性公告,finalpage/2014-04-25/63918531.PDF
2014-04-25,神农大丰：第五届监事会第五次会议决议公告,finalpage/2014-04-25/63918532.PDF
2014-04-25,神农大丰：2013年年度报告,finalpage/2014-04-25/63918533.PDF
2014-04-25,神农大丰：2014年第一季度报告全文披露提示性公告,finalpage/2014-04-25/63918535.PDF
2014-04-25,神农大丰：2014年第一季度报告全文,finalpage/2014-04-25/63918536.PDF
2014-04-25,神农大丰：公司章程（2014年4月）,finalpage/2014-04-25/63918537.PDF
2014-04-25,神农大丰：关于使用剩余超募资金永久性补充流动资金的公告,finalpage/2014-04-25/63918538.PDF
2014-04-25,神农大丰：关于召开2013年年度股东大会的通知,finalpage/2014-04-25/63918539.PDF
2014-04-25,神农大丰：平安证券有限责任公司关于公司2013年度内部控制自我评价报告的核查意见,finalpage/2014-04-25/63918540.PDF
2014-04-25,神农大丰：平安证券有限责任公司关于公司2013年度募集资金存放与使用情况的专项核查报告,finalpage/2014-04-25/63918541.PDF
2014-04-25,神农大丰：平安证券有限责任公司关于公司使用剩余超募资金永久性补充流动资金的核查意见,finalpage/2014-04-25/63918542.PDF
2014-04-25,神农大丰：独立董事关于第五届董事会第六次会议审议事项的独立意见,finalpage/2014-04-25/63918543.PDF
2014-04-25,神农大丰：关于对公司控股股东及其他关联方占用资金情况的专项审计说明,finalpage/2014-04-25/63918544.PDF
2014-04-25,神农大丰：募集资金年度存放与使用情况鉴证报告（2013年度）,finalpage/2014-04-25/63918545.PDF
2014-04-25,神农大丰：2014年度投资者关系管理工作计划,finalpage/2014-04-25/63918546.PDF
2014-04-25,神农大丰：关于举行2013年年度报告网上说明会的通知,finalpage/2014-04-25/63918547.PDF
2014-05-09,神农大丰：平安证券有限责任公司关于公司2013年年度跟踪报告,finalpage/2014-05-09/64006328.PDF
2014-05-15,神农大丰：关于参加“海南辖区上市公司2013年度业绩网上集体说明会”的公告,finalpage/2014-05-15/64029913.PDF
2014-05-19,神农大丰：关于控股子公司签订《合作框架协议书》的公告,finalpage/2014-05-19/64043674.PDF
2014-05-27,神农大丰：关于控股股东减持股份的公告,finalpage/2014-05-27/64074234.PDF
2014-05-27,神农大丰：简式权益变动报告书,finalpage/2014-05-27/64074235.PDF
2014-05-29,神农大丰：2013年年度股东大会决议公告,finalpage/2014-05-29/64083180.PDF
2014-05-29,神农大丰：2013年年度股东大会的法律意见书,finalpage/2014-05-29/64083181.PDF
2014-06-17,神农大丰：关于股东减持股份的公告,finalpage/2014-06-17/64142088.PDF
2014-06-17,神农大丰：简式权益变动报告书,finalpage/2014-06-17/64142089.PDF
2014-06-25,神农大丰：关于控股股东减持股份的公告,finalpage/2014-06-25/1200004811.PDF
2014-06-25,神农大丰：简式权益变动报告书,finalpage/2014-06-25/1200004812.PDF
2014-06-27,神农大丰：2013年度权益分派实施公告,finalpage/2014-06-27/1200014956.PDF
2014-07-08,神农大丰：关于股东减持股份的公告,finalpage/2014-07-08/1200041447.PDF
2014-07-08,神农大丰：简式权益变动报告书,finalpage/2014-07-08/1200041448.PDF
2014-07-10,神农大丰：平安证券有限责任公司关于公司首次公开发行前已发行股份上市流通核查意见,finalpage/2014-07-10/1200043843.PDF
2014-07-10,神农大丰：首次公开发行前已发行股份上市流通提示性公告,finalpage/2014-07-10/1200043844.PDF
2014-07-14,神农大丰：2014年半年度业绩预告,finalpage/2014-07-14/1200053315.PDF
2014-07-29,神农大丰：关于“威马逊”超强台风对公司影响情况的公告,finalpage/2014-07-29/1200086754.PDF
2014-08-25,神农大丰：2014年半年度报告摘要,finalpage/2014-08-25/1200154083.PDF
2014-08-25,神农大丰：2014年半年度报告,finalpage/2014-08-25/1200154085.PDF
2014-08-25,神农大丰：独立董事关于对公司2014年半年度相关事项的独立意见,finalpage/2014-08-25/1200154086.PDF
2014-08-25,神农大丰：2014年半年度报告披露提示性公告,finalpage/2014-08-25/1200155424.PDF
2014-09-10,神农大丰：平安证券有限责任公司关于公司2014年半年度跟踪报告,finalpage/2014-09-10/1200222413.PDF
2014-10-10,神农大丰：股票复牌公告,finalpage/2014-10-10/1200285462.PDF
2014-10-14,神农大丰：2014年前三季度业绩预告,finalpage/2014-10-14/1200299067.PDF
2014-10-24,神农大丰：2014年第三季度报告披露提示性公告,finalpage/2014-10-24/1200323204.PDF
2014-10-24,神农大丰：2014年第三季度报告全文,finalpage/2014-10-24/1200323205.PDF
2014-10-31,神农大丰：股票继续停牌公告,finalpage/2014-10-31/1200361029.PDF
2014-11-07,神农大丰：股票继续停牌公告,finalpage/2014-11-07/1200377805.PDF
2014-11-12,神农大丰：股东股份质押公告,finalpage/2014-11-12/1200388150.PDF
2014-11-14,神农大丰：股票继续停牌公告,finalpage/2014-11-14/1200393687.PDF
2014-11-21,神农大丰：股票继续停牌公告,finalpage/2014-11-21/1200408431.PDF
2014-11-27,神农大丰：股票复牌公告,finalpage/2014-11-27/1200419403.PDF
2014-11-28,神农大丰：平安证券有限责任公司关于公司首次公开发行前已发行股份上市流通核查意见,finalpage/2014-11-28/1200424426.PDF
2014-11-28,神农大丰：首次公开发行前已发行股份上市流通提示性公告,finalpage/2014-11-28/1200424427.PDF
2015-01-16,神农大丰：2014年年度业绩预告,finalpage/2015-01-16/1200550993.PDF
2015-02-10,神农大丰：关于签订《一站式粮食生产供应链管理战略合作框架协议》的公告,finalpage/2015-02-10/1200625661.PDF
2015-02-27,神农大丰：2014年度业绩快报,finalpage/2015-02-27/1200657486.PDF
2015-03-18,神农大丰：关于股东减持股份的公告,finalpage/2015-03-18/1200714060.PDF
2015-03-18,神农大丰：简式权益变动报告书,finalpage/2015-03-18/1200714061.PDF
2015-03-24,神农大丰：董事会秘书辞职公告,finalpage/2015-03-24/1200736216.PDF
2015-04-02,神农大丰：2015年第一季度业绩预告,finalpage/2015-04-02/1200777946.PDF
2015-04-14,神农大丰：关于签订《一站式粮食生产供应链管理战略合作框架协议》的公告,finalpage/2015-04-14/1200830799.PDF
2015-04-16,神农大丰：2014年度独立董事述职报告（冯克珊）,finalpage/2015-04-16/1200838746.PDF
2015-04-16,神农大丰：2014年度独立董事述职报告（吕品图）,finalpage/2015-04-16/1200838747.PDF
2015-04-16,神农大丰：2014年度独立董事述职报告（欧学旺）,finalpage/2015-04-16/1200838748.PDF
2015-04-16,神农大丰：2014年年度报告摘要,finalpage/2015-04-16/1200838749.PDF
2015-04-16,神农大丰：第五届董事会第九次会议决议公告,finalpage/2015-04-16/1200838752.PDF
2015-04-16,神农大丰：2014年年度报告披露提示性公告,finalpage/2015-04-16/1200838753.PDF
2015-04-16,神农大丰：第五届监事会第八次会议决议公告,finalpage/2015-04-16/1200838754.PDF
2015-04-16,神农大丰：2014年年度报告,finalpage/2015-04-16/1200838755.PDF
2015-04-16,神农大丰：平安证券有限责任公司关于公司2014年度内部控制自我评价报告的核查意见,finalpage/2015-04-16/1200838756.PDF
2015-04-16,神农大丰：平安证券有限责任公司关于公司2014年度募集资金存放与使用情况的专项核查报告,finalpage/2015-04-16/1200838757.PDF
2015-04-16,神农大丰：平安证券有限责任公司关于公司募集资金投资项目完成时间调整的核查意见,finalpage/2015-04-16/1200838758.PDF
2015-04-16,神农大丰：平安证券有限责任公司关于公司已建募投项目不再实施并将结余募集资金永久性补充流动资金的核查意见,finalpage/2015-04-16/1200838759.PDF
2015-04-16,神农大丰：独立董事关于第五届董事会第九次会议审议事项的独立意见,finalpage/2015-04-16/1200838760.PDF
2015-04-16,神农大丰：2014年度内部控制自我评价报告,finalpage/2015-04-16/1200838761.PDF
2015-04-16,神农大丰：2014年度募集资金存放与使用情况的专项报告,finalpage/2015-04-16/1200838762.PDF
2015-04-16,神农大丰：2015年度投资者关系管理工作计划,finalpage/2015-04-16/1200838763.PDF
2015-04-16,神农大丰：公司章程（2015年4月）,finalpage/2015-04-16/1200838764.PDF
2015-04-16,神农大丰：关于举行2014年年度报告网上说明会的通知,finalpage/2015-04-16/1200838765.PDF
2015-04-16,神农大丰：关于会计政策变更的公告,finalpage/2015-04-16/1200838766.PDF
2015-04-16,神农大丰：关于公司募集资金投资项目完成时间调整的公告,finalpage/2015-04-16/1200838767.PDF
2015-04-16,神农大丰：关于召开2014年年度股东大会的通知,finalpage/2015-04-16/1200838768.PDF
2015-04-16,神农大丰：关于已建募投项目不再实施并将结余募集资金永久性补充流动资金的公告,finalpage/2015-04-16/1200838769.PDF
2015-04-16,神农大丰：关于计提资产减值准备的公告,finalpage/2015-04-16/1200838770.PDF
2015-04-16,神农大丰：控股股东及其他关联方占用资金情况的专项审计说明,finalpage/2015-04-16/1200838771.PDF
2015-04-16,神农大丰：内部控制鉴证报告（2014年12月31日）,finalpage/2015-04-16/1200838772.PDF
2015-04-16,神农大丰：募集资金年度存放与使用情况鉴证报告（2014年度）,finalpage/2015-04-16/1200838773.PDF
2015-04-16,神农大丰：杂交水稻种子市场销售网络体系建设项目募集资金收支结余情况之专项审核报告,finalpage/2015-04-16/1200838774.PDF
2015-04-16,神农大丰：2014年年度审计报告,finalpage/2015-04-16/1200838775.PDF
2015-04-16,神农大丰：股东大会议事规则（2015年4月）,finalpage/2015-04-16/1200838776.PDF
2015-04-23,神农大丰：关于合资设立子公司的公告,finalpage/2015-04-23/1200895407.PDF
2015-04-24,神农大丰：2015年第一季度报告披露提示性公告,finalpage/2015-04-24/1200897841.PDF
2015-04-24,神农大丰：2015年第一季度报告全文,finalpage/2015-04-24/1200897842.PDF
2015-04-30,神农大丰：平安证券有限责任公司关于公司2014年年度跟踪报告,finalpage/2015-04-30/1200945545.PDF
2015-04-30,神农大丰：平安证券有限责任公司关于公司之保荐总结报告书,finalpage/2015-04-30/1200945546.PDF
2015-05-20,神农大丰：2014年年度股东大会决议公告,finalpage/2015-05-20/1201041177.PDF
2015-05-20,神农大丰：2014年年度股东大会的法律意见书,finalpage/2015-05-20/1201041178.PDF
2015-05-23,神农大丰：关于参加“海南辖区上市公司2014年度业绩网上集体说明会”的公告,finalpage/2015-05-23/1201049093.PDF
2015-06-01,神农大丰：关于公司股票停牌的公告,finalpage/2015-06-01/1201086938.PDF
2015-06-05,神农大丰：股票继续停牌公告,finalpage/2015-06-05/1201111597.PDF
2015-06-09,神农大丰：关于签订《一站式粮食生产供应链管理战略合作框架协议》的公告,finalpage/2015-06-09/1201127368.PDF
2015-06-12,神农大丰：股票继续停牌公告,finalpage/2015-06-12/1201145181.PDF
2015-06-17,神农大丰：关于签订《一站式粮食生产供应链管理战略合作框架协议》的公告,finalpage/2015-06-17/1201163710.PDF
2015-06-19,神农大丰：股票继续停牌公告,finalpage/2015-06-19/1201174386.PDF
2015-06-26,神农大丰：股票继续停牌公告,finalpage/2015-06-26/1201200915.PDF
2015-07-02,神农大丰：关于签订《一站式粮食生产供应链管理战略合作框架协议》的公告,finalpage/2015-07-02/1201230640.PDF
2015-07-03,神农大丰：股票继续停牌公告,finalpage/2015-07-03/1201236227.PDF
2015-07-03,神农大丰：关于“H优518”水稻品种被湖南省农业委员会纳入镉低积累水稻应急品种的公告,finalpage/2015-07-03/1201236226.PDF
2015-07-09,神农大丰：关于董事、监事和高级管理人员自愿购买本公司股票的公告,finalpage/2015-07-09/1201266395.PDF
2015-07-09,神农大丰：重大事项进展公告,finalpage/2015-07-09/1201266396.PDF
2015-07-14,神农大丰：2015年半年度业绩预告,finalpage/2015-07-14/1201293851.PDF
2015-07-17,神农大丰：股票继续停牌公告,finalpage/2015-07-17/1201310336.PDF
2015-07-24,神农大丰：股票继续停牌公告,finalpage/2015-07-24/1201343020.PDF
2015-07-27,神农大丰：关于控股子公司申请生物技术发明专利的公告,finalpage/2015-07-27/1201353047.PDF
2015-07-31,神农大丰：股票继续停牌公告,finalpage/2015-07-31/1201375154.PDF
2015-08-07,神农大丰：股票继续停牌公告,finalpage/2015-08-07/1201406679.PDF
2015-08-14,神农大丰：股票继续停牌公告,finalpage/2015-08-14/1201438287.PDF
2015-08-21,神农大丰：股票继续停牌公告,finalpage/2015-08-21/1201472341.PDF
2015-08-26,神农大丰：2015年半年度利润分配及资本公积转增股本预案,finalpage/2015-08-26/1201494203.PDF
2015-08-26,神农大丰：2015年半年度募集资金存放与使用情况的专项报告,finalpage/2015-08-26/1201494204.PDF
2015-08-26,神农大丰：2015年半年度报告摘要,finalpage/2015-08-26/1201494205.PDF
2015-08-26,神农大丰：2015年半年度审计报告,finalpage/2015-08-26/1201494207.PDF
2015-08-26,神农大丰：第五届董事会第十一次会议决议公告,finalpage/2015-08-26/1201494208.PDF
2015-08-26,神农大丰：2015年半年度报告披露提示性公告,finalpage/2015-08-26/1201494209.PDF
2015-08-26,神农大丰：第五届监事会第十次会议决议公告,finalpage/2015-08-26/1201494210.PDF
2015-08-26,神农大丰：2015年半年度报告,finalpage/2015-08-26/1201494211.PDF
2015-08-26,神农大丰：公司章程（2015年8月）,finalpage/2015-08-26/1201494212.PDF
2015-08-26,神农大丰：关于召开2015年第一次临时股东大会的的通知,finalpage/2015-08-26/1201494213.PDF
2015-08-26,神农大丰：独立董事关于对公司第五届董事会第十一次会议审议事项的独立意见,finalpage/2015-08-26/1201494214.PDF
2015-08-28,神农大丰：关于召开2015年第二次临时股东大会的的通知,finalpage/2015-08-28/1201519698.PDF
2015-08-28,神农大丰：第五届董事会第十二次会议决议公告,finalpage/2015-08-28/1201519699.PDF
2015-08-28,神农大丰：股票继续停牌公告,finalpage/2015-08-28/1201519700.PDF
2015-09-08,神农大丰：股票继续停牌公告,finalpage/2015-09-08/1201567509.PDF
2015-09-10,神农大丰：2015年第一次临时股东大会决议公告,finalpage/2015-09-10/1201577815.PDF
2015-09-10,神农大丰：2015年第一次临时股东大会的法律意见书,finalpage/2015-09-10/1201577816.PDF
2015-09-11,神农大丰：2015年半年度权益分派实施公告,finalpage/2015-09-11/1201582509.PDF
2015-09-14,神农大丰：关于更换持续督导保荐代表人的公告,finalpage/2015-09-14/1201593018.PDF
2015-09-15,神农大丰：2015年第二次临时股东大会决议公告,finalpage/2015-09-15/1201598527.PDF
