date,title,url
2014-10-08,太阳鸟：第二届监事会第二十五次会议决议公告,finalpage/2014-10-08/1200279254.PDF
2014-10-08,太阳鸟：非公开发行A股股票预案,finalpage/2014-10-08/1200279255.PDF
2014-10-08,太阳鸟：关于非公开发行股票方案的论证分析报告,finalpage/2014-10-08/1200279256.PDF
2014-10-08,太阳鸟：非公开发行股票募集资金使用的可行性分析报告,finalpage/2014-10-08/1200279257.PDF
2014-10-08,太阳鸟：前次募集资金使用情况报告,finalpage/2014-10-08/1200279258.PDF
2014-10-08,太阳鸟：前次募集资金使用情况鉴证报告,finalpage/2014-10-08/1200279259.PDF
2014-10-10,太阳鸟：股票交易异常波动公告,finalpage/2014-10-10/1200289284.PDF
2014-10-17,太阳鸟：关于2014年第二次临时股东大会召开地点的变更公告,finalpage/2014-10-17/1200309304.PDF
2014-10-24,太阳鸟：2014年第二次临时股东大会决议公告,finalpage/2014-10-24/1200330987.PDF
2014-10-24,太阳鸟：2014年第二次临时股东大会的法律意见书,finalpage/2014-10-24/1200330988.PDF
2014-10-24,太阳鸟：北京市海润律师事务所关于公司免于提交豁免要约收购申请事宜的专项核查意见,finalpage/2014-10-24/1200330989.PDF
2014-10-27,太阳鸟：关于2014年半年度报告披露的提示性公告,finalpage/2014-10-27/1200328621.PDF
2014-10-27,太阳鸟：2014年第三季度报告全文,finalpage/2014-10-27/1200328622.PDF
2014-10-30,太阳鸟：更正公告,finalpage/2014-10-30/1200357229.PDF
2014-11-14,太阳鸟：第二届董事会第二十八次会议决议公告,finalpage/2014-11-14/1200393287.PDF
2014-11-14,太阳鸟：第二届监事会第二十七次会议决议公告,finalpage/2014-11-14/1200393288.PDF
2014-11-14,太阳鸟：为全资子公司珠海太阳鸟游艇制造有限公司提供担保的公告,finalpage/2014-11-14/1200393289.PDF
2014-11-14,太阳鸟：关于全资子公司珠海太阳鸟游艇制造有限公司拟参与竞拍土地使用权的公告,finalpage/2014-11-14/1200393290.PDF
2014-11-14,太阳鸟：独立董事对第二届董事会第二十八次会议相关事项的独立意见,finalpage/2014-11-14/1200393291.PDF
2014-11-18,太阳鸟：关于收到《中国证监会行政许可申请受理通知书》的公告,finalpage/2014-11-18/1200401855.PDF
2014-12-19,太阳鸟：关于对外投资在珠海横琴新区设立融资租赁公司的公告,finalpage/2014-12-19/1200480268.PDF
2014-12-19,太阳鸟：关于召开2015年第一次临时股东大会的公告,finalpage/2014-12-19/1200480303.PDF
2014-12-19,太阳鸟：关于变更持续督导保荐机构及保荐代表人的公告,finalpage/2014-12-19/1200480346.PDF
2014-12-19,太阳鸟：独立董事提名人声明,finalpage/2014-12-19/1200480357.PDF
2014-12-19,太阳鸟：第二届董事会第二十九次会议决议公告,finalpage/2014-12-19/1200480358.PDF
2014-12-19,太阳鸟：独立董事候选人声明（李国强）,finalpage/2014-12-19/1200479995.PDF
2014-12-19,太阳鸟：独立董事候选人声明（李荻辉）,finalpage/2014-12-19/1200479996.PDF
2014-12-19,太阳鸟：独立董事候选人声明（颜爱民）,finalpage/2014-12-19/1200479997.PDF
2014-12-19,太阳鸟：独立董事对公司董事会换届选举等相关事项的独立意见,finalpage/2014-12-19/1200479998.PDF
2014-12-19,太阳鸟：第二届监事会第二十八次会议决议公告,finalpage/2014-12-19/1200480205.PDF
2014-12-24,太阳鸟：关于第三届董事会董事候选人、第三届监事会监事候选人简历的补充公告,finalpage/2014-12-24/1200492835.PDF
2014-12-29,太阳鸟：关于全资子公司珠海太阳鸟收到政府扶持资金的公告,finalpage/2014-12-29/1200504803.PDF
2014-12-29,太阳鸟：关于证券事务代表辞职的公告,finalpage/2014-12-29/1200505020.PDF
2014-12-30,太阳鸟：中标公告,finalpage/2014-12-30/1200506950.PDF
2015-01-05,太阳鸟：关于控股股东股权解除质押及股权质押的公告,finalpage/2015-01-05/1200522505.PDF
2015-01-05,太阳鸟：关于召开2015年第一次临时股东大会的提示性公告,finalpage/2015-01-05/1200522506.PDF
2015-01-06,太阳鸟：关于公司股票期权与限制性股票激励计划预留股票期权授予登记完成的公告,finalpage/2015-01-06/1200526272.PDF
2015-01-12,太阳鸟：2015年第一次临时股东大会决议公告,finalpage/2015-01-12/1200539224.PDF
2015-01-12,太阳鸟：2015年第一次临时股东大会的法律意见书,finalpage/2015-01-12/1200539225.PDF
2015-01-12,太阳鸟：关于高级管理人员辞职的公告,finalpage/2015-01-12/1200539223.PDF
2015-01-15,太阳鸟：关于控股股东及实际控制人部分股权解除质押的公告,finalpage/2015-01-15/1200547942.PDF
2015-01-22,太阳鸟：关于全资子公司参与珠海九洲船员培训中心有限公司增资扩股事项竞标的公告,finalpage/2015-01-22/1200570663.PDF
2015-01-22,太阳鸟：第三届监事会第一次会议决议公告,finalpage/2015-01-22/1200570664.PDF
2015-01-22,太阳鸟：第三届董事会第一次会议决议公告,finalpage/2015-01-22/1200570662.PDF
2015-01-29,太阳鸟：关于选举产生第三届监事会职工代表监事的公告,finalpage/2015-01-29/1200591141.PDF
2015-01-29,太阳鸟：关于全资子公司对外投资后续进展公告,finalpage/2015-01-29/1200591142.PDF
2015-01-31,太阳鸟：2014年度业绩预告公告,finalpage/2015-01-31/1200595401.PDF
2015-02-12,太阳鸟：关于控股股东进行股票质押式回购交易的公告,finalpage/2015-02-12/1200629384.PDF
2015-02-13,太阳鸟：关于非公开发行股票摊薄即期回报的风险提示及公司采取措施的公告,finalpage/2015-02-13/1200636575.PDF
2015-02-27,太阳鸟：中标项目后续进展公告,finalpage/2015-02-27/1200657864.PDF
2015-02-27,太阳鸟：2014年度业绩快报,finalpage/2015-02-27/1200657865.PDF
2015-03-18,太阳鸟：关于公司会计政策变更的公告,finalpage/2015-03-18/1200714735.PDF
2015-03-18,太阳鸟：关于撤回非公开发行股票申请文件的公告,finalpage/2015-03-18/1200714737.PDF
2015-03-18,太阳鸟：独立董事关于第三届董事会第二次会议相关事项的独立意见,finalpage/2015-03-18/1200714738.PDF
2015-03-18,太阳鸟：第三届董事会第二次会议决议公告,finalpage/2015-03-18/1200714734.PDF
2015-03-18,太阳鸟：第三届监事会第二次会议决议公告,finalpage/2015-03-18/1200714736.PDF
2015-03-27,太阳鸟：关于全资子公司签订股权转让框架协议的公告,finalpage/2015-03-27/1200755879.PDF
2015-03-27,太阳鸟：第三届监事会第三次会议决议公告,finalpage/2015-03-27/1200755880.PDF
2015-03-27,太阳鸟：第三届董事会第三次会议决议公告,finalpage/2015-03-27/1200755878.PDF
2015-04-03,太阳鸟：对外投资项目进展公告,finalpage/2015-04-03/1200787655.PDF
2015-04-07,太阳鸟：关于收到《中国证监会行政许可申请终止审查通知书》的公告,finalpage/2015-04-07/1200796699.PDF
2015-04-09,太阳鸟：2015年度第一季度业绩预告,finalpage/2015-04-09/1200806764.PDF
2015-04-10,太阳鸟：2014年度业绩快报修正公告,finalpage/2015-04-10/1200812249.PDF
2015-04-10,太阳鸟：关于公司通过高新技术企业复审的公告,finalpage/2015-04-10/1200812250.PDF
2015-04-10,太阳鸟：关于全资子公司对外投资签订《股权收购合作意向协议书》的公告,finalpage/2015-04-10/1200812251.PDF
2015-04-20,太阳鸟：关于收到广东宝达原股东及公司控股股东承诺函的公告,finalpage/2015-04-20/1200876364.PDF
2015-04-20,太阳鸟：关于获得装备承制单位注册证书的公告,finalpage/2015-04-20/1200876363.PDF
2015-04-27,太阳鸟：2014年度内部控制自我评价报告,finalpage/2015-04-27/1200909779.PDF
2015-04-27,太阳鸟：关于募集资金年度存放与使用情况的专项报告,finalpage/2015-04-27/1200909780.PDF
2015-04-27,太阳鸟：关于公司股票期权与限制性股票激励计划（草案修订稿）失效及注销已授予股票期权及限制性股票的公告,finalpage/2015-04-27/1200909781.PDF
2015-04-27,太阳鸟：北京市天银律师事务所关于公司终止股票期权与限制性股票激励计划的法律意见书,finalpage/2015-04-27/1200909782.PDF
2015-04-27,太阳鸟：关于续聘天健会计师事务所为公司审计机构的公告,finalpage/2015-04-27/1200909783.PDF
2015-04-27,太阳鸟：控股股东及其他关联方资金占用情况的专项审计说明,finalpage/2015-04-27/1200909784.PDF
2015-04-27,太阳鸟：关于举行2014年年度报告网上说明会的通知,finalpage/2015-04-27/1200909785.PDF
2015-04-27,太阳鸟：关于召开2014年年度股东大会的通知,finalpage/2015-04-27/1200909786.PDF
2015-04-27,太阳鸟：关于向有关商业银行申请综合授信额度的公告,finalpage/2015-04-27/1200909787.PDF
2015-04-27,太阳鸟：关于控股股东为公司申请银行授信提供关联担保的公告,finalpage/2015-04-27/1200909788.PDF
2015-04-27,太阳鸟：齐鲁证券有限公司关于公司控股股东为公司申请银行授信提供关联担保的核查意见,finalpage/2015-04-27/1200909789.PDF
2015-04-27,太阳鸟：关于公司2015年日常关联交易计划的公告,finalpage/2015-04-27/1200909790.PDF
2015-04-27,太阳鸟：关于2014年度不进行利润分配的专项说明,finalpage/2015-04-27/1200909791.PDF
2015-04-27,太阳鸟：独立董事关于第三届董事会第四次会议审议事项的事前认可意见及独立意见,finalpage/2015-04-27/1200909792.PDF
2015-04-27,太阳鸟：独立董事2014年度述职报告（李荻辉）,finalpage/2015-04-27/1200909793.PDF
2015-04-27,太阳鸟：独立董事2014年度述职报告（杨新发）,finalpage/2015-04-27/1200909794.PDF
2015-04-27,太阳鸟：独立董事2014年度述职报告（颜爱民）,finalpage/2015-04-27/1200909795.PDF
2015-04-27,太阳鸟：2014年度总经理工作报告,finalpage/2015-04-27/1200909796.PDF
2015-04-27,太阳鸟：2014年度董事会工作报告,finalpage/2015-04-27/1200909797.PDF
2015-04-27,太阳鸟：2014年度财务决算报告,finalpage/2015-04-27/1200909798.PDF
2015-04-27,太阳鸟：董事会审计委员会履职情况暨关于天健2014年度的审计工作总结报告,finalpage/2015-04-27/1200909799.PDF
2015-04-27,太阳鸟：2014年度监事会工作报告,finalpage/2015-04-27/1200909800.PDF
2015-04-27,太阳鸟：2014年年度报告摘要,finalpage/2015-04-27/1200909801.PDF
2015-04-27,太阳鸟：2014年年度审计报告（已取消）,finalpage/2015-04-27/1200909803.PDF
2015-04-27,太阳鸟：第三届董事会第四次会议决议公告,finalpage/2015-04-27/1200909804.PDF
2015-04-27,太阳鸟：2014年年度报告披露提示性公告,finalpage/2015-04-27/1200909805.PDF
2015-04-27,太阳鸟：第三届监事会第四次会议决议公告,finalpage/2015-04-27/1200909806.PDF
2015-04-27,太阳鸟：2014年年度报告,finalpage/2015-04-27/1200909807.PDF
2015-04-27,太阳鸟：2015年度一季度报告提示性公告,finalpage/2015-04-27/1200909809.PDF
2015-04-27,太阳鸟：2015年第一季度报告全文,finalpage/2015-04-27/1200909810.PDF
2015-04-30,太阳鸟：2014年年度审计报告（更新后）,finalpage/2015-04-30/1200957151.PDF
2015-04-30,太阳鸟：关于2014年度审计报告披露的更正公告,finalpage/2015-04-30/1200957150.PDF
2015-05-11,太阳鸟：减资公告,finalpage/2015-05-11/1200999479.PDF
2015-05-11,太阳鸟：关于召开2014年年度股东大会的提示性公告,finalpage/2015-05-11/1200999480.PDF
2015-05-15,太阳鸟：筹划重大事项停牌公告,finalpage/2015-05-15/1201019306.PDF
2015-05-19,太阳鸟：2014年年度股东大会决议公告,finalpage/2015-05-19/1201037212.PDF
2015-05-19,太阳鸟：2014年年度股东大会的法律意见书,finalpage/2015-05-19/1201037213.PDF
2015-05-21,太阳鸟：筹划重大事项继续停牌公告,finalpage/2015-05-21/1201045938.PDF
2015-05-22,太阳鸟：关于控股股东存续分立的提示性公告,finalpage/2015-05-22/1201050475.PDF
2015-05-28,太阳鸟：筹划重大事项继续停牌公告,finalpage/2015-05-28/1201078092.PDF
2015-06-05,太阳鸟：重大资产重组停牌公告,finalpage/2015-06-05/1201106320.PDF
2015-06-11,太阳鸟：重大资产重组停牌进展公告,finalpage/2015-06-11/1201139609.PDF
2015-06-15,太阳鸟：关于控股股东进行股票质押式回购交易的公告,finalpage/2015-06-15/1201153246.PDF
2015-06-18,太阳鸟：重大资产重组停牌进展公告,finalpage/2015-06-18/1201169193.PDF
2015-06-25,太阳鸟：重大资产重组停牌进展公告,finalpage/2015-06-25/1201195892.PDF
2015-06-29,太阳鸟：关于控股股东进行股票质押式回购交易的公告,finalpage/2015-06-29/1201212027.PDF
2015-07-03,太阳鸟：重大资产重组延期复牌及进展公告,finalpage/2015-07-03/1201230213.PDF
2015-07-07,太阳鸟：董事长暨实际控制人声明,finalpage/2015-07-07/1201253133.PDF
2015-07-09,太阳鸟：重大资产重组停牌进展公告,finalpage/2015-07-09/1201267584.PDF
2015-07-13,太阳鸟：关于开展维护公司股价稳定工作的公告,finalpage/2015-07-13/1201286370.PDF
2015-07-15,太阳鸟：关于控股股东进行股票质押式回购交易的公告,finalpage/2015-07-15/1201299055.PDF
2015-07-16,太阳鸟：重大资产重组停牌进展公告,finalpage/2015-07-16/1201304222.PDF
2015-07-23,太阳鸟：重大资产重组停牌进展公告,finalpage/2015-07-23/1201338617.PDF
2015-07-31,太阳鸟：重大资产重组延期复牌及进展公告,finalpage/2015-07-31/1201369395.PDF
2015-08-06,太阳鸟：重大资产重组停牌进展公告,finalpage/2015-08-06/1201401545.PDF
2015-08-14,太阳鸟：关于筹划重大资产重组停牌期满申请继续停牌公告,finalpage/2015-08-14/1201434835.PDF
2015-08-17,太阳鸟：关于股票期权行权价格调整的更正公告,finalpage/2015-08-17/1201449661.PDF
2015-08-17,太阳鸟：关于全资子公司珠海太阳鸟游艇制造有限公司竞拍土地使用权的进展公告,finalpage/2015-08-17/1201449717.PDF
2015-08-19,太阳鸟：关于全资子公司进行对外股权投资后续进展公告,finalpage/2015-08-19/1201462569.PDF
2015-08-19,太阳鸟：第三届董事会第五次会议决议公告,finalpage/2015-08-19/1201462570.PDF
2015-08-19,太阳鸟：第三届监事会第五次会议决议公告,finalpage/2015-08-19/1201462571.PDF
2015-08-20,太阳鸟：重大资产重组停牌进展公告,finalpage/2015-08-20/1201467527.PDF
2015-08-26,太阳鸟：关于募集资金年度存放与使用情况的专项报告,finalpage/2015-08-26/1201494247.PDF
2015-08-26,太阳鸟：2015年半年度报告摘要（已取消）,finalpage/2015-08-26/1201494248.PDF
2015-08-26,太阳鸟：第三届董事会第六次会议决议公告,finalpage/2015-08-26/1201494250.PDF
2015-08-26,太阳鸟：关于2015年半年度报告披露的提示性公告,finalpage/2015-08-26/1201494251.PDF
2015-08-26,太阳鸟：第三届监事会第六次会议决议公告,finalpage/2015-08-26/1201494252.PDF
2015-08-26,太阳鸟：2015年半年度报告（已取消）,finalpage/2015-08-26/1201494253.PDF
2015-08-26,太阳鸟：独立董事对第三届董事会第六次会议相关事项的独立意见,finalpage/2015-08-26/1201494254.PDF
2015-08-27,太阳鸟：重大资产重组停牌进展公告,finalpage/2015-08-27/1201508417.PDF
2015-09-02,太阳鸟：关于《2015年半年度报告》的更正公告,finalpage/2015-09-02/1201542883.PDF
2015-09-02,太阳鸟：2015年半年度报告摘要（更新后）,finalpage/2015-09-02/1201542885.PDF
2015-09-02,太阳鸟：2015年半年度报告（更新后）,finalpage/2015-09-02/1201542884.PDF
2015-09-07,太阳鸟：重大资产重组停牌进展公告,finalpage/2015-09-07/1201560731.PDF
2015-09-15,太阳鸟：重大资产重组延期复牌及进展公告,finalpage/2015-09-15/1201592760.PDF
2015-09-21,太阳鸟：重大资产重组停牌进展公告,finalpage/2015-09-21/1201620517.PDF
2015-09-22,太阳鸟：关于召开2015年第一次临时股东大会的通知,finalpage/2015-09-22/1201624858.PDF
2015-09-22,太阳鸟：关于继续筹划本次停牌相关重大资产重组事项及申请继续停牌的公告,finalpage/2015-09-22/1201624859.PDF
2015-09-22,太阳鸟：关于参加湖南上市公司投资者网上集体接待日活动及召开公司投资者说明会的公告,finalpage/2015-09-22/1201624860.PDF
2015-09-22,太阳鸟：第三届董事会第七次会议决议公告,finalpage/2015-09-22/1201624857.PDF
2015-09-22,太阳鸟：第三届监事会第七次会议决议公告,finalpage/2015-09-22/1201624861.PDF
2015-09-22,太阳鸟：独立董事关于第三届董事会第七次会议审议相关事项的独立意见,finalpage/2015-09-22/1201624862.PDF
2015-09-25,太阳鸟：关于召开2015年第二次临时股东大会的更正公告,finalpage/2015-09-25/1201640329.PDF
2015-09-25,太阳鸟：关于召开2015年第二次临时股东大会的提示性公告,finalpage/2015-09-25/1201640330.PDF
2015-09-28,太阳鸟：重大资产重组停牌进展公告,finalpage/2015-09-28/1201650386.PDF
2015-09-28,太阳鸟：关于公司签署重大合同的公告,finalpage/2015-09-28/1201650387.PDF
2015-09-30,太阳鸟：关于全资子公司对外投资项目进展公告,finalpage/2015-09-30/1201660514.PDF
2015-09-30,太阳鸟：关于公司投资者说明会投资者关心问题的提示性公告,finalpage/2015-09-30/1201660513.PDF
2015-10-08,太阳鸟：2015年第二次临时股东大会决议公告,finalpage/2015-10-08/1201669333.PDF
2015-10-08,太阳鸟：2015年第二次临时股东大会的法律意见书,finalpage/2015-10-08/1201669334.PDF
2015-10-12,太阳鸟：重大资产重组停牌进展公告,finalpage/2015-10-12/1201684265.PDF
2015-10-14,太阳鸟：关于筹划重大资产重组停牌期满再次申请继续停牌公告,finalpage/2015-10-14/1201689326.PDF
2015-10-15,太阳鸟：2015年前三季度业绩预告,finalpage/2015-10-15/1201698154.PDF
2015-10-23,太阳鸟：2015年第三季度报告全文（已取消）,finalpage/2015-10-23/1201715698.PDF
2015-10-23,太阳鸟：第三届董事会第八次会议决议公告,finalpage/2015-10-23/1201715699.PDF
2015-10-23,太阳鸟：独立董事关于第三届董事会第八次会议相关事项的独立意见,finalpage/2015-10-23/1201715700.PDF
2015-10-23,太阳鸟：第三届监事会第八次会议决议公告,finalpage/2015-10-23/1201715701.PDF
2015-10-23,太阳鸟：重大资产重组停牌进展公告,finalpage/2015-10-23/1201715702.PDF
2015-10-23,太阳鸟：关于2015年第三季度报告披露的提示性公告,finalpage/2015-10-23/1201715703.PDF
2015-10-26,太阳鸟：关于《2015年第三季度报告》的修正公告,finalpage/2015-10-26/1201728024.PDF
2015-10-26,太阳鸟：2015年第三季度报告全文（更新后）,finalpage/2015-10-26/1201728023.PDF
2015-10-28,太阳鸟：关于公司股权激励计划已授予全部股票期权完成注销的公告,finalpage/2015-10-28/1201735506.PDF
2015-10-29,太阳鸟：重大资产重组停牌进展公告,finalpage/2015-10-29/1201740226.PDF
2015-11-03,太阳鸟：海关监管艇中标提示性公告,finalpage/2015-11-03/1201751802.PDF
2015-11-05,太阳鸟：重大资产重组停牌进展公告,finalpage/2015-11-05/1201754880.PDF
2015-11-10,太阳鸟：关于签订战略框架协议的公告,finalpage/2015-11-10/1201762502.PDF
2015-11-10,太阳鸟：拟注销股权激励授予限制性股份的提示性公告,finalpage/2015-11-10/1201762503.PDF
2015-11-12,太阳鸟：重大资产重组停牌进展公告,finalpage/2015-11-12/1201766698.PDF
2015-11-16,太阳鸟：第三届董事会第九次会议决议公告,finalpage/2015-11-16/1201772643.PDF
2015-11-16,太阳鸟：第三届监事会第九次会议决议公告,finalpage/2015-11-16/1201772644.PDF
2015-11-16,太阳鸟：关于本次重组的一般风险提示公告,finalpage/2015-11-16/1201772645.PDF
2015-11-16,太阳鸟：关于披露发行股份购买资产并募集配套资金暨关联交易预案公司股票继续停牌的公告,finalpage/2015-11-16/1201772646.PDF
2015-11-16,太阳鸟：董事会关于停牌前公司股票价格波动未达到“128号文”第五条相关标准的说明,finalpage/2015-11-16/1201772647.PDF
2015-11-16,太阳鸟：关于填补本次资产购买摊薄公司当期每股收益具体措施的公告,finalpage/2015-11-16/1201772648.PDF
2015-11-16,太阳鸟：董事会关于本次交易符合《关于规范上市公司重大资产重组若干问题的规定》第四条规定的说明,finalpage/2015-11-16/1201772649.PDF
2015-11-16,太阳鸟：董事会关于本次发行股份购买资产并募集配套资金暨关联交易履行法定程序的完备性、合规性及提交法律文件的有效性的说明,finalpage/2015-11-16/1201772650.PDF
2015-11-16,太阳鸟：独立董事关于公司发行股份购买资产并募集配套资金暨关联交易事项的独立意见,finalpage/2015-11-16/1201772651.PDF
2015-11-16,太阳鸟：公司与发行股份购买资产交易对方就资产重组事宜采取的保密措施及保密制度的说明,finalpage/2015-11-16/1201772652.PDF
2015-11-16,太阳鸟：重大资产重组交易对方声明公告,finalpage/2015-11-16/1201772653.PDF
2015-11-16,太阳鸟：董事/监事/高级管理人员关于重组信息准确性、完整性、合法性的承诺,finalpage/2015-11-16/1201772654.PDF
2015-11-16,太阳鸟：董事/监事/高级管理人员承诺函,finalpage/2015-11-16/1201772655.PDF
2015-11-16,太阳鸟：关于发行股份购买资产并募集配套资金相关事项承诺,finalpage/2015-11-16/1201772656.PDF
2015-11-16,太阳鸟：公司与湖南太阳鸟控股有限公司关于公司发行股份购买资产的协议,finalpage/2015-11-16/1201772657.PDF
2015-11-16,太阳鸟：募集资金管理办法（2015年修订版）,finalpage/2015-11-16/1201772658.PDF
2015-11-16,太阳鸟：发行股份购买资产并募集配套资金暨关联交易预案,finalpage/2015-11-16/1201772659.PDF
2015-11-17,太阳鸟：关于控股股东进行股票质押式回购交易的公告,finalpage/2015-11-17/1201775639.PDF
2015-11-18,太阳鸟：关于拟回购注销股权激励授予限制性股份的补充公告,finalpage/2015-11-18/1201777972.PDF
2015-11-18,太阳鸟：关于海关监管艇中标项目签订合同的进展公告,finalpage/2015-11-18/1201777973.PDF
2015-11-18,太阳鸟：广州证券股份有限公司关于公司发行股份购买资产并募集配套资金暨关联交易预案之独立财务顾问核查意见,finalpage/2015-11-18/1201777971.PDF
2015-11-24,太阳鸟：关于发行股份购买资产事项的进展公告,finalpage/2015-11-24/1201786373.PDF
2015-12-01,太阳鸟：关于公司实际控制人及其配偶拟增持公司股份的公告,finalpage/2015-12-01/1201798429.PDF
2015-12-01,太阳鸟：发行股份购买资产并募集配套资金暨关联交易预案（修订稿）,finalpage/2015-12-01/1201798430.PDF
2015-12-01,太阳鸟：关于深圳证券交易所《关于对太阳鸟游艇股份有限公司的重组问询函》（创业板许可类重组问询函[2015]第59号）有关问题的答复,finalpage/2015-12-01/1201798431.PDF
2015-12-01,太阳鸟：关于公司股票复牌的提示性公告,finalpage/2015-12-01/1201798432.PDF
2015-12-01,太阳鸟：关于发行股份购买资产并募集配套资金暨关联交易预案的修订说明公告,finalpage/2015-12-01/1201798433.PDF
2015-12-01,太阳鸟：广州证券股份有限公司关于对公司重组问询函之核查意见,finalpage/2015-12-01/1201798434.PDF
2015-12-01,太阳鸟：湖南启元律师事务所关于对公司重组问询函之核查意见,finalpage/2015-12-01/1201798435.PDF
2015-12-03,太阳鸟：关于股票交易异常波动的公告,finalpage/2015-12-03/1201805129.PDF
2015-12-11,太阳鸟：第三届董事会第十次会议决议公告,finalpage/2015-12-11/1201827551.PDF
2015-12-11,太阳鸟：第三届监事会第十次会议决议公告,finalpage/2015-12-11/1201827552.PDF
2015-12-11,太阳鸟：关于董事辞职的公告,finalpage/2015-12-11/1201827553.PDF
2015-12-11,太阳鸟：关于收购珠海先歌游艇制造股份有限公司100%股权的后续进展公告,finalpage/2015-12-11/1201827554.PDF
2015-12-14,太阳鸟：关于控股股东部份股票解除质押及进行股票质押式回购交易的公告,finalpage/2015-12-14/1201832807.PDF
2015-12-18,太阳鸟：关于董事辞职的公告,finalpage/2015-12-18/1201845716.PDF
2015-12-23,太阳鸟：珠海先歌游艇制造股份有限公司审计报告,finalpage/2015-12-23/1201854854.PDF
2015-12-23,太阳鸟：益阳中海船舶有限责任公司审计报告,finalpage/2015-12-23/1201854895.PDF
2015-12-23,太阳鸟：重组预案与重组报告书差异说明表,finalpage/2015-12-23/1201854896.PDF
2015-12-23,太阳鸟：审阅报告,finalpage/2015-12-23/1201854902.PDF
2015-12-23,太阳鸟：拟非公开发行股份购买资产项目所涉及之益阳中海船舶有限责任公司股东全部权益评估报告,finalpage/2015-12-23/1201854903.PDF
2015-12-23,太阳鸟：湖南启元律师事务所关于公司发行股份及支付现金购买资产并募集配套资金暨关联交易之法律意见书,finalpage/2015-12-23/1201854911.PDF
2015-12-23,太阳鸟：关于召开2016年第一次临时股东大会的通知,finalpage/2015-12-23/1201854851.PDF
2015-12-23,太阳鸟：关于珠海先歌游艇制造股份有限公司之股份转让协议,finalpage/2015-12-23/1201854852.PDF
2015-12-23,太阳鸟：公司和珠海太阳鸟游艇制造有限公司股权收购事宜涉及的珠海先歌游艇制造股份有限公司股东全部权益评估报告,finalpage/2015-12-23/1201854853.PDF
