date,title,url
2016-06-23,易华录：2016年第一次临时股东大会决议公告,finalpage/2016-06-23/1202394344.PDF
2016-06-23,易华录：2016年第一次临时股东大会的法律意见书,finalpage/2016-06-23/1202394345.PDF
2016-06-29,易华录：关于2015年年报战略合作协议进展的补充公告,finalpage/2016-06-29/1202434413.PDF
2016-06-30,易华录：关于收到中标通知书的公告,finalpage/2016-06-30/1202437803.PDF
2016-07-01,易华录：关于股东解除股份质押及质押的公告,finalpage/2016-07-01/1202442537.PDF
2016-07-02,易华录：重大工程预中标公告,finalpage/2016-07-02/1202445848.PDF
2016-07-05,易华录：2016年半年度业绩预告,finalpage/2016-07-05/1202450215.PDF
2016-07-05,易华录：关于投资者接待日的公告,finalpage/2016-07-05/1202450216.PDF
2016-07-16,易华录：关于收到中标通知书的公告,finalpage/2016-07-16/1202477601.PDF
2016-07-16,易华录：关于签订重大合同的公告,finalpage/2016-07-16/1202477602.PDF
2016-07-30,易华录：重大项目预成交公告,finalpage/2016-07-30/1202517631.PDF
2016-08-12,易华录：关于收到成交通知书的公告,finalpage/2016-08-12/1202557828.PDF
2016-08-23,易华录：2016年半年度报告披露提示性公告,finalpage/2016-08-23/1202600942.PDF
2016-08-23,易华录：第三届董事会第十九次会议决议公告,finalpage/2016-08-23/1202600943.PDF
2016-08-23,易华录：第三届监事会第十次会议决议公告,finalpage/2016-08-23/1202600944.PDF
2016-08-23,易华录：独立董事关于第三届董事会第十九次会议相关事项的独立意见,finalpage/2016-08-23/1202600945.PDF
2016-08-23,易华录：2016年半年度报告,finalpage/2016-08-23/1202600946.PDF
2016-08-23,易华录：2016年半年度报告摘要,finalpage/2016-08-23/1202600947.PDF
2016-08-23,易华录：关于更换持续督导保荐代表人的公告,finalpage/2016-08-23/1202600951.PDF
2016-08-23,易华录：华西证券股份有限公司关于公司2016年上半年度持续督导跟踪报告,finalpage/2016-08-23/1202600952.PDF
2016-08-26,易华录：关于股东解除股份质押及质押的公告,finalpage/2016-08-26/1202619334.PDF
2016-09-03,易华录：关于发行中期票据的公告,finalpage/2016-09-03/1202673121.PDF
2016-09-03,易华录：关于召开2016年第二次临时股东大会会议的通知,finalpage/2016-09-03/1202673122.PDF
2016-09-03,易华录：独立董事关于第三届董事会第二十次会议相关事项的独立意见,finalpage/2016-09-03/1202673123.PDF
2016-09-03,易华录：第三届董事会第二十次会议决议公告,finalpage/2016-09-03/1202673124.PDF
2016-09-03,易华录：关于增资佛山中建交通联合投资有限公司的公告,finalpage/2016-09-03/1202673125.PDF
2016-09-19,易华录：重大项目预成交公告,finalpage/2016-09-19/1202707310.PDF
2016-09-20,易华录：2016年第二次临时股东大会决议公告,finalpage/2016-09-20/1202709029.PDF
2016-09-20,易华录：2016年第二次临时股东大会的法律意见书,finalpage/2016-09-20/1202709030.PDF
2016-09-22,易华录：独立董事关于聘任财务总监的独立意见,finalpage/2016-09-22/1202717219.PDF
2016-09-22,易华录：关于聘任财务总监的公告,finalpage/2016-09-22/1202717220.PDF
2016-09-22,易华录：第三届董事会第二十一次会议决议公告,finalpage/2016-09-22/1202717221.PDF
2016-09-22,易华录：重大工程预中标公告,finalpage/2016-09-22/1202717234.PDF
2016-10-11,易华录：关于入选2016年北京高精尖产业发展基金首批拟合作机构的公告,finalpage/2016-10-11/1202747465.PDF
2016-10-13,易华录：关于签订重大合同的公告,finalpage/2016-10-13/1202754499.PDF
2016-10-14,易华录：2016年前三季度业绩预告,finalpage/2016-10-14/1202758282.PDF
2016-10-14,易华录：关于PPP项目入选第三批政府和社会资本合作示范项目的公告,finalpage/2016-10-14/1202758283.PDF
2016-10-15,易华录：关于收到中标通知书的公告,finalpage/2016-10-15/1202761025.PDF
2016-10-29,易华录：2016年第三季度报告披露提示性公告,finalpage/2016-10-29/1202803021.PDF
2016-10-29,易华录：2016年第三季度报告全文,finalpage/2016-10-29/1202803022.PDF
2016-10-29,易华录：第三届董事会第二十二次会议决议公告,finalpage/2016-10-29/1202803023.PDF
2016-10-29,易华录：第三届监事会第十一次会议决议公告,finalpage/2016-10-29/1202803024.PDF
2016-11-04,易华录：关于控股子公司华录智达科技有限公司进行股份制改造及在全国中小企业股份转让系统申请挂牌的公告,finalpage/2016-11-04/1202814909.PDF
2016-11-04,易华录：关于聘任公司2016年度审计机构的公告,finalpage/2016-11-04/1202814910.PDF
2016-11-04,易华录：独立董事关于第三届董事会第二十三次会议相关事项的独立意见,finalpage/2016-11-04/1202814911.PDF
2016-11-04,易华录：公司章程（2016年11月）,finalpage/2016-11-04/1202814912.PDF
2016-11-04,易华录：独立董事关于聘任公司2016年度审计机构的事前认可意见,finalpage/2016-11-04/1202814913.PDF
2016-11-04,易华录：第三届董事会第二十三次会议决议公告,finalpage/2016-11-04/1202814914.PDF
2016-11-04,易华录：关于为控股子公司山东易华录信息技术有限公司提供担保的公告,finalpage/2016-11-04/1202814915.PDF
2016-11-04,易华录：关于召开2016年第三次临时股东大会会议的通知,finalpage/2016-11-04/1202814916.PDF
2016-11-23,易华录：2016年第三次临时股东大会决议公告,finalpage/2016-11-23/1202839901.PDF
2016-11-23,易华录：2016年第三次临时股东大会的法律意见书,finalpage/2016-11-23/1202839902.PDF
2016-12-01,易华录：关于重大资产重组停牌公告,finalpage/2016-12-01/1202850685.PDF
2016-12-06,易华录：关于重大资产重组停牌进展公告,finalpage/2016-12-06/1202861776.PDF
2016-12-06,易华录：关于签订重大合同的公告,finalpage/2016-12-06/1202859813.PDF
2016-12-13,易华录：关于重大资产重组停牌进展公告,finalpage/2016-12-13/1202873177.PDF
2016-12-20,易华录：关于重大资产重组停牌进展公告,finalpage/2016-12-20/1202908907.PDF
2016-12-23,易华录：关于股东股份质押的公告,finalpage/2016-12-23/1202955307.PDF
2016-12-27,易华录：关于重大资产重组停牌进展公告,finalpage/2016-12-27/1202966053.PDF
2016-12-27,易华录：第三届董事会第二十四次会议决议公告,finalpage/2016-12-27/1202966048.PDF
2016-12-27,易华录：关于发起设立智慧城市产业基金的公告,finalpage/2016-12-27/1202966049.PDF
2016-12-27,易华录：关于参股公司山东易华录投资管理有限公司投资设立北京易华录力鼎投资管理有限公司的公告,finalpage/2016-12-27/1202966050.PDF
2016-12-27,易华录：华西证券股份有限公司关于公司对外担保的专项核查意见,finalpage/2016-12-27/1202966051.PDF
2016-12-27,易华录：关于为参股子公司佛山中建交通联合投资有限公司提供担保的公告,finalpage/2016-12-27/1202966052.PDF
2016-12-28,易华录：关于投资成立蓬莱华录健康养老有限公司的公告,finalpage/2016-12-28/1202969878.PDF
2016-12-28,易华录：关于投资成立蓬莱易华录信息技术有限公司的公告,finalpage/2016-12-28/1202969879.PDF
2016-12-28,易华录：公司章程（2016年12月）,finalpage/2016-12-28/1202969880.PDF
2016-12-28,易华录：第三届董事会第二十五次会议决议公告,finalpage/2016-12-28/1202969881.PDF
2016-12-29,易华录：关于重大资产重组停牌进展暨延期复牌公告,finalpage/2016-12-29/1202969634.PDF
2017-01-05,易华录：关于重大资产重组停牌进展公告,finalpage/2017-01-05/1202994588.PDF
2017-01-12,易华录：关于重大资产重组停牌进展公告,finalpage/2017-01-12/1203011458.PDF
2017-01-16,易华录：重大工程预中标公告,finalpage/2017-01-16/1203019679.PDF
2017-01-18,易华录：关于签订重大合同的公告,finalpage/2017-01-18/1203026030.PDF
2017-01-19,易华录：重大工程预成交公告,finalpage/2017-01-19/1203030641.PDF
2017-01-19,易华录：关于重大资产重组停牌进展公告,finalpage/2017-01-19/1203030642.PDF
2017-01-24,易华录：2016年年度业绩预告,finalpage/2017-01-24/1203051491.PDF
2017-01-25,易华录：重大工程预中标公告,finalpage/2017-01-25/1203055914.PDF
2017-01-25,易华录：第三届董事第二十六次会议决议公告,finalpage/2017-01-25/1203051982.PDF
2017-01-25,易华录：关于重大资产重组停牌进展暨延期复牌公告,finalpage/2017-01-25/1203051983.PDF
2017-02-07,易华录：关于重大资产重组停牌进展公告,finalpage/2017-02-07/1203068310.PDF
2017-02-11,易华录：第三届董事第二十七次会议决议公告,finalpage/2017-02-11/1203076367.PDF
2017-02-11,易华录：关于召开2017年第一次临时股东大会会议的通知,finalpage/2017-02-11/1203076368.PDF
2017-02-11,易华录：关于提请股东大会审议重大资产重组事项申请继续停牌暨与主要交易对手签署资产收购框架协议的公告,finalpage/2017-02-11/1203076369.PDF
2017-02-11,易华录：华西证券股份有限公司关于公司重大资产重组延期复牌的核查意见,finalpage/2017-02-11/1203076370.PDF
2017-02-14,易华录：关于签订重大合同的公告,finalpage/2017-02-14/1203082621.PDF
2017-02-17,易华录：关于重大资产重组停牌进展公告,finalpage/2017-02-17/1203090896.PDF
2017-02-24,易华录：关于重大资产重组停牌进展公告,finalpage/2017-02-24/1203106641.PDF
2017-02-27,易华录：2016年度业绩快报,finalpage/2017-02-27/1203111163.PDF
2017-02-28,易华录：2017年第一次临时股东大会决议公告,finalpage/2017-02-28/1203117741.PDF
2017-02-28,易华录：2017年第一次临时股东大会的法律意见书,finalpage/2017-02-28/1203117743.PDF
2017-02-28,易华录：关于筹划重组期满申请继续停牌的公告,finalpage/2017-02-28/1203117744.PDF
2017-03-03,易华录：关于重大资产重组停牌进展公告,finalpage/2017-03-03/1203129880.PDF
2017-03-03,易华录：关于变更公司英文全称及简称的公告,finalpage/2017-03-03/1203124834.PDF
2017-03-10,易华录：关于重大资产重组停牌进展公告,finalpage/2017-03-10/1203149395.PDF
2017-03-13,易华录：重大工程预成交公告,finalpage/2017-03-13/1203154672.PDF
2017-03-17,易华录：关于重大资产重组停牌进展公告,finalpage/2017-03-17/1203173118.PDF
2017-03-24,易华录：关于重大资产重组停牌进展公告,finalpage/2017-03-24/1203195037.PDF
2017-03-27,易华录：关于与国富瑞数据系统有限公司股东签订股权收购框架协议的重大资产重组进展公告,finalpage/2017-03-27/1203210812.PDF
2017-03-28,易华录：关于公司中期票据发行获准注册的公告,finalpage/2017-03-28/1203216540.PDF
2017-03-30,易华录：关于重大资产重组停牌进展公告,finalpage/2017-03-30/1203238807.PDF
2017-03-30,易华录：中泰证券股份有限公司关于公司发行股份及支付现金购买资产停牌期间重组进展信息披露真实性、继续停牌合理性和六个月内复牌可行性的核查意见,finalpage/2017-03-30/1203238808.PDF
2017-04-06,易华录：关于股东股份质押及部分质押延期购回的公告,finalpage/2017-04-06/1203258144.PDF
2017-04-07,易华录：2017年第一季度业绩预告,finalpage/2017-04-07/1203260823.PDF
2017-04-07,易华录：关于重大资产重组停牌进展公告,finalpage/2017-04-07/1203260824.PDF
2017-04-14,易华录：关于重大资产重组停牌进展公告,finalpage/2017-04-14/1203300305.PDF
2017-04-18,易华录：2016年年度报告披露提示性公告,finalpage/2017-04-18/1203315281.PDF
2017-04-18,易华录：2016年年度审计报告,finalpage/2017-04-18/1203315282.PDF
2017-04-18,易华录：第三届监事会第十二次会议决议公告,finalpage/2017-04-18/1203315283.PDF
2017-04-18,易华录：独立董事关于第三届董事会第二十八次会议相关事项的独立意见,finalpage/2017-04-18/1203315284.PDF
2017-04-18,易华录：独立董事关于第三届董事会第二十八次会议相关事项的事前认可意见,finalpage/2017-04-18/1203315285.PDF
2017-04-18,易华录：2016年度内部控制自我评价报告,finalpage/2017-04-18/1203315286.PDF
2017-04-18,易华录：内部控制自我评价报告的审核评价意见,finalpage/2017-04-18/1203315287.PDF
2017-04-18,易华录：华西证券股份有限公司关于公司内部控制自我评价报告的核查意见,finalpage/2017-04-18/1203315288.PDF
2017-04-18,易华录：关于续聘公司2017年度审计机构的公告,finalpage/2017-04-18/1203315289.PDF
2017-04-18,易华录：华西证券股份有限公司关于公司2016年度持续督导跟踪报告,finalpage/2017-04-18/1203315290.PDF
2017-04-18,易华录：华西证券股份有限公司关于公司2017年度日常经营关联交易预计事项的核查意见,finalpage/2017-04-18/1203315291.PDF
2017-04-18,易华录：2017年度日常经营关联交易预计事项的公告,finalpage/2017-04-18/1203315292.PDF
2017-04-18,易华录：关于举行2016年度网上业绩说明会的公告,finalpage/2017-04-18/1203315293.PDF
2017-04-18,易华录：关于公司非经营性资金占用及其他关联资金往来的专项说明,finalpage/2017-04-18/1203315294.PDF
2017-04-18,易华录：2016年年度募集资金存放及使用情况专项审计报告,finalpage/2017-04-18/1203315295.PDF
2017-04-18,易华录：华西证券股份有限公司关于公司募集资金2016年度使用情况的专项核查意见,finalpage/2017-04-18/1203315296.PDF
2017-04-18,易华录：2016年年度报告,finalpage/2017-04-18/1203315297.PDF
2017-04-18,易华录：2016年年度报告摘要,finalpage/2017-04-18/1203315298.PDF
2017-04-18,易华录：第三届董事会第二十八次会议决议公告,finalpage/2017-04-18/1203315299.PDF
2017-04-18,易华录：关于公司2016年度募集资金存放与使用情况鉴证报告,finalpage/2017-04-18/1203315300.PDF
2017-04-18,易华录：关于公司未来三年（2017年-2019年）股东回报规划,finalpage/2017-04-18/1203315301.PDF
2017-04-18,易华录：2016年独立董事述职报告（吴晶妹）,finalpage/2017-04-18/1203315302.PDF
2017-04-18,易华录：2016年独立董事述职报告（梁云凤）,finalpage/2017-04-18/1203315303.PDF
2017-04-18,易华录：2016年独立董事述职报告（杨晓光）,finalpage/2017-04-18/1203315304.PDF
2017-04-18,易华录：关于控股子公司拟投资建设产业园的公告,finalpage/2017-04-18/1203315305.PDF
2017-04-21,易华录：关于重大资产重组停牌进展公告,finalpage/2017-04-21/1203357913.PDF
2017-04-25,易华录：2017年第一季度报告披露提示性公告,finalpage/2017-04-25/1203375765.PDF
2017-04-25,易华录：第三届董事会第二十九次会议决议公告,finalpage/2017-04-25/1203375766.PDF
2017-04-25,易华录：第三届监事会第十三次会议决议公告,finalpage/2017-04-25/1203375767.PDF
2017-04-25,易华录：2017年第一季度报告全文,finalpage/2017-04-25/1203375768.PDF
2017-04-28,易华录：第三届董事会第三十次会议决议公告,finalpage/2017-04-28/1203413411.PDF
2017-04-28,易华录：关于终止重大资产重组事项暨公司股票复牌的公告,finalpage/2017-04-28/1203413412.PDF
2017-04-28,易华录：独立董事关于终止重大资产重组事项的独立意见,finalpage/2017-04-28/1203413413.PDF
2017-04-28,易华录：独立董事关于终止重大资产重组事项的事前认可意见,finalpage/2017-04-28/1203413414.PDF
2017-04-28,易华录：中泰证券股份有限公司关于公司终止筹划重大资产重组事项的核查意见,finalpage/2017-04-28/1203413415.PDF
2017-04-28,易华录：关于签署股权转让协议暨对外投资的公告,finalpage/2017-04-28/1203413416.PDF
2017-05-03,易华录：关于签订重大合同的公告,finalpage/2017-05-03/1203474055.PDF
2017-05-05,易华录：关于召开2016年度股东大会的通知,finalpage/2017-05-05/1203475487.PDF
2017-05-09,易华录：关于2017年度第一期中期票据发行结果的公告,finalpage/2017-05-09/1203487127.PDF
2017-05-16,易华录：关于拟通过挂牌方式转让控股子公司部分股权的公告,finalpage/2017-05-16/1203525991.PDF
2017-05-16,易华录：独立董事关于第三届董事会第三十一次会议相关事项的独立意见,finalpage/2017-05-16/1203525992.PDF
2017-05-16,易华录：独立董事关于第三届董事会第三十一次会议相关事项的事前认可意见,finalpage/2017-05-16/1203525993.PDF
2017-05-16,易华录：关于投资设立乌当易华录数字产业基金的公告,finalpage/2017-05-16/1203525994.PDF
2017-05-16,易华录：关于投资设立河北冀财易华录京津冀投资发展基金的公告,finalpage/2017-05-16/1203525995.PDF
2017-05-16,易华录：华西证券股份有限公司关于公司关联交易的专项核查意见,finalpage/2017-05-16/1203525996.PDF
2017-05-16,易华录：第三届董事会第三十一次会议决议公告,finalpage/2017-05-16/1203525989.PDF
2017-05-16,易华录：关于拟收购控股子公司部分股权暨关联交易的公告,finalpage/2017-05-16/1203525990.PDF
2017-05-25,易华录：2016年度股东大会决议公告,finalpage/2017-05-25/1203568135.PDF
2017-05-25,易华录：2016年度股东大会的法律意见书,finalpage/2017-05-25/1203568136.PDF
2017-06-01,易华录：关于股东股份质押及部分股份解除质押的公告,finalpage/2017-06-01/1203579465.PDF
2017-06-14,易华录：关于签署乌当易华录数字经济产业发展中心合伙协议的公告,finalpage/2017-06-14/1203615449.PDF
2017-06-16,易华录：2016年年度权益分派实施公告,finalpage/2017-06-16/1203617806.PDF
2017-06-20,易华录：关于签署北京智慧城市产业基金合伙协议的公告,finalpage/2017-06-20/1203630911.PDF
2017-06-21,易华录：关于子公司拟发起设立产业并购基金的公告,finalpage/2017-06-21/1203634088.PDF
2017-07-05,易华录：关于投资设立的产业基金完成工商登记的公告,finalpage/2017-07-05/1203682076.PDF
2017-07-05,易华录：关于签订重大合同的公告,finalpage/2017-07-05/1203682078.PDF
2017-07-12,易华录：2017年半年度业绩预告,finalpage/2017-07-12/1203694221.PDF
2017-07-12,易华录：第三届董事会第三十二次会议决议公告,finalpage/2017-07-12/1203694222.PDF
2017-07-12,易华录：关于以现金方式收购国富瑞数据系统有限公司55.2357%股权的公告,finalpage/2017-07-12/1203694223.PDF
2017-07-27,易华录：关于股东部分股份补充质押的公告,finalpage/2017-07-27/1203736254.PDF
2017-08-03,易华录：关于控股子公司变更公司名称及注册资本的公告,finalpage/2017-08-03/1203759552.PDF
2017-08-15,易华录：关于召开2017年第二次临时股东大会的通知,finalpage/2017-08-15/1203796901.PDF
2017-08-15,易华录：第三届董事会第三十三次会议决议公告,finalpage/2017-08-15/1203796902.PDF
2017-08-15,易华录：关于变更公司经营范围、增加党建工作内容并修订《公司章程》的公告,finalpage/2017-08-15/1203796903.PDF
2017-08-17,易华录：关于控股子公司国富瑞数据系统有限公司完成工商变更登记的公告,finalpage/2017-08-17/1203807306.PDF
2017-08-19,易华录：关于股东股份质押及部分股份解除质押的公告,finalpage/2017-08-19/1203819935.PDF
2017-08-22,易华录：2017年半年度报告摘要,finalpage/2017-08-22/1203836179.PDF
2017-08-22,易华录：第三届董事会第三十四次会议决议公告,finalpage/2017-08-22/1203836180.PDF
2017-08-22,易华录：第三届监事会第十四次会议决议公告,finalpage/2017-08-22/1203836181.PDF
2017-08-22,易华录：独立董事关于第三届董事会第三十四次会议相关事项的独立意见,finalpage/2017-08-22/1203836182.PDF
2017-08-22,易华录：2017年半年度报告披露提示性公告,finalpage/2017-08-22/1203836183.PDF
2017-08-22,易华录：2017年半年度报告,finalpage/2017-08-22/1203836184.PDF
2017-08-22,易华录：华西证券股份有限公司关于公司2017年上半年度持续督导跟踪报告,finalpage/2017-08-22/1203836185.PDF
2017-08-25,易华录：关于股东股份质押及部分股份解除质押的公告,finalpage/2017-08-25/1203872169.PDF
2017-09-01,易华录：2017年第二次临时股东大会的法律意见书,finalpage/2017-09-01/1203925089.PDF
2017-09-01,易华录：2017年第二次临时股东大会决议公告,finalpage/2017-09-01/1203925090.PDF
2017-09-01,易华录：公司章程（2017年8月）,finalpage/2017-09-01/1203925091.PDF
2017-09-08,易华录：独立董事关于以控股子公司股权质押进行贷款的独立意见,finalpage/2017-09-08/1203959952.PDF
2017-09-08,易华录：第三届董事会第三十五次会议决议公告,finalpage/2017-09-08/1203959953.PDF
2017-09-08,易华录：关于以控股子公司股权质押进行贷款的公告,finalpage/2017-09-08/1203959954.PDF
2017-09-12,易华录：PPP项目成交公告,finalpage/2017-09-12/1203968324.PDF
2017-09-21,易华录：关于股东股份质押的公告,finalpage/2017-09-21/1203989734.PDF
2017-10-13,易华录：2017年第三季度业绩预告,finalpage/2017-10-13/1204039885.PDF
2017-10-16,易华录：第三届董事会第三十六次会议决议公告,finalpage/2017-10-16/1204045898.PDF
2017-10-16,易华录：关于控股子公司投资设立山东易新信息技术有限公司的公告,finalpage/2017-10-16/1204045899.PDF
2017-10-19,易华录：第三届董事会第三十七次会议决议公告,finalpage/2017-10-19/1204052680.PDF
2017-10-19,易华录：关于变更公司经营范围并修订《公司章程》的公告,finalpage/2017-10-19/1204052681.PDF
2017-10-19,易华录：关于召开2017年第三次临时股东大会的通知,finalpage/2017-10-19/1204052682.PDF
2017-10-19,易华录：公司章程（2017年10月）,finalpage/2017-10-19/1204052683.PDF
2017-10-27,易华录：2017年第三季度报告披露提示性公告,finalpage/2017-10-27/1204080060.PDF
2017-10-27,易华录：第三届董事会第三十八次会议决议公告,finalpage/2017-10-27/1204080061.PDF
2017-10-27,易华录：第三届监事会第十五次会议决议公告,finalpage/2017-10-27/1204080062.PDF
2017-10-27,易华录：2017年第三季度报告全文,finalpage/2017-10-27/1204080063.PDF
2017-10-30,易华录：关于股东解除部分股份质押的公告,finalpage/2017-10-30/1204097160.PDF
2017-11-03,易华录：2017年第三次临时股东大会决议公告,finalpage/2017-11-03/1204112378.PDF
2017-11-03,易华录：2017年第三次临时股东大会的法律意见书,finalpage/2017-11-03/1204112379.PDF
2017-11-07,易华录：独立董事关于限制性股票激励计划（草案）的独立意见,finalpage/2017-11-07/1204122769.PDF
2017-11-07,易华录：限制性股票激励计划（草案）,finalpage/2017-11-07/1204122770.PDF
2017-11-07,易华录：限制性股票激励计划（草案）摘要,finalpage/2017-11-07/1204122771.PDF
2017-11-07,易华录：中泰证券股份有限公司关于公司限制性股票激励计划（草案）之独立财务顾问报告,finalpage/2017-11-07/1204122772.PDF
2017-11-07,易华录：上市公司股权激励计划自查表,finalpage/2017-11-07/1204122773.PDF
2017-11-07,易华录：限制性股票激励计划实施考核管理办法,finalpage/2017-11-07/1204122774.PDF
2017-11-07,易华录：限制性股票激励计划激励对象名单,finalpage/2017-11-07/1204122775.PDF
2017-11-07,易华录：北京市海勤律师事务所关于公司股权激励计划的法律意见书,finalpage/2017-11-07/1204122776.PDF
2017-11-07,易华录：第三届董事会第三十九次会议决议公告,finalpage/2017-11-07/1204122767.PDF
2017-11-07,易华录：第三届监事会第十六次会议决议公告,finalpage/2017-11-07/1204122768.PDF
2017-11-09,易华录：关于股东部分股份质押及延期质押的公告,finalpage/2017-11-09/1204128855.PDF
2017-12-07,易华录：关于重大项目中标的公告,finalpage/2017-12-07/1204199059.PDF
2017-12-08,易华录：关于成为综合交通运输大数据行业研发中心的公告,finalpage/2017-12-08/1204206089.PDF
2017-12-12,易华录：第三届董事会第四十次会议决议公告,finalpage/2017-12-12/1204215159.PDF
2017-12-12,易华录：独立董事关于公司董事会换届选举及提名董事候选人的独立意见,finalpage/2017-12-12/1204215160.PDF
2017-12-12,易华录：独立董事候选人声明（梁云凤）,finalpage/2017-12-12/1204215161.PDF
2017-12-12,易华录：独立董事候选人声明（吴晶妹）,finalpage/2017-12-12/1204215162.PDF
2017-12-12,易华录：独立董事候选人声明（杨晓光）,finalpage/2017-12-12/1204215163.PDF
2017-12-12,易华录：独立董事提名人声明（一）,finalpage/2017-12-12/1204215164.PDF
2017-12-12,易华录：独立董事提名人声明（三）,finalpage/2017-12-12/1204215165.PDF
2017-12-12,易华录：独立董事提名人声明（二）,finalpage/2017-12-12/1204215166.PDF
2017-12-12,易华录：第三届监事会第十七次会议决议公告,finalpage/2017-12-12/1204215167.PDF
2017-12-12,易华录：关于召开2017年第四次临时股东大会的通知,finalpage/2017-12-12/1204215168.PDF
2017-12-12,易华录：关于独立董事公开征集委托投票权的公告,finalpage/2017-12-12/1204215169.PDF
2017-12-12,易华录：关于控股子公司参股设立华录健康养老服务（南通）有限公司的公告,finalpage/2017-12-12/1204215170.PDF
2017-12-12,易华录：关于清算注销项目公司的公告,finalpage/2017-12-12/1204215171.PDF
