date,title,url
2015-04-13,正海磁材：关于披露2015年第一季度报告的提示性公告,finalpage/2015-04-13/1200811759.PDF
2015-04-13,正海磁材：2015年第一季度报告全文,finalpage/2015-04-13/1200811760.PDF
2015-04-20,正海磁材：光大证券股份有限公司关于公司2014年度跟踪报告,finalpage/2015-04-20/1200873868.PDF
2015-04-20,正海磁材：光大证券股份有限公司关于公司IPO项目保荐总结报告书,finalpage/2015-04-20/1200873869.PDF
2015-04-24,正海磁材：关于召开2014年度股东大会的提示性公告,finalpage/2015-04-24/1200908748.PDF
2015-04-28,正海磁材：2014年度股东大会之律师见证法律意见书,finalpage/2015-04-28/1200933458.PDF
2015-04-28,正海磁材：2014年度股东大会决议公告,finalpage/2015-04-28/1200933459.PDF
2015-04-29,正海磁材：限制性股票激励计划激励对象名单,finalpage/2015-04-29/1200945331.PDF
2015-04-29,正海磁材：二届监事会第十八次会议决议公告,finalpage/2015-04-29/1200945327.PDF
2015-04-29,正海磁材：二届董事会第十九次会议决议公告,finalpage/2015-04-29/1200945328.PDF
2015-04-29,正海磁材：关于限制性股票激励计划授予相关事项的公告,finalpage/2015-04-29/1200945329.PDF
2015-04-29,正海磁材：独立董事对相关事项的独立意见,finalpage/2015-04-29/1200945332.PDF
2015-04-29,正海磁材：北京大成（上海）律师事务所关于公司限制性股票激励计划授予相关事项的法律意见书,finalpage/2015-04-29/1200945330.PDF
2015-05-11,正海磁材：关于董事辞职的公告,finalpage/2015-05-11/1200999304.PDF
2015-05-18,正海磁材：关于限制性股票授予完成的公告,finalpage/2015-05-18/1201030733.PDF
2015-05-21,正海磁材：2014年度权益分派实施公告,finalpage/2015-05-21/1201041234.PDF
2015-05-21,正海磁材：简式权益变动报告书,finalpage/2015-05-21/1201041471.PDF
2015-05-29,正海磁材：独立董事对相关事项的独立意见,finalpage/2015-05-29/1201082454.PDF
2015-05-29,正海磁材：公司章程（2015年5月）,finalpage/2015-05-29/1201082449.PDF
2015-05-29,正海磁材：公司章程修订对照表,finalpage/2015-05-29/1201082450.PDF
2015-05-29,正海磁材：关于办公地址变更的公告,finalpage/2015-05-29/1201082451.PDF
2015-05-29,正海磁材：关于召开2015年第二次临时股东大会的通知,finalpage/2015-05-29/1201082452.PDF
2015-05-29,正海磁材：关于增加使用闲置自有资金购买银行理财产品的公告,finalpage/2015-05-29/1201082453.PDF
2015-05-29,正海磁材：二届监事会第十九次会议决议公告,finalpage/2015-05-29/1201082447.PDF
2015-05-29,正海磁材：二届董事会第二十次会议决议公告,finalpage/2015-05-29/1201082448.PDF
2015-06-12,正海磁材：关于召开2015年第二次临时股东大会的提示性公告,finalpage/2015-06-12/1201144414.PDF
2015-06-15,正海磁材：2015年第二次临时股东大会之律师见证法律意见书,finalpage/2015-06-15/1201154087.PDF
2015-06-15,正海磁材：2015年第二次临时股东大会决议公告,finalpage/2015-06-15/1201154088.PDF
2015-06-24,正海磁材：关于控股股东将所持部分股份解除质押及重新质押的公告,finalpage/2015-06-24/1201190411.PDF
2015-07-07,正海磁材：2015年半年度业绩预告,finalpage/2015-07-07/1201253835.PDF
2015-07-10,正海磁材：关于维护股价稳定的具体方案的公告,finalpage/2015-07-10/1201273449.PDF
2015-07-24,正海磁材：关于独立董事辞职的公告,finalpage/2015-07-24/1201343037.PDF
2015-07-29,正海磁材：关于控股子公司对外投资的公告,finalpage/2015-07-29/1201358490.PDF
2015-08-07,正海磁材：股票交易异常波动公告,finalpage/2015-08-07/1201402168.PDF
2015-08-11,正海磁材：2015年半年度募集资金存放与使用情况的专项报告,finalpage/2015-08-11/1201417571.PDF
2015-08-11,正海磁材：2015年半年度报告摘要,finalpage/2015-08-11/1201417572.PDF
2015-08-11,正海磁材：2015年半年度报告,finalpage/2015-08-11/1201417573.PDF
2015-08-11,正海磁材：二届董事会第二十一次会议决议公告,finalpage/2015-08-11/1201417574.PDF
2015-08-11,正海磁材：关于披露2015年半年度报告的提示性公告,finalpage/2015-08-11/1201417575.PDF
2015-08-11,正海磁材：二届监事会第二十次会议决议公告,finalpage/2015-08-11/1201417576.PDF
2015-08-11,正海磁材：独立董事对相关事项的独立意见,finalpage/2015-08-11/1201417577.PDF
2015-08-12,正海磁材：关于2015年半年度报告全文及其摘要的更正公告,finalpage/2015-08-12/1201422591.PDF
2015-08-25,正海磁材：关于控股股东将所持部分股份解除质押及重新质押的公告,finalpage/2015-08-25/1201489067.PDF
2015-09-15,正海磁材：关于控股子公司对外投资进展公告,finalpage/2015-09-15/1201593062.PDF
2015-10-14,正海磁材：2015年前三季度业绩预告,finalpage/2015-10-14/1201688183.PDF
2015-10-27,正海磁材：关于披露2015年第三季度报告的提示性公告,finalpage/2015-10-27/1201725275.PDF
2015-10-27,正海磁材：2015年第三季度报告全文,finalpage/2015-10-27/1201725276.PDF
2015-12-29,正海磁材：关于使用募投项目的节余募集资金永久补充流动资金的公告,finalpage/2015-12-29/1201870370.PDF
2015-12-29,正海磁材：关于召开2016年第一次临时股东大会的通知,finalpage/2015-12-29/1201870373.PDF
2015-12-29,正海磁材：二届监事会第二十二次会议决议公告,finalpage/2015-12-29/1201870374.PDF
2015-12-29,正海磁材：独立董事关于相关事项的独立意见,finalpage/2015-12-29/1201870375.PDF
2015-12-29,正海磁材：独立董事提名人声明（一）,finalpage/2015-12-29/1201870376.PDF
2015-12-29,正海磁材：独立董事提名人声明（二）,finalpage/2015-12-29/1201870377.PDF
2015-12-29,正海磁材：独立董事提名人声明（三）,finalpage/2015-12-29/1201870378.PDF
2015-12-29,正海磁材：独立董事候选人声明（柳喜军）,finalpage/2015-12-29/1201870379.PDF
2015-12-29,正海磁材：独立董事候选人声明（殷承良）,finalpage/2015-12-29/1201870380.PDF
2015-12-29,正海磁材：独立董事候选人声明（于建青）,finalpage/2015-12-29/1201870381.PDF
2015-12-29,正海磁材：光大证券股份有限公司关于公司募投项目的节余募集资金永久补充流动资金的核查意见,finalpage/2015-12-29/1201870382.PDF
2015-12-29,正海磁材：二届董事会第二十三次会议决议公告,finalpage/2015-12-29/1201870383.PDF
2016-01-12,正海磁材：关于召开2016年第一次临时股东大会的提示性公告,finalpage/2016-01-12/1201905366.PDF
2016-01-15,正海磁材：三届监事会第一次会议决议公告,finalpage/2016-01-15/1201920621.PDF
2016-01-15,正海磁材：独立董事关于变更会计师事务所的事前认可意见,finalpage/2016-01-15/1201920612.PDF
2016-01-15,正海磁材：独立董事关于相关事项的独立意见,finalpage/2016-01-15/1201920613.PDF
2016-01-15,正海磁材：关于变更会计师事务所的公告,finalpage/2016-01-15/1201920614.PDF
2016-01-15,正海磁材：关于聘任证券事务代表的公告,finalpage/2016-01-15/1201920615.PDF
2016-01-15,正海磁材：关于使用超募资金永久性补充流动资金的公告,finalpage/2016-01-15/1201920616.PDF
2016-01-15,正海磁材：关于增加使用闲置自有资金购买银行理财产品的公告,finalpage/2016-01-15/1201920617.PDF
2016-01-15,正海磁材：关于召开2016年第二次临时股东大会的通知,finalpage/2016-01-15/1201920618.PDF
2016-01-15,正海磁材：光大证券股份有限公司关于公司使用超募资金永久性补充流动资金的核查意见,finalpage/2016-01-15/1201920619.PDF
2016-01-15,正海磁材：三届董事会第一次会议决议公告,finalpage/2016-01-15/1201920620.PDF
2016-01-15,正海磁材：2016年第一次临时股东大会之律师见证法律意见书,finalpage/2016-01-15/1201919875.PDF
2016-01-15,正海磁材：关于选举产生三届监事会职工代表监事的公告,finalpage/2016-01-15/1201919876.PDF
2016-01-15,正海磁材：2016年第一次临时股东大会决议公告,finalpage/2016-01-15/1201919874.PDF
2016-01-27,正海磁材：关于召开2016年第二次临时股东大会的提示性公告,finalpage/2016-01-27/1201943123.PDF
2016-01-29,正海磁材：2015年度业绩快报,finalpage/2016-01-29/1201954948.PDF
2016-02-01,正海磁材：2016年第二次临时股东大会决议公告,finalpage/2016-02-01/1201957784.PDF
2016-02-01,正海磁材：2016年第二次临时股东大会之律师见证法律意见书,finalpage/2016-02-01/1201957785.PDF
2016-02-19,正海磁材：关于办公地址门牌号变更的公告,finalpage/2016-02-19/1201987934.PDF
2016-03-21,正海磁材：关于公司营业执照、组织机构代码证、税务登记证“三证合一”的公告,finalpage/2016-03-21/1202057702.PDF
2016-03-21,正海磁材：关于筹划非公开发行股票事项的停牌公告,finalpage/2016-03-21/1202057703.PDF
2016-03-28,正海磁材：关于筹划非公开发行股票事项停牌的进展公告,finalpage/2016-03-28/1202081874.PDF
2016-04-05,正海磁材：关于策划非公开发行股票事项停牌进展暨延期复牌的公告,finalpage/2016-04-05/1202132841.PDF
2016-04-08,正海磁材：中信建投证券股份有限公司关于公司发行股份购买资产项目限售股份解禁上市流通的核查意见,finalpage/2016-04-08/1202155110.PDF
2016-04-08,正海磁材：非公开发行限售股流通的提示性公告,finalpage/2016-04-08/1202155109.PDF
2016-04-08,正海磁材：2016年第一季度业绩预告,finalpage/2016-04-08/1202148749.PDF
2016-04-09,正海磁材：独立董事关于公司非公开发行相关事项的事前认可意见,finalpage/2016-04-09/1202155552.PDF
2016-04-09,正海磁材：独立董事关于三届董事会第二次会议的独立意见,finalpage/2016-04-09/1202155553.PDF
2016-04-09,正海磁材：非公开发行股票方案论证分析报告,finalpage/2016-04-09/1202155554.PDF
2016-04-09,正海磁材：非公开发行股票募集资金使用可行性报告,finalpage/2016-04-09/1202155555.PDF
2016-04-09,正海磁材：关于非公开发行股票权益变动的提示性公告,finalpage/2016-04-09/1202155556.PDF
2016-04-09,正海磁材：保障公司填补即期回报措施切实履行的承诺公告,finalpage/2016-04-09/1202155557.PDF
2016-04-09,正海磁材：关于非公开发行股票认购对象穿透后涉及认购主体数量的说明公告,finalpage/2016-04-09/1202155558.PDF
2016-04-09,正海磁材：关于公司非公开发行股票涉及关联交易事项的公告,finalpage/2016-04-09/1202155559.PDF
2016-04-09,正海磁材：关于非公开发行股票摊薄即期回报及填补措施的公告,finalpage/2016-04-09/1202155560.PDF
2016-04-09,正海磁材：关于非公开发行股票预案的提示性公告,finalpage/2016-04-09/1202155561.PDF
2016-04-09,正海磁材：关于公司股票交易复牌的提示性公告,finalpage/2016-04-09/1202155562.PDF
2016-04-09,正海磁材：关于公司与认购对象签署附条件生效的股份购协议的公告,finalpage/2016-04-09/1202155563.PDF
2016-04-09,正海磁材：关于召开2016年第三次临时股东大会的通知,finalpage/2016-04-09/1202155564.PDF
2016-04-09,正海磁材：北京大成律师事务所关于正海集团有限公司免于提交豁免要约收购申请的专项核查意见,finalpage/2016-04-09/1202155565.PDF
2016-04-09,正海磁材：三届董事会第二次会议决议公告,finalpage/2016-04-09/1202155566.PDF
2016-04-09,正海磁材：三届监事会第二次会议决议公告,finalpage/2016-04-09/1202155567.PDF
2016-04-09,正海磁材：关于前次募集资金使用情况的报告,finalpage/2016-04-09/1202155568.PDF
2016-04-09,正海磁材：关于公司前次募集资金使用情况的鉴证报告,finalpage/2016-04-09/1202155569.PDF
2016-04-09,正海磁材：简式权益变动报告书（二）,finalpage/2016-04-09/1202155570.PDF
2016-04-09,正海磁材：简式权益变动报告书（一）,finalpage/2016-04-09/1202155571.PDF
2016-04-09,正海磁材：非公开发行股票预案,finalpage/2016-04-09/1202155572.PDF
2016-04-15,正海磁材：2015年年度报告摘要（更新后）,finalpage/2016-04-15/1202186646.PDF
2016-04-15,正海磁材：2015年年度报告（更新后）,finalpage/2016-04-15/1202186647.PDF
2016-04-15,正海磁材：关于2015年年度报告全文及其摘要的更正公告,finalpage/2016-04-15/1202186645.PDF
2016-04-15,正海磁材：关于披露2015年年度报告的提示性公告,finalpage/2016-04-15/1202181025.PDF
2016-04-15,正海磁材：三届董事会第三次会议决议公告,finalpage/2016-04-15/1202181026.PDF
2016-04-15,正海磁材：三届监事会第三次会议决议公告,finalpage/2016-04-15/1202181027.PDF
2016-04-15,正海磁材：2015年度监事会工作报告,finalpage/2016-04-15/1202181028.PDF
2016-04-15,正海磁材：2015年度募集资金存放与使用情况的专项报告,finalpage/2016-04-15/1202181029.PDF
2016-04-15,正海磁材：2015年度内部控制评价报告,finalpage/2016-04-15/1202181030.PDF
2016-04-15,正海磁材：独立董事关于相关事项的独立意见,finalpage/2016-04-15/1202181031.PDF
2016-04-15,正海磁材：独立董事述职报告（金福海）,finalpage/2016-04-15/1202181032.PDF
2016-04-15,正海磁材：独立董事述职报告（严纯华）,finalpage/2016-04-15/1202181033.PDF
2016-04-15,正海磁材：独立董事述职报告（于希茂）,finalpage/2016-04-15/1202181034.PDF
2016-04-15,正海磁材：公司章程（2016年4月）,finalpage/2016-04-15/1202181035.PDF
2016-04-15,正海磁材：《公司章程》修订对照表,finalpage/2016-04-15/1202181036.PDF
2016-04-15,正海磁材：关于2015年度利润分配预案的公告,finalpage/2016-04-15/1202181037.PDF
2016-04-15,正海磁材：关于变更财务顾问主办人的公告,finalpage/2016-04-15/1202181038.PDF
2016-04-15,正海磁材：关于举办2015年度网上业绩说明会的公告,finalpage/2016-04-15/1202181039.PDF
2016-04-15,正海磁材：关于限制性股票激励计划首次授予限制性股票第一期解锁条件成就可解锁的公告,finalpage/2016-04-15/1202181040.PDF
2016-04-15,正海磁材：关于召开2015年度股东大会的通知,finalpage/2016-04-15/1202181041.PDF
2016-04-15,正海磁材：监事会对公司内部控制自我评价报告的审核意见,finalpage/2016-04-15/1202181042.PDF
2016-04-15,正海磁材：北京大成（上海）律师事务所关于公司限制性股票激励计划首次授予限制性股票第一期可解锁的法律意见书,finalpage/2016-04-15/1202181043.PDF
2016-04-15,正海磁材：2015年年度报告（已取消）,finalpage/2016-04-15/1202181044.PDF
2016-04-15,正海磁材：关于公司2015年度备考合并盈利预测实现情况的专项审核报告,finalpage/2016-04-15/1202181045.PDF
2016-04-15,正海磁材：2015年度控股股东及其他关联方占用资金情况的专项说明,finalpage/2016-04-15/1202181046.PDF
2016-04-15,正海磁材：2015年度募集资金存放与实际使用情况的专项审核报告,finalpage/2016-04-15/1202181047.PDF
2016-04-15,正海磁材：关于公司2015年度业绩指标完成情况的专项审核报告,finalpage/2016-04-15/1202181048.PDF
2016-04-15,正海磁材：光大证券股份有限公司关于公司2015年度募集资金存放与使用情况的核查意见,finalpage/2016-04-15/1202181049.PDF
2016-04-15,正海磁材：关于上海大郡动力控制技术有限公司2015年度业绩承诺完成情况的专项审核报告,finalpage/2016-04-15/1202181050.PDF
2016-04-15,正海磁材：关于上海大郡动力控制技术有限公司2015年度盈利预测实现情况的专项审核报告,finalpage/2016-04-15/1202181051.PDF
2016-04-15,正海磁材：2015年年度审计报告,finalpage/2016-04-15/1202181052.PDF
2016-04-15,正海磁材：中信建投证券股份有限公司关于公司2015年度子公司业绩承诺实现情况的核查意见,finalpage/2016-04-15/1202181053.PDF
2016-04-15,正海磁材：中信建投证券股份有限公司关于公司发行股份及支付现金购买资产并募集配套资金之持续督导意见（2015年度）,finalpage/2016-04-15/1202181054.PDF
2016-04-15,正海磁材：2015年年度报告摘要（已取消）,finalpage/2016-04-15/1202181055.PDF
2016-04-19,正海磁材：关于披露2016年第一季度报告的提示性公告,finalpage/2016-04-19/1202195167.PDF
2016-04-19,正海磁材：2016年第一季度报告全文,finalpage/2016-04-19/1202195168.PDF
2016-04-20,正海磁材：关于召开2016年第三次临时股东大会的提示性公告,finalpage/2016-04-20/1202202600.PDF
2016-04-21,正海磁材：三届董事会第五次会议决议公告,finalpage/2016-04-21/1202211774.PDF
2016-04-21,正海磁材：三届监事会第五次会议决议公告,finalpage/2016-04-21/1202211775.PDF
2016-04-21,正海磁材：独立董事关于相关事项的独立意见,finalpage/2016-04-21/1202211776.PDF
2016-04-21,正海磁材：预留限制性股票激励对象名单,finalpage/2016-04-21/1202211777.PDF
2016-04-21,正海磁材：北京大成（上海）律师事务所关于公司限制性股票激励计划预留授予及调整事项的法律意见书,finalpage/2016-04-21/1202211778.PDF
2016-04-21,正海磁材：关于调整公司预留限制性股票授予数量的公告,finalpage/2016-04-21/1202211779.PDF
2016-04-21,正海磁材：关于向激励对象授予预留限制性股票的公告,finalpage/2016-04-21/1202211780.PDF
2016-04-25,正海磁材：2016年第三次临时股东大会决议公告,finalpage/2016-04-25/1202241466.PDF
2016-04-25,正海磁材：2016年第三次临时股东大会之律师见证法律意见书,finalpage/2016-04-25/1202241467.PDF
2016-04-26,正海磁材：股权激励限售股流通的提示性公告,finalpage/2016-04-26/1202249111.PDF
2016-04-29,正海磁材：关于召开2015年度股东大会的提示性公告,finalpage/2016-04-29/1202263337.PDF
2016-05-04,正海磁材：关于收到《中国证监会行政许可申请受理通知书》的公告,finalpage/2016-05-04/1202293641.PDF
2016-05-06,正海磁材：关于使用闲置自有资金购买银行理财产品的进展公告,finalpage/2016-05-06/1202303187.PDF
2016-05-06,正海磁材：2015年度股东大会之律师见证法律意见书,finalpage/2016-05-06/1202303186.PDF
2016-05-06,正海磁材：2015年度股东大会决议公告,finalpage/2016-05-06/1202303185.PDF
2016-05-16,正海磁材：关于预留限制性股票授予完成的公告,finalpage/2016-05-16/1202323778.PDF
2016-05-20,正海磁材：2015年度权益分派实施公告,finalpage/2016-05-20/1202330472.PDF
2016-05-25,正海磁材：关于使用闲置自有资金购买银行理财产品的进展公告,finalpage/2016-05-25/1202337144.PDF
2016-05-26,正海磁材：关于收到《中国证监会行政许可项目审查反馈意见通知书》的公告,finalpage/2016-05-26/1202340573.PDF
2016-06-03,正海磁材：独立董事关于三届董事会第六次会议的独立意见,finalpage/2016-06-03/1202352717.PDF
2016-06-03,正海磁材：独立董事关于续聘2016年度审计机构事项的事前认可意见,finalpage/2016-06-03/1202352718.PDF
2016-06-03,正海磁材：公司章程修订对照表,finalpage/2016-06-03/1202352719.PDF
2016-06-03,正海磁材：关于召开2016年第四次临时股东大会的通知,finalpage/2016-06-03/1202352720.PDF
2016-06-03,正海磁材：三届监事会第六次会议决议公告,finalpage/2016-06-03/1202352721.PDF
2016-06-03,正海磁材：关于前次募集资金使用情况的报告,finalpage/2016-06-03/1202352722.PDF
2016-06-03,正海磁材：关于公司前次募集资金使用情况的鉴证报告,finalpage/2016-06-03/1202352723.PDF
2016-06-03,正海磁材：三届董事会第六次会议决议公告,finalpage/2016-06-03/1202352724.PDF
2016-06-03,正海磁材：公司章程（2016年6月）,finalpage/2016-06-03/1202352725.PDF
2016-06-08,正海磁材：关于使用闲置自有资金购买银行理财产品的进展公告,finalpage/2016-06-08/1202363113.PDF
2016-06-08,正海磁材：关于参加山东辖区上市公司2016年投资者网上集体接待日活动的公告,finalpage/2016-06-08/1202363114.PDF
2016-06-15,正海磁材：关于召开2016年第四次临时股东大会的提示性公告,finalpage/2016-06-15/1202369745.PDF
2016-06-16,正海磁材：关于非公开发行股票申请文件反馈意见延期回复的公告,finalpage/2016-06-16/1202371725.PDF
2016-06-20,正海磁材：2016年第四次临时股东大会决议公告,finalpage/2016-06-20/1202375696.PDF
2016-06-20,正海磁材：2016年第四次临时股东大会之律师见证法律意见书,finalpage/2016-06-20/1202375697.PDF
2016-06-22,正海磁材：关于创业板非公开发行股票申请文件反馈意见之回复,finalpage/2016-06-22/1202387702.PDF
2016-06-22,正海磁材：关于实施2015年度权益分派方案后调整非公开发行股票发行价格和发行数量的公告,finalpage/2016-06-22/1202387694.PDF
2016-06-22,正海磁材：上汽投资-颀瑞1号基金合同,finalpage/2016-06-22/1202387695.PDF
2016-06-22,正海磁材：上汽投资-颀益1号基金合同,finalpage/2016-06-22/1202387696.PDF
2016-06-22,正海磁材：三届董事会第七次会议决议公告,finalpage/2016-06-22/1202387697.PDF
2016-06-22,正海磁材：三届监事会第七次会议决议公告,finalpage/2016-06-22/1202387698.PDF
2016-06-22,正海磁材：关于非公开发行股票相关承诺事项的公告,finalpage/2016-06-22/1202387700.PDF
2016-06-22,正海磁材：关于与特定对象签署附条件生效的股份认购协议之补充协议的公告,finalpage/2016-06-22/1202387701.PDF
2016-06-22,正海磁材：非公开发行股票方案论证分析报告（修订稿）,finalpage/2016-06-22/1202387689.PDF
2016-06-22,正海磁材：非公开发行股票募集资金使用可行性报告（修订稿）,finalpage/2016-06-22/1202387690.PDF
2016-06-22,正海磁材：独立董事关于三届董事会第七次会议的独立意见,finalpage/2016-06-22/1202387691.PDF
2016-06-22,正海磁材：关于创业板非公开发行股票申请文件反馈意见回复的公告,finalpage/2016-06-22/1202387692.PDF
2016-06-22,正海磁材：关于非公开发行股票预案修订情况说明的公告,finalpage/2016-06-22/1202387693.PDF
2016-06-22,正海磁材：非公开发行股票预案（第一次修订稿）,finalpage/2016-06-22/1202387699.PDF
2016-06-24,正海磁材：三届董事会第八次会议决议公告,finalpage/2016-06-24/1202402780.PDF
2016-06-24,正海磁材：三届监事会第八次会议决议公告,finalpage/2016-06-24/1202402781.PDF
2016-06-24,正海磁材：独立董事关于三届董事会第八次会议的独立意见,finalpage/2016-06-24/1202402782.PDF
2016-06-24,正海磁材：关于为控股子公司提供担保的公告,finalpage/2016-06-24/1202402783.PDF
2016-06-28,正海磁材：关于控股股东将所持部分股份解除质押及重新质押的公告,finalpage/2016-06-28/1202431114.PDF
2016-07-15,正海磁材：2016年半年度业绩预告,finalpage/2016-07-15/1202474674.PDF
2016-07-15,正海磁材：关于为控股子公司提供担保的进展公告,finalpage/2016-07-15/1202474675.PDF
2016-07-20,正海磁材：三届董事会第九次会议决议公告,finalpage/2016-07-20/1202488336.PDF
2016-07-20,正海磁材：三届监事会第九次会议决议公告,finalpage/2016-07-20/1202488337.PDF
2016-07-20,正海磁材：独立董事关于三届董事会第九次会议的独立意见,finalpage/2016-07-20/1202488338.PDF
2016-07-20,正海磁材：关于为控股子公司提供担保的公告,finalpage/2016-07-20/1202488339.PDF
2016-08-09,正海磁材：关于控股股东将所持部分股份解除质押及重新质押的公告,finalpage/2016-08-09/1202549603.PDF
2016-08-16,正海磁材：关于披露2016年半年度报告的提示性公告,finalpage/2016-08-16/1202565509.PDF
2016-08-16,正海磁材：2016年半年度报告摘要,finalpage/2016-08-16/1202565510.PDF
2016-08-16,正海磁材：三届监事会第十次会议决议公告,finalpage/2016-08-16/1202565511.PDF
2016-08-16,正海磁材：2016年半年度募集资金存放与使用情况的专项报告,finalpage/2016-08-16/1202565512.PDF
2016-08-16,正海磁材：2016年半年度报告,finalpage/2016-08-16/1202565513.PDF
2016-08-16,正海磁材：独立董事关于相关事项的独立意见,finalpage/2016-08-16/1202565514.PDF
2016-08-16,正海磁材：三届董事会第十次会议决议公告,finalpage/2016-08-16/1202565515.PDF
2016-08-19,正海磁材：关于为控股子公司提供担保的进展公告,finalpage/2016-08-19/1202588676.PDF
2016-08-24,正海磁材：独立董事关于公司非公开发行相关事项的事前认可意见,finalpage/2016-08-24/1202611357.PDF
2016-08-24,正海磁材：独立董事关于三届董事会第十一次会议的独立意见,finalpage/2016-08-24/1202611358.PDF
2016-08-24,正海磁材：关于创业板非公开发行股票申请文件反馈意见之回复（修订稿）,finalpage/2016-08-24/1202611359.PDF
2016-08-24,正海磁材：关于公司非公开发行股票涉及关联交易事项的补充公告,finalpage/2016-08-24/1202611360.PDF
2016-08-24,正海磁材：关于非公开发行股票预案修订情况说明的公告,finalpage/2016-08-24/1202611361.PDF
2016-08-24,正海磁材：关于调整非公开发行股票募集资金规模的公告,finalpage/2016-08-24/1202611362.PDF
2016-08-24,正海磁材：关于与发行对象签署非公开发行股票股份之附条件生效的认购协议之补充协议的公告,finalpage/2016-08-24/1202611363.PDF
