date,title,url
2016-08-24,正海磁材：关于召开2016年第五次临时股东大会的通知,finalpage/2016-08-24/1202611364.PDF
2016-08-24,正海磁材：三届董事会第十一次会议决议公告,finalpage/2016-08-24/1202611365.PDF
2016-08-24,正海磁材：三届监事会第十一次会议决议公告,finalpage/2016-08-24/1202611366.PDF
2016-08-24,正海磁材：非公开发行股票预案（第二次修订稿）,finalpage/2016-08-24/1202611367.PDF
2016-08-24,正海磁材：关于非公开发行股票申请文件反馈意见之回复（修订稿）的公告,finalpage/2016-08-24/1202611368.PDF
2016-08-24,正海磁材：非公开发行股票方案论证分析报告（第二次修订稿）,finalpage/2016-08-24/1202611355.PDF
2016-08-24,正海磁材：非公开发行股票募集资金使用可行性报告（第二次修订稿）,finalpage/2016-08-24/1202611356.PDF
2016-09-05,正海磁材：关于召开2016年第五次临时股东大会的提示性公告,finalpage/2016-09-05/1202675715.PDF
2016-09-09,正海磁材：2016年第五次临时股东大会决议公告,finalpage/2016-09-09/1202689984.PDF
2016-09-09,正海磁材：2016年第五次临时股东大会之律师见证法律意见书,finalpage/2016-09-09/1202689985.PDF
2016-09-29,正海磁材：关于非公开发行股票申请获得中国证监会创业板发审委审核通过的公告,finalpage/2016-09-29/1202733276.PDF
2016-10-12,正海磁材：关于使用闲置自有资金购买银行理财产品的进展公告,finalpage/2016-10-12/1202753415.PDF
2016-10-14,正海磁材：2016年前三季度业绩预告,finalpage/2016-10-14/1202756014.PDF
2016-10-25,正海磁材：关于披露2016年第三季度报告的提示性公告,finalpage/2016-10-25/1202780898.PDF
2016-10-25,正海磁材：关于对外投资设立控股子公司的公告,finalpage/2016-10-25/1202780899.PDF
2016-10-25,正海磁材：三届董事会第十二次会议决议公告,finalpage/2016-10-25/1202780900.PDF
2016-10-25,正海磁材：2016年第三季度报告全文,finalpage/2016-10-25/1202780901.PDF
2016-11-11,正海磁材：关于使用闲置自有资金购买银行理财产品的进展公告,finalpage/2016-11-11/1202824890.PDF
2016-12-08,正海磁材：关于对外投资设立控股子公司的进展公告,finalpage/2016-12-08/1202865331.PDF
2016-12-09,正海磁材：关于控股股东进行股票质押式回购交易的公告,finalpage/2016-12-09/1202867223.PDF
2017-01-05,正海磁材：关于非公开发行股票获得中国证监会核准批复的公告,finalpage/2017-01-05/1202993523.PDF
2017-01-09,正海磁材：2016年度业绩预告,finalpage/2017-01-09/1203001811.PDF
2017-01-17,正海磁材：验资报告,finalpage/2017-01-17/1203023100.PDF
2017-01-17,正海磁材：中信建投证券股份有限公司关于公司非公开发行股票发行过程和认购对象合规性的报告,finalpage/2017-01-17/1203023101.PDF
2017-01-17,正海磁材：北京大成律师事务所关于公司非公开发行股票发行过程及认购对象合规性之见证意见,finalpage/2017-01-17/1203023097.PDF
2017-01-17,正海磁材：关于非公开发行股票发行情况报告书的提示性公告,finalpage/2017-01-17/1203023098.PDF
2017-01-17,正海磁材：非公开发行股票发行情况报告书,finalpage/2017-01-17/1203023099.PDF
2017-01-19,正海磁材：关于使用闲置自有资金购买银行理财产品的进展公告,finalpage/2017-01-19/1203030490.PDF
2017-01-23,正海磁材：关于签订募集资金三方监管协议的公告,finalpage/2017-01-23/1203042375.PDF
2017-02-24,正海磁材：2016年度业绩快报,finalpage/2017-02-24/1203106512.PDF
2017-02-27,正海磁材：关于使用闲置自有资金购买银行理财产品的进展公告,finalpage/2017-02-27/1203111201.PDF
2017-03-02,正海磁材：关于使用闲置自有资金购买银行理财产品的进展公告,finalpage/2017-03-02/1203123681.PDF
2017-03-13,正海磁材：非公开发行股票新增股份变动报告及上市公告书,finalpage/2017-03-13/1203154212.PDF
2017-03-13,正海磁材：中信建投证券股份有限公司关于公司非公开发行股票上市保荐书,finalpage/2017-03-13/1203154213.PDF
2017-03-13,正海磁材：董事、监事和高级管理人员持股情况变动的报告,finalpage/2017-03-13/1203154214.PDF
2017-03-21,正海磁材：关于披露2016年年度报告的提示性公告,finalpage/2017-03-21/1203181119.PDF
2017-03-21,正海磁材：2016年年度审计报告（已取消）,finalpage/2017-03-21/1203181120.PDF
2017-03-21,正海磁材：三届董事会第十三次会议决议公告,finalpage/2017-03-21/1203181121.PDF
2017-03-21,正海磁材：三届监事会第十三次会议决议公告,finalpage/2017-03-21/1203181122.PDF
2017-03-21,正海磁材：关于举办2016年度网上业绩说明会的公告,finalpage/2017-03-21/1203181123.PDF
2017-03-21,正海磁材：关于2016年度利润分配预案的公告,finalpage/2017-03-21/1203181124.PDF
2017-03-21,正海磁材：关于召开2016年度股东大会的通知,finalpage/2017-03-21/1203181125.PDF
2017-03-21,正海磁材：2016年度募集资金存放与使用情况的专项报告,finalpage/2017-03-21/1203181126.PDF
2017-03-21,正海磁材：关于限制性股票激励计划首次授予的限制性股票第二期和预留授予的限制性股票第一期解锁条件成就可解锁的公告,finalpage/2017-03-21/1203181127.PDF
2017-03-21,正海磁材：2017年第一季度业绩预告,finalpage/2017-03-21/1203181128.PDF
2017-03-21,正海磁材：关于使用闲置自有资金购买理财产品的公告,finalpage/2017-03-21/1203181129.PDF
2017-03-21,正海磁材：关于收购控股子公司少数股东股权的公告,finalpage/2017-03-21/1203181130.PDF
2017-03-21,正海磁材：关于对外投资设立控股子公司的公告,finalpage/2017-03-21/1203181131.PDF
2017-03-21,正海磁材：关于调整公司组织结构的公告,finalpage/2017-03-21/1203181132.PDF
2017-03-21,正海磁材：关于变更公司董事的公告,finalpage/2017-03-21/1203181133.PDF
2017-03-21,正海磁材：2016年度内部控制自我评价报告,finalpage/2017-03-21/1203181134.PDF
2017-03-21,正海磁材：2016年度监事会工作报告,finalpage/2017-03-21/1203181135.PDF
2017-03-21,正海磁材：监事会对公司内部控制自我评价报告的审核意见,finalpage/2017-03-21/1203181136.PDF
2017-03-21,正海磁材：独立董事述职报告（柳喜军）,finalpage/2017-03-21/1203181137.PDF
2017-03-21,正海磁材：独立董事述职报告（殷承良）,finalpage/2017-03-21/1203181138.PDF
2017-03-21,正海磁材：独立董事述职报告（于建青）,finalpage/2017-03-21/1203181139.PDF
2017-03-21,正海磁材：独立董事关于续聘2017年度审计机构事项的事前认可意见,finalpage/2017-03-21/1203181140.PDF
2017-03-21,正海磁材：独立董事关于相关事项的独立意见,finalpage/2017-03-21/1203181141.PDF
2017-03-21,正海磁材：公司章程（2017年3月）,finalpage/2017-03-21/1203181143.PDF
2017-03-21,正海磁材：《章程》修订对照表,finalpage/2017-03-21/1203181144.PDF
2017-03-21,正海磁材：高级管理人员薪酬与考核方案（2017年3月）,finalpage/2017-03-21/1203181145.PDF
2017-03-21,正海磁材：2016年度控股股东及其他关联方占用资金情况的专项说明,finalpage/2017-03-21/1203181146.PDF
2017-03-21,正海磁材：2016年度募集资金存放与实际使用情况的专项审核报告,finalpage/2017-03-21/1203181147.PDF
2017-03-21,正海磁材：关于上海大郡动力控制技术有限公司2016年度业绩承诺完成情况的专项审核报告,finalpage/2017-03-21/1203181148.PDF
2017-03-21,正海磁材：关于公司2016年度业绩指标完成情况的专项审核报告,finalpage/2017-03-21/1203181149.PDF
2017-03-21,正海磁材：2016年度内部控制鉴证报告,finalpage/2017-03-21/1203181150.PDF
2017-03-21,正海磁材：中信建投证券股份有限公司关于公司2016年度募集资金存放与使用情况的核查意见,finalpage/2017-03-21/1203181151.PDF
2017-03-21,正海磁材：中信建投证券股份有限公司关于公司2016年度子公司业绩承诺实现情况的核查意见,finalpage/2017-03-21/1203181152.PDF
2017-03-21,正海磁材：中信建投证券股份有限公司关于公司发行股份及支付现金购买资产并募集配套资金之持续督导意见（2016年度）,finalpage/2017-03-21/1203181153.PDF
2017-03-21,正海磁材：中信建投证券股份有限公司关于公司使用闲置自有资金购买理财产品的核查意见,finalpage/2017-03-21/1203181154.PDF
2017-03-21,正海磁材：北京大成（上海）律师事务所关于公司限制性股票激励计划首次授予限制性股票第二期和预留授予限制性股票第一期解锁条件成就可解锁的法律意见书,finalpage/2017-03-21/1203181155.PDF
2017-03-21,正海磁材：内幕信息知情人登记管理和报备制度（2017年3月）,finalpage/2017-03-21/1203181156.PDF
2017-03-21,正海磁材：关于对外投资设立全资子公司的公告,finalpage/2017-03-21/1203181157.PDF
2017-03-21,正海磁材：募集资金专项存储及使用管理制度（2017年3月）,finalpage/2017-03-21/1203181158.PDF
2017-03-21,正海磁材：2016年年度报告摘要（已取消）,finalpage/2017-03-21/1203181159.PDF
2017-03-21,正海磁材：2016年年度报告（已取消）,finalpage/2017-03-21/1203181160.PDF
2017-03-24,正海磁材：关于控股股东进行股票质押式回购交易的公告,finalpage/2017-03-24/1203193728.PDF
2017-04-05,正海磁材：关于召开2016年度股东大会的提示性公告,finalpage/2017-04-05/1203251990.PDF
2017-04-10,正海磁材：2016年度股东大会决议公告,finalpage/2017-04-10/1203274873.PDF
2017-04-10,正海磁材：2016年度股东大会之律师见证法律意见书,finalpage/2017-04-10/1203274874.PDF
2017-04-12,正海磁材：2016年度权益分派实施公告,finalpage/2017-04-12/1203283027.PDF
2017-04-20,正海磁材：关于限制性股票激励计划预留授予的限制性股票第一期解锁股份上市流通的提示性公告,finalpage/2017-04-20/1203343787.PDF
2017-04-24,正海磁材：关于使用闲置自有资金购买理财产品的进展公告,finalpage/2017-04-24/1203374186.PDF
2017-04-27,正海磁材：关于控股股东部分股份补充质押的公告,finalpage/2017-04-27/1203410552.PDF
2017-04-27,正海磁材：关于对外投资设立全资子公司的进展公告,finalpage/2017-04-27/1203410551.PDF
2017-04-27,正海磁材：关于披露2017年第一季度报告的提示性公告,finalpage/2017-04-27/1203402931.PDF
2017-04-27,正海磁材：2017年第一季度报告全文（已取消）,finalpage/2017-04-27/1203402932.PDF
2017-04-27,正海磁材：拟在日本设立全资子公司的公告,finalpage/2017-04-27/1203402933.PDF
2017-04-27,正海磁材：三届董事会第十四次会议决议公告,finalpage/2017-04-27/1203402934.PDF
2017-05-04,正海磁材：关于限制性股票激励计划首次授予的限制性股票第二期解锁股份上市流通的提示性公告,finalpage/2017-05-04/1203473914.PDF
2017-05-11,正海磁材：关于使用闲置自有资金购买理财产品的进展公告,finalpage/2017-05-11/1203504501.PDF
2017-05-18,正海磁材：关于对外投资设立控股子公司的进展公告,finalpage/2017-05-18/1203536251.PDF
2017-05-24,正海磁材：关于控股股东将所持部分股份质押及解质押的公告,finalpage/2017-05-24/1203565716.PDF
2017-06-01,正海磁材：三届董事会第十五次会议决议公告,finalpage/2017-06-01/1203576825.PDF
2017-06-01,正海磁材：三届监事会第十五次会议决议公告,finalpage/2017-06-01/1203576826.PDF
2017-06-01,正海磁材：独立董事关于三届董事会第十五次会议的独立意见,finalpage/2017-06-01/1203576827.PDF
2017-06-01,正海磁材：北京大成（上海）律师事务所关于公司限制性股票激励计划回购注销部分限制性股票的法律意见书,finalpage/2017-06-01/1203576828.PDF
2017-06-01,正海磁材：关于回购注销部分限制性股票的公告,finalpage/2017-06-01/1203576829.PDF
2017-06-01,正海磁材：关于回购注销部分限制性股票的减资公告,finalpage/2017-06-01/1203576830.PDF
2017-06-01,正海磁材：关于增加使用闲置自有资金购买理财产品的公告,finalpage/2017-06-01/1203576831.PDF
2017-06-01,正海磁材：关于单项计提坏账准备的公告,finalpage/2017-06-01/1203576832.PDF
2017-06-01,正海磁材：公司章程（2017年5月）,finalpage/2017-06-01/1203576833.PDF
2017-06-01,正海磁材：《章程》修订对照表,finalpage/2017-06-01/1203576834.PDF
2017-06-01,正海磁材：关于召开2017年第一次临时股东大会的通知,finalpage/2017-06-01/1203576835.PDF
2017-06-01,正海磁材：关于使用闲置自有资金购买理财产品的进展公告,finalpage/2017-06-01/1203576836.PDF
2017-06-09,正海磁材：三届董事会第十六次会议决议公告,finalpage/2017-06-09/1203607041.PDF
2017-06-09,正海磁材：三届监事会第十六次会议决议公告,finalpage/2017-06-09/1203607042.PDF
2017-06-09,正海磁材：关于会计差错更正的公告,finalpage/2017-06-09/1203607044.PDF
2017-06-09,正海磁材：关于公司2016年度财务报表及附注更正的专项说明,finalpage/2017-06-09/1203607046.PDF
2017-06-09,正海磁材：关于会计差错更正的提示性公告,finalpage/2017-06-09/1203607047.PDF
2017-06-09,正海磁材：独立董事关于会计差错更正的独立意见,finalpage/2017-06-09/1203607043.PDF
2017-06-09,正海磁材：董事会关于会计差错更正的说明,finalpage/2017-06-09/1203607045.PDF
2017-06-13,正海磁材：关于召开2017年第一次临时股东大会的提示性公告,finalpage/2017-06-13/1203613310.PDF
2017-06-16,正海磁材：2017年第一次临时股东大会决议公告,finalpage/2017-06-16/1203624951.PDF
2017-06-16,正海磁材：2017年第一次临时股东大会之律师见证法律意见书,finalpage/2017-06-16/1203624952.PDF
2017-06-23,正海磁材：2016年年度报告（更新后）,finalpage/2017-06-23/1203643433.PDF
2017-06-23,正海磁材：2016年年度报告摘要（更新后）,finalpage/2017-06-23/1203643434.PDF
2017-06-23,正海磁材：2017年第一季度报告全文（更新后）,finalpage/2017-06-23/1203643435.PDF
2017-06-23,正海磁材：2017年第一季度财务报表（更新后）,finalpage/2017-06-23/1203643436.PDF
2017-06-23,正海磁材：2016年年度审计报告（更新后）,finalpage/2017-06-23/1203643437.PDF
2017-06-23,正海磁材：关于2016年年度报告及其摘要、2017年第一季度报告的更正公告,finalpage/2017-06-23/1203643438.PDF
2017-06-27,正海磁材：关于控股股东部分股权质押的公告,finalpage/2017-06-27/1203651093.PDF
2017-06-30,正海磁材：关于控股股东部分股权质押的公告,finalpage/2017-06-30/1203669281.PDF
2017-07-07,正海磁材：关于控股股东部分股份解除质押及重新质押的公告,finalpage/2017-07-07/1203689574.PDF
2017-07-07,正海磁材：股票交易异常波动公告,finalpage/2017-07-07/1203689575.PDF
2017-07-10,正海磁材：关于收购控股子公司少数股东股权的进展公告,finalpage/2017-07-10/1203691932.PDF
2017-07-12,正海磁材：2017年半年度业绩预告,finalpage/2017-07-12/1203699707.PDF
2017-07-14,正海磁材：关于部分限制性股票回购注销完成的公告,finalpage/2017-07-14/1203703992.PDF
2017-07-27,正海磁材：关于使用闲置自有资金购买理财产品的进展公告,finalpage/2017-07-27/1203735993.PDF
2017-08-08,正海磁材：关于使用闲置自有资金购买理财产品的进展公告,finalpage/2017-08-08/1203770307.PDF
2017-08-09,正海磁材：关于控股股东部分股份解除质押及重新质押的公告,finalpage/2017-08-09/1203773795.PDF
2017-08-15,正海磁材：关于披露2017年半年度报告的提示性公告,finalpage/2017-08-15/1203796525.PDF
2017-08-15,正海磁材：2017年半年度报告摘要,finalpage/2017-08-15/1203796527.PDF
2017-08-15,正海磁材：三届董事会第十七次会议决议公告,finalpage/2017-08-15/1203796528.PDF
2017-08-15,正海磁材：三届监事会第十七次会议决议公告,finalpage/2017-08-15/1203796529.PDF
2017-08-15,正海磁材：2017年半年度募集资金存放与使用情况的专项报告,finalpage/2017-08-15/1203796530.PDF
2017-08-15,正海磁材：独立董事关于相关事项的独立意见,finalpage/2017-08-15/1203796532.PDF
2017-08-15,正海磁材：《章程》修订对照表,finalpage/2017-08-15/1203796533.PDF
2017-08-15,正海磁材：公司章程（2017年8月）,finalpage/2017-08-15/1203796534.PDF
2017-08-15,正海磁材：董事、监事、高级管理人员持有本公司股票及其变动管理办法（2017年8月）,finalpage/2017-08-15/1203796536.PDF
2017-08-15,正海磁材：关于会计政策变更的公告,finalpage/2017-08-15/1203796537.PDF
2017-08-15,正海磁材：2017年半年度报告,finalpage/2017-08-15/1203796539.PDF
2017-08-19,正海磁材：关于参加山东辖区上市公司2017年投资者网上集体接待日活动的公告,finalpage/2017-08-19/1203811524.PDF
2017-08-23,正海磁材：股票交易异常波动公告,finalpage/2017-08-23/1203847764.PDF
2017-08-23,正海磁材：关于高级管理人员减持股份计划的预披露公告,finalpage/2017-08-23/1203847801.PDF
2017-08-24,正海磁材：关于董事、高级管理人员减持股份计划的预披露公告,finalpage/2017-08-24/1203857036.PDF
2017-08-30,正海磁材：中信建投证券股份有限公司关于公司2017年上半年度持续督导跟踪报告,finalpage/2017-08-30/1203907431.PDF
2017-09-07,正海磁材：关于高级管理人员减持股份计划的预披露公告,finalpage/2017-09-07/1203944094.PDF
2017-10-11,正海磁材：在日本设立全资子公司的进展公告,finalpage/2017-10-11/1204029978.PDF
2017-10-11,正海磁材：2017年前三季度业绩预告,finalpage/2017-10-11/1204029979.PDF
2017-10-13,正海磁材：关于使用闲置自有资金购买理财产品的进展公告,finalpage/2017-10-13/1204039067.PDF
2017-10-30,正海磁材：关于披露2017年第三季度报告的提示性公告,finalpage/2017-10-30/1204084659.PDF
2017-10-30,正海磁材：2017年第三季度报告全文,finalpage/2017-10-30/1204084660.PDF
2017-10-31,正海磁材：关于使用闲置自有资金购买理财产品的进展公告,finalpage/2017-10-31/1204102576.PDF
2017-11-28,正海磁材：关于控股股东进行股票质押式回购交易的公告,finalpage/2017-11-28/1204173563.PDF
2017-12-01,正海磁材：关于使用闲置自有资金购买理财产品的进展公告,finalpage/2017-12-01/1204183742.PDF
2017-12-05,正海磁材：关于控股股东拟非公开发行可交换债券的公告,finalpage/2017-12-05/1204194438.PDF
2017-12-06,正海磁材：关于控股股东进行股票质押式回购交易的公告,finalpage/2017-12-06/1204196705.PDF
2017-12-07,正海磁材：关于控股股东、实际控制人的一致行动人增持公司股份进展的公告,finalpage/2017-12-07/1204199014.PDF
2017-12-16,正海磁材：关于公司董事、高级管理人员股份减持进展情况的公告,finalpage/2017-12-16/1204231755.PDF
2017-12-30,正海磁材：关于公司高级管理人员股份减持进展情况的公告,finalpage/2017-12-30/1204290082.PDF
2018-01-02,正海磁材：关于使用闲置自有资金购买理财产品的进展公告,finalpage/2018-01-02/1204297789.PDF
2018-01-04,正海磁材：山东琴岛律师事务所关于公司控股股东、实际控制人的一致行动人增持公司股份之法律意见书,finalpage/2018-01-04/1204304551.PDF
2018-01-04,正海磁材：关于控股股东、实际控制人及其一致行动人股份增持计划完成的公告,finalpage/2018-01-04/1204304550.PDF
2018-01-30,正海磁材：2017年度业绩预告,finalpage/2018-01-30/1204374478.PDF
2018-02-08,正海磁材：关于控股股东进行股票质押式回购交易补充质押的公告,finalpage/2018-02-08/1204405972.PDF
2018-02-08,正海磁材：关于控股子公司诉讼进展的公告,finalpage/2018-02-08/1204405973.PDF
