date,title,url
2013-07-17,易华录：中航证券有限公司关于公司调整募集资金投资项目投资结构及剩余超募资金永久补充流动资金的核查意见,finalpage/2013-07-17/62842013.PDF
2013-07-17,易华录：关于使用剩余超募资金永久补充流动资金的公告,finalpage/2013-07-17/62842014.PDF
2013-07-17,易华录：关于调整募集资金投资项目投资结构的公告,finalpage/2013-07-17/62842015.PDF
2013-07-17,易华录：独立董事关于相关事项的独立意见,finalpage/2013-07-17/62842016.PDF
2013-07-17,易华录：第二届监事会第十一次会议决议公告,finalpage/2013-07-17/62842017.PDF
2013-07-17,易华录：第二届董事会第十五次会议决议公告,finalpage/2013-07-17/62842018.PDF
2013-07-18,易华录：中航证券有限公司关于公司部分限售股解禁上市流通的核查意见,finalpage/2013-07-18/62845400.PDF
2013-07-18,易华录：关于限售股解禁上市流通的提示性公告,finalpage/2013-07-18/62845401.PDF
2013-07-23,易华录：关于召开2013年第一次临时股东大会的通知,finalpage/2013-07-23/62860396.PDF
2013-08-06,易华录：关于召开2013年第一次临时股东大会的提示性公告,finalpage/2013-08-06/62912075.PDF
2013-08-12,易华录：2013年第一次临时股东大会的法律意见书,finalpage/2013-08-12/62931319.PDF
2013-08-12,易华录：2013年第一次临时股东大会决议公告,finalpage/2013-08-12/62931320.PDF
2013-08-12,易华录：公司章程（2013年8月）,finalpage/2013-08-12/62931321.PDF
2013-08-13,易华录：独立董事关于聘任公司高级管理人员的独立意见,finalpage/2013-08-13/62935869.PDF
2013-08-13,易华录：第二届董事会第十六次会议决议公告,finalpage/2013-08-13/62935870.PDF
2013-08-17,易华录：重大工程中标公告,finalpage/2013-08-17/62952758.PDF
2013-08-19,易华录：关于投资者接待日的公告,finalpage/2013-08-19/62964367.PDF
2013-08-26,易华录：2013年半年度报告摘要,finalpage/2013-08-26/62988134.PDF
2013-08-26,易华录：2013年半年度报告,finalpage/2013-08-26/62988136.PDF
2013-08-26,易华录：第二届董事会第十七次会议决议公告,finalpage/2013-08-26/62988137.PDF
2013-08-26,易华录：2013年半年度报告披露提示性公告,finalpage/2013-08-26/62988138.PDF
2013-08-26,易华录：第二届监事会第十二次会议决议公告,finalpage/2013-08-26/62988139.PDF
2013-08-26,易华录：中航证券有限公司关于公司2013年上半年度持续督导跟踪报告,finalpage/2013-08-26/62988140.PDF
2013-08-26,易华录：关于董事兼高管辞职的公告,finalpage/2013-08-26/62988141.PDF
2013-08-26,易华录：独立董事关于公司关联方占用资金和对外担保情况的专项说明及独立意见,finalpage/2013-08-26/62988142.PDF
2013-08-26,易华录：独立董事关于推选甄爱武先生为公司第二届董事会董事的独立意见,finalpage/2013-08-26/62988143.PDF
2013-10-14,易华录：2013年前三季度业绩预告,finalpage/2013-10-14/63154142.PDF
2013-10-26,易华录：2013年第三季度报告披露提示性公告,finalpage/2013-10-26/63196617.PDF
2013-10-26,易华录：2013年第三季度报告全文,finalpage/2013-10-26/63196618.PDF
2013-10-26,易华录：关于设立山西分公司的公告,finalpage/2013-10-26/63196619.PDF
2013-10-26,易华录：关于设立湖南分公司的公告,finalpage/2013-10-26/63196620.PDF
2013-10-26,易华录：关于设立长春分公司的公告,finalpage/2013-10-26/63196621.PDF
2013-10-26,易华录：第二届监事会第十三次会议决议公告,finalpage/2013-10-26/63196622.PDF
2013-10-26,易华录：第二届董事会第十八次会议决议公告,finalpage/2013-10-26/63196623.PDF
2013-10-31,易华录：中航证券有限公司关于公司日常经营重大合同交易各方履约能力之专项核查意见,finalpage/2013-10-31/63222578.PDF
2013-10-31,易华录：北京市海勤律师事务所关于公司签署重大合同的法律意见书,finalpage/2013-10-31/63222579.PDF
2013-10-31,易华录：第二届董事会第十九次会议决议公告,finalpage/2013-10-31/63222580.PDF
2013-10-31,易华录：关于签订重大合同的公告,finalpage/2013-10-31/63222581.PDF
2013-11-25,易华录：关于公司董事长代行董事会秘书职责的公告,finalpage/2013-11-25/63303170.PDF
2013-12-26,易华录：关于签订重大合同的公告,finalpage/2013-12-26/63418303.PDF
2013-12-27,易华录：中航证券有限公司关于公司日常经营重大合同交易各方履约能力之专项核查意见,finalpage/2013-12-27/63420144.PDF
2013-12-27,易华录：北京市海勤律师事务所关于公司与天津市津南区人民政府签署《“智慧津南”建设战略合作协议》相关事宜的法律意见书,finalpage/2013-12-27/63420145.PDF
2013-12-27,易华录：关于与天津市津南区人民政府签署战略合作协议的公告,finalpage/2013-12-27/63420146.PDF
2013-12-31,易华录：关于公司被认定为“2013-2014年度国家规划布局内重点软件企业”的公告,finalpage/2013-12-31/63438563.PDF
2014-01-20,易华录：2013年年度业绩预告,finalpage/2014-01-20/63503890.PDF
2014-02-13,易华录：关于公司及相关方承诺履行情况的公告,finalpage/2014-02-13/63568516.PDF
2014-02-14,易华录：关于聘任公司董事会秘书的公告,finalpage/2014-02-14/63573421.PDF
2014-02-14,易华录：关于设立控股子公司乐山市易华录投资发展有限公司的公告,finalpage/2014-02-14/63573424.PDF
2014-02-14,易华录：关于设立控股子公司易华录集成科技有限责任公司的公告,finalpage/2014-02-14/63573425.PDF
2014-02-14,易华录：关于设立控股子公司泉州易华录投资发展有限公司的公告,finalpage/2014-02-14/63573427.PDF
2014-02-14,易华录：独立董事关于聘任公司董事会秘书的独立意见,finalpage/2014-02-14/63573430.PDF
2014-02-14,易华录：第二届董事会第二十次会议决议公告,finalpage/2014-02-14/63573431.PDF
2014-02-19,易华录：重大工程中标提示性公告,finalpage/2014-02-19/63588810.PDF
2014-02-27,易华录：2013年度业绩快报,finalpage/2014-02-27/63613772.PDF
2014-03-13,易华录：关于参股设立佛山中建交通联合投资有限公司的公告,finalpage/2014-03-13/63672997.PDF
2014-03-13,易华录：第二届董事会第二十一次会议决议公告,finalpage/2014-03-13/63672998.PDF
2014-03-25,易华录：2013年年度报告摘要,finalpage/2014-03-25/63718702.PDF
2014-03-25,易华录：2013年年度审计报告,finalpage/2014-03-25/63718703.PDF
2014-03-25,易华录：第二届董事会第二十二次会议决议公告,finalpage/2014-03-25/63718704.PDF
2014-03-25,易华录：关于召开2013年度股东大会会议的通知,finalpage/2014-03-25/63718705.PDF
2014-03-25,易华录：2013年度报告披露提示性公告,finalpage/2014-03-25/63718706.PDF
2014-03-25,易华录：第二届监事会第十四次会议决议公告,finalpage/2014-03-25/63718707.PDF
2014-03-25,易华录：中航证券有限公司关于公司2013年关联交易及2014年关联交易计划事项的核查意见,finalpage/2014-03-25/63718708.PDF
2014-03-25,易华录：中航证券有限公司关于公司内部控制自我评价报告的核查意见,finalpage/2014-03-25/63718709.PDF
2014-03-25,易华录：中航证券有限公司关于公司募集资金2013年度使用情况的专项核查意见,finalpage/2014-03-25/63718710.PDF
2014-03-25,易华录：2013年度内部控制自我评价报告,finalpage/2014-03-25/63718711.PDF
2014-03-25,易华录：募集资金存放与使用情况的专项报告,finalpage/2014-03-25/63718712.PDF
2014-03-25,易华录：2014年度日常经营关联交易预计事项的公告,finalpage/2014-03-25/63718713.PDF
2014-03-25,易华录：2014年第一季度业绩预告,finalpage/2014-03-25/63718714.PDF
2014-03-25,易华录：公司章程（2014年3月）,finalpage/2014-03-25/63718715.PDF
2014-03-25,易华录：关于举行2013年度网上业绩说明会的公告,finalpage/2014-03-25/63718716.PDF
2014-03-25,易华录：内部控制鉴证报告,finalpage/2014-03-25/63718717.PDF
2014-03-25,易华录：募集资金存放与使用情况鉴证报告,finalpage/2014-03-25/63718718.PDF
2014-03-25,易华录：独立董事关于相关事项的独立意见,finalpage/2014-03-25/63718719.PDF
2014-03-25,易华录：2013年独立董事述职报告（于中一）,finalpage/2014-03-25/63718722.PDF
2014-03-25,易华录：2013年独立董事述职报告（许光建）,finalpage/2014-03-25/63718723.PDF
2014-03-25,易华录：2013年独立董事述职报告（陆化普）,finalpage/2014-03-25/63718724.PDF
2014-03-25,易华录：非经营性资金占用及其他关联资金往来的专项说明,finalpage/2014-03-25/63718725.PDF
2014-03-25,易华录：2013年年度报告,finalpage/2014-03-25/63720596.PDF
2014-03-27,易华录：关于变更股东大会召开方式暨2013年度股东大会补充通知的公告,finalpage/2014-03-27/63732869.PDF
2014-04-09,易华录：中航证券有限公司关于公司2013年度持续督导跟踪报告,finalpage/2014-04-09/63812706.PDF
2014-04-15,易华录：2013年度股东大会决议公告,finalpage/2014-04-15/63847448.PDF
2014-04-15,易华录：2013年度股东大会的法律意见书,finalpage/2014-04-15/63847449.PDF
2014-04-15,易华录：公司章程（2014年4月）,finalpage/2014-04-15/63847452.PDF
2014-04-15,易华录：关于变更董事的公告,finalpage/2014-04-15/63847454.PDF
2014-04-18,易华录：2013年年度权益分派实施公告,finalpage/2014-04-18/63862967.PDF
2014-04-23,易华录：关于投资者接待日的公告,finalpage/2014-04-23/63898806.PDF
2014-04-24,易华录：2014年第一季度报告全文,finalpage/2014-04-24/63904090.PDF
2014-04-24,易华录：2014年第一季度报告披露提示性公告,finalpage/2014-04-24/63904091.PDF
2014-04-24,易华录：关于召开2014年第一次临时股东大会会议的通知,finalpage/2014-04-24/63904092.PDF
2014-04-24,易华录：关于监事辞职的公告,finalpage/2014-04-24/63904094.PDF
2014-04-24,易华录：第二届监事会第十五次会议决议公告,finalpage/2014-04-24/63904095.PDF
2014-04-24,易华录：第二届董事会第二十三次会议决议公告,finalpage/2014-04-24/63904096.PDF
2014-04-30,易华录：中航证券有限公司关于公司部分限售股解禁上市流通的核查意见,finalpage/2014-04-30/63948830.PDF
2014-04-30,易华录：首次公开发行前已发行股份上市流通提示性公告,finalpage/2014-04-30/63948833.PDF
2014-05-12,易华录：2014年第一次临时股东大会的法律意见书,finalpage/2014-05-12/64016332.PDF
2014-05-12,易华录：2014年第一次临时股东大会决议公告,finalpage/2014-05-12/64016333.PDF
2014-05-12,易华录：关于变更监事的公告,finalpage/2014-05-12/64016334.PDF
2014-05-23,易华录：关于与东海县人民政府签署战略合作协议的公告,finalpage/2014-05-23/64059732.PDF
2014-06-09,易华录：关于设立云南分公司的公告,finalpage/2014-06-09/64118339.PDF
2014-06-09,易华录：关于设立内蒙古分公司的公告,finalpage/2014-06-09/64118340.PDF
2014-06-09,易华录：关于设立安徽分公司的公告,finalpage/2014-06-09/64118344.PDF
2014-06-09,易华录：关于设立广东分公司的公告,finalpage/2014-06-09/64118345.PDF
2014-06-09,易华录：关于设立江苏分公司的公告,finalpage/2014-06-09/64118346.PDF
2014-06-09,易华录：关于设立河南分公司的公告,finalpage/2014-06-09/64118349.PDF
2014-06-09,易华录：关于设立湖北分公司的公告,finalpage/2014-06-09/64118351.PDF
2014-06-09,易华录：关于设立贵州分公司的公告,finalpage/2014-06-09/64118352.PDF
2014-06-09,易华录：关于设立辽宁分公司的公告,finalpage/2014-06-09/64118354.PDF
2014-06-09,易华录：第二届董事会第二十四次会议决议公告,finalpage/2014-06-09/64118355.PDF
2014-06-13,易华录：关于与嘉禾县人民政府签署战略合作协议的公告,finalpage/2014-06-13/64135481.PDF
2014-06-18,易华录：关于与阿里云计算有限公司签署战略合作协议的公告,finalpage/2014-06-18/64151596.PDF
2014-06-18,易华录：关于投资者接待日的公告,finalpage/2014-06-18/64151294.PDF
2014-06-27,易华录：关于公司及相关方承诺履行情况的公告,finalpage/2014-06-27/1200014486.PDF
2014-06-30,易华录：关于重大工程预中标公告,finalpage/2014-06-30/1200022191.PDF
2014-07-03,易华录：关于签署东莞市东城区智慧城市智能中心建设意向书的公告,finalpage/2014-07-03/1200029642.PDF
2014-07-08,易华录：关于收到中标通知书的公告,finalpage/2014-07-08/1200041211.PDF
2014-07-09,易华录：2014年半年度业绩预告,finalpage/2014-07-09/1200043011.PDF
2014-07-23,易华录：关于与肥城市人民政府签署战略合作协议的公告,finalpage/2014-07-23/1200074009.PDF
2014-08-08,易华录：关于签订重大合同的公告,finalpage/2014-08-08/1200111874.PDF
2014-08-22,易华录：2014年半年度报告摘要,finalpage/2014-08-22/1200149414.PDF
2014-08-22,易华录：2014年半年度报告,finalpage/2014-08-22/1200149415.PDF
2014-08-22,易华录：第二届董事会第二十五次会议决议公告,finalpage/2014-08-22/1200149416.PDF
2014-08-22,易华录：2014年半年度报告披露提示性公告,finalpage/2014-08-22/1200149417.PDF
2014-08-22,易华录：第二届监事会第十六次会议决议公告,finalpage/2014-08-22/1200149418.PDF
2014-08-22,易华录：中航证券有限公司关于公司2014年上半年持续督导跟踪报告,finalpage/2014-08-22/1200149419.PDF
2014-08-22,易华录：2014年半年度募集资金存放与使用情况的专项报告,finalpage/2014-08-22/1200149420.PDF
2014-08-22,易华录：独立董事关于相关事项的独立意见,finalpage/2014-08-22/1200149421.PDF
2014-09-01,易华录：关于高级管理人员辞职的公告,finalpage/2014-09-01/1200196131.PDF
2014-09-01,易华录：第二届董事会第二十六次会议决议公告,finalpage/2014-09-01/1200196132.PDF
2014-09-04,易华录：重大事项停牌公告,finalpage/2014-09-04/1200202554.PDF
2014-09-11,易华录：重大事项停牌进展公告,finalpage/2014-09-11/1200226447.PDF
2014-09-18,易华录：重大事项停牌进展公告,finalpage/2014-09-18/1200246020.PDF
2014-09-25,易华录：重大事项停牌进展公告,finalpage/2014-09-25/1200261364.PDF
2014-09-30,易华录：中航证券有限公司关于公司调整募集资金投资项目投资结构并结项以及使用节余募集资金及利息永久补充流动资金的核查意见,finalpage/2014-09-30/1200278370.PDF
2014-09-30,易华录：关于使用节余募集资金及利息永久补充流动资金的公告,finalpage/2014-09-30/1200278371.PDF
2014-09-30,易华录：关于召开2014年第二次临时股东大会的通知,finalpage/2014-09-30/1200278372.PDF
2014-09-30,易华录：关于设立四川分公司的公告,finalpage/2014-09-30/1200278373.PDF
2014-09-30,易华录：关于设立陕西分公司的公告,finalpage/2014-09-30/1200278374.PDF
2014-09-30,易华录：关于调整募集资金投资项目投资结构并结项的公告,finalpage/2014-09-30/1200278375.PDF
2014-09-30,易华录：独立董事关于相关事项的独立意见,finalpage/2014-09-30/1200278376.PDF
2014-09-30,易华录：第二届监事会第十七次会议决议公告,finalpage/2014-09-30/1200278377.PDF
2014-09-30,易华录：第二届董事会第二十七次会议决议公告,finalpage/2014-09-30/1200278378.PDF
2014-10-09,易华录：重大事项停牌进展公告,finalpage/2014-10-09/1200285074.PDF
2014-10-10,易华录：关于召开2014年第二次临时股东大会的提示性公告,finalpage/2014-10-10/1200288377.PDF
2014-10-13,易华录：2014年前三季度业绩预告,finalpage/2014-10-13/1200295879.PDF
2014-10-13,易华录：关于与曲阜市人民政府签署战略合作协议的公告,finalpage/2014-10-13/1200294013.PDF
2014-10-16,易华录：2014年第二次临时股东大会决议公告,finalpage/2014-10-16/1200306141.PDF
2014-10-16,易华录：2014年第二次临时股东大会的法律意见书,finalpage/2014-10-16/1200306142.PDF
2014-10-16,易华录：重大事项停牌进展公告,finalpage/2014-10-16/1200306067.PDF
2014-10-22,易华录：独立董事关于《北京易华录信息技术股份有限公司关于非公开发行股票方案的论证分析报告》的专项意见,finalpage/2014-10-22/1200319892.PDF
2014-10-22,易华录：补充更正公告,finalpage/2014-10-22/1200319893.PDF
2014-10-22,易华录：公司章程修订对照说明,finalpage/2014-10-22/1200316849.PDF
2014-10-22,易华录：《股东大会议事规则》修订对照说明,finalpage/2014-10-22/1200316850.PDF
2014-10-22,易华录：公司与中再资产管理股份有限公司之非公开发行股份认购协议,finalpage/2014-10-22/1200316851.PDF
2014-10-22,易华录：公司与中国华录集团有限公司之非公开发行股份认购协议,finalpage/2014-10-22/1200316852.PDF
2014-10-22,易华录：公司与中国华融资产管理股份有限公司之非公开发行股份认购协议,finalpage/2014-10-22/1200316853.PDF
2014-10-22,易华录：非公开发行股份认购协议,finalpage/2014-10-22/1200316854.PDF
2014-10-22,易华录：公司与深圳潇湘君亨投资企业（有限合伙）之非公开发行股份认购协议,finalpage/2014-10-22/1200316855.PDF
2014-10-22,易华录：公司章程（2014年10月）,finalpage/2014-10-22/1200316856.PDF
2014-10-22,易华录：关于公司非公开发行股票涉及关联交易事项的公告,finalpage/2014-10-22/1200316857.PDF
2014-10-22,易华录：关于前次募集资金使用情况的报告,finalpage/2014-10-22/1200316858.PDF
2014-10-22,易华录：关于召开2014年第三次临时股东大会的通知,finalpage/2014-10-22/1200316859.PDF
2014-10-22,易华录：关于股票复牌的公告,finalpage/2014-10-22/1200316860.PDF
2014-10-22,易华录：关于非公开发行股票方案的论证分析报告,finalpage/2014-10-22/1200316861.PDF
2014-10-22,易华录：前次募集资金使用情况鉴证报告,finalpage/2014-10-22/1200316862.PDF
2014-10-22,易华录：北京市海勤律师事务所关于公司实施公司-第一期员工持股计划的法律意见书,finalpage/2014-10-22/1200316863.PDF
2014-10-22,易华录：华西证券股份有限公司关于公司非公开发行股票涉及关联交易事项的核查意见,finalpage/2014-10-22/1200316864.PDF
2014-10-22,易华录：关于公司未来三年（2014年-2016年）股东回报规划,finalpage/2014-10-22/1200316865.PDF
2014-10-22,易华录：独立董事关于关联交易等相关事项的事前认可意见,finalpage/2014-10-22/1200316866.PDF
2014-10-22,易华录：独立董事关于第二届董事会第二十八次会议相关事项的独立意见,finalpage/2014-10-22/1200316867.PDF
2014-10-22,易华录：公司—第1期员工持股计划（草案）（认购非公开发行股票方式）,finalpage/2014-10-22/1200316868.PDF
2014-10-22,易华录：第二届监事会第十八次会议决议公告,finalpage/2014-10-22/1200316869.PDF
2014-10-22,易华录：第二届董事会第二十八次会议决议公告,finalpage/2014-10-22/1200316870.PDF
2014-10-22,易华录：非公开发行股票募集资金使用可行性分析报告,finalpage/2014-10-22/1200316871.PDF
2014-10-22,易华录：非公开发行股票预案,finalpage/2014-10-22/1200316872.PDF
2014-10-22,易华录：非公开发行股票预案披露提示性公告,finalpage/2014-10-22/1200316873.PDF
2014-10-22,易华录：股东大会议事规则（2014年10月）,finalpage/2014-10-22/1200316874.PDF
2014-10-23,易华录：关于投资者接待日的公告,finalpage/2014-10-23/1200322705.PDF
2014-10-25,易华录：2014年第三季度报告披露提示性公告,finalpage/2014-10-25/1200329147.PDF
2014-10-25,易华录：2014年第三季度报告全文,finalpage/2014-10-25/1200329148.PDF
2014-10-25,易华录：关于会计政策变更的公告,finalpage/2014-10-25/1200329149.PDF
2014-10-25,易华录：独立董事关于会计政策变更的独立意见,finalpage/2014-10-25/1200329150.PDF
2014-10-25,易华录：第二届监事会第十九次会议决议公告,finalpage/2014-10-25/1200329151.PDF
2014-10-25,易华录：第二届董事会第二十九次会议决议公告,finalpage/2014-10-25/1200329152.PDF
2014-10-27,易华录：关于会计政策变更的补充公告,finalpage/2014-10-27/1200338294.PDF
2014-11-07,易华录：关于签订重大合同的公告,finalpage/2014-11-07/1200378725.PDF
2014-11-13,易华录：关于延期召开2014年第三次临时股东大会的通知,finalpage/2014-11-13/1200391019.PDF
2014-11-18,易华录：重大事项停牌公告,finalpage/2014-11-18/1200399206.PDF
2014-11-24,易华录：重大事项停牌进展公告,finalpage/2014-11-24/1200413492.PDF
2014-11-25,易华录：关于与阳信县人民政府签署战略合作协议的公告,finalpage/2014-11-25/1200417207.PDF
2014-11-25,易华录：关于取消召开2014年第三次临时股东大会的公告,finalpage/2014-11-25/1200417138.PDF
2014-11-25,易华录：独立董事关于相关事项的独立意见,finalpage/2014-11-25/1200417139.PDF
2014-11-25,易华录：第二届监事会第二十次会议决议公告,finalpage/2014-11-25/1200417140.PDF
2014-11-25,易华录：第二届董事会第三十次会议决议公告,finalpage/2014-11-25/1200417141.PDF
2014-12-02,易华录：公司与中再资产管理股份有限公司之非公开发行股份认购协议,finalpage/2014-12-02/1200431895.PDF
2014-12-02,易华录：公司与中国华录集团有限公司之非公开发行股份认购协议,finalpage/2014-12-02/1200431896.PDF
2014-12-02,易华录：公司与中国华融资产管理股份有限公司之非公开发行股份认购协议,finalpage/2014-12-02/1200431897.PDF
2014-12-02,易华录：公司与宁波华易智诚投资合伙企业（有限合伙）之非公开发行股份认购协议,finalpage/2014-12-02/1200431898.PDF
2014-12-02,易华录：公司与深圳潇湘君亨投资企业（有限合伙）之非公开发行股份认购协议,finalpage/2014-12-02/1200431899.PDF
2014-12-02,易华录：关于公司非公开发行股票涉及关联交易事项的公告,finalpage/2014-12-02/1200431900.PDF
2014-12-02,易华录：关于前次募集资金使用情况的报告,finalpage/2014-12-02/1200431901.PDF
2014-12-02,易华录：关于召开2014年第三次临时股东大会的通知,finalpage/2014-12-02/1200431902.PDF
2014-12-02,易华录：关于股票复牌的公告,finalpage/2014-12-02/1200431903.PDF
2014-12-02,易华录：关于非公开发行股票方案的论证分析报告,finalpage/2014-12-02/1200431904.PDF
2014-12-02,易华录：前次募集资金使用情况鉴证报告,finalpage/2014-12-02/1200431905.PDF
2014-12-02,易华录：华西证券股份有限公司关于公司非公开发行股票涉及关联交易事项的核查意见,finalpage/2014-12-02/1200431906.PDF
2014-12-02,易华录：独立董事关于《北京易华录信息技术股份有限公司关于非公开发行股票方案的论证分析报告》的专项意见,finalpage/2014-12-02/1200431907.PDF
2014-12-02,易华录：独立董事关于关联交易等相关事项的事前认可意见,finalpage/2014-12-02/1200431908.PDF
2014-12-02,易华录：独立董事关于第二届董事会第三十一次会议相关事项的独立意见,finalpage/2014-12-02/1200431909.PDF
2014-12-02,易华录：第二届监事会第二十一次会议决议公告,finalpage/2014-12-02/1200431910.PDF
2014-12-02,易华录：第二届董事会第三十一次会议决议公告,finalpage/2014-12-02/1200431911.PDF
2014-12-02,易华录：非公开发行股票募集资金使用可行性分析报告,finalpage/2014-12-02/1200431912.PDF
2014-12-02,易华录：非公开发行股票预案披露提示性公告,finalpage/2014-12-02/1200431913.PDF
2014-12-02,易华录：非公开发行股票预案（修订稿）,finalpage/2014-12-02/1200431914.PDF
2014-12-12,易华录：关于重大工程预中标公告,finalpage/2014-12-12/1200461934.PDF
2014-12-15,易华录：关于召开2014年第三次临时股东大会的提示性公告,finalpage/2014-12-15/1200467995.PDF
2014-12-15,易华录：关于召开2014年第四次临时股东大会的通知,finalpage/2014-12-15/1200467996.PDF
2014-12-15,易华录：关于拟使用自有资金增资并购新加坡Infologic公司的公告,finalpage/2014-12-15/1200467997.PDF
2014-12-15,易华录：关于非公开发行股票相关事项获得国务院国资委批复的公告,finalpage/2014-12-15/1200467998.PDF
2014-12-15,易华录：独立董事候选人声明（杨晓光）,finalpage/2014-12-15/1200467999.PDF
2014-12-15,易华录：独立董事候选人声明（梁云凤）,finalpage/2014-12-15/1200468000.PDF
2014-12-15,易华录：独立董事候选人声明（马朝松）,finalpage/2014-12-15/1200468001.PDF
2014-12-15,易华录：独立董事关于公司董事会换届选举及提名董事候选人的独立意见,finalpage/2014-12-15/1200468002.PDF
2014-12-15,易华录：独立董事提名人声明（一）,finalpage/2014-12-15/1200468003.PDF
2014-12-15,易华录：独立董事提名人声明（三）,finalpage/2014-12-15/1200468004.PDF
2014-12-15,易华录：独立董事提名人声明（二）,finalpage/2014-12-15/1200468005.PDF
2014-12-15,易华录：第二届监事会第二十二次会议决议公告,finalpage/2014-12-15/1200468006.PDF
2014-12-15,易华录：第二届董事会第三十二次会议决议公告,finalpage/2014-12-15/1200468007.PDF
2014-12-18,易华录：2014年第三次临时股东大会决议公告,finalpage/2014-12-18/1200476254.PDF
2014-12-18,易华录：2014年第三次临时股东大会的法律意见书,finalpage/2014-12-18/1200476255.PDF
