date,title,url
2014-12-26,易华录：关于召开2014年第四次临时股东大会的提示性公告,finalpage/2014-12-26/1200499374.PDF
2014-12-29,易华录：关于收到中标通知书的公告,finalpage/2014-12-29/1200503027.PDF
2014-12-30,易华录：关于收到《中国证监会行政许可申请受理通知书》的公告,finalpage/2014-12-30/1200506283.PDF
2014-12-31,易华录：2014年第四次临时股东大会决议公告,finalpage/2014-12-31/1200511749.PDF
2014-12-31,易华录：2014年第四次临时股东大会的法律意见书,finalpage/2014-12-31/1200511750.PDF
2014-12-31,易华录：关于选举产生第三届监事会职工监事的公告,finalpage/2014-12-31/1200511751.PDF
2015-01-14,易华录：关于与北京邮电大学经济管理学院签署战略合作协议的公告,finalpage/2015-01-14/1200545492.PDF
2015-01-26,易华录：2014年度业绩预告,finalpage/2015-01-26/1200579776.PDF
2015-02-02,易华录：关于签署增资并购新加坡Infologic公司投资协议的公告,finalpage/2015-02-02/1200603807.PDF
2015-02-04,易华录：关于公司及控股子公司近期取得资质证书的公告,finalpage/2015-02-04/1200610588.PDF
2015-02-05,易华录：关于与辽宁省公安厅交通安全管理局签署合作协议的公告,finalpage/2015-02-05/1200613777.PDF
2015-02-26,易华录：2014年度业绩快报,finalpage/2015-02-26/1200654096.PDF
2015-02-26,易华录：独立董事关于选举董事长及聘任公司高级管理人员的独立意见,finalpage/2015-02-26/1200653127.PDF
2015-02-26,易华录：第三届监事会第一次会议决议公告,finalpage/2015-02-26/1200653128.PDF
2015-02-26,易华录：第三届董事会第一次会议决议公告,finalpage/2015-02-26/1200653129.PDF
2015-03-04,易华录：关于签订重大合同的公告,finalpage/2015-03-04/1200670715.PDF
2015-03-23,易华录：关于与乐山市人民政府签订“智慧云亭”投资运营协议的公告,finalpage/2015-03-23/1200733057.PDF
2015-03-25,易华录：关于投资者接待日的公告,finalpage/2015-03-25/1200742117.PDF
2015-03-25,易华录：关于与阳泉市城区人民政府签署战略合作协议的公告,finalpage/2015-03-25/1200742118.PDF
2015-03-25,易华录：关于举行2014年度网上业绩说明会的公告,finalpage/2015-03-25/1200742119.PDF
2015-03-25,易华录：关于召开2014年度股东大会会议的通知,finalpage/2015-03-25/1200742120.PDF
2015-03-25,易华录：2014年年度报告摘要,finalpage/2015-03-25/1200737654.PDF
2015-03-25,易华录：2014年年度审计报告,finalpage/2015-03-25/1200737656.PDF
2015-03-25,易华录：第三届董事会第二次会议决议公告,finalpage/2015-03-25/1200737657.PDF
2015-03-25,易华录：2014年度报告披露提示性公告,finalpage/2015-03-25/1200737658.PDF
2015-03-25,易华录：第三届监事会第二次会议决议公告,finalpage/2015-03-25/1200737659.PDF
2015-03-25,易华录：2014年年度报告,finalpage/2015-03-25/1200737660.PDF
2015-03-25,易华录：中航证券有限公司关于公司2014年关联交易及2015年关联交易计划事项的核查意见,finalpage/2015-03-25/1200737661.PDF
2015-03-25,易华录：中航证券有限公司关于公司2014年度持续督导跟踪报告,finalpage/2015-03-25/1200737662.PDF
2015-03-25,易华录：中航证券有限公司关于公司内部控制自我评价报告的核查意见,finalpage/2015-03-25/1200737663.PDF
2015-03-25,易华录：中航证券有限公司关于公司募集资金2014年度使用情况的专项核查意见,finalpage/2015-03-25/1200737664.PDF
2015-03-25,易华录：2014年度募集资金存放与使用情况的专项报告,finalpage/2015-03-25/1200737665.PDF
2015-03-25,易华录：2014年度内部控制自我评价报告,finalpage/2015-03-25/1200737666.PDF
2015-03-25,易华录：内部控制鉴证报告,finalpage/2015-03-25/1200737667.PDF
2015-03-25,易华录：募集资金存放与使用情况鉴证报告,finalpage/2015-03-25/1200737668.PDF
2015-03-25,易华录：非经营性资金占用及其他关联资金往来的专项说明,finalpage/2015-03-25/1200737669.PDF
2015-03-25,易华录：2015年度日常经营关联交易预计事项的公告,finalpage/2015-03-25/1200737670.PDF
2015-03-25,易华录：2015年第一季度业绩预告,finalpage/2015-03-25/1200737671.PDF
2015-03-25,易华录：独立董事关于相关事项的独立意见,finalpage/2015-03-25/1200737672.PDF
2015-03-25,易华录：2014年独立董事述职报告（于中一）,finalpage/2015-03-25/1200737673.PDF
2015-03-25,易华录：2014年独立董事述职报告（许光建）,finalpage/2015-03-25/1200737674.PDF
2015-03-25,易华录：2014年独立董事述职报告（陆化普）,finalpage/2015-03-25/1200737675.PDF
2015-03-26,易华录：关于合作伙伴中标的提示性公告,finalpage/2015-03-26/1200745571.PDF
2015-04-10,易华录：中航证券有限公司关于公司首次公开发行股票并在创业板上市之持续督导保荐总结报告书,finalpage/2015-04-10/1200815334.PDF
2015-04-10,易华录：中航证券有限公司关于公司2014年度持续督导定期现场检查报告,finalpage/2015-04-10/1200815333.PDF
2015-04-13,易华录：与宁波华易智诚投资合伙企业（有限合伙）之非公开发行股份认购协议补充协议,finalpage/2015-04-13/1200820448.PDF
2015-04-13,易华录：与深圳潇湘君亨投资企业（有限合伙）之非公开发行股份认购协议补充协议,finalpage/2015-04-13/1200820449.PDF
2015-04-13,易华录：关于公司非公开发行股票涉及关联交易事项的公告,finalpage/2015-04-13/1200820450.PDF
2015-04-13,易华录：关于拟设立控股子公司两岸信息消费研究院有限公司的公告,finalpage/2015-04-13/1200820451.PDF
2015-04-13,易华录：关于前次募集资金使用情况的报告,finalpage/2015-04-13/1200820452.PDF
2015-04-13,易华录：前次募集资金使用情况鉴证报告,finalpage/2015-04-13/1200820453.PDF
2015-04-13,易华录：独立董事关于关联交易事项的事前认可意见,finalpage/2015-04-13/1200820454.PDF
2015-04-13,易华录：独立董事关于第三届董事会第三次会议相关事项的独立意见,finalpage/2015-04-13/1200820455.PDF
2015-04-13,易华录：第三届监事会第三次会议决议公告,finalpage/2015-04-13/1200820456.PDF
2015-04-13,易华录：第三届董事会第三次会议决议公告,finalpage/2015-04-13/1200820457.PDF
2015-04-20,易华录：2014年度股东大会决议公告,finalpage/2015-04-20/1200874423.PDF
2015-04-20,易华录：2014年度股东大会的法律意见书,finalpage/2015-04-20/1200874424.PDF
2015-04-22,易华录：独立董事关于相关事项的独立意见,finalpage/2015-04-22/1200888418.PDF
2015-04-22,易华录：第三届董事会第四次会议决议公告,finalpage/2015-04-22/1200888419.PDF
2015-04-27,易华录：2015年第一季度报告全文,finalpage/2015-04-27/1200903987.PDF
2015-04-27,易华录：2015年第一季度报告披露提示性公告,finalpage/2015-04-27/1200903988.PDF
2015-05-11,易华录：关于与白俄罗斯共和国BUSINESS NETWORK有限责任公司签署合作备忘录的公告,finalpage/2015-05-11/1200999987.PDF
2015-05-13,易华录：关于与白俄罗斯共和国电信及信息部及BUSINESS NETWORK有限责任公司签署合作备忘录的公告,finalpage/2015-05-13/1201011751.PDF
2015-05-15,易华录：关于与全国老龄工作委员会办公室信息中心签署合作协议的公告,finalpage/2015-05-15/1201020843.PDF
2015-05-20,易华录：关于与泗水县人民政府签署战略合作协议的公告,finalpage/2015-05-20/1201042300.PDF
2015-05-25,易华录：重大工程预中标公告,finalpage/2015-05-25/1201061950.PDF
2015-06-04,易华录：2014年年度权益分派实施公告,finalpage/2015-06-04/1201100587.PDF
2015-06-05,易华录：关于收到中标通知书的公告,finalpage/2015-06-05/1201110029.PDF
2015-06-09,易华录：第三届董事会第六次会议决议公告,finalpage/2015-06-09/1201128174.PDF
2015-06-09,易华录：关于与关联方共同投资设立华录光存储研究院有限公司暨关联交易的公告,finalpage/2015-06-09/1201128171.PDF
2015-06-09,易华录：独立董事关于关联交易事项的事前认可意见,finalpage/2015-06-09/1201128172.PDF
2015-06-09,易华录：独立董事关于关联交易事项的独立意见,finalpage/2015-06-09/1201128173.PDF
2015-06-11,易华录：关于实施2014年度权益分派方案后调整非公开股票发行价格及发行数量的公告,finalpage/2015-06-11/1201139545.PDF
2015-06-12,易华录：关于非公开发行股票相关事项的公告,finalpage/2015-06-12/1201145333.PDF
2015-06-17,易华录：关于非公开发行股票申请文件告知函有关问题落实情况的公告,finalpage/2015-06-17/1201164824.PDF
2015-06-19,易华录：关于与房山区人民政府签署战略合作协议的公告,finalpage/2015-06-19/1201175166.PDF
2015-06-19,易华录：关于与门头沟区人民政府签署战略合作协议的公告,finalpage/2015-06-19/1201175167.PDF
2015-06-24,易华录：关于非公开发行A股股票申请获得中国证监会创业板发行审核委员会审核通过的公告,finalpage/2015-06-24/1201190794.PDF
2015-07-01,易华录：关于重大事项停牌的公告,finalpage/2015-07-01/1201220416.PDF
2015-07-06,易华录：关于重大事项继续停牌的公告,finalpage/2015-07-06/1201247338.PDF
2015-07-08,易华录：关于控股股东与河北省人民政府签署战略合作协议的公告,finalpage/2015-07-08/1201254497.PDF
2015-07-08,易华录：关于重大事项继续停牌的公告,finalpage/2015-07-08/1201254498.PDF
2015-07-13,易华录：关于与白俄罗斯共和国BUSINESS NETWORK有限责任公司签署合作协议的公告,finalpage/2015-07-13/1201276717.PDF
2015-07-13,易华录：复牌公告,finalpage/2015-07-13/1201276718.PDF
2015-07-13,易华录：关于维护公司股价稳定的公告,finalpage/2015-07-13/1201282241.PDF
2015-07-14,易华录：2015年半年度业绩预告,finalpage/2015-07-14/1201293208.PDF
2015-07-14,易华录：关于与公安部交通管理科学研究所签署技术合作协议的公告,finalpage/2015-07-14/1201294121.PDF
2015-07-14,易华录：关于变更高管人员及董事会秘书的公告,finalpage/2015-07-14/1201291723.PDF
2015-07-14,易华录：独立董事关于相关事项的独立意见,finalpage/2015-07-14/1201291724.PDF
2015-07-14,易华录：第三届董事会第七次会议决议公告,finalpage/2015-07-14/1201291725.PDF
2015-07-16,易华录：股票交易异常波动公告,finalpage/2015-07-16/1201305345.PDF
2015-07-17,易华录：关于与国家开发银行股份有限公司北京市分行签署开发性金融合作协议的公告,finalpage/2015-07-17/1201311021.PDF
2015-07-22,易华录：关于签署乐山市大数据中心项目框架合作协议的公告,finalpage/2015-07-22/1201334661.PDF
2015-07-27,易华录：重大工程预中标公告,finalpage/2015-07-27/1201350865.PDF
2015-07-30,易华录：关于控股子公司收到中标通知书的公告,finalpage/2015-07-30/1201370351.PDF
2015-08-07,易华录：关于公司非公开发行股票申请获得中国证监会核准批复的公告,finalpage/2015-08-07/1201406495.PDF
2015-08-10,易华录：重大事项停牌进展公告,finalpage/2015-08-10/1201418051.PDF
2015-08-12,易华录：关于与湘潭市商务局签署招商引资项目协议、与湘潭市经济和信息化委员会签署智慧湘潭项目建设备忘录的公告,finalpage/2015-08-12/1201423843.PDF
2015-08-12,易华录：复牌公告,finalpage/2015-08-12/1201423844.PDF
2015-08-14,易华录：北京市海勤律师事务所关于公司与湘潭市商务局签署《招商引资项目协议》、与湘潭市经济和信息化委员会签署《智慧湘潭项目建设备忘录》相关事宜的法律意见书,finalpage/2015-08-14/1201439308.PDF
2015-08-14,易华录：北京市海勤律师事务所关于公司控股股东中国华录集团有限公司与河北省人民政府签署《战略合作协议》相关事宜的法律意见书,finalpage/2015-08-14/1201439309.PDF
2015-08-14,易华录：华西证券股份有限公司关于公司日常经营重大合同交易各方履约能力之专项核查意见,finalpage/2015-08-14/1201439310.PDF
2015-08-14,易华录：股票交易异常波动公告,finalpage/2015-08-14/1201439311.PDF
2015-08-20,易华录：关于与广东德联集团股份有限公司签署战略合作协议的公告,finalpage/2015-08-20/1201468783.PDF
2015-08-20,易华录：关于与中骏天宝资本管理（北京）有限公司、广东德联集团股份有限公司签署投资合作协议的公告,finalpage/2015-08-20/1201468782.PDF
2015-08-26,易华录：2015年半年度报告摘要,finalpage/2015-08-26/1201492091.PDF
2015-08-26,易华录：2015年半年度报告,finalpage/2015-08-26/1201492092.PDF
2015-08-26,易华录：第三届董事会第八次会议决议公告,finalpage/2015-08-26/1201492093.PDF
2015-08-26,易华录：2015年半年度报告披露提示性公告,finalpage/2015-08-26/1201492094.PDF
2015-08-26,易华录：第三届监事会第五次会议决议公告,finalpage/2015-08-26/1201492095.PDF
2015-08-26,易华录：独立董事关于相关事项的独立意见,finalpage/2015-08-26/1201492096.PDF
2015-09-22,易华录：关于非公开发行股票发行情况报告书的提示性公告,finalpage/2015-09-22/1201620285.PDF
2015-09-22,易华录：北京市海勤律师事务所关于公司非公开发行股票发行过程及发行对象合规性的见证法律意见书,finalpage/2015-09-22/1201620286.PDF
2015-09-22,易华录：华西证券股份有限公司关于公司非公开发行股票发行过程和认购对象合规性的报告,finalpage/2015-09-22/1201620287.PDF
2015-09-22,易华录：非公开发行股票发行情况报告书,finalpage/2015-09-22/1201620288.PDF
2015-09-22,易华录：验资报告,finalpage/2015-09-22/1201620289.PDF
2015-09-23,易华录：关于与数据堂（北京）科技股份有限公司签署战略合作协议的公告,finalpage/2015-09-23/1201630180.PDF
2015-09-25,易华录：华西证券股份有限公司关于公司非公开发行股票之上市保荐书,finalpage/2015-09-25/1201634630.PDF
2015-09-25,易华录：简式权益变动报告书,finalpage/2015-09-25/1201634631.PDF
2015-09-25,易华录：非公开发行股票上市公告书,finalpage/2015-09-25/1201634632.PDF
2015-09-28,易华录：公司章程（2015年9月）,finalpage/2015-09-28/1201649157.PDF
2015-09-28,易华录：关于签订募集资金三方监管协议的公告,finalpage/2015-09-28/1201649158.PDF
2015-09-28,易华录：第三届董事会第九次会议决议公告,finalpage/2015-09-28/1201649159.PDF
2015-10-14,易华录：2015年前三季度业绩预告,finalpage/2015-10-14/1201694013.PDF
2015-10-21,易华录：关于与九次方财富资讯（北京）有限责任公司签署战略合作协议的公告,finalpage/2015-10-21/1201713070.PDF
2015-10-23,易华录：预中标公告,finalpage/2015-10-23/1201718974.PDF
2015-10-26,易华录：关于签订重大合同的公告,finalpage/2015-10-26/1201720278.PDF
2015-10-27,易华录：关于与呼和浩特市人民政府签署合作协议的公告,finalpage/2015-10-27/1201730430.PDF
2015-10-27,易华录：2015年第三季度报告披露提示性公告,finalpage/2015-10-27/1201725149.PDF
2015-10-27,易华录：2015年第三季度报告全文,finalpage/2015-10-27/1201725150.PDF
2015-10-28,易华录：关于与山东省PPP发展基金参股设立子基金的公告,finalpage/2015-10-28/1201736305.PDF
2015-11-10,易华录：关于与华电联网股份有限公司（台湾）签署战略合作协议的公告,finalpage/2015-11-10/1201760721.PDF
2015-11-16,易华录：关于与泉州市公安局交通警察支队签署战略合作协议的公告,finalpage/2015-11-16/1201773953.PDF
2015-11-18,易华录：关于与福建省泉州市石狮市人民政府签署战略合作协议的公告,finalpage/2015-11-18/1201777092.PDF
2015-11-25,易华录：第三届董事会第十一次会议决议公告,finalpage/2015-11-25/1201788579.PDF
2015-11-30,易华录：第三届董事会第十二次会议决议公告,finalpage/2015-11-30/1201800009.PDF
2015-11-30,易华录：独立董事关于相关事项的独立意见,finalpage/2015-11-30/1201800010.PDF
2015-11-30,易华录：关于收购厦门世纪恒深科技工程有限公司股权的公告,finalpage/2015-11-30/1201800011.PDF
2015-11-30,易华录：关于投资设立控股子公司的公告,finalpage/2015-11-30/1201800012.PDF
2015-12-15,易华录：关于投资设立控股子公司华录健康养老发展有限公司的公告,finalpage/2015-12-15/1201836808.PDF
2015-12-15,易华录：关于独立董事辞职的公告,finalpage/2015-12-15/1201836809.PDF
2015-12-15,易华录：关于召开2015年第一次临时股东大会的通知,finalpage/2015-12-15/1201836810.PDF
2015-12-15,易华录：公司章程（2015年12月）,finalpage/2015-12-15/1201836807.PDF
2015-12-15,易华录：独立董事关于相关事项的独立意见,finalpage/2015-12-15/1201836811.PDF
2015-12-15,易华录：第三届董事会第十三次会议决议公告,finalpage/2015-12-15/1201836812.PDF
2015-12-17,易华录：重大工程预中标公告,finalpage/2015-12-17/1201844196.PDF
2015-12-22,易华录：第三届董事会第十四次会议决议公告,finalpage/2015-12-22/1201852773.PDF
2015-12-22,易华录：关于参股发起设立山东智慧城市PPP发展基金的公告,finalpage/2015-12-22/1201852774.PDF
2015-12-22,易华录：关于收到山东智慧城市PPP发展基金设立方案函的公告,finalpage/2015-12-22/1201852775.PDF
2015-12-22,易华录：关于投资设立山东易华录投资管理有限公司的公告,finalpage/2015-12-22/1201852776.PDF
2015-12-25,易华录：关于收到成交结果通知书的公告,finalpage/2015-12-25/1201863284.PDF
2015-12-28,易华录：关于与公安部交通管理科学研究所签订合同的公告,finalpage/2015-12-28/1201864525.PDF
2015-12-30,易华录：关于公司取得信息系统业务安全服务资质证书的公告,finalpage/2015-12-30/1201877227.PDF
2015-12-31,易华录：2015年第一次临时股东大会的法律意见书,finalpage/2015-12-31/1201884028.PDF
2015-12-31,易华录：2015年第一次临时股东大会决议公告,finalpage/2015-12-31/1201884029.PDF
2016-01-06,易华录：重大工程预中标公告,finalpage/2016-01-06/1201897707.PDF
2016-01-13,易华录：关于签署华录光存储研究院（大连）有限公司出资协议的公告,finalpage/2016-01-13/1201910440.PDF
2016-01-13,易华录：2015年年度业绩预告,finalpage/2016-01-13/1201910441.PDF
2016-02-02,易华录：关于签订重大合同的公告,finalpage/2016-02-02/1201961917.PDF
2016-02-24,易华录：关于控股子公司与潍坊滨海经济开发区签署战略合作（框架）协议的公告,finalpage/2016-02-24/1201997691.PDF
2016-02-26,易华录：2015年度业绩快报,finalpage/2016-02-26/1202004866.PDF
2016-03-02,易华录：重大工程预成交公告,finalpage/2016-03-02/1202018661.PDF
2016-03-07,易华录：关于收到成交结果通知书的公告,finalpage/2016-03-07/1202027554.PDF
2016-03-17,易华录：关于股东股份质押的公告,finalpage/2016-03-17/1202055725.PDF
2016-03-22,易华录：第三届董事会第十五次会议决议公告,finalpage/2016-03-22/1202067912.PDF
2016-03-22,易华录：第三届监事会第七次会议决议公告,finalpage/2016-03-22/1202067913.PDF
2016-03-22,易华录：独立董事关于关联交易事项的事前认可意见,finalpage/2016-03-22/1202067914.PDF
2016-03-22,易华录：独立董事关于相关事项的独立意见,finalpage/2016-03-22/1202067915.PDF
2016-03-22,易华录：关于董事辞职的公告,finalpage/2016-03-22/1202067916.PDF
2016-03-22,易华录：关于监事辞职的公告,finalpage/2016-03-22/1202067917.PDF
2016-03-22,易华录：关于增资北京华录亿动科技发展有限公司暨关联交易事项的公告,finalpage/2016-03-22/1202067918.PDF
2016-03-22,易华录：华西证券股份有限公司关于公司关联交易的专项核查意见,finalpage/2016-03-22/1202067911.PDF
2016-03-30,易华录：重大工程预中标公告,finalpage/2016-03-30/1202112028.PDF
2016-04-05,易华录：关于收到中标通知书的公告,finalpage/2016-04-05/1202139906.PDF
2016-04-08,易华录：2015年度报告披露提示性公告,finalpage/2016-04-08/1202150468.PDF
2016-04-08,易华录：2015年年度报告摘要,finalpage/2016-04-08/1202150469.PDF
2016-04-08,易华录：2015年年度报告,finalpage/2016-04-08/1202150470.PDF
2016-04-08,易华录：第三届董事会第十六次会议决议公告,finalpage/2016-04-08/1202150471.PDF
2016-04-08,易华录：第三届监事会第八次会议决议公告,finalpage/2016-04-08/1202150472.PDF
2016-04-08,易华录：独立董事关于关联交易事项的事前认可意见,finalpage/2016-04-08/1202150473.PDF
2016-04-08,易华录：独立董事关于相关事项的独立意见,finalpage/2016-04-08/1202150474.PDF
2016-04-08,易华录：关于召开2015年度股东大会会议的通知,finalpage/2016-04-08/1202150475.PDF
2016-04-08,易华录：2015年独立董事述职报告（梁云凤）,finalpage/2016-04-08/1202150476.PDF
2016-04-08,易华录：2015年独立董事述职报告（马朝松）,finalpage/2016-04-08/1202150477.PDF
2016-04-08,易华录：2015年独立董事述职报告（杨晓光）,finalpage/2016-04-08/1202150478.PDF
2016-04-08,易华录：2016年度日常经营关联交易预计事项的公告,finalpage/2016-04-08/1202150479.PDF
2016-04-08,易华录：华西证券股份有限公司关于公司2016年度日常经营关联交易预计事项的核查意见,finalpage/2016-04-08/1202150480.PDF
2016-04-08,易华录：2015年度内部控制自我评价报告,finalpage/2016-04-08/1202150481.PDF
2016-04-08,易华录：华西证券股份有限公司关于公司内部控制自我评价报告的核查意见,finalpage/2016-04-08/1202150482.PDF
2016-04-08,易华录：华西证券股份有限公司关于公司2015年度持续督导跟踪报告,finalpage/2016-04-08/1202150483.PDF
2016-04-08,易华录：华西证券股份有限公司关于公司募集资金2015年度使用情况的专项核查意见,finalpage/2016-04-08/1202150484.PDF
2016-04-08,易华录：华西证券股份有限公司关于公司内部控制自我评价报告的核查意见,finalpage/2016-04-08/1202150485.PDF
2016-04-08,易华录：公司章程（2016年4月）,finalpage/2016-04-08/1202150486.PDF
2016-04-08,易华录：关于举行2015年度网上业绩说明会的公告,finalpage/2016-04-08/1202150487.PDF
2016-04-08,易华录：2015年度募集资金存放与使用情况的专项报告,finalpage/2016-04-08/1202150488.PDF
2016-04-08,易华录：2015年年度审计报告,finalpage/2016-04-08/1202150489.PDF
2016-04-08,易华录：内部控制鉴证报告,finalpage/2016-04-08/1202150490.PDF
2016-04-08,易华录：募集资金存放与使用情况鉴证报告,finalpage/2016-04-08/1202150491.PDF
2016-04-08,易华录：非经营性资金占用及其他关联资金往来的专项说明,finalpage/2016-04-08/1202150492.PDF
2016-04-08,易华录：2016年第一季度业绩预告,finalpage/2016-04-08/1202150493.PDF
2016-04-15,易华录：重大工程预中标公告,finalpage/2016-04-15/1202185374.PDF
2016-04-26,易华录：关于召开2015年度股东大会的提示性公告,finalpage/2016-04-26/1202241738.PDF
2016-04-27,易华录：2016年第一季度报告披露提示性公告,finalpage/2016-04-27/1202250873.PDF
2016-04-27,易华录：2016年第一季度报告全文,finalpage/2016-04-27/1202250874.PDF
2016-04-27,易华录：第三届监事会第九次会议决议公告,finalpage/2016-04-27/1202250875.PDF
2016-04-27,易华录：关于投资成立吕梁市易华录智慧城市建设与运营有限责任公司的公告,finalpage/2016-04-27/1202250876.PDF
2016-04-27,易华录：关于控股子公司投资成立阳信智慧城市建设与运营有限责任公司的公告,finalpage/2016-04-27/1202250877.PDF
2016-04-27,易华录：第三届董事会第十七次会议决议公告,finalpage/2016-04-27/1202250878.PDF
2016-04-28,易华录：2015年度股东大会决议公告,finalpage/2016-04-28/1202265911.PDF
2016-04-28,易华录：关于变更董事的公告,finalpage/2016-04-28/1202265912.PDF
2016-04-28,易华录：关于变更监事的公告,finalpage/2016-04-28/1202265913.PDF
2016-04-28,易华录：2015年度股东大会的法律意见书,finalpage/2016-04-28/1202265914.PDF
2016-05-09,易华录：关于收到中标通知书的公告,finalpage/2016-05-09/1202312946.PDF
2016-05-09,易华录：关于签订重大合同的公告,finalpage/2016-05-09/1202312947.PDF
2016-06-01,易华录：关于与华为软件技术有限公司签署云战略合作协议的公告,finalpage/2016-06-01/1202351523.PDF
2016-06-03,易华录：2015年年度权益分派实施公告,finalpage/2016-06-03/1202355497.PDF
2016-06-08,易华录：独立董事关于第三届董事会第十八次会议相关事项的独立意见,finalpage/2016-06-08/1202361795.PDF
2016-06-08,易华录：第三届董事会第十八次会议决议公告,finalpage/2016-06-08/1202361796.PDF
2016-06-08,易华录：关于控股子公司投资成立菏泽易华录信息技术有限公司的公告,finalpage/2016-06-08/1202361797.PDF
2016-06-08,易华录：关于增资山东易华录信息技术有限公司的公告,finalpage/2016-06-08/1202361798.PDF
2016-06-08,易华录：关于为全资子公司提供担保的公告,finalpage/2016-06-08/1202361799.PDF
2016-06-08,易华录：关于召开2016年第一次临时股东大会会议的通知,finalpage/2016-06-08/1202361800.PDF
2016-06-23,易华录：重大工程预中标公告,finalpage/2016-06-23/1202394551.PDF
