,date,title,url
207,2013-11-19,三诺生物：第二届董事会第三次会议（通讯）决议公告,finalpage/2013-11-19/63280284.PDF
208,2013-12-03,三诺生物：关于召开2013年第三次临时股东大会的提示性公告,finalpage/2013-12-03/63326724.PDF
209,2013-12-06,三诺生物：2013年第三次临时股东大会决议公告,finalpage/2013-12-06/63349823.PDF
210,2013-12-06,三诺生物：2013年第三次临时股东大会的法律意见,finalpage/2013-12-06/63349824.PDF
211,2013-12-10,三诺生物：第二届董事会第四次会议（通讯）决议公告,finalpage/2013-12-10/63359746.PDF
212,2013-12-10,三诺生物：第二届监事会第四次会议决议公告,finalpage/2013-12-10/63359747.PDF
213,2013-12-10,三诺生物：关于向激励对象授予股票期权与限制性股票的公告,finalpage/2013-12-10/63359748.PDF
214,2013-12-10,三诺生物：关于独立董事辞职的公告,finalpage/2013-12-10/63359749.PDF
215,2013-12-10,三诺生物：独立董事关于股票期权与限制性股票授予相关事项的独立意见,finalpage/2013-12-10/63359750.PDF
216,2013-12-10,三诺生物：北京国枫凯文律师事务所关于公司股票期权与限制性股票激励计划授予事项的法律意见书,finalpage/2013-12-10/63359751.PDF
217,2013-12-30,三诺生物：首次公开发行前已发行股份上市流通提示性公告,finalpage/2013-12-30/63433551.PDF
218,2013-12-30,三诺生物：中信证券股份有限公司关于公司限售股份上市流通的核查意见,finalpage/2013-12-30/63433552.PDF
219,2014-01-03,三诺生物：第二届董事会第五次会议（通讯）决议公告,finalpage/2014-01-03/63444161.PDF
220,2014-01-03,三诺生物：第二届监事会第五次会议决议公告,finalpage/2014-01-03/63444162.PDF
221,2014-01-03,三诺生物：关于调整《股票期权与限制性股票激励计划》的公告,finalpage/2014-01-03/63444164.PDF
222,2014-01-03,三诺生物：关于股东股权质押的公告,finalpage/2014-01-03/63444165.PDF
223,2014-01-03,三诺生物：北京国枫凯文律师事务所关于公司调整首次授予限制性股票激励对象及数量的法律意见书,finalpage/2014-01-03/63444167.PDF
224,2014-01-03,三诺生物：独立董事关于公司限制性股票授予对象及数量调整相关事项的独立意见,finalpage/2014-01-03/63444170.PDF
225,2014-01-09,三诺生物：关于股票期权与限制性股票授予登记完成的公告,finalpage/2014-01-09/63467022.PDF
226,2014-01-10,三诺生物：第二届董事会第六次会议（通讯）决议公告,finalpage/2014-01-10/63470607.PDF
227,2014-01-10,三诺生物：公司章程（2014年1月）,finalpage/2014-01-10/63470608.PDF
228,2014-01-10,三诺生物：公司章程修订对照说明,finalpage/2014-01-10/63470609.PDF
229,2014-01-18,三诺生物：2013年度业绩预告,finalpage/2014-01-18/63497624.PDF
230,2014-01-18,三诺生物：2013年度利润分配预案的预披露,finalpage/2014-01-18/63497625.PDF
231,2014-01-27,三诺生物：关于完成工商变更登记的公告,finalpage/2014-01-27/63529337.PDF
232,2014-02-10,三诺生物：关于重大事项停牌的公告,finalpage/2014-02-10/63550307.PDF
233,2014-02-15,三诺生物：关于重大事项继续停牌的公告,finalpage/2014-02-15/63573093.PDF
234,2014-02-18,三诺生物：关于签订合作意向书的公告,finalpage/2014-02-18/63580931.PDF
235,2014-02-18,三诺生物：关于承诺相关方承诺及履行情况的公告,finalpage/2014-02-18/63580932.PDF
236,2014-02-22,三诺生物：关于重大事项继续停牌的公告,finalpage/2014-02-22/63595043.PDF
237,2014-02-27,三诺生物：第二届董事会第七次（临时）会议（现场结合通讯方式）决议公告,finalpage/2014-02-27/63610813.PDF
238,2014-02-27,三诺生物：第二届监事会第六次会议决议公告,finalpage/2014-02-27/63610814.PDF
239,2014-02-27,三诺生物：关于与华广生技股份有限公司签订《战略合作框架协议书》的公告,finalpage/2014-02-27/63610815.PDF
240,2014-02-27,三诺生物：关于与华广生技股份有限公司签订《私募认股协议书》的公告,finalpage/2014-02-27/63610816.PDF
241,2014-02-27,三诺生物：2013年度业绩快报,finalpage/2014-02-27/63610817.PDF
242,2014-02-27,三诺生物：独立董事关于第二届董事会第七次会议相关事项的独立意见,finalpage/2014-02-27/63610818.PDF
243,2014-02-27,三诺生物：关于使用部分超募资金认购华广生技股份有限公司私募股份的公告,finalpage/2014-02-27/63610819.PDF
244,2014-02-27,三诺生物：中信证券股份有限公司关于公司超募资金使用计划的核查意见,finalpage/2014-02-27/63610820.PDF
245,2014-02-27,三诺生物：关于重大事项复牌的公告,finalpage/2014-02-27/63610821.PDF
246,2014-03-11,三诺生物：公司章程修订对照说明,finalpage/2014-03-11/63658058.PDF
247,2014-03-11,三诺生物：关于延长募集资金投资项目建设期的公告,finalpage/2014-03-11/63658059.PDF
248,2014-03-11,三诺生物：关于会计政策变更的公告,finalpage/2014-03-11/63658060.PDF
249,2014-03-11,三诺生物：独立董事提名人声明,finalpage/2014-03-11/63658061.PDF
250,2014-03-11,三诺生物：关于举行2013年度业绩网上说明会的公告,finalpage/2014-03-11/63658062.PDF
251,2014-03-11,三诺生物：2013年度独立董事（周智广先生）述职报告,finalpage/2014-03-11/63658063.PDF
252,2014-03-11,三诺生物：2013年度独立董事（袁洪先生）述职报告,finalpage/2014-03-11/63658064.PDF
253,2014-03-11,三诺生物：2013年度独立董事（唐红女士）述职报告,finalpage/2014-03-11/63658065.PDF
254,2014-03-11,三诺生物：2013年度财务决算报告,finalpage/2014-03-11/63658066.PDF
255,2014-03-11,三诺生物：2013年度监事会工作报告,finalpage/2014-03-11/63658067.PDF
256,2014-03-11,三诺生物：2013年度募集资金存放与使用情况的专项报告,finalpage/2014-03-11/63658068.PDF
257,2014-03-11,三诺生物：独立董事候选人声明（纪立农）,finalpage/2014-03-11/63658069.PDF
258,2014-03-11,三诺生物：独立董事关于第二届董事会第八次会议相关事项的独立意见,finalpage/2014-03-11/63658070.PDF
259,2014-03-11,三诺生物：中信证券股份有限公司关于公司2013年度持续督导跟踪报告,finalpage/2014-03-11/63658071.PDF
260,2014-03-11,三诺生物：中信证券股份有限公司关于公司2013年度内部控制自我评价报告的核查意见,finalpage/2014-03-11/63658072.PDF
261,2014-03-11,三诺生物：中信证券股份有限公司关于公司2013年度募集资金存放与使用情况的核查意见,finalpage/2014-03-11/63658073.PDF
262,2014-03-11,三诺生物：中信证券股份有限公司关于公司延长募集资金投资项目建设期的核查意见,finalpage/2014-03-11/63658074.PDF
263,2014-03-11,三诺生物：关于公司2013年度控股股东及其他关联方资金占用情况的专项说明,finalpage/2014-03-11/63658075.PDF
264,2014-03-11,三诺生物：募集资金年度存放与使用情况鉴证报告,finalpage/2014-03-11/63658076.PDF
265,2014-03-11,三诺生物：2013年年度报告摘要,finalpage/2014-03-11/63658077.PDF
266,2014-03-11,三诺生物：2013年年度报告,finalpage/2014-03-11/63658079.PDF
267,2014-03-11,三诺生物：2013年年度审计报告,finalpage/2014-03-11/63658080.PDF
268,2014-03-11,三诺生物：第二届董事会第八次会议决议公告,finalpage/2014-03-11/63658081.PDF
269,2014-03-11,三诺生物：关于召开2013年度股东大会的通知,finalpage/2014-03-11/63658082.PDF
270,2014-03-11,三诺生物：2013年度报告披露提示性公告,finalpage/2014-03-11/63658083.PDF
271,2014-03-11,三诺生物：第二届监事会第七次会议决议公告,finalpage/2014-03-11/63658084.PDF
272,2014-03-12,三诺生物：补充更正公告,finalpage/2014-03-12/63668262.PDF
273,2014-03-20,三诺生物：重大合同公告,finalpage/2014-03-20/63696877.PDF
274,2014-03-20,三诺生物：2014年第一季度业绩预告,finalpage/2014-03-20/63696878.PDF
275,2014-03-24,三诺生物：首次公开发行前已发行股份上市流通提示性公告,finalpage/2014-03-24/63708306.PDF
276,2014-03-24,三诺生物：中信证券股份有限公司关于公司限售股份上市流通的核查意见,finalpage/2014-03-24/63708307.PDF
277,2014-03-27,三诺生物：2013年度内部控制自我评价报告,finalpage/2014-03-27/63737085.PDF
278,2014-04-01,三诺生物：2013年度股东大会决议公告,finalpage/2014-04-01/63764915.PDF
279,2014-04-01,三诺生物：第二届董事会第九次（临时）会议（通讯方式）决议公告,finalpage/2014-04-01/63764916.PDF
280,2014-04-01,三诺生物：对外投资公告,finalpage/2014-04-01/63764918.PDF
281,2014-04-01,三诺生物：2013年度股东大会的法律意见,finalpage/2014-04-01/63764919.PDF
282,2014-04-21,三诺生物：第二届董事会第十次会议（通讯）决议公告,finalpage/2014-04-21/63866914.PDF
283,2014-04-21,三诺生物：第二届监事会第八次会议决议公告,finalpage/2014-04-21/63866915.PDF
284,2014-04-21,三诺生物：关于申请银行综合授信额度的公告,finalpage/2014-04-21/63866916.PDF
285,2014-04-21,三诺生物：关于部分超募资金续存为定期存款的公告,finalpage/2014-04-21/63866917.PDF
286,2014-04-21,三诺生物：独立董事关于第二届董事会第十次会议相关事项的独立意见,finalpage/2014-04-21/63866918.PDF
287,2014-04-21,三诺生物：2014年第一季度报告披露提示性公告,finalpage/2014-04-21/63866920.PDF
288,2014-04-21,三诺生物：2014年第一季度报告全文,finalpage/2014-04-21/63866921.PDF
289,2014-04-23,三诺生物：补充更正公告,finalpage/2014-04-23/63894226.PDF
290,2014-04-30,三诺生物：关于持股5%以上的股东减持公司股份的提示性公告,finalpage/2014-04-30/63959140.PDF
291,2014-04-30,三诺生物：简式权益变动报告书,finalpage/2014-04-30/63959141.PDF
292,2014-05-07,三诺生物：2013年度权益分派实施公告,finalpage/2014-05-07/63989758.PDF
293,2014-05-07,三诺生物：关于2013年度权益分派实施的更正公告,finalpage/2014-05-07/63990502.PDF
294,2014-05-17,三诺生物：第二届董事会第十一次（临时）会议（通讯方式）决议公告,finalpage/2014-05-17/64034539.PDF
295,2014-05-17,三诺生物：关于调整公司股票期权与限制性股票激励计划所涉股票期权授予数量、行权价格和预留限制性股票数量的公告,finalpage/2014-05-17/64034541.PDF
296,2014-05-17,三诺生物：关于召开2014年第一次临时股东大会的通知,finalpage/2014-05-17/64034543.PDF
297,2014-05-17,三诺生物：《公司章程》修订对照说明,finalpage/2014-05-17/64034545.PDF
298,2014-05-17,三诺生物：关于更换保荐代表人的公告,finalpage/2014-05-17/64034547.PDF
299,2014-05-17,三诺生物：独立董事关于调整公司股票期权与限制性股票激励计划所涉股票期权授予数量、行权价格和预留限制性股票数量的独立意见,finalpage/2014-05-17/64034548.PDF
300,2014-05-17,三诺生物：北京国枫凯文律师事务所关于公司调整股票期权与限制性股票激励计划相关事项的法律意见书,finalpage/2014-05-17/64034550.PDF
301,2014-06-06,三诺生物：公司章程（2014年6月）,finalpage/2014-06-06/64105691.PDF
302,2014-06-06,三诺生物：2014年第一次临时股东大会的法律意见书,finalpage/2014-06-06/64105692.PDF
303,2014-06-06,三诺生物：2014年第一次临时股东大会决议公告,finalpage/2014-06-06/64105695.PDF
304,2014-06-17,三诺生物：关于完成工商变更登记的公告,finalpage/2014-06-17/64139784.PDF
305,2014-07-08,三诺生物：2014年半年度业绩预告,finalpage/2014-07-08/1200037548.PDF
306,2014-08-12,三诺生物：关于使用自有闲置资金购买低风险理财产品的公告,finalpage/2014-08-12/1200118111.PDF
307,2014-08-12,三诺生物：独立董事关于第二届董事会第十二次会议相关事项的独立意见,finalpage/2014-08-12/1200118112.PDF
308,2014-08-12,三诺生物：中信证券股份有限公司关于公司利用自有闲置资金择机购买低风险银行理财产品、资产管理计划及信托产品的核查意见,finalpage/2014-08-12/1200118113.PDF
309,2014-08-12,三诺生物：中信证券股份有限公司关于公司2014年上半年持续督导工作现场检查报告,finalpage/2014-08-12/1200118114.PDF
310,2014-08-12,三诺生物：2014年半年度报告摘要,finalpage/2014-08-12/1200118115.PDF
311,2014-08-12,三诺生物：第二届董事会第十二次会议（通讯）决议公告,finalpage/2014-08-12/1200118117.PDF
312,2014-08-12,三诺生物：2014年半年度报告披露提示性公告,finalpage/2014-08-12/1200118118.PDF
313,2014-08-12,三诺生物：第二届监事会第九次会议决议公告,finalpage/2014-08-12/1200118119.PDF
314,2014-08-12,三诺生物：2014年半年度报告,finalpage/2014-08-12/1200118120.PDF
315,2014-08-19,三诺生物：预留部分限制性股票授予人员名单,finalpage/2014-08-19/1200136457.PDF
316,2014-08-19,三诺生物：北京国枫凯文律师事务所关于公司股票期权与限制性股票激励计划预留限制性股票授予相关事项的法律意见书,finalpage/2014-08-19/1200136458.PDF
317,2014-08-19,三诺生物：独立董事关于向激励对象授予预留部分限制性股票事项的独立意见,finalpage/2014-08-19/1200136459.PDF
318,2014-08-19,三诺生物：第二届董事会第十三次（临时）会议（通讯表决）决议公告,finalpage/2014-08-19/1200136460.PDF
319,2014-08-19,三诺生物：第二届监事会第十次（临时）会议决议公告,finalpage/2014-08-19/1200136461.PDF
320,2014-08-19,三诺生物：关于向激励对象授予预留部分限制性股票的公告,finalpage/2014-08-19/1200136462.PDF
321,2014-08-30,三诺生物：关于参加2014年度投资者网上集体接待日活动的公告,finalpage/2014-08-30/1200188671.PDF
322,2014-09-20,三诺生物：第二届董事会第十四次会议（通讯表决）决议公告,finalpage/2014-09-20/1200249760.PDF
323,2014-09-20,三诺生物：第二届监事会第十一次会议决议公告,finalpage/2014-09-20/1200249761.PDF
324,2014-09-20,三诺生物：对外投资公告,finalpage/2014-09-20/1200249762.PDF
325,2014-09-20,三诺生物：关于签订股权收购意向书的公告,finalpage/2014-09-20/1200249763.PDF
326,2014-09-20,三诺生物：《公司章程》修订对照说明,finalpage/2014-09-20/1200249764.PDF
327,2014-09-20,三诺生物：公司章程（2014年9月）,finalpage/2014-09-20/1200249765.PDF
328,2014-09-20,三诺生物：独立董事关于第二届董事会第十四次会议相关事项的独立意见,finalpage/2014-09-20/1200249766.PDF
329,2014-09-25,三诺生物：关于预留部分限制性股票完成授予登记的公告,finalpage/2014-09-25/1200258937.PDF
330,2014-09-25,三诺生物：预留部分限制性股票授予人员名单（调整后）,finalpage/2014-09-25/1200258938.PDF
331,2014-09-25,三诺生物：北京国枫凯文律师事务所关于公司调整预留限制性股票授予对象及授予数量的法律意见书,finalpage/2014-09-25/1200258939.PDF
332,2014-09-30,三诺生物：关于完成工商变更登记的公告,finalpage/2014-09-30/1200273426.PDF
333,2014-09-30,三诺生物：对外投资进展公告,finalpage/2014-09-30/1200273427.PDF
334,2014-10-11,三诺生物：关于独立董事辞职的公告,finalpage/2014-10-11/1200288336.PDF
335,2014-10-14,三诺生物：2014年前三季度业绩预告,finalpage/2014-10-14/1200294444.PDF
336,2014-10-27,三诺生物：第二届董事会第十五次会议决议公告,finalpage/2014-10-27/1200328341.PDF
337,2014-10-27,三诺生物：关于将部分超募资金续存为定期存款的公告,finalpage/2014-10-27/1200328342.PDF
338,2014-10-27,三诺生物：独立董事关于第二届董事会第十五次会议相关事项的独立意见,finalpage/2014-10-27/1200328343.PDF
339,2014-10-27,三诺生物：关于使用部分超募资金认缴全资子公司出资并通过其收购北京三诺健恒糖尿病医院有限公司部分股权的可行性研究报告,finalpage/2014-10-27/1200328344.PDF
340,2014-10-27,三诺生物：中信证券股份有限公司关于公司超募资金使用计划的核查意见,finalpage/2014-10-27/1200328345.PDF
341,2014-10-27,三诺生物：第二届监事会第十二次会议决议公告,finalpage/2014-10-27/1200328346.PDF
342,2014-10-27,三诺生物：独立董事候选人声明（纪立农）,finalpage/2014-10-27/1200328347.PDF
343,2014-10-27,三诺生物：独立董事提名人声明（一）,finalpage/2014-10-27/1200328348.PDF
344,2014-10-27,三诺生物：独立董事候选人声明（李永国）,finalpage/2014-10-27/1200328349.PDF
345,2014-10-27,三诺生物：独立董事提名人声明（二）,finalpage/2014-10-27/1200328350.PDF
346,2014-10-27,三诺生物：关于使用部分超募资金认缴全资子公司出资并通过其收购北京三诺健恒糖尿病医院有限公司部分股权的公告,finalpage/2014-10-27/1200328351.PDF
347,2014-10-27,三诺生物：关于会计政策变更的公告,finalpage/2014-10-27/1200328352.PDF
348,2014-10-27,三诺生物：关于召开2014年第二次临时股东大会的通知,finalpage/2014-10-27/1200328353.PDF
349,2014-10-27,三诺生物：对外投资进展公告,finalpage/2014-10-27/1200328354.PDF
350,2014-10-27,三诺生物：2014年第三季度报告披露提示性公告,finalpage/2014-10-27/1200328356.PDF
351,2014-10-27,三诺生物：2014年第三季度报告全文,finalpage/2014-10-27/1200328357.PDF
352,2014-11-12,三诺生物：关于召开2014年第二次临时股东大会的提示性公告,finalpage/2014-11-12/1200385696.PDF
353,2014-11-12,三诺生物：关于新产品获得医疗器械注册证的公告,finalpage/2014-11-12/1200385697.PDF
354,2014-11-15,三诺生物：2014年第二次临时股东大会的法律意见书,finalpage/2014-11-15/1200394005.PDF
355,2014-11-15,三诺生物：第二届董事会第十六次会议决议公告,finalpage/2014-11-15/1200394006.PDF
356,2014-11-15,三诺生物：2014年第二次临时股东大会决议公告,finalpage/2014-11-15/1200394007.PDF
357,2014-11-15,三诺生物：关于公司独立董事及董事会各专门委员会成员变更的公告,finalpage/2014-11-15/1200394008.PDF
358,2014-12-02,三诺生物：第二届董事会第十七次会议（临时会议通讯表决）决议公告,finalpage/2014-12-02/1200431200.PDF
359,2014-12-02,三诺生物：第二届监事会第十三次会议决议公告,finalpage/2014-12-02/1200431201.PDF
360,2014-12-02,三诺生物：关于股票期权与限制性股票激励计划第一个行权/解锁期可行权/解锁的公告,finalpage/2014-12-02/1200431202.PDF
361,2014-12-02,三诺生物：关于拟回购注销部分不符合解锁条件限制性股票的公告,finalpage/2014-12-02/1200431203.PDF
362,2014-12-02,三诺生物：关于回购注销部分限制性股票暨减资的债权人公告,finalpage/2014-12-02/1200431204.PDF
363,2014-12-02,三诺生物：《公司章程》修订对照说明,finalpage/2014-12-02/1200431205.PDF
364,2014-12-02,三诺生物：独立董事关于第二届董事会第十七次会议相关事项的独立意见,finalpage/2014-12-02/1200431206.PDF
365,2014-12-02,三诺生物：北京国枫凯文律师事务所关于公司股票期权与限制性股票激励计划第一个行权/解锁期可行权/解锁暨回购注销部分限制性股票相关事项的法律意见书,finalpage/2014-12-02/1200431207.PDF
366,2014-12-02,三诺生物：股票期权与限制性股票激励计划第一个行权/解锁期激励对象名单,finalpage/2014-12-02/1200431208.PDF
367,2014-12-06,三诺生物：关于股票期权与限制性股票激励计划第一个行权期采用自主行权模式的公告,finalpage/2014-12-06/1200444743.PDF
368,2014-12-06,三诺生物：关于限制性股票第一期解锁股份上市流通的提示性公告,finalpage/2014-12-06/1200444744.PDF
369,2015-01-24,三诺生物：2014年度业绩预告,finalpage/2015-01-24/1200573830.PDF
370,2015-01-24,三诺生物：2014年度利润分配预案的预披露,finalpage/2015-01-24/1200573831.PDF
371,2015-01-24,三诺生物：重大合同公告,finalpage/2015-01-24/1200573832.PDF
372,2015-02-10,三诺生物：关于终止与华广生技股份有限公司《战略合作框架协议书》和《私募认股协议书》的公告,finalpage/2015-02-10/1200622816.PDF
373,2015-02-13,三诺生物：第二届董事会第十八次会议决议公告,finalpage/2015-02-13/1200633241.PDF
374,2015-02-13,三诺生物：第二届监事会第十四次会议决议公告,finalpage/2015-02-13/1200633242.PDF
375,2015-02-13,三诺生物：关于注销股权激励计划第二个行权期股票期权的公告,finalpage/2015-02-13/1200633243.PDF
376,2015-02-13,三诺生物：独立董事关于第二届董事会第十八次会议相关事项的独立意见,finalpage/2015-02-13/1200633244.PDF
377,2015-02-13,三诺生物：北京国枫律师事务所关于公司股票期权与限制性股票激励计划第二个行权期股票期权注销相关事项的法律意见书,finalpage/2015-02-13/1200633245.PDF
378,2015-02-27,三诺生物：2014年度业绩快报,finalpage/2015-02-27/1200653018.PDF
379,2015-03-16,三诺生物：首次公开发行前已发行股份上市流通提示性公告,finalpage/2015-03-16/1200699213.PDF
380,2015-03-16,三诺生物：中信证券股份有限公司关于公司限售股份上市流通的核查意见,finalpage/2015-03-16/1200699214.PDF
381,2015-03-17,三诺生物：公司章程（2015年3月）,finalpage/2015-03-17/1200706288.PDF
382,2015-03-17,三诺生物：股东大会议事规则（2015年3月）,finalpage/2015-03-17/1200706289.PDF
383,2015-03-17,三诺生物：关于公司2014年度控股股东及其他关联方资金占用情况的专项说明,finalpage/2015-03-17/1200706290.PDF
384,2015-03-17,三诺生物：董事会议事规则（2015年3月）,finalpage/2015-03-17/1200706291.PDF
385,2015-03-17,三诺生物：独立董事关于第二届董事会第十九次会议相关事项的独立意见,finalpage/2015-03-17/1200706292.PDF
386,2015-03-17,三诺生物：募集资金年度存放与使用情况鉴证报告,finalpage/2015-03-17/1200706293.PDF
387,2015-03-17,三诺生物：独立董事工作制度（2015年3月）,finalpage/2015-03-17/1200706294.PDF
388,2015-03-17,三诺生物：关于公司2014年度财务报表前期差错更正的专项说明,finalpage/2015-03-17/1200706295.PDF
389,2015-03-17,三诺生物：《公司章程》修订对照说明,finalpage/2015-03-17/1200706296.PDF
390,2015-03-17,三诺生物：关联交易管理制度（2015年3月）,finalpage/2015-03-17/1200706297.PDF
391,2015-03-17,三诺生物：关于会计估计变更的公告,finalpage/2015-03-17/1200706298.PDF
392,2015-03-17,三诺生物：对外担保管理制度（2015年3月）,finalpage/2015-03-17/1200706299.PDF
393,2015-03-17,三诺生物：关于前期会计差错更正的公告,finalpage/2015-03-17/1200706300.PDF
394,2015-03-17,三诺生物：重大投资与经营决策管理制度（2015年3月）,finalpage/2015-03-17/1200706301.PDF
395,2015-03-17,三诺生物：关于召开2014年度股东大会的通知,finalpage/2015-03-17/1200706302.PDF
396,2015-03-17,三诺生物：子公司管理制度（2015年3月）,finalpage/2015-03-17/1200706303.PDF
397,2015-03-17,三诺生物：关于举行2014年度业绩网上说明会的公告,finalpage/2015-03-17/1200706304.PDF
398,2015-03-17,三诺生物：内部控制评价制度（2015年3月）,finalpage/2015-03-17/1200706305.PDF
399,2015-03-17,三诺生物：2014年度独立董事（纪立农先生）述职报告,finalpage/2015-03-17/1200706306.PDF
400,2015-03-17,三诺生物：2014年度独立董事（李永国先生）述职报告,finalpage/2015-03-17/1200706307.PDF
401,2015-03-17,三诺生物：2014年度独立董事（唐红女士）述职报告,finalpage/2015-03-17/1200706308.PDF
402,2015-03-17,三诺生物：2014年度独立董事（袁洪先生）述职报告,finalpage/2015-03-17/1200706309.PDF
403,2015-03-17,三诺生物：2014年度独立董事（周智广先生）述职报告,finalpage/2015-03-17/1200706310.PDF
404,2015-03-17,三诺生物：中信证券股份有限公司关于公司2014年度内部控制自我评价报告的核查意见,finalpage/2015-03-17/1200706311.PDF
405,2015-03-17,三诺生物：2015年第一季度业绩预告,finalpage/2015-03-17/1200706312.PDF
406,2015-03-17,三诺生物：监事会议事规则（2015年3月）,finalpage/2015-03-17/1200706313.PDF
407,2015-03-17,三诺生物：2014年度监事会工作报告,finalpage/2015-03-17/1200706314.PDF
408,2015-03-17,三诺生物：中信证券股份有限公司关于公司2014年度募集资金存放与使用情况的核查意见,finalpage/2015-03-17/1200706315.PDF
409,2015-03-17,三诺生物：2014年度内部控制自我评价报告,finalpage/2015-03-17/1200706316.PDF
410,2015-03-17,三诺生物：2014年度募集资金存放与使用情况的专项报告,finalpage/2015-03-17/1200706317.PDF
411,2015-03-17,三诺生物：2014年度决算报告,finalpage/2015-03-17/1200706318.PDF
412,2015-03-17,三诺生物：2014年年度报告摘要,finalpage/2015-03-17/1200706319.PDF
413,2015-03-17,三诺生物：2014年年度审计报告,finalpage/2015-03-17/1200706321.PDF
414,2015-03-17,三诺生物：第二届董事会第十九次会议决议公告,finalpage/2015-03-17/1200706322.PDF
415,2015-03-17,三诺生物：2014年度报告披露提示性公告,finalpage/2015-03-17/1200706323.PDF
