,date,title,url
0,2012-02-24,三诺生物：2011年第一次临时股东大会决议,finalpage/2012-02-24/60579664.PDF
1,2012-02-24,三诺生物：2012年第一次临时股东大会决议,finalpage/2012-02-24/60579665.PDF
2,2012-02-24,三诺生物：内部控制鉴证报告（2011年12月31日）,finalpage/2012-02-24/60579666.PDF
3,2012-02-24,三诺生物：公司章程（上市修订草案）,finalpage/2012-02-24/60579667.PDF
4,2012-02-24,三诺生物：关于公司设立以来股本演变情况的说明及其董事、监事、高级管理人员的确认意见,finalpage/2012-02-24/60579668.PDF
5,2012-02-24,三诺生物：中信证券股份有限公司关于公司首次公开发行股票并在创业板上市之发行保荐书,finalpage/2012-02-24/60579669.PDF
6,2012-02-24,三诺生物：中信证券股份有限公司关于公司首次公开发行股票并在创业板上市之发行保荐工作报告,finalpage/2012-02-24/60579670.PDF
7,2012-02-24,三诺生物：北京市国枫律师事务所关于公司申请首次公开发行股票并在创业板上市的律师工作报告,finalpage/2012-02-24/60579671.PDF
8,2012-02-24,三诺生物：北京市国枫律师事务所关于公司申请首次公开发行股票并在创业板上市的法律意见,finalpage/2012-02-24/60579672.PDF
9,2012-02-24,三诺生物：第一届董事会第九次会议决议,finalpage/2012-02-24/60579673.PDF
10,2012-02-24,三诺生物：第一届董事会第四次会议决议,finalpage/2012-02-24/60579674.PDF
11,2012-02-24,三诺生物：非经常性损益明细表鉴证报告（2009年、2010年、2011年度）,finalpage/2012-02-24/60579675.PDF
12,2012-02-24,三诺生物：北京市国枫律师事务所关于公司申请首次公开发行股票并在创业板上市的补充法律意见之一,finalpage/2012-02-24/60579676.PDF
13,2012-02-24,三诺生物：北京市国枫律师事务所关于公司申请首次公开发行股票并在创业板上市的补充法律意见之七,finalpage/2012-02-24/60579677.PDF
14,2012-02-24,三诺生物：北京市国枫律师事务所关于公司申请首次公开发行股票并在创业板上市的补充法律意见之三,finalpage/2012-02-24/60579678.PDF
15,2012-02-24,三诺生物：北京市国枫律师事务所关于公司申请首次公开发行股票并在创业板上市的补充法律意见之二,finalpage/2012-02-24/60579679.PDF
16,2012-02-24,三诺生物：北京市国枫律师事务所关于公司申请首次公开发行股票并在创业板上市的补充法律意见之五,finalpage/2012-02-24/60579680.PDF
17,2012-02-24,三诺生物：北京市国枫律师事务所关于公司申请首次公开发行股票并在创业板上市的补充法律意见之八,finalpage/2012-02-24/60579681.PDF
18,2012-02-24,三诺生物：北京市国枫律师事务所关于公司申请首次公开发行股票并在创业板上市的补充法律意见之六,finalpage/2012-02-24/60579682.PDF
19,2012-02-24,三诺生物：北京市国枫律师事务所关于公司申请首次公开发行股票并在创业板上市的补充法律意见之四,finalpage/2012-02-24/60579683.PDF
20,2012-02-24,三诺生物：审计报告（2009年度、2010年度、2011年度）,finalpage/2012-02-24/60579684.PDF
21,2012-02-24,三诺生物：中国证监会关于核准公司首次公开发行股票并在创业板上市的批复,finalpage/2012-02-24/60579692.PDF
22,2012-02-24,三诺生物：实际控制人及一致行动人对招股意向书的确认意见,finalpage/2012-02-24/60579694.PDF
23,2012-02-24,三诺生物：首次公开发行股票并在创业板上市招股意向书,finalpage/2012-02-24/60579695.PDF
24,2012-02-24,三诺生物：首次公开发行股票并在创业板上市初步询价及推介公告,finalpage/2012-02-24/60579903.PDF
25,2012-02-24,三诺生物：首次公开发行股票并在创业板上市提示公告,finalpage/2012-02-24/60579904.PDF
26,2012-03-02,三诺生物：首次公开发行股票并在创业板上市网上路演公告,finalpage/2012-03-02/60612374.PDF
27,2012-03-05,三诺生物：首次公开发行股票并在创业板上市发行公告,finalpage/2012-03-05/60618666.PDF
28,2012-03-05,三诺生物：首次公开发行股票并在创业板上市投资风险特别公告,finalpage/2012-03-05/60618667.PDF
29,2012-03-05,三诺生物：实际控制人及一致行动人对招股说明书的确认意见,finalpage/2012-03-05/60623592.PDF
30,2012-03-05,三诺生物：首次公开发行股票并在创业板上市招股说明书,finalpage/2012-03-05/60623595.PDF
31,2012-03-08,三诺生物：首次公开发行股票并在创业板上市网上定价发行申购情况及中签率公告,finalpage/2012-03-08/60640538.PDF
32,2012-03-08,三诺生物：首次公开发行股票并在创业板上市网下摇号中签及配售结果公告,finalpage/2012-03-08/60640539.PDF
33,2012-03-09,三诺生物：首次公开发行股票并在创业板上市网上定价发行摇号中签结果公告,finalpage/2012-03-09/60646162.PDF
34,2012-03-16,三诺生物：北京市国枫律师事务所关于公司首次公开发行股票申请在创业板上市的法律意见,finalpage/2012-03-16/60676983.PDF
35,2012-03-16,三诺生物：中信证券股份有限公司关于公司股票上市保荐书,finalpage/2012-03-16/60676984.PDF
36,2012-03-16,三诺生物：首次公开发行股票并在创业板上市公告书,finalpage/2012-03-16/60676985.PDF
37,2012-03-16,三诺生物：首次公开发行股票并在创业板上市上市公告书提示性公告,finalpage/2012-03-16/60676986.PDF
38,2012-03-19,三诺生物：风险提示公告,finalpage/2012-03-19/60682576.PDF
39,2012-03-31,三诺生物：关于通过高新技术企业复审的公告,finalpage/2012-03-31/60773580.PDF
40,2012-03-31,三诺生物：2012年第一季度业绩预告,finalpage/2012-03-31/60773581.PDF
41,2012-04-24,三诺生物：第一届董事会第十次会议决议公告,finalpage/2012-04-24/60890003.PDF
42,2012-04-24,三诺生物：第一届监事会第六次会议决议公告,finalpage/2012-04-24/60890004.PDF
43,2012-04-24,三诺生物：关于召开2011年度股东大会的通知,finalpage/2012-04-24/60890005.PDF
44,2012-04-24,三诺生物：内幕信息知情人登记制度（2012年4月）,finalpage/2012-04-24/60890006.PDF
45,2012-04-24,三诺生物：外部信息使用人管理制度（2012年4月）,finalpage/2012-04-24/60890007.PDF
46,2012-04-24,三诺生物：董事、监事、高级管理人员持有和买卖公司股票管理制度（2012年4月）,finalpage/2012-04-24/60890008.PDF
47,2012-04-24,三诺生物：重大信息内部报告制度（2012年4月）,finalpage/2012-04-24/60890009.PDF
48,2012-04-24,三诺生物：投资者接待和推广工作制度（2012年4月）,finalpage/2012-04-24/60890011.PDF
49,2012-04-24,三诺生物：独立董事对第一届董事会第十次会议相关事项的独立意见,finalpage/2012-04-24/60890012.PDF
50,2012-04-24,三诺生物：2012年度高级管理人员薪酬方案（2012年4月）,finalpage/2012-04-24/60890013.PDF
51,2012-04-24,三诺生物：2012年第一季度报告正文,finalpage/2012-04-24/60890014.PDF
52,2012-04-24,三诺生物：2012年第一季度报告全文,finalpage/2012-04-24/60890018.PDF
53,2012-04-24,三诺生物：董事和高级管理人员关于2012年第一季度报告的确认意见,finalpage/2012-04-24/60890019.PDF
54,2012-04-24,三诺生物：关于完成工商变更登记的公告,finalpage/2012-04-24/60890060.PDF
55,2012-05-03,三诺生物：关于签署募集资金三方监管协议的公告,finalpage/2012-05-03/60942169.PDF
56,2012-05-18,三诺生物：重大合同公告,finalpage/2012-05-18/61012301.PDF
57,2012-05-19,三诺生物：2011年度股东大会决议公告,finalpage/2012-05-19/61018484.PDF
58,2012-05-19,三诺生物：2011年度股东大会的法律意见书,finalpage/2012-05-19/61018485.PDF
59,2012-06-05,三诺生物：关于公司名称变更的公告,finalpage/2012-06-05/61089110.PDF
60,2012-06-13,三诺生物：关于使用募集资金置换先期投入的公告,finalpage/2012-06-13/61134260.PDF
61,2012-06-13,三诺生物：第一届董事会第十一次会议决议公告,finalpage/2012-06-13/61134261.PDF
62,2012-06-13,三诺生物：第一届监事会第七次会议决议公告,finalpage/2012-06-13/61134262.PDF
63,2012-06-13,三诺生物：独立董事对第一届董事会第十一次会议相关议案的独立意见,finalpage/2012-06-13/61134263.PDF
64,2012-06-13,三诺生物：中信证券股份有限公司关于公司以募集资金置换预先已投入募集资金投资项目的自筹资金事项之保荐意见,finalpage/2012-06-13/61134264.PDF
65,2012-06-13,三诺生物：关于长沙三诺生物传感技术股份有限公司以自筹资金预先投入募集资金投资项目情况的鉴证报告,finalpage/2012-06-13/61134265.PDF
66,2012-06-14,三诺生物：关于限售股份上市流通的提示性公告,finalpage/2012-06-14/61139435.PDF
67,2012-06-21,三诺生物：2011年度权益分派实施公告,finalpage/2012-06-21/61163494.PDF
68,2012-07-13,三诺生物：关于证券事务代表辞职的公告,finalpage/2012-07-13/61261521.PDF
69,2012-07-13,三诺生物：2012年半年度业绩预告,finalpage/2012-07-13/61261522.PDF
70,2012-08-02,三诺生物：第一届董事会第十二次会议决议公告,finalpage/2012-08-02/61364541.PDF
71,2012-08-02,三诺生物：第一届监事会第八次会议决议公告,finalpage/2012-08-02/61364542.PDF
72,2012-08-02,三诺生物：关于召开2012年第一次临时股东大会的通知,finalpage/2012-08-02/61364543.PDF
73,2012-08-02,三诺生物：中信证券股份有限公司关于公司使用自有闲置资金择机购买低风险银行理财或信托产品的核查意见,finalpage/2012-08-02/61364544.PDF
74,2012-08-02,三诺生物：中信证券股份有限公司关于公司使用部分超募资金购买经营土地事项的核查意见,finalpage/2012-08-02/61364545.PDF
75,2012-08-02,三诺生物：关于使用部分超募资金购买经营土地的可行性研究报告,finalpage/2012-08-02/61364546.PDF
76,2012-08-02,三诺生物：独立董事关于第一届董事会第十二次会议相关事项的独立意见,finalpage/2012-08-02/61364547.PDF
77,2012-08-14,三诺生物：2012年半年度报告摘要,finalpage/2012-08-14/61415506.PDF
78,2012-08-14,三诺生物：2012年半年度报告,finalpage/2012-08-14/61415508.PDF
79,2012-08-14,三诺生物：独立董事关于2012年半年度相关事项的独立意见,finalpage/2012-08-14/61415509.PDF
80,2012-08-18,三诺生物：2012年第一次临时股东大会的法律意见,finalpage/2012-08-18/61440674.PDF
81,2012-08-18,三诺生物：2012年第一次临时股东大会决议公告,finalpage/2012-08-18/61440675.PDF
82,2012-09-18,三诺生物：中信证券股份有限公司关于公司2012年半年度持续督导跟踪报告,finalpage/2012-09-18/61583347.PDF
83,2012-10-13,三诺生物：2012年度前三季度业绩预告,finalpage/2012-10-13/61650395.PDF
84,2012-10-18,三诺生物：关于变更职工代表监事的公告,finalpage/2012-10-18/61669693.PDF
85,2012-10-23,三诺生物：第一届董事会第十四次会议决议公告,finalpage/2012-10-23/61688011.PDF
86,2012-10-23,三诺生物：关于聘任证券事务代表的公告,finalpage/2012-10-23/61688012.PDF
87,2012-10-23,三诺生物：2012年第三季度报告正文,finalpage/2012-10-23/61688013.PDF
88,2012-10-23,三诺生物：2012年第三季度报告全文,finalpage/2012-10-23/61688015.PDF
89,2012-10-23,三诺生物：第一届监事会第十次会议决议公告,finalpage/2012-10-23/61688666.PDF
90,2012-10-23,三诺生物：独立董事对第一届董事会第十四次会议相关议案的独立意见,finalpage/2012-10-23/61688667.PDF
91,2013-01-05,三诺生物：关于变更公司投资者关系部联系方式的公告,finalpage/2013-01-05/61984092.PDF
92,2013-01-10,三诺生物：2012年度业绩预告,finalpage/2013-01-10/62006985.PDF
93,2013-01-10,三诺生物：2012年度利润分配预案的预披露,finalpage/2013-01-10/62006986.PDF
94,2013-02-05,三诺生物：关于举行2012年度业绩网上说明会的公告,finalpage/2013-02-05/62109525.PDF
95,2013-02-05,三诺生物：独立董事对第一届董事会第十五次会议相关事项的独立意见,finalpage/2013-02-05/62109526.PDF
96,2013-02-05,三诺生物：2013年第一季度业绩预告,finalpage/2013-02-05/62109527.PDF
97,2013-02-05,三诺生物：年报信息披露重大差错责任追究制度（2013年2月）,finalpage/2013-02-05/62109528.PDF
98,2013-02-05,三诺生物：2012年度董事会工作报告,finalpage/2013-02-05/62109529.PDF
99,2013-02-05,三诺生物：中信证券股份有限公司关于公司2012年度募集资金存放与使用情况的专项核查报告,finalpage/2013-02-05/62109530.PDF
100,2013-02-05,三诺生物：中信证券股份有限公司对《三诺生物传感股份有限公司2012年度内部控制自我评价报告》的核查意见,finalpage/2013-02-05/62109531.PDF
101,2013-02-05,三诺生物：2012年度财务决算报告,finalpage/2013-02-05/62109532.PDF
102,2013-02-05,三诺生物：2012年度独立董事（周智广先生）述职报告,finalpage/2013-02-05/62109533.PDF
103,2013-02-05,三诺生物：2012年度独立董事（唐红女士）述职报告,finalpage/2013-02-05/62109534.PDF
104,2013-02-05,三诺生物：2012年度独立董事（袁洪先生）述职报告,finalpage/2013-02-05/62109535.PDF
105,2013-02-05,三诺生物：2012年度募集资金存放与使用情况的专项报告,finalpage/2013-02-05/62109536.PDF
106,2013-02-05,三诺生物：董事会关于2012年度公司内部控制的自我评价报告,finalpage/2013-02-05/62109538.PDF
107,2013-02-05,三诺生物：2013年度高级管理人员薪酬方案,finalpage/2013-02-05/62109539.PDF
108,2013-02-05,三诺生物：2012年度监事会工作报告,finalpage/2013-02-05/62109540.PDF
109,2013-02-05,三诺生物：2012年年度报告摘要,finalpage/2013-02-05/62109541.PDF
110,2013-02-05,三诺生物：2012年年度报告,finalpage/2013-02-05/62109542.PDF
111,2013-02-05,三诺生物：2012年年度审计报告,finalpage/2013-02-05/62109543.PDF
112,2013-02-05,三诺生物：第一届董事会第十五次会议决议公告,finalpage/2013-02-05/62109544.PDF
113,2013-02-05,三诺生物：关于召开2012年度股东大会的通知,finalpage/2013-02-05/62109545.PDF
114,2013-02-05,三诺生物：2012年度报告披露提示性公告,finalpage/2013-02-05/62109546.PDF
115,2013-02-05,三诺生物：第一届监事会第十一次会议决议公告,finalpage/2013-02-05/62109547.PDF
116,2013-02-05,三诺生物：关于公司2012年度控股股东及其他关联方资金占用情况的专项说明,finalpage/2013-02-05/62109549.PDF
117,2013-02-05,三诺生物：募集资金年度存放与使用情况鉴证报告,finalpage/2013-02-05/62109550.PDF
118,2013-02-06,三诺生物：关于签订国有土地使用权成交确认书的公告,finalpage/2013-02-06/62116451.PDF
119,2013-03-05,三诺生物：重大合同公告,finalpage/2013-03-05/62179748.PDF
120,2013-03-06,三诺生物：2012年度股东大会决议公告,finalpage/2013-03-06/62185408.PDF
121,2013-03-06,三诺生物：2012年度股东大会的法律意见,finalpage/2013-03-06/62185409.PDF
122,2013-03-12,三诺生物：独立董事对第一届董事会第十六次会议相关议案的独立意见,finalpage/2013-03-12/62204180.PDF
123,2013-03-12,三诺生物：第一届董事会第十六次会议（通讯）决议公告,finalpage/2013-03-12/62204182.PDF
124,2013-03-12,三诺生物：关于对外提供委托贷款的公告,finalpage/2013-03-12/62204183.PDF
125,2013-03-12,三诺生物：关于召开2013年第一次临时股东大会的通知,finalpage/2013-03-12/62204184.PDF
126,2013-03-12,三诺生物：中信证券股份有限公司关于公司2012年度跟踪报告,finalpage/2013-03-12/62204185.PDF
127,2013-03-12,三诺生物：中信证券股份有限公司关于公司使用自有闲置资金对外提供委托贷款事项的核查意见,finalpage/2013-03-12/62204186.PDF
128,2013-03-27,三诺生物：2012年度权益分派实施公告,finalpage/2013-03-27/62277592.PDF
129,2013-03-28,三诺生物：2013年第一次临时股东大会决议公告,finalpage/2013-03-28/62283476.PDF
130,2013-03-28,三诺生物：2013年第一次临时股东大会的法律意见,finalpage/2013-03-28/62283477.PDF
131,2013-04-22,三诺生物：2013年第一季度报告提示性公告,finalpage/2013-04-22/62389793.PDF
132,2013-04-22,三诺生物：2013年第一季度报告全文,finalpage/2013-04-22/62389795.PDF
133,2013-05-03,三诺生物：关于完成注册资本工商变更登记的公告,finalpage/2013-05-03/62450215.PDF
134,2013-05-17,三诺生物：关于委托贷款提前收回的公告,finalpage/2013-05-17/62498214.PDF
135,2013-06-04,三诺生物：关于与古巴TISA公司续签框架性合作协议的提示性公告,finalpage/2013-06-04/62553474.PDF
136,2013-06-20,三诺生物：重大合同公告,finalpage/2013-06-20/62596595.PDF
137,2013-07-12,三诺生物：2013年半年度业绩预告,finalpage/2013-07-12/62826390.PDF
138,2013-07-17,三诺生物：第一届董事会第十八次会议（通讯）决议公告,finalpage/2013-07-17/62842067.PDF
139,2013-07-17,三诺生物：募集资金管理制度（2013年7月）,finalpage/2013-07-17/62842068.PDF
140,2013-07-17,三诺生物：委托理财管理制度（2013年7月）,finalpage/2013-07-17/62842069.PDF
141,2013-07-17,三诺生物：对外提供财务资助管理制度（2013年7月）,finalpage/2013-07-17/62842070.PDF
142,2013-07-17,三诺生物：股东大会网络投票管理制度（2013年7月）,finalpage/2013-07-17/62842071.PDF
143,2013-08-13,三诺生物：独立董事对相关事项的独立意见,finalpage/2013-08-13/62932392.PDF
144,2013-08-13,三诺生物：2013年半年度报告摘要,finalpage/2013-08-13/62932394.PDF
145,2013-08-13,三诺生物：2013年半年度报告披露提示性公告,finalpage/2013-08-13/62932397.PDF
146,2013-08-13,三诺生物：2013年半年度报告,finalpage/2013-08-13/62932398.PDF
147,2013-08-20,三诺生物：第一届董事会第二十次会议（通讯）决议公告,finalpage/2013-08-20/62964651.PDF
148,2013-08-20,三诺生物：第一届监事会第十四次会议决议公告,finalpage/2013-08-20/62964652.PDF
149,2013-08-20,三诺生物：关于将部分超募资金转存为定期存款的公告,finalpage/2013-08-20/62964653.PDF
150,2013-08-20,三诺生物：关于使用自有闲置资金购买低风险理财产品的公告,finalpage/2013-08-20/62964654.PDF
151,2013-08-20,三诺生物：独立董事对相关事项的独立意见,finalpage/2013-08-20/62964655.PDF
152,2013-08-20,三诺生物：中信证券股份有限公司关于公司利用自有闲置资金择机购买低风险银行理财产品、资产管理计划及信托产品的核查意见,finalpage/2013-08-20/62964656.PDF
153,2013-08-20,三诺生物：中信证券股份有限公司关于公司将部分超募资金转存为定期存款的核查意见,finalpage/2013-08-20/62964657.PDF
154,2013-09-02,三诺生物：关于重大事项停牌的公告,finalpage/2013-09-02/63029440.PDF
155,2013-09-03,三诺生物：股票期权与限制性股票激励计划（草案）,finalpage/2013-09-03/63041687.PDF
156,2013-09-03,三诺生物：股票期权与限制性股票激励计划（草案摘要）,finalpage/2013-09-03/63041688.PDF
157,2013-09-03,三诺生物：关于聘任公司副总经理、首席科学家的公告,finalpage/2013-09-03/63041689.PDF
158,2013-09-03,三诺生物：第一届董事会第二十一次会议决议公告,finalpage/2013-09-03/63041690.PDF
159,2013-09-03,三诺生物：第一届监事会第十五次会议决议公告,finalpage/2013-09-03/63041691.PDF
160,2013-09-03,三诺生物：独立董事关于聘任公司副总经理、首席科学家的独立意见,finalpage/2013-09-03/63041692.PDF
161,2013-09-03,三诺生物：监事会关于公司股票期权与限制性股票激励计划激励对象人员名单的核查意见,finalpage/2013-09-03/63041693.PDF
162,2013-09-03,三诺生物：独立董事关于《三诺生物传感股份有限公司股票期权与限制性股票激励计划（草案）》的独立意见,finalpage/2013-09-03/63041694.PDF
163,2013-09-03,三诺生物：北京国枫凯文律师事务所关于公司股票期权与限制性股票激励计划（草案）的法律意见书,finalpage/2013-09-03/63041695.PDF
164,2013-09-03,三诺生物：中信证券股份有限公司关于公司股票期权与限制性股票激励计划（草案）之独立财务顾问报告,finalpage/2013-09-03/63041696.PDF
165,2013-09-03,三诺生物：股票期权与限制性股票激励计划激励对象名单,finalpage/2013-09-03/63041697.PDF
166,2013-09-03,三诺生物：股票期权与限制性股票激励计划实施考核管理办法（草案）（2013年9月）,finalpage/2013-09-03/63041698.PDF
167,2013-09-04,三诺生物：补充更正公告,finalpage/2013-09-04/63046433.PDF
168,2013-09-11,三诺生物：第一届董事会第二十二次会议（通讯）决议公告,finalpage/2013-09-11/63071065.PDF
169,2013-09-11,三诺生物：独立董事提名人声明,finalpage/2013-09-11/63071066.PDF
170,2013-09-11,三诺生物：第一届监事会第十六次会议决议公告,finalpage/2013-09-11/63071067.PDF
171,2013-09-11,三诺生物：关于选举产生第二届监事会职工代表监事的公告,finalpage/2013-09-11/63071068.PDF
172,2013-09-11,三诺生物：对外投资的公告,finalpage/2013-09-11/63071069.PDF
173,2013-09-11,三诺生物：关于召开2013年第二次临时股东大会的通知,finalpage/2013-09-11/63071070.PDF
174,2013-09-11,三诺生物：独立董事对相关事项发表的独立意见,finalpage/2013-09-11/63071071.PDF
175,2013-09-11,三诺生物：独立董事候选人声明（周智广）,finalpage/2013-09-11/63071072.PDF
176,2013-09-11,三诺生物：独立董事候选人声明（袁洪）,finalpage/2013-09-11/63071073.PDF
177,2013-09-11,三诺生物：独立董事候选人声明（唐红）,finalpage/2013-09-11/63071074.PDF
178,2013-09-11,三诺生物：中信证券股份有限公司关于公司2013年半年度持续督导跟踪报告,finalpage/2013-09-11/63071075.PDF
179,2013-09-27,三诺生物：2013年第二次临时股东大会决议公告,finalpage/2013-09-27/63120212.PDF
180,2013-09-27,三诺生物：第二届董事会第一次会议决议公告,finalpage/2013-09-27/63120213.PDF
181,2013-09-27,三诺生物：第二届监事会第一次会议决议公告,finalpage/2013-09-27/63120214.PDF
182,2013-09-27,三诺生物：对外投资公告,finalpage/2013-09-27/63120215.PDF
183,2013-09-27,三诺生物：关于变更公司办公地址和联系方式的公告,finalpage/2013-09-27/63120216.PDF
184,2013-09-27,三诺生物：募集资金管理制度（2013年9月）,finalpage/2013-09-27/63120217.PDF
185,2013-09-27,三诺生物：股东大会网络投票管理制度（2013年9月）,finalpage/2013-09-27/63120218.PDF
186,2013-09-27,三诺生物：独立董事关于第二届董事会第一次会议相关事项的独立意见,finalpage/2013-09-27/63120219.PDF
187,2013-09-27,三诺生物：公司章程（2013年9月）,finalpage/2013-09-27/63120220.PDF
188,2013-09-27,三诺生物：2013年第二次临时股东大会的法律意见,finalpage/2013-09-27/63120221.PDF
189,2013-09-27,三诺生物：《公司章程》修改对照表,finalpage/2013-09-27/63120222.PDF
190,2013-10-15,三诺生物：2013年前三季度业绩预告,finalpage/2013-10-15/63154928.PDF
191,2013-10-15,三诺生物：关于完成工商变更登记的公告,finalpage/2013-10-15/63154929.PDF
192,2013-10-25,三诺生物：第二届董事会第二次会议（通讯）决议公告,finalpage/2013-10-25/63191704.PDF
193,2013-10-25,三诺生物：第二届监事会第二次会议决议公告,finalpage/2013-10-25/63191705.PDF
194,2013-10-25,三诺生物：2013年第三季度报告披露提示性公告,finalpage/2013-10-25/63191707.PDF
195,2013-10-25,三诺生物：2013年第三季度报告全文,finalpage/2013-10-25/63191708.PDF
196,2013-11-16,三诺生物：关于股票期权与限制性股票激励计划（草案）获得中国证监会备案无异议的公告,finalpage/2013-11-16/63273043.PDF
197,2013-11-19,三诺生物：第二届监事会第三次会议决议公告,finalpage/2013-11-19/63280268.PDF
198,2013-11-19,三诺生物：关于召开2013年第三次临时股东大会的通知,finalpage/2013-11-19/63280269.PDF
199,2013-11-19,三诺生物：独立董事公开征集委托投票权报告书,finalpage/2013-11-19/63280270.PDF
200,2013-11-19,三诺生物：股票期权与限制性股票激励计划人员名单与分配数量（调整后）,finalpage/2013-11-19/63280271.PDF
201,2013-11-19,三诺生物：中信证券股份有限公司关于公司股票期权与限制性股票激励计划（草案修订稿）之独立财务顾问报告,finalpage/2013-11-19/63280272.PDF
202,2013-11-19,三诺生物：北京国枫凯文律师事务所关于公司股票期权与限制性股票激励计划（草案修订稿）的法律意见书,finalpage/2013-11-19/63280273.PDF
203,2013-11-19,三诺生物：股票期权与限制性股票激励计划（草案修订稿）,finalpage/2013-11-19/63280274.PDF
204,2013-11-19,三诺生物：股票期权与限制性股票激励计划（草案修订稿摘要）,finalpage/2013-11-19/63280277.PDF
205,2013-11-19,三诺生物：独立董事关于《三诺生物传感股份有限公司股票期权与限制性股票激励计划（草案修订稿）》的独立意见,finalpage/2013-11-19/63280280.PDF
206,2013-11-19,三诺生物：监事会关于公司股票期权与限制性股票激励计划激励对象人员名单的核查意见,finalpage/2013-11-19/63280283.PDF
