,date,title,url
416,2015-03-17,三诺生物：第二届监事会第十五次会议决议公告,finalpage/2015-03-17/1200706324.PDF
417,2015-03-17,三诺生物：2014年年度报告,finalpage/2015-03-17/1200706325.PDF
418,2015-03-24,三诺生物：关于重大事项停牌的公告,finalpage/2015-03-24/1200731966.PDF
419,2015-03-24,三诺生物：中信证券股份有限公司关于公司2014年度持续督导跟踪报告,finalpage/2015-03-24/1200731967.PDF
420,2015-03-28,三诺生物：关于公司再次通过高新技术企业认定的公告,finalpage/2015-03-28/1200752976.PDF
421,2015-03-31,三诺生物：关于重大事项停牌进展公告,finalpage/2015-03-31/1200763661.PDF
422,2015-04-08,三诺生物：关于重大事项停牌进展公告,finalpage/2015-04-08/1200795434.PDF
423,2015-04-08,三诺生物：关于召开2014年度股东大会的提示性公告,finalpage/2015-04-08/1200796423.PDF
424,2015-04-10,三诺生物：2014年度股东大会决议公告,finalpage/2015-04-10/1200812590.PDF
425,2015-04-10,三诺生物：2014年度股东大会的法律意见书,finalpage/2015-04-10/1200812591.PDF
426,2015-04-14,三诺生物：关于重大事项停牌进展公告,finalpage/2015-04-14/1200826417.PDF
427,2015-04-16,三诺生物：关于股权激励计划首次授予部分限制性股票回购注销和第二个行权期全部股票期权注销完成的公告,finalpage/2015-04-16/1200845847.PDF
428,2015-04-18,三诺生物：董事会关于重大资产重组停牌公告,finalpage/2015-04-18/1200864164.PDF
429,2015-04-18,三诺生物：董事会关于重大资产重组信息公布前股票价格波动未达到《关于规范上市公司信息披露及相关各方行为的通知》（证监公司字[2007]128号）相关标准的说明,finalpage/2015-04-18/1200864165.PDF
430,2015-04-24,三诺生物：第二届董事会第二十次会议（现场+通讯）决议公告,finalpage/2015-04-24/1200895025.PDF
431,2015-04-24,三诺生物：第二届监事会第十六次会议决议公告,finalpage/2015-04-24/1200895026.PDF
432,2015-04-24,三诺生物：2015年第一季度报告全文,finalpage/2015-04-24/1200895027.PDF
433,2015-04-24,三诺生物：2015年第一季度报告披露提示性公告,finalpage/2015-04-24/1200895028.PDF
434,2015-04-24,三诺生物：关于《2015年第一季度报告》有关内容的补充说明,finalpage/2015-04-24/1200898780.PDF
435,2015-04-25,三诺生物：重大资产重组进展公告,finalpage/2015-04-25/1200904248.PDF
436,2015-05-01,三诺生物：重大资产重组进展公告,finalpage/2015-05-01/1200956442.PDF
437,2015-05-09,三诺生物：重大资产重组进展公告,finalpage/2015-05-09/1200984824.PDF
438,2015-05-12,三诺生物：关于董事、副总经理辞职的公告,finalpage/2015-05-12/1200999319.PDF
439,2015-05-12,三诺生物：关于将部分超募资金续存为定期存款的公告,finalpage/2015-05-12/1200999320.PDF
440,2015-05-12,三诺生物：2014年年度权益分派实施公告,finalpage/2015-05-12/1200999512.PDF
441,2015-05-16,三诺生物：重大资产重组进展公告,finalpage/2015-05-16/1201019915.PDF
442,2015-05-22,三诺生物：关于重大资产重组进展暨延期复牌的公告,finalpage/2015-05-22/1201048676.PDF
443,2015-05-29,三诺生物：重大资产重组进展公告,finalpage/2015-05-29/1201077154.PDF
444,2015-06-05,三诺生物：重大资产重组进展公告,finalpage/2015-06-05/1201105267.PDF
445,2015-06-12,三诺生物：关于终止筹划重大资产重组事项暨公司股票复牌公告,finalpage/2015-06-12/1201139442.PDF
446,2015-06-12,三诺生物：关于终止筹划重大资产重组事项召开投资者说明会的提示性公告,finalpage/2015-06-12/1201139443.PDF
447,2015-06-16,三诺生物：第二届董事会第二十一次（临时）会议（通讯方式）决议公告,finalpage/2015-06-16/1201154372.PDF
448,2015-06-16,三诺生物：关于调整公司股票期权与限制性股票激励计划所涉股票期权授予数量与行权价格的公告,finalpage/2015-06-16/1201154373.PDF
449,2015-06-16,三诺生物：关于股票交易异常波动的公告,finalpage/2015-06-16/1201154374.PDF
450,2015-06-16,三诺生物：独立董事关于第二届董事会第二十一次会议相关事项的独立意见,finalpage/2015-06-16/1201154375.PDF
451,2015-06-16,三诺生物：北京国枫律师事务所关于公司调整股票期权与限制性股票激励计划相关事项的法律意见书,finalpage/2015-06-16/1201154376.PDF
452,2015-06-18,三诺生物：关于终止重大资产重组事项投资者说明会召开情况的公告,finalpage/2015-06-18/1201165049.PDF
453,2015-07-04,三诺生物：关于完成工商变更登记的公告,finalpage/2015-07-04/1201235938.PDF
454,2015-07-04,三诺生物：2015年半年度业绩预告,finalpage/2015-07-04/1201237153.PDF
455,2015-07-07,三诺生物：关于高级管理人员增持公司股票的公告,finalpage/2015-07-07/1201247455.PDF
456,2015-07-10,三诺生物：关于维护公司股价稳定方案的公告,finalpage/2015-07-10/1201268119.PDF
457,2015-07-10,三诺生物：关于举行维护公司股价稳定方案说明会的公告,finalpage/2015-07-10/1201268120.PDF
458,2015-07-13,三诺生物：关于股票交易异常波动的公告,finalpage/2015-07-13/1201273982.PDF
459,2015-08-05,三诺生物：第二届董事会第二十二次会议（临时）决议公告,finalpage/2015-08-05/1201392866.PDF
460,2015-08-05,三诺生物：第二届监事会第十七次会议决议公告,finalpage/2015-08-05/1201392867.PDF
461,2015-08-05,三诺生物：关于预留部分限制性股票第一个解锁期可解锁的公告,finalpage/2015-08-05/1201392868.PDF
462,2015-08-05,三诺生物：关于拟回购注销部分不符合解锁条件预留部分限制性股票的公告,finalpage/2015-08-05/1201392869.PDF
463,2015-08-05,三诺生物：关于回购注销部分限制性股票暨减资的债权人公告,finalpage/2015-08-05/1201392870.PDF
464,2015-08-05,三诺生物：《公司章程》修订对照说明,finalpage/2015-08-05/1201392871.PDF
465,2015-08-05,三诺生物：独立董事关于第二届董事会第二十二次会议相关事项的独立意见,finalpage/2015-08-05/1201392872.PDF
466,2015-08-05,三诺生物：北京国枫律师事务所关于公司股票期权与限制性股票激励计划预留限制性股票第一个解锁期可解锁暨回购注销部分预留限制性股票相关事项的法律意见书,finalpage/2015-08-05/1201392873.PDF
467,2015-08-11,三诺生物：关于获得中国驰名商标的公告,finalpage/2015-08-11/1201417084.PDF
468,2015-08-13,三诺生物：2015年半年度募集资金存放与使用情况的专项报告,finalpage/2015-08-13/1201427950.PDF
469,2015-08-13,三诺生物：关于使用自有闲置资金购买低风险银行理财产品的公告,finalpage/2015-08-13/1201427951.PDF
470,2015-08-13,三诺生物：独立董事关于第二届董事会第二十三次会议相关事项的独立意见,finalpage/2015-08-13/1201427952.PDF
471,2015-08-13,三诺生物：2015年半年度报告摘要,finalpage/2015-08-13/1201427953.PDF
472,2015-08-13,三诺生物：第二届董事会第二十三次会议（现场+通讯）决议公告,finalpage/2015-08-13/1201427955.PDF
473,2015-08-13,三诺生物：2015年半年度报告披露提示性公告,finalpage/2015-08-13/1201427956.PDF
474,2015-08-13,三诺生物：第二届监事会第十八次会议决议公告,finalpage/2015-08-13/1201427957.PDF
475,2015-08-13,三诺生物：2015年半年度报告,finalpage/2015-08-13/1201427958.PDF
476,2015-08-13,三诺生物：中信证券股份有限公司关于公司使用自有闲置资金购买低风险银行理财产品的核查意见,finalpage/2015-08-13/1201427959.PDF
477,2015-08-14,三诺生物：关于预留部分限制性股票第一期解锁股份上市流通的提示性公告,finalpage/2015-08-14/1201433773.PDF
478,2015-08-20,三诺生物：中信证券股份有限公司关于公司2015年上半年持续督导跟踪报告,finalpage/2015-08-20/1201465351.PDF
479,2015-09-08,三诺生物：第二届董事会第二十四次会议（现场+通讯）决议公告,finalpage/2015-09-08/1201560707.PDF
480,2015-09-08,三诺生物：关于召开2015年第一次临时股东大会的通知,finalpage/2015-09-08/1201560708.PDF
481,2015-09-23,三诺生物：关于召开2015年第一次临时股东大会的提示性公告,finalpage/2015-09-23/1201623962.PDF
482,2015-09-23,三诺生物：关于参加2015年度投资者网上接待日活动的公告,finalpage/2015-09-23/1201623963.PDF
483,2015-09-26,三诺生物：2015年第一次临时股东大会决议公告,finalpage/2015-09-26/1201641082.PDF
484,2015-09-26,三诺生物：关于变更董事的公告,finalpage/2015-09-26/1201641083.PDF
485,2015-09-26,三诺生物：《公司章程》修订对照说明,finalpage/2015-09-26/1201641084.PDF
486,2015-09-26,三诺生物：2015年第一次临时股东大会的法律意见书,finalpage/2015-09-26/1201641085.PDF
487,2015-10-14,三诺生物：2015年前三季度业绩预告,finalpage/2015-10-14/1201688466.PDF
488,2015-10-23,三诺生物：关于部分不符合解锁条件预留部分限制性股票回购注销完成的公告,finalpage/2015-10-23/1201718270.PDF
489,2015-10-23,三诺生物：关于完成工商变更登记的公告,finalpage/2015-10-23/1201714734.PDF
490,2015-10-27,三诺生物：2015年第三季度报告披露提示性公告,finalpage/2015-10-27/1201726147.PDF
491,2015-10-27,三诺生物：2015年第三季度报告全文,finalpage/2015-10-27/1201726149.PDF
492,2015-10-27,三诺生物：第二届董事会第二十五次会议（现场+通讯）决议公告,finalpage/2015-10-27/1201726150.PDF
493,2015-10-27,三诺生物：第二届监事会第十九次会议决议公告,finalpage/2015-10-27/1201726151.PDF
494,2015-10-27,三诺生物：关于调整董事会部分专门委员会委员的公告,finalpage/2015-10-27/1201726152.PDF
495,2015-10-28,三诺生物：第二届董事会第二十六次会议（现场+通讯）决议公告,finalpage/2015-10-28/1201732177.PDF
496,2015-10-28,三诺生物：独立董事关于公司子公司收购美国尼普洛诊断有限公司股权涉及关联交易和为关联方提供担保事项的事前认可意见,finalpage/2015-10-28/1201732178.PDF
497,2015-10-28,三诺生物：独立董事关于第二届董事会第二十六次会议相关事项的独立意见,finalpage/2015-10-28/1201732179.PDF
498,2015-10-28,三诺生物：第二届监事会第二十次会议决议公告,finalpage/2015-10-28/1201732180.PDF
499,2015-10-28,三诺生物：关于与公司控股股东签署《深圳市心诺健康产业投资有限公司增资协议》暨关联投资的公告,finalpage/2015-10-28/1201732181.PDF
500,2015-10-28,三诺生物：关于使用超募资金对公司子公司增资并参与海外股权收购事宜的公告,finalpage/2015-10-28/1201732182.PDF
501,2015-10-28,三诺生物：关于使用超募资金联合控股股东增资子公司并收购美国尼普洛诊断有限公司股权之可行性分析报告,finalpage/2015-10-28/1201732183.PDF
502,2015-10-28,三诺生物：关于向有关银行申请综合授信及为关联方提供担保的公告,finalpage/2015-10-28/1201732184.PDF
503,2015-10-28,三诺生物：关于公司子公司收购美国尼普洛诊断有限公司股权相关事项构成关联交易的公告,finalpage/2015-10-28/1201732185.PDF
504,2015-10-28,三诺生物：关于召开2015年第二次临时股东大会的通知,finalpage/2015-10-28/1201732186.PDF
505,2015-10-28,三诺生物：中信证券股份有限公司关于公司超募资金使用计划的核查意见,finalpage/2015-10-28/1201732187.PDF
506,2015-10-28,三诺生物：中信证券股份有限公司关于公司关联交易及对外担保的核查意见,finalpage/2015-10-28/1201732188.PDF
507,2015-10-28,三诺生物：关于公司子公司与日本尼普洛株式会社签署《股权收购协议》的公告,finalpage/2015-10-28/1201732189.PDF
508,2015-11-10,三诺生物：关于召开2015年第二次临时股东大会的提示性公告,finalpage/2015-11-10/1201759663.PDF
509,2015-11-14,三诺生物：2015年第二次临时股东大会决议公告,finalpage/2015-11-14/1201771444.PDF
510,2015-11-14,三诺生物：2015年第二次临时股东大会的法律意见书,finalpage/2015-11-14/1201771445.PDF
511,2015-11-28,三诺生物：第二届监事会第二十一次会议决议公告,finalpage/2015-11-28/1201795063.PDF
512,2015-11-28,三诺生物：关于回购注销部分限制性股票暨减资的债权人公告,finalpage/2015-11-28/1201795064.PDF
513,2015-11-28,三诺生物：《公司章程》修订对照说明,finalpage/2015-11-28/1201795065.PDF
514,2015-11-28,三诺生物：独立董事关于第二届董事会第二十七次会议相关事项的独立意见,finalpage/2015-11-28/1201795066.PDF
515,2015-11-28,三诺生物：北京国枫律师事务所关于公司股票期权与限制性股票激励计划限制性股票第二个解锁期可解锁暨回购注销部分限制性股票相关事项的法律意见书,finalpage/2015-11-28/1201795067.PDF
516,2015-11-28,三诺生物：关于限制性股票第二个解锁期条件成就可解锁的公告,finalpage/2015-11-28/1201795068.PDF
517,2015-11-28,三诺生物：关于拟回购注销部分不符合解锁条件限制性股票的公告,finalpage/2015-11-28/1201795069.PDF
518,2015-11-28,三诺生物：第二届董事会第二十七次会议（临时）决议公告,finalpage/2015-11-28/1201795070.PDF
519,2015-12-05,三诺生物：关于限制性股票第二期解锁股份上市流通的提示性公告,finalpage/2015-12-05/1201808487.PDF
520,2015-12-24,三诺生物：关于公司控股股东进行股票质押式回购交易的公告,finalpage/2015-12-24/1201853844.PDF
521,2015-12-24,三诺生物：关于职工代表监事辞职的公告,finalpage/2015-12-24/1201853845.PDF
522,2015-12-31,三诺生物：关于为子公司提供担保的进展公告,finalpage/2015-12-31/1201876443.PDF
523,2016-01-06,三诺生物：2015年度业绩预告,finalpage/2016-01-06/1201890115.PDF
524,2016-01-06,三诺生物：关于2015年度利润分配预案的预披露公告,finalpage/2016-01-06/1201890116.PDF
525,2016-01-08,三诺生物：关于对外投资的进展公告,finalpage/2016-01-08/1201902407.PDF
526,2016-01-28,三诺生物：关于部分不符合解锁条件限制性股票回购注销完成的公告,finalpage/2016-01-28/1201951596.PDF
527,2016-01-30,三诺生物：2015年度报告披露提示性公告,finalpage/2016-01-30/1201954107.PDF
528,2016-01-30,三诺生物：2015年年度报告摘要,finalpage/2016-01-30/1201954108.PDF
529,2016-01-30,三诺生物：2015年年度审计报告,finalpage/2016-01-30/1201954110.PDF
530,2016-01-30,三诺生物：2015年年度报告,finalpage/2016-01-30/1201954111.PDF
531,2016-01-30,三诺生物：第二届董事会第二十八次会议决议公告,finalpage/2016-01-30/1201954112.PDF
532,2016-01-30,三诺生物：第二届监事会第二十二次会议决议公告,finalpage/2016-01-30/1201954113.PDF
533,2016-01-30,三诺生物：关于使用节余募集资金永久性补充流动资金的公告,finalpage/2016-01-30/1201954114.PDF
534,2016-01-30,三诺生物：关于公司部分固定资产报废处理的公告,finalpage/2016-01-30/1201954115.PDF
535,2016-01-30,三诺生物：《公司章程》修订对照说明,finalpage/2016-01-30/1201954116.PDF
536,2016-01-30,三诺生物：关于举行2015年度业绩网上说明会的公告,finalpage/2016-01-30/1201954117.PDF
537,2016-01-30,三诺生物：关于召开2015年度股东大会的通知,finalpage/2016-01-30/1201954118.PDF
538,2016-01-30,三诺生物：2016年第一季度业绩预告,finalpage/2016-01-30/1201954119.PDF
539,2016-01-30,三诺生物：独立董事关于第二届董事会第二十八次会议相关事项的独立意见,finalpage/2016-01-30/1201954120.PDF
540,2016-01-30,三诺生物：2015年度独立董事（纪立农先生）述职报告,finalpage/2016-01-30/1201954121.PDF
541,2016-01-30,三诺生物：2015年度独立董事（李永国先生）述职报告,finalpage/2016-01-30/1201954122.PDF
542,2016-01-30,三诺生物：2015年度独立董事（唐红女士）述职报告,finalpage/2016-01-30/1201954123.PDF
543,2016-01-30,三诺生物：2015年度监事会工作报告,finalpage/2016-01-30/1201954124.PDF
544,2016-01-30,三诺生物：2015年度财务决算报告,finalpage/2016-01-30/1201954125.PDF
545,2016-01-30,三诺生物：2015年度内部控制自我评价报告,finalpage/2016-01-30/1201954126.PDF
546,2016-01-30,三诺生物：2015年度募集资金年度存放与使用情况鉴证报告,finalpage/2016-01-30/1201954127.PDF
547,2016-01-30,三诺生物：2015年度控股股东及其他关联方资金占用情况的专项说明,finalpage/2016-01-30/1201954128.PDF
548,2016-01-30,三诺生物：中信证券股份有限公司关于公司2015年度内部控制自我评价报告的核查意见,finalpage/2016-01-30/1201954129.PDF
549,2016-01-30,三诺生物：中信证券股份有限公司关于公司2015年度募集资金存放与使用情况的核查意见,finalpage/2016-01-30/1201954130.PDF
550,2016-01-30,三诺生物：中信证券股份有限公司关于公司使用节余募集资金永久性补充流动资金的核查意见,finalpage/2016-01-30/1201954131.PDF
551,2016-02-02,三诺生物：关于为子公司提供担保的进展公告,finalpage/2016-02-02/1201958185.PDF
552,2016-02-02,三诺生物：关于《2015年度利润分配预案》有关内容的补充说明,finalpage/2016-02-02/1201958186.PDF
553,2016-02-03,三诺生物：关于完成工商变更登记的公告,finalpage/2016-02-03/1201960529.PDF
554,2016-02-03,三诺生物：关于选举第二届监事会职工代表监事的公告,finalpage/2016-02-03/1201960530.PDF
555,2016-02-04,三诺生物：中信证券股份有限公司关于公司2015年度持续督导跟踪报告,finalpage/2016-02-04/1201971486.PDF
556,2016-02-22,三诺生物：第二届监事会第二十三次会议决议公告,finalpage/2016-02-22/1201990025.PDF
557,2016-02-22,三诺生物：独立董事关于第二届董事会第二十九次会议相关事项的独立意见,finalpage/2016-02-22/1201990026.PDF
558,2016-02-22,三诺生物：关于拟回购注销公司股权激励计划部分股票期权与限制性股票的公告,finalpage/2016-02-22/1201990028.PDF
559,2016-02-22,三诺生物：关于回购注销部分限制性股票暨减资的债权人公告,finalpage/2016-02-22/1201990029.PDF
560,2016-02-22,三诺生物：第二届董事会第二十九次会议（临时）决议公告,finalpage/2016-02-22/1201990024.PDF
561,2016-02-22,三诺生物：北京国枫律师事务所关于公司股票期权与限制性股票激励计划注销股票期权/回购注销限制性股票与预留部分限制性股票相关事项的法律意见书,finalpage/2016-02-22/1201990027.PDF
562,2016-02-22,三诺生物：《公司章程》修订对照说明,finalpage/2016-02-22/1201990030.PDF
563,2016-02-23,三诺生物：关于召开2015年度股东大会的提示性公告,finalpage/2016-02-23/1201990132.PDF
564,2016-02-27,三诺生物：2015年度股东大会的法律意见书,finalpage/2016-02-27/1202003944.PDF
565,2016-02-27,三诺生物：2015年度股东大会决议公告,finalpage/2016-02-27/1202003945.PDF
566,2016-03-05,三诺生物：2015年年度权益分派实施公告,finalpage/2016-03-05/1202024266.PDF
567,2016-03-09,三诺生物：中信证券股份有限公司关于公司2015年度持续督导跟踪报告（修订稿）,finalpage/2016-03-09/1202032327.PDF
568,2016-03-11,三诺生物：关于完成工商变更登记的公告,finalpage/2016-03-11/1202039158.PDF
569,2016-03-19,三诺生物：董事会关于重大资产重组停牌公告,finalpage/2016-03-19/1202057752.PDF
570,2016-03-26,三诺生物：重大资产重组进展公告,finalpage/2016-03-26/1202081878.PDF
571,2016-04-02,三诺生物：重大资产重组进展公告,finalpage/2016-04-02/1202131969.PDF
572,2016-04-08,三诺生物：关于完成工商变更登记的公告,finalpage/2016-04-08/1202149284.PDF
573,2016-04-09,三诺生物：重大资产重组进展公告,finalpage/2016-04-09/1202154694.PDF
574,2016-04-16,三诺生物：重大资产重组进展公告,finalpage/2016-04-16/1202185995.PDF
575,2016-04-19,三诺生物：关于重大资产重组进展暨延期复牌的公告,finalpage/2016-04-19/1202194372.PDF
576,2016-04-25,三诺生物：第二届监事会第二十四次会议决议公告,finalpage/2016-04-25/1202226467.PDF
577,2016-04-25,三诺生物：独立董事关于第二届董事会第三十次会议相关事项的独立意见,finalpage/2016-04-25/1202226468.PDF
578,2016-04-25,三诺生物：关于调整《公司股票期权与限制性股票激励计划（草案修订稿）》所涉股票期权授予数量与行权价格的公告,finalpage/2016-04-25/1202226469.PDF
579,2016-04-25,三诺生物：北京国枫律师事务所关于公司调整股票期权与限制性股票激励计划所涉股票期权相关事项的法律意见书,finalpage/2016-04-25/1202226470.PDF
580,2016-04-25,三诺生物：2016年第一季度报告全文,finalpage/2016-04-25/1202226472.PDF
581,2016-04-25,三诺生物：2016年第一季度报告披露提示性公告,finalpage/2016-04-25/1202226473.PDF
582,2016-04-25,三诺生物：第二届董事会第三十次会议（现场+通讯）决议公告,finalpage/2016-04-25/1202226474.PDF
583,2016-04-26,三诺生物：重大资产重组进展公告,finalpage/2016-04-26/1202238178.PDF
584,2016-04-27,三诺生物：关于股权激励计划首次授予部分限制性股票回购注销和第三个行权期全部股票期权注销完成的公告,finalpage/2016-04-27/1202257208.PDF
585,2016-04-29,三诺生物：关于完成工商变更登记的公告,finalpage/2016-04-29/1202263328.PDF
586,2016-05-03,三诺生物：关于收购美国PTS公司签署《并购协议》的公告,finalpage/2016-05-03/1202285793.PDF
587,2016-05-04,三诺生物：重大资产重组进展公告,finalpage/2016-05-04/1202286658.PDF
588,2016-05-11,三诺生物：重大资产重组进展公告,finalpage/2016-05-11/1202315111.PDF
589,2016-05-17,三诺生物：关于重大资产重组进展暨延期复牌的公告,finalpage/2016-05-17/1202323463.PDF
590,2016-05-24,三诺生物：《公司章程》修订对照说明,finalpage/2016-05-24/1202334959.PDF
591,2016-05-24,三诺生物：第二届董事会第三十一次会议决议公告,finalpage/2016-05-24/1202334960.PDF
592,2016-05-24,三诺生物：关于对外投资设立子公司的公告,finalpage/2016-05-24/1202334961.PDF
593,2016-05-24,三诺生物：重大资产重组进展公告,finalpage/2016-05-24/1202334962.PDF
594,2016-05-31,三诺生物：关于对外投资的进展公告,finalpage/2016-05-31/1202346932.PDF
595,2016-05-31,三诺生物：重大资产重组进展公告,finalpage/2016-05-31/1202346931.PDF
596,2016-06-01,三诺生物：第二届董事会第三十二次会议决议公告,finalpage/2016-06-01/1202349896.PDF
597,2016-06-01,三诺生物：关于放弃参股子公司股权优先购买权的公告,finalpage/2016-06-01/1202349897.PDF
598,2016-06-01,三诺生物：独立董事关于第二届董事会第三十二次会议相关事项的独立意见,finalpage/2016-06-01/1202349898.PDF
599,2016-06-07,三诺生物：重大资产重组进展公告,finalpage/2016-06-07/1202357579.PDF
600,2016-06-14,三诺生物：重大资产重组进展公告,finalpage/2016-06-14/1202366343.PDF
601,2016-06-20,三诺生物：第二届董事会第三十三次会议决议公告,finalpage/2016-06-20/1202374982.PDF
602,2016-06-20,三诺生物：关于收购美国PTS公司签署《并购协议》暨与子公司签订《股份与权利义务转让协议》的公告,finalpage/2016-06-20/1202374983.PDF
603,2016-06-20,三诺生物：关于召开2016年第一次临时股东大会的通知,finalpage/2016-06-20/1202374984.PDF
604,2016-06-21,三诺生物：关于召开2016年第二次临时股东大会的通知,finalpage/2016-06-21/1202378249.PDF
605,2016-06-21,三诺生物：签订《发行股份购买资产框架协议》的公告,finalpage/2016-06-21/1202378250.PDF
606,2016-06-21,三诺生物：关于重大资产重组进展暨延期复牌的公告,finalpage/2016-06-21/1202378251.PDF
607,2016-06-21,三诺生物：第二届董事会第三十四次会议决议公告,finalpage/2016-06-21/1202378252.PDF
608,2016-06-21,三诺生物：独立董事关于第三届董事会第三十四次（临时）会议相关事项的独立意见,finalpage/2016-06-21/1202378253.PDF
609,2016-06-21,三诺生物：中信证券股份有限公司关于公司继续停牌的核查意见,finalpage/2016-06-21/1202378254.PDF
610,2016-06-28,三诺生物：重大资产重组进展公告,finalpage/2016-06-28/1202418233.PDF
611,2016-07-02,三诺生物：关于注销募集资金专户的公告,finalpage/2016-07-02/1202444930.PDF
612,2016-07-05,三诺生物：重大资产重组进展公告,finalpage/2016-07-05/1202448713.PDF
613,2016-07-06,三诺生物：2016年第一次临时股东大会的法律意见书,finalpage/2016-07-06/1202455551.PDF
614,2016-07-06,三诺生物：2016年第一次临时股东大会决议公告,finalpage/2016-07-06/1202455552.PDF
615,2016-07-07,三诺生物：2016年第二次临时股东大会决议公告,finalpage/2016-07-07/1202459494.PDF
616,2016-07-07,三诺生物：2016年第二次临时股东大会的法律意见书,finalpage/2016-07-07/1202459493.PDF
617,2016-07-09,三诺生物：第二届董事会第三十五次会议决议公告,finalpage/2016-07-09/1202461309.PDF
618,2016-07-09,三诺生物：关于签订《股权转让协议》的公告,finalpage/2016-07-09/1202461310.PDF
619,2016-07-09,三诺生物：《公司章程》修订对照说明,finalpage/2016-07-09/1202461311.PDF
