date,title,url
2013-12-12,正海磁材：关于召开2013年第一次临时股东大会的提示性公告,finalpage/2013-12-12/63371898.PDF
2013-12-17,正海磁材：2013年第一次临时股东大会之律师见证法律意见书,finalpage/2013-12-17/63386933.PDF
2013-12-17,正海磁材：2013年第一次临时股东大会决议公告,finalpage/2013-12-17/63386934.PDF
2014-01-27,正海磁材：2013年度业绩快报,finalpage/2014-01-27/63529914.PDF
2014-02-10,正海磁材：关于公司及相关主体承诺履行情况的公告,finalpage/2014-02-10/63557997.PDF
2014-03-12,正海磁材：关于2013年度利润分配预案征求投资者意见的公告,finalpage/2014-03-12/63669267.PDF
2014-03-25,正海磁材：2013年度内部控制评价报告,finalpage/2014-03-25/63718575.PDF
2014-03-25,正海磁材：关于公司2013年度募集资金存放与使用情况的专项审核报告,finalpage/2014-03-25/63718576.PDF
2014-03-25,正海磁材：关于公司2013年度控股股东及其他关联方占用资金情况的专项说明,finalpage/2014-03-25/63718577.PDF
2014-03-25,正海磁材：2013年度监事会工作报告,finalpage/2014-03-25/63718578.PDF
2014-03-25,正海磁材：2014年第一季度业绩预告,finalpage/2014-03-25/63718579.PDF
2014-03-25,正海磁材：2013年年度报告摘要,finalpage/2014-03-25/63718580.PDF
2014-03-25,正海磁材：2013年年度报告,finalpage/2014-03-25/63718581.PDF
2014-03-25,正海磁材：2013年年度审计报告,finalpage/2014-03-25/63718588.PDF
2014-03-25,正海磁材：二届董事会第七次会议决议公告,finalpage/2014-03-25/63718592.PDF
2014-03-25,正海磁材：关于召开2013年度股东大会的通知,finalpage/2014-03-25/63718594.PDF
2014-03-25,正海磁材：关于披露2013年度报告的提示性公告,finalpage/2014-03-25/63718596.PDF
2014-03-25,正海磁材：二届监事会第七次会议决议公告,finalpage/2014-03-25/63718598.PDF
2014-03-25,正海磁材：光大证券股份有限公司关于公司2013年度内部控制评价报告的核查意见,finalpage/2014-03-25/63718602.PDF
2014-03-25,正海磁材：光大证券股份有限公司关于公司2013年度募集资金存放与使用情况的核查意见,finalpage/2014-03-25/63718605.PDF
2014-03-25,正海磁材：光大证券股份有限公司关于公司募集资金投资项目延期的核查意见,finalpage/2014-03-25/63718608.PDF
2014-03-25,正海磁材：公司章程（2013年10月）,finalpage/2014-03-25/63718613.PDF
2014-03-25,正海磁材：《公司章程》修改对照表,finalpage/2014-03-25/63718615.PDF
2014-03-25,正海磁材：关于举办2013年度网上业绩说明会的公告,finalpage/2014-03-25/63718617.PDF
2014-03-25,正海磁材：关于募集资金投资项目延期的公告,finalpage/2014-03-25/63718620.PDF
2014-03-25,正海磁材：关于募集资金2013年度存放与使用情况的专项报告,finalpage/2014-03-25/63718624.PDF
2014-03-25,正海磁材：独立董事2013年度述职报告（严纯华）,finalpage/2014-03-25/63718625.PDF
2014-03-25,正海磁材：独立董事2013年度述职报告（于希茂）,finalpage/2014-03-25/63718628.PDF
2014-03-25,正海磁材：独立董事2013年度述职报告（金福海）,finalpage/2014-03-25/63718630.PDF
2014-03-25,正海磁材：独立董事对相关事项的独立意见,finalpage/2014-03-25/63718633.PDF
2014-03-25,正海磁材：股东回报规划（2014年-2016年）,finalpage/2014-03-25/63718635.PDF
2014-04-15,正海磁材：2013年度股东大会之律师见证法律意见书,finalpage/2014-04-15/63845889.PDF
2014-04-15,正海磁材：2013年度股东大会决议公告,finalpage/2014-04-15/63845890.PDF
2014-04-15,正海磁材：光大证券股份有限公司关于公司2013年度跟踪报告,finalpage/2014-04-15/63845891.PDF
2014-04-22,正海磁材：关于披露2014年第一季度报告的提示性公告,finalpage/2014-04-22/63882637.PDF
2014-04-22,正海磁材：2014年第一季度报告全文,finalpage/2014-04-22/63882638.PDF
2014-05-06,正海磁材：2013年度权益分派实施公告,finalpage/2014-05-06/63972255.PDF
2014-05-26,正海磁材：重大事项停牌公告,finalpage/2014-05-26/64061357.PDF
2014-05-27,正海磁材：二届监事会第九次会议决议公告,finalpage/2014-05-27/64068974.PDF
2014-05-27,正海磁材：二届董事会第九次会议决议公告,finalpage/2014-05-27/64068975.PDF
2014-05-27,正海磁材：限制性股票激励计划激励对象名单,finalpage/2014-05-27/64068976.PDF
2014-05-27,正海磁材：限制性股票激励计划实施考核管理办法,finalpage/2014-05-27/64068977.PDF
2014-05-27,正海磁材：限制性股票激励计划（草案）,finalpage/2014-05-27/64068978.PDF
2014-05-27,正海磁材：限制性股票激励计划（草案）摘要,finalpage/2014-05-27/64068979.PDF
2014-05-27,正海磁材：独立董事关于公司限制性股票激励计划（草案）的独立意见,finalpage/2014-05-27/64068982.PDF
2014-05-27,正海磁材：关于股票复牌的公告,finalpage/2014-05-27/64068983.PDF
2014-05-28,正海磁材：光大证券股份有限公司关于公司部分限售股份上市流通的核查意见,finalpage/2014-05-28/64078091.PDF
2014-05-28,正海磁材：首次公开发行前已发行股份上市流通提示性公告,finalpage/2014-05-28/64078092.PDF
2014-06-05,正海磁材：关于控股股东部分股权质押的公告,finalpage/2014-06-05/64105989.PDF
2014-07-04,正海磁材：二届董事会第十次会议决议公告,finalpage/2014-07-04/1200029456.PDF
2014-07-04,正海磁材：拟在德国设立全资子公司的公告,finalpage/2014-07-04/1200029457.PDF
2014-07-04,正海磁材：拟在德国设立全资子公司项目可行性研究报告,finalpage/2014-07-04/1200029458.PDF
2014-07-10,正海磁材：关于限制性股票激励计划获得中国证监会备案无异议的公告,finalpage/2014-07-10/1200045325.PDF
2014-07-14,正海磁材：2014年半年度业绩预告,finalpage/2014-07-14/1200053311.PDF
2014-07-16,正海磁材：上海荣正投资咨询有限公司关于公司限制性股票激励计划（草案修订稿）之独立财务顾问报告,finalpage/2014-07-16/1200056857.PDF
2014-07-16,正海磁材：二届监事会第十次会议决议公告,finalpage/2014-07-16/1200056858.PDF
2014-07-16,正海磁材：二届董事会第十一次会议决议公告,finalpage/2014-07-16/1200056859.PDF
2014-07-16,正海磁材：关于召开2014年第一次临时股东大会的通知,finalpage/2014-07-16/1200056860.PDF
2014-07-16,正海磁材：北京大成（上海）律师事务所关于公司限制性股票激励计划（草案修订稿）法律意见书,finalpage/2014-07-16/1200056861.PDF
2014-07-16,正海磁材：限制性股票激励计划激励对象名单,finalpage/2014-07-16/1200056862.PDF
2014-07-16,正海磁材：独立董事公开征集委托投票权报告书,finalpage/2014-07-16/1200056863.PDF
2014-07-16,正海磁材：独立董事关于公司限制性股票激励计划（草案修订稿）的独立意见,finalpage/2014-07-16/1200056864.PDF
2014-07-16,正海磁材：限制性股票激励计划（草案修订稿）,finalpage/2014-07-16/1200056865.PDF
2014-07-16,正海磁材：限制性股票激励计划（草案修订稿）摘要,finalpage/2014-07-16/1200056866.PDF
2014-07-21,正海磁材：重大事项停牌公告,finalpage/2014-07-21/1200064968.PDF
2014-07-25,正海磁材：重大事项停牌进展公告,finalpage/2014-07-25/1200078883.PDF
2014-07-31,正海磁材：关于召开2014年第一次临时股东大会的提示性公告,finalpage/2014-07-31/1200091925.PDF
2014-08-01,正海磁材：重大事项停牌进展公告,finalpage/2014-08-01/1200095521.PDF
2014-08-04,正海磁材：2014年第一次临时股东大会之律师见证法律意见书,finalpage/2014-08-04/1200098136.PDF
2014-08-04,正海磁材：2014年第一次临时股东大会决议公告,finalpage/2014-08-04/1200098137.PDF
2014-08-11,正海磁材：关于发行股份购买资产的停牌公告,finalpage/2014-08-11/1200112942.PDF
2014-08-18,正海磁材：关于发行股份购买资产事项的进展公告,finalpage/2014-08-18/1200132592.PDF
2014-08-19,正海磁材：2014年半年度募集资金存放与使用情况的专项报告,finalpage/2014-08-19/1200135730.PDF
2014-08-19,正海磁材：2014年半年度报告摘要,finalpage/2014-08-19/1200135731.PDF
2014-08-19,正海磁材：二届董事会第十二次会议决议公告,finalpage/2014-08-19/1200135733.PDF
2014-08-19,正海磁材：关于披露2014年半年度报告的提示性公告,finalpage/2014-08-19/1200135734.PDF
2014-08-19,正海磁材：二届监事会第十一次会议决议公告,finalpage/2014-08-19/1200135735.PDF
2014-08-19,正海磁材：2014年半年度报告,finalpage/2014-08-19/1200135736.PDF
2014-08-19,正海磁材：光大证券股份有限公司关于公司变更募集资金专户的核查意见,finalpage/2014-08-19/1200135737.PDF
2014-08-19,正海磁材：关于变更募集资金专户的公告,finalpage/2014-08-19/1200135738.PDF
2014-08-19,正海磁材：独立董事对相关事项的独立意见,finalpage/2014-08-19/1200135739.PDF
2014-08-25,正海磁材：关于控股股东部分股权质押的公告,finalpage/2014-08-25/1200165386.PDF
2014-08-25,正海磁材：关于发行股份购买资产事项的进展公告,finalpage/2014-08-25/1200154242.PDF
2014-08-29,正海磁材：光大证券股份有限公司关于公司2014年半年报持续督导期间跟踪报告,finalpage/2014-08-29/1200188726.PDF
2014-09-01,正海磁材：关于发行股份购买资产事项的进展公告,finalpage/2014-09-01/1200188738.PDF
2014-09-06,正海磁材：关于发行股份购买资产事项进展暨延期复牌的公告,finalpage/2014-09-06/1200208988.PDF
2014-09-15,正海磁材：关于签订募集资金三方监管协议的公告,finalpage/2014-09-15/1200236352.PDF
2014-09-16,正海磁材：关于发行股份购买资产事项的进展公告,finalpage/2014-09-16/1200236338.PDF
2014-09-23,正海磁材：关于发行股份购买资产事项的进展公告,finalpage/2014-09-23/1200251526.PDF
2014-09-30,正海磁材：关于发行股份购买资产事项的进展公告,finalpage/2014-09-30/1200273750.PDF
2014-10-08,正海磁材：关于发行股份购买资产事项进展暨延期复牌的公告,finalpage/2014-10-08/1200278968.PDF
2014-10-09,正海磁材：关于签订募集资金三方监管协议的公告,finalpage/2014-10-09/1200285073.PDF
2014-10-14,正海磁材：2014年前三季度业绩预告,finalpage/2014-10-14/1200298641.PDF
2014-10-14,正海磁材：关于发行股份购买资产事项的进展公告,finalpage/2014-10-14/1200294903.PDF
2014-10-17,正海磁材：中信建投证券股份有限公司关于公司发行股份及支付现金购买资产并募集配套资金预案之核查意见书,finalpage/2014-10-17/1200306732.PDF
2014-10-17,正海磁材：中信建投证券股份有限公司关于公司本次交易产业政策和交易类型之独立财务顾问核查意见,finalpage/2014-10-17/1200306733.PDF
2014-10-17,正海磁材：二届监事会第十二次会议决议公告,finalpage/2014-10-17/1200306734.PDF
2014-10-17,正海磁材：二届董事会第十三次会议决议公告,finalpage/2014-10-17/1200306735.PDF
2014-10-17,正海磁材：关于提供资料真实、准确和完整的承诺函,finalpage/2014-10-17/1200306736.PDF
2014-10-17,正海磁材：关于重大资产重组的一般风险提示暨复牌公告,finalpage/2014-10-17/1200306737.PDF
2014-10-17,正海磁材：发行股份及支付现金购买资产并募集配套资金预案,finalpage/2014-10-17/1200306738.PDF
2014-10-17,正海磁材：独立董事关于公司发行股份及支付现金购买资产并募集配套资金事项的事前认可意见,finalpage/2014-10-17/1200306739.PDF
2014-10-17,正海磁材：独立董事关于公司发行股份及支付现金购买资产并募集配套资金事项的独立意见,finalpage/2014-10-17/1200306740.PDF
2014-10-17,正海磁材：董事会关于公司股票价格波动是否达到《关于规范上市公司信息披露及相关各方行为的通知》（证监公司字[2007]128号）第五条相关标准的说明,finalpage/2014-10-17/1200306741.PDF
2014-10-17,正海磁材：董事会关于重组履行法定程序的完备性、合规性及提交的法律文件的有效性的说明,finalpage/2014-10-17/1200306742.PDF
2014-10-17,正海磁材：关于披露2014年第三季度报告的提示性公告,finalpage/2014-10-17/1200306749.PDF
2014-10-17,正海磁材：2014年第三季度报告全文,finalpage/2014-10-17/1200306750.PDF
2014-10-23,正海磁材：上海大郡动力控制技术有限公司审计报告,finalpage/2014-10-23/1200320714.PDF
2014-10-23,正海磁材：上海大郡动力控制技术有限公司盈利预测审核报告,finalpage/2014-10-23/1200320715.PDF
2014-10-23,正海磁材：拟收购股权事宜涉及的上海大郡动力控制技术有限公司股东全部权益价值项目资产评估报告,finalpage/2014-10-23/1200320716.PDF
2014-10-23,正海磁材：拟收购股权事宜涉及的上海大郡动力控制技术有限公司股东全部权益价值项目资产评估说明,finalpage/2014-10-23/1200320717.PDF
2014-10-23,正海磁材：中信建投证券股份有限公司关于公司发行股份及支付现金购买资产并募集配套资金事项之独立财务顾问声明,finalpage/2014-10-23/1200320718.PDF
2014-10-23,正海磁材：中信建投证券股份有限公司关于公司发行股份及支付现金购买资产并募集配套资金之独立财务顾问报告,finalpage/2014-10-23/1200320719.PDF
2014-10-23,正海磁材：二届监事会第十三次会议决议公告,finalpage/2014-10-23/1200320720.PDF
2014-10-23,正海磁材：二届董事会第十四次会议决议公告,finalpage/2014-10-23/1200320721.PDF
2014-10-23,正海磁材：发行股份及支付现金购买资产并募集配套资金报告书与预案差异对比表,finalpage/2014-10-23/1200320722.PDF
2014-10-23,正海磁材：关于召开2014年第二次临时股东大会的通知,finalpage/2014-10-23/1200320723.PDF
2014-10-23,正海磁材：公司与上海大郡动力控制技术有限公司股东发行股份及支付现金购买资产的利润补偿协议,finalpage/2014-10-23/1200320724.PDF
2014-10-23,正海磁材：北京市金杜律师事务所关于公司发行股份及支付现金购买资产并募集配套资金之法律意见书,finalpage/2014-10-23/1200320725.PDF
2014-10-23,正海磁材：公司与上海大郡动力控制技术有限公司股东发行股份及支付现金购买资产协议,finalpage/2014-10-23/1200320726.PDF
2014-10-23,正海磁材：发行股份及支付现金购买资产并募集配套资金报告书（草案）,finalpage/2014-10-23/1200320727.PDF
2014-10-23,正海磁材：发行股份及支付现金购买资产并募集配套资金报告书（草案）摘要,finalpage/2014-10-23/1200320728.PDF
2014-10-23,正海磁材：备考合并盈利预测审核报告,finalpage/2014-10-23/1200320729.PDF
2014-10-23,正海磁材：独立董事关于公司发行股份及支付现金购买资产并募集配套资金事项的事前认可意见,finalpage/2014-10-23/1200320730.PDF
2014-10-23,正海磁材：独立董事关于公司发行股份及支付现金购买资产并募集配套资金事项的独立意见,finalpage/2014-10-23/1200320731.PDF
2014-10-23,正海磁材：公司与明绚新能源技术（上海）有限公司关于发行股份及支付现金购买资产协议之补充协议（一）,finalpage/2014-10-23/1200320732.PDF
2014-10-29,正海磁材：关于与中信证券股份有限公司签署《市值管理服务战略合作协议》的公告,finalpage/2014-10-29/1200351949.PDF
2014-10-29,正海磁材：关于控股股东股份减持计划的公告,finalpage/2014-10-29/1200351950.PDF
2014-11-05,正海磁材：关于召开2014年第二次临时股东大会的提示性公告,finalpage/2014-11-05/1200369807.PDF
2014-11-07,正海磁材：2014年第二次临时股东大会决议公告,finalpage/2014-11-07/1200378467.PDF
2014-11-07,正海磁材：2014年第二次临时股东大会的法律意见书,finalpage/2014-11-07/1200378468.PDF
2014-11-18,正海磁材：关于收到《中国证监会行政许可申请受理通知书》的公告,finalpage/2014-11-18/1200401283.PDF
2014-11-24,正海磁材：关于中国证监会上市公司并购重组审核委员会审核公司发行股份及支付现金购买资产并募集配套资金事项的停牌公告,finalpage/2014-11-24/1200409719.PDF
2014-11-28,正海磁材：关于中国证监会上市公司并购重组审核委员会审核公司发行股份及支付现金购买资产并募集配套资金事项的停牌进展公告,finalpage/2014-11-28/1200425073.PDF
2014-12-08,正海磁材：关于中国证监会上市公司并购重组审核委员会审核公司发行股份及支付现金购买资产并募集配套资金事项的停牌进展公告,finalpage/2014-12-08/1200449090.PDF
2014-12-10,正海磁材：关于公司发行股份及支付现金购买资产并募集配套资金事项获得中国证监会上市公司并购重组审核委员会审核通过暨公司股票复牌公告,finalpage/2014-12-10/1200454333.PDF
2014-12-15,正海磁材：关于控股股东减持股份的公告,finalpage/2014-12-15/1200467688.PDF
2014-12-15,正海磁材：简式权益变动报告书,finalpage/2014-12-15/1200467689.PDF
2014-12-18,正海磁材：光大证券股份有限公司关于公司使用部分超募资金永久性补充流动资金的核查意见,finalpage/2014-12-18/1200475767.PDF
2014-12-18,正海磁材：关于使用部分超募资金永久性补充流动资金的公告,finalpage/2014-12-18/1200475768.PDF
2014-12-18,正海磁材：独立董事关于使用部分超募资金永久性补充流动资金的独立意见,finalpage/2014-12-18/1200475769.PDF
2014-12-18,正海磁材：关于召开2015年第一次临时股东大会的通知,finalpage/2014-12-18/1200475770.PDF
2014-12-18,正海磁材：二届监事会第十四次会议决议公告,finalpage/2014-12-18/1200475765.PDF
2014-12-18,正海磁材：二届董事会第十五次会议决议公告,finalpage/2014-12-18/1200475766.PDF
2014-12-19,正海磁材：关于控股股东减持股份的公告,finalpage/2014-12-19/1200479305.PDF
2014-12-19,正海磁材：简式权益变动报告书,finalpage/2014-12-19/1200479306.PDF
2014-12-30,正海磁材：关于2014年度利润分配预案的预披露公告,finalpage/2014-12-30/1200507175.PDF
2015-01-05,正海磁材：2015年第一次临时股东大会之律师见证法律意见书,finalpage/2015-01-05/1200521245.PDF
2015-01-05,正海磁材：2015年第一次临时股东大会决议公告,finalpage/2015-01-05/1200521246.PDF
2015-01-12,正海磁材：对外投资进展公告,finalpage/2015-01-12/1200539033.PDF
2015-01-20,正海磁材：发行股份及支付现金购买资产并募集配套资金报告书（修订稿）摘要,finalpage/2015-01-20/1200562342.PDF
2015-01-20,正海磁材：发行股份及支付现金购买资产并募集配套资金报告书（修订稿）,finalpage/2015-01-20/1200562341.PDF
2015-01-20,正海磁材：北京市金杜律师事务所关于公司发行股份及支付现金购买资产并募集配套资金的补充法律意见书,finalpage/2015-01-20/1200562340.PDF
2015-01-20,正海磁材：中信建投证券股份有限公司关于公司发行股份及支付现金购买资产并募集配套资金之独立财务顾问报告,finalpage/2015-01-20/1200562337.PDF
2015-01-20,正海磁材：关于公司发行股份及支付现金购买资产并募集配套资金事项获得中国证监会正式批复的公告,finalpage/2015-01-20/1200562338.PDF
2015-01-20,正海磁材：关于发行股份及支付现金购买资产并募集配套资金报告书的修订说明公告,finalpage/2015-01-20/1200562339.PDF
2015-01-28,正海磁材：二届监事会第十五次会议决议公告,finalpage/2015-01-28/1200586789.PDF
2015-01-28,正海磁材：二届董事会第十六次会议决议公告,finalpage/2015-01-28/1200586790.PDF
2015-01-28,正海磁材：光大证券股份有限公司关于公司使用部分闲置资金购买银行理财产品的核查意见,finalpage/2015-01-28/1200586791.PDF
2015-01-28,正海磁材：关于使用闲置资金购买银行理财产品的公告,finalpage/2015-01-28/1200586792.PDF
2015-01-28,正海磁材：委托理财管理制度（2015年1月）,finalpage/2015-01-28/1200586793.PDF
2015-01-28,正海磁材：独立董事关于使用闲置资金购买银行理财产品的独立意见,finalpage/2015-01-28/1200586794.PDF
2015-01-30,正海磁材：2014年年度业绩预告,finalpage/2015-01-30/1200590586.PDF
2015-02-27,正海磁材：2014年度业绩快报,finalpage/2015-02-27/1200652920.PDF
2015-03-18,正海磁材：中信建投证券股份有限公司关于公司发行股份及支付现金购买资产并募集配套资金标的资产过户情况之核查意见,finalpage/2015-03-18/1200710345.PDF
2015-03-18,正海磁材：发行股份及支付现金购买资产并募集配套资金事项之标的资产过户完成的公告,finalpage/2015-03-18/1200710346.PDF
2015-03-18,正海磁材：北京市金杜律师事务所关于公司发行股份及支付现金购买资产资产过户的法律意见书,finalpage/2015-03-18/1200710347.PDF
2015-03-30,正海磁材：关于公司通过高新技术企业重新认定的公告,finalpage/2015-03-30/1200764634.PDF
2015-04-07,正海磁材：内部控制审计报告,finalpage/2015-04-07/1200788246.PDF
2015-04-07,正海磁材：2014年度内部控制评价报告,finalpage/2015-04-07/1200788247.PDF
2015-04-07,正海磁材：关于公司2014年度募集资金存放与使用情况的专项审核报告,finalpage/2015-04-07/1200788248.PDF
2015-04-07,正海磁材：2014年度募集资金存放与使用情况的专项报告,finalpage/2015-04-07/1200788249.PDF
2015-04-07,正海磁材：2014年年度审计报告,finalpage/2015-04-07/1200788250.PDF
2015-04-07,正海磁材：2014年度控股股东及其他关联方占用资金情况的专项说明,finalpage/2015-04-07/1200788251.PDF
2015-04-07,正海磁材：2014年度监事会工作报告,finalpage/2015-04-07/1200788252.PDF
2015-04-07,正海磁材：2015年第一季度业绩预告,finalpage/2015-04-07/1200788253.PDF
2015-04-07,正海磁材：2014年年度报告摘要,finalpage/2015-04-07/1200788254.PDF
2015-04-07,正海磁材：财务报告,finalpage/2015-04-07/1200788256.PDF
2015-04-07,正海磁材：二届董事会第十七次会议决议公告,finalpage/2015-04-07/1200788257.PDF
2015-04-07,正海磁材：关于披露2014年度报告的提示性公告,finalpage/2015-04-07/1200788258.PDF
2015-04-07,正海磁材：二届监事会第十六次会议决议公告,finalpage/2015-04-07/1200788259.PDF
2015-04-07,正海磁材：2014年年度报告,finalpage/2015-04-07/1200788260.PDF
2015-04-07,正海磁材：光大证券股份有限公司关于公司2014年度内部控制评价报告的核查意见,finalpage/2015-04-07/1200788261.PDF
2015-04-07,正海磁材：光大证券股份有限公司关于公司2014年度募集资金存放与使用情况的核查意见,finalpage/2015-04-07/1200788262.PDF
2015-04-07,正海磁材：公司章程（2015年4月）,finalpage/2015-04-07/1200788263.PDF
2015-04-07,正海磁材：公司章程修订对照表,finalpage/2015-04-07/1200788264.PDF
2015-04-07,正海磁材：关于举办2014年度网上业绩说明会的公告,finalpage/2015-04-07/1200788265.PDF
2015-04-07,正海磁材：关于会计政策变更的公告,finalpage/2015-04-07/1200788266.PDF
2015-04-07,正海磁材：关于召开2014年度股东大会的通知,finalpage/2015-04-07/1200788267.PDF
2015-04-07,正海磁材：独立董事2014年度述职报告（严纯华）,finalpage/2015-04-07/1200788268.PDF
2015-04-07,正海磁材：独立董事2014年度述职报告（于希茂）,finalpage/2015-04-07/1200788269.PDF
2015-04-07,正海磁材：独立董事2014年度述职报告（金福海）,finalpage/2015-04-07/1200788270.PDF
2015-04-07,正海磁材：独立董事对相关事项的独立意见,finalpage/2015-04-07/1200788271.PDF
2015-04-07,正海磁材：股东大会议事规则（2015年4月）,finalpage/2015-04-07/1200788272.PDF
2015-04-07,正海磁材：《股东大会议事规则》修订对照表,finalpage/2015-04-07/1200788273.PDF
2015-04-08,正海磁材：中信建投证券股份有限公司关于公司发行股份及支付现金购买资产并募集配套资金之非公开发行股票发行过程和认购对象合规性的审核报告,finalpage/2015-04-08/1200799223.PDF
2015-04-08,正海磁材：中信建投证券股份有限公司关于公司发行股份及支付现金购买资产并募集配套资金实施情况之核查意见,finalpage/2015-04-08/1200799224.PDF
2015-04-08,正海磁材：北京市金杜律师事务所关于公司发行股份及支付现金购买资产并募集配套资金之募集配套资金非公开发行股票发行过程和认购对象合规性的法律意见书,finalpage/2015-04-08/1200799225.PDF
2015-04-08,正海磁材：北京市金杜律师事务所关于公司发行股份及支付现金购买资产并募集配套资金实施结果的法律意见书,finalpage/2015-04-08/1200799226.PDF
2015-04-08,正海磁材：关于发行股份购买资产相关承诺的说明,finalpage/2015-04-08/1200799227.PDF
2015-04-08,正海磁材：发行股份及支付现金购买资产并募集配套资金实施情况暨新增股份上市报告书,finalpage/2015-04-08/1200799228.PDF
2015-04-08,正海磁材：发行股份及支付现金购买资产并募集配套资金实施情况暨新增股份上市报告书（摘要）,finalpage/2015-04-08/1200799229.PDF
2015-04-13,正海磁材：关于签订募集资金三方监管协议的公告,finalpage/2015-04-13/1200826139.PDF
