,date,title,url
620,2016-07-11,三诺生物：关于签订《股权转让协议》的补充更正公告,finalpage/2016-07-11/1202463427.PDF
621,2016-07-12,三诺生物：重大资产重组进展公告,finalpage/2016-07-12/1202465434.PDF
622,2016-07-15,三诺生物：关于披露重大资产重组预案暨公司股票暂不复牌的提示性公告,finalpage/2016-07-15/1202475532.PDF
623,2016-07-15,三诺生物：关于重大资产重组的一般风险提示公告,finalpage/2016-07-15/1202475533.PDF
624,2016-07-15,三诺生物：创业板上市公司重大资产重组方案首次披露对照表,finalpage/2016-07-15/1202475534.PDF
625,2016-07-15,三诺生物：董事会关于本次重组履行法定程序的完备性、合规性及提交法律文件的有效性说明,finalpage/2016-07-15/1202475535.PDF
626,2016-07-15,三诺生物：关于本次重大资产重组不存在内幕交易行为的说明,finalpage/2016-07-15/1202475536.PDF
627,2016-07-15,三诺生物：董事会关于公司股票价格波动是否达到《关于规范上市公司信息披露及相关各方行为的通知》（证监公司字[2007]128号）第五条相关标准的说明,finalpage/2016-07-15/1202475537.PDF
628,2016-07-15,三诺生物：全体董事、高级管理人员关于公司填补发行股票购买资产摊薄即期回报采取措施的承诺函,finalpage/2016-07-15/1202475538.PDF
629,2016-07-15,三诺生物：控股股东、实际控制人关于公司发行股票摊薄即期回报采取填补措施的承诺函,finalpage/2016-07-15/1202475539.PDF
630,2016-07-15,三诺生物：全体董事、监事及高级管理人员关于所提供信息真实性、准确性和完整性的承诺函,finalpage/2016-07-15/1202475540.PDF
631,2016-07-15,三诺生物：关于重大资产重组事宜采取的保密措施及保密制度的说明,finalpage/2016-07-15/1202475541.PDF
632,2016-07-15,三诺生物：中信证券股份有限公司关于公司发行股份购买资产暨关联交易预案之独立财务顾问核查意见,finalpage/2016-07-15/1202475542.PDF
633,2016-07-15,三诺生物：上市公司并购重组财务顾问专业意见附表第2号——重大资产重组,finalpage/2016-07-15/1202475543.PDF
634,2016-07-15,三诺生物：中信证券股份有限公司关于公司本次重大资产重组产业政策和交易类型之独立财务顾问核查意见,finalpage/2016-07-15/1202475544.PDF
635,2016-07-15,三诺生物：中信证券股份有限公司关于公司重大资产重组独立财务顾问工作的承诺函,finalpage/2016-07-15/1202475545.PDF
636,2016-07-15,三诺生物：第二届董事会第三十六次会议决议公告,finalpage/2016-07-15/1202475546.PDF
637,2016-07-15,三诺生物：第二届监事会第二十五次会议决议公告,finalpage/2016-07-15/1202475547.PDF
638,2016-07-15,三诺生物：承诺函,finalpage/2016-07-15/1202475548.PDF
639,2016-07-15,三诺生物：2016年半年度业绩预告,finalpage/2016-07-15/1202475549.PDF
640,2016-07-15,三诺生物：发行股份购买资产暨关联交易预案,finalpage/2016-07-15/1202475550.PDF
641,2016-07-15,三诺生物：独立董事关于本次发行股份购买资产暨关联交易事宜的独立意见,finalpage/2016-07-15/1202475551.PDF
642,2016-07-15,三诺生物：关联交易事项独立董事事前认可函,finalpage/2016-07-15/1202475552.PDF
643,2016-07-15,三诺生物：重组预案独立财务顾问核查意见表,finalpage/2016-07-15/1202475553.PDF
644,2016-07-15,三诺生物：创业板上市公司重大资产重组方案首次披露对照表,finalpage/2016-07-15/1202475554.PDF
645,2016-07-19,三诺生物：重大资产重组进展公告,finalpage/2016-07-19/1202480181.PDF
646,2016-07-22,三诺生物：关于完成工商变更登记的公告,finalpage/2016-07-22/1202496795.PDF
647,2016-07-22,三诺生物：关于对外投资的进展公告,finalpage/2016-07-22/1202496796.PDF
648,2016-07-26,三诺生物：重大资产重组进展公告,finalpage/2016-07-26/1202502531.PDF
649,2016-08-02,三诺生物：重大资产重组进展公告,finalpage/2016-08-02/1202524550.PDF
650,2016-08-04,三诺生物：关于公司股票复牌的提示性公告,finalpage/2016-08-04/1202534591.PDF
651,2016-08-04,三诺生物：中信证券股份有限公司关于深圳证券交易所《关于对三诺生物传感股份有限公司的重组问询函》的回复,finalpage/2016-08-04/1202534592.PDF
652,2016-08-04,三诺生物：中信证券股份有限公司关于公司发行股份购买资产暨关联交易预案之独立财务顾问核查意见,finalpage/2016-08-04/1202534593.PDF
653,2016-08-04,三诺生物：发行股份购买资产暨关联交易预案（修订稿）,finalpage/2016-08-04/1202534594.PDF
654,2016-08-04,三诺生物：发行股份购买资产暨关联交易预案修订说明公告,finalpage/2016-08-04/1202534595.PDF
655,2016-08-04,三诺生物：北京国枫律师事务所关于公司发行股份购买资产暨关联交易的专项核查意见,finalpage/2016-08-04/1202534596.PDF
656,2016-08-04,三诺生物：关于深圳证券交易所《关于对三诺生物传感股份有限公司的重组问询函》的回复,finalpage/2016-08-04/1202534597.PDF
657,2016-08-06,三诺生物：关于获得政府补助的公告,finalpage/2016-08-06/1202540744.PDF
658,2016-08-25,三诺生物：2016年半年度报告披露提示性公告,finalpage/2016-08-25/1202613329.PDF
659,2016-08-25,三诺生物：2016年半年度报告摘要,finalpage/2016-08-25/1202613330.PDF
660,2016-08-25,三诺生物：第二届董事会第三十七次会议决议公告,finalpage/2016-08-25/1202613332.PDF
661,2016-08-25,三诺生物：第二届监事会第二十六次会议决议公告,finalpage/2016-08-25/1202613333.PDF
662,2016-08-25,三诺生物：2016年半年度报告,finalpage/2016-08-25/1202613334.PDF
663,2016-08-25,三诺生物：独立董事关于第二届董事会第三十七次会议相关事项的独立意见,finalpage/2016-08-25/1202613335.PDF
664,2016-09-24,三诺生物：第二届董事会第三十八次会议（现场+通讯）决议公告,finalpage/2016-09-24/1202723200.PDF
665,2016-09-24,三诺生物：第二届监事会第二十七次会议决议公告,finalpage/2016-09-24/1202723201.PDF
666,2016-09-24,三诺生物：独立董事关于第二届董事会第三十八次会议相关事项的独立意见,finalpage/2016-09-24/1202723202.PDF
667,2016-09-24,三诺生物：关于使用自有闲置资金购买低风险银行理财产品的公告,finalpage/2016-09-24/1202723203.PDF
668,2016-09-24,三诺生物：关于第二届董事会、监事会延期换届选举的公告,finalpage/2016-09-24/1202723204.PDF
669,2016-10-10,三诺生物：重大资产重组进展公告,finalpage/2016-10-10/1202745916.PDF
670,2016-10-15,三诺生物：2016年前三季度业绩预告,finalpage/2016-10-15/1202760539.PDF
671,2016-10-19,三诺生物：第二届董事会第三十九次会议（现场+通讯）决议公告,finalpage/2016-10-19/1202768331.PDF
672,2016-10-19,三诺生物：第二届监事会第二十八次会议决议公告,finalpage/2016-10-19/1202768332.PDF
673,2016-10-19,三诺生物：独立董事关于第二届董事会第三十九次会议相关事项的独立意见,finalpage/2016-10-19/1202768333.PDF
674,2016-10-19,三诺生物：关于延长控股股东在收购Trividia后续事项中承诺期限的公告,finalpage/2016-10-19/1202768334.PDF
675,2016-10-19,三诺生物：关于终止重大资产重组事项召开投资者说明会的提示性公告,finalpage/2016-10-19/1202768335.PDF
676,2016-10-19,三诺生物：中信证券股份有限公司关于公司终止筹划重大资产重组事项的专项核查意见,finalpage/2016-10-19/1202768336.PDF
677,2016-10-19,三诺生物：关于终止重大资产重组事项的公告,finalpage/2016-10-19/1202768337.PDF
678,2016-10-19,三诺生物：关于召开2016年第三次临时股东大会的通知,finalpage/2016-10-19/1202768338.PDF
679,2016-10-28,三诺生物：2016年第三季度报告披露提示性公告,finalpage/2016-10-28/1202795591.PDF
680,2016-10-28,三诺生物：2016年第三季度报告全文,finalpage/2016-10-28/1202795593.PDF
681,2016-10-28,三诺生物：第二届董事会第四十次会议（现场+通讯）决议公告,finalpage/2016-10-28/1202795594.PDF
682,2016-10-28,三诺生物：第二届监事会第二十九次会议决议公告,finalpage/2016-10-28/1202795595.PDF
683,2016-10-29,三诺生物：关于参加2016年度投资者网上接待日活动的公告,finalpage/2016-10-29/1202800878.PDF
684,2016-10-29,三诺生物：关于控股股东、实际控制人减持公司股份的提示性公告,finalpage/2016-10-29/1202802284.PDF
685,2016-11-10,三诺生物：2016年第三次临时股东大会决议公告,finalpage/2016-11-10/1202823096.PDF
686,2016-11-10,三诺生物：2016年第三次临时股东大会的法律意见书,finalpage/2016-11-10/1202823097.PDF
687,2016-11-19,三诺生物：关于完成工商变更登记的公告,finalpage/2016-11-19/1202835087.PDF
688,2016-11-24,三诺生物：关于监事会换届选举的提示性公告,finalpage/2016-11-24/1202842893.PDF
689,2016-11-24,三诺生物：关于董事会换届选举的提示性公告,finalpage/2016-11-24/1202842894.PDF
690,2016-12-03,三诺生物：独立董事关于第二届董事会第四十一次会议相关事项的独立意见,finalpage/2016-12-03/1202856080.PDF
691,2016-12-03,三诺生物：第二届监事会第三十次会议决议公告,finalpage/2016-12-03/1202856081.PDF
692,2016-12-03,三诺生物：独立董事提名人声明（一）,finalpage/2016-12-03/1202856082.PDF
693,2016-12-03,三诺生物：独立董事提名人声明（二）,finalpage/2016-12-03/1202856083.PDF
694,2016-12-03,三诺生物：独立董事提名人声明（三）,finalpage/2016-12-03/1202856084.PDF
695,2016-12-03,三诺生物：关于拟续聘会计师事务所的公告,finalpage/2016-12-03/1202856085.PDF
696,2016-12-03,三诺生物：《公司章程》修订对照说明,finalpage/2016-12-03/1202856086.PDF
697,2016-12-03,三诺生物：独立董事候选人声明（纪立农）,finalpage/2016-12-03/1202856087.PDF
698,2016-12-03,三诺生物：独立董事候选人声明（李永国）,finalpage/2016-12-03/1202856088.PDF
699,2016-12-03,三诺生物：独立董事候选人声明（何斌辉）,finalpage/2016-12-03/1202856089.PDF
700,2016-12-03,三诺生物：第二届董事会第四十一次会议决议公告,finalpage/2016-12-03/1202856090.PDF
701,2016-12-03,三诺生物：关于召开2016年第四次临时股东大会的通知,finalpage/2016-12-03/1202856091.PDF
702,2016-12-06,三诺生物：关于实际控制人减持股份的公告,finalpage/2016-12-06/1202859514.PDF
703,2016-12-10,三诺生物：关于实际控制人减持股份的公告,finalpage/2016-12-10/1202867820.PDF
704,2016-12-15,三诺生物：关于召开2016年第四次临时股东大会的提示性公告,finalpage/2016-12-15/1202874580.PDF
705,2016-12-23,三诺生物：2016年第四次临时股东大会的法律意见书,finalpage/2016-12-23/1202955093.PDF
706,2016-12-23,三诺生物：2016年第四次临时股东大会决议公告,finalpage/2016-12-23/1202955094.PDF
707,2016-12-23,三诺生物：关于选举第三届监事会职工代表监事的公告,finalpage/2016-12-23/1202939506.PDF
708,2016-12-26,三诺生物：独立董事关于第三届董事会第一次会议相关事项的独立意见,finalpage/2016-12-26/1202958003.PDF
709,2016-12-26,三诺生物：第三届监事会第一次会议决议公告,finalpage/2016-12-26/1202958004.PDF
710,2016-12-26,三诺生物：第三届董事会第一次会议决议公告,finalpage/2016-12-26/1202958005.PDF
711,2016-12-27,三诺生物：关于实际控制人减持股份的公告,finalpage/2016-12-27/1202964541.PDF
712,2016-12-27,三诺生物：简式权益变动报告书,finalpage/2016-12-27/1202964542.PDF
713,2017-01-03,三诺生物：关于实际控制人减持股份的公告,finalpage/2017-01-03/1202986791.PDF
714,2017-01-07,三诺生物：关于控股股东、实际控制人减持公司股份的提示性公告,finalpage/2017-01-07/1202997615.PDF
715,2017-01-10,三诺生物：关于完成工商变更登记的公告,finalpage/2017-01-10/1203000996.PDF
716,2017-01-14,三诺生物：关于实际控制人减持股份的公告,finalpage/2017-01-14/1203014592.PDF
717,2017-01-25,三诺生物：2016年度业绩预告,finalpage/2017-01-25/1203050616.PDF
718,2017-01-25,三诺生物：第三届董事会第二次会议决议公告,finalpage/2017-01-25/1203050617.PDF
719,2017-01-25,三诺生物：第三届监事会第二次会议决议公告,finalpage/2017-01-25/1203050618.PDF
720,2017-01-25,三诺生物：独立董事关于第三届董事会第二次会议相关事项的独立意见,finalpage/2017-01-25/1203050619.PDF
721,2017-01-25,三诺生物：第一期员工持股计划（草案）,finalpage/2017-01-25/1203050620.PDF
722,2017-01-25,三诺生物：第一期员工持股计划（草案）摘要,finalpage/2017-01-25/1203050621.PDF
723,2017-01-25,三诺生物：关于召开2017年第一次临时股东大会的通知,finalpage/2017-01-25/1203050622.PDF
724,2017-01-25,三诺生物：第一期员工持股计划管理办法,finalpage/2017-01-25/1203050623.PDF
725,2017-01-25,三诺生物：关于2016年度利润分配预案的预披露公告,finalpage/2017-01-25/1203050624.PDF
726,2017-02-07,三诺生物：关于员工持股计划相关议案审议中关联董事未回避表决的说明公告,finalpage/2017-02-07/1203066149.PDF
727,2017-02-10,三诺生物：2017年第一次临时股东大会决议公告,finalpage/2017-02-10/1203076137.PDF
728,2017-02-10,三诺生物：2017年第一次临时股东大会的法律意见书,finalpage/2017-02-10/1203076138.PDF
729,2017-02-10,三诺生物：北京国枫律师事务所关于公司第一期员工持股计划的法律意见书,finalpage/2017-02-10/1203073146.PDF
730,2017-02-18,三诺生物：2016年度业绩快报,finalpage/2017-02-18/1203091141.PDF
731,2017-02-18,三诺生物：第三届董事会第三次会议决议公告,finalpage/2017-02-18/1203091142.PDF
732,2017-02-18,三诺生物：独立董事关于第三届董事会第三次会议相关事项的独立意见,finalpage/2017-02-18/1203091143.PDF
733,2017-02-18,三诺生物：第一期员工持股计划（草案修订稿）,finalpage/2017-02-18/1203091144.PDF
734,2017-02-18,三诺生物：第一期员工持股计划（草案修订稿）摘要,finalpage/2017-02-18/1203091145.PDF
735,2017-02-18,三诺生物：关于《三诺生物传感股份有限公司第一期员工持股计划（草案修订稿）》的修订说明,finalpage/2017-02-18/1203091146.PDF
736,2017-02-18,三诺生物：第一期员工持股计划管理办法（修订稿）,finalpage/2017-02-18/1203091147.PDF
737,2017-02-18,三诺生物：北京国枫律师事务所关于公司第一期员工持股计划的补充法律意见书之一,finalpage/2017-02-18/1203091148.PDF
738,2017-02-25,三诺生物：关于实际控制人减持股份的公告,finalpage/2017-02-25/1203106669.PDF
739,2017-02-25,三诺生物：简式权益变动报告书,finalpage/2017-02-25/1203106670.PDF
740,2017-03-10,三诺生物：关于第一期员工持股计划实施的进展公告,finalpage/2017-03-10/1203144561.PDF
741,2017-03-31,三诺生物：2016年度报告披露提示性公告,finalpage/2017-03-31/1203235816.PDF
742,2017-03-31,三诺生物：2016年年度报告摘要,finalpage/2017-03-31/1203235817.PDF
743,2017-03-31,三诺生物：2016年年度审计报告,finalpage/2017-03-31/1203235819.PDF
744,2017-03-31,三诺生物：第三届董事会第四次会议决议公告,finalpage/2017-03-31/1203235820.PDF
745,2017-03-31,三诺生物：第三届监事会第三次会议决议公告,finalpage/2017-03-31/1203235821.PDF
746,2017-03-31,三诺生物：2016年年度报告,finalpage/2017-03-31/1203235822.PDF
747,2017-03-31,三诺生物：2016年度财务决算报告,finalpage/2017-03-31/1203235823.PDF
748,2017-03-31,三诺生物：2016年度利润分配预案的公告,finalpage/2017-03-31/1203235824.PDF
749,2017-03-31,三诺生物：关于举行2016年度业绩网上说明会的公告,finalpage/2017-03-31/1203235825.PDF
750,2017-03-31,三诺生物：关于召开2016年度股东大会的通知,finalpage/2017-03-31/1203235826.PDF
751,2017-03-31,三诺生物：2017年第一季度业绩预告,finalpage/2017-03-31/1203235827.PDF
752,2017-03-31,三诺生物：独立董事关于第三届董事会第四次会议相关事项的独立意见,finalpage/2017-03-31/1203235828.PDF
753,2017-03-31,三诺生物：2016年度监事会工作报告,finalpage/2017-03-31/1203235829.PDF
754,2017-03-31,三诺生物：2016年度内部控制自我评价报告,finalpage/2017-03-31/1203235830.PDF
755,2017-03-31,三诺生物：2016年度独立董事（纪立农先生）述职报告,finalpage/2017-03-31/1203235831.PDF
756,2017-03-31,三诺生物：2016年度独立董事（李永国先生）述职报告,finalpage/2017-03-31/1203235832.PDF
757,2017-03-31,三诺生物：2016年度独立董事（唐红女士）述职报告,finalpage/2017-03-31/1203235833.PDF
758,2017-03-31,三诺生物：2016年度独立董事（何斌辉先生）述职报告,finalpage/2017-03-31/1203235834.PDF
759,2017-03-31,三诺生物：2016年度募集资金年度存放与使用情况鉴证报告,finalpage/2017-03-31/1203235835.PDF
760,2017-03-31,三诺生物：2016年度控股股东及其他关联方资金占用情况的专项说明,finalpage/2017-03-31/1203235836.PDF
761,2017-04-08,三诺生物：关于第一期员工持股计划实施的进展公告,finalpage/2017-04-08/1203260653.PDF
762,2017-04-11,三诺生物：第三届董事会第五次会议决议公告,finalpage/2017-04-11/1203274633.PDF
763,2017-04-11,三诺生物：独立董事关于公司第三届董事会第五次会议相关事项的独立意见,finalpage/2017-04-11/1203274634.PDF
764,2017-04-11,三诺生物：第三届监事会第四次会议决议公告,finalpage/2017-04-11/1203274635.PDF
765,2017-04-11,三诺生物：《公司章程》修订对照说明,finalpage/2017-04-11/1203274636.PDF
766,2017-04-11,三诺生物：关于拟回购注销公司股权激励计划全部剩余股票期权与限制性股票的公告,finalpage/2017-04-11/1203274637.PDF
767,2017-04-11,三诺生物：关于回购注销部分限制性股票暨减资的债权人公告,finalpage/2017-04-11/1203274638.PDF
768,2017-04-11,三诺生物：北京国枫律师事务所关于公司股票期权与限制性股票激励计划注销股票期权/回购注销限制性股票与预留部分限制性股票相关事项的法律意见书,finalpage/2017-04-11/1203274639.PDF
769,2017-04-15,三诺生物：关于召开2016年度股东大会的提示性公告,finalpage/2017-04-15/1203298392.PDF
770,2017-04-21,三诺生物：2016年度股东大会的法律意见书,finalpage/2017-04-21/1203357633.PDF
771,2017-04-21,三诺生物：2016年度股东大会决议公告,finalpage/2017-04-21/1203356803.PDF
772,2017-04-21,三诺生物：2017年第一季度报告披露提示性公告,finalpage/2017-04-21/1203343029.PDF
773,2017-04-21,三诺生物：2017年第一季度报告全文,finalpage/2017-04-21/1203343030.PDF
774,2017-04-21,三诺生物：第三届监事会第五次会议决议公告,finalpage/2017-04-21/1203343032.PDF
775,2017-04-21,三诺生物：第三届董事会第六次会议决议公告,finalpage/2017-04-21/1203343033.PDF
776,2017-04-26,三诺生物：关于职工代表监事辞职及补选第三届监事会职工代表监事的公告,finalpage/2017-04-26/1203382039.PDF
777,2017-04-26,三诺生物：关于实际控制人减持股份的公告,finalpage/2017-04-26/1203382040.PDF
778,2017-04-26,三诺生物：关于第一期员工持股计划实施的进展公告,finalpage/2017-04-26/1203382041.PDF
779,2017-05-06,三诺生物：第三届董事会第七次会议决议公告,finalpage/2017-05-06/1203482207.PDF
780,2017-05-06,三诺生物：第三届监事会第六次会议决议公告,finalpage/2017-05-06/1203482208.PDF
781,2017-05-06,三诺生物：2017年限制性股票激励计划（草案）摘要,finalpage/2017-05-06/1203482209.PDF
782,2017-05-06,三诺生物：限制性股票激励计划实施考核管理办法,finalpage/2017-05-06/1203482210.PDF
783,2017-05-06,三诺生物：股权激励计划自查表,finalpage/2017-05-06/1203482211.PDF
784,2017-05-06,三诺生物：关于召开2017年第二次临时股东大会的通知,finalpage/2017-05-06/1203482212.PDF
785,2017-05-06,三诺生物：监事会关于公司2017年限制性股票激励计划激励对象人员名单的核查意见,finalpage/2017-05-06/1203482213.PDF
786,2017-05-06,三诺生物：北京国枫律师事务所关于公司2017年限制性股票激励计划（草案）的法律意见书,finalpage/2017-05-06/1203482214.PDF
787,2017-05-06,三诺生物：独立董事关于第三届董事会第七次会议相关事项的独立意见,finalpage/2017-05-06/1203482215.PDF
788,2017-05-06,三诺生物：2017年限制性股票激励计划（草案）,finalpage/2017-05-06/1203482216.PDF
789,2017-05-06,三诺生物：独立董事公开征集委托投票权报告书,finalpage/2017-05-06/1203482217.PDF
790,2017-05-06,三诺生物：2017年限制性股票激励计划激励对象名单,finalpage/2017-05-06/1203482218.PDF
791,2017-05-09,三诺生物：关于《第三届董事会第七次会议决议》的补充更正公告,finalpage/2017-05-09/1203484734.PDF
792,2017-05-13,三诺生物：2016年年度权益分派实施公告,finalpage/2017-05-13/1203514812.PDF
793,2017-05-17,三诺生物：董事会关于重大资产重组停牌公告,finalpage/2017-05-17/1203525897.PDF
794,2017-05-23,三诺生物：关于召开2017年第二次临时股东大会的提示性公告,finalpage/2017-05-23/1203555604.PDF
795,2017-05-23,三诺生物：监事会关于2017年限制性股票激励计划激励对象人员名单的审核意见及公示情况说明,finalpage/2017-05-23/1203555605.PDF
796,2017-05-24,三诺生物：重大资产重组进展公告,finalpage/2017-05-24/1203559502.PDF
797,2017-05-26,三诺生物：2017年第二次临时股东大会决议公告,finalpage/2017-05-26/1203571872.PDF
798,2017-05-26,三诺生物：2017年第二次临时股东大会的法律意见书,finalpage/2017-05-26/1203571873.PDF
799,2017-05-26,三诺生物：关于2017年限制性股票激励计划内幕信息知情人买卖公司股票情况的自查报告,finalpage/2017-05-26/1203571874.PDF
800,2017-05-26,三诺生物：关于第一期员工持股计划实施的进展公告,finalpage/2017-05-26/1203567572.PDF
801,2017-06-02,三诺生物：重大资产重组进展公告,finalpage/2017-06-02/1203578660.PDF
802,2017-06-03,三诺生物：第三届董事会第八次会议决议公告,finalpage/2017-06-03/1203587731.PDF
803,2017-06-03,三诺生物：关于调整2017年限制性股票激励计划授予限制性股票数量和授予价格的公告,finalpage/2017-06-03/1203587732.PDF
804,2017-06-03,三诺生物：独立董事关于第三届董事会第八次会议相关事项的独立意见,finalpage/2017-06-03/1203587733.PDF
805,2017-06-03,三诺生物：北京国枫律师事务所关于公司2017年限制性股票激励计划调整授予限制性股票相关事项的法律意见书,finalpage/2017-06-03/1203587734.PDF
806,2017-06-03,三诺生物：北京国枫律师事务所关于公司股票期权与限制性股票激励计划调整拟回购注销限制性股票相关事项的法律意见书,finalpage/2017-06-03/1203587735.PDF
807,2017-06-03,三诺生物：关于调整拟回购注销限制性股票回购价格和数量的公告,finalpage/2017-06-03/1203587736.PDF
808,2017-06-08,三诺生物：重大资产重组进展公告,finalpage/2017-06-08/1203598769.PDF
809,2017-06-15,三诺生物：关于重大资产重组进展暨延期复牌的公告,finalpage/2017-06-15/1203615528.PDF
810,2017-06-15,三诺生物：关于公司股权激励计划全部剩余股票期权与限制性股票回购注销完成的公告,finalpage/2017-06-15/1203615530.PDF
811,2017-06-20,三诺生物：第三届董事会第九次会议决议公告,finalpage/2017-06-20/1203630479.PDF
812,2017-06-20,三诺生物：关于放弃参股子公司股权优先购买权的公告,finalpage/2017-06-20/1203630480.PDF
813,2017-06-20,三诺生物：独立董事关于第三届董事会第九次会议相关事项的独立意见,finalpage/2017-06-20/1203630481.PDF
814,2017-06-21,三诺生物：关于完成工商变更登记的公告,finalpage/2017-06-21/1203634289.PDF
815,2017-06-22,三诺生物：重大资产重组进展公告,finalpage/2017-06-22/1203638903.PDF
816,2017-06-24,三诺生物：关于第一期员工持股计划实施的进展公告,finalpage/2017-06-24/1203643057.PDF
817,2017-06-29,三诺生物：重大资产重组进展公告,finalpage/2017-06-29/1203658588.PDF
818,2017-07-01,三诺生物：关于公司股票暂不复牌的提示性公告,finalpage/2017-07-01/1203672247.PDF
819,2017-07-01,三诺生物：关于重大资产重组的一般风险提示公告,finalpage/2017-07-01/1203672248.PDF
820,2017-07-01,三诺生物：第三届董事会第十次会议决议公告,finalpage/2017-07-01/1203672249.PDF
821,2017-07-01,三诺生物：第三届监事会第七次会议决议公告,finalpage/2017-07-01/1203672250.PDF
822,2017-07-01,三诺生物：独立董事关于公司发行股份购买资产并募集配套资金事项的事前认可函,finalpage/2017-07-01/1203672251.PDF
823,2017-07-01,三诺生物：独立董事对第三届董事会第十次会议有关事项的独立意见,finalpage/2017-07-01/1203672252.PDF
824,2017-07-01,三诺生物：创业板上市公司重大资产重组方案首次披露对照表,finalpage/2017-07-01/1203672253.PDF
