date,title,url
2017-05-09,安控科技：公开发行可转换公司债券的论证分析报告,finalpage/2017-05-09/1203484972.PDF
2017-05-09,安控科技：前次募集资金使用情况报告,finalpage/2017-05-09/1203484973.PDF
2017-05-09,安控科技：关于公开发行可转换公司债券摊薄即期回报对公司主要财务指标的影响及公司采取措施的公告,finalpage/2017-05-09/1203484974.PDF
2017-05-09,安控科技：可转换公司债券持有人会议规则（2017年5月）,finalpage/2017-05-09/1203484975.PDF
2017-05-09,安控科技：未来三年股东分红回报规划（2017-2019年度）,finalpage/2017-05-09/1203484976.PDF
2017-05-09,安控科技：关于最近五年被证券监管部门和交易所采取监管措施或处罚及整改情况的公告,finalpage/2017-05-09/1203484977.PDF
2017-05-09,安控科技：关于公司控股股东、实际控制人及全资子公司为公司拟申请银行综合授信额度提供担保的公告,finalpage/2017-05-09/1203484978.PDF
2017-05-09,安控科技：公司章程（2017年5月）,finalpage/2017-05-09/1203484979.PDF
2017-05-09,安控科技：宁波市东望智能系统工程有限公司审计报告,finalpage/2017-05-09/1203484980.PDF
2017-05-09,安控科技：公开发行可转换公司债券预案,finalpage/2017-05-09/1203484981.PDF
2017-05-09,安控科技：公开发行可转换公司债券募集资金项目可行性分析报告,finalpage/2017-05-09/1203484982.PDF
2017-05-09,安控科技：前次募集资金使用情况鉴证报告,finalpage/2017-05-09/1203484983.PDF
2017-05-09,安控科技：控股股东、实际控制人及董事、高级管理人员关于公开发行可转换公司债券摊薄即期回报采取填补措施的承诺的公告,finalpage/2017-05-09/1203484984.PDF
2017-05-09,安控科技：拟收购宁波市东望智能系统工程有限公司股权项目资产评估报告,finalpage/2017-05-09/1203484985.PDF
2017-05-09,安控科技：拟收购宁波市东望智能系统工程有限公司股权项目资产评估说明,finalpage/2017-05-09/1203484986.PDF
2017-05-09,安控科技：第四届董事会第十一次会议决议公告,finalpage/2017-05-09/1203484987.PDF
2017-05-09,安控科技：第四届监事会第七次会议决议公告,finalpage/2017-05-09/1203484988.PDF
2017-05-09,安控科技：独立董事关于第四届董事会第十一次会议相关事项的独立意见,finalpage/2017-05-09/1203484989.PDF
2017-05-09,安控科技：关于召开2017年第四次临时股东大会通知的公告,finalpage/2017-05-09/1203484990.PDF
2017-05-09,安控科技：关于控股子公司克拉玛依市三达新技术股份有限公司完成工商变更登记的公告,finalpage/2017-05-09/1203484991.PDF
2017-05-09,安控科技：关于全资子公司对外投资成立合资公司完成工商设立登记的公告,finalpage/2017-05-09/1203484992.PDF
2017-05-18,安控科技：关于召开2017年第四次临时股东大会提示性公告,finalpage/2017-05-18/1203536162.PDF
2017-05-18,安控科技：关于控股孙公司西安安控鼎辉信息技术有限公司完成工商变更登记的公告,finalpage/2017-05-18/1203536163.PDF
2017-05-22,安控科技：2016年公司债券2017年跟踪信用评级报告,finalpage/2017-05-22/1203554876.PDF
2017-05-22,安控科技：第四届监事会第八次会议决议公告,finalpage/2017-05-22/1203553726.PDF
2017-05-22,安控科技：独立董事关于第四届董事会第十三次会议相关事项的独立意见,finalpage/2017-05-22/1203553727.PDF
2017-05-22,安控科技：关于调整2015年股票期权激励计划期权数量和行权价格的公告,finalpage/2017-05-22/1203553728.PDF
2017-05-22,安控科技：第四届董事会第十三次会议决议公告,finalpage/2017-05-22/1203553729.PDF
2017-05-22,安控科技：北京市时代九和律师事务所关于公司2015年股票期权激励计划股票期权数量及行权价格调整之法律意见书,finalpage/2017-05-22/1203553730.PDF
2017-05-22,安控科技：关于为全资孙公司杭州安控环保科技有限公司申请综合授信额度暨公司及公司股东提供关联担保的公告,finalpage/2017-05-22/1203553731.PDF
2017-05-23,安控科技：关于召开2017年第五次临时股东大会通知的公告,finalpage/2017-05-23/1203553732.PDF
2017-05-24,安控科技：关于公司控股股东、实际控制人进行股票质押式回购交易及部分股权解除质押的公告,finalpage/2017-05-24/1203565962.PDF
2017-05-24,安控科技：2017年第四次临时股东大会决议公告,finalpage/2017-05-24/1203565963.PDF
2017-05-24,安控科技：2017年第四次临时股东大会的律师见证法律意见书,finalpage/2017-05-24/1203565964.PDF
2017-05-31,安控科技：关于公开发行可转换公司债券预案修订情况说明的公告,finalpage/2017-05-31/1203576046.PDF
2017-05-31,安控科技：公开发行可转换公司债券预案（修订稿）,finalpage/2017-05-31/1203576047.PDF
2017-05-31,安控科技：公开发行可转换公司债券的论证分析报告（修订稿）,finalpage/2017-05-31/1203576048.PDF
2017-05-31,安控科技：公开发行可转换公司债券募集资金项目可行性分析报告（修订稿）,finalpage/2017-05-31/1203576049.PDF
2017-05-31,安控科技：关于公开发行可转换公司债券摊薄即期回报对公司主要财务指标的影响及公司采取措施（修订稿）的公告,finalpage/2017-05-31/1203576050.PDF
2017-05-31,安控科技：关于对全资子公司陕西安控科技有限公司增资的公告,finalpage/2017-05-31/1203576051.PDF
2017-05-31,安控科技：关于取得实用新型专利证书的公告,finalpage/2017-05-31/1203576052.PDF
2017-05-31,安控科技：关于公司控股股东、实际控制人进行股票质押式回购交易及部分股权解除质押的公告,finalpage/2017-05-31/1203576053.PDF
2017-05-31,安控科技：第四届监事会第九次会议决议公告,finalpage/2017-05-31/1203576054.PDF
2017-05-31,安控科技：2017年第一季度审阅报告,finalpage/2017-05-31/1203576055.PDF
2017-05-31,安控科技：第四届董事会第十四次会议决议公告,finalpage/2017-05-31/1203576044.PDF
2017-05-31,安控科技：独立董事关于第四届董事会第十四次会议相关事项的独立意见,finalpage/2017-05-31/1203576045.PDF
2017-06-01,安控科技：关于召开2017年第五次临时股东大会提示性公告,finalpage/2017-06-01/1203578673.PDF
2017-06-01,安控科技：关于收到深圳证券交易所《关于北京安控科技股份有限公司2017年非公开发行公司债券符合深交所转让条件的无异议函》的公告,finalpage/2017-06-01/1203578674.PDF
2017-06-02,安控科技：关于限售股份上市流通提示性公告,finalpage/2017-06-02/1203579549.PDF
2017-06-02,安控科技：安信证券股份有限公司关于公司限售股份上市流通的核查意见,finalpage/2017-06-02/1203579550.PDF
2017-06-07,安控科技：2017年第五次临时股东大会的律师见证法律意见书,finalpage/2017-06-07/1203598425.PDF
2017-06-07,安控科技：2017年第五次临时股东大会决议公告,finalpage/2017-06-07/1203598424.PDF
2017-06-07,安控科技：关于监事股东计划减持公司股份的提示性公告,finalpage/2017-06-07/1203598426.PDF
2017-06-16,安控科技：关于公开发行可转换公司债券申请材料获得中国证监会行政许可申请受理的公告,finalpage/2017-06-16/1203624552.PDF
2017-06-23,安控科技：关于完成注册资本工商变更登记的公告,finalpage/2017-06-23/1203644067.PDF
2017-06-23,安控科技：关于控股孙公司拟申请银行综合授信额度暨公司提供担保的公告,finalpage/2017-06-23/1203643117.PDF
2017-06-23,安控科技：关于公司向银行申请综合授信额度暨公司控股股东、实际控制人提供关联担保的公告,finalpage/2017-06-23/1203643118.PDF
2017-06-23,安控科技：第四届董事会第十五次会议决议公告,finalpage/2017-06-23/1203643121.PDF
2017-06-23,安控科技：第四届监事会第十次会议决议公告,finalpage/2017-06-23/1203643122.PDF
2017-06-23,安控科技：独立董事关于第四届董事会第十五次会议相关事项的独立意见,finalpage/2017-06-23/1203643123.PDF
2017-06-23,安控科技：关于公司向银行申请并购贷款暨公司股东提供关联担保的公告,finalpage/2017-06-23/1203643124.PDF
2017-06-23,安控科技：关于全资孙公司对外投资成立合资公司的公告,finalpage/2017-06-23/1203643116.PDF
2017-06-23,安控科技：关于全资子公司向银行申请综合授信额度暨公司及公司控股股东、实际控制人提供关联担保的公告,finalpage/2017-06-23/1203643119.PDF
2017-06-23,安控科技：关于全资子公司向银行申请综合授信额度暨公司及公司股东提供关联担保的公告,finalpage/2017-06-23/1203643120.PDF
2017-06-24,安控科技：关于公司间接合计持股比例5%以上股东股份减持计划的提示性公告,finalpage/2017-06-24/1203643114.PDF
2017-06-24,安控科技：关于召开2017年第六次临时股东大会通知的公告,finalpage/2017-06-24/1203643115.PDF
2017-06-26,安控科技：2016年面向合格投资者公开发行公司债券2016年度受托管理事务报告,finalpage/2017-06-26/1203648634.PDF
2017-06-30,安控科技：关于监事股东减持计划完成的公告,finalpage/2017-06-30/1203669201.PDF
2017-07-04,安控科技：关于召开2017年第六次临时股东大会提示性公告,finalpage/2017-07-04/1203681425.PDF
2017-07-04,安控科技：关于全资子公司陕西安控科技有限公司完成工商变更登记的公告,finalpage/2017-07-04/1203681426.PDF
2017-07-06,安控科技：关于公司二级子公司陕西安控石油技术有限公司购买实物资产暨关联交易的公告,finalpage/2017-07-06/1203685592.PDF
2017-07-06,安控科技：关于公司二级子公司西安安控鼎辉信息技术有限公司收购江苏景雄科技有限公司100%股权的公告,finalpage/2017-07-06/1203685593.PDF
2017-07-06,安控科技：关于注销北京安控科技股份有限公司山东分公司的公告,finalpage/2017-07-06/1203685594.PDF
2017-07-06,安控科技：第四届董事会第十六次会议决议公告,finalpage/2017-07-06/1203685589.PDF
2017-07-06,安控科技：独立董事关于第四届董事会第十六次会议相关事项的独立意见,finalpage/2017-07-06/1203685590.PDF
2017-07-06,安控科技：独立董事关于第四届董事会第十六次会议相关事项的事前认可意见,finalpage/2017-07-06/1203685591.PDF
2017-07-06,安控科技：公司章程（2017年7月）,finalpage/2017-07-06/1203685595.PDF
2017-07-06,安控科技：关联交易决策制度（2017年7月）,finalpage/2017-07-06/1203685596.PDF
2017-07-07,安控科技：关于召开2017年第七次临时股东大会通知的公告,finalpage/2017-07-07/1203685598.PDF
2017-07-07,安控科技：2017年非公开发行公司债券（第一期）发行结果公告,finalpage/2017-07-07/1203685599.PDF
2017-07-10,安控科技：关于全资二级子公司对外投资设立合资公司完成工商设立登记的公告,finalpage/2017-07-10/1203691975.PDF
2017-07-10,安控科技：2017年第六次临时股东大会决议公告,finalpage/2017-07-10/1203691973.PDF
2017-07-10,安控科技：2017年第六次临时股东大会的律师见证法律意见书,finalpage/2017-07-10/1203691974.PDF
2017-07-12,安控科技：第四届董事会第十七次会议决议公告,finalpage/2017-07-12/1203699574.PDF
2017-07-12,安控科技：独立董事关于第四届董事会第十七次会议相关事项的独立意见,finalpage/2017-07-12/1203699575.PDF
2017-07-12,安控科技：关于全资一级子公司浙江安控科技有限公司向银行申请固定资产贷款暨公司提供担保的公告,finalpage/2017-07-12/1203699576.PDF
2017-07-12,安控科技：2017年半年度业绩预告,finalpage/2017-07-12/1203699577.PDF
2017-07-12,安控科技：关于完成《企业境外投资证书》变更登记的公告,finalpage/2017-07-12/1203699578.PDF
2017-07-12,安控科技：关于2017年第七次临时股东大会增加临时提案暨股东大会补充通知的公告,finalpage/2017-07-12/1203699579.PDF
2017-07-13,安控科技：关于公司持股5%以上股东进行股票质押式回购交易及部分股权解除质押的公告,finalpage/2017-07-13/1203703079.PDF
2017-07-17,安控科技：关于公司持股5%以上股东进行股票质押式回购交易及部分股权解除质押的公告,finalpage/2017-07-17/1203709647.PDF
2017-07-18,安控科技：关于公司控股二级子公司西安安控鼎辉信息技术有限公司收购江苏景雄科技有限公司100%股权完成工商变更登记的公告,finalpage/2017-07-18/1203712005.PDF
2017-07-18,安控科技：关于召开2017年第七次临时股东大会提示性公告,finalpage/2017-07-18/1203712004.PDF
2017-07-24,安控科技：2017年第七次临时股东大会决议公告,finalpage/2017-07-24/1203728864.PDF
2017-07-24,安控科技：2017年第七次临时股东大会的律师见证法律意见书,finalpage/2017-07-24/1203728865.PDF
2017-07-24,安控科技：关于参与设立产业基金完成工商设立登记的公告,finalpage/2017-07-24/1203728866.PDF
2017-08-01,安控科技：关于收购宁波市东望智能系统工程有限公司70%股权完成工商变更登记的公告,finalpage/2017-08-01/1203752646.PDF
2017-08-01,安控科技：关于创业板公开发行可转换公司债券申请文件反馈意见回复的公告,finalpage/2017-08-01/1203752638.PDF
2017-08-01,安控科技：关于公司创业板公开发行可转换公司债券申请文件反馈意见的回复,finalpage/2017-08-01/1203752639.PDF
2017-08-01,安控科技：创业板公开发行可转换公司债券申请文件反馈意见中相关财务问题的专项说明,finalpage/2017-08-01/1203752640.PDF
2017-08-01,安控科技：中联资产评估集团有限公司关于公司创业板公开发行可转换公司债券申请文件反馈意见中评估相关问题的专项说明,finalpage/2017-08-01/1203752641.PDF
2017-08-01,安控科技：北京市时代九和律师事务所关于公司创业板公开发行可转换公司债券之补充法律意见书（一）,finalpage/2017-08-01/1203752642.PDF
2017-08-01,安控科技：公开发行可转换公司债券预案（第二次修订稿）,finalpage/2017-08-01/1203752643.PDF
2017-08-01,安控科技：公开发行可转换公司债券募集资金项目可行性分析报告（第二次修订稿）,finalpage/2017-08-01/1203752644.PDF
2017-08-01,安控科技：关于公开发行可转换公司债券预案第二次修订情况说明的公告,finalpage/2017-08-01/1203752645.PDF
2017-08-07,安控科技：关于2017年累计新增借款的公告,finalpage/2017-08-07/1203769650.PDF
2017-08-07,安控科技：2016年面向合格投资者公开发行公司债券临时受托管理事务报告,finalpage/2017-08-07/1203769651.PDF
2017-08-11,安控科技：关于向全资一级子公司安控科技（香港）有限公司增资的公告,finalpage/2017-08-11/1203789650.PDF
2017-08-11,安控科技：独立董事关于第四届董事会第十八次会议相关事项的独立意见,finalpage/2017-08-11/1203789649.PDF
2017-08-11,安控科技：关于清算并注销参股二级子公司苏州安控创领九鼎股权投资中心（有限合伙）暨关联交易的公告,finalpage/2017-08-11/1203789651.PDF
2017-08-11,安控科技：关于关注公司2017年累计新增借款的公告,finalpage/2017-08-11/1203789652.PDF
2017-08-11,安控科技：第四届董事会第十八次会议决议公告,finalpage/2017-08-11/1203789648.PDF
2017-08-25,安控科技：2017年半年度报告披露提示性公告,finalpage/2017-08-25/1203862702.PDF
2017-08-25,安控科技：2017年半年度报告摘要,finalpage/2017-08-25/1203862703.PDF
2017-08-25,安控科技：第四届董事会第十九次会议决议公告,finalpage/2017-08-25/1203862704.PDF
2017-08-25,安控科技：第四届监事会第十一次会议决议公告,finalpage/2017-08-25/1203862705.PDF
2017-08-25,安控科技：独立董事关于第四届董事会第十九次会议相关事项的独立意见,finalpage/2017-08-25/1203862706.PDF
2017-08-25,安控科技：2017年半年度募集资金存放与使用情况的专项报告,finalpage/2017-08-25/1203862707.PDF
2017-08-25,安控科技：关于会计政策变更的公告,finalpage/2017-08-25/1203862708.PDF
2017-08-25,安控科技：2017年半年度报告,finalpage/2017-08-25/1203862710.PDF
2017-08-29,安控科技：第四届董事会第二十次会议决议公告,finalpage/2017-08-29/1203893580.PDF
2017-08-29,安控科技：第四届监事会第十二次会议决议公告,finalpage/2017-08-29/1203893581.PDF
2017-08-29,安控科技：独立董事关于第四届董事会第二十次会议相关事项的独立意见,finalpage/2017-08-29/1203893582.PDF
2017-08-29,安控科技：安信证券股份有限公司关于公司2017年半年度持续督导跟踪报告,finalpage/2017-08-29/1203893583.PDF
2017-08-29,安控科技：关于全资二级子公司杭州安控环保科技有限公司申请综合授信额度暨公司及公司股东提供关联担保的公告,finalpage/2017-08-29/1203893584.PDF
2017-08-29,安控科技：关于全资二级子公司杭州青鸟电子有限公司申请综合授信额度暨公司及公司股东提供关联担保的公告,finalpage/2017-08-29/1203893585.PDF
2017-08-29,安控科技：关于全资一级子公司北京泽天盛海油田技术服务有限公司办理融资租赁业务暨公司及公司控股股东提供关联担保的公告,finalpage/2017-08-29/1203893586.PDF
2017-08-29,安控科技：关于控股二级子公司郑州鑫胜电子科技有限公司拟申请银行综合授信额度暨公司提供担保的公告,finalpage/2017-08-29/1203893587.PDF
2017-08-30,安控科技：关于召开2017年第八次临时股东大会通知的公告,finalpage/2017-08-30/1203893588.PDF
2017-09-04,安控科技：关于公司持股5%以上股东进行股票质押式回购交易的公告,finalpage/2017-09-04/1203930577.PDF
2017-09-04,安控科技：关于公司控股股东、实际控制人进行股票质押式回购交易的公告,finalpage/2017-09-04/1203930576.PDF
2017-09-06,安控科技：深圳市高新投集团有限公司2017年半年度财务报表,finalpage/2017-09-06/1203941851.PDF
2017-09-08,安控科技：关于召开2017年第八次临时股东大会提示性公告,finalpage/2017-09-08/1203959458.PDF
2017-09-11,安控科技：关于2015年非公开发行限售股份上市流通的提示性公告,finalpage/2017-09-11/1203964392.PDF
2017-09-11,安控科技：安信证券股份有限公司关于公司2015年非公开发行限售股份上市流通的核查意见,finalpage/2017-09-11/1203964393.PDF
2017-09-11,安控科技：第四届董事会第二十一次会议决议公告,finalpage/2017-09-11/1203963557.PDF
2017-09-11,安控科技：第四届监事会第十三次会议决议公告,finalpage/2017-09-11/1203963558.PDF
2017-09-11,安控科技：独立董事关于第四届董事会第二十一次会议相关事项的独立意见,finalpage/2017-09-11/1203963559.PDF
2017-09-11,安控科技：关于注销公司2015年股票期权激励计划部分已授予股票期权的公告,finalpage/2017-09-11/1203963560.PDF
2017-09-11,安控科技：北京市时代九和律师事务所关于公司2015年股票期权激励计划部分股票期权注销之法律意见书,finalpage/2017-09-11/1203963561.PDF
2017-09-14,安控科技：关于公司2015年股票期权激励计划部分已授予股票期权注销完成的公告,finalpage/2017-09-14/1203975456.PDF
2017-09-14,安控科技：2017年第八次临时股东大会决议公告,finalpage/2017-09-14/1203975457.PDF
2017-09-14,安控科技：2017年第八次临时股东大会的律师见证法律意见书,finalpage/2017-09-14/1203975458.PDF
2017-09-18,安控科技：第四届董事会第二十二次会议决议公告,finalpage/2017-09-18/1203981040.PDF
2017-09-18,安控科技：关于公司持股5%以上股东部分股权解除质押的公告,finalpage/2017-09-18/1203981042.PDF
2017-09-18,安控科技：独立董事关于第四届董事会第二十二次会议相关事项的独立意见,finalpage/2017-09-18/1203981043.PDF
2017-09-18,安控科技：关于申请撤回本次公开发行可转换公司债券申请文件的公告,finalpage/2017-09-18/1203981060.PDF
2017-09-21,安控科技：第四届董事会第二十三次会议决议公告,finalpage/2017-09-21/1203993718.PDF
2017-09-21,安控科技：关于公司全资一级子公司克拉玛依安控科技有限公司对外投资设立合资公司的公告,finalpage/2017-09-21/1203993719.PDF
2017-09-25,安控科技：关于持股5%以上股东减持股份计划实施进展公告,finalpage/2017-09-25/1203998637.PDF
2017-09-29,安控科技：关于公司持股5%以上股东股票质押的公告,finalpage/2017-09-29/1204013458.PDF
2017-09-29,安控科技：第四届董事会第二十四次会议决议公告,finalpage/2017-09-29/1204013459.PDF
2017-09-29,安控科技：第四届监事会第十四次会议决议公告,finalpage/2017-09-29/1204013460.PDF
2017-09-29,安控科技：独立董事关于第四届董事会第二十四次会议相关事项的独立意见,finalpage/2017-09-29/1204013461.PDF
2017-09-29,安控科技：关于公司控股一级子公司宁波市东望智能系统工程有限公司拟参与设立产业基金的公告,finalpage/2017-09-29/1204013462.PDF
2017-09-29,安控科技：关于公司控股一级子公司宁波市东望智能系统工程有限公司申请综合授信额度暨公司及公司控股股东、实际控制人提供关联担保的公告,finalpage/2017-09-29/1204013463.PDF
2017-09-29,安控科技：关于公司向银行申请综合授信额度暨公司控股股东、实际控制人提供关联担保的公告,finalpage/2017-09-29/1204013464.PDF
2017-09-30,安控科技：关于召开2017年第九次临时股东大会通知的公告,finalpage/2017-09-30/1204013465.PDF
2017-10-10,安控科技：关于召开2017年第九次临时股东大会提示性公告,finalpage/2017-10-10/1204024009.PDF
2017-10-13,安控科技：2017年前三季度业绩预告,finalpage/2017-10-13/1204038912.PDF
2017-10-16,安控科技：2017年第九次临时股东大会决议公告,finalpage/2017-10-16/1204045158.PDF
2017-10-16,安控科技：2017年第九次临时股东大会的律师见证法律意见书,finalpage/2017-10-16/1204045159.PDF
2017-10-17,安控科技：2016年面向合格投资者公开发行公司债券2017年付息公告,finalpage/2017-10-17/1204049289.PDF
2017-10-17,安控科技：关于公司全资一级子公司克拉玛依安控科技有限公司对外投资成立合资公司完成工商设立登记的公告,finalpage/2017-10-17/1204048776.PDF
2017-10-17,安控科技：关于收到《中国证监会行政许可申请终止审查通知书》的公告,finalpage/2017-10-17/1204048775.PDF
2017-10-23,安控科技：关于变更持续督导保荐代表人的公告,finalpage/2017-10-23/1204059929.PDF
2017-10-25,安控科技：关于公司持股5%以上股东股票质押的公告,finalpage/2017-10-25/1204068979.PDF
2017-10-25,安控科技：关于公司控股一级子公司宁波市东望智能系统工程有限公司拟参与设立产业基金完成工商登记的公告,finalpage/2017-10-25/1204068980.PDF
2017-10-27,安控科技：2017年第三季度报告披露提示性公告,finalpage/2017-10-27/1204077201.PDF
2017-10-27,安控科技：2017年第三季度报告全文,finalpage/2017-10-27/1204077203.PDF
2017-10-30,安控科技：关于全资二级子公司杭州青鸟电子有限公司取得涉密信息系统集成甲级资质证书的公告,finalpage/2017-10-30/1204095217.PDF
2017-10-30,安控科技：关于公司向相关银行申请综合授信额度由公司股东提供关联担保的公告,finalpage/2017-10-30/1204095221.PDF
2017-10-30,安控科技：关于公司控股子公司向相关银行申请综合授信额度由公司及公司股东提供关联担保的公告,finalpage/2017-10-30/1204095222.PDF
2017-10-30,安控科技：第四届董事会第二十六次会议决议的公告,finalpage/2017-10-30/1204095218.PDF
2017-10-30,安控科技：第四届监事会第十六次会议决议公告,finalpage/2017-10-30/1204095219.PDF
2017-10-30,安控科技：独立董事关于第四届董事会第二十六次会议相关事项的独立意见,finalpage/2017-10-30/1204095220.PDF
2017-10-31,安控科技：关于召开2017年第十次临时股东大会通知的公告,finalpage/2017-10-31/1204095223.PDF
2017-11-07,安控科技：关于持股5%以上股东减持股份计划实施进展公告,finalpage/2017-11-07/1204122258.PDF
2017-11-07,安控科技：关于2017年累计新增借款的公告,finalpage/2017-11-07/1204122252.PDF
2017-11-08,安控科技：关于重大资产重组限售股份解禁上市流通的提示性公告,finalpage/2017-11-08/1204125643.PDF
2017-11-09,安控科技：2016年面向合格投资者公开发行公司债券临时受托管理事务报告,finalpage/2017-11-09/1204128534.PDF
2017-11-09,安控科技：关于召开2017年第十次临时股东大会提示性公告,finalpage/2017-11-09/1204128335.PDF
2017-11-14,安控科技：关于公司控股股东、实际控制人部分股权解除质押的公告,finalpage/2017-11-14/1204138407.PDF
2017-11-15,安控科技：2017年第十次临时股东大会决议公告,finalpage/2017-11-15/1204142326.PDF
2017-11-15,安控科技：2017年第十次临时股东大会的律师见证法律意见书,finalpage/2017-11-15/1204142327.PDF
2017-11-17,安控科技：关于对外投资设立合资公司的公告,finalpage/2017-11-17/1204146370.PDF
