date,title,url
2015-03-12,安控科技：关于全资子公司竞拍取得土地使用权的公告,finalpage/2015-03-12/1200694891.PDF
2015-03-16,安控科技：关于发行股份购买资产进展的公告,finalpage/2015-03-16/1200706451.PDF
2015-03-18,安控科技：关于控股股东进行股票质押式回购交易的公告,finalpage/2015-03-18/1200714773.PDF
2015-03-24,安控科技：2014年年度募集资金存放与实际使用情况的专项报告,finalpage/2015-03-24/1200732472.PDF
2015-03-24,安控科技：独立董事关于公司第三届董事会第十五次会议相关事项的独立意见,finalpage/2015-03-24/1200732473.PDF
2015-03-24,安控科技：2014年度独立董事述职报告（俞鹂）,finalpage/2015-03-24/1200732474.PDF
2015-03-24,安控科技：2014年度独立董事述职报告（周东华）,finalpage/2015-03-24/1200732475.PDF
2015-03-24,安控科技：2014年度独立董事述职报告（赵斌）,finalpage/2015-03-24/1200732476.PDF
2015-03-24,安控科技：内部控制鉴证报告,finalpage/2015-03-24/1200732477.PDF
2015-03-24,安控科技：控股股东及其他关联方资金占用情况专项审核报告,finalpage/2015-03-24/1200732478.PDF
2015-03-24,安控科技：募集资金年度存放与使用情况鉴证报告,finalpage/2015-03-24/1200732479.PDF
2015-03-24,安控科技：公司2014年度利润分配预案公告,finalpage/2015-03-24/1200732480.PDF
2015-03-24,安控科技：2014年度内部控制自我评价报告,finalpage/2015-03-24/1200732481.PDF
2015-03-24,安控科技：关于会计政策变更的公告,finalpage/2015-03-24/1200732482.PDF
2015-03-24,安控科技：监事会关于第三届监事会第十次会议相关事项的审核意见公告,finalpage/2015-03-24/1200732483.PDF
2015-03-24,安控科技：安信证券股份有限公司关于公司2014年度内部控制自我评价报告的核查意见,finalpage/2015-03-24/1200732484.PDF
2015-03-24,安控科技：安信证券股份有限公司关于公司2014年度募集资金存放与使用情况的专项核查意见,finalpage/2015-03-24/1200732485.PDF
2015-03-24,安控科技：董事会关于召开2014年年度股东大会的通知公告,finalpage/2015-03-24/1200732486.PDF
2015-03-24,安控科技：关于举行2014年年度报告网上说明会的通知公告,finalpage/2015-03-24/1200732487.PDF
2015-03-24,安控科技：关于调整会计核算科目的公告,finalpage/2015-03-24/1200732488.PDF
2015-03-24,安控科技：2015年第一季度业绩预告公告,finalpage/2015-03-24/1200732489.PDF
2015-03-24,安控科技：2014年年度报告摘要,finalpage/2015-03-24/1200732490.PDF
2015-03-24,安控科技：2014年年度审计报告,finalpage/2015-03-24/1200732492.PDF
2015-03-24,安控科技：第三届董事会第十五次会议决议公告,finalpage/2015-03-24/1200732493.PDF
2015-03-24,安控科技：2014年度报告披露提示性公告,finalpage/2015-03-24/1200732494.PDF
2015-03-24,安控科技：第三届监事会第十次会议决议公告,finalpage/2015-03-24/1200732495.PDF
2015-03-24,安控科技：2014年年度报告,finalpage/2015-03-24/1200732496.PDF
2015-04-02,安控科技：关于全资子公司竞拍取得土地使用权的进展公告,finalpage/2015-04-02/1200783487.PDF
2015-04-10,安控科技：2014年年度股东大会提示性公告,finalpage/2015-04-10/1200811100.PDF
2015-04-10,安控科技：安信证券股份有限公司关于公司2014年度持续督导跟踪报告,finalpage/2015-04-10/1200811101.PDF
2015-04-14,安控科技：关于控股股东进行股票质押式回购交易的公告,finalpage/2015-04-14/1200832394.PDF
2015-04-16,安控科技：2014年年度股东大会的律师见证法律意见书,finalpage/2015-04-16/1200846215.PDF
2015-04-16,安控科技：2014年年度股东大会决议公告,finalpage/2015-04-16/1200847139.PDF
2015-04-25,安控科技：第三届董事会第十六次会议决议公告,finalpage/2015-04-25/1200906488.PDF
2015-04-25,安控科技：第三届监事会第十一次会议决议公告,finalpage/2015-04-25/1200906489.PDF
2015-04-25,安控科技：2015年第一季度报告披露提示性公告,finalpage/2015-04-25/1200906491.PDF
2015-04-25,安控科技：2015年第一季度报告全文,finalpage/2015-04-25/1200906492.PDF
2015-04-27,安控科技：2014年度利润分配实施公告,finalpage/2015-04-27/1200919300.PDF
2015-05-07,安控科技：关于持股5%以上股东股份减持计划的公告,finalpage/2015-05-07/1200978740.PDF
2015-05-08,安控科技：关于对新疆宇澄热力股份有限公司增资及后续股份安排暨对外投资的公告,finalpage/2015-05-08/1200985698.PDF
2015-05-08,安控科技：独立董事关于对新疆宇澄热力股份有限公司增资及后续股份安排暨对外投资相关事项的独立意见,finalpage/2015-05-08/1200985699.PDF
2015-05-08,安控科技：关于持股5%以上股东股份减持计划的公告,finalpage/2015-05-08/1200985696.PDF
2015-05-08,安控科技：第三届董事会第十七次会议决议公告,finalpage/2015-05-08/1200985697.PDF
2015-05-20,安控科技：独立董事关于公司以资产抵押向银行申请贷款相关事项的独立意见,finalpage/2015-05-20/1201041244.PDF
2015-05-20,安控科技：关于以资产抵押向银行申请贷款的公告,finalpage/2015-05-20/1201041245.PDF
2015-05-20,安控科技：公司章程（2015年5月）,finalpage/2015-05-20/1201041246.PDF
2015-05-20,安控科技：董事会关于召开2015年第二次临时股东大会的通知公告,finalpage/2015-05-20/1201041247.PDF
2015-05-20,安控科技：第三届董事会第十八次会议决议公告,finalpage/2015-05-20/1201041243.PDF
2015-06-02,安控科技：第三届董事会第十九次会议决议公告,finalpage/2015-06-02/1201094107.PDF
2015-06-02,安控科技：关于公司对外投资设立全资子公司的公告,finalpage/2015-06-02/1201094108.PDF
2015-06-02,安控科技：董事会2015年第二次临时股东大会提示性公告,finalpage/2015-06-02/1201094109.PDF
2015-06-04,安控科技：2015年第二次临时股东大会的律师见证法律意见书,finalpage/2015-06-04/1201105647.PDF
2015-06-04,安控科技：2015年第二次临时股东大会决议公告,finalpage/2015-06-04/1201105840.PDF
2015-06-15,安控科技：关于控股股东进行股票质押式回购交易的公告,finalpage/2015-06-15/1201153275.PDF
2015-07-03,安控科技：关于中国证监会上市公司并购重组委员会审核公司发行股份及支付现金购买资产并募集资金事项的停牌公告,finalpage/2015-07-03/1201230094.PDF
2015-07-09,安控科技：关于控股股东及全体董事、监事、高级管理人员计划增持公司股份的公告,finalpage/2015-07-09/1201266385.PDF
2015-07-10,安控科技：关于积极响应中国上市公司协会倡议的公告,finalpage/2015-07-10/1201268052.PDF
2015-07-13,安控科技：关于公司发行股份及支付现金购买资产并募集配套资金事项获得中国证监会并购重组委审核通过暨公司股票复牌的公告,finalpage/2015-07-13/1201276593.PDF
2015-07-13,安控科技：关于召开投资者说明会的公告,finalpage/2015-07-13/1201276594.PDF
2015-07-13,安控科技：关于维护证券市场稳定措施的公告,finalpage/2015-07-13/1201276595.PDF
2015-07-14,安控科技：2015年半年度业绩预告,finalpage/2015-07-14/1201286309.PDF
2015-07-17,安控科技：关于与河南工业大学签署战略合作框架协议的公告,finalpage/2015-07-17/1201309643.PDF
2015-07-23,安控科技：关于全资子公司收购郑州鑫胜电子科技有限公司51%股权的公告,finalpage/2015-07-23/1201337981.PDF
2015-07-23,安控科技：浙江安控科技有限公司拟收购郑州鑫胜电子科技有限公司51%股权项目资产评估报告,finalpage/2015-07-23/1201337982.PDF
2015-07-23,安控科技：关于对外投资设立合资公司的公告,finalpage/2015-07-23/1201337983.PDF
2015-07-23,安控科技：关于变更以资产抵押向银行申请贷款的公告,finalpage/2015-07-23/1201337984.PDF
2015-07-23,安控科技：关于增加公司经营范围及修订《公司章程》的公告,finalpage/2015-07-23/1201337985.PDF
2015-07-23,安控科技：关于完成工商变更登记的公告,finalpage/2015-07-23/1201337988.PDF
2015-07-23,安控科技：公司章程（2015年7月）,finalpage/2015-07-23/1201337986.PDF
2015-07-23,安控科技：董事会关于召开2015年第三次临时股东大会的通知公告,finalpage/2015-07-23/1201337987.PDF
2015-07-23,安控科技：第三届董事会第二十次会议决议公告,finalpage/2015-07-23/1201337980.PDF
2015-07-29,安控科技：关于全资子公司完成工商设立登记的公告,finalpage/2015-07-29/1201363627.PDF
2015-07-29,安控科技：关于合资公司完成工商注册登记的公告,finalpage/2015-07-29/1201363628.PDF
2015-07-29,安控科技：关于控股股东进行股票补充质押的公告,finalpage/2015-07-29/1201363629.PDF
2015-08-03,安控科技：2015年第三次临时股东大会提示性公告,finalpage/2015-08-03/1201385648.PDF
2015-08-07,安控科技：关于控股股东进行股票补充质押的公告,finalpage/2015-08-07/1201406488.PDF
2015-08-10,安控科技：关于公司发行股份购买资产并募集配套资金事项获得中国证券监督管理委员会正式批复的公告,finalpage/2015-08-10/1201417283.PDF
2015-08-10,安控科技：关于发行股份及支付现金购买资产并募集配套资金报告书的修订说明公告,finalpage/2015-08-10/1201417284.PDF
2015-08-10,安控科技：发行股份及支付现金购买资产并募集配套资金报告书（修订稿）,finalpage/2015-08-10/1201417285.PDF
2015-08-10,安控科技：发行股份及支付现金购买资产并募集配套资金报告书摘要（修订稿）,finalpage/2015-08-10/1201417286.PDF
2015-08-10,安控科技：发行股份及支付现金购买资产并募集配套资金之独立财务顾问报告,finalpage/2015-08-10/1201417287.PDF
2015-08-10,安控科技：2015年第三次临时股东大会的律师见证法律意见书,finalpage/2015-08-10/1201417148.PDF
2015-08-10,安控科技：北京泽天盛海油田技术服务有限公司审计报告,finalpage/2015-08-10/1201417288.PDF
2015-08-10,安控科技：北京市时代九和律师事务所关于公司发行股份及支付现金购买资产并募集配套资金之补充法律意见书（一）,finalpage/2015-08-10/1201417289.PDF
2015-08-10,安控科技：2015年第三次临时股东大会决议公告,finalpage/2015-08-10/1201417545.PDF
2015-08-12,安控科技：第三届董事会第二十一次会议决议公告,finalpage/2015-08-12/1201428100.PDF
2015-08-12,安控科技：第三届监事会第十二次会议决议公告,finalpage/2015-08-12/1201428101.PDF
2015-08-12,安控科技：独立董事关于公司股票期权激励计划（草案）的独立意见,finalpage/2015-08-12/1201428102.PDF
2015-08-12,安控科技：独立董事征集投票权报告书,finalpage/2015-08-12/1201428103.PDF
2015-08-12,安控科技：董事会关于召开2015年第四次临时股东大会的通知公告,finalpage/2015-08-12/1201428104.PDF
2015-08-12,安控科技：股票期权激励计划（草案）,finalpage/2015-08-12/1201428106.PDF
2015-08-12,安控科技：高级管理人员股票期权激励计划实施考核管理办法（2015年8月）,finalpage/2015-08-12/1201428107.PDF
2015-08-12,安控科技：北京市时代九和律师事务所关于公司股权激励计划（草案）之法律意见书,finalpage/2015-08-12/1201428109.PDF
2015-08-12,安控科技：监事会关于公司股票期权激励计划激励对象名单的核查意见,finalpage/2015-08-12/1201428105.PDF
2015-08-12,安控科技：股票期权激励计划（草案）激励对象名单,finalpage/2015-08-12/1201428108.PDF
2015-08-12,安控科技：股票期权激励计划（草案）摘要,finalpage/2015-08-12/1201428110.PDF
2015-08-17,安控科技：第三届董事会第二十二次会议决议公告,finalpage/2015-08-17/1201451167.PDF
2015-08-17,安控科技：北京市时代九和律师事务所关于公司股权激励计划（草案）（修订稿）之法律意见书,finalpage/2015-08-17/1201451174.PDF
2015-08-17,安控科技：第三届监事会第十三次会议决议公告,finalpage/2015-08-17/1201451168.PDF
2015-08-17,安控科技：独立董事对有关事项的独立意见,finalpage/2015-08-17/1201451169.PDF
2015-08-17,安控科技：股票期权激励计划（草案）激励对象名单（调整后）,finalpage/2015-08-17/1201451171.PDF
2015-08-17,安控科技：股票期权激励计划（草案）,finalpage/2015-08-17/1201451172.PDF
2015-08-17,安控科技：股票期权激励计划（草案）摘要,finalpage/2015-08-17/1201451173.PDF
2015-08-17,安控科技：关于持有公司3%以上股份的股东提交临时提案暨召开2015年第四次临时股东大会的补充通知,finalpage/2015-08-17/1201451175.PDF
2015-08-17,安控科技：关于调整公司股票期权激励计划授予激励对象及授予数量的公告,finalpage/2015-08-17/1201451170.PDF
2015-08-20,安控科技：2015年第四次临时股东大会提示性公告,finalpage/2015-08-20/1201467023.PDF
2015-08-24,安控科技：关于维护股价稳定方案落实情况的公告,finalpage/2015-08-24/1201482067.PDF
2015-08-26,安控科技：关于控股股东进行股票补充质押的公告,finalpage/2015-08-26/1201500884.PDF
2015-08-26,安控科技：2015年半年度募集资金存放与实际使用情况的专项报告,finalpage/2015-08-26/1201491314.PDF
2015-08-26,安控科技：独立董事关于第三届董事会第二十三次会议相关事项发表的独立意见,finalpage/2015-08-26/1201491315.PDF
2015-08-26,安控科技：关于独立董事辞职的公告,finalpage/2015-08-26/1201491316.PDF
2015-08-26,安控科技：独立董事提名人声明,finalpage/2015-08-26/1201491317.PDF
2015-08-26,安控科技：关于更换独立董事的公告,finalpage/2015-08-26/1201491318.PDF
2015-08-26,安控科技：独立董事候选人声明（李量）,finalpage/2015-08-26/1201491319.PDF
2015-08-26,安控科技：董事会关于召开2015年第五次临时股东大会的通知公告,finalpage/2015-08-26/1201491320.PDF
2015-08-26,安控科技：关于全资子公司签订《股权收购意向书》的公告,finalpage/2015-08-26/1201491321.PDF
2015-08-26,安控科技：2015年半年度报告摘要,finalpage/2015-08-26/1201491322.PDF
2015-08-26,安控科技：第三届董事会第二十三次会议决议公告,finalpage/2015-08-26/1201491324.PDF
2015-08-26,安控科技：2015年半年度报告披露提示性公告,finalpage/2015-08-26/1201491325.PDF
2015-08-26,安控科技：第三届监事会第十四次会议决议公告,finalpage/2015-08-26/1201491326.PDF
2015-08-26,安控科技：2015年半年度报告（已取消）,finalpage/2015-08-26/1201491327.PDF
2015-08-27,安控科技：2015年第四次临时股东大会的律师见证法律意见书,finalpage/2015-08-27/1201508924.PDF
2015-08-27,安控科技：安信证券股份有限公司关于公司2015年半年度持续督导跟踪报告,finalpage/2015-08-27/1201508925.PDF
2015-08-27,安控科技：2015年第四次临时股东大会决议公告,finalpage/2015-08-27/1201510139.PDF
2015-08-27,安控科技：关于维护股价稳定方案落实情况的公告,finalpage/2015-08-27/1201508926.PDF
2015-08-28,安控科技：2015年半年度报告（更新后）,finalpage/2015-08-28/1201518592.PDF
2015-08-28,安控科技：安信证券股份有限公司关于公司首次公开发行股票前已发行股份解除限售上市流通的核查意见,finalpage/2015-08-28/1201517491.PDF
2015-08-28,安控科技：首次公开发行前已发行股份上市流通提示性公告,finalpage/2015-08-28/1201517490.PDF
2015-08-28,安控科技：关于2015年半年度报告数据的更正公告,finalpage/2015-08-28/1201516658.PDF
2015-09-02,安控科技：2015年第五次临时股东大会提示性公告,finalpage/2015-09-02/1201542240.PDF
2015-09-07,安控科技：公司章程（2015年8月）,finalpage/2015-09-07/1201560303.PDF
2015-09-07,安控科技：关于全资子公司收购郑州鑫胜电子科技有限公司51%股权完成工商变更登记的公告,finalpage/2015-09-07/1201560523.PDF
2015-09-07,安控科技：关于完成经营范围工商变更登记的公告,finalpage/2015-09-07/1201560302.PDF
2015-09-08,安控科技：第三届监事会第十五次会议决议公告,finalpage/2015-09-08/1201568199.PDF
2015-09-08,安控科技：独立董事关于第三届董事会第二十四次会议相关事项的独立意见,finalpage/2015-09-08/1201568200.PDF
2015-09-08,安控科技：关于向激励对象授予股票期权的公告,finalpage/2015-09-08/1201568201.PDF
2015-09-08,安控科技：北京市时代九和律师事务所关于公司股票期权授予事项之法律意见书,finalpage/2015-09-08/1201568202.PDF
2015-09-08,安控科技：关于合资公司完成工商注册登记的公告,finalpage/2015-09-08/1201568680.PDF
2015-09-08,安控科技：第三届董事会第二十四次会议决议公告,finalpage/2015-09-08/1201568198.PDF
2015-09-10,安控科技：关于控股股东进行股票补充质押的公告,finalpage/2015-09-10/1201577376.PDF
2015-09-10,安控科技：2015年第五次临时股东大会决议公告,finalpage/2015-09-10/1201577491.PDF
2015-09-10,安控科技：关于公司与西安交通大学签署战略合作协议的公告,finalpage/2015-09-10/1201577374.PDF
2015-09-10,安控科技：2015年第五次临时股东大会的律师见证法律意见书,finalpage/2015-09-10/1201577375.PDF
2015-09-28,安控科技：发行股份及支付现金购买资产并募集配套资金之标的股权过户完成的公告,finalpage/2015-09-28/1201650203.PDF
2015-09-28,安控科技：安信证券股份有限公司关于公司发行股份及支付现金购买资产并募集配套资金实施情况之资产交割过户之专项核查意见,finalpage/2015-09-28/1201650204.PDF
2015-09-28,安控科技：北京市时代九和律师事务所关于公司发行股份及支付现金购买资产并募集配套资金之标的资产过户情况的法律意见书,finalpage/2015-09-28/1201650205.PDF
2015-09-28,安控科技：关于全资子公司收购杭州叙简科技有限公司10%股权的公告,finalpage/2015-09-28/1201649754.PDF
2015-09-28,安控科技：关于全资子公司收购浙江求是嘉禾信息技术有限公司35%股权的公告,finalpage/2015-09-28/1201649759.PDF
2015-09-28,安控科技：浙江安控科技有限公司拟收购浙江求是嘉禾信息技术有限公司35%股权项目资产评估报告,finalpage/2015-09-28/1201649760.PDF
2015-09-28,安控科技：关于全资子公司向银行申请综合授信额度暨公司提供担保的公告,finalpage/2015-09-28/1201649935.PDF
2015-09-28,安控科技：第三届董事会第二十五次会议决议公告,finalpage/2015-09-28/1201649755.PDF
2015-09-28,安控科技：独立董事关于第三届董事会第二十五次会议相关事项的独立意见,finalpage/2015-09-28/1201649756.PDF
2015-09-28,安控科技：第三届监事会第十六次会议决议公告,finalpage/2015-09-28/1201649757.PDF
2015-09-28,安控科技：关于对北京大漠石油工程技术有限公司增资暨对外投资的公告,finalpage/2015-09-28/1201649758.PDF
2015-09-29,安控科技：关于股票期权授予登记完成的公告,finalpage/2015-09-29/1201655187.PDF
2015-10-09,安控科技：关于重大资产重组实施进展公告,finalpage/2015-10-09/1201673473.PDF
2015-10-09,安控科技：第三届董事会第二十六次会议决议公告,finalpage/2015-10-09/1201673474.PDF
2015-10-09,安控科技：独立董事关于第三届董事会第二十六次会议相关事项的独立意见,finalpage/2015-10-09/1201673475.PDF
2015-10-09,安控科技：第三届监事会第十七次会议决议公告,finalpage/2015-10-09/1201673476.PDF
2015-10-09,安控科技：北京市时代九和律师事务所关于公司发行股份及支付现金购买资产并募集配套资金之募集配套资金发行有关事项的法律意见书,finalpage/2015-10-09/1201673477.PDF
2015-10-09,安控科技：停牌公告,finalpage/2015-10-09/1201669354.PDF
2015-10-14,安控科技：2015年前三季度业绩预告,finalpage/2015-10-14/1201693971.PDF
2015-10-16,安控科技：关于完成非公开发行股份募集配套资金特定投资者询价事项暨股票复牌的公告,finalpage/2015-10-16/1201700082.PDF
2015-10-22,安控科技：首次公开发行前已发行股份上市流通提示性公告,finalpage/2015-10-22/1201713711.PDF
2015-10-22,安控科技：安信证券股份有限公司关于公司首次公开发行股票前已发行股份解除限售上市流通的核查意见,finalpage/2015-10-22/1201713712.PDF
2015-10-23,安控科技：2015年第三季度报告披露提示性公告,finalpage/2015-10-23/1201715210.PDF
2015-10-23,安控科技：关于向全资子公司浙江安控科技有限公司增资的公告,finalpage/2015-10-23/1201715211.PDF
2015-10-23,安控科技：第三届董事会第二十七次会议决议公告,finalpage/2015-10-23/1201715212.PDF
2015-10-23,安控科技：第三届监事会第十八次会议决议公告,finalpage/2015-10-23/1201715213.PDF
2015-10-23,安控科技：独立董事关于第三届董事会第二十七次会议相关事项的独立意见,finalpage/2015-10-23/1201715214.PDF
2015-10-23,安控科技：关于全资子公司向银行申请综合授信额度暨公司提供担保的公告,finalpage/2015-10-23/1201715215.PDF
2015-10-23,安控科技：2015年第三季度报告全文,finalpage/2015-10-23/1201715216.PDF
2015-11-03,安控科技：第三届董事会第二十八次会议决议公告,finalpage/2015-11-03/1201750693.PDF
2015-11-03,安控科技：关于调整为全资子公司提供担保有关事项的公告,finalpage/2015-11-03/1201750694.PDF
2015-11-05,安控科技：发行股份及支付现金购买资产并募集配套资金相关承诺的说明,finalpage/2015-11-05/1201755125.PDF
2015-11-05,安控科技：北京市时代九和律师事务所关于公司发行股份及支付现金购买资产并募集配套资金之实施情况的法律意见书,finalpage/2015-11-05/1201755126.PDF
2015-11-05,安控科技：发行股份及支付现金购买资产并募集配套资金实施情况暨新增股份上市公告书（摘要）,finalpage/2015-11-05/1201755127.PDF
2015-11-05,安控科技：发行股份及支付现金购买资产并募集配套资金实施情况暨新增股份上市公告书,finalpage/2015-11-05/1201755128.PDF
2015-11-05,安控科技：安信证券股份有限公司关于公司发行股份及支付现金购买资产并募集配套资金实施情况之独立财务顾问核查意见,finalpage/2015-11-05/1201755129.PDF
2015-11-10,安控科技：公司章程（2015年11月）,finalpage/2015-11-10/1201760854.PDF
2015-11-10,安控科技：董事会关于召开2015年第六次临时股东大会的通知公告,finalpage/2015-11-10/1201760855.PDF
2015-11-10,安控科技：关于拟与关联方及第三方专业投资管理机构共同发起设立产业并购基金的框架协议公告,finalpage/2015-11-10/1201760856.PDF
2015-11-10,安控科技：第三届董事会第二十九次会议决议公告,finalpage/2015-11-10/1201760853.PDF
2015-11-16,安控科技：关于全资子公司向银行申请综合授信额度暨公司提供担保的公告,finalpage/2015-11-16/1201773221.PDF
2015-11-16,安控科技：第三届监事会第十九次会议决议公告,finalpage/2015-11-16/1201773222.PDF
2015-11-16,安控科技：安信证券股份有限公司关于公司将节余募集资金永久补充流动资金的专项核查意见,finalpage/2015-11-16/1201773223.PDF
2015-11-16,安控科技：第三届董事会第三十次会议决议公告,finalpage/2015-11-16/1201773217.PDF
2015-11-16,安控科技：关于签署募集资金三方监管协议的公告,finalpage/2015-11-16/1201773218.PDF
2015-11-16,安控科技：独立董事关于第三届董事会第三十次会议相关事项的独立意见,finalpage/2015-11-16/1201773219.PDF
2015-11-16,安控科技：关于将节余募集资金永久补充流动资金的公告,finalpage/2015-11-16/1201773220.PDF
2015-11-24,安控科技：关于筹划非公开发行股票事项的停牌公告,finalpage/2015-11-24/1201785084.PDF
2015-11-26,安控科技：2015年第六次临时股东大会决议公告,finalpage/2015-11-26/1201789958.PDF
2015-11-26,安控科技：2015年第六次临时股东大会的律师见证法律意见书,finalpage/2015-11-26/1201789959.PDF
2015-11-30,安控科技：董事会关于召开2015年第七次临时股东大会的通知公告,finalpage/2015-11-30/1201798739.PDF
2015-12-01,安控科技：关于非公开发行股票预案披露提示暨复牌公告,finalpage/2015-12-01/1201799107.PDF
2015-12-01,安控科技：关于前次募集资金使用情况的报告,finalpage/2015-12-01/1201799108.PDF
2015-12-01,安控科技：前次募集资金使用情况鉴证报告,finalpage/2015-12-01/1201799109.PDF
2015-12-01,安控科技：关于调整以资产抵押向银行申请贷款的公告,finalpage/2015-12-01/1201799110.PDF
2015-12-01,安控科技：关于变更公司财务总监的公告,finalpage/2015-12-01/1201799111.PDF
2015-12-01,安控科技：关于参股公司完成工商变更登记的公告,finalpage/2015-12-01/1201799112.PDF
2015-12-01,安控科技：关于非公开发行股票摊薄即期回报及应对措施的公告,finalpage/2015-12-01/1201799113.PDF
2015-12-01,安控科技：未来三年股东回报规划（2015-2017年度）,finalpage/2015-12-01/1201799114.PDF
2015-12-01,安控科技：克拉玛依市三达新技术股份有限公司审计报告,finalpage/2015-12-01/1201799115.PDF
