date,title,url
2014-01-06,安控股份：2010年第三次临时股东大会决议,finalpage/2014-01-06/63456121.PDF
2014-01-06,安控股份：2011年第三次临时股东大会决议,finalpage/2014-01-06/63456122.PDF
2014-01-06,安控股份：2012年第三次临时股东大会决议,finalpage/2014-01-06/63456123.PDF
2014-01-06,安控股份：2013年度第五次临时股东大会决议,finalpage/2014-01-06/63456124.PDF
2014-01-06,安控股份：中国证监会关于核准公司首次公开发行股票并在创业板上市的批复,finalpage/2014-01-06/63456125.PDF
2014-01-06,安控股份：公司章程（草案）,finalpage/2014-01-06/63456126.PDF
2014-01-06,安控股份：关于公司设立以来股本演变情况的说明及董事、监事、高级管理人员的确认意见,finalpage/2014-01-06/63456127.PDF
2014-01-06,安控股份：非经常性损益鉴证报告,finalpage/2014-01-06/63456128.PDF
2014-01-06,安控股份：内部控制鉴证报告,finalpage/2014-01-06/63456129.PDF
2014-01-06,安控股份：北京市时代九和律师事务所关于公司首次公开发行人民币普通股（A股）股票并在创业板上市之法律意见书,finalpage/2014-01-06/63456130.PDF
2014-01-06,安控股份：北京市时代九和律师事务所关于公司首次公开发行人民币普通股（A股）股票并在创业板上市之补充法律意见书（一）,finalpage/2014-01-06/63456131.PDF
2014-01-06,安控股份：北京市时代九和律师事务所关于公司首次公开发行人民币普通股（A股）股票并在创业板上市之补充法律意见书（七）,finalpage/2014-01-06/63456132.PDF
2014-01-06,安控股份：北京市时代九和律师事务所关于公司首次公开发行人民币普通股（A股）股票并在创业板上市之补充法律意见书（三）,finalpage/2014-01-06/63456133.PDF
2014-01-06,安控股份：北京市时代九和律师事务所关于公司首次公开发行人民币普通股（A股）股票并在创业板上市之补充法律意见书（二）,finalpage/2014-01-06/63456134.PDF
2014-01-06,安控股份：北京市时代九和律师事务所关于公司首次公开发行人民币普通股（A股）股票并在创业板上市之补充法律意见书（五）,finalpage/2014-01-06/63456135.PDF
2014-01-06,安控股份：北京市时代九和律师事务所关于公司首次公开发行人民币普通股（A股）股票并在创业板上市之补充法律意见书（六）,finalpage/2014-01-06/63456136.PDF
2014-01-06,安控股份：北京市时代九和律师事务所关于公司首次公开发行人民币普通股（A股）股票并在创业板上市之补充法律意见书（四）,finalpage/2014-01-06/63456137.PDF
2014-01-06,安控股份：北京市时代九和律师事务所关于公司首次公开发行人民币普通股（A股）股票并在创业板上市之律师工作报告,finalpage/2014-01-06/63456138.PDF
2014-01-06,安控股份：北京市时代九和律师事务所关于发审委会议对公司审核意见的函之回复法律意见书,finalpage/2014-01-06/63456139.PDF
2014-01-06,安控股份：关于公司首次公开发行股票并在创业板上市之发行保荐书,finalpage/2014-01-06/63456140.PDF
2014-01-06,安控股份：关于公司首次公开发行股票并在创业板上市之发行保荐工作报告,finalpage/2014-01-06/63456141.PDF
2014-01-06,安控股份：审计报告,finalpage/2014-01-06/63456142.PDF
2014-01-06,安控股份：控股股东、实际控制人对招股说明书的确认意见,finalpage/2014-01-06/63456143.PDF
2014-01-06,安控股份：第三届董事会第三次会议决议,finalpage/2014-01-06/63456144.PDF
2014-01-06,安控股份：第三届董事会第二次会议决议,finalpage/2014-01-06/63456145.PDF
2014-01-06,安控股份：第二届董事会第三次会议决议,finalpage/2014-01-06/63456146.PDF
2014-01-06,安控股份：第二届董事会第二十二次会议决议,finalpage/2014-01-06/63456147.PDF
2014-01-06,安控股份：第二届董事会第十一次会议决议,finalpage/2014-01-06/63456148.PDF
2014-01-06,安控股份：首次公开发行股票并在创业板上市初步询价及推介公告,finalpage/2014-01-06/63456149.PDF
2014-01-06,安控股份：首次公开发行股票并在创业板上市招股意向书,finalpage/2014-01-06/63456150.PDF
2014-01-06,安控股份：首次公开发行股票并在创业板上市提示公告,finalpage/2014-01-06/63456151.PDF
2014-01-09,安控股份：首次公开发行股票并在创业板上市网上路演公告,finalpage/2014-01-09/63466662.PDF
2014-01-10,安控股份：首次公开发行股票并在创业板上市发行公告及投资风险特别公告之更正公告,finalpage/2014-01-10/63475516.PDF
2014-01-10,安控股份：首次公开发行股票并在创业板上市发行公告（更新后）,finalpage/2014-01-10/63475517.PDF
2014-01-10,安控股份：首次公开发行股票并在创业板上市投资风险特别公告（更新后）,finalpage/2014-01-10/63475518.PDF
2014-01-10,安控股份：首次公开发行股票并在创业板上市招股说明书（更新后）,finalpage/2014-01-10/63475519.PDF
2014-01-10,安控股份：首次公开发行股票并在创业板上市发行公告（已取消）,finalpage/2014-01-10/63471730.PDF
2014-01-10,安控股份：首次公开发行股票并在创业板上市投资风险特别公告（已取消）,finalpage/2014-01-10/63471731.PDF
2014-01-10,安控股份：首次公开发行股票并在创业板上市招股说明书（已取消）,finalpage/2014-01-10/63471732.PDF
2014-01-15,安控股份：首次公开发行股票并在创业板上市网上定价发行申购情况及中签率公告,finalpage/2014-01-15/63485935.PDF
2014-01-15,安控股份：首次公开发行股票并在创业板上市网下配售结果公告,finalpage/2014-01-15/63485936.PDF
2014-01-16,安控股份：首次公开发行股票并在创业板上市网上定价发行摇号中签结果公告,finalpage/2014-01-16/63488588.PDF
2014-01-22,安控股份：北京市时代九和律师事务所关于公司首次公开发行的股票申请在深圳证券交易所创业板上市之法律意见书,finalpage/2014-01-22/63510921.PDF
2014-01-22,安控股份：安信证券股份有限公司关于公司股票上市保荐书,finalpage/2014-01-22/63510922.PDF
2014-01-22,安控股份：首次公开发行股票并在创业板上市公告书,finalpage/2014-01-22/63510923.PDF
2014-01-22,安控股份：首次公开发行股票并在创业板上市公告书提示性公告,finalpage/2014-01-22/63510924.PDF
2014-01-23,安控股份：上市首日风险提示公告,finalpage/2014-01-23/63514331.PDF
2014-01-28,安控股份：第三届董事会第五次会议决议公告,finalpage/2014-01-28/63532602.PDF
2014-01-28,安控股份：关于签署募集资金三方监管协议的公告,finalpage/2014-01-28/63532603.PDF
2014-01-28,安控股份：关于签订投资意向协议的公告,finalpage/2014-01-28/63532604.PDF
2014-02-24,安控股份：首次公开发行股票并在创业板上市招股说明书及上市公告书公告之更正公告,finalpage/2014-02-24/63596160.PDF
2014-02-26,安控股份：关于公司及相关主体承诺履行情况的公告,finalpage/2014-02-26/63607017.PDF
2014-03-04,安控股份：公司章程（2014年3月）,finalpage/2014-03-04/63636447.PDF
2014-03-04,安控股份：公司独立董事关于公司以募集资金置换预先已投入募集资金投资项目自筹资金发表的独立意见公告,finalpage/2014-03-04/63636448.PDF
2014-03-04,安控股份：关于使用募集资金置换先期投入公告,finalpage/2014-03-04/63636449.PDF
2014-03-04,安控股份：安信证券股份有限公司关于公司以募集资金置换已投入募集资金项目自筹资金的核查意见,finalpage/2014-03-04/63636450.PDF
2014-03-04,安控股份：关于公司以自筹资金预先投入募集资金投资项目的鉴证报告,finalpage/2014-03-04/63636451.PDF
2014-03-04,安控股份：关于对外投资设立合资公司的公告,finalpage/2014-03-04/63636452.PDF
2014-03-04,安控股份：独立董事对公司聘任高管发表的独立意见公告,finalpage/2014-03-04/63636453.PDF
2014-03-04,安控股份：关于召开2014年第一次临时股东大会的通知,finalpage/2014-03-04/63636454.PDF
2014-03-04,安控股份：第三届监事会第三次会议决议公告,finalpage/2014-03-04/63636455.PDF
2014-03-04,安控股份：公司监事会关于公司以募集资金置换预先已投入募集资金投资项目自筹资金发表的独立意见公告,finalpage/2014-03-04/63636457.PDF
2014-03-04,安控股份：第三届董事会第六次会议决议公告,finalpage/2014-03-04/63636872.PDF
2014-03-20,安控股份：2014年度第一次临时股东大会的律师见证法律意见书,finalpage/2014-03-20/63703741.PDF
2014-03-20,安控股份：2014年第一次临时股东大会决议公告,finalpage/2014-03-20/63703772.PDF
2014-03-29,安控股份：关于与新疆石油勘察设计研究院（有限公司）签订战略合作框架协议书的公告,finalpage/2014-03-29/63752968.PDF
2014-04-09,安控股份：独立董事关于公司第三届董事会第七次会议相关事项的独立意见公告,finalpage/2014-04-09/63808213.PDF
2014-04-09,安控股份：2013年度独立董事述职报告（俞鹂）,finalpage/2014-04-09/63808214.PDF
2014-04-09,安控股份：2013年度独立董事述职报告（周东华）,finalpage/2014-04-09/63808215.PDF
2014-04-09,安控股份：2013年度独立董事述职报告（赵斌）,finalpage/2014-04-09/63808216.PDF
2014-04-09,安控股份：2013年年度审计报告,finalpage/2014-04-09/63808217.PDF
2014-04-09,安控股份：董事会关于截止2013年12月31日内部控制有效性的自我评价报告,finalpage/2014-04-09/63808218.PDF
2014-04-09,安控股份：控股股东及其他关联方资金占用情况专项审核报告,finalpage/2014-04-09/63808219.PDF
2014-04-09,安控股份：公司2013年度利润分配预案公告,finalpage/2014-04-09/63808220.PDF
2014-04-09,安控股份：关于公司对外投资设立全资子公司的公告,finalpage/2014-04-09/63808221.PDF
2014-04-09,安控股份：2013年度内部控制自我评价报告,finalpage/2014-04-09/63808222.PDF
2014-04-09,安控股份：监事会关于2013年度内部控制自我评价报告的核查意见公告,finalpage/2014-04-09/63808223.PDF
2014-04-09,安控股份：安信证券股份责任公司关于公司2013年度内部控制自我评价报告的核查意见,finalpage/2014-04-09/63808224.PDF
2014-04-09,安控股份：2013年年度报告摘要,finalpage/2014-04-09/63808225.PDF
2014-04-09,安控股份：第三届董事会第七次会议决议公告,finalpage/2014-04-09/63808229.PDF
2014-04-09,安控股份：关于召开2013年年度股东大会的通知,finalpage/2014-04-09/63808232.PDF
2014-04-09,安控股份：2013年度报告披露提示性公告,finalpage/2014-04-09/63808233.PDF
2014-04-09,安控股份：第三届监事会第四次会议决议公告,finalpage/2014-04-09/63808234.PDF
2014-04-09,安控股份：2013年年度报告,finalpage/2014-04-09/63808235.PDF
2014-04-10,安控股份：关于举行2013年度业绩网上说明会的通知,finalpage/2014-04-10/63813299.PDF
2014-04-11,安控股份：关于完成工商变更登记的公告,finalpage/2014-04-11/63820758.PDF
2014-04-11,安控股份：对外投资进展公告,finalpage/2014-04-11/63820759.PDF
2014-04-15,安控股份：关于变更2014年第一季度报告披露日期的公告,finalpage/2014-04-15/63837819.PDF
2014-04-22,安控股份：公司年报信息披露重大差错责任追究制度（2014年4月）,finalpage/2014-04-22/63889194.PDF
2014-04-22,安控股份：重大信息内部报告制度（2014年4月）,finalpage/2014-04-22/63889195.PDF
2014-04-22,安控股份：董事、监事和高级管理人员所持公司股份及其变动管理制度（2014年4月）,finalpage/2014-04-22/63889196.PDF
2014-04-22,安控股份：内幕信息知情人登记管理制度（2014年4月）,finalpage/2014-04-22/63889197.PDF
2014-04-22,安控股份：关于公司内部组织机构调整的公告,finalpage/2014-04-22/63889198.PDF
2014-04-22,安控股份：第三届监事会第五次会议决议公告,finalpage/2014-04-22/63889199.PDF
2014-04-22,安控股份：关于变更公司证券简称的公告,finalpage/2014-04-22/63889200.PDF
2014-04-22,安控股份：2014年第一季度报告披露提示性公告,finalpage/2014-04-22/63889202.PDF
2014-04-22,安控股份：2014年第一季度报告全文,finalpage/2014-04-22/63889203.PDF
2014-04-22,安控股份：第三届董事会第八次会议决议公告,finalpage/2014-04-22/63889865.PDF
2014-04-30,安控科技：安信证券股份有限公司关于公司持续督导期间2013年度跟踪报告,finalpage/2014-04-30/63949687.PDF
2014-04-30,安控科技：2013年年度股东大会的律师见证法律意见书,finalpage/2014-04-30/63949692.PDF
2014-04-30,安控科技：2013年年度股东大会决议公告,finalpage/2014-04-30/63951577.PDF
2014-05-07,安控科技：关于控股子公司未分配利润转增资本的进展公告,finalpage/2014-05-07/63989584.PDF
2014-05-07,安控科技：2013年度利润分配实施公告,finalpage/2014-05-07/63989585.PDF
2014-05-20,安控科技：独立董事关于公司股东为公司向银行借款提供担保暨关联交易发表的独立意见,finalpage/2014-05-20/64047656.PDF
2014-05-20,安控科技：关于安控科技公司股东为公司银行借款提供担保暨关联交易公告,finalpage/2014-05-20/64047657.PDF
2014-05-20,安控科技：安信证券股份有限公司关于公司股东为公司银行借款提供担保暨关联交易的核查意见,finalpage/2014-05-20/64047658.PDF
2014-05-20,安控科技：公司章程（2014年5月）,finalpage/2014-05-20/64047659.PDF
2014-05-20,安控科技：关于公司对外投资设立全资子公司的公告,finalpage/2014-05-20/64047660.PDF
2014-05-20,安控科技：关于召开2014年第二次临时股东大会的通知,finalpage/2014-05-20/64047661.PDF
2014-05-20,安控科技：第三届监事会第六次会议决议公告,finalpage/2014-05-20/64047663.PDF
2014-05-20,安控科技：监事会关于公司股东为公司向银行借款提供担保暨关联交易发表的独立意见,finalpage/2014-05-20/64047664.PDF
2014-05-20,安控科技：关于取得商标注册证书的公告,finalpage/2014-05-20/64047665.PDF
2014-05-20,安控科技：关于办公地址搬迁的公告,finalpage/2014-05-20/64047666.PDF
2014-05-20,安控科技：第三届董事会第九次会议决议公告,finalpage/2014-05-20/64047927.PDF
2014-05-24,安控科技：重大合同公告,finalpage/2014-05-24/64061653.PDF
2014-06-04,安控科技：2014年第二次临时股东大会的律师见证法律意见书,finalpage/2014-06-04/64102739.PDF
2014-06-04,安控科技：2014年第二次临时股东大会决议公告,finalpage/2014-06-04/64103170.PDF
2014-07-02,安控科技：关于完成工商变更登记的公告,finalpage/2014-07-02/1200024439.PDF
2014-07-04,安控科技：关于重大事项停牌公告,finalpage/2014-07-04/1200030702.PDF
2014-07-10,安控科技：董事会关于重大资产重组停牌公告,finalpage/2014-07-10/1200043427.PDF
2014-07-15,安控科技：2014年半年度业绩预告,finalpage/2014-07-15/1200054266.PDF
2014-07-16,安控科技：重大资产重组进展公告,finalpage/2014-07-16/1200058933.PDF
2014-07-16,安控科技：关于控股股东进行股票质押式回购交易的公告,finalpage/2014-07-16/1200056016.PDF
2014-07-24,安控科技：重大资产重组进展公告,finalpage/2014-07-24/1200074361.PDF
2014-07-24,安控科技：关于全资子公司变更注册地址的公告,finalpage/2014-07-24/1200074362.PDF
2014-07-30,安控科技：重大资产重组进展公告,finalpage/2014-07-30/1200088848.PDF
2014-08-04,安控科技：关于终止重大资产重组事项暨股票复牌公告,finalpage/2014-08-04/1200095306.PDF
2014-08-08,安控科技：2014年半年度募集资金存放与实际使用情况的专项报告,finalpage/2014-08-08/1200105673.PDF
2014-08-08,安控科技：独立董事关于2014年半年度报告等相关事项发表的独立意见,finalpage/2014-08-08/1200105674.PDF
2014-08-08,安控科技：关于终止设立浙江安控自动化有限公司的公告,finalpage/2014-08-08/1200105675.PDF
2014-08-08,安控科技：2014年半年度报告摘要,finalpage/2014-08-08/1200105676.PDF
2014-08-08,安控科技：第三届董事会第十次会议决议公告,finalpage/2014-08-08/1200105678.PDF
2014-08-08,安控科技：2014年半年度报告披露提示性公告,finalpage/2014-08-08/1200105679.PDF
2014-08-08,安控科技：第三届监事会第七次会议决议公告,finalpage/2014-08-08/1200105680.PDF
2014-08-08,安控科技：2014年半年度报告,finalpage/2014-08-08/1200105681.PDF
2014-08-14,安控科技：关于取得商标注册证书的公告,finalpage/2014-08-14/1200125063.PDF
2014-08-26,安控科技：安信证券股份有限公司关于公司2014年半年度持续督导跟踪报告,finalpage/2014-08-26/1200173029.PDF
2014-09-09,安控科技：关于公司股东进行股票质押式回购交易的公告,finalpage/2014-09-09/1200219990.PDF
2014-09-19,安控科技：关于收购北京双良石油技术有限公司100%股权的公告,finalpage/2014-09-19/1200250081.PDF
2014-09-19,安控科技：关于公司对外投资设立全资子公司的公告,finalpage/2014-09-19/1200250082.PDF
2014-09-19,安控科技：关于向全资子公司浙江安控科技有限公司增资的公告,finalpage/2014-09-19/1200250083.PDF
2014-09-19,安控科技：第三届董事会第十一次会议决议公告,finalpage/2014-09-19/1200250780.PDF
2014-10-14,安控科技：2014年前三季度业绩预告,finalpage/2014-10-14/1200299073.PDF
2014-10-24,安控科技：第三届监事会第八次会议决议公告,finalpage/2014-10-24/1200323579.PDF
2014-10-24,安控科技：2014年第三季度报告披露提示性公告,finalpage/2014-10-24/1200323581.PDF
2014-10-24,安控科技：2014年第三季度报告全文,finalpage/2014-10-24/1200323582.PDF
2014-10-24,安控科技：第三届董事会第十二次会议决议公告,finalpage/2014-10-24/1200324035.PDF
2014-10-27,安控科技：关于取得商标注册证书的公告,finalpage/2014-10-27/1200341995.PDF
2014-11-11,安控科技：对外投资进展公告,finalpage/2014-11-11/1200386056.PDF
2014-11-17,安控科技：关于收到中标通知书的公告,finalpage/2014-11-17/1200399133.PDF
2014-11-17,安控科技：关于设立安控科技北美有限公司的进展公告,finalpage/2014-11-17/1200399134.PDF
2014-11-27,安控科技：关于重大事项停牌公告,finalpage/2014-11-27/1200419402.PDF
2014-11-28,安控科技：关于公司股东进行股票质押式回购交易及部分股权解除质押的公告,finalpage/2014-11-28/1200426631.PDF
2014-11-28,安控科技：第三届董事会第十三次会议决议公告,finalpage/2014-11-28/1200426735.PDF
2014-11-28,安控科技：关于对外投资设立合资公司的公告,finalpage/2014-11-28/1200426627.PDF
2014-11-28,安控科技：关于注销北京安控科技股份有限公司昌平分公司的公告,finalpage/2014-11-28/1200426628.PDF
2014-11-28,安控科技：关于在新疆克拉玛依设立分公司的公告,finalpage/2014-11-28/1200426629.PDF
2014-11-28,安控科技：关于在浙江富阳设立分公司的公告,finalpage/2014-11-28/1200426630.PDF
2014-12-04,安控科技：关于重大事项停牌进展公告,finalpage/2014-12-04/1200438241.PDF
2014-12-09,安控科技：董事会关于重大资产重组停牌公告,finalpage/2014-12-09/1200450575.PDF
2014-12-16,安控科技：重大资产重组进展公告,finalpage/2014-12-16/1200468008.PDF
2014-12-22,安控科技：重大资产重组进展公告,finalpage/2014-12-22/1200484609.PDF
2014-12-22,安控科技：对外投资进展公告,finalpage/2014-12-22/1200484610.PDF
2014-12-30,安控科技：关于向全资子公司浙江安控科技有限公司增资的进展公告,finalpage/2014-12-30/1200507815.PDF
2014-12-31,安控科技：重大资产重组进展公告,finalpage/2014-12-31/1200507440.PDF
2015-01-07,安控科技：关于重大资产重组事项进展暨延期复牌的公告,finalpage/2015-01-07/1200524915.PDF
2015-01-13,安控科技：重大资产重组进展公告,finalpage/2015-01-13/1200541127.PDF
2015-01-20,安控科技：重大资产重组进展公告,finalpage/2015-01-20/1200562305.PDF
2015-01-28,安控科技：重大资产重组进展公告,finalpage/2015-01-28/1200583750.PDF
2015-01-29,安控科技：2014年年度业绩预告,finalpage/2015-01-29/1200587182.PDF
2015-02-04,安控科技：关于重大资产重组事项进展暨延期复牌的公告,finalpage/2015-02-04/1200606721.PDF
2015-02-06,安控科技：关于通过高新技术企业重新认定的公告,finalpage/2015-02-06/1200612899.PDF
2015-02-11,安控科技：第三届董事会第十四次会议决议公告,finalpage/2015-02-11/1200626365.PDF
2015-02-11,安控科技：关于变更公司英文名称、英文简称等基本信息的公告,finalpage/2015-02-11/1200626366.PDF
2015-02-11,安控科技：关联交易决策制度（2015年2月）,finalpage/2015-02-11/1200626367.PDF
2015-02-11,安控科技：公司章程（2015年2月）,finalpage/2015-02-11/1200626368.PDF
2015-02-11,安控科技：关于选举副董事长、改聘总经理的公告,finalpage/2015-02-11/1200626369.PDF
2015-02-11,安控科技：关于公司选举副董事长、改聘总经理事项的独立意见,finalpage/2015-02-11/1200626370.PDF
2015-02-11,安控科技：发行股份及支付现金购买资产并募集配套资金报告书（草案）,finalpage/2015-02-11/1200626371.PDF
2015-02-11,安控科技：北京市时代九和律师事务所关于公司发行股份及支付现金购买资产并募集配套资金之法律意见书,finalpage/2015-02-11/1200626372.PDF
2015-02-11,安控科技：北京泽天盛海油田技术服务有限公司盈利预测审核报告,finalpage/2015-02-11/1200626373.PDF
2015-02-11,安控科技：北京泽天盛海油田技术服务有限公司审计报告,finalpage/2015-02-11/1200626374.PDF
2015-02-11,安控科技：企业价值评估报告书,finalpage/2015-02-11/1200626375.PDF
2015-02-11,安控科技：拟以发行股份及支付现金方式收购北京泽天盛海油田技术服务股份有限公司股权的企业价值评估说明,finalpage/2015-02-11/1200626376.PDF
2015-02-11,安控科技：拟以发行股份及支付现金方式收购北京泽天盛海油田技术服务股份有限公司股权所涉及的长期股权投资单位――北京泽天盛海能源技术服务有限公司评估说明,finalpage/2015-02-11/1200626377.PDF
2015-02-11,安控科技：拟以发行股份及支付现金方式收购北京泽天盛海油田技术服务股份有限公司股权所涉及的长期股权投资单位――北京泽天盛海石油工程技术有限公司的企业价值评估说明,finalpage/2015-02-11/1200626378.PDF
2015-02-11,安控科技：交易对方关于提供材料真实、准确、完整的承诺函,finalpage/2015-02-11/1200626379.PDF
2015-02-11,安控科技：安信证券股份有限公司关于公司《关于配合做好并购重组审核分道制相关工作的通知》的核查意见,finalpage/2015-02-11/1200626380.PDF
2015-02-11,安控科技：董事会关于公司股票价格波动是否达到《关于规范上市公司信息披露及相关各方行为的通知》第五条相关标准的说明,finalpage/2015-02-11/1200626381.PDF
2015-02-11,安控科技：第三届监事会第九次会议决议公告,finalpage/2015-02-11/1200626382.PDF
2015-02-11,安控科技：董事会关于本次发行股份及支付现金购买资产并募集配套资金履行法定程序的完备性、合规性及提交法律文件的有效性的说明,finalpage/2015-02-11/1200626383.PDF
2015-02-11,安控科技：独立董事关于公司发行股份及支付现金购买资产并募集配套资金事项的事前认可意见,finalpage/2015-02-11/1200626384.PDF
2015-02-11,安控科技：独立董事关于公司发行股份及支付现金购买资产并募集配套资金事项的独立意见,finalpage/2015-02-11/1200626385.PDF
2015-02-11,安控科技：发行股份及支付现金购买资产并募集配套资金之独立财务顾问报告,finalpage/2015-02-11/1200626386.PDF
2015-02-11,安控科技：董事会关于重大资产重组的一般风险提示暨复牌公告,finalpage/2015-02-11/1200626387.PDF
2015-02-11,安控科技：董事会关于召开2015年第一次临时股东大会的通知,finalpage/2015-02-11/1200626388.PDF
2015-02-11,安控科技：独立财务顾问在充分尽职调查和内核的基础上出具的承诺,finalpage/2015-02-11/1200626389.PDF
2015-02-11,安控科技：发行股份及支付现金购买资产并募集配套资金报告书（草案）摘要,finalpage/2015-02-11/1200626390.PDF
2015-02-13,安控科技：首次公开发行前已发行股份上市流通提示性公告,finalpage/2015-02-13/1200636689.PDF
2015-02-13,安控科技：安信证券股份有限公司关于公司首次公开发行股票前已发行股份解除限售上市流通的核查意见,finalpage/2015-02-13/1200636690.PDF
2015-02-26,安控科技：2015年第一次临时股东大会的律师见证法律意见书,finalpage/2015-02-26/1200653718.PDF
2015-02-26,安控科技：2015年第一次临时股东大会决议公告,finalpage/2015-02-26/1200654134.PDF
2015-02-27,安控科技：2014年度业绩快报,finalpage/2015-02-27/1200656302.PDF
2015-03-04,安控科技：关于收到《中国证监会行政许可申请受理通知书》的公告,finalpage/2015-03-04/1200669426.PDF
2015-03-04,安控科技：关于取得商标注册证书的公告,finalpage/2015-03-04/1200666720.PDF
