date,title,url
2015-12-01,安控科技：拟非公开发行股份收购克拉玛依市三达新技术股份有限公司股权项目资产评估报告,finalpage/2015-12-01/1201799116.PDF
2015-12-01,安控科技：2015年度非公开发行股票预案,finalpage/2015-12-01/1201799117.PDF
2015-12-01,安控科技：2015年度非公开发行股票方案的论证分析报告,finalpage/2015-12-01/1201799118.PDF
2015-12-01,安控科技：2015年度非公开发行股票募集资金使用的可行性分析报告,finalpage/2015-12-01/1201799119.PDF
2015-12-01,安控科技：关于最近五年被证券监管部门和交易所采取监管措施或处罚及整改情况的公告,finalpage/2015-12-01/1201799120.PDF
2015-12-01,安控科技：独立董事关于第三届董事会第三十一次会议相关事项的独立意见,finalpage/2015-12-01/1201799121.PDF
2015-12-01,安控科技：第三届监事会第二十次会议决议公告,finalpage/2015-12-01/1201799122.PDF
2015-12-01,安控科技：第三届董事会第三十一次会议决议公告,finalpage/2015-12-01/1201799123.PDF
2015-12-03,安控科技：关于注销募集资金专用账户的公告,finalpage/2015-12-03/1201804428.PDF
2015-12-08,安控科技：2015年第七次临时股东大会提示性公告,finalpage/2015-12-08/1201819544.PDF
2015-12-11,安控科技：关于完成注册资本工商变更登记的公告,finalpage/2015-12-11/1201830091.PDF
2015-12-14,安控科技：关于控股股东进行股票质押式回购交易的公告,finalpage/2015-12-14/1201832664.PDF
2015-12-15,安控科技：2015年第七次临时股东大会的律师见证法律意见书,finalpage/2015-12-15/1201836360.PDF
2015-12-15,安控科技：2015年第七次临时股东大会决议公告,finalpage/2015-12-15/1201836361.PDF
2015-12-23,安控科技：关于收到《中国证监会行政许可申请受理通知书》的公告,finalpage/2015-12-23/1201853713.PDF
2015-12-28,安控科技：第三届监事会第二十一次会议决议公告,finalpage/2015-12-28/1201869833.PDF
2015-12-28,安控科技：关于与杭州中恒电气股份有限公司签署合作框架协议的公告,finalpage/2015-12-28/1201869834.PDF
2015-12-28,安控科技：关于与关联方共同发起设立产业并购基金暨关联交易的公告,finalpage/2015-12-28/1201869835.PDF
2015-12-28,安控科技：第三届董事会第三十二次会议决议公告,finalpage/2015-12-28/1201869828.PDF
2015-12-28,安控科技：关于向银行申请综合授信额度由公司股东提供关联担保的公告,finalpage/2015-12-28/1201869829.PDF
2015-12-28,安控科技：独立董事关于公司与关联方共同发起设立产业并购基金暨关联交易的事前认可意见,finalpage/2015-12-28/1201869830.PDF
2015-12-28,安控科技：独立董事关于第三届董事会第三十二次会议相关事项的独立意见,finalpage/2015-12-28/1201869831.PDF
2015-12-28,安控科技：董事会关于召开2016年第一次临时股东大会的通知公告,finalpage/2015-12-28/1201869832.PDF
2016-01-06,安控科技：关于召开2016年第一次临时股东大会提示性公告,finalpage/2016-01-06/1201892287.PDF
2016-01-12,安控科技：关于中标中石化油气生产信息化项目的公告,finalpage/2016-01-12/1201907558.PDF
2016-01-13,安控科技：2016年第一次临时股东大会的律师见证法律意见书,finalpage/2016-01-13/1201909985.PDF
2016-01-13,安控科技：2016年第一次临时股东大会决议公告,finalpage/2016-01-13/1201909984.PDF
2016-01-15,安控科技：第三届董事会第三十三次会议决议公告,finalpage/2016-01-15/1201918264.PDF
2016-01-15,安控科技：独立董事关于第三届董事会第三十三次会议相关事项的独立意见,finalpage/2016-01-15/1201918265.PDF
2016-01-15,安控科技：第三届监事会第二十二次会议决议公告,finalpage/2016-01-15/1201918266.PDF
2016-01-15,安控科技：关于清算解散控股子公司北京安控联拓能源投资有限公司的公告,finalpage/2016-01-15/1201918267.PDF
2016-01-15,安控科技：关于将节余募集资金永久性补充流动资金的公告,finalpage/2016-01-15/1201918268.PDF
2016-01-15,安控科技：关于为控股孙公司郑州鑫胜电子科技有限公司提供担保的公告,finalpage/2016-01-15/1201918269.PDF
2016-01-15,安控科技：安信证券股份有限公司关于公司将节余募集资金永久性补充流动资金的专项核查意见,finalpage/2016-01-15/1201918270.PDF
2016-01-18,安控科技：关于公司技术中心被认定为“北京市企业技术中心”公告,finalpage/2016-01-18/1201922602.PDF
2016-01-18,安控科技：关于全资子公司签订《股权收购意向书》的公告,finalpage/2016-01-18/1201922603.PDF
2016-01-22,安控科技：关于收到《中国证监会行政许可项目审查反馈意见通知书》的公告,finalpage/2016-01-22/1201934874.PDF
2016-01-25,安控科技：安信证券股份有限公司关于公司首次公开发行股票前已发行股份解除限售上市流通的核查意见,finalpage/2016-01-25/1201935321.PDF
2016-01-25,安控科技：首次公开发行前已发行股份上市流通提示性公告,finalpage/2016-01-25/1201935322.PDF
2016-01-26,安控科技：2015年度业绩预告,finalpage/2016-01-26/1201943085.PDF
2016-01-26,安控科技：关于2015年度利润分配及资本公积金转增股本预案的预披露公告,finalpage/2016-01-26/1201943086.PDF
2016-01-26,安控科技：拟收购杭州青鸟电子有限公司股权项目资产评估报告,finalpage/2016-01-26/1201943087.PDF
2016-01-26,安控科技：第三届董事会第三十四次会议决议公告,finalpage/2016-01-26/1201943088.PDF
2016-01-26,安控科技：关于全资子公司收购杭州青鸟电子有限公司100%股权的公告,finalpage/2016-01-26/1201943089.PDF
2016-01-28,安控科技：关于2015年度利润分配及资本公积金转增股本预案的预披露补充公告,finalpage/2016-01-28/1201952761.PDF
2016-01-29,安控科技：关于前次募集资金使用（首次公开发行股票）情况的报告（更新至2015年12月31日）,finalpage/2016-01-29/1201953936.PDF
2016-01-29,安控科技：关于前次募集资金使用（发行股份及支付现金购买资产并募集配套资金）情况的报告,finalpage/2016-01-29/1201953937.PDF
2016-01-29,安控科技：前次募集资金使用情况鉴证报告（一）,finalpage/2016-01-29/1201953938.PDF
2016-01-29,安控科技：前次募集资金使用情况鉴证报告（二）,finalpage/2016-01-29/1201953939.PDF
2016-01-29,安控科技：关于公司2015年创业板非公开发行股票申请文件反馈意见的回复,finalpage/2016-01-29/1201953940.PDF
2016-01-29,安控科技：关于注销募集资金专用账户的公告,finalpage/2016-01-29/1201953928.PDF
2016-01-29,安控科技：关于召开2016年第二次临时股东大会通知的公告,finalpage/2016-01-29/1201953929.PDF
2016-01-29,安控科技：第三届监事会第二十三次会议决议公告,finalpage/2016-01-29/1201953930.PDF
2016-01-29,安控科技：关于非公开发行股票申请文件反馈意见回复的公告,finalpage/2016-01-29/1201953931.PDF
2016-01-29,安控科技：关于非公开发行股票预案修订情况说明的公告,finalpage/2016-01-29/1201953932.PDF
2016-01-29,安控科技：2015年度非公开发行股票预案（修订稿）,finalpage/2016-01-29/1201953933.PDF
2016-01-29,安控科技：2015年度非公开发行股票方案的论证分析报告,finalpage/2016-01-29/1201953934.PDF
2016-01-29,安控科技：关于非公开发行股票摊薄即期回报及填补回报措施的公告,finalpage/2016-01-29/1201953935.PDF
2016-01-29,安控科技：第三届董事会第三十五次会议决议公告,finalpage/2016-01-29/1201953926.PDF
2016-01-29,安控科技：独立董事关于第三届董事会第三十五次会议相关事项的独立意见,finalpage/2016-01-29/1201953927.PDF
2016-01-29,安控科技：关于股价异常波动的公告,finalpage/2016-01-29/1201953401.PDF
2016-02-16,安控科技：关于召开2016年第二次临时股东大会提示性公告,finalpage/2016-02-16/1201981986.PDF
2016-02-16,安控科技：关于全资子公司收购浙江求是嘉禾信息技术有限公司35%股权完成工商变更登记的公告,finalpage/2016-02-16/1201981987.PDF
2016-02-19,安控科技：第三届董事会第三十六次会议决议公告,finalpage/2016-02-19/1201987957.PDF
2016-02-19,安控科技：关于公司对外投资设立全资子公司的公告,finalpage/2016-02-19/1201987958.PDF
2016-02-19,安控科技：关于2016年度向银行申请综合授信额度由公司股东提供关联担保的公告,finalpage/2016-02-19/1201987959.PDF
2016-02-19,安控科技：关于召开2016年第三次临时股东大会通知的公告,finalpage/2016-02-19/1201987960.PDF
2016-02-19,安控科技：第三届监事会第二十四次会议决议公告,finalpage/2016-02-19/1201987961.PDF
2016-02-19,安控科技：独立董事关于第三届董事会第三十六次会议相关事项的独立意见,finalpage/2016-02-19/1201987962.PDF
2016-02-23,安控科技：关于取得中国储备粮管理总公司中标通知书的公告,finalpage/2016-02-23/1201992375.PDF
2016-02-23,安控科技：2016年第二次临时股东大会决议公告,finalpage/2016-02-23/1201992373.PDF
2016-02-23,安控科技：2016年第二次临时股东大会的律师见证法律意见书,finalpage/2016-02-23/1201992374.PDF
2016-02-25,安控科技：2015年度业绩快报,finalpage/2016-02-25/1201999258.PDF
2016-03-02,安控科技：关于召开2016年第三次临时股东大会提示性公告,finalpage/2016-03-02/1202017614.PDF
2016-03-03,安控科技：关于全资子公司浙江安控科技有限公司完成工商变更登记的公告,finalpage/2016-03-03/1202020618.PDF
2016-03-08,安控科技：关于公司2015年创业板非公开发行股票交易标的克拉玛依市三达新技术股份有限公司业绩情况的说明,finalpage/2016-03-08/1202029934.PDF
2016-03-08,安控科技：2016年第三次临时股东大会决议公告,finalpage/2016-03-08/1202029932.PDF
2016-03-08,安控科技：2016年第三次临时股东大会的律师见证法律意见书,finalpage/2016-03-08/1202029933.PDF
2016-03-09,安控科技：关于非公开发行股票获得中国证监会发行审核委员会审核通过的公告,finalpage/2016-03-09/1202032041.PDF
2016-03-15,安控科技：关于收到“北京市发展和改革委员会2015年认定北京市工程研究中心和工程实验室的批复”的公告,finalpage/2016-03-15/1202048009.PDF
2016-03-18,安控科技：独立董事关于第三届董事会第三十七次会议相关事项的独立意见,finalpage/2016-03-18/1202056897.PDF
2016-03-18,安控科技：关于全资子公司内部股权转让的公告,finalpage/2016-03-18/1202056899.PDF
2016-03-18,安控科技：第三届监事会第二十五次会议决议公告,finalpage/2016-03-18/1202056898.PDF
2016-03-18,安控科技：第三届董事会第三十七次会议决议公告,finalpage/2016-03-18/1202056896.PDF
2016-03-30,安控科技：关于与龙芯中科技术有限公司签署战略合作框架协议的公告,finalpage/2016-03-30/1202113150.PDF
2016-04-05,安控科技：关于全资子公司完成工商设立登记的公告,finalpage/2016-04-05/1202138794.PDF
2016-04-05,安控科技：2016年第一季度业绩预告,finalpage/2016-04-05/1202138795.PDF
2016-04-15,安控科技：第三届董事会第三十八次会议决议公告,finalpage/2016-04-15/1202185626.PDF
2016-04-15,安控科技：关于公司2016年度办理部分应收账款质押登记业务的公告,finalpage/2016-04-15/1202185627.PDF
2016-04-15,安控科技：关于变更保荐代表人的公告,finalpage/2016-04-15/1202185628.PDF
2016-04-25,安控科技：2015年年度报告披露提示性公告,finalpage/2016-04-25/1202227120.PDF
2016-04-25,安控科技：第三届董事会第三十九次会议决议公告,finalpage/2016-04-25/1202227121.PDF
2016-04-25,安控科技：第三届监事会二十六次会议决议公告,finalpage/2016-04-25/1202227122.PDF
2016-04-25,安控科技：2016年度第一季度报告披露提示性公告,finalpage/2016-04-25/1202227123.PDF
2016-04-25,安控科技：2015年度募集资金存放与使用情况的专项报告,finalpage/2016-04-25/1202227125.PDF
2016-04-25,安控科技：2016年第一季度报告全文,finalpage/2016-04-25/1202227126.PDF
2016-04-25,安控科技：2015年度内部控制自我评价报告,finalpage/2016-04-25/1202227127.PDF
2016-04-25,安控科技：关于北京泽天盛海油田技术服务有限公司2015年度业绩承诺完成情况的说明,finalpage/2016-04-25/1202227128.PDF
2016-04-25,安控科技：2015年度独立董事述职报告（俞鹂）,finalpage/2016-04-25/1202227129.PDF
2016-04-25,安控科技：2015年度独立董事述职报告（李量）,finalpage/2016-04-25/1202227130.PDF
2016-04-25,安控科技：2015年度独立董事述职报告（赵斌）,finalpage/2016-04-25/1202227131.PDF
2016-04-25,安控科技：关于召开2015年年度股东大会通知的公告,finalpage/2016-04-25/1202227132.PDF
2016-04-25,安控科技：关于举行2015年度网上业绩说明会的公告,finalpage/2016-04-25/1202227133.PDF
2016-04-25,安控科技：2015年度监事会工作报告,finalpage/2016-04-25/1202227134.PDF
2016-04-25,安控科技：安信证券股份有限公司关于公司2015年度募集资金存放与使用情况的专项核查意见,finalpage/2016-04-25/1202227135.PDF
2016-04-25,安控科技：安信证券股份有限公司关于北京泽天盛海油田技术服务有限公司2015年度业绩承诺完成情况的专项核查意见,finalpage/2016-04-25/1202227136.PDF
2016-04-25,安控科技：安信证券股份有限公司关于公司2015年度内部控制自我评价报告的核查意见,finalpage/2016-04-25/1202227137.PDF
2016-04-25,安控科技：2015年年度报告摘要,finalpage/2016-04-25/1202227138.PDF
2016-04-25,安控科技：公司章程（2016年4月）,finalpage/2016-04-25/1202227139.PDF
2016-04-25,安控科技：2015年年度报告,finalpage/2016-04-25/1202227141.PDF
2016-04-25,安控科技：独立董事关于第三届董事会第三十九次会议相关事项的独立意见,finalpage/2016-04-25/1202227142.PDF
2016-04-25,安控科技：内部控制鉴证报告,finalpage/2016-04-25/1202227143.PDF
2016-04-25,安控科技：控股股东及其他关联方资金占用情况的专项审核报告,finalpage/2016-04-25/1202227144.PDF
2016-04-25,安控科技：重大资产重组标的资产业绩承诺完成情况的专项审核报告,finalpage/2016-04-25/1202227145.PDF
2016-04-25,安控科技：2015年年度审计报告,finalpage/2016-04-25/1202227146.PDF
2016-04-25,安控科技：募集资金年度存放与使用情况的鉴证报告,finalpage/2016-04-25/1202227147.PDF
2016-04-25,安控科技：关于2015年度利润分配预案的公告,finalpage/2016-04-25/1202227148.PDF
2016-05-03,安控科技：关于全资子公司收购杭州青鸟电子有限公司100%股权完成工商变更登记的公告,finalpage/2016-05-03/1202286660.PDF
2016-05-04,安控科技：安信证券股份有限公司关于公司2015年度持续督导跟踪报告,finalpage/2016-05-04/1202294080.PDF
2016-05-04,安控科技：安信证券股份有限公司关于公司发行股份及支付现金购买资产并募集配套资金之2015年度持续督导报告,finalpage/2016-05-04/1202294081.PDF
2016-05-06,安控科技：独立董事关于第三届董事会第四十次会议相关事项的独立意见,finalpage/2016-05-06/1202302971.PDF
2016-05-06,安控科技：关于公开发行公司债券的公告,finalpage/2016-05-06/1202302972.PDF
2016-05-06,安控科技：关于对全资孙公司杭州青鸟电子有限公司增资的公告,finalpage/2016-05-06/1202302973.PDF
2016-05-06,安控科技：关于召开2016年第四次临时股东大会通知的公告,finalpage/2016-05-06/1202302974.PDF
2016-05-06,安控科技：关于全资子公司内部股权转让的公告,finalpage/2016-05-06/1202302975.PDF
2016-05-06,安控科技：关于全资子公司拟申请银行综合授信额度暨公司股东及公司提供关联担保的公告,finalpage/2016-05-06/1202302976.PDF
2016-05-06,安控科技：关于控股股东、实际控制人解除股权质押的公告,finalpage/2016-05-06/1202302977.PDF
2016-05-06,安控科技：第三届监事会二十七次会议决议公告,finalpage/2016-05-06/1202302970.PDF
2016-05-06,安控科技：第三届董事会第四十次会议决议公告,finalpage/2016-05-06/1202302978.PDF
2016-05-12,安控科技：关于召开2015年年度股东大会提示性公告,finalpage/2016-05-12/1202318497.PDF
2016-05-12,安控科技：关于参股公司新疆宇澄热力股份有限公司完成工商变更登记的公告,finalpage/2016-05-12/1202318498.PDF
2016-05-16,安控科技：第三届监事会二十八次会议决议公告,finalpage/2016-05-16/1202323374.PDF
2016-05-16,安控科技：独立董事关于第三届董事会第四十一次会议相关事项的独立意见,finalpage/2016-05-16/1202323375.PDF
2016-05-16,安控科技：关于公司控股子公司股权内部转让的公告,finalpage/2016-05-16/1202323376.PDF
2016-05-16,安控科技：关于取得计算机软件著作权和实用新型专利的公告,finalpage/2016-05-16/1202323377.PDF
2016-05-16,安控科技：关于全资子公司对外投资成立合资公司的公告,finalpage/2016-05-16/1202323378.PDF
2016-05-16,安控科技：第三届董事会第四十一次会议决议公告,finalpage/2016-05-16/1202323379.PDF
2016-05-18,安控科技：关于召开2016年第四次临时股东大会提示性公告,finalpage/2016-05-18/1202328378.PDF
2016-05-18,安控科技：关于更换持续督导财务顾问主办人的公告,finalpage/2016-05-18/1202328379.PDF
2016-05-18,安控科技：2015年年度股东大会决议公告,finalpage/2016-05-18/1202328380.PDF
2016-05-18,安控科技：2015年年度股东大会的律师见证法律意见书,finalpage/2016-05-18/1202328381.PDF
2016-05-19,安控科技：2015年度利润分配实施公告,finalpage/2016-05-19/1202330714.PDF
2016-05-24,安控科技：2016年第四次临时股东大会决议公告,finalpage/2016-05-24/1202336877.PDF
2016-05-24,安控科技：2016年第四次临时股东大会的律师见证法律意见书,finalpage/2016-05-24/1202336878.PDF
2016-05-26,安控科技：关于公司控股股东、实际控制人进行股票质押式回购交易及部分股权解除质押的公告,finalpage/2016-05-26/1202340572.PDF
2016-05-30,安控科技：关于调整股票期权激励计划期权数量和行权价格的公告,finalpage/2016-05-30/1202345185.PDF
2016-05-30,安控科技：关于全资子公司对外投资的公告,finalpage/2016-05-30/1202345186.PDF
2016-05-30,安控科技：独立董事关于第三届董事会第四十二次会议相关事项的独立意见,finalpage/2016-05-30/1202345182.PDF
2016-05-30,安控科技：北京市时代九和律师事务所关于公司股票期权激励计划股票期权数量及行权价格调整之法律意见书,finalpage/2016-05-30/1202345183.PDF
2016-05-30,安控科技：关于实施2015年度权益分派方案后调整非公开发行股票发行数量的公告,finalpage/2016-05-30/1202345184.PDF
2016-05-30,安控科技：第三届董事会第四十二次会议决议公告,finalpage/2016-05-30/1202345181.PDF
2016-06-07,安控科技：关于全资孙公司完成工商变更登记的公告,finalpage/2016-06-07/1202360094.PDF
2016-06-07,安控科技：关于全资子公司对外投资设立合资公司完成工商设立登记的公告,finalpage/2016-06-07/1202360095.PDF
2016-06-14,安控科技：关于完成注册资本工商变更登记的公告,finalpage/2016-06-14/1202368171.PDF
2016-06-14,安控科技：关于参股孙公司完成工商变更登记的公告,finalpage/2016-06-14/1202368172.PDF
2016-06-14,安控科技：关于公司控股孙公司完成工商变更登记的公告,finalpage/2016-06-14/1202368173.PDF
2016-06-16,安控科技：关于持股5%以上股东减持股份的公告,finalpage/2016-06-16/1202372536.PDF
2016-06-24,安控科技：关于股价异常波动的公告,finalpage/2016-06-24/1202404743.PDF
2016-06-27,安控科技：关于收到中国证监会核准非公开发行股票批复的公告,finalpage/2016-06-27/1202422257.PDF
2016-06-27,安控科技：关于公司控股股东、实际控制人进行股票质押式回购交易的公告,finalpage/2016-06-27/1202418494.PDF
2016-06-29,安控科技：关于公司全资孙公司完成工商变更登记的公告,finalpage/2016-06-29/1202437641.PDF
2016-06-29,安控科技：关于持股5%以上股东减持股份的公告,finalpage/2016-06-29/1202437640.PDF
2016-07-04,安控科技：关于公司控股股东、实际控制人部分股权解除质押的公告,finalpage/2016-07-04/1202448813.PDF
2016-07-08,安控科技：第三届董事会第四十三次会议决议公告,finalpage/2016-07-08/1202460814.PDF
2016-07-08,安控科技：关于对全资子公司陕西安控科技有限公司增资的公告,finalpage/2016-07-08/1202460815.PDF
2016-07-08,安控科技：关于对全资子公司浙江安控科技有限公司增资的公告,finalpage/2016-07-08/1202460816.PDF
2016-07-08,安控科技：关于公司控股股东、实际控制人进行股票质押式回购交易的公告,finalpage/2016-07-08/1202460817.PDF
2016-07-08,安控科技：关于持股5%以上股东进行股票质押式回购交易的公告,finalpage/2016-07-08/1202460818.PDF
2016-07-12,安控科技：2016年半年度业绩预告,finalpage/2016-07-12/1202467492.PDF
2016-07-13,安控科技：关于持股5%以上股东进行股票质押式回购交易及部分股权解除质押的公告,finalpage/2016-07-13/1202469511.PDF
2016-07-18,安控科技：第三届董事会第四十四次会议决议公告,finalpage/2016-07-18/1202480182.PDF
2016-07-18,安控科技：关于转让控股子公司厦门安控联润科技有限公司股权的公告,finalpage/2016-07-18/1202480183.PDF
2016-07-20,安控科技：关于公司控股股东、实际控制人部分股权解除质押的公告,finalpage/2016-07-20/1202492674.PDF
2016-07-26,安控科技：独立董事关于第三届董事会第四十五次会议相关事项的独立意见,finalpage/2016-07-26/1202505829.PDF
2016-07-26,安控科技：关于控股孙公司拟申请银行综合授信额度暨公司提供担保的公告,finalpage/2016-07-26/1202505830.PDF
2016-07-26,安控科技：关于召开2016年第五次临时股东大会通知的公告,finalpage/2016-07-26/1202505831.PDF
2016-07-26,安控科技：第三届监事会第二十九次会议决议公告,finalpage/2016-07-26/1202505828.PDF
2016-07-26,安控科技：第三届董事会第四十五次会议决议公告,finalpage/2016-07-26/1202505827.PDF
2016-07-29,安控科技：关于全资子公司浙江安控科技有限公司完成工商变更登记的公告,finalpage/2016-07-29/1202517160.PDF
2016-08-02,安控科技：第三届董事会第四十六次会议决议公告,finalpage/2016-08-02/1202531975.PDF
2016-08-02,安控科技：第三届监事会第三十次会议决议公告,finalpage/2016-08-02/1202531976.PDF
2016-08-02,安控科技：独立董事关于第三届董事会第四十六次会议相关事项的独立意见,finalpage/2016-08-02/1202531977.PDF
2016-08-02,安控科技：关于全资子公司向银行申请综合授信额度暨公司提供担保的公告,finalpage/2016-08-02/1202531978.PDF
2016-08-02,安控科技：关于注销北京安控科技股份有限公司富阳分公司的公告,finalpage/2016-08-02/1202531979.PDF
2016-08-04,安控科技：关于召开2016年第五次临时股东大会提示性公告,finalpage/2016-08-04/1202536282.PDF
2016-08-10,安控科技：2016年第五次临时股东大会决议公告,finalpage/2016-08-10/1202553591.PDF
2016-08-10,安控科技：2016年第五次临时股东大会的律师见证法律意见书,finalpage/2016-08-10/1202553592.PDF
2016-08-10,安控科技：关于全资子公司陕西安控科技有限公司完成工商变更登记的公告,finalpage/2016-08-10/1202553593.PDF
2016-08-16,安控科技：停牌公告,finalpage/2016-08-16/1202566769.PDF
2016-08-19,安控科技：关于召开2016年第六次临时股东大会通知的公告,finalpage/2016-08-19/1202592912.PDF
2016-08-19,安控科技：第三届董事会第四十七次会议决议公告,finalpage/2016-08-19/1202592906.PDF
2016-08-19,安控科技：第三届监事会第三十一次会议决议公告,finalpage/2016-08-19/1202592907.PDF
2016-08-19,安控科技：独立董事关于第三届董事会第四十七次会议相关事项的独立意见,finalpage/2016-08-19/1202592908.PDF
2016-08-19,安控科技：关于公司向银行申请并购贷款暨公司股东提供关联担保的公告,finalpage/2016-08-19/1202592909.PDF
2016-08-19,安控科技：关于为全资子公司浙江安控科技有限公司申请综合授信暨公司股东及公司提供关联担保的公告,finalpage/2016-08-19/1202592910.PDF
2016-08-19,安控科技：关于为全资孙公司杭州安控环保科技有限公司申请综合授信暨公司股东及公司提供关联担保的公告,finalpage/2016-08-19/1202592911.PDF
2016-08-20,安控科技：关于完成非公开发行股票特定投资者询价事项暨股票复牌的公告,finalpage/2016-08-20/1202592838.PDF
2016-08-27,安控科技：2016年半年度报告披露提示性公告,finalpage/2016-08-27/1202629782.PDF
2016-08-27,安控科技：第三届董事会第四十八次会议决议公告,finalpage/2016-08-27/1202629783.PDF
2016-08-27,安控科技：第三届监事会第三十二次会议决议公告,finalpage/2016-08-27/1202629784.PDF
