date,title,url
2017-07-28,科大国创：独立董事关于相关事项的独立意见,finalpage/2017-07-28/1203739630.PDF
2017-07-28,科大国创：公司章程（2017年7月）,finalpage/2017-07-28/1203739631.PDF
2017-07-28,科大国创：安徽天禾律师事务所关于公司终止实施限制性股票激励计划相关事项的法律意见书,finalpage/2017-07-28/1203739632.PDF
2017-07-28,科大国创：关于终止实施限制性股票激励计划的公告,finalpage/2017-07-28/1203739633.PDF
2017-07-28,科大国创：关于召开2017年第二次临时股东大会的通知公告,finalpage/2017-07-28/1203739634.PDF
2017-08-15,科大国创：2017年第二次临时股东大会决议公告,finalpage/2017-08-15/1203796671.PDF
2017-08-15,科大国创：关于终止实施限制性股票的减资公告,finalpage/2017-08-15/1203796672.PDF
2017-08-15,科大国创：2017年第二次临时股东大会的法律意见书,finalpage/2017-08-15/1203796673.PDF
2017-08-22,科大国创：关于2017年半年度报告披露的提示性公告,finalpage/2017-08-22/1203835941.PDF
2017-08-22,科大国创：第二届董事会第十八次会议决议公告,finalpage/2017-08-22/1203835942.PDF
2017-08-22,科大国创：国元证券股份有限公司关于公司2017年半年度持续督导跟踪报告,finalpage/2017-08-22/1203835943.PDF
2017-08-22,科大国创：关于会计政策变更的公告,finalpage/2017-08-22/1203835944.PDF
2017-08-22,科大国创：2017年上半年募集资金存放与使用情况的专项报告,finalpage/2017-08-22/1203835945.PDF
2017-08-22,科大国创：独立董事关于相关事项的独立意见,finalpage/2017-08-22/1203835946.PDF
2017-08-22,科大国创：第二届监事会第十四次会议决议公告,finalpage/2017-08-22/1203835947.PDF
2017-08-22,科大国创：2017年半年度报告摘要,finalpage/2017-08-22/1203835948.PDF
2017-08-22,科大国创：2017年半年度报告（已取消）,finalpage/2017-08-22/1203835950.PDF
2017-08-23,科大国创：关于2017年半年度报告的更正公告,finalpage/2017-08-23/1203847661.PDF
2017-08-23,科大国创：2017年半年度报告（更新后）,finalpage/2017-08-23/1203847662.PDF
2017-09-06,科大国创：股票交易异常波动及风险提示公告,finalpage/2017-09-06/1203938295.PDF
2017-09-15,科大国创：股票交易异常波动公告,finalpage/2017-09-15/1203975708.PDF
2017-09-19,科大国创：关于参加2017年安徽上市公司投资者网上集体接待日活动的公告,finalpage/2017-09-19/1203981782.PDF
2017-09-20,科大国创：关于持股5%以上股东减持公司股份的预披露公告,finalpage/2017-09-20/1203987961.PDF
2017-09-29,科大国创：第二届董事会第十九次会议决议公告,finalpage/2017-09-29/1204011834.PDF
2017-09-29,科大国创：关于吸收合并全资子公司的公告,finalpage/2017-09-29/1204011835.PDF
2017-09-29,科大国创：关于召开2017年第三次临时股东大会的通知公告,finalpage/2017-09-29/1204011836.PDF
2017-10-17,科大国创：2017年第三次临时股东大会决议公告,finalpage/2017-10-17/1204045633.PDF
2017-10-17,科大国创：2017年第三次临时股东大会的法律意见书,finalpage/2017-10-17/1204045634.PDF
2017-10-26,科大国创：关于2017年第三季度报告披露的提示性公告,finalpage/2017-10-26/1204070532.PDF
2017-10-26,科大国创：第二届董事会第二十次会议决议公告,finalpage/2017-10-26/1204070534.PDF
2017-10-26,科大国创：第二届监事会第十五次会议决议公告,finalpage/2017-10-26/1204070535.PDF
2017-10-26,科大国创：关于为控股子公司申请银行综合授信提供担保的公告,finalpage/2017-10-26/1204070536.PDF
2017-10-26,科大国创：关于公司及控股子公司使用闲置自有资金进行投资理财的公告,finalpage/2017-10-26/1204070537.PDF
2017-10-26,科大国创：关于召开2017年第四次临时股东大会的通知公告,finalpage/2017-10-26/1204070538.PDF
2017-10-26,科大国创：2017年第三季度报告全文,finalpage/2017-10-26/1204070539.PDF
2017-10-26,科大国创：独立董事关于相关事项的独立意见,finalpage/2017-10-26/1204070540.PDF
2017-10-26,科大国创：国元证券股份有限公司关于公司及控股子公司使用闲置自有资金进行投资理财的核查意见,finalpage/2017-10-26/1204070541.PDF
2017-11-11,科大国创：2017年第四次临时股东大会的法律意见书,finalpage/2017-11-11/1204131679.PDF
2017-11-11,科大国创：2017年第四次临时股东大会决议公告,finalpage/2017-11-11/1204131680.PDF
2017-11-15,科大国创：关于实际控制人部分股权质押的公告,finalpage/2017-11-15/1204139325.PDF
2017-11-21,科大国创：股票交易异常波动公告,finalpage/2017-11-21/1204153391.PDF
2017-11-28,科大国创：关于持股5%以上股东减持比例达到1%的公告,finalpage/2017-11-28/1204172412.PDF
2017-11-30,科大国创：关于限制性股票回购注销完成的公告,finalpage/2017-11-30/1204176143.PDF
2017-12-08,科大国创：关于完成工商变更登记的公告,finalpage/2017-12-08/1204199802.PDF
2017-12-27,科大国创：第二届董事会第二十一次会议决议公告,finalpage/2017-12-27/1204270188.PDF
2017-12-27,科大国创：第二届监事会第十六次会议决议公告,finalpage/2017-12-27/1204270189.PDF
2017-12-27,科大国创：关于调整2017年度日常关联交易预计的公告,finalpage/2017-12-27/1204270190.PDF
2017-12-27,科大国创：国元证券股份有限公司关于公司调整2017年度日常关联交易预计的核查意见,finalpage/2017-12-27/1204270191.PDF
2017-12-27,科大国创：独立董事关于相关事项的独立意见,finalpage/2017-12-27/1204270192.PDF
2017-12-27,科大国创：独立董事关于相关事项的事前认可意见,finalpage/2017-12-27/1204270193.PDF
2018-01-17,科大国创：关于通过高新技术企业重新认定的公告,finalpage/2018-01-17/1204335931.PDF
2018-01-19,科大国创：关于持股5%以上股东股份减持计划的进展公告,finalpage/2018-01-19/1204343142.PDF
2018-01-25,科大国创：关于为控股子公司提供担保的进展公告,finalpage/2018-01-25/1204359762.PDF
2018-01-30,科大国创：2017年度业绩预告,finalpage/2018-01-30/1204373126.PDF
2018-02-01,科大国创：关于股东股份减持计划期限届满暨实施情况的公告,finalpage/2018-02-01/1204379353.PDF
2018-02-08,科大国创：关于全资子公司通过高新技术企业重新认定的公告,finalpage/2018-02-08/1204401528.PDF
