date,title,url
2016-06-20,科大国创：2012年年度股东大会决议,finalpage/2016-06-20/1202375052.PDF
2016-06-20,科大国创：审计报告,finalpage/2016-06-20/1202375053.PDF
2016-06-20,科大国创：2013年年度股东大会决议,finalpage/2016-06-20/1202375054.PDF
2016-06-20,科大国创：2014年年度股东大会决议,finalpage/2016-06-20/1202375055.PDF
2016-06-20,科大国创：中国证监会关于核准公司首次公开发行股票的批复,finalpage/2016-06-20/1202375056.PDF
2016-06-20,科大国创：公司章程（草案）,finalpage/2016-06-20/1202375057.PDF
2016-06-20,科大国创：关于公司设立以来股本演变情况的说明及其董事、监事、高级管理人员的确认意见,finalpage/2016-06-20/1202375058.PDF
2016-06-20,科大国创：内部控制鉴证报告,finalpage/2016-06-20/1202375059.PDF
2016-06-20,科大国创：国元证券股份有限公司关于公司首次公开发行股票并在创业板上市之发行保荐工作报告,finalpage/2016-06-20/1202375060.PDF
2016-06-20,科大国创：国元证券股份有限公司关于公司首次公开发行股票并在创业板上市之证券发行保荐书,finalpage/2016-06-20/1202375061.PDF
2016-06-20,科大国创：首次公开发行股票并在创业板上市之律师工作报告,finalpage/2016-06-20/1202375062.PDF
2016-06-20,科大国创：首次公开发行股票并在创业板上市之法律意见书,finalpage/2016-06-20/1202375063.PDF
2016-06-20,科大国创：首次公开发行股票并在创业板上市之补充律师工作报告,finalpage/2016-06-20/1202375064.PDF
2016-06-20,科大国创：安徽天禾律师事务所关于公司首次公开发行股票并在创业板上市之补充法律意见书（一）,finalpage/2016-06-20/1202375065.PDF
2016-06-20,科大国创：安徽天禾律师事务所关于公司首次公开发行股票并在创业板上市之补充法律意见书（七）,finalpage/2016-06-20/1202375066.PDF
2016-06-20,科大国创：安徽天禾律师事务所关于公司首次公开发行股票并在创业板上市之补充法律意见书（三）,finalpage/2016-06-20/1202375067.PDF
2016-06-20,科大国创：安徽天禾律师事务所关于公司首次公开发行股票并在创业板上市之补充法律意见书（二）,finalpage/2016-06-20/1202375068.PDF
2016-06-20,科大国创：安徽天禾律师事务所关于公司首次公开发行股票并在创业板上市之补充法律意见书（五）,finalpage/2016-06-20/1202375069.PDF
2016-06-20,科大国创：安徽天禾律师事务所关于公司首次公开发行股票并在创业板上市之补充法律意见书（八）,finalpage/2016-06-20/1202375070.PDF
2016-06-20,科大国创：安徽天禾律师事务所关于公司首次公开发行股票并在创业板上市之补充法律意见书（六）,finalpage/2016-06-20/1202375071.PDF
2016-06-20,科大国创：安徽天禾律师事务所关于公司首次公开发行股票并在创业板上市之补充法律意见书（四）,finalpage/2016-06-20/1202375072.PDF
2016-06-20,科大国创：审阅报告,finalpage/2016-06-20/1202375073.PDF
2016-06-20,科大国创：控股股东、实际控制人对招股意向书的确认意见,finalpage/2016-06-20/1202375074.PDF
2016-06-20,科大国创：第一届董事会第六次会议决议,finalpage/2016-06-20/1202375075.PDF
2016-06-20,科大国创：第一届董事会第十六次会议决议,finalpage/2016-06-20/1202375076.PDF
2016-06-20,科大国创：第一届董事会第十次会议决议,finalpage/2016-06-20/1202375077.PDF
2016-06-20,科大国创：非经常性损益鉴证报告,finalpage/2016-06-20/1202375078.PDF
2016-06-20,科大国创：首次公开发行股票并在创业板上市初步询价及推介公告,finalpage/2016-06-20/1202375079.PDF
2016-06-20,科大国创：首次公开发行股票并在创业板上市招股意向书,finalpage/2016-06-20/1202375080.PDF
2016-06-20,科大国创：首次公开发行股票并在创业板上市提示公告,finalpage/2016-06-20/1202375081.PDF
2016-06-24,科大国创：首次公开发行股票并在创业板上市网上路演公告,finalpage/2016-06-24/1202396536.PDF
2016-06-27,科大国创：首次公开发行股票并在创业板上市发行公告,finalpage/2016-06-27/1202409872.PDF
2016-06-27,科大国创：首次公开发行股票并在创业板上市投资风险特别公告,finalpage/2016-06-27/1202409873.PDF
2016-06-27,科大国创：首次公开发行股票并在创业板上市招股说明书,finalpage/2016-06-27/1202409874.PDF
2016-06-29,科大国创：首次公开发行股票并在创业板上市网上定价发行申购情况及中签率公告,finalpage/2016-06-29/1202434665.PDF
2016-06-30,科大国创：首次公开发行股票并在创业板上市网下发行初步配售结果公告,finalpage/2016-06-30/1202437357.PDF
2016-06-30,科大国创：首次公开发行股票并在创业板上市网上中签结果公告,finalpage/2016-06-30/1202437376.PDF
2016-07-04,科大国创：首次公开发行股票并在创业板上市发行结果公告,finalpage/2016-07-04/1202447869.PDF
2016-07-07,科大国创：国元证券股份有限公司关于公司股票上市保荐书,finalpage/2016-07-07/1202455906.PDF
2016-07-07,科大国创：首次公开发行股票并在创业板上市之上市公告书,finalpage/2016-07-07/1202455907.PDF
2016-07-07,科大国创：首次公开发行股票并在创业板上市之上市公告书提示性公告,finalpage/2016-07-07/1202455908.PDF
2016-07-07,科大国创：安徽天禾律师事务所关于公司首次公开发行股票于深圳证券交易所创业板上市之法律意见书,finalpage/2016-07-07/1202455910.PDF
2016-07-13,科大国创：股票交易异常波动及风险提示公告,finalpage/2016-07-13/1202467994.PDF
2016-07-18,科大国创：股票交易异常波动及风险提示公告,finalpage/2016-07-18/1202477141.PDF
2016-07-21,科大国创：股票交易异常波动及风险提示公告,finalpage/2016-07-21/1202493684.PDF
2016-07-25,科大国创：股票交易异常波动及风险提示公告,finalpage/2016-07-25/1202500529.PDF
2016-07-27,科大国创：独立董事对相关事项的独立意见,finalpage/2016-07-27/1202508447.PDF
2016-07-27,科大国创：第二届监事会第三次会议决议公告,finalpage/2016-07-27/1202508448.PDF
2016-07-27,科大国创：第二届董事会第四次会议决议公告,finalpage/2016-07-27/1202508449.PDF
2016-07-27,科大国创：关于签署募集资金三方监管协议的公告,finalpage/2016-07-27/1202508450.PDF
2016-07-27,科大国创：关于使用部分闲置募集资金进行现金管理的公告,finalpage/2016-07-27/1202508451.PDF
2016-07-27,科大国创：国元证券股份有限公司关于公司使用部分闲置募集资金进行现金管理的核查意见,finalpage/2016-07-27/1202508452.PDF
2016-07-27,科大国创：关于召开2016年第一次临时股东大会的通知公告,finalpage/2016-07-27/1202508453.PDF
2016-07-27,科大国创：董事、监事和高级管理人员持有和买卖本公司股票管理制度（2016年7月）,finalpage/2016-07-27/1202508454.PDF
2016-07-27,科大国创：独立董事年报工作制度（2016年7月）,finalpage/2016-07-27/1202508455.PDF
2016-07-27,科大国创：对外担保管理制度（2016年7月）,finalpage/2016-07-27/1202508456.PDF
2016-07-27,科大国创：对外投资管理制度（2016年7月）,finalpage/2016-07-27/1202508457.PDF
2016-07-27,科大国创：非日常经营交易事项决策制度（2016年7月）,finalpage/2016-07-27/1202508458.PDF
2016-07-27,科大国创：公司章程（2016年7月）,finalpage/2016-07-27/1202508459.PDF
2016-07-27,科大国创：股东大会投票计票制度（2016年7月）,finalpage/2016-07-27/1202508460.PDF
2016-07-27,科大国创：募集资金管理制度（2016年7月）,finalpage/2016-07-27/1202508461.PDF
2016-07-27,科大国创：内幕信息知情人登记管理制度（2016年7月）,finalpage/2016-07-27/1202508462.PDF
2016-07-27,科大国创：日常生产经营交易事项决策制度（2016年7月）,finalpage/2016-07-27/1202508463.PDF
2016-07-27,科大国创：投资者关系管理制度（2016年7月）,finalpage/2016-07-27/1202508464.PDF
2016-07-27,科大国创：重大财务决策制度（2016年7月）,finalpage/2016-07-27/1202508465.PDF
2016-07-27,科大国创：年报信息披露重大差错责任追究制度（2016年7月）,finalpage/2016-07-27/1202508466.PDF
2016-07-27,科大国创：重大信息内部报告制度（2016年7月）,finalpage/2016-07-27/1202508467.PDF
2016-07-28,科大国创：股票交易异常波动及风险提示公告,finalpage/2016-07-28/1202511156.PDF
2016-08-01,科大国创：股票交易异常波动及风险提示公告,finalpage/2016-08-01/1202518317.PDF
2016-08-03,科大国创：股票交易异常波动及风险提示公告,finalpage/2016-08-03/1202532154.PDF
2016-08-05,科大国创：2016年限制性股票激励计划（草案）,finalpage/2016-08-05/1202540564.PDF
2016-08-05,科大国创：上海荣正投资咨询有限公司关于公司2016年限制性股票激励计划（草案）之独立财务顾问报告,finalpage/2016-08-05/1202540565.PDF
2016-08-05,科大国创：关于开立现金管理专用结算账户的公告,finalpage/2016-08-05/1202540566.PDF
2016-08-05,科大国创：关于子公司完成工商变更登记的公告,finalpage/2016-08-05/1202540567.PDF
2016-08-05,科大国创：第二届监事会第四次会议决议公告,finalpage/2016-08-05/1202540557.PDF
2016-08-05,科大国创：独立董事关于相关事项的独立意见,finalpage/2016-08-05/1202540558.PDF
2016-08-05,科大国创：2016年限制性股票激励计划（草案）摘要,finalpage/2016-08-05/1202540559.PDF
2016-08-05,科大国创：2016年限制性股票激励计划首次授予部分激励对象名单,finalpage/2016-08-05/1202540560.PDF
2016-08-05,科大国创：2016年限制性股票激励计划实施考核管理办法（2016年8月）,finalpage/2016-08-05/1202540561.PDF
2016-08-05,科大国创：第二届董事会第五次会议决议公告,finalpage/2016-08-05/1202540562.PDF
2016-08-05,科大国创：安徽天禾律师事务所关于公司限制性股票激励计划法律意见书,finalpage/2016-08-05/1202540563.PDF
2016-08-08,科大国创：股票交易异常波动及风险提示公告,finalpage/2016-08-08/1202543213.PDF
2016-08-09,科大国创：关于召开2016年第一次临时股东大会的提示性公告,finalpage/2016-08-09/1202548253.PDF
2016-08-09,科大国创：股票交易异常波动及风险提示公告,finalpage/2016-08-09/1202548254.PDF
2016-08-10,科大国创：第二届董事会第六次会议决议公告,finalpage/2016-08-10/1202552544.PDF
2016-08-10,科大国创：关于拟对外投资成立合资公司的公告,finalpage/2016-08-10/1202552545.PDF
2016-08-12,科大国创：关于使用部分闲置募集资金进行现金管理的进展公告,finalpage/2016-08-12/1202560207.PDF
2016-08-12,科大国创：2016年第一次临时股东大会决议公告,finalpage/2016-08-12/1202560208.PDF
2016-08-12,科大国创：2016年第一次临时股东大会的法律意见书,finalpage/2016-08-12/1202560209.PDF
2016-08-18,科大国创：关于设立分公司的公告,finalpage/2016-08-18/1202575698.PDF
2016-08-18,科大国创：第二届董事会第七次会议决议公告,finalpage/2016-08-18/1202575699.PDF
2016-08-26,科大国创：关于完成工商变更登记的公告,finalpage/2016-08-26/1202622889.PDF
2016-08-29,科大国创：关于召开2016年第二次临时股东大会的通知公告,finalpage/2016-08-29/1202638966.PDF
2016-08-29,科大国创：第二届董事会第八次会议决议公告,finalpage/2016-08-29/1202638967.PDF
2016-08-29,科大国创：独立董事公开征集委托投票权报告书,finalpage/2016-08-29/1202638968.PDF
2016-08-29,科大国创：非日常经营交易事项决策制度（2016年8月）,finalpage/2016-08-29/1202638969.PDF
2016-08-29,科大国创：公司章程（2016年8月）,finalpage/2016-08-29/1202638970.PDF
2016-08-29,科大国创：监事会关于限制性股票激励计划激励对象人员名单的核查意见及公示情况说明,finalpage/2016-08-29/1202638971.PDF
2016-08-29,科大国创：信息披露管理制度（2016年8月）,finalpage/2016-08-29/1202638972.PDF
2016-08-29,科大国创：关联交易决策制度（2016年8月）,finalpage/2016-08-29/1202638973.PDF
2016-09-01,科大国创：股票交易异常波动公告,finalpage/2016-09-01/1202664326.PDF
2016-09-10,科大国创：关于实际控制人部分股权质押的公告,finalpage/2016-09-10/1202689596.PDF
2016-09-10,科大国创：关于召开2016年第二次临时股东大会的提示性公告,finalpage/2016-09-10/1202689597.PDF
2016-09-14,科大国创：上市公司股权激励计划自查表,finalpage/2016-09-14/1202699782.PDF
2016-09-14,科大国创：2016年第二次临时股东大会的法律意见书,finalpage/2016-09-14/1202699783.PDF
2016-09-14,科大国创：关于本次限制性股票激励计划内幕信息知情人买卖公司股票情况自查报告,finalpage/2016-09-14/1202699784.PDF
2016-09-14,科大国创：2016年第二次临时股东大会决议公告,finalpage/2016-09-14/1202699785.PDF
2016-09-28,科大国创：第二届董事会第九次会议决议公告,finalpage/2016-09-28/1202730772.PDF
2016-09-28,科大国创：第二届监事会第五次会议决议公告,finalpage/2016-09-28/1202730773.PDF
2016-09-28,科大国创：2016年限制性股票激励计划首次授予部分激励对象名单,finalpage/2016-09-28/1202730774.PDF
2016-09-28,科大国创：关于向激励对象首次授予限制性股票的公告,finalpage/2016-09-28/1202730775.PDF
2016-09-28,科大国创：上海荣正投资咨询有限公司关于公司限制性股票激励计划（授予事项）之独立财务顾问报告,finalpage/2016-09-28/1202730776.PDF
2016-09-28,科大国创：独立董事关于相关事项的独立意见,finalpage/2016-09-28/1202730777.PDF
2016-09-28,科大国创：安徽天禾律师事务所关于公司2016年限制性股票激励计划激励对象调整及限制性股票授予相关事项的法律意见书,finalpage/2016-09-28/1202730778.PDF
2016-09-28,科大国创：关于调整限制性股票激励计划相关事项的公告,finalpage/2016-09-28/1202730779.PDF
2016-10-15,科大国创：独立董事对相关事项的独立意见,finalpage/2016-10-15/1202759305.PDF
2016-10-15,科大国创：关于公司及控股子公司使用闲置自有资金进行投资理财的公告,finalpage/2016-10-15/1202759306.PDF
2016-10-15,科大国创：第二届董事会第十次会议决议公告,finalpage/2016-10-15/1202759307.PDF
2016-10-15,科大国创：第二届监事会第六次会议决议公告,finalpage/2016-10-15/1202759310.PDF
2016-10-15,科大国创：国元证券股份有限公司关于公司及控股子公司使用闲置自有资金进行投资理财的核查意见,finalpage/2016-10-15/1202759311.PDF
2016-10-15,科大国创：关于召开2016年第三次临时股东大会的通知公告,finalpage/2016-10-15/1202759312.PDF
2016-10-15,科大国创：2016年度前三季度业绩预告,finalpage/2016-10-15/1202759313.PDF
2016-10-28,科大国创：关于限制性股票授予完成的公告,finalpage/2016-10-28/1202797184.PDF
2016-10-29,科大国创：关于2016年第三季度报告披露的提示性公告,finalpage/2016-10-29/1202802117.PDF
2016-10-29,科大国创：关于召开2016年第三次临时股东大会的提示性公告,finalpage/2016-10-29/1202802118.PDF
2016-10-29,科大国创：2016年第三季度报告全文,finalpage/2016-10-29/1202802120.PDF
2016-11-02,科大国创：2016年第三次临时股东大会决议公告,finalpage/2016-11-02/1202810355.PDF
2016-11-02,科大国创：2016年第三次临时股东大会的法律意见书,finalpage/2016-11-02/1202810356.PDF
2016-11-15,科大国创：关于完成工商变更登记的公告,finalpage/2016-11-15/1202827815.PDF
2016-11-19,科大国创：关于实际控制人部分股权质押的公告,finalpage/2016-11-19/1202835350.PDF
2016-12-08,科大国创：第二届董事会第十二次会议决议公告,finalpage/2016-12-08/1202863756.PDF
2016-12-08,科大国创：第二届监事会第八次会议决议公告,finalpage/2016-12-08/1202863757.PDF
2016-12-08,科大国创：独立董事对相关事项的独立意见,finalpage/2016-12-08/1202863758.PDF
2016-12-08,科大国创：关于变更部分募投项目实施主体的公告,finalpage/2016-12-08/1202863759.PDF
2016-12-08,科大国创：国元证券股份有限公司关于公司首次公开发行股票募集资金使用相关事项的专项意见,finalpage/2016-12-08/1202863760.PDF
2016-12-08,科大国创：公司章程修正案,finalpage/2016-12-08/1202863761.PDF
2016-12-08,科大国创：公司章程（2016年12月）,finalpage/2016-12-08/1202863762.PDF
2016-12-08,科大国创：关联交易决策制度（2016年12月）,finalpage/2016-12-08/1202863763.PDF
2016-12-08,科大国创：非日常经营交易事项决策制度（2016年12月）,finalpage/2016-12-08/1202863764.PDF
2016-12-08,科大国创：对外投资管理制度（2016年12月）,finalpage/2016-12-08/1202863765.PDF
2016-12-08,科大国创：关于签署募集资金四方监管协议的公告,finalpage/2016-12-08/1202863766.PDF
2016-12-08,科大国创：关于召开2016年第四次临时股东大会的通知公告,finalpage/2016-12-08/1202863767.PDF
2016-12-22,科大国创：国元证券股份有限公司关于公司2016年现场检查工作报告,finalpage/2016-12-22/1202925834.PDF
2016-12-22,科大国创：国元证券股份有限公司关于公司2016年持续督导培训情况的报告,finalpage/2016-12-22/1202925835.PDF
2016-12-24,科大国创：2016年第四次临时股东大会决议公告,finalpage/2016-12-24/1202954597.PDF
2016-12-24,科大国创：2016年第四次临时股东大会的法律意见书,finalpage/2016-12-24/1202954598.PDF
2016-12-31,科大国创：关于收到政府补助的公告,finalpage/2016-12-31/1202979433.PDF
2017-01-27,科大国创：2016年度业绩预告,finalpage/2017-01-27/1203058857.PDF
2017-02-28,科大国创：第二届董事会第十三次会议决议公告,finalpage/2017-02-28/1203112735.PDF
2017-02-28,科大国创：第二届监事会第九次会议决议公告,finalpage/2017-02-28/1203112736.PDF
2017-02-28,科大国创：关于变更部分募集资金用途的公告,finalpage/2017-02-28/1203112737.PDF
2017-02-28,科大国创：关于设立分公司的公告,finalpage/2017-02-28/1203112738.PDF
2017-02-28,科大国创：关于副总经理辞职的公告,finalpage/2017-02-28/1203112739.PDF
2017-02-28,科大国创：关于召开2017年第一次临时股东大会的通知公告,finalpage/2017-02-28/1203112740.PDF
2017-02-28,科大国创：国元证券股份有限公司关于公司变更部分募集资金用途的专项核查意见,finalpage/2017-02-28/1203112741.PDF
2017-02-28,科大国创：独立董事对相关事项的独立意见,finalpage/2017-02-28/1203112742.PDF
2017-02-28,科大国创：2016年度业绩快报,finalpage/2017-02-28/1203112743.PDF
2017-03-01,科大国创：关于变更部分募集资金用途的补充公告,finalpage/2017-03-01/1203117448.PDF
2017-03-11,科大国创：关于2016年度利润分配及资本公积金转增股本预案的预披露公告,finalpage/2017-03-11/1203150151.PDF
2017-03-14,科大国创：2016年度报告披露的提示性公告,finalpage/2017-03-14/1203153831.PDF
2017-03-14,科大国创：第二届董事会第十四次会议决议公告,finalpage/2017-03-14/1203153832.PDF
2017-03-14,科大国创：第二届监事会第十次会议决议公告,finalpage/2017-03-14/1203153833.PDF
2017-03-14,科大国创：关于续聘公司2017年度审计机构的公告,finalpage/2017-03-14/1203153834.PDF
2017-03-14,科大国创：关于向银行申请综合授信额度的公告,finalpage/2017-03-14/1203153835.PDF
2017-03-14,科大国创：2016年度募集资金存放与使用情况的专项报告,finalpage/2017-03-14/1203153836.PDF
2017-03-14,科大国创：关于公司总经理辞职暨聘任总经理、副总经理的公告,finalpage/2017-03-14/1203153837.PDF
2017-03-14,科大国创：关于举办2016年度网上业绩说明会的公告,finalpage/2017-03-14/1203153838.PDF
2017-03-14,科大国创：2016年度独立董事述职报告（胡晓珂）,finalpage/2017-03-14/1203153839.PDF
2017-03-14,科大国创：2016年度监事会工作报告,finalpage/2017-03-14/1203153840.PDF
2017-03-14,科大国创：2016年度内部控制自我评价报告,finalpage/2017-03-14/1203153841.PDF
2017-03-14,科大国创：董事、监事与高级管理人员薪酬管理制度（2017年3月）,finalpage/2017-03-14/1203153842.PDF
2017-03-14,科大国创：独立董事对相关事项的独立意见,finalpage/2017-03-14/1203153843.PDF
2017-03-14,科大国创：国元证券股份有限公司关于公司2016年度持续督导跟踪报告,finalpage/2017-03-14/1203153844.PDF
2017-03-14,科大国创：内部控制鉴证报告,finalpage/2017-03-14/1203153845.PDF
2017-03-14,科大国创：募集资金年度存放与使用情况鉴证报告,finalpage/2017-03-14/1203153846.PDF
2017-03-14,科大国创：控股股东及其他关联方资金占用情况专项审核报告,finalpage/2017-03-14/1203153847.PDF
2017-03-14,科大国创：国元证券股份有限公司关于公司2016年度内部控制自我评价报告的核查意见,finalpage/2017-03-14/1203153848.PDF
2017-03-14,科大国创：国元证券股份有限公司关于公司2016年度募集资金存放与使用情况的专项核查意见,finalpage/2017-03-14/1203153849.PDF
2017-03-14,科大国创：2016年度财务决算报告,finalpage/2017-03-14/1203153850.PDF
2017-03-14,科大国创：2016年度董事会工作报告,finalpage/2017-03-14/1203153851.PDF
2017-03-14,科大国创：2017年第一季度业绩预告,finalpage/2017-03-14/1203153852.PDF
2017-03-14,科大国创：2016年年度报告摘要,finalpage/2017-03-14/1203153853.PDF
2017-03-14,科大国创：2016年年度审计报告,finalpage/2017-03-14/1203153855.PDF
2017-03-14,科大国创：2016年年度报告,finalpage/2017-03-14/1203153856.PDF
2017-03-14,科大国创：审计报告,finalpage/2017-03-14/1203153857.PDF
2017-03-18,科大国创：2017年第一次临时股东大会决议公告,finalpage/2017-03-18/1203173150.PDF
2017-03-18,科大国创：2017年第一次临时股东大会的法律意见书,finalpage/2017-03-18/1203173151.PDF
2017-04-20,科大国创：关于重新签订募集资金三方监管协议的公告,finalpage/2017-04-20/1203331906.PDF
2017-04-26,科大国创：公司章程（2017年4月）,finalpage/2017-04-26/1203384916.PDF
2017-04-26,科大国创：关于2017年第一季度报告披露的提示性公告,finalpage/2017-04-26/1203384917.PDF
2017-04-26,科大国创：关于召开2016年度股东大会的通知公告,finalpage/2017-04-26/1203384918.PDF
2017-04-26,科大国创：第二届董事会第十五次会议决议公告,finalpage/2017-04-26/1203384919.PDF
2017-04-26,科大国创：第二届监事会第十一次会议决议公告,finalpage/2017-04-26/1203384920.PDF
2017-04-26,科大国创：2017年第一季度报告全文,finalpage/2017-04-26/1203384922.PDF
2017-05-27,科大国创：2016年度股东大会决议公告,finalpage/2017-05-27/1203571728.PDF
2017-05-27,科大国创：2016年年度股东大会的法律意见书,finalpage/2017-05-27/1203571729.PDF
2017-07-05,科大国创：国元证券股份有限公司关于公司部分限售股上市流通的核查意见,finalpage/2017-07-05/1203684012.PDF
2017-07-05,科大国创：首次公开发行前已发行股份上市流通提示性公告,finalpage/2017-07-05/1203684013.PDF
2017-07-12,科大国创：2016年度权益分派实施公告,finalpage/2017-07-12/1203694493.PDF
2017-07-14,科大国创：2017年半年度业绩预告,finalpage/2017-07-14/1203704280.PDF
2017-07-19,科大国创：第二届董事会第十六次会议决议的公告,finalpage/2017-07-19/1203712830.PDF
2017-07-19,科大国创：第二届监事会第十二次会议决议的公告,finalpage/2017-07-19/1203712831.PDF
2017-07-19,科大国创：独立董事关于相关事项的独立意见,finalpage/2017-07-19/1203712832.PDF
2017-07-19,科大国创：关于2017年度日常关联交易预计额度的公告,finalpage/2017-07-19/1203712833.PDF
2017-07-19,科大国创：关于公司及全资子公司使用部分闲置募集资金进行现金管理的公告,finalpage/2017-07-19/1203712834.PDF
2017-07-19,科大国创：关于回购并注销部分股权激励限制性股票的公告,finalpage/2017-07-19/1203712835.PDF
2017-07-19,科大国创：关于回购并注销部分股权激励限制性股票的减资公告,finalpage/2017-07-19/1203712836.PDF
2017-07-19,科大国创：独立董事关于相关事项的事前认可意见,finalpage/2017-07-19/1203712837.PDF
2017-07-19,科大国创：国元证券股份有限公司关于公司2017年度日常关联交易预计额度的核查意见,finalpage/2017-07-19/1203712838.PDF
2017-07-19,科大国创：国元证券股份有限公司关于公司及全资子公司使用部分闲置募集资金进行现金管理的核查意见,finalpage/2017-07-19/1203712839.PDF
2017-07-19,科大国创：安徽天禾律师事务所关于公司回购注销部分限制性股票相关事项的法律意见书,finalpage/2017-07-19/1203712840.PDF
2017-07-26,科大国创：关于完成工商变更登记的公告,finalpage/2017-07-26/1203732509.PDF
2017-07-26,科大国创：关于股东减持公司股份的预披露公告,finalpage/2017-07-26/1203732889.PDF
2017-07-28,科大国创：第二届董事会第十七次会议决议的公告,finalpage/2017-07-28/1203739628.PDF
2017-07-28,科大国创：第二届监事会第十三次会议决议的公告,finalpage/2017-07-28/1203739629.PDF
