,date,title,url
204,2018-01-19,农尚环境：内部控制鉴证报告,finalpage/2018-01-19/1204343739.PDF
205,2018-01-23,农尚环境：股票交易异常波动及风险提示公告,finalpage/2018-01-23/1204352344.PDF
206,2018-01-31,农尚环境：关于2017年第四季度主要经营情况的公告,finalpage/2018-01-31/1204375827.PDF
207,2018-02-06,农尚环境：前次募集资金使用情况报告,finalpage/2018-02-06/1204394097.PDF
208,2018-02-06,农尚环境：关于创业板公开发行可转换公司债券摊薄即期回报对公司主要财务指标的影响及公司采取措施的公告（更新后）,finalpage/2018-02-06/1204393719.PDF
209,2018-02-06,农尚环境：创业板公开发行可转换公司债券预案（更新后）,finalpage/2018-02-06/1204393720.PDF
210,2018-02-06,农尚环境：创业板公开发行可转换公司债券的论证分析报告（更新后）,finalpage/2018-02-06/1204393721.PDF
211,2018-02-06,农尚环境：第二届董事会第二十三次会议决议公告,finalpage/2018-02-06/1204393722.PDF
212,2018-02-06,农尚环境：创业板公开发行可转换公司债券募集资金使用的可行性分析报告（更新后）,finalpage/2018-02-06/1204393723.PDF
213,2018-02-06,农尚环境：独立董事关于对公司第二届董事会第二十三次会议相关事项的独立意见,finalpage/2018-02-06/1204393724.PDF
214,2018-02-06,农尚环境：前次募集资金使用情况报告（截至2017年12月31日止）,finalpage/2018-02-06/1204393725.PDF
215,2018-02-06,农尚环境：第二届监事会第十三次会议决议公告,finalpage/2018-02-06/1204393726.PDF
216,2018-02-09,农尚环境：关于控股股东、实际控制人部分股份补充质押的公告,finalpage/2018-02-09/1204407130.PDF
217,2018-02-09,农尚环境：2017年度股东大会决议公告,finalpage/2018-02-09/1204407131.PDF
218,2018-02-09,农尚环境：2017年年度股东大会的法律意见书,finalpage/2018-02-09/1204407132.PDF
