,date,title,url
0,2016-08-08,农尚环境：关于公司首次公开发行股票并在创业板上市的发行保荐书,finalpage/2016-08-08/1202544727.PDF
1,2016-08-08,农尚环境：红塔证券股份有限公司关于公司首次公开发行股票并在创业板上市发行保荐工作报告,finalpage/2016-08-08/1202544728.PDF
2,2016-08-08,农尚环境：审计报告,finalpage/2016-08-08/1202544729.PDF
3,2016-08-08,农尚环境：内部控制鉴证报告,finalpage/2016-08-08/1202544730.PDF
4,2016-08-08,农尚环境：非经常性损益鉴证报告,finalpage/2016-08-08/1202544731.PDF
5,2016-08-08,农尚环境：关于公司首次公开发行人民币普通股股票并在创业板上市的补充法律意见书（七）,finalpage/2016-08-08/1202544732.PDF
6,2016-08-08,农尚环境：关于公司首次公开发行人民币普通股股票并在创业板上市的法律意见书,finalpage/2016-08-08/1202544733.PDF
7,2016-08-08,农尚环境：关于公司首次公开发行人民币普通股股票并在创业板上市的补充法律意见书（一）,finalpage/2016-08-08/1202544734.PDF
8,2016-08-08,农尚环境：关于公司首次公开发行人民币普通股股票并在创业板上市的补充法律意见书（二）,finalpage/2016-08-08/1202544735.PDF
9,2016-08-08,农尚环境：关于公司首次公开发行人民币普通股股票并在创业板上市的补充法律意见书（三）,finalpage/2016-08-08/1202544736.PDF
10,2016-08-08,农尚环境：关于公司首次公开发行人民币普通股股票并在创业板上市的补充法律意见书（四）,finalpage/2016-08-08/1202544737.PDF
11,2016-08-08,农尚环境：关于公司首次公开发行人民币普通股股票并在创业板上市的补充法律意见书（五）,finalpage/2016-08-08/1202544738.PDF
12,2016-08-08,农尚环境：关于公司首次公开发行人民币普通股股票并在创业板上市的补充法律意见书（六）,finalpage/2016-08-08/1202544739.PDF
13,2016-08-08,农尚环境：关于公司首次公开发行人民币普通股股票并在创业板上市的补充法律意见书（八）,finalpage/2016-08-08/1202544740.PDF
14,2016-08-08,农尚环境：关于公司首次公开发行人民币普通股股票并在创业板上市的律师工作报告,finalpage/2016-08-08/1202544741.PDF
15,2016-08-08,农尚环境：公司章程（草案）,finalpage/2016-08-08/1202544742.PDF
16,2016-08-08,农尚环境：关于公司设立以来股本演变情况的说明及其董事、监事、高级管理人员的确认意见,finalpage/2016-08-08/1202544743.PDF
17,2016-08-08,农尚环境：2013年度第二次临时股东大会会议决议等,finalpage/2016-08-08/1202544744.PDF
18,2016-08-08,农尚环境：第一届董事会第七次会议决议等,finalpage/2016-08-08/1202544745.PDF
19,2016-08-08,农尚环境：首次公开发行股票并在创业板上市初步询价及推介公告,finalpage/2016-08-08/1202544746.PDF
20,2016-08-08,农尚环境：首次公开发行股票并在创业板上市招股意向书,finalpage/2016-08-08/1202544837.PDF
21,2016-08-08,农尚环境：中国证监会关于核准公司首次公开发行股票的批复,finalpage/2016-08-08/1202544838.PDF
22,2016-08-08,农尚环境：控股股东、实际控制人对招股意向书的确认意见,finalpage/2016-08-08/1202544839.PDF
23,2016-08-08,农尚环境：首次公开发行股票并在创业板上市提示公告,finalpage/2016-08-08/1202544840.PDF
24,2016-08-15,农尚环境：首次公开发行股票并在创业板上市初步询价结果及推迟发行公告,finalpage/2016-08-15/1202561991.PDF
25,2016-08-15,农尚环境：首次公开发行股票并在创业板上市投资风险特别公告,finalpage/2016-08-15/1202561992.PDF
26,2016-08-22,农尚环境：首次公开发行股票并在创业板上市投资风险特别公告（第二次）,finalpage/2016-08-22/1202592840.PDF
27,2016-08-29,农尚环境：首次公开发行股票并在创业板上市投资风险特别公告（第三次）,finalpage/2016-08-29/1202637533.PDF
28,2016-09-02,农尚环境：首次公开发行股票并在创业板上市网上路演公告,finalpage/2016-09-02/1202669439.PDF
29,2016-09-05,农尚环境：首次公开发行股票并在创业板上市招股说明书,finalpage/2016-09-05/1202674660.PDF
30,2016-09-05,农尚环境：首次公开发行股票并在创业板上市发行公告,finalpage/2016-09-05/1202674661.PDF
31,2016-09-07,农尚环境：首次公开发行股票并在创业板上市网上申购情况及中签率公告,finalpage/2016-09-07/1202680100.PDF
32,2016-09-08,农尚环境：首次公开发行股票并在创业板上市网上中签结果公告,finalpage/2016-09-08/1202685459.PDF
33,2016-09-08,农尚环境：首次公开发行股票并在创业板上市网下发行初步配售结果公告,finalpage/2016-09-08/1202685460.PDF
34,2016-09-12,农尚环境：首次公开发行股票并在创业板上市发行结果公告,finalpage/2016-09-12/1202691625.PDF
35,2016-09-19,农尚环境：红塔证券股份有限公司关于公司股票上市保荐书,finalpage/2016-09-19/1202704260.PDF
36,2016-09-19,农尚环境：首次公开发行股票并在创业板上市之上市公告书提示性公告,finalpage/2016-09-19/1202704261.PDF
37,2016-09-19,农尚环境：首次公开发行股票并在创业板上市之上市公告书,finalpage/2016-09-19/1202704262.PDF
38,2016-09-19,农尚环境：关于公司首次公开发行的股票在深圳证券交易所创业板上市的法律意见书,finalpage/2016-09-19/1202704263.PDF
39,2016-09-23,农尚环境：股票交易异常波动及风险提示公告,finalpage/2016-09-23/1202724097.PDF
40,2016-09-28,农尚环境：股票交易异常波动及风险提示公告,finalpage/2016-09-28/1202731393.PDF
41,2016-10-10,农尚环境：股票交易异常波动及风险提示公告,finalpage/2016-10-10/1202741484.PDF
42,2016-10-11,农尚环境：独立董事关于公司实际控制人之一吴亮先生及其配偶刘莉女士为公司申请银行授信额度提供关联担保的独立意见公告,finalpage/2016-10-11/1202746445.PDF
43,2016-10-11,农尚环境：第二届董事会第十次会议决议公告,finalpage/2016-10-11/1202746446.PDF
44,2016-10-11,农尚环境：关于召开2016年第三次临时股东大会的通知,finalpage/2016-10-11/1202746447.PDF
45,2016-10-11,农尚环境：公司章程（2016年9月）,finalpage/2016-10-11/1202746448.PDF
46,2016-10-11,农尚环境：公司董事长、实际控制人之一吴亮先生及其配偶刘莉女士为公司申请银行授信额度提供担保暨关联交易的公告,finalpage/2016-10-11/1202746449.PDF
47,2016-10-13,农尚环境：股票交易异常波动及风险提示公告,finalpage/2016-10-13/1202753592.PDF
48,2016-10-17,农尚环境：股票交易异常波动及风险提示公告,finalpage/2016-10-17/1202760670.PDF
49,2016-10-19,农尚环境：股票交易异常波动及风险提示公告,finalpage/2016-10-19/1202767885.PDF
50,2016-10-20,农尚环境：关于签署募集资金三方监管协议的公告,finalpage/2016-10-20/1202772428.PDF
51,2016-10-28,农尚环境：2016年第三季度报告披露提示性公告,finalpage/2016-10-28/1202798288.PDF
52,2016-10-28,农尚环境：2016年第三季度报告全文,finalpage/2016-10-28/1202798290.PDF
53,2016-10-28,农尚环境：第二届董事会第十一次会议决议公告,finalpage/2016-10-28/1202798291.PDF
54,2016-10-28,农尚环境：第二届监事会第五次会议决议公告,finalpage/2016-10-28/1202798292.PDF
55,2016-11-01,农尚环境：2016年第三次临时股东大会决议公告,finalpage/2016-11-01/1202808890.PDF
56,2016-11-03,农尚环境：关于更换保荐代表人的公告,finalpage/2016-11-03/1202812701.PDF
57,2016-11-14,农尚环境：关于控股股东、实际控制人部分股份质押的公告,finalpage/2016-11-14/1202825591.PDF
58,2016-12-12,农尚环境：关于完成工商变更登记的公告,finalpage/2016-12-12/1202868492.PDF
59,2017-01-04,农尚环境：红塔证券股份有限公司关于公司2016年度现场检查报告,finalpage/2017-01-04/1202985639.PDF
60,2017-01-13,农尚环境：关于设立广西分公司的公告,finalpage/2017-01-13/1203011887.PDF
61,2017-01-24,农尚环境：2016年度业绩预告,finalpage/2017-01-24/1203043386.PDF
62,2017-01-27,农尚环境：关于经营合同处于筹划阶段的提示性公告,finalpage/2017-01-27/1203058839.PDF
63,2017-02-27,农尚环境：2016年度业绩快报,finalpage/2017-02-27/1203106954.PDF
64,2017-03-21,农尚环境：关于公司股东部分股份质押的公告,finalpage/2017-03-21/1203180816.PDF
65,2017-04-08,农尚环境：2017年第一季度业绩预告,finalpage/2017-04-08/1203261373.PDF
66,2017-04-26,农尚环境：关于延期披露2016年年度报告及其摘要的公告,finalpage/2017-04-26/1203391246.PDF
67,2017-04-27,农尚环境：2016年年度报告及摘要披露提示性公告,finalpage/2017-04-27/1203403475.PDF
68,2017-04-27,农尚环境：2016年年度报告摘要,finalpage/2017-04-27/1203403476.PDF
69,2017-04-27,农尚环境：2016年年度审计报告,finalpage/2017-04-27/1203403478.PDF
70,2017-04-27,农尚环境：第二届董事会第十二次会议决议公告,finalpage/2017-04-27/1203403479.PDF
71,2017-04-27,农尚环境：第二届监事会第六次会议决议公告,finalpage/2017-04-27/1203403480.PDF
72,2017-04-27,农尚环境：2016年年度报告,finalpage/2017-04-27/1203403481.PDF
73,2017-04-27,农尚环境：关于召开2016年年度报告网上业绩说明会的公告,finalpage/2017-04-27/1203403482.PDF
74,2017-04-27,农尚环境：关于聘任公司高级管理人员的公告,finalpage/2017-04-27/1203403483.PDF
75,2017-04-27,农尚环境：关于2016年度利润分配及资本公积转增股本预案的公告,finalpage/2017-04-27/1203403484.PDF
76,2017-04-27,农尚环境：2016年度募集资金存放与使用情况专项报告,finalpage/2017-04-27/1203403485.PDF
77,2017-04-27,农尚环境：关于募集资金投资项目进展情况的说明,finalpage/2017-04-27/1203403486.PDF
78,2017-04-27,农尚环境：关于续聘2017年度审计机构的公告,finalpage/2017-04-27/1203403487.PDF
79,2017-04-27,农尚环境：2016年度内部控制自我评价报告,finalpage/2017-04-27/1203403488.PDF
80,2017-04-27,农尚环境：内部控制鉴证报告,finalpage/2017-04-27/1203403489.PDF
81,2017-04-27,农尚环境：控股股东及其他关联方占用资金情况的专项审计说明,finalpage/2017-04-27/1203403490.PDF
82,2017-04-27,农尚环境：募集资金年度存放与使用情况鉴证报告,finalpage/2017-04-27/1203403491.PDF
83,2017-04-27,农尚环境：红塔证券股份有限公司关于公司2016年度募集资金存放与使用情况的核查意见,finalpage/2017-04-27/1203403492.PDF
84,2017-04-27,农尚环境：红塔证券股份有限公司关于公司2016年度内部控制自我评价报告的核查意见,finalpage/2017-04-27/1203403493.PDF
85,2017-04-27,农尚环境：2016年度独立董事述职报告（易西多）,finalpage/2017-04-27/1203403494.PDF
86,2017-04-27,农尚环境：2016年度独立董事述职报告（乐瑞）,finalpage/2017-04-27/1203403495.PDF
87,2017-04-27,农尚环境：2016年度独立董事述职报告（谢峰）,finalpage/2017-04-27/1203403496.PDF
88,2017-04-27,农尚环境：关于召开2016年度股东大会的通知,finalpage/2017-04-27/1203403497.PDF
89,2017-04-27,农尚环境：独立董事关于对公司第二届董事会第十二次会议相关事项的独立意见,finalpage/2017-04-27/1203403498.PDF
90,2017-04-27,农尚环境：2017年第一季度报告披露提示性公告,finalpage/2017-04-27/1203403499.PDF
91,2017-04-27,农尚环境：2017年第一季度报告全文,finalpage/2017-04-27/1203403501.PDF
92,2017-04-28,农尚环境：第二届董事会第十三次会议决议公告,finalpage/2017-04-28/1203414479.PDF
93,2017-04-28,农尚环境：第二届监事会第七次会议决议公告,finalpage/2017-04-28/1203414480.PDF
94,2017-05-05,农尚环境：重大合同进展公告,finalpage/2017-05-05/1203479382.PDF
95,2017-05-16,农尚环境：红塔证券股份有限公司关于公司2016年度持续督导跟踪报告,finalpage/2017-05-16/1203519559.PDF
96,2017-05-18,农尚环境：2016年度股东大会决议,finalpage/2017-05-18/1203532356.PDF
97,2017-05-18,农尚环境：2016年度股东大会的法律意见书,finalpage/2017-05-18/1203532357.PDF
98,2017-06-02,农尚环境：关于参加2017年湖北上市公司投资者网上集体接待日活动的提示性公告,finalpage/2017-06-02/1203580014.PDF
99,2017-06-13,农尚环境：第二届董事会第十四次会议决议公告,finalpage/2017-06-13/1203611374.PDF
100,2017-06-14,农尚环境：关于与乌苏市人民政府签订《战略合作框架协议》的公告,finalpage/2017-06-14/1203615590.PDF
101,2017-07-06,农尚环境：2016年年度权益分派实施公告,finalpage/2017-07-06/1203684050.PDF
102,2017-07-14,农尚环境：2017年半年度业绩预告,finalpage/2017-07-14/1203703739.PDF
103,2017-07-28,农尚环境：关于重大合同持续进展的公告,finalpage/2017-07-28/1203739934.PDF
104,2017-07-29,农尚环境：关于2017年第二季度主要经营情况的公告,finalpage/2017-07-29/1203741372.PDF
105,2017-08-09,农尚环境：第二届董事会第十五次会议决议公告,finalpage/2017-08-09/1203775459.PDF
106,2017-08-09,农尚环境：独立董事关于对公司第二届董事会第十五次会议相关事项的独立意见,finalpage/2017-08-09/1203775460.PDF
107,2017-08-10,农尚环境：公司董事长、实际控制人之一吴亮先生及其配偶刘莉女士为公司申请银行授信额度提供担保暨关联交易的公告,finalpage/2017-08-10/1203782560.PDF
108,2017-08-10,农尚环境：关于对外投资设立全资子公司的公告,finalpage/2017-08-10/1203782561.PDF
109,2017-08-10,农尚环境：关于召开2017年第一次临时股东大会的通知,finalpage/2017-08-10/1203782562.PDF
110,2017-08-10,农尚环境：关于注销分公司的公告,finalpage/2017-08-10/1203782563.PDF
111,2017-08-12,农尚环境：重大工程中标公告,finalpage/2017-08-12/1203791455.PDF
112,2017-08-17,农尚环境：2017年半年度报告及摘要披露提示性公告,finalpage/2017-08-17/1203805852.PDF
113,2017-08-17,农尚环境：2017年半年度报告摘要,finalpage/2017-08-17/1203805853.PDF
114,2017-08-17,农尚环境：第二届董事会第十六次会议决议公告,finalpage/2017-08-17/1203805855.PDF
115,2017-08-17,农尚环境：第二届监事会第八次会议决议公告,finalpage/2017-08-17/1203805856.PDF
116,2017-08-17,农尚环境：2017年半年度报告,finalpage/2017-08-17/1203805857.PDF
117,2017-08-17,农尚环境：2017年半年度募集资金存放与使用情况专项报告,finalpage/2017-08-17/1203805858.PDF
118,2017-08-17,农尚环境：独立董事关于对公司第二届董事会第十六次会议相关事项的独立意见,finalpage/2017-08-17/1203805859.PDF
119,2017-08-23,农尚环境：红塔证券股份有限公司关于公司2017年半年度持续督导跟踪报告,finalpage/2017-08-23/1203848142.PDF
120,2017-08-29,农尚环境：2017年第一次临时股东大会的法律意见书,finalpage/2017-08-29/1203893367.PDF
121,2017-08-29,农尚环境：2017年第一次临时股东大会决议,finalpage/2017-08-29/1203890624.PDF
122,2017-09-05,农尚环境：第二届董事会第十七次会议决议公告,finalpage/2017-09-05/1203931612.PDF
123,2017-09-05,农尚环境：关于公司申请银行授信额度暨关联交易的公告,finalpage/2017-09-05/1203931613.PDF
124,2017-09-05,农尚环境：关于召开2017年第二次临时股东大会的通知,finalpage/2017-09-05/1203931614.PDF
125,2017-09-05,农尚环境：独立董事关于对公司第二届董事会第十七次会议相关事项的独立意见,finalpage/2017-09-05/1203931615.PDF
126,2017-09-08,农尚环境：关于持股5%以上股东股份减持计划的预披露公告,finalpage/2017-09-08/1203957391.PDF
127,2017-09-15,农尚环境：关于签订重大合同的公告,finalpage/2017-09-15/1203976090.PDF
128,2017-09-20,农尚环境：红塔证券股份有限公司关于公司首次公开发行股票前已发行股份解除限售上市流通的核查意见,finalpage/2017-09-20/1203988123.PDF
129,2017-09-20,农尚环境：首次公开发行前已发行股份上市流通提示性公告,finalpage/2017-09-20/1203988124.PDF
130,2017-09-21,农尚环境：2017年第二次临时股东大会决议,finalpage/2017-09-21/1203990219.PDF
131,2017-09-22,农尚环境：2017年第二次临时股东大会的法律意见书,finalpage/2017-09-22/1203993875.PDF
132,2017-09-22,农尚环境：关于全资子公司完成工商注册的公告,finalpage/2017-09-22/1203994055.PDF
133,2017-09-30,农尚环境：关于公司为第一中标候选人公示的提示性公告,finalpage/2017-09-30/1204015749.PDF
134,2017-10-12,农尚环境：2017年前三季度业绩预告,finalpage/2017-10-12/1204030473.PDF
135,2017-10-12,农尚环境：关于重大工程项目中标的公告,finalpage/2017-10-12/1204030474.PDF
136,2017-10-17,农尚环境：股票交易异常波动及风险提示公告,finalpage/2017-10-17/1204045938.PDF
137,2017-10-20,农尚环境：股票交易异常波动及风险提示公告,finalpage/2017-10-20/1204054402.PDF
138,2017-10-27,农尚环境：2017年第三季度报告全文,finalpage/2017-10-27/1204078601.PDF
139,2017-10-27,农尚环境：2017年第三季度报告披露提示性公告,finalpage/2017-10-27/1204078602.PDF
140,2017-10-31,农尚环境：关于2017年第三季度主要经营情况的公告,finalpage/2017-10-31/1204097020.PDF
141,2017-11-04,农尚环境：第二届监事会第十次会议决议公告,finalpage/2017-11-04/1204112968.PDF
142,2017-11-04,农尚环境：关于变更部分募集资金用途的公告,finalpage/2017-11-04/1204112969.PDF
143,2017-11-04,农尚环境：关于召开2017年第三次临时股东大会的通知,finalpage/2017-11-04/1204112970.PDF
144,2017-11-04,农尚环境：红塔证券股份有限公司关于公司变更部分募集资金用途的保荐意见,finalpage/2017-11-04/1204112971.PDF
145,2017-11-04,农尚环境：第二届董事会第十九次会议决议公告,finalpage/2017-11-04/1204112972.PDF
146,2017-11-04,农尚环境：独立董事关于对公司第二届董事会第十九次会议相关事项的独立意见,finalpage/2017-11-04/1204112973.PDF
147,2017-11-09,农尚环境：关于公司监事减持股份计划的预披露公告,finalpage/2017-11-09/1204125661.PDF
148,2017-11-09,农尚环境：关于控股股东、实际控制人部分股份质押的公告,finalpage/2017-11-09/1204125854.PDF
149,2017-11-10,农尚环境：关于控股股东、实际控制人部分股份解除质押的公告,finalpage/2017-11-10/1204128395.PDF
150,2017-11-11,农尚环境：关于全资子公司完成工商注册的公告,finalpage/2017-11-11/1204132646.PDF
151,2017-11-21,农尚环境：2017年第三次临时股东大会决议公告,finalpage/2017-11-21/1204153646.PDF
152,2017-11-21,农尚环境：2017年第三次临时股东大会的法律意见书,finalpage/2017-11-21/1204153647.PDF
153,2017-12-05,农尚环境：前次募集资金使用情况报告,finalpage/2017-12-05/1204194111.PDF
154,2017-12-05,农尚环境：第二届董事会第二十次会议决议公告,finalpage/2017-12-05/1204193502.PDF
155,2017-12-05,农尚环境：第二届监事会第十一次会议决议公告,finalpage/2017-12-05/1204193503.PDF
156,2017-12-05,农尚环境：董事、高级管理人员及控股股东、实际控制人关于创业板公开发行可转换公司债券摊薄即期回报采取填补措施的承诺的公告,finalpage/2017-12-05/1204193504.PDF
157,2017-12-05,农尚环境：关于创业板公开发行可转换公司债券摊薄即期回报对公司主要财务指标的影响及公司采取措施的公告（已取消）,finalpage/2017-12-05/1204193505.PDF
158,2017-12-05,农尚环境：关于最近五年被证券监管部门和交易所采取监管措施或处罚及整改情况的公告,finalpage/2017-12-05/1204193506.PDF
159,2017-12-05,农尚环境：2017年9月30日内部控制评价报告,finalpage/2017-12-05/1204193507.PDF
160,2017-12-05,农尚环境：独立董事关于对公司第二届董事会第二十次会议相关事项的独立意见,finalpage/2017-12-05/1204193508.PDF
161,2017-12-05,农尚环境：创业板公开发行可转换公司债券募集资金使用的可行性分析报告（已取消）,finalpage/2017-12-05/1204193509.PDF
162,2017-12-05,农尚环境：创业板公开发行可转换公司债券的论证分析报告（已取消）,finalpage/2017-12-05/1204193510.PDF
163,2017-12-05,农尚环境：创业板公开发行可转换公司债券预案（已取消）,finalpage/2017-12-05/1204193511.PDF
164,2017-12-05,农尚环境：创业板公开发行可转换公司债券持有人会议规则（2017年12月）,finalpage/2017-12-05/1204193512.PDF
165,2017-12-05,农尚环境：未来三年股东回报规划（2017年-2019年）,finalpage/2017-12-05/1204193513.PDF
166,2017-12-05,农尚环境：关于召开2017年第四次临时股东大会的通知,finalpage/2017-12-05/1204193514.PDF
167,2017-12-06,农尚环境：关于签署募集资金三方监管协议之补充协议的公告,finalpage/2017-12-06/1204195252.PDF
168,2017-12-09,农尚环境：关于持股5%以上股东减持股份的公告,finalpage/2017-12-09/1204206341.PDF
169,2017-12-15,农尚环境：第二届董事会第二十一次会议决议公告,finalpage/2017-12-15/1204222634.PDF
170,2017-12-15,农尚环境：关于召开2017年第五次临时股东大会的通知,finalpage/2017-12-15/1204222635.PDF
171,2017-12-15,农尚环境：关于公司申请银行授信额度暨关联交易的公告,finalpage/2017-12-15/1204222636.PDF
172,2017-12-15,农尚环境：独立董事关于对公司第二届董事会第二十一次会议相关事项的独立意见,finalpage/2017-12-15/1204222637.PDF
173,2017-12-21,农尚环境：2017年第四次临时股东大会的法律意见书,finalpage/2017-12-21/1204243539.PDF
174,2017-12-21,农尚环境：2017年第四次临时股东大会决议公告,finalpage/2017-12-21/1204243540.PDF
175,2017-12-30,农尚环境：关于签订重大合同的公告,finalpage/2017-12-30/1204289363.PDF
176,2018-01-03,农尚环境：2017年第五次临时股东大会决议公告,finalpage/2018-01-03/1204299138.PDF
177,2018-01-03,农尚环境：2017年第五次临时股东大会的法律意见书,finalpage/2018-01-03/1204299139.PDF
178,2018-01-04,农尚环境：股票交易异常波动及风险提示公告,finalpage/2018-01-04/1204302852.PDF
179,2018-01-15,农尚环境：红塔证券股份有限公司关于公司2017年度现场检查报告,finalpage/2018-01-15/1204326023.PDF
180,2018-01-19,农尚环境：2017年年度报告及摘要披露提示性公告,finalpage/2018-01-19/1204343714.PDF
181,2018-01-19,农尚环境：第二届监事会第十二次会议决议公告,finalpage/2018-01-19/1204343715.PDF
182,2018-01-19,农尚环境：关于召开2017年度股东大会的通知,finalpage/2018-01-19/1204343716.PDF
183,2018-01-19,农尚环境：关于2017年度利润分配预案的公告,finalpage/2018-01-19/1204343717.PDF
184,2018-01-19,农尚环境：关于续聘2018年度审计机构的公告,finalpage/2018-01-19/1204343718.PDF
185,2018-01-19,农尚环境：2017年度内部控制自我评价报告,finalpage/2018-01-19/1204343719.PDF
186,2018-01-19,农尚环境：2017年度独立董事述职报告（乐瑞）,finalpage/2018-01-19/1204343720.PDF
187,2018-01-19,农尚环境：2017年度独立董事述职报告（谢峰）,finalpage/2018-01-19/1204343721.PDF
188,2018-01-19,农尚环境：2017年度独立董事述职报告（易西多）,finalpage/2018-01-19/1204343722.PDF
189,2018-01-19,农尚环境：第二届董事会第二十二次会议决议公告,finalpage/2018-01-19/1204343723.PDF
190,2018-01-19,农尚环境：关于召开2017年年度报告网上业绩说明会的公告,finalpage/2018-01-19/1204343724.PDF
191,2018-01-19,农尚环境：2017年度募集资金存放与使用情况专项报告,finalpage/2018-01-19/1204343725.PDF
192,2018-01-19,农尚环境：2018年第一季度业绩预告,finalpage/2018-01-19/1204343726.PDF
193,2018-01-19,农尚环境：红塔证券股份有限公司关于公司2017年度持续督导跟踪报告,finalpage/2018-01-19/1204343727.PDF
194,2018-01-19,农尚环境：红塔证券股份有限公司关于公司2017年度内部控制自我评价报告的核查意见,finalpage/2018-01-19/1204343728.PDF
195,2018-01-19,农尚环境：红塔证券股份有限公司关于公司2017年度募集资金存放与使用情况的核查意见,finalpage/2018-01-19/1204343729.PDF
196,2018-01-19,农尚环境：监事会对公司内部控制自我评价报告的审核意见,finalpage/2018-01-19/1204343730.PDF
197,2018-01-19,农尚环境：独立董事关于对公司第二届董事会第二十二次会议相关事项的独立意见,finalpage/2018-01-19/1204343731.PDF
198,2018-01-19,农尚环境：独立董事关于续聘立信会计事务所（特殊普通合伙）为2018年度审计机构的事前认可意见,finalpage/2018-01-19/1204343732.PDF
199,2018-01-19,农尚环境：2017年年度报告摘要,finalpage/2018-01-19/1204343733.PDF
200,2018-01-19,农尚环境：2017年年度审计报告,finalpage/2018-01-19/1204343735.PDF
201,2018-01-19,农尚环境：2017年年度报告,finalpage/2018-01-19/1204343736.PDF
202,2018-01-19,农尚环境：募集资金年度存放与使用情况鉴证报告（2017年1月1日至2017年12月31日止）,finalpage/2018-01-19/1204343737.PDF
203,2018-01-19,农尚环境：控股股东及其他关联方占用资金情况的专项审计说明,finalpage/2018-01-19/1204343738.PDF
