,date,title,url
0,2017-02-27,三雄极光：首次公开发行股票并在创业板上市招股意向书,finalpage/2017-02-27/1203109921.PDF
1,2017-02-27,三雄极光：北京市君合律师事务所关于公司在中国境内首次公开发行人民币普通股股票并上市的补充法律意见（二）,finalpage/2017-02-27/1203109922.PDF
2,2017-02-27,三雄极光：北京市君合律师事务所关于公司在中国境内首次公开发行人民币普通股股票并上市的补充法律意见（三）,finalpage/2017-02-27/1203109923.PDF
3,2017-02-27,三雄极光：北京市君合律师事务所关于公司在中国境内首次公开发行人民币普通股股票并上市的补充法律意见（四）,finalpage/2017-02-27/1203109924.PDF
4,2017-02-27,三雄极光：北京市君合律师事务所关于公司在中国境内首次公开发行人民币普通股股票并上市的补充法律意见（五）,finalpage/2017-02-27/1203109925.PDF
5,2017-02-27,三雄极光：北京市君合律师事务所关于公司在中国境内首次公开发行人民币普通股股票并上市的补充法律意见（六）,finalpage/2017-02-27/1203109926.PDF
6,2017-02-27,三雄极光：北京市君合律师事务所关于公司在中国境内首次公开发行人民币普通股股票并上市的补充法律意见（七）,finalpage/2017-02-27/1203109927.PDF
7,2017-02-27,三雄极光：北京市君合律师事务所关于公司在中国境内首次公开发行人民币普通股股票并上市的补充法律意见（八）,finalpage/2017-02-27/1203109928.PDF
8,2017-02-27,三雄极光：北京市君合律师事务所为公司在中国境内首次公开发行人民币普通股股票并上市出具法律意见的律师工作报告,finalpage/2017-02-27/1203109929.PDF
9,2017-02-27,三雄极光：广发证券股份有限公司关于公司首次公开发行股票并在创业板上市之发行保荐书,finalpage/2017-02-27/1203109930.PDF
10,2017-02-27,三雄极光：广发证券股份有限公司关于公司首次公开发行股票并在创业板上市之发行保荐工作报告,finalpage/2017-02-27/1203109931.PDF
11,2017-02-27,三雄极光：第二届董事会第十四次会议决议,finalpage/2017-02-27/1203109932.PDF
12,2017-02-27,三雄极光：中国证监会关于核准公司首次公开发行股票的批复,finalpage/2017-02-27/1203109933.PDF
13,2017-02-27,三雄极光：首次公开发行股票并在创业板上市初步询价及推介公告,finalpage/2017-02-27/1203109934.PDF
14,2017-02-27,三雄极光：首次公开发行股票并在创业板上市提示公告,finalpage/2017-02-27/1203109935.PDF
15,2017-02-27,三雄极光：关于公司设立以来股本演变情况的说明及其董事、监事、高级管理人员的确认意见,finalpage/2017-02-27/1203109936.PDF
16,2017-02-27,三雄极光：控股股东、实际控制人对招股说明书的确认意见,finalpage/2017-02-27/1203109937.PDF
17,2017-02-27,三雄极光：2015年第四次临时股东大会会议决议,finalpage/2017-02-27/1203109938.PDF
18,2017-02-27,三雄极光：公司章程（草案）,finalpage/2017-02-27/1203109939.PDF
19,2017-02-27,三雄极光：审计报告,finalpage/2017-02-27/1203109940.PDF
20,2017-02-27,三雄极光：非经常性损益鉴证报告,finalpage/2017-02-27/1203109941.PDF
21,2017-02-27,三雄极光：内部控制鉴证报告,finalpage/2017-02-27/1203109942.PDF
22,2017-02-27,三雄极光：北京市君合律师事务所关于公司在中国境内首次公开发行人民币普通股股票并上市的法律意见,finalpage/2017-02-27/1203109943.PDF
23,2017-02-27,三雄极光：北京市君合律师事务所关于公司在中国境内首次公开发行人民币普通股股票并上市的补充法律意见（一）,finalpage/2017-02-27/1203109944.PDF
24,2017-03-03,三雄极光：首次公开发行股票并在创业板上市网上路演公告,finalpage/2017-03-03/1203126394.PDF
25,2017-03-06,三雄极光：首次公开发行股票并在创业板上市发行公告,finalpage/2017-03-06/1203131142.PDF
26,2017-03-06,三雄极光：首次公开发行股票并在创业板上市投资风险特别公告,finalpage/2017-03-06/1203131143.PDF
27,2017-03-06,三雄极光：首次公开发行股票并在创业板上市招股说明书,finalpage/2017-03-06/1203131144.PDF
28,2017-03-08,三雄极光：首次公开发行股票并在创业板上市网上定价发行申购情况及中签率公告,finalpage/2017-03-08/1203138244.PDF
29,2017-03-09,三雄极光：首次公开发行股票并在创业板上市网上定价发行摇号中签结果公告,finalpage/2017-03-09/1203141939.PDF
30,2017-03-09,三雄极光：首次公开发行股票并在创业板上市网下发行初步配售结果公告,finalpage/2017-03-09/1203141940.PDF
31,2017-03-13,三雄极光：首次公开发行股票并在创业板上市发行结果公告,finalpage/2017-03-13/1203150470.PDF
32,2017-03-16,三雄极光：北京市君合律师事务所关于公司于中国境内首次公开发行的股票在深圳证券交易所创业板上市的法律意见,finalpage/2017-03-16/1203163175.PDF
33,2017-03-16,三雄极光：广发证券股份有限公司关于公司股票上市保荐书,finalpage/2017-03-16/1203163176.PDF
34,2017-03-16,三雄极光：首次公开发行股票并在创业板上市上市公告书提示性公告,finalpage/2017-03-16/1203163177.PDF
35,2017-03-16,三雄极光：首次公开发行股票并在创业板上市之上市公告书,finalpage/2017-03-16/1203163178.PDF
36,2017-03-23,三雄极光：股票交易异常波动公告,finalpage/2017-03-23/1203186470.PDF
37,2017-03-28,三雄极光：股票交易异常波动公告,finalpage/2017-03-28/1203209646.PDF
38,2017-03-30,三雄极光：股票交易异常波动公告,finalpage/2017-03-30/1203223435.PDF
39,2017-03-31,三雄极光：股票交易异常波动公告,finalpage/2017-03-31/1203238089.PDF
40,2017-03-31,三雄极光：关于签订募集资金三方监管协议的公告,finalpage/2017-03-31/1203238287.PDF
41,2017-04-01,三雄极光：第三届董事会第五次会议决议公告,finalpage/2017-04-01/1203246276.PDF
42,2017-04-01,三雄极光：关于变更公司注册资本、修改公司章程的公告,finalpage/2017-04-01/1203246277.PDF
43,2017-04-01,三雄极光：关于拟使用部分暂时闲置募集资金购买理财产品的公告,finalpage/2017-04-01/1203246278.PDF
44,2017-04-01,三雄极光：关于召开2017年第一次临时股东大会的通知,finalpage/2017-04-01/1203246279.PDF
45,2017-04-01,三雄极光：董事会议事规则（2017年3月）,finalpage/2017-04-01/1203246280.PDF
46,2017-04-01,三雄极光：公司章程（2017年3月）,finalpage/2017-04-01/1203246281.PDF
47,2017-04-01,三雄极光：独立董事关于拟使用部分暂时闲置募集资金购买理财产品的独立意见,finalpage/2017-04-01/1203246282.PDF
48,2017-04-01,三雄极光：广发证券股份有限公司关于公司使用部分暂时闲置募集资金购买理财产品的核查意见,finalpage/2017-04-01/1203246283.PDF
49,2017-04-01,三雄极光：内幕信息管理制度（2017年3月）,finalpage/2017-04-01/1203246284.PDF
50,2017-04-01,三雄极光：年报信息披露重大差错责任追究制度（2017年3月）,finalpage/2017-04-01/1203246285.PDF
51,2017-04-01,三雄极光：年度报告工作制度（2017年3月）,finalpage/2017-04-01/1203246286.PDF
52,2017-04-01,三雄极光：投资者关系管理制度（2017年3月）,finalpage/2017-04-01/1203246287.PDF
53,2017-04-01,三雄极光：中小投资者单独计票管理办法（2017年3月）,finalpage/2017-04-01/1203246288.PDF
54,2017-04-01,三雄极光：重大信息内部报告制度（2017年3月）,finalpage/2017-04-01/1203246289.PDF
55,2017-04-01,三雄极光：第三届监事会第四次会议决议公告,finalpage/2017-04-01/1203246290.PDF
56,2017-04-01,三雄极光：关于修改《董事会议事规则》的公告,finalpage/2017-04-01/1203246291.PDF
57,2017-04-07,三雄极光：关于签订募集资金四方监管协议的公告,finalpage/2017-04-07/1203257495.PDF
58,2017-04-13,三雄极光：关于召开2017年第一次临时股东大会的提示性公告,finalpage/2017-04-13/1203290104.PDF
59,2017-04-18,三雄极光：2017年第一次临时股东大会的法律意见,finalpage/2017-04-18/1203313081.PDF
60,2017-04-18,三雄极光：2017年第一次临时股东大会决议公告,finalpage/2017-04-18/1203313082.PDF
61,2017-04-21,三雄极光：关于使用募集资金向全资子公司增资的公告,finalpage/2017-04-21/1203342762.PDF
62,2017-04-21,三雄极光：控股子公司管理制度（2017年4月）,finalpage/2017-04-21/1203342763.PDF
63,2017-04-21,三雄极光：第三届监事会第五次会议决议公告,finalpage/2017-04-21/1203342764.PDF
64,2017-04-21,三雄极光：第三届董事会第六次会议决议公告,finalpage/2017-04-21/1203342765.PDF
65,2017-04-21,三雄极光：2017年第一季度报告披露提示性公告,finalpage/2017-04-21/1203342766.PDF
66,2017-04-21,三雄极光：2017年第一季度报告全文,finalpage/2017-04-21/1203342767.PDF
67,2017-04-27,三雄极光：关于使用部分暂时闲置募集资金购买理财产品及开立募集资金理财产品专用结算账户的进展公告,finalpage/2017-04-27/1203403868.PDF
68,2017-05-06,三雄极光：关于全资子公司完成工商变更登记的公告,finalpage/2017-05-06/1203479978.PDF
69,2017-05-10,三雄极光：关于完成工商变更登记并换发营业执照的公告,finalpage/2017-05-10/1203487086.PDF
70,2017-05-17,三雄极光：关于全资子公司完成工商变更登记的公告,finalpage/2017-05-17/1203525779.PDF
71,2017-05-23,三雄极光：监事辞职公告,finalpage/2017-05-23/1203554585.PDF
72,2017-05-24,三雄极光：关于董事辞职的公告,finalpage/2017-05-24/1203559647.PDF
73,2017-05-25,三雄极光：广发证券股份有限公司关于公司增加部分募投项目实施主体及变更实施地点的核查意见,finalpage/2017-05-25/1203566125.PDF
74,2017-05-25,三雄极光：第三届监事会第六次会议决议公告,finalpage/2017-05-25/1203566126.PDF
75,2017-05-25,三雄极光：对外投资管理制度（2017年5月）,finalpage/2017-05-25/1203566127.PDF
76,2017-05-25,三雄极光：独立董事关于第三届董事会第七次会议相关事项的独立意见,finalpage/2017-05-25/1203566128.PDF
77,2017-05-25,三雄极光：关于修订《对外投资管理制度》的公告,finalpage/2017-05-25/1203566129.PDF
78,2017-05-25,三雄极光：关于召开2017年第二次临时股东大会的通知,finalpage/2017-05-25/1203566130.PDF
79,2017-05-25,三雄极光：第三届董事会第七次会议决议公告,finalpage/2017-05-25/1203566131.PDF
80,2017-05-25,三雄极光：关于增加公司部分募投项目实施主体及变更实施地点的公告,finalpage/2017-05-25/1203566132.PDF
81,2017-06-08,三雄极光：关于召开2017年第二次临时股东大会的提示性公告,finalpage/2017-06-08/1203598143.PDF
82,2017-06-08,三雄极光：关于签订募集资金四方监管协议的公告,finalpage/2017-06-08/1203598429.PDF
83,2017-06-13,三雄极光：2017年第二次临时股东大会的法律意见,finalpage/2017-06-13/1203610877.PDF
84,2017-06-13,三雄极光：2017年第二次临时股东大会决议公告,finalpage/2017-06-13/1203610878.PDF
85,2017-06-23,三雄极光：关于全资子公司收到政府税收返还的公告,finalpage/2017-06-23/1203641478.PDF
86,2017-06-29,三雄极光：关于使用募集资金向全资子公司增资的公告,finalpage/2017-06-29/1203658546.PDF
87,2017-06-29,三雄极光：外部信息报送和使用管理制度（2017年6月）,finalpage/2017-06-29/1203658547.PDF
88,2017-06-29,三雄极光：广发证券股份有限公司关于公司使用募集资金置换预先投入募投项目自筹资金的核查意见（已取消）,finalpage/2017-06-29/1203658548.PDF
89,2017-06-29,三雄极光：独立董事关于第三届董事会第八次会议相关事项的独立意见,finalpage/2017-06-29/1203658549.PDF
90,2017-06-29,三雄极光：以自筹资金预先投入募集资金投资项目的鉴证报告,finalpage/2017-06-29/1203658550.PDF
91,2017-06-29,三雄极光：第三届监事会第七次会议决议公告,finalpage/2017-06-29/1203658551.PDF
92,2017-06-29,三雄极光：第三届董事会第八次会议决议公告,finalpage/2017-06-29/1203658552.PDF
93,2017-06-29,三雄极光：关于使用募集资金置换预先投入募投项目自筹资金的公告,finalpage/2017-06-29/1203658553.PDF
94,2017-06-29,三雄极光：临时公告更正的公告,finalpage/2017-06-29/1203660672.PDF
95,2017-06-29,三雄极光：广发证券股份有限公司关于公司使用募集资金置换预先投入募投项目自筹资金的核查意见（更新后）,finalpage/2017-06-29/1203660673.PDF
96,2017-07-11,三雄极光：2017年半年度业绩预告,finalpage/2017-07-11/1203691888.PDF
97,2017-07-12,三雄极光：关于全资子公司完成工商变更登记的公告,finalpage/2017-07-12/1203693765.PDF
98,2017-07-26,三雄极光：第三届监事会第八次会议决议公告,finalpage/2017-07-26/1203732087.PDF
99,2017-07-26,三雄极光：关于新增公司部分募投项目实施主体和实施地点的公告,finalpage/2017-07-26/1203732088.PDF
100,2017-07-26,三雄极光：独立董事关于第三届董事会第九次会议相关事项的独立意见,finalpage/2017-07-26/1203732089.PDF
101,2017-07-26,三雄极光：第三届董事会第九次会议决议公告,finalpage/2017-07-26/1203732090.PDF
102,2017-07-26,三雄极光：广发证券股份有限公司关于公司新增部分募投项目实施主体和实施地点的核查意见,finalpage/2017-07-26/1203732091.PDF
103,2017-07-29,三雄极光：关于使用闲置募集资金购买理财产品到期赎回及继续购买理财产品进展的公告,finalpage/2017-07-29/1203741417.PDF
104,2017-08-26,三雄极光：关于签订募集资金四方监管协议的公告,finalpage/2017-08-26/1203869769.PDF
105,2017-08-29,三雄极光：2017年半年度报告披露提示性公告,finalpage/2017-08-29/1203888123.PDF
106,2017-08-29,三雄极光：第三届董事会第十次会议决议公告,finalpage/2017-08-29/1203888124.PDF
107,2017-08-29,三雄极光：第三届监事会第九次会议决议公告,finalpage/2017-08-29/1203888125.PDF
108,2017-08-29,三雄极光：关于2017年半年度募集资金存放与使用情况专项报告,finalpage/2017-08-29/1203888126.PDF
109,2017-08-29,三雄极光：独立董事关于第三届董事会第十次会议相关事项的独立意见,finalpage/2017-08-29/1203888127.PDF
110,2017-08-29,三雄极光：关于会计政策变更的公告,finalpage/2017-08-29/1203888128.PDF
111,2017-08-29,三雄极光：关于使用募集资金向全资子公司增资的公告,finalpage/2017-08-29/1203888129.PDF
112,2017-08-29,三雄极光：广发证券股份有限公司关于公司2017年半年度跟踪报告,finalpage/2017-08-29/1203888131.PDF
113,2017-08-29,三雄极光：2017年半年度报告,finalpage/2017-08-29/1203888132.PDF
114,2017-08-29,三雄极光：2017年半年度报告摘要,finalpage/2017-08-29/1203888133.PDF
115,2017-09-21,三雄极光：关于全资子公司完成工商变更登记的公告,finalpage/2017-09-21/1203989371.PDF
116,2017-10-12,三雄极光：2017年前三季度业绩预告,finalpage/2017-10-12/1204029776.PDF
117,2017-10-24,三雄极光：关于使用部分暂时闲置募集资金购买理财产品的进展公告,finalpage/2017-10-24/1204060995.PDF
118,2017-10-27,三雄极光：2017年第三季度报告披露提示性公告,finalpage/2017-10-27/1204077679.PDF
119,2017-10-27,三雄极光：第三届监事会第十次会议决议公告,finalpage/2017-10-27/1204077680.PDF
120,2017-10-27,三雄极光：第三届董事会第十一次会议决议公告,finalpage/2017-10-27/1204077681.PDF
121,2017-10-27,三雄极光：广发证券股份有限公司关于公司2017年持续督导培训工作报告（2017年10月）,finalpage/2017-10-27/1204077682.PDF
122,2017-10-27,三雄极光：2017年第三季度报告全文,finalpage/2017-10-27/1204077683.PDF
123,2017-10-27,三雄极光：关于拟对外投资设立全资子公司的公告,finalpage/2017-10-27/1204077684.PDF
124,2017-10-28,三雄极光：关于使用闲置募集资金购买理财产品到期赎回及继续购买理财产品的公告,finalpage/2017-10-28/1204086967.PDF
125,2017-10-31,三雄极光：关于使用闲置自有资金购买理财产品的进展公告,finalpage/2017-10-31/1204096702.PDF
126,2017-11-03,三雄极光：关于全资子公司完成工商登记并取得营业执照的公告,finalpage/2017-11-03/1204108601.PDF
127,2017-11-04,三雄极光：关于使用闲置自有资金购买理财产品的进展公告,finalpage/2017-11-04/1204111409.PDF
128,2017-12-01,三雄极光：广发证券股份有限公司关于公司关联租赁的核查意见,finalpage/2017-12-01/1204178229.PDF
129,2017-12-01,三雄极光：独立董事关于第三届董事会第十二次会议相关事项的独立意见,finalpage/2017-12-01/1204178230.PDF
130,2017-12-01,三雄极光：独立董事关于第三届董事会第十二次会议相关事项的事前认可意见,finalpage/2017-12-01/1204178231.PDF
131,2017-12-01,三雄极光：第三届监事会第十一次会议决议公告,finalpage/2017-12-01/1204178232.PDF
132,2017-12-01,三雄极光：第三届董事会第十二次会议决议公告,finalpage/2017-12-01/1204178233.PDF
133,2017-12-01,三雄极光：关于拟使用部分暂时闲置自有资金购买理财产品的公告,finalpage/2017-12-01/1204178234.PDF
134,2017-12-01,三雄极光：关于拟向银行申请授信额度并提供抵押担保的公告,finalpage/2017-12-01/1204178235.PDF
135,2017-12-01,三雄极光：关于关联租赁的公告,finalpage/2017-12-01/1204178236.PDF
136,2017-12-01,三雄极光：关于召开2017年第三次临时股东大会的通知,finalpage/2017-12-01/1204178237.PDF
137,2017-12-13,三雄极光：关于证券事务代表辞职的公告,finalpage/2017-12-13/1204216933.PDF
138,2017-12-16,三雄极光：广发证券股份有限公司关于公司持续督导定期现场检查报告,finalpage/2017-12-16/1204231659.PDF
139,2017-12-20,三雄极光：关于使用闲置自有资金购买理财产品的进展公告,finalpage/2017-12-20/1204239346.PDF
140,2017-12-21,三雄极光：关于召开2017年第三次临时股东大会的提示性公告,finalpage/2017-12-21/1204242145.PDF
141,2017-12-26,三雄极光：关于使用闲置自有资金购买理财产品的进展公告,finalpage/2017-12-26/1204252831.PDF
142,2017-12-27,三雄极光：2017年第三次临时股东大会决议公告,finalpage/2017-12-27/1204269552.PDF
143,2017-12-27,三雄极光：2017年第三次临时股东大会的法律意见,finalpage/2017-12-27/1204269553.PDF
144,2018-01-12,三雄极光：2017年度业绩预告,finalpage/2018-01-12/1204323882.PDF
145,2018-01-30,三雄极光：关于使用闲置募集资金购买理财产品到期赎回及继续购买理财产品的公告,finalpage/2018-01-30/1204372554.PDF
146,2018-02-07,三雄极光：2017年度业绩快报,finalpage/2018-02-07/1204398492.PDF
147,2018-02-13,三雄极光：关于控股股东、实际控制人增持公司股份的公告,finalpage/2018-02-13/1204418506.PDF
