date,title,url
2017-03-09,久吾高科：中国证监会关于核准公司首次公开发行股票的批复,finalpage/2017-03-09/1203142055.PDF
2017-03-09,久吾高科：关于公司设立以来股本演变情况的说明及其董事、监事、高级管理人员的确认意见,finalpage/2017-03-09/1203142056.PDF
2017-03-09,久吾高科：关于公司最近三年及一期非经常性损益的鉴证报告,finalpage/2017-03-09/1203142057.PDF
2017-03-09,久吾高科：审计报告,finalpage/2017-03-09/1203142058.PDF
2017-03-09,久吾高科：审阅报告,finalpage/2017-03-09/1203142059.PDF
2017-03-09,久吾高科：关于公司内部控制的鉴证报告,finalpage/2017-03-09/1203142060.PDF
2017-03-09,久吾高科：国泰君安证券股份有限公司关于公司首次公开发行股票并在创业板上市之发行保荐书,finalpage/2017-03-09/1203142061.PDF
2017-03-09,久吾高科：国泰君安证券股份有限公司关于公司首次公开发行A股股票并在创业板上市之发行保荐工作报告,finalpage/2017-03-09/1203142062.PDF
2017-03-09,久吾高科：首次公开发行股票并在创业板上市提示公告,finalpage/2017-03-09/1203142063.PDF
2017-03-09,久吾高科：首次公开发行股票并在创业板上市网上路演公告,finalpage/2017-03-09/1203142064.PDF
2017-03-09,久吾高科：首次公开发行股票并在创业板上市招股说明书,finalpage/2017-03-09/1203142065.PDF
2017-03-09,久吾高科：控股股东、实际控制人对招股说明书的确认意见,finalpage/2017-03-09/1203142066.PDF
2017-03-09,久吾高科：广东诚公律师事务所、北京国枫律师事务所关于公司申请首次公开发行股票并在创业板上市的律师工作报告,finalpage/2017-03-09/1203142067.PDF
2017-03-09,久吾高科：广东诚公律师事务所、北京国枫律师事务所关于公司申请首次公开发行股票并在创业板上市的法律意见书,finalpage/2017-03-09/1203142068.PDF
2017-03-09,久吾高科：广东诚公律师事务所、北京国枫律师事务所关于公司申请首次公开发行股票并在创业板上市的补充法律意见书一,finalpage/2017-03-09/1203142069.PDF
2017-03-09,久吾高科：北京国枫律师事务所关于公司申请首次公开发行股票并在创业板上市的补充法律意见书之二,finalpage/2017-03-09/1203142070.PDF
2017-03-09,久吾高科：北京国枫律师事务所关于公司申请首次公开发行股票并在创业板上市的补充法律意见书之三,finalpage/2017-03-09/1203142071.PDF
2017-03-09,久吾高科：北京国枫律师事务所关于公司申请首次公开发行股票并在创业板上市的补充法律意见书之四,finalpage/2017-03-09/1203142072.PDF
2017-03-09,久吾高科：北京国枫律师事务所关于公司申请首次公开发行股票并在创业板上市的补充法律意见书之六,finalpage/2017-03-09/1203142073.PDF
2017-03-09,久吾高科：北京国枫律师事务所关于公司申请首次公开发行股票并在创业板上市的补充法律意见书之七,finalpage/2017-03-09/1203142074.PDF
2017-03-09,久吾高科：北京国枫律师事务所关于公司申请首次公开发行股票并在创业板上市的补充法律意见书之八,finalpage/2017-03-09/1203142075.PDF
2017-03-09,久吾高科：公司章程（草案）,finalpage/2017-03-09/1203142076.PDF
2017-03-09,久吾高科：第五届董事会第七次会议决议,finalpage/2017-03-09/1203142077.PDF
2017-03-09,久吾高科：第五届董事会第八次会议决议,finalpage/2017-03-09/1203142078.PDF
2017-03-09,久吾高科：第五届董事会第十三次会议决议,finalpage/2017-03-09/1203142079.PDF
2017-03-09,久吾高科：第六届董事会第三次会议决议,finalpage/2017-03-09/1203142080.PDF
2017-03-09,久吾高科：2014年第一次临时股东大会决议,finalpage/2017-03-09/1203142081.PDF
2017-03-09,久吾高科：2014年第二次临时股东大会决议,finalpage/2017-03-09/1203142082.PDF
2017-03-09,久吾高科：2015年第一次临时股东大会决议,finalpage/2017-03-09/1203142083.PDF
2017-03-09,久吾高科：2016年第一次临时股东大会决议,finalpage/2017-03-09/1203142084.PDF
2017-03-10,久吾高科：首次公开发行股票并在创业板上市投资风险特别公告,finalpage/2017-03-10/1203144822.PDF
2017-03-10,久吾高科：首次公开发行股票并在创业板上市发行公告,finalpage/2017-03-10/1203144823.PDF
2017-03-14,久吾高科：首次公开发行股票并在创业板上市网上中签率公告,finalpage/2017-03-14/1203154944.PDF
2017-03-15,久吾高科：首次公开发行股票并在创业板上市网上中签结果公告,finalpage/2017-03-15/1203158046.PDF
2017-03-17,久吾高科：首次公开发行股票并在创业板上市发行结果公告,finalpage/2017-03-17/1203168339.PDF
2017-03-22,久吾高科：北京国枫律师事务所关于公司首次公开发行股票并在深圳证券交易所创业板申请上市的法律意见书,finalpage/2017-03-22/1203182975.PDF
2017-03-22,久吾高科：首次公开发行股票并在创业板上市之上市公告书,finalpage/2017-03-22/1203182976.PDF
2017-03-22,久吾高科：首次公开发行股票并在创业板上市上市公告书提示性公告,finalpage/2017-03-22/1203182977.PDF
2017-03-22,久吾高科：国泰君安证券股份有限公司关于公司首次公开发行股票并在创业板上市之上市保荐书,finalpage/2017-03-22/1203182978.PDF
2017-03-28,久吾高科：股票交易异常波动公告,finalpage/2017-03-28/1203211251.PDF
2017-03-29,久吾高科：股票交易异常波动公告,finalpage/2017-03-29/1203225669.PDF
2017-03-29,久吾高科：关于签订募集资金三方监管协议的公告,finalpage/2017-03-29/1203225668.PDF
2017-03-31,久吾高科：股票交易异常波动公告,finalpage/2017-03-31/1203246015.PDF
2017-04-07,久吾高科：股票交易异常波动公告,finalpage/2017-04-07/1203261444.PDF
2017-04-07,久吾高科：2017年第一季度业绩预告,finalpage/2017-04-07/1203261445.PDF
2017-04-11,久吾高科：股票交易异常波动公告,finalpage/2017-04-11/1203284262.PDF
2017-04-13,久吾高科：股票交易异常波动公告,finalpage/2017-04-13/1203297233.PDF
2017-04-25,久吾高科：2016年年度报告,finalpage/2017-04-25/1203378880.PDF
2017-04-25,久吾高科：2016年年度审计报告,finalpage/2017-04-25/1203378881.PDF
2017-04-25,久吾高科：第六届董事会第六次会议决议公告,finalpage/2017-04-25/1203378882.PDF
2017-04-25,久吾高科：第六届监事会第五次会议决议公告,finalpage/2017-04-25/1203378883.PDF
2017-04-25,久吾高科：2017年第一季度报告披露提示性公告,finalpage/2017-04-25/1203378884.PDF
2017-04-25,久吾高科：2017年第一季度报告全文,finalpage/2017-04-25/1203378885.PDF
2017-04-25,久吾高科：2016年度报告披露提示性公告,finalpage/2017-04-25/1203378886.PDF
2017-04-25,久吾高科：2016年年度报告摘要,finalpage/2017-04-25/1203378887.PDF
2017-04-25,久吾高科：内部控制自我评价报告,finalpage/2017-04-25/1203378888.PDF
2017-04-25,久吾高科：关于公司控股股东及其他关联方占用资金情况的专项审计说明,finalpage/2017-04-25/1203378889.PDF
2017-04-25,久吾高科：独立董事意见,finalpage/2017-04-25/1203378890.PDF
2017-04-25,久吾高科：独立董事述职报告（郭立玮）,finalpage/2017-04-25/1203378891.PDF
2017-04-25,久吾高科：独立董事述职报告（姜涟）,finalpage/2017-04-25/1203378892.PDF
2017-04-25,久吾高科：独立董事述职报告（吕伟）,finalpage/2017-04-25/1203378893.PDF
2017-04-25,久吾高科：关于召开2016年度股东大会的通知,finalpage/2017-04-25/1203378894.PDF
2017-04-25,久吾高科：关于使用部分闲置募集资金和自有资金购买银行理财产品的公告,finalpage/2017-04-25/1203378895.PDF
2017-04-25,久吾高科：国泰君安证券股份有限公司关于公司使用部分闲置募集资金和自有资金购买银行理财产品的核查意见,finalpage/2017-04-25/1203378896.PDF
2017-04-25,久吾高科：关于使用募集资金置换预先投入募投项目自筹资金的公告,finalpage/2017-04-25/1203378897.PDF
2017-04-25,久吾高科：关于公司以自筹资金预先投入募投项目的鉴证报告,finalpage/2017-04-25/1203378898.PDF
2017-04-25,久吾高科：国泰君安证券股份有限公司关于公司使用募集资金置换预先投入募集资金投资项目自筹资金的核查意见,finalpage/2017-04-25/1203378899.PDF
2017-04-25,久吾高科：国泰君安证券股份有限公司关于公司2016年度内部控制自我评价报告的核查意见,finalpage/2017-04-25/1203378900.PDF
2017-04-25,久吾高科：内部控制鉴证报告,finalpage/2017-04-25/1203378901.PDF
2017-04-25,久吾高科：内幕信息知情人登记管理制度（2017年4月）,finalpage/2017-04-25/1203378902.PDF
2017-04-25,久吾高科：外部信息使用人管理制度（2017年4月）,finalpage/2017-04-25/1203378903.PDF
2017-04-25,久吾高科：重大信息内部报告制度（2017年4月）,finalpage/2017-04-25/1203378904.PDF
2017-04-25,久吾高科：公司章程（2017年3月）,finalpage/2017-04-25/1203378905.PDF
2017-04-25,久吾高科：国泰君安证券股份有限公司关于公司2016年度跟踪报告,finalpage/2017-04-25/1203378906.PDF
2017-05-05,久吾高科：关于举行2016年度网上业绩说明会的公告,finalpage/2017-05-05/1203475261.PDF
2017-05-16,久吾高科：2016年度股东大会决议公告,finalpage/2017-05-16/1203526577.PDF
2017-05-16,久吾高科：2016年年度股东大会的法律意见书,finalpage/2017-05-16/1203526578.PDF
2017-06-21,久吾高科：关于完成工商变更登记并换发营业执照的公告,finalpage/2017-06-21/1203638240.PDF
2017-06-27,久吾高科：2016年度权益分派实施公告,finalpage/2017-06-27/1203653704.PDF
2017-07-11,久吾高科：关于董事长辞职的公告,finalpage/2017-07-11/1203694899.PDF
2017-07-12,久吾高科：2017年半年度业绩预告,finalpage/2017-07-12/1203700110.PDF
2017-07-17,久吾高科：公司章程（2017年7月）,finalpage/2017-07-17/1203709119.PDF
2017-07-17,久吾高科：第六届董事会第七次会议决议公告,finalpage/2017-07-17/1203709115.PDF
2017-07-17,久吾高科：关于补选第六届董事会非独立董事的公告,finalpage/2017-07-17/1203709116.PDF
2017-07-17,久吾高科：独立董事关于相关事项的独立意见,finalpage/2017-07-17/1203709117.PDF
2017-07-17,久吾高科：关于召开2017年第一次临时股东大会的通知,finalpage/2017-07-17/1203709118.PDF
2017-08-02,久吾高科：2017年第一次临时股东大会决议公告,finalpage/2017-08-02/1203758182.PDF
2017-08-02,久吾高科：2017年第一次临时股东大会的法律意见书,finalpage/2017-08-02/1203758183.PDF
2017-08-02,久吾高科：关于变更第六届董事会非独立董事的公告,finalpage/2017-08-02/1203758184.PDF
2017-08-22,久吾高科：2017年半年度报告披露提示性公告,finalpage/2017-08-22/1203836473.PDF
2017-08-22,久吾高科：2017年半年度报告摘要,finalpage/2017-08-22/1203836474.PDF
2017-08-22,久吾高科：2017年半年度报告,finalpage/2017-08-22/1203836475.PDF
2017-08-22,久吾高科：第六届董事会第八次会议决议公告,finalpage/2017-08-22/1203836476.PDF
2017-08-22,久吾高科：第六届监事会第六次会议决议公告,finalpage/2017-08-22/1203836477.PDF
2017-08-22,久吾高科：关于选举董事长的公告,finalpage/2017-08-22/1203836478.PDF
2017-08-22,久吾高科：关于会计政策变更的公告,finalpage/2017-08-22/1203836479.PDF
2017-08-22,久吾高科：关于2017年半年度募集资金存放与使用情况的专项报告,finalpage/2017-08-22/1203836480.PDF
2017-08-22,久吾高科：独立董事意见,finalpage/2017-08-22/1203836481.PDF
2017-08-22,久吾高科：国泰君安证券股份有限公司关于公司2017年半年度跟踪报告,finalpage/2017-08-22/1203836482.PDF
2017-09-13,久吾高科：关于完成工商变更登记并换发营业执照的公告,finalpage/2017-09-13/1203971374.PDF
2017-09-21,久吾高科：股票交易异常波动公告,finalpage/2017-09-21/1203994412.PDF
2017-10-12,久吾高科：2017年前三季度业绩预告,finalpage/2017-10-12/1204033327.PDF
2017-10-24,久吾高科：2017年第三季度报告披露提示性公告,finalpage/2017-10-24/1204061063.PDF
2017-10-24,久吾高科：2017年第三季度报告全文,finalpage/2017-10-24/1204061064.PDF
2017-12-26,久吾高科：国泰君安证券股份有限公司关于公司2017年持续督导定期现场检查报告,finalpage/2017-12-26/1204270039.PDF
2017-12-26,久吾高科：国泰君安证券股份有限公司关于公司2017年培训情况报告,finalpage/2017-12-26/1204270040.PDF
2018-01-26,久吾高科：2017年度业绩预告,finalpage/2018-01-26/1204369354.PDF
