,date,title,url
332,2016-11-29,兰石重装三届八次监事会决议公告,/disclosure/listedinfo/announcement/c/2016-11-29/603169_20161129_2.pdf
333,2016-11-29,兰石重装关于增加公司2016年日常关联交易金额的公告,/disclosure/listedinfo/announcement/c/2016-11-29/603169_20161129_4.pdf
334,2016-11-29,兰石重装关于使用部分闲置募集资金暂时补充流动资金的公告,/disclosure/listedinfo/announcement/c/2016-11-29/603169_20161129_3.pdf
335,2016-11-29,兰石重装独立董事关于三届十次董事会发表的独立意见,/disclosure/listedinfo/announcement/c/2016-11-29/603169_20161129_6.pdf
336,2016-11-29,兰石重装董事会审计委员会关于关联交易事项的书面审核意见,/disclosure/listedinfo/announcement/c/2016-11-29/603169_20161129_7.pdf
337,2016-11-29,兰石重装：华龙证券股份有限公司关于兰州兰石重型装备股份有限公司使用闲置募集资金暂时性补充流动资金的核查意见,/disclosure/listedinfo/announcement/c/2016-11-29/603169_20161129_5.pdf
338,2016-12-01,兰石重装重大资产重组进展公告,/disclosure/listedinfo/announcement/c/2016-12-01/603169_20161201_1.pdf
339,2016-12-02,兰石重装关于提前归还部分募集资金的公告,/disclosure/listedinfo/announcement/c/2016-12-02/603169_20161202_1.pdf
340,2016-12-07,兰石重装三届十一次董事会决议公告,/disclosure/listedinfo/announcement/c/2016-12-07/603169_20161207_1.pdf
341,2016-12-07,兰石重装三届九次监事会决议公告,/disclosure/listedinfo/announcement/c/2016-12-07/603169_20161207_2.pdf
342,2016-12-07,兰石重装关于召开2016年第四次临时股东大会的通知,/disclosure/listedinfo/announcement/c/2016-12-07/603169_20161207_4.pdf
343,2016-12-07,兰石重装关于使用部分闲置募集资金暂时补充流动资金的公告,/disclosure/listedinfo/announcement/c/2016-12-07/603169_20161207_3.pdf
344,2016-12-07,兰石重装独立董事关于三届十一次董事会发表的独立意见,/disclosure/listedinfo/announcement/c/2016-12-07/603169_20161207_5.pdf
345,2016-12-07,兰石重装：华龙证券股份有限公司关于兰州兰石重型装备股份有限公司使用闲置募集资金暂时性补充流动资金的核查意见,/disclosure/listedinfo/announcement/c/2016-12-07/603169_20161207_6.pdf
346,2016-12-07,兰石重装2016年第四次临时股东大会资料,/disclosure/listedinfo/announcement/c/2016-12-07/603169_20161207_7.pdf
347,2016-12-08,兰石重装重大资产重组进展公告,/disclosure/listedinfo/announcement/c/2016-12-08/603169_20161208_1.pdf
348,2016-12-13,兰石重装关于提前归还部分募集资金的公告,/disclosure/listedinfo/announcement/c/2016-12-13/603169_20161213_1.pdf
349,2016-12-15,兰石重装重大资产重组进展公告,/disclosure/listedinfo/announcement/c/2016-12-15/603169_20161215_1.pdf
350,2016-12-20,兰石重装三届十二次董事会决议公告,/disclosure/listedinfo/announcement/c/2016-12-20/603169_20161220_1.pdf
351,2016-12-20,兰石重装三届十次监事会决议公告,/disclosure/listedinfo/announcement/c/2016-12-20/603169_20161220_2.pdf
352,2016-12-20,兰石重装关于张掖晋昌源项目合同变更的公告,/disclosure/listedinfo/announcement/c/2016-12-20/603169_20161220_5.pdf
353,2016-12-20,兰石重装关于使用部分闲置募集资金暂时补充流动资金的公告,/disclosure/listedinfo/announcement/c/2016-12-20/603169_20161220_3.pdf
354,2016-12-20,兰石重装关于公司部分固定资产报废处理的公告,/disclosure/listedinfo/announcement/c/2016-12-20/603169_20161220_4.pdf
355,2016-12-20,兰石重装独立董事关于三届十二次董事会发表的独立意见,/disclosure/listedinfo/announcement/c/2016-12-20/603169_20161220_7.pdf
356,2016-12-20,兰石重装：华龙证券股份有限公司关于兰州兰石重型装备股份有限公司使用闲置募集资金暂时性补充流动资金的核查意见,/disclosure/listedinfo/announcement/c/2016-12-20/603169_20161220_6.pdf
357,2016-12-22,兰石重装重大资产重组进展公告,/disclosure/listedinfo/announcement/c/2016-12-22/603169_20161222_1.pdf
358,2016-12-23,兰石重装2016年第四次临时股东大会决议公告,/disclosure/listedinfo/announcement/c/2016-12-23/603169_20161223_1.pdf
359,2016-12-23,兰石重装2016年第四次临时股东大会的法律意见,/disclosure/listedinfo/announcement/c/2016-12-23/603169_20161223_2.pdf
360,2016-12-24,兰石重装重大资产重组继续停牌公告,/disclosure/listedinfo/announcement/c/2016-12-24/603169_20161224_1.pdf
361,2016-12-31,兰石重装重大资产重组进展公告,/disclosure/listedinfo/announcement/c/2016-12-31/603169_20161231_1.pdf
362,2016-12-31,兰石重装非公开发行限售股上市流通公告,/disclosure/listedinfo/announcement/c/2016-12-31/603169_20161231_2.pdf
363,2016-12-31,兰石重装：华龙证券股份有限公司关于兰州兰石重型装备股份有限公司非公开发行股票限售股解禁的核查意见,/disclosure/listedinfo/announcement/c/2016-12-31/603169_20161231_3.pdf
364,2017-01-07,兰石重装重大资产重组进展公告,/disclosure/listedinfo/announcement/c/2017-01-07/603169_20170107_1.pdf
365,2017-01-14,兰石重装重大资产重组进展公告,/disclosure/listedinfo/announcement/c/2017-01-14/603169_20170114_1.pdf
366,2017-01-21,兰石重装重大资产重组进展公告,/disclosure/listedinfo/announcement/c/2017-01-21/603169_20170121_1.pdf
367,2017-01-24,兰石重装重大资产重组继续停牌公告,/disclosure/listedinfo/announcement/c/2017-01-24/603169_20170124_4.pdf
368,2017-01-24,兰石重装三届十三次董事会决议公告,/disclosure/listedinfo/announcement/c/2017-01-24/603169_20170124_3.pdf
369,2017-01-24,兰石重装关于公司申请金融机构综合授信额度的公告,/disclosure/listedinfo/announcement/c/2017-01-24/603169_20170124_2.pdf
370,2017-01-24,兰石重装独立董事关于三届十三次董事会发表的独立意见,/disclosure/listedinfo/announcement/c/2017-01-24/603169_20170124_5.pdf
371,2017-01-24,兰石重装2016年度业绩预减公告,/disclosure/listedinfo/announcement/c/2017-01-24/603169_20170124_1.pdf
372,2017-01-25,兰石重装关于持股5%以上股东减持计划实施情况的公告,/disclosure/listedinfo/announcement/c/2017-01-25/603169_20170125_1.pdf
373,2017-02-07,兰石重装重大资产重组进展公告,/disclosure/listedinfo/announcement/c/2017-02-07/603169_20170207_1.pdf
374,2017-02-14,兰石重装重大资产重组进展公告,/disclosure/listedinfo/announcement/c/2017-02-14/603169_20170214_1.pdf
375,2017-02-21,兰石重装重大资产重组进展公告,/disclosure/listedinfo/announcement/c/2017-02-21/603169_20170221_1.pdf
376,2017-02-24,兰石重装三届十一次监事会决议公告,/disclosure/listedinfo/announcement/c/2017-02-24/603169_20170224_3.pdf
377,2017-02-24,兰石重装三届十四次董事会决议公告,/disclosure/listedinfo/announcement/c/2017-02-24/603169_20170224_2.pdf
378,2017-02-24,兰石重装关于收到甘肃省人民政府国有资产监督管理委员会原则性批复文件的公告,/disclosure/listedinfo/announcement/c/2017-02-24/603169_20170224_4.pdf
379,2017-02-24,兰石重装关于披露重大资产重组预案暨公司股票暂不复牌的公告,/disclosure/listedinfo/announcement/c/2017-02-24/603169_20170224_5.pdf
380,2017-02-24,兰石重装关于本次重大资产重组申请文件真实性、准确性和完整性的承诺书,/disclosure/listedinfo/announcement/c/2017-02-24/603169_20170224_18.pdf
381,2017-02-24,兰石重装关于本次交易不构成重大资产重组的说明,/disclosure/listedinfo/announcement/c/2017-02-24/603169_20170224_13.pdf
382,2017-02-24,兰石重装关于本次交易不构成借壳上市的说明,/disclosure/listedinfo/announcement/c/2017-02-24/603169_20170224_11.pdf
383,2017-02-24,兰石重装关于本次交易不构成关联交易的说明,/disclosure/listedinfo/announcement/c/2017-02-24/603169_20170224_14.pdf
384,2017-02-24,兰石重装发行股份及支付现金购买资产预案摘要,/disclosure/listedinfo/announcement/c/2017-02-24/603169_20170224_1.pdf
385,2017-02-24,兰石重装发行股份及支付现金购买资产预案,/disclosure/listedinfo/announcement/c/2017-02-24/603169_20170224_6.pdf
386,2017-02-24,兰石重装独立董事关于发行股份及支付现金购买资产相关事项发表的事前认可,/disclosure/listedinfo/announcement/c/2017-02-24/603169_20170224_12.pdf
387,2017-02-24,兰石重装独立董事关于发行股份及支付现金购买资产相关事项的独立意见,/disclosure/listedinfo/announcement/c/2017-02-24/603169_20170224_7.pdf
388,2017-02-24,兰石重装董事会关于公司股票价格波动是否达到《关于规范上市公司信息披露及相关各方行为的通知》第五条相关标准的说明,/disclosure/listedinfo/announcement/c/2017-02-24/603169_20170224_17.pdf
389,2017-02-24,兰石重装董事会关于发行股份及支付现金购买资产履行法定程序的完备性、合规性及提交法律文件有效性的说明,/disclosure/listedinfo/announcement/c/2017-02-24/603169_20170224_15.pdf
390,2017-02-24,兰石重装董事会关于发行股份购买资产符合《关于规范上市公司重大资产重组若干问题的规定》第四条规定的说明,/disclosure/listedinfo/announcement/c/2017-02-24/603169_20170224_16.pdf
391,2017-02-24,兰石重装：交易对方洛阳瑞泽关于提供消息及文件真实、准确、完整的承诺,/disclosure/listedinfo/announcement/c/2017-02-24/603169_20170224_8.pdf
392,2017-02-24,兰石重装：华龙证券股份有限公司关于兰州兰石重型装备股份有限公司发行股份及支付现金购买资产预案之独立财务顾问核查意见,/disclosure/listedinfo/announcement/c/2017-02-24/603169_20170224_9.pdf
393,2017-02-24,兰石重装：华龙证券股份有限公司关于兰州兰石重型装备股份有限公司发行股份及支付现金购买资产项目之重要声明,/disclosure/listedinfo/announcement/c/2017-02-24/603169_20170224_19.pdf
394,2017-02-24,兰石重装：华龙证券股份有限公司关于《兰州兰石重型装备股份有限公司董事会关于公司股票价格波动是否达到＜关于规范上市公司信息披露及相关各方行为的通知＞第五条相关标准的说明》之核查意见,/disclosure/listedinfo/announcement/c/2017-02-24/603169_20170224_10.pdf
395,2017-02-25,兰石重装三届十五次董事会决议公告,/disclosure/listedinfo/announcement/c/2017-02-25/603169_20170225_1.pdf
396,2017-02-25,兰石重装三届十二次监事会决议公告,/disclosure/listedinfo/announcement/c/2017-02-25/603169_20170225_2.pdf
397,2017-02-25,兰石重装关于子公司申请设备报废处理的公告,/disclosure/listedinfo/announcement/c/2017-02-25/603169_20170225_6.pdf
398,2017-02-25,兰石重装关于召开2017年第一次临时股东大会的通知,/disclosure/listedinfo/announcement/c/2017-02-25/603169_20170225_10.pdf
399,2017-02-25,兰石重装关于预计公司2017年度日常关联交易的公告,/disclosure/listedinfo/announcement/c/2017-02-25/603169_20170225_7.pdf
400,2017-02-25,兰石重装关于修订《会计核算办法》的公告,/disclosure/listedinfo/announcement/c/2017-02-25/603169_20170225_5.pdf
401,2017-02-25,兰石重装关于修订《股东大会议事规则》的公告,/disclosure/listedinfo/announcement/c/2017-02-25/603169_20170225_4.pdf
402,2017-02-25,兰石重装关于修订《公司章程》的公告,/disclosure/listedinfo/announcement/c/2017-02-25/603169_20170225_3.pdf
403,2017-02-25,兰石重装关于为子公司申请金融机构综合授信提供担保的公告,/disclosure/listedinfo/announcement/c/2017-02-25/603169_20170225_9.pdf
404,2017-02-25,兰石重装关于申请金融机构综合授信额度的公告,/disclosure/listedinfo/announcement/c/2017-02-25/603169_20170225_8.pdf
405,2017-02-25,兰石重装股东大会议事规则（2017年2月修订）,/disclosure/listedinfo/announcement/c/2017-02-25/603169_20170225_12.pdf
406,2017-02-25,兰石重装公司章程（2017年2月修订）,/disclosure/listedinfo/announcement/c/2017-02-25/603169_20170225_11.pdf
407,2017-02-25,兰石重装独立董事关于三届十五次董事会相关事项发表的独立意见,/disclosure/listedinfo/announcement/c/2017-02-25/603169_20170225_13.pdf
408,2017-03-09,兰石重装2017年第一次临时股东大会资料,/disclosure/listedinfo/announcement/c/2017-03-09/603169_20170309_1.pdf
409,2017-03-10,兰石重装关于收到上海证券交易所《问询函》的公告,/disclosure/listedinfo/announcement/c/2017-03-10/603169_20170310_1.pdf
410,2017-03-14,兰石重装三届十六次董事会决议公告,/disclosure/listedinfo/announcement/c/2017-03-14/603169_20170314_1.pdf
411,2017-03-14,兰石重装关于聘请审计与评估机构为公司本次发行股份及支付现金购买资产事项提供服务的公告,/disclosure/listedinfo/announcement/c/2017-03-14/603169_20170314_2.pdf
412,2017-03-14,兰石重装独立董事关于公司聘请审计与评估机构发表的独立意见,/disclosure/listedinfo/announcement/c/2017-03-14/603169_20170314_4.pdf
413,2017-03-14,兰石重装2017年第一次临时股东大会决议公告,/disclosure/listedinfo/announcement/c/2017-03-14/603169_20170314_3.pdf
414,2017-03-14,兰石重装2017年第一次临时股东大会的法律意见,/disclosure/listedinfo/announcement/c/2017-03-14/603169_20170314_5.pdf
415,2017-03-21,兰石重装关于回复上海证券交易所《问询函》的公告,/disclosure/listedinfo/announcement/c/2017-03-21/603169_20170321_2.pdf
416,2017-03-21,兰石重装关于公司股票复牌的提示性公告,/disclosure/listedinfo/announcement/c/2017-03-21/603169_20170321_3.pdf
417,2017-03-21,兰石重装发行股份及支付现金购买资产预案（修订稿）摘要,/disclosure/listedinfo/announcement/c/2017-03-21/603169_20170321_1.pdf
418,2017-03-21,兰石重装发行股份及支付现金购买资产预案（修订稿）,/disclosure/listedinfo/announcement/c/2017-03-21/603169_20170321_4.pdf
419,2017-03-21,兰石重装：华龙证券股份有限公司关于上海证券交易所《关于对兰州兰石重型装备股份有限公司发行股份及支付现金购买资产预案信息披露的问询函》相关问题之专项核查意见,/disclosure/listedinfo/announcement/c/2017-03-21/603169_20170321_5.pdf
420,2017-03-21,兰石重装：甘肃正天合律师事务所关于上海证券交易所《关于对兰州兰石重型装备股份有限公司发行股份及支付现金购买资产预案信息披露的问询函》的专项核查意见,/disclosure/listedinfo/announcement/c/2017-03-21/603169_20170321_7.pdf
421,2017-03-21,兰石重装：北京中科华资产评估有限公司关于上海证券交易所《关于对兰州兰石重型装备股份有限公司发行股份及支付现金购买资产预案信息披露的问询函》有关问题的回复,/disclosure/listedinfo/announcement/c/2017-03-21/603169_20170321_6.pdf
422,2017-03-23,兰石重装关于提前归还部分补充流动资金的募集资金的公告,/disclosure/listedinfo/announcement/c/2017-03-23/603169_20170323_1.pdf
423,2017-03-25,兰石重装重大资产重组进展公告,/disclosure/listedinfo/announcement/c/2017-03-25/603169_20170325_1.pdf
424,2017-03-25,兰石重装关于股东减持股份计划的公告,/disclosure/listedinfo/announcement/c/2017-03-25/603169_20170325_2.pdf
425,2017-04-05,兰石重装关于公司控股股东股份质押的公告,/disclosure/listedinfo/announcement/c/2017-04-05/603169_20170405_1.pdf
426,2017-04-07,兰石重装关于公司控股股东股份质押的补充公告,/disclosure/listedinfo/announcement/c/2017-04-07/603169_20170407_1.pdf
427,2017-04-12,兰石重装三届十三次监事会决议公告,/disclosure/listedinfo/announcement/c/2017-04-12/603169_20170412_3.pdf
428,2017-04-12,兰石重装三届十七次董事会决议公告,/disclosure/listedinfo/announcement/c/2017-04-12/603169_20170412_2.pdf
429,2017-04-12,兰石重装关于召开2016年年度股东大会的通知,/disclosure/listedinfo/announcement/c/2017-04-12/603169_20170412_7.pdf
430,2017-04-12,兰石重装关于增加金融机构综合授信额度的公告,/disclosure/listedinfo/announcement/c/2017-04-12/603169_20170412_6.pdf
431,2017-04-12,兰石重装关于公司募集资金存放与使用情况专项报告,/disclosure/listedinfo/announcement/c/2017-04-12/603169_20170412_4.pdf
432,2017-04-12,兰石重装关于对全资子公司增加注册资本的公告,/disclosure/listedinfo/announcement/c/2017-04-12/603169_20170412_5.pdf
433,2017-04-12,兰石重装独立董事关于三届十七次董事会相关事项发表的独立意见,/disclosure/listedinfo/announcement/c/2017-04-12/603169_20170412_17.pdf
434,2017-04-12,兰石重装董事会审计委员会2016年度履职情况报告,/disclosure/listedinfo/announcement/c/2017-04-12/603169_20170412_16.pdf
435,2017-04-12,兰石重装：华龙证券股份有限公司关于兰州兰石重型装备股份有限公司2016年度募集资金存放与实际使用情况的专项核查意见,/disclosure/listedinfo/announcement/c/2017-04-12/603169_20170412_15.pdf
436,2017-04-12,兰石重装：华龙证券股份有限公司关于兰州兰石重型装备股份有限公司2016年持续督导年度报告书,/disclosure/listedinfo/announcement/c/2017-04-12/603169_20170412_18.pdf
437,2017-04-12,兰石重装：关于兰州兰石重型装备股份有限公司募集资金年度存放与实际使用情况的鉴证报告,/disclosure/listedinfo/announcement/c/2017-04-12/603169_20170412_13.pdf
438,2017-04-12,兰石重装：关于兰州兰石重型装备股份有限公司非经营性资金占用及其他关联资金往来情况汇总表的专项审核报告,/disclosure/listedinfo/announcement/c/2017-04-12/603169_20170412_10.pdf
439,2017-04-12,兰石重装：2016年内部控制审计报告,/disclosure/listedinfo/announcement/c/2017-04-12/603169_20170412_14.pdf
440,2017-04-12,兰石重装：2016年度审计报告,/disclosure/listedinfo/announcement/c/2017-04-12/603169_20170412_9.pdf
441,2017-04-12,兰石重装2016年年度报告摘要,/disclosure/listedinfo/announcement/c/2017-04-12/603169_2016_nzy.pdf
442,2017-04-12,兰石重装2016年年度报告,/disclosure/listedinfo/announcement/c/2017-04-12/603169_2016_n.pdf
443,2017-04-12,兰石重装2016年度内部控制评价报告,/disclosure/listedinfo/announcement/c/2017-04-12/603169_20170412_12.pdf
444,2017-04-12,兰石重装2016年度独立董事述职报告,/disclosure/listedinfo/announcement/c/2017-04-12/603169_20170412_11.pdf
445,2017-04-13,兰石重装：华龙证券股份有限公司关于兰州兰石重型装备股份有限公司营业利润比上年同期下降50%以上的专项核查报告,/disclosure/listedinfo/announcement/c/2017-04-13/603169_20170413_2.pdf
446,2017-04-13,兰石重装：华龙证券股份有限公司关于兰州兰石重型装备股份有限公司2017年现场检查报告,/disclosure/listedinfo/announcement/c/2017-04-13/603169_20170413_1.pdf
447,2017-04-20,兰石重装2016年年度股东大会资料,/disclosure/listedinfo/announcement/c/2017-04-20/603169_20170420_1.pdf
448,2017-04-25,兰石重装重大资产重组进展公告,/disclosure/listedinfo/announcement/c/2017-04-25/603169_20170425_1.pdf
449,2017-04-28,兰石重装三届十四次监事会决议公告,/disclosure/listedinfo/announcement/c/2017-04-28/603169_20170428_3.pdf
450,2017-04-28,兰石重装三届十八次董事会决议公告,/disclosure/listedinfo/announcement/c/2017-04-28/603169_20170428_2.pdf
451,2017-04-28,兰石重装关于股东债务重组暨无法实施减持计划的公告,/disclosure/listedinfo/announcement/c/2017-04-28/603169_20170428_4.pdf
452,2017-04-28,兰石重装2017年第一季度报告,/disclosure/listedinfo/announcement/c/2017-04-28/603169_2017_1.pdf
453,2017-04-29,兰石重装三届十九次董事会决议公告,/disclosure/listedinfo/announcement/c/2017-04-29/603169_20170429_1.pdf
454,2017-04-29,兰石重装关于公司海外重大合同终止的公告,/disclosure/listedinfo/announcement/c/2017-04-29/603169_20170429_2.pdf
455,2017-05-03,兰石重装关于控股股东增持公司股份计划的公告,/disclosure/listedinfo/announcement/c/2017-05-03/603169_20170503_1.pdf
456,2017-05-04,兰石重装关于公司海外重大合同终止的补充公告,/disclosure/listedinfo/announcement/c/2017-05-04/603169_20170504_3.pdf
457,2017-05-04,兰石重装2016年年度股东大会决议公告,/disclosure/listedinfo/announcement/c/2017-05-04/603169_20170504_1.pdf
458,2017-05-04,兰石重装2016年年度股东大会的法律意见,/disclosure/listedinfo/announcement/c/2017-05-04/603169_20170504_2.pdf
459,2017-05-05,兰石重装股票交易异常波动公告,/disclosure/listedinfo/announcement/c/2017-05-05/603169_20170505_1.pdf
460,2017-05-05,兰石重装：兰石集团关于对《兰石重装股票交易异常波动问询函》的回函,/disclosure/listedinfo/announcement/c/2017-05-05/603169_20170505_2.pdf
461,2017-05-25,兰石重装关于控股股东增持公司股份达到1%的公告,/disclosure/listedinfo/announcement/c/2017-05-25/603169_20170525_1.pdf
462,2017-05-26,兰石重装重大资产重组进展公告,/disclosure/listedinfo/announcement/c/2017-05-26/603169_20170526_1.pdf
463,2017-05-27,兰石重装未来三年（2017-2019）股东分红回报规划,/disclosure/listedinfo/announcement/c/2017-05-27/603169_20170527_9.pdf
464,2017-05-27,兰石重装三届十五次监事会决议公告,/disclosure/listedinfo/announcement/c/2017-05-27/603169_20170527_18.pdf
465,2017-05-27,兰石重装三届二十次董事会决议公告,/disclosure/listedinfo/announcement/c/2017-05-27/603169_20170527_17.pdf
466,2017-05-27,兰石重装拟非公开发行股票及支付现金购买洛阳瑞泽石化工程有限公司部分股权所涉及洛阳瑞泽石化工程有限公司股东全部权益价值评估项目评估报告,/disclosure/listedinfo/announcement/c/2017-05-27/603169_20170527_5.pdf
467,2017-05-27,兰石重装关于召开2017年第二次临时股东大会的通知,/disclosure/listedinfo/announcement/c/2017-05-27/603169_20170527_21.pdf
468,2017-05-27,兰石重装关于发行股份及支付现金购买资产报告书（草案）与预案（修订稿）差异情况说明公告,/disclosure/listedinfo/announcement/c/2017-05-27/603169_20170527_19.pdf
469,2017-05-27,兰石重装关于变更标的资产审计评估基准日的公告,/disclosure/listedinfo/announcement/c/2017-05-27/603169_20170527_20.pdf
470,2017-05-27,兰石重装关于本次资产重组前12个月内购买、出售资产的说明,/disclosure/listedinfo/announcement/c/2017-05-27/603169_20170527_8.pdf
471,2017-05-27,兰石重装发行股份及支付现金购买资产报告书（草案）摘要,/disclosure/listedinfo/announcement/c/2017-05-27/603169_20170527_1.pdf
472,2017-05-27,兰石重装发行股份及支付现金购买资产报告书（草案）,/disclosure/listedinfo/announcement/c/2017-05-27/603169_20170527_2.pdf
473,2017-05-27,兰石重装独立董事关于发行股份及支付现金购买资产相关事项发表的事前认可,/disclosure/listedinfo/announcement/c/2017-05-27/603169_20170527_10.pdf
474,2017-05-27,兰石重装独立董事关于发行股份及支付现金购买资产相关事项的独立意见,/disclosure/listedinfo/announcement/c/2017-05-27/603169_20170527_11.pdf
475,2017-05-27,兰石重装董事会关于发行股份及支付现金购买资产履行法定程序的完备性、合规性及提交法律文件有效性的说明,/disclosure/listedinfo/announcement/c/2017-05-27/603169_20170527_7.pdf
476,2017-05-27,兰石重装：洛阳瑞泽石化工程有限公司审计报告及财务报表,/disclosure/listedinfo/announcement/c/2017-05-27/603169_20170527_4.pdf
477,2017-05-27,兰石重装：华龙证券股份有限公司关于兰州兰石重型装备股份有限公司发行股份及支付现金购买资产之独立财务顾问报告,/disclosure/listedinfo/announcement/c/2017-05-27/603169_20170527_3.pdf
478,2017-05-27,兰石重装：华龙证券股份有限公司关于兰州兰石重型装备股份有限公司本次交易产业政策和交易类型之独立财务顾问核查意见,/disclosure/listedinfo/announcement/c/2017-05-27/603169_20170527_14.pdf
479,2017-05-27,兰石重装：华龙证券股份有限公司关于兰州兰石重型装备股份有限公司本次发行股份及支付现金购买资产前十二个月内购买、出售资产的核查意见,/disclosure/listedinfo/announcement/c/2017-05-27/603169_20170527_12.pdf
480,2017-05-27,兰石重装：华龙证券股份有限公司关于兰石重装发行股份及支付现金购买资产变更审计和评估基准日是否构成对重组方案重大调整之专项核查意见,/disclosure/listedinfo/announcement/c/2017-05-27/603169_20170527_13.pdf
481,2017-05-27,兰石重装：甘肃正天合律师事务所关于兰州兰石重型装备股份有限公司发行股份及支付现金购买资产的法律意见,/disclosure/listedinfo/announcement/c/2017-05-27/603169_20170527_6.pdf
482,2017-05-27,兰石重装：甘肃正天合律师事务所关于对洛阳瑞泽石化工程有限公司相关资产权属证书的鉴证意见书,/disclosure/listedinfo/announcement/c/2017-05-27/603169_20170527_16.pdf
483,2017-05-27,兰石重装：备考合并财务报表审阅报告,/disclosure/listedinfo/announcement/c/2017-05-27/603169_20170527_15.pdf
484,2017-06-01,兰石重装关于2017年第二次临时股东大会更正补充公告,/disclosure/listedinfo/announcement/c/2017-06-01/603169_20170601_1.pdf
485,2017-06-02,兰石重装：2017年第二次临时股东大会授权委托书,/disclosure/listedinfo/announcement/c/2017-06-02/603169_20170602_1.pdf
