,date,title,url
166,2015-08-26,兰石重装关于四方公司完成注销的公告,/disclosure/listedinfo/announcement/c/2015-08-26/603169_20150826_1.pdf
167,2015-09-01,兰石重装关于兰州精密石化设备有限公司完成注销的公告,/disclosure/listedinfo/announcement/c/2015-09-01/603169_20150901_1.pdf
168,2015-09-08,兰石重装2015年第三次临时股东大会决议公告,/disclosure/listedinfo/announcement/c/2015-09-08/603169_20150908_1.pdf
169,2015-09-08,兰石重装2015年第三次临时股东大会的法律意见,/disclosure/listedinfo/announcement/c/2015-09-08/603169_20150908_2.pdf
170,2015-09-25,兰石重装关于前次募集资金使用情况的报告,/disclosure/listedinfo/announcement/c/2015-09-25/603169_20150925_3.pdf
171,2015-09-25,兰石重装关于非公开发行股票申请文件反馈意见回复的公告,/disclosure/listedinfo/announcement/c/2015-09-25/603169_20150925_1.pdf
172,2015-09-25,兰石重装：关于公司前次募集资金使用情况的鉴证报告,/disclosure/listedinfo/announcement/c/2015-09-25/603169_20150925_4.pdf
173,2015-09-25,兰石重装2015年度非公开发行股票申请文件反馈意见回复,/disclosure/listedinfo/announcement/c/2015-09-25/603169_20150925_2.pdf
174,2015-10-13,兰石重装首次公开发行限售股上市流通公告,/disclosure/listedinfo/announcement/c/2015-10-13/603169_20151013_1.pdf
175,2015-10-13,兰石重装：华龙证券股份有限公司关于兰州兰石重型装备股份有限公司首次公开发行限售股解禁的核查意见,/disclosure/listedinfo/announcement/c/2015-10-13/603169_20151013_2.pdf
176,2015-10-15,兰石重装2015年前三季度业绩预增公告,/disclosure/listedinfo/announcement/c/2015-10-15/603169_20151015_1.pdf
177,2015-10-29,兰石重装二届十三次监事会决议公告,/disclosure/listedinfo/announcement/c/2015-10-29/603169_20151029_3.pdf
178,2015-10-29,兰石重装二届二十八次董事会决议公告,/disclosure/listedinfo/announcement/c/2015-10-29/603169_20151029_2.pdf
179,2015-10-29,兰石重装第三季度季报,/disclosure/listedinfo/announcement/c/2015-10-29/603169_2015_3.pdf
180,2015-11-04,兰石重装关于非公开发行A股股票获得中国证监会发行审核委员会审核通过的公告,/disclosure/listedinfo/announcement/c/2015-11-04/603169_20151104_1.pdf
181,2015-11-07,兰石重装关于投资者联系方式的提示性公告,/disclosure/listedinfo/announcement/c/2015-11-07/603169_20151107_1.pdf
182,2015-11-17,兰石重装非公开发行股票募投项目之新疆兰石重装能源工程有限公司建设项目进展情况的公告,/disclosure/listedinfo/announcement/c/2015-11-17/603169_20151117_1.pdf
183,2015-11-25,兰石重装关于全资子公司设备采购暨关联交易的公告,/disclosure/listedinfo/announcement/c/2015-11-25/603169_20151125_2.pdf
184,2015-11-25,兰石重装二届二十九次董事会决议公告,/disclosure/listedinfo/announcement/c/2015-11-25/603169_20151125_1.pdf
185,2015-11-25,兰石重装独立董事关于公司二届二十九次董事会涉及关联交易事项发表的独立意见,/disclosure/listedinfo/announcement/c/2015-11-25/603169_20151125_3.pdf
186,2015-12-03,兰石重装关于2015年非公开发行股票申请获得中国证监会核准批文的公告,/disclosure/listedinfo/announcement/c/2015-12-03/603169_20151203_1.pdf
187,2015-12-08,兰石重装关于收到中标通知书的公告,/disclosure/listedinfo/announcement/c/2015-12-08/603169_20151208_2.pdf
188,2015-12-08,兰石重装非公开发行股票募投项目之青岛兰石重型机械设备有限公司专业核电装备生产厂房建设项目进展情况的公告,/disclosure/listedinfo/announcement/c/2015-12-08/603169_20151208_1.pdf
189,2015-12-15,兰石重装关于兰州兰石球罐工程有限责任公司完成注销的公告,/disclosure/listedinfo/announcement/c/2015-12-15/603169_20151215_1.pdf
190,2015-12-17,兰石重装关于全资子公司的子公司承接兰石集团技术创新项目暨关联交易的公告,/disclosure/listedinfo/announcement/c/2015-12-17/603169_20151217_2.pdf
191,2015-12-17,兰石重装二届三十次董事会决议公告,/disclosure/listedinfo/announcement/c/2015-12-17/603169_20151217_1.pdf
192,2015-12-17,兰石重装独立董事关于公司二届三十次董事会涉及关联交易事项发表的独立意见,/disclosure/listedinfo/announcement/c/2015-12-17/603169_20151217_3.pdf
193,2015-12-21,兰石重装关于子公司生产的首台民用核安全压力容器发运出厂的公告,/disclosure/listedinfo/announcement/c/2015-12-21/603169_20151221_1.pdf
194,2015-12-30,兰石重装关于独立董事辞职的公告,/disclosure/listedinfo/announcement/c/2015-12-30/603169_20151230_1.pdf
195,2016-01-07,兰石重装简式权益变动报告书,/disclosure/listedinfo/announcement/c/2016-01-07/603169_20160107_3.pdf
196,2016-01-07,兰石重装关于非公开发行A股股票权益变动的提示性公告,/disclosure/listedinfo/announcement/c/2016-01-07/603169_20160107_2.pdf
197,2016-01-07,兰石重装非公开发行股票发行情况报告书,/disclosure/listedinfo/announcement/c/2016-01-07/603169_20160107_7.pdf
198,2016-01-07,兰石重装非公开发行股票发行结果暨股份变动公告,/disclosure/listedinfo/announcement/c/2016-01-07/603169_20160107_1.pdf
199,2016-01-07,兰石重装：华龙证券股份有限公司关于兰州兰石重型装备股份有限公司非公开发行股票发行过程和认购对象合规性的报告,/disclosure/listedinfo/announcement/c/2016-01-07/603169_20160107_6.pdf
200,2016-01-07,兰石重装：关于兰州兰石重型装备股份有限公司非公开发行股票募集资金之验资报告,/disclosure/listedinfo/announcement/c/2016-01-07/603169_20160107_4.pdf
201,2016-01-07,兰石重装：甘肃正天合律师事务所关于兰州兰石重型装备股份有限公司非公开发行股票发行过程和认购对象合规性的法律意见,/disclosure/listedinfo/announcement/c/2016-01-07/603169_20160107_5.pdf
202,2016-01-08,兰石重装非公开发行股票发行结果暨股份变动补充公告,/disclosure/listedinfo/announcement/c/2016-01-08/603169_20160108_1.pdf
203,2016-01-12,兰石重装以自筹资金预先投入募集资金投资项目情况报告的鉴证报告,/disclosure/listedinfo/announcement/c/2016-01-12/603169_20160112_7.pdf
204,2016-01-12,兰石重装监事会关于相关事项发表的专项意见,/disclosure/listedinfo/announcement/c/2016-01-12/603169_20160112_12.pdf
205,2016-01-12,兰石重装关于使用银行承兑汇票支付募投项目所需资金并以募集资金等额置换的公告,/disclosure/listedinfo/announcement/c/2016-01-12/603169_20160112_6.pdf
206,2016-01-12,兰石重装关于使用闲置募集资金暂时性补充流动资金的公告,/disclosure/listedinfo/announcement/c/2016-01-12/603169_20160112_5.pdf
207,2016-01-12,兰石重装关于使用募集资金置换募投项目已投入自筹资金的公告,/disclosure/listedinfo/announcement/c/2016-01-12/603169_20160112_4.pdf
208,2016-01-12,兰石重装关于签订募集资金三方监管协议的公告,/disclosure/listedinfo/announcement/c/2016-01-12/603169_20160112_1.pdf
209,2016-01-12,兰石重装二届十四次监事会决议公告,/disclosure/listedinfo/announcement/c/2016-01-12/603169_20160112_3.pdf
210,2016-01-12,兰石重装二届三十一次董事会决议公告,/disclosure/listedinfo/announcement/c/2016-01-12/603169_20160112_2.pdf
211,2016-01-12,兰石重装独立董事关于二届三十一次董事会发表的独立意见,/disclosure/listedinfo/announcement/c/2016-01-12/603169_20160112_11.pdf
212,2016-01-12,兰石重装：华龙证券股份有限公司关于兰州兰石重型装备股份有限公司使用银行承兑汇票支付非公开发行募投项目资金并以募集资金等额置换的核查意见,/disclosure/listedinfo/announcement/c/2016-01-12/603169_20160112_9.pdf
213,2016-01-12,兰石重装：华龙证券股份有限公司关于兰州兰石重型装备股份有限公司使用闲置募集资金暂时性补充流动资金的核查意见,/disclosure/listedinfo/announcement/c/2016-01-12/603169_20160112_10.pdf
214,2016-01-12,兰石重装：华龙证券股份有限公司关于兰州兰石重型装备股份有限公司使用募集资金置换预先已投入募集资金投资项目的自筹资金的核查意见,/disclosure/listedinfo/announcement/c/2016-01-12/603169_20160112_8.pdf
215,2016-01-22,兰石重装关于监事会换届选举的提示性公告,/disclosure/listedinfo/announcement/c/2016-01-22/603169_20160122_2.pdf
216,2016-01-22,兰石重装关于董事会换届选举的提示性公告,/disclosure/listedinfo/announcement/c/2016-01-22/603169_20160122_1.pdf
217,2016-01-27,兰石重装2015年度业绩预增公告,/disclosure/listedinfo/announcement/c/2016-01-27/603169_20160127_1.pdf
218,2016-01-28,兰石重装关于2015年度业绩预增公告落款日期的更正公告,/disclosure/listedinfo/announcement/c/2016-01-28/603169_20160128_1.pdf
219,2016-02-03,兰石重装关于完成注册资本工商变更登记及“三证合一”的公告,/disclosure/listedinfo/announcement/c/2016-02-03/603169_20160203_1.pdf
220,2016-03-01,兰石重装关于股东所持股份部分解除质押的公告,/disclosure/listedinfo/announcement/c/2016-03-01/603169_20160301_1.pdf
221,2016-03-03,兰石重装关于持股5%以上股东减持股份计划公告,/disclosure/listedinfo/announcement/c/2016-03-03/603169_20160303_1.pdf
222,2016-03-04,兰石重装关于持股5%以上股东减持股份计划的补充公告,/disclosure/listedinfo/announcement/c/2016-03-04/603169_20160304_1.pdf
223,2016-03-05,兰石重装二届三十二次董事会决议公告,/disclosure/listedinfo/announcement/c/2016-03-05/603169_20160305_1.pdf
224,2016-03-16,兰石重装关于股东股权解除质押及再质押的公告,/disclosure/listedinfo/announcement/c/2016-03-16/603169_20160316_1.pdf
225,2016-03-19,兰石重装关于召开2016年第一次临时股东大会的通知,/disclosure/listedinfo/announcement/c/2016-03-19/603169_20160319_4.pdf
226,2016-03-19,兰石重装关于为子公司申请金融机构综合授信提供担保的公告,/disclosure/listedinfo/announcement/c/2016-03-19/603169_20160319_3.pdf
227,2016-03-19,兰石重装关于换届选举第三届监事会职工代表监事的公告,/disclosure/listedinfo/announcement/c/2016-03-19/603169_20160319_5.pdf
228,2016-03-19,兰石重装二届十五次监事会决议公告,/disclosure/listedinfo/announcement/c/2016-03-19/603169_20160319_2.pdf
229,2016-03-19,兰石重装二届三十三次董事会决议公告,/disclosure/listedinfo/announcement/c/2016-03-19/603169_20160319_1.pdf
230,2016-03-19,兰石重装独立董事提名人声明,/disclosure/listedinfo/announcement/c/2016-03-19/603169_20160319_11.pdf
231,2016-03-19,兰石重装独立董事候选人声明（赵新民）,/disclosure/listedinfo/announcement/c/2016-03-19/603169_20160319_10.pdf
232,2016-03-19,兰石重装独立董事候选人声明（万红波）,/disclosure/listedinfo/announcement/c/2016-03-19/603169_20160319_9.pdf
233,2016-03-19,兰石重装独立董事候选人声明（梁永智）,/disclosure/listedinfo/announcement/c/2016-03-19/603169_20160319_8.pdf
234,2016-03-19,兰石重装独立董事关于二届三十三次董事会相关事项发表的独立意见,/disclosure/listedinfo/announcement/c/2016-03-19/603169_20160319_6.pdf
235,2016-03-19,兰石重装董事会提名委员会关于第三届董事会董事候选人的审核意见,/disclosure/listedinfo/announcement/c/2016-03-19/603169_20160319_7.pdf
236,2016-03-25,兰石重装2016年第一次临时股东大会资料,/disclosure/listedinfo/announcement/c/2016-03-25/603169_20160325_1.pdf
237,2016-03-31,兰石重装关于持股5%以上股东减持股份计划公告,/disclosure/listedinfo/announcement/c/2016-03-31/603169_20160331_1.pdf
238,2016-04-06,兰石重装三届一次监事会决议公告,/disclosure/listedinfo/announcement/c/2016-04-06/603169_20160406_2.pdf
239,2016-04-06,兰石重装三届一次董事会决议公告,/disclosure/listedinfo/announcement/c/2016-04-06/603169_20160406_1.pdf
240,2016-04-06,兰石重装公司章程（2016修订）,/disclosure/listedinfo/announcement/c/2016-04-06/603169_20160406_6.pdf
241,2016-04-06,兰石重装独立董事关于三届一次董事会相关事项发表的独立意见,/disclosure/listedinfo/announcement/c/2016-04-06/603169_20160406_4.pdf
242,2016-04-06,兰石重装2016年第一次临时股东大会决议公告,/disclosure/listedinfo/announcement/c/2016-04-06/603169_20160406_3.pdf
243,2016-04-06,兰石重装2016年第一次临时股东大会的法律意见,/disclosure/listedinfo/announcement/c/2016-04-06/603169_20160406_5.pdf
244,2016-04-07,兰石重装关于董事会秘书变更的公告,/disclosure/listedinfo/announcement/c/2016-04-07/603169_20160407_1.pdf
245,2016-04-12,兰石重装三届二次监事会决议公告,/disclosure/listedinfo/announcement/c/2016-04-12/603169_20160412_3.pdf
246,2016-04-12,兰石重装三届二次董事会决议公告,/disclosure/listedinfo/announcement/c/2016-04-12/603169_20160412_2.pdf
247,2016-04-12,兰石重装年报摘要,/disclosure/listedinfo/announcement/c/2016-04-12/603169_2015_nzy.pdf
248,2016-04-12,兰石重装年报,/disclosure/listedinfo/announcement/c/2016-04-12/603169_2015_n.pdf
249,2016-04-12,兰石重装内部控制审计报告,/disclosure/listedinfo/announcement/c/2016-04-12/603169_20160412_16.pdf
250,2016-04-12,兰石重装关于召开2015年年度股东大会的通知,/disclosure/listedinfo/announcement/c/2016-04-12/603169_20160412_6.pdf
251,2016-04-12,兰石重装关于预计公司2016年度日常关联交易的公告,/disclosure/listedinfo/announcement/c/2016-04-12/603169_20160412_5.pdf
252,2016-04-12,兰石重装关于公司募集资金存放与使用情况专项报告,/disclosure/listedinfo/announcement/c/2016-04-12/603169_20160412_4.pdf
253,2016-04-12,兰石重装独立董事关于三届二次董事会发表的独立意见,/disclosure/listedinfo/announcement/c/2016-04-12/603169_20160412_9.pdf
254,2016-04-12,兰石重装董事会审计委员会2015年度履职情况报告,/disclosure/listedinfo/announcement/c/2016-04-12/603169_20160412_18.pdf
255,2016-04-12,兰石重装董事会关于募集资金年度存放与实际使用情况的专项报告,/disclosure/listedinfo/announcement/c/2016-04-12/603169_20160412_14.pdf
256,2016-04-12,兰石重装：华龙证券股份有限公司关于兰州兰石重型装备股份有限公司2015年度募集资金存放与实际使用情况的专项核查意见,/disclosure/listedinfo/announcement/c/2016-04-12/603169_20160412_17.pdf
257,2016-04-12,兰石重装：华龙证券股份有限公司关于兰州兰石重型装备股份有限公司2015年持续督导年度报告书,/disclosure/listedinfo/announcement/c/2016-04-12/603169_20160412_19.pdf
258,2016-04-12,兰石重装：关于兰州兰石重型装备股份有限公司募集资金年度存放与实际使用情况的鉴证报告,/disclosure/listedinfo/announcement/c/2016-04-12/603169_20160412_15.pdf
259,2016-04-12,兰石重装：关于兰州兰石重型装备股份有限公司非经营性资金占用及其他关联资金往来情况汇总表的专项审核报告,/disclosure/listedinfo/announcement/c/2016-04-12/603169_20160412_11.pdf
260,2016-04-12,兰石重装2016年一季度业绩预亏公告,/disclosure/listedinfo/announcement/c/2016-04-12/603169_20160412_7.pdf
261,2016-04-12,兰石重装2015年度审计报告,/disclosure/listedinfo/announcement/c/2016-04-12/603169_20160412_10.pdf
262,2016-04-12,兰石重装2015年度内部控制评价报告,/disclosure/listedinfo/announcement/c/2016-04-12/603169_20160412_13.pdf
263,2016-04-12,兰石重装2015年度独立董事述职报告,/disclosure/listedinfo/announcement/c/2016-04-12/603169_20160412_12.pdf
264,2016-04-16,兰石重装第一季度季报,/disclosure/listedinfo/announcement/c/2016-04-16/603169_2016_1.pdf
265,2016-04-16,兰石重装2015年度股东大会资料,/disclosure/listedinfo/announcement/c/2016-04-16/603169_20160416_3.pdf
266,2016-05-06,兰石重装2015年年度股东大会决议公告,/disclosure/listedinfo/announcement/c/2016-05-06/603169_20160506_1.pdf
267,2016-05-06,兰石重装2015年年度股东大会的法律意见,/disclosure/listedinfo/announcement/c/2016-05-06/603169_20160506_2.pdf
268,2016-05-13,兰石重装关于完成注册地址工商变更登记的公告,/disclosure/listedinfo/announcement/c/2016-05-13/603169_20160513_1.pdf
269,2016-06-07,兰石重装关于公司控股股东部分股权解除质押及再质押的公告,/disclosure/listedinfo/announcement/c/2016-06-07/603169_20160607_1.pdf
270,2016-06-15,兰石重装2015年度利润分配实施公告,/disclosure/listedinfo/announcement/c/2016-06-15/603169_20160615_1.pdf
271,2016-06-16,兰石重装关于提前归还部分募集资金的公告,/disclosure/listedinfo/announcement/c/2016-06-16/603169_20160616_1.pdf
272,2016-06-25,兰石重装关于参加2016年甘肃上市公司投资者集体接待日活动的公告,/disclosure/listedinfo/announcement/c/2016-06-25/603169_20160625_1.pdf
273,2016-07-12,兰石重装三届四次董事会决议公告,/disclosure/listedinfo/announcement/c/2016-07-12/603169_20160712_1.pdf
274,2016-07-13,兰石重装2016年半年度业绩预减公告,/disclosure/listedinfo/announcement/c/2016-07-13/603169_20160713_1.pdf
275,2016-07-30,兰石重装三届五次董事会决议公告,/disclosure/listedinfo/announcement/c/2016-07-30/603169_20160730_2.pdf
276,2016-07-30,兰石重装三届四次监事会决议公告,/disclosure/listedinfo/announcement/c/2016-07-30/603169_20160730_3.pdf
277,2016-07-30,兰石重装募集资金2016年上半年度存放与使用情况的专项报告,/disclosure/listedinfo/announcement/c/2016-07-30/603169_20160730_4.pdf
278,2016-07-30,兰石重装关于召开2016年第二次临时股东大会的通知,/disclosure/listedinfo/announcement/c/2016-07-30/603169_20160730_11.pdf
279,2016-07-30,兰石重装关于选举公司第三届董事会董事长的公告,/disclosure/listedinfo/announcement/c/2016-07-30/603169_20160730_8.pdf
280,2016-07-30,兰石重装关于向控股股东购买商务用车暨关联交易的公告,/disclosure/listedinfo/announcement/c/2016-07-30/603169_20160730_6.pdf
281,2016-07-30,兰石重装关于西安公司承接兰石集团钻机试制项目暨关联交易的公告,/disclosure/listedinfo/announcement/c/2016-07-30/603169_20160730_7.pdf
282,2016-07-30,兰石重装关于聘任证券事务代表的公告,/disclosure/listedinfo/announcement/c/2016-07-30/603169_20160730_10.pdf
283,2016-07-30,兰石重装关于聘任公司总经理的公告,/disclosure/listedinfo/announcement/c/2016-07-30/603169_20160730_9.pdf
284,2016-07-30,兰石重装关于公司拟向控股股东拆借资金暨关联交易的公告,/disclosure/listedinfo/announcement/c/2016-07-30/603169_20160730_5.pdf
285,2016-07-30,兰石重装独立董事关于三届五次董事会相关事项发表的事前认可及独立意见,/disclosure/listedinfo/announcement/c/2016-07-30/603169_20160730_13.pdf
286,2016-07-30,兰石重装2016年半年度报告摘要,/disclosure/listedinfo/announcement/c/2016-07-30/603169_2016_zzy.pdf
287,2016-07-30,兰石重装2016年半年度报告,/disclosure/listedinfo/announcement/c/2016-07-30/603169_2016_z.pdf
288,2016-08-02,兰石重装申请综合授信额度的公告,/disclosure/listedinfo/announcement/c/2016-08-02/603169_20160802_3.pdf
289,2016-08-02,兰石重装关于修改公司章程的公告,/disclosure/listedinfo/announcement/c/2016-08-02/603169_20160802_2.pdf
290,2016-08-02,兰石重装公司章程（2016年7月修订）,/disclosure/listedinfo/announcement/c/2016-08-02/603169_20160802_4.pdf
291,2016-08-02,兰石重装2016年第二次临时股东大会资料,/disclosure/listedinfo/announcement/c/2016-08-02/603169_20160802_1.pdf
292,2016-08-06,兰石重装关于新疆公司向国开发展基金有限公司申请专项基金投资的公告,/disclosure/listedinfo/announcement/c/2016-08-06/603169_20160806_1.pdf
293,2016-08-06,兰石重装关于2016年第二次临时股东大会增加临时提案的公告,/disclosure/listedinfo/announcement/c/2016-08-06/603169_20160806_2.pdf
294,2016-08-06,兰石重装2016年第二次临时股东大会资料（补充版）,/disclosure/listedinfo/announcement/c/2016-08-06/603169_20160806_3.pdf
295,2016-08-16,兰石重装重大合同公告,/disclosure/listedinfo/announcement/c/2016-08-16/603169_20160816_2.pdf
296,2016-08-16,兰石重装2016年第二次临时股东大会决议公告,/disclosure/listedinfo/announcement/c/2016-08-16/603169_20160816_1.pdf
297,2016-08-16,兰石重装2016年第二次临时股东大会的法律意见,/disclosure/listedinfo/announcement/c/2016-08-16/603169_20160816_3.pdf
298,2016-08-19,兰石重装三届六次董事会决议公告,/disclosure/listedinfo/announcement/c/2016-08-19/603169_20160819_1.pdf
299,2016-09-01,兰石重装关于持股5%以上股东因误操作导致违规买卖股票的公告,/disclosure/listedinfo/announcement/c/2016-09-01/603169_20160901_1.pdf
300,2016-09-02,兰石重装关于完成公司法定代表人工商变更登记的公告,/disclosure/listedinfo/announcement/c/2016-09-02/603169_20160902_2.pdf
301,2016-09-02,兰石重装关于股东所持股份全部解除质押的公告,/disclosure/listedinfo/announcement/c/2016-09-02/603169_20160902_1.pdf
302,2016-09-10,兰石重装三届五次监事会决议公告,/disclosure/listedinfo/announcement/c/2016-09-10/603169_20160910_1.pdf
303,2016-09-10,兰石重装关于提前归还部分募集资金的公告,/disclosure/listedinfo/announcement/c/2016-09-10/603169_20160910_3.pdf
304,2016-09-10,兰石重装关于监事会主席辞职及补选股东代表监事的公告,/disclosure/listedinfo/announcement/c/2016-09-10/603169_20160910_2.pdf
305,2016-09-15,兰石重装重大合同公告,/disclosure/listedinfo/announcement/c/2016-09-15/603169_20160915_2.pdf
306,2016-09-15,兰石重装三届七次董事会决议公告,/disclosure/listedinfo/announcement/c/2016-09-15/603169_20160915_1.pdf
307,2016-09-23,兰石重装三届八次董事会决议公告,/disclosure/listedinfo/announcement/c/2016-09-23/603169_20160923_1.pdf
308,2016-09-23,兰石重装海外重大合同公告,/disclosure/listedinfo/announcement/c/2016-09-23/603169_20160923_2.pdf
309,2016-09-26,兰石重装海外重大合同补充公告,/disclosure/listedinfo/announcement/c/2016-09-26/603169_20160926_2.pdf
310,2016-09-26,兰石重装关于持股5%以上股东减持计划实施完毕的公告,/disclosure/listedinfo/announcement/c/2016-09-26/603169_20160926_1.pdf
311,2016-10-01,兰石重装关于持股5%以上股东减持股份计划实施情况及后续减持股份计划的公告,/disclosure/listedinfo/announcement/c/2016-10-01/603169_20161001_1.pdf
312,2016-10-11,兰石重装关于提前归还部分募集资金的公告,/disclosure/listedinfo/announcement/c/2016-10-11/603169_20161011_1.pdf
313,2016-10-15,兰石重装2016年前三季度业绩预减公告,/disclosure/listedinfo/announcement/c/2016-10-15/603169_20161015_1.pdf
314,2016-10-28,兰石重装三届六次监事会决议公告,/disclosure/listedinfo/announcement/c/2016-10-28/603169_20161028_3.pdf
315,2016-10-28,兰石重装三届九次董事会决议公告,/disclosure/listedinfo/announcement/c/2016-10-28/603169_20161028_1.pdf
316,2016-10-28,兰石重装关于召开2016年第三次临时股东大会的通知,/disclosure/listedinfo/announcement/c/2016-10-28/603169_20161028_6.pdf
317,2016-10-28,兰石重装关于公司首次公开发行全部募投项目结项的公告,/disclosure/listedinfo/announcement/c/2016-10-28/603169_20161028_4.pdf
318,2016-10-28,兰石重装关于承接兰州兰石能源装备工程研究院有限公司EPC工程总包项目暨关联交易的公告,/disclosure/listedinfo/announcement/c/2016-10-28/603169_20161028_5.pdf
319,2016-10-28,兰石重装独立董事关于三届九次董事会相关事项发表的事前认可及独立意见,/disclosure/listedinfo/announcement/c/2016-10-28/603169_20161028_8.pdf
320,2016-10-28,兰石重装董事会审计委员会关于关联交易的书面审核意见,/disclosure/listedinfo/announcement/c/2016-10-28/603169_20161028_10.pdf
321,2016-10-28,兰石重装：华龙证券股份有限公司关于兰州兰石重型装备股份有限公司首次公开发行股票募投项目结项的核查意见,/disclosure/listedinfo/announcement/c/2016-10-28/603169_20161028_9.pdf
322,2016-10-28,兰石重装2016年第三季度报告,/disclosure/listedinfo/announcement/c/2016-10-28/603169_2016_3.pdf
323,2016-10-28,兰石重装2016年第三次临时股东大会资料,/disclosure/listedinfo/announcement/c/2016-10-28/603169_20161028_11.pdf
324,2016-11-15,兰石重装三届七次监事会决议公告,/disclosure/listedinfo/announcement/c/2016-11-15/603169_20161115_2.pdf
325,2016-11-15,兰石重装2016年第三次临时股东大会决议公告,/disclosure/listedinfo/announcement/c/2016-11-15/603169_20161115_1.pdf
326,2016-11-15,兰石重装2016年第三次临时股东大会的法律意见,/disclosure/listedinfo/announcement/c/2016-11-15/603169_20161115_3.pdf
327,2016-11-23,兰石重装关于提前归还部分募集资金的公告,/disclosure/listedinfo/announcement/c/2016-11-23/603169_20161123_1.pdf
328,2016-11-24,兰石重装重大资产重组停牌公告,/disclosure/listedinfo/announcement/c/2016-11-24/603169_20161124_1.pdf
329,2016-11-26,兰石重装关于前十名股东持股情况的公告,/disclosure/listedinfo/announcement/c/2016-11-26/603169_20161126_2.pdf
330,2016-11-26,兰石重装关于董事辞职的公告,/disclosure/listedinfo/announcement/c/2016-11-26/603169_20161126_1.pdf
331,2016-11-29,兰石重装三届十次董事会决议公告,/disclosure/listedinfo/announcement/c/2016-11-29/603169_20161129_1.pdf
