,date,title,url
0,2014-10-14,兰石重装股票交易异常波动公告,/disclosure/listedinfo/announcement/c/2014-10-13/603169_20141014_1.pdf
1,2014-10-17,兰石重装股票交易异常波动公告,/disclosure/listedinfo/announcement/c/2014-10-16/603169_20141017_1.pdf
2,2014-10-17,兰石重装出城入园产业升级项目进展情况公告,/disclosure/listedinfo/announcement/c/2014-10-16/603169_20141017_2.pdf
3,2014-10-17,兰石重装：兰州兰石集团有限公司关于对兰州兰石重型装备股份有限公司问询函的复函,/disclosure/listedinfo/announcement/c/2014-10-16/603169_20141017_3.pdf
4,2014-10-21,兰石重装股票交易异常波动公告,/disclosure/listedinfo/announcement/c/2014-10-20/603169_20141021_1.pdf
5,2014-10-21,兰石重装：兰州兰石集团有限公司关于对公司问询函的复函,/disclosure/listedinfo/announcement/c/2014-10-20/603169_20141021_2.pdf
6,2014-10-23,兰石重装股票交易异常波动公告,/disclosure/listedinfo/announcement/c/2014-10-22/603169_20141023_1.pdf
7,2014-10-23,兰石重装：兰州兰石集团有限公司关于对兰州兰石重型装备股份有限公司问询函的复函,/disclosure/listedinfo/announcement/c/2014-10-22/603169_20141023_2.pdf
8,2014-10-25,兰石重装股票交易异常波动公告,/disclosure/listedinfo/announcement/c/2014-10-24/603169_20141025_1.pdf
9,2014-10-25,兰石重装：兰州兰石集团有限公司关于对兰州兰石重型装备股份有限公司问询函的复函,/disclosure/listedinfo/announcement/c/2014-10-24/603169_20141025_2.pdf
10,2014-10-29,兰石重装重大事项内部报告制度,/disclosure/listedinfo/announcement/c/2014-10-28/603169_20141029_7.pdf
11,2014-10-29,兰石重装信息披露事务管理制度,/disclosure/listedinfo/announcement/c/2014-10-28/603169_20141029_6.pdf
12,2014-10-29,兰石重装投资者关系管理制度,/disclosure/listedinfo/announcement/c/2014-10-28/603169_20141029_8.pdf
13,2014-10-29,兰石重装公司章程（2014修订）,/disclosure/listedinfo/announcement/c/2014-10-28/603169_20141029_5.pdf
14,2014-10-29,兰石重装二届五次监事会决议公告,/disclosure/listedinfo/announcement/c/2014-10-28/603169_20141029_3.pdf
15,2014-10-29,兰石重装二届十八次董事会决议公告,/disclosure/listedinfo/announcement/c/2014-10-28/603169_20141029_2.pdf
16,2014-10-29,兰石重装第三季度季报,/disclosure/listedinfo/announcement/c/2014-10-28/603169_2014_3.pdf
17,2014-10-30,兰石重装股票交易异常波动公告,/disclosure/listedinfo/announcement/c/2014-10-29/603169_20141030_1.pdf
18,2014-10-30,兰石重装：兰州兰石集团有限公司关于对兰州兰石重型装备股份有限公司问询函的复函,/disclosure/listedinfo/announcement/c/2014-10-29/603169_20141030_2.pdf
19,2014-11-01,兰石重装关于签订募集资金专户存储三方监管协议的公告,/disclosure/listedinfo/announcement/c/2014-10-31/603169_20141101_1.pdf
20,2014-11-04,兰石重装股票交易异常波动公告,/disclosure/listedinfo/announcement/c/2014-11-03/603169_20141104_1.pdf
21,2014-11-04,兰石重装：兰州兰石集团有限公司关于对兰州兰石重型装备股份有限公司问询函的复函,/disclosure/listedinfo/announcement/c/2014-11-03/603169_20141104_2.pdf
22,2014-11-06,兰石重装股票交易异常波动公告,/disclosure/listedinfo/announcement/c/2014-11-05/603169_20141106_1.pdf
23,2014-11-06,兰石重装：兰州兰石集团有限公司关于对兰州兰石重型装备股份有限公司问询函的复函,/disclosure/listedinfo/announcement/c/2014-11-05/603169_20141106_2.pdf
24,2014-11-07,兰石重装内幕信息知情人登记管理制度,/disclosure/listedinfo/announcement/c/2014-11-06/603169_20141107_6.pdf
25,2014-11-07,兰石重装关于使用募集资金置换募投项目已投入自筹资金的公告,/disclosure/listedinfo/announcement/c/2014-11-06/603169_20141107_1.pdf
26,2014-11-07,兰石重装二届十九次董事会决议公告,/disclosure/listedinfo/announcement/c/2014-11-06/603169_20141107_2.pdf
27,2014-11-07,兰石重装二届六次监事会决议公告,/disclosure/listedinfo/announcement/c/2014-11-06/603169_20141107_3.pdf
28,2014-11-07,兰石重装：瑞华会计师事务所（特殊普通合伙）关于兰州兰石重型装备股份有限公司以自筹资金预先投入募集资金投资项目情况报告的鉴证报告,/disclosure/listedinfo/announcement/c/2014-11-06/603169_20141107_5.pdf
29,2014-11-07,兰石重装：华龙证券有限责任公司关于兰州兰石重型装备股份有限公司以募集资金置换预先投入募集资金投资项目的自筹资金之核查意见,/disclosure/listedinfo/announcement/c/2014-11-06/603169_20141107_4.pdf
30,2014-11-08,兰石重装股票交易异常波动公告,/disclosure/listedinfo/announcement/c/2014-11-07/603169_20141108_1.pdf
31,2014-11-08,兰石重装：兰州兰石集团有限公司关于对兰州兰石重型装备股份有限公司问询函的复函,/disclosure/listedinfo/announcement/c/2014-11-07/603169_20141108_2.pdf
32,2014-11-11,兰石重装股票停牌并召开投资者说明会的公告,/disclosure/listedinfo/announcement/c/2014-11-10/603169_20141111_1.pdf
33,2014-11-12,兰石重装关于投资者说明会召开情况说明暨股票复牌的公告,/disclosure/listedinfo/announcement/c/2014-11-11/603169_20141112_1.pdf
34,2014-11-22,兰石重装股票交易异常波动公告,/disclosure/listedinfo/announcement/c/2014-11-21/603169_20141122_1.pdf
35,2014-11-22,兰石重装：兰州兰石集团有限公司关于对兰州兰石重型装备股份有限公司问询函的复函,/disclosure/listedinfo/announcement/c/2014-11-21/603169_20141122_2.pdf
36,2014-11-25,兰石重装股票交易异常波动实施停牌的公告,/disclosure/listedinfo/announcement/c/2014-11-24/603169_20141125_1.pdf
37,2014-11-28,兰石重装关于股价异常波动核查结果暨复牌公告,/disclosure/listedinfo/announcement/c/2014-11-27/603169_20141128_3.pdf
38,2014-11-28,兰石重装关于变更投资者联系电话的公告,/disclosure/listedinfo/announcement/c/2014-11-27/603169_20141128_2.pdf
39,2014-11-28,兰石重装关于办理完毕工商变更登记及备案的公告,/disclosure/listedinfo/announcement/c/2014-11-27/603169_20141128_1.pdf
40,2014-12-13,兰石重装拟搬迁改造所涉及的部分资产搬迁补偿价值项目资产评估报告书,/disclosure/listedinfo/announcement/c/2014-12-12/603169_20141213_8.pdf
41,2014-12-13,兰石重装关于召开公司2014年第四次临时股东大会的通知,/disclosure/listedinfo/announcement/c/2014-12-12/603169_20141213_6.pdf
42,2014-12-13,兰石重装关于出城入园产业升级项目资产移交暨关联交易的公告,/disclosure/listedinfo/announcement/c/2014-12-12/603169_20141213_3.pdf
43,2014-12-13,兰石重装关于出城入园产业升级项目受让部分土地使用权暨关联交易的公告,/disclosure/listedinfo/announcement/c/2014-12-12/603169_20141213_5.pdf
44,2014-12-13,兰石重装关于出城入园产业升级项目搬迁补偿暨关联交易的公告,/disclosure/listedinfo/announcement/c/2014-12-12/603169_20141213_4.pdf
45,2014-12-13,兰石重装二届七次监事会决议公告,/disclosure/listedinfo/announcement/c/2014-12-12/603169_20141213_2.pdf
46,2014-12-13,兰石重装二届二十次董事会决议公告,/disclosure/listedinfo/announcement/c/2014-12-12/603169_20141213_1.pdf
47,2014-12-13,兰石重装独立董事关于公司二届二十次董事会关联交易事项发表的事前认可及独立意见,/disclosure/listedinfo/announcement/c/2014-12-12/603169_20141213_10.pdf
48,2014-12-13,兰石重装：土地估价报告,/disclosure/listedinfo/announcement/c/2014-12-12/603169_20141213_9.pdf
49,2014-12-13,兰石重装：甘肃省人民政府国有资产监督管理委员会关于兰州兰石集团有限公司转让兰州新区装备制造工业园区部分国有土地使用权的批复,/disclosure/listedinfo/announcement/c/2014-12-12/603169_20141213_11.pdf
50,2014-12-13,兰石重装“出城入园”产业升级项目竣工财务决算审核报告,/disclosure/listedinfo/announcement/c/2014-12-12/603169_20141213_7.pdf
51,2014-12-16,兰石重装关于董事会、监事会决议公告以及出城入园产业升级项目资产移交暨关联交易公告的更正公告,/disclosure/listedinfo/announcement/c/2014-12-15/603169_20141216_1.pdf
52,2014-12-19,兰石重装关于完成炼化分公司注销登记的公告,/disclosure/listedinfo/announcement/c/2014-12-18/603169_20141219_1.pdf
53,2014-12-19,兰石重装2014年第四次临时股东大会会议资料,/disclosure/listedinfo/announcement/c/2014-12-18/603169_20141219_2.pdf
54,2014-12-24,兰石重装股票交易异常波动公告,/disclosure/listedinfo/announcement/c/2014-12-23/603169_20141224_1.pdf
55,2014-12-24,兰石重装：兰州兰石集团有限公司关于对兰州兰石重型装备股份有限公司问询函的复函,/disclosure/listedinfo/announcement/c/2014-12-23/603169_20141224_2.pdf
56,2014-12-26,兰石重装关于公司股东股份质押公告,/disclosure/listedinfo/announcement/c/2014-12-25/603169_20141226_1.pdf
57,2014-12-30,兰石重装2014年第四次临时股东大会决议公告,/disclosure/listedinfo/announcement/c/2014-12-29/603169_20141230_1.pdf
58,2014-12-30,兰石重装2014年第四次临时股东大会的法律意见,/disclosure/listedinfo/announcement/c/2014-12-29/603169_20141230_2.pdf
59,2015-01-09,兰石重装股票交易异常波动公告,/disclosure/listedinfo/announcement/c/2015-01-08/603169_20150109_1.pdf
60,2015-01-09,兰石重装：兰州兰石集团有限公司关于对兰州兰石重型装备股份有限公司问询函的复函,/disclosure/listedinfo/announcement/c/2015-01-08/603169_20150109_2.pdf
61,2015-01-21,兰石重装股票交易异常波动公告,/disclosure/listedinfo/announcement/c/2015-01-20/603169_20150121_1.pdf
62,2015-01-21,兰石重装：兰州兰石集团有限公司关于对兰州兰石重型装备股份有限公司问询函的复函,/disclosure/listedinfo/announcement/c/2015-01-20/603169_20150121_2.pdf
63,2015-01-31,兰石重装2014年度业绩预增公告,/disclosure/listedinfo/announcement/c/2015-01-30/603169_20150131_1.pdf
64,2015-02-03,兰石重装关于全资子公司设备采购暨关联交易的公告,/disclosure/listedinfo/announcement/c/2015-02-02/603169_20150203_2.pdf
65,2015-02-03,兰石重装二届二十一次董事会决议公告,/disclosure/listedinfo/announcement/c/2015-02-02/603169_20150203_1.pdf
66,2015-02-03,兰石重装独立董事关于公司二届二十一次董事会关联交易事项的发表的事前认可及独立意见,/disclosure/listedinfo/announcement/c/2015-02-02/603169_20150203_3.pdf
67,2015-03-18,兰石重装年报摘要,/disclosure/listedinfo/announcement/c/2015-03-17/603169_2014_nzy.pdf
68,2015-03-18,兰石重装年报信息披露重大差错责任追究制度,/disclosure/listedinfo/announcement/c/2015-03-17/603169_20150318_22.pdf
69,2015-03-18,兰石重装年报,/disclosure/listedinfo/announcement/c/2015-03-17/603169_2014_n.pdf
70,2015-03-18,兰石重装监事会关于会计估计变更的说明,/disclosure/listedinfo/announcement/c/2015-03-17/603169_20150318_17.pdf
71,2015-03-18,兰石重装关于召开2014年年度股东大会的通知,/disclosure/listedinfo/announcement/c/2015-03-17/603169_20150318_8.pdf
72,2015-03-18,兰石重装关于预计公司2015年度日常关联交易的公告,/disclosure/listedinfo/announcement/c/2015-03-17/603169_20150318_7.pdf
73,2015-03-18,兰石重装关于为子公司申请金融机构综合授信提供担保的公告,/disclosure/listedinfo/announcement/c/2015-03-17/603169_20150318_5.pdf
74,2015-03-18,兰石重装关于募集资金存放与使用情况的专项报告,/disclosure/listedinfo/announcement/c/2015-03-17/603169_20150318_6.pdf
75,2015-03-18,兰石重装关于公司募集资金存放与使用情况专项报告,/disclosure/listedinfo/announcement/c/2015-03-17/603169_20150318_15.pdf
76,2015-03-18,兰石重装关于调整固定资产折旧年限暨会计估计变更的公告,/disclosure/listedinfo/announcement/c/2015-03-17/603169_20150318_4.pdf
77,2015-03-18,兰石重装二届二十二次董事会决议公告,/disclosure/listedinfo/announcement/c/2015-03-17/603169_20150318_2.pdf
78,2015-03-18,兰石重装二届八次监事会决议公告,/disclosure/listedinfo/announcement/c/2015-03-17/603169_20150318_3.pdf
79,2015-03-18,兰石重装独立董事关于二届二十二次董事会发表的独立意见,/disclosure/listedinfo/announcement/c/2015-03-17/603169_20150318_10.pdf
80,2015-03-18,兰石重装董事会审计委员会2014年度履职情况报告,/disclosure/listedinfo/announcement/c/2015-03-17/603169_20150318_20.pdf
81,2015-03-18,兰石重装董事会关于会计估计变更的说明,/disclosure/listedinfo/announcement/c/2015-03-17/603169_20150318_16.pdf
82,2015-03-18,兰石重装：华龙证券股份有限公司关于兰州兰石重型装备股份有限公司2014年度募集资金存放与实际使用情况的专项核查意见,/disclosure/listedinfo/announcement/c/2015-03-17/603169_20150318_19.pdf
83,2015-03-18,兰石重装：华龙证券股份有限公司关于兰州兰石重型装备股份有限公司2014年持续督导年度报告书,/disclosure/listedinfo/announcement/c/2015-03-17/603169_20150318_21.pdf
84,2015-03-18,兰石重装：关于公司募集资金年度存放与实际使用情况的鉴证报告,/disclosure/listedinfo/announcement/c/2015-03-17/603169_20150318_18.pdf
85,2015-03-18,兰石重装：关于公司非经营性资金占用及其他关联资金往来情况汇总表的专项审核报告,/disclosure/listedinfo/announcement/c/2015-03-17/603169_20150318_12.pdf
86,2015-03-18,兰石重装2014年度审计报告,/disclosure/listedinfo/announcement/c/2015-03-17/603169_20150318_11.pdf
87,2015-03-18,兰石重装2014年度内部控制自我评价报告,/disclosure/listedinfo/announcement/c/2015-03-17/603169_20150318_14.pdf
88,2015-03-18,兰石重装2014年度独立董事述职报告,/disclosure/listedinfo/announcement/c/2015-03-17/603169_20150318_13.pdf
89,2015-03-20,兰石重装关于股东股权解押及再次质押的公告,/disclosure/listedinfo/announcement/c/2015-03-19/603169_20150320_1.pdf
90,2015-03-25,兰石重装2014年度股东大会资料,/disclosure/listedinfo/announcement/c/2015-03-24/603169_20150325_1.pdf
91,2015-04-03,兰石重装关于召开2014年度股东大会的提示性公告,/disclosure/listedinfo/announcement/c/2015-04-02/603169_20150403_1.pdf
92,2015-04-04,兰石重装2015年一季度业绩预亏公告,/disclosure/listedinfo/announcement/c/2015-04-03/603169_20150404_1.pdf
93,2015-04-09,兰石重装2014年年度股东大会决议公告,/disclosure/listedinfo/announcement/c/2015-04-08/603169_20150409_1.pdf
94,2015-04-09,兰石重装2014年年度股东大会的法律意见,/disclosure/listedinfo/announcement/c/2015-04-08/603169_20150409_2.pdf
95,2015-04-16,兰石重装关于完成注册地址工商变更登记的公告,/disclosure/listedinfo/announcement/c/2015-04-15/603169_20150416_1.pdf
96,2015-04-20,兰石重装2014年度利润分配实施公告,/disclosure/listedinfo/announcement/c/2015-04-19/603169_20150420_1.pdf
97,2015-04-21,兰石重装关于筹划非公开发行股票事项的停牌公告,/disclosure/listedinfo/announcement/c/2015-04-20/603169_20150421_1.pdf
98,2015-04-21,兰石重装股票交易异常波动公告,/disclosure/listedinfo/announcement/c/2015-04-20/603169_20150421_2.pdf
99,2015-04-21,兰石重装：兰州兰石集团有限公司关于对兰州兰石重型装备股份有限公司问询函的复函,/disclosure/listedinfo/announcement/c/2015-04-20/603169_20150421_3.pdf
100,2015-04-25,兰石重装关于对2014年年报事后审核意见函回复的公告,/disclosure/listedinfo/announcement/c/2015-04-24/603169_20150425_1.pdf
101,2015-04-28,兰石重装关于筹划非公开发行股票事项进展情况暨继续停牌的公告,/disclosure/listedinfo/announcement/c/2015-04-27/603169_20150428_1.pdf
102,2015-04-29,兰石重装二届九次监事会决议公告,/disclosure/listedinfo/announcement/c/2015-04-28/603169_20150429_3.pdf
103,2015-04-29,兰石重装二届二十三次董事会决议公告,/disclosure/listedinfo/announcement/c/2015-04-28/603169_20150429_2.pdf
104,2015-04-29,兰石重装第一季度季报,/disclosure/listedinfo/announcement/c/2015-04-28/603169_2015_1.pdf
105,2015-05-06,兰石重装中小投资者单独计票管理办法,/disclosure/listedinfo/announcement/c/2015-05-05/603169_20150506_16.pdf
106,2015-05-06,兰石重装未来三年（2015-2017）股东分红回报规划,/disclosure/listedinfo/announcement/c/2015-05-05/603169_20150506_15.pdf
107,2015-05-06,兰石重装拟对外投资涉及固定资产及部分负债评估项目资产评估报告,/disclosure/listedinfo/announcement/c/2015-05-05/603169_20150506_10.pdf
108,2015-05-06,兰石重装监事会关于公司二届二十四次董事会关联交易事项发表的专项意见,/disclosure/listedinfo/announcement/c/2015-05-05/603169_20150506_19.pdf
109,2015-05-06,兰石重装关于召开2015年第一次临时股东大会的通知,/disclosure/listedinfo/announcement/c/2015-05-05/603169_20150506_8.pdf
110,2015-05-06,兰石重装关于设立全资子公司的公告,/disclosure/listedinfo/announcement/c/2015-05-05/603169_20150506_3.pdf
111,2015-05-06,兰石重装关于前次募集资金使用情况的报告,/disclosure/listedinfo/announcement/c/2015-05-05/603169_20150506_17.pdf
112,2015-05-06,兰石重装关于披露非公开发行股票预案暨股票复牌的公告,/disclosure/listedinfo/announcement/c/2015-05-05/603169_20150506_6.pdf
113,2015-05-06,兰石重装关于非公开发行股票后填补被摊薄即期回报措施的公告,/disclosure/listedinfo/announcement/c/2015-05-05/603169_20150506_7.pdf
114,2015-05-06,兰石重装关于处置子公司兰州兰石重工有限公司部分资产暨关联交易的公告,/disclosure/listedinfo/announcement/c/2015-05-05/603169_20150506_4.pdf
115,2015-05-06,兰石重装关于处置子公司兰州兰石精密机械设备有限公司部分资产暨关联交易的公告,/disclosure/listedinfo/announcement/c/2015-05-05/603169_20150506_5.pdf
116,2015-05-06,兰石重装非公开发行股票预案公告,/disclosure/listedinfo/announcement/c/2015-05-05/603169_20150506_9.pdf
117,2015-05-06,兰石重装非公开发行股票预案,/disclosure/listedinfo/announcement/c/2015-05-05/603169_20150506_14.pdf
118,2015-05-06,兰石重装非公开发行股票募集资金使用可行性研究报告,/disclosure/listedinfo/announcement/c/2015-05-05/603169_20150506_13.pdf
119,2015-05-06,兰石重装二届十次监事会决议公告,/disclosure/listedinfo/announcement/c/2015-05-05/603169_20150506_2.pdf
120,2015-05-06,兰石重装二届二十四次董事会决议公告,/disclosure/listedinfo/announcement/c/2015-05-05/603169_20150506_30.pdf
121,2015-05-06,兰石重装独立董事关于公司二届二十四次董事会关联交易事项发表的事前认可及独立意见,/disclosure/listedinfo/announcement/c/2015-05-05/603169_20150506_18.pdf
122,2015-05-06,兰石重装：兰州兰石重工有限公司拟处置部分实物资产评估项目资产评估报告,/disclosure/listedinfo/announcement/c/2015-05-05/603169_20150506_12.pdf
123,2015-05-06,兰石重装：兰州兰石精密机械设备有限公司拟处置部分实物资产评估项目资产评估报告,/disclosure/listedinfo/announcement/c/2015-05-05/603169_20150506_11.pdf
124,2015-05-06,兰石重装：关于兰州兰石重型装备股份有限公司前次募集资金使用情况的鉴证报告,/disclosure/listedinfo/announcement/c/2015-05-05/603169_20150506_20.pdf
125,2015-05-08,兰石重装股票交易异常波动公告,/disclosure/listedinfo/announcement/c/2015-05-07/603169_20150508_1.pdf
126,2015-05-08,兰石重装：兰州兰石集团有限公司关于对公司问询函的复函,/disclosure/listedinfo/announcement/c/2015-05-07/603169_20150508_2.pdf
127,2015-05-14,兰石重装2015年第一次临时股东大会资料,/disclosure/listedinfo/announcement/c/2015-05-13/603169_20150514_1.pdf
128,2015-05-22,兰石重装关于非公开发行股票获甘肃省国资委批复的公告,/disclosure/listedinfo/announcement/c/2015-05-21/603169_20150522_2.pdf
129,2015-05-22,兰石重装2015年第一次临时股东大会决议公告,/disclosure/listedinfo/announcement/c/2015-05-21/603169_20150522_1.pdf
130,2015-05-22,兰石重装2015年第一次临时股东大会的法律意见,/disclosure/listedinfo/announcement/c/2015-05-21/603169_20150522_3.pdf
131,2015-05-27,兰石重装关于参加甘肃辖区上市公司2015年投资者网上集体接待日活动的公告,/disclosure/listedinfo/announcement/c/2015-05-26/603169_20150527_1.pdf
132,2015-06-06,兰石重装第一季度季报（修订版）,/disclosure/listedinfo/announcement/c/2015-06-05/603169_2015_1.pdf
133,2015-06-06,兰石重装2015年第一季度报告更正公告,/disclosure/listedinfo/announcement/c/2015-06-05/603169_20150606_1.pdf
134,2015-06-10,兰石重装转让土地使用权价格评估（甘肃方家评估2014557号）,/disclosure/listedinfo/announcement/c/2015-06-09/603169_20150610_5.pdf
135,2015-06-10,兰石重装监事会关于公司二届二十五次董事会关联交易事项发表的专项意见,/disclosure/listedinfo/announcement/c/2015-06-09/603169_20150610_8.pdf
136,2015-06-10,兰石重装关于召开2015年第二次临时股东大会的通知,/disclosure/listedinfo/announcement/c/2015-06-09/603169_20150610_3.pdf
137,2015-06-10,兰石重装关于公司原址七里河厂区土地转让暨关联交易的公告,/disclosure/listedinfo/announcement/c/2015-06-09/603169_20150610_2.pdf
138,2015-06-10,兰石重装二届十一次监事会决议公告,/disclosure/listedinfo/announcement/c/2015-06-09/603169_20150610_4.pdf
139,2015-06-10,兰石重装二届二十五次董事会决议公告,/disclosure/listedinfo/announcement/c/2015-06-09/603169_20150610_1.pdf
140,2015-06-10,兰石重装独立董事关于公司二届二十五次董事会关联交易事项发表的事前认可及独立意见,/disclosure/listedinfo/announcement/c/2015-06-09/603169_20150610_7.pdf
141,2015-06-10,兰石重装：兰州兰石换热设备有限责任公司转让土地使用权价格评估（甘肃方家评估2014559号）,/disclosure/listedinfo/announcement/c/2015-06-09/603169_20150610_6.pdf
142,2015-06-16,兰石重装关于完成注册资本工商变更登记的公告,/disclosure/listedinfo/announcement/c/2015-06-15/603169_20150616_1.pdf
143,2015-06-16,兰石重装公司章程（2015修订）,/disclosure/listedinfo/announcement/c/2015-06-15/603169_20150616_2.pdf
144,2015-06-19,兰石重装关于全资子公司完成工商注册登记的公告,/disclosure/listedinfo/announcement/c/2015-06-18/603169_20150619_2.pdf
145,2015-06-19,兰石重装2015年第二次临时股东大会资料,/disclosure/listedinfo/announcement/c/2015-06-18/603169_20150619_1.pdf
146,2015-06-24,兰石重装关于非公开发行股票申请获得中国证监会受理的公告,/disclosure/listedinfo/announcement/c/2015-06-23/603169_20150624_1.pdf
147,2015-06-26,兰石重装2015年第二次临时股东大会决议公告,/disclosure/listedinfo/announcement/c/2015-06-25/603169_20150626_1.pdf
148,2015-06-26,兰石重装2015年第二次临时股东大会的法律意见,/disclosure/listedinfo/announcement/c/2015-06-25/603169_20150626_2.pdf
149,2015-06-30,兰石重装关于公司控股股东股份质押公告,/disclosure/listedinfo/announcement/c/2015-06-29/603169_20150630_1.pdf
150,2015-07-10,兰石重装关于甘肃省省属国有企业维护资本市场稳定措施的公告,/disclosure/listedinfo/announcement/c/2015-07-09/603169_20150710_1.pdf
151,2015-07-11,兰石重装关于维护公司股价稳定方案的公告,/disclosure/listedinfo/announcement/c/2015-07-10/603169_20150711_1.pdf
152,2015-07-11,兰石重装关于全资子公司完成注册资本工商变更登记的公告,/disclosure/listedinfo/announcement/c/2015-07-10/603169_20150711_2.pdf
153,2015-07-21,兰石重装2015年半年度业绩预增公告,/disclosure/listedinfo/announcement/c/2015-07-20/603169_20150721_1.pdf
154,2015-07-23,兰石重装股票交易异常波动公告,/disclosure/listedinfo/announcement/c/2015-07-22/603169_20150723_2.pdf
155,2015-07-23,兰石重装更正公告,/disclosure/listedinfo/announcement/c/2015-07-22/603169_20150723_1.pdf
156,2015-07-23,兰石重装：关于对兰州兰石重型装备股份有限公司问询函的复函,/disclosure/listedinfo/announcement/c/2015-07-22/603169_20150723_3.pdf
157,2015-08-06,兰石重装二届十二次监事会决议公告,/disclosure/listedinfo/announcement/c/2015-08-06/603169_20150806_3.pdf
158,2015-08-06,兰石重装二届二十六次董事会决议公告,/disclosure/listedinfo/announcement/c/2015-08-06/603169_20150806_2.pdf
159,2015-08-06,兰石重装半年报摘要,/disclosure/listedinfo/announcement/c/2015-08-06/603169_2015_zzy.pdf
160,2015-08-06,兰石重装半年报,/disclosure/listedinfo/announcement/c/2015-08-06/603169_2015_z.pdf
161,2015-08-20,兰石重装关于召开2015年第三次临时股东大会的通知,/disclosure/listedinfo/announcement/c/2015-08-20/603169_20150820_4.pdf
162,2015-08-20,兰石重装关于向子公司银行授信提供担保的公告,/disclosure/listedinfo/announcement/c/2015-08-20/603169_20150820_3.pdf
163,2015-08-20,兰石重装二届二十七次董事会决议公告,/disclosure/listedinfo/announcement/c/2015-08-20/603169_20150820_2.pdf
164,2015-08-20,兰石重装独立董事关于二届二十七次董事会发表的独立意见,/disclosure/listedinfo/announcement/c/2015-08-20/603169_20150820_5.pdf
165,2015-08-20,兰石重装2015年第三次临时股东大会资料,/disclosure/listedinfo/announcement/c/2015-08-20/603169_20150820_1.pdf
