,date,title,url
486,2017-06-07,兰石重装2017年第二次临时股东大会资料,/disclosure/listedinfo/announcement/c/2017-06-07/603169_20170607_1.pdf
487,2017-06-10,兰石重装关于资产重组事项涉及资产评估备案结果的公告,/disclosure/listedinfo/announcement/c/2017-06-10/603169_20170610_4.pdf
488,2017-06-10,兰石重装关于提前归还部分补充流动资金的募集资金的公告,/disclosure/listedinfo/announcement/c/2017-06-10/603169_20170610_1.pdf
489,2017-06-10,兰石重装关于收到甘肃省人民政府国有资产监督管理委员会批复文件的公告,/disclosure/listedinfo/announcement/c/2017-06-10/603169_20170610_5.pdf
490,2017-06-10,兰石重装关于回复上海证券交易所问询函的补充公告,/disclosure/listedinfo/announcement/c/2017-06-10/603169_20170610_2.pdf
491,2017-06-10,兰石重装：北京兴华会计师事务所关于《问询函》相关问题之专项核查意见,/disclosure/listedinfo/announcement/c/2017-06-10/603169_20170610_3.pdf
492,2017-06-13,兰石重装2017年第二次临时股东大会决议公告,/disclosure/listedinfo/announcement/c/2017-06-13/603169_20170613_1.pdf
493,2017-06-13,兰石重装2017年第二次临时股东大会的法律意见,/disclosure/listedinfo/announcement/c/2017-06-13/603169_20170613_2.pdf
494,2017-06-14,兰石重装重大合同公告,/disclosure/listedinfo/announcement/c/2017-06-14/603169_20170614_2.pdf
495,2017-06-14,兰石重装三届二十一次董事会决议公告,/disclosure/listedinfo/announcement/c/2017-06-14/603169_20170614_1.pdf
496,2017-06-22,兰石重装2016年年度权益分派实施公告,/disclosure/listedinfo/announcement/c/2017-06-22/603169_20170622_1.pdf
497,2017-06-24,兰石重装重大资产重组进展公告,/disclosure/listedinfo/announcement/c/2017-06-24/603169_20170624_1.pdf
498,2017-06-27,兰石重装关于是否符合《关于上市公司重大资产重组前发生业绩“变脸”或本次重组存在拟置出资产情形的相关问题与解答》的说明,/disclosure/listedinfo/announcement/c/2017-06-27/603169_20170627_1.pdf
499,2017-06-27,兰石重装：瑞华会计事务所（特殊普通合伙）关于兰州兰石重型装备股份有限公司《关于上市公司重大资产重组前发生业绩“变脸”或本次重组存在拟置出资产情形的相关问题与解答》专项核查意见的专项说明,/disclosure/listedinfo/announcement/c/2017-06-27/603169_20170627_3.pdf
500,2017-06-27,兰石重装：华龙证券股份有限公司关于兰州兰石重型装备股份有限公司《关于上市公司重大资产重组前发生业绩“变脸”或本次重组存在拟置出资产情形的相关问题与解答》之专项核查意见,/disclosure/listedinfo/announcement/c/2017-06-27/603169_20170627_2.pdf
501,2017-06-27,兰石重装：甘肃正天合律师事务所关于兰州兰石重型装备股份有限公司重大资产重组前发生业绩“变脸”或本次重组存在拟置出资产情形的专项核查意见,/disclosure/listedinfo/announcement/c/2017-06-27/603169_20170627_4.pdf
502,2017-06-29,兰石重装关于收到《中国证监会行政许可申请受理通知书》的公告,/disclosure/listedinfo/announcement/c/2017-06-29/603169_20170629_1.pdf
503,2017-07-12,兰石重装关于收到《中国证监会行政许可项目审查一次反馈意见通知书》的公告,/disclosure/listedinfo/announcement/c/2017-07-12/603169_20170712_3.pdf
504,2017-07-12,兰石重装：中国证监会行政许可项目审查一次反馈意见通知书（171155号）,/disclosure/listedinfo/announcement/c/2017-07-12/603169_20170712_4.pdf
505,2017-07-13,兰石重装关于控股股东增持公司股份进展的公告,/disclosure/listedinfo/announcement/c/2017-07-13/603169_20170713_1.pdf
506,2017-07-14,兰石重装关于全资子公司增资完成工商变更登记的公告,/disclosure/listedinfo/announcement/c/2017-07-14/603169_20170714_1.pdf
507,2017-07-22,兰石重装重大资产重组进展公告,/disclosure/listedinfo/announcement/c/2017-07-22/603169_20170722_2.pdf
508,2017-07-22,兰石重装关于持股5%以上股东减持股份计划公告,/disclosure/listedinfo/announcement/c/2017-07-22/603169_20170722_1.pdf
509,2017-07-25,兰石重装关于注销部分募集资金专项账户的公告,/disclosure/listedinfo/announcement/c/2017-07-25/603169_20170725_1.pdf
510,2017-08-10,兰石重装关于提前归还部分补充流动资金的募集资金的公告,/disclosure/listedinfo/announcement/c/2017-08-10/603169_20170810_1.pdf
511,2017-08-16,兰石重装三届二十二次董事会决议公告,/disclosure/listedinfo/announcement/c/2017-08-16/603169_20170816_1.pdf
512,2017-08-16,兰石重装关于审阅报告后附财务报表附注差错更正的函,/disclosure/listedinfo/announcement/c/2017-08-16/603169_20170816_10.pdf
513,2017-08-16,兰石重装关于《中国证监会行政许可项目审查一次反馈意见通知书》（171155号）的回复,/disclosure/listedinfo/announcement/c/2017-08-16/603169_20170816_3.pdf
514,2017-08-16,兰石重装关于《中国证监会行政许可审查一次反馈意见通知书》（171155号）之反馈意见回复的公告,/disclosure/listedinfo/announcement/c/2017-08-16/603169_20170816_2.pdf
515,2017-08-16,兰石重装发行股份及支付现金购买资产报告书（修订稿）摘要,/disclosure/listedinfo/announcement/c/2017-08-16/603169_20170816_5.pdf
516,2017-08-16,兰石重装发行股份及支付现金购买资产报告书（修订稿）,/disclosure/listedinfo/announcement/c/2017-08-16/603169_20170816_4.pdf
517,2017-08-16,兰石重装：华龙证券股份有限公司关于兰州兰石重型装备股份有限公司发行股份及支付现金购买资产申请材料之中国证监会一次反馈意见相关问题的核查意见,/disclosure/listedinfo/announcement/c/2017-08-16/603169_20170816_6.pdf
518,2017-08-16,兰石重装：甘肃正天合律师事务所关于兰州兰石重型装备股份有限公司发行股份及支付现金购买资产的补充法律意见（二）,/disclosure/listedinfo/announcement/c/2017-08-16/603169_20170816_9.pdf
519,2017-08-16,兰石重装：备考合并财务报表审阅报告（更正后）,/disclosure/listedinfo/announcement/c/2017-08-16/603169_20170816_12.pdf
520,2017-08-16,兰石重装：北京中科华资产评估有限公司关于中国证券监督管理委员会《中国证监会行政许可项目审查一次反馈意见通知书》有关问题的回复,/disclosure/listedinfo/announcement/c/2017-08-16/603169_20170816_8.pdf
521,2017-08-16,兰石重装：北京兴华会计师事务所（特殊普通合伙）关于审阅报告后附财务报表附注差错更正的函,/disclosure/listedinfo/announcement/c/2017-08-16/603169_20170816_11.pdf
522,2017-08-16,兰石重装：北京兴华会计师事务所（特殊普通合伙）关于《中国证监会行政许可项目审查一次反馈意见通知书》（171155号）相关问题之专项核查意见,/disclosure/listedinfo/announcement/c/2017-08-16/603169_20170816_7.pdf
523,2017-08-18,兰石重装三届十六次监事会决议公告,/disclosure/listedinfo/announcement/c/2017-08-18/603169_20170818_4.pdf
524,2017-08-18,兰石重装三届二十三次董事会决议公告,/disclosure/listedinfo/announcement/c/2017-08-18/603169_20170818_3.pdf
525,2017-08-18,兰石重装募集资金2017年上半年度存放与使用情况的专项报告,/disclosure/listedinfo/announcement/c/2017-08-18/603169_20170818_5.pdf
526,2017-08-18,兰石重装2017年半年度报告摘要,/disclosure/listedinfo/announcement/c/2017-08-18/603169_2017_zzy.pdf
527,2017-08-18,兰石重装2017年半年度报告,/disclosure/listedinfo/announcement/c/2017-08-18/603169_2017_z.pdf
528,2017-08-22,兰石重装重大资产重组进展公告,/disclosure/listedinfo/announcement/c/2017-08-22/603169_20170822_1.pdf
529,2017-09-20,兰石重装关于持股5%以上股东减持股份计划实施进展公告,/disclosure/listedinfo/announcement/c/2017-09-20/603169_20170920_1.pdf
530,2017-09-22,兰石重装重大资产重组进展公告,/disclosure/listedinfo/announcement/c/2017-09-22/603169_20170922_1.pdf
531,2017-09-27,兰石重装首次公开发行限售股上市流通公告,/disclosure/listedinfo/announcement/c/2017-09-27/603169_20170927_3.pdf
532,2017-09-27,兰石重装关于控股股东承诺不减持公司股份的公告,/disclosure/listedinfo/announcement/c/2017-09-27/603169_20170927_1.pdf
533,2017-09-27,兰石重装关于持股5%以上股东减持股份计划实施进展公告,/disclosure/listedinfo/announcement/c/2017-09-27/603169_20170927_2.pdf
534,2017-09-27,兰石重装：华龙证券关于兰石重装首次公开发行股票部分限售股解禁上市流通的核查意见,/disclosure/listedinfo/announcement/c/2017-09-27/603169_20170927_4.pdf
535,2017-09-29,兰石重装三届十七次监事会决议公告,/disclosure/listedinfo/announcement/c/2017-09-29/603169_20170929_13.pdf
536,2017-09-29,兰石重装三届二十四次董事会决议公告,/disclosure/listedinfo/announcement/c/2017-09-29/603169_20170929_1.pdf
537,2017-09-29,兰石重装关于增加金融机构综合授信额度的公告,/disclosure/listedinfo/announcement/c/2017-09-29/603169_20170929_14.pdf
538,2017-09-29,兰石重装关于《中国证监会行政许可项目审查一次反馈意见通知书》（171155号）的回复（修订稿）,/disclosure/listedinfo/announcement/c/2017-09-29/603169_20170929_11.pdf
539,2017-09-29,兰石重装发行股份及支付现金购买资产报告书（修订稿）摘要,/disclosure/listedinfo/announcement/c/2017-09-29/603169_20170929_7.pdf
540,2017-09-29,兰石重装发行股份及支付现金购买资产报告书（修订稿）,/disclosure/listedinfo/announcement/c/2017-09-29/603169_20170929_9.pdf
541,2017-09-29,兰石重装：洛阳瑞泽石化工程有限公司审计报告及财务报表（2015年1月1日至2017年6月30日止）,/disclosure/listedinfo/announcement/c/2017-09-29/603169_20170929_2.pdf
542,2017-09-29,兰石重装：华龙证券股份有限公司关于兰州兰石重型装备股份有限公司发行股份及支付现金购买资产之独立财务顾问报告（修订稿）,/disclosure/listedinfo/announcement/c/2017-09-29/603169_20170929_5.pdf
543,2017-09-29,兰石重装：华龙证券股份有限公司关于兰州兰石重型装备股份有限公司发行股份及支付现金购买资产申请材料之中国证监会反馈意见相关问题的核查意见（修订稿）,/disclosure/listedinfo/announcement/c/2017-09-29/603169_20170929_10.pdf
544,2017-09-29,兰石重装：甘肃正天合律师事务所关于兰石重装发行股份及支付现金购买资产的补充法律意见（四）,/disclosure/listedinfo/announcement/c/2017-09-29/603169_20170929_4.pdf
545,2017-09-29,兰石重装：甘肃正天合律师事务所关于兰石重装发行股份及支付现金购买资产的补充法律意见（三）,/disclosure/listedinfo/announcement/c/2017-09-29/603169_20170929_6.pdf
546,2017-09-29,兰石重装：备考合并财务报表审阅报告,/disclosure/listedinfo/announcement/c/2017-09-29/603169_20170929_8.pdf
547,2017-09-29,兰石重装：北京中科华资产评估有限公司关于中国证券监督管理委员会《中国证监会行政许可项目审查一次反馈意见通知书》有关问题的回复（修订稿）,/disclosure/listedinfo/announcement/c/2017-09-29/603169_20170929_3.pdf
548,2017-09-29,兰石重装：北京兴华会计师事务所关于《中国证监会行政许可项目审查一次反馈意见通知书》（171155号）相关问题之专项核查意见（修订稿）,/disclosure/listedinfo/announcement/c/2017-09-29/603169_20170929_12.pdf
549,2017-10-10,兰石重装关于公司控股股东进行股票质押式回购交易的公告,/disclosure/listedinfo/announcement/c/2017-10-10/603169_20171010_1.pdf
550,2017-10-12,兰石重装关于中国证监会并购重组审核委员会审核公司重大资产重组事项的停牌公告,/disclosure/listedinfo/announcement/c/2017-10-12/603169_20171012_1.pdf
551,2017-10-20,兰石重装三届十八次监事会决议公告,/disclosure/listedinfo/announcement/c/2017-10-20/603169_20171020_5.pdf
552,2017-10-20,兰石重装三届二十五次董事会决议公告,/disclosure/listedinfo/announcement/c/2017-10-20/603169_20171020_3.pdf
553,2017-10-20,兰石重装内幕信息知情人登记管理制度（2017年10月修订）,/disclosure/listedinfo/announcement/c/2017-10-20/603169_20171020_4.pdf
554,2017-10-20,兰石重装关于增加公司2017年日常关联交易金额的公告,/disclosure/listedinfo/announcement/c/2017-10-20/603169_20171020_7.pdf
555,2017-10-20,兰石重装关于公司副总经理辞职并聘任副总经理的公告,/disclosure/listedinfo/announcement/c/2017-10-20/603169_20171020_6.pdf
556,2017-10-20,兰石重装独立董事关于三届二十五次董事会发表的独立意见,/disclosure/listedinfo/announcement/c/2017-10-20/603169_20171020_8.pdf
557,2017-10-20,兰石重装2017年第三季度报告,/disclosure/listedinfo/announcement/c/2017-10-20/603169_2017_3.pdf
558,2017-10-21,兰石重装重大资产重组进展公告,/disclosure/listedinfo/announcement/c/2017-10-21/603169_20171021_1.pdf
559,2017-10-21,兰石重装关于重大资产重组事项获得中国证监会并购重组审核委员会审核通过暨公司股票复牌的公告,/disclosure/listedinfo/announcement/c/2017-10-21/603169_20171021_2.pdf
560,2017-10-26,兰石重装关于注销募集资金专项账户的公告,/disclosure/listedinfo/announcement/c/2017-10-26/603169_20171026_1.pdf
561,2017-11-03,兰石重装关于控股股东延期履行增持公司股票计划的公告,/disclosure/listedinfo/announcement/c/2017-11-03/603169_20171103_1.pdf
562,2017-11-09,兰石重装关于提前归还部分补充流动资金的募集资金的公告,/disclosure/listedinfo/announcement/c/2017-11-09/603169_20171109_1.pdf
563,2017-11-11,兰石重装关于持股5%以上股东减持股份计划实施完毕的公告,/disclosure/listedinfo/announcement/c/2017-11-11/603169_20171111_1.pdf
564,2017-11-18,兰石重装关于持股5%以上股东减持股份计划公告,/disclosure/listedinfo/announcement/c/2017-11-18/603169_20171118_1.pdf
565,2017-11-23,兰石重装重大资产重组进展公告,/disclosure/listedinfo/announcement/c/2017-11-23/603169_20171123_1.pdf
566,2017-11-23,兰石重装关于提前归还部分补充流动资金的募集资金的公告,/disclosure/listedinfo/announcement/c/2017-11-23/603169_20171123_2.pdf
567,2017-11-29,兰石重装三届十九次监事会决议公告,/disclosure/listedinfo/announcement/c/2017-11-29/603169_20171129_2.pdf
568,2017-11-29,兰石重装三届二十六次董事会决议公告,/disclosure/listedinfo/announcement/c/2017-11-29/603169_20171129_1.pdf
569,2017-11-29,兰石重装关于使用部分闲置募集资金暂时补充流动资金的公告,/disclosure/listedinfo/announcement/c/2017-11-29/603169_20171129_3.pdf
570,2017-11-29,兰石重装独立董事关于三届二十六次董事会发表的独立意见,/disclosure/listedinfo/announcement/c/2017-11-29/603169_20171129_4.pdf
571,2017-11-29,兰石重装：华龙证券关于兰石重装使用闲置募集资金暂时性补充流动资金的核查意见,/disclosure/listedinfo/announcement/c/2017-11-29/603169_20171129_5.pdf
572,2017-12-06,兰石重装关于提前归还部分补充流动资金的募集资金的公告,/disclosure/listedinfo/announcement/c/2017-12-06/603169_20171206_1.pdf
573,2017-12-08,兰石重装三届二十七次董事会决议公告,/disclosure/listedinfo/announcement/c/2017-12-08/603169_20171208_1.pdf
574,2017-12-08,兰石重装三届二十次监事会决议公告,/disclosure/listedinfo/announcement/c/2017-12-08/603169_20171208_2.pdf
575,2017-12-08,兰石重装关于使用部分闲置募集资金暂时补充流动资金的公告,/disclosure/listedinfo/announcement/c/2017-12-08/603169_20171208_3.pdf
576,2017-12-08,兰石重装独立董事关于三届二十七次董事会发表的独立意见,/disclosure/listedinfo/announcement/c/2017-12-08/603169_20171208_4.pdf
577,2017-12-08,兰石重装：华龙证券关于兰石重装使用闲置募集资金暂时性补充流动资金核查意见,/disclosure/listedinfo/announcement/c/2017-12-08/603169_20171208_5.pdf
578,2017-12-09,兰石重装关于重大资产重组事项获得中国证监会核准批复的公告,/disclosure/listedinfo/announcement/c/2017-12-09/603169_20171209_2.pdf
579,2017-12-09,兰石重装关于提前归还部分补充流动资金的募集资金的公告,/disclosure/listedinfo/announcement/c/2017-12-09/603169_20171209_1.pdf
580,2017-12-09,兰石重装关于发行股份及支付现金购买资产报告书修订说明的公告,/disclosure/listedinfo/announcement/c/2017-12-09/603169_20171209_6.pdf
581,2017-12-09,兰石重装发行股份及支付现金购买资产报告书摘要（修订稿）,/disclosure/listedinfo/announcement/c/2017-12-09/603169_20171209_4.pdf
582,2017-12-09,兰石重装发行股份及支付现金购买资产报告书（修订稿）,/disclosure/listedinfo/announcement/c/2017-12-09/603169_20171209_3.pdf
583,2017-12-09,兰石重装：华龙证券股份有限公司关于兰州兰石重型装备股份有限公司发行股份及支付现金购买资产之独立财务顾问报告（修订稿）,/disclosure/listedinfo/announcement/c/2017-12-09/603169_20171209_5.pdf
584,2017-12-12,兰石重装三届二十一次监事会决议公告,/disclosure/listedinfo/announcement/c/2017-12-12/603169_20171212_2.pdf
585,2017-12-12,兰石重装三届二十八次董事会决议公告,/disclosure/listedinfo/announcement/c/2017-12-12/603169_20171212_1.pdf
586,2017-12-12,兰石重装关于使用部分闲置募集资金暂时补充流动资金的公告,/disclosure/listedinfo/announcement/c/2017-12-12/603169_20171212_3.pdf
587,2017-12-12,兰石重装独立董事关于三届二十八次董事会发表的独立意见,/disclosure/listedinfo/announcement/c/2017-12-12/603169_20171212_4.pdf
588,2017-12-12,兰石重装：华龙证券股份有限公司关于兰州兰石重型装备股份有限公司使用闲置募集资金暂时性补充流动资金的核查意见,/disclosure/listedinfo/announcement/c/2017-12-12/603169_20171212_5.pdf
589,2017-12-13,兰石重装三届二十九次董事会决议公告,/disclosure/listedinfo/announcement/c/2017-12-13/603169_20171213_1.pdf
590,2017-12-13,兰石重装三届二十二次监事会决议公告,/disclosure/listedinfo/announcement/c/2017-12-13/603169_20171213_2.pdf
591,2017-12-13,兰石重装关于召开2017年第三次临时股东大会的通知,/disclosure/listedinfo/announcement/c/2017-12-13/603169_20171213_6.pdf
592,2017-12-13,兰石重装关于对部分募投项目结项并将节余募集资金变更为永久补充流动资金的公告,/disclosure/listedinfo/announcement/c/2017-12-13/603169_20171213_3.pdf
593,2017-12-13,兰石重装独立董事关于三届二十九次董事会相关事项发表的独立意见,/disclosure/listedinfo/announcement/c/2017-12-13/603169_20171213_4.pdf
594,2017-12-13,兰石重装：华龙证券关于兰石重装非公开发行股票部分募投项目结项并将节余募集资金永久性补充流动资金的专项核查意见,/disclosure/listedinfo/announcement/c/2017-12-13/603169_20171213_5.pdf
595,2017-12-14,兰石重装关于发行股份及支付现金购买资产之标的资产过户完成的公告,/disclosure/listedinfo/announcement/c/2017-12-14/603169_20171214_1.pdf
596,2017-12-14,兰石重装：华龙证券股份有限公司关于兰州兰石重型装备股份有限公司发行股份及支付现金购买资产之标的资产过户情况独立财务顾问核查意见,/disclosure/listedinfo/announcement/c/2017-12-14/603169_20171214_2.pdf
597,2017-12-14,兰石重装：甘肃正天合律师事务所关于兰州兰石重型装备股份有限公司发行股份及支付现金购买资产之标的资产过户情况的法律意见,/disclosure/listedinfo/announcement/c/2017-12-14/603169_20171214_3.pdf
598,2017-12-14,兰石重装：非公开发行股份购买资产验资报告,/disclosure/listedinfo/announcement/c/2017-12-14/603169_20171214_4.pdf
599,2017-12-21,兰石重装发行股份及支付现金购买资产交易之重组实施情况报告书暨新增股份上市公告书,/disclosure/listedinfo/announcement/c/2017-12-21/603169_20171221_4.pdf
600,2017-12-21,兰石重装发行股份及支付现金购买资产发行结果暨股份变动公告,/disclosure/listedinfo/announcement/c/2017-12-21/603169_20171221_1.pdf
601,2017-12-21,兰石重装：华龙证券股份有限公司关于兰州兰石重型装备股份有限公司发行股份及支付现金购买资产交易实施情况之独立财务顾问核查意见,/disclosure/listedinfo/announcement/c/2017-12-21/603169_20171221_3.pdf
602,2017-12-21,兰石重装：甘肃正天合律师事务所关于兰州兰石重型装备股份有限公司发行股份及支付现金购买资产之实施情况的法律意见,/disclosure/listedinfo/announcement/c/2017-12-21/603169_20171221_2.pdf
603,2017-12-21,兰石重装2017年第三次临时股东大会资料,/disclosure/listedinfo/announcement/c/2017-12-21/603169_20171221_5.pdf
604,2017-12-22,兰石重装重大资产重组进展公告,/disclosure/listedinfo/announcement/c/2017-12-22/603169_20171222_1.pdf
605,2017-12-23,兰石重装章程（2017年12月修订）,/disclosure/listedinfo/announcement/c/2017-12-23/603169_20171223_2.pdf
606,2017-12-23,兰石重装关于注册资本等事项完成工商变更登记的公告,/disclosure/listedinfo/announcement/c/2017-12-23/603169_20171223_1.pdf
607,2017-12-29,兰石重装2017年第三次临时股东大会决议公告,/disclosure/listedinfo/announcement/c/2017-12-29/603169_20171229_1.pdf
608,2017-12-29,兰石重装2017年第三次临时股东大会的法律意见,/disclosure/listedinfo/announcement/c/2017-12-29/603169_20171229_2.pdf
609,2017-12-30,兰石重装简式权益变动报告书,/disclosure/listedinfo/announcement/c/2017-12-30/603169_20171230_2.pdf
610,2017-12-30,兰石重装关于持股5%以上股东减持股份至5%以下的提示性公告,/disclosure/listedinfo/announcement/c/2017-12-30/603169_20171230_1.pdf
611,2018-01-09,兰石重装关于控股股东增持公司股份达到2%的公告,/disclosure/listedinfo/announcement/c/2018-01-09/603169_20180109_1.pdf
612,2018-01-23,兰石重装关于原持股5%以上股东减持股份计划实施进展公告,/disclosure/listedinfo/announcement/c/2018-01-23/603169_20180123_1.pdf
613,2018-01-24,兰石重装章程（2018年1月修订）,/disclosure/listedinfo/announcement/c/2018-01-24/603169_20180124_15.pdf
614,2018-01-24,兰石重装三届三十次董事会决议公告,/disclosure/listedinfo/announcement/c/2018-01-24/603169_20180124_24.pdf
615,2018-01-24,兰石重装三届二十三次监事会决议公告,/disclosure/listedinfo/announcement/c/2018-01-24/603169_20180124_13.pdf
616,2018-01-24,兰石重装关于召开2018年第一次临时股东大会的通知,/disclosure/listedinfo/announcement/c/2018-01-24/603169_20180124_23.pdf
617,2018-01-24,兰石重装关于预计公司2018年度日常关联交易的公告,/disclosure/listedinfo/announcement/c/2018-01-24/603169_20180124_16.pdf
618,2018-01-24,兰石重装关于修订《公司章程》的公告,/disclosure/listedinfo/announcement/c/2018-01-24/603169_20180124_14.pdf
619,2018-01-24,兰石重装关于向中国进出口银行申请授信额度并提供抵押担保的公告,/disclosure/listedinfo/announcement/c/2018-01-24/603169_20180124_19.pdf
620,2018-01-24,兰石重装关于为子公司申请金融机构综合授信提供担保的公告,/disclosure/listedinfo/announcement/c/2018-01-24/603169_20180124_20.pdf
621,2018-01-24,兰石重装关于为控股股东开展融资租赁业务提供担保暨关联交易的公告,/disclosure/listedinfo/announcement/c/2018-01-24/603169_20180124_21.pdf
622,2018-01-24,兰石重装关于申请金融机构综合授信额度的公告,/disclosure/listedinfo/announcement/c/2018-01-24/603169_20180124_18.pdf
623,2018-01-24,兰石重装关于公司部分固定资产报废处理的公告,/disclosure/listedinfo/announcement/c/2018-01-24/603169_20180124_22.pdf
624,2018-01-24,兰石重装独立董事关于三届三十次董事会相关事项发表的独立意见,/disclosure/listedinfo/announcement/c/2018-01-24/603169_20180124_17.pdf
625,2018-02-01,兰石重装2018年第一次临时股东大会资料,/disclosure/listedinfo/announcement/c/2018-02-01/603169_20180201_1.pdf
626,2018-02-03,兰石重装关于提前归还部分补充流动资金的募集资金的公告,/disclosure/listedinfo/announcement/c/2018-02-03/603169_20180203_3.pdf
627,2018-02-03,兰石重装关于控股股东增持公司股份计划实施完成的公告,/disclosure/listedinfo/announcement/c/2018-02-03/603169_20180203_1.pdf
628,2018-02-03,兰石重装：甘肃正天合律师事务所关于兰州兰石重型装备股份有限公司控股股东增持公司股份的法律意见,/disclosure/listedinfo/announcement/c/2018-02-03/603169_20180203_2.pdf
629,2018-02-06,兰石重装重大合同公告,/disclosure/listedinfo/announcement/c/2018-02-06/603169_20180206_2.pdf
630,2018-02-06,兰石重装重大合同的补充公告,/disclosure/listedinfo/announcement/c/2018-02-06/603169_20180206_3.pdf
631,2018-02-06,兰石重装三届三十一次董事会决议公告,/disclosure/listedinfo/announcement/c/2018-02-06/603169_20180206_1.pdf
632,2018-02-09,兰石重装2018年第一次临时股东大会决议公告,/disclosure/listedinfo/announcement/c/2018-02-09/603169_20180209_1.pdf
633,2018-02-09,兰石重装2018年第一次临时股东大会的法律意见书,/disclosure/listedinfo/announcement/c/2018-02-09/603169_20180209_2.pdf
